F1: 红旗 Linux
A2: =ROW()-2 -> 1224 | B2: P- | C2: 3123 | D2: 1 | E2: 7900631232 | F2: 红旗 Linux 应用软件（配光盘） | G2: 中科红旗 | H2: 42.00 | I2: 37012 | J2: 7
A3: =ROW()-2 -> 1225 | B3: P- | C3: 3116 | D3: 1 | E3: 790063116X | F3: 红旗 Linux 技能荟萃（配光盘） | G3: 中科红旗 | H3: 49.80 | I3: 37043 | J3: 6
A4: =ROW()-2 -> 1226 | B4: P- | C4: 3125 | D4: 1 | E4: 7900631259 | F4: 红旗 Linux 桌面版入门（配光盘） | G4: 中科红旗 | H4: 32.00 | I4: 37043 | J4: 11
A5: =ROW()-2 -> 1227 | B5: TP | C5: 4605 | D5: 1 | E5: 04605-0 | F5: Linux/UNIX 高级编程 | G5: 中科红旗 | H5: 60.00 | I5: 37073 | J5: 5
A6: =ROW()-2 -> 1228 | B6: P | C6: 3124 | D6: 1 | E6: 7900631240 | F6: 红旗Linux软件开发技术（配光盘） | G6: 中科红旗 | H6: 42.00 | I6: 36982 | J6: 9
F7: 战胜系列丛书
A8: =ROW()-2 -> 1230 | B8: TP | C8: 5797 | D8: 1 | E8: 05797-4 | F8: 战胜Flash MX快易60讲 | G8: 汪端 | H8: 32.00 | I8: 37500 | J8: 8
A9: =ROW()-2 -> 1231 | B9: P- | C9: 4366 | D9: 1 | E9: 7900643664 | F9: 战胜特效字制作快易60讲（配光盘） | G9: 王永辉 | H9: 36.00 | I9: 37530 | J9: 7
A10: =ROW()-2 -> 1232 | B10: TP | C10: 5930 | D10: 1 | E10: 05930-6 | F10: 战胜Poser Pro快易60讲 | G10: 王岩 | H10: 28.00 | I10: 37530 | J10: 8
F11: 软件开发指南丛书
A12: =ROW()-2 -> 1234 | B12: TP | C12: 1346 | D12: 2 | E12: 01346-2 | F12: Delphi 5 开发指南 | G12: 谢玉凤等 | H12: 40.00 | I12: 36951 | J12: 7
F13: 中文信息处理丛书
A14: =ROW()-2 -> 1236 | B14: TP | C14: 5435 | D14: 1 | E14: 05435-5 | F14: 自然语言理解――一种让机器懂得人类语言的研究第２版 | G14: 李春葆 | H14: 39.80 | I14: 37530 | J14: 6
F15: 流行软件指南丛书
A16: =ROW()-2 -> 1238 | B16: TP | C16: 0699 | D16: 1 | E16: 00699-7 | F16: 红旗 Linux 使用指南 | G16: 孔长征 | H16: 26.00 | I16: 36770 | J16: 10
A17: =ROW()-2 -> 1239 | B17: TP | C17: 2554 | D17: 5 | E17: 02554-1 | F17: UNIX使用指南 | G17: 杜维文 | H17: 35.00 | I17: 36404 | J17: 7
A18: =ROW()-2 -> 1240 | B18: TP | C18: 3366 | D18: 1 | E18: 03366-8 | F18: Lotus 1-2-3 Office Pro 97 中文版使用指南 | G18: 谢何 等 | H18: 36.00 | I18: 1999 | J18: 6
A19: =ROW()-2 -> 1241 | B19: TP | C19: 0765 | D19: 1 | E19: 00765-9 | F19: Lotus Notes 5.0 使用指南 | G19: 桂隽超 | H19: 29.00 | I19: 36831 | J19: 9
A20: =ROW()-2 -> 1242 | B20: P- | C20: 0756 | D20: 1 | E20: 00756-X | F20: Windows 2000 中文版使用指南 | G20: 李博轩等 | H20: 32.00 | I20: 36617 | J20: 7
A21: =ROW()-2 -> 1243 | B21: TP | C21: 4028 | D21: 1 | E21: 04028-1 | F21: Windows ME 中文版使用指南 | G21: 孟晓东等 | H21: 32.00 | I21: 37104 | J21: 8
A22: =ROW()-2 -> 1244 | B22: TP | C22: 2961 | D22: 2 | E22: 02961-X | F22: WPS 97 使用指南 | G22: 金帆工作室 | H22: 15.00 | I22: 1998 | J22: 14
A23: =ROW()-2 -> 1245 | B23: TP | C23: 3474 | D23: 2 | E23: 03474-5 | F23: WPS 2000 使用指南 | G23: 罗运模等 | H23: 21.00 | I23: 36434 | J23: 12
A24: =ROW()-2 -> 1246 | B24: TP | C24: 4163 | D24: 1 | E24: 04163-6 | F24: 方正书版 9.0 使用速成 | G24: 许书明 | H24: 29.00 | I24: 36861 | J24: 10
A25: =ROW()-2 -> 1247 | B25: TP | C25: 2920 | D25: 2 | E25: 02920-2 | F25: Excel 97 中文版使用指南 | G25: 张群英等 | H25: 21.00 | I25: 1998 | J25: 10
A26: =ROW()-2 -> 1248 | B26: TP | C26: 3139 | D26: 1 | E26: 03139-8 | F26: PowerPoint 97中文版使用指南 | G26: 张 羿 | H26: 16.80 | I26: 1998 | J26: 15
A27: =ROW()-2 -> 1249 | B27: TP | C27: 3388 | D27: 4 | E27: 03388-9 | F27: AutoCAD R14 中文版使用指南 | G27: 康博创作室 | H27: 34.00 | I27: 36831 | J27: 7
A28: =ROW()-2 -> 1250 | B28: TP | C28: 3107 | D28: 3 | E28: 3107-X | F28: 3D Studio MAX 使用指南 | G28: 王朝阳等 | H28: 23.5 | I28: 36434 | J28: 10
A29: =ROW()-2 -> 1251 | B29: TP | C29: 3251 | D29: 4 | E29: 03251-3 | F29: Photoshop 5.0 使用指南 | G29: 黄雄 等 | H29: 28.00 | I29: 36586 | J29: 8
F30: 老年人学电脑用电脑丛书（谭浩强主编）
A31: =ROW()-2 -> 1253 | B31: TP | C31: 1100 | D31: 1 | E31: 01100-1 | F31: 老年人学电脑用电脑丛书（套） | H31: 90.00 | I31: 37135 | J31: 3
A32: =ROW()-2 -> 1254 | B32: TP | C32: 4686 | D32: 1 | E32: 04686-7 | F32: 怎样使用电脑 | G32: 赵野军等 | H32: 20.00 | I32: 37377 | J32: 15
A33: =ROW()-2 -> 1255 | B33: TP | C33: 4726 | D33: 1 | E33: 04726-X | F33: 怎样用电脑写信和理财 | G33: 宋金珂 | H33: 20.00 | I33: 37135 | J33: 13
A34: =ROW()-2 -> 1256 | B34: TP | C34: 4796 | D34: 1 | E34: 04796-0 | F34: 怎样上网 | G34: 尚晓航等 | H34: 20.00 | I34: 37135 | J34: 12
A35: =ROW()-2 -> 1257 | B35: P- | C35: 3701 | D35: 1 | E35: 790063701x | F35: 怎样制作电子相册（配光盘） | G35: 沈洪 等 | H35: 30.00 | I35: 37135 | J35: 10
A36: =ROW()-2 -> 1258 | B36: GP | C36: 154 | D36: 1 | E36: 0154-1 | F36: 老年人学电脑用电脑 | G36: 谭浩强 | H36: 10.00 | I36: 37393 | J36: 10
F37: 电脑神通傻瓜丛书
A38: =ROW()-2 -> 1260 | B38: TP | C38: 3096 | D38: 4 | E38: 03096-0 | F38: Windows 98 中文版傻瓜书 | G38: 汉扬天地译 | H38: 32.00 | I38: 36617 | J38: 9
A39: =ROW()-2 -> 1261 | B39: TP | C39: 3871 | D39: 1 | E39: 7302038716 | F39: Windows CE 傻瓜书 | H39: 36.00 | I39: 36708 | J39: 8
A40: =ROW()-2 -> 1262 | B40: P- | C40: 2260 | D40: 1 | E40: 7900622608 | F40: Linux 傻瓜书（配光盘） | G40: 王义豹译 | H40: 39.00 | I40: 36647 | J40: 8
A41: =ROW()-2 -> 1263 | B41: TP | C41: 2915 | D41: 1 | E41: 02915-6 | F41: Mircosoft Visual InterDEV――因特网开发工具傻瓜书（配光盘） | G41: 林福宗等译 | H41: 46.00 | I41: 1998 | J41: 8
A42: =ROW()-2 -> 1264 | B42: TP | C42: 3797 | D42: 1 | E42: 03797-3 | F42: Office 2000 中文版傻瓜书 | G42: 汉扬天地译 | H42: 28.00 | I42: 36617 | J42: 10
A43: =ROW()-2 -> 1265 | B43: TP | C43: 2360 | D43: 6 | E43: 02360-3 | F43: FrontPage 2000 中文版傻瓜书 | G43: 汉扬天地译 | H43: 33.00 | I43: 36678 | J43: 8
A44: =ROW()-2 -> 1266 | B44: TP | C44: 2628 | D44: 3 | E44: 02628-9 | F44: PowerPoint 97中文版傻瓜书 | G44: 赵 + 洋译 | H44: 25.00 | I44: 1998 | J44: 11
A45: =ROW()-2 -> 1267 | B45: TP | C45: 2950 | D45: 1 | E45: 02950-4 | F45: Netscape Communicator 4 傻瓜书 | G45: 曹 卫 译 | H45: 28.00 | I45: 1998 | J45: 12
A46: =ROW()-2 -> 1268 | B46: TP | C46: 2733 | D46: 1 | E46: 02733-1 | F46: Windows NT Workstation 4.0中文版傻瓜书 | G46: 贺军等译 | H46: 34 | I46: 1997 | J46: 10
F47: 《电脑神通傻瓜丛书》新编系列
A48: =ROW()-2 -> 1270 | B48: TP | C48: 3100 | D48: 4 | E48: 03100-2 | F48: 中文 Windows 98 实用傻瓜书 | G48: 钱培德等 | H48: 19.00 | I48: 36465 | J48: 13
A49: =ROW()-2 -> 1271 | B49: TP | C49: 3410 | D49: 4 | E49: 03410-9 | F49: 中文Visual Basic 6.0 傻瓜书 | G49: 钱培德等 | H49: 35.00 | I49: 36586 | J49: 7
A50: =ROW()-2 -> 1272 | B50: TP | C50: 2887 | D50: 6 | E50: 02887-7 | F50: 电脑选购与配置傻瓜书 | G50: 张夷人等 | H50: 19.80 | I50: 36678 | J50: 12
A51: =ROW()-2 -> 1273 | B51: TP | C51: 3020 | D51: 8 | E51: 03020-0 | F51: 电脑组装与维护傻瓜书 | G51: 张夷人等 | H51: 21.00 | I51: 36586 | J51: 12
F52: 电脑神通百事通系列
A53: =ROW()-2 -> 1275 | B53: P- | C53: 2286 | D53: 2 | E53: 7900622861 | F53: 计算机病毒防治百事通（配光盘） | G53: 陈立新 | H53: 36.00 | I53: 36708 | J53: 8
A54: =ROW()-2 -> 1276 | B54: TP | C54: 1145 | D54: 1 | E54: 01145-1 | F54: 共享软件百事通 | G54: 张洪彬 | H54: 35.00 | I54: 36647 | J54: 7
A55: =ROW()-2 -> 1277 | B55: TP | C55: 1179 | D55: 2 | E55: 01179-6 | F55: 电脑组装与维护百事通（配光盘） | G55: 张夷人等 | H55: 32.00 | I55: 37135 | J55: 10
F56: 电脑使用急救手册系列
A57: =ROW()-2 -> 1279 | B57: TP | C57: 4487 | D57: 1 | E57: 04487-2 | F57: Word 排版急救手册 | G57: 徐进明 | H57: 17.00 | I57: 37043 | J57: 16
A58: =ROW()-2 -> 1280 | B58: TP | C58: 4860 | D58: 1 | E58: 04860-6 | F58: Windows 急救手册 | G58: 郭闰丙 | H58: 35.00 | I58: 37344 | J58: 8
A59: =ROW()-2 -> 1281 | B59: TP | C59: 4858 | D59: 1 | E59: 04858-4 | F59: 电脑常见故障急救手册 | G59: 苏瑞 等 | H59: 28.00 | I59: 37377 | J59: 9
F60: 轻松学习系列
A61: =ROW()-2 -> 1283 | B61: TP | C61: 2240 | D61: I | E61: 02240-2 | F61: 轻松学习 Windows 95 中文版 | G61: 章 辉 | H61: 28.00 | I61: 36586 | J61: 8
F62: 轻松掌握系列
A63: =ROW()-2 -> 1285 | B63: P- | C63: 3065 | D63: 1 | E63: 7900630651 | F63: 轻松掌握 Adobe Photoshop 6 (配光盘) | G63: 张昀 等 | H63: 42.00 | I63: 36892 | J63: 8
A64: =ROW()-2 -> 1286 | B64: P- | C64: 2283 | D64: 1 | E64: 7900622837 | F64: 轻松掌握 3D Studio MAX R3 (下)(配光盘) | G64: 张昀 等 | H64: 39.50 | I64: 36647 | J64: 9
A65: =ROW()-2 -> 1287 | B65: P- | C65: 1780 | D65: 2 | E65: 7900617809 | F65: 轻松掌握 Office 2000 中文标准版 (配光盘) | G65: 张 昀 | H65: 48.00 | I65: 36586 | J65: 8
A66: =ROW()-2 -> 1288 | B66: P- | C66: 1777 | D66: 1 | E66: 7900617779 | F66: 轻松掌握 WPS 2000（配光盘） | G66: 初英 等 | H66: 43.00 | I66: 36373 | J66: 9
A67: =ROW()-2 -> 1289 | B67: P- | C67: 1796 | D67: 2 | E67: 7900617965 | F67: 轻松掌握 Word 2000（配光盘） | G67: 徐自亮等 | H67: 48.00 | I67: 36617 | J67: 8
A68: =ROW()-2 -> 1290 | B68: P- | C68: 2242 | D68: 1 | E68: 790062242X | F68: 轻松掌握 PowerPoint 2000（配光盘） | G68: 徐自亮等 | H68: 39.00 | I68: 36526 | J68: 11
A69: =ROW()-2 -> 1291 | B69: P- | C69: 2547 | D69: 1 | E69: 790062547X | F69: 轻松掌握网上冲浪新技能（配光盘） | G69: 张昀 等 | H69: 33.00 | I69: 37012 | J69: 10
A70: =ROW()-2 -> 1292 | B70: P- | C70: 3516 | D70: 1 | E70: 7900635165 | F70: 轻松掌握个人主页制作（配光盘） | G70: 张昀 等 | H70: 38.00 | I70: 37135 | J70: 8
A71: =ROW()-2 -> 1293 | B71: P- | C71: 3017 | D71: 1 | E71: 7900630171 | F71: 轻松掌握电脑炒股（配光盘） | G71: 张昀 等 | H71: 34.00 | I71: 37226 | J71: 10
A72: =ROW()-2 -> 1294 | B72: P- | C72: 2213 | D72: 2 | E72: 7900622136 | F72: 轻松掌握 方正飞腾（配光盘） | G72: 张昀 等 | H72: 39.00 | I72: 36557 | J72: 10
A73: =ROW()-2 -> 1295 | B73: P- | C73: 1734 | D73: 1 | E73: 7900617345 | F73: 轻松掌握电脑使用 （配光盘） | G73: 徐自亮等 | H73: 58.00 | I73: 36739 | J73: 7
F74: 循序渐进学用系列
A75: =ROW()-2 -> 1297 | B75: TP | C75: 0969 | D75: 1 | E75: 00969-4 | F75: 学用 Windows 2000 Professional 中文版 | G75: 超峰创作室 | H75: 29.80 | I75: 36617 | J75: 8
A76: =ROW()-2 -> 1298 | B76: TP | C76: 3431 | D76: 4 | E76: 03431-1 | F76: 学用 Office 2000 中文版 | G76: 丁力波等 | H76: 28.00 | I76: 37530 | J76: 9
A77: =ROW()-2 -> 1299 | B77: TP | C77: 3620 | D77: 2 | E77: 03620-9 | F77: 学用 Excel 2000 中文版 | G77: 李铁军 | H77: 30.00 | I77: 36557 | J77: 9
A78: =ROW()-2 -> 1300 | B78: TP | C78: 3664 | D78: 2 | E78: 03664-0 | F78: 学用 FrontPage 2000 中文版 | G78: 李 滨 | H78: 24.00 | I78: 36831 | J78: 12
A79: =ROW()-2 -> 1301 | B79: TP | C79: 3795 | D79: 1 | E79: 03795-7 | F79: 学用PageMaker 6.X | G79: 强翔等译 | H79: 48.00 | I79: 36526 | J79: 10
A80: =ROW()-2 -> 1302 | B80: TP | C80: 3619 | D80: 2 | E80: 03619-5 | F80: 学用 WPS 2000 | G80: 宋征 等 | H80: 25.00 | I80: 36831 | J80: 12
A81: =ROW()-2 -> 1303 | B81: TP | C81: 0997 | D81: 1 | E81: 00997-X | F81: 学用 AutoCAD 2000 | G81: 李涛 等 | H81: 38.00 | I81: 37469 | J81: 6
A82: =ROW()-2 -> 1304 | B82: TP | C82: 3524 | D82: 3 | E82: 03524-5 | F82: 学用 Visual FoxPro 6.0 中文版 | G82: 冯晓利等 | H82: 43.00 | I82: 36982 | J82: 6
A83: =ROW()-2 -> 1305 | B83: TP | C83: 3728 | D83: 2 | E83: 03728-0 | F83: 学用 Visual Basic 6.0 | G83: 戴红等译 | H83: 59.80 | I83: 36982 | J83: 6
A84: =ROW()-2 -> 1306 | B84: TP | C84: 3564 | D84: 2 | E84: 03564-4 | F84: 学用 Visual C++ 6.0 | G84: 张长乐译 | H84: 59.80 | I84: 37408 | J84: 5
A85: =ROW()-2 -> 1307 | B85: TP | C85: 3379 | D85: 1 | E85: 03379-X | F85: 学用Authorware 4 (配光盘) | G85: 常促宇等译 | H85: 48.00 | I85: 36312 | J85: 9
F86: 实例精通系列
A87: =ROW()-2 -> 1309 | B87: P- | C87: 2505 | D87: 2 | E87: 7900625054 | F87: Authorware 5 实例精通（配光盘） | G87: 叶 彬 | H87: 30.00 | I87: 37012 | J87: 10
A88: =ROW()-2 -> 1310 | B88: P- | C88: 2503 | D88: 2 | E88: 7900625038 | F88: Photoshop 5.0-5.5 实例精通（配光盘） | G88: 陈培军 | H88: 36.00 | I88: 36861 | J88: 8
A89: =ROW()-2 -> 1311 | B89: P- | C89: 2543 | D89: 1 | E89: 7900625437 | F89: CorelDRAW 9 实例精通（配光盘） | G89: 李新媛 | H89: 42.00 | I89: 36892 | J89: 7
A90: =ROW()-2 -> 1312 | B90: TP | C90: 4460 | D90: 1 | E90: 04460-0 | F90: Dreamweaver UltraDev 4 精彩网页制作与动态网站开发 | G90: 刘 烊 | H90: 32.00 | I90: 37043 | J90: 8
A91: =ROW()-2 -> 1313 | B91: P- | C91: 2506 | D91: 2 | E91: 7900625062 | F91: Delphi 5 实例精通（配光盘） | G91: 徐万力 | H91: 30.00 | I91: 36708 | J91: 10
A92: =ROW()-2 -> 1314 | B92: P- | C92: 2504 | D92: 2 | E92: 7900625046 | F92: Visual Basic 6.0 实例精通 (配光盘) | G92: 周 颖 | H92: 38.00 | I92: 37469 | J92: 8
F93: 实例通系列丛书
A94: =ROW()-2 -> 1316 | B94: P- | C94: 3573 | D94: 1 | E94: 7900635734 | F94: 实例通系列丛书――Visual Basic 基础编程百例（配光盘） | G94: 魏江江等 | H94: 40.00 | I94: 37362 | J94: 8
A95: =ROW()-2 -> 1317 | B95: P- | C95: 3756 | D95: 1 | E95: 7900637567 | F95: 实例通系列丛书――网页特效编程百例 （配光盘） | G95: 林少景 | H95: 38.00 | I95: 37226 | J95: 8
A96: =ROW()-2 -> 1318 | B96: TP | C96: 4984 | D96: 1 | E96: 04984-X | F96: 实例通系列丛书――ASP.NET 网站设计实例通 | G96: 王 易 | H96: 32.00 | I96: 37226 | J96: 8
A97: =ROW()-2 -> 1319 | B97: P- | C97: 4162 | D97: 1 | E97: 04162-9 | F97: 实例通系列丛书――ASP.NET 编程百例通 | G97: 林少景 | H97: 34.00 | I97: 37377 | J97: 7
A98: =ROW()-2 -> 1320 | B98: P- | C98: 4328 | D98: 1 | E98: 7900643281 | F98: 实例通系列丛书――Flash MX实用编程百例（配光盘） | G98: 林少景 | H98: 36.00 | I98: 37469 | J98: 9
F99: 自学教程系列
A100: =ROW()-2 -> 1322 | B100: TP | C100: 2995 | D100: 7 | E100: 02995-4 | F100: Windows 98 中文版自学教程 | G100: 康博创作室 | H100: 37.00 | I100: 37288 | J100: 6
A101: =ROW()-2 -> 1323 | B101: TP | C101: 4060 | D101: 1 | E101: 04060-5 | F101: Windows 2000 Professional 中文版自学教程 | G101: 益嘉创作室 | H101: 33.00 | I101: 36861 | J101: 8
A102: =ROW()-2 -> 1324 | B102: TP | C102: 1394 | D102: 3 | E102: 01394-2 | F102: Windows 2000 Server 中文版自学教程 | G102: 益嘉创作室 | H102: 35.00 | I102: 36982 | J102: 8
A103: =ROW()-2 -> 1325 | B103: TP | C103: 4153 | D103: 1 | E103: 04153-9 | F103: Windows ME 中文版自学教程 | G103: 益嘉创作室 | H103: 31.00 | I103: 37043 | J103: 8
A104: =ROW()-2 -> 1326 | B104: TP | C104: 3924 | D104: 1 | E104: 03924-0 | F104: Linux 中文版自学教程 | G104: 康博创作室 | H104: 21.00 | I104: 36800 | J104: 12
A105: =ROW()-2 -> 1327 | B105: TP | C105: 2162 | D105: 2 | E105: 02162-7 | F105: Office 2000 中文版自学教程 | G105: 益嘉创作室 | H105: 39.80 | I105: 37288 | J105: 6
A106: =ROW()-2 -> 1328 | B106: TP | C106: 3684 | D106: 2 | E106: 03684-5 | F106: Word 2000 中文版自学教程 | G106: 康博创作室 | H106: 29.80 | I106: 37104 | J106: 8
A107: =ROW()-2 -> 1329 | B107: TP | C107: 3894 | D107: 1 | E107: 03894-5 | F107: Excel 2000 中文版自学教程 | G107: 益嘉创作室 | H107: 26.00 | I107: 36708 | J107: 9
A108: =ROW()-2 -> 1330 | B108: TP | C108: 4033 | D108: 1 | E108: 04033-8 | F108: FrontPage 2000 中文版自学教程 | G108: 康博创作室 | H108: 28.00 | I108: 36982 | J108: 10
A109: =ROW()-2 -> 1331 | B109: TP | C109: 4125 | D109: 1 | E109: 04125-3 | F109: Internet Explorer 5.5 中文版自学教程 | G109: 康博创作室 | H109: 27.00 | I109: 36861 | J109: 10
A110: =ROW()-2 -> 1332 | B110: TP | C110: 3644 | D110: 2 | E110: 03644-6 | F110: WPS 2000 自学教程 | G110: 康博创作室 | H110: 20.00 | I110: 36586 | J110: 10
A111: =ROW()-2 -> 1333 | B111: TP | C111: 2220 | D111: 2 | E111: 02220-8 | F111: AutoCAD 2000 （中文版）自学教程 | G111: 段红梅等 | H111: 47.00 | I111: 37438 | J111: 6
A112: =ROW()-2 -> 1334 | B112: TP | C112: 1124 | D112: 1 | E112: 01124-9 | F112: AutoCAD 2000 自学教程 | G112: 益嘉创作室 | H112: 48.00 | I112: 36982 | J112: 6
A113: =ROW()-2 -> 1335 | B113: TP | C113: 3052 | D113: 3 | E113: 03052-9 | F113: Word 97 中文版自学教程 | G113: 益嘉创作室 | H113: 29.80 | I113: 1999 | J113: 7
A114: =ROW()-2 -> 1336 | B114: TP | C114: 3296 | D114: 3 | E114: 03296-3 | F114: Office 97 中文版自学教程 | G114: 益嘉创作室 | H114: 42.00 | I114: 1999 | J114: 5
A115: =ROW()-2 -> 1337 | B115: TP | C115: 4126 | D115: 1 | E115: 04126-1 | F115: SQL Server 2000 自学教程 | G115: 杨继平等 | H115: 32.00 | I115: 36982 | J115: 9
A116: =ROW()-2 -> 1338 | B116: TP | C116: 3740 | D116: 1 | E116: 03740-X | F116: Microsoft Visual C++ 6.0 程序设计自学教程 | G116: 康博创作室 | H116: 34.80 | I116: 37257 | J116: 7
A117: =ROW()-2 -> 1339 | B117: TP | C117: 3670 | D117: 2 | E117: 03670-5 | F117: Visual FoxPro 6.0 中文版自学教程 | G117: 益嘉创作室 | H117: 39.80 | I117: 36951 | J117: 8
A118: =ROW()-2 -> 1340 | B118: TP | C118: 3588 | D118: 2 | E118: 03588-1 | F118: Photoshop 5.0 自学教程 | G118: 益嘉创作室 | H118: 29.50 | I118: 36526 | J118: 9
A119: =ROW()-2 -> 1341 | B119: TP | C119: 1275 | D119: 2 | E119: 01275-X | F119: Illustrator 9.0 实用宝典 | G119: 张喜平等 | H119: 24.00 | I119: 36892 | J119: 11
A120: =ROW()-2 -> 1342 | B120: TP | C120: 4061 | D120: 1 | E120: 04061-3 | F120: Illustrator 9.0 自学教程 | G120: 益嘉创作室 | H120: 32.00 | I120: 36861 | J120: 8
A121: =ROW()-2 -> 1343 | B121: TP | C121: 3900 | D121: 1 | E121: 03900-3 | F121: CorelDRAW 9 自学教程 | G121: 张喜平等 | H121: 39.80 | I121: 37104 | J121: 6
A122: =ROW()-2 -> 1344 | B122: TP | C122: 3637 | D122: 3 | E122: 03637-3 | F122: Authorware 5 自学教程 | G122: 康博创作室 | H122: 33.00 | I122: 36923 | J122: 6
A123: =ROW()-2 -> 1345 | B123: TP | C123: 3946 | D123: 1 | E123: 03946-1 | F123: 3D Studio MAX 3.0 自学教程 | G123: 康博创作室 | H123: 22.00 | I123: 36951 | J123: 12
A124: =ROW()-2 -> 1346 | B124: TP | C124: 2978 | D124: 1 | E124: 02978-4 | F124: 中文AutoCAD R14自学教程 | G124: 林立域 | H124: 45.00 | I124: 1998 | J124: 7
F125: 实用教程系列
A126: =ROW()-2 -> 1348 | B126: TP | C126: 1262 | D126: 1 | E126: 01262-8 | F126: 中文 Windows 2000 实用教程 | G126: 孟晓东等 | H126: 18.00 | I126: 36586 | J126: 12
A127: =ROW()-2 -> 1349 | B127: TP | C127: 3109 | D127: 7 | E127: 03109-6 | F127: 中文 Windows 98实用教程 | G127: 谢术清等 | H127: 15.00 | I127: 37438 | J127: 13
A128: =ROW()-2 -> 1350 | B128: TP | C128: 3643 | D128: 2 | E128: 03643-8 | F128: WPS 2000 实用教程 | G128: 合力工作室 | H128: 16.80 | I128: 36739 | J128: 14
A129: =ROW()-2 -> 1351 | B129: TP | C129: 3688 | D129: 1 | E129: 03688-8 | F129: 中文 Outlook 2000 实用教程 | G129: 合力工作室 | H129: 13.50 | I129: 36465 | J129: 15
A130: =ROW()-2 -> 1352 | B130: TP | C130: 3678 | D130: 2 | E130: 03678-0 | F130: 中文 FrontPage 2000 实用教程 | G130: 合力工作室 | H130: 15.00 | I130: 37469 | J130: 15
A131: =ROW()-2 -> 1353 | B131: TP | C131: 3679 | D131: 2 | E131: 03679-9 | F131: 中文 Excel 2000 实用教程 | G131: 合力工作室 | H131: 15.00 | I131: 37469 | J131: 15
A132: =ROW()-2 -> 1354 | B132: TP | C132: 3702 | D132: 1 | E132: 03702-7 | F132: 中文 PowerPoint 2000 实用教程 | G132: 合力工作室 | H132: 11.50 | I132: 37469 | J132: 20
A133: =ROW()-2 -> 1355 | B133: TP | C133: 3639 | D133: 1 | E133: 03639-X | F133: 中文 Word 2000 中文版实用教程 | G133: 合力工作室 | H133: 17.00 | I133: 37319 | J133: 14
A134: =ROW()-2 -> 1356 | B134: TP | C134: 3764 | D134: 1 | E134: 03764-7 | F134: 中文 Access 2000 中文版实用教程 | G134: 合力工作室 | H134: 17.00 | I134: 37328 | J134: 13
A135: =ROW()-2 -> 1357 | B135: TP | C135: 3776 | D135: 1 | E135: 03776-0 | F135: 3D Studio MAX 3.0 实用教程 | G135: 陆水 等 | H135: 16.00 | I135: 36526 | J135: 16
A136: =ROW()-2 -> 1358 | B136: TP | C136: 4861 | D136: 1 | E136: 04861-4 | F136: 中文Office 实用教程 | G136: 王冬 等 | H136: 29.80 | I136: 37165
F137: 实用培训教程系列
A138: =ROW()-2 -> 1360 | B138: P- | C138: 2521 | D138: 1 | E138: 7900625216 | F138: CorelDRAW 9 实用培训教程 | G138: 李新媛 | H138: 35.00 | I138: 36982 | J138: 9
A139: =ROW()-2 -> 1361 | B139: TP 5474 1 | D139: 1 | E139: 05474-6 | F139: Director 8.5 实用培训教程 | G139: 龚正伟张璇 | H139: 30.00 | I139: 37408 | J139: 9
A140: =ROW()-2 -> 1362 | B140: P- | C140: 3028 | D140: 1 | E140: 7900630287 | F140: Access 2000 实用培训教程 （配光盘） | G140: 白松涛 | H140: 35.00 | I140: 37104 | J140: 10
A141: =ROW()-2 -> 1363 | B141: TP | C141: 5053 | D141: 1 | E141: 05053-8 | F141: Oracle 9i 中文版实用培训教程 | G141: 赵伯山 | H141: 33.00 | I141: 37371 | J141: 8
A142: =ROW()-2 -> 1364 | B142: TP | C142: 5408 | D142: 1 | E142: 05408-8 | F142: Oracle 9i中文版基础教程 | G142: 张曜等 | H142: 35.00 | I142: 37469 | J142: 7
A143: =ROW()-2 -> 1365 | B143: P- | C143: 2520 | D143: 1 | E143: 7900625208 | F143: Authorware 5.X实用培训教程 | G143: 邹 冰 | H143: 35.00 | I143: 37329 | J143: 7
A144: =ROW()-2 -> 1366 | B144: P- | C144: 4135 | D144: 1 | E144: 7900641351 | F144: Visual C++.NET中文版实用培训教程（配光盘） | G144: 晓东等 | H144: 38.00 | I144: 37316 | J144: 8
A145: =ROW()-2 -> 1367 | B145: TP | C145: 5209 | D145: 1 | E145: 05209-3 | F145: Maya4.0实用培训教程 | G145: 薛树旗等 | H145: 26.00 | I145: 37500 | J145: 10
A146: =ROW()-2 -> 1368 | B146: TP | C146: 5224 | D146: 1 | E146: 05224-7 | F146: Authorware 6.0实用培训教程 | G146: 焦智芳 | H146: 34.00 | I146: 37469 | J146: 7
A147: =ROW()-2 -> 1369 | B147: TP | C147: 5235 | D147: 1 | E147: 05235-2 | F147: Visual Basic.Net中文 版实用培训教程 | G147: 李万红等 | H147: 28.00 | I147: 37316 | J147: 9
A148: =ROW()-2 -> 1370 | B148: TP | C148: 5306 | D148: 1 | E148: 05306-5 | F148: Flash MX实用培训教程 | G148: 李伟等 | H148: 26.00 | I148: 37362 | J148: 10
A149: =ROW()-2 -> 1371 | B149: TP | C149: 5466 | D149: 1 | E149: 05466-5 | F149: Photoshop 7.0实用培训教程 | G149: 许书明 | H149: 32.00 | I149: 37469 | J149: 8
A150: =ROW()-2 -> 1372 | B150: TP | C150: 5440 | D150: 1 | E150: 05440-1 | F150: Autodesk VIZ4实用培训教程 | G150: 王军等 | H150: 36.00 | I150: 37391 | J150: 8
A151: =ROW()-2 -> 1373 | B151: TP | C151: 5519 | D151: 1 | E151: 05519-X | F151: 多媒体电脑组装实用培训教程 | G151: 许书明 | H151: 25.00 | I151: 37408 | J151: 9
A152: =ROW()-2 -> 1374 | B152: TP | C152: 5779 | D152: 1 | E152: 05779-6 | F152: 3D Studio MAX 5 实用培训教程 | G152: 许书明 | H152: 28.00 | I152: 37500 | J152: 10
A153: =ROW()-2 -> 1375 | B153: TP | C153: 5863 | D153: 1 | E153: 05863-6 | F153: 网页设计师实用培训教程 | G153: 李伟学 | H153: 30.00 | I153: 37530 | J153: 8
A154: =ROW()-2 -> 1376 | B154: TP | C154: 5897 | D154: 1 | E154: 05897-0 | F154: Mastercam 9实用培训教程 | G154: 张小宁 | H154: 35.00 | I154: 37530 | J154: 9
F155: 计算机综合培训教程系列
A156: =ROW()-2 -> 1378 | B156: TP | C156: 4399 | D156: 1 | E156: 04399-X | F156: 电脑办公综合培训教程 | G156: 李月强 | H156: 27.00 | I156: 37335 | J156: 8
F157: 计算机实用技术培训系列教材
A158: =ROW()-2 -> 1380 | B158: TP | C158: 4946 | D158: 1 | E158: 04946-7 | F158: 办公系列软件简明教程 | G158: 杨大勇等 | H158: 26.00 | I158: 37370 | J158: 9
A159: =ROW()-2 -> 1381 | B159: TP | C159: 5460 | D159: 1 | E159: 05460-6 | F159: SQL Server 2000 培训教程 | G159: 陈小兵等 | H159: 29.00 | I159: 37500 | J159: 9
F160: 计算机实用技术系列教程
A161: =ROW()-2 -> 1383 | B161: TP | C161: 5391 | D161: 1 | E161: 05391-x | F161: 新编微机基础实用教程 | G161: 赵世霞 | H161: 33.00 | I161: 37469 | J161: 8
F162: 网络编程实践丛书
A163: =ROW()-2 -> 1385 | B163: P- | C163: 4351 | D163: 1 | E163: 7900643516 | F163: JSP编程实践动态网页的引擎 | G163: 都志辉 | H163: 48.00 | I163: 37500 | J163: 9
F164: 中国计算机学会学术著作丛书
A165: =ROW()-2 -> 1387 | B165: TP | C165: 5637 | D165: 1 | E165: 05637-4 | F165: 定性推理方法 | G165: 石纯一 | H165: 20.00 | I165: 37530 | J165: 15
F166: 简明教程系列
A167: =ROW()-2 -> 1389 | B167: TP | C167: 4022 | D167: 1 | E167: 04022-2 | F167: 中文 Windows 2000 上网简明教程 | G167: 甘登岱等 | H167: 22.00 | I167: 36951 | J167: 12
A168: =ROW()-2 -> 1390 | B168: TP | C168: 3988 | D168: 6 | E168: 03988-7 | F168: 中文Windows 2000 Server 简明教程 | G168: 罗运模 | H168: 28.00 | I168: 36861 | J168: 10
A169: =ROW()-2 -> 1391 | B169: P- | C169: 3517 | D169: 2 | E169: 03517-2 | F169: 中文Windows 2000 专业版简明教程 | G169: 罗运模等 | H169: 28.00 | I169: 36647 | J169: 11
A170: =ROW()-2 -> 1392 | B170: TP | C170: 3202 | D170: 2 | E170: 03202-5 | F170: 中文Windows 98 上网简明教程 | G170: 罗运模等 | H170: 28.00 | I170: 1999 | J170: 9
A171: =ROW()-2 -> 1393 | B171: TP | C171: 3028 | D171: 6 | E171: 03028-6 | F171: 中文Windows 98 简明教程 | G171: 罗运模 | H171: 22.00 | I171: 36923 | J171: 12
A172: =ROW()-2 -> 1394 | B172: TP | C172: 3537 | D172: 2 | E172: 03537-7 | F172: Word 2000 简明教程 | G172: 罗运模等 | H172: 26.00 | I172: 36465 | J172: 10
A173: =ROW()-2 -> 1395 | B173: TP | C173: 3608 | D173: 2 | E173: 03608-X | F173: 中文 Excel 2000 简明教程 | G173: 罗运模等 | H173: 25.00 | I173: 36465 | J173: 10
A174: =ROW()-2 -> 1396 | B174: TP | C174: 3581 | D174: 2 | E174: 03581-4 | F174: PowerPoint 2000 简明教程 | G174: 罗运模等 | H174: 26.00 | I174: 36434 | J174: 10
A175: =ROW()-2 -> 1397 | B175: TP | C175: 3026 | D175: 1 | E175: 03026-X | F175: 中文Lotus Freelance Graphics 97简明教程 | G175: 罗运模等 | H175: 19.50 | I175: 1998 | J175: 15
A176: =ROW()-2 -> 1398 | B176: TP | C176: 3027 | D176: 1 | E176: 03027-8 | F176: 中文Lotus Word Pro 97 简明教程 | G176: 罗运模等 | H176: 19.00 | I176: 1998 | J176: 15
A177: =ROW()-2 -> 1399 | B177: TP | C177: 3336 | D177: 1 | E177: 03336-6 | F177: 写作之星――WDS 98 简明教程 | G177: 罗运模等 | H177: 17.00 | I177: 36281 | J177: 15
A178: =ROW()-2 -> 1400 | B178: TP | C178: 3618 | D178: 3 | E178: 03618-7 | F178: SQL Server 实用简明教程 | G178: 黄维通等 | H178: 18.00 | I178: 36923 | J178: 15
A179: =ROW()-2 -> 1401 | B179: TP | C179: 2647 | D179: 2 | E179: 02647-5 | F179: VHDL简明教程 | G179: 王小军 | H179: 19.50 | I179: 36861 | J179: 15
F180: 电脑秀丛书
A181: =ROW()-2 -> 1403 | B181: P- | C181: 3117 | D181: 1 | E181: 7900631178 | F181: 百年经典――多媒体影视制作实战 （配光盘） | G181: 吴春旭等 | H181: 76.00 | I181: 36982 | J181: 7
A182: =ROW()-2 -> 1404 | B182: P- | C182: 3143 | D182: 1 | E182: 7900631437 | F182: 网络冠军（配光盘） | G182: 王 彦 | H182: 45.00 | I182: 37073 | J182: 7
A183: =ROW()-2 -> 1405 | B183: P- | C183: 3529 | D183: 1 | E183: 7900635297 | F183: 世界公园――3DS VIZ R3.0 再现世界建筑奇观（配光盘） | G183: 数字公社 | H183: 38.00 | I183: 37135 | J183: 10
A184: =ROW()-2 -> 1406 | B184: P- | C184: 3197 | D184: 1 | E184: 7900631976 | F184: 虚拟国的日记――Photoshop 6.0 探索 （配光盘） | G184: 数字公社 | H184: 46.00 | I184: 37135 | J184: 7
A185: =ROW()-2 -> 1407 | B185: P- | C185: 3149 | D185: 1 | E185: 7900631496 | F185: 戏剧人生――活用 Photoshop 与 Premiere （配光盘） | G185: 数字公社 | H185: 39.00 | I185: 37135 | J185: 9
A186: =ROW()-2 -> 1408 | B186: P- | C186: 3563 | D186: 1 | E186: 7900635637 | F186: 生物大疯狂――3DS MAX 4.0 与 Maya 4.0 生物制作特效（配光盘） | G186: 数字公社 | H186: 48.00 | I186: 37135 | J186: 13
A187: =ROW()-2 -> 1409 | B187: P- | C187: 3520 | D187: 1 | E187: 7900635203 | F187: 室内风景――3DS MAX 室内装潢经典实例 （配光盘） | G187: 数字公社 | H187: 32.00 | I187: 37104 | J187: 11
A188: =ROW()-2 -> 1410 | B188: P- | C188: 3151 | D188: 1 | E188: 7900631518 | F188: 变形金刚――3DS MAX 的诱惑（配光盘） | G188: 李 等 | H188: 58.00 | I188: 37104 | J188: 10
F189: 电脑DIY系列
A190: =ROW()-2 -> 1412 | B190: TP | C190: 3958 | D190: 1 | E190: 03958-5 | F190: 精品网页制作 DIY | G190: 甘登岱等 | H190: 39.00 | I190: 37012 | J190: 7
A191: =ROW()-2 -> 1413 | B191: TP | C191: 0678 | D191: 1 | E191: 00678-4 | F191: 精品电脑绘图 DIY | G191: 甘登岱等 | H191: 36.00 | I191: 36770 | J191: 8
A192: =ROW()-2 -> 1414 | B192: TP | C192: 4133 | D192: 1 | E192: 04133-4 | F192: 精品图像处理DIY | G192: 甘登岱等 | H192: 32.00 | I192: 36892 | J192: 9
A193: =ROW()-2 -> 1415 | B193: TP | C193: 4183 | D193: 1 | E193: 04183-0 | F193: 电脑 DIY 一点通 （2001版） | G193: 张晓 等 | H193: 25.00 | I193: 37104 | J193: 10
A194: =ROW()-2 -> 1416 | B194: TP | C194: 4343 | D194: 1 | E194: 04343-4 | F194: 电脑 DIY2001 局域网资源共享 | G194: 林建铭 | H194: 46.00 | I194: 37165 | J194: 6
A195: =ROW()-2 -> 1417 | B195: TP | C195: 4483 | D195: 1 | E195: 04483-X | F195: 局域网建设 DIY | G195: 曲景东等 | H195: 32.00 | I195: 37469 | J195: 8
A196: =ROW()-2 -> 1418 | B196: TP | C196: 4295 | D196: 1 | E196: 04295-0 | F196: DIY 2001 电脑选购/组装/维修 | G196: 江钧研究室 | H196: 30.00 | I196: 37104 | J196: 8
A197: =ROW()-2 -> 1419 | B197: TP | C197: 1321 | D197: 1 | E197: 01321-7 | F197: 免费网站 DIY | G197: 陈长念 | H197: 18.00 | I197: 36892 | J197: 17
A198: =ROW()-2 -> 1420 | B198: TP | C198: 4226 | D198: 1 | E198: 04226-8 | F198: 网络生活 DIY | G198: 刘 霄 | H198: 26.00 | I198: 36923 | J198: 11
A199: =ROW()-2 -> 1421 | B199: P- | C199: 3196 | D199: 1 | E199: 7900631968 | F199: 网上炒股 DIY （配光盘） | G199: 韦宇 等 | H199: 32.00 | I199: 37012 | J199: 10
A200: =ROW()-2 -> 1422 | B200: TP | C200: 1102 | D200: 1 | E200: 01102-8 | F200: 电脑死机急救 DIY | G200: 解健彬 | H200: 18.00 | I200: 37012 | J200: 15
A201: =ROW()-2 -> 1423 | B201: TP | C201: 4016 | D201: 1 | E201: 04016-8 | F201: 包罗万象 ―― 电脑硬件DIY应用大全 | G201: 荣钦科技 | H201: 24.00 | I201: 36982 | J201: 11
A202: =ROW()-2 -> 1424 | B202: TP | C202: 4071 | D202: 1 | E202: 04071-0 | F202: 电脑选购与配置 DIY | G202: 马汝峰等 | H202: 35.00 | I202: 36982 | J202: 9
A203: =ROW()-2 -> 1425 | B203: TP | C203: 5935 | D203: 1 | E203: 05935-7 | F203: 电脑DIY选购、组装与维护教程 | G203: 王卫国 | H203: 33.00 | I203: 37530 | J203: 7
F204: 清华电脑学堂
A205: =ROW()-2 -> 1427 | B205: TP | C205: 5610 | D205: 1 | E205: 05610-1 | F205: Delphi 6 程序设计培训教程 | G205: 王渝等 | H205: 29.00 | I205: 37438 | J205: 9
A206: =ROW()-2 -> 1428 | B206: TP | C206: 5215 | D206: 1 | E206: 05215-8 | F206: 办公文秘上机培训教程 | G206: 周予滨 | H206: 28.00 | I206: 37438 | J206: 8
A207: =ROW()-2 -> 1429 | B207: TP | C207: 5611 | D207: 1 | E207: 05611-1 | F207: C/C++程序设计培训教程 | G207: 王雷编著 | H207: 38.00 | I207: 37438 | J207: 7
A208: =ROW()-2 -> 1430 | B208: TP | C208: 5566 | D208: 1 | E208: 05566-1 | F208: Java程序设计培训教程 | G208: 孙燕等 | H208: 24.00 | I208: 37438 | J208: 10
A209: =ROW()-2 -> 1431 | B209: TP | C209: 5052 | D209: 1 | E209: 05052-x | F209: 互联网上机培训教程 | G209: 周予滨 | H209: 29.00 | I209: 37347 | J209: 8
A210: =ROW()-2 -> 1432 | B210: TP | C210: 5217 | D210: 1 | E210: 05217-4 | F210: XML 1.x 编程培训教程 | G210: 赵克立等 | H210: 32.00 | I210: 37347 | J210: 9
A211: =ROW()-2 -> 1433 | B211: TP | C211: 5176 | D211: 1 | E211: 05176-3 | F211: 零起点学电脑上机培训教程 | G211: 史斌星等 | H211: 24.00 | I211: 37500 | J211: 10
A212: =ROW()-2 -> 1434 | B212: TP | C212: 5335 | D212: 1 | E212: 05335-9 | F212: 网页制作上机培训教程 | G212: 周予滨 | H212: 25.00 | I212: 37500 | J212: 9
A213: =ROW()-2 -> 1435 | B213: TP | C213: 5402 | D213: 1 | E213: 05402-9 | F213: 平面设计上机培训教程 | G213: 周予滨 | H213: 26.00 | I213: 37469 | J213: 9
A214: =ROW()-2 -> 1436 | B214: TP | C214: 5415 | D214: 1 | E214: 05415-1 | F214: 电脑组装与维修上机培训教程 | G214: 周予滨 | H214: 28.00 | I214: 37377 | J214: 8
A215: =ROW()-2 -> 1437 | B215: TP | C215: 5489 | D215: 1 | E215: 05489-4 | F215: Excel 会计电算化培训教程 | G215: 俞建海等 | H215: 19.00 | I215: 37469 | J215: 13
A216: =ROW()-2 -> 1438 | B216: P- | C216: 4184 | D216: 1 | E216: 790064184X | F216: AutoCAD 2002中文版培训教程（配光盘） | G216: 孙立斌等 | H216: 38.00 | I216: 37500 | J216: 8
A217: =ROW()-2 -> 1439 | B217: TP | C217: 5419 | D217: 1 | E217: 05419-3 | F217: ASP.NET编程培训教程 | G217: 赵克立 | H217: 32.00 | I217: 37414 | J217: 9
A218: =ROW()-2 -> 1440 | B218: TP | C218: 5628 | D218: 1 | E218: 05628-5 | F218: Visual C++程序设计培训教程 | G218: 赵克立 | H218: 48.00 | I218: 37438 | J218: 6
A219: =ROW()-2 -> 1441 | B219: TP | C219: 5777 | D219: 1 | E219: 05777-X | F219: Oracle gi for windows NT/2000 数据库系统培训教程（基础篇） | G219: 黄河等 | H219: 46.00 | I219: 37500 | J219: 6
A220: =ROW()-2 -> 1442 | B220: P- | C220: 4359 | D220: 1 | E220: 7900643591 | F220: 现代电脑办公互动培训教程（配光盘） | G220: 苏国彬等 | H220: 34.00 | I220: 37500 | J220: 10
F221: 工具软件实用详解系列
A222: =ROW()-2 -> 1444 | B222: TP | C222: 3738 | D222: 1 | E222: 03738-8 | F222: Internet 工具和翻译软件实用详解 | G222: 骞文 等 | H222: 28.00 | I222: 37408 | J222: 8
A223: =ROW()-2 -> 1445 | B223: TP | C223: 3727 | D223: 1 | E223: 03727-2 | F223: FreeHand 8.0 实用详解 | G223: 雷 波 | H223: 28.00 | I223: 36465 | J223: 12
A224: =ROW()-2 -> 1446 | B224: TP | C224: 1181 | D224: 1 | E224: 01181-8 | F224: CorelDRAW 9 实用详解 | G224: 张 韬 | H224: 35.00 | I224: 36708 | J224: 7
A225: =ROW()-2 -> 1447 | B225: TP | C225: 3829 | D225: 1 | E225: 03829-5 | F225: PageMaker 6.5 C 实用详解 | G225: 雷 波 | H225: 28.00 | I225: 36526 | J225: 12
A226: =ROW()-2 -> 1448 | B226: TP | C226: 3754 | D226: 1 | E226: 03754-X | F226: Adobe Illustrator 8.0 中文版实用详解 | G226: 雷 波 | H226: 30.00 | I226: 36495 | J226: 9
A227: =ROW()-2 -> 1449 | B227: TP | C227: 3631 | D227: 1 | E227: 03631-4 | F227: 系统工具、杀毒工具及测试工具实用详解 | G227: 崔 勃 | H227: 21.00 | I227: 36465 | J227: 12
F228: 参 考 详 解 系 列
A229: =ROW()-2 -> 1451 | B229: TP | C229: 3816 | D229: 2 | E229: 03816-3 | F229: Visual FoxPro 6.0 参考详解 | G229: 方建平等 | H229: 46.00 | I229: 36617 | J229: 8
A230: =ROW()-2 -> 1452 | B230: TP | C230: 3796 | D230: 2 | E230: 03796-5 | F230: Visual Basic 6.0 中文版参考详解 | G230: 李怀明等 | H230: 62.00 | I230: 37347 | J230: 5
A231: =ROW()-2 -> 1453 | B231: TP | C231: 3772 | D231: 1 | E231: 03772-8 | F231: Visual C++ 6.0 参考详解 | G231: 刘金龙等 | H231: 62.00 | I231: 36892 | J231: 6
A232: =ROW()-2 -> 1454 | B232: TP | C232: 3793 | D232: 1 | E232: 03793-0 | F232: Borland C++ Builder 3.0/4.0 高级类参考详解 | G232: 王秀娟等 | H232: 46.00 | I232: 36617 | J232: 8
A233: =ROW()-2 -> 1455 | B233: TP | C233: 3773 | D233: 2 | E233: 03773-6 | F233: Delphi 4.0/5.0 类参考详解 | G233: 秦绪佳等 | H233: 48.00 | I233: 36647 | J233: 7
F234: 技法教室1+1系列
A235: =ROW()-2 -> 1457 | B235: P- | C235: 3096 | D235: 1 | E235: 7900630961 | F235: Dreamweaver 3.0 技法教室 1+1（配光盘） | G235: 周予滨 | H235: 35 | I235: 36861 | J235: 11
A236: =ROW()-2 -> 1458 | B236: P- | C236: 3112 | D236: 1 | E236: 7900631127 | F236: Authorware 5.X 技法教室 1+1 （配光盘） | G236: 周予滨 | H236: 38.00 | I236: 36951 | J236: 9
A237: =ROW()-2 -> 1459 | B237: P- | C237: 3157 | D237: 1 | E237: 7900631577 | F237: Flash 5.0 技法教室 1+1 （配光盘） | G237: 周予滨 | H237: 36.00 | I237: 36982 | J237: 10
A238: =ROW()-2 -> 1460 | B238: P- | C238: 3193 | D238: 1 | E238: 7900631933 | F238: Fireworks 4.0 技法教室 1+1（配光盘） | G238: 周予滨 | H238: 36.00 | I238: 37012 | J238: 11
A239: =ROW()-2 -> 1461 | B239: P- | C239: 3097 | D239: 1 | E239: 790063097X | F239: Director 8.0 技法教室 1+1（配光盘） | G239: 周予滨 | H239: 32 | I239: 36861 | J239: 11
F240: SCO OpenServer 5 实用大全丛书
A241: =ROW()-2 -> 1463 | B241: TP | C241: 3239 | D241: 1 | E241: 03239-4 | F241: SCO OpenServer用户指南 | G241: 胡钦谙等译 | H241: 98.00 | I241: 1999 | J241: 7
A242: =ROW()-2 -> 1464 | B242: TP | C242: 3219 | D242: 1 | E242: 03219-X | F242: SCO OpenServer系统管理指南 | G242: 胡才勇等译 | H242: 98.00 | I242: 1999 | J242: 8
A243: =ROW()-2 -> 1465 | B243: TP | C243: 3218 | D243: 1 | E243: 03218-1 | F243: SCO OpenServer 网络指南 | G243: 何军等译 | H243: 126.00 | I243: 1999 | J243: 6
A244: =ROW()-2 -> 1466 | B244: TP | C244: 3124 | D244: 1 | E244: 03124-X | F244: SCO OpenServer开发系统编程工具指南 | G244: 熊胜峰等译 | H244: 168.00 | I244: 1999 | J244: 6
A245: =ROW()-2 -> 1467 | B245: TP | C245: 3220 | D245: 1 | E245: 03220-3 | F245: SCO OpenServer程序员技术精粹 | G245: 李祥凯等译 | H245: 88.00 | I245: 1998 | J245: 13
F246: Osborne 计算机专业技术丛书
A247: =ROW()-2 -> 1469 | B247: P- | C247: 3177 | D247: 1 | E247: 7900631771 | F247: Windows 系统策略（配光盘） | G247: 天宏工作室译 | H247: 63.00 | I247: 37196 | J247: 7
A248: =ROW()-2 -> 1470 | B248: TP | C248: 4029 | D248: 1 | E248: 04029-X | F248: 实用联网指南 | G248: 天宏工作室译 | H248: 38.00 | I248: 36800 | J248: 9
A249: =ROW()-2 -> 1471 | B249: TP | C249: 4427 | D249: 1 | E249: 04427-9 | F249: Windows 2000 实用指南 | G249: 天宏工作室译 | H249: 65.00 | I249: 37012 | J249: 5
A250: =ROW()-2 -> 1472 | B250: TP | C250: 4601 | D250: 1 | E250: 04601-8 | F250: Windows 2000 Active Directory | G250: 天宏工作室译 | H250: 50.00 | I250: 37165 | J250: 6
A251: =ROW()-2 -> 1473 | B251: TP | C251: 4970 | D251: 1 | E251: 04970-X | F251: Windows 2000 DNS 服务器 | G251: 天宏工作室译 | H251: 58.80 | I251: 37226 | J251: 5
A252: =ROW()-2 -> 1474 | B252: P- | C252: 4127 | D252: 1 | E252: 7900641270 | F252: Windows 2000 程序设计（配光盘） | G252: 天宏工作室译 | H252: 108.00 | I252: 37438 | J252: 3
A253: =ROW()-2 -> 1475 | B253: P- | C253: 3178 | D253: 1 | E253: 790063178X | F253: Windows 2000 与 UNIX 集成指南（配光盘） | G253: 天宏工作室译 | H253: 65.00 | I253: 37196 | J253: 1
A254: =ROW()-2 -> 1476 | B254: TP | C254: 4076 | D254: 1 | E254: 04076-1 | F254: Windows 2000 设计与移植 | G254: 天宏 工作室译 | H254: 58.00 | I254: 36831 | J254: 6
A255: =ROW()-2 -> 1477 | B255: TP | C255: 4182 | D255: 1 | E255: 04182-2 | F255: SQL Server 7 备份与还原 | G255: 天宏工作室译 | H255: 50.00 | I255: 36951 | J255: 7
A256: =ROW()-2 -> 1478 | B256: TP | C256: 4277 | D256: 1 | E256: 04277-2 | F256: Windows Web 脚本开发指南 （配软盘） | G256: 天宏工 作室译 | H256: 68.00 | I256: 36982 | J256: 6
A257: =ROW()-2 -> 1479 | B257: TP | C257: 4770 | D257: 1 | E257: 04770-7 | F257: Solaris 管理实用指南 | G257: 天宏工 作室译 | H257: 48.00 | I257: 37165 | J257: 7
A258: =ROW()-2 -> 1480 | B258: P- | C258: 3075 | D258: 1 | E258: 7900630759 | F258: COM+ 开发指南 （配光盘） | G258: 天宏工 作室译 | H258: 56.00 | I258: 36892 | J258: 7
A259: =ROW()-2 -> 1481 | B259: TP | C259: 5050 | D259: 1 | E259: 05050-3 | F259: 使用Visual Studio 6开发Web数据库应用程序 | G259: 天宏工 作室译 | H259: 74.00 | I259: 37316 | J259: 4
A260: =ROW()-2 -> 1482 | B260: TP | C260: 5066 | D260: 1 | E260: 05066-1 | F260: 北电网络故障排除与优化 | G260: 天宏工 作室译 | H260: 63.00 | I260: 37347 | J260: 5
A261: =ROW()-2 -> 1483 | B261: TP | C261: 5703 | D261: 1 | E261: 05703-6 | F261: 北电网络实用指南 | G261: 天宏工 作室译 | H261: 48.00 | I261: 37500 | J261: 7
A262: =ROW()-2 -> 1484 | B262: TP | C262: 5738 | D262: 1 | E262: 05738-9 | F262: Windows 2000管理指南 | G262: 天宏工 作室译 | H262: 72.00 | I262: 37530 | J262: 4
F263: Osborne 开发与应用技术丛书
A264: =ROW()-2 -> 1486 | B264: TP | C264: 5654 | D264: 1 | E264: 05654-4 | F264: Visual Basic.NET开发快速入门 | G264: 天宏工作室译 | H264: 22.00 | I264: 37530 | J264: 12
F265: ATM 与 B-ISDN 技术丛书 （影印版）
A266: =ROW()-2 -> 1488 | B266: TN | C266: 2816 | D266: 3 | E266: 02816-8 | F266: 宽带网络技术基础（ATM：Foundation for Broadband Networks） | G266: Uyless Black | H266: 22.00 | I266: 1998 | J266: 11
A267: =ROW()-2 -> 1489 | B267: TN | C267: 2817 | D267: 2 | E267: 02817-6 | F267: 宽带网络信令（ATM：Signaling in Broadband Networks） | G267: Uyless Black | H267: 12.00 | I267: 1998 | J267: 25
A268: =ROW()-2 -> 1490 | B268: TN | C268: 2815 | D268: 4 | E268: 02815-X | F268: 现代通信最新技术（第2版） (Emerging Communications Technologies 2nd Edition) | G268: Uyless Black | H268: 26.00 | I268: 37469 | J268: 12
A269: =ROW()-2 -> 1491 | B269: TN | C269: 2818 | D269: 2 | E269: 02818-4 | F269: 宽带网络性能分析 （Broadband Integrated Networks） | G269: Mischa Schwartz | H269: 19.80 | I269: 1998 | J269: 13
A270: =ROW()-2 -> 1492 | B270: TN | C270: 2819 | D270: 2 | E270: 02819-2 | F270: ATM网络规划与管理（Planning and Managing ATM Networks） | G270: Dan Minoli | H270: 17.00 | I270: 1998 | J270: 15
A271: =ROW()-2 -> 1493 | B271: TN | C271: 2821 | D271: 3 | E271: 02821-4 | F271: ATM网互通技术 （Internet Working with ATM） | G271: Uyless Black | H271: 13.80 | I271: 1999 | J271: 20
A272: =ROW()-2 -> 1494 | B272: TN | C272: 2820 | D272: 1 | E272: 02820-6 | F272: 解决因特网、企业网和居民宽带的新途径(ATM：The New Paradigm for Internet，Intranet and Residential Broadband Services and Applications ) | G272: Timothy Kwok | H272: 21.00 | I272: 1998 | J272: 14
F273: ATM 与 B-ISDN 技术丛书(翻译版）
A274: =ROW()-2 -> 1496 | B274: TP | C274: 1182 | D274: 1 | E274: 01182-6 | F274: 现代通信最新技术（第2版） | G274: 贺苏宁译 | H274: 36.00 | I274: 37257 | J274: 9
A275: =ROW()-2 -> 1497 | B275: TP | C275: 0840 | D275: 1 | E275: 00840-X | F275: ATM 宽带网络 | G275: 吕良双等译 | H275: 64.00 | I275: 36892 | J275: 5
F276: VHDL 与集成电路设计丛书
A277: =ROW()-2 -> 1499 | B277: TP | C277: 3932 | D277: 1 | E277: 03932-1 | F277: 用 VHDL 设计电子线路 | G277: 边计年等译 | H277: 42.00 | I277: 36982 | J277: 7
A278: =ROW()-2 -> 1500 | B278: P- | C278: 2502 | D278: 1 | E278: 790062502X | F278: VHDL 语言100例详解（配光盘） | G278: 北京理工大学 | H278: 52.00 | I278: 36982 | J278: 5
A279: =ROW()-2 -> 1501 | B279: P- | C279: 3536 | D279: 1 | E279: 790063536X | F279: 硬件描述语言 Verilog（第四版 配光盘） | G279: 刘明业等译 | H279: 36.00 | I279: 37104 | J279: 8
F280: Microsoft 编程系列
A281: =ROW()-2 -> 1503 | B281: P- | C281: 2569 | D281: 1 | E281: 7900625690 | F281: 基于服务器的应用程序技术内幕（配光盘） （Inside Server-Based Applications) | G281: 潇湘工作室译 | H281: 89.00 | I281: 36861 | J281: 5
A282: =ROW()-2 -> 1504 | B282: P- | C282: 3527 | D282: 1 | E282: 7900635270 | F282: Direct 3D 技术内幕（配光盘） | G282: 李晔 等译 | H282: 58.00 | I282: 37104 | J282: 7
A283: =ROW()-2 -> 1505 | B283: P- | C283: 3089 | D283: 1 | E283: 7900630899 | F283: ADO 编程技术 （配光盘） | H283: 48.00 | I283: 36951 | J283: 10
A284: =ROW()-2 -> 1506 | B284: P- | C284: 3159 | D284: 1 | E284: 7900631593 | F284: 应用程序调试技术（配光盘） | G284: 潘文林等译 | H284: 65.00 | I284: 37104 | J284: 7
A285: =ROW()-2 -> 1507 | B285: P- | C285: 3158 | D285: 1 | E285: 7900631585 | F285: Exchange 2000 Server 协作式网络编程 （配光盘） | H285: 80.00 | I285: 37012 | J285: 5
F286: Windows 2000 系列图书
A287: =ROW()-2 -> 1509 | B287: TP | C287: 0904 | D287: 1 | E287: 00904-X | F287: 中文Windows 2000 办公自动化培训教程 | G287: 张涛 等 | H287: 24.00 | I287: 36770 | J287: 11
A288: =ROW()-2 -> 1510 | B288: TP | C288: 3859 | D288: 1 | E288: 03859-7 | F288: Windows 2000 中文版初中级教程（基础篇） | G288: 东箭工作室 | H288: 20.00 | I288: 36739 | J288: 12
A289: =ROW()-2 -> 1511 | B289: TP | C289: 3857 | D289: 1 | E289: 03857-0 | F289: Windows 2000 中文版初中级教程（网络篇） | G289: 东箭工作室 | H289: 18.00 | I289: 36770 | J289: 15
A290: =ROW()-2 -> 1512 | B290: TP | C290: 3960 | D290: 1 | E290: 03960-7 | F290: Windows ME 中文版初中级教程 | G290: 东箭工作室 | H290: 39.50 | I290: 36739 | J290: 6
A291: =ROW()-2 -> 1513 | B291: TP | C291: 1072 | D291: 1 | E291: 01072-2 | F291: Windows 2000 中文版快速入门 | G291: 高越明等 | H291: 32.00 | I291: 36617 | J291: 9
A292: =ROW()-2 -> 1514 | B292: TP | C292: 1128 | D292: 2 | E292: 01128-1 | F292: Windows 2000 中文版实用组网技术 | G292: 刘芝泉等 | H292: 28.00 | I292: 36678 | J292: 10
A293: =ROW()-2 -> 1515 | B293: TP | C293: 1113 | D293: 1 | E293: 01113-3 | F293: Windows2000中文版注册表使用开发与实例 | G293: 曹国钧等 | H293: 58.00 | I293: 36831 | J293: 4
A294: =ROW()-2 -> 1516 | B294: TP | C294: 0742 | D294: 1 | E294: 00742-X | F294: Windows 2000 中文版系统管理员指南 | G294: 孙全党等 | H294: 36.00 | I294: 36770 | J294: 7
A295: =ROW()-2 -> 1517 | B295: TP | C295: 3787 | D295: 1 | E295: 03787-6 | F295: 中文版 Windows 2000 网络实用指南 | G295: 戴有炜 | H295: 32.00 | I295: 36831 | J295: 9
A296: =ROW()-2 -> 1518 | B296: TP | C296: 4078 | D296: 1 | E296: 04078-8 | F296: 中文版 Windows 2000 网络专业指南 | G296: 戴有炜 | H296: 35.00 | I296: 36831 | J296: 8
A297: =ROW()-2 -> 1519 | B297: TP | C297: 3874 | D297: 1 | E297: 03874-0 | F297: 图解 Windows 2000 配置手册 | G297: 郝岩冰 | H297: 29.00 | I297: 36770 | J297: 10
F298: Microsoft SQL Server 2000 开发指南系列丛书
A299: =ROW()-2 -> 1521 | B299: TP | C299: 4666 | D299: 1 | E299: 04666-2 | F299: 数据库创建、数据仓库与优化 | G299: 郭东清等译 | H299: 41.00 | I299: 37104 | J299: 8
A300: =ROW()-2 -> 1522 | B300: TP | C300: 4673 | D300: 1 | E300: 04673-5 | F300: 分析服务 | G300: 东方人华译 | H300: 62.00 | I300: 37135 | J300: 6
A301: =ROW()-2 -> 1523 | B301: TP | C301: 4622 | D301: 1 | E301: 04622-0 | F301: 复制与自然语言查询 | G301: 李宏益等 | H301: 56.00 | I301: 37135 | J301: 6
A302: =ROW()-2 -> 1524 | B302: TP | C302: 4954 | D302: 1 | E302: 04954-8 | F302: Microsoft T-SQL 语言参考 | G302: 潇湘工作室译 | H302: 69.00 | I302: 37196 | J302: 4
A303: =ROW()-2 -> 1525 | B303: TP | C303: 4623 | D303: 1 | E303: 04623-9 | F303: SQL Server 2000 体系结构与 XML/Internet 支持 | G303: 孙岩 等译 | H303: 67.00 | I303: 37135 | J303: 5
A304: =ROW()-2 -> 1526 | B304: TP | C304: 4624 | D304: 1 | E304: 04624-7 | F304: T-SQL 存储过程和表引用 | G304: 潇湘工作室 | H304: 104.00 | I304: 37135 | J304: 3
F305: JAVA 技术丛书
A306: =ROW()-2 -> 1528 | B306: TP | C306: 0719 | D306: 1 | E306: 00719-5 | F306: Java 2 程序设计 | G306: 王克宏等 | H306: 32.00 | I306: 36982 | J306: 9
A307: =ROW()-2 -> 1529 | B307: TP | C307: 3306 | D307: 1 | E307: 03306-4 | F307: Java 编程技术教程 | G307: 姚晓春等 | H307: 42.00 | I307: 37012 | J307: 6
A308: =ROW()-2 -> 1530 | B308: TP | C308: 3269 | D308: 1 | E308: 03269-6 | F308: JavaBean 组件程序设计 | G308: 王 炜 | H308: 32.00 | I308: 1999 | J308: 7
A309: =ROW()-2 -> 1531 | B309: TP | C309: 3518 | D309: 1 | E309: 03518-0 | F309: Java 多媒体程序设计 | G309: 王峰 等 | H309: 17.50 | I309: 36312 | J309: 14
A310: =ROW()-2 -> 1532 | B310: TP | C310: 3350 | D310: 1 | E310: 03350-1 | F310: Java 服务器程序设计 | G310: 宋辉 等 | H310: 27.00 | I310: 36739 | J310: 10
A311: =ROW()-2 -> 1533 | B311: TP | C311: 2537 | D311: 1 | E311: 02537-1 | F311: Java 程序设计语言 | G311: 吴建平等 | H311: 28.00 | I311: 36739 | J311: 9
A312: =ROW()-2 -> 1534 | B312: TP | C312: 3380 | D312: 1 | E312: 03380-3 | F312: Java 问答式教程 | G312: 戴梅萼 | H312: 26.50 | I312: 36739 | J312: 11
F313: JAVA 技术教程系列丛书
A314: =ROW()-2 -> 1536 | B314: TP | C314: 5234 | D314: 1 | E314: 05234-4 | F314: Java 技术教程（基础篇） | G314: 王克宏等 | H314: 48.00 | I314: 37347 | J314: 6
F315: Visual Foxpro 6.0中文版技术丛书
A316: =ROW()-2 -> 1538 | B316: TP | C316: 3284 | D316: 2 | E316: 03284-X | F316: Visual Foxpro 6.0 中文版函数手册 | G316: 吴迪 等 | H316: 35.00 | I316: 37196 | J316: 9
A317: =ROW()-2 -> 1539 | B317: TP | C317: 3326 | D317: 3 | E317: 03326-9 | F317: Visual FoxPro 6.0 中文版命令手册 | G317: 吴迪 等 | H317: 39.50 | I317: 36951 | J317: 8
A318: =ROW()-2 -> 1540 | B318: TP | C318: 3337 | D318: 3 | E318: 03337-4 | F318: Visual FoxPro 6.0 中文版类和对象手册 | G318: 吴迪 等 | H318: 35.50 | I318: 36617 | J318: 10
A319: =ROW()-2 -> 1541 | B319: TP | C319: 3233 | D319: 3 | E319: 03233-5 | F319: Visual FoxPro 6.0 中文版程序设计指南 | G319: 吴迪 等 | H319: 58.00 | I319: 36923 | J319: 6
A320: =ROW()-2 -> 1542 | B320: TP | C320: 3400 | D320: 3 | E320: 03400-1 | F320: Visual FoxPro 6.0 中文版入门与技巧 | G320: 木林森 | H320: 25.00 | I320: 37257 | J320: 12
A321: =ROW()-2 -> 1543 | B321: TP | C321: 3373 | D321: 4 | E321: 03373-0 | F321: 中文Visual FoxPro 6.0 编程基础 | G321: 合力工作室 | H321: 32.00 | I321: 37500 | J321: F
A322: =ROW()-2 -> 1544 | B322: TP | C322: 3423 | D322: 4 | E322: 03423-0 | F322: 中文Visual FoxPro 6.0 高级编程 | G322: 合力工作室 | H322: 39.80 | I322: 36617 | J322: 6
A323: =ROW()-2 -> 1545 | B323: TP | C323: 3494 | D323: 2 | E323: 03494-X | F323: Visual FoxPro 6.0开发实例 | G323: 张治文等 | H323: 29.00 | I323: 36281 | J323: 11
A324: =ROW()-2 -> 1546 | B324: TP | C324: 3746 | D324: 2 | E324: 03746-9 | F324: 深入Visual FoxPro 6.0面向对象程序设计 | G324: 冯惠璋等 | H324: 29.00 | I324: 36526 | J324: 10
F325: Visual Foxpro 7.0参考手册
A326: =ROW()-2 -> 1548 | B326: TP | C326: 5555 | D326: 1 | E326: 05555-6 | F326: Visual FoxPro 7.0命令手册 | G326: 夏辉等 | H326: 40.00 | I326: 37469 | J326: 7
F327: PowerBuilder 7 .0 技术丛书
A328: =ROW()-2 -> 1550 | B328: TP | C328: 3961 | D328: 1 | E328: 03961-5 | F328: PowerBuilder 7.0 入门 | G328: 崔巍 等 | H328: 18.00 | I328: 36831 | J328: 17
A329: =ROW()-2 -> 1551 | B329: TP | C329: 1228 | D329: 1 | E329: 01228-3 | F329: PowerBuilder 7.0 使用指南 | G329: 崔巍 等 | H329: 33.00 | I329: 37012 | J329: 9
A330: =ROW()-2 -> 1552 | B330: TP | C330: 0816 | D330: 1 | E330: 00816-7 | F330: PowerBuilder 7.0 应用技术 | G330: 崔巍 等 | H330: 29.00 | I330: 36982 | J330: 9
A331: =ROW()-2 -> 1553 | B331: TP | C331: 0701 | D331: 1 | E331: 00701-2 | F331: PowerBuilder 7.0 参考手册 | G331: 崔巍 等 | H331: 70.00 | I331: 37257 | J331: 4
A332: =ROW()-2 -> 1554 | B332: TP | C332: 1229 | D332: 1 | E332: 01229-6 | F332: PowerBuilder 7.0 数据库窗口程序设计 | G332: 崔巍 等 | H332: 68.00 | I332: 36982 | J332: 4
F333: PowerBuilder 8.0 系列图书
A334: =ROW()-2 -> 1556 | B334: TP | C334: 5089 | D334: 1 | E334: 05089-9 | F334: PowerBuilder 8.0 数据库开发入门 | G334: 崔巍编著 | H334: 20.00 | I334: 37408 | J334: 13
A335: =ROW()-2 -> 1557 | B335: TP | C335: 5195 | D335: 1 | E335: 05195-X | F335: PowerBuilder 8.0 数据库应用系统开发教程 | G335: 崔巍编著 | H335: 29.00 | I335: 37500 | J335: 9
A336: =ROW()-2 -> 1558 | B336: TP | C336: 5397 | D336: 1 | E336: 05397-9 | F336: PowerBuilder 8.0 高级应用技术 | G336: 崔巍编著 | H336: 30.00 | I336: 37384 | J336: 9
A337: =ROW()-2 -> 1559 | B337: P- | C337: 4181 | D337: 1 | E337: 7900641815 | F337: PowerBuilder 8.0 进阶篇（实例与技巧篇 附光盘） | G337: 柯建勋等 | H337: 56.00 | I337: 37500 | J337: 5
A338: =ROW()-2 -> 1560 | B338: P- | C338: 4187 | D338: 1 | E338: 7900641874 | F338: PowerBuilder 8.0 编程实用技术与案例（配光盘） | G338: 朱爱民 | H338: 48.00 | I338: 37530 | J338: 7
A339: =ROW()-2 -> 1561 | B339: TP | C339: 5343 | D339: 1 | E339: 05343-X | F339: PowerBuilder 8.0 基础篇 | G339: 柯建勋等 | H339: 65.00 | I339: 37500 | J339: 4
F340: Linux/UNIX 开发与应用系列
A341: =ROW()-2 -> 1563 | B341: TP | C341: 1423 | D341: 2 | E341: 01423-X | F341: 用 Linux 构建 Intranet | G341: 王少华等 | H341: 28.00 | I341: 36982 | J341: 10
A342: =ROW()-2 -> 1564 | B342: TP | C342: 4341 | D342: 1 | E342: 04341-8 | F342: UNIX 程序设计教程 | G342: 赵克佳等 | H342: 50.00 | I342: 37257 | J342: 5
A343: =ROW()-2 -> 1565 | B343: TP | C343: 1219 | D343: 1 | E343: 01219-9 | F343: Linux 平台下的 Web 编程 | G343: 张斌 等 | H343: 35.00 | I343: 36831 | J343: 7
A344: =ROW()-2 -> 1566 | B344: TP | C344: 1098 | D344: 1 | E344: 01098-6 | F344: Linux 网络编程 | G344: 张斌 等 | H344: 27.00 | I344: 36678 | J344: 8
A345: =ROW()-2 -> 1567 | B345: TP | C345: 0772 | D345: 1 | E345: 00772-1 | F345: UNIX 网络管理（SCO,Solaris,Linux) | G345: 窦剑 等 | H345: 33.00 | I345: 36861 | J345: 9
A346: =ROW()-2 -> 1568 | B346: TP | C346: 0975 | D346: 1 | E346: 00975-9 | F346: UNIX 使用与系统管理（SCO,Solaris） | G346: 孟庆昌等 | H346: 45.00 | I346: 36831 | J346: 6
A347: =ROW()-2 -> 1569 | B347: TP | C347: 5580 | D347: 1 | E347: 05580-7 | F347: Sun Solaris 8 系统管理员指南 | G347: 徐国平 | H347: 45.00 | I347: 37469 | J347: 6
F348: C++Builder 4 高级编程丛书
A349: =ROW()-2 -> 1571 | B349: TP | C349: 3848 | D349: 1 | E349: 03848-1 | F349: 集成开发环境与面向对象编程技术 | G349: 徐新华 | H349: 18.00 | I349: 36647 | J349: 15
A350: =ROW()-2 -> 1572 | B350: TP | C350: 3835 | D350: 1 | E350: 03835-X | F350: 数据库与 MIDAS 编程技术 | G350: 徐新华 | H350: 22.00 | I350: 36647 | J350: 12
A351: =ROW()-2 -> 1573 | B351: TP | C351: 3897 | D351: 1 | E351: 03897-X | F351: 图形用户界面编程技术 | G351: 徐新华 | H351: 35.00 | I351: 36678 | J351: 8
A352: =ROW()-2 -> 1574 | B352: TP | C352: 3898 | D352: 1 | E352: 03898-8 | F352: COM、CORBA 与 Internet 编程技术 | G352: 徐新华 | H352: 22.00 | I352: 36678 | J352: 12
F353: 计算机编程技术丛书
A354: =ROW()-2 -> 1576 | B354: P- | C354: 3047 | D354: 1 | E354: 7900630473 | F354: Windows 2000 高级编程技巧与剖析（配光盘） | G354: 齐舒创作室 | H354: 49.00 | I354: 36861 | J354: 7
A355: =ROW()-2 -> 1577 | B355: P- | C355: 2525 | D355: 1 | E355: 7900625259 | F355: Windows API 常用技巧汇编（配光盘） | G355: 王宏 等 | H355: 29.00 | I355: 36892 | J355: 12
A356: =ROW()-2 -> 1578 | B356: TP | C356: 3672 | D356: 2 | E356: 03672-1 | F356: Authorware 5.0 实战与精通 | G356: 刘 春 | H356: 29.00 | I356: 36861 | J356: 10
A357: =ROW()-2 -> 1579 | B357: TP | C357: 3709 | D357: 2 | E357: 03709-4 | F357: Visual FoxPro 6.0 实战与精通 | G357: 方可燕等 | H357: 39.50 | I357: 36647 | J357: 8
A358: =ROW()-2 -> 1580 | B358: TP | C358: 2356 | D358: 4 | E358: 02356-5 | F358: AutoCAD 2000 (机械版）实战与精通 | G358: 徐进明等 | H358: 35.00 | I358: 37165 | J358: 8
A359: =ROW()-2 -> 1581 | B359: TP | C359: 5613 | D359: 1 | E359: 05613-7 | F359: AutoCAD 2002实战与精通 | G359: 邢增平 | H359: 35.00 | I359: 37469 | J359: 8
A360: =ROW()-2 -> 1582 | B360: TP | C360: 1130 | D360: 1 | E360: 01130-3 | F360: Delphi 5 实战与精通（实战篇） | G360: 唐健 等 | H360: 28.00 | I360: 36678 | J360: 9
A361: =ROW()-2 -> 1583 | B361: TP | C361: 3872 | D361: 1 | E361: 03872-4 | F361: Delphi 5 实战与精通（精通篇） | G361: 方可燕等 | H361: 34.00 | I361: 36831 | J361: 9
A362: =ROW()-2 -> 1584 | B362: TP | C362: 3930 | D362: 1 | E362: 03930-5 | F362: Delphi 5 数据库编程实战与精通 | G362: 房增华等 | H362: 30.00 | I362: 37012 | J362: 9
A363: =ROW()-2 -> 1585 | B363: TP | C363: 0964 | D363: 1 | E363: 00964-3 | F363: Delphi 5.0 专题开发指南 | G363: 刘华 等 | H363: 39.80 | I363: 36770 | J363: 6
A364: =ROW()-2 -> 1586 | B364: TP | C364: 1183 | D364: 1 | E364: 01183-4 | F364: 精通 Visual C++ 6.0 | G364: 刘小石等 | H364: 46.00 | I364: 37438 | J364: 6
A365: =ROW()-2 -> 1587 | B365: TP | C365: 0906 | D365: 1 | E365: 00906-6 | F365: Visual C++ 6.0 实战与精通 | G365: 方可燕等 | H365: 42.00 | I365: 37012 | J365: 6
F366: 计算机编程系列
A367: =ROW()-2 -> 1589 | B367: TP | C367: 2268 | D367: 3 | E367: 02268-2 | F367: COM 原理与应用 | G367: 潘爱民 | H367: 39.00 | I367: 37326 | J367: 7
A368: =ROW()-2 -> 1590 | B368: P- | C368: 2262 | D368: 1 | E368: 7900622624 | F368: COM/DCOM 编程指南（配光盘） | G368: 刘云等译 | H368: 52.00 | I368: 36495 | J368: 7
A369: =ROW()-2 -> 1591 | B369: TP | C369: 5543 | D369: 1 | E369: 05543-2 | F369: COM与CORBA本质与互用：体系结构 策略实现 | G369: Jason Pritchard | H369: 39.00 | I369: 37408 | J369: 8
A370: =ROW()-2 -> 1592 | B370: TP | C370: 0758 | D370: 1 | E370: 00758-6 | F370: Delphi 5 编程基础 | G370: 吴小前等 | H370: 27.00 | I370: 36923 | J370: 9
A371: =ROW()-2 -> 1593 | B371: TP | C371: 3955 | D371: 1 | E371: 03955-0 | F371: Delphi 5 高级编程 | G371: 熊傲 等 | H371: 33.00 | I371: 36739 | J371: 8
A372: =ROW()-2 -> 1594 | B372: TP | C372: 3578 | D372: 2 | E372: 03578-4 | F372: Visual C++6.0编程基础 | G372: 王世同等 | H372: 19.80 | I372: 37469 | J372: 12
A373: =ROW()-2 -> 1595 | B373: TP | C373: 3507 | D373: 3 | E373: 03507-5 | F373: Visual C++6.0高级编程 | G373: 康博创作室 | H373: 29.80 | I373: 36586 | J373: 7
A374: =ROW()-2 -> 1596 | B374: TP | C374: 3681 | D374: 1 | E374: 03681-0 | F374: Visual C++6.0开发技巧及实例剖析(配光盘) | G374: 齐舒创作室 | H374: 59.00 | I374: 36708 | J374: 5
A375: =ROW()-2 -> 1597 | B375: P- | C375: 3068 | D375: 1 | E375: 7900630686 | F375: Visual C++ 图形用户界面开发指南(配光盘) | G375: 李博轩 | H375: 46.80 | I375: 36861 | J375: 7
A376: =ROW()-2 -> 1598 | B376: P- | C376: 2282 | D376: 1 | E376: 7900622829 | F376: Visual C++6.0多媒体开发指南（配光盘） | G376: 李博轩 | H376: 35.00 | I376: 36678 | J376: 9
A377: =ROW()-2 -> 1599 | B377: P- | C377: 2568 | D377: 1 | E377: 7900625682 | F377: Visual C++6.0 网络及 Internet 开发指南(配光盘) | G377: 李博轩 | H377: 42.00 | I377: 36739 | J377: 7
A378: =ROW()-2 -> 1600 | B378: P- | C378: 3044 | D378: 1 | E378: 7900630449 | F378: Visual C++6.0 项目开发指南 （配光盘） | G378: 张志学等 | H378: 48.00 | I378: 36831 | J378: 7
A379: =ROW()-2 -> 1601 | B379: P- | C379: 2536 | D379: 1 | E379: 7900625364 | F379: Visual C++6.0 计算方法开发指南（配光盘） | G379: 黄淼云等 | H379: 32.00 | I379: 36739 | J379: 12
A380: =ROW()-2 -> 1602 | B380: TP | C380: 3365 | D380: 4 | E380: 03365-X | F380: 中文Visual Basic 6.0 编程基础 | G380: 宋伟 等 | H380: 32.00 | I380: 36586 | J380: 7
A381: =ROW()-2 -> 1603 | B381: TP | C381: 3422 | D381: 3 | E381: 03422-2 | F381: 中文Visual Basic 6.0 高级编程 | G381: 宋伟 等 | H381: 29.80 | I381: 36739 | J381: 8
A382: =ROW()-2 -> 1604 | B382: TP | C382: 1125 | D382: 1 | E382: 01125-7 | F382: Visual Basic 6.0 数据库开发指南 | G382: 王福成等 | H382: 25.80 | I382: 37500 | J382: 10
A383: =ROW()-2 -> 1605 | B383: P- | C383: 2507 | D383: 1 | E383: 7900625070 | F383: Visual Basic 实用编程百例 | G383: 吴师通 | H383: 39.00 | I383: 37320 | J383: 8
A384: =ROW()-2 -> 1606 | B384: TP | C384: 3657 | D384: 2 | E384: 03657-8 | F384: 编程丛书 Visual Basic 6.0 常用编程技巧 | G384: 抖斗书屋 | H384: 31.00 | I384: 36526 | J384: 9
A385: =ROW()-2 -> 1607 | B385: P- | C385: 2212 | D385: 1 | E385: 7900622128 | F385: Visual Basic 6.0 数据库开发(配光盘) | G385: 顾 斌等译 | H385: 85 | I385: 36404 | J385: 4
A386: =ROW()-2 -> 1608 | B386: P- | C386: 2246 | D386: 1 | E386: 7900622462 | F386: Visual Basic 6.0 多媒体与因特网应用(配光盘) | G386: 朱锦坤 | H386: 39 | I386: 36495 | J386: 9
A387: =ROW()-2 -> 1609 | B387: TP | C387: 0966 | D387: 1 | E387: 00966-X | F387: PowerBuilder 7 编程基础 | G387: 李国民等 | H387: 29 | I387: 37165 | J387: 8
A388: =ROW()-2 -> 1610 | B388: P- | C388: 2570 | D388: 1 | E388: 7900625704 | F388: Visual J++ 图形设计与图象处理（配光盘） | G388: 向世明等 | H388: 66 | I388: 36739 | J388: 5
A389: =ROW()-2 -> 1611 | B389: TP | C389: 3913 | D389: 1 | E389: 03913-5 | F389: GNU/Linux 编程指南 | H389: 62.00 | I389: 36678 | J389: 5
A390: =ROW()-2 -> 1612 | B390: P- | C390: 2510 | D390: 1 | E390: 7900625100 | F390: 因特网应用编程（配光盘） | G390: 汪蒲阳 | H390: 48.00 | I390: 36617 | J390: 6
A391: =ROW()-2 -> 1613 | B391: TP | C391: 3893 | D391: 1 | E391: 03893-7 | F391: Authorware 数据库编程 | G391: 朱诗兵等 | H391: 30.00 | I391: 36739 | J391: 9
A392: =ROW()-2 -> 1614 | B392: TP | C392: 5175 | D392: 1 | E392: 05175-5 | F392: 基于Windows的TCP/IP编程 | G392: 王罡 | H392: 35.00 | I392: 37438 | J392: 8
A393: =ROW()-2 -> 1615 | B393: TP | C393: 3775 | D393: 2 | E393: 03775-2 | F393: Delphi 5 标准教程 | G393: Inprise 公司 | H393: 49.00 | I393: 36617 | J393: 7
A394: =ROW()-2 -> 1616 | B394: TP | C394: 1174 | D394: 1 | E394: 01174-5 | F394: Borland C++ Builder 4 标准教程 | G394: Inprise 公司 | H394: 60.00 | I394: 36678 | J394: 7
A395: =ROW()-2 -> 1617 | B395: TP | C395: 5101 | D395: 1 | E395: 05101-1 | F395: 全面理解JavaScript | G395: 马雷等译 | H395: 74.00 | I395: 37347 | J395: 5
A396: =ROW()-2 -> 1618 | B396: P- | C396: 4140 | D396: 1 | E396: 7900641408 | F396: 精通Servlets――Java平台的服务器端编程（配光盘） | G396: 战小苏译 | H396: 85.00 | I396: 37347 | J396: 4
A397: =ROW()-2 -> 1619 | B397: TP | C397: 5261 | D397: 1 | E397: 05261-1 | F397: 破译思科之CCNA2.0卷 | G397: 李宇峰等 | H397: 26.00 | I397: 37347 | J397: 10
A398: =ROW()-2 -> 1620 | B398: P- | C398: 4171 | D398: 1 | E398: 7900641718 | F398: Java2编程21天自学通（配光盘） | G398: 束闻等译 | H398: 65.00 | I398: 37347 | J398: 5
F399: Macromedia 系列技术软件丛书
A400: =ROW()-2 -> 1622 | B400: P- | C400: 2584 | D400: 1 | E400: 7900625844 | F400: Flash 标准教程（配光盘） | G400: 刘 超 等 | H400: 42.00 | I400: 36892 | J400: 8
A401: =ROW()-2 -> 1623 | B401: TP | C401: 4194 | D401: 1 | E401: 04194-6 | F401: CourseBuilder 标准教程 | G401: 石明贵等 | H401: 27.00 | I401: 36982 | J401: 11
A402: =ROW()-2 -> 1624 | B402: P- | C402: 2539 | D402: 1 | E402: 7900625399 | F402: Authorware 程序经典 -Show Me 程序50例 | G402: 石明贵等 | H402: 49.00 | I402: 36800 | J402: 7
A403: =ROW()-2 -> 1625 | B403: P- | C403: 3056 | D403: 1 | E403: 7900630562 | F403: Authorware 5.1 标准教程（配光盘） | G403: 石明贵等 | H403: 49.00 | I403: 36831 | J403: 8
F404: 计算机网络教育丛书(谭浩强主编）
A405: =ROW()-2 -> 1627 | B405: TP | C405: 4848 | D405: 1 | E405: 04848-7 | F405: 主页制作与站点建设 | G405: 刘 涛 | H405: 19.80 | I405: 37165 | J405: 15
A406: =ROW()-2 -> 1628 | B406: TP | C406: 2038 | D406: 5 | E406: 02038-8 | F406: 怎样使用 Internet Explorer 5 浏览器 | G406: 邵丽萍等 | H406: 12.00 | I406: 36617 | J406: 8
A407: =ROW()-2 -> 1629 | B407: TP | C407: 3763 | D407: 2 | E407: 03763-9 | F407: 怎样制作 Web 页面 | G407: 邵丽萍等 | H407: 14.00 | I407: 36586 | J407: 18
A408: =ROW()-2 -> 1630 | B408: TP | C408: 2178 | D408: 5 | E408: 02178-3 | F408: 怎样使用 Internet | G408: 浩强创作室 | H408: 14.00 | I408: 36923 | J408: 16
A409: =ROW()-2 -> 1631 | B409: TP | C409: 2176 | D409: 1 | E409: 02176-7 | F409: 怎样使用 Netscape 浏览器 | G409: 浩强创作室 | H409: 14.00 | I409: 36557 | J409: 18
A410: =ROW()-2 -> 1632 | B410: TP | C410: 3690 | D410: 3 | E410: 03690-X | F410: 计算机局域网与 Windows NT 实用教程 | G410: 尚晓航等 | H410: 27.50 | I410: 2002、8 | J410: 9
A411: =ROW()-2 -> 1633 | B411: TP | C411: 3705 | D411: 2 | E411: 03705-1 | F411: 计算机网络实用教程 | G411: 浩强创作室 | H411: 32.00 | I411: 37469 | J411: 8
A412: =ROW()-2 -> 1634 | B412: TP | C412: 5452 | D412: 1 | E412: 05452-5 | F412: Web数据库技术实用教程 | G412: 魏善师 | H412: 30.00 | I412: 37408 | J412: 8
F413: 新手上网实用系列
A414: =ROW()-2 -> 1636 | B414: TP | C414: 1213 | D414: 1 | E414: 01213-X | F414: 网上冲浪完全手册 | G414: 东箭工作室 | H414: 18.00 | I414: 37165 | J414: 13
A415: =ROW()-2 -> 1637 | B415: TP | C415: 4465 | D415: 1 | E415: 04465-1 | F415: 网上下载完全手册 | G415: 东箭工作室 | H415: 20.00 | I415: 37377 | J415: 12
A416: =ROW()-2 -> 1638 | B416: TP | C416: 4575 | D416: 1 | E416: 04575-5 | F416: QQ/ICQ 完全手册 | G416: 东箭工作室 | H416: 13.80 | I416: 37257 | J416: 18
A417: =ROW()-2 -> 1639 | B417: TP | C417: 4449 | D417: 1 | E417: 04449-X | F417: 电子邮件完全手册 | G417: 东箭工作室 | H417: 19.00 | I417: 37328 | J417: 13
F418: 计算机网络安全丛书
A419: =ROW()-2 -> 1641 | B419: TP | C419: 3293 | D419: 2 | E419: 03293-9 | F419: Internet/Intranet 网络安全结构设计 | G419: 徐锦波等 | H419: 53.00 | I419: 36434 | J419: 6
A420: =ROW()-2 -> 1642 | B420: TP | C420: 2683 | D420: 2 | E420: 02683-1 | F420: 网络安全基础 | G420: 黄允聪等 | H420: 25.00 | I420: 37469 | J420: 15
A421: =ROW()-2 -> 1643 | B421: TP | C421: 3576 | D421: 2 | E421: 03576-8 | F421: Windows NT 系统安全实用技术 | G421: 高鹏 等 | H421: 27.00 | I421: 36434 | J421: 14
A422: =ROW()-2 -> 1644 | B422: TP | C422: 3341 | D422: 2 | E422: 03341-2 | F422: 计算机网络安全工具 | G422: 张小斌等 | H422: 29.00 | I422: 36342 | J422: 12
A423: =ROW()-2 -> 1645 | B423: TP | C423: 3305 | D423: 2 | E423: 03305-6 | F423: 防火墙的选型、配置、安装和维护 | G423: 黄允聪等 | H423: 23.00 | I423: 1999 | J423: 14
A424: =ROW()-2 -> 1646 | B424: TP | C424: 3460 | D424: 4 | E424: 03460-5 | F424: 黑客分析与防范技术 | G424: 张小斌等 | H424: 25.00 | I424: 37012 | J424: 11
F425: 网络新技术丛书（翻译版）
A426: =ROW()-2 -> 1648 | B426: TP | C426: 2344 | D426: 2 | E426: 02344-1 | F426: 新因特网协议 IPv6 (第2版) | G426: 陶文星等译 | H426: 20.00 | I426: 36678 | J426: 15
A427: =ROW()-2 -> 1649 | B427: TP | C427: 5327 | D427: 1 | E427: 05327-8 | F427: 管理动态IP网络 | G427: 徐六通等 | H427: 28.00 | I427: 37530 | J427: 8
F428: 网络新技术丛书（影印版）
A429: =ROW()-2 -> 1651 | B429: TP | C429: 1083 | D429: 1 | E429: 01083-8 | F429: 移动 IP （MOBILE IP） | G429: James D.Solomon | H429: 36.00 | I429: 37012 | J429: 8
A430: =ROW()-2 -> 1652 | B430: TP | C430: 4119 | D430: 1 | E430: 04119-9 | F430: 管理动态 IP 网络 (Managing Dynamic IP Networks) | G430: Paul T.Ammann | H430: 46.00 | I430: 36861 | J430: 7
A431: =ROW()-2 -> 1653 | B431: TP | C431: 4118 | D431: 1 | E431: 04118-0 | F431: IP 与 ATM 网络中的 QoS 和业务量管理 （QoS &Traffic Management in IP & ATM Networks) | G431: David McDysan | H431: 46.00 | I431: 36861 | J431: 7
A432: =ROW()-2 -> 1654 | B432: TP | C432: 4117 | D432: 1 | E432: 04117-2 | F432: XDSL 体系结构 （XDSL Architecture) | G432: Padmanand Warrier | H432: 48.00 | I432: 36861 | J432: 6
A433: =ROW()-2 -> 1655 | B433: TP | C433: 1081 | D433: 1 | E433: 01081-1 | F433: 虚拟局域网（Virtual LANs) | G433: Marina Smith | H433: 40.00 | I433: 36557 | J433: 7
A434: =ROW()-2 -> 1656 | B434: TP | C434: 4121 | D434: 1 | E434: 04121-0 | F434: 电信协议（第2版） (Telecommunications Protocols) | G434: Travis Russell | H434: 45.00 | I434: 36861 | J434: 7
A435: =ROW()-2 -> 1657 | B435: TP | C435: 1091 | D435: 1 | E435: 01091-9 | F435: 交换式局域网（Switched LANs) | G435: John J.Roese | H435: 40.00 | I435: 36557 | J435: 7
A436: =ROW()-2 -> 1658 | B436: TP | C436: 1092 | D436: 1 | E436: 01092-7 | F436: 千兆以太网（Gigabit Ethernet Networking) | G436: David G. William G. | H436: 49.00 | I436: 36526 | J436: 5
F437: 网页设计・网站建设培训教材
A438: =ROW()-2 -> 1660 | B438: TP | C438: 4068 | D438: 1 | E438: 04068-0 | F438: 网页核心 XML 应用技巧与实例 | G438: 刘 光 | H438: 28.00 | I438: 36800 | J438: 9
A439: =ROW()-2 -> 1661 | B439: TP | C439: 4168 | D439: 1 | E439: 04168-7 | F439: JSP编程入门与应用实例 | G439: 李巍 | H439: 24.00 | I439: 36892
F440: 网络编程实例导学系列
A441: =ROW()-2 -> 1663 | B441: P- | C441: 3094 | D441: 1 | E441: 7900630945 | F441: Windows 网络编程之Delphi篇（配光盘） | G441: 萧秋水等 | H441: 35.00 | I441: 36923 | J441: 10
A442: =ROW()-2 -> 1664 | B442: P- | C442: 3114 | D442: 1 | E442: 7900631143 | F442: Windows 网络编程之VB 篇 （配光盘） | G442: 萧秋水等 | H442: 32.00 | I442: 36951 | J442: 12
A443: =ROW()-2 -> 1665 | B443: P- | C443: 3109 | D443: 1 | E443: 7900631097 | F443: Windows 网络编程之VC篇（配光盘） | G443: 萧秋水等 | H443: 35.00 | I443: 37196 | J443: 10
F444: 全面突破网络编程技术丛书
A445: =ROW()-2 -> 1667 | B445: TP | C445: 1397 | D445: 1 | E445: 01397-7 | F445: JSP 程序设计与实例分析教程 | G445: 姜晓铭等 | H445: 38.00 | I445: 36982 | J445: 7
A446: =ROW()-2 -> 1668 | B446: TP | C446: 4382 | D446: 1 | E446: 04382-5 | F446: JSP 网站开发技术 | G446: 徐进明 | H446: 28.00 | I446: 37012 | J446: 10
A447: =ROW()-2 -> 1669 | B447: TP | C447: 4470 | D447: 1 | E447: 04470-8 | F447: PHP程序设计与实例分析教程 | G447: 姜晓铭等 | H447: 29.00 | I447: 37043 | J447: 9
F448: 程序员指南丛书
A449: =ROW()-2 -> 1671 | B449: TP | C449: 4956 | D449: 1 | E449: 04956-4 | F449: Visual C++.NET 编程基础 | G449: 冯敏 等 | H449: 29.80 | I449: 37226 | J449: 9
A450: =ROW()-2 -> 1672 | B450: TP | C450: 5540 | D450: 1 | E450: 05540-1 | F450: Visual FoxPro 7.0 高级编程 | G450: 孙立明刘琳等 | H450: 35.00 | I450: 37438 | J450: 7
A451: =ROW()-2 -> 1673 | B451: TP | C451: 4974 | D451: 1 | E451: 04974-2 | F451: Visual C#.NET 编程基础 | G451: 李满潮等 | H451: 25.00 | I451: 37227 | J451: 10
A452: =ROW()-2 -> 1674 | B452: TP | C452: 4963 | D452: 1 | E452: 04963-7 | F452: Visual Basic.NET 编程基础 | G452: 张文 等 | H452: 26.80 | I452: 37408 | J452: 10
A453: =ROW()-2 -> 1675 | B453: TP | C453: 5056 | D453: 1 | E453: 05056-2 | F453: Visual FoxPro 7.0 编程基础 | G453: 赵静 等 | H453: 25.00 | I453: 37377 | J453: 10
A454: =ROW()-2 -> 1676 | B454: TP | C454: 4973 | D454: 1 | E454: 04973-4 | F454: Delphi 6 编程基础 | G454: 肖建 等 | H454: 36.00 | I454: 37226 | J454: 7
A455: =ROW()-2 -> 1677 | B455: TP | C455: 4964 | D455: 1 | E455: 04964-5 | F455: PowerBuilder 8.0 编程基础 | G455: 李超 等 | H455: 22.80 | I455: 37389 | J455: 11
A456: =ROW()-2 -> 1678 | B456: TP | C456: 5373 | D456: 1 | E456: 05373-1 | F456: VisualC#.NET高级 编程 | G456: 李满潮 等 | H456: 42.80 | I456: 37349 | J456: 6
A457: =ROW()-2 -> 1679 | B457: TP 5510 1 | D457: 1 | E457: 05510-1 | F457: Visual Basic.NET程序设计入门 | G457: 李万红等 | H457: 28.00 | I457: 37408 | J457: 9
A458: =ROW()-2 -> 1680 | B458: TP | C458: 5395 | D458: 1 | E458: 05395-1 | F458: ASP.NET 编程基础 | G458: 肖建 等 | H458: 27.00 | I458: 37385 | J458: 9
A459: =ROW()-2 -> 1681 | B459: TP | C459: 5768 | D459: 1 | E459: 05768-0 | F459: ASP.NET 高级编程 | G459: 但正刚等 | H459: 40.00 | I459: 37508 | J459: 7
F460: Unigraphics 应用指导系列丛书
A461: =ROW()-2 -> 1683 | B461: TP | C461: 5004 | D461: 1 | E461: 05004-X | F461: UG 渲染与实例 | G461: 李开林 | H461: 20.00 | I461: 37226 | J461: 13
A462: =ROW()-2 -> 1684 | B462: P- | C462: 4191 | D462: 1 | E462: 7900641912 | F462: UG高级铣加工应用培训教程（配光盘） | G462: 苗春杰编译 | H462: 30.00 | I462: 37438 | J462: 12
A463: =ROW()-2 -> 1685 | B463: P- | C463: 3790 | D463: 1 | E463: 7900637907 | F463: UG 设计应用培训教程（配光盘） | G463: 丁炜 等译 | H463: 39.00 | I463: 37333 | J463: 9
A464: =ROW()-2 -> 1686 | B464: P- | C464: 4309 | D464: 1 | E464: 7900643095 | F464: UG知识熔接技术培训教程（配光盘） | G464: 王刚等译 | H464: 22.00 | I464: 37438 | J464: 20
A465: =ROW()-2 -> 1687 | B465: P- | C465: 3796 | D465: 1 | E465: 7900637966 | F465: UG 自由形状特征建模培训教程（配光盘） | G465: 龚勉 译 | H465: 27.00 | I465: 37408 | J465: 15
A466: =ROW()-2 -> 1688 | B466: P- | C466: 3795 | D466: 1 | E466: 7900637958 | F466: UG 制图基础培训教程（配光盘） | G466: 赵翠莲等译 | H466: 42.00 | I466: 37226 | J466: 8
A467: =ROW()-2 -> 1689 | B467: P- | C467: 3793 | D467: 1 | E467: 7900637931 | F467: UG CAD 快速入门指导（配光盘） | G467: 洪如瑾 | H467: 47.00 | I467: 37408 | J467: 7
A468: =ROW()-2 -> 1690 | B468: P- | C468: 3792 | D468: 1 | E468: 7900637923 | F468: UG 相关参数化设计培训教程（配光盘） | G468: 张琴 译 | H468: 30.00 | I468: 37226 | J468: 12
A469: =ROW()-2 -> 1691 | B469: P- | C469: 3791 | D469: 1 | E469: 7900637915 | F469: UG/Open GRIP 实用编程基础（配光盘） | G469: 王庆林 | H469: 46.00 | I469: 37288 | J469: 7
A470: =ROW()-2 -> 1692 | B470: P- | C470: 4183 | D470: 1 | E470: 7900641831 | F470: UG WAVE 产品设计技术培训教程(配光盘) | G470: Unigraphics Solutions Inc | H470: 30.00 | I470: 37408 | J470: 13
A471: =ROW()-2 -> 1693 | B471: P- | C471: 4318 | D471: 1 | E471: 7900643184 | F471: UG高级装配培训教程（配光盘） | G471: Unigraphics Solutions Inc | H471: 24.00 | I471: 37438 | J471: 17
A472: =ROW()-2 -> 1694 | B472: TP | C472: 5658 | D472: 1 | E472: 05658-7 | F472: UG CAD 实用教程 | G472: 赵波等 | H472: 49.00 | I472: 37438 | J472: 6
A473: =ROW()-2 -> 1695 | B473: P- | C473: 3794 | D473: 1 | E473: 790063794X | F473: UG 铣制造过程培训教程（配光盘） | G473: 苏红卫译 | H473: 30.00 | I473: 37333 | J473: 11
A474: =ROW()-2 -> 1696 | B474: P- | C474: 4317 | D474: 1 | E474: 7900643176 | F474: UG多轴铣制造过程培训教程 | G474: Unigraphics Solutions Inc | H474: 26.00 | I474: 37469 | J474: 15
A475: =ROW()-2 -> 1697 | B475: P- | C475: 4321 | D475: 1 | E475: 7900643214 | F475: UG铣制造过程实用指导(配光盘) | G475: 王庆林等 | H475: 46.00 | I475: 37469 | J475: 8
A476: =ROW()-2 -> 1698 | B476: P- | C476: 5708 | D476: 1 | E476: 05708-7 | F476: UG/Open API编程基础 | G476: 董正卫等 | H476: 28.00 | I476: 37469 | J476: 11
A477: =ROW()-2 -> 1699 | B477: P- | C477: 4324 | D477: 1 | E477: 7900643249 | F477: UG实践应用初步培训教程（配光盘） | G477: 李维等著 | H477: 36.00 | I477: 37469 | J477: 10
A478: =ROW()-2 -> 1700 | B478: P- | C478: 4336 | D478: 1 | E478: 7900643362 | F478: UG运动分析培训教程 | G478: 胡晓康 | H478: 46.00 | I478: 37500 | J478: 7
A479: =ROW()-2 -> 1701 | B479: P- | C479: 4354 | D479: 1 | E479: 7900643540 | F479: UG钣金设计培训教程（配光盘） | G479: Unigraphics Solutions Inc | H479: 33.00 | I479: 37500 | J479: 11
A480: =ROW()-2 -> 1702 | B480: P- | C480: 4347 | D480: 1 | E480: 7900643478 | F480: UG注塑模具设计培训教程 | G480: Unigraphics Solutions Inc | H480: 46.00 | I480: 37500 | J480: 7
A481: =ROW()-2 -> 1703 | B481: P- | C481: 4356 | D481: 1 | E481: 7900643567 | F481: UG工业设计培训教程（配光盘） | G481: Unigraphics Solutions Inc | H481: 35.00 | I481: 37530 | J481: 10
F482: Delphi 网络和通信编程的深入教程
A483: =ROW()-2 -> 1705 | B483: P- | C483: 3580 | D483: 1 | E483: 7900635807 | F483: Internet 与 TCP/IP程序设计之 Delphi 高手 （配光盘） | G483: 黄志鸿等 | H483: 56.00 | I483: 37135 | J483: 6
A484: =ROW()-2 -> 1706 | B484: TP 5308 1 | D484: 1 | E484: 05308-1 | F484: 局域网生手组网宝典 | G484: 郭 玲文 | H484: 35.00 | I484: 37469 | J484: 8
F485: 程序开发人员进阶与提高黑皮书
A486: =ROW()-2 -> 1708 | B486: P- | C486: 3510 | D486: 1 | E486: 7900635106 | F486: Borland C++ Builder 程序设计（配光盘） | G486: 刘华 等 | H486: 55.00 | I486: 37073 | J486: 6
A487: =ROW()-2 -> 1709 | B487: P- | C487: 3778 | D487: 1 | E487: 7900637788 | F487: Borland Delphi 数据库应用开发技术与实例（配光盘） | G487: 张大年等 | H487: 55.00 | I487: 37438 | J487: 5
A488: =ROW()-2 -> 1710 | B488: TP | C488: 5298 | D488: 1 | E488: 05298-0 | F488: Borland Delphi程序设计 | G488: 蒋方帅 | H488: 43.00 | I488: 37347 | J488: 5
A489: =ROW()-2 -> 1711 | B489: P- | C489: 3776 | D489: 1 | E489: 7900637761 | F489: Borland Delphi多媒体应用开发技术与实例（配光盘） | G489: 韩冰 等 | H489: 55.00 | I489: 37257 | J489: 5
A490: =ROW()-2 -> 1712 | B490: P- | C490: 4138 | D490: 1 | E490: 7900641386 | F490: Borland Delphi网络应用开发技术与实例（配光盘） | G490: 黄超 等 | H490: 59.00 | I490: 37316 | J490: 5
A491: =ROW()-2 -> 1713 | B491: TP | C491: 5860 | D491: 1 | E491: 05860-1 | F491: Windows XP 网络信息服务应用实践与精通 | G491: 林山 | H491: 45.00 | I491: 37530 | J491: 6
F492: 平面设计人员进阶与提高黑皮书
A493: =ROW()-2 -> 1715 | B493: P- | C493: 4331 | D493: 2 | E493: 7900643311 | F493: Photoshop 7.0 平面设计绘创作技法 | G493: 李达 | H493: 49.00 | I493: 37500 | J493: 6
A494: =ROW()-2 -> 1716 | B494: TP | C494: 5691 | D494: 1 | E494: 05691-9 | F494: Photoshop 7.0 平面设计完全手册 | G494: 焦志平等 | H494: 40.00 | I494: 37500 | J494: 6
F495: 网页设计 e 典系列
A496: =ROW()-2 -> 1718 | B496: TP | C496: 4300 | D496: 1 | E496: 04300-0 | F496: Macromedia 网页设计梦之队 | G496: 东方人华 | H496: 46.90 | I496: 37012 | J496: 6
A497: =ROW()-2 -> 1719 | B497: TP | C497: 1336 | D497: 2 | E497: 01336-5 | F497: Dreamweaver 4 网页制作 | G497: 东方人华 | H497: 30 | I497: 37043 | J497: 8
A498: =ROW()-2 -> 1720 | B498: TP | C498: 4450 | D498: 1 | E498: 04450-3 | F498: Dreamweaver UltraDev 4 互动式网页数据库 | G498: 东方人华 | H498: 36.50 | I498: 37073 | J498: 7
A499: =ROW()-2 -> 1721 | B499: P- | C499: 3555 | D499: 1 | E499: 7900635556 | F499: FLASH 5 Action 程序设计（配光盘） | G499: 王 刚 | H499: 28.00 | I499: 37104 | J499: 10
A500: =ROW()-2 -> 1722 | B500: TP | C500: 1345 | D500: 2 | E500: 01345-4 | F500: Fireworks 4 网页图形制作 | G500: 东方人华 | H500: 33 | I500: 36982 | J500: 7
F501: .NET 框架开发人员参考手册
A502: =ROW()-2 -> 1724 | B502: TP | C502: 4286 | D502: 1 | E502: 04286-1 | F502: .NET 框架开发人员参考手册 系统构架分册 | G502: 张志学等 | H502: 64.00 | I502: 36982 | J502: 5
A503: =ROW()-2 -> 1725 | B503: TP | C503: 4286 | D503: 2 | E503: 04286-1 | F503: .NET 框架开发人员参考手册 数据库分册 | G503: 张志学 | H503: 64.00 | I503: 37043 | J503: 5
A504: =ROW()-2 -> 1726 | B504: TP | C504: 4286 | D504: 3 | E504: 04286-1 | F504: .NET 框架开发人员参考手册 网络和Internet分册 | G504: 张志学 | H504: 64.00 | I504: 37073 | J504: 4
A505: =ROW()-2 -> 1727 | B505: TP | C505: 4286 | D505: 4 | E505: 04286-1 | F505: .NET 框架开发人员参考手册 编程要素分册 | G505: 张志学 | H505: 64.00 | I505: 37135 | J505: 4
F506: 电脑平面设计丛书
A507: =ROW()-2 -> 1729 | B507: TP | C507: 3711 | D507: 1 | E507: 03711-6 | F507: CorelDRAW 平面设计 | G507: 马特 等 | H507: 28.00 | I507: 36647 | J507: 12
F508: 图象处理与多媒体制作范例集丛书
A509: =ROW()-2 -> 1731 | B509: TP | C509: 0872 | D509: 1 | E509: 00872-8 | F509: CorelDRAW 9 范例集 | G509: 张 雨 | H509: 29.00 | I509: 36770 | J509: 10
A510: =ROW()-2 -> 1732 | B510: TP | C510: 1230 | D510: 1 | E510: 01230-X | F510: FreeHand 范例集 | G510: 朱竟非等 | H510: 39.00 | I510: 36831 | J510: 9
A511: =ROW()-2 -> 1733 | B511: TP | C511: 1109 | D511: 1 | E511: 01109-5 | F511: Dreamweaver 网页制作范例集 | G511: 王 峰 等 | H511: 26.00 | I511: 36647 | J511: 10
A512: =ROW()-2 -> 1734 | B512: P- | C512: 2540 | D512: 1 | E512: 7900625402 | F512: Flash 4.0 范例集（配光盘） | G512: 刘继恩等 | H512: 34.00 | I512: 36739 | J512: 11
A513: =ROW()-2 -> 1735 | B513: P- | C513: 2538 | D513: 1 | E513: 7900625380 | F513: Authorware 5.0 范例集（配光盘） | G513: 马首敖等 | H513: 35.00 | I513: 36923 | J513: 10
A514: =ROW()-2 -> 1736 | B514: TP | C514: 1131 | D514: 1 | E514: 01131-1 | F514: Illustrator 范例集（配光盘） | G514: 苏忠 等 | H514: 20.00 | I514: 36708 | J514: 12
A515: =ROW()-2 -> 1737 | B515: TP | C515: 3195 | D515: 4 | E515: 03195-9 | F515: Photoshop 5 范例集 (配光盘） | G515: 张 雨 | H515: 39.00 | I515: 36617 | J515: 8
A516: =ROW()-2 -> 1738 | B516: P- | C516: 2541 | D516: 1 | E516: 7900625410 | F516: Photoshop 5.5 范例集 (配光盘） | G516: 前途工作室 | H516: 36.80 | I516: 36770 | J516: 9
A517: =ROW()-2 -> 1739 | B517: P- | C517: 3095 | D517: 1 | E517: 7900630953 | F517: Maya 3.0 范例集（配光盘） | G517: 杨蔚 等 | H517: 52.80 | I517: 36923 | J517: 7
A518: =ROW()-2 -> 1740 | B518: TP | C518: 1105 | D518: 1 | E518: 01105-2 | F518: PageMaker 6.5c 范例集 | G518: 顾铁成等 | H518: 29.00 | I518: 36800 | J518: 9
A519: =ROW()-2 -> 1741 | B519: P- | C519: 2281 | D519: 1 | E519: 7900622810 | F519: 3D Studio MAX 范例集（配光盘） | G519: 陆 水 | H519: 38 | I519: 36678 | J519: 9
F520: AutoCAD 开发技术丛书
A521: =ROW()-2 -> 1743 | B521: TP | C521: 0960 | D521: 1 | E521: 00960-0 | F521: AutoCAD 2000 VBA 开发技术 | G521: 张国宝 | H521: 30.00 | I521: 36800 | J521: 9
A522: =ROW()-2 -> 1744 | B522: TP | C522: 0702 | D522: 1 | E522: 00702-0 | F522: AutoCAD 2000 ARX 开发技术 | G522: 刘良华等 | H522: 42.00 | I522: 36800 | J522: 6
A523: =ROW()-2 -> 1745 | B523: TP | C523: 4447 | D523: 1 | E523: 04447-3 | F523: AutoCAD 2000 定制与 Visual LISP 开发技术 | G523: 李学志 | H523: 39.00 | I523: 37043 | J523: 7
F524: AutoCAD 2002 应用与开发系列
A525: =ROW()-2 -> 1747 | B525: TP | C525: 4353 | D525: 1 | E525: 04353-1 | F525: AutoCAD 2002/2000 VBA 开发指南 | G525: 李凤华 | H525: 42.00 | I525: 37012 | J525: 7
A526: =ROW()-2 -> 1748 | B526: TP | C526: 4654 | D526: 1 | E526: 04654-9 | F526: AutoCAD 2002/2000 Visual LISP 开发指南 | G526: 康 博 | H526: 62.00 | I526: 37135 | J526: 5
A527: =ROW()-2 -> 1749 | B527: P- | C527: 4314 | D527: 1 | E527: 7900643141 | F527: AutoCAD 权威技术支持（配光盘） | G527: 马力著 | H527: 45.00 | I527: 37438 | J527: 7
A528: =ROW()-2 -> 1750 | B528: TP | C528: 4926 | D528: 1 | E528: 04926-2 | F528: AutoCAD 2002 二次开发技术指南 | G528: 梁雪春等 | H528: 45.00 | I528: 37196 | J528: 6
A529: =ROW()-2 -> 1751 | B529: TP | C529: 4377 | D529: 1 | E529: 04377-9 | F529: AutoCAD 2002实用培训教程 | G529: 崔洪斌等 | H529: 46.00 | I529: 37469 | J529: 6
A530: =ROW()-2 -> 1752 | B530: TP | C530: 4782 | D530: 1 | E530: 04782-0 | F530: 中文版 AutoCAD 2002 高级应用技巧 | G530: 王爱民等 | H530: 45.00 | I530: 37135 | J530: 6
A531: =ROW()-2 -> 1753 | B531: TP | C531: 4879 | D531: 1 | E531: 04879-7 | F531: 中文版 AutoCAD 2002 机械图形设计 | G531: 黎广生 | H531: 36.00 | I531: 37334 | J531: 7
A532: =ROW()-2 -> 1754 | B532: TP | C532: 4578 | D532: 1 | E532: 04578-X | F532: AutoCAD 2002 中文版建筑图形设计 | G532: 白振刚等 | H532: 30.00 | I532: 37469 | J532: 10
A533: =ROW()-2 -> 1755 | B533: TP | C533: 4626 | D533: 1 | E533: 04626-3 | F533: AutoCAD 2002 中文版实用指南 | G533: 黎广生等 | H533: 56.00 | I533: 37500 | J533: 5
A534: =ROW()-2 -> 1756 | B534: TP | C534: 4466 | D534: 1 | E534: 04466-X | F534: AutoCAD 2002 三维图形设计 | G534: 崔洪斌等 | H534: 35.00 | I534: 37257 | J534: 8
A535: =ROW()-2 -> 1757 | B535: P- | C535: 4143 | D535: 1 | E535: 7900641432 | F535: AutoCAD 2002 建筑应用实例导学（配光盘） | G535: 陈克等 | H535: 44.00 | I535: 37530 | J535: 7
F536: AutoCAD 高级应用与开发丛书
A537: =ROW()-2 -> 1759 | B537: TP | C537: 5145 | D537: 1 | E537: 05145-3 | F537: AutoCAD 与3DS MAX精彩效果图设计 | G537: 陈健 | H537: 26.00 | I537: 37374 | J537: 10
A538: =ROW()-2 -> 1760 | B538: TP | C538: 5518 | D538: 1 | E538: 05518-1 | F538: AutoCAD 2002 定制与开发 | G538: 郭朝勇等 | H538: 42.00 | I538: 37438 | J538: 6
A539: =ROW()-2 -> 1761 | B539: TP | C539: 5128 | D539: 1 | E539: 05128-3 | F539: Visual Basic与AutoCAD 二次开发 | G539: 张晋西 | H539: 29.00 | I539: 37315 | J539: 10
F540: Mastercam 应用指导丛书
A541: =ROW()-2 -> 1763 | B541: TP | C541: 5035 | D541: 1 | E541: 05035-X | F541: Mastercam 8 实体设计应用指南 | G541: 周永俊 | H541: 12.00 | I541: 37469 | J541: 18
A542: =ROW()-2 -> 1764 | B542: TP | C542: 5149 | D542: 1 | E542: 05149-6 | F542: Mastercam V8 .1高手指路 | G542: 简琦昭 | H542: 39.00 | I542: 37469 | J542: 6
A543: =ROW()-2 -> 1765 | B543: TP | C543: 5034 | D543: 1 | E543: 05034-1 | F543: Mastercam应用指南：Mastercam 8铣削/车削应用指南 | G543: 周永俊 | H543: 24.00 | I543: 37347 | J543: 11
F544: 电脑美术设计师全面培训教程
A545: =ROW()-2 -> 1767 | B545: TP | C545: 4992 | D545: 1 | E545: 04992-0 | F545: 绘图经典――CorelDRAW+FreeHand | G545: 龚正伟等 | H545: 32.00 | I545: 37226 | J545: 8
A546: =ROW()-2 -> 1768 | B546: P- | C546: 4177 | D546: 1 | E546: 7900641777 | F546: 影像经典――3D Studio MAX | G546: 龚正伟等 | H546: 38.00 | I546: 37408 | J546: 8
A547: =ROW()-2 -> 1769 | B547: P- | C547: 4136 | D547: 1 | E547: 790064136X | F547: 建筑效果――3D Studio MAX+Photoshop（含盘） | G547: 龚正伟等 | H547: 38.00 | I547: 37438 | J547: 8
A548: =ROW()-2 -> 1770 | B548: TP | C548: 4885 | D548: 1 | E548: 04885-1 | F548: 图像处理大师――Photoshop | G548: 张璇等 | H548: 29.00 | I548: 37408 | J548: 9
A549: =ROW()-2 -> 1771 | B549: P- | C549: 4194 | D549: 1 | E549: 7900641947 | F549: 动感十足――flash | G549: 张璇等 | H549: 35.00 | I549: 37438 | J549: 9
F550: 3ds max 4.2 专家之路系列丛书
A551: =ROW()-2 -> 1773 | B551: P- | C551: 3758 | D551: 1 | E551: 637-58-3 | F551: 3ds max 4.2 实体造型专家之路（配光盘） | G551: 吉海滨 | H551: 35.00 | I551: 37406 | J551: 8
A552: =ROW()-2 -> 1774 | B552: P- | C552: 3762 | D552: 1 | E552: 7900637621 | F552: 3ds max 4.2 动画制作专家之路（配光盘） | G552: 杨 军 | H552: 35.00 | I552: 37196 | J552: 6
A553: =ROW()-2 -> 1775 | B553: P- | C553: 3763 | D553: 1 | E553: 790063763X | F553: 3ds max 4.2 建筑建模专家之路（配光盘） | G553: 刘晓东 | H553: 35.00 | I553: 37363 | J553: 7
A554: =ROW()-2 -> 1776 | B554: P- | C554: 3581 | D554: 1 | E554: 7900635815 | F554: 3ds max 4.2专家之路（配光盘） | G554: 么 远 | H554: 35.00 | I554: 37226 | J554: 8
F555: 笑傲3D Studio MAX R4.0系列丛书
A556: =ROW()-2 -> 1778 | B556: P- | C556: 3797 | D556: 4 | E556: 7900637974 | F556: 笑傲3D Studio MAX R4.0之造型篇 | G556: 张铭歧 | H556: 28.00 | I556: 37316 | J556: 9
F557: Office XP 专家之路系列丛书
A558: =ROW()-2 -> 1780 | B558: P- | C558: 3784 | D558: 1 | E558: 7900637842 | F558: 精通 Microsoft Excel 2002 中文版（配光盘） | G558: 曹晓刚等译 | H558: 98.00 | I558: 37257 | J558: 4
A559: =ROW()-2 -> 1781 | B559: P- | C559: 4103 | D559: 1 | E559: 7900641033 | F559: 精通 Microsoft Word 2002 中文版（配光盘） | G559: Mary Milluon | H559: 98.00 | I559: 37258 | J559: 4
A560: =ROW()-2 -> 1782 | B560: P- | C560: 4102 | D560: 1 | E560: 7900641025 | F560: 精通 Microsoft Office XP 中文版（配光盘） | G560: 智慧东方工作室译 | H560: 128.00 | I560: 37257 | J560: 3
A561: =ROW()-2 -> 1783 | B561: TP | C561: 5120 | D561: 1 | E561: 05120-8 | F561: 精通 Outlook 2002 中文版 | G561: 智慧东方工作室译 | H561: 98.00 | I561: 37257 | J561: 4
A562: =ROW()-2 -> 1784 | B562: P- | C562: 3785 | D562: 1 | E562: 7900637850 | F562: 精通 Microsoft FrontPage 2002 中文版（配光盘） | G562: 艾希亚公司译 | H562: 98.00 | I562: 2001.12 | J562: 4
F563: 计算机信息基础教育丛书
A564: =ROW()-2 -> 1786 | B564: TP | C564: 4989 | D564: 1 | E564: 04989-0 | F564: 五笔及汉字输入培训教程 | G564: 东方人华 | H564: 23.00 | I564: 37500 | J564: 9
A565: =ROW()-2 -> 1787 | B565: TP | C565: 4994 | D565: 1 | E565: 04994-7 | F565: 计算机办公应用培训教程 | G565: 东方人华 | H565: 22.00 | I565: 37408 | J565: 9
A566: =ROW()-2 -> 1788 | B566: TP | C566: 5024 | D566: 1 | E566: 05024-4 | F566: 计算机基础培训教程 | G566: 东方人华 | H566: 21.00 | I566: 37413 | J566: 9
A567: =ROW()-2 -> 1789 | B567: TP | C567: 4890 | D567: 1 | E567: 04890-8 | F567: Internet 培训教程 | G567: 东方人华 | H567: 23.00 | I567: 37469 | J567: 8
F568: 事半功倍系列丛书
A569: =ROW()-2 -> 1791 | B569: TP | C569: 4357 | D569: 1 | E569: 04357-4 | F569: Unix | G569: 叶丽彬译 | H569: 31.50 | I569: 37104 | J569: 9
A570: =ROW()-2 -> 1792 | B570: TP | C570: 4357 | D570: 2 | E570: 04357-4 | F570: XML | G570: 白俊涛译 | H570: 28.00 | I570: 37104 | J570: 10
A571: =ROW()-2 -> 1793 | B571: TP | C571: 4357 | D571: 3 | E571: 04357-4 | F571: HTML | G571: 孙巍 等译 | H571: 29.00 | I571: 37104 | J571: 9
A572: =ROW()-2 -> 1794 | B572: TP | C572: 4357 | D572: 4 | E572: 04357-4 | F572: Perl | G572: 刘昕 等译 | H572: 27.00 | I572: 37104 | J572: 11
A573: =ROW()-2 -> 1795 | B573: TP | C573: 4357 | D573: 5 | E573: 04357-4 | F573: Active Server Pages 3.0 | G573: 曹晓刚译 | H573: 28.00 | I573: 37104 | J573: 10
A574: =ROW()-2 -> 1796 | B574: TP | C574: 4357 | D574: 6 | E574: 04357-4 | F574: Linux | G574: 孙巍 译 | H574: 31.00 | I574: 37104 | J574: 9
A575: =ROW()-2 -> 1797 | B575: TP | C575: 4357 | D575: 7 | E575: 04357-4 | F575: JavaScript | G575: 侯 等译 | H575: 27.00 | I575: 37104 | J575: 10

A1: 肖 火 等译

A1: 彭松虎等译