F1: 计算机软件专业技术资格和水平考试用书系列
F2: 计算机软件专业技术资格和水平考试指定用书
A3: =ROW()-2 -> 600 | B3: TP | C3: 5380 | D3: 1 | E3: 05380-4 | F3: 2002 年度中国计算机软件专业技术资格和水平考试大纲 | G3: 信息产业部软考办 | H3: 5 | I3: 37408 | J3: 55
A4: =ROW()-2 -> 601 | B4: TP | C4: 4395 | D4: 1 | E4: 04395-7 | F4: 初级程序员教程 | G4: 刘英 等 | H4: 29.8 | I4: 37469 | J4: 9
A5: =ROW()-2 -> 602 | B5: TP | C5: 4371 | D5: 1 | E5: 04371-X | F5: 程序员教程 | G5: 王春森 | H5: 38 | I5: 37377 | J5: 7
A6: =ROW()-2 -> 603 | B6: TP | C6: 4409 | D6: 1 | E6: 04409-0 | F6: 系统设计师（高级程序员）教程 | G6: 王春森 | H6: 49 | I6: 37104 | J6: 6
A7: =ROW()-2 -> 604 | B7: TP | C7: 4310 | D7: 1 | E7: 04310-8 | F7: 网络程序员教程 | G7: 胡道元 | H7: 29.8 | I7: 37104 | J7: 10
A8: =ROW()-2 -> 605 | B8: TP | C8: 4306 | D8: 1 | E8: 04306-X | F8: 网络设计师教程 | G8: 胡道元 | H8: 48 | I8: 37043 | J8: 7
A9: =ROW()-2 -> 606 | B9: TP | C9: 5379 | D9: 1 | E9: 05379-1 | F9: 1999-2001年度初级程序员级试题分析与解答 | G9: 信息产业部软考办 | H9: 11 | I9: 37377 | J9: 25
A10: =ROW()-2 -> 607 | B10: TP | C10: 5401 | D10: 1 | E10: 05401-1 | F10: 1999～2001程序员级试题分析与解答 | G10: 信息产业部软考办 | H10: 11.5 | I10: 37377 | J10: 25
A11: =ROW()-2 -> 608 | B11: TP 5509 1 | D11: 1 | E11: 05509-2 | F11: 1999-2001年度系统分析员级试题分析与解答 | G11: 信息产业部软考办 | H11: 20 | I11: 37469 | J11: 15
A12: =ROW()-2 -> 609 | B12: TP | C12: 5432 | D12: 1 | E12: 05432-1 | F12: 2001年度网络程序员级和网络设计师级试题分析与解答 | G12: 信息产业部软考办 | H12: 13 | I12: 37377 | J12: 20
A13: =ROW()-2 -> 610 | B13: TP | C13: 4322 | D13: 1 | E13: 04322-1 | F13: 1999～2000 年度中国计算机软件专业技术资格和水平考试题集 | G13: 胡道元 | H13: 18 | I13: 37104 | J13: 16
A14: =ROW()-2 -> 611 | B14: TP | C14: 5400 | D14: 1 | E14: 05400-2 | F14: 1999-2001年度系统设计师（高级程序员）级试题分析与解答 | G14: 信息产业部软考办 | H14: 13 | I14: 37377 | J14: 20
E15: 计算机软件专业技术资格和水平考试辅导用书
A16: =ROW()-2 -> 613 | B16: TP | C16: 4652 | D16: 1 | E16: 04652-2 | F16: 网络程序员教程同步辅导 | G16: 郭学理 | H16: 26.00 | I16: 37438 | J16: 10
A17: =ROW()-2 -> 614 | B17: TP | C17: 5494 | D17: 1 | E17: 05494-1 | F17: 程序员教程同步辅导 | G17: 谢树煜主编 | H17: 39.00 | I17: 37438 | J17: 7
A18: =ROW()-2 -> 615 | B18: TP 5500 1 | D18: 1 | E18: 05500-6 | F18: 系统设计师（高级程序员）教程 | G18: 谢树煜主编 | H18: 46.00 | I18: 37408 | J18: 6
A19: =ROW()-2 -> 616 | B19: TP 5351 1 | D19: 1 | E19: 05351-1 | F19: 初级程序员教程同步辅导 | G19: 沈林兴主编 | H19: 23.00 | I19: 37408 | J19: 12
A20: =ROW()-2 -> 617 | B20: TP | C20: 4713 | D20: 1 | E20: 04713-8 | F20: 网络设计师 教程同步辅导 | G20: 郭学理 | H20: 29.00 | I20: 37104 | J20: 10
E21: 计算机软件专业技术资格和水平考试参考用书
A22: =ROW()-2 -> 619 | B22: TP | C22: 3153 | D22: 1 | E22: 03153-3 | F22: 计算机综合应用知识 (第2版) | G22: 罗晓沛等 | H22: 36.00 | I22: 37135 | J22: 6
A23: =ROW()-2 -> 620 | B23: TP | C23: 2480 | D23: 9 | E23: 02480-4 | F23: 计算机英语(第2版) (配光盘) | G23: 刘兆毓等 | H23: 39.50 | I23: 37337 | J23: 8
A24: =ROW()-2 -> 621 | B24: TP | C24: 2480 | D24: 5 | E24: 02480-4 | F24: 计算机英语(第2版) | G24: 刘兆毓等 | H24: 26.00 | I24: 37438 | J24: 8
E25: 计算机等级考试丛书(2002大纲)(谭浩强主编)
F26: 教程系列
A27: =ROW()-2 -> 624 | B27: TP | C27: 5040 | D27: 1 | E27: 05040-6 | F27: 计算机基础知识（一级）教程（Windows环境） | G27: 徐士良 | H27: 21.00 | I27: 37500 | J27: 12
A28: =ROW()-2 -> 625 | B28: TP | C28: 5269 | D28: 1 | E28: 05269-7 | F28: 计算机基础知识(二级)教程 | G28: 徐士良 | H28: 12.00 | I28: 37500 | J28: 18
A29: =ROW()-2 -> 626 | B29: TP | C29: 5526 | D29: 1 | E29: 05526-1 | F29: C 程序设计(二级)教程 | G29: 谭浩强等 | H29: 22.00 | I29: 37438 | J29: 10
A30: =ROW()-2 -> 627 | B30: TP | C30: 5529 | D30: 1 | E30: 05529-1 | F30: QBASIC程序设计（二级）教程 | G30: 谭浩强等 | H30: 26.00 | I30: 37469 | J30: 9
A31: =ROW()-2 -> 628 | B31: TP | C31: 5528 | D31: 1 | E31: 05528-1 | F31: FORTRAN 程序设计(二级)教程 | G31: 谭浩强等 | H31: 21.00 | I31: 37469 | J31: 10
A32: =ROW()-2 -> 629 | B32: TP | C32: 5527 | D32: 1 | E32: 05527-0 | F32: FoxBASE 程序设计(二级)教程 | G32: 史济民等 | H32: 14.00 | I32: 37469 | J32: 14
A33: =ROW()-2 -> 630 | B33: TP | C33: 5006 | D33: 1 | E33: 05006-1 | F33: Visual Basic程序设计（二级）教程 | G33: 陈志泊 | H33: 25.00 | I33: 37469 | J33: 8
A34: =ROW()-2 -> 631 | B34: TP | C34: 5177 | D34: 1 | E34: 05177-1 | F34: Visual FoxPro程序设计（二级）教程 | G34: 周山芙 | H34: 28.00 | I34: 37500 | J34: 9
F35: 辅导系列
A36: =ROW()-2 -> 633 | B36: TP | C36: 5475 | D36: 1 | E36: 05475-4 | F36: QBASIC程序设计(二级)辅导 | G36: 殷光复等 | H36: 30.00 | I36: 37408 | J36: 8
A37: =ROW()-2 -> 634 | B37: TP | C37: 5476 | D37: 1 | E37: 05476-2 | F37: C 程序设计(二级)辅导 | G37: 周海燕等 | H37: 29.00 | I37: 37500 | J37: 7
A38: =ROW()-2 -> 635 | B38: TP | C38: 5424 | D38: 1 | E38: 05424-X | F38: FORTRAN 程序设计(二级)辅导 | G38: 徐士良等 | H38: 29.00 | I38: 37408 | J38: 8
A39: =ROW()-2 -> 636 | B39: TP | C39: 5512 | D39: 1 | E39: 05512-2 | F39: FoxBASE程序设计(二级)辅导 | G39: 齐英杰等 | H39: 25.00 | I39: 37469 | J39: 10
F40: 样题汇编系列
A41: =ROW()-2 -> 638 | B41: TP | C41: 5572 | D41: 1 | E41: 05572-6 | F41: C 程序设计(二级)样题汇编 | G41: 鲍有文等 | H41: 15.00 | I41: 37500 | J41: 16
A42: =ROW()-2 -> 639 | B42: TP | C42: 5571 | D42: 1 | E42: 05571-8 | F42: QBASIC程序设计(二级)样题汇编 | G42: 周海燕等 | H42: 16.00 | I42: 37438 | J42: 14
A43: =ROW()-2 -> 640 | B43: TP | C43: 5530 | D43: 1 | E43: 05530-0 | F43: FoxBASE 程序设计(二级)样题汇编 | G43: 李广第等 | H43: 18.00 | I43: 37469 | J43: 12
F44: 全国计算机等级考试全真训练丛书
A45: =ROW()-2 -> 642 | B45: P- | C45: 3042 | D45: 1 | E45: 7900630422 | F45: 全国计算机等级考试（一级DOS）全真训练 （配光盘） | G45: 黄 蓉 | H45: 28.00 | I45: 37073 | J45: 10
A46: =ROW()-2 -> 643 | B46: P- | C46: 3040 | D46: 1 | E46: 7900630406 | F46: 全国计算机等级考试（一级B类）全真训练 （配软盘） | G46: 李 智 | H46: 25.00 | I46: 37073 | J46: 15
A47: =ROW()-2 -> 644 | B47: P- | C47: 3041 | D47: 1 | E47: 7900630414 | F47: 全国计算机等级考试（一级Win）全真训练 （配光盘） | G47: 王俊萍 | H47: 25.00 | I47: 37329 | J47: 16
A48: =ROW()-2 -> 645 | B48: P- | C48: 3062 | D48: 1 | E48: 7900630627 | F48: 全国计算机等级考试(二级QBASIC)全真训练 (配光盘) | G48: 成正祥等 | H48: 29.00 | I48: 37326 | J48: 10
A49: =ROW()-2 -> 646 | B49: P- | C49: 3060 | D49: 1 | E49: 7900630600 | F49: 全国计算机等级考试(二级Pascal )全真训练 (配软盘) | G49: 成正祥等 | H49: 32.00 | I49: 37196 | J49: 9
A50: =ROW()-2 -> 647 | B50: P- | C50: 3063 | D50: 1 | E50: 7900630635 | F50: 全国计算机等级考试（二级C语言）全真训练 （配光盘） | G50: 成正祥等 | H50: 37.00 | I50: 37349 | J50: 8
A51: =ROW()-2 -> 648 | B51: TP | C51: 5208 | D51: 1 | E51: 05208-5 | F51: 全国计算机等级考试（四级）全真训练) ――软件工程 | G51: 刘生平等 | H51: 28.00 | I51: 37502 | J51: 9
F52: MCP 微软专家认证考试培训教程
A53: =ROW()-2 -> 650 | B53: TP | C53: 3435 | D53: 1 | E53: 03435-4 | F53: 网络基础教程（配光盘）（第2版） | G53: 沈新国译 | H53: 78.00 | I53: 36526 | J53: 5
A54: =ROW()-2 -> 651 | B54: P- | C54: 3071 | D54: 1 | E54: 7900630716 | F54: 网络基础教程（配光盘）（第3版） | G54: 李晔等译 | H54: 79.00 | I54: 36831 | J54: 6
F55: 微软指定 MCSE 教材
A56: =ROW()-2 -> 653 | B56: P- | C56: 2575 | D56: 1 | E56: 7900625755 | F56: MCSE 制胜宝典 ―― MS Windows 2000 Server (配光盘） | G56: 萧湘工作室 | H56: 98.00 | I56: 37344 | J56: 4
A57: =ROW()-2 -> 654 | B57: TP | C57: 4040 | D57: 1 | E57: 04040-0 | F57: MCSE 制胜宝典 ―― MS Windows 2000 Active Directory 服务 | G57: 陈文杰等译 | H57: 79.00 | I57: 36831 | J57: 5
A58: =ROW()-2 -> 655 | B58: P- | C58: 3088 | D58: 1 | E58: 7900630880 | F58: MCSE 制胜宝典――网络基础 （配光盘） | G58: 萧湘工作室 | H58: 78.00 | I58: 36951 | J58: 5
A59: =ROW()-2 -> 656 | B59: P- | C59: 3525 | D59: 1 | E59: 7900635254 | F59: MCSE 制胜宝典――直通 Microsoft Windows 2000（配光盘） | G59: 东方人华 译 | H59: 132.00 | I59: 37104 | J59: 3
A60: =ROW()-2 -> 657 | B60: P- | C60: 3753 | D60: 1 | E60: 7900637532 | F60: MCSE 制胜宝典―― Microsoft Windows 2000目录服务基础结构设计（配光盘） | G60: 曹小刚等译 | H60: 40.00 | I60: 37226 | J60: 9
A61: =ROW()-2 -> 658 | B61: P- | C61: 3593 | D61: 1 | E61: 7900635939 | F61: MCSE 制胜宝典――从Windows NT 4.0 迁移到 Windows 2000（配光盘） | G61: 商丽媛等 | H61: 54.00 | I61: 37135 | J61: 7
A62: =ROW()-2 -> 659 | B62: P- | C62: 3037 | D62: 1 | E62: 7900630376 | F62: MCSE 制胜宝典――IIS 4.0 （配光盘） | G62: 石勇 等译 | H62: 58.00 | I62: 36982 | J62: 10
A63: =ROW()-2 -> 660 | B63: P- | C63: 3038 | D63: 1 | E63: 7900630384 | F63: MCSE 制胜宝典――Windows 2000 网络基础结构管理（配光盘） | G63: 陈萍 等译 | H63: 59.00 | I63: 36923 | J63: 7
A64: =ROW()-2 -> 661 | B64: P- | C64: 3798 | D64: 1 | E64: 7900637982 | F64: MCSE 制胜宝典――Microsoft Windows 2000 Advanced Server 群集服务（配光盘） | G64: 杨丹 等译 | H64: 49.00 | I64: 37257 | J64: 9
A65: =ROW()-2 -> 662 | B65: P- | C65: 3767 | D65: 1 | E65: 7900637672 | F65: MCSE 制胜宝典――Microsoft Windows 2000 网络基础结构设计（配光盘） | G65: 东方人华 译 | H65: 98.00 | I65: 37226 | J65: 4
A66: =ROW()-2 -> 663 | B66: P- | C66: 3716 | D66: 1 | E66: 7900637168 | F66: MCSE 制胜宝典――Microsoft Windows 2000 网络安全设计（配光盘） | G66: 黄波 等译 | H66: 78.00 | I66: 37389 | J66: 5
A67: =ROW()-2 -> 664 | B67: P- | C67: 3715 | D67: 1 | E67: 790063715X | F67: MCSE 制胜宝典――Microsoft Exchange 2000 Server 实现与管理（配光盘） | G67: 树军 等译 | H67: 98.00 | I67: 37135 | J67: 3
A68: =ROW()-2 -> 665 | B68: P- | C68: 3746 | D68: 1 | E68: 790063746X | F68: MCSE 制胜宝典――Microsoft SQL Server 2000 数据库设计与实现（配光盘） | G68: 孙巍 等译 | H68: 69.00 | I68: 37165 | J68: 5
A69: =ROW()-2 -> 666 | B69: P- | C69: 3754 | D69: 1 | E69: 7900637540 | F69: MCSE 制胜宝典――Microsoft SQL Server 2000 系统管理（配光盘） | G69: 高丽媛等译 | H69: 78.00 | I69: 37530 | J69: 5
A70: =ROW()-2 -> 667 | B70: P- | C70: 3082 | D70: 1 | E70: 7900630821 | F70: MCSE制胜宝典――Windows 2000 Professional (配光盘） | G70: 李娇娇等译 | H70: 88.00 | I70: 37412 | J70: 4
A71: =ROW()-2 -> 668 | B71: P- | C71: 4149 | D71: 1 | E71: 7900641491 | F71: MCSE 制胜宝典――Microsoft Windows 2000 Server 技术设计高效的Web解决方案（配光盘） | G71: 韩宏志 等译 | H71: 59.00 | I71: 37316 | J71: 10
A72: =ROW()-2 -> 669 | B72: P- | C72: 4116 | D72: 1 | E72: 7900641165 | F72: MCSE 制胜宝典――Microsoft ISA Server 2000（配光盘） | G72: 李良波等译 | H72: 58.00 | I72: 37316 | J72: 7
A73: =ROW()-2 -> 670 | B73: P- | C73: 4148 | D73: 1 | E73: 7900641483 | F73: MCSE 制胜宝典――Microsoft Exchange 2000 Server设计与部署 | G73: 黄开枝等译 | H73: 69.00 | I73: 37362 | J73: 6
A74: =ROW()-2 -> 671 | B74: P- | C74: 4193 | D74: 1 | E74: 7900641939 | F74: MCSE 制胜宝典 ―― MS BizTalk Server 2000 (配光盘） | G74: 萧湘工作室 | H74: 63.00 | I74: 37438 | J74: 7
A75: =ROW()-2 -> 672 | B75: P- | C75: 4343 | D75: 1 | E75: 7900643435 | F75: MCSA/MCSE制胜宝典 ―― Microsoft Windows2000 网络环境管理(配光盘) | G75: 李祥青等译 | H75: 79.00 | I75: 37500 | J75: 5
A76: =ROW()-2 -> 673 | B76: P- | C76: 4173 | D76: 1 | E76: 7900641-73-4 | F76: MCSE制胜宝典――Microsoft Windows XP Professional | G76: 朱堂良等译 | H76: 85.00 | I76: 37530 | J76: 5
F77: MCSE 官方模拟试题丛书
A78: =ROW()-2 -> 675 | B78: P- | C78: 3175 | D78: 1 | E78: 7900631755 | F78: MCSE 官方模拟试题――实现和管理 Microsoft Windows 2000目录服务基础结构(配光盘) | G78: 胡祺昊等译 | H78: 35.00 | I78: 37073 | J78: 11
A79: =ROW()-2 -> 676 | B79: P- | C79: 4182 | D79: 1 | E79: 7900641823 | F79: MCSE 官方模拟试题――Microsoft Windows XP Professional（配光盘） | G79: 李祥凯等译 | H79: 59.00 | I79: 37408 | J79: 6
A80: =ROW()-2 -> 677 | B80: P- | C80: 3194 | D80: 1 | E80: 7900631941 | F80: MCSE 官方模拟试题――实现和管理 Microsoft Windows 2000 网络基础结构（配光盘） | G80: 东方人华译 | H80: 35.00 | I80: 37104 | J80: 11
A81: =ROW()-2 -> 678 | B81: P- | C81: 3518 | D81: 1 | E81: 7900635181 | F81: MCSE 官方模拟试题――安装、配置和管理Microsoft Windows 2000 Professional （配光盘） | G81: 侯晓霞译 | H81: 39.00 | I81: 37104 | J81: 9
A82: =ROW()-2 -> 679 | B82: P- | C82: 3188 | D82: 1 | E82: 7900631887 | F82: MCSE 官方模拟试题――安装、配置和管理Microsoft Windows 2000 Server（配光盘） | G82: 张为普译 | H82: 42.00 | I82: 37104 | J82: 9
A83: =ROW()-2 -> 680 | B83: P- | C83: 3742 | D83: 1 | E83: 7900637427 | F83: MCSE 官方模拟试题――Microsoft SQL Server 2000 系统管理（配光盘） | G83: 东方人华译 | H83: 39.00 | I83: 37165 | J83: 10
A84: =ROW()-2 -> 681 | B84: P- | C84: 3755 | D84: 1 | E84: 7900637559 | F84: MCSE 官方模拟试题――Microsoft Exchange 2000 Server 系统管理（配光盘） | G84: 东方人华译 | H84: 42.00 | I84: 37196 | J84: 10
A85: =ROW()-2 -> 682 | B85: P- | C85: 3789 | D85: 1 | E85: 7900637893 | F85: MCSE 官方模拟试题――Microsoft Windows 2000 目录服务基础结构设计（配光盘） | G85: 常晓波译 | H85: 59.00 | I85: 37257 | J85: 6
A86: =ROW()-2 -> 683 | B86: P- | C86: 4115 | D86: 1 | E86: 7900641157 | F86: MCSE 官方模拟试题――Microsoft Windows 2000 网络基础结构设计（配光盘） | G86: 微软公司 | H86: 58.00 | I86: 37288 | J86: 7
A87: =ROW()-2 -> 684 | B87: P- | C87: 4161 | D87: 1 | E87: 7900641610 | F87: MCSE 官方模拟试题――Microsoft Windows 2000网 络安全设计（配光盘） | G87: 微软公司 | H87: 59.00 | I87: 37347 | J87: 6
A88: =ROW()-2 -> 685 | B88: P- | C88: 3081 | D88: 1 | E88: 7900630813 | F88: SQL Server 7.0 数据库设计与实现（配光盘） | G88: 汉扬天地 | H88: 60.00 | I88: 37012 | J88: 6
A89: =ROW()-2 -> 686 | B89: P- | C89: 3069 | D89: 1 | E89: 7900630694 | F89: 管理 SQL Server 7.0 （配光盘） | G89: 健莲工作室 | H89: 52.00 | I89: 36861 | J89: 8
F90: MCSE 学习指南系列
A91: =ROW()-2 -> 688 | B91: TP | C91: 3442 | D91: 2 | E91: 03442-7 | F91: Windows 98 MCSE 学习指南 | G91: 陈武 译 | H91: 51.00 | I91: 36617 | J91: 6
A92: =ROW()-2 -> 689 | B92: TP | C92: 3771 | D92: 1 | E92: 03771-X | F92: Windows NT Workstation 4.0 MCSE 学习指南 | G92: 刘春等译 | H92: 58.00 | I92: 36526 | J92: 6
A93: =ROW()-2 -> 690 | B93: TP | C93: 3577 | D93: 2 | E93: 03577-6 | F93: IIS 4.0 MCSE 学习指南 | G93: 司罗 译 | H93: 34.80 | I93: 36770 | J93: 8
A94: =ROW()-2 -> 691 | B94: GP | C94: 3596 | D94: 1 | E94: 03596-2 | F94: Windows NT Server 4.0 (企业版）MCSE 学习指南(CD-ROM) | H94: 60.00 | I94: 36586 | J94: 25
A95: =ROW()-2 -> 692 | B95: GP | C95: 3616 | D95: 1 | E95: 03616-0 | F95: Windows NT Server 4.0 MCSE 学习指南(CD-ROM) | H95: 60.00 | I95: 36586 | J95: 25
A96: =ROW()-2 -> 693 | B96: GP | C96: 3771 | D96: 1 | E96: 03771-X | F96: Windows NT Workstation 4.0 MCSE 学习指南(CD-ROM) | H96: 60.00 | I96: 36586 | J96: 25
A97: =ROW()-2 -> 694 | B97: GP | C97: 3442 | D97: 1 | E97: 03442-7 | F97: Windows 98 MCSE 学习指南(CD-ROM) | H97: 60.00 | I97: 36465 | J97: 25
A98: =ROW()-2 -> 695 | B98: GP | C98: 3497 | D98: 1 | E98: 03497-4 | F98: 网络基础 MCSE 学习指南(CD-ROM) | H98: 60.00 | I98: 36465 | J98: 25
A99: =ROW()-2 -> 696 | B99: GP | C99: 3577 | D99: 1 | E99: 03577-6 | F99: IIS 4.0 MCSE 学习指南(CD-ROM) | H99: 60.00 | I99: 36465 | J99: 25
F100: CISCO 丛书 (英文影印版 )
A101: =ROW()-2 -> 698 | B101: TP | C101: 3462 | D101: 2 | E101: 03462-1 | F101: CISCO 路由器配置导论 (Introduction to Cisco Router Configuration) | G101: Laura Chappell | H101: 53.00 | I101: 37257 | J101: 5
A102: =ROW()-2 -> 699 | B102: TP | C102: 3456 | D102: 3 | E102: 03456-7 | F102: IP 路由技术基础 (IP Routing Primer) | G102: Robert Wright | H102: 30.00 | I102: 36617 | J102: 9
A103: =ROW()-2 -> 700 | B103: TP | C103: 2949 | D103: 2 | E103: 02949-0 | F103: TCP/IP 路由技术 卷1 (Routing TCP/IP) | G103: Jeff Doyle | H103: 89.00 | I103: 37500 | J103: 3
A104: =ROW()-2 -> 701 | B104: TP | C104: 3493 | D104: 1 | E104: 03493-1 | F104: 网络互联排错手册 (Internetworking Troubleshooting Handbook) | G104: H.Kim Lew | H104: 69.00 | I104: 36982 | J104: 4
A105: =ROW()-2 -> 702 | B105: TP | C105: 1036 | D105: 1 | E105: 01036-6 | F105: 网络设计与个案分析 （Network Design and Case Studies) | G105: Cisco Systems | H105: 75.00 | I105: 36557 | J105: 3
A106: =ROW()-2 -> 703 | B106: TP | C106: 1094 | D106: 1 | E106: 01094-3 | F106: Cisco 高级路由器配置技术 （Adveanced Cisco Router Configuration) | G106: Laura Chappell | H106: 58.00 | I106: 36526 | J106: 4
A107: =ROW()-2 -> 704 | B107: TP | C107: 3660 | D107: 2 | E107: 03660-8 | F107: IP 路由技术原理 (IP Routing Fundamentals) | G107: Mark A.Sportack | H107: 47.00 | I107: 36617 | J107: 5
A108: =ROW()-2 -> 705 | B108: TP | C108: 1093 | D108: 1 | E108: 01093-5 | F108: Internet 路由技术 （Internet Routing Architectures) | G108: Bassam Halabi | H108: 44.00 | I108: 36831 | J108: 6
A109: =ROW()-2 -> 706 | B109: P- | C109: 2218 | D109: 2 | E109: 7900622181 | F109: CCNA 资格认证考试及培训必读 (配光盘） （CCNA Exam Certification Guide) | G109: Wendell Odom | H109: 65.00 | I109: 36739 | J109: 5
F110: 4.培训
F111: 计算机技术系列培训教材
A112: =ROW()-2 -> 709 | B112: TP | C112: 3453 | D112: 1 | E112: 03453-9 | F112: 软件工程初级培训教程 | G112: 郑人杰 | H112: 29.5 | I112: 36373 | J112: 10
A113: =ROW()-2 -> 710 | B113: TP | C113: 3231 | D113: 2 | E113: 03231-9 | F113: 软件工程 中级培训教程 | G113: 郑人杰 | H113: 49 | I113: 36404 | J113: 6
A114: =ROW()-2 -> 711 | B114: TP | C114: 3534 | D114: 2 | E114: 03534-2 | F114: 软件工程高级培训教程 | G114: 郑人杰 | H114: 37 | I114: 36373 | J114: 8
A115: =ROW()-2 -> 712 | B115: TP | C115: 3550 | D115: 2 | E115: 03550-4 | F115: 数据库技术初级培训教程 | G115: 罗晓沛等 | H115: 26 | I115: 36892 | J115: 10
A116: =ROW()-2 -> 713 | B116: TP | C116: 3528 | D116: 2 | E116: 03528-1 | F116: 数据库技术中级培训教程 | G116: 罗晓沛等 | H116: 38 | I116: 36465 | J116: 8
A117: =ROW()-2 -> 714 | B117: TP | C117: 3634 | D117: 2 | E117: 03634-9 | F117: 数据库技术高级培训教程 | G117: 罗晓沛等 | H117: 46 | I117: 36465 | J117: 7
A118: =ROW()-2 -> 715 | B118: TP | C118: 3415 | D118: 3 | E118: 03415-X | F118: 计算机网络初级培训教程 | G118: 胡道元 | H118: 19.00 | I118: 37288 | J118: 13
A119: =ROW()-2 -> 716 | B119: TP | C119: 3446 | D119: 3 | E119: 03446-X | F119: 计算机网络中级培训教程 | G119: 胡道元 | H119: 20.00 | I119: 36951 | J119: 12
A120: =ROW()-2 -> 717 | B120: TP | C120: 3574 | D120: 2 | E120: 03574-1 | F120: 计算机网络高级培训教程 | G120: 胡道元 | H120: 34.00 | I120: 36951 | J120: 9
A121: =ROW()-2 -> 718 | B121: TP | C121: 3457 | D121: 3 | E121: 03457-5 | F121: 多媒体技术初级培训教程 | G121: 钟玉琢 | H121: 29.00 | I121: 37288 | J121: 10
A122: =ROW()-2 -> 719 | B122: TP | C122: 3480 | D122: 2 | E122: 03480-X | F122: 多媒体技术中级培训教程 | G122: 钟玉琢 | H122: 22.00 | I122: 37288 | J122: 12
A123: =ROW()-2 -> 720 | B123: TP | C123: 3416 | D123: 3 | E123: 03416-8 | F123: 多媒体技术高级培训教程 | G123: 钟玉琢 | H123: 55 | I123: 36373 | J123: 5
F124: 公务员电脑培训教程系列
A125: =ROW()-2 -> 722 | B125: TP | C125: 1134 | D125: 1 | E125: 01134-6 | F125: 公务员电脑文字处理培训教程 | G125: 庄盛珠 | H125: 29.00 | I125: 36800 | J125: 9
A126: =ROW()-2 -> 723 | B126: TP | C126: 1134 | D126: 2 | E126: 01134-6 | F126: 公务员电脑表格处理培训教程 | G126: 王旭升 | H126: 29.00 | I126: 36708 | J126: 9
A127: =ROW()-2 -> 724 | B127: TP | C127: 1134 | D127: 3 | E127: 01134-6 | F127: 公务员上网培训教程 | G127: 林章波等 | H127: 23.00 | I127: 36861 | J127: 12
A128: =ROW()-2 -> 725 | B128: TP | C128: 3685 | D128: 4 | E128: 03685-3 | F128: 公务员电脑培训教程 （Windows98 Office 97 Internet) | G128: 文信达 | H128: 30.00 | I128: 37257 | J128: 9
A129: =ROW()-2 -> 726 | B129: TP | C129: 1348 | D129: 1 | E129: 01348-9 | F129: 公务人员电脑培训教程 Win Me | G129: 东方人华 | H129: 30.00 | I129: 36951 | J129: 10
F130: 国家公务员培训教材
A131: =ROW()-2 -> 728 | B131: TP | C131: 4929 | D131: 1 | E131: 04929-7 | F131: 信息技术与电子政务 | G131: 北京市人事局 | H131: 30.00 | I131: 37500 | J131: 9
F132: 全国现代制造技术应用软件课程远程培训教材
A133: =ROW()-4 -> 728 | B133: P- | C133: 4350 | D133: 1 | E133: 7900643508 | F133: 数控工艺培训教程(数控铣部分) | G133: 杨伟群 | H133: 36.00 | I133: 37500 | J133: 10
F134: 新东方电脑标准培训教材
A135: =ROW()-2 -> 732 | B135: TP | C135: 4518 | D135: 1 | E135: 04518-6 | F135: 办公软件专家系列丛书――Internet Explorer 5.5 & FrontPage 实用教程 | G135: 张剑悦 | H135: 29.00 | I135: 37257 | J135: 11
A136: =ROW()-2 -> 733 | B136: TP | C136: 4520 | D136: 1 | E136: 04520-8 | F136: 办公软件专家系列丛书――Word 实用教程 | G136: 贾燕枫等 | H136: 38.00 | I136: 37073 | J136: 9
A137: =ROW()-2 -> 734 | B137: TP | C137: 4521 | D137: 1 | E137: 04521-6 | F137: 办公软件专家系列丛书――Excel 实用教程 | G137: 何 丰 | H137: 33.00 | I137: 37073 | J137: 10
A138: =ROW()-2 -> 735 | B138: TP | C138: 4522 | D138: 1 | E138: 04522-4 | F138: 办公软件专家系列丛书――PowerPoint 实用教程 | G138: 贾燕枫 | H138: 19.00 | I138: 37073 | J138: 15
A139: =ROW()-2 -> 736 | B139: TP | C139: 4519 | D139: 1 | E139: 04519-4 | F139: 办公软件专家系列丛书――Windows 2000 Professional 实用教程 | G139: 王 宁 | H139: 34.00 | I139: 37500 | J139: 9
A140: =ROW()-2 -> 737 | B140: TP | C140: 4572 | D140: 1 | E140: 04572-0 | F140: 网络工程师系列丛书――Windows 2000 活动目录 | G140: 殷 强 | H140: 26.00 | I140: 37073 | J140: 10
A141: =ROW()-2 -> 738 | B141: TP | C141: 4585 | D141: 1 | E141: 04585-2 | F141: 网络工程师系列丛书――Windows 2000 网络基础 | G141: 钱 强 | H141: 28.00 | I141: 37104 | J141: 11
A142: =ROW()-2 -> 739 | B142: TP | C142: 4725 | D142: 1 | E142: 04725-1 | F142: 网络工程师系列丛书――Windows 2000 网络服务 | G142: 李伟东 | H142: 42.00 | I142: 37337 | J142: 8
A143: =ROW()-2 -> 740 | B143: TP | C143: 4830 | D143: 1 | E143: 04830-4 | F143: 网络工程师系列丛书――Windows 2000 Server 配置与管理 | G143: 施伟光等 | H143: 31.00 | I143: 37288 | J143: 10
A144: =ROW()-2 -> 741 | B144: TP | C144: 4672 | D144: 1 | E144: 04672-7 | F144: 网络工程师系列丛书――RedHat 7.0 安装配置与管理 | G144: 梁如军 | H144: 67.00 | I144: 37408 | J144: 5
A145: =ROW()-2 -> 742 | B145: TP | C145: 4671 | D145: 1 | E145: 04671-9 | F145: 网络工程师系列丛书――Exchange 2000 Server 配置与管理 | G145: 金 悦 | H145: 34.00 | I145: 37135 | J145: 9
A146: =ROW()-2 -> 743 | B146: TP | C146: 5347 | D146: 1 | E146: 05347-2 | F146: 网络工程师系列丛书――ISA配置与管理 | G146: 邱亮 等 | H146: 25.00 | I146: 37364 | J146: 13
A147: =ROW()-2 -> 744 | B147: TP | C147: 4725 | D147: 1 | E147: 047251 | F147: 网络工程师系列丛书――Windows 2000网络服务 | G147: 李伟东 | H147: 42.00 | I147: 37469 | J147: 8
A148: =ROW()-2 -> 745 | B148: TP | C148: 5741 | D148: 1 | E148: 05741-9 | F148: Apache 服务器配置与管理 | G148: 新东方 | H148: 21.00 | I148: 37500 | J148: 13
A149: =ROW()-2 -> 746 | B149: P- | C149: 3588 | D149: 1 | E149: 7900635882 | F149: 软件程序员系列丛书――网页编程基础 （配光盘） | G149: 石志国 | H149: 32.00 | I149: 37316 | J149: 12
A150: =ROW()-2 -> 747 | B150: TP | C150: 4783 | D150: 1 | E150: 04783-9 | F150: 软件程序员系列丛书――ASP 动态网站编程 | G150: 石志国 | H150: 35.00 | I150: 37469 | J150: 9
A151: =ROW()-2 -> 748 | B151: TP | C151: 4911 | D151: 1 | E151: 049111-4 | F151: 软件程序员系列丛书――XML 程序设计 | G151: 栗松涛 | H151: 40.00 | I151: 37196 | J151: 8
A152: =ROW()-2 -> 749 | B152: TP | C152: 5014 | D152: 1 | E152: 05014-7 | F152: 软件程序员系列丛书――PHP 4.0 与 MySQL 动态网站编程 | G152: 冯燕奎 | H152: 35.00 | I152: 37226 | J152: 9
A153: =ROW()-2 -> 750 | B153: P- | C153: 3587 | D153: 1 | E153: 7900635874 | F153: 电脑美术系列丛书――Fireworks 4.0 网页图象设计（配光盘） | G153: 沈晓春 | H153: 46.00 | I153: 37105 | J153: 8
A154: =ROW()-2 -> 751 | B154: TP | C154: 4656 | D154: 1 | E154: 04656-5 | F154: 电脑美术系列丛书――Photoshop 6.0 网页图象 设计 | G154: 刘鸿 等 | H154: 25.00 | I154: 37165 | J154: 12
A155: =ROW()-2 -> 752 | B155: TP | C155: 5059 | D155: 1 | E155: 05059-7 | F155: 电脑美术系列丛书――Flash5.0网页动画设计 | G155: 沈晓春 | H155: 28.00 | I155: 37500 | J155: 11
A156: =ROW()-2 -> 753 | B156: P- | C156: 3572 | D156: 1 | E156: 7900635726 | F156: 电脑美术系列丛书――Dreamweaver 4.0 网页设计 （配光盘） | G156: 白 煜 | H156: 36.00 | I156: 37257 | J156: 10
F157: 计算机综合培训教程系列丛书
A158: =ROW()-2 -> 755 | B158: TP | C158: 4516 | D158: 1 | E158: 04516-X | F158: 网页制作综合培训教程――Flash 5.0 Dreamweaver 4.0 Fireworks 4.0 | G158: 高清风 | H158: 27.00 | I158: 37288 | J158: 8
A159: =ROW()-2 -> 756 | B159: TP | C159: 5532 | D159: 1 | E159: 05532-1 | F159: Internet 实用综合培训教程 | G159: 苏武荣主编 | H159: 29.00 | I159: 37438 | J159: 10
A160: =ROW()-2 -> 757 | B160: TP | C160: 4552 | D160: 1 | E160: 04552-6 | F160: 平面设计综合培训教程 | G160: 江燕飞 | H160: 34.00 | I160: 37104 | J160: 7
A161: =ROW()-2 -> 758 | B161: TP | C161: 5558 | D161: 1 | E161: 05558-0 | F161: 排版软件四合一短期速成培训教程 | G161: 马晓敏等 | H161: 32.00 | I161: 37469 | J161: 9
F162: 微软培训教材系列
A163: =ROW()-2 -> 760 | B163: P- | C163: 3011 | D163: 1 | E163: 7900630112 | F163: MS VC++ 开发教程（配光盘） | G163: 博彦公司 | H163: 42.00 | I163: 36982 | J163: 8
A164: =ROW()-2 -> 761 | B164: P- | C164: 3106 | D164: 1 | E164: 7900631062 | F164: Access 开发教程 （配光盘） | G164: 博彦公司 | H164: 42.00 | I164: 37104 | J164: 8
A165: =ROW()-2 -> 762 | B165: P- | C165: 3010 | D165: 1 | E165: 7900630104 | F165: MS VB++ 开发教程（配光盘） | G165: 博彦公司 | H165: 40.00 | I165: 36800 | J165: 8
A166: =ROW()-2 -> 763 | B166: P- | C166: 3014 | D166: 1 | E166: 7900630147 | F166: MS Visual J++ 开发教程（配光盘） | G166: 博彦公司 | H166: 39.00 | I166: 36800 | J166: 10
A167: =ROW()-2 -> 764 | B167: P- | C167: 3016 | D167: 1 | E167: 7900630163 | F167: MS Visual InterDev 开发教程（配光盘） | G167: 博彦公司 | H167: 39.00 | I167: 36800 | J167: 8
A168: =ROW()-2 -> 765 | B168: P- | C168: 3049 | D168: 1 | E168: 790063049X | F168: MS Windows NT 网络管理教程（配光盘） | G168: 博彦公司 | H168: 39.00 | I168: 37316 | J168: 8
A169: =ROW()-2 -> 766 | B169: P- | C169: 3048 | D169: 1 | E169: 7900630481 | F169: MS Windows NT 核心技术教程（配光盘） | G169: 博彦公司 | H169: 42.00 | I169: 36861 | J169: 9
A170: =ROW()-2 -> 767 | B170: P- | C170: 3012 | D170: 1 | E170: 7900630120 | F170: MS Office 2000 中文版培训教程（配光盘） | G170: 博彦公司 | H170: 40.00 | I170: 37104 | J170: 8
A171: =ROW()-2 -> 768 | B171: P- | C171: 3050 | D171: 1 | E171: 7900630503 | F171: 网络基础培训教程（配光盘） | G171: 博彦公司 | H171: 38.00 | I171: 36831 | J171: 10
A172: =ROW()-2 -> 769 | B172: TP | C172: 1518 | D172: X | E172: 01518-X | F172: 微软培训与认证系列教材 Implementing and Administering Microsoft Windows 2000 Directory Services | G172: 微软公司 | H172: 180.00 | I172: 37257
F173: 微软 Office 产品组推荐短训教材
A174: =ROW()-2 -> 771 | B174: TP | C174: 4536 | D174: 1 | E174: 04536-4 | F174: Office XP 中文版快捷教程 | G174: 东方人华 | H174: 20.00 | I174: 37135 | J174: 10
A175: =ROW()-2 -> 772 | B175: TP | C175: 4536 | D175: 2 | E175: 04536-4 | F175: PowerPoint 20002中文版快捷教程 | G175: 东方人华 | H175: 20.00 | I175: 37135 | J175: 12
A176: =ROW()-2 -> 773 | B176: TP | C176: 4536 | D176: 5 | E176: 04536-4 | F176: FrontPage 2002 中文版快捷教程 | G176: 东方人华 | H176: 20.00 | I176: 37073 | J176: 12
A177: =ROW()-2 -> 774 | B177: TP | C177: 4536 | D177: 3 | E177: 04536-4 | F177: Word 2002 中文版快捷教程 | G177: 东方人华 | H177: 20.00 | I177: 37135 | J177: 10
A178: =ROW()-2 -> 775 | B178: TP | C178: 4536 | D178: 4 | E178: 04536-5 | F178: Excel 2002 中文版快捷教程 | G178: 东方人华 | H178: 20.00 | I178: 37135 | J178: 15
A179: =ROW()-2 -> 776 | B179: TP | C179: 5660 | D179: 1 | E179: 05660-1 | F179: Windows XP 中文版快捷教程 | G179: 东方人华 | H179: 28.00 | I179: 37438 | J179: 8
A180: =ROW()-2 -> 777 | B180: TP | C180: 5839 | D180: 1 | E180: 05839-3 | F180: Windows XP+Office XP中文版快捷教程 | G180: 东方人华 | H180: 28.00 | I180: 37500 | J180: 8
F181: MCSD 培训教程
A182: =ROW()-2 -> 779 | B182: P- | C182: 3108 | D182: 1 | E182: 7900631089 | F182: Visual C++6.0 桌面应用程序开发 | G182: 魏星 等译 | H182: 75.00 | I182: 36923 | J182: 5
A183: =ROW()-2 -> 780 | B183: P- | C183: 3507 | D183: 1 | E183: 7900635076 | F183: Visual Basic 6.0 分布式应用程序开发 | G183: 李晔 等译 | H183: 58.00 | I183: 37196 | J183: 6
A184: =ROW()-2 -> 781 | B184: P- | C184: 3120 | D184: 1 | E184: 7900631208 | F184: Visual InterDev 6.0 Web 应用程序开发 （配光盘） | G184: 李晔 译 | H184: 58.00 | I184: 37165 | J184: 6
F185: Autodesk 官方培训教程系列（影印版）
A186: =ROW()-2 -> 783 | B186: P- | C186: 4346 | D186: 1 | E186: 790064346X | F186: AutoCAD 2002 Level 1 & Update Official Training Courseware (AutoCAD 2002 专业一级与新功能培训教程 配光盘） | G186: Autodesk公司 | H186: 60.00 | I186: 37469 | J186: 4
F187: ACCD 设计师系列丛书
A188: =ROW()-2 -> 785 | B188: TP | C188: 1329 | D188: 1 | E188: 01329-2 | F188: Illustrator 9.0 培训教程 | G188: 王晓亮 | H188: 30.00 | I188: 37257 | J188: 8
A189: =ROW()-2 -> 786 | B189: P- | C189: 3583 | D189: 1 | E189: 7900635831 | F189: Photoshop 6.0 培训教程 （配光盘） | G189: 李 涛 | H189: 43.00 | I189: 37196 | J189: 6
A190: =ROW()-2 -> 787 | B190: P- | C190: 3179 | D190: 1 | E190: 7900631798 | F190: Photoshop 6.0 中文版 培训教程 （配光盘） | G190: 李 涛 | H190: 44.00 | I190: 37358 | J190: 6
A191: =ROW()-2 -> 788 | B191: P- | C191: 3532 | D191: 1 | E191: 7900635327 | F191: After Effects 4.1 培训教程（配光盘） | G191: 秦化雨等 | H191: 31.00 | I191: 37073 | J191: 10
A192: =ROW()-2 -> 789 | B192: TP | C192: 4474 | D192: 1 | E192: 04474-0 | F192: Acrobat 4.0 中文版培训手册 | G192: 邵 喃 | H192: 23.00 | I192: 37043 | J192: 10
A193: =ROW()-2 -> 790 | B193: TP | C193: 4392 | D193: 1 | E193: 04392-2 | F193: PageMaker 6.5C 培训手册 | G193: 邵 喃 | H193: 38.00 | I193: 37333 | J193: 6
F194: 微软培训教程
A195: =ROW()-2 -> 792 | B195: P- | C195: 3002 | D195: 1 | E195: 7900630023 | F195: MS Windows 2000 Professional 中文版进阶教程 （配光盘） | G195: 东庭 等译 | H195: 30.00 | I195: 36800 | J195: 17
A196: =ROW()-2 -> 793 | B196: P- | C196: 2582 | D196: 1 | E196: 7900625828 | F196: MS Windows 2000 Professional 中文版基础教程 （配光盘） | G196: 东 庭等译 | H196: 28.00 | I196: 36831 | J196: 20
A197: =ROW()-2 -> 794 | B197: P- | C197: 3019 | D197: 1 | E197: 7900630198 | F197: MS Access 2000 中文版基础教程（配光盘） | G197: 东方人华 | H197: 30.00 | I197: 36800 | J197: 17
A198: =ROW()-2 -> 795 | B198: P- | C198: 2581 | D198: 1 | E198: 790062581X | F198: MS Access 2000 中文版进阶教程（配光盘） | G198: 林洁等译 | H198: 38.00 | I198: 36800 | J198: 12
A199: =ROW()-2 -> 796 | B199: P- | C199: 3009 | D199: 1 | E199: 7900630090 | F199: MS FrontPage 2000 中文版基础教程（配光盘） | G199: 崔伟等译 | H199: 30.00 | I199: 36800 | J199: 16
A200: =ROW()-2 -> 797 | B200: P- | C200: 3003 | D200: 1 | E200: 7900630031 | F200: MS FrontPage 2000 中文版进阶教程（配光盘） | G200: 孙晓东译 | H200: 30.00 | I200: 36831 | J200: 16
A201: =ROW()-2 -> 798 | B201: P- | C201: 3092 | D201: 1 | E201: 7900630929 | F201: MS Word 2000中文版进阶教程(配光盘) | G201: 东庭 译 | H201: 35.00 | I201: 36892 | J201: 13
A202: =ROW()-2 -> 799 | B202: P- | C202: 3086 | D202: 1 | E202: 7900630864 | F202: MS Excel 2000 中文版进阶教程（配光盘） | G202: 杜朝 译 | H202: 29.00 | I202: 36892 | J202: 15
A203: =ROW()-2 -> 800 | B203: P- | C203: 3078 | D203: 1 | E203: 7900630872 | F203: MS Outlook 2000 中文版基础教程（配光盘） | G203: 东方人华 | H203: 32.00 | I203: 36892 | J203: 14
A204: =ROW()-2 -> 801 | B204: P- | C204: 3084 | D204: 1 | E204: 7900630848 | F204: MS Outlook 2000 中文版进阶教程（配光盘） | G204: 东方人华 | H204: 28.00 | I204: 36892 | J204: 15
A205: =ROW()-2 -> 802 | B205: P- | C205: 3036 | D205: 1 | E205: 7900630368 | F205: MS Excel 2000 中文版基础教程（配光盘） | G205: 付东云译 | H205: 25.00 | I205: 36861 | J205: 16
F206: CCTV 电视讲座教材
F207: 迎接新世纪――计算机技能培训丛书（谭浩强主编）
A208: =ROW()-2 -> 805 | B208: TP | C208: 3214 | D208: 6 | E208: 03214-9 | F208: Windows 98 中文版操作系统 | G208: 王世忠 | H208: 19.00 | I208: 37135 | J208: 15
A209: =ROW()-2 -> 806 | B209: TP | C209: 3116 | D209: 6 | E209: 03116-9 | F209: Internet 上网与使用 | G209: 陶文星等 | H209: 16.00 | I209: 36739 | J209: 16
A210: =ROW()-2 -> 807 | B210: TP | C210: 3146 | D210: 4 | E210: 03146-0 | F210: HTML网页制作 | G210: 王映雪等 | H210: 10.00 | I210: 36770 | J210: 25
A211: =ROW()-2 -> 808 | B211: TP | C211: 3176 | D211: 4 | E211: 03176-2 | F211: Internet Explorer 浏览器 | G211: 鲍泓 等 | H211: 17.50 | I211: 36495 | J211: 14
A212: =ROW()-2 -> 809 | B212: TP | C212: 3155 | D212: 4 | E212: 03155-X | F212: Lotus Notes 网络办公平台 | G212: 赵丽萍 | H212: 16.00 | I212: 36495 | J212: 15
A213: =ROW()-2 -> 810 | B213: TP | C213: 3169 | D213: 4 | E213: 03169-X | F213: Photoshop图象处理 | G213: 沈 洪 | H213: 17.00 | I213: 36770 | J213: 16
A214: =ROW()-2 -> 811 | B214: TP | C214: 3115 | D214: 5 | E214: 03115-0 | F214: PowerPoint演示文稿制作 | G214: 庄洪林 | H214: 14.00 | I214: 37135 | J214: 18
A215: =ROW()-2 -> 812 | B215: TP | C215: 3229 | D215: 4 | E215: 03229-7 | F215: 3D Studio MAX 动画制作 | G215: 李利平 | H215: 12.00 | I215: 36647 | J215: 22
A216: =ROW()-2 -> 813 | B216: TP | C216: 3230 | D216: 4 | E216: 03230-0 | F216: Authorware 多媒体制作 | G216: 李秀等 | H216: 16.00 | I216: 37226 | J216: 18
A217: =ROW()-2 -> 814 | B217: P- | C217: 4310 | D217: 1 | E217: 04310-1 | F217: JAVA事件处理指南（配光盘） | G217: 沈莹谢乐健等译 | H217: 58.00 | I217: 37438 | J217: 6
A218: =ROW()-2 -> 815 | B218: TP | C218: 3170 | D218: 2 | E218: 03170-3 | F218: Java 程序设计 | G218: 刘 波 | H218: 14.80 | I218: 36982 | J218: 15
A219: =ROW()-2 -> 816 | B219: TP | C219: 3241 | D219: 2 | E219: 03241-6 | F219: 多媒体应用基础 | G219: 王辉 等 | H219: 14.00 | I219: 36923 | J219: 18
A220: =ROW()-2 -> 817 | B220: VD | C220: 9831 | D220: 1 | F220: Windows 98 中文版操作系统（VCD2盘） | G220: 王世忠 | H220: 50 | I220: 1999 | J220: 50
A221: =ROW()-2 -> 818 | B221: VD | C221: 0061 | D221: 1 | F221: Internet 上网与使用（VCD2盘） | G221: 陶文星等 | H221: 50 | I221: 1999 | J221: 50
A222: =ROW()-2 -> 819 | B222: VD | C222: 9863 | D222: 1 | F222: HTML网页制作 （VCD3盘） | G222: 肖 平 | H222: 75 | I222: 1999 | J222: 25
A223: =ROW()-2 -> 820 | B223: VD | C223: 9865 | D223: 1 | F223: Internet Explorer 浏览器（VCD2盘） | G223: 鲍泓等 | H223: 50.00 | I223: 1999 | J223: 50
A224: =ROW()-2 -> 821 | B224: VD | C224: 9917 | D224: 1 | F224: Photoshop图象处理 (VCD5盘) | G224: 沈洪 等 | H224: 125.00 | I224: 1999 | J224: 10
A225: =ROW()-2 -> 822 | B225: VD | C225: 9918 | D225: 1 | F225: PowerPoint演示文稿制作 (VCD2盘) | G225: 庄洪林 | H225: 50.00 | I225: 1999 | J225: 25
A226: =ROW()-2 -> 823 | B226: VD | C226: 9916 | D226: 1 | F226: 3D Studio MAX 动画制作 (VCD7盘) | G226: 李利平等 | H226: 175.00 | I226: 36281 | J226: 6
A227: =ROW()-2 -> 824 | B227: VD | C227: 9919 | D227: 1 | F227: Authorware 多媒体制作 (VCD6盘) | G227: 李秀 等 | H227: 150.00 | I227: 36281 | J227: 9
A228: =ROW()-2 -> 825 | B228: VD | C228: 9915 | D228: 1 | F228: 多媒体应用基础 (VCD2盘) | G228: 王辉 等 | H228: 50.00 | I228: 1999 | J228: 40
A229: =ROW()-2 -> 826 | B229: GP | C229: 1759 | D229: 1 | E229: 7900617590 | F229: 多媒体技术应用部分 (CD-ROM) | G229: 刘 波 | H229: 35.00 | I229: 36281 | J229: 30
F230: 迎接新世纪――最新常用软件技能培训丛书（谭浩强主编）
A231: =ROW()-2 -> 828 | B231: TP | C231: 3597 | D231: 3 | E231: 03597-0 | F231: WPS 2000 实用技能 | G231: 求伯君等 | H231: 24.50 | I231: 37327 | J231: 9
A232: =ROW()-2 -> 829 | B232: TP | C232: 3800 | D232: 3 | E232: 03800-7 | F232: Word 2000 实用技能 | G232: 沈 洪 | H232: 19.00 | I232: 36982 | J232: 13
A233: =ROW()-2 -> 830 | B233: TP | C233: 3824 | D233: 2 | E233: 03824-4 | F233: Excel 2000 实用技能 (配光盘） | G233: 李 秀 | H233: 30.00 | I233: 36495 | J233: 12
A234: =ROW()-2 -> 831 | B234: TP | C234: 3799 | D234: 1 | E234: 03799-X | F234: PowerPoint 2000 实用技能 | G234: 庄洪林 | H234: 18.00 | I234: 36982 | J234: 13
A235: =ROW()-2 -> 832 | B235: TP | C235: 2492 | D235: 3 | E235: 02492-8 | F235: Outlook 2000 实用技能 | G235: 郑 坚 | H235: 12.80 | I235: 36586 | J235: 18
A236: =ROW()-2 -> 833 | B236: TP | C236: 2380 | D236: 3 | E236: 02380-8 | F236: FrontPage 2000 实用技能 | G236: 杜煜 等 | H236: 19.00 | I236: 37334 | J236: 13
A237: =ROW()-2 -> 834 | B237: TP | C237: 1207 | D237: 1 | E237: 01207-5 | F237: Access 2000 实用技能 | G237: 杨一平等 | H237: 23.00 | I237: 37408 | J237: 12
A238: =ROW()-2 -> 835 | B238: TP | C238: 1207 | D238: 2 | E238: 01207-5 | F238: Access 2000 实用技能（配光盘） | G238: 杨一平等 | H238: 43.00 | I238: 36770 | J238: 10
A239: =ROW()-2 -> 836 | B239: TP | C239: 3823 | D239: 1 | E239: 03823-6 | F239: Office 2000 基础操作与综合应用 | G239: 王 电 | H239: 22.00 | I239: 36982 | J239: 12
A240: =ROW()-2 -> 837 | B240: TP | C240: 3823 | D240: 2 | E240: 03823-6 | F240: Office 2000 基础操作与综合应用（配光盘） | G240: 王 电 | H240: 42.00 | I240: 36739 | J240: 10
A241: =ROW()-2 -> 838 | B241: TP | C241: 3945 | D241: 1 | E241: 03945-3 | F241: Auto CAD 2000 实用教程 | G241: 谭浩强主编 | H241: 35.00 | I241: 36923 | J241: 7
A242: =ROW()-2 -> 839 | B242: P- | C242: 2563 | D242: 1 | E242: 7900625631 | F242: 多媒体制作实例与技巧（配光盘） | G242: 黄心渊等 | H242: 26.00 | I242: 36739 | J242: 16
A243: =ROW()-2 -> 840 | B243: VD | C243: 9952 | D243: 1 | F243: WPS 2000 实用技能 （5VCD） | G243: 赵新国等 | H243: 125.00 | I243: 36404 | J243: 12
A244: =ROW()-2 -> 841 | B244: VD | C244: 9980 | D244: 1 | F244: Word 2000 实用技能（2VCD） | G244: 沈 洪等 | H244: 45.00 | I244: 36465 | J244: 25
A245: =ROW()-2 -> 842 | B245: VD | C245: 9978 | D245: 1 | F245: PowerPoint 2000 实用技能 (5VCD) | G245: 庄洪林等 | H245: 25.00 | I245: 36465 | J245: 25
A246: =ROW()-2 -> 843 | B246: VD | C246: 9985 | D246: 1 | F246: Excel 2000 电子表格 (3VCD） | G246: 李 秀 | H246: 75.00 | I246: 36647 | J246: 12
A247: =ROW()-2 -> 844 | B247: VD | C247: 9988 | D247: 1 | F247: Outlook 2000 个人信息管理（2VCD） | G247: 郑 坚 | H247: 50.00 | I247: 36647 | J247: 25
A248: =ROW()-2 -> 845 | B248: VD | C248: 9989 | D248: 1 | F248: Office 2000 基础操作与综合应用（2VCD） | G248: 王 电 | H248: 50.00 | I248: 36647 | J248: 25
A249: =ROW()-2 -> 846 | B249: VD | C249: 9982 | D249: 1 | F249: FrontPage 2000 网页制作（3VCD） | G249: 杜煜 等 | H249: 75.00 | I249: 36647 | J249: 12
F250: 信息技术培训教材
A251: =ROW()-2 -> 848 | B251: TP | C251: 1387 | D251: 1 | E251: 01387-2 | F251: 基础知识与应用 | G251: 周美瑞等 | H251: 29.00 | I251: 37500 | J251: 11
F252: 电视培训教材
A253: =ROW()-2 -> 850 | B253: TP | C253: 5821 | D253: 1 | E253: 05821-0 | F253: Photoshop 7.0 电视讲座教程 | G253: 雷波 | H253: 45.00 | I253: 37530 | J253: 6
F254: 多媒体 CAI 课件制作实例教程丛书
A255: =ROW()-2 -> 852 | B255: P- | C255: 3582 | D255: 1 | E255: 7900635823 | F255: Authorware 多媒体 CAI 课件制作实例教程（配光盘） | G255: 方其桂等 | H255: 38.00 | I255: 37377 | J255: 8
A256: =ROW()-2 -> 853 | B256: P- | C256: 3775 | D256: 1 | E256: 7900637753 | F256: Flash多媒体CAI课件制作实例教程（配光盘） | G256: 王玉华等 | H256: 28 | I256: 37469 | J256: 10
A257: =ROW()-2 -> 854 | B257: P- | C257: 3714 | D257: 1 | E257: 7900637141 | F257: 几何画板多媒体CAI课件制作实例教程（配光盘） | G257: 张杏林等 | H257: 19.00 | I257: 37377 | J257: 16
A258: =ROW()-2 -> 855 | B258: P- | C258: 3766 | D258: 1 | E258: 7900637664 | F258: FrontPage 多媒体CAI课件制作实例教程（配光盘） | G258: 方其桂等 | H258: 28.00 | I258: 37288 | J258: 12
A259: =ROW()-2 -> 856 | B259: P- | C259: 3773 | D259: 1 | E259: 7900637737 | F259: PowerPoint 多媒体CAI课件制作实例教程（配光盘） | G259: 于继成等 | H259: 29.00 | I259: 37469 | J259: 10
F260: 5.其他系列丛书
F261: 网络工程师系列丛书
A262: =ROW()-2 -> 859 | B262: TP | C262: 5084 | D262: 1 | E262: 05084-8 | F262: 校园网组建与管理 | G262: 王竹林等 | H262: 26.00 | I262: 37288 | J262: 9
A263: =ROW()-2 -> 860 | B263: TP | C263: 5077 | D263: 1 | E263: 05077-5 | F263: 局域网组建与管理 | G263: 吴迪 等 | H263: 25.00 | I263: 37341 | J263: 12
A264: =ROW()-2 -> 861 | B264: TP | C264: 5225 | D264: 1 | E264: 05225-1 | F264: 局域网经典案例教程 | G264: 龙岗 等 | H264: 35.00 | I264: 37347 | J264: 7
A265: =ROW()-2 -> 862 | B265: TP | C265: 5374 | D265: 1 | E265: 05374-1 | F265: Cisco Catalyst系列交换机的使用与组网技术 | G265: 刘鲁川 等 | H265: 28.00 | I265: 37377 | J265: 9
A266: =ROW()-2 -> 863 | B266: TP | C266: 5693 | D266: 1 | E266: 05693-5 | F266: 多媒体教学系统组建与管理 | G266: 李香敏 | H266: 28.00 | I266: 37530 | J266: 10
F267: 微软.NET程序员系列
A268: =ROW()-2 -> 865 | B268: TP | C268: 5609 | D268: 1 | E268: 05609-1 | F268: ASP.NET 程序设计 | G268: [美]G.Andrew Duthie | H268: 48.00 | I268: 37438 | J268: 6
A269: =ROW()-2 -> 866 | B269: P- 4168 1 | C269: 4168 | D269: 1 | E269: 04168-1 | F269: ASP.NET Web应用程序开发新思维(配光盘) | G269: [美]Douglas J. Reilly | H269: 38.00 | I269: 37408 | J269: 7
A270: =ROW()-2 -> 867 | B270: TP | C270: 5776 | D270: 1 | E270: 05776-1 | F270: Visual C#.NET语言参考手册 | G270: 微软公司 | H270: 49.00 | I270: 37469 | J270: 7
A271: =ROW()-2 -> 868 | B271: TP | C271: 5412 | D271: 1 | E271: 05412-6 | F271: MICROSOFT.NET MY SERVICES 精解 | G271: [美]微软公司 | H271: 69.00 | I271: 37500 | J271: 5
A272: =ROW()-2 -> 869 | B272: TP | C272: 5809 | D272: 1 | E272: 05809-1 | F272: Visual Basic. NET语言参考手册 | G272: [美]微软公司 | H272: 68.00 | I272: 37500 | J272: 5
A273: =ROW()-2 -> 870 | B273: TP | C273: 5775 | D273: 1 | E273: 05775-3 | F273: 应用程序升级――Visual Basic 6.0到Visual Basic .NET | G273: [美]Ed Robinson | H273: 49.00 | I273: 37500 | J273: 6
A274: =ROW()-2 -> 871 | B274: TP | C274: 5834 | D274: 2 | E274: 05834-2 | F274: Applied Microsoft .NET Framework Programming程序设计 | G274: Jeffref Richter | H274: 58.00 | I274: 37508 | J274: 6
A275: =ROW()-2 -> 872 | B275: TP | C275: 5918 | D275: 1 | E275: 05918-7 | F275: 构建Web解决方案――应用ASP.NET和ADO.NET | G275: Dino Esposito | H275: 45.00 | I275: 37530 | J275: 9
A276: =ROW()-2 -> 873 | B276: TP | C276: 5947 | D276: 1 | E276: 05947-0 | F276: Windows网络编程（第2版） | G276: Anthory Jones, Jim Ohlund | H276: 78.00 | I276: 37530 | J276: 6
A277: =ROW()-2 -> 874 | B277: TP | C277: 5946 | D277: 1 | E277: 05946-2 | F277: Visual C++.NET语言参考手册 | G277: 微软公司 | H277: 108.00 | I277: 37530 | J277: 4
F278: 微软.NET程序设计系列
A279: =ROW()-2 -> 876 | B279: TP | C279: 5663 | D279: 1 | E279: 05663-3 | F279: 微软ADO.NET 程序设计 | G279: [美]Rebecca M.Riordan | H279: 48.00 | I279: 37438 | J279: 7
A280: =ROW()-2 -> 877 | B280: TP | C280: 5640 | D280: 1 | E280: 05640-4 | F280: Visual Basic.Net 和Visual C#.NET面向对象程序设计 | G280: [美]Robin A.Reynolds-Haertle | H280: 36.00 | I280: 37439 | J280: 6
A281: =ROW()-2 -> 878 | B281: TP | C281: 5644 | D281: 1 | E281: 05644-7 | F281: Visual Basic.Net 程序设计 | G281: [美]Michael Halvorson | H281: 48.00 | I281: 37439 | J281: 5
A282: =ROW()-2 -> 879 | B282: TP | C282: 5643 | D282: 1 | E282: 05643-9 | F282: Visual C++.NET 程序设计 | G282: [美]Julian Templeman,Andy Olsen | H282: 58.00 | I282: 37469 | J282: 5
A283: =ROW()-2 -> 880 | B283: TP | C283: 5948 | D283: 1 | E283: 05948-9 | F283: WEB数据库程序设计（.NET版） | G283: Jim Buyens | H283: 68.00 | I283: 37530 | J283: 6
F284: 信息技术丛书
A285: =ROW()-2 -> 882 | B285: TP | C285: 3965 | D285: 1 | E285: 03965-8 | F285: 离散事件动态系统 | G285: 郑大钟等 | H285: 39 | I285: 36892 | J285: 6
A286: =ROW()-2 -> 883 | B286: TP | C286: 5227 | D286: 1 | E286: 05227-1 | F286: 自适应控制系统 | G286: 谢树民 | H286: 21 | I286: 37469 | J286: 13
A287: =ROW()-2 -> 884 | B287: TP | C287: 5667 | D287: 1 | E287: 05667-6 | F287: 多尺度估计理论及其应用 | G287: 文成林 | H287: 35 | I287: 37500 | J287: 9
F288: SEI 软件工程译丛
A289: =ROW()-2 -> 886 | B289: TP | C289: 5865 | D289: 1 | E289: 05865-2 | F289: 技术人员管理 | G289: 朱崇高等译 | H289: 49.00 | I289: 37530 | J289: 8
A290: =ROW()-2 -> 887 | B290: TP | C290: 5867 | D290: 1 | E290: 05867-9 | F290: 风险管理――软件系统开发方法 | G290: 王海鹏等译 | H290: 49.00 | I290: 37530 | J290: 7
A291: =ROW()-2 -> 888 | B291: TP | C291: 5866 | D291: 1 | E291: 05866-0 | F291: 软件制胜之道 | G291: 施安平译 | H291: 29.00 | I291: 37530 | J291: 12
A292: =ROW()-2 -> 889 | B292: TP | C292: 5883 | D292: 1 | E292: 05883-0 | F292: 软件构架实践 | G292: 孙学涛等译 | H292: 69.00 | I292: 37530 | J292: 5
A293: =ROW()-2 -> 890 | B293: TP | C293: 5868 | D293: 1 | E293: 05868-7 | F293: 软件采办管理――开放系统和COTS产品 | G293: B.Craig Meyers | H293: 49.00 | I293: 37530 | J293: 8
F294: SEI 软件工程丛书（影印版）
A295: =ROW()-2 -> 892 | B295: TP | C295: 5753 | D295: 1 | E295: 05753-2 | F295: 软件制胜之道 | G295: Watts Si Humphrey | H295: 39.00 | I295: 37500 | J295: 10
A296: =ROW()-2 -> 893 | B296: TP | C296: 5757 | D296: 1 | E296: 05757-5 | F296: 软件采办管理――开放系统和COTS产品 | G296: B Craig Meyers | H296: 59.00 | I296: 37500 | J296: 6
A297: =ROW()-2 -> 894 | B297: TP | C297: 5752 | D297: 1 | E297: 05752-4 | F297: 风险管理――软件系统开发方法 | G297: Elaine M Hall | H297: 49.00 | I297: 37500 | J297: 7
A298: =ROW()-2 -> 895 | B298: TP | C298: 5756 | D298: 1 | E298: 05756-7 | F298: 技术人员管理――创新、协作和软件过程 | G298: Watts Si Humphrey | H298: 49.00 | I298: 37500 | J298: 7
A299: =ROW()-2 -> 896 | B299: TP | C299: 5758 | D299: 1 | E299: 05758--3 | F299: 软件过程管理 | G299: Watts Si Humphrey | H299: 59.00 | I299: 37469 | J299: 6
A300: =ROW()-2 -> 897 | B300: TP | C300: 5754 | D300: 1 | E300: 05754-0 | F300: 用商业组件构建系统 | G300: Kurt L wallnau | H300: 49.00 | I300: 37469 | J300: 7
F301: 微软版权图书
A302: =ROW()-2 -> 899 | B302: TP | C302: 4433 | D302: 1 | E302: 04433-3 | F302: 微软电子商务制胜策略 | G302: 侯 或等译 | H302: 28.00 | I302: 37073 | J302: 10
A303: =ROW()-2 -> 900 | B303: P- | C303: 3761 | D303: 1 | E303: 7900637613 | F303: 微软电子商务解决方案――Microsoft Commerce Server 2000（配光盘） | G303: 张涛 等译 | H303: 54.00 | I303: 37226 | J303: 6
A304: =ROW()-2 -> 901 | B304: TP | C304: 4982 | D304: 1 | E304: 04982-3 | F304: 电子商务管理实务 | G304: 健莲科技译 | H304: 38.00 | I304: 37226 | J304: 9
A305: =ROW()-2 -> 902 | B305: P- | C305: 3531 | D305: 1 | E305: 7900635319 | F305: Microsoft Exchange 2000 Server 资源大全 | G305: 东方人华译 | H305: 125.00 | I305: 37104 | J305: 3
A306: =ROW()-2 -> 903 | B306: P- | C306: 3584 | D306: 1 | E306: 790063584X | F306: Microsoft SQL Server 2000 系统管理员宝典 (配光盘） | G306: 孙岩 等译 | H306: 115.00 | I306: 37104 | J306: 3
A307: =ROW()-2 -> 904 | B307: TP | C307: 3087 | D307: 4 | E307: 03087-1 | F307: Microsoft Windows 98 中文版使用大全 | G307: 博彦公司 | H307: 79.00 | I307: 36951 | J307: 5
A308: =ROW()-2 -> 905 | B308: TP | C308: 4294 | D308: 1 | E308: 04294-2 | F308: 微软知识管理策略 | G308: 夏兆彦等译 | H308: 20.00 | I308: 36982 | J308: 17
A309: =ROW()-2 -> 906 | B309: TP | C309: 1402 | D309: A | E309: 01402-7 | F309: Microsoft Windows 2000 系统管理员手册 | G309: 王悦亲等译 | H309: 43.00 | I309: 36951 | J309: 8
A310: =ROW()-2 -> 907 | B310: TP | C310: 3698 | D310: 2 | E310: 03698-5 | F310: Microsoft Office 2000 中文中小企业版使用大全 | G310: 博彦公司 | H310: 100.00 | I310: 36557 | J310: 4
A311: =ROW()-2 -> 908 | B311: TP | C311: 3747 | D311: 1 | E311: 03747-7 | F311: Microsoft Office 2000 中文专业版使用大全 | G311: 汉扬天地 | H311: 115.00 | I311: 36465 | J311: 3
A312: =ROW()-2 -> 909 | B312: TP | C312: 3768 | D312: 1 | E312: 03768-X | F312: Microsoft Office 2000 中文企业版使用大全 | G312: 汉扬天地 | H312: 140.00 | I312: 36465 | J312: 2
A313: =ROW()-2 -> 910 | B313: TP | C313: 3759 | D313: 1 | E313: 03759-0 | F313: Microsoft Word 2000 中文版使用大全 | G313: 汉扬天地 | H313: 90.00 | I313: 36465 | J313: 3
A314: =ROW()-2 -> 911 | B314: TP | C314: 4011 | D314: 1 | E314: 04011-7 | F314: Microsoft Excel 2000 中文版使用大全 | G314: 汉扬天地 | H314: 95.00 | I314: 37073 | J314: 4
A315: =ROW()-2 -> 912 | B315: P- | C315: 2259 | D315: 1 | E315: 02259-4 | F315: Microsoft Access 2000 中文版使用大全 | G315: 汉扬天地 | H315: 98.00 | I315: 37104 | J315: 3
A316: =ROW()-2 -> 913 | B316: TP | C316: 3761 | D316: 2 | E316: 03761-2 | F316: Microsoft PowerPoint 2000 中文版使用大全 | G316: 汉扬天地 | H316: 55.00 | I316: 36586 | J316: 6
A317: =ROW()-2 -> 914 | B317: TP | C317: 3769 | D317: 1 | E317: 03769-8 | F317: Microsoft Outlook 2000中文版使用大全 | G317: 汉扬天地 | H317: 65.00 | I317: 36434 | J317: 5
A318: =ROW()-2 -> 915 | B318: TP | C318: 3767 | D318: 2 | E318: 03767-1 | F318: Microsoft FrontPage 2000中文版使用大全 | G318: 汉扬天地 | H318: 99.00 | I318: 36647 | J318: 4
A319: =ROW()-2 -> 916 | B319: TP | C319: 2750 | D319: 4 | E319: 02750-1 | F319: Microsoft Office 97 中文版使用大全 | G319: 黄林红等译 | H319: 98.00 | I319: 1999 | J319: 3
A320: =ROW()-2 -> 917 | B320: TP | C320: 3083 | D320: 2 | E320: 03083-9 | F320: Microsoft Excel 97中文版使用大全 | G320: 詹津明等译 | H320: 88.00 | I320: 1999 | J320: 3
A321: =ROW()-2 -> 918 | B321: TP | C321: 3240 | D321: 3 | E321: 03240-8 | F321: Microsoft Access 97 中文版使用大全(配光盘) | G321: 贺军等译 | H321: 95.00 | I321: 36465 | J321: 4
A322: =ROW()-2 -> 919 | B322: TP | C322: 3328 | D322: 2 | E322: 03328-5 | F322: Windows 高级编程指南 (配光盘) | G322: 王书洪等译 | H322: 99.00 | I322: 36495 | J322: 3
A323: =ROW()-2 -> 920 | B323: TP 5550 12 | D323: 1 | E323: 05550-1 | F323: GNU/Linux 编程指南(第二版）入门应用精通 | G323: Kurt Wall 等著 | H323: 68.00 | I323: 37408 | J323: 4
A324: =ROW()-2 -> 921 | B324: TP | C324: 3316 | D324: 1 | E324: 03316-1 | F324: Visual C++ 使用指南 | G324: 詹津明等译 | H324: 65.00 | I324: 36281 | J324: 6
A325: =ROW()-2 -> 922 | B325: TP | C325: 3253 | D325: 1 | E325: 03253-X | F325: Microsoft Visual C++ 语言参考手册 | G325: 前导工作室译 | H325: 69.00 | I325: 1999 | J325: 5
A326: =ROW()-2 -> 923 | B326: TP | C326: 2866 | D326: 3 | E326: 02866-4 | F326: Windows NT Server 4.0 中文版使用大全 | G326: 白卫等译 | H326: 49.00 | I326: 36708 | J326: 7
A327: =ROW()-2 -> 924 | B327: TP | C327: 3243 | D327: 2 | E327: 03243-2 | F327: Visual C++ 技术内幕（第4版）(配光盘) | G327: 潘爱民等译 | H327: 96.00 | I327: 37356 | J327: 3
A328: =ROW()-2 -> 925 | B328: TP | C328: 3118 | D328: 2 | E328: 03118-5 | F328: Microsoft SQL Server 6.5 技术内幕 | G328: Ron Soukup | H328: 79.00 | I328: 1999 | J328: 5
A329: =ROW()-2 -> 926 | B329: TP | C329: 0836 | D329: 1 | E329: 00836-1 | F329: 深入理解 COM+ | G329: 潘爱民译 | H329: 25.00 | I329: 36678 | J329: 14
A330: =ROW()-2 -> 927 | B330: TP | C330: 3320 | D330: 1 | E330: 03320-X | F330: COM 技术内幕――微软组件对象模型 （配光盘） | G330: 杨秀章译 | H330: 50.00 | I330: 36678 | J330: 9
A331: =ROW()-2 -> 928 | B331: P- | C331: 3140 | D331: 1 | E331: 7900631401 | F331: 构建Active Directory 服务――业内专家经验笔录 （配光盘） | G331: 东方人华译 | H331: 59.00 | I331: 37073 | J331: 7
A332: =ROW()-2 -> 929 | B332: TP | C332: 3301 | D332: 1 | E332: 03301-3 | F332: Internet 标准与协议 | G332: 博彦公司 | H332: 32.00 | I332: 1999 | J332: 10
A333: =ROW()-2 -> 930 | B333: TP | C333: 4988 | D333: 1 | E333: 04988-2 | F333: Microsoft .NET 战略 | G333: 王黎 等译 | H333: 36.00 | I333: 37377 | J333: 8
F334: 微软战略性技术丛书
A335: =ROW()-2 -> 932 | B335: TP | C335: 3311 | D335: 1 | E335: 03311-0 | F335: 带宽的竞争：全面理解数据传输 | G335: Cary Lu | H335: 20.00 | I335: 1999 | J335: 20
F336: 微软全面掌握系列
A337: =ROW()-2 -> 934 | B337: P- | C337: 3542 | D337: 1 | E337: 7900635424 | F337: 全面掌握 Microsoft Visual C++ 6.0 MFC 应用程序开发（配光盘） | G337: 博彦公司译 | H337: 65.00 | I337: 2001.12 | J337: 6
A338: =ROW()-2 -> 935 | B338: P- | C338: 3052 | D338: 1 | E338: 790063052X | F338: 全面掌握 MS Office 2000 应用程序开发 （配光盘） | G338: 博彦公司译 | H338: 56.00 | I338: 36831 | J338: 6
A339: =ROW()-2 -> 936 | B339: P- | C339: 3046 | D339: 1 | E339: 7900630465 | F339: 全面掌握 MS VB 6.0 基础（配光盘） | G339: 博彦公司译 | H339: 49.00 | I339: 36800 | J339: 11
A340: =ROW()-2 -> 937 | B340: P- | C340: 3015 | D340: 1 | E340: 7900630155 | F340: 全面掌握 MS VB 6.0 企业应用程序开发 （配光盘） | G340: 博彦公司译 | H340: 56.00 | I340: 36770 | J340: 8
A341: =ROW()-2 -> 938 | B341: P- | C341: 3021 | D341: 1 | E341: 790063021X | F341: 全面掌握 MS VB 6.0 应用程序开发（配光盘） | G341: 博彦公司译 | H341: 58.80 | I341: 36770 | J341: 7
A342: =ROW()-2 -> 939 | B342: P- | C342: 3008 | D342: 1 | E342: 7900630082 | F342: 全面掌握电子商务开发技术：Business to Consumer （配光盘） | G342: 博彦公司译 | H342: 46.00 | I342: 36831 | J342: 9
A343: =ROW()-2 -> 940 | B343: P- | C343: 3055 | D343: 1 | E343: 7900630554 | F343: 全面掌握电子商务开发技术：Business to Business （配光盘） | G343: 博彦公司译 | H343: 45.00 | I343: 36892 | J343: 8
A344: =ROW()-2 -> 941 | B344: P- | C344: 3018 | D344: 1 | E344: 790063018X | F344: 全面掌握 MS Visual InterDev 6.0 Web 应用程序开发 （配光盘） | G344: 博彦公司译 | H344: 63.00 | I344: 36800 | J344: 7
F345: Microsoft 程序设计系列
A346: =ROW()-2 -> 943 | B346: P- | C346: 3080 | D346: 1 | E346: 7900630805 | F346: Microsoft Internet Explorer 5 程序设计 （配光盘） | G346: 博彦公司译 | H346: 59.00 | I346: 36951 | J346: 6
A347: =ROW()-2 -> 944 | B347: P- | C347: 3192 | D347: 1 | E347: 7900631925 | F347: MFC Windows 程序设计（第2版）（配光盘） | G347: 博彦公司译 | H347: 128.00 | I347: 37319 | J347: 2
F348: 微软 Visual Studio.NET程序开发系列丛书
A349: =ROW()-2 -> 946 | B349: TP | C349: 4389 | D349: 1 | E349: 04389-2 | F349: C# 编程技术 | G349: 微软公司 东方人华 | H349: 42.00 | I349: 37135 | J349: 8
A350: =ROW()-2 -> 947 | B350: P- | C350: 3759 | D350: 1 | E350: 7900637591 | F350: C# 技术内幕（配光盘） | G350: 微软公司 东方人华 | H350: 49.00 | I350: 37408 | J350: 7
A351: =ROW()-2 -> 948 | B351: TP | C351: 4434 | D351: 1 | E351: 04434-1 | F351: C# 语言参考手册 | G351: 微软公司 东方人华 | H351: 49.50 | I351: 37073 | J351: 7
A352: =ROW()-2 -> 949 | B352: TP | C352: 4462 | D352: 1 | E352: 04462-7 | F352: Visual Studio.NET开发环境使用指南 | G352: 微软公司 东方人华 | H352: 49.00 | I352: 37104 | J352: 6
A353: =ROW()-2 -> 950 | B353: TP | C353: 4620 | D353: 1 | E353: 04620-4 | F353: XML 3.0 技术内幕 | G353: 微软公司 东方人华 | H353: 72.00 | I353: 37104 | J353: 4
F354: 乐思.NET和Oracle编程经典系列
F355: 程序员为程序员而作
A356: =ROW()-2 -> 953 | B356: TP | C356: 4876 | D356: 1 | E356: 04876-2 | F356: C# 程序设计教程 | G356: 康博 译 | H356: 38.00 | I356: 37341 | J356: 7
A357: =ROW()-2 -> 954 | B357: TP | C357: 5000 | D357: 1 | E357: 05000-7 | F357: Application Center 2000 专家指南 | G357: 袁勤勇等译 | H357: 39.00 | I357: 37196 | J357: 8
A358: =ROW()-2 -> 955 | B358: TP | C358: 4934 | D358: 1 | E358: 04934-3 | F358: ASP 与 XML 高级编程 | G358: 康博 译 | H358: 78.00 | I358: 36892 | J358: 4
A359: =ROW()-2 -> 956 | B359: TP | C359: 4878 | D359: 1 | E359: 04878-9 | F359: VB.NET 程序设计教程 | G359: 康博 译 | H359: 40.00 | I359: 37373 | J359: 7
A360: =ROW()-2 -> 957 | B360: TP | C360: 5155 | D360: 1 | E360: 05155-0 | F360: Oracle 8i应用高级编程――Java, PL/SQL 和XML深入开发 | G360: 郝启堂译 | H360: 128.00 | I360: 37257 | J360: 2
A361: =ROW()-2 -> 958 | B361: TP | C361: 5091 | D361: 1 | E361: 05091-0 | F361: C#高级编程 | G361: 康博译 | H361: 128.00 | I361: 37257 | J361: 3
A362: =ROW()-2 -> 959 | B362: TP | C362: 5118 | D362: 1 | E362: 05118-6 | F362: ASP.NET 高级编程 | G362: 王 毅等 译 | H362: 128.00 | I362: 37257 | J362: 3
A363: =ROW()-2 -> 960 | B363: TP | C363: 5725 | D363: 1 | E363: 05725-7 | F363: J#程序设计教程――从Java到.NET的桥梁 | G363: 康博 译 | H363: 32.00 | I363: 37500 | J363: 11
A364: =ROW()-2 -> 961 | B364: TP | C364: 5684 | D364: 1 | E364: 05684-6 | F364: C#高级编程 | G364: 杨 浩等 译 | H364: 128.00 | I364: 37500 | J364: 3
A365: =ROW()-2 -> 962 | B365: TP | C365: 5683 | D365: 1 | E365: 05683-8 | F365: Oracle 9i Java程序设计――使用 PLISQL和Java的解决方案 | G365: 康博 译 | H365: 88.00 | I365: 37500 | J365: 4
A366: =ROW()-2 -> 963 | B366: TP | C366: 5205 | D366: 1 | E366: 05205-0 | F366: ASP.NET入门经典――VB.NET编程篇 | G366: 崔洪斌等译 | H366: 75.00 | I366: 37347 | J366: 4
A367: =ROW()-2 -> 964 | B367: TP | C367: 5569 | D367: 1 | E367: 05569-1 | F367: ASP.NET 1.0 高级编程 | G367: 王毅等译 | H367: 128.00 | I367: 37438 | J367: 3
A368: =ROW()-2 -> 965 | B368: TP | C368: 5407 | D368: 1 | E368: 05407-X | F368: ASP.NET入门经典――C#编程篇 | G368: 康博 译 | H368: 75.00 | I368: 37377 | J368: 4
A369: =ROW()-2 -> 966 | B369: TP | C369: 5334 | D369: 1 | E369: 05334-0 | F369: Oracle专家高级编程 | G369: 袁勤勇等译 | H369: 138.00 | I369: 37347 | J369: 2
A370: =ROW()-2 -> 967 | B370: TP | C370: 5236 | D370: 1 | E370: 05236-0 | F370: VB.NET高级编程 | G370: 康博译 | H370: 88.00 | I370: 37347 | J370: 2
A371: =ROW()-2 -> 968 | B371: TP | C371: 5359 | D371: 1 | E371: 05359-6 | F371: VB.NET入门经典 | G371: 康博译 | H371: 75.00 | I371: 37384 | J371: 4
A372: =ROW()-2 -> 969 | B372: TP | C372: 5333 | D372: 1 | E372: 05333-2 | F372: C#入门经典 | G372: 康博译 | H372: 96.00 | I372: 37384 | J372: 3
A373: =ROW()-2 -> 970 | B373: TP | C373: 5522 | D373: 1 | E373: 05522-X | F373: .NET XML 高级编程 | G373: 英宇 等译 | H373: 75.00 | I373: 37438 | J373: 4
A374: =ROW()-2 -> 971 | B374: TP | C374: 5406 | D374: 1 | E374: 05406-9 | F374: .NET Framework高级编程 | G374: 汪钟鸣等译 | H374: 68.00 | I374: 37384 | J374: 5
A375: =ROW()-2 -> 972 | B375: TP | C375: 5366 | D375: 1 | E375: 05366-2 | F375: ASP.NET程序员参考手册 | G375: 赵彦敏译 | H375: 98.00 | I375: 37384 | J375: 3
A376: =ROW()-2 -> 973 | B376: TP | C376: 5283 | D376: 1 | E376: 05283-8 | F376: Cold Fusion 5.0高级编程 | G376: 杜炜等译 | H376: 115.00 | I376: 37384 | J376: 3
A377: =ROW()-2 -> 974 | B377: TP 5439 1 | E377: 05439-9 | F377: BizTalk 高级编程 | G377: 康博 译 | H377: 68.00 | I377: 37408 | J377: 5
A378: =ROW()-2 -> 975 | B378: TP | C378: 5464 | D378: 1 | E378: 05464-9 | F378: ASP.NET Web服务高级编程 | G378: 康博 译 | H378: 69.00 | I378: 37413 | J378: 4
A379: =ROW()-2 -> 976 | B379: TP | C379: 5521 | D379: 1 | E379: 05521-1 | F379: Windows Forms 高级编程 | G379: 袁勤勇等译 | H379: 65.00 | I379: 37413 | J379: 5
A380: =ROW()-2 -> 977 | B380: TP | C380: 5581 | D380: 1 | E380: 05581-5 | F380: .NET数据服务 C#高级编程 | G380: 毛晓飞等译 | H380: 78.00 | I380: 37438 | J380: 4
A381: =ROW()-2 -> 978 | B381: TP | C381: 5564 | D381: 1 | E381: 05564-5 | F381: Visual Basic.NET数据库开发入门经典 | G381: 康博 译 | H381: 65.00 | I381: 37438 | J381: 5
A382: =ROW()-2 -> 979 | B382: TP | C382: 5746 | D382: 1 | E382: 05746-X | F382: Visual Basic.NET互操作高级编程――从com和VB 6升级到.NET | G382: 康博 译 | H382: 42.00 | I382: 37469 | J382: 8
A383: =ROW()-2 -> 980 | B383: TP | C383: 5619 | D383: 1 | E383: 05619-6 | F383: VB.NET事务处理高级编程 | G383: 袁勤勇等译 | H383: 52.00 | I383: 37469 | J383: 6
A384: =ROW()-2 -> 981 | B384: TP | C384: 5728 | D384: 1 | E384: 05728-1 | F384: .NET 企业应用高级编程――C#编程篇 | G384: 康博 译 | H384: 48.00 | I384: 37469 | J384: 8
A385: =ROW()-2 -> 982 | B385: TP | C385: 5685 | D385: 1 | E385: 05685-4 | F385: C#Web 服务高级编程――使用.NET Remoting 和ASP.NET 创建WEB服务 | G385: 康博 译 | H385: 68.00 | I385: 37469 | J385: 6
A386: =ROW()-2 -> 983 | B386: TP | C386: 5749 | D386: 1 | E386: 05749-4 | F386: ASP. NET Web 站点高级编程 | G386: 康博 译 | H386: 55.00 | I386: 37500 | J386: 6
A387: =ROW()-2 -> 984 | B387: TP | C387: 5412 | D387: 1 | E387: 05412-0 | F387: 微软NET编程系列 Microsoft. NET My Services 精解 | G387: 微软公司 | H387: 69.00 | I387: 37500 | J387: 5
A388: =ROW()-2 -> 985 | B388: TP | C388: 5715 | D388: 1 | E388: 05715-X | F388: Visual C++.NET编程经典----从C++到Visual C++.NET快速进阶 | G388: 康博 译 | H388: 46.00 | I388: 37500 | J388: 7
A389: =ROW()-2 -> 986 | B389: TP | C389: 5808 | D389: 1 | E389: 05808-3 | F389: C#程序员参考手册 | G389: 康博 译 | H389: 55.00 | I389: 37500 | J389: 7
A390: =ROW()-2 -> 987 | B390: TP | C390: 5806 | D390: 1 | E390: 05806-7 | F390: VB.NET高级编程（第2版） | G390: 张加荣译 | H390: 96.00 | I390: 37500 | J390: 4
A391: =ROW()-2 -> 988 | B391: TP | C391: 5889 | D391: 1 | E391: 05889-X | F391: ASP.NET1.0入门经典――VB.NET编程篇 | G391: 康博 译 | H391: 78.00 | I391: 37530 | J391: 5
A392: =ROW()-2 -> 989 | B392: TP | C392: 5750 | D392: 1 | E392: 05750-8 | F392: ASP.NET服务器控件高级编程 | G392: 袁勤勇等译 | H392: 48.00 | I392: 37500 | J392: 8
A393: =ROW()-2 -> 990 | B393: TP | C393: 5886 | D393: 1 | E393: 05886-5 | F393: .NET Freamework 编程思想 | G393: 袁勤勇等译 | H393: 35.00 | I393: 37530 | J393: 12
A394: =ROW()-2 -> 991 | B394: TP | C394: 5925 | D394: 1 | E394: 05925-X | F394: Visual Basic.NET线程参考手册 | G394: 康博 译 | H394: 32.00 | I394: 37530 | J394: 12
F395: Deitel 编程金典
A396: =ROW()-2 -> 993 | B396: TP | C396: 5751 | D396: 1 | E396: 05751-6 | F396: Deitel 编程金典; Perl How to program、Perl 编程金典 | G396: H.M.Deitel etal | H396: 128.00 | I396: 37500 | J396: 3
A397: =ROW()-2 -> 994 | B397: TP | C397: 5785 | D397: 1 | E397: 05785-0 | F397: Deitel 编程金典: C++编程金典（第3版） | G397: H.M.Destel | H397: 118.00 | I397: 37500 | J397: 3
F398: EDA工程系列丛书
A399: =ROW()-2 -> 996 | B399: TP | C399: 3896 | D399: 2 | E399: 03896-1 | F399: VHDL程序设计(第二版) | G399: 曾繁泰等 | H399: 37.00 | I399: 36951 | J399: 8
A400: =ROW()-2 -> 997 | B400: TP | C400: 4312 | D400: 1 | E400: 04312-4 | F400: 可编程器件应用导论 | G400: 曾繁泰等 | H400: 30.00 | I400: 36982 | J400: 9
A401: =ROW()-2 -> 998 | B401: TP | C401: 5057 | D401: 1 | E401: 05057-0 | F401: EDA工程概论 | G401: 曾繁泰等 | H401: 41.00 | I401: 37288 | J401: 6
F402: 计算机实用技术与案例丛书
A403: =ROW()-2 -> 1000 | B403: TP | C403: 1096 | D403: 1 | E403: 01096-X | F403: Java 编程实用技术与案例 | G403: 杨绍方 | H403: 34.00 | I403: 36951 | J403: 8
A404: =ROW()-2 -> 1001 | B404: TP | C404: 4445 | D404: 1 | E404: 04445-7 | F404: Photoshop 6.0 实用技术与案例 | G404: 周天明等 | H404: 29.00 | I404: 37337 | J404: 7
A405: =ROW()-2 -> 1002 | B405: TP | C405: 4349 | D405: 1 | E405: 04349-3 | F405: 计算机工程绘图及动画设计技巧与实例 | G405: 郭克希等 | H405: 32.00 | I405: 36982 | J405: 8
A406: =ROW()-2 -> 1003 | B406: TP | C406: 4398 | D406: 1 | E406: 04398-1 | F406: Visual C++ 6.0 编程实用技术与案例 | G406: 陈元琰等 | H406: 51.00 | I406: 37196 | J406: 5
F407: 百 问 丛 书
A408: =ROW()-2 -> 1005 | B408: TP | C408: 3097 | D408: 1 | E408: 03097-9 | F408: Word 97 中文版实用100问 | G408: 史惠康等 | H408: 8.50 | I408: 1998 | J408: 35
A409: =ROW()-2 -> 1006 | B409: TP | C409: 3086 | D409: 1 | E409: 03086-3 | F409: Access 97 中文版实用100问 | G409: 史惠康等 | H409: 8.50 | I409: 1998 | J409: 30
A410: =ROW()-2 -> 1007 | B410: TP | C410: 3151 | D410: 1 | E410: 03151-7 | F410: PowerPoint 97中文版实用100问 | G410: 史惠康等 | H410: 8.50 | I410: 1998 | J410: 30
A411: =ROW()-2 -> 1008 | B411: TP | C411: 3178 | D411: 1 | E411: 03178-9 | F411: 常用小工具软件100问 | G411: 史惠康等 | H411: 8.50 | I411: 1998 | J411: 22
F412: 电脑应用百科系列读物
A413: =ROW()-2 -> 1010 | B413: TP | C413: 3929 | D413: 1 | E413: 03929-1 | F413: 电脑入门和基本操作（配光盘） | G413: 史斌星等 | H413: 25.00 | I413: 37104 | J413: 15
A414: =ROW()-2 -> 1011 | B414: TP | C414: 3929 | D414: 2 | E414: 03929-1 | F414: 怎样上网和制作网页（配光盘） | G414: 高婉英等 | H414: 25.00 | I414: 37408 | J414: 14
A415: =ROW()-2 -> 1012 | B415: TP | C415: 3929 | D415: 3 | E415: 03929-1 | F415: 怎样用电脑管理日常事物（配光盘） | G415: 刘朝芬等 | H415: 25.00 | I415: 36739 | J415: 15
A416: =ROW()-2 -> 1013 | B416: TP | C416: 1499 | D416: 2 | E416: 01499-X | F416: 怎样玩电脑游戏 | G416: 刘朝芬 | H416: 12.00 | I416: 36861 | J416: 20
A417: =ROW()-2 -> 1014 | B417: TP | C417: 3929 | D417: 4 | E417: 03929-1 | F417: 汉字输入和文稿编辑（配光盘） | G417: 史斌星等 | H417: 25.00 | I417: 36861 | J417: 15
A418: =ROW()-2 -> 1015 | B418: TP | C418: 3929 | D418: 5 | E418: 03929-2 | F418: 图片的制作和欣赏（配光盘） | G418: 史斌星等 | H418: 25.00 | I418: 36861 | J418: 15
E419: IT&AT 教育部实用型信息技术人才培养系列教材
A420: =ROW()-2 -> 1017 | B420: TP | C420: 4973 | D420: 2 | E420: 04973-4 | F420: Delphi6编程基础 | G420: 肖建 等 | H420: 36.00 | I420: 37347 | J420: 7
A421: =ROW()-2 -> 1018 | B421: TP | C421: 5398 | D421: 1 | E421: 05398-7 | F421: 自己动手建商务网站 | G421: 张义忠 | H421: 32.00 | I421: 37347 | J421: 8
A422: =ROW()-2 -> 1019 | B422: TP | C422: 4632 | D422: 2 | E422: 04632-8 | F422: C++语言基础教程 | G422: 徐孝凯 | H422: 28.00 | I422: 37349 | J422: 10
A423: =ROW()-2 -> 1020 | B423: TP | C423: 4632 | D423: 2 | E423: 04632-8 | F423: C++语言基础教程（配光盘） | G423: 徐孝凯 | H423: 36.00 | I423: 37469 | J423: 10
A424: =ROW()-2 -> 1021 | B424: TP | C424: 4579 | D424: 1 | E424: 04579-8 | F424: 自己动手组装和维护多媒体电脑 | G424: 何卫雄等 | H424: 26.00 | I424: 37257 | J424: 10
A425: =ROW()-2 -> 1022 | B425: TP | C425: 4687 | D425: 1 | E425: 04687-5 | F425: 计算机机房管理 | G425: 方刚 等 | H425: 30.00 | I425: 37438 | J425: 9
A426: =ROW()-2 -> 1023 | B426: TP | C426: 4703 | D426: 1 | E426: 04703-0 | F426: 常用工具软件 | G426: 孙雷 等 | H426: 18.00 | I426: 37408 | J426: 14
A427: =ROW()-2 -> 1024 | B427: TP | C427: 4658 | D427: 1 | E427: 04658-1 | F427: Perl 5 程序设计 | G427: 戴高乐等 | H427: 28.00 | I427: 37135 | J427: 10
A428: =ROW()-2 -> 1025 | B428: TP | C428: 4638 | D428: 4 | E428: 04638-7 | F428: Internet 应用教程 | G428: 谭浩强 | H428: 20.00 | I428: 37165 | J428: 14
A429: =ROW()-2 -> 1026 | B429: TP | C429: 5011 | D429: 2 | E429: 05011-2 | F429: 边用边学 C 语言（含光盘） | G429: 郎建昭 | H429: 33.00 | I429: 37347 | J429: 11
A430: =ROW()-2 -> 1027 | B430: TP | C430: 4009 | D430: 1 | E430: 04009-5 | F430: 自己动手建立个人网站 | G430: 张 秦 | H430: 20.00 | I430: 37500 | J430: 18
A431: =ROW()-2 -> 1028 | B431: TP | C431: 4031 | D431: 1 | E431: 04031-1 | F431: 自己动手建立企业局域网 | G431: 吴怀宇 | H431: 33.00 | I431: 37438 | J431: 9
A432: =ROW()-2 -> 1029 | B432: TP | C432: 4030 | D432: 1 | E432: 04030-3 | F432: 自己动手建立企业网站 | G432: 李颂华 | H432: 32.00 | I432: 37165 | J432: 9
A433: =ROW()-2 -> 1030 | B433: TP | C433: 1378 | D433: 1 | E433: 01378-0 | F433: 自己动手制作动态网页 | G433: 邱亚希 | H433: 32.00 | I433: 36982 | J433: 9
A434: =ROW()-2 -> 1031 | B434: TP | C434: 4381 | D434: 1 | E434: 04381-7 | F434: 边用边学 Delphi 编程 | G434: 刘彦利等 | H434: 19.80 | I434: 37012 | J434: 13
A435: =ROW()-2 -> 1032 | B435: TP | C435: 4362 | D435: 1 | E435: 04362-9 | F435: 边用边学 Visual FoxPro 编程 | G435: 张治文 | H435: 28.00 | I435: 37347 | J435: 9
A436: =ROW()-2 -> 1033 | B436: TP | C436: 1070 | D436: 1 | E436: 01070-6 | F436: 边用边学 Visual Basic 编程 | G436: 魏江江 | H436: 29.00 | I436: 37362 | J436: 8
A437: =ROW()-2 -> 1034 | B437: TP | C437: 4166 | D437: 1 | E437: 04166-0 | F437: 边用边学Power Builder编程 | G437: 李礼 等 | H437: 21.00 | I437: 37319 | J437: 14
A438: =ROW()-2 -> 1035 | B438: TP | C438: 4124 | D438: 1 | E438: 04124-5 | F438: 边用边学 Visual C++ 编程 | G438: 黄维通等 | H438: 34.00 | I438: 36923 | J438: 8
A439: =ROW()-2 -> 1036 | B439: TP | C439: 5134 | D439: 1 | E439: 05134-8 | F439: 边用边学 Linux | G439: Xteam | H439: 24.00 | I439: 37358 | J439: 10
A440: =ROW()-2 -> 1037 | B440: TP | C440: 5078 | D440: 1 | E440: 05078-3 | F440: 边用边学 计算机英语 | G440: 刘兆毓等 | H440: 18.00 | I440: 37316 | J440: 15
A441: =ROW()-2 -> 1038 | B441: P- | C441: 4179 | D441: 1 | E441: 04179-1 | F441: 边用边学Fireworks设计互动网页(配光盘) | G441: 王彦峰等 | H441: 27.00 | I441: 37377 | J441: 12
A442: =ROW()-2 -> 1039 | B442: TP | C442: 5212 | D442: 1 | E442: 05212-1 | F442: 多媒体基础 | G442: 陈明 | H442: 24.00 | I442: 37377 | J442: 11
A443: =ROW()-2 -> 1040 | B443: P- | C443: 4355 | D443: 1 | E443: 7900643559 | F443: 网站美工高级培训教程（配光盘） | G443: 张帆 | H443: 39.50 | I443: 37530 | J443: 8
F444: 信息技术 (CIT)系 列
A445: =ROW()-2 -> 1042 | B445: TP | C445: 2042 | D445: 9 | E445: 02042-6 | F445: 计算机初阶 | G445: 苏运霖 | H445: 18.50 | I445: 36892 | J445: 15
E446: 看图速成系列 | F446: 看图速成系列
A447: =ROW()-2 -> 1044 | B447: TP | C447: 0837 | D447: 1 | E447: 00837-X | F447: Windows 2000 中文版看图速成 | G447: 王彦峰等 | H447: 30.00 | I447: 36923 | J447: 9
A448: =ROW()-2 -> 1045 | B448: TP | C448: 5515 | D448: 1 | E448: 05515-1 | F448: 常用工具软件看图速成 | G448: 程旭 等 | H448: 27.00 | I448: 37408 | J448: 9
A449: =ROW()-2 -> 1046 | B449: TP | C449: 4017 | D449: 1 | E449: 04017-6 | F449: Windows ME 中文版看图速成 | G449: 王剑 等 | H449: 24.00 | I449: 36923 | J449: 10
A450: =ROW()-2 -> 1047 | B450: TP | C450: 4635 | D450: 1 | E450: 04635-2 | F450: Windows XP 中文版看图速成 | G450: 黄劲杉等 | H450: 26.00 | I450: 37349 | J450: 10
A451: =ROW()-2 -> 1048 | B451: TP | C451: 4625 | D451: 1 | E451: 04625-5 | F451: WPS Office 看图速成 | G451: 仇轶 等 | H451: 27.00 | I451: 37328 | J451: 9
A452: =ROW()-2 -> 1049 | B452: TP | C452: 4618 | D452: 1 | E452: 04618-2 | F452: Office XP 中文版看图速成 | G452: 王冬 等 | H452: 33.00 | I452: 37135 | J452: 7
A453: =ROW()-2 -> 1050 | B453: TP | C453: 4675 | D453: 1 | E453: 04675-1 | F453: Word 2002 中文版看图速成 | G453: 张少宇等 | H453: 28.00 | I453: 37226 | J453: 10
A454: =ROW()-2 -> 1051 | B454: TP | C454: 4576 | D454: 1 | E454: 04576-3 | F454: Excel 2002 中文版看图速成 | G454: 潘宁 等 | H454: 27.00 | I454: 37104 | J454: 9
A455: =ROW()-2 -> 1052 | B455: TP | C455: 4619 | D455: 1 | E455: 04619-0 | F455: FrontPage 2002 中文版看图速成 | G455: 李海峰等 | H455: 28.00 | I455: 37257 | J455: 9
A456: =ROW()-2 -> 1053 | B456: TP | C456: 3704 | D456: 3 | E456: 03704-3 | F456: WPS 2000 中文版看图速成 | G456: 张凤龙等 | H456: 20.00 | I456: 36861 | J456: 12
A457: =ROW()-2 -> 1054 | B457: TP | C457: 3477 | D457: 3 | E457: 03477-X | F457: Office 2000 中文版看图速成 | G457: 鑫万博 | H457: 25.00 | I457: 37257 | J457: 10
A458: =ROW()-2 -> 1055 | B458: TP | C458: 1280 | D458: 1 | E458: 01280-6 | F458: Premiere 5.5 看图速成 | G458: 郭亮 等 | H458: 28.00 | I458: 36951 | J458: 10
A459: =ROW()-2 -> 1056 | B459: TP | C459: 4416 | D459: 1 | E459: 04416-3 | F459: IE 5.5 上网起步看图速成 | G459: 农孙雄等 | H459: 24.00 | I459: 37012 | J459: 11
A460: =ROW()-2 -> 1057 | B460: TP | C460: 1377 | D460: 1 | E460: 01377-2 | F460: 网上冲浪看图速成 | G460: 雨波 等 | H460: 23.80 | I460: 36951 | J460: 12
A461: =ROW()-2 -> 1058 | B461: P- | C461: 4006 | D461: 1 | E461: 7880140069 | F461: Internet 看图速成――实用技巧篇（配光盘） | G461: 汪 晶 | H461: 28.00 | I461: 37012 | J461: 10
A462: =ROW()-2 -> 1059 | B462: TP | C462: 4438 | D462: 1 | E462: 04438-4 | F462: Fireworks 4 看图速成 | G462: 夏辉 等 | H462: 22.00 | I462: 37012 | J462: 11
A463: =ROW()-2 -> 1060 | B463: TP | C463: 4617 | D463: 1 | E463: 04617-4 | F463: AutoCAD 2002 看图速成 | G463: 肖军 等 | H463: 28.00 | I463: 37104 | J463: 10
A464: =ROW()-2 -> 1061 | B464: TP | C464: 3476 | D464: 3 | E464: 03476-1 | F464: Word 2000 中文版看图速成 | G464: 应 勤 | H464: 19.80 | I464: 37104 | J464: 12
A465: =ROW()-2 -> 1062 | B465: TP | C465: 3454 | D465: 2 | E465: 03454-0 | F465: Excel 2000 中文版看图速成 | G465: 张凤龙 | H465: 22.80 | I465: 37469 | J465: 10
A466: =ROW()-2 -> 1063 | B466: TP | C466: 3579 | D466: 2 | E466: 03579-2 | F466: Access 2000 中文版看图速成 | G466: 白致铭 | H466: 19.50 | I466: 36465 | J466: 10
A467: =ROW()-2 -> 1064 | B467: TP | C467: 3614 | D467: 1 | E467: 03614-4 | F467: Outlook 2000 中文版看图速成 | G467: 朱宏伟 | H467: 19.00 | I467: 36404 | J467: 12
A468: =ROW()-2 -> 1065 | B468: TP | C468: 3455 | D468: 2 | E468: 03455-9 | F468: PowerPoint 2000中文版看图速成 | G468: 李晓红 | H468: 19.80 | I468: 37012 | J468: 12
A469: =ROW()-2 -> 1066 | B469: TP | C469: 3478 | D469: 2 | E469: 03478-8 | F469: FrontPage 2000 中文版看图速成 | G469: 杨学斌 | H469: 18.00 | I469: 37165 | J469: 14
A470: =ROW()-2 -> 1067 | B470: TP | C470: 3095 | D470: 6 | E470: 03095-2 | F470: Windows 98 中文版看图速成 | G470: 鑫万博 | H470: 24.50 | I470: 37362 | J470: 10
A471: =ROW()-2 -> 1068 | B471: TP | C471: 2654 | D471: 9 | E471: 02654-8 | F471: Word 97中文版看图速成 | G471: 应 勤 | H471: 19.80 | I471: 36647 | J471: 11
A472: =ROW()-2 -> 1069 | B472: TP | C472: 2656 | D472: 5 | E472: 02656-4 | F472: Excel 97中文版看图速成 | G472: 樊 荣 | H472: 19.50 | I472: 36373 | J472: 12
A473: =ROW()-2 -> 1070 | B473: TP | C473: 3165 | D473: 1 | E473: 03165-7 | F473: Outlook 97 中文版看图速成 | G473: 黎建辉 | H473: 19.80 | I473: 1998 | J473: 10
A474: =ROW()-2 -> 1071 | B474: TP | C474: 3338 | D474: 3 | E474: 03338-2 | F474: Photoshop 5.0 看图速成 | G474: 东方人华 | H474: 21.00 | I474: 36739 | J474: 11
A475: =ROW()-2 -> 1072 | B475: TP | C475: 0697 | D475: 1 | E475: 00697-0 | F475: Photoshop 6.0 看图速成 | G475: 王谦 等 | H475: 30.00 | I475: 37135 | J475: 8
A476: =ROW()-2 -> 1073 | B476: TP | C476: 4471 | D476: 1 | E476: 04471-6 | F476: CorelDRAW 10 看图速成 | G476: 吴光 等 | H476: 30.80 | I476: 37104 | J476: 9
A477: =ROW()-2 -> 1074 | B477: TP | C477: 4417 | D477: 1 | E477: 04417-1 | F477: 3DS MAX 看图速成 | G477: 马赢 等 | H477: 32.00 | I477: 37104 | J477: 8
A478: =ROW()-2 -> 1075 | B478: TP | C478: 1339 | D478: 1 | E478: 01339-X | F478: COOL 3D 3.0 看图速成 | G478: 王谦 等 | H478: 28.80 | I478: 36951 | J478: 9
A479: =ROW()-2 -> 1076 | B479: TP | C479: 3539 | D479: 3 | E479: 03539-3 | F479: Authorware 5.0 看图速成 | G479: 所玉君 | H479: 24.50 | I479: 37104 | J479: 10
A480: =ROW()-2 -> 1077 | B480: TP | C480: 4180 | D480: 1 | E480: 04180-6 | F480: Authorware 5.x看图速成 | G480: 魏洪斌等 | H480: 25.00 | I480: 36982 | J480: 11
A481: =ROW()-2 -> 1078 | B481: TP | C481: 3601 | D481: 2 | E481: 03601-2 | F481: PageMaker 6.5 看图速成 | G481: 淦 伟 | H481: 22.50 | I481: 36557 | J481: 10
A482: =ROW()-2 -> 1079 | B482: TP | C482: 4073 | D482: 1 | E482: 04073-7 | F482: Dreamweaver 3.0 看图速成 | G482: 王 谦 | H482: 28.80 | I482: 36831 | J482: 8
A483: =ROW()-2 -> 1080 | B483: TP | C483: 4472 | D483: 1 | E483: 04472-4 | F483: Dreamweaver 4 看图速成 | G483: 王冬 等 | H483: 29.80 | I483: 37104 | J483: 9
A484: =ROW()-2 -> 1081 | B484: TP | C484: 1200 | D484: I | E484: 01200-8 | F484: Flash 5 看图速成 | G484: 吴光 等 | H484: 29.80 | I484: 36982 | J484: 8
A485: =ROW()-2 -> 1082 | B485: TP | C485: 4142 | D485: 1 | E485: 04142-3 | F485: FreeHand 9 看图速成 | G485: 雷福林等 | H485: 23.80 | I485: 36861 | J485: 12
A486: =ROW()-2 -> 1083 | B486: TP | C486: 1132 | D486: 1 | E486: 01132-X | F486: Internet 看图速成 ―― 入门篇 | G486: 汪 晶 | H486: 14.00 | I486: 36861 | J486: 15
A487: =ROW()-2 -> 1084 | B487: TP | C487: 1132 | D487: 2 | E487: 01132-X | F487: Internet 看图速成 ―― 入门篇（配光盘） | G487: 汪 晶 | H487: 24.00 | I487: 36800 | J487: 15
A488: =ROW()-2 -> 1085 | B488: TP | C488: 1133 | D488: 1 | E488: 01133-8 | F488: Internet 看图速成 ―― 提高篇 | G488: 汪 晶 | H488: 19.00 | I488: 36800 | J488: 14
A489: =ROW()-2 -> 1086 | B489: TP | C489: 1133 | D489: 2 | E489: 01133-8 | F489: Internet 看图速成 ―― 提高篇（配光盘） | G489: 汪 晶 | H489: 28.00 | I489: 36739 | J489: 12
A490: =ROW()-2 -> 1087 | B490: TP | C490: 4087 | D490: 1 | E490: 04087-7 | F490: Maya 3.0 看图速成 | G490: 仲喃喃等 | H490: 29.80 | I490: 36982 | J490: 9
A491: =ROW()-2 -> 1088 | B491: TP | C491: 4227 | D491: 1 | E491: 04227-6 | F491: 电脑日常维护看图速成 | G491: 宁松 等 | H491: 27.00 | I491: 37438 | J491: 9
A492: =ROW()-2 -> 1089 | B492: TP | C492: 3479 | D492: 1 | E492: 03479-6 | F492: Director 6.X 看图速成 | G492: 孙久文 | H492: 22.00 | I492: 36281 | J492: 10
A493: =ROW()-2 -> 1090 | B493: TP | C493: 0698 | D493: 1 | E493: 00698-9 | F493: Director 8.0 看图速成 | G493: 刘刀桂等 | H493: 21.00 | I493: 36831 | J493: 13
A494: =ROW()-2 -> 1091 | B494: TP | C494: 5180 | D494: 1 | E494: 05180-1 | F494: PageMaker7.0看图速成 | G494: 余磊等 | H494: 27.00 | I494: 37316 | J494: 10
A495: =ROW()-2 -> 1092 | B495: TP | C495: 5396 | D495: 1 | E495: 05396-0 | F495: Flash MX看图速成 | G495: 巨泽建等 | H495: 25.50 | I495: 37377 | J495: 10
A496: =ROW()-2 -> 1093 | B496: TP | C496: 5348 | D496: 1 | E496: 05348-0 | F496: Authorware 6.0看图速成 | G496: 黄劲杉等 | H496: 27.00 | I496: 37347 | J496: 9
A497: =ROW()-2 -> 1094 | B497: TP | C497: 5627 | D497: 1 | E497: 05627-7 | F497: Photoshop 7.0看图速成 | G497: 凌晓聪等 | H497: 28.00 | I497: 37469 | J497: 9
A498: =ROW()-2 -> 1095 | B498: TP | C498: 5614 | D498: 1 | E498: 05614-5 | F498: 我的第一个主页 | G498: 王苏颖等 | H498: 27.00 | I498: 37469 | J498: 10
A499: =ROW()-2 -> 1096 | B499: TP | C499: 5872 | D499: 1 | E499: 05872-5 | F499: Dreamweaver MX看图速成 | G499: 魏洪斌等 | H499: 28.00 | I499: 37530 | J499: 10
F500: 流行软件速成丛书
A501: =ROW()-2 -> 1098 | B501: TP | C501: 1313 | D501: 2 | E501: 01313-6 | F501: Windows 2000 中文版使用速成 | G501: 梁书斌等 | H501: 32.00 | I501: 36831 | J501: 7
A502: =ROW()-2 -> 1099 | B502: TP | C502: 4057 | D502: 1 | E502: 04057-5 | F502: Windows ME 中文版使用速成 | G502: 康博创作室 | H502: 32.00 | I502: 36982 | J502: 9
A503: =ROW()-2 -> 1100 | B503: TP | C503: 4727 | D503: 1 | E503: 04727-8 | F503: Office XP 中文版使用速成 | G503: 刘钦彦等 | H503: 42.80 | I503: 37377 | J503: 6
A504: =ROW()-2 -> 1101 | B504: TP | C504: 4692 | D504: 1 | E504: 04692-1 | F504: Word 2002 中文版使用速成 | G504: 左禹 等 | H504: 28.00 | I504: 37257 | J504: 9
A505: =ROW()-2 -> 1102 | B505: TP | C505: 4728 | D505: 1 | E505: 04728-6 | F505: Excel 2002 中文版使用速成 | G505: 牟洪雨等 | H505: 29.00 | I505: 37226 | J505: 9
A506: =ROW()-2 -> 1103 | B506: TP | C506: 4786 | D506: 1 | E506: 04786-3 | F506: Access 2002 中文版使用速成 | G506: 武陵 等 | H506: 34.80 | I506: 37288 | J506: 8
A507: =ROW()-2 -> 1104 | B507: TP | C507: 4693 | D507: 1 | E507: 04693-X | F507: FrontPage 2002 中文版使用速成 | G507: 任广杰等 | H507: 24.00 | I507: 37257 | J507: 11
A508: =ROW()-2 -> 1105 | B508: TP | C508: 4709 | D508: 1 | E508: 04709-X | F508: PowerPoint 2002 中文版使用速成 | G508: 何百磊等 | H508: 26.00 | I508: 37165 | J508: 10
A509: =ROW()-2 -> 1106 | B509: TP | C509: 5179 | D509: 1 | E509: 05179-8 | F509: Windows XP 中文版使用速成 | G509: 程旭等 | H509: 30.00 | I509: 37316 | J509: 9
A510: =ROW()-2 -> 1107 | B510: TP | C510: 2813 | D510: 9 | E510: 02813-3 | F510: Office 97中文版使用速成 | G510: 黄林红等 | H510: 20.00 | I510: 36892 | J510: 10
A511: =ROW()-2 -> 1108 | B511: TP | C511: 3081 | D511: 2 | E511: 03081-2 | F511: Access 97中文版使用速成 | G511: 贺民 等 | H511: 16.00 | I511: 1999 | J511: 13
A512: =ROW()-2 -> 1109 | B512: TP | C512: 2885 | D512: 4 | E512: 02885-0 | F512: Excel 97 中文版使用速成 | G512: 张文 等 | H512: 15.00 | I512: 36404 | J512: 13
A513: =ROW()-2 -> 1110 | B513: TP | C513: 4907 | D513: 1 | E513: 04907-6 | F513: Visio 2002 使用速成 | G513: 黄劲杉等 | H513: 26.50 | I513: 37196 | J513: 10
A514: =ROW()-2 -> 1111 | B514: TP | C514: 5010 | D514: 1 | E514: 05010-4 | F514: Mastercam 8.X 使用速成 | G514: 巨泽建等 | H514: 36.00 | I514: 37226 | J514: 8
A515: =ROW()-2 -> 1112 | B515: TP | C515: 3352 | D515: 5 | E515: 03352-8 | F515: AutoCAD R14 中文版使用速成 | G515: 崔洪斌等 | H515: 19.50 | I515: 36923 | J515: 12
A516: =ROW()-2 -> 1113 | B516: TP | C516: 3689 | D516: 2 | E516: 03689-6 | F516: AutoCAD 2000 中文版使用速成 | G516: 康博创作室 | H516: 19.50 | I516: 37469 | J516: 11
A517: =ROW()-2 -> 1114 | B517: TP | C517: 1068 | D517: 1 | E517: 01068-4 | F517: AutoCAD 2000 I 使用速成 | G517: 康博创作室 | H517: 32.00 | I517: 36982 | J517: 9
A518: =ROW()-2 -> 1115 | B518: TP | C518: 3491 | D518: 3 | E518: 03491-5 | F518: Photoshop 5.0 中文版使用速成 | G518: 康博创作室 | H518: 27.00 | I518: 36831 | J518: 8
A519: =ROW()-2 -> 1116 | B519: TP | C519: 1019 | D519: 1 | E519: 01019-6 | F519: Photoshop 5.5 使用速成 | G519: 康博创作室 | H519: 30.00 | I519: 36739 | J519: 8
A520: =ROW()-2 -> 1117 | B520: TP | C520: 4135 | D520: 1 | E520: 04135-0 | F520: Photoshop 6.0 使用速成 | G520: 王军 等 | H520: 35.00 | I520: 36923 | J520: 9
A521: =ROW()-2 -> 1118 | B521: TP | C521: 4402 | D521: 1 | E521: 04402-3 | F521: PhotoImpact 6.0 使用速成 | G521: 康博创作室 | H521: 29.80 | I521: 37012 | J521: 9
A522: =ROW()-2 -> 1119 | B522: TP | C522: 1373 | D522: 2 | E522: 01373-X | F522: Maya 3.0 使用速成 | G522: 郭骁 等 | H522: 38.00 | I522: 36951 | J522: 7
A523: =ROW()-2 -> 1120 | B523: TP | C523: 1458 | D523: 2 | E523: 01458-2 | F523: Illustrator 9.0 使用速成 | G523: 康博创作室 | H523: 22.80 | I523: 36982 | J523: 11
A524: =ROW()-2 -> 1121 | B524: TP | C524: 4384 | D524: 1 | E524: 04384-1 | F524: 3DS MAX 4 使用速成 | G524: 孙海峰等 | H524: 25.00 | I524: 37135 | J524: 10
A525: =ROW()-2 -> 1122 | B525: TP | C525: 0749 | D525: 1 | E525: 00749-7 | F525: 3D Studio MAX R3 使用速成 | G525: 康博创作室 | H525: 29.00 | I525: 36617 | J525: 10
A526: =ROW()-2 -> 1123 | B526: TP | C526: 3862 | D526: 1 | E526: 03862-7 | F526: 3D Studio Viz R3 使用速成 | G526: 王 军 | H526: 34.80 | I526: 36708 | J526: 8
A527: =ROW()-2 -> 1124 | B527: TP | C527: 1222 | D527: 1 | E527: 01222-9 | F527: Poser 4 使用速成 | G527: 康博创作室 | H527: 20.00 | I527: 36831 | J527: 15
A528: =ROW()-2 -> 1125 | B528: TP | C528: 0981 | D528: 1 | E528: 00981-3 | F528: Director 8 使用速成 | G528: 康博创作室 | H528: 21.00 | I528: 36800 | J528: 12
A529: =ROW()-2 -> 1126 | B529: TP | C529: 4302 | D529: 1 | E529: 04302-7 | F529: 中文版 Linux 使用速成 | G529: 张红军等 | H529: 35.00 | I529: 36982 | J529: 8
A530: =ROW()-2 -> 1127 | B530: TP | C530: 0886 | D530: 1 | E530: 00886-8 | F530: Freehand 9 使用速成 | G530: 康博创作室 | H530: 28.00 | I530: 36770 | J530: 11
A531: =ROW()-2 -> 1128 | B531: TP | C531: 4657 | D531: 1 | E531: 04657-3 | F531: Corel DRAW 10 使用速成 | G531: 吴光 等 | H531: 37.50 | I531: 37398 | J531: 7
A532: =ROW()-2 -> 1129 | B532: TP | C532: 2298 | D532: 1 | E532: 02298-4 | F532: Corel DRAW 9 使用速成 | G532: 康博创作室 | H532: 18.00 | I532: 36923 | J532: 13
A533: =ROW()-2 -> 1130 | B533: TP | C533: 3719 | D533: 1 | E533: 03719-1 | F533: Authorware 5 使用速成 | G533: 康博创作室 | H533: 22.50 | I533: 36951 | J533: 10
A534: =ROW()-2 -> 1131 | B534: TP | C534: 3023 | D534: 1 | E534: 03023-5 | F534: VRML2.0使用速成 | G534: 施寅 等 | H534: 16.50 | I534: 1998 | J534: 13
A535: =ROW()-2 -> 1132 | B535: TP | C535: 4186 | D535: 1 | E535: 04186-5 | F535: Flash 5 使用速成 | G535: 康博创作室 | H535: 19.00 | I535: 36892 | J535: 13
A536: =ROW()-2 -> 1133 | B536: TP | C536: 1390 | D536: 2 | E536: 01390-X | F536: Norton SystemWorks 2000 使用速成 | G536: 康博创作室 | H536: 19.00 | I536: 36951 | J536: 15
A537: =ROW()-2 -> 1134 | B537: TP | C537: 3962 | D537: 1 | E537: 03962-3 | F537: Fireworks 3.0 使用速成 | G537: 鞠盈禧等 | H537: 20.00 | I537: 36739 | J537: 14
A538: =ROW()-2 -> 1135 | B538: TP | C538: 3856 | D538: 1 | E538: 03856-2 | F538: Dreamweaver 3.0 使用速成 | G538: 周苏明等 | H538: 21.00 | I538: 36831 | J538: 12
A539: =ROW()-2 -> 1136 | B539: TP | C539: 1032 | D539: 1 | E539: 01032-3 | F539: Office 2000 中文版使用速成 | G539: 黄林红等 | H539: 29.80 | I539: 37438 | J539: 7
A540: =ROW()-2 -> 1137 | B540: TP | C540: 1177 | D540: 1 | E540: 01177-X | F540: Word 2000 中文版使用速成 | G540: 杨秀章等 | H540: 26.00 | I540: 36982 | J540: 8
A541: =ROW()-2 -> 1138 | B541: TP | C541: 1203 | D541: 1 | E541: 01203-2 | F541: Excel 2000 中文版使用速成 | G541: 潇湘工作室 | H541: 20.00 | I541: 36831 | J541: 12
A542: =ROW()-2 -> 1139 | B542: TP | C542: 2175 | D542: 9 | E542: 02175-9 | F542: PowerPoint 2000 中文版使用速成 | G542: 黄建江等 | H542: 20.00 | I542: 36495 | J542: 10
A543: =ROW()-2 -> 1140 | B543: TP | C543: 1305 | D543: 1 | E543: 01305-5 | F543: PhotoDraw 2000 和 Publisher 2000 中文版使用速成 | G543: 康博创作室 | H543: 30.00 | I543: 36617 | J543: 8
A544: =ROW()-2 -> 1141 | B544: TP | C544: 0773 | D544: 1 | E544: 00773-X | F544: 我行我速 3.0 使用速成 | G544: 康博创作室 | H544: 23.80 | I544: 36831 | J544: 10
A545: =ROW()-2 -> 1142 | B545: TP | C545: 3490 | D545: 3 | E545: 03490-9 | F545: Front Page 2000 中文版使用速成 | G545: 康博创作室 | H545: 17.80 | I545: 37438 | J545: 14
F546: 入门与提高丛书
A547: =ROW()-2 -> 1144 | B547: TP | C547: 3075 | D547: B | E547: 03075-8 | F547: Windows 98 中文版入门与提高 | G547: 鑫万博创作室 | H547: 37.50 | I547: 37469 | J547: 6
A548: =ROW()-2 -> 1145 | B548: TP | C548: 1149 | D548: 1 | E548: 01149-4 | F548: Windows 2000 中文版入门与提高 | G548: 东方人华 | H548: 39.80 | I548: 37500 | J548: 7
A549: =ROW()-2 -> 1146 | B549: TP | C549: 4089 | D549: 1 | E549: 04089-3 | F549: Windows Me 中文版入门与提高 | G549: 赵永捷等 | H549: 34.00 | I549: 37135 | J549: 8
A550: =ROW()-2 -> 1147 | B550: TP | C550: 3509 | D550: 1 | E550: 03509-1 | F550: Windows C程序设计入门与提高 | G550: 柳永新等 | H550: 32.50 | I550: 37438 | J550: 6
A551: =ROW()-2 -> 1148 | B551: TP | C551: 5576 | D551: 1 | E551: 05576-1 | F551: I-DEAS 入门与提高 | G551: 杨建新等 | H551: 23.00 | I551: 37438 | J551: 10
A552: =ROW()-2 -> 1149 | B552: TP | C552: 4488 | D552: 1 | E552: 04488-0 | F552: Office XP 中文版入门与提高 | G552: 东方人华 | H552: 29.80 | I552: 37469 | J552: 7
A553: =ROW()-2 -> 1150 | B553: TP | C553: 4567 | D553: 1 | E553: 04567-4 | F553: Excel 2002 中文版入门与提高 | G553: 东方人华 | H553: 29.80 | I553: 37500 | J553: 8
A554: =ROW()-2 -> 1151 | B554: TP | C554: 4663 | D554: 1 | E554: 04663-8 | F554: PowerPoint 2002 中文版入门与提高 | G554: 东方人华 | H554: 26.00 | I554: 37408 | J554: 10
A555: =ROW()-2 -> 1152 | B555: TP | C555: 4906 | D555: 1 | E555: 04906-8 | F555: FrontPage 2002 中文版入门与提高 | G555: 杨 聪 | H555: 29.50 | I555: 37408 | J555: 8
A556: =ROW()-2 -> 1153 | B556: TP | C556: 4804 | D556: 1 | E556: 04804-5 | F556: Word 2002 中文版入门与提高 | G556: 蒋川 等 | H556: 28.00 | I556: 37469 | J556: 9
A557: =ROW()-2 -> 1154 | B557: TP | C557: 4883 | D557: 1 | E557: 04883-5 | F557: Access 2002 中文版入门与提高 | G557: 王成辉 | H557: 26.00 | I557: 37368 | J557: 9
A558: =ROW()-2 -> 1155 | B558: TP | C558: 5033 | D558: 1 | E558: 05033-3 | F558: AutoCAD 2002 入门与提高 | G558: 张跃峰等 | H558: 38.00 | I558: 37328 | J558: 6
A559: =ROW()-2 -> 1156 | B559: TP | C559: 4238 | D559: 1 | E559: 04238-1 | F559: 电脑上网入门与提高 | G559: 东方人华 | H559: 34.00 | I559: 37530 | J559: 7
A560: =ROW()-2 -> 1157 | B560: TP | C560: 4062 | D560: 1 | E560: 04062-1 | F560: 网页制作入门与提高 | G560: 东方人华 | H560: 32.00 | I560: 37469 | J560: 8
A561: =ROW()-2 -> 1158 | B561: TP | C561: 4274 | D561: 1 | E561: 04274-8 | F561: Fireworks 4 入门与提高 | G561: 李鹰 等 | H561: 28.00 | I561: 37012 | J561: 9
A562: =ROW()-2 -> 1159 | B562: TP | C562: 2588 | D562: 2 | E562: 02588-6 | F562: Windows NT 3.51中文版入门与提高 | G562: 王国栋 | H562: 35.00 | I562: 1998 | J562: 6
A563: =ROW()-2 -> 1160 | B563: TP | C563: 2835 | D563: 5 | E563: 02835-4 | F563: Windows NT Server 4.0中文版入门与提高 | G563: 王国栋等 | H563: 32.00 | I563: 37372 | J563: 7
A564: =ROW()-2 -> 1161 | B564: TP | C564: 3602 | D564: 2 | E564: 03602-0 | F564: UNIX 入门与提高 | G564: 许锦波等 | H564: 26.00 | I564: 37336 | J564: 8
A565: =ROW()-2 -> 1162 | B565: TP | C565: 0967 | D565: 1 | E565: 0967-8 | F565: Red Hat Linux 6.x 入门与提高 | G565: 陆涛涛等 | H565: 35.00 | I565: 37104 | J565: 8
A566: =ROW()-2 -> 1163 | B566: TP | C566: 4268 | D566: 1 | E566: 04268-3 | F566: 现代办公入门与提高 | G566: 东方人华 | H566: 38.00 | I566: 37469 | J566: 6
A567: =ROW()-2 -> 1164 | B567: TP | C567: 5144 | D567: 1 | E567: 05144-5 | F567: 现代办公（XP）入门与提高 | G567: 东方人华 | H567: 33.00 | I567: 37500 | J567: 7
A568: =ROW()-2 -> 1165 | B568: TP | C568: 2972 | D568: F | E568: 02972-5 | F568: Office 97 中文版入门与提高 | G568: 吕建忠等 | H568: 28.00 | I568: 36892 | J568: 8
A569: =ROW()-2 -> 1166 | B569: TP | C569: 3141 | D569: 2 | E569: 03141-X | F569: WPS97入门与提高 | G569: 丁胜昔等 | H569: 18.00 | I569: 1998 | J569: 12
A570: =ROW()-2 -> 1167 | B570: TP | C570: 3703 | D570: 2 | E570: 03703-5 | F570: WPS 2000 入门与提高 | G570: 周 斌 等 | H570: 28.00 | I570: 37043 | J570: 8
A571: =ROW()-2 -> 1168 | B571: TP | C571: 3538 | D571: 5 | E571: 03538-5 | F571: Office 2000 中文版入门与提高 | G571: 东方人华 | H571: 29.80 | I571: 37469 | J571: 8
A572: =ROW()-2 -> 1169 | B572: TP | C572: 3611 | D572: 3 | E572: 03611-X | F572: Word 2000 中文版入门与提高 | G572: 张本龙 | H572: 29.80 | I572: 37500 | J572: 8
A573: =ROW()-2 -> 1170 | B573: TP | C573: 3527 | D573: 4 | E573: 03527-X | F573: Excel 2000 中文版入门与提高 | G573: 谢国锋 | H573: 29.80 | I573: 37347 | J573: 8
A574: =ROW()-2 -> 1171 | B574: TP | C574: 3638 | D574: 2 | E574: 03638-1 | F574: PowerPoint 2000 中文版入门与提高 | G574: 谢之明 | H574: 27.50 | I574: 37469 | J574: 10
A575: =ROW()-2 -> 1172 | B575: TP | C575: 2168 | D575: 9 | E575: 02168-6 | F575: Access 2000 中文版入门与提高 | G575: 张堪 等 | H575: 22.00 | I575: 37370 | J575: 10
A576: =ROW()-2 -> 1173 | B576: TP | C576: 3593 | D576: 4 | E576: 03593-8 | F576: FrontPage 2000 中文版入门与提高 | G576: 黄敏如 | H576: 32.00 | I576: 37408 | J576: 7
A577: =ROW()-2 -> 1174 | B577: TP | C577: 3737 | D577: 1 | E577: 03737-X | F577: Outlook 2000 中文版入门与提高 | G577: 郑海利 | H577: 20.00 | I577: 36465 | J577: 12
A578: =ROW()-2 -> 1175 | B578: TP | C578: 3840 | D578: 1 | E578: 03840-6 | F578: SQL Server 7.0 入门与提高 | G578: 周绪 等 | H578: 35.00 | I578: 37365 | J578: 7
A579: =ROW()-2 -> 1176 | B579: TP | C579: 4468 | D579: 1 | E579: 04468-6 | F579: SQL Server 2000中文版 入门与提高 | G579: 周绪 等 | H579: 39.50 | I579: 37438 | J579: 7
A580: =ROW()-2 -> 1177 | B580: TP | C580: 4448 | D580: 1 | E580: 04448-1 | F580: Macromedia 网页制作软件入门与提高 | G580: 东方人华 | H580: 34.80 | I580: 37371 | J580: 6
A581: =ROW()-2 -> 1178 | B581: TP | C581: 3951 | D581: 1 | E581: 03951-8 | F581: Dreamweaver 3.0 入门与提高 | G581: 杨守申等 | H581: 29.80 | I581: 36892 | J581: 8
A582: =ROW()-2 -> 1179 | B582: TP | C582: 4355 | D582: 1 | E582: 04355-8 | F582: Dreamweaver 4 入门与提高 | G582: 东方人华 | H582: 29.80 | I582: 37408 | J582: 8
A583: =ROW()-2 -> 1180 | B583: TP | C583: 4756 | D583: 1 | E583: 04756-1 | F583: Dreamweaver UltraDev 4 入门与提高 | G583: 蔡长明等 | H583: 26.00 | I583: 37370 | J583: 9
A584: =ROW()-2 -> 1181 | B584: TP | C584: 3762 | D584: 2 | E584: 03762-0 | F584: Authorware 5.0 入门与提高 | G584: 曲 昊 | H584: 33.00 | I584: 37530 | J584: 7
A585: =ROW()-2 -> 1182 | B585: TP | C585: 1208 | D585: 1 | E585: 01208-3 | F585: MATLAB 5.x 入门与提高 | G585: 龚剑 等 | H585: 33.00 | I585: 36982 | J585: 7
A586: =ROW()-2 -> 1183 | B586: TP | C586: 3841 | D586: 1 | E586: 03841-4 | F586: 3D Studio MAX 3.0 入门与提高 | G586: 熊歆斌 | H586: 34.80 | I586: 37288 | J586: 8
A587: =ROW()-2 -> 1184 | B587: TP | C587: 4328 | D587: 1 | E587: 04328-0 | F587: Photoshop 6.0 入门与提高 | G587: 应 勤 | H587: 42.00 | I587: 37469 | J587: 6
A588: =ROW()-2 -> 1185 | B588: TP | C588: 3250 | D588: 7 | E588: 03250-5 | F588: Photoshop 5.0 入门与提高 | G588: 应 勤 | H588: 34.00 | I588: 36951 | J588: 8
A589: =ROW()-2 -> 1186 | B589: TP | C589: 4041 | D589: 1 | E589: 04041-9 | F589: Photoshop 5.x 入门与提高 | G589: 应勤 等 | H589: 39.00 | I589: 37043 | J589: 7
A590: =ROW()-2 -> 1187 | B590: TP | C590: 4026 | D590: 1 | E590: 04026-5 | F590: PhotoImpact 5.0 入门与提高 | G590: 杨 璞 | H590: 32.00 | I590: 36800 | J590: 8
A591: =ROW()-2 -> 1188 | B591: TP | C591: 3873 | D591: 1 | E591: 03873-2 | F591: Illustrator 8.0 中文版入门与提高 | G591: 苏 瑞 | H591: 29.00 | I591: 36739 | J591: 8
A592: =ROW()-2 -> 1189 | B592: TP | C592: 3860 | D592: 1 | E592: 03860-0 | F592: PageMaker 6.5C 入门与提高 | G592: 孙全党等 | H592: 24.80 | I592: 37369 | J592: 11
A593: =ROW()-2 -> 1190 | B593: TP | C593: 3851 | D593: 1 | E593: 03851-1 | F593: Premiere 5.X 入门与提高 | G593: 吴英华 | H593: 24.00 | I593: 37104 | J593: 10
A594: =ROW()-2 -> 1191 | B594: TP | C594: 3078 | D594: 9 | E594: 03078-2 | F594: AutoCAD R14 入门与提高 | G594: 张跃峰等 | H594: 35.00 | I594: 37500 | J594: 6
A595: =ROW()-2 -> 1192 | B595: TP | C595: 2171 | D595: 5 | E595: 02171-6 | F595: AutoCAD 2000 入门与提高 | G595: 张跃峰等 | H595: 42.00 | I595: 37469 | J595: 6
A596: =ROW()-2 -> 1193 | B596: TP | C596: 3899 | D596: 1 | E596: 03899-6 | F596: AutoCAD 2000 中文版入门与提高 | G596: 陈通 等 | H596: 42.80 | I596: 37469 | J596: 6
A597: =ROW()-2 -> 1194 | B597: TP | C597: 3854 | D597: 1 | E597: 03854-6 | F597: FreeHand 8.0 中文版入门与提高 | G597: 张 冲 | H597: 32.80 | I597: 36647 | J597: 8
A598: =ROW()-2 -> 1195 | B598: TP | C598: 1008 | D598: 1 | E598: 01008-0 | F598: Flash 4.0 入门与提高 | G598: 李 鹰 | H598: 25.00 | I598: 36892 | J598: 10
A599: =ROW()-2 -> 1196 | B599: TP | C599: 4469 | D599: 1 | E599: 04469-4 | F599: Flash 5 入门与提高 | G599: 赵 明 | H599: 29.50 | I599: 37469 | J599: 8
A600: =ROW()-2 -> 1197 | B600: TP | C600: 3744 | D600: 2 | E600: 03744-2 | F600: JavaScript 入门与提高 | G600: 杨 浩 | H600: 26.80 | I600: 36923 | J600: 9
A601: =ROW()-2 -> 1198 | B601: TP | C601: 3832 | D601: 1 | E601: 03832-5 | F601: Visual J++ 6.0 入门与提高 | G601: 赖宇阳等 | H601: 35.00 | I601: 36831 | J601: 8
A602: =ROW()-2 -> 1199 | B602: TP | C602: 3509 | D602: 2 | E602: 03509-1 | F602: Windows C 程序设计入门与提高 | G602: 柳永新等 | H602: 32.50 | I602: 36831 | J602: 6
A603: =ROW()-2 -> 1200 | B603: TP | C603: 2622 | D603: 4 | E603: 02622-X | F603: Visual C++ 4.X入门与提高 | G603: 柳永新等 | H603: 32.00 | I603: 1998 | J603: 8
A604: =ROW()-2 -> 1201 | B604: TP | C604: 3508 | D604: 2 | E604: 03508-3 | F604: Visual C++ 6.0 入门与提高 | G604: 徐晓刚等 | H604: 29.80 | I604: 37469 | J604: 8
A605: =ROW()-2 -> 1202 | B605: TP | C605: 2589 | D605: 4 | E605: 02589-4 | F605: Borland C++5.0入门与提高 | G605: 陈志全 | H605: 35.00 | I605: 1998 | J605: 6
A606: =ROW()-2 -> 1203 | B606: TP | C606: 3901 | D606: 1 | E606: 03901-1 | F606: Delphi 5.0入门与提高 | G606: 鲁宗相 | H606: 36.00 | I606: 37257 | J606: 7
A607: =ROW()-2 -> 1204 | B607: TP | C607: 1127 | D607: 1 | E607: 01127-3 | F607: Director 7.0/8.0 入门与提高 | G607: 蔡长明等 | H607: 27.00 | I607: 36861 | J607: 9
A608: =ROW()-2 -> 1205 | B608: TP | C608: 0767 | D608: 1 | E608: 00767-5 | F608: Oracle 8 入门与提高 | G608: 付继彬等 | H608: 29.80 | I608: 37369 | J608: 9
A609: =ROW()-2 -> 1206 | B609: TP | C609: 3558 | D609: 4 | E609: 03558-X | F609: Visual FoxPro 6.0 中文版入门与提高 | G609: 李加福等 | H609: 38.00 | I609: 37469 | J609: 7
A610: =ROW()-2 -> 1207 | B610: TP | C610: 3489 | D610: 3 | E610: 03489-3 | F610: Visual Basic 6.0中文版入门与提高 | G610: 张树兵等 | H610: 33.00 | I610: 37469 | J610: 7
A611: =ROW()-2 -> 1208 | B611: TP | C611: 5113 | D611: 1 | E611: 05113-5 | F611: 3ds max 4入门与提高 | G611: 金涛 等 | H611: 31.00 | I611: 37530 | J611: 8
A612: =ROW()-2 -> 1209 | B612: TP | C612: 5112 | D612: 1 | E612: 05112-7 | F612: JSP入门与提高 | G612: 杨学瑜 等 | H612: 24.00 | I612: 37469 | J612: 9
A613: =ROW()-2 -> 1210 | B613: TP | C613: 5141 | D613: 1 | E613: 05141-0 | F613: Photoshop 6.x 中文版入门与提高 | G613: 应勤 | H613: 37.00 | I613: 37469 | J613: 6
A614: =ROW()-2 -> 1211 | B614: TP | C614: 5372 | D614: 1 | E614: 05372-3 | F614: BIOS和注册表入门与提高 | G614: 王炯 | H614: 29.00 | I614: 37469 | J614: 8
A615: =ROW()-2 -> 1212 | B615: TP | C615: 5371 | D615: 1 | E615: 05371-5 | F615: DB2 入门与提高 | G615: 刘耸柏著 | H615: 39.00 | I615: 37500 | J615: 7
A616: =ROW()-2 -> 1213 | B616: TP | C616: 5403 | D616: 1 | E616: 05403-1 | F616: WPS office 入门与提高 | G616: 东方人华 | H616: 27.00 | I616: 37469 | J616: 9
A617: =ROW()-2 -> 1214 | B617: TP | C617: 5417 | D617: 1 | E617: 05417-7 | F617: Windows XP中文版入门与提高 | G617: 鑫万博创作室 | H617: 36.00 | I617: 37500 | J617: 6
A618: =ROW()-2 -> 1215 | B618: TP | C618: 5495 | D618: 1 | E618: 05495-9 | F618: SQL Server 2000 与Visual Basic.NET数据库.NET入门与提高 | G618: 东方人华 | H618: 38.00 | I618: 37500 | J618: 6
A619: =ROW()-2 -> 1216 | B619: TP | C619: 5597 | D619: 1 | E619: 05597-1 | F619: Photoshop 7.0 入门与提高 | G619: 应勤 | H619: 34.00 | I619: 37530 | J619: 6
A620: =ROW()-2 -> 1217 | B620: TP | C620: 5612 | D620: 1 | E620: 05612-9 | F620: Delphi 6 入门与提高 | G620: 吕伟臣 | H620: 37.00 | I620: 37500 | J620: 7
A621: =ROW()-2 -> 1218 | B621: TP | C621: 5651 | D621: 1 | E621: 05651-X | F621: Visual C++.NET入门与提高 | G621: 孙飞等 | H621: 34.00 | I621: 37469 | J621: 8
A622: =ROW()-2 -> 1219 | B622: TP | C622: 5692 | D622: 1 | E622: 056927 | F622: Visual C#.NET入门与提高 | G622: 孙永强 | H622: 41.00 | I622: 37469 | J622: 6
A623: =ROW()-2 -> 1220 | B623: TP | C623: 5769 | D623: 1 | E623: 05769-9 | F623: Flash MX入门与提高 | G623: 王太冲等 | H623: 27.00 | I623: 37500 | J623: 9
A624: =ROW()-2 -> 1221 | B624: TP | C624: 5845 | D624: 1 | E624: 05845-8 | F624: 电脑上网入门与提高（XP版） | G624: 东方人华 | H624: 36.00 | I624: 37500 | J624: 8
A625: =ROW()-2 -> 1222 | B625: TP | C625: 5796 | D625: 1 | E625: 05796-6 | F625: 电脑DIY入门与提高 | G625: 宋宏伟 | H625: 29.00 | I625: 37530 | J625: 7