F1: 专家指导丛书
A2: =ROW()-2 -> 1799 | B2: TP | C2: 4828 | D2: 1 | E2: 04828-2 | F2: Dreamweaver 4 网页设计专家指导 | G2: 王颖倩等 | H2: 35.00 | I2: 37408 | J2: 8
A3: =ROW()-2 -> 1800 | B3: TP | C3: 4785 | D3: 1 | E3: 04785-5 | F3: Fireworks 4 网页图象设计专家指导 | G3: 林渊博等 | H3: 35.00 | I3: 37196 | J3: 7
A4: =ROW()-2 -> 1801 | B4: P- | C4: 3713 | D4: 1 | E4: 7900637133 | F4: 电脑室内装修设计专家指导（配光盘） | G4: 李绍勇等 | H4: 60.00 | I4: 37344 | J4: 5
F5: 直通车系列丛书
A6: =ROW()-2 -> 1803 | B6: TP | C6: 4588 | D6: 1 | E6: 04588-7 | F6: Windows XP 直通车 | G6: 刘涛 等 | H6: 34.00 | I6: 37327 | J6: 9
A7: =ROW()-2 -> 1804 | B7: TP | C7: 4590 | D7: 1 | E7: 04590-9 | F7: Execl 2002 XP 中文版直通车 | G7: 刘胜雷等 | H7: 39.00 | I7: 37104 | J7: 7
A8: =ROW()-2 -> 1805 | B8: TP | C8: 4591 | D8: 1 | E8: 04591-7 | F8: Word 2002 中文版直通车 | G8: 徐冉 等 | H8: 35.00 | I8: 37257 | J8: 8
A9: =ROW()-2 -> 1806 | B9: TP | C9: 4592 | D9: 1 | E9: 04592-5 | F9: PowerPoint 2002 中文版直通车 | G9: 徐冉 等 | H9: 30.00 | I9: 37257 | J9: 8
A10: =ROW()-2 -> 1807 | B10: TP | C10: 5648 | D10: 1 | E10: 05648-x | F10: Photoshop 7.0 直通车 | G10: 贺军 | H10: 34.00 | I10: 37469 | J10: 8
A11: =ROW()-2 -> 1808 | B11: TP | C11: 4556 | D11: 1 | E11: 04556-9 | F11: FrontPage 2002 中文版直通车 | G11: 刘胜雷等 | H11: 29.00 | I11: 37336 | J11: 9
F12: 全面掌握中文版系列丛书
A13: =ROW()-2 -> 1810 | B13: TP | C13: 4831 | D13: 1 | E13: 04831-2 | F13: 全面掌握中文版 Excel 2002 | G13: 康博创作室 | H13: 41.00 | I13: 37469 | J13: 6
A14: =ROW()-2 -> 1811 | B14: TP | C14: 4631 | D14: 1 | E14: 04631-X | F14: 全面掌握中文版 FrontPage 2002 | G14: 康博创作室 | H14: 37.00 | I14: 37329 | J14: 7
A15: =ROW()-2 -> 1812 | B15: TP | C15: 4955 | D15: 1 | E15: 04955-6 | F15: 全面掌握中文版 Access 2002 | G15: 钟鸣 等 | H15: 46.00 | I15: 37408 | J15: 6
A16: =ROW()-2 -> 1813 | B16: TP | C16: 4986 | D16: 1 | E16: 04986-6 | F16: 全面掌握中文版 Word 2002 | G16: 康博创作室 | H16: 45.00 | I16: 37226 | J16: 6
A17: =ROW()-2 -> 1814 | B17: TP | C17: 5081 | D17: 1 | E17: 05081-3 | F17: 全面掌握中文版Windows XP | G17: 袁建华等 | H17: 36.00 | I17: 37469 | J17: 7
A18: =ROW()-2 -> 1815 | B18: TP | C18: 5082 | D18: 1 | E18: 05082-1 | F18: 全面掌握中文版 Office XP | G18: 仵春光 | H18: 59.00 | I18: 37530 | J18: 4
F19: 趣味程序导学
A20: =ROW()-2 -> 1817 | B20: P | C20: 4123 | D20: 1 | E20: 7900641238 | F20: 趣味程序导学 C++Builder（配光盘） | G20: 刘光编著 | H20: 35.00 | I20: 37257 | J20: 8
A21: =ROW()-2 -> 1818 | B21: P- | C21: 4125 | D21: 1 | E21: 7900641254 | F21: 趣味程序导学 Java 2（配光盘） | G21: 宋现锋 | H21: 32.00 | I21: 37257 | J21: 8
A22: =ROW()-2 -> 1819 | B22: P- | C22: 4124 | D22: 1 | E22: 7900641246 | F22: 趣味程序导学 JavaScript（配光盘） | G22: 杨正华等 | H22: 32.00 | I22: 37288 | J22: 8
A23: =ROW()-2 -> 1820 | B23: P- | C23: 4307 | D23: 1 | E23: 7900643079 | F23: 趣味程序导学 Visual C++（配光盘） | G23: 董末名等 | H23: 29.50 | I23: 37408 | J23: 10
A24: =ROW()-2 -> 1821 | B24: P- | C24: 4331 | D24: 1 | E24: 7900643311 | F24: 趣味程序导学 Delphi（配光盘） | G24: 杨正华等 | H24: 32.00 | I24: 37469 | J24: 9
A25: =ROW()-2 -> 1822 | B25: Ｐ- | C25: 4352 | D25: 1 | E25: 7900643524 | F25: 趣味程序导学Visual Basic （含光盘） | G25: 彭永清 | H25: 32.00 | I25: 37530 | J25: 8
F26: 编程之路系列教材
A27: =ROW()-2 -> 1824 | B27: TP | C27: 5015 | D27: 1 | E27: 05015-5 | F27: 编程之路系列教材――Visual Basic 6 程序设计导学 | G27: 刘圣才等 | H27: 32.00 | I27: 37316 | J27: 8
A28: =ROW()-2 -> 1825 | B28: TP | C28: 5246 | D28: 1 | E28: 05246-8 | F28: 编程之路系列教材――数据结构导学 | G28: 苏光奎等 | H28: 22.00 | I28: 37288 | J28: 12
A29: =ROW()-2 -> 1826 | B29: TP | C29: 5271 | D29: 1 | E29: 05271-9 | F29: 编程之路系列教材――Visual C++ 6程序设计导学 | G29: 马安鹏 | H29: 38.00 | I29: 37316 | J29: 7
A30: =ROW()-2 -> 1827 | B30: TP | C30: 5388 | D30: 1 | E30: 05388-X | F30: 编程之路系列教材――Delphi 6程序设计导学 | G30: 张春林 | H30: 29.00 | I30: 37363 | J30: 8
A31: =ROW()-2 -> 1828 | B31: TP | C31: 5472 | D31: 1 | E31: 05472-1 | F31: 编程之路系列教材――C++Builder程序设计导学 | G31: 刘光 | H31: 32.00 | I31: 37398 | J31: 8
A32: =ROW()-2 -> 1829 | B32: TP | C32: 5544 | D32: 1 | E32: 05544-0 | F32: 编程之路系列教材――Power Builder 7 程序设计导学 | G32: 徐武平 | H32: 38.00 | I32: 37408 | J32: 6
F33: 计算机专业教学辅导丛书
A34: =ROW()-2 -> 1831 | B34: TP | C34: 5316 | D34: 1 | E34: 05316-2 | F34: 计算机组成原理――习题与解析 | G34: 徐爱萍 | H34: 30.00 | I34: 37316 | J34: 8
A35: =ROW()-2 -> 1832 | B35: TP | C35: 5411 | D35: 1 | E35: 05411-8 | F35: 数据结构（C语言篇）――习题与解析（修订版） | G35: 李春葆 | H35: 29.00 | I35: 37363 | J35: 8
A36: =ROW()-2 -> 1833 | B36: TP | C36: 4512 | D36: 1 | E36: 04512-7 | F36: 编译原理――习题与解析 | G36: 伍春香 | H36: 25.00 | I36: 37043 | J36: 9
A37: =ROW()-2 -> 1834 | B37: TP | C37: 5163 | D37: 1 | E37: 05163-1 | F37: 离散数学――习题与解析 | G37: 胡新启等 | H37: 28.00 | I37: 37257 | J37: 9
A38: =ROW()-2 -> 1835 | B38: TP | C38: 4948 | D38: 1 | E38: 04948-3 | F38: C++ 语言――习题与解析 | G38: 李春葆 | H38: 26.00 | I38: 37165 | J38: 9
A39: =ROW()-2 -> 1836 | B39: TP | C39: 3513 | D39: 1 | E39: 03513-X | F39: 数据结构――习题与解析 | G39: 李春葆 | H39: 26.00 | I39: 36281 | J39: 10
A40: =ROW()-2 -> 1837 | B40: TP | C40: 3786 | D40: 1 | E40: 03786-8 | F40: 数据结构(C语言篇)――习题与解析 | G40: 李春葆 | H40: 28.00 | I40: 36526 | J40: 8
A41: =ROW()-2 -> 1838 | B41: TP | C41: 4659 | D41: 1 | E41: 04659-X | F41: 操作系统――习题与解析 | G41: 曾平 等 | H41: 24.00 | I41: 37073 | J41: 10
A42: =ROW()-2 -> 1839 | B42: TP | C42: 4534 | D42: 1 | E42: 04534-8 | F42: 计算机网络――习题与解析 | G42: 鲁士文 | H42: 28.00 | I42: 37043 | J42: 8
F43: 信息安全技术系列丛书
A44: =ROW()-2 -> 1841 | B44: TP | C44: 4245 | D44: 1 | E44: 04245-4 | F44: 计算机通信网络安全 | G44: 冯登国 | H44: 22.00 | I44: 36951 | J44: 12
A45: =ROW()-2 -> 1842 | B45: TP | C45: 5099 | D45: 1 | E45: 05099-6 | F45: 系统安全与入侵检测 | G45: 戴英侠等 | H45: 26.00 | I45: 37316 | J45: 9
F46: 科海电脑技术丛书
A47: =ROW()-2 -> 1844 | B47: TP | C47: 5289 | D47: 1 | E47: 05289-1 | F47: Perl网络编程 | G47: 王超等译 | H47: 62.00 | I47: 37316 | J47: 5
A48: =ROW()-2 -> 1845 | B48: TP | C48: 5241 | D48: 1 | E48: 05241-7 | F48: SOLARIS系统管理员指南 | G48: 束文译 | H48: 39.00 | I48: 37316 | J48: 8
A49: =ROW()-2 -> 1846 | B49: TP | C49: 4172 | D49: 1 | E49: 7900641726 | F49: JavaScript示例导学（配光盘） | G49: 聊宏斌等译 | H49: 54.00 | I49: 37347 | J49: 5
F50: 网络程序设计系列丛书
A51: =ROW()-2 -> 1848 | B51: TP | C51: 5309 | D51: 1 | E51: 05309-X | F51: Borland C++ Builder网络 编程 | G51: 贺涛 | H51: 36.00 | I51: 37408 | J51: 7
F52: 北京计算机教育培训中心培训系列教材
A53: =ROW()-2 -> 1850 | B53: P- | C53: 4142 | D53: 1 | E53: 7900641424 | F53: 3ds max电视讲座教程――3ds max认证考试题解(含光盘) | G53: 黄心渊 | H53: 28.00 | I53: 37347 | J53: 12
F54: 审计署计算机审计中级培训系列教材
A55: =ROW()-2 -> 1852 | B55: TP | C55: 5559 | D55: 1 | E55: 05559-9 | F55: 数据库基础及应用技术 | G55: 何玉洁 | H55: 39.00 | I55: 37408 | J55: 8
A56: =ROW()-2 -> 1853 | B56: P- | C56: 4190 | D56: 1 | E56: 7900641904 | F56: 计算机审计――数据采集与分析技术（配光盘） | G56: 董化礼等 | H56: 36.00 | I56: 37408 | J56: 10
A57: =ROW()-2 -> 1854 | B57: TP- | C57: 5430 | D57: 1 | E57: 05430-4 | F57: Visual Basic 编程基础与应用 | G57: 董宛 | H57: 29.00 | I57: 37500 | J57: 10
F58: CAXA实用范例教程系列
A59: =ROW()-2 -> 1856 | B59: P- | C59: 4101 | D59: 1 | E59: 7900641017 | F59: CAXA二维电子图板V2范例教程 | G59: 高梦月等 | H59: 35.00 | I59: 37347 | J59: 9
F60: 尚顾问企业信息化丛书
A61: =ROW()-2 -> 1858 | B61: P- | C61: 2559 | D61: 1 | E61: 7900625593 | F61: 企业信息化经典――企业信息化指南(配光盘) | H61: 98.00 | I61: 36951 | J61: 3
F62: 数据库技术专业丛书
A63: =ROW()-2 -> 1860 | B63: TP | C63: 5107 | D63: 1 | E63: 05107-0 | F63: 数据库技术专业丛书――SQL Server 2000 管理指南 | G63: 吕静桦等译 | H63: 37.00 | I63: 2001.12 | J63: 9
A64: =ROW()-2 -> 1861 | B64: TP | C64: 4949 | D64: 1 | E64: 04949-1 | F64: 数据库技术专业丛书――SQL Server 2000 Web 应用开发指南 | G64: 宫丽杰译 | H64: 39.00 | I64: 37165 | J64: 8
A65: =ROW()-2 -> 1862 | B65: TP | C65: 5009 | D65: 1 | E65: 05009-0 | F65: 数据库技术专业丛书――SQL Server 2000 设计与 T-SQL 编程 | G65: 卢庆龄等译 | H65: 40.00 | I65: 37196 | J65: 7
A66: =ROW()-2 -> 1863 | B66: P- | C66: 3712 | D66: 1 | E66: 7900637125 | F66: 数据库技术专业丛书――SQL Server 2000 基础教程（配光盘） | G66: 吕静桦等译 | H66: 52.00 | I66: 37135 | J66: 6
A67: =ROW()-2 -> 1864 | B67: TP | C67: 5106 | D67: 1 | E67: 05106-2 | F67: 数据库技术专业丛书――SQL Server 2000 开发指南（配光盘） | G67: 陈恩义等译 | H67: 95.00 | I67: 37257 | J67: 3
A68: =ROW()-2 -> 1865 | B68: TP | C68: 5270 | D68: 1 | E68: 05270-0 | F68: 数据库技术专业丛书――SQL Server 2000 高级编程技术 | G68: 熊桂喜等译 | H68: 52.00 | I68: 37316 | J68: 6
A69: =ROW()-2 -> 1866 | B69: TP | C69: 5542 | D69: 1 | E69: 05542-4 | F69: 数据库技术专业丛书――SQL Server 2000 参考大全 | G69: Jeffrey R.Shapiro | H69: 69.00 | I69: 37408 | J69: 4
F70: 计算机科学组合学丛书
A71: =ROW()-2 -> 1868 | B71: TP | C71: 4581 | D71: 1 | E71: 04581-X | F71: 组合数学（第3版） | G71: 卢开澄等 | H71: 19.80 | I71: 37438 | J71: 11
A72: =ROW()-2 -> 1869 | B72: TP | C72: 3330 | D72: 1 | E72: 03330-7 | F72: 单目标、多目标与整数规划 | G72: 卢开澄 | H72: 29.80 | I72: 36373 | J72: 8
A73: =ROW()-2 -> 1870 | B73: TP | C73: 1817 | D73: 3 | E73: 01817-0 | F73: 图论及其应用 (第2版) | G73: 卢开澄等 | H73: 12.80 | I73: 37226 | J73: 15
A74: =ROW()-2 -> 1871 | B74: TP | C74: 2277 | D74: 4 | E74: 02277-1 | F74: 计算机算法导引――设计与分析 | G74: 卢开澄 | H74: 21.00 | I74: 37469 | J74: 10
A75: =ROW()-2 -> 1872 | B75: TP | C75: 2783 | D75: 3 | E75: 02783-8 | F75: 计算机密码学 (第2版) | G75: 卢开澄 | H75: 19.80 | I75: 37196 | J75: 9
F76: 软件工程师编程基础丛书
A77: =ROW()-2 -> 1874 | B77: TP | C77: 5687 | D77: 1 | E77: 05687-0 | F77: C语言程序设计题典 | G77: 李春葆等 | H77: 29.00 | I77: 37438 | J77: 9
A78: =ROW()-2 -> 1875 | B78: TP | C78: 5686 | D78: 1 | E78: 05686-2 | F78: C++语言程序设计题典 | G78: 李春葆等 | H78: 25.00 | I78: 37438 | J78: 10
A79: =ROW()-2 -> 1876 | B79: TP | C79: 5688 | D79: 1 | E79: 05688-9 | F79: 数据结构程序设计题典 | G79: 李春葆等 | H79: 34.00 | I79: 37469 | J79: 7
A80: =ROW()-2 -> 1877 | B80: TP | C80: 5902 | D80: 1 | E80: 05902-0 | F80: Visual Basic 程序设计题典 | G80: 李春葆等 | H80: 25.00 | I80: 37530 | J80: 10
F81: 计算机在农业工程中的应用丛书
A82: =ROW()-2 -> 1879 | B82: S- | C82: 3120 | D82: 1 | E82: 03120-7 | F82: 计算机在农机化管理中的应用 | G82: 晏国生 | H82: 15.00 | I82: 1998 | J82: 15
A83: =ROW()-2 -> 1880 | B83: S- | C83: 2779 | D83: 1 | E83: 02779-X | F83: 计算机在农业生物环境测控与管理中的应用 | G83: 白广存等 | H83: 22.8 | I83: 1998 | J83: 10
A84: =ROW()-2 -> 1881 | B84: TP | C84: 3849 | D84: 1 | E84: 03849-X1 | F84: 农业专家系统入门 | G84: 石纯一等 | H84: 16 | I84: 36647 | J84: 30
F85: 精通SolidWorks 丛书
A86: =ROW()-2 -> 1883 | B86: TP 5389 1 | E86: 05389-7 | F86: SolidWorks 零件设计 | G86: 杨勇生等 | H86: 18.00 | I86: 37408 | J86: 13
A87: =ROW()-2 -> 1884 | B87: P- | C87: 4196 | D87: 1 | E87: 7900641963 | F87: SolidWorks 装配和二维工程图（配光盘） | G87: 夏燕等 | H87: 24.00 | I87: 37438 | J87: 12
A88: =ROW()-2 -> 1885 | B88: P- | C88: 4195 | D88: 1 | E88: 7900641955 | F88: SolidWorks 精彩实例（配光盘） | G88: 李维等著 | H88: 20.00 | I88: 37438 | J88: 16
A89: =ROW()-2 -> 1886 | B89: P- | C89: 4326 | D89: 1 | E89: 7900643265 | F89: SolidWorks入门（配光盘） | G89: 刘友和 | H89: 38.00 | I89: 37500 | J89: 9
F90: 建筑智能化系统设计丛书
A91: =ROW()-2 -> 1888 | B91: TP | C91: 5429 | D91: 1 | E91: 05429-0 | F91: 智能建筑计算机网络工程 | G91: 胡道元 | H91: 27.00 | I91: 37500 | J91: 11
F92: 软件研发管理技术丛书
A93: =ROW()-2 -> 1890 | B93: TP 5389 1 | C93: 5553 | E93: 05553-X | F93: 软件配置管理 | G93: 徐晓春等 | H93: 30.00 | I93: 37438 | J93: 9
A94: =ROW()-2 -> 1891 | B94: TP 5389 1 | C94: 5873 | D94: 1 | E94: 05873-3 | F94: CVS和Nightly Build技术 | G94: 杨锦方等 | H94: 25.00 | I94: 37530 | J94: 12
F95: Visual Basic 高级程序设计
A96: =ROW()-2 -> 1893 | B96: TP | C96: 5426 | D96: 1 | E96: 05426-6 | F96: Visual Basic Internet 程序设计 | G96: 刘炳文 | H96: 25 | I96: 37469 | J96: 13
A97: =ROW()-2 -> 1894 | B97: TP | C97: 5420 | D97: 1 | E97: 054207 | F97: Visual Basic ActiveX 程序设计 | G97: 刘炳文 | H97: 17 | I97: 37469 | J97: 12
A98: =ROW()-2 -> 1895 | B98: TP | C98: 5425 | D98: 1 | E98: 05425-8 | F98: Visual Basic 图形与多媒体程序设计 | G98: 刘炳文 | H98: 23 | I98: 37469 | J98: 10
F99: Pro/E零件设计系列
A100: =ROW()-2 -> 1897 | B100: P- | C100: 3702 | D100: 1 | E100: 7900637028 | F100: Pro/ENGINEER 2000Ａ慵设计高级篇（上）（配光盘） | G100: 林清安 | H100: 58 | I100: 37329 | J100: 6
A101: =ROW()-2 -> 1898 | B101: P- | C101: 3747 | D101: 1 | E101: 7900637478 | F101: Pro/ENGINEER 2000Ａ慵设计高级篇（下）（配光盘） | G101: 林清安 | H101: 65 | I101: 37329 | J101: 5
A102: =ROW()-2 -> 1899 | B102: P- | C102: 3550 | D102: 1 | E102: 7900635505 | F102: Pro/ENGINEER 2000Ａ慵设计基础篇（上）（配光盘） | G102: 林清安 | H102: 57 | I102: 37469 | J102: 6
F103: 超越零点系列丛书
A104: =ROW()-2 -> 1901 | B104: TP | C104: 5823 | D104: 1 | E104: 05823-7 | F104: 超越零点学Excel | G104: 孙红等 | H104: 27 | I104: 37500 | J104: 10
A105: =ROW()-2 -> 1902 | B105: TP | C105: 5795 | D105: 1 | E105: 05795-8 | F105: 超越零点学网页制作 | G105: 顾义华 | H105: 24 | I105: 37530 | J105: 12
F106: 串行通信控制系列
A107: =ROW()-2 -> 1904 | B107: P- | C107: 4188 | D107: 1 | E107: 04188-1 | F107: Delphi 与RS-232串行通信控制（配光盘） | G107: 范逸之 | H107: 49.00 | I107: 37408 | J107: 7
A108: =ROW()-2 -> 1905 | B108: P- | C108: 4305 | D108: 1 | E108: 04305-1 | F108: C++ Builder与RS-232串行通信控制（配光盘） | G108: 范逸之 | H108: 49.00 | I108: 37438 | J108: 6
A109: =ROW()-2 -> 1906 | B109: P- | C109: 4306 | D109: 1 | E109: 07900643060 | F109: Visual Basic与RS-232串行通信控制（最新版）（配光盘） | G109: 范逸之 | H109: 39.00 | I109: 37438 | J109: 8
A110: =ROW()-2 -> 1907 | B110: P- | C110: 3122 | D110: 1 | E110: 7900631224 | F110: 利用 Visual Basic 实现串并行通信技术 （配光盘） | G110: 范逸之等 | H110: 57.00 | I110: 37321 | J110: 5
F111: 程序设计基础系列
A112: =ROW()-2 -> 1909 | B112: TP | C112: 4359 | D112: 1 | E112: 04359-0 | F112: Visual C++ 程序设计基础 | G112: 戴 锋 | H112: 29.00 | I112: 37330 | J112: 8
A113: =ROW()-2 -> 1910 | B113: TP | C113: 5384 | D113: 1 | E113: 05384-1 | F113: Visual C#.NET程序设计基础 | G113: 孙永强等 | H113: 30.00 | I113: 37386 | J113: 7
A114: =ROW()-2 -> 1911 | B114: TP | C114: 4393 | D114: 1 | E114: 04393-0 | F114: Visual Basic 程序设计基础 | G114: 韦源 等 | H114: 29.90 | I114: 37377 | J114: 8
F115: 6.分类图书
F116: 计算机原理及基础知识
A117: =ROW()-2 -> 1914 | B117: TP | C117: 3812 | D117: 1 | E117: 03812-0 | F117: 计算机组成与系统结构 | G117: 李亚民 | H117: 32.00 | I117: 36678 | J117: 7
A118: =ROW()-2 -> 1915 | B118: TP | C118: 5363 | D118: 1 | E118: 05363-4 | F118: 电脑选购、组装、维护一路通 | G118: 导向科技 | H118: 25.00 | I118: 37500 | J118: 10
A119: =ROW()-2 -> 1916 | B119: TP | C119: 3033 | D119: 6 | E119: 03033-2 | F119: 微型计算机系统原理及应用(第三版 上） | G119: 周明德 | H119: 38.00 | I119: 37500 | J119: 6
A120: =ROW()-2 -> 1917 | B120: TP | C120: 3114 | D120: 4 | E120: 03114-2 | F120: 微型计算机系统原理及应用(第三版 下） | G120: 宋瀚涛 | H120: 13.50 | I120: 37438 | J120: 14
A121: =ROW()-2 -> 1918 | B121: TP | C121: 5548 | D121: 1 | E121: 05548-3 | F121: 微型计算机系统原理及应用(第4版） | G121: 周明德 | H121: 33.00 | I121: 37408 | J121: 7
A122: =ROW()-2 -> 1919 | B122: TP | C122: 5561 | D122: 1 | E122: 05561-0 | F122: 微型计算机系统原理及应用(第4版）――习题集与实验指导书 | G122: 周明德 | H122: 8.50 | I122: 37408 | J122: 25
A123: =ROW()-2 -> 1920 | B123: TP | C123: 5689 | D123: 1 | E123: 05689-1 | F123: 奔腾系列微型计算机原理及接口技术 | G123: 谢瑞和等 | H123: 24.00 | I123: 37438 | J123: 12
A124: =ROW()-2 -> 1921 | B124: TP | C124: 5446 | D124: 1 | E124: 05446-1 | F124: 微型机应用基础教程――从windows98到 windows 2000 | G124: 戴梅萼 | H124: 28.00 | I124: 37438 | J124: 9
A125: =ROW()-2 -> 1922 | B125: TP | C125: 4977 | D125: 1 | E125: 04977-7 | F125: 新编计算机应用基础教程 | G125: 王军 等 | H125: 39.00 | I125: 37530 | J125: 7
A126: =ROW()-2 -> 1923 | B126: P- | C126: 3799 | D126: 1 | E126: 7900637990 | F126: 硬盘修复、备份、分区一次搞定（附光盘） | G126: 王丽琴 | H126: 42.00 | I126: 37469 | J126: 8
A127: =ROW()-2 -> 1924 | B127: TP | C127: 2290 | D127: 4 | E127: 02290-1 | F127: C常用算法程序集 | G127: 徐士良 | H127: 48.00 | I127: 37408 | J127: 7
A128: =ROW()-2 -> 1925 | B128: TP | C128: 5843 | D128: 1 | E128: 05843-1 | F128: 电脑应用综合培训教程（XP中文版） | G128: 刘建龙等 | H128: 28.00 | I128: 37500 | J128: 8
A129: =ROW()-2 -> 1926 | B129: P- | C129: 3198 | D129: 1 | E129: 7900631984 | F129: 新编16-32位微型计算机原理及应用（第2 版） | G129: 李继灿等 | H129: 36.00 | I129: 37347 | J129: 7
A130: =ROW()-2 -> 1927 | B130: TP | C130: 0237 | D130: I | E130: 00237-1 | F130: 微型计算机硬件软件及其应用(修订版) | G130: 周明德 | H130: 36.00 | I130: 36739 | J130: 5
A131: =ROW()-2 -> 1928 | B131: TP | C131: 3992 | D131: 2 | E131: 03992-5 | F131: 微型计算机应用技术（上）―― 数据采集与控制技术 | G131: 唐光荣等 | H131: 18.00 | I131: 36739 | J131: 12
A132: =ROW()-2 -> 1929 | B132: TP | C132: 3992 | D132: 1 | E132: 03992-5 | F132: 微型计算机应用技术（下）―― 计算机网络与多媒体应用技术 | G132: 张曾科等 | H132: 18.00 | I132: 36739 | J132: 13
A133: =ROW()-2 -> 1930 | B133: TP | C133: 3359 | D133: 3 | E133: 03359-5 | F133: 微型计算机控制技术* | G133: 于海生等 | H133: 24.00 | I133: 37526 | J133: 10
F134: *本书获2002年教育部全国普通高等学校优秀教材二等奖。
A135: =ROW()-2 -> 1932 | B135: TP | C135: 3880 | D135: 1 | E135: 03880-5 | F135: 32位微型计算机原理与接口技术 | G135: 仇玉章等 | H135: 28.50 | I135: 37288 | J135: 7
A136: =ROW()-2 -> 1933 | B136: TP | C136: 3881 | D136: 1 | E136: 03881-3 | F136: 32位微型计算机原理与接口技术实验指导 | G136: 仇玉章等 | H136: 6.00 | I136: 37469 | J136: 35
A137: =ROW()-2 -> 1934 | B137: TP | C137: 2658 | D137: 7 | E137: 02658-0 | F137: 计算机基础教程（WINDOWS版） | G137: 黄云森 | H137: 25.00 | I137: 1999 | J137: 10
A138: =ROW()-2 -> 1935 | B138: TP | C138: 1152 | D138: 1 | E138: 01152-4 | F138: 微机使用综合教程 | G138: 成正祥等 | H138: 24.00 | I138: 37500 | J138: 12
A139: =ROW()-2 -> 1936 | B139: TP | C139: 3875 | D139: 1 | E139: 03875-9 | F139: 新编微机培训教程（2000版） | G139: 王诚君 | H139: 24.00 | I139: 36923 | J139: 8
A140: =ROW()-2 -> 1937 | B140: TP | C140: 3843 | D140: 2 | E140: 03843-0 | F140: 初学计算机实用教程 | G140: 钟建华等 | H140: 22.00 | I140: 36982 | J140: 12
A141: =ROW()-2 -> 1938 | B141: TP | C141: 1372 | D141: 2 | E141: 01372-1 | F141: 你也能用电脑计算∏=3.14159…到千万位 | G141: 杨自强等 | H141: 10.00 | I141: 36982 | J141: 25
A142: =ROW()-2 -> 1939 | B142: TP | C142: 3635 | D142: 1 | E142: 03635-7 | F142: 用于最优化的计算智能 | G142: 李军等译 | H142: 18.00 | I142: 36495 | J142: 20
A143: =ROW()-2 -> 1940 | B143: TP | C143: 1762 | D143: 2 | E143: 01762-X | F143: 系统设计与仿真 | G143: 顾启泰 | H143: 17.50 | I143: 1998 | J143: 9
A144: =ROW()-2 -> 1941 | B144: TP | C144: 4577 | D144: 1 | E144: 04577-1 | F144: PIC 单片机轻松入门 | G144: 施威铭 研究室 | H144: 27.00 | I144: 37377 | J144: 8
A145: =ROW()-2 -> 1942 | B145: TP | C145: 5046 | D145: 1 | E145: 05046-5 | F145: 8×C196KX单片机及其应用系统设计 | G145: 刘复华 | H145: 29.60 | I145: 37438 | J145: 8
A146: =ROW()-2 -> 1943 | B146: TP | C146: 4714 | D146: 1 | E146: 04714-6 | F146: 单片机原理及系统设计 | G146: 胡汉才 | H146: 39.00 | I146: 37377 | J146: 6
A147: =ROW()-2 -> 1944 | B147: TP | C147: 5531 | D147: 1 | E147: 05531-9 | F147: 8051单片机实践与应用 | G147: 吴金戌等 | H147: 39.00 | I147: 37500 | J147: 7
A148: =ROW()-2 -> 1945 | B148: TP | C148: 3686 | D148: 1 | E148: 03686-1 | F148: 8051 单片机 C 语言控制与应用 | G148: 陈龙三 | H148: 35.00 | I148: 36404 | J148: 9
A149: =ROW()-2 -> 1946 | B149: TP | C149: 2914 | D149: 1 | E149: 02914-8 | F149: 8098单片机及扩展接口实验指导 | G149: 唐庆红 | H149: 15.00 | I149: 1998 | J149: 15
A150: =ROW()-2 -> 1947 | B150: TP | C150: 0948 | D150: E | E150: 00948-1 | F150: 计算机原理与系统结构 | G150: 侯炳辉 | H150: 18.00 | I150: 37288 | J150: 9
A151: =ROW()-2 -> 1948 | B151: TP | C151: 3599 | D151: 1 | E151: 03599-7 | F151: 微机控制应用实验与实例 | G151: 黄胜军 | H151: 20.00 | I151: 36495 | J151: 12
A152: =ROW()-2 -> 1949 | B152: TP | C152: 4580 | D152: 1 | E152: 04580-1 | F152: Fuzzy Control of Queueing Networks | G152: 张润彤 | H152: 49.00 | I152: 37288 | J152: 7
A153: =ROW()-2 -> 1950 | B153: TP | C153: 1101 | D153: 4 | E153: 01101-X | F153: 8098 单片机及其应用系统设计 | G153: 刘复华 | H153: 20.00 | I153: 37196 | J153: 9
A154: =ROW()-2 -> 1951 | B154: TP | C154: 2343 | D154: 1 | E154: 02343- | F154: 8098单片机及其应用系统设计例题习题教程 | G154: 刘复华 | H154: 16.80 | I154: 1997 | J154: 10
A155: =ROW()-2 -> 1952 | B155: TP | C155: 1086 | D155: 1 | E155: 01086-2 | F155: H8S/2655 系列 16 位 单片机 | G155: 李芙英等 | H155: 26.00 | I155: 36770 | J155: 9
A156: =ROW()-2 -> 1953 | B156: TP | C156: 2107 | D156: 7 | E156: 02107-4 | F156: 单片机原理及其接口技术 | G156: 胡汉才 | H156: 32.00 | I156: 37438 | J156: 6
A157: =ROW()-2 -> 1954 | B157: TP | C157: 2737 | D157: 1 | E157: 02737-4 | F157: 单片机应用技术教程 | G157: 张洪润等 | H157: 29.00 | I157: 1997 | J157: 10
A158: =ROW()-2 -> 1955 | B158: TP | C158: 3252 | D158: 1 | E158: 03252-2 | F158: SH3高级单片机原理及应用 | G158: 沈永林 | H158: 22.00 | I158: 1999 | J158: 12
A159: =ROW()-2 -> 1956 | B159: TP | C159: 2675 | D159: 2 | E159: 02675-0 | F159: IBM AS/400计算机概论 | G159: 濮群 等 | H159: 40.00 | I159: 1998 | J159: 8
A160: =ROW()-2 -> 1957 | B160: TP | C160: 2540 | D160: 6 | E160: 02540-1 | F160: 计算机基础知识与操作(第2版) | G160: 徐士良等 | H160: 17.00 | I160: 36526 | J160: 12
A161: =ROW()-2 -> 1958 | B161: TP | C161: 1447 | D161: I | E161: 01447-7 | F161: 计算机基础知识教程 | G161: 姜爱群等 | H161: 13.50 | I161: 36404 | J161: 13
A162: =ROW()-2 -> 1959 | B162: TP | C162: 0768 | D162: 1 | E162: 00768-3 | F162: 计算机导论 | G162: Roberta Baber | H162: 48.00 | I162: 37438 | J162: 6
A163: =ROW()-2 -> 1960 | B163: P- | C163: 1748 | D163: 1 | E163: 7900617485 | F163: 家庭电脑十用 (配光盘) | G163: 史斌星等 | H163: 46.00 | I163: 36647 | J163: 8
A164: =ROW()-2 -> 1961 | B164: GP | C164: 1748 | D164: 1 | E164: 7900617485 | F164: 家庭电脑十用 (光盘) | H164: 31.00 | I164: 36434 | J164: 25
A165: =ROW()-2 -> 1962 | B165: TP | C165: 2928 | D165: 3 | E165: 02928-8 | F165: 计算机病毒防治实用技术 | G165: 袁忠良 | H165: 28.00 | I165: 36526 | J165: 8
A166: =ROW()-2 -> 1963 | B166: TP | C166: 3425 | D166: 2 | E166: 03425-7 | F166: 安全防范系统工程 | G166: 陈 龙 | H166: 21.50 | I166: 36465 | J166: 12
A167: =ROW()-2 -> 1964 | B167: TP | C167: 2789 | D167: 1 | E167: 02789-7 | F167: 计算机应用系统安全要则 | G167: 叶 红 | H167: 7.8 | I167: 1998 | J167: 25
A168: =ROW()-2 -> 1965 | B168: TP | C168: 5392 | D168: 1 | E168: 05392-8 | F168: 入侵检测系统实例剖析 | G168: 韩东海等 | H168: 28.00 | I168: 37377 | J168: 9
A169: =ROW()-2 -> 1966 | B169: TP | C169: 4001 | D169: 1 | E169: 04001-X | F169: PC 技术内幕（第8版） | G169: 张琦等译 | H169: 56.00 | I169: 36739 | J169: 5
A170: =ROW()-2 -> 1967 | B170: TP | C170: 3288 | D170: 1 | E170: 03288-2 | F170: 多媒体电脑日常维护与故障排除 | G170: 范文历等 | H170: 29.80 | I170: 37073 | J170: 9
A171: =ROW()-2 -> 1968 | B171: TP | C171: 4608 | D171: 1 | E171: 04608-5 | F171: 电脑应用入门教程 | G171: 王诚君 | H171: 19.80 | I171: 37073 | J171: 8
A172: =ROW()-2 -> 1969 | B172: TP | C172: 4640 | D172: 1 | E172: 04640-9 | F172: 电脑生手入门宝典 | G172: 高越明等 | H172: 36.00 | I172: 37469 | J172: 7
A173: =ROW()-2 -> 1970 | B173: TP | C173: 1076 | D173: 1 | E173: 01076-5 | F173: 电脑应用入门宝典 | G173: 高越明等 | H173: 42.00 | I173: 37408 | J173: 6
A174: =ROW()-2 -> 1971 | B174: TP | C174: 5249 | D174: 1 | E174: 05249-2 | F174: 计算机短期培训教程 | G174: 胡辰浩 | H174: 26.00 | I174: 37316 | J174: 10
A175: =ROW()-2 -> 1972 | B175: TP | C175: 4253 | D175: 1 | E175: 04253-5 | F175: 计算机维护技术 （第二版） | G175: 瓮正科 | H175: 29.00 | I175: 36951 | J175: 8
A176: =ROW()-2 -> 1973 | B176: TP | C176: 3061 | D176: 1 | E176: 03061-8 | F176: 最新电脑配置与故障检修 | H176: 26.00 | I176: 1998 | J176: 10
A177: =ROW()-2 -> 1974 | B177: TP | C177: 5317 | D177: 1 | E177: 05317-0 | F177: 中文Windows培训教程 | G177: 牛田 | H177: 29.00 | I177: 37316 | J177: 7
A178: =ROW()-2 -> 1975 | B178: TP | C178: 5292 | D178: 1 | E178: 05292-1 | F178: 新编微机培训教程（2002版） | G178: 王诚君 | H178: 28.00 | I178: 37316 | J178: 8
A179: =ROW()-2 -> 1976 | B179: TP | C179: 5100 | D179: 1 | E179: 05100-3 | F179: 微机原理、外设、接口 | G179: 陈启美 | H179: 42.00 | I179: 37316 | J179: 6
A180: =ROW()-2 -> 1977 | B180: TP | C180: 5722 | D180: 1 | E180: 05722-2 | F180: 最新微机操作培训教程（第三版） | G180: 王诚君 | H180: 29.00 | I180: 37469 | J180: 7
A181: =ROW()-2 -> 1978 | B181: TP | C181: 5726 | D181: 1 | E181: 05726-5 | F181: 软件企业IS9001认证教程 | G181: 田代军 | H181: 28.00 | I181: 37469 | J181: 11
A182: =ROW()-2 -> 1979 | B182: TP | C182: 5354 | D182: 1 | E182: 05354-5 | F182: 微机硬盘管理实用详解 | G182: 王恒青等 | H182: 24.00 | I182: 37469 | J182: 11
A183: =ROW()-2 -> 1980 | B183: TP | C183: 5859 | D183: 1 | E183: 05859-8 | F183: 嵌入式系统设计与实例开发 | G183: 王田苗 | H183: 28.00 | I183: 37500 | J183: 10
F184: 计算机语言及程序设计
A185: =ROW()-2 -> 1982 | B185: TP | C185: 4566 | D185: 1 | E185: 04566-6 | F185: 高性能计算并行编程技术――MPI 并行程序设计 | G185: 都志辉 | H185: 36.00 | I185: 37104 | J185: 9
A186: =ROW()-2 -> 1983 | B186: TP | C186: 4847 | D186: 1 | E186: 04847-9 | F186: Kylix 程序设计 | G186: 杨宗志 | H186: 33.00 | I186: 37165 | J186: 7
A187: =ROW()-2 -> 1984 | B187: P- | C187: 3522 | D187: 1 | E187: 790063522X | F187: 活动目录编程指南（配光盘） | G187: 谭郁松等译 | H187: 66.00 | I187: 37012 | J187: 5
A188: =ROW()-2 -> 1985 | B188: TP | C188: 3374 | D188: 2 | E188: 03374-9 | F188: Windows Sockets 网络程序设计大全 | G188: 蒋东兴等 | H188: 29.50 | I188: 36831 | J188: 8
A189: =ROW()-2 -> 1986 | B189: P- | C189: 2544 | D189: 1 | E189: 7900625445 | F189: Windows 图形编程（配光盘） | G189: 罗骏等译 | H189: 75.00 | I189: 36708 | J189: 5
A190: =ROW()-2 -> 1987 | B190: TP | C190: 4564 | D190: 1 | E190: 04564-X | F190: 精通 InstallShield 6 | G190: 张铭 等 | H190: 29.00 | I190: 37073 | J190: 9
A191: =ROW()-2 -> 1988 | B191: TP | C191: 4334 | D191: 1 | E191: 04334-5 | F191: API for Windows 98/2000 详解 | G191: 张昆深等 | H191: 48.00 | I191: 37349 | J191: 7
A192: =ROW()-2 -> 1989 | B192: TP | C192: 4875 | D192: 1 | E192: 04875-4 | F192: Perl 调试技术 | G192: 曾奇 译 | H192: 16.00 | I192: 37165 | J192: 18
A193: =ROW()-2 -> 1990 | B193: P- | C193: 2515 | D193: 1 | E193: 7900625151 | F193: OpenGL 程序设计 | G193: 乔林 等 | H193: 54.00 | I193: 36647 | J193: 6
A194: =ROW()-2 -> 1991 | B194: P- | C194: 3113 | D194: 1 | E194: 7900631135 | F194: 可视化OpenGL程序设计 （配光盘） | G194: 费广正等 | H194: 42.00 | I194: 36982 | J194: 8
A195: =ROW()-2 -> 1992 | B195: TP | C195: 3825 | D195: 1 | E195: 03825-2 | F195: 漫游 Logo 世界 | G195: 薛维明 | H195: 10.00 | I195: 36617 | J195: 18
A196: =ROW()-2 -> 1993 | B196: TP | C196: 3472 | D196: 2 | E196: 03472-9 | F196: 应用软件系统开发 | G196: 柴跃廷等 | H196: 24.00 | I196: 36526 | J196: 8
A197: =ROW()-2 -> 1994 | B197: TP | C197: 4002 | D197: 1 | E197: 04002-8 | F197: 游戏软件设计与开发大揭秘 | G197: 何健辉等译 | H197: 42.00 | I197: 36770 | J197: 8
A198: =ROW()-2 -> 1995 | B198: TP | C198: 1223 | D198: 1 | E198: 01223-7 | F198: DirectDraw 原理与 API 参考 | G198: 武永康 | H198: 39.00 | I198: 36831 | J198: 8
A199: =ROW()-2 -> 1996 | B199: TP | C199: 4484 | D199: 1 | E199: 04484-8 | F199: DirectInput 原理与 API 参考 | G199: 武永康 | H199: 32.00 | I199: 37073 | J199: 9
A200: =ROW()-2 -> 1997 | B200: TP | C200: 4774 | D200: 1 | E200: 04774-X | F200: Direct3D 与 API 参考（上） | G200: 武永康 | H200: 32.00 | I200: 37196 | J200: 8
A201: =ROW()-2 -> 1998 | B201: TP | C201: 4774 | D201: 2 | E201: 4774-X | F201: Direct3D 与 API 参考（下） | G201: 武永康 | H201: 38.00 | I201: 37196 | J201: 7
A202: =ROW()-2 -> 1999 | B202: P- | C202: 3730 | D202: 1 | E202: 7900637303 | F202: C#和ASP.NET程序设计教程（含盘） | G202: 木林森 | H202: 38.00 | I202: 37288 | J202: 8
A203: =ROW()-2 -> 2000 | B203: TP | C203: 5578 | D203: 1 | E203: 05578-5 | F203: BizTalk Server 开发人员指南 | G203: Peishu Li | H203: 75.00 | I203: 37500 | J203: 6
A204: =ROW()-2 -> 2001 | B204: TP | C204: 4787 | D204: 1 | E204: 04787-1 | F204: C# 程序设计 | G204: 郭大权等 | H204: 28.00 | I204: 37165 | J204: 10
A205: =ROW()-2 -> 2002 | B205: TP | C205: 4976 | D205: 1 | E205: 04976-9 | F205: C# 程序设计案例教程 | G205: 王 宏 | H205: 28.00 | I205: 37226 | J205: 10
A206: =ROW()-2 -> 2003 | B206: TP | C206: 5111 | D206: 1 | E206: 05111-9 | F206: C++ 程序设计导学 | G206: 李春葆 | H206: 30.00 | I206: 2001.12 | J206: 8
A207: =ROW()-2 -> 2004 | B207: TP | C207: 5173 | D207: 1 | E207: 05173-9 | F207: C#编程实例与技巧 | G207: 刘浩 等 | H207: 30.00 | I207: 2002.2 | J207: 10
A208: =ROW()-2 -> 2005 | B208: P- | C208: 3585 | D208: 1 | E208: 7900635858 | F208: C 语言贯通教程――C、C++、Visual C++ 及Windows 应用程序 | G208: 史斌星等 | H208: 46.00 | I208: 37438 | J208: 6
A209: =ROW()-2 -> 2006 | B209: P- | C209: 3565 | D209: 1 | E209: 7900635653 | F209: Internet TCP/IP 程序设计之 C ++ Builder 高手 （配光盘） | G209: 黄嘉辉 | H209: 54.00 | I209: 37165 | J209: 6
A210: =ROW()-2 -> 2007 | B210: TP | C210: 3253 | D210: 1 | E210: 03253-X | F210: Microsoft Visual C++ 语言参考手册 | H210: 69.00 | I210: 1999 | J210: 5
A211: =ROW()-2 -> 2008 | B211: TP | C211: 3321 | D211: 5 | E211: 03321-8 | F211: C++ 语言基础教程 | G211: 吕凤翥 | H211: 26.00 | I211: 37329 | J211: 9
A212: =ROW()-2 -> 2009 | B212: TP | C212: 3421 | D212: 6 | E212: 03421-4 | F212: C++ 程序设计教程* | G212: 钱 能 | H212: 39.50 | I212: 37530 | J212: 7
F213: *本书获2002年教育部全国普通高等学校优秀教材二等奖。
A214: =ROW()-2 -> 2011 | B214: TP | C214: 2140 | D214: 3 | E214: 02140-6 | F214: C++ 程序设计习题与解答 | G214: 钱 能 | H214: 14.00 | I214: 37530 | J214: 18
A215: =ROW()-2 -> 2012 | B215: TP | C215: 3496 | D215: 4 | E215: 03496-6 | F215: C++ 程序设计实验指导 | G215: 钱 能 | H215: 9.50 | I215: 37521 | J215: 20
A216: =ROW()-2 -> 2013 | B216: TP | C216: 2063 | D216: B | E216: 02063-9 | F216: C高级实用程序设计 | G216: 王士元等 | H216: 32.00 | I216: 37398 | J216: 6
A217: =ROW()-2 -> 2014 | B217: TP | C217: 2393 | D217: 4 | E217: 02393-X | F217: C语言编程常见问题解答 | G217: 张芳妮等 | H217: 34.00 | I217: 37104 | J217: 7
A218: =ROW()-2 -> 2015 | B218: TP | C218: 2290 | D218: 4 | E218: 02290-9 | F218: C常用算法程序集(第2版) (含盘) | G218: 徐士良 | H218: 48.00 | I218: 37135 | J218: 7
A219: =ROW()-2 -> 2016 | B219: TP | C219: 2269 | D219: 4 | E219: 02269-0 | F219: 面向对象的理论与C++实践 | G219: 王 燕 | H219: 26.00 | I219: 37288 | J219: 7
A220: =ROW()-2 -> 2017 | B220: TP | C220: 1011 | D220: 1 | E220: 01011-0 | F220: 面向对象分析设计与编程OOA/OOD/OOP | G220: 吴炜煜 | H220: 19.50 | I220: 37104 | J220: 11
A221: =ROW()-2 -> 2018 | B221: TP | C221: 1271 | D221: 1 | E221: 01271-7 | F221: 面向对象分析和设计 | H221: 39.00 | I221: 36923 | J221: 6
A222: =ROW()-2 -> 2019 | B222: TP | C222: 2794 | D222: 7 | E222: 02794-3 | F222: C++语言和面向对象程序设计(第2版) | H222: 24.00 | I222: 36708 | J222: 9
A223: =ROW()-2 -> 2020 | B223: TP | C223: 4509 | D223: 1 | E223: 04509-7 | F223: 数据结构（C语言版） | G223: 黄国瑜等 | H223: 32.00 | I223: 37438 | J223: 7
A224: =ROW()-2 -> 2021 | B224: TP | C224: 5119 | D224: 1 | E224: 05119-4 | F224: 数据结构（Java语言版） | G224: 黄国瑜等 | H224: 32.00 | I224: 37469 | J224: 7
A225: =ROW()-2 -> 2022 | B225: TP | C225: 1663 | D225: 8 | E225: 01663-1 | F225: 数据结构简明教程 | G225: 徐孝凯 | H225: 17.00 | I225: 37288 | J225: 11
A226: =ROW()-2 -> 2023 | B226: P- | C226: 3523 | D226: 1 | E226: 7900635238 | F226: 掌握Visual C++.MFC程序设计与剖析（配光盘） | G226: 胡哲源 | H226: 54.00 | I226: 37104 | J226: 6
A227: =ROW()-2 -> 2024 | B227: TP | C227: 3227 | D227: 2 | E227: 03227-0 | F227: Visual C++6.0使用与开发 | G227: 木林森等 | H227: 40.00 | I227: 1998 | J227: 8
A228: =ROW()-2 -> 2025 | B228: P- | C228: 3020 | D228: 1 | E228: 7900635203 | F228: Visual C++6.0 DCOM 开发指南（配光盘） | G228: 田雨 等译 | H228: 42.00 | I228: 36770 | J228: 10
A229: =ROW()-2 -> 2026 | B229: P- | C229: 2527 | D229: 1 | E229: 7900625275 | F229: 实用 Visual C++6.0 教程（配光盘） | G229: 何健辉等译 | H229: 69.00 | I229: 36739 | J229: 5
A230: =ROW()-2 -> 2027 | B230: P- | C230: 4165 | D230: 1 | E230: 7900641653 | F230: VC++编程技术与难点剖析（配光盘） | G230: 梅林 | H230: 46.00 | I230: 37500 | J230: 2
A231: =ROW()-2 -> 2028 | B231: P- | C231: 4323 | D231: 1 | E231: 7900643230 | F231: Visual C++ .Net 开发南（配光盘） | G231: John Paul Maller | H231: 68.00 | I231: 37469 | J231: 5
A232: =ROW()-2 -> 2029 | B232: P- | C232: 4333 | D232: 1 | E232: 7900643338 | F232: 即学即用ASP.NET应用开发（含光盘） | G232: [美]Greg Buczek | H232: 69.00 | I232: 37500 | J232: 5
A233: =ROW()-2 -> 2030 | B233: TP | C233: 5437 | D233: 1 | E233: 05437-1 | F233: Java程序设计基础 | G233: 吴晓东 | H233: 25.00 | I233: 37438 | J233: 9
A234: =ROW()-2 -> 2031 | B234: TP | C234: 4308 | D234: 1 | E234: 04308-6 | F234: Java 程序设计百事通 | G234: 张洪斌 | H234: 39.00 | I234: 37104 | J234: 8
A235: =ROW()-2 -> 2032 | B235: TP | C235: 5016 | D235: 1 | E235: 05016-3 | F235: Java 2 参考大全（第四版） | G235: 张玉清等译 | H235: 79.00 | I235: 37196 | J235: 4
A236: =ROW()-2 -> 2033 | B236: P- | C236: 3728 | D236: 1 | E236: 7900637281 | F236: 反编译 Java 程序（配光盘） | G236: Decoder | H236: 47.00 | I236: 37196 | J236: 6
A237: =ROW()-2 -> 2034 | B237: P- | C237: 3586 | D237: 1 | E237: 7900635866 | F237: JAVA 范例实战（配光盘） | G237: 数位文化 | H237: 39.00 | I237: 37135 | J237: 6
A238: =ROW()-2 -> 2035 | B238: P- | C238: 3751 | D238: 1 | E238: 7900637516 | F238: Java 与 XML 数据库整合应用（配光盘） | G238: 沈兆阳 | H238: 49.00 | I238: 37226 | J238: 6
A239: =ROW()-2 -> 2036 | B239: TP | C239: 5067 | D239: 1 | E239: 05067-1 | F239: Java 2 程序设计 | G239: 普悠玛数位科技 | H239: 35.00 | I239: 37438 | J239: 7
A240: =ROW()-2 -> 2037 | B240: TP | C240: 5523 | D240: 1 | E240: 05523-8 | F240: Java 2简明教程 | G240: 李诚等 | H240: 37.00 | I240: 37438 | J240: 8
A241: =ROW()-2 -> 2038 | B241: TP | C241: 5870 | D241: 1 | E241: 05870-9 | F241: Java 网络程序设计 | G241: 黄嘉辉 | H241: 58.00 | I241: 37530 | J241: 6
A242: =ROW()-2 -> 2039 | B242: TP | C242: 5223 | D242: 1 | E242: 05223-9 | F242: Java Servlet 网络编程 | G242: 陈海山 | H242: 30.00 | I242: 37316 | J242: 8
A243: =ROW()-2 -> 2040 | B243: TP | C243: 5207 | D243: 1 | E243: 05207-7 | F243: JBuilder 5 实例教程 | G243: 张 焱 | H243: 26.00 | I243: 37363 | J243: 10
A244: =ROW()-2 -> 2041 | B244: P- | C244: 3571 | D244: 1 | E244: 7900635718 | F244: J2EE 构建企业系统――专家级解决方案 | G244: 谭郁松等译 | H244: 105.00 | I244: 37043 | J244: 3
A245: =ROW()-2 -> 2042 | B245: P- | C245: 3576 | D245: 1 | E245: 7900635769 | F245: C++ Builder 程序设计轻松上手（配光盘） | G245: 洪国胜等 | H245: 49.00 | I245: 37165 | J245: 4
A246: =ROW()-2 -> 2043 | B246: P- | C246: 3745 | D246: 1 | E246: 7900637451 | F246: C++ Builder 数据库程序设计（配光盘） | G246: 杨宗志 | H246: 35.00 | I246: 37165 | J246: 8
A247: =ROW()-2 -> 2044 | B247: TP | C247: 1322 | D247: 1 | E247: 01322-5 | F247: C++ Builder 程序设计教程 | G247: 王宏 等 | H247: 48.00 | I247: 36586 | J247: 6
A248: =ROW()-2 -> 2045 | B248: P- | C248: 4329 | D248: 1 | E248: 790064329X | F248: C++ Builder 与Windows API经典范例（配光盘) | G248: 郑明等 | H248: 49.00 | I248: 37469 | J248: 6
A249: =ROW()-2 -> 2046 | B249: TP | C249: 3659 | D249: 1 | E249: 03659-4 | F249: C 语言与习题解答 | G249: 李春葆 | H249: 26.00 | I249: 36373 | J249: 9
A250: =ROW()-2 -> 2047 | B250: TP | C250: 3613 | D250: 2 | E250: 03613-6 | F250: C++ Builder 4.0 从入门到精通 | G250: 李智慧等 | H250: 37.00 | I250: 36465 | J250: 8
A251: =ROW()-2 -> 2048 | B251: P- | C251: 3526 | D251: 1 | E251: 7900635262 | F251: Borland C++ Builder 5 实例精解 （配光盘） | G251: 余明兴等 | H251: 60.00 | I251: 37073 | J251: 5
A252: =ROW()-2 -> 2049 | B252: P- | C252: 3510 | D252: 1 | E252: 7900635106 | F252: Borland C++ Builder 程序设计（配光盘） | G252: 刘华 等 | H252: 55.00 | I252: 37469 | J252: 5
A253: =ROW()-2 -> 2050 | B253: TP | C253: 2199 | D253: 1 | E253: 02199-6 | F253: Delphi――从入门到精通 | G253: 张育荣等 | H253: 26.00 | I253: 1996 | J253: 12
A254: =ROW()-2 -> 2051 | B254: TP | C254: 2559 | D254: 6 | E254: 02559-2 | F254: Qbasic程序设计教程 | G254: 邓德祥等 | H254: 23.00 | I254: 36617 | J254: 9
A255: =ROW()-2 -> 2052 | B255: TP | C255: 2662 | D255: 3 | E255: 02662-9 | F255: Qbasic常用算法程序集(配盘） | G255: 徐士良 | H255: 50.00 | I255: 1998 | J255: 5
A256: =ROW()-2 -> 2053 | B256: TP | C256: 4837 | D256: 1 | E256: 04837-1 | F256: 从 Qbasic 到 Visual Basic 实用教程 | G256: 刘士杰 | H256: 29.00 | I256: 37196 | J256: 8
A257: =ROW()-2 -> 2054 | B257: TP | C257: 5042 | D257: 1 | E257: 05042-2 | F257: Visual Basic 程序设计实用教程（第二版） | G257: 王 栋 | H257: 36.00 | I257: 37500 | J257: 6
A258: =ROW()-2 -> 2055 | B258: P- | C258: 3145 | D258: 1 | E258: 7900631453 | F258: Visual Basic & Access 数据库管理系统构建实例 （配光盘） | G258: 谢炎桦 | H258: 32.00 | I258: 37073 | J258: 11
A259: =ROW()-2 -> 2056 | B259: TP | C259: 4665 | D259: 1 | E259: 04665-4 | F259: Visual Basic Win32 API 程序设计 | G259: 刘炳文等 | H259: 58.00 | I259: 37288 | J259: 5
A260: =ROW()-2 -> 2057 | B260: P- | C260: 3768 | D260: 1 | E260: 7900637680 | F260: Visual Basic 与分布式监控系统――RS-232/485串行 通信（配光盘） | G260: 范逸之 | H260: 59.00 | I260: 37408 | J260: 4
A261: =ROW()-2 -> 2058 | B261: P- | C261: 4188 | D261: 1 | E261: 04188-1 | F261: Delphi 与RS-232串行通信控制（配光盘） | G261: 范逸之 | H261: 49.00 | I261: 37408 | J261: 7
A262: =ROW()-2 -> 2059 | B262: P- | C262: 4305 | D262: 1 | E262: 04305-1 | F262: C++ Builder与RS-232串行通信控制（配光盘） | G262: 范逸之 | H262: 49.00 | I262: 37438 | J262: 6
A263: =ROW()-2 -> 2060 | B263: P- | C263: 4306 | D263: 1 | E263: 07900643060 | F263: Visual Basic与RS-232串行通信控制（最新版）（配光盘） | G263: 范逸之 | H263: 39.00 | I263: 37438 | J263: 8
A264: =ROW()-2 -> 2061 | B264: P- | C264: 3732 | D264: 1 | E264: 790063732X | F264: Visual Basic 游戏编程21天自学通 | G264: 王国春等译 | H264: 58.00 | I264: 37135 | J264: 5
A265: =ROW()-2 -> 2062 | B265: TP | C265: 1180 | D265: 1 | E265: 01180-X | F265: Visual Basic 程序设计教程 | G265: 周霭如等 | H265: 30.00 | I265: 37333 | J265: 8
A266: =ROW()-2 -> 2063 | B266: TP | C266: 3985 | D266: 1 | E266: 03985-2 | F266: Visual Basic 程序设计 | G266: 谭浩强等 | H266: 23.00 | I266: 37469 | J266: 10
A267: =ROW()-2 -> 2064 | B267: TP | C267: 5894 | D267: 1 | E267: 05894-6 | F267: Visual Basic.NET 入门与进阶 | G267: 博文 | H267: 36.00 | I267: 37530 | J267: 7
A268: =ROW()-2 -> 2065 | B268: P- | C268: 3743 | D268: 1 | E268: 7900637435 | F268: Visual Basic 经典范例（配光盘） | G268: 杨仓杰 | H268: 35.00 | I268: 37165 | J268: 8
A269: =ROW()-2 -> 2066 | B269: P- | C269: 3717 | D269: 1 | E269: 7900637176 | F269: Visual Basic 与 Windows API 程序设计高手（配光盘） | G269: 黄嘉辉等 | H269: 48.00 | I269: 37165 | J269: 7
A270: =ROW()-2 -> 2067 | B270: TP | C270: 4793 | D270: 1 | E270: 04793-6 | F270: Visual InterDev 6.0 程序设计 | G270: 白飞明等 | H270: 37.00 | I270: 37165 | J270: 7
A271: =ROW()-2 -> 2068 | B271: P | C271: 4138 | D271: 1 | E271: 7900641386 | F271: Borland Delphi 网络应用开发技术与实例 | G271: 黄超等 | H271: 59.00 | I271: 37316 | J271: 5
A272: =ROW()-2 -> 2069 | B272: P- | C272: 3764 | D272: 1 | E272: 7900637648 | F272: Delphi 6 应用开发指南（配光盘） | G272: 郭旭 等译 | H272: 62.00 | I272: 37196 | J272: 5
A273: =ROW()-2 -> 2070 | B273: TP | C273: 4363 | D273: 1 | E273: 04363-9 | F273: Delphi 程序设计基础 | G273: 刘海涛 | H273: 32.50 | I273: 37349 | J273: 7
A274: =ROW()-2 -> 2071 | B274: TP | C274: 4573 | D274: 1 | E274: 04573-9 | F274: Delphi 5.0 因特网与数据库程序设计 | G274: 刘海涛 | H274: 36.00 | I274: 37104 | J274: 8
A275: =ROW()-2 -> 2072 | B275: P- | C275: 3744 | D275: 1 | E275: 7900637443 | F275: Delphi 数据库程序设计（配光盘） | G275: 杨宗志 | H275: 35.00 | I275: 37344 | J275: 9
A276: =ROW()-2 -> 2073 | B276: TP | C276: 5117 | D276: 1 | E276: 05117-8 | F276: Delphi 6 程序设计教程 | G276: 韩伟峰 | H276: 32.00 | I276: 37374 | J276: 8
A277: =ROW()-2 -> 2074 | B277: P- | C277: 4325 | D277: 1 | E277: 7900643257 | F277: 深入浅出Delphi 6 （配光盘） | G277: 董良 | H277: 72.00 | I277: 37530 | J277: 4
A278: =ROW()-2 -> 2075 | B278: TP | C278: 4845 | D278: 1 | E278: 04845-2 | F278: Framework 程序设计 | G278: 孙永强 | H278: 39.00 | I278: 37165 | J278: 6
A279: =ROW()-2 -> 2076 | B279: TP | C279: 4036 | D279: 1 | E279: 04036-2 | F279: Visual Basic 程序设计实用教程（含实验指导与习题解答） | G279: 王 栋 | H279: 32.00 | I279: 36800 | J279: 8
A280: =ROW()-2 -> 2077 | B280: TP | C280: 0820 | D280: 1 | E280: 00820-5 | F280: Visual Basic 中文版面向对象与可视化程序设计 | G280: 廖彬山 | H280: 38.00 | I280: 37408 | J280: 7
A281: =ROW()-2 -> 2078 | B281: P- | C281: 2220 | D281: 2 | E281: 7900622209 | F281: Visual Basic 6.0 数据库编程(配光盘) | G281: 陈海标译 | H281: 85.00 | I281: 37343 | J281: 4
A282: =ROW()-2 -> 2079 | B282: TP | C282: 3369 | D282: 3 | E282: 03369-2 | F282: Visual Basic 6.0中文版入门与技巧 | G282: 木林森 工作室 | H282: 25.00 | I282: 36557 | J282: 12
A283: =ROW()-2 -> 2080 | B283: TP | C283: 2166 | D283: 2 | E283: 02166-X | F283: VBScript 可视化程序设计 | G283: 刘炳文 | H283: 42.00 | I283: 36739 | J283: 7
A284: =ROW()-2 -> 2081 | B284: P- | C284: 3554 | D284: 1 | E284: 7900635548 | F284: JScript 应用系统开发宝典（配光盘） | G284: 帝 龙 | H284: 45.00 | I284: 37104 | J284: 7
A285: =ROW()-2 -> 2082 | B285: TP | C285: 3999 | D285: 1 | E285: 03999-2 | F285: 实用 Visual InterDev 6 教程 | G285: 冯毅等译 | H285: 62.00 | I285: 36739 | J285: 5
A286: =ROW()-2 -> 2083 | B286: TP | C286: 1947 | D286: 2 | E286: 01947-9 | F286: FORTRAN 常用算法程序集( 第2版 )(含盘) | G286: 徐士良 | H286: 52.00 | I286: 1999 | J286: 5
A287: =ROW()-2 -> 2084 | B287: TP | C287: 1135 | D287: 1 | E287: 01135-4 | F287: Fortran PowerStation 4.0 基础教程 | G287: 徐 明 | H287: 30.00 | I287: 36678 | J287: 8
A288: =ROW()-2 -> 2085 | B288: TP | C288: 0992 | D288: 1 | E288: 09921-9 | F288: Turbo Pascal 程序设计基础 | G288: 刘海涛 | H288: 26.00 | I288: 36647 | J288: 10
A289: =ROW()-2 -> 2086 | B289: TP | C289: 3510 | D289: 1 | E289: 03510-5 | F289: HP VEE 可视化编程 (第3版) | G289: 惠普中心 | H289: 34.00 | I289: 36312 | J289: 9
A290: =ROW()-2 -> 2087 | B290: TP | C290: 2632 | D290: 3 | E290: 02632-7 | F290: 编译程序原理与技术 | G290: 李赣生等 | H290: 28.00 | I290: 1998 | J290: 8
A291: =ROW()-2 -> 2088 | B291: TP | C291: 0737 | D291: 5 | E291: 00737-3 | F291: PL/M 96 程序设计语言及其应用 | G291: 袁 涛 | H291: 11.00 | I291: 1997 | J291: 15
A292: =ROW()-2 -> 2089 | B292: TP | C292: 2901 | D292: 3 | E292: 02901-6 | F292: 80X86汇编语言程序设计教程 | G292: 杨季文等 | H292: 39.00 | I292: 37408 | J292: 5
A293: =ROW()-2 -> 2090 | B293: TP | C293: 3150 | D293: 2 | E293: 03150-9 | F293: 程序设计方法与PASCAL语言(修订) | G293: 彭 澎 | H293: 24.00 | I293: 1999 | J293: 11
A294: =ROW()-2 -> 2091 | B294: P- | C294: 2502 | D294: 1 | E294: 790062502X | F294: VHDL 语言 100 例详解（配光盘） | G294: 理工大学 | H294: 52.00 | I294: 36982 | J294: 5
A295: =ROW()-2 -> 2092 | B295: TP | C295: 3440 | D295: 1 | E295: 03440-0 | F295: Visual Basic 6.0中文版学习捷径(配光盘) | G295: 李天启等 | H295: 43 | I295: 36892 | J295: 8
A296: =ROW()-2 -> 2093 | B296: TP | C296: 4266 | D296: 1 | E296: 04266-7 | F296: 实用Visual Basic 6 教程 | G296: 何健辉等译 | H296: 59 | I296: 36951 | J296: 5
A297: =ROW()-2 -> 2094 | B297: TP | C297: 2932 | D297: 1 | E297: 02932-6 | F297: Windows 95 Visual Basic编程指导 (第4版) | G297: (美)Peter Norton | H297: 69 | I297: 1998 | J297: 4
A298: =ROW()-2 -> 2095 | B298: TP | C298: 3324 | D298: 3 | E298: 03324-2 | F298: Win 9X 虚拟设备驱动程序编程指南 | G298: 杨强 等 | H298: 15 | I298: 36586 | J298: 17
A299: =ROW()-2 -> 2096 | B299: TP | C299: 0900 | D299: 1 | E299: 00900-7 | F299: Windows 设备驱动程序技术内幕 | G299: 孙守阁等 | H299: 22 | I299: 36678 | J299: 12
A300: =ROW()-2 -> 2097 | B300: TP | C300: 0857 | D300: 1 | E300: 00857-4 | F300: Pro/ENGINEER 2000i 轻松学习与实例精解 | G300: 戴向国 | H300: 36 | I300: 37012 | J300: 8
A301: =ROW()-2 -> 2098 | B301: TP | C301: 0899 | D301: 1 | E301: 00899-X | F301: 版主答疑―― Delphi 高级编程技巧 | G301: 岳庆生 | H301: 49.00 | I301: 37012 | J301: 6
A302: =ROW()-2 -> 2099 | B302: TP | C302: 4510 | D302: 1 | E302: 04510-0 | F302: 精通Palm OS 程序设计――Code Warrior入门 教程 | G302: 位元文化 | H302: 32.00 | I302: 37073 | J302: 8
A303: =ROW()-2 -> 2100 | B303: P- | C303: 3558 | D303: 1 | E303: 7900635580 | F303: Plalm OS 程序设计入门（配光盘） | G303: 宝库网络 | H303: 26.00 | I303: 37073 | J303: 12
A304: =ROW()-2 -> 2101 | B304: TP | C304: 0939 | D304: 1 | E304: 00939-2 | F304: Director 8 和 Lingo 程序设计 | G304: 刘小峰 | H304: 29.00 | I304: 36708 | J304: 8
A305: =ROW()-2 -> 2102 | B305: TP | C305: 3545 | D305: 3 | E305: 03545-8 | F305: 精通 MATLAB 5 | G305: 张宜华 | H305: 34.50 | I305: 36831 | J305: 8
A306: =ROW()-2 -> 2103 | B306: TP | C306: 1138 | D306: 1 | E306: 01138-9 | F306: MATLAB 5.X 与科学计算 | G306: 王沫然 | H306: 26.50 | I306: 37012 | J306: 10
A307: =ROW()-2 -> 2104 | B307: TP | C307: 5413 | D307: 1 | E307: 05413-4 | F307: MATLAB6.x信号处理 | G307: 邹鲲等 | H307: 29.00 | I307: 37377 | J307: 10
A308: =ROW()-2 -> 2105 | B308: TP | C308: 1226 | D308: 1 | E308: 01126-1 | F308: 科学运算语言 MATLAB 5.3 程序设计与应用 | G308: 薛定宇 | H308: 32.00 | I308: 36831 | J308: 9
A309: =ROW()-2 -> 2106 | B309: TP | C309: 5461 | D309: 1 | E309: 05461-4 | F309: 精通MATLAB 6 | G309: 尹泽明等 | H309: 38.00 | I309: 37408 | J309: 7
A310: =ROW()-2 -> 2107 | B310: TP | C310: 4101 | D310: 1 | E310: 04101-6 | F310: 实用 KDE 教程 | G310: 张辉 译 | H310: 49.00 | I310: 36831 | J310: 7
A311: =ROW()-2 -> 2108 | B311: TP | C311: 3445 | D311: 2 | E311: 03445-1 | F311: PowerBuilder 6.5 参考手册 | G311: 合力工作室 | H311: 52 | I311: 36465 | J311: 4
A312: =ROW()-2 -> 2109 | B312: TP | C312: 3443 | D312: 2 | E312: 03443-5 | F312: Power Builder 6.0 入门 | G312: 刘兴出等 | H312: 27.5 | I312: 36281 | J312: 8
A313: =ROW()-2 -> 2110 | B313: TP | C313: 0901 | D313: 1 | E313: 00901-5 | F313: Power Builder 7.0 初学者指南 | G313: 抖斗书屋 | H313: 28.5 | I313: 36739 | J313: 9
A314: =ROW()-2 -> 2111 | B314: TP | C314: 0769 | D314: 1 | E314: 00769-1 | F314: Power Builder 7.0 数据库应用系统开发教程 | G314: 崔 巍 | H314: 30 | I314: 37320 | J314: 9
A315: =ROW()-2 -> 2112 | B315: TP | C315: 0783 | D315: 1 | E315: 00783-7 | F315: Power Builder 7.0 开发者指南 | G315: 抖斗书屋 | H315: 36 | I315: 36770 | J315: 7
A316: =ROW()-2 -> 2113 | B316: TP | C316: 4544 | D316: 1 | E316: 04544-5 | F316: Power Builder 8 Web 数据库开发指南 | G316: 徐松林等 | H316: 34.00 | I316: 37073 | J316: 8
A317: =ROW()-2 -> 2114 | B317: TP | C317: 3212 | D317: 1 | E317: 03212-2 | F317: ACM 国际大学生程序设计竞赛试题与分析(1) | G317: 吴文虎 | H317: 12 | I317: 1999 | J317: 18
A318: =ROW()-2 -> 2115 | B318: P | C318: 4141 | D318: 1 | E318: 7900641416 | F318: C/C++与数据结构 | G318: 王立柱 | H318: 35 | I318: 37362 | J318: 9
A319: =ROW()-2 -> 2116 | B319: TP | C319: 5206 | D319: 1 | E319: 05206-9 | F319: XHTML实例精解 | G319: 袁勤勇等译 | H319: 59 | I319: 37347 | J319: 5
A320: =ROW()-2 -> 2117 | B320: TP | C320: 5267 | D320: 1 | E320: 05267-0 | F320: Flash PHP实用开发技术 | G320: 王黎译 | H320: 39 | I320: 37347 | J320: 9
A321: =ROW()-2 -> 2118 | B321: TP | C321: 5110 | D321: 1 | E321: 05110-0 | F321: C++高级程序设计 | G321: 宛延] | H321: 32 | I321: 37347 | J321: 8
A322: =ROW()-2 -> 2119 | B322: TP | C322: 5341 | D322: 1 | E322: 05341-3 | F322: 基于MATLAB/Simulink的系统防真技术与应用 | G322: 薛定宇等 | H322: 38 | I322: 37347 | J322: 7
A323: =ROW()-2 -> 2120 | B323: TP | C323: 5231 | D323: 1 | E323: 05231-X | F323: Qt程序设计 | G323: Xteam | H323: 30 | I323: 37347 | J323: 9
A324: =ROW()-2 -> 2121 | B324: TP | C324: 5362 | D324: 1 | E324: 05362-6 | F324: UML精粹（第2版）标准对象建模语言简明指南 | G324: 徐家福译 | H324: 24 | I324: 37408 | J324: 10
A325: =ROW()-2 -> 2122 | B325: TP | C325: 5465 | D325: 1 | E325: 05465-7 | F325: 使用Visual Basic和UML开发应用程序 | G325: 李博等译 | H325: 39 | I325: 37408 | J325: 8
A326: =ROW()-2 -> 2123 | B326: TP | C326: 5545 | D326: 1 | E326: 55451 | F326: 精通 MATLAB 6 | G326: 张航等译 | H326: 69.00 | I326: 37438 | J326: 5
A327: =ROW()-2 -> 2124 | B327: P- | C327: 4180 | D327: 1 | E327: 7900641807 | F327: MATLAB 扩展编程（配光盘） | G327: 何强等 | H327: 42 | I327: 37438 | J327: 7
A328: =ROW()-2 -> 2125 | B328: TP | C328: 5054 | D328: 1 | E328: 05054-1 | F328: 全C编程（配软盘） | G328: 高永强等 | H328: 59 | I328: 37438 | J328: 4
A329: =ROW()-2 -> 2126 | B329: TP | C329: 5551 | D329: 1 | E329: 05551-3 | F329: DB2技术参考大全 | G329: 袁勤勇等译 | H329: 85 | I329: 37438 | J329: 4
A330: =ROW()-2 -> 2127 | B330: TP | C330: 5507 | D330: 1 | E330: 05507-6 | F330: CASL程序设计教程 | G330: 刘克武等 | H330: 23 | I330: 37469 | J330: 14
A331: =ROW()-2 -> 2128 | B331: TP | C331: 5579 | D331: 1 | E331: 05579-3 | F331: .NET框架程序开发指南（上册） | G331: 张志学 | H331: 35 | I331: 37469 | J331: 7
A332: =ROW()-2 -> 2129 | B332: TP | C332: 5652 | D332: 1 | E332: 05652-8 | F332: .NET框架程序开发指南（下册） | G332: 张志学 | H332: 38 | I332: 37469 | J332: 8
A333: =ROW()-2 -> 2130 | B333: TP | C333: 5681 | D333: 1 | E333: 05681-1 | F333: Jbuilder程序设计实例 | G333: 杨宗志 | H333: 29 | I333: 37469 | J333: 9
A334: =ROW()-2 -> 2131 | B334: TP | C334: 5420 | D334: 1 | E334: 05420-7 | F334: Visual Basic Active X程序设计 | G334: 刘炳文 | H334: 17 | I334: 37469 | J334: ?
A335: =ROW()-2 -> 2132 | B335: TP | C335: 5759 | D335: 1 | E335: 05759-1 | F335: 面向对象Java编程思想(修订版) | G335: Timothy Budd | H335: 45 | I335: 37469 | J335: 8
A336: =ROW()-2 -> 2133 | B336: TP | C336: 5713 | D336: 1 | E336: 05713-3 | F336: UNIX C 程序设计入门与应用 | G336: 洪锦魁 | H336: 28 | I336: 37469 | J336: 10
A337: =ROW()-2 -> 2134 | B337: TP | C337: 5724 | D337: 1 | E337: 05724-9 | F337: Visual C#.Net 应用精彩50例 | G337: 张龙卿等 | H337: 26 | I337: 37469 | J337: 10
A338: =ROW()-2 -> 2135 | B338: TP | C338: 5595 | D338: 1 | E338: 05595-5 | F338: 用 J2EE和UML开发Java 企业级应用程序 | G338: 康博 译 | H338: 28 | I338: 37500 | J338: 11
A339: =ROW()-2 -> 2136 | B339: TP | C339: 5620 | D339: 1 | E339: 05620-X | F339: Perl 实例精解（第三版） | G339: 杜炜 译 | H339: 82.00 | I339: 37500 | J339: 4
A340: =ROW()-2 -> 2137 | B340: TP | C340: 5625 | D340: 1 | E340: 05625-0 | F340: Java 2 精要：语言详解与编程指南 | G340: [美]布雷恩等 | H340: 60.00 | I340: 37500 | J340: 5
A341: =ROW()-2 -> 2138 | B341: P- | C341: 4349 | D341: 1 | E341: 7900643494 | F341: 用Python 学编程(含光盘) | G341: [美]Alan Gauld | H341: 32.00 | I341: 37500 | J341: 12
A342: =ROW()-2 -> 2139 | B342: TP | C342: 5794 | D342: 1 | E342: 05794-X | F342: Java 语法及网络应用设计 | G342: 徐迎晓 | H342: 34.00 | I342: 37500 | J342: 8
A343: =ROW()-2 -> 2140 | B343: P- | C343: 4322 | D343: 1 | E343: 7900643222 | F343: 数据结构（C 语言版）（配光盘） | G343: 黄国瑜 | H343: 30.00 | I343: 37530 | J343: 8
A344: =ROW()-2 -> 2141 | B344: TP | C344: 5936 | D344: 1 | E344: 05936-5 | F344: C语言程序设计 | G344: 彭四伟 | H344: 18.00 | I344: 37530 | J344: 13
A345: =ROW()-2 -> 2142 | B345: P- | C345: 4363 | D345: 1 | E345: 790064363X | F345: 从Matlab/Simulink 模型到代码实现（配光盘） | G345: 陈永春 | H345: 34.00 | I345: 37530 | J345: 8
A346: =ROW()-2 -> 2143 | B346: TP | C346: 5727 | D346: 1 | E346: 05727-3 | F346: Java程序设计教程 | G346: John Smiley | H346: 56.00 | I346: 37530 | J346: 6
A347: =ROW()-2 -> 2144 | B347: P- | C347: 4357 | D347: 1 | E347: 7900643575 | F347: Delphi 高手突破（配光盘） | G347: 申雯 | H347: 32.00 | I347: 37530 | J347: 9
F348: 操作系统
A349: =ROW()-2 -> 2146 | B349: TP | C349: 3943 | D349: 1 | E349: 03943-7 | F349: 操作系统基础(第3版) | G349: 屠祁 等 | H349: 25.50 | I349: 37408 | J349: 8
A350: =ROW()-2 -> 2147 | B350: TP | C350: 5447 | D350: 1 | E350: 05447-1 | F350: 多代理系统理论、方法与应用 | G350: 范玉顺、曹军威 | H350: 25.00 | I350: 37438 | J350: 13
A351: =ROW()-2 -> 2148 | B351: TP | C351: 5393 | D351: 1 | E351: 05393-1 | F351: Ｗindows 环境下的多线程编程原理与应用 | G351: 王险峰等 | H351: 35.00 | I351: 37438 | J351: 8
A352: =ROW()-2 -> 2149 | B352: TP | C352: 5158 | D352: 1 | E352: 05158-5 | F352: Ｗindows XP 中文版学习捷径 | G352: 陈硕辉等 | H352: 36.00 | I352: 37257 | J352: 7
A353: =ROW()-2 -> 2150 | B353: TP | C353: 4240 | D353: 1 | E353: 04240-3 | F353: Windows NT 系统安全指南 | G353: 熊桂喜等译 | H353: 30.00 | I353: 36892 | J353: 9
A354: =ROW()-2 -> 2151 | B354: P- | C354: 4913 | D354: 1 | E354: 04913-0 | F354: Windows 2000 Server 技术内幕 | G354: 杨洪涛等译 | H354: 98.00 | I354: 37135 | J354: 3
A355: =ROW()-2 -> 2152 | B355: TP | C355: 4945 | D355: 1 | E355: 04945-9 | F355: Windows XP 中文版家庭多媒体与网络技术 | G355: 田海波等 | H355: 28.00 | I355: 37196 | J355: 9
A356: =ROW()-2 -> 2153 | B356: TP | C356: 4769 | D356: 1 | E356: 04769-3 | F356: 深入理解 Microsoft Windows 2000 分布式服务 | G356: 潘爱民译 | H356: 31.00 | I356: 37196 | J356: 8
A357: =ROW()-2 -> 2154 | B357: TP | C357: 5539 | D357: 1 | E357: 05539-1 | F357: Windows XP 注册表应用实践与精通 | G357: 林山主编 | H357: 35.00 | I357: 37438 | J357: 6
A358: =ROW()-2 -> 2155 | B358: TP | C358: 4908 | D358: 1 | E358: 04908-4 | F358: 巧学巧用 BIOS 与 Windows 注册表 | G358: 孙 含 | H358: 32.00 | I358: 37375 | J358: 8
A359: =ROW()-2 -> 2156 | B359: TP | C359: 5496 | D359: 1 | E359: 05496-7 | F359: Windows XP 注册表配置、维护与应用900例 | G359: 东方硅谷 | H359: 46.00 | I359: 37408 | J359: 5
A360: =ROW()-2 -> 2157 | B360: TP | C360: 4931 | D360: 1 | E360: 04931-9 | F360: WSH 实用技术与应用 | G360: 马文刚等 | H360: 19.00 | I360: 37226 | J360: 10
A361: =ROW()-2 -> 2158 | B361: TP | C361: 4464 | D361: 1 | E361: 04464-3 | F361: Exchange 2000 Server 系统实务经典 | G361: 东名 等 | H361: 43.00 | I361: 37043 | J361: 6
A362: =ROW()-2 -> 2159 | B362: TP | C362: 3128 | D362: 2 | E362: 03128-2 | F362: 操作系统原理DOS篇 (第2版) | G362: 张昆苍等 | H362: 26.00 | I362: 36770 | J362: 7
A363: =ROW()-2 -> 2160 | B363: TP | C363: 3852 | D363: 1 | E363: 03852-X | F363: PC 操作系统及常用软件实用教程 | G363: 王启丁等 | H363: 34.00 | I363: 36526 | J363: 8
A364: =ROW()-2 -> 2161 | B364: P- | C364: 3700 | D364: 1 | E364: 7900637001 | F364: PC/Mac 跨平台网络连接实务 | G364: 杜仕德研究室 | H364: 32.00 | I364: 37135 | J364: 8
A365: =ROW()-2 -> 2162 | B365: TP | C365: 1099 | D365: 1 | E365: 01099-4 | F365: DOS & Windows 95/98 无盘工作站配置、管理与实例 | G365: 曹国钧等 | H365: 49.00 | I365: 36831 | J365: 5
A366: =ROW()-2 -> 2163 | B366: TP | C366: 4910 | D366: 1 | E366: 04910-6 | F366: 中文版 Windows XP 系统管理指南 | G366: 李万红等 | H366: 48.00 | I366: 37349 | J366: 5
A367: =ROW()-2 -> 2164 | B367: TP | C367: 5012 | D367: 1 | E367: 05012-0 | F367: 中文版 Windows XP 入门与进阶 | G367: 王梦兰等 | H367: 35.00 | I367: 2002.3 | J367: 7
A368: =ROW()-2 -> 2165 | B368: TP | C368: 5699 | D368: 1 | E368: 056994 | F368: Visual C++.NET 入门与进阶 | G368: 冉林仓等 | H368: 38.00 | I368: 37469 | J368: 7
A369: =ROW()-2 -> 2166 | B369: TP | C369: 5104 | D369: 1 | E369: 05104-6 | F369: 中文Windows XP 简明教程 | G369: 罗运模等 | H369: 37.00 | I369: 2002.4 | J369: 7
A370: =ROW()-2 -> 2167 | B370: TP | C370: 5825 | D370: 1 | E370: 05825-3 | F370: XSLT开发人员指南 | G370: 英宇 译 | H370: 32.00 | I370: 37500 | J370: 9
A371: =ROW()-2 -> 2168 | B371: TP | C371: 1075 | D371: 1 | E371: 01075-7 | F371: Windows 95/98 中文版实用100问 | G371: 潇湘工作室 | H371: 22.00 | I371: 36951 | J371: 12
A372: =ROW()-2 -> 2169 | B372: TP | C372: 1758 | D372: 3 | E372: 7900617582 | F372: Microsoft Windows 98 标准学习(配光盘) | G372: 博彦公司 | H372: 42.00 | I372: 36982 | J372: 8
A373: =ROW()-2 -> 2170 | B373: P- | C373: 2550 | D373: 2 | E373: 790062550X | F373: Windows 2000 Professional 中文版标准学习(配光盘) | G373: 博彦公司 | H373: 42.00 | I373: 36770 | J373: 9
A374: =ROW()-2 -> 2171 | B374: TP | C374: 4415 | D374: 1 | E374: 04415-5 | F374: Windows 2000 Server 配置、管理与应用 | G374: 甘登岱等 | H374: 32.00 | I374: 37408 | J374: 8
A375: =ROW()-2 -> 2172 | B375: P- | C375: 3579 | D375: 1 | E375: 7900635793 | F375: Windows 2000 Professional 安装与配置 （配光盘） | G375: 李博 译 | H375: 48.00 | I375: 37073 | J375: 6
A376: =ROW()-2 -> 2173 | B376: TP | C376: 4524 | D376: 1 | E376: 04524-0 | F376: 无盘 Win 9x 和 Windows 2000 Server 技术精解及实例分析 | G376: 闵 军 | H376: 49.00 | I376: 37257 | J376: 6
A377: =ROW()-2 -> 2174 | B377: P- | C377: 2578 | D377: 1 | E377: 790062578X | F377: 升级到 Windows 2000 （配光盘） | G377: 陆争鸣译 | H377: 56.00 | I377: 36951 | J377: 9
A378: =ROW()-2 -> 2175 | B378: TP | C378: 4189 | D378: 1 | E378: 04189-X | F378: 中文 Windows Me 培训教程 | G378: 欧阳春 | H378: 28.00 | I378: 36861 | J378: 8
A379: =ROW()-2 -> 2176 | B379: TP | C379: 4303 | D379: 1 | E379: 04303-5 | F379: 中文 Windows ME 组网与多媒体技术 | G379: 康博创作室 | H379: 25.80 | I379: 36982 | J379: 10
A380: =ROW()-2 -> 2177 | B380: TP | C380: 4763 | D380: 1 | E380: 04763-4 | F380: Windows 2000 虚拟专用网络 | G380: 陆建业译 | H380: 32.00 | I380: 37104 | J380: 10
A381: =ROW()-2 -> 2178 | B381: TP | C381: 3019 | D381: 4 | E381: 03019-7 | F381: 中文Windows 98 使用手册 | G381: 木林森等 | H381: 34.00 | I381: 1998 | J381: 10
A382: =ROW()-2 -> 2179 | B382: TP | C382: 3286 | D382: 1 | E382: 03286-6 | F382: Windows 98 中文版学习捷径 | G382: 贺军 等 | H382: 38.00 | I382: 36892 | J382: 7
A383: =ROW()-2 -> 2180 | B383: TP | C383: 3349 | D383: 1 | E383: 03349-8 | F383: 中文Windows 98 培训教程 | G383: 王诚君 | H383: 28.00 | I383: 1999 | J383: 8
A384: =ROW()-2 -> 2181 | B384: TP | C384: 3201 | D384: 2 | E384: 03201-7 | F384: 中文Windows 98 使用技巧与实例 | G384: 罗运模等 | H384: 28.00 | I384: 1999 | J384: 9
A385: =ROW()-2 -> 2182 | B385: TP | C385: 3126 | D385: 2 | E385: 03126-6 | F385: Windows 98 新功能 | G385: 陈强等 | H385: 22.50 | I385: 1998 | J385: 9
A386: =ROW()-2 -> 2183 | B386: TP | C386: 3282 | D386: 1 | E386: 03282-3 | F386: Windows 98 高级实用指南 | G386: 段爱民 等译 | H386: 59.00 | I386: 1998 | J386: 5
A387: =ROW()-2 -> 2184 | B387: TP | C387: 3209 | D387: 2 | E387: 03209-2 | F387: Windows 98 中文版使用、技巧与编程 | G387: 曹国钧等 | H387: 48.00 | I387: 1999 | J387: 7
A388: =ROW()-2 -> 2185 | B388: TP | C388: 1030 | D388: 1 | E388: 01030-7 | F388: 计算机基础教程 (Windows 98 版) | G388: 黄云森等 | H388: 38.00 | I388: 37530 | J388: 7
A389: =ROW()-2 -> 2186 | B389: TP | C389: 5085 | D389: 1 | E389: 05085-6 | F389: Windows 2000 安全技术 | G389: 倪晓强等译 | H389: 43.00 | I389: 37226 | J389: 7
A390: =ROW()-2 -> 2187 | B390: TP | C390: 4476 | D390: 1 | E390: 04476-7 | F390: Windows 2000 注册表技术与应用实例 | G390: 李进 等 | H390: 58.00 | I390: 37257 | J390: 5
A391: =ROW()-2 -> 2188 | B391: TP | C391: 4844 | D391: 1 | E391: 04844-4 | F391: Windows 2000 注册表彻底剖析 | G391: 章轩工作室 | H391: 32.00 | I391: 37323 | J391: 8
A392: =ROW()-2 -> 2189 | B392: TP | C392: 5027 | D392: 1 | E392: 05027-9 | F392: 中文版 Windows XP 注册表应用与开发实例 | G392: 胡辰浩等 | H392: 32.00 | I392: 37327 | J392: 8
A393: =ROW()-2 -> 2190 | B393: TP | C393: 3307 | D393: 6 | E393: 03307-2 | F393: Windows 95/98中文版注册表\配置与应用实例 | G393: 曹国均等 | H393: 49.00 | I393: 36982 | J393: 5
A394: =ROW()-2 -> 2191 | B394: TP | C394: 1216 | D394: 2 | E394: 01216-4 | F394: Windows 9X/NT 注册表技术内幕 | G394: 李进 等 | H394: 32.00 | I394: 36951 | J394: 8
A395: =ROW()-2 -> 2192 | B395: TP | C395: 2686 | D395: 1 | E395: 02686-6 | F395: Windows NT Server 4.0中文版专业指南 | G395: 戴有炜等 | H395: 35.00 | I395: 1997 | J395: 8
A396: =ROW()-2 -> 2193 | B396: TP | C396: 2659 | D396: 2 | E396: 02659-9 | F396: Windows NT Server 4.0中文版实用指南 | G396: 戴有炜等 | H396: 32.00 | I396: 1998 | J396: 9
A397: =ROW()-2 -> 2194 | B397: TP | C397: 1153 | D397: 1 | E397: 01153-2 | F397: 巧学巧用 Windows me 中文版 | G397: 刘 彪 等 | H397: 34.00 | I397: 36923 | J397: 7
A398: =ROW()-2 -> 2195 | B398: TP | C398: 4185 | D398: 1 | E398: 04185-7 | F398: 中文 Windows me 实用培训教程 | G398: 蒋小华等 | H398: 20.00 | I398: 37135 | J398: 13
A399: =ROW()-2 -> 2196 | B399: TP | C399: 4637 | D399: 1 | E399: 04637-9 | F399: 实用 UNIX 教程 | G399: 安捷 译 | H399: 64.00 | I399: 37073 | J399: 4
A400: =ROW()-2 -> 2197 | B400: TP | C400: 4500 | D400: 1 | E400: 04500-3 | F400: 最新 UNIX 程序设计与编程技巧 | G400: 阮戈 等 | H400: 46.00 | I400: 37073 | J400: 6
A401: =ROW()-2 -> 2198 | B401: TP | C401: 4795 | D401: 1 | E401: 04795-2 | F401: UNIX 平台下 C 语言编程 | G401: 喻志虎 | H401: 38.00 | I401: 37337 | J401: 7
A402: =ROW()-2 -> 2199 | B402: TP | C402: 2767 | D402: 3 | E402: 02767-6 | F402: UNIX系统基础 | G402: 陈慧蓉 | H402: 18.50 | I402: 37226 | J402: 10
A403: =ROW()-2 -> 2200 | B403: P- | C403: 2532 | D403: 1 | E403: 7900625321 | F403: UNIX系统管理员大全（配光盘） | G403: 段剑波译 | H403: 68.00 | I403: 36678 | J403: 6
A404: =ROW()-2 -> 2201 | B404: TP | C404: 3815 | D404: 1 | E404: 03815-5 | F404: UNIX 网络编程 第2卷：进程间通信(第2版) | G404: 扬继张译 | H404: 58.00 | I404: 36586 | J404: 6
A405: =ROW()-2 -> 2202 | B405: TP | C405: 0427 | D405: I | E405: 00427-7 | F405: 中国计算机培训网统编教材：XENIX系统使用 入门 | G405: 白晓笛等 | H405: 25.00 | I405: 1998 | J405: 8
A406: =ROW()-2 -> 2203 | B406: TP | C406: 2496 | D406: 3 | E406: 02496-0 | F406: 微机上的UNIX操作系统Linux使用指南 | G406: 王小鸽等 | H406: 19.50 | I406: 1998 | J406: 11
A407: =ROW()-2 -> 2204 | B407: TP | C407: 5105 | D407: 1 | E407: 05105-4 | F407: Debian GUN/Linux 高级应用大全（配光盘） | G407: 陈河南等译 | H407: 95.00 | I407: 37257 | J407: 3
A408: =ROW()-2 -> 2205 | B408: TP | C408: 5709 | D408: 1 | E408: 05709-5 | F408: Red Hat Linux 7.2系统管理 | G408: 李蔚泽 | H408: 34.00 | I408: 37500 | J408: 8
A409: =ROW()-2 -> 2206 | B409: TP | C409: 4263 | D409: 1 | E409: 04263-2 | F409: 实用 Linux 教程 | H409: 43.00 | I409: 36951 | J409: 7
A410: =ROW()-2 -> 2207 | B410: TP | C410: 4553 | D410: 1 | E410: 04553-4 | F410: Linux 服务器配置与优化 | G410: 顾云苏 | H410: 23.00 | I410: 37135 | J410: 9
A411: =ROW()-2 -> 2208 | B411: TP | C411: 4688 | D411: 1 | E411: 04688-3 | F411: Linux 实用组网技术 | G411: 肖薇 等 | H411: 42.00 | I411: 37500 | J411: 7
A412: =ROW()-2 -> 2209 | B412: P- | C412: 3724 | D412: 1 | E412: 7900637249 | F412: Linux 技术内幕（配光盘） | G412: 王超 译 | H412: 39.00 | I412: 37135 | J412: 10
A413: =ROW()-2 -> 2210 | B413: P- | C413: 3599 | D413: 1 | E413: 7900635998 | F413: 嵌入式 Linux 系统设计与应用（配光盘） | G413: 王学龙 | H413: 45.00 | I413: 37104 | J413: 7
A414: =ROW()-2 -> 2211 | B414: TP | C414: 4979 | D414: 2 | E414: 04979-3 | F414: 嵌入式 Linux 设计与应用（配光盘） | G414: 邹思轶 | H414: 38.00 | I414: 37372 | J414: 7
A415: =ROW()-2 -> 2212 | B415: TP | C415: 1312 | D415: 2 | E415: 01312-8 | F415: Linux 初学者指南 | G415: 宋建平等 | H415: 33.00 | I415: 36617 | J415: 8
A416: =ROW()-2 -> 2213 | B416: P- | C416: 1774 | D416: 2 | E416: 7900617744 | F416: Linux 系统管理指南 （配光盘) | G416: 晓冬等译 | H416: 39.00 | I416: 36312 | J416: 11
A417: =ROW()-2 -> 2214 | B417: TP | C417: 3720 | D417: 1 | E417: 03720-5 | F417: Linux 管理员指南 （配光盘) | G417: 何田 等 | H417: 39.00 | I417: 36617 | J417: 8
A418: =ROW()-2 -> 2215 | B418: TP | C418: 1089 | D418: 1 | E418: 01089-7 | F418: Linux 高级网络管理 | G418: 冯建华等 | H418: 25.00 | I418: 36861 | J418: 10
A419: =ROW()-2 -> 2216 | B419: TP | C419: 5552 | D419: 1 | E419: 05552-1 | F419: Linux 管理与应用基础（配光盘) | G419: 位元文化 | H419: 38.00 | I419: 37438 | J419: 7
A420: =ROW()-2 -> 2217 | B420: P- | C420: 3064 | D420: 1 | E420: 7900630643 | F420: Linux 实用大全 （配4张光盘） | G420: 杨文志 | H420: 95.00 | I420: 36951 | J420: 5
A421: =ROW()-2 -> 2218 | B421: P- | C421: 3115 | D421: 1 | E421: 7900631151 | F421: Linux 快速入门 （配光盘） | G421: 超星空工作室 | H421: 33.00 | I421: 36982 | J421: 11
A422: =ROW()-2 -> 2219 | B422: TP | C422: 4149 | D422: 1 | E422: 04149-0 | F422: Red Hat Linux 系统管理指南 | G422: 卢亮等译 | H422: 30.00 | I422: 36861 | J422: 10
A423: =ROW()-2 -> 2220 | B423: P- | C423: 2565 | D423: 1 | E423: 7900625658 | F423: FreeBSD 3.0 Internet 服务器的架设与管理 （配光盘） | G423: 王子华 | H423: 39.00 | I423: 36800 | J423: 10
A424: =ROW()-2 -> 2221 | B424: P- | C424: 2566 | D424: 1 | E424: 7900625666 | F424: FreeBSD 3.x Internet 高级服务器的架设与管理 （配光盘） | G424: 王子华 | H424: 39.00 | I424: 36800 | J424: 10
A425: =ROW()-2 -> 2222 | B425: TP | C425: 5869 | D425: 1 | E425: 05869-5 | F425: Windows.NET Server安全指南 | G425: Seth Fogie 等 | H425: 39.00 | I425: 37530 | J425: 9
F426: 数据库
A427: =ROW()-2 -> 2224 | B427: TP | C427: 0268 | D427: 5 | E427: 00268-1 | F427: 数据库系统原理 | G427: 俞盘祥等 | H427: 23.00 | I427: 36678 | J427: 8
A428: =ROW()-2 -> 2225 | B428: TP | C428: 4317 | D428: 1 | E428: 04317-5 | F428: 数据库原理与应用――习题解析 | G428: 李春葆 | H428: 24.00 | I428: 36982 | J428: 9
A429: =ROW()-2 -> 2226 | B429: TP | C429: 4340 | D429: 1 | E429: 04340-X | F429: 数据库系统原理与应用教程 | G429: 闪四清 | H429: 35.00 | I429: 37438 | J429: 8
A430: =ROW()-2 -> 2227 | B430: TP | C430: 4574 | D430: 1 | E430: 04574-7 | F430: 精通 SPSS | G430: 张宜华 | H430: 30.00 | I430: 37500 | J430: 9
A431: =ROW()-2 -> 2228 | B431: P- | C431: 2599 | D431: 1 | E431: 7900625992 | F431: 多层分布式数据库实战（配光盘） | G431: 王 涛 | H431: 33.00 | I431: 36800 | J431: 13
A432: =ROW()-2 -> 2229 | B432: TP | C432: 1215 | D432: 1 | E432: 01215-6 | F432: Informix 高级编程指南 | G432: 赵敬中等 | H432: 38.00 | I432: 36831 | J432: 8
A433: =ROW()-2 -> 2230 | B433: TP | C433: 0759 | D433: 1 | E433: 00759-4 | F433: Visual C++ 6.0 数据库开发指南（配光盘） | G433: 李博轩 | H433: 64.00 | I433: 37226 | J433: 5
A434: =ROW()-2 -> 2231 | B434: TP | C434: 3029 | D434: 6 | E434: 03029-4 | F434: FoxBASE+关系数据库系统（第二版） | G434: 郑甫京等 | H434: 18.80 | I434: 37104 | J434: 12
A435: =ROW()-2 -> 2232 | B435: TP | C435: 3645 | D435: 2 | E435: 03645-4 | F435: Visual Basic 6.0 中文版数据库和 Internet 编程 | G435: 胡荣根 | H435: 30.00 | I435: 36678 | J435: 8
A436: =ROW()-2 -> 2233 | B436: TP | C436: 3617 | D436: 2 | E436: 03617-9 | F436: Visual FoxPro 6.0入门与应用实例(配光盘) | G436: 李俊德 | H436: 69.00 | I436: 37408 | J436: 5
A437: =ROW()-2 -> 2234 | B437: TP | C437: 4003 | D437: 1 | E437: 04003-6 | F437: Visual FoxPro 6 数据库开发教程 | H437: 34.00 | I437: 36739 | J437: 6
A438: =ROW()-2 -> 2235 | B438: TP | C438: 3878 | D438: 1 | E438: 03878-3 | F438: Visual FoxPro 6.0 中文版专家指南 | G438: 夏伟文 | H438: 16.00 | I438: 37012 | J438: 21
A439: =ROW()-2 -> 2236 | B439: TP | C439: 2610 | D439: 1 | E439: 02610-6 | F439: FoxPro 2.6数据库应用教程 | G439: 翁正科 | H439: 28.00 | I439: 36892 | J439: 7
A440: =ROW()-2 -> 2237 | B440: P- | C440: 2254 | D440: 1 | E440: 7900622543 | F440: SQL Server 7.0 系统管理指南 | G440: 熊桂喜等译 | H440: 78.00 | I440: 36495 | J440: 4
A441: =ROW()-2 -> 2238 | B441: TP | C441: 1175 | D441: 1 | E441: 01175-3 | F441: SQL Server 7.0 系统管理和应用开发指南 | G441: 闪四清 | H441: 65.00 | I441: 36770 | J441: 4
A442: =ROW()-2 -> 2239 | B442: TP | C442: 5455 | D442: 1 | E442: 05455-X | F442: SQL Server 实用简明教程 | G442: 闪四清 | H442: 33.00 | I442: 37347 | J442: 8
A443: =ROW()-2 -> 2240 | B443: P- | C443: 3045 | D443: 1 | E443: 7900630457 | F443: Microsoft SQL Server 7.0 开发指南（配光盘） | G443: 熊桂喜等译 | H443: 69.00 | I443: 36770 | J443: 5
A444: =ROW()-2 -> 2241 | B444: TP | C444: 4161 | D444: 1 | E444: 04161-X | F444: 实用 Microsoft SQL Server 7.0 教程 | G444: 李昕等译 | H444: 46.00 | I444: 36861 | J444: 6
A445: =ROW()-2 -> 2242 | B445: TP | C445: 4222 | D445: 1 | E445: 04222-5 | F445: SQL Server 2000 系统管理指南 | G445: 闪四清 | H445: 42.00 | I445: 37165 | J445: 7
A446: =ROW()-2 -> 2243 | B446: TP | C446: 4401 | D446: 1 | E446: 04401-5 | F446: SQL Server 2000 应用开发技术指南 | G446: 彭 东 | H446: 58.00 | I446: 37012 | J446: 5
A447: =ROW()-2 -> 2244 | B447: TP | C447: 4383 | D447: 1 | E447: 04383-3 | F447: SQL Server 2000 数据仓库设计和使用指南 | G447: 康博创作室 | H447: 28.00 | I447: 37226 | J447: 10
A448: =ROW()-2 -> 2245 | B448: TP | C448: 4514 | D448: 1 | E448: 04514-3 | F448: SQL Server 2000 数据库设计与系统管理 | G448: 李劲 等 | H448: 45.00 | I448: 37073 | J448: 6
A449: =ROW()-2 -> 2246 | B449: TP | C449: 4621 | D449: 1 | E449: 04621-2 | F449: SQL Server 2000 与 XML 整合应用 | G449: 沈兆阳等 | H449: 33.00 | I449: 37135 | J449: 5
A450: =ROW()-2 -> 2247 | B450: TP | C450: 4517 | D450: 1 | E450: 04517-8 | F450: SQL Server 2000 培训教程 | G450: 余晨 等 | H450: 36.00 | I450: 37530 | J450: 7
A451: =ROW()-2 -> 2248 | B451: TP | C451: 4843 | D451: 1 | E451: 04843-6 | F451: SQL Server 2000 程序设计 | G451: 隆华软件 | H451: 33.00 | I451: 37362 | J451: 9
A452: =ROW()-2 -> 2249 | B452: TP | C452: 4695 | D452: 1 | E452: 04695-6 | F452: SQL Server 2000 OLAP 解决方案――数据仓库与Analysis Services | G452: 沈兆阳 | H452: 31.00 | I452: 37135 | J452: 8
A453: =ROW()-2 -> 2250 | B453: P- | C453: 3748 | D453: 1 | E453: 7900637486 | F453: Microsoft SQL Server 2000 优化指南（配光盘） | G453: 袁勤勇等译 | H453: 45.00 | I453: 37196 | J453: 7
A454: =ROW()-2 -> 2251 | B454: TP | C454: 4682 | D454: 1 | E454: 04682-4 | F454: 手把手教你开发管理信息系统 | G454: 罗超理 | H454: 28.00 | I454: 37348 | J454: 10
A455: =ROW()-2 -> 2252 | B455: TP | C455: 5554 | D455: 1 | E455: 05554-1 | F455: Visual FoxPro 7.0类和对象手册 | G455: 王冬等 | H455: 30.00 | I455: 37438 | J455: 8
A456: =ROW()-2 -> 2253 | B456: TP | C456: 4496 | D456: 1 | E456: 04496-1 | F456: 手把手教你学用数据库 | G456: 赵健明 | H456: 34.00 | I456: 37043 | J456: 8
A457: =ROW()-2 -> 2254 | B457: TP | C457: 5088 | D457: 1 | E457: 05088-0 | F457: Visual FoxPro 7.0实例解析 | G457: 孙立明等 | H457: 28.00 | I457: 37438 | J457: 10
A458: =ROW()-2 -> 2255 | B458: P- | C458: 4164 | D458: 1 | E458: 7900641645 | F458: SQL实用参考手册（第四版）（配光盘） | G458: 康博译 | H458: 46.00 | I458: 37348 | J458: 7
A459: =ROW()-2 -> 2256 | B459: TP | C459: 5293 | D459: 1 | E459: 05293-X | F459: SQL故障诊断与排错技术 | G459: 康博译 | H459: 26.00 | I459: 37348 | J459: 11
A460: =ROW()-2 -> 2257 | B460: TP | C460: 5129 | D460: 1 | E460: 05129-1 | F460: Delphi分布式多层应用程序开发 | G460: 陈锐 | H460: 25.00 | I460: 37348 | J460: 10
A461: =ROW()-2 -> 2258 | B461: TP | C461: 5278 | D461: 1 | E461: 05278-6 | F461: SQL Server 2000简明教程 | G461: 黄维通等 | H461: 22.00 | I461: 37469 | J461: 11
A462: =ROW()-2 -> 2259 | B462: TP | C462: 5556 | D462: 1 | E462: 05556-1 | F462: Visual FoxPro 7.0函数和系统变量手册 | G462: 王冬等 | H462: 36.00 | I462: 37438 | J462: 7
A463: =ROW()-2 -> 2260 | B463: TP | C463: 5755 | D463: 1 | E463: 057559 | F463: 分布式Java 2 数据库系统开发指南 | G463: Stewart birnam | H463: 36.00 | I463: 37469 | J463: 12
A464: =ROW()-2 -> 2261 | B464: TP | C464: 5833 | D464: 1 | E464: 05833-4 | F464: Pocket PC 数据库应用程序设计 | G464: 黄聪明 | H464: 38.00 | I464: 37500 | J464: 8
F465: 网络与通信
A466: =ROW()-2 -> 2263 | B466: TP | C466: 5617 | D466: 1 | E466: 05617-1 | F466: Unix/solaris 系统管理与网络管理 | G466: 饶云华等 | H466: 45.00 | I466: 37438 | J466: 7
A467: =ROW()-2 -> 2264 | B467: TP | C467: 5153 | D467: 1 | E467: 05153-4 | F467: Windows 2000 Server网络技术与构架管理 | G467: 蔡一郎 | H467: 34.00 | I467: 37469 | J467: 7
A468: =ROW()-2 -> 2265 | B468: TP | C468: 5178 | D468: 1 | E468: 05178-x | F468: 自己动手装ADSL | G468: 柯志贤 | H468: 38.00 | I468: 37316 | J468: 7
A469: =ROW()-2 -> 2266 | B469: TP | C469: 4708 | D469: 1 | E469: 04708-1 | F469: 嵌入式 Internet――21世纪的一场信息技术革命 | G469: 赵 海 | H469: 29.80 | I469: 37135 | J469: 8
A470: =ROW()-2 -> 2267 | B470: TP | C470: 4639 | D470: 1 | E470: 04639-5 | F470: 网络建设与服务技术丛书――MySQL 高级配置和管理 | G470: 卢湘江等 | H470: 32.00 | I470: 37135 | J470: 8
A471: =ROW()-2 -> 2268 | B471: TP | C471: 4862 | D471: 1 | E471: 04862-2 | F471: 网络建设与服务技术丛书――PHP 语言进阶和高级应用 | G471: 龙浩 等 | H471: 45.00 | I471: 37196 | J471: 6
A472: =ROW()-2 -> 2269 | B472: TP | C472: 4975 | D472: 1 | E472: 04975-0 | F472: 网络建设与服务技术丛书――Apache 服务器配置和管理 | G472: 傅宇旭等 | H472: 32.00 | I472: 37226 | J472: 8
A473: =ROW()-2 -> 2270 | B473: TP | C473: 5130 | D473: 1 | E473: 05130-5 | F473: 网络建设与服务技术丛书――Email 服务器配置和管理 | G473: 傅宇旭等 | H473: 29.00 | I473: 37362 | J473: 9
A474: =ROW()-2 -> 2271 | B474: TP | C474: 4762 | D474: 1 | E474: 04762-6 | F474: 网络系统的集成管理：概念、体系及其应用 | G474: 曹阳 等译 | H474: 58.00 | I474: 37196 | J474: 8
A475: =ROW()-2 -> 2272 | B475: P- | C475: 3737 | D475: 1 | E475: 7900637370 | F475: 移动 agent 及其应用 | G475: 张云勇 | H475: 34.00 | I475: 37196 | J475: 10
A476: =ROW()-2 -> 2273 | B476: TP | C476: 3216 | D476: 3 | E476: 03216-5 | F476: 计算机网络基础 | G476: 伍小明等 | H476: 10.00 | I476: 36586 | J476: 25
A477: =ROW()-2 -> 2274 | B477: TP | C477: 2203 | D477: 3 | E477: 02203-8 | F477: 计算机通信与网络教程 | G477: 林 生 | H477: 49.00 | I477: 36586 | J477: 5
A478: =ROW()-2 -> 2275 | B478: TP | C478: 5499 | D478: 1 | E478: 05499-1 | F478: Java移动通信程序设计――J2ME MIDP | G478: 黄聪明 | H478: 33.00 | I478: 37408 | J478: 8
A479: =ROW()-2 -> 2276 | B479: TP | C479: 3920 | D479: 1 | E479: 03920-8 | F479: 计算机网络协议和实现技术 | G479: 鲁士文 | H479: 42.00 | I479: 36739 | J479: 5
A480: =ROW()-2 -> 2277 | B480: TP | C480: 0775 | D480: 1 | E480: 00775-6 | F480: 网络管理原理与实现技术 | G480: 杨家海等 | H480: 38.00 | I480: 36770 | J480: 7
A481: =ROW()-2 -> 2278 | B481: TP | C481: 4372 | D481: 1 | E481: 04372-8 | F481: XDSL 技术与体系结构 | G481: 任天恩译 | H481: 38.00 | I481: 36982 | J481: 9
A482: =ROW()-2 -> 2279 | B482: TP | C482: 3833 | D482: 1 | E482: 03833-3 | F482: 虚拟私用网络技术 | G482: 孔雷等译 | H482: 26.00 | I482: 36617 | J482: 20
A483: =ROW()-2 -> 2280 | B483: TP | C483: 4267 | D483: 1 | E483: 04267-5 | F483: 计算机网络和计算机系统的性能评价 | G483: 林 闯 | H483: 32.00 | I483: 36982 | J483: 7
A484: =ROW()-2 -> 2281 | B484: TP | C484: 0989 | D484: 1 | E484: 00989-9 | F484: 电脑・网络基本操作 16讲 | G484: 陈树楷等 | H484: 19.00 | I484: 36617 | J484: 15
A485: =ROW()-2 -> 2282 | B485: TP | C485: 0989 | D485: 2 | E485: 00989-9 | F485: 电脑・网络基本操作 16讲（配光盘） | G485: 陈树楷等 | H485: 29.00 | I485: 36739 | J485: 14
A486: =ROW()-2 -> 2283 | B486: TP | C486: 1010 | D486: 1 | E486: 01010-2 | F486: 计算机常用网络工具集锦 | G486: 关敬敏等 | H486: 23.00 | I486: 36647 | J486: 13
A487: =ROW()-2 -> 2284 | B487: TP | C487: 4140 | D487: 1 | E487: 04140-7 | F487: 当代组网技术 | G487: 张公忠等 | H487: 49.80 | I487: 36861 | J487: 5
A488: =ROW()-2 -> 2285 | B488: TP | C488: 4256 | D488: 1 | E488: 04256-X | F488: ISDN 联网技术与应用指南 | G488: 陈建华等 | H488: 29.00 | I488: 36951 | J488: 9
A489: =ROW()-2 -> 2286 | B489: TP | C489: 4066 | D489: 1 | E489: 04066-4 | F489: 实用网络布线教程 | G489: 薛淑良等译 | H489: 22.00 | I489: 36800 | J489: 15
A490: =ROW()-2 -> 2287 | B490: P- | C490: 2508 | D490: 1 | E490: 7900625089 | F490: 家庭网络实用（配光盘） | G490: 吴师通 | H490: 35.00 | I490: 36739 | J490: 12
A491: =ROW()-2 -> 2288 | B491: TP | C491: 3969 | D491: 1 | E491: 03969-0 | F491: 微软家庭及中小企业联网指南 | G491: 陈萍等译 | H491: 34.00 | I491: 36739 | J491: 10
A492: =ROW()-2 -> 2289 | B492: TP | C492: 1319 | D492: 1 | E492: 01319-0 | F492: 政府上网机关工作人员培训教程 | G492: 李进 等 | H492: 22.00 | I492: 36617 | J492: 12
A493: =ROW()-2 -> 2290 | B493: TP | C493: 2739 | D493: 3 | E493: 02739-0 | F493: 因特网路由技术 | G493: 陶文星等 | H493: 27.00 | I493: 1998 | J493: 10
A494: =ROW()-2 -> 2291 | B494: P- | C494: 3013 | D494: 2 | E494: 7900630139 | F494: 因特网应用培训教程（配光盘） | G494: 北京市委等 | H494: 25.00 | I494: 37135 | J494: 15
A495: =ROW()-2 -> 2292 | B495: TP | C495: 3256 | D495: 6 | E495: 03256-4 | F495: 网上冲浪夺冠 | G495: 扬 庆 | H495: 38 | I495: 36678 | J495: 8
A496: =ROW()-2 -> 2293 | B496: TP | C496: 4435 | D496: 1 | E496: 04435-X | F496: Microsoft Windows 2000 Server 网络系统与服务 | G496: 李毅聘 | H496: 32.00 | I496: 37104 | J496: 8
A497: =ROW()-2 -> 2294 | B497: TP | C497: 3724 | D497: 2 | E497: 03724-8 | F497: Windows 98 联网指南 | G497: 博彦公司 | H497: 22.80 | I497: 36708 | J497: 9
A498: =ROW()-2 -> 2295 | B498: TP | C498: 3755 | D498: 1 | E498: 03755-8 | F498: 国家空间信息基础设施与数字地球 | G498: 承继成等 | H498: 21.00 | I498: 36434 | J498: 11
A499: =ROW()-2 -> 2296 | B499: TP | C499: 3813 | D499: 1 | E499: 03813-9 | F499: Internet 网络信息检索 ―― 原理 工具 技巧 | G499: 储荷婷等 | H499: 26.50 | I499: 36465 | J499: 9
A500: =ROW()-2 -> 2297 | B500: TP | C500: 1122 | D500: 1 | E500: 01122-2 | F500: 新一代 Internet 协议 IPv6 | G500: 卢显良等 | H500: 16.00 | I500: 36739 | J500: 15
A501: =ROW()-2 -> 2298 | B501: TP | C501: 4993 | D501: 1 | E501: 04993-9 | F501: Internet 协议概念与实践 | G501: 施威铭 研究室 | H501: 48.00 | I501: 37165 | J501: 5
A502: =ROW()-2 -> 2299 | B502: TP | C502: 2782 | D502: 4 | E502: 02782-X | F502: Internet 入网与使用 | G502: 刘畅 等 | H502: 24.00 | I502: 36495 | J502: 10
A503: =ROW()-2 -> 2300 | B503: TP | C503: 3814 | D503: 1 | E503: 03814-7 | F503: Internet 高级应用与技巧 | G503: 孙 昕 等 | H503: 26.00 | I503: 36617 | J503: 10
A504: =ROW()-2 -> 2301 | B504: TP | C504: 3803 | D504: 1 | E504: 03803-1 | F504: 上网起步―― 操作与技巧 | G504: 童纯清等 | H504: 20.00 | I504: 36526 | J504: 12
A505: =ROW()-2 -> 2302 | B505: TP | C505: 4127 | D505: 1 | E505: 04127-X | F505: 上网实用培训教程 | G505: 王诚君 | H505: 24.00 | I505: 36892 | J505: 9
A506: =ROW()-2 -> 2303 | B506: TP | C506: 4701 | D506: 1 | E506: 04701-4 | F506: 电脑生手轻松上网 | G506: 高越明等 | H506: 22.00 | I506: 37348 | J506: 13
A507: =ROW()-2 -> 2304 | B507: TP | C507: 4307 | D507: 1 | E507: 04307-8 | F507: 上网实用――技巧与提高 | G507: 罗晓光 | H507: 19.00 | I507: 36982 | J507: 13
A508: =ROW()-2 -> 2305 | B508: TP | C508: 5659 | D508: 1 | E508: 05659-1 | F508: Internet 网络冲浪百事通 | G508: 张洪彬 | H508: 26.00 | I508: 37438 | J508: 10
A509: =ROW()-2 -> 2306 | B509: TP | C509: 1074 | D509: 2 | E509: 01074-9 | F509: Internet 网虫百事通 | G509: 张洪彬 | H509: 34.00 | I509: 37073 | J509: 8
A510: =ROW()-2 -> 2307 | B510: TP | C510: 2889 | D510: 3 | E510: 02889-3 | F510: INTRANET 网络技术及应用 | G510: 胡道元 | H510: 29.80 | I510: 37469 | J510: 8
A511: =ROW()-2 -> 2308 | B511: TP | C511: 2458 | D511: 3 | E511: 02458-8 | F511: ATM网络互连原理与工程 | G511: 张宏科等 | H511: 17.50 | I511: 36342 | J511: 13
A512: =ROW()-2 -> 2309 | B512: TP | C512: 4444 | D512: 1 | E512: 04444-9 | F512: ADSL 宽带网技术 | G512: 郭士秋 | H512: 32.00 | I512: 37043 | J512: 9
A513: =ROW()-2 -> 2310 | B513: TN | C513: 2759 | D513: 2 | E513: 02759-5 | F513: 宽带综合业务数字网与ATM局域网 | G513: 李津生等 | H513: 17.50 | I513: 1998 | J513: 12
A514: =ROW()-2 -> 2311 | B514: TP | C514: 5157 | D514: 1 | E514: 05157-7 | F514: 宽带网络快易通――网络通信应用指南 | G514: 王志平 | H514: 27.00 | I514: 37257 | J514: 9
A515: =ROW()-2 -> 2312 | B515: TP | C515: 2951 | D515: 2 | E515: 02951-2 | F515: 网络管理协议及应用开发 | G515: 岑贤道等 | H515: 29.00 | I515: 1999 | J515: 8
A516: =ROW()-2 -> 2313 | B516: TP | C516: 4865 | D516: 1 | E516: 04865-7 | F516: 局域网应急处理与技巧实例（上册） | G516: 先 锋 | H516: 49.00 | I516: 37196 | J516: 5
A517: =ROW()-2 -> 2314 | B517: TP | C517: 2336 | D517: 7 | E517: 02336-0 | F517: 计算机局域网(第2版) | G517: 胡道元 | H517: 28.00 | I517: 37257 | J517: 8
A518: =ROW()-2 -> 2315 | B518: TP | C518: 2336 | D518: 8 | E518: 02336-0 | F518: 计算机局域网(第2版)（配光盘） | G518: 胡道元 | H518: 38.00 | I518: 36982 | J518: 8
A519: =ROW()-2 -> 2316 | B519: TP | C519: 4397 | D519: 1 | E519: 04397-3 | F519: 以太网组网技术大全 | G519: 刘晓辉 | H519: 52.00 | I519: 37326 | J519: 5
A520: =ROW()-2 -> 2317 | B520: TP | C520: 4458 | D520: 1 | E520: 04458-9 | F520: 企业网组建指南 | G520: 郝卫东等 | H520: 24.00 | I520: 37012 | J520: 10
A521: =ROW()-2 -> 2318 | B521: TP | C521: 1945 | D521: 6 | E521: 01945-2 | F521: Novell NetWare 网络速成 | G521: 夏春和等 | H521: 11.00 | I521: 36617 | J521: 18
A522: =ROW()-2 -> 2319 | B522: TP | C522: 0897 | D522: 1 | E522: 00897-3 | F522: NetWare 5 网络管理及应用 | G522: 李辉 等 | H522: 32.00 | I522: 36923 | J522: 10
A523: =ROW()-2 -> 2320 | B523: TP | C523: 0898 | D523: 2 | E523: 00898-1 | F523: 网络技术基础 | G523: 黄丹 等 | H523: 21.00 | I523: 36678 | J523: 16
A524: =ROW()-2 -> 2321 | B524: G- | C524: 4257 | D524: 1 | E524: 04257-8 | F524: 网络媒体概论 | G524: 匡文波 | H524: 17.00 | I524: 36951 | J524: 16
A525: =ROW()-2 -> 2322 | B525: P- | C525: 2519 | D525: 1 | E525: 7900625194 | F525: 畅游 Internet 实用培训教程（配光盘） | G525: 汤 文 | H525: 35.00 | I525: 36861 | J525: 9
A526: =ROW()-2 -> 2323 | B526: TP | C526: 3495 | D526: 1 | E526: 03495-8 | F526: 使用 Internet 问题解答 | G526: 赵 彬 | H526: 14.00 | I526: 36312 | J526: 20
A527: =ROW()-2 -> 2324 | B527: TP | C527: 3828 | D527: 1 | E527: 03828-7 | F527: WWW 辞典 | G527: 裴晓明译 | H527: 12.00 | I527: 36647 | J527: 24
A528: =ROW()-2 -> 2325 | B528: TP | C528: 2592 | D528: 1 | E528: 02592-4 | F528: UNIX 网络原理与应用 | G528: 欧宗生 | H528: 22.00 | I528: 1997 | J528: 15
A529: =ROW()-2 -> 2326 | B529: TP | C529: 3548 | D529: 1 | E529: 03548-2 | F529: UNIX 网络编程 | G529: 施振川等 | H529: 94.00 | I529: 36342 | J529: 3
A530: =ROW()-2 -> 2327 | B530: TP | C530: 1585 | D530: 5 | E530: 01585-6 | F530: 微机通信原理与实用技术 | G530: 马宏杰等 | H530: 19.80 | I530: 36586 | J530: 10
A531: =ROW()-2 -> 2328 | B531: TP | C531: 1427 | D531: C | E531: 01427-2 | F531: TCP/IP 网络原理与技术 | G531: 周明天等 | H531: 19.00 | I531: 37500 | J531: 12
A532: =ROW()-2 -> 2329 | B532: TP | C532: 1077 | D532: 1 | E532: 01077-3 | F532: IP 路由原理与技术 | G532: 张宏科等 | H532: 20.00 | I532: 36831 | J532: 16
A533: =ROW()-2 -> 2330 | B533: TP | C533: 3847 | D533: 1 | E533: 03847-3 | F533: 实用 Cisco 路由器技术教程 | G533: 钟向群译 | H533: 28.00 | I533: 36647 | J533: 13
A534: =ROW()-2 -> 2331 | B534: TP | C534: 4150 | D534: 1 | E534: 04150-4 | F534: IIS 5.0 系统管理指南 | G534: 于骞等译 | H534: 40.00 | I534: 36861 | J534: 8
A535: =ROW()-2 -> 2332 | B535: TP | C535: 2738 | D535: 1 | E535: 02738-2 | F535: 网络工程与综合布线系统 | G535: 黎连业 | H535: 34.00 | I535: 1997 | J535: 10
A536: =ROW()-2 -> 2333 | B536: TP | C536: 3110 | D536: 1 | E536: 03110-X | F536: 智能大厦网络实施指南 | G536: 黎连业等 | H536: 20.00 | I536: 1998 | J536: 13
A537: =ROW()-2 -> 2334 | B537: TP | C537: 3031 | D537: 1 | E537: 03031-6 | F537: 网络多媒体技术与应用 | G537: 张明敏 | H537: 38.00 | I537: 1998 | J537: 7
A538: =ROW()-2 -> 2335 | B538: TP | C538: 4167 | D538: 1 | E538: 04167-9 | F538: 实用Windows 对等网络连接教程 | H538: 40.00 | I538: 36892 | J538: 7
A539: =ROW()-2 -> 2336 | B539: P- | C539: 4186 | D539: 1 | E539: 7900641866 | F539: Pro/E 2000 i2 e 点就通（配光盘） | G539: 杨忠衡等 | H539: 38.00 | I539: 37469 | J539: 8
A540: =ROW()-2 -> 2337 | B540: TP | C540: 5121 | D540: 1 | E540: 05121-6 | F540: 蓝牙技术 | G540: 禹帆 | H540: 28.00 | I540: 37316 | J540: 10
A541: =ROW()-2 -> 2338 | B541: TP | C541: 5332 | D541: 1 | E541: 05332-4 | F541: 网络银行服务 | G541: 陈进 | H541: 14.00 | I541: 37347 | J541: 16
A542: =ROW()-2 -> 2339 | B542: TP | C542: 5268 | D542: 1 | E542: 05268-9 | F542: 局域网组建及应用培训教程 | G542: 孙江宏等 | H542: 30.00 | I542: 37469 | J542: 9
A543: =ROW()-2 -> 2340 | B543: TP | C543: 5266 | D543: 1 | E543: 05266-2 | F543: Windows Internet黑客防范与安全策略 | G543: 康博译 | H543: 28.00 | I543: 37347 | J543: 12
A544: =ROW()-2 -> 2341 | B544: TP | C544: 5349 | D544: 1 | E544: 05349-9 | F544: Exchange 2000 Server 系统管理指南 | G544: 吴志华等 | H544: 30.00 | I544: 37347 | J544: 9
A545: =ROW()-2 -> 2342 | B545: TP | C545: 5248 | D545: 1 | E545: 05248-4 | F545: Internet应急处理与技巧实例 | G545: 先锋 | H545: 48.00 | I545: 37347 | J545: 5
A546: =ROW()-2 -> 2343 | B546: TP | C546: 5184 | D546: 1 | E546: 05184-4 | F546: 下一代的IP网络技术保障――多协议标签交换 | G546: 吴伟 | H546: 14.00 | I546: 37347 | J546: 18
A547: =ROW()-2 -> 2344 | B547: TP | C547: 5462 | D547: 1 | E547: 05462-2 | F547: Jini实例精解 | G547: W.Keith Edwards Tom Rodden | H547: 49.00 | I547: 37408 | J547: 7
A548: =ROW()-2 -> 2345 | B548: TP | C548: 5541 | D548: 1 | E548: 05541-6 | F548: 心动数码生活 扫描刻录步步高 | G548: 鳄鱼宝宝 | H548: 18.00 | I548: 37408 | J548: 23
A549: =ROW()-2 -> 2346 | B549: TP | C549: 5458 | D549: 1 | E549: 05458-4 | F549: 校园网系统集成技术与应用 | G549: 刘正勇 | H549: 29.00 | I549: 37409 | J549: 9
A550: =ROW()-2 -> 2347 | B550: TP | C550: 5826 | D550: 1 | E550: 05826-1 | F550: 中国计算机科学与技术学科教程2002 | H550: 32.00 | I550: 37500 | J550: 25
A551: =ROW()-2 -> 2348 | B551: TP | C551: 5279 | D551: 1 | E551: 05279-4 | F551: 数据库驱动的Web站点 | G551: [美]Mike Morrison等 | H551: 34.00 | I551: 37438 | J551: 9
A552: =ROW()-2 -> 2349 | B552: TP | C552: 5835 | D552: 1 | E552: 05835-0 | F552: 中小网络管理维护一点通 | G552: 东方人华 | H552: 29.00 | I552: 37500 | J552: 10
A553: =ROW()-2 -> 2350 | B553: TP | C553: 5583 | D553: 1 | E553: 05583-1 | F553: XML高级网络应用 | G553: 但正刚等 | H553: 36.00 | I553: 37469 | J553: 7
A554: =ROW()-2 -> 2351 | B554: TP | C554: 5847 | D554: 1 | E554: 05847-4 | F554: 中小网络建设一点通 | G554: 东方人华 | H554: 23.00 | I554: 37500 | J554: 13
A555: =ROW()-2 -> 2352 | B555: TP | C555: 5870 | D555: 1 | E555: 05870-9 | F555: Java 网络程序设计 | G555: 黄嘉辉 | H555: 58.00 | I555: 37530 | J555: 6
A556: =ROW()-2 -> 2353 | B556: TP | C556: 5848 | D556: 1 | E556: 05848-2 | F556: Windows 2000 黑客大曝光：网络安全机密与解决方案 | G556: Joel Scambray, Stuart McClure 著 | H556: 53.00 | I556: 37530 | J556: 6
A557: =ROW()-2 -> 2354 | B557: TP | C557: 5876 | D557: 1 | E557: 05876-8 | F557: Linux 黑客大曝光：Linux 安全机密与解决方案 | G557: Brian Hatch, James Lee,George Kurtz 著 | H557: 59.00 | I557: 37530 | J557: 5
A558: =ROW()-2 -> 2355 | B558: TP | C558: 5733 | D558: 1 | E558: 05733-8 | F558: 黑客大挑战――用20个案例测试你的事件响应能力 | G558: Mike Schiffman | H558: 38.00 | I558: 37530 | J558: 8
A559: =ROW()-2 -> 2356 | B559: TP | C559: 5928 | D559: 1 | E559: 05928-4 | F559: 网络工程概论 | G559: 蔡建新 | H559: 33.00 | I559: 37530 | J559: 7
A560: =ROW()-2 -> 2357 | B560: TP | C560: 5927 | D560: 1 | E560: 05927-6 | F560: .NET移动通信程序设计 | G560: 刘志安 | H560: 20.00 | I560: 37530 | J560: 15
F561: 电子商务
A562: =ROW()-2 -> 2359 | B562: TP | C562: 3636 | D562: 2 | E562: 03636-5 | F562: EDI 与电子商务 | G562: 信息办公室 | H562: 38.00 | I562: 36708 | J562: 6
A563: =ROW()-2 -> 2360 | B563: TP | C563: 1154 | D563: 1 | E563: 01154-0 | F563: 实战网络营销 ―― 理论与实践 | G563: 刘光峰等 | H563: 39.80 | I563: 36678 | J563: 6
A564: =ROW()-2 -> 2361 | B564: TP | C564: 5102 | D564: 1 | E564: 05102-X | F564: 网络营销基础与实践 | G564: 冯英健 | H564: 27.00 | I564: 37469 | J564: 12
A565: =ROW()-2 -> 2362 | B565: TP | C565: 4152 | D565: 1 | E565: 04125-0 | F565: 电子商务与企业通信 | G565: 沈伦译 | H565: 24.00 | I565: 36892 | J565: 12
A566: =ROW()-2 -> 2363 | B566: TP | C566: 4058 | D566: 1 | E566: 04058-3 | F566: 电子商务网站的构建与维护 | G566: 王志峰等 | H566: 25.00 | I566: 36982 | J566: 11
A567: =ROW()-2 -> 2364 | B567: TP | C567: 4884 | D567: 1 | E567: 04884-3 | F567: 电子商务――从理念到行动 | G567: 梁春晓等 | H567: 27.00 | I567: 37165 | J567: 7
A568: =ROW()-2 -> 2365 | B568: P- | C568: 3780 | D568: 1 | E568: 790063780X | F568: 电子商务原理与应用开发实务（配光盘） | G568: 李明刚等 | H568: 46.00 | I568: 37226 | J568: 7
A569: =ROW()-2 -> 2366 | B569: P- | C569: 3739 | D569: 1 | E569: 7900637397 | F569: Microsoft Commerce Server 建构智能化电子商务平台（配光盘） | G569: 东 名 | H569: 33.00 | I569: 37196 | J569: 9
A570: =ROW()-2 -> 2367 | B570: TP | C570: 3844 | D570: 1 | E570: 03844-9 | F570: 网上商品行销指南 | G570: 孙 昕等译 | H570: 36.00 | I570: 36647 | J570: 10
A571: =ROW()-2 -> 2368 | B571: TP | C571: 5596 | D571: 1 | E571: 05596-3 | F571: 电子商务新视野 | G571: 陈锡筠等译 | H571: 29.00 | I571: 37438 | J571: 10
A572: =ROW()-2 -> 2369 | B572: TP | C572: 5621 | D572: 1 | E572: 056218 | F572: 电子商务实务教程 | G572: 陈科鹤 | H572: 30.00 | I572: 37469 | J572: 9
F573: 网络安全
A574: =ROW()-2 -> 2371 | B574: TP | C574: 5026 | D574: 1 | E574: 05026-0 | F574: 黑客大暴光 （第二版）―― 网络安全机密与解决方案 | G574: 钟向群等译 | H574: 69.00 | I574: 37196 | J574: 3
A575: =ROW()-2 -> 2372 | B575: P- | C575: 3749 | D575: 1 | E575: 7900637494 | F575: 黑客攻防对策（配光盘） | G575: 秘密客 | H575: 34.00 | I575: 37257 | J575: 8
A576: =ROW()-2 -> 2373 | B576: P- | C576: 4146 | D576: 1 | E576: 04146-7 | F576: 黑客攻防对策之木马篇 | G576: 秘密客 | H576: 29.00 | I576: 37414 | J576: 12
A577: =ROW()-2 -> 2374 | B577: TP | C577: 5020 | D577: 1 | E577: 05020-1 | F577: Windows 2000 Server 网络建设及安全维护 | G577: 庄彦泽 | H577: 23.00 | I577: 37226 | J577: 12
A578: =ROW()-2 -> 2375 | B578: TP | C578: 0819 | D578: 1 | E578: 00819-1 | F578: 网络安全与防火墙技术 | G578: 王睿 等 | H578: 25.00 | I578: 36831 | J578: 12
A579: =ROW()-2 -> 2376 | B579: G- | C579: 5641 | D579: 1 | E579: 05641-2 | F579: e矛e盾 | G579: 白 硕 | H579: 16.00 | I579: 37469 | J579: 18
A580: =ROW()-2 -> 2377 | B580: TP | C580: 5793 | D580: 1 | E580: 05793-1 | F580: 网络安全实用技术 | G580: 叶 丹 | H580: 33.00 | I580: 37530 | J580: 8
F581: RAS信息安全系列丛书
A582: =ROW()-2 -> 2379 | B582: P- | C582: 3718 | D582: 1 | E582: 7900637184 | F582: 密码工程实践指南（配光盘） | G582: 冯登国等译 | H582: 53.00 | I582: 37196 | J582: 6
A583: =ROW()-2 -> 2380 | B583: TP | C583: 4942 | D583: 1 | E583: 04942-4 | F583: IPSec：VPN的安全实施 | G583: 周永彬等译 | H583: 52.00 | I583: 37226 | J583: 7
F584: 网站及网页
A585: =ROW()-2 -> 2382 | B585: TP | C585: 4523 | D585: 1 | E585: 04523-2 | F585: Web 管理员手册 | G585: 李凤华 | H585: 32.00 | I585: 37073 | J585: 9
A586: =ROW()-2 -> 2383 | B586: TP | C586: 4233 | D586: 1 | E586: 04233-0 | F586: 精通 Linux 系统管理与应用开发技术 | G586: 超星空工作室 | H586: 49.00 | I586: 36982 | J586: 5
A587: =ROW()-2 -> 2384 | B587: P- | C587: 3124 | D587: 1 | E587: 7900631240 | F587: 红旗 Linux 软件开发技术 （配光盘） | G587: 中科红旗 | H587: 42.00 | I587: 36982 | J587: 9
A588: =ROW()-2 -> 2385 | B588: P- | C588: 3035 | D588: 1 | E588: 790063035X | F588: Linux 架站玩家（配光盘） | G588: 浮 云 | H588: 53.00 | I588: 36800 | J588: 6
A589: =ROW()-2 -> 2386 | B589: P- | C589: 3557 | D589: 1 | E589: 7900635572 | F589: 实用 JavaScript 网页特效编程百宝箱 （配光盘） | G589: 张宝亮 | H589: 88.00 | I589: 37073 | J589: 4
A590: =ROW()-2 -> 2387 | B590: TP | C590: 5514 | D590: 1 | E590: 05514-9 | F590: JavaScript 网页编程案例教程 | G590: 屈鹏飞 | H590: 30.00 | I590: 37408 | J590: 9
A591: =ROW()-2 -> 2388 | B591: TP | C591: 4329 | D591: 1 | E591: 04329-9 | F591: APACHE 系统管理指南 | G591: 王一川译 | H591: 36.00 | I591: 36982 | J591: 8
A592: =ROW()-2 -> 2389 | B592: TP | C592: 4352 | D592: 1 | E592: 04352-3 | F592: 网络社区建设――设计策略揭秘 | G592: 张署 等译 | H592: 26.00 | I592: 36982 | J592: 12
A593: =ROW()-2 -> 2390 | B593: P- | C593: 3578 | D593: 1 | E593: 7900635785 | F593: qmail 实用技术指南（配光盘） | G593: 赖斌 等 | H593: 46.00 | I593: 37073 | J593: 7
A594: =ROW()-2 -> 2391 | B594: TP | C594: 4589 | D594: 1 | E594: 04589-5 | F594: WAP 建站技术详解与实例 | G594: 汪翔 等 | H594: 31.00 | I594: 37073 | J594: 9
A595: =ROW()-2 -> 2392 | B595: TP | C595: 5513 | D595: 1 | E595: 05513-1 | F595: Web 服务架构与开放互操作技术 | G595: 柴晓路 | H595: 42.00 | I595: 37438 | J595: 7
A596: =ROW()-2 -> 2393 | B596: TP | C596: 4511 | D596: 1 | E596: 04511-9 | F596: CGI 技术全面接触 | G596: 刘伟 等 | H596: 39.00 | I596: 37104 | J596: 9
A597: =ROW()-2 -> 2394 | B597: P- | C597: 4345 | D597: 1 | E597: 7900643451 | F597: XML网页开发实例教程（配光盘） | G597: 李永详 | H597: 30.00 | I597: 37500 | J597: 10
A598: =ROW()-2 -> 2395 | B598: TP | C598: 4724 | D598: 1 | E598: 04724-3 | F598: 网页设计九合一培训教程 | G598: 陈新峰等 | H598: 35.00 | I598: 37257 | J598: 8
A599: =ROW()-2 -> 2396 | B599: P- | C599: 3779 | D599: 1 | E599: 7900637796 | F599: 网页设计与Web数据库发布技术（配光盘） | G599: 魏应彬 | H599: 27.00 | I599: 37469 | J599: 9
A600: =ROW()-2 -> 2397 | B600: P- | C600: 3564 | D600: 1 | E600: 7900635645 | F600: 个性主页平面方案 + Photoshop 手记 （配光盘） | G600: 老 鱼 | H600: 58 | I600: 37196 | J600: 10
A601: =ROW()-2 -> 2398 | B601: TP | C601: 3934 | D601: 1 | E601: 03934-8 | F601: 实用网站建设技术 | G601: 陈育松 | H601: 30 | I601: 36739 | J601: 9
A602: =ROW()-2 -> 2399 | B602: TP | C602: 3197 | D602: 1 | E602: 03197-5 | F602: HTML 语言与 Web 站点开发技术 | G602: 马洪兵等 | H602: 33 | I602: 1999 | J602: 6
A603: =ROW()-2 -> 2400 | B603: TP | C603: 4391 | D603: 1 | E603: 04391-4 | F603: 网页数据库实例应用宝典 | G603: 数位文化 | H603: 36.00 | I603: 37043 | J603: 8
A604: =ROW()-2 -> 2401 | B604: TP | C604: 4385 | D604: 1 | E604: 04385-X | F604: 网页数据库设计圣典 | G604: 数位文化 | H604: 32.9 | I604: 37043 | J604: 9
A605: =ROW()-2 -> 2402 | B605: TP | C605: 4681 | D605: 1 | E605: 04681-6 | F605: FrontPage 2002 中文版动态网页开发密笈 | G605: 张振峰等 | H605: 52 | I605: 37104 | J605: 6
A606: =ROW()-2 -> 2403 | B606: P- | C606: 3076 | D606: 1 | E606: 7900630767 | F606: FrontPage 2000 & ASP 网页设计技巧与网站 维护 | G606: 蒋方帅 | H606: 56.00 | I606: 36831 | J606: 5
A607: =ROW()-2 -> 2404 | B607: TP | C607: 4228 | D607: 1 | E607: 04228-4 | F607: 网站策划与建设手册――FrontPage 2000网站建 设篇 | G607: 刘凤英 | H607: 18.00 | I607: 36982 | J607: 13
A608: =ROW()-2 -> 2405 | B608: TP | C608: 4437 | D608: 1 | E608: 04437-6 | F608: 网站策划与建设手册――Fireworks 4.0 图形设 计篇 | G608: 刘光峰等 | H608: 37.00 | I608: 37012 | J608: 9
A609: =ROW()-2 -> 2406 | B609: TP | C609: 4350 | D609: 1 | E609: 04350-7 | F609: 网站策划与建设手册――Dreamwerver 4.0网站设 计篇 | G609: 刘光峰等 | H609: 24.00 | I609: 37012 | J609: 9
A610: =ROW()-2 -> 2407 | B610: TP | C610: 2670 | D610: 2 | E610: 02670-X | F610: World Wide Web循序渐进 | G610: 毛伟 等 | H610: 19.00 | I610: 1998 | J610: 13
A611: =ROW()-2 -> 2408 | B611: P- | C611: 2549 | D611: 1 | E611: 7900625496 | F611: 网页设计总动员（配光盘） | G611: 上奇科技 | H611: 78.00 | I611: 36739 | J611: 8
A612: 2271 | B612: TP | C612: 4351 | D612: 1 | E612: 04351-5 | F612: 网页设计三剑客 | G612: 培训中心 | H612: 26.00 | I612: 37469 | J612: 10
A613: 2272 | B613: TP | C613: 4223 | D613: 1 | E613: 04223-3 | F613: 动态网页设计培训教程 | G613: 刘育楠等 | H613: 28.00 | I613: 36982 | J613: 10
A614: =ROW()-2 -> 2411 | B614: TP | C614: 0774 | D614: 1 | E614: 00774-8 | F614: 网页设计培训教程 | G614: 周宇坤 | H614: 29.80 | I614: 36739 | J614: 8
A615: =ROW()-2 -> 2412 | B615: TP | C615: 4067 | D615: 1 | E615: 04067-2 | F615: 网页标题制作技巧与实例 | G615: 吕少华 | H615: 22.00 | I615: 36800 | J615: 10
A616: =ROW()-2 -> 2413 | B616: TP | C616: 4234 | D616: 1 | E616: 04234-9 | F616: 网页织梦完全手册 | G616: 东箭工作室 | H616: 26.00 | I616: 37196 | J616: 11
A617: =ROW()-2 -> 2414 | B617: TP | C617: 1268 | D617: 1 | E617: 01268-7 | F617: 网页图像特效完全手册（上）―― 基础篇 | G617: 东箭工作室 | H617: 32.00 | I617: 36982 | J617: 8
A618: =ROW()-2 -> 2415 | B618: P- | C618: 3091 | D618: 1 | E618: 7900630910 | F618: 网页图象特效完全手册（下）――实例篇 （配光盘） | G618: 东箭工作室 | H618: 54.00 | I618: 36923 | J618: 10
A619: =ROW()-2 -> 2416 | B619: P- | C619: 3111 | D619: 1 | E619: 7900631119 | F619: 网页动画特效完全手册（配光盘） | G619: 东箭工作室 | H619: 48.00 | I619: 36982 | J619: 6
A620: =ROW()-2 -> 2417 | B620: P- | C620: 3153 | D620: 1 | E620: 7900631534 | F620: 精品网页创意制作集粹 （配光盘） | G620: 龚正伟等 | H620: 38.00 | I620: 36982 | J620: 8
A621: =ROW()-2 -> 2418 | B621: TP | C621: 3111 | D621: 4 | E621: 03111-8 | F621: 精品网页制作（配光盘） | G621: 鲁倩 等 | H621: 42 | I621: 36617 | J621: 10
A622: =ROW()-2 -> 2419 | B622: P- | C622: 2518 | D622: 1 | E622: 7900625186 | F622: 精品网页制作 ―― Flash 4.0（配光盘） | G622: 汤 文 | H622: 35 | I622: 36831 | J622: 10
A623: =ROW()-2 -> 2420 | B623: P- | C623: 2232 | D623: 2 | E623: 7900622322 | F623: 精品动态网页制作（配光盘） | G623: 杨内 等 | H623: 39 | I623: 36739 | J623: 10
A624: =ROW()-2 -> 2421 | B624: TP | C624: 4193 | D624: 1 | E624: 04193-8 | F624: 动态网页程序设计 | G624: 施红芹等 | H624: 27 | I624: 37043 | J624: 11
A625: =ROW()-2 -> 2422 | B625: P- | C625: 3546 | D625: 1 | E625: 7900635467 | F625: 动态网页设计――Photoshop 与 ImageReady 整合应用（配光盘） | G625: 慧通资讯 | H625: 34 | I625: 37135 | J625: 8
A626: =ROW()-2 -> 2423 | B626: TP | C626: 4490 | D626: 1 | E626: 04490-2 | F626: 动态网页制作精粹 | G626: 张红军等 | H626: 41 | I626: 37043 | J626: 7
A627: =ROW()-2 -> 2424 | B627: P- | C627: 2562 | D627: 1 | E627: 7900625623 | F627: 交互式动画网页与网站设计（配光盘） | G627: 杨内 等 | H627: 36 | I627: 36800 | J627: 11
A628: =ROW()-2 -> 2425 | B628: TP | C628: 3621 | D628: 3 | E628: 03621-7 | F628: 网页数据库设计与发布 | G628: 第三波 | H628: 28 | I628: 36892 | J628: 10
A629: =ROW()-2 -> 2426 | B629: P- | C629: 3559 | D629: 1 | E629: 7900635599 | F629: Java 网页特效180招（配光盘） | G629: 数位文化 | H629: 48 | I629: 37104 | J629: 5
A630: =ROW()-2 -> 2427 | B630: TP | C630: 3760 | D630: 1 | E630: 03760-4 | F630: 动态 Web 网页技术大全 | G630: 於志渊 | H630: 46 | I630: 36617 | J630: 6
A631: =ROW()-2 -> 2428 | B631: TP | C631: 4358 | D631: 1 | E631: 04358-2 | F631: CSS 动态网页样式表应用开发手册 | G631: 王天利 | H631: 21 | I631: 36982 | J631: 15
A632: =ROW()-2 -> 2429 | B632: TP | C632: 3982 | D632: 1 | E632: 03982-8 | F632: 动态网页设计 Flash 4 攻略手册 | H632: 22 | I632: 36708 | J632: 12
A633: =ROW()-2 -> 2430 | B633: TP | C633: 1264 | D633: 2 | E633: 01264-4 | F633: 网页制作常用工具指南 | G633: 林贻珀 | H633: 26 | I633: 36647 | J633: 10
A634: =ROW()-2 -> 2431 | B634: TP | C634: 4229 | D634: 1 | E634: 04229-2 | F634: 网页制作梦幻组合 | G634: 田守瑞等 | H634: 33.00 | I634: 37257 | J634: 9
A635: =ROW()-2 -> 2432 | B635: TP | C635: 3845 | D635: 1 | E635: 03845-7 | F635: CSS & DHTML for Web 专业设计 | G635: 陈 虹 译 | H635: 20.00 | I635: 36647 | J635: 17
A636: =ROW()-2 -> 2433 | B636: TP | C636: 4131 | D636: 1 | E636: 04131-8 | F636: CSS & DHTML 网页制作特效与实例 | G636: 杨正华等 | H636: 32.00 | I636: 36831 | J636: 7
A637: =ROW()-2 -> 2434 | B637: TP | C637: 4365 | D637: 1 | E637: 04365-5 | F637: DHTML 使用与技巧――用DHTML开发动态网站 | G637: 蒋骏 等 | H637: 32.00 | I637: 36982 | J637: 8
A638: =ROW()-2 -> 2435 | B638: P- | C638: 3545 | D638: 1 | E638: 7900635459 | F638: XHTML 高级应用――网页动画与特效 （配光盘） | G638: 何东隆等 | H638: 49 | I638: 37135 | J638: 5
A639: =ROW()-2 -> 2436 | B639: TP | C639: 3914 | D639: 1 | E639: 03914-3 | F639: 大师指点 Web 动画创意 | G639: 何健辉等译 | H639: 38 | I639: 36678 | J639: 7
A640: =ROW()-2 -> 2437 | B640: TP | C640: 1005 | D640: 1 | E640: 01005-6 | F640: Web 设计要素与名作欣赏（第2版） | G640: 陈 武 译 | H640: 43 | I640: 36647 | J640: 7
A641: =ROW()-2 -> 2438 | B641: P- | C641: 2268 | D641: 1 | E641: 7900622683 | F641: Dreamweaver 2.0 梦幻网页（配光盘） | G641: 郑志强等 | H641: 89 | I641: 36586 | J641: 9
A642: =ROW()-2 -> 2439 | B642: P- | C642: 2572 | D642: 1 | E642: 7900625720 | F642: Dreamweaver 3 筑梦王国（配光盘） | G642: 吕志宏 | H642: 78 | I642: 36708 | J642: 8
A643: =ROW()-2 -> 2440 | B643: P- | C643: 2579 | D643: 1 | E643: 7900625798 | F643: Dreamweaver 3 网页设计宝典（配光盘） | G643: 贰工数位设计 | H643: 39 | I643: 36800 | J643: 9
A644: =ROW()-2 -> 2441 | B644: P- | C644: 3552 | D644: 1 | E644: 7900635521 | F644: Dreamweaver 4 筑梦天堂（配光盘） | G644: 吕志宏 | H644: 34 | I644: 37135 | J644: 9
A645: =ROW()-2 -> 2442 | B645: TP | C645: 4288 | D645: 1 | E645: 04288-8 | F645: Dreamweaver 4 网页制作教程 | G645: 白振刚等 | H645: 32 | I645: 36982 | J645: 9
A646: =ROW()-2 -> 2443 | B646: TP | C646: 4408 | D646: 1 | E646: 04408-2 | F646: Dreamweaver 4 网页设计梦幻作坊 | G646: 苏国彬 | H646: 29 | I646: 37073 | J646: 9
A647: =ROW()-2 -> 2444 | B647: TP | C647: 5025 | D647: 1 | E647: 05025-2 | F647: Dreamweaver 4.0 动态网页制作精粹 | G647: 高云峰等 | H647: 39 | I647: 37226 | J647: 8
A648: =ROW()-2 -> 2445 | B648: TP | C648: 4604 | D648: 1 | E648: 04604-2 | F648: 全面掌握 Dreamweaver 4.0 可视化网页设计 | G648: 甘登岱等 | H648: 36 | I648: 37469 | J648: 7
A649: =ROW()-2 -> 2446 | B649: TP | C649: 4513 | D649: 1 | E649: 04513-5 | F649: Dreamweaver 4 Fireworks 4 Flash 5 网页设计梦幻组合 | G649: 洪锦魁 | H649: 55.00 | I649: 37349 | J649: 5
A650: =ROW()-2 -> 2447 | B650: TP | C650: 4729 | D650: 1 | E650: 04729-4 | F650: Dreamweaver 4 + Flash 5 + Fireworks 4 梦幻网站设计 | G650: 覃艳馨等 | H650: 43.8 | I650: 37165 | J650: 6
A651: =ROW()-2 -> 2448 | B651: TP | C651: 4446 | D651: 1 | E651: 04446-5 | F651: 实例精通丛书――Dreamweaver 4 精彩网页制作 | G651: 田守瑞等 | H651: 27 | I651: 37500 | J651: 8
A652: =ROW()-2 -> 2449 | B652: TP | C652: 4584 | D652: 1 | E652: 04584-4 | F652: Dreamweaver UltraDev 4 交互网站轻松做 | G652: 张长军等 | H652: 34 | I652: 37135 | J652: 7
A653: =ROW()-2 -> 2450 | B653: TP | C653: 4868 | D653: 1 | E653: 04868-1 | F653: Dreamweaver UltraDev 建站手册 | G653: 战祥森 | H653: 32 | I653: 37196 | J653: 8
A654: =ROW()-2 -> 2451 | B654: TP | C654: 4280 | D654: 1 | E654: 04280-2 | F654: Dreamweaver UltraDev 4 培训教程 | H654: 29 | I654: 36951 | J654: 8
A655: =ROW()-2 -> 2452 | B655: TP | C655: 4432 | D655: 1 | E655: 04432-5 | F655: Dreamweaver UltraDev 4 动态网页开发指南 | G655: 李万红等 | H655: 39 | I655: 37043 | J655: 7
A656: =ROW()-2 -> 2453 | B656: P- | C656: 3569 | D656: 1 | E656: 7900635696 | F656: Dreamweaver UltraDev 4 动态数据库网站快速上手（配光盘） | G656: 小正正 | H656: 36 | I656: 37104 | J656: 13
A657: =ROW()-2 -> 2454 | B657: P- | C657: 3591 | D657: 1 | E657: 03591-1 | F657: Dreamweaver UltraDev 4 技术大全（配光盘） | G657: 郝启堂等译 | H657: 75 | I657: 37104 | J657: 5
A658: =ROW()-2 -> 2455 | B658: TP | C658: 3981 | D658: 1 | E658: 03981-X | F658: 梦幻网页设计Dreamweaver 3.0 培训教程 | G658: 高志兴 | H658: 28 | I658: 36708 | J658: 8
A659: =ROW()-2 -> 2456 | B659: TP | C659: 1225 | D659: 1 | E659: 01225-3 | F659: 基于 Dreamweaver 3 的网站规划与建设 | G659: 沈江天等 | H659: 24 | I659: 36861 | J659: 10
A660: =ROW()-2 -> 2457 | B660: TP | C660: 5126 | D660: 1 | E660: 05126-7 | F660: Dreamweaver 4 的Web开发指南 | G660: 刘小东等 | H660: 36.00 | I660: 37316 | J660: 8
A661: =ROW()-2 -> 2458 | B661: TP | C661: 4342 | D661: 1 | E661: 04342-6 | F661: Photoshop 6.0 Dreamweaver 4.0 网页及动画制作 | G661: 蒋俊峰等 | H661: 30 | I661: 37043 | J661: 10
A662: =ROW()-2 -> 2459 | B662: TP | C662: 4846 | D662: 1 | E662: 04846-0 | F662: Photoshop 6 网页活点子――Image Ready 3.0 | G662: 叶翊隆 | H662: 30 | I662: 37165 | J662: 9
A663: =ROW()-2 -> 2460 | B663: P- | C663: 3141 | D663: 1 | E663: 03141-X | F663: Fireworks 4.0 完全成长手册 | G663: 马存伟等 | H663: 37 | I663: 37012 | J663: 9
A664: =ROW()-2 -> 2461 | B664: TP | C664: 4481 | D664: 1 | E664: 04481-3 | F664: Fireworks 4.0 网页制作彻底解析 | G664: 赵健斌等 | H664: 22 | I664: 37012 | J664: 12
A665: =ROW()-2 -> 2462 | B665: TP | C665: 4485 | D665: 1 | E665: 04485-6 | F665: Fireworks 4 精彩网页图象制作 | G665: 李永清等 | H665: 26 | I665: 37104 | J665: 8
A666: =ROW()-2 -> 2463 | B666: P- | C666: 2567 | D666: 1 | E666: 7900625674 | F666: Fireworks 3 网页图形设计宝典（配光盘） | G666: 上奇科技 | H666: 39 | I666: 36708 | J666: 8
A667: =ROW()-2 -> 2464 | B667: TP | C667: 5473 | D667: 1 | E667: 05473-1 | F667: Flash 4 游戏设计宝典 | G667: 康博 译 | H667: 59.00 | I667: 37408 | J667: 5
A668: =ROW()-2 -> 2465 | B668: P- | C668: 2500 | D668: 1 | E668: 7900625003 | F668: Flash 4 网页动画（配光盘） | G668: 赵英杰 | H668: 48 | I668: 36647 | J668: 8
A669: =ROW()-2 -> 2466 | B669: P- | C669: 2297 | D669: 1 | E669: 7900622977 | F669: Flash 4 网页动画动画设计宝典（配光盘） | G669: 廖御琪 | H669: 98 | I669: 36739 | J669: 7
A670: =ROW()-2 -> 2467 | B670: P- | C670: 3119 | D670: 1 | E670: 7900631194 | F670: Flash 5 动态网页e点通 （配光盘） | G670: 朱志山 | H670: 34.00 | I670: 36951 | J670: 8
A671: =ROW()-2 -> 2468 | B671: P- | C671: 3139 | D671: 1 | E671: 7900631399 | F671: Flash 5 动态网页设计精粹（配光盘） | G671: 陈怡杰 | H671: 39 | I671: 36982 | J671: 9
A672: =ROW()-2 -> 2469 | B672: P- | C672: 3160 | D672: 1 | E672: 7900631607 | F672: Flash 5.0 综合精彩实例（配光盘） | G672: 潘正海等 | H672: 35 | I672: 37073 | J672: 9
A673: =ROW()-2 -> 2470 | B673: P- | C673: 3553 | D673: 1 | E673: 790063553X | F673: Flash 5 魔幻密笈（配光盘） | G673: 廖御琪 | H673: 36 | I673: 37135 | J673: 9
A674: =ROW()-2 -> 2471 | B674: TP | C674: 4255 | D674: 1 | E674: 04255-1 | F674: Flash 5 网页设计自学通 | G674: 杨洪涛 | H674: 20 | I674: 36951 | J674: 11
A675: =ROW()-2 -> 2472 | B675: TP | C675: 4897 | D675: 1 | E675: 04897-5 | F675: Flash 实用编程指南 | G675: 张璇 等 | H675: 25 | I675: 37135 | J675: 10
A676: =ROW()-2 -> 2473 | B676: TP | C676: 4558 | D676: 1 | E676: 04558-5 | F676: 深入剖析 Flash 5 | G676: 范承松等 | H676: 39 | I676: 37104 | J676: 7
A677: =ROW()-2 -> 2474 | B677: P- | C677: 3508 | D677: 1 | E677: 7900635084 | F677: Flash 5 网络游戏大观（配光盘） | G677: 王大任等 | H677: 38 | I677: 37135 | J677: 7
A678: =ROW()-2 -> 2475 | B678: P- | C678: 3577 | D678: 1 | E678: 03577-6 | F678: 进阶 Flash 5 网络游戏（配光盘） | G678: 位元文化 | H678: 42 | I678: 37196 | J678: 6
A679: =ROW()-2 -> 2476 | B679: TP | C679: 5376 | D679: 1 | E679: 05376-6 | F679: 宽带风暴――视频点播与网络游戏 | G679: 卢军等 | H679: 30.00 | I679: 37377 | J679: 9
A680: =ROW()-2 -> 2477 | B680: TP | C680: 5444 | D680: 1 | E680: 05444-4 | F680: 说不尽的flash――flash动画设计实例 | G680: 王且力 | H680: 49.00 | I680: 37500 | J680: 11
A681: =ROW()-2 -> 2478 | B681: TP | C681: 5844 | D681: 1 | E681: 05844-X | F681: Flash MX 动画制作实例教程 | G681: 李伟 | H681: 28.00 | I681: 37500 | J681: 10
A682: =ROW()-2 -> 2479 | B682: P- | C682: 4338 | D682: 1 | E682: 7900643389 | F682: 闪客必备――Flash MX精彩实例详解（配光盘） | G682: 王太吉 | H682: 39.00 | I682: 37530 | J682: 7
A683: =ROW()-2 -> 2480 | B683: TP | C683: 5878 | D683: 1 | E683: 05878-4 | F683: 闪客必备――Flash MX动画制作基础教程 | G683: 甘登岱等 | H683: 26.00 | I683: 37530 | J683: 11
A684: =ROW()-2 -> 2481 | B684: P- | C684: 3199 | D684: 1 | E684: 7900631992 | F684: 动画奇兵 Flash 5 ――中高级实例详解 （配光盘） | G684: 祁新 等 | H684: 29 | I684: 37073 | J684: 9
A685: =ROW()-2 -> 2482 | B685: TP | C685: 4784 | D685: 1 | E685: 04784-7 | F685: Flash 5 外挂程序精粹 | G685: 数位猫 | H685: 30 | I685: 37226 | J685: 10
A686: =ROW()-2 -> 2483 | B686: TP | C686: 5618 | D686: 1 | E686: 05618-1 | F686: 手把手教你学用Flash MX | G686: 韩伟峰等 | H686: 28.00 | I686: 37438 | J686: 9
A687: =ROW()-2 -> 2484 | B687: TP | C687: 4836 | D687: 1 | E687: 04836-3 | F687: 手把手教你学用 Premiere 6.0 | G687: 龚正伟 | H687: 23.00 | I687: 37165 | J687: 12
A688: =ROW()-2 -> 2485 | B688: TP | C688: 4439 | D688: 1 | E688: 04439-2 | F688: Macromedia 网页风暴培训教程 | G688: 田守瑞 | H688: 36 | I688: 37500 | J688: 7
A689: =ROW()-2 -> 2486 | B689: TP | C689: 4428 | D689: 1 | E689: 04428-7 | F689: Adobe GoLive 5.0 网页设计入门 | G689: 杨涛 等 | H689: 29 | I689: 37073 | J689: 9
A690: =ROW()-2 -> 2487 | B690: P- | C690: 3195 | D690: 1 | E690: 790063195X | F690: 完全 Adobe GoLive 5（配光盘） | G690: 郑志强 | H690: 36 | I690: 37104 | J690: 9
A691: =ROW()-2 -> 2488 | B691: TP | C691: 1078 | D691: 1 | E691: 01078-1 | F691: Active Server Pages (ASP) 网页制作指南 | G691: 周中雨等 | H691: 24 | I691: 36739 | J691: 10
A692: =ROW()-2 -> 2489 | B692: P- | C692: 2237 | D692: 1 | E692: 7900622373 | F692: Actice Sever Pages 网应用大全（配光盘） | G692: 廖信彦 | H692: 65.00 | I692: 36800 | J692: 6
A693: =ROW()-2 -> 2490 | B693: TP | C693: 1217 | D693: 1 | E693: 01217-2 | F693: ASP 动态网站开发教程 | G693: 廖彬山等 | H693: 29.00 | I693: 37469 | J693: 9
A694: =ROW()-2 -> 2491 | B694: TP | C694: 4794 | D694: 1 | E694: 04794-4 | F694: ASP 网络编程技术 | G694: 肖金秀 | H694: 44 | I694: 37196 | J694: 6
A695: =ROW()-2 -> 2492 | B695: TP | C695: 4889 | D695: 1 | E695: 04889-4 | F695: 轻松学习――ASP 网络实用编程 | G695: 冯能山等 | H695: 25.00 | I695: 37257 | J695: 10
A696: =ROW()-2 -> 2493 | B696: TP | C696: 4364 | D696: 1 | E696: 04364-7 | F696: ASP编程技术与综合实例演练 | G696: 蒙 新 | H696: 26.00 | I696: 37043 | J696: 9
A697: =ROW()-2 -> 2494 | B697: TP | C697: 4869 | D697: 1 | E697: 04869-X | F697: ASP.NET 动态网页设计高手 | G697: 东 名 | H697: 38 | I697: 37165 | J697: 6
A698: =ROW()-2 -> 2495 | B698: TP | C698: 5003 | D698: 1 | E698: 05003-1 | F698: 亲密接触 ASP.Net （配软盘） | G698: 杜 亮 | H698: 39 | I698: 2001.12 | J698: 7
A699: =ROW()-2 -> 2496 | B699: TP | C699: 5780 | D699: 1 | E699: 05780-X | F699: ASP.NET 开发人员指南 | G699: 康博译 | H699: 65.00 | I699: 37500 | J699: 25
A700: =ROW()-2 -> 2497 | B700: TP | C700: 5086 | D700: 1 | E700: 05086-4 | F700: JSP快速高效开发利器－Dreamweaver UltraDev | G700: 许增伟等 | H700: 42.00 | I700: 37257 | J700: 6
A701: =ROW()-2 -> 2498 | B701: TP | C701: 4951 | D701: 1 | E701: 04951-3 | F701: JSP 技术揭密 | G701: Decoder | H701: 38 | I701: 37196 | J701: 8
A702: =ROW()-2 -> 2499 | B702: TP | C702: 4840 | D702: 1 | E702: 04840-1 | F702: JSP 实用编程实例集锦 | G702: 马文刚等 | H702: 27 | I702: 37196 | J702: 8
A703: =ROW()-2 -> 2500 | B703: TP | C703: 4430 | D703: 1 | E703: 04430-9 | F703: JSP 程序设计精彩实例 | G703: 姜晓明等 | H703: 28 | I703: 37073 | J703: 9
A704: =ROW()-2 -> 2501 | B704: P- | C704: 3562 | D704: 1 | E704: 7900635629 | F704: JSP 应用程序开发指南 | G704: 章明 等译 | H704: 34 | I704: 37073 | J704: 10
A705: =ROW()-2 -> 2502 | B705: TP | C705: 4336 | D705: 1 | E705: 04336-1 | F705: 深入 JSP 网络编程 | G705: 雨阳隆春等 | H705: 52 | I705: 37073 | J705: 6
A706: =ROW()-2 -> 2503 | B706: P- | C706: 3511 | D706: 1 | E706: 7900635111 | F706: JSP/Servlet ――基于 Java 的最新网站建设工具 （配光盘） | G706: 王迪华等 | H706: 42 | I706: 37073 | J706: 8
A707: =ROW()-2 -> 2504 | B707: P- | C707: 3568 | D707: 1 | E707: 7900635688 | F707: PHP 4 交互式网页数据实战手册 | G707: 数位文化 | H707: 85 | I707: 37165 | J707: 4
A708: =ROW()-2 -> 2505 | B708: TP | C708: 5001 | D708: 1 | E708: 05001-5 | F708: PHP 4.0 入门与提高 | G708: 吕京涛等 | H708: 29 | I708: 37469 | J708: 9
A709: =ROW()-2 -> 2506 | B709: TP | C709: 4497 | D709: 1 | E709: 04497-X | F709: PHP & MySQL 网站建设宝典 | G709: 黄经纬 | H709: 21 | I709: 37104 | J709: 10
A710: =ROW()-2 -> 2507 | B710: P- | C710: 3548 | D710: 1 | E710: 7900635483 | F710: PHP Web 数据库开发与实例（配光盘） | G710: 木林森 | H710: 34 | I710: 37073 | J710: 10
A711: =ROW()-2 -> 2508 | B711: TP | C711: 5017 | D711: 1 | E711: 05017-1 | F711: PHP4 应用开发指南 | G711: 杨洪涛等译 | H711: 62 | I711: 37196 | J711: 4
A712: =ROW()-2 -> 2509 | B712: P- | C712: 3566 | D712: 1 | E712: 7900635661 | F712: 最新PHP 及 MySQL 进阶教程（配光盘） | G712: 荣钦科技 | H712: 38 | I712: 37073 | J712: 10
A713: =ROW()-2 -> 2510 | B713: TP- | C713: 5344 | D713: 1 | E713: 05344-8 | F713: PHP高级开发技术与应用 | G713: 曹轶群等 | H713: 32.00 | I713: 37408 | J713: 7
A714: =ROW()-2 -> 2511 | B714: TP | C714: 4559 | D714: 1 | E714: 04559-3 | F714: 企业网站建设解决方案（上篇）――基于 Windows 的网站建设 | G714: 董小满等 | H714: 39 | I714: 37135 | J714: 7
A715: =ROW()-2 -> 2512 | B715: TP | C715: 4909 | D715: 1 | E715: 04909-2 | F715: 企业网站建设解决方案（中篇）――跨平台的 PHP+MySQL | G715: 罗明 等 | H715: 32 | I715: 37196 | J715: 8
A716: =ROW()-2 -> 2513 | B716: TP | C716: 5297 | D716: 1 | E716: 05297-1 | F716: 企业网站建设解决方案（下篇）― 基于Linux的Apache+JSP+Oracle | G716: 张金涛 | H716: 29.00 | I716: 37384 | J716: 9
A717: =ROW()-2 -> 2514 | B717: P- | C717: 3765 | D717: 1 | E717: 7900637656 | F717: XML 编程技术大全 | G717: 康博 译 | H717: 95.00 | I717: 2002.1 | J717: 4
A718: =ROW()-2 -> 2515 | B718: TP | C718: 5812 | D718: 1 | E718: 05812-1 | F718: XML 示例程序导学（第二版） | G718: Benoit Marchal | H718: 42.00 | I718: 37469 | J718: 7
A719: =ROW()-2 -> 2516 | B719: TP | C719: 4158 | D719: 1 | E719: 04158-X | F719: XML 实用进阶教程 | G719: XML中国论坛 | H719: 34 | I719: 36982 | J719: 8
A720: =ROW()-2 -> 2517 | B720: TP | C720: 5649 | D720: 1 | E720: 5649 | F720: 基于 XML的ASP.NET开发 | G720: 王宝良译 | H720: 42.00 | I720: 37438 | J720: 7
A721: =ROW()-2 -> 2518 | B721: TP | C721: 4501 | D721: 1 | E721: 04501-1 | F721: XML 新网页语言开发手册 | G721: 黄中杰等 | H721: 35 | I721: 37043 | J721: 8
A722: =ROW()-2 -> 2519 | B722: P- | C722: 3528 | D722: 1 | E722: 7900635289 | F722: XML 揭秘――入门・应用・精通（配光盘） | G722: 陆新年等译 | H722: 69.5 | I722: 37043 | J722: 4
A723: =ROW()-2 -> 2520 | B723: P- | C723: 3533 | D723: 1 | E723: 7900635335 | F723: XML & ASP 网页程序设计（配光盘） | G723: 陈勤意等 | H723: 42 | I723: 37165 | J723: 9
A724: =ROW()-2 -> 2521 | B724: TP | C724: 5183 | D724: 1 | E724: 05183-6 | F724: XML精要：语法详解与编辑指南（第二版） | G724: 赵洪利等译 | H724: 68.00 | I724: 37377 | J724: 4
A725: =ROW()-2 -> 2522 | B725: P- | C725: 3556 | D725: 1 | E725: 7900635564 | F725: HTML 与 ASP 编程实务（配光盘） | G725: 林信成等 | H725: 38 | I725: 37196 | J725: 9
A726: =ROW()-2 -> 2523 | B726: P- | C726: 3073 | D726: 1 | E726: 7900630732 | F726: HTML Web 页面制作教程（配光盘） | G726: 宛延]等 | H726: 108.00 | I726: 36892 | J726: 3
A727: =ROW()-2 -> 2524 | B727: TP- | C727: 5290 | D727: 1 | E727: 05290-5 | F727: HTML 参考大全（第三版） | G727: 杨正华等译 | H727: 92.00 | I727: 37316 | J727: 3
A728: =ROW()-2 -> 2525 | B728: P- | C728: 3560 | D728: 1 | E728: 7900635602 | F728: 精通 XHTML（配光盘） | G728: 萧世文 | H728: 53 | I728: 37104 | J728: 6
A729: =ROW()-2 -> 2526 | B729: TP | C729: 4406 | D729: 1 | E729: 04406-6 | F729: XML 与 WML 整合应用 | G729: 隆华软件 | H729: 19.90 | I729: 37012 | J729: 13
A730: =ROW()-2 -> 2527 | B730: P- | C730: 3524 | D730: 1 | E730: 7900635246 | F730: VRML 虚拟现实网页语言 （配光盘） | G730: 严子翔 | H730: 30 | I730: 37104 | J730: 10
A731: =ROW()-2 -> 2528 | B731: P- | C731: 3147 | D731: 1 | E731: 790063147X | F731: 纯手工打造――黄金网页（配光盘） | G731: 数位文化 | H731: 56.00 | I731: 37012 | J731: 6
A732: =ROW()-2 -> 2529 | B732: P- | C732: 3148 | D732: 1 | E732: 7900631488 | F732: 精通 VBScript （配光盘） | G732: 刘中宏等 | H732: 58 | I732: 37104 | J732: 5
A733: =ROW()-2 -> 2530 | B733: P- | C733: 3152 | D733: 1 | E733: 7900631526 | F733: JavaScript/VBScript 网页编程实例解析 （配光盘） | G733: 武晓军等 | H733: 30.00 | I733: 36982 | J733: 11
A734: =ROW()-2 -> 2531 | B734: TP | C734: 4361 | D734: 1 | E734: 04361-2 | F734: HotDog 6.x 网页设计宝典 | G734: 马占魁等 | H734: 26.00 | I734: 36982 | J734: 9
A735: =ROW()-2 -> 2532 | B735: TP | C735: 4241 | D735: 1 | E735: 04241-1 | F735: 网页编程入门与应用实例 | H735: 29.00 | I735: 36923 | J735: 8
A736: =ROW()-2 -> 2533 | B736: P- | C736: 3072 | D736: 1 | E736: 7900630724 | F736: 网页设计创意与精品赏析 | H736: 50.00 | I736: 36892 | J736: 7
A737: =ROW()-2 -> 2534 | B737: TP | C737: 4998 | D737: 1 | E737: 04998-X | F737: Internet Information Server5.0/6.0配置与使用详解 | G737: 刘晓辉 | H737: 34.00 | I737: 37316 | J737: 8
A738: =ROW()-2 -> 2535 | B738: TP | C738: 5232 | D738: 1 | E738: 05232-8 | F738: eWAP无线世界――WML玩家通 | G738: 千展发展中心 | H738: 28.00 | I738: 37347 | J738: 10
A739: =ROW()-2 -> 2536 | B739: TP | C739: 5181 | D739: 1 | E739: 05181-X | F739: 用ASP.NET开发动态网站 | G739: 张敏等 | H739: 22.50 | I739: 37316 | J739: 12
A740: =ROW()-2 -> 2537 | B740: TP | C740: 5152 | D740: 1 | E740: 05152-6 | F740: ASP.NET与网站开发编程实战 | G740: 陈湘 | H740: 41.00 | I740: 37288 | J740: 7
A741: =ROW()-2 -> 2538 | B741: TP | C741: 5148 | D741: 1 | E741: 05148-8 | F741: PHP4网页编程实例解析 | G741: 李辛铭 | H741: 26.00 | I741: 37316 | J741: 10
A742: =ROW()-2 -> 2539 | B742: TP | C742: 5463 | D742: 1 | E742: 05463-0 | F742: Flash XML实用开发技术 | G742: Lan Tindale等 | H742: 38.00 | I742: 37412 | J742: 8
A743: =ROW()-2 -> 2540 | B743: TP | C743: 5459 | D743: 1 | E743: 05459-2 | F743: Windows/UNIX/Linux综合组网技术 | G743: 黄永峰等 | H743: 52.00 | I743: 37438 | J743: 5
A744: =ROW()-2 -> 2541 | B744: TP | C744: 5690 | D744: 1 | E744: 05690-0 | F744: C#.NET程序设计教程 | G744: 郭胜等 | H744: 28.00 | I744: 37500 | J744: 9
A745: =ROW()-2 -> 2542 | B745: TP | C745: 5805 | D745: 1 | E745: 05805-9 | F745: 电子商务网站开发指南 | G745: 萨尔玛等 | H745: 59.00 | I745: 37500 | J745: 6
A746: =ROW()-2 -> 2543 | B746: P- | C746: 4360 | D746: 1 | E746: 7900643605 | F746: Flash MX培训教程（配光盘） | G746: 赵东升等 | H746: 35.00 | I746: 37530 | J746: 9
A747: =ROW()-2 -> 2544 | B747: TP | C747: 5890 | D747: 1 | E747: 05890-3 | F747: 构建Web服务和.NET应用程序 | G747: Lonnie Wal 等 | H747: 54.00 | I747: 37530 | J747: 7

A1: 宛延

A1: 宛延