A1: 序号 | C1: 代 号 | E1: ISBN 7-302- | F1: 名 称 | G1: 著译编者 | H1: 定价(元) | I1: 印年 | J1: 册/包 | K1: 订数
F2: 一、工 具 书
A3: =ROW()-2 -> 1 | B3: TP | C3: 2970 | D3: 2 | E3: 02970-9 | F3: 计算机科学技术百科全书 | G3: 张效祥等 | H3: 180.00 | I3: 36069 | J3: 2
A4: =ROW()-2 -> 2 | B4: TP | C4: 4789 | D4: 1 | E4: 04789-8 | F4: 计算机科学技术百科全书（选编本） | G4: 张效祥等 | H4: 30.00 | I4: 37257 | J4: 7
A5: =ROW()-2 -> 3 | B5: Z- | C5: 2382 | D5: 2 | E5: 02382-4 | F5: 朗文―清华英汉双解科技大辞典 | G5: 编委会 | H5: 148.00 | I5: 36069 | J5: 1
A6: =ROW()-2 -> 4 | B6: TP | C6: 1465 | D6: 7 | E6: 01465-5 | F6: 英汉双解计算机辞典 (精) | G6: 编委会 | H6: 49.00 | I6: 37257 | J6: 5
A7: =ROW()-2 -> 5 | B7: TP | C7: 2399 | D7: 6 | E7: 02399-9 | F7: 英汉计算机词汇(精) (第2版) | G7: 中国计算机学会编 | H7: 48.00 | I7: 36465 | J7: 5
A8: =ROW()-2 -> 6 | B8: TP | C8: 3516 | D8: 2 | E8: 03516-4 | F8: 最新英汉计算机词汇 (第2版) | G8: 章鸿猷 | H8: 28.00 | I8: 37316 | J8: 8
A9: =ROW()-2 -> 7 | B9: TP | C9: 3347 | D9: 2 | E9: 03347-1 | F9: 新英汉计算机词典 (第2版) | G9: 编委会 | H9: 39.00 | I9: 36495 | J9: 6
A10: =ROW()-2 -> 8 | B10: TP | C10: 4560 | D10: 1 | E10: 04560-7 | F10: 简明英汉信息技术词汇 | G10: 章鸿猷 | H10: 19.00 | I10: 37257 | J10: 16
A11: =ROW()-2 -> 9 | B11: H- | C11: 2876 | D11: 1 | E11: 02876-1 | F11: 中学生实用英语动词搭配词典（精） | G11: 席玉虎 | H11: 50 | I11: 37530 | J11: 7
A12: =ROW()-2 -> 10 | B12: TP | C12: 1939 | D12: 3 | E12: 01939-8 | F12: 微机操作与应用常见英文信息解释 | G12: 王路敬 | H12: 21.00 | I12: 1998 | J12: 12
A13: =ROW()-2 -> 11 | B13: TP | C13: 2929 | D13: 1 | E13: 02929-6 | F13: 英文计算机术语译名研究 | G13: 章鸿猷 | H13: 9.80 | I13: 1998 | J13: 20
A14: =ROW()-2 -> 12 | B14: F- | C14: 0704 | D14: 3 | E14: 00704-7 | F14: 英汉汉英双解会计辞典 | G14: 韩 颖 | H14: 29.80 | I14: 36069 | J14: 6
A15: =ROW()-2 -> 13 | B15: H- | C15: 3014 | D15: 1 | E15: 03014-6 | F15: 国际商务英语用法词典 | G15: 徐 健 | H15: 32.80 | I15: 36739 | J15: 6
A16: =ROW()-2 -> 14 | B16: TP | C16: 3226 | D16: 1 | E16: 03226-2 | F16: 英汉双解微软计算机辞典 （第3版） | G16: 章鸿猷等译 | H16: 100.00 | I16: 36708 | J16: 3
A17: =ROW()-2 -> 15 | B17: TP | C17: 3047 | D17: 1 | E17: 03047-2 | F17: 英汉双解信息技术辞典（1）基本术语 | G17: 章鸿猷 | H17: 4.80 | I17: 1998 | J17: 50
A18: =ROW()-2 -> 16 | B18: H- | C18: 3105 | D18: 1 | E18: 03105-3 | F18: 英汉双解美国20世纪流行文化词典 | H18: 24.00 | I18: 1998 | J18: 12
A19: =ROW()-2 -> 17 | B19: TP | C19: 3199 | D19: 1 | E19: 03199-1 | F19: 英汉信息技术标准词汇 | G19: 章天懿 | H19: 15.00 | I19: 1999 | J19: 15
A20: =ROW()-2 -> 18 | B20: TP | C20: 3159 | D20: 2 | E20: 03159-2 | F20: 英汉多媒体技术词典(精） | G20: 林福宗 | H20: 30.00 | I20: 36495 | J20: 8
A21: =ROW()-2 -> 19 | B21: N- | C21: 4048 | D21: 1 | E21: 04048-6 | F21: 高技术辞典（精） | G21: 王大珩等 | H21: 120.00 | I21: 36831 | J21: 3
A22: =ROW()-2 -> 20 | B22: TP | C22: 4110 | D22: 1 | E22: 04110-5 | F22: 英汉网络技术词汇 | G22: 章鸿猷 | H22: 56.00 | I22: 37469 | J22: 6
A23: =ROW()-2 -> 21 | B23: TP | C23: 2545 | D23: 1 | E23: 02545-2 | F23: 计算机机房工作实用大全（精） | G23: 上海教委会 | H23: 128 | I23: 1998 | J23: 2
F24: 二、计算机类图书
F25: 1.大中专教材
F26: 计算机基础教育丛书（谭浩强主编）
A27: =ROW()-2 -> 25 | B27: TP | C27: 0860 | D27: 3 | E27: 00860-4 | F27: C程序设计(第1版） | G27: 谭浩强 | H27: 22.00 | I27: 37321 | J27: 9
A28: =ROW()-2 -> 26 | B28: TP | C28: 1034 | D28: S | E28: 01034-X | F28: C程序设计题解与上机指导 | G28: 谭浩强 | H28: 14.80 | I28: 37330 | J28: 13
A29: =ROW()-2 -> 27 | B29: TP | C29: 2621 | D29: 6 | E29: 02621-1 | F29: C程序设计实验指导 | G29: 徐士良 | H29: 9.00 | I29: 36951 | J29: 20
A30: =ROW()-2 -> 28 | B30: TP | C30: 2890 | D30: 8 | E30: 02890-7 | F30: C程序设计试题汇编 | G30: 谭浩强等 | H30: 26.00 | I30: 37406 | J30: 8
A31: =ROW()-2 -> 29 | B31: TP | C31: 2466 | D31: 7 | E31: 02466-9 | F31: True Basic程序设计（第3版） | G31: 谭浩强等 | H31: 21.00 | I31: 36861 | J31: 10
A32: =ROW()-2 -> 30 | B32: TP | C32: 0623 | D32: K | E32: 00623-7 | F32: FORTRAN 语言――FORTRAN77结构化程序设计 | G32: 谭浩强等 | H32: 22.00 | I32: 37500 | J32: 9
A33: =ROW()-2 -> 31 | B33: TP | C33: 3080 | D33: 2 | E33: 03080-4 | F33: FORTRAN77程序设计试题汇编 | G33: 鲍有文等 | H33: 12.80 | I33: 36586 | J33: 15
A34: =ROW()-2 -> 32 | B34: TP | C34: 0996 | D34: E | E34: 00996-1 | F34: FORTRAN77结构化程序设计题解 | G34: 谭浩强 | H34: 11.00 | I34: 37257 | J34: 20
A35: =ROW()-2 -> 33 | B35: TP | C35: 1422 | D35: N | E35: 01422-1 | F35: FoxBASE+及其应用系统开发 | G35: 史济民等 | H35: 21.00 | I35: 37356 | J35: 9
A36: =ROW()-2 -> 34 | B36: TP | C36: 2842 | D36: 5 | E36: 02842-7 | F36: FoxBASE+及其应用系统开发题解 | G36: 史济民 | H36: 10.00 | I36: 36951 | J36: 20
A37: =ROW()-2 -> 35 | B37: TP | C37: 1958 | D37: 5 | E37: 01958-4 | F37: 计算机常用算法(第2版) | G37: 徐士良 | H37: 25.00 | I37: 37530 | J37: 8
A38: =ROW()-2 -> 36 | B38: TP | C38: 1802 | D38: A | E38: 01802-2 | F38: 微型计算机原理及应用(第2版) | G38: 郑学坚等 | H38: 32.00 | I38: 36892 | J38: 6
A39: =ROW()-2 -> 37 | B39: TP | C39: 1967 | D39: 7 | E39: 01967-3 | F39: 微型计算机原理及应用实验指导（第1版） | G39: 郑学坚等 | H39: 18.00 | I39: 36800 | J39: 11
A40: =ROW()-2 -> 38 | B40: TP | C40: 1961 | D40: 9 | E40: 01961-4 | F40: 清华大学非计算机专业微机原理教材 ――微型计算机系统原理与应用 | G40: 杨素行等 | H40: 27.00 | I40: 37469 | J40: 8
A41: =ROW()-2 -> 39 | B41: TP | C41: 3917 | D41: 1 | E41: 03917-8 | F41: 计算机辅助设计技术基础（第2版） | G41: 孙家广 | H41: 29.50 | I41: 37377 | J41: 7
A42: =ROW()-2 -> 40 | B42: TP | C42: 1866 | D42: 8 | E42: 01866-9 | F42: 微机系统应用基础 | G42: 李大友 | H42: 18.00 | I42: 36526 | J42: 11
A43: =ROW()-2 -> 41 | B43: TP | C43: 1200 | D43: G | E43: 01200-8 | F43: 计算机软件技术基础(第2版) | G43: 李芳芸等 | H43: 16.00 | I43: 36739 | J43: 12
A44: =ROW()-2 -> 42 | B44: TP | C44: 3941 | D44: 1 | E44: 03941-0 | F44: 计算机软件技术基础(第3版)* | G44: 沈被娜等 | H44: 21.00 | I44: 37316 | J44: 10
F45: *本书获2002年教育部全国普通高等学校优秀教材二等奖。
A46: =ROW()-2 -> 44 | B46: TP | C46: 3140 | D46: 2 | E46: 03140-1 | F46: 计算机公共基础（第1版） | G46: 徐士良 | H46: 26.00 | I46: 36708 | J46: 8
A47: =ROW()-2 -> 45 | B47: TP | C47: 3603 | D47: 2 | E47: 03603-9 | F47: 计算机辅助绘图基础 | G47: 陆润民 | H47: 11.00 | I47: 36708 | J47: 18
A48: =ROW()-2 -> 46 | B48: TP | C48: 4032 | D48: 1 | E48: 04032-X | F48: 计算机辅助绘图基础 (2000版） | G48: 陆润民 | H48: 15.00 | I48: 37257 | J48: 16
F49: 新世纪计算机基础教育丛书（谭浩强主编）
A50: =ROW()-2 -> 48 | B50: TP | C50: 3806 | D50: 3 | E50: 03806-6 | F50: C程序设计 （第2版） | G50: 谭浩强 | H50: 26.00 | I50: 37500 | J50: 8
A51: =ROW()-2 -> 49 | B51: TP | C51: 3911 | D51: 2 | E51: 03911-9 | F51: C程序设计题解与上机指导（第2版） | G51: 谭浩强 | H51: 19.50 | I51: 37438 | J51: 11
A52: =ROW()-2 -> 50 | B52: TP | C52: 2883 | D52: 9 | E52: 02883-4 | F52: FoxPro 及其应用系统开发* | G52: 史济民等 | H52: 23.00 | I52: 37469 | J52: 9
F53: *本书获2002年教育部全国普通高等学校优秀教材一等奖。
A54: =ROW()-2 -> 52 | B54: TP | C54: 4053 | D54: 1 | E54: 04053-2 | F54: FoxPro 及其应用系统开发题解 | G54: 史济民等 | H54: 12.00 | I54: 37530 | J54: 20
A55: =ROW()-2 -> 53 | B55: TP | C55: 3778 | D55: 2 | E55: 03778-7 | F55: Visual FoxPro 及其应用系统开发 | G55: 史济民等 | H55: 25.00 | I55: 37469 | J55: 8
A56: =ROW()-2 -> 54 | B56: TP | C56: 4311 | D56: 1 | E56: 04311-6 | F56: Visual FoxPro 及其应用系统开发题解 | G56: 史济民等 | H56: 12.00 | I56: 37340 | J56: 20
A57: =ROW()-2 -> 55 | B57: TP | C57: 3674 | D57: 2 | E57: 03674-8 | F57: FORTRAN77程序设计上机指导（第2版） | G57: 朱明方等 | H57: 12.00 | I57: 37333 | J57: 15
A58: =ROW()-2 -> 56 | B58: TP | C58: 3784 | D58: 1 | E58: 03784-1 | F58: 计算机公共基础（第2版） | G58: 徐士良 | H58: 21.50 | I58: 37500 | J58: 11
A59: =ROW()-2 -> 57 | B59: TP | C59: 4259 | D59: 1 | E59: 04259-4 | F59: 计算机公共基础 （Windows 98 环境 ） | G59: 徐士良 | H59: 22.00 | I59: 37469 | J59: 11
A60: =ROW()-2 -> 58 | B60: TP | C60: 4755 | D60: 1 | E60: 04755-3 | F60: 计算机公共基础 习题与实验指导（Windows 98 环境 ） | G60: 高成强 | H60: 9.00 | I60: 37500 | J60: 28
A61: =ROW()-2 -> 59 | B61: TP | C61: 4644 | D61: 1 | E61: 04644-1 | F61: 计算机图形技术与 CAD | G61: 何 薇 | H61: 21.00 | I61: 37322 | J61: 10
A62: =ROW()-2 -> 60 | B62: TP | C62: 2152 | D62: 2 | E62: 02152-X | F62: 实用数据结构 | G62: 徐士良 | H62: 16.00 | I62: 37469 | J62: 15
A63: =ROW()-2 -> 61 | B63: TP | C63: 4064 | D63: 1 | E63: 04064-8 | F63: 实用数据结构题解 | G63: 徐士良 | H63: 11.00 | I63: 37043 | J63: 22
A64: =ROW()-2 -> 62 | B64: TP | C64: 2206 | D64: 3 | E64: 02206-2 | F64: Internet 基础 | G64: 吴功宜等 | H64: 18.00 | I64: 37327 | J64: 14
A65: =ROW()-2 -> 63 | B65: TP | C65: 4020 | D65: 1 | E65: 04020-6 | F65: 计算机网络与多媒体应用基础 | G65: 黄云森 | H65: 19.00 | I65: 37135 | J65: 12
A66: =ROW()-2 -> 64 | B66: TP | C66: 3695 | D66: 2 | E66: 03695-0 | F66: QBASIC程序设计 | G66: 谭浩强等 | H66: 23.50 | I66: 37469 | J66: 10
A67: =ROW()-2 -> 65 | B67: TP | C67: 3910 | D67: 1 | E67: 03910-0 | F67: QBASIC程序设计题解与上机指导 | G67: 谭浩强等 | H67: 14.00 | I67: 37469 | J67: 15
A68: =ROW()-2 -> 66 | B68: TP | C68: 4177 | D68: 1 | E68: 04177-6 | F68: Delphi 程序设计 | G68: 周果宏等 | H68: 29.00 | I68: 37347 | J68: 8
A69: =ROW()-2 -> 67 | B69: TP | C69: 1121 | D69: 1 | E69: 01121-4 | F69: Visual Basic 程序设计教程 | G69: 刘炳文 | H69: 33.60 | I69: 37469 | J69: 7
A70: =ROW()-2 -> 68 | B70: TP | C70: 4097 | D70: 1 | E70: 04097-4 | F70: Visual Basic 程序设计教程题解与上机指导 | G70: 刘炳文 | H70: 23.00 | I70: 37438 | J70: 10
A71: =ROW()-2 -> 69 | B71: TP | C71: 4549 | D71: 1 | E71: 04549-6 | F71: Java 程序设计 | G71: 辛运帏等 | H71: 21.00 | I71: 37530 | J71: 10
A72: =ROW()-2 -> 70 | B72: TP | C72: 4037 | D72: 1 | E72: 04037-0 | F72: 大学文科计算机教程（第1分册）计算机基础知识与操作平台 | G72: 黄都培 | H72: 15.00 | I72: 37104 | J72: 15
A73: =ROW()-2 -> 71 | B73: TP | C73: 4038 | D73: 1 | E73: 04038-9 | F73: 大学文科计算机教程（第2分册）计算机办公软件 | G73: 周山芙等 | H73: 21.00 | I73: 37135 | J73: 12
A74: =ROW()-2 -> 72 | B74: TP | C74: 4014 | D74: 1 | E74: 04014-1 | F74: 大学文科计算机教程（第3分册）计算机网络应用基础 | G74: 蔡翠平 | H74: 11.00 | I74: 37469 | J74: 20
A75: =ROW()-2 -> 73 | B75: TP | C75: 4023 | D75: 1 | E75: 04023-0 | F75: 电子商务基础教程 | G75: 黄云森等 | H75: 14.00 | I75: 37500 | J75: 16
A76: =ROW()-2 -> 74 | B76: TP | C76: 2213 | D76: 2 | E76: 02213-5 | F76: 网页制作实用技术 ―― FrontPage 2000 | G76: 陈强 等 | H76: 19.50 | I76: 37469 | J76: 12
A77: =ROW()-2 -> 75 | B77: TP | C77: 4052 | D77: 1 | E77: 04052-4 | F77: 微型计算机原理及应用(第3版) | G77: 郑学坚等 | H77: 36.00 | I77: 37469 | J77: 6
A78: =ROW()-2 -> 76 | B78: P- | C78: 1783 | D78: 2 | E78: 7900617833 | F78: 微型计算机原理及应用实验指导（第2版） | G78: 郑学坚等 | H78: 25.00 | I78: 37408 | J78: 8
A79: =ROW()-2 -> 77 | B79: P- | C79: 1783 | D79: 1 | E79: 7900617833 | F79: 微型计算机原理及应用实验指导（第2版） （配光盘） | G79: 郑学坚等 | H79: 35.00 | I79: 36982 | J79: 8
A80: =ROW()-2 -> 78 | B80: TP | C80: 5165 | D80: 1 | E80: 05165-8 | F80: 计算机公共基础（第四版）(Windows98,Office2000) | G80: 徐士良 | H80: 27.00 | I80: 37438 | J80: 8
A81: =ROW()-2 -> 79 | B81: TP | C81: 5005 | D81: 1 | E81: 05005-8 | F81: 计算机网络应用技术教程 | G81: 吴功宜等 | H81: 21.00 | I81: 37438 | J81: 9
A82: =ROW()-2 -> 80 | B82: TP | C82: 5065 | D82: 1 | E82: 05065-1 | F82: 计算机软件技术基础 | G82: 徐士良 | H82: 21.00 | I82: 37408 | J82: 10
A83: =ROW()-2 -> 81 | B83: TP | C83: 5737 | D83: 1 | E83: 05737-0 | F83: 计算机公共基础实验指导（Windows 98 Office2000） | G83: 徐士良 | H83: 10.00 | I83: 37469 | J83: 24
A84: =ROW()-2 -> 82 | B84: TP | C84: 5781 | D84: 1 | E84: 05781-8 | F84: Access 2000基础与应用 | G84: 李雁翎 | H84: 26.00 | I84: 37469 | J84: 10
A85: =ROW()-2 -> 83 | B85: TP | C85: 5079 | D85: 1 | E85: 05079-1 | F85: Internet基础(第二版) | G85: 吴功宜等 | H85: 18.00 | I85: 37500 | J85: 12
F86: 清华大学计算机基础教育课程系列教材
A87: =ROW()-2 -> 85 | B87: TP | C87: 2966 | D87: 8 | E87: 02966-0 | F87: 计算机文化基础(第2版) | G87: 王行言等 | H87: 16.00 | I87: 36586 | J87: 12
A88: =ROW()-2 -> 86 | B88: TP | C88: 3987 | D88: 1 | E88: 03987-9 | F88: 计算机文化基础(第3版) | G88: 李秀 等 | H88: 29.00 | I88: 37500 | J88: 8
A89: =ROW()-2 -> 87 | B89: TP | C89: 3970 | D89: 1 | E89: 03970-4 | F89: 计算机硬件技术基础（第2版） | G89: 张菊鹏等 | H89: 32.00 | I89: 37438 | J89: 7
A90: =ROW()-2 -> 88 | B90: TP | C90: 4019 | D90: 1 | E90: 04019-2 | F90: 计算机硬件技术基础实验指导 | G90: 李芙英等 | H90: 13.00 | I90: 37438 | J90: 17
A91: =ROW()-2 -> 89 | B91: TP | C91: 1261 | D91: 1 | E91: 01261-X | F91: 计算机硬件技术基础习题集 | G91: 沈永林 | H91: 9.00 | I91: 37012 | J91: 22
A92: =ROW()-2 -> 90 | B92: TP | C92: 3836 | D92: 1 | E92: 03836-8 | F92: Visual C++ 面向对象与可视化程序设计 | G92: 黄维通 | H92: 26.00 | I92: 37438 | J92: 8
F93: *本书获2002年教育部全国普通高等学校优秀教材二等奖。
A94: =ROW()-2 -> 92 | B94: P- | C94: 3058 | D94: 1 | E94: 7900630589 | F94: Visual C++ 面向对象与可视化程序设计习题解析与编程实例（配光盘） | G94: 黄维通 | H94: 38.00 | I94: 37469 | J94: 8
A95: =ROW()-2 -> 93 | B95: TP | C95: 4504 | D95: 1 | E95: 04504-6 | F95: C++语言程序设计(第2版）* | G95: 郑莉 等 | H95: 26.00 | I95: 37438 | J95: 8
E96: *本书第1版荣获2000年度中国高校科学技术奖自然科学二等奖、2000年度全国优秀畅销书奖
A97: =ROW()-2 -> 95 | B97: TP | C97: 3926 | D97: 1 | E97: 03926-7 | F97: C++语言程序设计习题与实验指导（配软盘） | G97: 郑莉 等 | H97: 25.00 | I97: 37500 | J97: 11
A98: =ROW()-2 -> 96 | B98: TP | C98: 5705 | D98: 1 | E98: 05705-2 | F98: 多媒体技术基础（第2版） | G98: 林福宗 | H98: 37.00 | I98: 37530 | J98: 6
A99: =ROW()-2 -> 97 | B99: TP | C99: 3927 | D99: 1 | E99: 03927-5 | F99: Java 语言与面向对象程序设计 | H99: 23.50 | I99: 37326 | J99: 9
A100: =ROW()-2 -> 98 | B100: TP | C100: 4407 | D100: 1 | E100: 04407-4 | F100: Linux 基础教程（1） 操作系统基础 | G100: 汤荷美等 | H100: 19.80 | I100: 37073 | J100: 12
A101: =ROW()-2 -> 99 | B101: TP | C101: 4105 | D101: 1 | E101: 04105-9 | F101: Internet 原理与技术 | G101: 赵锦蓉 | H101: 22.00 | I101: 37438 | J101: 10
A102: =ROW()-2 -> 100 | B102: P- | C102: 3721 | D102: 1 | E102: 7900637214 | F102: 计算机辅助设计技术基础教程（配光盘） | G102: 唐龙等 | H102: 21.00 | I102: 37469 | J102: 11
A103: =ROW()-2 -> 101 | B103: TP | C103: 5606 | D103: 1 | E103: 05606-4 | F103: 计算机辅助绘图基础（第3版）（AutoCAD2002） | G103: 陆润民 | H103: 17.00 | I103: 37469 | J103: 12
F104: 高等学校计算机基础教育教材精选
A105: =ROW()-2 -> 103 | B105: TP | C105: 4685 | D105: 1 | E105: 04685-9 | F105: 计算机文化基础教程 | G105: 冯博琴等 | H105: 25.00 | I105: 37469 | J105: 9
A106: =ROW()-2 -> 104 | B106: TP | C106: 5272 | D106: 1 | E106: 05272-7 | F106: 微型计算机原理与接口技术 | G106: 吴宁等 | H106: 29.00 | I106: 37288 | J106: 7
A107: =ROW()-2 -> 105 | B107: TP | C107: 1082 | D107: B | E107: 7810820427 | F107: 微机原理与接口技术 | G107: 朱定华编 | H107: 28.00 | I107: 37414 | J107: 10
A108: =ROW()-2 -> 106 | B108: TP | C108: 5284 | D108: 1 | E108: 05284-0 | F108: 数据库原理及应用（Access 2000) | G108: 姚普选 | H108: 20.00 | I108: 37347 | J108: 10
A109: =ROW()-2 -> 107 | B109: TP | C109: 5358 | D109: 1 | E109: 05358-8 | F109: 计算机网络公共基础 | G109: 史济民 | H109: 23.00 | I109: 37438 | J109: 9
A110: =ROW()-2 -> 108 | B110: TP | C110: 5360 | D110: 1 | E110: 05360-X | F110: 计算机辅助设计与绘图 | G110: 李学志 | H110: 30.00 | I110: 37469 | J110: 8
A111: =ROW()-2 -> 109 | B111: TP | C111: 5280 | D111: 1 | E111: 05280-8 | F111: C++语言基础教程题解与上机指导 | G111: 吕凤翥 | H111: 18.00 | I111: 37469 | J111: 15
A112: =ROW()-2 -> 110 | B112: TP | C112: 5562 | D112: 1 | E112: 05562-9 | F112: AutoCAD2002实用教程 | G112: 唐嘉平 | H112: 37.00 | I112: 37469 | J112: 7
A113: =ROW()-2 -> 111 | B113: TP | C113: 5760 | D113: 1 | E113: 05760-5 | F113: 基于开放平台的网页设计与编程 | G113: 程向前 | H113: 30.00 | I113: 37469 | J113: 8
F114: 高等学校计算机科学与技术教材
A115: =ROW()-2 -> 113 | B115: TP | C115: 1082 | D115: E | E115: 7810820680 | F115: 新编Internet基础及应用教程 | G115: 李军义等 | H115: 19.00 | I115: 37438 | J115: 12
A116: =ROW()-2 -> 114 | B116: TP | C116: 1082 | D116: G | E116: 7810820672 | F116: 多媒体计算机外部设备 | G116: 周怡陪等 | H116: 38.00 | I116: 37469 | J116: 6
A117: =ROW()-2 -> 115 | B117: TP | C117: 1082 | D117: H | E117: 7810820737 | F117: 算法与数据结构(C与++描述) | G117: 陈松乔等 | H117: 23.00 | I117: 37500 | J117: 11
A118: =ROW()-2 -> 116 | B118: TP | C118: 1082 | D118: B | E118: 7810820427 | F118: 微机原理与接口技术 | G118: 朱定华 | H118: 28.00 | I118: 37500 | J118: 10
F119: 普通高校文科专业计算机系列教材
A120: =ROW()-2 -> 118 | B120: TP | C120: 3183 | D120: 1 | E120: 03183-5 | F120: 计算机应用教程(第二版 DOS环境） | G120: 卢湘鸿 | H120: 29.00 | I120: 1999 | J120: 7
A121: =ROW()-2 -> 119 | B121: TP | C121: 3650 | D121: 3 | E121: 03650-0 | F121: 计算机应用教程(Windows 98环境) | G121: 卢湘鸿 | H121: 35.00 | I121: 37469 | J121: 6
A122: =ROW()-2 -> 120 | B122: TP | C122: 4178 | D122: 1 | E122: 04178-4 | F122: 计算机应用教程（Windows 2000 环境） | G122: 卢湘鸿 | H122: 36.00 | I122: 37500 | J122: 6
A123: =ROW()-2 -> 121 | B123: TP | C123: 5115 | D123: 1 | E123: 05115-1 | F123: 计算机应用教程（Windows 2000 环境）习题解答与实验指导 | G123: 卢湘鸿 | H123: 17 | I123: 37347 | J123: 12
A124: =ROW()-2 -> 122 | B124: TP | C124: 5645 | D124: 1 | E124: 05645-5 | F124: 计算机应用教程(第3版）（Windows XP环境） | G124: 卢湘鸿 | H124: 36 | I124: 37469 | J124: 6
A125: =ROW()-2 -> 123 | B125: P- | C125: 4371 | D125: 1 | E125: 7900643710 | F125: 网页制作教程（配光盘） | G125: 赵祖荫 | H125: 23 | I125: 37530 | J125: 9
A126: =ROW()-2 -> 124 | B126: TP | C126: 5646 | D126: 1 | E126: 05646-3 | F126: Visual FoxPro 6.0程序设计基础 | G126: 李吉梅等 | H126: 30 | I126: 37530 | J126: 18
F127: 清华大学计算机系列教材
F128: （普通高等教育“九五”国家教委重点教材）
A129: =ROW()-2 -> 127 | B129: TP | C129: 0984 | D129: L | E129: 00984-8 | F129: 数据结构(第2版) | G129: 严蔚敏等 | H129: 21.00 | I129: 37469 | J129: 9
A130: =ROW()-2 -> 128 | B130: TP | C130: 4540 | D130: 1 | E130: 04540-2 | F130: 80x86汇编语言程序设计 | G130: 沈美明等 | H130: 46.00 | I130: 37408 | J130: 5
A131: =ROW()-2 -> 129 | B131: TP | C131: 2520 | D131: 6 | E131: 02520-7 | F131: 实用软件工程(第2版) | G131: 郑人杰等 | H131: 32.00 | I131: 37469 | J131: 6
A132: =ROW()-2 -> 130 | B132: TP | C132: 3238 | D132: 5 | E132: 03238-6 | F132: 数据结构题集(第2版) | G132: 严蔚敏等 | H132: 15.80 | I132: 37410 | J132: 11
A133: =ROW()-2 -> 131 | B133: TP | C133: 2368 | D133: A | E133: 02368-9 | F133: 数据结构(C语言版) | G133: 严蔚敏 | H133: 22.00 | I133: 37500 | J133: 9
A134: =ROW()-2 -> 132 | B134: TP | C134: 3314 | D134: 4 | E134: 03314-5 | F134: 数据结构题集(C语言版) | G134: 严蔚敏 | H134: 16.00 | I134: 37413 | J134: 13
A135: =ROW()-2 -> 133 | B135: TP | C135: 3405 | D135: 4 | E135: 03405-2 | F135: 数据结构 （用面向对象方法与C++描述） | G135: 殷人昆等 | H135: 26.00 | I135: 37500 | J135: 6
A136: =ROW()-2 -> 134 | B136: TP | C136: 5288 | D136: 1 | E136: 05288-3 | F136: 数据结构习题解析（用面向对象方法与C++语言描述） | G136: 殷人昆、徐孝凯 | H136: 26 | I136: 37438 | J136: 12
A137: =ROW()-2 -> 135 | B137: TP | C137: 5036 | D137: 1 | E137: 05036-8 | F137: 数字逻辑与数字集成电路（第2版） | G137: 王尔乾等 | H137: 29.00 | I137: 37469 | J137: 10
A138: =ROW()-2 -> 136 | B138: TP | C138: 2004 | D138: D | E138: 02004-3 | F138: PASCAL程序设计(第2版) | G138: 郑启华 | H138: 17.60 | I138: 37469 | J138: 10
A139: =ROW()-2 -> 137 | B139: TP | C139: 1992 | D139: C | E139: 01992-4 | F139: PASCAL程序设计习题与选解 (新编 ) | G139: 郑启华 | H139: 11.50 | I139: 37530 | J139: 15
A140: =ROW()-2 -> 138 | B140: TP | C140: 4664 | D140: 1 | E140: 04664-6 | F140: IBM-PC 汇编语言程序设计（第2版） | G140: 沈美明等 | H140: 34.80 | I140: 37420 | J140: 6
A141: =ROW()-2 -> 139 | B141: TP | C141: 0829 | D141: N | E141: 00829-9 | F141: IBM-PC汇编语言程序设计 | G141: 沈美明等 | H141: 26.00 | I141: 37421 | J141: 7
A142: =ROW()-2 -> 140 | B142: TP | C142: 0756 | D142: L | E142: 00756-X | F142: IBM-PC汇编语言程序设计例题习题集 | G142: 温冬婵等 | H142: 7.50 | I142: 37422 | J142: 22
A143: =ROW()-2 -> 141 | B143: TP | C143: 1033 | D143: G | E143: 01033-1 | F143: IBM-PC汇编语言程序设计实验教程 | G143: 沈美明等 | H143: 13.00 | I143: 37423 | J143: 16
A144: =ROW()-2 -> 142 | B144: TP | C144: 3990 | D144: 2 | E144: 03990-9 | F144: 计算机操作系统教程（第2版） | G144: 张尧学等 | H144: 19.60 | I144: 37469 | J144: 10
F145: *本书获2002年教育部全国普通高等学校优秀教材一等奖。
A146: =ROW()-2 -> 144 | B146: TP | C146: 4004 | D146: 1 | E146: 04004-4 | F146: 计算机操作系统教程（第2版）习题解答与实验指导 | G146: 张尧学 | H146: 11 | I146: 37500 | J146: 20
A147: =ROW()-2 -> 145 | B147: TP | C147: 3082 | D147: 3 | E147: 03082-0 | F147: 计算机图形学（第3版） | G147: 孙家广等 | H147: 39.00 | I147: 37469 | J147: 5
A148: =ROW()-2 -> 146 | B148: TP | C148: 2053 | D148: 5 | E148: 02053-1 | F148: 计算机组成原理实验指导书与习题集 | G148: 王诚 等 | H148: 15.80 | I148: 37519 | J148: 12
A149: =ROW()-2 -> 147 | B149: TP | C149: 2732 | D149: 8 | E149: 02732-3 | F149: 编译原理 | G149: 吕映芝等 | H149: 23.00 | I149: 37469 | J149: 9
A150: =ROW()-2 -> 148 | B150: TP | C150: 0408 | D150: B | E150: 00408-0 | F150: 人工智能导论 | G150: 林尧瑞等 | H150: 16.00 | I150: 37521 | J150: 16
A151: =ROW()-2 -> 149 | B151: TP | C151: 2089 | D151: A | E151: 02089-2 | F151: 微型计算机技术及应用 ――从16位到32位 (第2版) | G151: 戴梅萼等 | H151: 38 | I151: 37430 | J151: 5
A152: =ROW()-2 -> 150 | B152: TP | C152: 2646 | D152: 8 | E152: 02646-7 | F152: 微型计算机技术及应用――从16位到32位习题与实验题集(第2版)（配光盘） | G152: 戴梅萼 | H152: 19.5 | I152: 37431 | J152: 20
A153: =ROW()-2 -> 151 | B153: TP | C153: 2646 | D153: 7 | E153: 02646-7 | F153: 微型计算机技术及应用――从16位到32位习题与实验题集(第2版) | G153: 戴梅萼 | H153: 9.5 | I153: 37432 | J153: 20
A154: =ROW()-2 -> 152 | B154: TP | C154: 2087 | D154: 2 | E154: 02087-6 | F154: 微型计算机技术及应用――微型机软件硬件开发指南 | G154: 戴梅萼 | H154: 8 | I154: 37433 | J154: 20
A155: =ROW()-2 -> 153 | B155: TP | C155: 4095 | D155: 1 | E155: 04095-8 | F155: 计算机组成与结构(第3版) | G155: 王爱英 | H155: 32.50 | I155: 37434 | J155: 7
A156: =ROW()-2 -> 154 | B156: TP | C156: 2900 | D156: 5 | E156: 02900-8 | F156: 计算机系统结构(第2版） | G156: 郑纬民等 | H156: 42.00 | I156: 37435 | J156: 4
A157: =ROW()-2 -> 155 | B157: TP | C157: 3573 | D157: 3 | E157: 03573-3 | F157: 计算机网络与 Internet 教程 | G157: 张尧学等 | H157: 24.50 | I157: 37469 | J157: 8
A158: =ROW()-2 -> 156 | B158: TP | C158: 3933 | D158: 1 | E158: 03933-X | F158: 多媒体技术基础 | G158: 林福宗 | H158: 28.00 | I158: 37438 | J158: 7
A159: =ROW()-2 -> 157 | B159: TP | C159: 4006 | D159: 1 | E159: 04006-0 | F159: 多媒体技术基础实验指南 | G159: 谢霄艳等 | H159: 18.00 | I159: 37438 | J159: 12
A160: =ROW()-2 -> 158 | B160: TP | C160: 2016 | D160: 8 | E160: 02016-7 | F160: 计算机图形学基础 | G160: 唐泽圣等 | H160: 20.00 | I160: 37439 | J160: 10
A161: =ROW()-2 -> 159 | B161: TP | C161: 4042 | D161: 1 | E161: 04042-7 | F161: 数理逻辑与集合论（第2版） | G161: 石纯一等 | H161: 18.00 | I161: 37440 | J161: 12
A162: =ROW()-2 -> 160 | B162: TP | C162: 4528 | D162: 1 | E162: 04528-3 | F162: 数理逻辑与集合论（第2版）精要与题解 | G162: 王宏 等 | H162: 16.00 | I162: 37441 | J162: 20
A163: =ROW()-2 -> 161 | B163: TP | C163: 1814 | D163: 3 | E163: 01814-6 | F163: 图论与代数结构 | G163: 戴一奇等 | H163: 12.90 | I163: 37442 | J163: 12
A164: =ROW()-2 -> 162 | B164: TP | C164: 1615 | D164: 3 | E164: 01615-1 | F164: 系统分析与控制 | G164: 孙增圻 | H164: 17.50 | I164: 37443 | J164: 10
A165: =ROW()-2 -> 163 | B165: TP | C165: 5160 | D165: 1 | E165: 05160-7 | F165: 计算机局域网 （第三版） | G165: 胡道元 | H165: 39.00 | I165: 37444 | J165: 6
A166: =ROW()-2 -> 164 | B166: TP | C166: 5549 | D166: 1 | E166: 05549-1 | F166: 计算机组成与设计实验指导 | G166: 王诚 等 | H166: 21 | I166: 37469 | J166: 15
A167: =ROW()-2 -> 165 | B167: P- | C167: 4358 | D167: 1 | E167: 7900643583 | F167: 计算机组成与设计（配光盘） | G167: 王诚 | H167: 39 | I167: 37500 | J167: 8
F168: 21世纪大学本科计算机专业系列教材
A169: =ROW()-2 -> 167 | B169: TP | C169: 5695 | D169: 1 | E169: 05695-1 | F169: 多媒体技术原理及应用 | G169: 马华东 | H169: 24.8 | I169: 37469 | J169: 10
F170: 普通高校计算机专业(本科）实用教程系列
A171: =ROW()-2 -> 169 | B171: TP | C171: 4730 | D171: 1 | E171: 04730-8 | F171: 计算机组成原理实用教程 | G171: 幸云辉等 | H171: 30.00 | I171: 37257 | J171: 9
A172: =ROW()-2 -> 170 | B172: TP | C172: 4655 | D172: 1 | E172: 04655-7 | F172: 操作系统实用教程 | G172: 任爱华等 | H172: 28.00 | I172: 37377 | J172: 10
A173: =ROW()-2 -> 171 | B173: TP | C173: 5023 | D173: 1 | E173: 05023-1 | F173: 微机接口技术实用教程 | G173: 艾德才等 | H173: 34.00 | I173: 37438 | J173: 7
A174: =ROW()-2 -> 172 | B174: TP | C174: 1950 | D174: 2 | E174: 01950-9 | F174: 数据结构实用教程（C/C++描述） | G174: 徐孝凯 | H174: 29.00 | I174: 37328 | J174: 9
A175: =ROW()-2 -> 173 | B175: TP | C175: 5007 | D175: 1 | E175: 05007-4 | F175: 数据结构课程实验 | G175: 徐孝凯 | H175: 16.00 | I175: 37257 | J175: 16
A176: =ROW()-2 -> 174 | B176: TP | C176: 2072 | D176: 4 | E176: 02072-8 | F176: 数据结构实用教程习题参考解答 | G176: 徐孝凯等 | H176: 12.00 | I176: 37377 | J176: 20
A177: =ROW()-2 -> 175 | B177: TP | C177: 4723 | D177: 1 | E177: 04723-5 | F177: JAVA 2 实用教程(修订版） | G177: 耿祥义等 | H177: 39.00 | I177: 37469 | J177: 7
A178: =ROW()-2 -> 176 | B178: TP | C178: 4797 | D178: 1 | E178: 04797-9 | F178: 数据库实用教程 | G178: 丁宝康等 | H178: 35.00 | I178: 37196 | J178: 8
A179: =ROW()-2 -> 177 | B179: TP | C179: 4296 | D179: 1 | E179: 04296-9 | F179: 面向对象程序设计实用教程 | G179: 张海藩等 | H179: 22.00 | I179: 37500 | J179: 11
A180: =ROW()-2 -> 178 | B180: TP | C180: 4750 | D180: 1 | E180: 04750-2 | F180: 计算机网络实用教程 | G180: 刘云 等 | H180: 32.00 | I180: 37257 | J180: 8
A181: =ROW()-2 -> 179 | B181: TP | C181: 5127 | D181: 1 | E181: 05127-5 | F181: 数字逻辑实用教程 | G181: 王玉龙 | H181: 28.00 | I181: 37408 | J181: 9
A182: =ROW()-2 -> 180 | B182: TP | C182: 5211 | D182: 1 | E182: 05211-5 | F182: 信息技术基础实用教程 | G182: 樊孝忠等 | H182: 26.00 | I182: 37408 | J182: 10
F183: 世界著名计算机教材精选
A184: =ROW()-2 -> 182 | B184: TP | C184: 3463 | D184: 1 | E184: 03463-X | F184: 计算机组织与结构：性能设计 （第4版） | G184: 张昆藏等译 | H184: 56.00 | I184: 36831 | J184: 6
A185: =ROW()-2 -> 183 | B185: TP | C185: 4239 | D185: 1 | E185: 04239-X | F185: 因特网和万维网的基本原理与技术 | G185: 郭振波译 | H185: 42.00 | I185: 36951 | J185: 7
A186: =ROW()-2 -> 184 | B186: TP | C186: 4463 | D186: 1 | E186: 04463-5 | F186: TCP/IP 协议族 | G186: 谢希仁译 | H186: 69.00 | I186: 37135 | J186: 4
A187: =ROW()-2 -> 185 | B187: TP | C187: 3646 | D187: 2 | E187: 03646-2 | F187: 数据库系统基础教程 | G187: 史嘉权等译 | H187: 36.00 | I187: 37469 | J187: 8
A188: =ROW()-2 -> 186 | B188: TP | C188: 2342 | D188: 4 | E188: 02342-5 | F188: 面向对象系统分析与设计 | G188: 周之英等译 | H188: 35.00 | I188: 37469 | J188: 10
A189: =ROW()-2 -> 187 | B189: TP | C189: 3948 | D189: 1 | E189: 03948-8 | F189: 计算理论基础（第2版） | G189: 张立昂等译 | H189: 29.00 | I189: 36708 | J189: 10
A190: =ROW()-2 -> 188 | B190: TP | C190: 3035 | D190: 8 | E190: 03035-9 | F190: 计算机网络(第3版) | G190: 熊桂喜等译 | H190: 48.00 | I190: 37469 | J190: 5
A191: =ROW()-2 -> 189 | B191: TP | C191: 3160 | D191: 4 | E191: 03160-6 | F191: 数据结构 C++语言描述 | G191: 刘卫东等译 | H191: 58.00 | I191: 37135 | J191: 4
A192: =ROW()-2 -> 190 | B192: TP | C192: 4164 | D192: 1 | E192: 04164-4 | F192: 多媒体技术：计算、通信和应用 | G192: 潘志庚等译 | H192: 52.00 | I192: 36861 | J192: 6
A193: =ROW()-2 -> 191 | B193: P- | C193: 4330 | D193: 1 | E193: 7900643303 | F193: 计算机网络与Internet――网络应用(第三版)配光盘 | G193: Douglas E.Comer | H193: 58.00 | I193: 37469 | J193: 6
A194: =ROW()-2 -> 192 | B194: TP | C194: 4871 | D194: 1 | E194: 04871-1 | F194: 计算机系统结构――一种定量的方法（第2版）Computer Architecture: A Quantitative Approach | G194: 郑纬民等译 | H194: 72.00 | I194: 37469 | J194: 4
A195: =ROW()-2 -> 193 | B195: P- | C195: 4342 | D195: 1 | E195: 7900643427 | F195: C/C++/Java程序设计经典教程 第三版（含光盘） | G195: Harvey M. Deitel & Deitel & Paul J. Deitel | H195: 99.00 | I195: 37500 | J195: 3
F196: 大学计算机教育丛书（英文影印版）
A197: =ROW()-2 -> 195 | B197: TP | C197: 3623 | D197: 1 | E197: 03623-3 | F197: Elements of the theory of computation 2nd Edition（ 计算理论基础 第2版) | G197: Harry R.Lewis 等 | H197: 19.00 | I197: 37135 | J197: 16
A198: =ROW()-2 -> 196 | B198: TP | C198: 4480 | D198: 1 | E198: 04480-5 | F198: Applied C ：An Introduction and More （C 的应用：入门和提高） | G198: Alice E.Fischer等 | H198: 79.80 | I198: 37043 | J198: 3
A199: =ROW()-2 -> 197 | B199: P- | C199: 3750 | D199: 1 | E199: 7900637508 | F199: C++ Program Design: An Introduction to Programming and Object-Orient Design 3rd Edition (C++ 程序设计 :程序设计和面向对象设计入门 第3版）（配光盘） | G199: James P.Cohoon 等 | H199: 76.00 | I199: 37364 | J199: 3
A200: =ROW()-2 -> 198 | B200: TP | C200: 2976 | D200: 4 | E200: 02976-8 | F200: Operating Systems Internals and Design Principles 3rd Edition（ 操作系统精髓与设计原理 第3版） | G200: William Stallings | H200: 35.00 | I200: 37530 | J200: 7
A201: =ROW()-2 -> 199 | B201: TP | C201: 4314 | D201: 1 | E201: 04314-0 | F201: Systems Programming and Operating Systems 2nd Edition （系统程序设计和操作系统 第2版修订版） | G201: D.M. Dhamdhere | H201: 56.00 | I201: 37500 | J201: 4
A202: =ROW()-2 -> 200 | B202: TP | C202: 2714 | D202: 4 | E202: 02714-5 | F202: Operating Systems Design and Implementation 2nd Edition（操作系统:设计及实现 第2版 配光盘) | G202: Andrew S. Tanenbaum | H202: 69.00 | I202: 37165 | J202: 6
A203: =ROW()-2 -> 201 | B203: TP | C203: 2411 | D203: 6 | E203: 02411-1 | F203: Distributed Operating Systems （分布式操作系统） | G203: Andrew S. Tanenbaum | H203: 30.00 | I203: 37135 | J203: 9
A204: =ROW()-2 -> 202 | B204: TP | C204: 4378 | D204: 1 | E204: 04378-7 | F204: Data Communications and Networking 2nd Edition（数据通信与网络技术 第2版） | G204: Behrouz A.Forouzan | H204: 78.00 | I204: 37196 | J204: 3
A205: =ROW()-2 -> 203 | B205: TP | C205: 3891 | D205: 1 | E205: 03891-0 | F205: In-line/On-line: Fundamentals of the Internet and the the World Wide Web（因特网与万维网基本原理与技术） | G205: Raymond Greenlaw | H205: 49.00 | I205: 36831 | J205: 5
A206: =ROW()-2 -> 204 | B206: TP | C206: 3890 | D206: 1 | E206: 03890-2 | F206: Student Solution Mannal to Accompany In-line/On-line:Fundamentals of the Internet and the World Web（因特网与万维网基本原理与技术学生解题手册） | H206: 15.00 | I206: 36739 | J206: 17
A207: =ROW()-2 -> 205 | B207: TP | C207: 2410 | D207: 9 | E207: 02410-3 | F207: Computer Networks 3rd Edition （计算机网络 第3版) | G207: Andrew S. Tanenbaum | H207: 45.00 | I207: 37073 | J207: 7
A208: =ROW()-2 -> 206 | B208: TP | C208: 1037 | D208: 1 | E208: 01037-4 | F208: Database Management Systems 2nd Edition (数据库管理系统 第2版） | G208: Raghu Ramakrishnan | H208: 76.00 | I208: 37333 | J208: 3
A209: =ROW()-2 -> 207 | B209: TP | C209: 2829 | D209: 4 | E209: 02829-X | F209: A First Course in Database Systems （数据库系统基础教程） | G209: Jeffrey D.Ullman | H209: 23.00 | I209: 37408 | J209: 12
A210: =ROW()-2 -> 208 | B210: TP | C210: 2414 | D210: 5 | E210: 02414-6 | F210: Multimedia:Computing,Communications & Applications(多媒体技术:计算,通信及应用) | G210: Steinmetz R. | H210: 50.001997000000003 | I210: 37257 | J210: 7
A211: =ROW()-2 -> 209 | B211: TP | C211: 2830 | D211: 3 | E211: 02830-3 | F211: IBM PC Assembly Language and Programming 4nd Edition (IBM PC汇编语言与程序设计 第4版) | G211: Peter Abel | H211: 30.00 | I211: 37500 | J211: 9
A212: =ROW()-2 -> 210 | B212: TP | C212: 2412 | D212: 7 | E212: 02412-X | F212: The C Programming Language (C程序设计语言 第2版 ) | G212: Brian W. Kernighan | H212: 23.00 | I212: 37288 | J212: 21
A213: =ROW()-2 -> 211 | B213: TP | C213: 2728 | D213: 3 | E213: 02728-5 | F213: The C Answer Book Solutions to the Exercises in The C Programming Language （C程序设计语言习题解答 第2版) | G213: Clovis L.Tondo | H213: 12.00 | I213: 37377 | J213: 22
A214: =ROW()-2 -> 212 | B214: TP | C214: 2413 | D214: 6 | E214: 02413-8 | F214: Data Structure with C++ (数据结构 C++语言描述 ) | G214: William Ford | H214: 54.00 | I214: 37043 | J214: 7
A215: =ROW()-2 -> 213 | B215: TP | C215: 2943 | D215: 2 | E215: 02943-1 | G215: Robert L.Kruse | H215: 32.00 | I215: 37414 | J215: 8
A216: =ROW()-2 -> 214 | B216: TP | C216: 2192 | D216: 3 | E216: 02192-9 | F216: Java Structures (数据结构 Java 描述） | G216: Duane A.Bailey | H216: 32.00 | I216: 36861 | J216: 8
A217: =ROW()-2 -> 215 | B217: TP | C217: 2415 | D217: 5 | E217: 02415-4 | F217: Computer Organization and Architecture (计算机组织与结构:性能设计 第4版) | G217: William Stallings | H217: 43.00 | I217: 36982 | J217: 8
A218: =ROW()-2 -> 216 | B218: TP | C218: 2832 | D218: 3 | E218: 02832-X | F218: Software Architecture（软件体系结构) | G218: Mary Shaw | H218: 15.00 | I218: 37469 | J218: 20
A219: =ROW()-2 -> 217 | B219: TP | C219: 4139 | D219: 1 | E219: 04139-3 | F219: Software Engineering a Practitioner's Approach (软件工程实践者之路 第5版） | G219: Roger S.Pressman | H219: 79.00 | I219: 37530 | J219: 3
A220: =ROW()-2 -> 218 | B220: TP | C220: 2766 | D220: 3 | E220: 02766-8 | F220: Discrete Mathematical Structures （离散数学结构 第3版) | G220: Bernard Kolman | H220: 32.00 | I220: 37257 | J220: 10
A221: =ROW()-2 -> 219 | B221: TP | C221: 2744 | D221: 3 | E221: 02744-7 | F221: Digital Logic Circuit Analysis & Design (数字逻辑电路分析与设计 ) | G221: Victor P. Nelsom | H221: 69.00 | I221: 36617 | J221: 3
A222: =ROW()-2 -> 220 | B222: TP | C222: 2944 | D222: 3 | E222: 02944-X | F222: Object-Oriented Systems Analysis and Design（面向对象系统分析与设计) | G222: R.J. Norman | H222: 23.00 | I222: 36982 | J222: 12
A223: =ROW()-2 -> 221 | B223: TP | C223: 3188 | D223: 1 | E223: 03188-6 | F223: Object-Oriented Software Construction (面向对象软件构造 第2版 ) | G223: Bertrand Meyer | H223: 96.00 | I223: 36434 | J223: 2
A224: =ROW()-2 -> 222 | B224: TP | C224: 4098 | D224: 1 | E224: 04098-2 | F224: Practical Object-Ortented Design with UML (面向对象设计的 UML 实践 ) | G224: Mark Priestley | H224: 39.00 | I224: 37323 | J224: 9
A225: =ROW()-2 -> 223 | B225: TP | C225: 4220 | D225: 1 | E225: 04220-9 | F225: An Introduction to Object-Oriented Programming witn Java 2nd Edition (Java 面向对象程序设计 第2版） | G225: C.Thomas Wu | H225: 72.00 | I225: 37165 | J225: 4
A226: =ROW()-2 -> 224 | B226: TP | C226: 2771 | D226: 2 | E226: 02771-4 | F226: Computer Graphics (计算机图形学 C语言版 第2版） | G226: Dorald Hearn | H226: 68 | I226: 1998 | J226: 4
A227: =ROW()-2 -> 225 | B227: TP | C227: 2942 | D227: 3 | E227: 02942-3 | F227: UNIX Network Programming (UNIX网络编程 卷一 第二版) | G227: W.Richard Stevens | H227: 43.00 | I227: 37288 | J227: 6
A228: =ROW()-2 -> 226 | B228: TP | C228: 3547 | D228: 2 | E228: 03547-4 | F228: IPv6 The New Internet Protocol (新因特网协议 IPv6 第2版) | G228: Christian Huitema | H228: 14 | I228: 36861 | J228: 20
A229: =ROW()-2 -> 227 | B229: TN | C229: 2828 | D229: 3 | E229: 02828-1 | F229: Digital Image Processing (数字图象处理） | G229: K.R. Castleman | H229: 32.00 | I229: 37371 | J229: 8
A230: =ROW()-2 -> 228 | B230: TN | C230: 2927 | D230: 2 | E230: 02927-X | F230: Digital Video Processing（数字视频处理） | G230: A.Murat Tekalp | H230: 27.00 | I230: 1998 | J230: 10
A231: =ROW()-2 -> 229 | B231: TP | C231: 3640 | D231: 1 | E231: 03640-3 | F231: Fundamentals of Speech Recognition (语音识别基本原理) | G231: Lawrence Rabiner等 | H231: 41.00 | I231: 36404 | J231: 5
A232: =ROW()-2 -> 230 | B232: TP | C232: 2831 | D232: 2 | E232: 02831-1 | F232: Computer System Architecture（计算机系统体系结构 第3版） | G232: M.Morris Mano | H232: 28.00 | I232: 37469 | J232: 11
A233: =ROW()-2 -> 231 | B233: TP | C233: 4123 | D233: 1 | E233: 04123-7 | F233: Communication Networks Fundamental Concepts and key Architectures (通信网基本概念与主体结构) | G233: Alberto Leon-Garcia | H233: 72.00 | I233: 36892 | J233: 4
A234: =ROW()-2 -> 232 | B234: TP | C234: 4100 | D234: 1 | E234: 04100-8 | F234: TCP/IP Protocol Suite (TCP/IP 协议族 ) | G234: Behrouz A. | H234: 69.00 | I234: 36861 | J234: 4
A235: =ROW()-2 -> 233 | B235: TP | C235: 2946 | D235: 3 | E235: 02946-6 | F235: Principles,Protocols and ArchitectureTCP/IP ( 网络互联技术1 原理，协议和体系结构 第3版） | G235: Douglas E.Comer | H235: 30.00 | I235: 37500 | J235: 10
A236: =ROW()-2 -> 234 | B236: TP | C236: 2947 | D236: 3 | E236: 02947-4 | F236: Design,Implementation and Internals (TCP/IP 网络互联技术2 设计与实现 ) | G236: Douglas E.Comer等 | H236: 30.00 | I236: 37288 | J236: 9
A237: =ROW()-2 -> 235 | B237: TP | C237: 2948 | D237: 2 | E237: 02948-2 | F237: Client-Server Programming and Applications (TCP/IP 网络互联技术3 第2版 客户服务器编程应用BSD套接字版 ) | G237: Douglas E.Comer等 | H237: 32 | I237: 36617 | J237: 10
A238: =ROW()-2 -> 236 | B238: TP | C238: 3094 | D238: 3 | E238: 03094-4 | F238: Client-Server Programming and Applications (TCP/IP 网络互联技术 第3版 客户服务器编程应用Windows套接字版 ) | G238: Douglas E.Comer等 | H238: 30 | I238: 36465 | J238: 10
F239: 大学计算机教育国外著名教材、教参系列（影印版）
A240: =ROW()-2 -> 238 | B240: TP | C240: 5493 | D240: 1 | E240: 05493-2 | F240: Principles of Distributed Database System Second Edition （分布式数据库系统原理 第2版） | G240: Douglas E.Comer等 | H240: 57.00 | I240: 37408 | J240: 4
A241: =ROW()-2 -> 239 | B241: TP | C241: 5021 | D241: 1 | E241: 05021-1 | F241: Introduction to Automata Theory,Languages,and Computation 2ed（自动机理论、语言和计算机导论 第2版） | G241: John E.Hopcroft等 | H241: 47 | I241: 37438 | J241: 5
A242: =ROW()-2 -> 240 | B242: TP | C242: 5355 | D242: 1 | E242: 05355-3 | F242: UNIX Network Progrmming Volume 2:Interprocess Communication 2ed(UNIX网络编程 卷二：过程间通信 第2版) | G242: W.Richard Stevens | H242: 47.00 | I242: 37371 | J242: 5
A243: =ROW()-2 -> 241 | B243: TP | C243: 4999 | D243: 1 | E243: 04999-1 | F243: The 80x86 IBM PC and Compatible Computers(Volumes I &II) Assembly Language, Design and Interfacing 3ed (80x86 IBM PC 及兼容计算机 卷I和卷II）（配光盘） | G243: Muhammad Ali Mazidi等 | H243: 85.00 | I243: 37438 | J243: 3
A244: =ROW()-2 -> 242 | B244: TP | C244: 5536 | D244: 1 | E244: 05536-X | F244: Network Security Essentials:Applications and Stardards（网络安全基础教程:应用与标准） | G244: William Stallings | H244: 35.00 | I244: 37469 | J244: 7
A245: =ROW()-2 -> 243 | B245: TP | C245: 5537 | D245: 1 | E245: 05537-8 | F245: Crytogrphy and Network Security:Principles and Computation 2ed (密码学与网络安全：原理与实践 第2版） | G245: William Stallings | H245: 53.00 | I245: 37469 | J245: 4
A246: =ROW()-2 -> 244 | B246: P- | C246: 4334 | D246: 1 | E246: 7900643346 | F246: PCI-X System Architecture (PCI-X 系统的体系结构 配光盘） | G246: MindShare,Inc等 | H246: 68.00 | I246: 37469 | J246: 3
A247: =ROW()-2 -> 245 | B247: TP | C247: 5717 | D247: 1 | E247: 05717-6 | F247: Introduction to Logic Design(逻辑设计基础） | G247: Alan B.Marcovitz | H247: 50.00 | I247: 37469 | J247: 4
A248: =ROW()-2 -> 246 | B248: TP | C248: 5710 | D248: 1 | E248: 05710-9 | F248: Operating Systems: A Systematic View (Fifth Edition) (操作系统；实践与应用）（第5版） | G248: William S. Davis T.M. Rajkumar | H248: 55.00 | I248: 37500 | J248: 4
A249: =ROW()-2 -> 247 | B249: TP | C249: 5702 | D249: 1 | E249: 05702-8 | F249: Data Structures & Algorithm Analysis in C++(2nd ed.) （数据结构与算法分析C++描述（第2版） | G249: Mark Allen weise | H249: 54.00 | I249: 37500 | J249: 40
F250: 教育部人才培养试点教材
A251: =ROW()-2 -> 249 | B251: TP | C251: 3567 | D251: 2 | E251: 03567-9 | F251: 多媒体技术基础及应用 | G251: 钟玉琢等 | H251: 28.00 | I251: 37438 | J251: 10
A252: =ROW()-2 -> 250 | B252: TP | C252: 0696 | D252: 1 | E252: 00696-2 | F252: 多媒体技术基础及应用辅导与实验 | G252: 钟玉琢等 | H252: 18.00 | I252: 37469 | J252: 15
A253: =ROW()-2 -> 251 | B253: TP | C253: 1314 | D253: 3 | E253: 01314-4 | F253: 计算机组成原理 | G253: 王 诚 | H253: 27.00 | I253: 37469 | J253: 8
A254: =ROW()-2 -> 252 | B254: TP | C254: 5192 | D254: 1 | E254: 05192-5 | F254: 计算机组成原理实验指导书 | G254: 王诚 等 | H254: 13.00 | I254: 37327 | J254: 16
A255: =ROW()-2 -> 253 | B255: TP | C255: 4237 | D255: 1 | E255: 04237-3 | F255: 计算机系统结构 | G255: 郑纬民等 | H255: 29.80 | I255: 37469 | J255: 8
A256: =ROW()-2 -> 254 | B256: TP | C256: 4262 | D256: 2 | E256: 04262-4 | F256: 计算机网络 | G256: 吴企渊 | H256: 23.00 | I256: 37377 | J256: 10
A257: =ROW()-2 -> 255 | B257: TP | C257: 4271 | D257: 1 | E257: 04271-3 | F257: 数据结构 | G257: 殷人昆 | H257: 27.60 | I257: 37408 | J257: 8
A258: =ROW()-2 -> 256 | B258: TP | C258: 4425 | D258: 1 | E258: 04425-2 | F258: 实用软件工具与环境教程――C++ 高级编程 | G258: 谭德强等 | H258: 28.00 | I258: 37073 | J258: 8
A259: =ROW()-2 -> 257 | B259: TP | C259: 4669 | D259: 1 | E259: 04669-7 | F259: 微计算机技术 | G259: 马群生等 | H259: 29.50 | I259: 37196 | J259: 9
A260: =ROW()-2 -> 258 | B260: TP | C260: 4670 | D260: 1 | E260: 04670-0 | F260: 微计算机技术实验教程 | G260: 潘孝梅等 | H260: 8.50 | I260: 37135 | J260: 30
A261: =ROW()-2 -> 259 | B261: TP | C261: 3928 | D261: 2 | E261: 03928-3 | F261: 计算机操作系统 | G261: 吴企渊等 | H261: 16.00 | I261: 37012 | J261: 16
A262: =ROW()-2 -> 260 | B262: TN | C262: 4039 | D262: 2 | E262: 04039-7 | F262: 信号处理原理 | G262: 郑方 等 | H262: 26.00 | I262: 37469 | J262: 11
A263: =ROW()-2 -> 261 | B263: TP | C263: 4699 | D263: 1 | E263: 04699-9 | F263: 数据库系统教程 | G263: 史嘉权等 | H263: 22.00 | I263: 37438 | J263: 13
A264: =ROW()-2 -> 262 | B264: TP | C264: 5159 | D264: 1 | E264: 05159-3 | F264: C++面向对象程序设计教程 | G264: 王萍等 | H264: 35.00 | I264: 37508 | J264: 7
F265: 高等院校信息管理与信息系统专业系列教材
F266: 教程系列
A267: =ROW()-2 -> 265 | B267: TP | C267: 5049 | D267: 1 | E267: 05049-X | F267: 计算机原理与系统结构（第二版） | G267: 侯炳辉等 | H267: 23.00 | I267: 37469 | J267: 9
A268: =ROW()-2 -> 266 | B268: TP | C268: 2787 | D268: 5 | E268: 02787-0 | F268: 计算机组成原理教程(第2版) | G268: 张基温 | H268: 17.00 | I268: 37438 | J268: 13
A269: =ROW()-2 -> 267 | B269: TP | C269: 4013 | D269: 1 | E269: 04013-3 | F269: 计算机组成原理教程题解与实验指导 | G269: 张基温 | H269: 17.50 | I269: 37073 | J269: 12
A270: =ROW()-2 -> 268 | B270: TP | C270: 1123 | D270: 1 | E270: 01123-0 | F270: 操作系统原理教程 | G270: 孟 静 | H270: 25.00 | I270: 37469 | J270: 8
A271: =ROW()-2 -> 269 | B271: TP | C271: 2801 | D271: 2 | E271: 02801-X | F271: 信息经济学教程 | G271: 陈 禹 | H271: 17.00 | I271: 37135 | J271: 11
A272: =ROW()-2 -> 270 | B272: TP | C272: 4443 | D272: 1 | E272: 04443-0 | F272: 信息系统的开发与管理教程 | G272: 左美云等 | H272: 28.00 | I272: 37469 | J272: 8
A273: =ROW()-2 -> 271 | B273: TP | C273: 2913 | D273: 2 | E273: 02913-X | F273: 信息系统开发方法教程 | G273: 陈 佳 | H273: 18.00 | I273: 37438 | J273: 10
A274: =ROW()-2 -> 272 | B274: TP | C274: 3530 | D274: 3 | E274: 03530-X | F274: 计算机网络工程教程 | G274: 黄叔武等 | H274: 24.50 | I274: 37326 | J274: 8
A275: =ROW()-2 -> 273 | B275: TP | C275: 3739 | D275: 1 | E275: 03739-6 | F275: 计算机网络工程教程题解与实验指导 | G275: 黄叔武等 | H275: 19.00 | I275: 37257 | J275: 11
A276: =ROW()-2 -> 274 | B276: TP | C276: 4012 | D276: 1 | E276: 04012-5 | F276: 数据结构及应用算法教程（配光盘） | G276: 严蔚敏等 | H276: 29.00 | I276: 37469 | J276: 10
A277: =ROW()-2 -> 275 | B277: TP | C277: 3009 | D277: 6 | E277: 03009-X | F277: 数据库系统原理教程 | G277: 王珊 等 | H277: 18.50 | I277: 37438 | J277: 10
A278: =ROW()-2 -> 276 | B278: TP | C278: 3788 | D278: 1 | E278: 03788-4 | F278: 运筹学模型与方法教程 | G278: 程理民等 | H278: 21.00 | I278: 37357 | J278: 9
A279: =ROW()-2 -> 277 | B279: TP | C279: 4088 | D279: 1 | E279: 04088-5 | F279: 运筹学模型与方法教程例题分析与题解 | G279: 刘满凤等 | H279: 22.00 | I279: 37257 | J279: 10
A280: =ROW()-2 -> 278 | B280: TP | C280: 3722 | D280: 2 | E280: 03722-1 | F280: 离散数学 (第二版) | G280: 耿素云等 | H280: 16.80 | I280: 37408 | J280: 12
A281: =ROW()-2 -> 279 | B281: TP | C281: 3398 | D281: 2 | E281: 03398-6 | F281: 离散数学题解 | G281: 屈婉玲等 | H281: 13.00 | I281: 37357 | J281: 15
F282: 参考系列
A283: =ROW()-2 -> 281 | B283: TP | C283: 3562 | D283: 3 | E283: 03562-8 | F283: 电子商务概论* | G283: 方美琪 | H283: 27.00 | I283: 36982 | J283: 8
F284: *本书获2002年教育部全国普通高等学校优秀教材二等奖。
A285: =ROW()-2 -> 283 | B285: TP | C285: 4823 | D285: 1 | E285: 04823-1 | F285: 电子商务概论（第二版） | G285: 方美琪 | H285: 37.00 | I285: 37196 | J285: 5
A286: =ROW()-2 -> 284 | B286: F- | C286: 3418 | D286: 1 | E286: 03418-4 | F286: 信息系统开发案例 (第一辑) | G286: 张基温等 | H286: 11.50 | I286: 37257 | J286: 20
A287: =ROW()-2 -> 285 | B287: TP | C287: 3830 | D287: 1 | E287: 03830-9 | F287: 信息系统开发案例 (第二辑) | G287: 张基温等 | H287: 14.00 | I287: 36526 | J287: 15
A288: =ROW()-2 -> 286 | B288: TP | C288: 4122 | D288: 1 | E288: 04122-9 | F288: 信息系统开发案例（第三辑） | G288: 张基温 | H288: 16.00 | I288: 37257 | J288: 15
A289: =ROW()-2 -> 287 | B289: TP | C289: 3277 | D289: 1 | E289: 03277-7 | F289: 信息系统工程中的面向对象方法 | G289: 陈余年等 | H289: 22.00 | I289: 1999 | J289: 9
A290: =ROW()-2 -> 288 | B290: TP | C290: 3995 | D290: 1 | E290: 03995-X | F290: 信息系统建设的软系统方法 | G290: 邝孔武等 | H290: 12.00 | I290: 36770 | J290: 20
A291: =ROW()-2 -> 289 | B291: TP | C291: 3213 | D291: 1 | E291: 03213-0 | F291: 信息系统的安全与保密 | G291: 贾 晶 | H291: 12.00 | I291: 37358 | J291: 22
A292: =ROW()-2 -> 290 | B292: TP | C292: 1055 | D292: 1 | E292: 01055-2 | F292: 管理系统模拟与GPSS语言 | G292: 姜林奇 | H292: 12.00 | I292: 36708 | J292: 18
A293: =ROW()-2 -> 291 | B293: TP | C293: 5454 | D293: 1 | E293: 05454-1 | F293: 信息系统的组织・管理・建模 | G293: 陈国青等 | H293: 22.00 | I293: 37469 | J293: 11
F294: 高等院校电脑美术系列
A295: =ROW()-2 -> 293 | B295: TP | C295: 5002 | D295: 1 | E295: 05002-3 | F295: Photoshop 7.0 | G295: 于鹏 | H295: 35.00 | I295: 37530 | J295: 7
F296: 北京大学信息技术系列教材
A297: =ROW()-2 -> 295 | B297: TP | C297: 1082 | D297: 1 | E297: 7810820001 | F297: 数据库技术－SQL | G297: 蔡翠平主编 | H297: 21.00 | I297: 37257 | J297: 11
A298: =ROW()-2 -> 296 | B298: TP | C298: 1082 | D298: C | E298: 7810820613 | F298: 从HTML 到 XML（含盘） | G298: 蔡翠平主编 | H298: 26.00 | I298: 37438 | J298: 11
A299: =ROW()-2 -> 297 | B299: TP | C299: 1082 | D299: 2 | E299: 7810820095 | F299: 办公自动化软件 | G299: 蔡翠平主编 | H299: 23.00 | I299: 37469 | J299: 10
A300: =ROW()-2 -> 298 | B300: TP | C300: 1082 | D300: 3 | E300: 7810820184 | F300: 计算机信息技术 基础 | G300: 蔡翠平主编 | H300: 17.00 | I300: 37257 | J300: 13
A301: =ROW()-2 -> 299 | B301: TP | C301: 1082 | D301: 4 | E301: 7810820192 | F301: 计算机网络应用技术 | G301: 蔡翠平主编 | H301: 19.00 | I301: 37501 | J301: 12
A302: =ROW()-2 -> 300 | B302: TP | C302: 1082 | D302: 5 | E302: 7810820176 | F302: Visual Basic 程序设计 | G302: 蔡翠平主编 | H302: 27.00 | I302: 37258 | J302: 8
A303: =ROW()-2 -> 301 | B303: TP | C303: 1082 | D303: 7 | E303: 7810820109 | F303: 多媒体应用技术（含光盘） | G303: 蔡翠平主编 | H303: 29.00 | I303: 37317 | J303: 9
A304: =ROW()-2 -> 302 | B304: TP | C304: 1082 | D304: 8 | E304: 7810820087 | F304: 网络程序设计――ASP（含光盘） | G304: 蔡翠平主编 | H304: 28.00 | I304: 37469 | J304: 10
A305: =ROW()-2 -> 303 | B305: TP | C305: 1082 | D305: 9 | E305: 7810820419 | F305: 网页制作技术 | G305: 蔡翠平主编 | H305: 22.00 | I305: 37389 | J305: 12
A306: =ROW()-2 -> 304 | B306: TP | C306: 1082 | D306: A | E306: 7810820303 | F306: Visual FoxPro程序设计 | G306: 蔡翠平主编 | H306: 29.00 | I306: 37414 | J306: 12
F307: 大学计算机文化基础课教材
A308: =ROW()-2 -> 306 | B308: TP | C308: 5729 | D308: 1 | E308: 05729-X | F308: 计算机信息技术基础 | G308: 东方人华 | H308: 25.00 | I308: 37469 | J308: 9
F309: 高等学校工科电子类规划教材
A310: =ROW()-2 -> 308 | B310: TP | C310: 1470 | D310: 9 | E310: 01470-1 | F310: 软件应用技术基础 | G310: 徐士良等 | H310: 23.00 | I310: 37408 | J310: 9
A311: =ROW()-2 -> 309 | B311: TB | C311: 4396 | D311: 1 | E311: 04396-5 | F311: 电子材料导论 | G311: 李言荣等 | H311: 34.00 | I311: 37104 | J311: 7
A312: =ROW()-2 -> 310 | B312: TP | C312: 3390 | D312: 3 | E312: 03390-0 | F312: 信息系统分析与设计 | G312: 邝孔武等 | H312: 16.00 | I312: 37329 | J312: 12
F313: 高等学校电子信息类规划教材
A314: =ROW()-2 -> 312 | B314: TP | C314: 3749 | D314: 2 | E314: 03749-3 | F314: C++面向对象程序设计教程 | G314: 陈维兴等 | H314: 17.00 | I314: 37469 | J314: 13
A315: =ROW()-2 -> 313 | B315: TP | C315: 1082 | D315: D | E315: 7810820524 | F315: 蓝牙技术原理与协议 | G315: 朱刚等 | H315: 26.00 | I315: 37438 | J315: 12
A316: =ROW()-2 -> 314 | B316: TP | C316: 3821 | D316: 1 | E316: 03821-X | F316: 系统仿真导论 | G316: 肖田元等 | H316: 23.50 | I316: 37104 | J316: 10
A317: =ROW()-2 -> 315 | B317: TH | C317: 1389 | D317: 1 | E317: 01389-6 | F317: 电子机械可靠性与维修性 | G317: 王世萍等 | H317: 19.50 | I317: 36647 | J317: 10
A318: =ROW()-2 -> 316 | B318: TP | C318: 5607 | D318: 1 | E318: 05607-2 | F318: 信息系统分析与设计（第2版） | G318: 邝孔武 | H318: 22.00 | I318: 37530 | J318: 12
F319: 国外计算机科学经典教材
A320: =ROW()-2 -> 318 | B320: TP | C320: 5594 | D320: 1 | E320: 05594-7 | F320: TCP/IP 权威教程（第七版） | G320: 杨铁男等译 | H320: 75.00 | I320: 37469 | J320: 5
F321: 高等学校统计分析软件系列教材
A322: =ROW()-2 -> 320 | B322: TP | C322: 1082 | D322: 1 | E322: 7810820664 | F322: STATISTICA for Windows 统计与图表分析教程 | G322: 洪楠 | H322: 49 | I322: 37500 | J322: 6
F323: 现代远程教育计算机信息技术教材
A324: =ROW()-2 -> 322 | B324: TP | C324: 1082 | D324: F | E324: 781082063X | F324: 微型计算机原理与接口技术 | G324: 毛六平等编 | H324: 26.00 | I324: 37469 | J324: 10
F325: 21 世纪计算机专业大专系列教材（李大友主编）
A326: =ROW()-2 -> 324 | B326: TP | C326: 4292 | D326: 1 | E326: 04292-6 | F326: 离散数学 | G326: 邵学才等 | H326: 17.00 | I326: 37257 | J326: 15
A327: =ROW()-2 -> 325 | B327: TP | C327: 4996 | D327: 1 | E327: 04996-3 | F327: 离散数学习题与解答 | G327: 邵学才等 | H327: 15.00 | I327: 37408 | J327: 14
A328: =ROW()-2 -> 326 | B328: TP | C328: 4505 | D328: 1 | E328: 04505-4 | F328: 多媒体技术及其应用 | G328: 李大友 | H328: 21.00 | I328: 37404 | J328: 11
A329: =ROW()-2 -> 327 | B329: TP 4943 1 | D329: 1 | E329: 04943-2 | F329: 计算机组成原理（第二版） | G329: 李文兵 | H329: 26.00 | I329: 37408 | J329: 8
A330: =ROW()-2 -> 328 | B330: P- | C330: 3711 | D330: 1 | E330: 7900637117 | F330: Java 语言程序设计（配光盘） | G330: 孙一林 | H330: 29.00 | I330: 37500 | J330: 10
A331: =ROW()-2 -> 329 | B331: TP | C331: 5080 | D331: 1 | E331: 05080-5 | F331: 计算机组织与结构 | G331: 蒋本珊 | H331: 28.00 | I331: 37438 | J331: 8
A332: =ROW()-2 -> 330 | B332: TP | C332: 5262 | D332: 1 | E332: 05262-X | F332: Visual FoxPro程序设计 | G332: 陈 明 | H332: 25.00 | I332: 37469 | J332: 9
A333: =ROW()-2 -> 331 | B333: P- | C333: 4167 | D333: 1 | E333: 790064167X | F333: 数据结构(配光盘) | G333: 李大友 | H333: 25.00 | I333: 37469 | J333: 10
A334: =ROW()-2 -> 332 | B334: TP | C334: 5546 | D334: 1 | E334: 05546-7 | F334: 实用软件工程基础 | G334: 陈 明 | H334: 25.00 | I334: 37469 | J334: 10
A335: =ROW()-2 -> 333 | B335: P- | C335: 4199 | D335: 1 | E335: 7900614998 | F335: Visual Basic 程序设计(配光盘） | G335: 彭波 | H335: 27.00 | I335: 37469 | J335: 7
A336: =ROW()-2 -> 334 | B336: TP | C336: 5328 | D336: 1 | E336: 05328-6 | F336: Internet 技术及其应用 | G336: 刘建 | H336: 35.00 | I336: 37469 | J336: 6
E337: 教育部高职高专规划教材
A338: =ROW()-2 -> 336 | B338: TP | C338: 4027 | D338: 1 | E338: 04027-3 | F338: 微机接口技术 | G338: 邵时 等 | H338: 19.00 | I338: 37438 | J338: 13
A339: =ROW()-2 -> 337 | B339: TP | C339: 5041 | D339: 1 | E339: 05041-4 | F339: Pentium 微机原理与接口技术 | G339: 姚放吾主编 | H339: 25.00 | I339: 2002.1 | J339: 9
A340: =ROW()-2 -> 338 | B340: TP | C340: 4827 | D340: 1 | E340: 04827-4 | F340: 微机组装与维修 | G340: 梁和 等 | H340: 29.00 | I340: 37257 | J340: 7
A341: =ROW()-2 -> 339 | B341: TP | C341: 4376 | D341: 1 | E341: 04376-0 | F341: 计算机网络工程与实训 | G341: 沈辉 等 | H341: 21.00 | I341: 37469 | J341: 12
A342: =ROW()-2 -> 340 | B342: TP | C342: 4636 | D342: 1 | E342: 04636-0 | F342: 多媒体技术与应用基础 | G342: 周 琛 | H342: 18.00 | I342: 37469 | J342: 14
A343: =ROW()-2 -> 341 | B343: TP | C343: 4562 | D343: 1 | E343: 04562-3 | F343: 数据库应用系统开发――PowerBuilder 实用编程技术 | G343: 齐治文等 | H343: 28.00 | I343: 37469 | J343: 9
A344: =ROW()-2 -> 342 | B344: TP | C344: 4065 | D344: 1 | E344: 04065-6 | F344: 数据结构 | G344: 张世和 | H344: 16.00 | I344: 37135 | J344: 15
F345: 高职高专计算机系列教材（谭浩强主编）
A346: =ROW()-2 -> 344 | B346: TP | C346: 3802 | D346: 2 | E346: 03802-3 | F346: 计算机基础知识与基本操作 | G346: 张 玲 | H346: 19.50 | I346: 37469 | J346: 13
A347: =ROW()-2 -> 345 | B347: TP | C347: 4603 | D347: 1 | E347: 04603-4 | F347: 微机原理与接口技术 | G347: 李文英等 | H347: 26.00 | I347: 37257 | J347: 8
A348: =ROW()-2 -> 346 | B348: TP | C348: 3952 | D348: 1 | E348: 03952-6 | F348: 最新常用软件的使用 Office 2000 中文版 | G348: 孙慧 等 | H348: 27.00 | I348: 37469 | J348: 9
A349: =ROW()-2 -> 347 | B349: TP | C349: 3791 | D349: 2 | E349: 03791-4 | F349: C 语言程序设计 | G349: 谭浩强 | H349: 24.00 | I349: 37469 | J349: 9
A350: =ROW()-2 -> 348 | B350: TP | C350: 4008 | D350: 1 | E350: 04008-7 | F350: C 语言程序设计题解与上机指导 | G350: 谭浩强等 | H350: 20.00 | I350: 37469 | J350: 12
A351: =ROW()-2 -> 349 | B351: TP | C351: 4771 | D351: 1 | E351: 04771-5 | F351: Visual FoxPro 6.0 使用与开发技术 | G351: 李雁翎 | H351: 25.00 | I351: 37288 | J351: 10
A352: =ROW()-2 -> 350 | B352: TP | C352: 3798 | D352: 1 | E352: 03798-1 | F352: Visual BASIC 程序设计 | G352: 谭浩强等 | H352: 23.00 | I352: 37469 | J352: 10
A353: =ROW()-2 -> 351 | B353: TP | C353: 4086 | D353: 1 | E353: 04086-9 | F353: 多媒体技术及应用 | G353: 陈 明 | H353: 18.00 | I353: 37257 | J353: 14
A354: =ROW()-2 -> 352 | B354: TP | C354: 4018 | D354: 1 | E354: 04018-4 | F354: QBASIC 语言程序设计 | G354: 谭浩强等 | H354: 25.50 | I354: 37469 | J354: 10
A355: =ROW()-2 -> 353 | B355: TP | C355: 4874 | D355: 1 | E355: 04874-6 | F355: QBASIC 语言程序设计题解与上机指导 | G355: 谭浩强 | H355: 13.50 | I355: 37257 | J355: 16
A356: =ROW()-2 -> 354 | B356: TP | C356: 4609 | D356: 1 | E356: 04609-3 | F356: Java 语言程序设计 | G356: 邵光亚等 | H356: 22.00 | I356: 37408 | J356: 10
A357: =ROW()-2 -> 355 | B357: TP | C357: 3805 | D357: 1 | E357: 03805-8 | F357: 数据库应用技术（FoxPro) | G357: 訾秀玲 | H357: 15.00 | I357: 37377 | J357: 15
A358: =ROW()-2 -> 356 | B358: TP | C358: 4638 | D358: 1 | E358: 04638-7 | F358: Internet 应用教程 | G358: 陈强 等 | H358: 20.00 | I358: 37530 | J358: 14
A359: =ROW()-2 -> 357 | B359: TP | C359: 3789 | D359: 2 | E359: 03789-2 | F359: Internet 技术与应用 | G359: 李琳 等 | H359: 13.60 | I359: 37500 | J359: 18
A360: =ROW()-2 -> 358 | B360: TP | C360: 3921 | D360: 1 | E360: 03921-6 | F360: 计算机辅助制图与设计 | G360: 郝玲 等 | H360: 22.00 | I360: 36739 | J360: 12
A361: =ROW()-2 -> 359 | B361: TP | C361: 3807 | D361: 1 | E361: 03807-4 | F361: 计算机安全技术 | G361: 刘荫铭等 | H361: 24.00 | I361: 37412 | J361: 10
A362: =ROW()-2 -> 360 | B362: TP | C362: 5636 | D362: 1 | E362: 05636-6 | F362: 计算机网络安全与应用技术 | G362: 袁家政 | H362: 30.00 | I362: 37500 | J362: 8
A363: =ROW()-2 -> 361 | B363: TP | C363: 5635 | D363: 1 | E363: 05635-8 | F363: 计算机网络 | G363: 徐敬东等 | H363: 26.00 | I363: 37469 | J363: 9
A364: =ROW()-2 -> 362 | B364: TP | C364: 5591 | D364: 1 | E364: 05591-2 | F364: Access 及其应用系统开发 | G364: 薛静锋 | H364: 18.50 | I364: 37469 | J364: 13
A365: =ROW()-2 -> 363 | B365: TP | C365: 5647 | D365: 1 | E365: 05647-1 | F365: 实用数据结构基础 | G365: 陈明 | H365: 25.00 | I365: 37500 | J365: 10
A366: =ROW()-2 -> 364 | B366: TP | C366: 5701 | D366: 1 | E366: 05701-X | F366: 网页编程技术 | G366: 邵丽萍 | H366: 25.00 | I366: 37500 | J366: 10
A367: =ROW()-2 -> 365 | B367: TP | C367: 5731 | D367: 1 | E367: 05731-1 | F367: 网页制作技术 | G367: 赵丰年 | H367: 19.00 | I367: 37500 | J367: 10
A368: =ROW()-2 -> 366 | B368: TP | C368: 5813 | D368: 1 | E368: 05813-X | F368: 计算机基础知识与基本操作（第二版） | G368: 张玲 | H368: 24.00 | I368: 37530 | J368: 11
F369: 高职高专电子商务专业系列教材
F370: 商业信息化系列培训教材
A371: =ROW()-2 -> 369 | B371: TP | C371: 5213 | D371: 1 | E371: 05213-1 | F371: 商务管理信息系统 | G371: 李大军 | H371: 30.00 | I371: 37288 | J371: 9
A372: =ROW()-2 -> 370 | B372: TP | C372: 5146 | D372: 1 | E372: 05146-1 | F372: 计算机会计与电子商务 | G372: 黄 群 | H372: 15.00 | I372: 37469 | J372: 18
A373: =ROW()-2 -> 371 | B373: TP | C373: 5147 | D373: 1 | E373: 05147-X | F373: 连锁经营与计算机管理 | G373: 李大军 | H373: 23.00 | I373: 37316 | J373: 12
A374: =ROW()-2 -> 372 | B374: TP | C374: 5174 | D374: 1 | E374: 05174-7 | F374: 商业会计实务与财务管理 | G374: 吴江江 | H374: 30.00 | I374: 37316 | J374: 9
A375: =ROW()-2 -> 373 | B375: TP | C375: 5850 | D375: 1 | E375: 05850-4 | F375: 电子商务法律法规 | G375: 王纪平 | H375: 29.50 | I375: 37500 | J375: 9
A376: =ROW()-2 -> 374 | B376: TP | C376: 5817 | D376: 1 | E376: 05817-2 | F376: 电子商务 | G376: 李大军 | H376: 37.00 | I376: 37500 | J376: 7
F377: 计算机专业大专系列教材（李大友主编）
A378: =ROW()-2 -> 376 | B378: TP | C378: 3563 | D378: 2 | E378: 03563-6 | F378: 离散数学 | G378: 耿素云等 | H378: 17.00 | I378: 37226 | J378: 13
A379: =ROW()-2 -> 377 | B379: TP | C379: 2548 | D379: 7 | E379: 02548-7 | F379: 计算机组成原理 | G379: 李文兵 | H379: 18.00 | I379: 37408 | J379: 12
A380: =ROW()-2 -> 378 | B380: TP | C380: 2100 | D380: 3 | E380: 02100-7 | F380: 计算机组成原理题解与实验指导 | G380: 李文兵 | H380: 9.00 | I380: 36678 | J380: 25
A381: =ROW()-2 -> 379 | B381: TP | C381: 2341 | D381: 7 | E381: 02341-7 | F381: 数据库原理及应用(FoxBASE) | G381: 王 利等 | H381: 15.00 | I381: 36526 | J381: 12
A382: =ROW()-2 -> 380 | B382: TP | C382: 1139 | D382: 1 | E382: 01139-7 | F382: 数据库原理及应用（第2版）(FoxPro) | G382: 李大友等 | H382: 14.50 | I382: 37469 | J382: 15
A383: =ROW()-2 -> 381 | B383: TP | C383: 2909 | D383: 3 | E383: 02909-1 | F383: 软件工程概论 | G383: 郑人杰等 | H383: 19.80 | I383: 37321 | J383: 10
A384: =ROW()-2 -> 382 | B384: TP | C384: 3103 | D384: 3 | E384: 03103-7 | F384: C 语言程序设计 | G384: 李大友等 | H384: 15.50 | I384: 36951 | J384: 12
A385: =ROW()-2 -> 383 | B385: TP | C385: 2965 | D385: 5 | E385: 02965-2 | F385: 微型计算机接口技术 | G385: 李大友等 | H385: 22.00 | I385: 37329 | J385: 8
A386: =ROW()-2 -> 384 | B386: TP | C386: 2923 | D386: 4 | E386: 02923-7 | F386: 大专教材 微型计算机原理 | G386: 李大友等 | H386: 21.00 | I386: 37500 | J386: 10
A387: =ROW()-2 -> 385 | B387: TP | C387: 2587 | D387: 4 | E387: 02587-8 | F387: 数字电路逻辑设计 | G387: 严化南等 | H387: 20.00 | I387: 37196 | J387: 10
A388: =ROW()-2 -> 386 | B388: TP | C388: 3084 | D388: 5 | E388: 03084-7 | F388: 计算机网络 | G388: 李大友主编 | H388: 12.00 | I388: 37377 | J388: 18
F389: 21世纪中等职业技术教育计算机系列教材
A390: =ROW()-2 -> 388 | B390: TP | C390: 5226 | D390: 1 | E390: 05226-3 | F390: Word 2000、Excel 2000与上机指导 | G390: 韩祖德等 | H390: 24.00 | I390: 37370 | J390: 9
A391: =ROW()-2 -> 389 | B391: TP | C391: 5294 | D391: 1 | E391: 05294-8 | F391: 多媒体应用软件的设计与制作 | G391: 谢宝荣 | H391: 23.00 | I391: 37408 | J391: 9
A392: =ROW()-2 -> 390 | B392: TP | C392: 5586 | D392: 1 | E392: 05586-6 | F392: Visual Basic 6.0程序设计与上机指导 | G392: 冯 昊 | H392: 26.00 | I392: 37500 | J392: 10
F393: 中等职业技术教育计算机教材
A394: =ROW()-2 -> 392 | B394: TP | C394: 3885 | D394: 1 | E394: 03885-6 | F394: 微型计算机的结构、维护与实习指导 | G394: 戚文正 | H394: 24.00 | I394: 37104 | J394: 10
A395: =ROW()-2 -> 393 | B395: TP | C395: 4172 | D395: 1 | E395: 04172-5 | F395: 微型计算机原理及应用 | G395: 史建华等 | H395: 28.00 | I395: 37012 | J395: 9
A396: =ROW()-2 -> 394 | B396: TP | C396: 2980 | D396: 6 | E396: 02980-6 | F396: FoxBASE+与上机指导 | G396: 吴清萍等 | H396: 20.00 | I396: 37165 | J396: 11
A397: =ROW()-2 -> 395 | B397: TP | C397: 3600 | D397: 2 | E397: 03600-4 | F397: VB5.0/6.0 中文版程序设计与上机指导 | G397: 冯 昊 | H397: 24.00 | I397: 37408 | J397: 10
A398: =ROW()-2 -> 396 | B398: TP | C398: 3651 | D398: 2 | E398: 03651-9 | F398: Visual FoxPro 5.0 中文版与上机指导 | G398: 韩立凡等 | H398: 26.00 | I398: 36892 | J398: 9
A399: =ROW()-2 -> 397 | B399: TP | C399: 3590 | D399: 2 | E399: 03590-3 | F399: C 语言程序设计与上机指导 | G399: 吕凤翥 | H399: 21.00 | I399: 36708 | J399: 11
A400: =ROW()-2 -> 398 | B400: TP | C400: 2403 | D400: 6 | E400: 02403-0 | F400: 计算机基础知识与上机指导 | G400: 吴清萍等 | H400: 14.00 | I400: 36739 | J400: 14
A401: =ROW()-2 -> 399 | B401: TP | C401: 2417 | D401: 8 | E401: 02417-0 | F401: 计算机字表处理与上机指导 | G401: 韩祖德等 | H401: 15.00 | I401: 37043 | J401: 12
A402: =ROW()-2 -> 400 | B402: TP | C402: 3632 | D402: 2 | E402: 03632-2 | F402: 计算机网络应用基础 (NetWare 与 Windows NT) | G402: 吴清萍等 | H402: 14.00 | I402: 36708 | J402: 15
A403: =ROW()-2 -> 401 | B403: TP | C403: 3609 | D403: 3 | E403: 03609-8 | F403: Internet 与上网操作 | G403: 毛汉书 | H403: 11.50 | I403: 37104 | J403: 18
A404: =ROW()-2 -> 402 | B404: TP | C404: 5055 | D404: 1 | E404: 05055-4 | F404: 计算机图像处理与应用――Photoshop 6.0 | G404: 董鲁平 | H404: 16.00 | I404: 37469 | J404: 12
A405: =ROW()-2 -> 403 | B405: TP | C405: 3888 | D405: 1 | E405: 03888-0 | F405: 网页设计与制作 | G405: 宋 琳 等 | H405: 16.00 | I405: 37469 | J405: 15
A406: =ROW()-2 -> 404 | B406: TP | C406: 3481 | D406: 1 | E406: 03481-8 | F406: 计算机字表图处理与上机指导 (Windows 9X环境) | G406: 韩祖德等 | H406: 23.00 | I406: 37104 | J406: 10
A407: =ROW()-2 -> 405 | B407: TP | C407: 4083 | D407: 1 | E407: 04083-4 | F407: 计算机英语 | G407: 曾 江 等 | H407: 21.00 | I407: 37257 | J407: 12
A408: =ROW()-2 -> 406 | B408: TP | C408: 4063 | D408: 1 | E408: 04063-X | F408: 计算机辅助制图与上机指导 | G408: 童 迪 | H408: 22.00 | I408: 36892 | J408: 12
E409: 2.中小学教材（教辅、教参、教师培训）与科普
F410: 信息技术教材
F411: （北京市计算机教育研究会组编）
A412: =ROW()-2 -> 410 | B412: TT | C412: 0134 | D412: 4 | E412: 05134-6 | F412: 信息技术（小学版 第1册）（彩色版） | G412: 教育研究会 | H412: 11.8 | I412: 37438 | J412: 30
A413: =ROW()-2 -> 411 | B413: TT | C413: 0134 | D413: 3 | E413: 7801551346 | F413: 信息技术（小学版 第1册）（黑白版） | G413: 教育研究会 | H413: 6.8 | I413: 37500 | J413: 30
A414: =ROW()-2 -> 412 | B414: TT | C414: 0135 | D414: 4 | E414: 7801551354 | F414: 信息技术（小学版 第2册）（彩色版） | G414: 教育研究会 | H414: 11.8 | I414: 37500 | J414: 30
A415: =ROW()-2 -> 413 | B415: TT | C415: 0135 | D415: 2 | E415: 7801551354 | F415: 信息技术（小学版 第2册）（黑白版） | G415: 教育研究会 | H415: 6.8 | I415: 37500 | J415: 30
A416: =ROW()-2 -> 414 | B416: TP | C416: 4606 | D416: 1 | E416: 04606-9 | F416: 信息技术（小学版 第1册、第2册）教学参考书 | G416: 教育研究会 | H416: 12 | I416: 37408 | J416: 25
A417: =ROW()-2 -> 415 | B417: TP | C417: 5197 | D417: 2 | E417: 05197-6 | F417: 信息技术（小学版 第3册）――综合实践（黑白版） | G417: 教育研究会 | H417: 9.80 | I417: 37500 | J417: 25
A418: =ROW()-2 -> 416 | B418: TP | C418: 5198 | D418: 1 | E418: 05198-4 | F418: 信息技术（小学版 第3册）――综合实践（彩色版） | G418: 教育研究会 | H418: 12.80 | I418: 37342 | J418: 20
A419: =ROW()-2 -> 417 | B419: TP | C419: 5199 | D419: 2 | E419: 05199-2 | F419: 信息技术（小学版 第4册）――LOGO（黑白版） | G419: 教育研究会 | H419: 9.80 | I419: 37530 | J419: 25
A420: =ROW()-2 -> 418 | B420: TP | C420: 5200 | D420: 2 | E420: 05200-X | F420: 信息技术（小学版 第4册）――LOGO（彩色版） | G420: 教育研究会 | H420: 12.80 | I420: 37500 | J420: 20
A421: =ROW()-2 -> 419 | B421: TP | C421: 5311 | D421: 3 | E421: 05311-1 | F421: 信息技术（中学版 第1册）（黑白版） | G421: 教育研究会 | H421: 9.8 | I421: 37408 | J421: 22
A422: =ROW()-2 -> 420 | B422: TP | C422: 3975 | D422: 1 | E422: 03975-5 | F422: 信息技术（中学版 第1册）（彩色版） | G422: 教育研究会 | H422: 14.8 | I422: 37408 | J422: 20
A423: =ROW()-2 -> 421 | B423: TP | C423: 5312 | D423: 3 | E423: 05312-X | F423: 信息技术（中学版 第2册）（黑白版） | G423: 教育研究会 | H423: 9.8 | I423: 37408 | J423: 22
A424: =ROW()-2 -> 422 | B424: TP | C424: 4024 | D424: 2 | E424: 04024-9 | F424: 信息技术（中学版 第2册）（彩色版） | G424: 教育研究会 | H424: 14.8 | I424: 37408 | J424: 20
A425: =ROW()-2 -> 423 | B425: TP | C425: 4633 | D425: 1 | E425: 04633-6 | F425: 信息技术（中学版第1册、第2册）教学参考书 | G425: 教育研究会 | H425: 12 | I425: 37408 | J425: 23
A426: =ROW()-2 -> 424 | B426: TP | C426: 5201 | D426: 1 | E426: 05201-8 | F426: 信息技术（中学版 第3册）――综合实践（黑白版） | G426: 教育研究会 | H426: 9.80 | I426: 37408 | J426: 25
A427: =ROW()-2 -> 425 | B427: TP | C427: 5202 | D427: 1 | E427: 05202-6 | F427: 信息技术（中学版 第3册）――综合实践（彩色版） | G427: 教育研究会 | H427: 12.80 | I427: 37469 | J427: 20
A428: =ROW()-2 -> 426 | B428: TP | C428: 5203 | D428: 1 | E428: 05203-4 | F428: 信息技术（中学版 第4册）――QBASIC（黑白版） | G428: 教育研究会 | H428: 9.80 | I428: 37288 | J428: 25
A429: =ROW()-2 -> 427 | B429: TP | C429: 5204 | D429: 1 | E429: 05204-2 | F429: 信息技术（中学版 第4册）――QBASIC（彩色版） | G429: 教育研究会 | H429: 12.80 | I429: 37337 | J429: 20
F430: （注：清华大学出版社网站免费提供教学资源，浏览方法见教材前言）
F431: 中小学信息技术教材（谭浩强教授 主编）
A432: （全日制普通高级中学教科书，经全国中小学教材审定委员会2002年审查通过）
A433: =ROW()-2 -> 431 | B433: TP | C433: 3993 | D433: 1 | E433: 03993-3 | F433: 高中信息技术（第一册） 第2版 | G433: 谭浩强 | H433: 17.9 | I433: 37500 | J433: 11
A434: =ROW()-2 -> 432 | B434: TP | C434: 4279 | D434: 1 | E434: 04279-9 | F434: 高中信息技术（第二册） 第2版 | G434: 谭浩强 | H434: 18.9 | I434: 37530 | J434: 10
A435: =ROW()-2 -> 433 | B435: TP | C435: 4441 | D435: 1 | E435: 04441-4 | F435: 初中信息技术（第一册） 第2版 | G435: 谭浩强 | H435: 12.9 | I435: 37469 | J435: 17
A436: =ROW()-2 -> 434 | B436: TP | C436: 4442 | D436: 2 | E436: 04442-2 | F436: 初中信息技术（第二册） 第2版 | G436: 谭浩强 | H436: 11.9 | I436: 37500 | J436: 17
A437: =ROW()-2 -> 435 | B437: TP | C437: 4753 | D437: 1 | E437: 04753-7 | F437: 小学信息技术（第一册）（黑白版）含光盘 | G437: 谭浩强 | H437: 10.5 | I437: 37377 | J437: 25
A438: =ROW()-2 -> 436 | B438: TP | C438: 4754 | D438: 1 | E438: 04754-5 | F438: 小学信息技术（第二册）（黑白版） | G438: 谭浩强 | H438: 5.5 | I438: 37377 | J438: 35
A439: =ROW()-2 -> 437 | B439: TP | C439: 4751 | D439: 1 | E439: 04751-0 | F439: 小学信息技术（第一册）（彩色版）含光盘 | G439: 谭浩强 | H439: 14 | I439: 37377 | J439: 24
A440: =ROW()-2 -> 438 | B440: TP | C440: 4752 | D440: 1 | E440: 04752-9 | F440: 小学信息技术（第二册）（彩色版） | G440: 谭浩强 | H440: 8.5 | I440: 37377 | J440: 30
F441: 中小学主题信息技术课实验教材
F442: （经吉林省中小学教材审定委员会审定）
A443: =ROW()-2 -> 441 | B443: G- | C443: 4250 | D443: 1 | E443: 04250-0 | F443: 高中主题信息技术课本 | G443: 教材编写组 | H443: 10 | I443: 37500 | J443: 16
A444: =ROW()-2 -> 442 | B444: G- | C444: 4248 | D444: 1 | E444: 04248-9 | F444: 小学主题信息技术课本 | G444: 教材编写组 | H444: 10 | I444: 37469 | J444: 15
A445: =ROW()-2 -> 443 | B445: G- | C445: 4249 | D445: 1 | E445: 04249-7 | F445: 初中主题信息技术课本 | G445: 教材编写组 | H445: 10 | I445: 37469 | J445: 14
F446: 中小学信息技术课实验教材
F447: （杨芙清院士主编）
A448: =ROW()-2 -> 446 | B448: G- | C448: 4047 | D448: 3 | E448: 04047-8 | F448: 小学信息技术课实验教材 入门篇 | G448: 杨芙清 | H448: 12 | I448: 37500 | J448: 18
A449: =ROW()-2 -> 447 | B449: G- | C449: 4047 | D449: 1 | E449: 04047-8 | F449: 小学信息技术课实验教材 基础篇 | G449: 杨芙清 | H449: 12.00 | I449: 37469 | J449: 20
A450: =ROW()-2 -> 448 | B450: G- | C450: 4047 | D450: 2 | E450: 04047-8 | F450: 小学信息技术课实验教材 提高篇 | G450: 杨芙清 | H450: 12.00 | I450: 37469 | J450: 17
A451: =ROW()-2 -> 449 | B451: G- | C451: 4103 | D451: 2 | E451: 04103-2 | F451: 初中信息技术课实验教材 初一分册 | G451: 杨芙清 | H451: 12 | I451: 37530 | J451: 20
A452: =ROW()-2 -> 450 | B452: G- | C452: 4103 | D452: 1 | E452: 04103-2 | F452: 初中信息技术课实验教材 初二分册 | G452: 杨芙清 | H452: 12 | I452: 37500 | J452: 20
A453: =ROW()-2 -> 451 | B453: G- | C453: 4104 | D453: 1 | E453: 04104-0 | F453: 高中信息技术课实验教材 高一分册 | G453: 杨芙清 | H453: 16 | I453: 37469 | J453: 12
A454: =ROW()-2 -> 452 | B454: G- | C454: 4104 | D454: 2 | E454: 04104-0 | F454: 高中信息技术 课实验教材高二分册 | G454: 杨芙清 | H454: 16 | I454: 37135 | J454: 14
F455: 中学信息学教材
A456: =ROW()-2 -> 454 | B456: TP | C456: 3604 | D456: 1 | E456: 03604-7 | F456: 中学信息技术(计算机)教程（高中 上） | G456: 吴文虎等 | H456: 16 | I456: 37500 | J456: 12
A457: =ROW()-2 -> 455 | B457: TP | C457: 3607 | D457: 1 | E457: 03607-1 | F457: 中学信息技术(计算机)教程（高中 下） | G457: 吴文虎等 | H457: 16.5 | I457: 37500 | J457: 13
A458: =ROW()-2 -> 456 | B458: TP | C458: 3302 | D458: 2 | E458: 03302-1 | F458: 中学计算机教学法 | G458: 薛维明 | H458: 13.50 | I458: 37012 | J458: 22
F459: 中学信息技术创新丛书
A460: =ROW()-2 -> 458 | B460: TP | C460: 5387 | D460: 1 | E460: 05387-1 | F460: 从数学题解到程序设计 | G460: 薛维明 | H460: 18.00 | I460: 37377 | J460: 12
A461: =ROW()-2 -> 459 | B461: TP | C461: 5138 | D461: 1 | E461: 05138-0 | F461: Powerpoint 演示文稿设计能手 | G461: 薛维明 | H461: 12.00 | I461: 37377 | J461: 18
A462: =ROW()-2 -> 460 | B462: TP | C462: 5315 | D462: 1 | E462: 05315-4 | F462: Word & Excel 文字表格处理小能手 | G462: 薛维明 | H462: 15.00 | I462: 37377 | J462: 12
F463: 中小学信息技术课程范例教与学系列
F464: (全国中小学计算机教育研究中心组编 吴文虎主审)
F465: 小学信息技术课程范例教与学 76元/套
A466: =ROW()-2 -> 464 | B466: TP | C466: 4050 | D466: 1 | E466: 04050-8 | F466: 文字处理小博士（上） | G466: 教研中心 | H466: 10.00 | I466: 36951 | J466: 25
A467: =ROW()-2 -> 465 | B467: TP | C467: 4050 | D467: 3 | E467: 04050-8 | F467: 文字处理小博士（下） | G467: 教研中心 | H467: 12.00 | I467: 36800 | J467: 25
A468: =ROW()-2 -> 466 | B468: TP | C468: 4050 | D468: 2 | E468: 04050-8 | F468: 电脑美术小博士（上）（四色彩印） | G468: 教研中心 | H468: 14.00 | I468: 36982 | J468: 25
A469: =ROW()-2 -> 467 | B469: TP | C469: 4050 | D469: 5 | E469: 04050-8 | F469: 电脑美术小博士（下）（四色彩印） | G469: 教研中心 | H469: 16.00 | I469: 36831 | J469: 20
A470: =ROW()-2 -> 468 | B470: TP | C470: 4050 | D470: 4 | E470: 04050-8 | F470: 网上冲浪小博士 | G470: 教研中心 | H470: 12.00 | I470: 36831 | J470: 20
A471: =ROW()-2 -> 469 | B471: TP | C471: 4050 | D471: 6 | E471: 04050-8 | F471: 多媒体制作小博士 | G471: 教研中心 | H471: 12.00 | I471: 37469 | J471: 20
F472: 初中信息技术课程范例教与学 76元/套
A473: =ROW()-2 -> 471 | B473: TP | C473: 4138 | D473: 5 | E473: 04138-5 | F473: 多媒体制作小 博士 | G473: 教研中心 | H473: 12.00 | I473: 37073 | J473: 20
A474: =ROW()-2 -> 472 | B474: TP | C474: 4138 | D474: 3 | E474: 04138-5 | F474: 电脑美术小博士（四色彩印） | G474: 教研中心 | H474: 16.00 | I474: 37043 | J474: 20
A475: =ROW()-2 -> 473 | B475: TP | C475: 4138 | D475: 4 | E475: 04138-5 | F475: 数据处理小博士 | G475: 教研中心 | H475: 12.00 | I475: 37044 | J475: 20
A476: =ROW()-2 -> 474 | B476: TP | C476: 4138 | D476: 1 | E476: 04138-5 | F476: 文字处理小博士 | G476: 教研 中心 | H476: 12.00 | I476: 36923 | J476: 20
A477: =ROW()-2 -> 475 | B477: TP | C477: 4138 | D477: 2 | E477: 04138-5 | F477: 网上冲浪小博士 | G477: 教研 中心 | H477: 12.00 | I477: 36951 | J477: 20
A478: =ROW()-2 -> 476 | B478: TP | C478: 4138 | D478: 6 | E478: 04138-5 | F478: 视窗操作小博士 | G478: 教研 中心 | H478: 12.00 | I478: 37104 | J478: 21
F479: 高中信息技术课程范例教与学 72元/套
A480: =ROW()-2 -> 478 | B480: TP | C480: 4155 | D480: 1 | E480: 04155-5 | F480: 数据处理小博士 | H480: 12.00 | I480: 36923 | J480: 20
A481: =ROW()-2 -> 479 | B481: TP | C481: 4155 | D481: 2 | E481: 04155-5 | F481: 网上冲浪小博士 | G481: 教研 中心 | H481: 12.00 | I481: 37073 | J481: 20
A482: =ROW()-2 -> 480 | B482: TP | C482: 4155 | D482: 3 | E482: 04155-5 | F482: 多媒体制作小博士 | G482: 教研中心 | H482: 12.00 | I482: 37135 | J482: 20
A483: =ROW()-2 -> 481 | B483: TP | C483: 4155 | D483: 4 | E483: 04155-5 | F483: 程序设计小博士（Visual Basic） | G483: 教研中心 | H483: 12.00 | I483: 37135 | J483: 20
A484: =ROW()-2 -> 482 | B484: TP | C484: 4155 | D484: 5 | E484: 04155-5 | F484: 文字处理小博士 | G484: 教研 中心 | H484: 12.00 | I484: 37165 | J484: 20
A485: =ROW()-2 -> 483 | B485: TP | C485: 4155 | D485: 6 | E485: 04155-5 | F485: 视窗操作小博士 | G485: 教研 中心 | H485: 12.00 | I485: 37196 | J485: 20
F486: 中小学生电脑制作辅导丛书
A487: =ROW()-2 -> 485 | B487: P- | C487: 4311 | D487: 1 | E487: 7900643117 | F487: 电脑绘画－－边学边做 （配光盘） | G487: 方其桂等 | H487: 19 | I487: 37438 | J487: 12
A488: =ROW()-2 -> 486 | B488: P- | C488: 4304 | D488: 1 | E488: 7900643044 | F488: 网页制作－－边学边做 （配光盘） | G488: 方其桂等 | H488: 21 | I488: 37469 | J488: 10
A489: =ROW()-2 -> 487 | B489: P- | C489: 4302 | D489: 1 | E489: 7900643028 | F489: 电子报刊－－边学边做 （配光盘） | G489: 方其桂等 | H489: 20 | I489: 37469 | J489: 10
A490: =ROW()-2 -> 488 | B490: P- | C490: 4303 | D490: 1 | E490: 7900643036 | F490: 程序设计－－边学边做 （配光盘） | G490: 方其桂等 | H490: 24 | I490: 37469 | J490: 10
A491: =ROW()-2 -> 489 | B491: P- | C491: 4301 | D491: 1 | E491: 790064301X | F491: 电脑动画－－边学边做 （配光盘） | G491: 方其桂等 | H491: 27 | I491: 37500 | J491: 8
F492: 信息学奥林匹克竞赛指导丛书
A493: =ROW()-2 -> 491 | B493: TP | C493: 4055 | D493: 1 | E493: 04055-9 | F493: 信息学奥林匹克竞赛指导 ――1997－1998竞赛试题解析 | G493: 吴文虎等 | H493: 26 | I493: 36923 | J493: 8
A494: =ROW()-2 -> 492 | B494: TP | C494: 2238 | D494: 1 | E494: 02238-0 | F494: 信息学奥林匹克竞赛指导 ――1994－1995竞赛试题解析 | G494: 吴文虎等 | H494: 18 | I494: 37469 | J494: 11
A495: =ROW()-2 -> 493 | B495: TP | C495: 2203 | D495: 1 | E495: 02203-8 | F495: 组合数学的算法与程序设计(PASCAL版) | G495: 吴文虎等 | H495: 19 | I495: 37469 | J495: 15
A496: =ROW()-2 -> 494 | B496: TP | C496: 2237 | D496: 1 | E496: 02237-2 | F496: 信息学奥林匹克竞赛指导 ――图论的算法与程序设计(PASCAL版) | G496: 吴文虎等 | H496: 16 | I496: 37469 | J496: 16
F497: 北京景山学校信息技术系列教材
A498: =ROW()-2 -> 496 | B498: TP | C498: 3944 | D498: 1 | E498: 03944-5 | F498: 计算机图文处理与上机指导 | G498: 翟冬敏 | H498: 19.50 | I498: 36831 | J498: 15
F499: 全国中小学教师继续教育教材
A500: =ROW()-2 -> 498 | B500: TP | C500: 4563 | D500: 1 | E500: 04563-1 | F500: 中小学教师继续教育信息技术培训实用教材 | G500: 吴文虎 | H500: 14.50 | I500: 37226 | J500: 17
A501: =ROW()-2 -> 499 | B501: P- | C501: 3592 | D501: 1 | E501: 7900635920 | F501: 用几何画板教平面解析几何（配光盘） | G501: 陶维林 | H501: 29.00 | I501: 37500 | J501: 12
A502: =ROW()-2 -> 500 | B502: P- | C502: 3757 | D502: 1 | E502: 7900637575 | F502: 用几何画板教物理（配光盘） | G502: 杨树崤主编 | H502: 32.00 | I502: 37377 | J502: 10
A503: =ROW()-2 -> 501 | B503: P- | C503: 3162 | D503: 1 | E503: 7900631623 | F503: 几何画板实用范例教程 （配光盘） | G503: 陶维林 | H503: 32.50 | I503: 37350 | J503: 11
A504: =ROW()-2 -> 502 | B504: TP | C504: 5310 | D504: 1 | E504: 05310-3 | F504: 几何画板简明教程 | G504: 陶维林 | H504: 10.00 | I504: 37438 | J504: 25
F505: 中小学课程网络资源索引
A506: =ROW()-2 -> 504 | B506: TP | C506: 1171 | D506: 1 | E506: 01171-0 | F506: 语文英语分册 | G506: 乌美娜 | H506: 9.00 | I506: 37356 | J506: 30
A507: =ROW()-2 -> 505 | B507: TP | C507: 1269 | D507: 1 | E507: 01269-5 | F507: 信息技术分册 | G507: 乌美娜 | H507: 7.00 | I507: 37356 | J507: 45
A508: =ROW()-2 -> 506 | B508: TP | C508: 1148 | D508: 1 | E508: 01148-6 | F508: 历史地理分册 | G508: 乌美娜 | H508: 13.00 | I508: 37356 | J508: 22
A509: =ROW()-2 -> 507 | B509: TP | C509: 1214 | D509: 1 | E509: 01214-8 | F509: 物理化学分册 | G509: 乌美娜 | H509: 13.00 | I509: 37356 | J509: 22
A510: =ROW()-2 -> 508 | B510: TP | C510: 1156 | D510: 1 | E510: 01156-7 | F510: 数学分册 | G510: 乌美娜 | H510: 8.00 | I510: 37356 | J510: 40
F511: “计算机科学技术创新”科普教育丛书
A512: =ROW()-2 -> 510 | B512: TP | C512: 4410 | D512: 1 | E512: 04410-4 | F512: 网络啊，网络！ | G512: 俞嘉惠 | H512: 18.00 | I512: 37104 | J512: 12
A513: =ROW()-2 -> 511 | B513: TP | C513: 4386 | D513: 1 | E513: 04386-8 | F513: 谁使唤谁――漫谈人机界面 | G513: 刘晋 等 | H513: 14.80 | I513: 37135 | J513: 15
A514: =ROW()-2 -> 512 | B514: TP | C514: 4817 | D514: 1 | E514: 04817-7 | F514: 漫谈电脑“管家”――操作系统的发展与创新 | G514: 袁 捷 | H514: 19.00 | I514: 37196 | J514: 13
A515: =ROW()-2 -> 513 | B515: TP | C515: 4538 | D515: 1 | E515: 04538-0 | F515: 计算机的灵魂程序 | G515: 缪淮扣 | H515: 15.00 | I515: 37196 | J515: 14
A516: =ROW()-2 -> 514 | B516: TP | C516: 4683 | D516: 1 | E516: 04683-2 | F516: 撩开计算机的面纱 | G516: 张世正等 | H516: 9.80 | I516: 37165 | J516: 20
A517: =ROW()-2 -> 515 | B517: TP | C517: 4684 | D517: 1 | E517: 04684-0 | F517: 生活于数字化之中 | G517: 周卓伦 | H517: 11.00 | I517: 37165 | J517: 21
A518: =ROW()-2 -> 516 | B518: TP | C518: 4525 | D518: 1 | E518: 04525-9 | F518: 计算机科学技术创新传奇 | G518: 陈海洋等 | H518: 14.00 | I518: 37135 | J518: 18
A519: =ROW()-2 -> 517 | B519: TP | C519: 4586 | D519: 1 | E519: 04586-0 | F519: 信息王国中的代码 | G519: 董百年等 | H519: 19.90 | I519: 37530 | J519: 12
F520: 计算机与信息科学十万个为什么（普及版）
A521: =ROW()-2 -> 519 | B521: TP | C521: 4646 | D521: 1 | E521: 04646-8 | F521: 从烽火台到因特网 | G521: 俞嘉惠 | H521: 21.00 | I521: 37196 | J521: 10
A522: =ROW()-2 -> 520 | B522: TP | C522: 4822 | D522: 1 | E522: 04822-3 | F522: 神奇的计算机 | G522: 郁宝忠等 | H522: 18.00 | I522: 37196 | J522: 12
A523: =ROW()-2 -> 521 | B523: TP | C523: 4821 | D523: 1 | E523: 04821-5 | F523: 奥妙的多媒体世界 | G523: 朱亦梅 | H523: 23.00 | I523: 37257 | J523: 10
A524: =ROW()-2 -> 522 | B524: TP | C524: 5286 | D524: 1 | E524: 05286-7 | F524: 高超的计算机辅助技术 | G524: 李启炎等 | H524: 16.00 | I524: 37347 | J524: 12
F525: 新编计算机与信息科学十万个为什么
A526: =ROW()-2 -> 524 | B526: TP | C526: 3931 | D526: 1 | E526: 03931-3 | F526: 新编计算机与信息科学十万个为什么（套） | G526: 丛书编委会 | H526: 200.00 | I526: 36831 | J526: 1
F527: 青少年科学教育丛书――信息科学与技术系列（李衍达主编）
A528: =ROW()-2 -> 526 | B528: TP | C528: 4354 | D528: 1 | E528: 04354-X | F528: 信息时代我们将怎样生活 | G528: 阎平凡 | H528: 10.00 | I528: 37073 | J528: 27
A529: =ROW()-2 -> 527 | B529: TP | C529: 4082 | D529: 1 | E529: 04082-6 | F529: 人类智慧与人工智能 | G529: 林尧瑞等 | H529: 10.00 | I529: 36951 | J529: 25
A530: =ROW()-2 -> 528 | B530: TP | C530: 3855 | D530: 1 | E530: 03855-4 | F530: 电话百年变奏曲 | G530: 乐正友 | H530: 10.00 | I530: 36647 | J530: 30
A531: =ROW()-2 -> 529 | B531: TP | C531: 3782 | D531: 2 | E531: 03782-5 | F531: 漫谈我们身边的自动化 | G531: 王家桢 | H531: 10.00 | I531: 36739 | J531: 25
A532: =ROW()-2 -> 530 | B532: TP | C532: 3994 | D532: 1 | E532: 03994-1 | F532: 走进网络世界 | G532: 张尧学等 | H532: 10.00 | I532: 36739 | J532: 25
A533: =ROW()-2 -> 531 | B533: TP | C533: 5210 | D533: 1 | E533: 05210-7 | F533: 精彩的多媒体世界 | G533: 钟玉琢等 | H533: 10.00 | I533: 37404 | J533: 25
F534: 3.考试与认证
F535: 全国计算机应用技术证书考试 (NIT)用书
A536: =ROW()-2 -> 534 | B536: TP | C536: 3413 | D536: 2 | E536: 03413-3 | F536: 文字处理(WPS 97) 教程 | G536: 教育部考试中心 | H536: 19.00 | I536: 36739 | J536: 14
A537: =ROW()-2 -> 535 | B537: TP | C537: 3411 | D537: 4 | E537: 03411-7 | F537: 文字处理(Word 97)教程 | G537: 教育部考试中心 | H537: 20.00 | I537: 37500 | J537: 12
A538: =ROW()-2 -> 536 | B538: TP | C538: 2181 | D538: 1 | E538: 02181-3 | F538: 电子表格（Excel 97）教程 | G538: 教育部考试中心 | H538: 22.50 | I538: 37438 | J538: 12
A539: =ROW()-2 -> 537 | B539: TP | C539: 2146 | D539: 1 | E539: 02146-5 | F539: 程序设计（C 语言）教程 | G539: 教育部考试中心 | H539: 19.00 | I539: 37396 | J539: 15
A540: =ROW()-2 -> 538 | B540: TP | C540: 3853 | D540: 1 | E540: 03853-8 | F540: 程序设计（QBASIC语言）教程 | G540: 教育部考试中心 | H540: 21.50 | I540: 37135 | J540: 12
A541: =ROW()-2 -> 539 | B541: TP | C541: 3412 | D541: 4 | E541: 03412-5 | F541: 因特网 (Internet) 教程 | G541: 教育部考试中心 | H541: 17.00 | I541: 37377 | J541: 15
A542: =ROW()-2 -> 540 | B542: TP | C542: 3412 | D542: 3 | E542: 03412-5 | F542: 因特网 (Internet) 教程（配光盘） | G542: 教育部考试中心 | H542: 32.00 | I542: 37500 | J542: 15
A543: =ROW()-2 -> 541 | B543: TP | C543: 4054 | D543: 1 | E543: 04054-0 | F543: 局域网（Windows 2000 Server) 教程 | G543: 教育部考试中心 | H543: 19.50 | I543: 37500 | J543: 14
A544: =ROW()-2 -> 542 | B544: TP | C544: 3466 | D544: 4 | E544: 03466-4 | F544: 计算机操作基础 (Windows 95环境)教程 | G544: 教育部考试中心 | H544: 14.50 | I544: 37438 | J544: 16
A545: =ROW()-2 -> 543 | B545: TP | C545: 3466 | D545: 3 | E545: 03466-4 | F545: 计算机操作基础 (Windows 95环境)教程（配光盘） | G545: 教育部考试中心 | H545: 29.50 | I545: 37500 | J545: 16
A546: =ROW()-2 -> 544 | B546: TP | C546: 3414 | D546: 2 | E546: 03414-1 | F546: 会计电算化教程 | G546: 教育部考试中心 | H546: 15.00 | I546: 37104 | J546: 20
A547: =ROW()-2 -> 545 | B547: TP | C547: 5247 | D547: 1 | E547: 05247-6 | F547: 会计电算化教程（第二版） | G547: 教育部考试中心 | H547: 21.00 | I547: 37469 | J547: 13
A548: =ROW()-2 -> 546 | B548: TP | C548: 3831 | D548: 1 | E548: 03831-7 | F548: 计算机绘图（AutoCAD R14中文版）教程 | G548: 教育部考试中心 | H548: 19.80 | I548: 37408 | J548: 12
A549: =ROW()-2 -> 547 | B549: TP | C549: 4269 | D549: 1 | E549: 04269-1 | F549: 计算机绘图（CAXA 电子图板2000）教程 | G549: 教育部考试中心 | H549: 19.00 | I549: 37321 | J549: 12
A550: =ROW()-2 -> 548 | B550: TP | C550: 4824 | D550: 1 | E550: 04824-X | F550: 图象处理（Photoshop 5.0 中文版）教程 | G550: 教育部考试中心 | H550: 33.00 | I550: 37226 | J550: 7
A551: =ROW()-2 -> 549 | B551: TP | C551: 3870 | D551: 1 | E551: 03870-8 | F551: 多媒体演示文稿（PowerPoint 97) 教程 | G551: 教育部考试中心 | H551: 15.00 | I551: 37469 | J551: 16
A552: =ROW()-2 -> 550 | B552: TP | C552: 4109 | D552: 1 | E552: 04109-1 | F552: 数据库（Access 2000 )教程（配软盘） | G552: 教育部考试中心 | H552: 36.00 | I552: 37469 | J552: 8
A553: =ROW()-2 -> 551 | B553: TP | C553: 3475 | D553: 3 | E553: 03475-3 | F553: 数据库（FoxPro for Windows)教程 | G553: 教育部考试中心 | H553: 19.00 | I553: 37469 | J553: 14
A554: =ROW()-2 -> 552 | B554: TP | C554: 4099 | D554: 1 | E554: 04099-0 | F554: 局域网（NetWare 5) 教程 | G554: 教育部考试中心 | H554: 17.50 | I554: 36892 | J554: 15
A555: =ROW()-2 -> 553 | B555: P- | C555: 4160 | D555: 1 | E555: 7900641602 | F555: Linux操作基础及桌面应用（红旗Linux桌面环境）教程（配光盘） | G555: 教育部考试中心 | H555: 20.00 | I555: 37354 | J555: 15
F556: 全国高等教育自学考试自学指导丛书
F557: 计算机信息管理专业专科
A558: =ROW()-2 -> 556 | B558: TP | C558: 0660 | D558: 1 | E558: 00660-1 | F558: 计算机原理自学考试指导 | G558: 教育中心 | H558: 16.00 | I558: 37196 | J558: 15
A559: =ROW()-2 -> 557 | B559: TP | C559: 5568 | D559: 1 | E559: 05568-1 | F559: 数据库原理自学考试指导 | G559: 教育中心 | H559: 18.50 | I559: 37408 | J559: 15
A560: =ROW()-2 -> 558 | B560: TP 5567 1 | E560: 05567-1 | F560: 高级语言程序设计自学考试指导 | G560: 教育中心 | H560: 26.00 | I560: 37408 | J560: 10
A561: =ROW()-2 -> 559 | B561: TP | C561: 1668 | D561: 2 | E561: 01668-2 | F561: 计算机应用技术自学考试指导 | G561: 教育中心 | H561: 15.00 | I561: 37327 | J561: 18
A562: =ROW()-2 -> 560 | B562: TP | C562: 0737 | D562: 1 | E562: 00737-3 | F562: 办公自动化原理及应用自学考试指导 | G562: 教育中心 | H562: 17.00 | I562: 37335 | J562: 18
A563: =ROW()-2 -> 561 | B563: TP | C563: 4258 | D563: 2 | E563: 04258-6 | F563: 数据库及其应用自学考试指导 | G563: 张国鸣等 | H563: 16.00 | I563: 37408 | J563: 16
A564: =ROW()-2 -> 562 | B564: TP | C564: 1393 | D564: 2 | E564: 01393-4 | F564: 管理信息系统自学考试指导 | G564: 盛定宇等 | H564: 15.00 | I564: 37257 | J564: 18
A565: =ROW()-2 -> 563 | B565: TP | C565: 4863 | D565: 1 | E565: 04863-0 | F565: 计算机信息管理专业（专科）实践环节指导 | G565: 教育中心 | H565: 20.00 | I565: 37377 | J565: 14
F566: 计算机信息管理专业本科
A567: =ROW()-2 -> 565 | B567: TP | C567: 3568 | D567: 1 | E567: 03568-7 | F567: 运筹学基础自学考试指导 | G567: 教育中心 | H567: 15.00 | I567: 37012 | J567: 17
A568: =ROW()-2 -> 566 | B568: TP | C568: 4094 | D568: 1 | E568: 04094-X | F568: 操作系统自学考试指导 | G568: 教育中心 | H568: 16 | I568: 36982 | J568: 18
A569: =ROW()-2 -> 567 | B569: TP | C569: 4260 | D569: 1 | E569: 04260-8 | F569: 数据结构自学考试指导 | G569: 丁宝康 | H569: 23 | I569: 37012 | J569: 12
A570: =ROW()-2 -> 568 | B570: TP | C570: 1382 | D570: 2 | E570: 01382-9 | F570: 软件开发工具自学考试指导 | G570: 方美琪等 | H570: 15.00 | I570: 37012 | J570: 18
A571: =ROW()-2 -> 569 | B571: TP | C571: 4418 | D571: 1 | E571: 04418-X | F571: 信息系统开发自学考试指导 | G571: 王守茂 | H571: 25 | I571: 37012 | J571: 12
A572: =ROW()-2 -> 570 | B572: TP | C572: 4704 | D572: 1 | E572: 04704-9 | F572: 计算机网络技术自学考试指导 | G572: 王兵 等 | H572: 21.00 | I572: 37226 | J572: 13
A573: =ROW()-2 -> 571 | B573: TP | C573: 5194 | D573: 1 | E573: 05194-1 | F573: 信息资源管理自学考试指导 | G573: 方锦城 | H573: 10.00 | I573: 37327 | J573: 25
A574: =ROW()-2 -> 572 | B574: TP | C574: 5240 | D574: 1 | E574: 05240-9 | F574: 组织与管理概论自学考试指导 | G574: 陈坚 等 | H574: 15.00 | I574: 37288 | J574: 20
A575: =ROW()-2 -> 573 | B575: TP | C575: 5252 | D575: 1 | E575: 05252-2 | F575: 数据通信原理自学考试指导 | G575: 倪维贞等 | H575: 21.00 | I575: 37327 | J575: 12
A576: =ROW()-2 -> 574 | B576: TP | C576: 4272 | D576: 1 | E576: 04272-1 | F576: 计算机信息管理专业（本科）实践环节指导 | G576: 教育中心 | H576: 26.00 | I576: 37165 | J576: 12
A577: =ROW()-2 -> 575 | B577: TP | C577: 4859 | D577: 1 | E577: 04859-2 | F577: 计算机信息管理专业（本科）毕业设计案例 摘选 | G577: 侯炳辉等 | H577: 23.00 | I577: 37196 | J577: 12
F578: 计算机网络专业本科
A579: =ROW()-2 -> 577 | B579: TP | C579: 1477 | D579: 2 | E579: 01477-9 | F579: 数据库技术自学考试指导 | G579: 丁宝康等 | H579: 19.00 | I579: 37328 | J579: 14
A580: =ROW()-2 -> 578 | B580: TP | C580: 3925 | D580: 1 | E580: 03925-9 | F580: 计算机网络基本原理自学考试指导 | G580: 教育中心 | H580: 22.00 | I580: 37043 | J580: 12
A581: =ROW()-2 -> 579 | B581: TP | C581: 0688 | D581: 1 | E581: 00688-1 | F581: 网络操作系统自学考试指导 | G581: 教育中心 | H581: 20.00 | I581: 37104 | J581: 13
A582: =ROW()-2 -> 580 | B582: TP | C582: 4134 | D582: 1 | E582: 04134-2 | F582: 互联网及其应用自学考试指导 | G582: 教育中心 | H582: 25.00 | I582: 36982 | J582: 12
A583: =ROW()-2 -> 581 | B583: TP | C583: 4181 | D583: 1 | E583: 04181-4 | F583: 局域网技术与组网工程自学考试指导 | G583: 张公忠 | H583: 22.00 | I583: 36982 | J583: 12
A584: =ROW()-2 -> 582 | B584: TP | C584: 4181 | D584: 2 | E584: 04181-4 | F584: 局域网技术与组网工程自学考试指导（修订） | G584: 张公忠 | H584: 27.00 | I584: 37469 | J584: 10
F585: 模拟试题
A586: =ROW()-2 -> 584 | B586: G- | C586: 3937 | D586: 1 | E586: 03937-2 | F586: 法律基础与思想道德修养模拟试题 | G586: 李卫红等 | H586: 12.8 | I586: 36708 | J586: 28
A587: =ROW()-2 -> 585 | B587: G- | C587: 3939 | D587: 1 | E587: 03939-9 | F587: 毛泽东思想概论模拟试题 | G587: 陈道华等 | H587: 16.00 | I587: 36739 | J587: 25
A588: =ROW()-2 -> 586 | B588: G- | C588: 3938 | D588: 1 | E588: 03938-0 | F588: 邓小平理论概论模拟试题 | G588: 闫志民等 | H588: 16 | I588: 36739 | J588: 15
A589: =ROW()-2 -> 587 | B589: G- | C589: 3935 | D589: 1 | E589: 03935-6 | F589: 马克思主义哲学原理模拟试题 | G589: 李卫红 | H589: 16.00 | I589: 36708 | J589: 22
A590: =ROW()-2 -> 588 | B590: G- | C590: 3936 | D590: 1 | E590: 03936-4 | F590: 马克思主义政治经济学原理模拟试题 | G590: 李红薇 | H590: 18 | I590: 36739 | J590: 15
F591: 高等教育自学考试计算机及应用专业（专科）自学辅导丛书
A592: =ROW()-2 -> 590 | B592: TP | C592: 5598 | D592: 1 | E592: 05598-X | F592: 数据结构导论自学考试指导 | G592: 徐孝凯 | H592: 22.00 | I592: 37408 | J592: 13
A593: =ROW()-2 -> 591 | B593: TP | C593: 5771 | D593: 1 | E593: 05771-0 | F593: 微型计算机及其接口技术自学考试指导 | G593: 王亚明 | H593: 30.00 | I593: 37469 | J593: 10
A594: =ROW()-2 -> 592 | B594: TP | C594: 5662 | D594: 1 | E594: 05662-5 | F594: 汇编语言程序设计自学考试指导 | G594: 丁凤刚 | H594: 18.00 | I594: 37469 | J594: 15
A595: =ROW()-2 -> 593 | B595: TP | C595: 5792 | D595: 1 | E595: 05792-3 | F595: 计算机组成原理自学考试指导 | G595: 顾一禾 | H595: 24.00 | I595: 37500 | J595: 13
A596: =ROW()-2 -> 594 | B596: TP | C596: 5871 | D596: 1 | E596: 05871-7 | F596: 计算机网络与通信自学辅导 | G596: 程向前等 | H596: 21.00 | I596: 37530 | J596: 13
F597: 计算机及应用专业（独立本科段）自学辅导丛书
A598: =ROW()-2 -> 596 | B598: TP | C598: 4668 | D598: 1 | E598: 04668-9 | F598: 面向对象程序设计自学辅导（配软盘） | G598: 刘振安 | H598: 25.00 | I598: 37104 | J598: 12
A599: =ROW()-2 -> 597 | B599: TP | C599: 5664 | D599: 1 | E599: 05664-1 | F599: 数据库原理自学辅导 | G599: 王卫平 | H599: 13.00 | I599: 37530 | J599: 20

A1: 李著

A1: 印 等

A1: TM

A1: Data Structure & Program Design in C (数据结构与程序设计C语言描述 第2版)

A1: 教研中心