F1: 多媒体技术及应用
A2: =ROW()-2 -> 2546 | B2: TP | C2: 3319 | D2: 4 | E2: 03319-6 | F2: 多媒体计算机技术原理 | G2: 马华东 | H2: 18.00 | I2: 37469 | J2: 12
A3: =ROW()-2 -> 2547 | B3: P- | C3: 3567 | D3: 1 | E3: 790063567X | F3: 多媒体课件设计与实例剖析 | G3: 孙江宏等 | H3: 38.00 | I3: 37257 | J3: 9
A4: =ROW()-2 -> 2548 | B4: TP | C4: 1150 | D4: 1 | E4: 01150-8 | F4: 多媒体电脑升级与改装 | G4: 葛宁轩 | H4: 28.00 | I4: 36739 | J4: 10
A5: =ROW()-2 -> 2549 | B5: P- | C5: 3074 | D5: 1 | E5: 7900630740 | F5: 多媒体课件制作实用教程（配光盘） | G5: 刘振华等 | H5: 37.00 | I5: 37408 | J5: 8
A6: =ROW()-2 -> 2550 | B6: TP | C6: 1530 | D6: 3 | E6: 01530-9 | F6: 多媒体电脑选购与组装 | G6: 葛宁轩 | H6: 28.00 | I6: 36800 | J6: 11
A7: =ROW()-2 -> 2551 | B7: P- | C7: 2269 | D7: 1 | E7: 7900622691 | F7: 多媒体课件开发与方正奥应用（配光盘） | G7: 刘剑平等 | H7: 29.00 | I7: 36526 | J7: 14
A8: =ROW()-2 -> 2552 | B8: P- | C8: 3054 | D8: 1 | E8: 7900630546 | F8: 多媒体演示─方法、技术与实例(配光盘) | G8: 宋铁英 | H8: 37.00 | I8: 36892 | J8: 9
A9: =ROW()-2 -> 2553 | B9: P- | C9: 3142 | D9: 1 | E9: 7900631429 | F9: After Effects 4.1 视频大飓风 （配光盘） | G9: 马存伟 | H9: 46.00 | I9: 36982 | J9: 7
A10: =ROW()-2 -> 2554 | B10: P- | C10: 3118 | D10: 1 | E10: 7900631186 | F10: After Effects 4.x 使用指南 （配光盘） | G10: 谢正武等 | H10: 35.00 | I10: 36982 | J10: 10
A11: =ROW()-2 -> 2555 | B11: P- | C11: 2573 | D11: 1 | E11: 7900625739 | F11: Director 8 多媒体设计宝典（配光盘） | G11: 曾安德 | H11: 39.80 | I11: 36770 | J11: 10
A12: =ROW()-2 -> 2556 | B12: P- | C12: 3156 | D12: 1 | E12: 7900631569 | F12: 最新 Director 8 进阶教程 （配光盘） | G12: 荣钦科技 | H12: 48.00 | I12: 36982 | J12: 7
A13: =ROW()-2 -> 2557 | B13: TP | C13: 2326 | D13: 1 | E13: 02326-3 | F13: Action 3.0 for Window 使用手册 | G13: 曾安德 | H13: 23.00 | I13: 1997 | J13: 13
A14: =ROW()-2 -> 2558 | B14: P- | C14: 2299 | D14: 1 | E14: 7900622993 | F14: Authorware Attain 多媒体大师（配光盘） | G14: 上奇科技 | H14: 43.00 | I14: 36678 | J14: 13
A15: =ROW()-2 -> 2559 | B15: TP | C15: 4702 | D15: 1 | E15: 04702-2 | F15: Authorware 5.2 实例演练 | G15: 谭干森 | H15: 26.00 | I15: 37288 | J15: 10
A16: =ROW()-2 -> 2560 | B16: TP | C16: 1295 | D16: 1 | E16: 01295-4 | F16: Authorware 与多媒体编程 | G16: 朱诗兵等 | H16: 26.00 | I16: 36951 | J16: 11
A17: =ROW()-2 -> 2561 | B17: TP | C17: 5250 | D17: 1 | E17: 05250-6 | F17: Authorware 6.0网上多媒体课件制作 | G17: 周苏明等 | H17: 25.00 | I17: 37347 | J17: 11
A18: =ROW()-2 -> 2562 | B18: TP | C18: 5214 | D18: 1 | E18: 05214-X | F18: Authorware 6培训教程 | G18: 石明贵 | H18: 29.00 | I18: 37438 | J18: 9
A19: =ROW()-2 -> 2563 | B19: TP | C19: 5337 | D19: 1 | E19: 05337-5 | F19: Python技术参考大全 | G19: Martin C.Brown | H19: 54.00 | I19: 37377 | J19: 6
A20: =ROW()-2 -> 2564 | B20: TP | C20: 5370 | D20: 1 | E20: 05370-7 | F20: 电脑音乐梦工厂 | G20: 王锐 | H20: 40.00 | I20: 37377 | J20: 6
A21: =ROW()-2 -> 2565 | B21: P- | C21: 4320 | D21: 1 | E21: 7900643206 | F21: 多媒体CAI课件制作实例教程 | G21: 方其桂 | H21: 46.00 | I21: 37469 | J21: 7
A22: =ROW()-2 -> 2566 | B22: TP | C22: 5778 | D22: 1 | E22: 05778-8 | F22: Flash MX动画乐园 | G22: 翟志强 | H22: 30.00 | I22: 37500 | J22: 10
A23: =ROW()-2 -> 2567 | B23: TP | C23: 5718 | D23: 1 | E23: 05718-4 | F23: Flash 动画与卡通制作创意导航 | G23: [美]Lbis Fernamdez | H23: 39.00 | I23: 37500 | J23: 8
A24: =ROW()-2 -> 2568 | B24: TP | C24: 5584 | D24: 2 | E24: 05584-X | F24: 网上多媒体信息分析与检索 | G24: 庄越挺 | H24: 37 | I24: 37500 | J24: 8
F25: 图形、图像处理及计算机辅助设计
A26: =ROW()-2 -> 2570 | B26: TP | C26: 4886 | D26: 1 | E26: 04886-X | F26: Solid Works 2001 中文版实用技术精粹 | G26: 邢启恩等 | H26: 32 | I26: 37530 | J26: 9
A27: =ROW()-2 -> 2571 | B27: TP | C27: 4967 | D27: 1 | E27: 04967-X | F27: Solid Edge V9 中文版三维设计与工程实践 | G27: 孟磊 等 | H27: 29 | I27: 37226 | J27: 9
A28: =ROW()-2 -> 2572 | B28: TP | C28: 4551 | D28: 1 | E28: 04551-8 | F28: 数字化平面设计实用教程 | G28: 吴延雄 | H28: 48 | I28: 37104 | J28: 5
A29: =ROW()-2 -> 2573 | B29: TP | C29: 4318 | D29: 1 | E29: 04318-3 | F29: 人工鱼――计算机动画的人工生命方法 （配光盘） | G29: 涂晓媛 | H29: 25.00 | I29: 36982 | J29: 15
A30: =ROW()-2 -> 2574 | B30: TP | C30: 4330 | D30: 1 | E30: 04330-2 | F30: 建筑计算机绘图入门与进阶实战教程 | G30: 陈明 等 | H30: 32.00 | I30: 37012 | J30: 10
A31: =ROW()-2 -> 2575 | B31: P- | C31: 3736 | D31: 1 | E31: 7900637362 | F31: 电脑美术全接触（配光盘） | G31: 火神动漫网 | H31: 30 | I31: 37226 | J31: 11
A32: =ROW()-2 -> 2576 | B32: TP | C32: 5410 | D32: 1 | E32: 05410-X | F32: MATLAB6.x图像处理 | G32: 孙兆林 | H32: 30.00 | I32: 37469 | J32: 9
A33: =ROW()-2 -> 2577 | B33: TP | C33: 1176 | D33: 2 | E33: 01176-1 | F33: 计算机图象处理 | G33: 容观澳 | H33: 26.00 | I33: 36831 | J33: 9
A34: =ROW()-2 -> 2578 | B34: P- | C34: 2258 | D34: 1 | E34: 7900622586 | F34: 我行我速 2.0 电脑艺术卡片设计(配光盘) | G34: 李四达 | H34: 66.00 | I34: 36526 | J34: 10
A35: =ROW()-2 -> 2579 | B35: TP | C35: 4947 | D35: 1 | E35: 04947-5 | F35: 建立个人数码相馆 | G35: 高林 等 | H35: 20 | I35: 37226 | J35: 11
A36: =ROW()-2 -> 2580 | B36: TP | C36: 5058 | D36: 1 | E36: 05058-9 | F36: 数码相机使用与影像处理快速攻略 | G36: 许书明等 | H36: 28.00 | I36: 37257 | J36: 13
A37: =ROW()-2 -> 2581 | B37: TP | C37: 3451 | D37: 1 | E37: 03451-6 | F37: 印前图象处理高级指导 扫描.校色.特技 | G37: 邬国明 | H37: 98.00 | I37: 1999 | J37: 7
A38: =ROW()-2 -> 2582 | B38: TP | C38: 3406 | D38: 2 | E38: 03406-0 | F38: 电脑建筑画创作技术与实例精选 (配光盘) | G38: 方可 等 | H38: 48.00 | I38: 36465 | J38: 9
A39: =ROW()-2 -> 2583 | B39: P- | C39: 2509 | D39: 1 | E39: 7900625097 | F39: 室内设计与精品赏析（配光盘） | G39: 郑 曙 | H39: 39.00 | I39: 36708 | J39: 15
A40: =ROW()-2 -> 2584 | B40: P- | C40: 3161 | D40: 1 | E40: 7900631615 | F40: 电脑室内外效果图创意制作大全 （配光盘） | G40: 邓红梅等 | H40: 65.00 | I40: 36982 | J40: 5
A41: =ROW()-2 -> 2585 | B41: P- | C41: 4178 | D41: 1 | E41: 7900641785 | F41: 电脑室内装修设计教程―双实例十一讲 | G41: 曾冬梅等 | H41: 28.00 | I41: 37377 | J41: 10
A42: =ROW()-2 -> 2586 | B42: TP | C42: 3842 | D42: 1 | E42: 03842-2 | F42: 急救 ―― 平面设计实用手册 | G42: 杨宝忠等 | H42: 98.00 | I42: 36495 | J42: 7
A43: =ROW()-2 -> 2587 | B43: TP | C43: 4587 | D43: 1 | E43: 04587-9 | F43: Mastercam 8.X 实用培训教程 | G43: 王睿 等 | H43: 36 | I43: 37469 | J43: 7
A44: =ROW()-2 -> 2588 | B44: P- | C44: 2226 | D44: 1 | E44: 7900622268 | F44: 用 3DS MAX 3.0 和 Photoshop 5.0 画建筑表现图（配光盘） | G44: 吴嘉明等 | H44: 48.00 | I44: 36678 | J44: 8
A45: =ROW()-2 -> 2589 | B45: P- | C45: 4166 | D45: 1 | E45: 7900641661 | F45: 3D Studio VIZ R3 100问室内设计渲染秘籍大公开100问（配光盘） | G45: 李展铭等 | H45: 26.00 | I45: 37377 | J45: 11
A46: =ROW()-2 -> 2590 | B46: TP | C46: 3902 | D46: 1 | E46: 03902-X | F46: 现代 CAD 技术 | G46: 童秉枢 | H46: 19.00 | I46: 36708 | J46: 13
A47: =ROW()-2 -> 2591 | B47: P- | C47: 3752 | D47: 1 | E47: 7900637524 | F47: AutoCAD 高级教程（配光盘） | G47: 宋振会 | H47: 64 | I47: 37500 | J47: 5
A48: =ROW()-2 -> 2592 | B48: TP | C48: 5277 | D48: 1 | E48: 05277-8 | F48: AutoCAD 2000/2002 辅助设计培训教程 | G48: 李香敏主编 | H48: 29.00 | I48: 37500 | J48: 8
A49: =ROW()-2 -> 2593 | B49: TP | C49: 3482 | D49: 2 | E49: 03482-6 | F49: AutoCAD 2000 中文版使用大全 | G49: 康博创作室 | H49: 59.80 | I49: 36892 | J49: 4
A50: =ROW()-2 -> 2594 | B50: TP | C50: 3723 | D50: 2 | E50: 03723-X | F50: AutoCAD 2000 中文版新功能 | G50: 康博创作室 | H50: 19.00 | I50: 36586 | J50: 12
A51: =ROW()-2 -> 2595 | B51: TP | C51: 3781 | D51: 2 | E51: 03781-7 | F51: 精通 AutoCAD 2000 中文版 | G51: 郭玲文等 | H51: 49.00 | I51: 37469 | J51: 6
A52: =ROW()-2 -> 2596 | B52: TP | C52: 1039 | D52: 2 | E52: 01039-0 | F52: AutoCAD 2000 三维建模技巧与范例 | G52: 谭荣伟 | H52: 30.00 | I52: 36647 | J52: 8
A53: =ROW()-2 -> 2597 | B53: TP | C53: 1401 | D53: 1 | E53: 01401-9 | F53: AutoCAD 2000 三维技术精粹 | G53: 颜国忠等 | H53: 39.00 | I53: 36982 | J53: 7
A54: =ROW()-2 -> 2598 | B54: P- | C54: 3725 | D54: 1 | E54: 7900637257 | F54: AutoCAD 2000 中文版实用教程（配光盘） | G54: 蔡希林 | H54: 32.00 | I54: 37362 | J54: 8
A55: =ROW()-2 -> 2599 | B55: TP | C55: 4790 | D55: 1 | E55: 04790-1 | F55: 实现网络三维互动――Cult3D 应用指南 | G55: 苏威洲等 | H55: 30 | I55: 37165 | J55: 8
A56: =ROW()-2 -> 2600 | B56: P- | C56: 3121 | D56: 1 | E56: 7900631216 | F56: AutoCAD 2000 实体模拟与三维渲染 （配光盘） | G56: 何冬隆等 | H56: 59.00 | I56: 36982 | J56: 5
A57: =ROW()-2 -> 2601 | B57: TP | C57: 0784 | D57: 1 | E57: 00784-5 | F57: AutoCAD 2000 机械设计指南 | G57: 齐舒创作室 | H57: 42.00 | I57: 36861 | J57: 7
A58: =ROW()-2 -> 2602 | B58: TP | C58: 1129 | D58: 1 | E58: 01129-X | F58: 中文 AutoCAD 2000 创意实例（机械篇） | G58: 黎广生等 | H58: 34.00 | I58: 36647 | J58: 9
A59: =ROW()-2 -> 2603 | B59: TP | C59: 3877 | D59: 1 | E59: 03877-5 | F59: 中文 AutoCAD 2000 创意实例（建筑篇） | G59: 李增民等 | H59: 36.00 | I59: 36982 | J59: 8
A60: =ROW()-2 -> 2604 | B60: TP | C60: 4162 | D60: 1 | E60: 04162-8 | F60: AutoCAD 2000i 中文版实用教程 | G60: 杨鹏起等 | H60: 37.00 | I60: 36982 | J60: 7
A61: =ROW()-2 -> 2605 | B61: P- | C61: 3146 | D61: 1 | E61: 7900631461 | F61: AutoCAD 2000i 中文版建筑实例与技巧 （配光盘） | G61: 朱涛 等 | H61: 38.00 | I61: 37257 | J61: 8
A62: =ROW()-2 -> 2606 | B62: TP | C62: 4641 | D62: 1 | E62: 04641-7 | F62: AutoCAD 2002 使用与精通 | G62: 宋勇 等 | H62: 63.00 | I62: 37344 | J62: 4
A63: =ROW()-2 -> 2607 | B63: TP | C63: 4887 | D63: 1 | E63: 04887-8 | F63: 中文版 AutoCAD 2002 实用大全 | G63: 高强 等 | H63: 45.00 | I63: 37369 | J63: 6
A64: =ROW()-2 -> 2608 | B64: TP | C64: 4128 | D64: 1 | E64: 04128-8 | F64: 中文AutoCAD 2000i 使用大全 | G64: 黎广生 | H64: 66.00 | I64: 36892 | J64: 4
A65: =ROW()-2 -> 2609 | B65: TP | C65: 4835 | D65: 1 | E65: 04835-5 | F65: 手把手教你学用中文版 AutoCAD 2002 | G65: 王毅 等 | H65: 33.00 | I65: 37288 | J65: 9
A66: =ROW()-2 -> 2610 | B66: TP | C66: 3010 | D66: 2 | E66: 03010-3 | F66: AutoCAD 建筑工程设计绘图 | G66: 唐 海 | H66: 29.60 | I66: 1998 | J66: 7
A67: =ROW()-2 -> 2611 | B67: TP | C67: 4390 | D67: 1 | E67: 04390-6 | F67: AutoCAD 2000 建筑与室内设计应用 | G67: 薛希浩 | H67: 15.00 | I67: 37104 | J67: 17
A68: =ROW()-2 -> 2612 | B68: TP | C68: 4866 | D68: 1 | E68: 04866-5 | F68: UG/CAD 工程设计基础教程（上册） | G68: 孙江宏等 | H68: 38.00 | I68: 37327 | J68: 7
A69: =ROW()-2 -> 2613 | B69: TP | C69: 4888 | D69: 1 | E69: 04888-6 | F69: UG/CAD 工程设计基础教程（下册） | G69: 孙江宏等 | H69: 32.00 | I69: 37333 | J69: 8
A70: =ROW()-2 -> 2614 | B70: P- | C70: 4192 | D70: 1 | E70: 7900641920 | F70: UG范例教程（配光盘） | G70: 黄贵东等 | H70: 48.00 | I70: 37469 | J70: 6
A71: =ROW()-2 -> 2615 | B71: TP | C71: 5124 | D71: 1 | E71: 05124-0 | F71: Unigraphics 18版CAD应用基础 | G71: 莫蓉 | H71: 48.00 | I71: 37377 | J71: 5
A72: =ROW()-2 -> 2616 | B72: P- | C72: 2516 | D72: 1 | E72: 790062516X | F72: After Effects 4.0 影像处理宝典（配光盘） | G72: 张世昌等 | H72: 98.00 | I72: 36647 | J72: 8
A73: =ROW()-2 -> 2617 | B73: P- | C73: 3043 | D73: 1 | E73: 7900630430 | F73: MediaStudio Pro 6.0 影音传奇 （配光盘） | G73: 郑正权 | H73: 42.00 | I73: 36982 | J73: 9
A74: =ROW()-2 -> 2618 | B74: P- | C74: 3735 | D74: 1 | E74: 7900637354 | F74: Premiere 6.0 高级视频编辑技术与实战指南 （配光盘） | G74: 王 琦 | H74: 30.00 | I74: 37356 | J74: 10
A75: =ROW()-2 -> 2619 | B75: P- | C75: 3004 | D75: 1 | E75: 790063004X | F75: Premiere 5.x 视频处理使用指南（配光盘） | G75: 李阳 等 | H75: 39.00 | I75: 36831 | J75: 9
A76: =ROW()-2 -> 2620 | B76: TP | C76: 4184 | D76: 1 | E76: 04184-9 | F76: Adobe Premiere 5.x 实例教程 | G76: 胡晓冰等 | H76: 40.00 | I76: 36982 | J76: 6
A77: =ROW()-2 -> 2621 | B77: TP | C77: 4645 | D77: 1 | E77: 04645-X | F77: Visio 工程图表制作实例导学 | G77: 甘登岱等 | H77: 28 | I77: 37135 | J77: 10
A78: =ROW()-2 -> 2622 | B78: TP | C78: 5399 | D78: 1 | E78: 05399-5 | F78: FreeHand 10 创意设计精彩实例 | G78: 李晓鲁 | H78: 24.00 | I78: 37408 | J78: 10
A79: =ROW()-2 -> 2623 | B79: P- | C79: 2530 | D79: 1 | E79: 7900625305 | F79: FreeHand 中文版绘图宝典（配光盘） | G79: 叶宝文 | H79: 58.00 | I79: 36708 | J79: 7
A80: =ROW()-2 -> 2624 | B80: TP | C80: 4877 | D80: 1 | E80: 04877-0 | F80: FreeHand 10 实用培训教程 | G80: 崔洪斌等 | H80: 32 | I80: 37469 | J80: 9
A81: =ROW()-2 -> 2625 | B81: TP | C81: 4944 | D81: 1 | E81: 04944-0 | F81: FreeHand 10 平面设计与网页制作 | G81: 张璇 等 | H81: 24 | I81: 37196 | J81: 11
A82: =ROW()-2 -> 2626 | B82: TP | C82: 4920 | D82: 1 | E82: 04920-3 | F82: FreeHand 10 发烧友 | G82: 东海 等 | H82: 23 | I82: 37196 | J82: 11
A83: =ROW()-2 -> 2627 | B83: TP | C83: 4788 | D83: 1 | E83: 04788-X | F83: LiveMotion 速学速用 | G83: 赵文博等 | H83: 20 | I83: 37165 | J83: 13
A84: =ROW()-2 -> 2628 | B84: P- | C84: 2526 | D84: 1 | E84: 7900625267 | F84: 工业设计电脑表现技法 | G84: 牛凯工作室 | H84: 30.00 | I84: 36708 | J84: 12
A85: =ROW()-2 -> 2629 | B85: TP | C85: 2085 | D85: 4 | E85: 02085-X | F85: C语言绘图教程 | G85: 陆润民 | H85: 16.00 | I85: 36708 | J85: 12
A86: =ROW()-2 -> 2630 | B86: TP | C86: 3523 | D86: 2 | E86: 03523-7 | F86: 数字图象处理编程入门 ―― 做一个自己的 Photoshop | G86: 吕凤军 | H86: 24.00 | I86: 36495 | J86: 13
A87: =ROW()-2 -> 2631 | B87: TP | C87: 2194 | D87: 5 | E87: 02194-5 | F87: 控制系统计算机辅助设计―― MATLAB 语言及应用 | G87: 薛定宇 | H87: 28.00 | I87: 37316 | J87: 8
A88: =ROW()-2 -> 2632 | B88: P- | C88: 2288 | D88: 1 | E88: 7900622888 | F88: Photoshop 文字效果创意与设计(配光盘) | G88: 方彩欣 | H88: 108.00 | I88: 36617 | J88: 7
A89: =ROW()-2 -> 2633 | B89: P- | C89: 2501 | D89: 1 | E89: 7900625011 | F89: Photoshop 锦囊妙计（配光盘） | G89: 谢建勋译 | H89: 76.00 | I89: 36708 | J89: 11
A90: =ROW()-2 -> 2634 | B90: TP | C90: 3790 | D90: 2 | E90: 03790-6 | F90: Photoshop 平面设计 | G90: 张 舜 | H90: 30.00 | I90: 36982 | J90: 10
A91: =ROW()-2 -> 2635 | B91: P- | C91: 2514 | D91: 1 | E91: 7900625143 | F91: Photoshop 绝招100（配光盘） | G91: 李乃雄 | H91: 98.00 | I91: 36647 | J91: 9
A92: =ROW()-2 -> 2636 | B92: P- | C92: 2512 | D92: 1 | E92: 7900625127 | F92: Photoshop 创意无限（第2版） | G92: 孙晓东译 | H92: 116.00 | I92: 36647 | J92: 7
A93: =ROW()-2 -> 2637 | B93: TP | C93: 3368 | D93: 2 | E93: 03368-4 | F93: Photoshop 5 完全使用手册 (配软盘） | G93: 张文 等 | H93: 45.00 | I93: 36526 | J93: 7
A94: =ROW()-2 -> 2638 | B94: TP | C94: 3682 | D94: 2 | E94: 03682-9 | F94: Photoshop 5.0 中文版实务经典 | G94: 若扬其等 | H94: 38.00 | I94: 36434 | J94: 7
A95: =ROW()-2 -> 2639 | B95: TP | C95: 4829 | D95: 1 | E95: 04829-0 | F95: Photoshop 6.0 中文版电视讲座教程 | G95: 雷 波 | H95: 45.00 | I95: 37333 | J95: 6
A96: =ROW()-2 -> 2640 | B96: TP | C96: 4610 | D96: 2 | E96: 04610-7 | F96: 中文版 Photoshop 6.X 实用培训教程 | G96: 张林娣等 | H96: 30.00 | I96: 37326 | J96: 9
A97: =ROW()-2 -> 2641 | B97: TP | C97: 4985 | D97: 1 | E97: 04985-8 | F97: 全面接触 Photoshop 6.0 中文版 | G97: 王军 等 | H97: 35.00 | I97: 37326 | J97: 8
A98: =ROW()-2 -> 2642 | B98: TP | C98: 4498 | D98: 1 | E98: 04498-8 | F98: 精通 Photoshop 6.0 | G98: 张雪峰等 | H98: 36.00 | I98: 37135 | J98: 8
A99: =ROW()-2 -> 2643 | B99: TP | C99: 4515 | D99: 1 | E99: 04515-1 | F99: 战胜 Potoshop 6.0 必做练习 60 题 | G99: 汪 端 | H99: 33.00 | I99: 37369 | J99: 6
A100: =ROW()-2 -> 2644 | B100: TP | C100: 4429 | D100: 1 | E100: 04429-5 | F100: “画”说 Photoshop 6.0 | G100: 郭 勐 | H100: 24.00 | I100: 37257 | J100: 10
A101: =ROW()-2 -> 2645 | B101: TP | C101: 4885 | D101: 1 | E101: 04885-1 | F101: 图像处理大师――Photoshop | G101: 张璇 等 | H101: 29.00 | I101: 37330 | J101: 9
A102: =ROW()-2 -> 2646 | B102: TP | C102: 1395 | D102: 2 | E102: 01395-0 | F102: Photoshop 6.0 设计师手册 | G102: 王 谦 | H102: 59.80 | I102: 37073 | J102: 5
A103: =ROW()-2 -> 2647 | B103: P- | C103: 2533 | D103: 1 | E103: 790062533X | F103: Photoshop 6.0 图象设计宝典 | G103: 陈思聪等 | H103: 56 | I103: 37073 | J103: 6
A104: =ROW()-2 -> 2648 | B104: TP | C104: 1232 | D104: 1 | E104: 01232-6 | F104: Photoshop 6.0 影像设计培训教程 | G104: 朱旋 等 | H104: 39.80 | I104: 37012 | J104: 7
A105: =ROW()-2 -> 2649 | B105: TP | C105: 3748 | D105: 1 | E105: 03748-5 | F105: Photoshop 6.0影像密码 | G105: 游闵州 | H105: 49.00 | I105: 37316 | J105: 7
A106: =ROW()-2 -> 2650 | B106: P- | C106: 3107 | D106: 1 | E106: 7900631070 | F106: Photoshop 6.0 创意实例（配光盘） | G106: 康博创作室 | H106: 38.00 | I106: 36951 | J106: 8
A107: =ROW()-2 -> 2651 | B107: TP | C107: 4779 | D107: 1 | E107: 04779-0 | F107: 中文版Photoshop 6.0 创意技法实例 | G107: 翟志强等 | H107: 32.00 | I107: 37349 | J107: 9
A108: =ROW()-2 -> 2652 | B108: TP | C108: 4833 | D108: 1 | E108: 04833-9 | F108: 深入解析 Photoshop 6.X 中文版 | G108: 龚正伟 | H108: 32.00 | I108: 37364 | J108: 8
A109: =ROW()-2 -> 2653 | B109: TP | C109: 4195 | D109: 1 | E109: 04195-4 | F109: 动画与图象处理大师――Photoshop 6.0 教程与实例 | G109: 刘金喜等 | H109: 39.00 | I109: 36982 | J109: 7
A110: =ROW()-2 -> 2654 | B110: TP | C110: 4301 | D110: 1 | E110: 04301-9 | F110: Photoshop 6.0 梦幻王国 | G110: 陈燕凌等 | H110: 32.00 | I110: 37104 | J110: 8
A111: =ROW()-2 -> 2655 | B111: P- | C111: 3163 | D111: 1 | E111: 7900631631 | F111: Photoshop 6.0 综合精彩实例（配光盘） | G111: 杨林 等 | H111: 38.00 | I111: 37104 | J111: 9
A112: =ROW()-2 -> 2656 | B112: TP | C112: 4722 | D112: 1 | E112: 04722-7 | F112: 精通 Photoshop 6 中文版完全手册 | G112: 何茜 等 | H112: 37 | I112: 37104 | J112: 7
A113: =ROW()-2 -> 2657 | B113: TP | C113: 4691 | D113: 1 | E113: 04691-3 | F113: 图象处理新概念――Photoshop 6.0 CorelDRAW 10 与 PHOTO-PAINT 10 综合实例诠释 | G113: 张治文等 | H113: 38 | I113: 37135 | J113: 7
A114: =ROW()-2 -> 2658 | B114: TP | C114: 4832 | D114: 1 | E114: 04832-0 | F114: 中文 Photoshop 6.0 与 ImageReady 3.0 经典教程与实例 | G114: 赵健斌等 | H114: 42 | I114: 37165 | J114: 7
A115: =ROW()-2 -> 2659 | B115: P- | C115: 3781 | D115: 1 | E115: 7900637818 | F115: Photoshop 外挂滤镜完全攻略（配光盘） | G115: 孙文姬等 | H115: 88.00 | I115: 37257 | J115: 7
A116: =ROW()-2 -> 2660 | B116: P- | C116: 2513 | D116: 1 | E116: 7900625135 | F116: Photoshop/Painter 创意与设计梦幻组合 （配光盘） | G116: 萧淑慧等 | H116: 108.00 | I116: 36678 | J116: 10
A117: =ROW()-2 -> 2661 | B117: P- | C117: 2564 | D117: 1 | E117: 790062564X | F117: Painter 6 图象设计宝典（配光盘） | G117: 陈春辉 | H117: 76.00 | I117: 36739 | J117: 8
A118: =ROW()-2 -> 2662 | B118: TP | C118: 4440 | D118: 1 | E118: 04440-6 | F118: Painter 6.0 实例教程 | G118: 金晓明等 | H118: 29 | I118: 37073 | J118: 9
A119: =ROW()-2 -> 2663 | B119: P- | C119: 3155 | D119: 1 | E119: 7900631550 | F119: Painter 6.0 梦幻王国 （配光盘） | G119: 薛书琴等 | H119: 35.00 | I119: 36982 | J119: 9
A120: =ROW()-2 -> 2664 | B120: TP | C120: 3700 | D120: 1 | E120: 03700-0 | F120: 图像处理大师 Paint Shop Pro 5.0 从入门到精通 | H120: 29.00 | I120: 36434 | J120: 11
A121: =ROW()-2 -> 2665 | B121: P- | C121: 2545 | D121: 1 | E121: 7900625453 | F121: After Effects 从入门到精通（配光盘） | G121: 萧湘工作室 | H121: 49.00 | I121: 36831 | J121: 6
A122: =ROW()-2 -> 2666 | B122: TP | C122: 4254 | D122: 1 | E122: 04254-3 | F122: Pro/ENGINEER 2000i 入门 | G122: 苏厚合等 | H122: 34.00 | I122: 36951 | J122: 8
A123: =ROW()-2 -> 2667 | B123: P- | C123: 3164 | D123: 1 | E123: 790063164X | F123: Pro/ENGINEER 2000i 进阶教程 | G123: 张沛颀等 | H123: 42.00 | I123: 36982 | J123: 8
A124: =ROW()-2 -> 2668 | B124: P- | C124: 3590 | D124: 1 | E124: 7900635904 | F124: Pro/ENGINEER 2000i 基础设计教程(配光盘) | G124: 孙江宏等 | H124: 52.00 | I124: 37316 | J124: 5
A125: =ROW()-2 -> 2669 | B125: TP | C125: 4987 | D125: 1 | E125: 04987-4 | F125: Pro/ENGINEER 2000i 高级功能应用及二次开发 | G125: 孙江宏等 | H125: 30.00 | I125: 37404 | J125: 9
A126: =ROW()-2 -> 2670 | B126: P- | C126: 3760 | D126: 1 | E126: 7900637605 | F126: Pro/ENGINEER 2001 工业造型设计（配光盘） | G126: 柳迎春等 | H126: 39.00 | I126: 37257 | J126: 9
A127: =ROW()-2 -> 2671 | B127: TP- | C127: 5216 | D127: 1 | E127: 05216-6 | F127: Pro/ENGINEER 2000i/i2 与三维模型设计 | G127: 甘登岱等 | H127: 34.00 | I127: 37469 | J127: 8
A128: =ROW()-2 -> 2672 | B128: P- | C128: 4126 | D128: 1 | E128: 7900641262 | F128: Pro/ENGINEER 数控加工（基础篇）（配光盘） | G128: 赵德永等 | H128: 31.00 | I128: 37347 | J128: 12
A129: =ROW()-2 -> 2673 | B129: P- | C129: 5336 | D129: 1 | E129: 05336-7 | F129: Pro/ENGINEER 2000i 数控铣床加工自动编程技术 | G129: 戴向国等 | H129: 25.00 | I129: 37408 | J129: 12
A130: =ROW()-2 -> 2674 | B130: P- | C130: 5732 | D130: 1 | E130: 05732-X | F130: Pro/ENGINEER 2001实例精解 | G130: 彭万波等 | H130: 36.00 | I130: 37500 | J130: 8
A131: =ROW()-2 -> 2675 | B131: TP | C131: 5744 | D131: 1 | E131: 05744-3 | F131: 计算机辅助设计基础及应用 | G131: 崔洪斌 | H131: 25.00 | I131: 37500 | J131: 11
A132: =ROW()-2 -> 2676 | B132: TP | C132: 5742 | D132: 1 | E132: 05742-7 | F132: Pro/ENGINEER 2001 中文版自由曲面与行为建模 | G132: 柳迎春 | H132: 23.00 | I132: 37530 | J132: 14
A133: =ROW()-2 -> 2677 | B133: P- | C133: 3061 | D133: 1 | E133: 7900630619 | F133: 图像艺术设计与实现（配光盘） | G133: 陈杰明 | H133: 37.00 | I133: 36831 | J133: 9
A134: =ROW()-2 -> 2678 | B134: TP | C134: 3092 | D134: 1 | E134: 03092-8 | F134: 细说风云――图象扫描与编修 | G134: 牛 凯 | H134: 168.00 | I134: 1998 | J134: 9
A135: =ROW()-2 -> 2679 | B135: TP | C135: 1547 | D135: 2 | E135: 01547-3 | F135: 扫描与半色调处理（第2版） | G135: 潘文林等译 | H135: 39.00 | I135: 36770 | J135: 8
A136: =ROW()-2 -> 2680 | B136: P- | C136: 2285 | D136: 1 | E136: 7900622853 | F136: Adobe Illustrator 8.0 中创意与设计无限 （配光盘） | G136: 陈杰民 | H136: 98.00 | I136: 36586 | J136: 8
A137: =ROW()-2 -> 2681 | B137: TP | C137: 3594 | D137: 1 | E137: 03594-6 | F137: CorelDRAW 8 中文版完全使用手册 | G137: 张文 等 | H137: 45.00 | I137: 36342 | J137: 6
A138: =ROW()-2 -> 2682 | B138: TP | C138: 3892 | D138: 1 | E138: 03892-9 | F138: CorelDRAW 9 中文版专家指南 | G138: 李阳 等 | H138: 38.80 | I138: 36739 | J138: 8
A139: =ROW()-2 -> 2683 | B139: P- | C139: 2546 | D139: 1 | E139: 7900625461 | F139: CorelDRAW 9 实战创意与分析（配光盘） | G139: 张璇 等 | H139: 38.00 | I139: 36831 | J139: 8
A140: =ROW()-2 -> 2684 | B140: TP | C140: 4290 | D140: 1 | E140: 04290-X | F140: CorelDRAW 9.0 基础 案例 技巧 创意 | G140: 田守瑞等 | H140: 29.00 | I140: 37288 | J140: 8
A141: =ROW()-2 -> 2685 | B141: P- | C141: 2511 | D141: 1 | E141: 7900625119 | F141: CorelDRAW 9 中文版绘图设计宝典（配光盘） | G141: 陈思聪等 | H141: 52.00 | I141: 37043 | J141: 6
A142: =ROW()-2 -> 2686 | B142: P- | C142: 2291 | D142: 1 | E142: 7900622918 | F142: CorelDRAW 9 创意实例（配光盘） | G142: 康博创作室 | H142: 39.00 | I142: 36708 | J142: 9
A143: =ROW()-2 -> 2687 | B143: P- | C143: 2517 | E143: 7900625178 | F143: CorelDRAW 9 中文版绘图手册（配光盘） | G143: 徐凯玲 | H143: 58.00 | I143: 36708 | J143: 6
A144: =ROW()-2 -> 2688 | B144: TP | C144: 0751 | D144: 1 | E144: 00751-9 | F144: CorelDRAW 9 中文版初中级教程 | G144: 东箭工作室 | H144: 37.00 | I144: 37530 | J144: 7
A145: =ROW()-2 -> 2689 | B145: TP | C145: 3826 | D145: 2 | E145: 03826-0 | F145: 精通 CorelDRAW 9 | G145: 张文 等 | H145: 43.00 | I145: 36465 | J145: 6
A146: =ROW()-2 -> 2690 | B146: P- | C146: 3547 | D146: 1 | E146: 7900635471 | F146: CorelDRAW 10 企业标识、产品包装和广告设计（配光盘） | G146: 张璇 等 | H146: 35.00 | I146: 37073 | J146: 11
A147: =ROW()-2 -> 2691 | B147: TP | C147: 4489 | D147: 1 | E147: 04489-9 | F147: CorelDRAW 10 绘图实用宝典（上）――基础篇 | G147: 陈浩 等 | H147: 26.00 | I147: 37043 | J147: 10
A148: =ROW()-2 -> 2692 | B148: P- | C148: 3154 | D148: 1 | E148: 7900631542 | F148: CorelDRAW 10 绘图实用宝典（下）――创意篇（配光盘） | G148: 陈浩 等 | H148: 35 | I148: 37073 | J148: 9
A149: =ROW()-2 -> 2693 | B149: P- | C149: 3509 | D149: 1 | E149: 7900635092 | F149: CorelDRAW 10 平面设计精粹（配光盘） | G149: 张璇 等 | H149: 32 | I149: 37073 | J149: 10
A150: =ROW()-2 -> 2694 | B150: P- | C150: 3544 | D150: 1 | E150: 7900635440 | F150: Maya 角色动画技术（配光盘） | G150: 陈跃琴等译 | H150: 49.00 | I150: 37043 | J150: 7
A151: =ROW()-2 -> 2695 | B151: TP | C151: 4148 | D151: 1 | E151: 04148-2 | F151: Maya 3 实例教程 | G151: 巨泽建等 | H151: 32.00 | I151: 36982 | J151: 8
A152: =ROW()-2 -> 2696 | B152: P- | C152: 2534 | D152: 1 | E152: 7900625348 | F152: Maya 3.0动画（配光盘） | G152: 苑利维等 | H152: 48.00 | I152: 36739 | J152: 6
A153: =ROW()-2 -> 2697 | B153: TP | C153: 1071 | D153: 1 | E153: 01071-4 | F153: Maya 2.5 使用手册 | G153: 姚文龙等 | H153: 34.60 | I153: 36708 | J153: 8
A154: =ROW()-2 -> 2698 | B154: P- | C154: 3051 | D154: 1 | E154: 7900630511 | F154: Maya 2.5/3.0 建模技巧与范例（配光盘） | G154: 姚文龙等 | H154: 40.00 | I154: 36831 | J154: 9
A155: =ROW()-2 -> 2699 | B155: P- | C155: 3543 | D155: 1 | E155: 7900635432 | F155: Maya 3.0 精品实例创作（上篇）（配光盘） | G155: 张毅卓等 | H155: 34 | I155: 37073 | J155: 9
A156: =ROW()-2 -> 2700 | B156: P- | C156: 3731 | D156: 1 | E156: 7900637311 | F156: Maya 3.0 精品实例创作（下篇）（配光盘） | G156: 岳夏 等 | H156: 28 | I156: 37196 | J156: 11
A157: =ROW()-2 -> 2701 | B157: P- | C157: 2552 | D157: 1 | E157: 7900622551 | F157: Maya 特效（配光盘） | G157: 苑利维等 | H157: 48.00 | I157: 36739 | J157: 6
A158: =ROW()-2 -> 2702 | B158: P- | C158: 2535 | D158: 1 | E158: 7900625356 | F158: Maya 3.0造型（配光盘） | G158: 苑利维等 | H158: 48.00 | I158: 36739 | J158: 5
A159: =ROW()-2 -> 2703 | B159: TP- | C159: 5156 | D159: 1 | E159: 05156-9 | F159: Maya4 动画特效制作 | G159: 翟志强 | H159: 28.00 | I159: 37288 | J159: 11
A160: =ROW()-2 -> 2704 | B160: TP | C160: 4380 | D160: 1 | E160: 04380-9 | F160: SoftImage 3D 全攻略 | G160: 黄云 等 | H160: 51.00 | I160: 37012 | J160: 6
A161: =ROW()-2 -> 2705 | B161: P- | C161: 4189 | D161: 1 | E161: 04189-1 | F161: 3DS MAX 4.2 效果图制作与实用线架大全（配光盘） | G161: 朱仁成等 | H161: 49.00 | I161: 37438 | J161: 7
A162: =ROW()-2 -> 2706 | B162: P- | C162: 4341 | D162: 1 | E162: 7900643419 | F162: MAYA 4 3D动画总动员（含光盘） | G162: 微粒工作室 | H162: 36.00 | I162: 37500 | J162: 8
A163: =ROW()-2 -> 2707 | B163: P- | C163: 3530 | D163: 1 | E163: 7900635300 | F163: 神秘园――3DS MAX 4.0 创意新能量 | G163: 周 锦 | H163: 58 | I163: 37135 | J163: 10
A164: =ROW()-2 -> 2708 | B164: TP | C164: 4535 | D164: 1 | E164: 04535-6 | F164: 3DS MAX 4.0 例解 | G164: 吴绍炜等 | H164: 29.00 | I164: 37333 | J164: 8
A165: =ROW()-2 -> 2709 | B165: P- | C165: 3769 | D165: 1 | E165: 7900637699 | F165: 3ds max 4 横空出世（配2张光盘） | G165: 陈邦本等 | H165: 48 | I165: 37226 | J165: 7
A166: =ROW()-2 -> 2710 | B166: TP | C166: 5032 | D166: 1 | E166: 05032-5 | F166: 3ds max 4.x 实用速查手册 | G166: 陈世红等 | H166: 30.00 | I166: 37469 | J166: 10
A167: =ROW()-2 -> 2711 | B167: P- | C167: 3551 | D167: 1 | E167: 7900635513 | F167: 3DS MAX 4.0 高级造型技巧与实用产品设计（配光盘） | G167: 宋雪岩 | H167: 29 | I167: 37073 | J167: 12
A168: =ROW()-2 -> 2712 | B168: P- | C168: 3534 | D168: 1 | E168: 7900635343 | F168: 3D Studio MAX R4 三维建模与动画实战攻略（配光盘） | G168: 吴海滨等 | H168: 34 | I168: 37073 | J168: 9
A169: =ROW()-2 -> 2713 | B169: TP | C169: 4287 | D169: 1 | E169: 04287-X | F169: 3D Studio MAX R4 实用培训教程 | G169: 李东升等 | H169: 35.00 | I169: 36982 | J169: 9
A170: =ROW()-2 -> 2714 | B170: TP | C170: 4482 | D170: 1 | E170: 04482-1 | F170: 3D Studio MAX R4 技术精粹 | G170: 龚正伟 | H170: 30 | I170: 37073 | J170: 10
A171: =ROW()-2 -> 2715 | B171: P- | C171: 3535 | D171: 1 | E171: 7900635351 | F171: 3D Studio MAX R4 人体与生物建模宝典 （配光盘） | G171: 赵 建 | H171: 35 | I171: 37104 | J171: 10
A172: =ROW()-2 -> 2716 | B172: P- | C172: 3189 | D172: 1 | E172: 7900631895 | F172: 3D Studio MAX R4 建筑与环境效果制作宝典（配光盘） | G172: 翟志强 | H172: 35.00 | I172: 37012 | J172: 10
A173: =ROW()-2 -> 2717 | B173: TP | C173: 4867 | D173: 1 | E173: 04867-3 | F173: 3D Studio MAX 4.0 + Photoshop6.0 建筑装潢 设计 | G173: 张国权等 | H173: 36.00 | I173: 37326 | J173: 8
A174: =ROW()-2 -> 2718 | B174: TP | C174: 4928 | D174: 1 | E174: 04928-9 | F174: 3D Studio VIZ 3i 建筑效果设计宝典 | G174: 赵 健 | H174: 24 | I174: 37196 | J174: 11
A175: =ROW()-2 -> 2719 | B175: P- | C175: 3521 | D175: 1 | E175: 7900635211 | F175: 3DS VIZ R3 超完美空间设计（配光盘） | G175: 卢师德 | H175: 49.00 | I175: 37012 | J175: 6
A176: =ROW()-2 -> 2720 | B176: P- | C176: 2248 | D176: 1 | E176: 7900622489 | F176: 3D STUDIO MAX R3 动画设计宝典(配光盘） | G176: 徐之洋等 | H176: 116.00 | I176: 36770 | J176: 6
A177: =ROW()-2 -> 2721 | B177: TP | C177: 1233 | D177: 1 | E177: 01233-4 | F177: 3D Studio MAX R3 基础教程 ―― 建模篇 | G177: 马 放 | H177: 26.00 | I177: 36708 | J177: 10
A178: =ROW()-2 -> 2722 | B178: P- | C178: 2576 | D178: 1 | E178: 7900625763 | F178: 3D Studio MAX R3 创意实例（配光盘） | G178: 刘继良等 | H178: 46.80 | I178: 36739 | J178: 7
A179: =ROW()-2 -> 2723 | B179: P- | C179: 2531 | D179: 1 | E179: 7900625313 | F179: 3D Studio MAX R3 三维动画设计实例 （配光盘） | G179: 孙全党等 | H179: 36.00 | I179: 36831 | J179: 9
A180: =ROW()-2 -> 2724 | B180: P- | C180: 1750 | D180: 1 | E180: 7900617507 | F180: 3D Studio MAX 实例通（配光盘） | G180: 游易霖 | H180: 39.8 | I180: 36861 | J180: 8
A181: =ROW()-2 -> 2725 | B181: P- | C181: 2252 | D181: 1 | E181: 7900622527 | F181: 3D Studio MAX 动画创意与设计无限完全进化论（配光盘） | G181: V.N.Club | H181: 126 | I181: 36617 | J181: 7
A182: =ROW()-2 -> 2726 | B182: P- | C182: 2247 | D182: 1 | E182: 7900622470 | F182: 3D Studio MAX 动画创意与设计无限超级进化论（配光盘） | G182: V.N.Club | H182: 130 | I182: 36617 | J182: 7
A183: =ROW()-2 -> 2727 | B183: P- | C183: 2561 | D183: 1 | E183: 7900625615 | F183: 3D Studio MAX 3.0 影视广告与片头设计 | G183: 李阳 等 | H183: 46 | I183: 36739 | J183: 8
A184: =ROW()-2 -> 2728 | B184: P- | C184: 2542 | D184: 1 | E184: 7900625429 | F184: 3D Studio MAX 3.0 专家指南（配光盘） | G184: 陆水 等 | H184: 42 | I184: 36739 | J184: 7
A185: =ROW()-2 -> 2729 | B185: P- | C185: 3007 | D185: 1 | E185: 7900630074 | F185: 3D Studio MAX 3.0 建模技巧与范例 （配光盘） | G185: 杨蔚 等 | H185: 45 | I185: 36800 | J185: 7
A186: =ROW()-2 -> 2730 | B186: TP | C186: 1461 | D186: 1 | E186: 01461-2 | F186: 3D Studio MAX 动画设计操作与实例 | G186: 甘登岱等 | H186: 39 | I186: 36770 | J186: 7
A187: =ROW()-2 -> 2731 | B187: P- | C187: 2298 | D187: 1 | E187: 7900622985 | F187: 3D Studio MAX 建筑与装饰设计(配光盘) | G187: 张璐 等 | H187: 39.8 | I187: 36617 | J187: 11
A188: =ROW()-2 -> 2732 | B188: P- | C188: 2290 | D188: 1 | E188: 790062290X | F188: 3DS MAX 3.0 和 Photoshop 5.0 建筑装潢与室内设计（配光盘） | G188: 吴嘉明等 | H188: 42 | I188: 36647 | J188: 8
A189: =ROW()-2 -> 2733 | B189: P- | C189: 2249 | D189: 1 | E189: 7900622497 | F189: 3D Studio MAX R3 动画超能量(配光盘) | G189: 郑正权 | H189: 68 | I189: 36526 | J189: 6
A190: =ROW()-2 -> 2734 | B190: TP | C190: 4690 | D190: 1 | E190: 04690-5 | F190: 3D Studio Viz R3i 实用培训教程 | G190: 王庆军等 | H190: 36 | I190: 37104 | J190: 8
A191: =ROW()-2 -> 2735 | B191: TP | C191: 1289 | D191: 1 | E191: 01289-X | F191: Rhino 造型专家 | G191: 黄云 等 | H191: 32 | I191: 36923 | J191: 6
A192: =ROW()-2 -> 2736 | B192: TP | C192: 604 | D192: 1 | E192: 00604-0 | F192: 电脑服装样板设计 | G192: 张兆璞 | H192: 20 | I192: 36892 | J192: 16
A193: =ROW()-2 -> 2737 | B193: P- | C193: 3039 | D193: 1 | E193: 7900630392 | F193: Illustrator 绘图宝典 | G193: 叶 翊 | H193: 46.00 | I193: 36982 | J193: 7
A194: =ROW()-2 -> 2738 | B194: P- | C194: 2577 | D194: 1 | E194: 7900625771 | F194: OpenGL 三维动画程序设计（配光盘） | G194: 杨武功等 | H194: 29.00 | I194: 36770 | J194: 14
A195: =ROW()-2 -> 2739 | B195: TP | C195: 5068 | D195: 1 | E195: 05068-6 | F195: MPEG-2运动图像压缩编码国际标准及MPEG的新进展 | G195: 钟玉琢等 | H195: 35 | I195: 37438 | J195: 8
A196: =ROW()-2 -> 2740 | B196: TP | C196: 5151 | D196: 1 | E196: 05151-8 | F196: 设计大师AutoCAD2002高级使用篇 | G196: 孙海林 | H196: 32 | I196: 37347 | J196: 8
A197: =ROW()-2 -> 2741 | B197: TP | C197: 5441 | D197: 1 | E197: 05441-X | F197: Autodesk VIZ 4 经典设计集粹 | G197: 翟志强 | H197: 30 | I197: 37377 | J197: 10
A198: =ROW()-2 -> 2742 | B198: P- | C198: 4147 | D198: 1 | E198: 7900641475 | F198: Rhino3D 2.0 实用设计（配光盘） | G198: 黄少刚等 | H198: 38 | I198: 37378 | J198: 9
A199: =ROW()-2 -> 2743 | B199: TP | C199: 5390 | D199: 1 | E199: 05390-1 | F199: Lightwave 3D角色建模 | G199: JJ N2M3 | H199: 24 | I199: 37378 | J199: 10
A200: =ROW()-2 -> 2744 | B200: P- | C200: 4327 | D200: 1 | E200: 7900643273 | F200: photoshop 7.0图像艺术设计实例教程(含光盘) | G200: 郭万军 | H200: 36 | I200: 37469 | J200: 9
A201: =ROW()-2 -> 2745 | B201: TP | C201: 5661 | D201: 1 | E201: 05661-7 | F201: photoshop 7.0全方位突破 | G201: 龚正伟等 | H201: 30 | I201: 37469 | J201: 10
A202: =ROW()-2 -> 2746 | B202: P- | C202: 4353 | D202: 1 | E202: 7900643532 | F202: Photoshop 7.0 经典实例详解（配光盘） | G202: 朱仁成等 | H202: 36.00 | I202: 37530 | J202: 7
A203: =ROW()-2 -> 2747 | B203: P- | C203: 4370 | D203: 1 | E203: 7900643702 | F203: SolidWorks 2001 Plus原厂教育训练手册（上）（配光盘） | G203: 实威科技 | H203: 49.00 | I203: 37530 | J203: 7
A204: =ROW()-2 -> 2748 | B204: TP | C204: 5791 | D204: 1 | E204: 05791-5 | F204: ＩＰ认证园地系列：Illustrator & Photoshop 平面设计电视讲座教程 | G204: 马鑫等 | H204: 36.00 | I204: 37530 | J204: 8
A205: =ROW()-2 -> 2749 | B205: TP | C205: 5820 | D205: 1 | E205: 05820-2 | F205: IP认证园地系列：PageMaker & Acrobat Adobe出版工具电视讲座教程 | G205: 马鑫等 | H205: 39.00 | I205: 37530 | J205: 7
F206: 人工智能
A207: =ROW()-2 -> 2751 | B207: TP | C207: 2962 | D207: 2 | E207: 02962-8 | F207: 神经网络与模糊控制 | G207: 张乃尧等 | H207: 19.50 | I207: 36861 | J207: 10
A208: =ROW()-2 -> 2752 | B208: TP | C208: 1307 | D208: 7 | E208: 01307-1 | F208: 人工智能原理 | G208: 石纯一等 | H208: 15.00 | I208: 37500 | J208: 15
A209: =ROW()-2 -> 2753 | B209: TP | C209: 2127 | D209: 5 | E209: 02127-9 | F209: 人工智能及其应用(第2版) | G209: 蔡自兴等 | H209: 32.50 | I209: 37438 | J209: 6
A210: =ROW()-2 -> 2754 | B210: TP | C210: 3879 | D210: 1 | E210: 03879-1 | F210: 智能卡应用系统 | G210: 黄淼云等 | H210: 20.00 | I210: 36770 | J210: 13
A211: =ROW()-2 -> 2755 | B211: TP | C211: 3971 | D211: 1 | E211: 03971-2 | F211: 智能卡技术―― IC 卡（第二版） | G211: 王爱英 | H211: 29.00 | I211: 37073 | J211: 8
A212: =ROW()-2 -> 2756 | B212: TP | C212: 2431 | D212: 2 | E212: 02431-6 | F212: 智能控制理论与技术 | G212: 孙增圻 | H212: 32.00 | I212: 37530 | J212: 7
F213: 软件技术与软件工程
A214: =ROW()-2 -> 2758 | B214: TP | C214: 2799 | D214: 9 | E214: 02799-4 | F214: 软件工程导论(第3版) | G214: 张海藩 | H214: 24.00 | I214: 2002.8 | J214: 8
A215: =ROW()-2 -> 2759 | B215: TP | C215: 2709 | D215: 1 | E215: 02709-9 | F215: 计算机软件著作权保护 | G215: 寿 步 | H215: 23.80 | I215: 1997 | J215: 8
A216: =ROW()-2 -> 2760 | B216: TP | C216: 2726 | D216: 1 | E216: 02726-9 | F216: Win95 & Internet 文件压缩与防毒 | G216: 许世英 | H216: 20.00 | I216: 1997 | J216: 15
A217: =ROW()-2 -> 2761 | B217: TP | C217: 3811 | D217: 1 | E217: 03811-2 | F217: 软件能力成熟度模型 | G217: 何新贵等 | H217: 28.00 | I217: 36982 | J217: 12
A218: =ROW()-2 -> 2762 | B218: P- | C218: 4145 | D218: 1 | E218: 7900641459 | F218: VB问答式教程（配光盘） | G218: 庞一鸣 | H218: 39.00 | I218: 37347 | J218: 7
A219: =ROW()-2 -> 2763 | B219: P- | C219: 5707 | D219: 1 | E219: 05707-9 | F219: 集成化系统开发的技术基础 | G219: 萧蕴诗等 | H219: 29.00 | I219: 37500 | J219: 10
A220: =ROW()-2 -> 2764 | B220: TP | C220: 5739 | D220: 1 | E220: 05739-7 | F220: CMM：软件过程的管理与改进 | G220: 雷剑文 | H220: 15.00 | I220: 37530 | J220: 20
A221: =ROW()-2 -> 2765 | B221: TP | C221: 5938 | D221: 1 | E221: 05938-1 | F221: 计算机专业教材精选：面向对象的软件工程――构建复杂且多变的系统 | G221: 吴 丹等译 | H221: 45.00 | I221: 37530 | J221: 3
F222: 办公自动化及字表处理
A223: =ROW()-2 -> 2767 | B223: TP | C223: 4861 | D223: 1 | E223: 04861-4 | F223: 中文 Office XP 实用教程 | G223: 王冬 等 | H223: 29.80 | I223: 37327 | J223: 8
A224: =ROW()-2 -> 2768 | B224: TP | C224: 5230 | D224: 1 | E224: 05230-1 | F224: Microsoft office XP新体验 | G224: 王仲麒 | H224: 17.00 | I224: 37377 | J224: 14
A225: =ROW()-2 -> 2769 | B225: TP | C225: 4864 | D225: 1 | E225: 04864-9 | F225: 精通 Office XP 中文版 | G225: 甘登岱等 | H225: 36.00 | I225: 37288 | J225: 7
A226: =ROW()-2 -> 2770 | B226: TP | C226: 4854 | D226: 1 | E226: 04854-1 | F226: Office XP 中文版入门与进阶 | G226: 刘兴亮等 | H226: 31.50 | I226: 37374 | J226: 10
A227: =ROW()-2 -> 2771 | B227: TP | C227: 4903 | D227: 1 | E227: 04903-3 | F227: 中文版 Windows XP 实用培训教程 | G227: 许书明 | H227: 28.00 | I227: 37373 | J227: 9
A228: =ROW()-2 -> 2772 | B228: TP | C228: 5394 | D228: 1 | E228: 05394-1 | F228: Exchange 2000 sever应用程序开发指南 | G228: 唐明湘等 | H228: 26 | I228: 37438 | J228: 9
A229: =ROW()-2 -> 2773 | B229: TP | C229: 4919 | D229: 1 | E229: 04919-X | F229: Exchange 2000 应用程序开发经典 | G229: 贾建平译 | H229: 39.00 | I229: 37196 | J229: 7
A230: =ROW()-2 -> 2774 | B230: TP | C230: 4495 | D230: 1 | E230: 04495-3 | F230: Word 2002 中文版实用培训教程 | G230: 许书明等 | H230: 28.00 | I230: 37257 | J230: 9
A231: =ROW()-2 -> 2775 | B231: TP | C231: 4825 | D231: 1 | E231: 04825-8 | F231: 中文 Word 2002 培训教程 | G231: 王诚君 | H231: 25.00 | I231: 37135 | J231: 9
A232: =ROW()-2 -> 2776 | B232: TP | C232: 4855 | D232: 2 | E232: 04855-X | F232: 中文 Word 2002 简明教程 | G232: 罗运模等 | H232: 32.00 | I232: 37372 | J232: 10
A233: =ROW()-2 -> 2777 | B233: TP | C233: 4950 | D233: 1 | E233: 04950-5 | F233: 中文 Excel 2002 及其在财务管理和投资分析中的应用 | G233: 罗运模等 | H233: 29.00 | I233: 37336 | J233: 10
A234: =ROW()-2 -> 2778 | B234: TP | C234: 3378 | D234: 2 | E234: 03378-1 | F234: Excel 在财务管理中的应用 | G234: 侯国屏等编 | H234: 18.00 | I234: 37257 | J234: 12
A235: =ROW()-2 -> 2779 | B235: TP | C235: 4781 | D235: 1 | E235: 04781-2 | F235: 网上办公一册通――中文版Word 2002、Excel 2002、FrontPage 2002 | G235: 袁建华等 | H235: 45.00 | I235: 37135 | J235: 6
A236: =ROW()-2 -> 2780 | B236: TP | C236: 4957 | D236: 1 | E236: 04957-2 | F236: 中文 Office XP 培训教程 | G236: 王诚君 | H236: 28 | I236: 37165 | J236: 8
A237: =ROW()-2 -> 2781 | B237: TP | C237: 4834 | D237: 1 | E237: 04834-7 | F237: WPS Office 上网办公一册通 | G237: 王毅 等 | H237: 28 | I237: 37165 | J237: 9
A238: =ROW()-2 -> 2782 | B238: TP | C238: 4968 | D238: 1 | E238: 04968-8 | F238: WPS Office 简明教程 | G238: 罗运模等 | H238: 32.5 | I238: 37196 | J238: 8
A239: =ROW()-2 -> 2783 | B239: TP | C239: 4419 | D239: 1 | E239: 04419-8 | F239: 学电脑不求人（Windows98、Word2000、Excel2000 快易通教程） | H239: 18.00 | I239: 37012 | J239: 11
A240: =ROW()-2 -> 2784 | B240: TP | C240: 0823 | D240: 1 | E240: 00823-X | F240: Acrobat 4.0 中文版应用教程 | G240: 方满洲等 | H240: 29.00 | I240: 36770 | J240: 9
A241: =ROW()-2 -> 2785 | B241: TP | C241: 3785 | D241: 1 | E241: 03785-X | F241: 图文双解 Office 2000 应用大全 | G241: 尹锵等译 | H241: 62.00 | I241: 36526 | J241: 5
A242: =ROW()-2 -> 2786 | B242: TP | C242: 0778 | D242: 1 | E242: 00778-0 | F242: 中文 Access 问题与技巧精解 | G242: 叶 彬 | H242: 28.00 | I242: 36739 | J242: 9
A243: =ROW()-2 -> 2787 | B243: TP | C243: 4780 | D243: 1 | E243: 04780-4 | F243: 精通中文版 Access 2002 数据库开发与应用 | G243: 梁书斌等 | H243: 49 | I243: 37135 | J243: 6
A244: =ROW()-2 -> 2788 | B244: TP | C244: 4264 | D244: 1 | E244: 04264-0 | F244: 中文 Access 2000 培训教程 | G244: 王诚君 | H244: 22.00 | I244: 36951 | J244: 9
A245: =ROW()-2 -> 2789 | B245: TP | C245: 4431 | D245: 1 | E245: 04431-7 | F245: 用 Access 2000 和 VisualFoxPro 6.0 管理公司和个人数据 | G245: 肖勇波等 | H245: 29.00 | I245: 37043 | J245: 9
A246: =ROW()-2 -> 2790 | B246: TP | C246: 1001 | D246: 1 | E246: 01001-3 | F246: 精通 Office 2000 | G246: 甘登岱等 | H246: 49.00 | I246: 37330 | J246: 5
A247: =ROW()-2 -> 2791 | B247: TP | C247: 3766 | D247: 2 | E247: 03766-3 | F247: Office 2000 中文版使用与技巧 | G247: 高越明等 | H247: 36.00 | I247: 36800 | J247: 8
A248: =ROW()-2 -> 2792 | B248: TP | C248: 3624 | D248: 1 | E248: 03624-1 | F248: Word 2000 中文版使用与技巧 | G248: 木林森等 | H248: 22.00 | I248: 36557 | J248: 13
A249: =ROW()-2 -> 2793 | B249: TP | C249: 3765 | D249: 2 | E249: 03765-5 | F249: Excel 2000 中文版使用与技巧 | G249: 木林森等 | H249: 20.00 | I249: 36526 | J249: 13
A250: =ROW()-2 -> 2794 | B250: TP | C250: 2074 | D250: 2 | E250: 02074-4 | F250: PowerPoint 2000 中文版使用与技巧 | G250: 付新丽等 | H250: 25.00 | I250: 36526 | J250: 11
A251: =ROW()-2 -> 2795 | B251: P- | C251: 4316 | D251: 1 | E251: 7900643168 | F251: 会计信息系统实验教程（配光盘） | G251: 王新玲汪刚主编 | H251: 28.80 | I251: 37438 | J251: 10
A252: =ROW()-2 -> 2796 | B252: TP | C252: 1227 | D252: 3 | E252: 01227-X | F252: 电子表格化财务、会计与管理 | G252: 王啸 等 | H252: 36.00 | I252: 37104 | J252: 8
A253: =ROW()-2 -> 2797 | B253: TP | C253: 4537 | D253: 1 | E253: 04537-2 | F253: Excel 2002 中文版实用培训教程 | G253: 韩伟峰等 | H253: 32 | I253: 37073 | J253: 9
A254: =ROW()-2 -> 2798 | B254: TP | C254: 3595 | D254: 2 | E254: 03595-4 | F254: Word 2000 命令与实例 | G254: 赖晓凌 | H254: 28.50 | I254: 36404 | J254: 9
A255: =ROW()-2 -> 2799 | B255: TP | C255: 3541 | D255: 1 | E255: 03541-5 | F255: Excel 2000 命令与实例 | G255: 曾 毅 | H255: 28.50 | I255: 36312 | J255: 9
A256: =ROW()-2 -> 2800 | B256: TP | C256: 3575 | D256: 1 | E256: 03575-X | F256: Access 2000 命令与实例 | G256: 陈立航 | H256: 28.50 | I256: 36831 | J256: 9
A257: =ROW()-2 -> 2801 | B257: TP | C257: 3542 | D257: 2 | E257: 03542-3 | F257: PowerPoint 2000 命令与实例 | G257: 方延风等 | H257: 28.50 | I257: 36404 | J257: 9
A258: =ROW()-2 -> 2802 | B258: TP | C258: 3687 | D258: 2 | E258: 03687-X | F258: FrontPage 2000 命令与实例 | G258: 张大为等 | H258: 28.50 | I258: 36739 | J258: 9
A259: =ROW()-2 -> 2803 | B259: TP | C259: 3529 | D259: 2 | E259: 03529-6 | F259: WPS 2000 入门与技巧 | G259: 曹国均等 | H259: 38.00 | I259: 36434 | J259: 7
A260: =ROW()-2 -> 2804 | B260: TP | C260: 3001 | D260: 1 | E260: 03001-4 | F260: 易学易用UCDOS/WIN 7.0 | G260: 曹国钧等 | H260: 36.00 | I260: 1998 | J260: 9
A261: =ROW()-2 -> 2805 | B261: TP | C261: 3535 | D261: 1 | E261: 03535-0 | F261: 中文 Word 2000 培训教程 | G261: 科海中心 | H261: 28.00 | I261: 36312 | J261: 8
A262: =ROW()-2 -> 2806 | B262: TP | C262: 3658 | D262: 1 | E262: 03658-6 | F262: 中文 Excel 2000 培训教程 | G262: 王诚君 | H262: 26.00 | I262: 36373 | J262: 9
A263: =ROW()-2 -> 2807 | B263: TP | C263: 3655 | D263: 1 | E263: 03655-1 | F263: 郑码输入法操作教程 | G263: 崔彦文等 | H263: 16.00 | I263: 36526 | J263: 15
A264: =ROW()-2 -> 2808 | B264: TP | C264: 0813 | D264: 1 | E264: 00813-2 | F264: 智能 ABC 教程（配光盘） | G264: 李政等 | H264: 25.00 | I264: 36861 | J264: 22
A265: =ROW()-2 -> 2809 | B265: TP | C265: 4557 | D265: 1 | E265: 04557-7 | F265: 巧学巧用系列丛书――巧学巧用五笔字型 (第3版） | G265: 钟道隆 | H265: 18.00 | I265: 37377 | J265: 14
A266: =ROW()-2 -> 2810 | B266: TP | C266: 5538 | D266: 1 | E266: 05538-6 | F266: 巧学巧用系列丛书――巧学巧用Photoshop 7.0 | G266: 应勤等 | H266: 29.00 | I266: 37469 | J266: 8
A267: =ROW()-2 -> 2811 | B267: TP | C267: 5125 | D267: 1 | E267: 05125-9 | F267: 巧学巧用系列丛书――巧学巧用photoshop 6.x中文版 | G267: 周韬等 | H267: 28.00 | I267: 37355 | J267: 10
A268: =ROW()-2 -> 2812 | B268: TP | C268: 5125 | D268: 1 | E268: 05125-9 | F268: 巧学巧用系列丛书――巧学巧用photoshop 6.x中文版 | G268: 周韬等 | H268: 28.00 | I268: 37355 | J268: 10
A269: =ROW()-2 -> 2813 | B269: TP | C269: 5782 | D269: 1 | E269: 05782-6 | F269: 巧学巧用系列：巧学巧用Windows XP中文版 | G269: 李毅 | H269: 24.00 | I269: 37500 | J269: 9
A270: =ROW()-2 -> 2814 | B270: TP | C270: 4891 | D270: 1 | E270: 04891-6 | F270: 巧学巧用系列丛书――巧学巧用AutoCAD 2002 | G270: 王旭升 | H270: 29 | I270: 37319 | J270: 8
A271: =ROW()-2 -> 2815 | B271: TP | C271: 4548 | D271: 1 | E271: 04548-8 | F271: 巧学巧用 Office XP 中文版 | G271: 余琦 等 | H271: 29 | I271: 37135 | J271: 8
A272: =ROW()-2 -> 2816 | B272: TP | C272: 2190 | D272: 9 | E272: 02190-2 | F272: 巧学巧用系列丛书――巧学巧用五笔字型 (第2版） | G272: 钟道隆 | H272: 18.80 | I272: 36892 | J272: 13
A273: =ROW()-2 -> 2817 | B273: TP | C273: 4870 | D273: 1 | E273: 04870-3 | F273: 最好用的五笔字型――智能五笔（配软盘） | G273: 陈 虎 | H273: 23 | I273: 37500 | J273: 10
A274: =ROW()-2 -> 2818 | B274: TP | C274: 2668 | D274: I | E274: 02668-8 | F274: 趣味速学五笔字型 | G274: 杨植莲 | H274: 15.00 | I274: 37500 | J274: 15
A275: =ROW()-2 -> 2819 | B275: TP | C275: 2668 | D275: E | E275: 02668-8 | F275: 趣味速学五笔字型（配光盘） | G275: 杨植莲 | H275: 29.00 | I275: 37438 | J275: 15
A276: =ROW()-2 -> 2820 | B276: TP | C276: 3615 | D276: 1 | E276: 03615-2 | F276: 趣味速学 98 王码 | G276: 杨植莲 | H276: 15.00 | I276: 36617 | J276: 20
A277: =ROW()-2 -> 2821 | B277: TP | C277: 1718 | D277: 1 | E277: 01718- | F277: 五笔字型学习捷径 | G277: 庄跃辉等 | H277: 15.00 | I277: 1997 | J277: 13
A278: =ROW()-2 -> 2822 | B278: TP | C278: 5846 | D278: 1 | E278: 05846-6 | F278: 五笔字型简明教程 | G278: 东方人华 | H278: 18.00 | I278: 37500 | J278: 15
A279: =ROW()-2 -> 2823 | B279: TP | C279: 5694 | D279: 1 | E279: 05694-3 | F279: 86/98 版双解五笔字型字词编码速查手册 | G279: 视点工作室 | H279: 20.00 | I279: 37501 | J279: 12
A280: =ROW()-2 -> 2824 | B280: TP | C280: 1469 | D280: 6 | E280: 01469-3 | F280: 打字指法练习与电脑输入 | G280: 陈炳旭等 | H280: 15.80 | I280: 1998 | J280: 10
A281: =ROW()-2 -> 2825 | B281: P- | C281: 2263 | D281: 1 | E281: 7900622632 | F281: 电脑学校 2000 入门篇 (配光盘) | G281: 博彦公司 | H281: 26.00 | I281: 36526 | J281: 14
A282: =ROW()-2 -> 2826 | B282: P- | C282: 1771 | D282: 2 | E282: 790061771X | F282: 电脑学校 2000 基础篇 (配光盘) | G282: 博彦公司 | H282: 32.00 | I282: 36557 | J282: 15
A283: =ROW()-2 -> 2827 | B283: P- | C283: 1770 | D283: 1 | E283: 7900617701 | F283: 电脑学校 2000 应用篇 (配光盘) | G283: 博彦公司 | H283: 32.00 | I283: 36343 | J283: 14
A284: =ROW()-2 -> 2828 | B284: P- | C284: 1772 | D284: 1 | E284: 7900617728 | F284: 电脑学校 2000 扩展篇 (配光盘) | G284: 博彦公司 | H284: 32.00 | I284: 36342 | J284: 14
A285: =ROW()-2 -> 2829 | B285: P- | C285: 1773 | D285: 2 | E285: 7900617736 | F285: 电脑学校 2000 Internet篇 (配光盘) | G285: 博彦公司 | H285: 32.00 | I285: 36526 | J285: 9
A286: =ROW()-2 -> 2830 | B286: TP | C286: 3820 | D286: 1 | E286: 03820-1 | F286: 电脑打字实用教材（第2版） | G286: 康东日 | H286: 18.00 | I286: 37012 | J286: 15
A287: =ROW()-2 -> 2831 | B287: TP | C287: 4930 | D287: 1 | E287: 04930-0 | F287: PageMaker 专业排版技术与实例分析 | G287: 孙江宏等 | H287: 28 | I287: 37328 | J287: 9
A288: =ROW()-2 -> 2832 | B288: TP | C288: 4791 | D288: 1 | E288: 04791-X | F288: 北大方正书版9.01培训教程 | G288: 楠天健 | H288: 38 | I288: 37104 | J288: 8
A289: =ROW()-2 -> 2833 | B289: TP | C289: 5087 | D289: 1 | E289: 05087-2 | F289: 精通彩色页面排版和 Web 页设计 | G289: 龚正伟 | H289: 24.00 | I289: 37257 | J289: 13
A290: =ROW()-2 -> 2834 | B290: TP | C290: 1392 | D290: 8 | E290: 01392-6 | F290: 电脑文字编辑与数据处理 | G290: 康东日 | H290: 12.50 | I290: 1997 | J290: 12
A291: =ROW()-2 -> 2835 | B291: TP | C291: 1879 | D291: 6 | E291: 01879-0 | F291: 微型计算机操作员录入员培训教材 (第3版) | G291: 刘尊全等 | H291: 28.00 | I291: 1998 | J291: 6
A292: =ROW()-2 -> 2836 | B292: TP | C292: 2600 | D292: 3 | E292: 02600-9 | F292: 计算机文字录入处理员技术等级考试题解 （第2版） | G292: 吴克忠 | H292: 17.50 | I292: 1999 | J292: 12
A293: =ROW()-2 -> 2837 | B293: TP | C293: 1937 | D293: 5 | E293: 01937-1 | F293: 计算机操作与上机指导培训教程(上) | G293: 王路敬等 | H293: 24.00 | I293: 1998 | J293: 11
A294: =ROW()-2 -> 2838 | B294: TP | C294: 1938 | D294: 4 | E294: 01938-X | F294: 计算机操作与上机指导培训教程(下) | G294: 王路敬等 | H294: 21.00 | I294: 1998 | J294: 13
A295: =ROW()-2 -> 2839 | B295: TP | C295: 4007 | D295: 1 | E295: 04007-9 | F295: 新编电脑实用教程 | G295: 刘小伟 | H295: 27.00 | I295: 37043 | J295: 12
A296: =ROW()-2 -> 2840 | B296: TP | C296: 4360 | D296: 1 | E296: 04360-4 | F296: Adobe InDesign 1.5 实用宝典 | G296: 孙玉珊等 | H296: 25.00 | I296: 36982 | J296: 10
A297: =ROW()-2 -> 2841 | B297: TP | C297: 4144 | D297: 1 | E297: 04144-X | F297: Excel 2000中文版函数图书馆 | G297: 程 锦 | H297: 46.00 | I297: 36892 | J297: 6
A298: =ROW()-2 -> 2842 | B298: TP | C298: 5090 | D298: 1 | E298: 05090-2 | F298: WPS Office案例培训教程 | G298: 华源中科辅龙 | H298: 20.00 | I298: 37355 | J298: 12
A299: =ROW()-2 -> 2843 | B299: TP | C299: 5770 | D299: 1 | E299: 05770-2 | F299: Windows XP+Office XP办公应用培训教程 | G299: 王文娟 | H299: 40.00 | I299: 37530 | J299: 7
F300: 计算机硬件、外部设备及维修
A301: =ROW()-2 -> 2845 | B301: TP | C301: 3461 | D301: 5 | E301: 03461-3 | F301: 微机 BIOS 与 CMOS 实用详解 | G301: 王恒青等 | H301: 14.00 | I301: 37043 | J301: 18
A302: =ROW()-2 -> 2846 | B302: TP | C302: 4634 | D302: 1 | E302: 04634-4 | F302: 微机 BIOS 和CMOS 设置与管理图解教程 | G302: 王少华等 | H302: 25.00 | I302: 37327 | J302: 11
A303: =ROW()-2 -> 2847 | B303: P- | C303: 3575 | D303: 1 | E303: 7900635750 | F303: BIOS 研发技术剖析（配光盘） | G303: 陈文钦 | H303: 49 | I303: 37135 | J303: 5
A304: =ROW()-2 -> 2848 | B304: TP | C304: 5517 | D304: 1 | E304: 05517-1 | F304: 掌上型电脑大盘点――全面解读PDA | G304: 时间创作室 | H304: 19.00 | I304: 37438 | J304: 13
A305: =ROW()-2 -> 2849 | B305: TP | C305: 4792 | D305: 1 | E305: 04792-8 | F305: iMac 万事无忧 | G305: 刘建昌等译 | H305: 49 | I305: 37196 | J305: 7
A306: =ROW()-2 -> 2850 | B306: TP | C306: 5051 | D306: 1 | E306: 05051-1 | F306: 电脑使用万事通――软、硬件及外围设备大揭密 | G306: 郭玲文 | H306: 30.00 | I306: 37336 | J306: 9
A307: =ROW()-2 -> 2851 | B307: TP | C307: 3040 | D307: 1 | E307: 03040-5 | F307: 微型计算机及外部设备常用芯片手册 | G307: 编辑委员会 | H307: 78.00 | I307: 36495 | J307: 4
A308: =ROW()-2 -> 2852 | B308: TP | C308: 3895 | D308: 1 | E308: 03895-3 | F308: 硬件大师 | G308: 秋实工作室 | H308: 32.8 | I308: 37316 | J308: 8
A309: =ROW()-2 -> 2853 | B309: TP | C309: 0674 | D309: 1 | E309: 00674-1 | F309: 电脑与网络超频、提速及配置实例 | G309: 曹国钧等 | H309: 59.00 | I309: 36831 | J309: 4
A310: =ROW()-2 -> 2854 | B310: TP | C310: 1274 | D310: 1 | E310: 01274-1 | F310: 驱动器与内存故障处理手册 | G310: 李晔 译 | H310: 28.00 | I310: 36892 | J310: 12
A311: =ROW()-2 -> 2855 | B311: TP | C311: 4261 | D311: 1 | E311: 04261-6 | F311: 打印机故障处理手册 | H311: 24.00 | I311: 36951 | J311: 14
A312: =ROW()-2 -> 2856 | B312: TP | C312: 1308 | D312: 1 | E312: 01308-X | F312: 电脑性能测试与超频 | G312: 易鸿 等 | H312: 25.00 | I312: 36951 | J312: 11
A313: =ROW()-2 -> 2857 | B313: TP | C313: 3318 | D313: 2 | E313: 03318-8 | F313: MPP 嵌入式计算机设计 | G313: 沈绪榜 | H313: 40.00 | I313: 36404 | J313: 6
A314: =ROW()-2 -> 2858 | B314: TP | C314: 3436 | D314: 1 | E314: 03436-2 | F314: 数字相机入门 | G314: 水 木 | H314: 35.00 | I314: 36342 | J314: 22
A315: =ROW()-2 -> 2859 | B315: TP | C315: 1491 | D315: 1 | E315: 01491-4 | F315: 激光印字机原理及维修 | G315: 曲志深 | H315: 5.00 | I315: 1994 | J315: 30
A316: =ROW()-2 -> 2860 | B316: TP | C316: 1733 | D316: 2 | E316: 01733-6 | F316: 喷墨打印机原理与维修 | G316: 曲志深 | H316: 8.80 | I316: 1997 | J316: 20
A317: =ROW()-2 -> 2861 | B317: TP | C317: 2043 | D317: 1 | E317: 02043-4 | F317: EPSON打印机使用大全 | G317: 金山编辑室 | H317: 26.50 | I317: 1996 | J317: 8
A318: =ROW()-2 -> 2862 | B318: TP | C318: 2024 | D318: 2 | E318: 02024-8 | F318: 扫描仪的原理与开发应用 | G318: 郭繁夏 | H318: 16.80 | I318: 1997 | J318: 12
A319: =ROW()-2 -> 2863 | B319: TP | C319: 3753 | D319: 2 | E319: 03753-1 | F319: CD-R/RW光盘刻录 ABC | G319: 简中山 | H319: 28.50 | I319: 36678 | J319: 9
A320: =ROW()-2 -> 2864 | B320: TP | C320: 2091 | D320: 2 | E320: 02091-4 | F320: PC机外部设备的配置、使用与维护 (第2版) | G320: 韩乐 等 | H320: 8.00 | I320: 1997 | J320: 22
A321: =ROW()-2 -> 2865 | B321: TP | C321: 3949 | D321: 1 | E321: 03949-6 | F321: 最新电脑装机与调试 | G321: 袁 辉等 | H321: 25.00 | I321: 37104 | J321: 10
A322: =ROW()-2 -> 2866 | B322: TP | C322: 5367 | D322: 1 | E322: 05367-7 | F322: 最新电脑装机与调试（第二版） | G322: 刘小伟等 | H322: 31.00 | I322: 37377 | J322: 9
A323: =ROW()-2 -> 2867 | B323: TP | C323: 4838 | D323: 1 | E323: 04838-X | F323: 装机大师 | G323: 秋实科技 | H323: 18 | I323: 37323 | J323: 13
A324: =ROW()-2 -> 2868 | B324: TP | C324: 4293 | D324: 1 | E324: 04293-4 | F324: 学电脑、装电脑、修电脑不求人 | H324: 23.00 | I324: 36982 | J324: 9
A325: =ROW()-2 -> 2869 | B325: TP | C325: 5884 | D325: 1 | E325: 05884-9 | F325: 学、装、修电脑不求人(第二版） | H325: 29.50 | I325: 37500 | J325: 7
A326: =ROW()-2 -> 2870 | B326: P- | C326: 3085 | D326: 1 | E326: 7900630856 | F326: 硬盘故障不求人 （配光盘） | G326: 林东和 | H326: 27.00 | I326: 36982 | J326: 12
A327: =ROW()-2 -> 2871 | B327: TP | C327: 4904 | D327: 1 | E327: 04904-1 | F327: 排除电脑故障实例精选 | G327: 王寒晖 | H327: 19.00 | I327: 37377 | J327: 12
A328: =ROW()-2 -> 2872 | B328: TP | C328: 3606 | D328: 1 | E328: 03606-3 | F328: 电脑自维修手册 | G328: 林东和 | H328: 24.00 | I328: 36312 | J328: 12
A329: =ROW()-2 -> 2873 | B329: TP | C329: 3536 | D329: 1 | E329: 03536-9 | F329: 电脑工程师维修教程 | G329: 吴志滨等译 | H329: 62.00 | I329: 36312 | J329: 6
A330: =ROW()-2 -> 2874 | B330: TP | C330: 1525 | D330: 4 | E330: 01525-2 | F330: 微机故障诊断与维修实用大全 | G330: 袁忠良等 | H330: 42.00 | I330: 1997 | J330: 4
A331: =ROW()-2 -> 2875 | B331: TP | C331: 1791 | D331: 3 | E331: 01791-3 | F331: 微机常见故障诊断与排除的软件技术 | G331: 谢深泉 | H331: 18.00 | I331: 1999 | J331: 12
A332: =ROW()-2 -> 2876 | B332: TP | C332: 2679 | D332: 5 | E332: 02679-3 | F332: 微机常见故障会诊 | G332: 金 帆 | H332: 21.00 | I332: 1999 | J332: 10
A333: =ROW()-2 -> 2877 | B333: TP | C333: 3882 | D333: 1 | E333: 03882-1 | F333: 微机常见故障会诊（修订版） | G333: 杜昌领 | H333: 27.00 | I333: 36982 | J333: 10
A334: =ROW()-2 -> 2878 | B334: TP | C334: 5937 | D334: 1 | E334: 05937-3 | F334: USB ２.0硬件设计 | G334: 萧世文 | H334: 35.00 | I334: 37530 | J334: 9
F335: 管理信息技术
A336: =ROW()-2 -> 2880 | B336: TP | C336: 3173 | D336: 1 | E336: 03173-8 | F336: 管理信息系统设计与实现 | G336: 黎连业 | H336: 20.00 | I336: 1998 | J336: 13
A337: =ROW()-2 -> 2881 | B337: P- | C337: 4340 | D337: 1 | E337: 7900643400 | F337: 企业信息化自助纲要（配光盘） | G337: 高展等 | H337: 33.00 | I337: 37521 | J337: 5
A338: =ROW()-2 -> 2882 | B338: TP | C338: 5585 | D338: 1 | E338: 05585-8 | F338: 基于价值链的企业流程再选与信息集成 | G338: 王田苗 | H338: 43 | I338: 37500 | J338: 7
A339: =ROW()-2 -> 2883 | B339: TP | C339: 5864 | D339: 4 | E339: 05864-4 | F339: 管理信息系统原理与应用 | G339: 罗超理等 | H339: 32.00 | I339: 37500 | J339: 9
A340: =ROW()-2 -> 2884 | B340: TP | C340: 4473 | D340: 1 | E340: 04473-2 | F340: GLOBAL DIGITAL LIBRARY DEVELOPMENT in the New Millennium ――Fertile Ground for Distributed Cross-Disciplinary Collaboration （新千年全球数字图书馆的发展――众多交叉学科合作的沃土） | G340: Ching-chih Chen | H340: 198.00 | I340: 37043 | J340: 3
A341: =ROW()-2 -> 2885 | B341: TP | C341: 4218 | D341: 1 | E341: 04218-7 | F341: 信息工程――创建企业计算机信息系统的工程 | G341: 耿继秀 | H341: 15.00 | I341: 37257 | J341: 16
F342: 信息产业
A343: =ROW()-2 -> 2887 | B343: TP | C343: 1224 | D343: 1 | E343: 01224-5 | F343: 新世纪初信息产业导向 | G343: 雷晓明等 | H343: 56.00 | I343: 36800 | J343: 6
A344: =ROW()-2 -> 2888 | B344: TP | C344: 5307 | D344: 1 | E344: 05307-3 | F344: 信息资源规划――信息化建设基础工程 | G344: 高复先 | H344: 22.00 | I344: 37347 | J344: 11
A345: =ROW()-2 -> 2889 | B345: TP | C345: 1431 | D345: 1 | E345: 01431-2 | F345: 信息化先锋 | G345: 陈禹等 | H345: 130.00 | I345: 37347 | J345: 10
F346: 计算机在各个领域中的应用
A347: =ROW()-2 -> 2891 | B347: TP | C347: 2645 | D347: 1 | E347: 02645-9 | F347: 并行工程原理及应用 | G347: 潘雪增 | H347: 16.00 | I347: 1997 | J347: 14
A348: =ROW()-2 -> 2892 | B348: TP | C348: 1178 | D348: 1 | E348: 01178-8 | F348: MatLab 工程数学应用 | G348: 许波 等 | H348: 39.80 | I348: 36861 | J348: 7
A349: =ROW()-2 -> 2893 | B349: TP | C349: 1168 | D349: 1 | E349: 01168-0 | F349: Protel 99 电路设计指南 | G349: 王彦平等 | H349: 24 | I349: 37328 | J349: 11
A350: =ROW()-2 -> 2894 | B350: P- | C350: 3070 | D350: 1 | E350: 7900630708 | F350: Protel 99 SE 电路设计与仿真应用（配光盘） | G350: 梁恩主等 | H350: 49 | I350: 36831 | J350: 6
A351: =ROW()-2 -> 2895 | B351: TP | C351: 4451 | D351: 1 | E351: 04451-1 | F351: Protel PCB 99 SE 电路板设计 | G351: 谢淑如等 | H351: 48 | I351: 37257 | J351: 5
A352: =ROW()-2 -> 2896 | B352: TP | C352: 4079 | D352: 1 | E352: 04079-6 | F352: 数字图书馆 ―― 原理与技术实现 | G352: 高文 等 | H352: 39.50 | I352: 36800 | J352: 6
A353: =ROW()-2 -> 2897 | B353: TU | C353: 2145 | D353: 1 | E353: 02145-7 | F353: 建筑工程计算机应用系列教材：工程结构计算机仿真分析 | G353: 江见鲸 | H353: 17.60 | I353: 1996 | J353: 11
A354: =ROW()-2 -> 2898 | B354: TU | C354: 2875 | D354: 1 | E354: 02875-3 | F354: 建筑结构计算机分析及程序 | G354: 江见鲸等 | H354: 18.80 | I354: 1998 | J354: 10
A355: =ROW()-2 -> 2899 | B355: TP | C355: 2289 | D355: 2 | E355: 02289-5 | F355: 建筑结构计算机分析及程序 | G355: 张 戈 | H355: 73.00 | I355: 1997 | J355: 6
A356: =ROW()-2 -> 2900 | B356: G- | C356: 5599 | D356: 1 | E356: 05599-1 | F356: 电脑启示录（中篇）硅谷的秘密 | G356: 徐志伟 | H356: 18.00 | I356: 37438 | J356: 13
A357: =ROW()-2 -> 2901 | B357: P | C357: 4185 | D357: 1 | E357: 7900641858 | F357: MIDI技巧与数字音频（配光盘） | G357: 颜东成等 | H357: 43.00 | I357: 37404 | J357: 7
A358: =ROW()-2 -> 2902 | B358: TP | C358: 5743 | D358: 1 | E358: 05743-5 | F358: Protel 电路设计教程 | G358: 江思敏等 | H358: 32.00 | I358: 37500 | J358: 8
A359: =ROW()-2 -> 2903 | B359: TH | C359: 3198 | D359: 1 | E359: 03198-3 | F359: 计算机辅助制造 | G359: 王先逵 | H359: 14.00 | I359: 36861 | J359: 15
A360: =ROW()-2 -> 2904 | B360: TP | C360: 4224 | D360: 1 | E360: 04224-1 | F360: 机械系统计算机控制 | G360: 钟约先等 | H360: 36.00 | I360: 36982 | J360: 6
A361: =ROW()-2 -> 2905 | B361: TP | C361: 2502 | D361: 1 | E361: 02502-9 | F361: 计算机辅助光学测量 | G361: 金观昌 | H361: 19.50 | I361: 1997 | J361: 12
A362: =ROW()-2 -> 2906 | B362: TP | C362: 4550 | D362: 1 | E362: 04550-X | F362: 智能建筑火灾监控系统设计 | G362: 陈 南 | H362: 24 | I362: 37073 | J362: 12
A363: =ROW()-2 -> 2907 | B363: TU | C363: 2229 | D363: 4 | E363: 02229-1 | F363: 智能建筑 | G363: 张瑞武 | H363: 36 | I363: 37257 | J363: 8
A364: =ROW()-2 -> 2908 | B364: P | C364: 3738 | D364: 1 | E364: 7900637389 | F364: Delphi构建进销存系统――POS系统开发实例 | G364: 黄文钰 | H364: 55.00 | I364: 37408 | J364: 6
A365: =ROW()-2 -> 2909 | B365: TP | C365: 5150 | D365: 1 | E365: 05150-X | F365: Intranet技术及在住宅智能化中的应用 | G365: 吴成东 | H365: 38.00 | I365: 37347 | J365: 8
A366: =ROW()-2 -> 2910 | B366: TP | C366: 5281 | D366: 1 | E366: 05281-6 | F366: 精通ChemDraw | G366: 胡立江 | H366: 21.00 | I366: 37347 | J366: 12
A367: =ROW()-2 -> 2911 | B367: TP | C367: 5331 | D367: 1 | E367: 05331-6 | F367: 安全电子商务实用技术 | G367: 张炯明 | H367: 28.00 | I367: 37347 | J367: 10
A368: =ROW()-2 -> 2912 | B368: TP | C368: 5103 | D368: 1 | E368: 05103-8 | F368: 有限元分析基础篇ANSYS与Mathematica | G368: 夸克工作室 | H368: 48.00 | I368: 37469 | J368: 5
A369: =ROW()-2 -> 2913 | B369: TP | C369: 5154 | D369: 1 | E369: 05154-2 | F369: 有限元分析基础篇ANSYS与Matlab | G369: 夸克工作室 | H369: 48.00 | I369: 37316 | J369: 5
A370: =ROW()-2 -> 2914 | B370: TP | C370: 5229 | D370: 1 | E370: 05229-8 | F370: 精通ANSYS | G370: 刘涛等 | H370: 43.00 | I370: 37500 | J370: 6
A371: =ROW()-2 -> 2915 | B371: TP | C371: 5879 | D371: 1 | E371: 05879-2 | F371: 系统实时仿真开发环境与应用 | G371: 杨涤 | H371: 46.00 | I371: 37530 | J371: 7
F372: 7.学术专著
A373: =ROW()-2 -> 2917 | B373: TP | C373: 3200 | D373: 2 | E373: 03200-9 | F373: HNC（概念层次网络）理论――计算机理解语言研究的新思路 | G373: 黄曾阳 | H373: 66.00 | I373: 36586 | J373: 5
A374: =ROW()-2 -> 2918 | B374: TP | C374: 4477 | D374: 1 | E374: 04477-5 | F374: 认知逻辑导论 | G374: 周昌乐 | H374: 25.00 | I374: 37043 | J374: 19
A375: =ROW()-2 -> 2919 | B375: TP | C375: 4475 | D375: 1 | E375: 04475-9 | F375: 世纪之交的知识工程与知识科学 | G375: 陆汝钤 | H375: 46 | I375: 37135 | J375: 6
A376: =ROW()-2 -> 2920 | B376: TP | C376: 2935 | D376: 1 | E376: 02935-0 | F376: 现代汉语语法信息词典详解（精） | G376: 俞士汶等 | H376: 86.00 | I376: 1998 | J376: 3
A377: =ROW()-2 -> 2921 | B377: TP | C377: 1875 | D377: 3 | E377: 01875-8 | F377: 高等计算机系统结构 | G377: 王鼎兴等译 | H377: 36.00 | I377: 37196 | J377: 4
A378: =ROW()-2 -> 2922 | B378: TP | C378: 3976 | D378: 1 | E378: 03976-3 | F378: 密码分析学 | G378: 冯登国 | H378: 14.00 | I378: 36861 | J378: 20
A379: =ROW()-2 -> 2923 | B379: P- | C379: 3782 | D379: 1 | E379: 7900637826 | F379: Mathcad 2001详解（配盘） | G379: 纪哲锐 | H379: 38 | I379: 37288 | J379: 9
A380: =ROW()-2 -> 2924 | B380: TP | C380: 4379 | D380: 1 | E380: 04379-5 | F380: 密码学与计算机网络安全 | G380: 卿斯汉 | H380: 28 | I380: 37327 | J380: 10
A381: =ROW()-2 -> 2925 | B381: TP | C381: 3986 | D381: 1 | E381: 03986-0 | F381: 分组密码的设计与分析 | G381: 冯登国等 | H381: 18 | I381: 36770 | J381: 18
A382: =ROW()-2 -> 2926 | B382: TP | C382: 3801 | D382: 1 | E382: 03801-5 | F382: 计算几何―― 算法分析与设计 | G382: 周培德 | H382: 29 | I382: 36647 | J382: 9
A383: =ROW()-2 -> 2927 | B383: TP | C383: 5061 | D383: 1 | E383: 05061-9 | F383: 知识发现 | G383: 史忠植 | H383: 38.00 | I383: 37257 | J383: 7
A384: =ROW()-2 -> 2928 | B384: TP | C384: 3232 | D384: 1 | E384: 03232-7 | F384: 计算机视觉――算法与系统原理 | G384: 高文 等 | H384: 29.00 | I384: 36617 | J384: 10
A385: =ROW()-2 -> 2929 | B385: TP | C385: 3752 | D385: 1 | E385: 03752-3 | F385: 三维数据场可视化 | G385: 唐泽圣等 | H385: 24.00 | I385: 36647 | J385: 9
A386: =ROW()-2 -> 2930 | B386: TP | C386: 3752 | D386: 2 | E386: 03752-3 | F386: 三维数据场可视化（精） | G386: 唐泽圣等 | H386: 36.00 | I386: 36586 | J386: 7
A387: =ROW()-2 -> 2931 | B387: TP | C387: 1017 | D387: 1 | E387: 01017-X | F387: 随机 Petri 网和系统性能评价 | G387: 林 闯 | H387: 28.00 | I387: 36526 | J387: 10
A388: =ROW()-2 -> 2932 | B388: TP | C388: 3580 | D388: 1 | E388: 03580-6 | F388: 人工神经元网络及其应用 | G388: 袁曾任 | H388: 29.80 | I388: 36861 | J388: 8
A389: =ROW()-2 -> 2933 | B389: TP | C389: 3235 | D389: 2 | E389: 03235-1 | F389: 面向对象的系统分析 | G389: 邵维忠等 | H389: 20.00 | I389: 37135 | J389: 12
A390: =ROW()-2 -> 2934 | B390: TP | C390: 5345 | D390: 1 | E390: 05345-6 | F390: 系统分析 | G390: 黄敬仁 | H390: 22.00 | I390: 37469 | J390: 11
A391: =ROW()-2 -> 2935 | B391: TP | C391: 3940 | D391: 1 | E391: 03940-2 | F391: 面向中文信息处理的现代汉语短语结构规则 研究 | G391: 詹卫东 | H391: 19.00 | I391: 36739 | J391: 14
A392: =ROW()-2 -> 2936 | B392: TP | C392: 2218 | D392: 3 | E392: 02218-6 | F392: 决策支持系统(DSS)理论・方法・案例 | G392: 高洪深 | H392: 24.00 | I392: 36557 | J392: 9
A393: =ROW()-2 -> 2937 | B393: TP | C393: 3915 | D393: 1 | E393: 03915-1 | F393: 决策支持系统(DSS)理论・方法・案例（第2版） | G393: 高洪深 | H393: 36.00 | I393: 37073 | J393: 7
A394: =ROW()-2 -> 2938 | B394: TP | C394: 0968 | D394: 1 | E394: 00968-6 | F394: 决策支持系统及其开发（第2版） | G394: 陈文伟 | H394: 30.00 | I394: 36678 | J394: 7
A395: =ROW()-2 -> 2939 | B395: TP | C395: 3587 | D395: 1 | E395: 03587-3 | F395: 工程数据库系统 | H395: 21.00 | I395: 36373 | J395: 12
A396: =ROW()-2 -> 2940 | B396: TP | C396: 3382 | D396: 2 | E396: 03382-X | F396: 关系数据库理论 | G396: 马 垣 | H396: 33.00 | I396: 36434 | J396: 7
A397: =ROW()-2 -> 2941 | B397: TP | C397: 2897 | D397: 2 | E397: 02897-4 | F397: 演化计算 | G397: 潘正君等 | H397: 20.00 | I397: 36617 | J397: 12
A398: =ROW()-2 -> 2942 | B398: G | C398: 4850 | D398: 1 | E398: 04850-9 | F398: 高中数学学法指津 | G398: 叶运佳 | H398: 16.00 | I398: 37362 | J398: 15
A399: =ROW()-2 -> 2943 | B399: TP | C399: 2061 | D399: 2 | E399: 02061-2 | F399: 模糊理论和神经网络的基础与应用 | G399: 赵振宇等 | H399: 16.00 | I399: 1997 | J399: 11
A400: =ROW()-2 -> 2944 | B400: TP | C400: 3675 | D400: 1 | E400: 03675-6 | F400: 推陈出新―― 传统文化在现代的发展 | G400: 钱 逊 | H400: 20.00 | I400: 36495 | J400: 17
A401: =ROW()-2 -> 2945 | B401: TP | C401: 5405 | D401: 1 | E401: 05405-1 | F401: 亿恒C164CI 16位单片机 | G401: 陆延丰等 | H401: 40.00 | I401: 37408 | J401: 7
A402: =ROW()-2 -> 2946 | B402: Z | C402: 5019 | D402: 1 | E402: 05019-8 | F402: 工程前沿――美国国家工程院“工程前沿学术研讨会”1995年及1996年会议文集 | G402: 国家自然 科学基金会 | H402: 22 | I402: 37438 | J402: 11
A403: =ROW()-2 -> 2947 | B403: TP | C403: 5162 | D403: 1 | E403: 05162-3 | F403: 理论力学计算机模拟（配光盘） | G403: 彭芳麟等 | H403: 31.00 | I403: 37316 | J403: 10
A404: =ROW()-2 -> 2948 | B404: TP | C404: 5228 | D404: 1 | E404: 05228-1 | F404: 基于ACIS的几何造型技术与系统开发 | G404: 詹海生等 | H404: 42.00 | I404: 37438 | J404: 8

A1: 李晔 译

A1: 田

A1: 田

A1: 宛延