A1: 序号 | B1: 代 号 | E1: ISBN 7-302- | F1: 名 称 | G1: 著译编者 | H1: 定价(元) | I1: 印年 | J1: 册/包 | K1: 订数
F2: 七、电 子 产 品
F3: (一)CD-ROM 光 盘
F4: 1.计 算 机 类
F5: 重点产品
A6: =ROW()-5 -> 1 | B6: GP | C6: 3720 | D6: 1 | F6: 信息技术――中小学均适用 | G6: 本 社 | H6: 10 | I6: 37377 | J6: 25
A7: =ROW()-5 -> 2 | B7: GP | C7: 3501 | D7: 1 | F7: 边用边学 PowerBuilder 编程 | G7: 本 社 | H7: 40 | I7: 37165 | J7: 25
A8: =ROW()-5 -> 3 | B8: GP | C8: 3506 | D8: 1 | F8: 边用边学 Photoshop 5.0 图象处理实例详解 | G8: 本 社 | H8: 30 | I8: 37165 | J8: 25
A9: =ROW()-5 -> 4 | B9: GP | C9: 3505 | D9: 1 | F9: 边用边学 Authorware 5 多媒体制作实例详解 | G9: 本 社 | H9: 30 | I9: 37165 | J9: 25
A10: =ROW()-5 -> 5 | B10: GP | C10: 3503 | D10: 1 | F10: 边用边学 Flash 4.0 | G10: 本 社 | H10: 30 | I10: 37165 | J10: 25
A11: =ROW()-5 -> 6 | B11: GP | C11: 3500 | D11: 1 | F11: 边用边学 FrontPage 2000 | G11: 本 社 | H11: 30 | I11: 37165 | J11: 25
A12: =ROW()-5 -> 7 | B12: GP | C12: 3504 | D12: 1 | F12: 边用边学 PowerPoint 2000 | G12: 本 社 | H12: 30 | I12: 37165 | J12: 25
A13: =ROW()-5 -> 8 | B13: GP | F13: 边用边学 Excel 2000 | G13: 本 社 | H13: 30 | I13: 37412
A14: =ROW()-5 -> 9 | B14: GP | F14: 边用边学 Word 2000 | G14: 本 社 | H14: 30 | I14: 37412
A15: =ROW()-5 -> 10 | B15: GP | F15: 边用边学 Access 2000 | G15: 本 社 | H15: 30 | I15: 37412
A16: =ROW()-5 -> 11 | B16: GP | F16: 自己动手制作个人网站 | G16: 本 社 | H16: 30 | I16: 37412
A17: =ROW()-5 -> 12 | B17: GP | F17: 自己动手制作企业网站 | G17: 本 社 | H17: 30 | I17: 37412
A18: =ROW()-5 -> 13 | B18: GP | F18: 中小学教师信息技术培训 | G18: 本 社 | H18: 40 | I18: 37412
A19: =ROW()-5 -> 14 | B19: GP | C19: 2241 | D19: 1 | F19: 基于Pwin95/98平台的辅助考试系统 （教师版） | G19: 翟 洁 | H19: 800 | I19: 36586 | J19: 20
A20: =ROW()-5 -> 15 | B20: GP | C20: 2261 | D20: 1 | F20: 基于Pwin95/98平台的辅助考试系统 （学生版） | G20: 翟 洁 | H20: 30 | I20: 36617 | J20: 25
A21: =ROW()-5 -> 16 | B21: GP | C21: 2554 | D21: 1 | F21: Word 2000 实用培训教程（书+盘） | G21: 本 社 | H21: 20 | I21: 36831 | J21: 4
A22: =ROW()-5 -> 17 | B22: GP | C22: 2555 | D22: 1 | F22: PowerPoint 2000 实用培训教程（书+盘） | G22: 李 鸿 | H22: 20 | I22: 36861 | J22: 4
A23: =ROW()-5 -> 18 | B23: GP | C23: 1360 | D23: 1 | F23: 现代办公大全 | G23: 本 社 | H23: 98 | J23: 20
A24: =ROW()-5 -> 19 | B24: GP | C24: 1307 | D24: 1 | F24: 多媒体影像材质资料库(6CDR&书) | G24: 本 社 | H24: 420 | J24: 6
A25: =ROW()-5 -> 20 | B25: GP | C25: 1762 | D25: 1 | F25: “五笔”自通 | G25: 本 社 | H25: 20 | I25: 36434 | J25: 25
A26: =ROW()-5 -> 21 | B26: GP | C26: 1787 | D26: 1 | F26: 边学边用（CD-ROM) | G26: 先科公司 | H26: 28 | I26: 36465 | J26: 25
F27: 推荐产品
A28: =ROW()-5 -> 23 | B28: GP | C28: 4337 | D28: 1 | F28: 教学质量实时监控系统 | G28: 北大医学部 | H28: 19800 | I28: 2002.11 | J28: 1
F29: 2.外 语 类
F30: 重点产品
A31: =ROW()-5 -> 26 | B31: GP | C31: 3137 | D31: 1 | F31: 有声记忆活用词典―四级词汇 | G31: 胡宛如 | H31: 27 | I31: 37012
A32: =ROW()-5 -> 27 | B32: GP | C32: 3138 | D32: 1 | F32: 有声记忆活用词典―六级词汇 | G32: 胡宛如 | H32: 16 | I32: 37043 | J32: 25
A33: =ROW()-5 -> 28 | B33: GP | C33: 2214 | D33: 1 | F33: 新英语教程（第3版）阅读1 CD-ROM | G33: 覃学岚等 | H33: 29 | I33: 36647
A34: =ROW()-5 -> 29 | B34: GP | C34: 2266 | D34: 1 | F34: 新英语教程（第3版）听说1 CD-ROM | G34: 何福胜等 | H34: 29 | I34: 36647
A35: =ROW()-5 -> 30 | B35: GP | C35: 1363 | D35: 1 | F35: 金榜英语 ―― 四级篇 | G35: 本 社 | H35: 20 | J35: 25
A36: =ROW()-5 -> 31 | B36: CD | C36: 3719 | D36: 1 | F36: 逆向法巧学英语（第3版） | G36: 钟道隆 | H36: 28 | I36: 37135 | J36: 25
A37: =ROW()-5 -> 32 | B37: GP | C37: 1355 | D37: 1 | F37: 计算机英语 | G37: 本 社 | H37: 49 | J37: 1
A38: =ROW()-5 -> 33 | B38: GP | C38: 0083 | D38: 1 | F38: 商务日语（2CDR） | G38: 本 社 | H38: 48 | J38: 2
A39: =ROW()-5 -> 34 | B39: GP | C39: 2265 | D39: 1 | F39: 听遍全世界 CD-ROM 1盘 | G39: 钟道隆 | H39: 29 | I39: 36647 | J39: 25
F40: 推荐产品
A41: =ROW()-5 -> 36 | B41: GP | C41: 1782 | D41: 1 | F41: 英语四级闪电达标 (配光盘) | G41: 长城公司 | H41: 30 | I41: 36373 | J41: 25
F42: 3.百 科 类
A43: =ROW()-5 -> 38 | B43: GP | C43: 1391 | D43: 1 | F43: 权威配景素材（2CDR） | G43: 本 社 | H43: 25 | J43: 2
A44: =ROW()-5 -> 39 | B44: GP | C44: 0047 | D44: 1 | F44: 恬恬与小旋系列之一(在夏季) | G44: 本 社 | H44: 98 | J44: 1
A45: =ROW()-5 -> 40 | B45: GP | C45: 0069 | D45: 1 | F45: 恬恬与小旋系列之二(在秋季) | G45: 本 社 | H45: 98 | J45: 1
A46: =ROW()-5 -> 41 | B46: GP | C46: 1350 | D46: 1 | F46: 恬恬与小旋系列之三(在冬季) | G46: 本 社 | H46: 98 | J46: 1
A47: =ROW()-5 -> 42 | B47: GP | C47: 1798 | D47: 1 | F47: 理财大师 | G47: 本 社 | H47: 25 | I47: 36373 | J47: 8
A48: =ROW()-5 -> 43 | B48: GP | C48: 1375 | D48: 1 | F48: 颐和园(精装) | G48: 本 社 | H48: 98 | J48: 5
A49: =ROW()-5 -> 44 | B49: GP | C49: 2201 | D49: 1 | F49: 世界建筑 100 期（2CD） | G49: 本 社 | H49: 30 | I49: 36678 | J49: 5
A50: =ROW()-5 -> 45 | B50: GP | C50: 2557 | D50: 1 | F50: 国粹京剧 (光盘) | G50: 本 社 | H50: 180 | I50: 37288 | J50: 20
A51: =ROW()-5 -> 46 | B51: GP | C51: 1761 | D51: 1 | F51: 建材集成 | G51: 本 社 | H51: 30 | I51: 36434 | J51: 25
F52: (二)清华大学电子教材
A53: =ROW()-5 -> 48 | B53: GP | C53: 2588 | D53: 1 | F53: 中小学规划教材集锦（光盘版）―― 中学部分 | G53: 教育部 | H53: 450 | I53: 36617 | J53: 3
A54: =ROW()-5 -> 49 | B54: GP | C54: 2589 | D54: 1 | F54: 中小学规划教材集锦（光盘版）―― 小学部分 | G54: 教育部 | H54: 270 | I54: 36617 | J54: 5
A55: =ROW()-5 -> 50 | B55: GP | C55: 4176 | D55: 1 | F55: 2002年高考名师辅导X（文科综合） | G55: 华创阳光 | H55: 100 | I55: 37377 | J55: 5
A56: =ROW()-5 -> 51 | B56: GP | C56: 4175 | D56: 1 | F56: 2003年高考名师辅导X（理科综合） | G56: 华创阳光 | H56: 100 | I56: 37378 | J56: 5
A57: =ROW()-5 -> 52 | B57: GP | C57: 4130 | D57: 1 | F57: 计算机组成原理多媒体课件 | G57: 王诚 等 | H57: 1000 | I57: 37347 | J57: 1
A58: =ROW()-5 -> 53 | B58: GP | C58: 3729 | D58: 1 | F58: C++ 语言程序设计 | G58: 郑 莉等 | H58: 128 | I58: 37196 | J58: 8
A59: =ROW()-5 -> 54 | B59: GP | C59: 3135 | D59: 1 | F59: 多媒体技术基础及应用 | G59: 钟玉琢 | H59: 280 | I59: 37196 | J59: 8
A60: =ROW()-5 -> 55 | B60: GP | C60: 2215 | D60: 1 | F60: 数据结构 | G60: 严蔚敏 | H60: 500 | I60: 36647 | J60: 12
A61: =ROW()-5 -> 56 | B61: GP | C61: 1779 | D61: 1 | F61: 微机原理（CAI课件V2.0） | G61: 孙荣平 | H61: 380 | I61: 36647 | J61: 12
A62: =ROW()-5 -> 57 | B62: GP | C62: 2200 | D62: 1 | F62: C语言程序设计 | G62: 郑 莉等 | H62: 500 | I62: 36647 | J62: 12
A63: =ROW()-5 -> 58 | B63: GP | C63: 1788 | D63: 1 | F63: 单片机原理及应用CAI教程 | G63: 胡汉才等 | H63: 800 | I63: 36647 | J63: 12
A64: =ROW()-5 -> 59 | B64: GP | C64: 1765 | D64: 1 | F64: 计算机网络技术 | G64: 赵士滨 | H64: 35 | I64: 36404 | J64: 25
A65: =ROW()-5 -> 60 | B65: GP | C65: 1362 | D65: 1 | F65: 液压传动多媒体课件（单机版） | G65: 清华大学 | H65: 500
A66: =ROW()-5 -> 61 | B66: GP | C66: 2206 | D66: 1 | F66: 电工学―― 电工技术（第2版） | G66: 高上凯等 | H66: 800 | I66: 36647 | J66: 12
A67: =ROW()-5 -> 62 | B67: GP | C67: 2207 | D67: 1 | F67: 电工学―― 电子技术（第2版） | G67: 段玉生等 | H67: 800 | I67: 36648 | J67: 12
A68: =ROW()-5 -> 63 | B68: GP | C68: 2205 | D68: 1 | F68: 电工学―― 数字电子技术 | G68: 唐 英等 | H68: 800 | I68: 36649 | J68: 12
A69: =ROW()-5 -> 64 | B69: GP | C69: 3053 | D69: 1 | F69: 数字逻辑电路CAI | G69: 邱寄帆 | H69: 800 | I69: 36861
A70: =ROW()-5 -> 65 | B70: GP | C70: 2251 | D70: 1 | F70: 非线性电路分析 | G70: 上官右黎 | H70: 600 | I70: 36708 | J70: 20
A71: =ROW()-5 -> 66 | B71: GP | C71: 2202 | D71: 1 | F71: 线性代数与解析几何 | G71: 俞正光 | H71: 500 | I71: 36647 | J71: 12
A72: =ROW()-5 -> 67 | B72: GP | C72: 3029 | D72: 1 | F72: 微积分 | G72: 王燕来 | H72: 500 | I72: 37135 | J72: 20
A73: =ROW()-5 -> 68 | B73: GP | C73: 2217 | D73: 1 | F73: 大学物理（2CD） | G73: 邓新元等 | H73: 2500 | I73: 36739 | J73: 25
A74: =ROW()-5 -> 69 | B74: GP | C74: 1345 | D74: 1 | F74: 水工概论 | G74: 水利系 | H74: 188 | I74: 1998.2 | J74: 1
A75: =ROW()-5 -> 70 | B75: GP | C75: 2228 | D75: 1 | F75: 模拟电子技术多媒体CAI 课件 | G75: 孙荣平 | H75: 380 | I75: 36647 | J75: 12
A76: =ROW()-5 -> 71 | B76: GP | C76: 2204 | D76: 1 | F76: 工业控制机原理及应用 | G76: 林 亨 | H76: 380 | I76: 1999
A77: =ROW()-5 -> 72 | B77: GP | C77: 2223 | D77: 1 | F77: 控制工程基础 | G77: 董景新 | H77: 380 | I77: 36647 | J77: 25
A78: =ROW()-5 -> 73 | B78: GP | C78: 3026 | D78: 1 | F78: 陀螺理论与应用 | G78: 谷德桥 | H78: 1000 | I78: 36892 | J78: 15
A79: =ROW()-5 -> 74 | B79: GP | C79: 2216 | D79: 1 | F79: 机械制图（非机类） | G79: 杨惠英等 | H79: 500 | I79: 36647 | J79: 12
A80: =ROW()-4 -> 76 | B80: GP | C80: 4313 | D80: 1 | E80: 7900643133 | F80: 机械制图习题集（非机械制造类)电子教案 第二版 CD-ROM | G80: 杨惠英等 | H80: 1500.00 | I80: 37500 | J80: 5
A81: =ROW()-5 -> 76 | B81: GP | C81: 2243 | D81: 1 | F81: 机械原理多媒体教学系统 （ 上）（单机版） | G81: 申永胜 | H81: 2900 | I81: 36495 | J81: 1
A82: =ROW()-5 -> 77 | F82: 机械原理多媒体教学系统 （ 下）（单机版） | G82: 申永胜 | H82: 2000 | I82: 37257
A83: =ROW()-5 -> 78 | B83: GP | C83: 2243 | D83: 2 | F83: 机械原理多媒体教学系统 （上）（网络版） | G83: 申永胜 | H83: 3900 | I83: 36495 | J83: 1
A84: =ROW()-5 -> 79 | F84: 机械原理多媒体教学系统 （下）（网络版） | G84: 申永胜 | H84: 2600 | I84: 37257
A85: =ROW()-5 -> 80 | B85: GP | C85: 3770 | D85: 1 | F85: 混凝土结构（教师版） | G85: 叶列平 | H85: 3000 | I85: 37408
A86: =ROW()-5 -> 81 | B86: GP | C86: 4174 | D86: 1 | F86: 生物医学测量与传感器 | G86: 刘纪红等 | H86: 280 | I86: 37408
F87: （三）软 件
F88: 辅 助 教 学 类
A89: =ROW()-5 -> 84 | B89: RP | C89: 1074 | D89: 1 | F89: 数据结构的算法动态模拟(英文版) | G89: 严蔚敏 | H89: 100 | J89: 1
A90: =ROW()-5 -> 85 | B90: RP | C90: 1343 | D90: 1 | F90: 数据结构算法演示系统(V3.0中文版) | G90: 严蔚敏 | H90: 150 | I90: 36526 | J90: 19
A91: =ROW()-5 -> 86 | B91: RP | C91: 1751 | D91: 1 | F91: 数据结构算法演示系统(V3.1C中文版) | G91: 严蔚敏 | H91: 150 | I91: 36526 | J91: 20
F92: 配 书 软 盘
A93: =ROW()-5 -> 88 | B93: RP | C93: 2498 | D93: 1 | F93: 数字信号处理――理论算法与实现 | G93: 胡广书 | H93: 40 | J93: 1