F1: 五、经济管理类
A2: (一)经济管理教材
F3: 1.自编系列教材
F4: 21 世纪清华 MBA 系列教材
A5: 本套教材的编写都是从事该课程教学多年的经验丰富的清华大学经济管理学院教师，教材的内容与体系经过了多轮教学实践的检验。教材在体系上充分考虑了对MBA的要求，覆盖MBA培养方案中内容相对稳定的主要课程，既保证了各门课程知识的系统性，又照顾到课程之间的联系与协调。在教材内容上突出了“宽、新、实”的特点，即：知识面要宽，兼收并蓄中外管理科学的优秀理论与方法；内容要新而实，反映各学科的最新进展，理论联系实际，符合中国国情，具有可操作性。
A6: =ROW()-5 -> 560 | B6: F- | C6: 2060 | D6: 9 | E6: 02060-4 | F6: 管理经济学 | G6: 陈章武 | H6: 13.8 | I6: 37438 | J6: 16
A7: =ROW()-5 -> 561 | B7: D- | C7: 4969 | D7: 1 | E7: 04969-6 | F7: 经济法律原理与实务 | G7: 吕春燕 | H7: 35 | I7: 37408 | J7: 6
A8: =ROW()-5 -> 562 | B8: F- | C8: 2465 | D8: 4 | E8: 02465-0 | F8: 财务会计 | G8: 张荟等 | H8: 18 | I8: 37500 | J8: 12
A9: =ROW()-5 -> 563 | B9: F- | C9: 4459 | D9: 7 | E9: 04459-7 | F9: 财务管理*(第二版） | G9: 卢家仪等 | H9: 28 | I9: 37073 | J9: 9
C10: *本书为2000年全国保险精算师考试指定考试辅导用书。
A11: =ROW()-5 -> 565 | B11: F- | C11: 4914 | D11: 1 | E11: 04914-9 | F11: 人力资源开发与管理（第二版） | G11: 张 德 | H11: 34 | I11: 37469 | J11: 7
A12: =ROW()-5 -> 566 | B12: F- | C12: 5831 | D12: 1 | E12: 05831-8 | F12: 人力资源开发与管理案例精选 | G12: 张 德 | H12: 35 | I12: 37530 | J12: 8
A13: =ROW()-5 -> 567 | B13: F- | C13: 2009 | D13: 7 | E13: 02009-4 | F13: 质量管理学 | G13: 刘广第 | H13: 15 | I13: 37408 | J13: 15
A14: =ROW()-5 -> 568 | B14: F- | C14: 1808 | D14: 9 | E14: 01808-1 | F14: 企业经营战略 | G14: 刘冀生 | H14: 18.8 | I14: 37408 | J14: 11
A15: =ROW()-5 -> 569 | B15: F- | C15: 3090 | D15: 3 | E15: 03090-1 | F15: 生产与运作管理 | G15: 刘丽文 | H15: 29 | I15: 37319 | J15: 9
A16: =ROW()-5 -> 570 | B16: F- | C16: 5478 | D16: 1 | E16: 05478-9 | F16: 生产与运作管理（第二版） | G16: 刘丽文 | H16: 31 | I16: 37408 | J16: 8
A17: =ROW()-5 -> 571 | B17: F- | C17: 5069 | D17: 1 | E17: 05069-4 | F17: 企业竞争力提升战略 | G17: 吴维库 | H17: 28 | I17: 37438 | J17: 10
A18: =ROW()-5 -> 572 | B18: F- | C18: 1205 | D18: 1 | E18: 01205-9 | F18: 技术创新管理* | G18: 吴贵生 | H18: 20 | I18: 37334 | J18: 12
F19: *本书获2002年教育部全国普通高等学校优秀教材一等奖。
A20: =ROW()-5 -> 574 | B20: F- | C20: 2547 | D20: 4 | E20: 02547-9 | F20: 管理数学（下）――运筹学 | G20: 蓝伯雄等 | H20: 17 | I20: 37408 | J20: 12
A21: =ROW()-5 -> 575 | B21: F- | C21: 4527 | D21: 1 | E21: 04527-5 | F21: 创业管理 | G21: 陈德智 | H21: 25 | I21: 37226 | J21: 11
A22: =ROW()-5 -> 576 | B22: F- | C22: 4179 | D22: 1 | E22: 04179-2 | F22: 新产品开发 | G22: 刘求生 | H22: 24 | I22: 37341 | J22: 12
A23: =ROW()-5 -> 577 | B23: F- | C23: 3072 | D23: 5 | E23: 03072-3 | F23: 管理学* | G23: 张 德等 | H23: 22 | I23: 37469 | J23: 9
C24: *本书获1992年国家教委高校优秀教材二等奖。
A25: =ROW()-5 -> 579 | B25: F- | C25: 4034 | D25: 1 | E25: 04034-6 | F25: 组织行为学 | G25: 张 德等 | H25: 28 | I25: 37438 | J25: 9
A26: =ROW()-5 -> 580 | B26: F- | C26: 3656 | D26: 2 | E26: 03656-X | F26: 电子商务教程 | G26: 黄京华 | H26: 23 | I26: 37135 | J26: 10
F27: 教育部面向21世纪课程教材
F28: （信息管理与信息系统专业教材系列）
A29: 本套书的作者都是国内信息管理方面的专家或后起之秀，本套书不仅是他（她）们多年教学改革即经验的总结，也是他（她）们最新科研成果的结晶。有的教材出版印刷过多次，获过奖，此次再版增加了新的研究成果；有几位青年作者近年刚从国外归来，在他（她）们的书中反映了学科前沿的最新进展。
A30: =ROW()-5 -> 584 | B30: F- | C30: 3323 | D30: 3 | E30: 03323-4 | F30: 管理信息系统（第3版）* | G30: 薛华成等 | H30: 34 | I30: 37408 | J30: 8
A31: *本书曾获1986、1998、2000年全国优秀畅销书奖，第三届高校优秀教材二等奖，发行量已突破46万册。
A32: =ROW()-5 -> 586 | B32: F- | C32: 2204 | D32: 1 | E32: 02204-6 | F32: 信息管理基础 | G32: 岳剑波 | H32: 19.5 | I32: 37257 | J32: 12
A33: =ROW()-5 -> 587 | B33: G- | C33: 4650 | D33: 1 | E33: 04650-6 | F33: 信息组织 | G33: 马张华 | H33: 28 | I33: 37257 | J33: 9
A34: =ROW()-5 -> 588 | B34: F- | C34: 3822 | D34: 1 | E34: 03822-8 | F34: 因特网信息资源检索与利用 | G34: 符绍宏等 | H34: 19.5 | I34: 37438 | J34: 12
F35: 清华建设管理系列教材
A36: =ROW()-5 -> 590 | B36: F- | C36: 4283 | D36: 1 | E36: 04283-7 | F36: 项目分析经济学――实践指南 | G36: 卢有杰译 | H36: 36 | I36: 37012 | J36: 10
F37: 清华经济学系列教材
A38: 这套系列教材是清华大学经济管理学院本科生教材，教材的编写遵循“秋水文章不染尘”、“经济学是致用之学”的原则。既能反映清华教授对21世纪经济学理论成果的认知水平，更能记录清华在新世纪里迎接挑战时所做出的努力。
A39: =ROW()-5 -> 593 | B39: F- | C39: 3751 | D39: 1 | E39: 03751-5 | F39: 货币银行学教程 | G39: 武康平 | H39: 19 | I39: 37257 | J39: 12
A40: =ROW()-5 -> 594 | B40: F- | C40: 3834 | D40: 1 | E40: 03834-1 | F40: 公共财政学 | G40: 刘玲玲 | H40: 26 | I40: 37500 | J40: 10
A41: =ROW()-5 -> 595 | B41: F- | C41: 3741 | D41: 1 | E41: 03741-8 | F41: 经济控制论―― 动态经济系统分析方法与应用 | G41: 张金水 | H41: 20 | I41: 36526 | J41: 11
A42: =ROW()-5 -> 596 | B42: F- | C42: 2769 | D42: 2 | E42: 02769-2 | F42: 数理经济学――理论与应用 | G42: 张金水 | H42: 16 | I42: 36373 | J42: 11
A43: =ROW()-5 -> 597 | B43: F- | C43: 0952 | D43: 6 | E43: 00952-X | F43: 计量经济学――方法和应用 | G43: 李子奈 | H43: 16 | I43: 37500 | J43: 15
A44: =ROW()-5 -> 598 | B44: F- | C44: 4171 | D44: 1 | E44: 04171-7 | F44: 高级微观经济学 | G44: 武康平 | H44: 29.5 | I44: 36982 | J44: 8
A45: =ROW()-5 -> 599 | B45: F- | C45: 3889 | D45: 1 | E45: 03889-9 | F45: 高等计量经济学* | G45: 李子奈等 | H45: 26 | I45: 37530 | J45: 9
A46: *本书是教育部“九五”重点教材
F47: 清华数量经济学应用教程（从入门到前沿系列）
A48: 本套丛书的作者尽量采用最通俗的语言来讲述经济学中最深入的知识。丛书全面反映了近年来有关数量经济学发展的重要科研成果。
A49: =ROW()-5 -> 603 | B49: F- | C49: 4108 | D49: 1 | E49: 04108-3 | F49: 可计算非线性动态投入产出模型 | G49: 张金水 | H49: 22 | I49: 36861 | J49: 17
A50: =ROW()-5 -> 604 | B50: F- | C50: 4456 | D50: 1 | E50: 04456-2 | F50: 应用宏观经济学 | G50: 张金水等 | H50: 18 | I50: 37165 | J50: 16
A51: =ROW()-5 -> 605 | B51: F- | C51: 4170 | D51: 1 | E51: 04170-9 | F51: 应用微观经济学* | G51: 张金水等 | H51: 19 | I51: 37412 | J51: 15
A52: 本书内容在清华大学为全校学生开设的经济学课程中讲授十几次，书中给出大量的经济学故事、经济学 应用案例，通俗地介绍了经济学知识与经济学概念。适合作为经济学的入门教材。
A53: =ROW()-5 -> 607 | B53: F- | C53: 5433 | D53: 1 | E53: 05433-9 | F53: 应用国际贸易学 | G53: 张金水等 | H53: 17 | I53: 37500 | J53: 19
F54: 高职高专经济管理系列教材
A55: =ROW()-5 -> 609 | B55: F- | C55: 5166 | D55: 1 | E55: 05166-6 | F55: 审计学概论 | G55: 刘进宝 | H55: 19.5 | I55: 37337 | J55: 13
A56: =ROW()-5 -> 610 | B56: F- | C56: 5140 | D56: 1 | E56: 05140-2 | F56: 市场营销学 | G56: 刘金花 | H56: 23.5 | I56: 37335 | J56: 10
A57: =ROW()-5 -> 611 | B57: F- | C57: 5219 | D57: 1 | E57: 05219-0 | F57: 新编经济法 | G57: 申松涛 | H57: 30 | I57: 37335 | J57: 9
A58: =ROW()-5 -> 612 | B58: F- | C58: 5237 | D58: 1 | E58: 05237-9 | F58: 企业财务会计 | G58: 王新钢 | H58: 19.5 | I58: 37335 | J58: 11
A59: =ROW()-5 -> 613 | B59: F- | C59: 5218 | D59: 1 | E59: 05218-2 | F59: 会计学原理 | G59: 宋灵标 | H59: 16 | I59: 37335 | J59: 15
A60: =ROW()-5 -> 614 | B60: F- | C60: 5258 | D60: 1 | E60: 05258-1 | F60: 财务管理 | G60: 张洪友 | H60: 27 | I60: 37335 | J60: 9
A61: =ROW()-5 -> 615 | B61: F- | C61: 5256 | D61: 1 | E61: 05256-5 | F61: 管理学原理 | G61: 乔颖丽 | H61: 19 | I61: 37350 | J61: 15
A62: =ROW()-5 -> 616 | B62: F- | C62: 5220 | D62: 1 | E62: 05220-4 | F62: 投资项目评估基础 | G62: 李源生 | H62: 18 | I62: 37350 | J62: 14
F63: 组织发展与创新译丛
A64: =ROW()-5 -> 618 | B64: F- | C64: 5285 | D64: 1 | E64: 05285-9 | F64: 成功的团队管理 | G64: 杨蓓译 | H64: 18 | I64: 37530 | J64: 18
A65: =ROW()-5 -> 619 | B65: F- | C65: 5245 | D65: 1 | E65: 05245-X | F65: 快速运转的组织发展 | G65: 关海峡等译 | H65: 12 | I65: 37377 | J65: 25
A66: =ROW()-5 -> 620 | B66: F- | C66: 5242 | D66: 1 | E66: 05242-5 | F66: 组织绩效管理 | G66: 理查德 | H66: 22 | I66: 37377 | J66: 14
A67: =ROW()-5 -> 621 | B67: F- | C67: 5244 | D67: 1 | E67: 05244-1 | F67: 健康的组织 | G67: 王剑锋等译 | H67: 17.5 | I67: 37377 | J67: 17
A68: =ROW()-5 -> 622 | B68: F- | C68: 5339 | D68: 1 | E68: 05339-1 | F68: 组织人员选聘心理 | G68: 罗伯逊 | H68: 18 | I68: 37377 | J68: 17
A69: =ROW()-5 -> 623 | B69: F- | C69: 5243 | D69: 1 | E69: 05243-3 | F69: 组织危机管理（第2版） | G69: 巴顿 | H69: 24 | I69: 37377 | J69: 13
A70: =ROW()-5 -> 624 | B70: F- | C70: 5340 | D70: 1 | E70: 05340-5 | F70: 组织中的印象管理 | G70: 李原 | H70: 20 | I70: 37377 | J70: 15
A71: =ROW()-5 -> 625 | B71: F- | C71: 5301 | D71: 1 | E71: 05301-4 | F71: 组织创新与变革 | G71: 奈杰尔 | H71: 18 | I71: 37408 | J71: 17
F72: 会计信息系统课件总书目
A73: =ROW()-5 -> 627 | B73: P- | C73: 5533 | D73: 1 | E73: 05533-5 | F73: 会计信息系统 | G73: 付得一 | H73: 22 | I73: 37438 | J73: 12
A74: =ROW()-5 -> 628 | B74: P- | C74: 4315 | D74: 1 | E74: 790064315X | F74: 财务软件实用教程（配光盘） | G74: 孙莲香 | H74: 26.80 | I74: 37438 | J74: 12
A75: =ROW()-5 -> 629 | B75: P- | C75: 4319 | D75: 1 | E75: 7900643192 | F75: 财务软件应用技术（配光盘） | G75: 孙万军等 | H75: 28.60 | I75: 37438 | J75: 11
A76: =ROW()-5 -> 630 | B76: P- | C76: 4316 | D76: 1 | E76: 7900643168 | F76: 会计信息系统实验教程 | G76: 王新玲等 | H76: 28.60 | I76: 37438 | J76: 11
F77: 2.自编分类教材
F78: 管理科学类
A79: =ROW()-5 -> 633 | B79: F- | C79: 5477 | D79: 1 | E79: 05477-0 | F79: 企业管理学（第二版） | G79: 金占明 | H79: 33 | I79: 37469 | J79: 8
A80: =ROW()-5 -> 634 | B80: F- | C80: 3667 | D80: 1 | E80: 03667-5 | F80: 战略管理―― 超竞争环境下的选择 | G80: 金占明 | H80: 28 | I80: 37500 | J80: 10
A81: =ROW()-5 -> 635 | B81: F- | C81: 1371 | D81: 7 | E81: 01371-3 | F81: 现代生产管理学* | G81: 潘家轺等 | H81: 23 | I81: 37288 | J81: 8
A82: *本书获第三届国家教委优秀教材二等奖
A83: =ROW()-5 -> 637 | B83: F- | C83: 1015 | D83: 2 | E83: 01015-3 | F83: 现代市场营销学（第2版） | G83: 吕一林等 | H83: 18 | I83: 37288 | J83: 12
A84: =ROW()-5 -> 638 | B84: F- | C84: 4972 | D84: 1 | E84: 04972-6 | F84: 日本家电企业市场营销创新* | G84: 胡左浩 | H84: 28 | I84: 37257 | J84: 10
B85: * 本书由海尔集团总裁张瑞敏作序推荐，书中详细研究SONY、东芝、日立等日本家电企业市场营销的渠道、模式以及创新，对中国家电企业的发展具有重要指导意义。
A86: =ROW()-5 -> 640 | B86: F- | C86: 2958 | D86: 1 | E86: 02958-X | F86: 零售营销 | G86: 黄桂芝 | H86: 12 | I86: 37257 | J86: 20
A87: =ROW()-5 -> 641 | B87: F- | C87: 2985 | D87: 5 | E87: 02985-7 | F87: 电子商贸与网络营销 | G87: 姜旭平 | H87: 18.6 | I87: 36951 | J87: 11
A88: =ROW()-5 -> 642 | B88: F- | C88: 2985 | D88: 3 | E88: 02985-7 | F88: 电子商贸与网络营销(含盘) | G88: 姜旭平 | H88: 35 | I88: 36952 | J88: 11
A89: =ROW()-5 -> 643 | B89: F- | C89: 2416 | D89: 3 | E89: 02416-2 | F89: 信息系统开发方法 | G89: 姜旭平 | H89: 20 | I89: 36679 | J89: 10
A90: =ROW()-5 -> 644 | B90: F- | C90: 1118 | D90: 1 | E90: 01118-4 | F90: 决策支持系统理论和应用 | G90: 陈晓红 | H90: 23 | I90: 37135 | J90: 14
A91: =ROW()-5 -> 645 | B91: F- | C91: 3779 | D91: 1 | E91: 03779-5 | F91: 工业系统概论 | G91: 卢达溶等 | H91: 22 | I91: 37500 | J91: 13
A92: =ROW()-5 -> 646 | B92: F- | C92: 2378 | D92: 1 | E92: 02378-6 | F92: 建设系统工程 | G92: 卢有杰 | H92: 19.50 | I92: 1997 | J92: 10
A93: =ROW()-5 -> 647 | B93: F- | C93: 5139 | D93: 1 | E93: 05139-9 | F93: 经营分析方法与IT工具 | G93: 姜旭平 | H93: 19.8 | I93: 37316 | J93: 14
A94: =ROW()-5 -> 648 | B94: F- | C94: 5623 | D94: 1 | E94: 05623-4 | F94: 最佳创新公司 | G94: 陈 劲 | H94: 18 | I94: 37500 | J94: 15
A95: =ROW()-4 -> 650 | B95: F- | C95: 5172 | D95: 1 | E95: 05172-0 | F95: Bio――股市信息学 | G95: 张冬生 | H95: 45.00 | I95: 37530 | J95: 6
A96: =ROW()-5 -> 650 | B96: F- | C96: 4933 | D96: 1 | E96: 04933-5 | F96: 虚拟企业构建与管理 | G96: 陈剑 等 | H96: 20 | I96: 37438 | J96: 13
A97: =ROW()-5 -> 651 | B97: F- | C97: 5829 | D97: 1 | E97: 05829-6 | F97: 管理控制 | G97: 杜栋 | H97: 15 | I97: 37530 | J97: 18
A98: =ROW()-5 -> 652 | B98: F- | C98: 5274 | D98: 1 | E98: 05274-3 | F98: 信息管理学教程 | G98: 杜栋 | H98: 15 | I98: 37530 | J98: 20
F99: 经济科学类
A100: =ROW()-5 -> 654 | B100: F- | C100: 2922 | D100: 4 | E100: 02922-9 | F100: 运筹学教程 | G100: 胡运权等 | H100: 35 | I100: 37408 | J100: 7
A101: =ROW()-5 -> 655 | B101: F- | C101: 0490 | D101: P | E101: 00490-0 | F101: 运筹学（修订版）* | G101: 钱颂迪等 | H101: 38 | I101: 37500 | J101: 6
F102: *本书曾获1986、1998年全国优秀畅销书奖，发行量已突破６１万册。
A103: =ROW()-5 -> 657 | B103: F- | C103: 5434 | D103: 1 | E103: 05434-7 | F103: 运筹学习题集（第三版） | G103: 胡运权等 | H103: 25 | I103: 37500 | J103: 11
A104: =ROW()-5 -> 658 | B104: F- | C104: 1669 | D104: 5 | E104: 01669-0 | F104: 运筹学基础 | G104: 张 莹 | H104: 19 | I104: 37257 | J104: 9
A105: =ROW()-5 -> 659 | B105: F- | C105: 0156 | D105: E | E105: 00156-1 | F105: 西方经济学 (上) 微观经济分析 | G105: 黎诣远 | H105: 21 | I105: 37165 | J105: 10
A106: =ROW()-5 -> 660 | B106: F- | C106: 0993 | D106: A | E106: 00993-7 | F106: 西方经济学 (下) 宏观经济分析 | G106: 黎诣远 | H106: 16 | I106: 37165 | J106: 12
A107: =ROW()-5 -> 661 | B107: F- | C107: 1597 | D107: 7 | E107: 01597-X | F107: 西方经济学习题集 | G107: 朱宝宪等 | H107: 15 | I107: 37469 | J107: 12
A108: =ROW()-5 -> 662 | B108: F- | C108: 4091 | D108: 1 | E108: 04091-5 | F108: 建筑工程经济 | G108: 邓卫等 | H108: 32.00 | I108: 36892 | J108: 8
A109: =ROW()-5 -> 663 | B109: F- | C109: 2284 | D109: 2 | E109: 02284-4 | F109: 城市经济学 | G109: 谢文蕙等 | H109: 18 | I109: 37438 | J109: 12
A110: =ROW()-5 -> 664 | B110: F- | C110: 2164 | D110: 9 | E110: 02164-3 | F110: 工业技术经济学（第3版）* | G110: 傅家骥等 | H110: 18 | I110: 37408 | J110: 10
A111: *本书曾获1992年国家教委高校优秀教材奖，1998年全国高校出版社优秀双效书奖，1998年第十一届中国图书奖
A112: =ROW()-5 -> 666 | B112: F- | C112: 2335 | D112: 2 | E112: 02335-2 | F112: 国际贸易学 | G112: 黄鲁成 | H112: 14 | I112: 1997 | J112: 17
A113: =ROW()-5 -> 667 | B113: F- | C113: 0848 | D113: 7 | E113: 00848-5 | F113: 货币银行学 | G113: 孙礼照 | H113: 11 | I113: 36892 | J113: 18
A114: =ROW()-5 -> 668 | B114: F- | C114: 1889 | D114: 3 | E114: 01889-8 | F114: 国际金融原理 | G114: 张陶伟 | H114: 13.5 | I114: 37500 | J114: 14
A115: =ROW()-5 -> 669 | B115: F- | C115: 3694 | D115: 1 | E115: 03694-2 | F115: 期货与期权教程 | G115: 李一智等 | H115: 19 | I115: 37316 | J115: 12
A116: =ROW()-5 -> 670 | B116: F- | C116: 5557 | D116: 1 | E116: 05557-2 | F116: 投资理财的新型理论、方法与实务 | G116: 杨义群等 | H116: 26 | I116: 2002.9 | J116: 8
A117: =ROW()-5 -> 671 | B117: F- | C117: 5678 | D117: 1 | E117: 05678-1 | F117: 会计电算化系统应用操作 | G117: 何日胜 | H117: 29 | I117: 2002.9 | J117: 9
A118: =ROW()-5 -> 672 | B118: F- | C118: 5720 | D118: 1 | E118: 05720-6 | F118: 金融发展与经济增长――理论、实证与政策 | G118: 韩廷春 | H118: 16 | I118: 2002.9 | J118: 26
A119: 3.引进版教材
F120: 国外工商管理硕士（MBA)优秀教材译丛
A121: 本套教材均选自西方著名高校商学院教材，大多由清华大学经济管理学院教师翻译。其中部分图书被选为清华大学等高校相关专业教材。
A122: =ROW()-5 -> 676 | B122: F- | C122: 2665 | D122: 3 | E122: 02665-3 | F122: 现代财务管理基础 (第7版) | G122: 朱武祥译 | H122: 49.5 | I122: 37375 | J122: 7
A123: =ROW()-5 -> 677 | B123: F- | C123: 3237 | D123: 1 | E123: 03237-8 | F123: 会计学―― 面向实用者・面向决策 | G123: 夏冬林等译 | H123: 65 | I123: 1999 | J123: 5
A124: =ROW()-5 -> 678 | B124: F- | C124: 3057 | D124: 1 | E124: 03057-X | F124: 市场营销原理（第7版） | G124: 赵平等译 | H124: 58 | I124: 37500 | J124: 6
A125: =ROW()-5 -> 679 | B125: F- | C125: 0711 | D125: 1 | E125: 00711-X | F125: 商务营销（第3版） | G125: 李雪峰等译 | H125: 75 | I125: 36739 | J125: 5
A126: =ROW()-5 -> 680 | B126: F- | C126: 4347 | D126: 1 | E126: 04347-7 | F126: 实用多元统计分析 （第四版）（配软盘） | G126: 陆璇 译 | H126: 69.5 | I126: 36982 | J126: 5
A127: =ROW()-5 -> 681 | B127: F- | C127: 3838 | D127: 1 | E127: 03838-4 | F127: 例解商务统计学（第五版） | G127: 陈鹤琴等译 | H127: 79 | I127: 37165 | J127: 3
A128: =ROW()-5 -> 682 | B128: F- | C128: 3221 | D128: 1 | E128: 03221-1 | F128: 全球营销管理 (第5版) | G128: 段志蓉译 | H128: 47 | I128: 1998 | J128: 7
A129: =ROW()-5 -> 683 | B129: F- | C129: 3273 | D129: 1 | E129: 03273-4 | F129: 管理沟通指南――有效商务写作与交谈 (第4版) | G129: 钱小军等译 | H129: 17 | I129: 37165 | J129: 18
A130: =ROW()-5 -> 684 | B130: F- | C130: 3069 | D130: 2 | E130: 03069-3 | F130: 国际经济学（第五版） | G130: 朱宝宪等译 | H130: 59.5 | I130: 37500 | J130: 5
A131: =ROW()-5 -> 685 | B131: F- | C131: 1119 | D131: 1 | E131: 01119-2 | F131: 国际经济中的经理 (第七版） | G131: 李晓光等译 | H131: 42 | I131: 36647 | J131: 8
A132: =ROW()-5 -> 686 | B132: F- | C132: 4081 | D132: 1 | E132: 04081-8 | F132: 服务运作管理 | G132: 刘丽文译 | H132: 36 | I132: 36892 | J132: 10
F133: 清华大学风险管理与保险丛书
A134: =ROW()-5 -> 688 | B134: F- | C134: 4273 | D134: 1 | E134: 04273-X | F134: 风险管理与保险 | G134: 陈秉正等译 | H134: 46.00 | I134: 37165 | J134: 5
F135: 清华会计学系列英文版教材
A136: =ROW()-5 -> 690 | B136: F- | C136: 4720 | D136: 1 | E136: 04720-0 | F136: 管理会计（第3版） Management Accounting, 3/e | G136: Rajiv D. Banker等 | H136: 56.00 | I136: 37111 | J136: 5
A137: =ROW()-5 -> 691 | B137: F- | C137: 4715 | D137: 1 | E137: 04715-4 | F137: 会计信息系统（第8版） Accounting Information Systems, 8/e | G137: George H. Bodnar等 | H137: 62.00 | I137: 37112 | J137: 4
A138: =ROW()-5 -> 692 | B138: F- | C138: 4716 | D138: 1 | E138: 04716-2 | F138: 财务会计（第4版） Financial Accounting and GAP Annual Report, 4/e | G138: Walter T.Harrison | H138: 65.00 | I138: 37113 | J138: 4
A139: =ROW()-5 -> 693 | B139: F- | C139: 4801 | D139: 1 | E139: 04801-0 | F139: 审计学：整合方法（第8版） Auditing: An Integrated Approach, 8/e | G139: Alvin A. Arens等 | H139: 75.00 | I139: 37114 | J139: 4
A140: =ROW()-5 -> 694 | B140: F- | C140: 4799 | D140: 1 | E140: 04799-5 | F140: 会计学基础（第7版） Essentials of Accounting, 7/e | G140: Robert N. Anthony等 | H140: 24.00 | I140: 37414 | J140: 10
A141: =ROW()-5 -> 695 | B141: F- | C141: 4775 | D141: 1 | E141: 04775-8 | F141: 成本会计：管理的着重点（第10版） Cost Accounting: A Managerial Emphasis, 10/e | G141: Charles T. Horngren等 | H141: 79.00 | I141: 37165 | J141: 3
F142: 清华营销学系列英文版教材
A143: =ROW()-5 -> 697 | B143: F- | C143: 4738 | D143: 1 | E143: 04738-3 | F143: 市场营销渠道（第6版）Marketing Channels, 6/e | G143: Louis W. Stern等 | H143: 53.00 | I143: 37104 | J143: 5
A144: =ROW()-5 -> 698 | B144: F- | C144: 4815 | D144: 1 | E144: 04815-0 | F144: 服务营销：人员、技术与策略（第4版） Services Marketing: People, Technology, Strategy, 4/e | G144: Christopher Lovelock | H144: 66.00 | I144: 37104 | J144: 4
A145: =ROW()-5 -> 699 | B145: F- | C145: 5114 | D145: 1 | E145: 05114-3 | F145: 定价策略与技巧 获利性决策指南（第3版） Strategy and Tactics of Pricing, The, 3/e | G145: Thomas T. Nagle | H145: 34.00 | I145: 37288 | J145: 7
A146: =ROW()-5 -> 700 | B146: F- | C146: 4736 | D146: 1 | E146: 04736-7 | F146: 消费者行为学（第7版）Consumer Behavior, 7/e | G146: Leon G Schiffman等 | H146: 46.00 | I146: 37104 | J146: 6
A147: =ROW()-5 -> 701 | B147: F- | C147: 4798 | D147: 1 | E147: 04798-7 | F147: 市场营销原理（第9版）Principles of Marketing, 9/e | G147: Philip Kotler等 | H147: 76.00 | I147: 37469 | J147: 4
A148: =ROW()-5 -> 702 | B148: F- | C148: 4764 | D148: 1 | E148: 04764-2 | F148: 商业预测（第7版）Business Forecasting, 7/e | G148: John E. Hanke | H148: 46.00 | I148: 37104 | J148: 6
A149: =ROW()-5 -> 703 | B149: F- | C149: 4761 | D149: 1 | E149: 04761-8 | F149: 全球营销管理（第 6版） Global Marketing Management, 6/e | G149: Warren J. Keegan | H149: 58.00 | I149: 37104 | J149: 5
A150: =ROW()-5 -> 704 | B150: F- | C150: 4746 | D150: 1 | E150: 04746-4 | F150: 营销管理 Marketing Magagement | G150: Russell S. Winer | H150: 58.00 | I150: 37104 | J150: 6
F151: 清华管理学系列英文版教材
A152: =ROW()-5 -> 706 | B152: F- | C152: 4735 | D152: 1 | E152: 04735-9 | F152: 供应链管理：战略、规划与运作（第1版） Supply Chain Management: Strategy, Planning and Operations, 1/e | G152: Sunil Chopra等 | H152: 43.00 | I152: 37530 | J152: 6
A153: =ROW()-5 -> 707 | B153: F- | C153: 4810 | D153: 1 | E153: 04810-X | F153: 有效的小企业管理：创业方法（第6版） Effective Small Business Management: An Entrepreneurial Approach, 6/e | G153: Norman M. Scarborough等 | H153: 75.00 | I153: 37118 | J153: 4
A154: =ROW()-5 -> 708 | B154: F- | C154: 4765 | D154: 1 | E154: 04765-0 | F154: 公共关系实务（第8版） Practice of Public Relations, The, 8/e | G154: Fraser P. Seitel等 | H154: 49.50 | I154: 37119 | J154: 6
A155: =ROW()-5 -> 709 | B155: F- | C155: 4800 | D155: 1 | E155: 04800-2 | F155: 面向商务和技术的项目管理（第2版）Project Management for Business and Technology, 2/e | G155: John M. Nicholas | H155: 55.00 | I155: 37120 | J155: 5
A156: =ROW()-5 -> 710 | B156: F- | C156: 4339 | D156: 1 | E156: 04339-6 | F156: 管理学（第7 版） Management, 7/e | G156: Stephen P. Robbins等 | H156: 59.00 | I156: 37500 | J156: 4
A157: =ROW()-5 -> 711 | F157: 管理学（第7 版） Management, 7/e(教师用书) | G157: Stephen P. Robbins等 | H157: (非卖品) | I157: 37257 | J157: 9
A158: =ROW()-5 -> 712 | B158: F- | C158: 4742 | D158: 1 | E158: 04742-1 | F158: 人力资源管理（第 8版） Human Resource Management, 8/e | G158: Gary Dessler | H158: 65.00 | I158: 37122 | J158: 4
A159: =ROW()-5 -> 713 | B159: F- | C159: 4812 | D159: 1 | E159: 04812-6 | F159: 面向经理的在线企业和电子商务（第 1版） e-Commerce & e-Business for Managers, 1/e | G159: Deitel | H159: 69.00 | I159: 37123 | J159: 4
A160: =ROW()-5 -> 714 | B160: F- | C160: 4734 | D160: 1 | E160: 04734-0 | F160: 管理沟通指南：有效商务写作与交谈（第 5版） Guide to Managerial Communication: Effective Business Writing and Speaking, 5/e | G160: Mary Munter | H160: 14.00 | I160: 37372 | J160: 25
A161: =ROW()-5 -> 715 | B161: F- | C161: 4732 | D161: 1 | E161: 04732-4 | F161: 信息系统的管理 Managing Information Systems | G161: David L.Anderson | H161: 48.00 | I161: 37125 | J161: 7
A162: =ROW()-5 -> 716 | B162: F- | C162: 4743 | D162: 1 | E162: 04743-X | F162: 组织中的领导（第5版） Leadership in Organizations,5/e | G162: Gary Yukl | H162: 48.00 | I162: 37126 | J162: 6
F163: 清华金融学系列英文版教材
A164: =ROW()-5 -> 718 | B164: F- | C164: 4739 | D164: 1 | E164: 04739-1 | F164: 金融市场与金融机构（第3版） Financial Markets and Institutions, 3/e | G164: Frederic S. Mishkin等 | H164: 69.00 | I164: 37127 | J164: 4
A165: =ROW()-5 -> 719 | B165: F- | C165: 4893 | D165: 1 | E165: 04893-2 | F165: 金融机构管理（第3版） Financial Institutions Management, 3/e | G165: Anthony Saunders | H165: 68.00 | I165: 37128 | J165: 4
A166: =ROW()-5 -> 720 | B166: F- | C166: 4839 | D166: 1 | E166: 04839-8 | F166: 期权、期货和其他衍生品 （第4 版） Options, Futures, And Other Derivatives， 4/e | G166: John C. Hull等 | H166: 64.00 | I166: 37500 | J166: 4
A167: =ROW()-5 -> 721 | B167: F- | C167: 4740 | D167: 1 | E167: 04740-5 | F167: 投资学（第6 版） Investments, 6/e | G167: William F. Sharpe等 | H167: 88.00 | I167: 37130 | J167: 3
A168: =ROW()-5 -> 722 | B168: F- | C168: 4811 | D168: 1 | E168: 04811-8 | F168: 财务管理基础（第 11版） Fundamentals of Financial management, 11/e | G168: James C. Van Horne等 | H168: 68.00 | I168: 37469 | J168: 4
A169: =ROW()-5 -> 723 | B169: F- | C169: 4802 | D169: 1 | E169: 04802-9 | F169: 期货与期权市场基本原理（第4版） Fundamentals of Futures and Options Markets,4/e | G169: John C. Hull | H169: 46.00 | I169: 37132 | J169: 6
A170: =ROW()-5 -> 724 | B170: F- | C170: 4745 | D170: 1 | E170: 04745-6 | F170: 期权市场 Options Markets | G170: John C.Cox等 | H170: 26.00 | I170: 37133 | J170: 12
F171: 清华经济学系列英文版教材
A172: =ROW()-5 -> 726 | B172: F- | C172: 4737 | D172: 1 | E172: 04737-5 | F172: 环境与自然资源经济学（第5版） Environmental and Natural Resource Economics, 5/e | G172: Tom Tietenberg等 | H172: 59.00 | I172: 37134 | J172: 5
A173: =ROW()-5 -> 727 | B173: F- | C173: 4778 | D173: 1 | E173: 04778-2 | F173: 计量经济分析（第4 版）Econometric Analysis, 4/e | G173: William H. Greene | H173: 89.00 | I173: 37104 | J173: 3
A174: =ROW()-5 -> 728 | B174: F- | C174: 4719 | D174: 1 | E174: 04719-7 | F174: 微观经济学（第 5版） Microeconomics, 5/e | G174: Robert S. Pindyck等 | H174: 65.00 | I174: 37438 | J174: 4
A175: =ROW()-5 -> 729 | B175: F- | C175: 4731 | D175: 1 | E175: 04731-6 | F175: 宏观经济学（第2 版） Macroeconomics, 2/e | G175: Olivier Jean Blanchard | H175: 55.00 | I175: 37408 | J175: 5
A176: =ROW()-5 -> 730 | B176: F- | C176: 4733 | D176: 1 | E176: 04733-2 | F176: 国际经济学：理论与政策（第 5版） International Economics: Theory and Policy, 5/e | G176: Paul R. Krugman等 | H176: 69.00 | I176: 37469 | J176: 4
F177: 清华MBA核心课程英文版教材
A178: =ROW()-5 -> 732 | B178: F- | C178: 4721 | D178: 1 | E178: 04721-9 | F178: 运作管理（第6版）Operations Management, 6/e | G178: Jay Heizer | H178: 83.00 | I178: 37104 | J178: 3
A179: =ROW()-5 -> 733 | B179: F- | C179: 4776 | D179: 1 | E179: 04776-6 | F179: 会计学（第5 版） Accounting, 5/e | G179: Charles T. Horngren等 | H179: 79.00 | I179: 37105 | J179: 3
A180: =ROW()-5 -> 734 | B180: F- | C180: 4741 | D180: 1 | E180: 04741-3 | F180: 组织行为学（第 9版）Organizational Behavior, 9/e | G180: Stephen P. Robbins | H180: 59.00 | I180: 37469 | J180: 4
A181: =ROW()-5 -> 735 | B181: F- | C181: 4777 | D181: 1 | E181: 04777-4 | F181: 战略管理：概念与案例（第8 版） Strategic Management: Concepts and Cases, 8/e | G181: Fred R. David | H181: 69.00 | I181: 37408 | J181: 4
A182: =ROW()-5 -> 736 | B182: F- | C182: 4744 | D182: 1 | E182: 04744-8 | F182: 营销管理（第 10版）Marketing Management | G182: Philip Kotler | H182: 69.00 | I182: 37373 | J182: 4
A183: =ROW()-5 -> 737 | B183: F- | C183: 4809 | D183: 1 | E183: 04809-6 | F183: 管理经济学与组织结构（第2版） Managerial economics and organizational archetecture,2/e | G183: Brickley | H183: 57.00 | I183: 37109 | J183: 5
A184: =ROW()-5 -> 738 | B184: F- | C184: 5167 | D184: 1 | E184: 05167-4 | F184: 金融市场与公司战略（第2版）Financial Markets and Corporate Strategy,2/e | G184: Mark Grinblatt | H184: 78.00 | I184: 37353 | J184: 3
F185: 财金之旅 (英文影印版)
A186: 本套丛书均为美国当前众多大学广泛采用的财金类教科书，作者均是在美国著名学府执教多年的资深教授，并拥有丰富的实践经验。本套丛书内容全面、新颖，不仅涵盖面广泛，而且阐述深入透彻，对财金领域的最新动态给予了充分介绍。
A187: =ROW()-5 -> 741 | B187: F- | C187: 3429 | D187: 1 | E187: 03429-X | F187: 财金之旅――金融市场利率与流量(第5版) (Financial Market Rates and Flows ) | G187: James C.V. | H187: 29 | I187: 1999 | J187: 10
A188: =ROW()-5 -> 742 | B188: F- | C188: 3426 | D188: 1 | E188: 03426-5 | F188: 财金之旅―― 财务管理基础 (第10版) (Fundamentals of Financial Management ) | G188: James C.V. | H188: 66 | I188: 37073 | J188: 4
A189: =ROW()-5 -> 743 | B189: F- | C189: 3430 | D189: 1 | E189: 03430-3 | F189: 财金之旅―― 金融市场与金融机构基础 (第2版) (Foundations of Financial Markets and Institutions ) | G189: Frank J.Fabozzi | H189: 58 | I189: 1999 | J189: 5
A190: =ROW()-5 -> 744 | B190: F- | C190: 3428 | D190: 1 | E190: 03428-1 | F190: 财金之旅―― 现代投资理论 （第4版） （Modern Investment Theory) | G190: Robert A.Haugen | H190: 65 | I190: 1999 | J190: 4
A191: =ROW()-5 -> 745 | B191: F- | C191: 3427 | D191: 1 | E191: 03427-3 | F191: 财金之旅―― 财务管理：原理与实务 (Financial Management: Principles and Practice) | G191: Timothy J.Gallagher | H191: 49 | I191: 36281 | J191: 5
F192: 世界工商管理名典系列（英文影印版）
A193: 该套丛书基本上已再版多次，在国内外深受欢迎并被广泛采用的优秀教材，是该领域具有权威性经典之作。更重要的是，他们无论从选材到内容都十分适合我国经管学院的教学需要，适合广大经管领域读者的学习品味。
A194: =ROW()-5 -> 748 | B194: F- | C194: 2983 | D194: 1 | E194: 02983-0 | F194: 资本市场机构与工具（第2版） （Capital Markets Institutions and Instruments） | G194: Frank J.Fabozzi | H194: 58 | I194: 1998 | J194: 4
A195: =ROW()-5 -> 749 | B195: F- | C195: 3332 | D195: 1 | E195: 03332-3 | F195: 广告学――原理与实践 （第4版） (Advertising ―― Princiles & Practice) | G195: William Wells等 | H195: 66 | I195: 36281 | J195: 4
A196: =ROW()-5 -> 750 | B196: F- | C196: 3071 | D196: 1 | E196: 03071-5 | F196: 市场调研（第2版） （Marketing Research） | G196: Naresh K.Malhotra | H196: 64 | I196: 1998 | J196: 3
A197: =ROW()-5 -> 751 | B197: F- | C197: 3036 | D197: 1 | E197: 03036-7 | F197: 高级管理会计(第三版) （Advanced Management Accounting） | G197: Robert S.Pindyck | H197: 68 | I197: 1998 | J197: 4
A198: =ROW()-5 -> 752 | B198: F- | C198: 3025 | D198: 2 | E198: 03025-1 | F198: 读懂财务报表（第五版） (Understanding Financial Statements) | G198: Lyn M.Fraser | H198: 22 | I198: 36557 | J198: 11
A199: =ROW()-5 -> 753 | B199: F- | C199: 2982 | D199: 2 | E199: 02982-2 | F199: 今日商务沟通(第5版） （Business Communication Today） | G199: （美） 蒂尔 | H199: 59.8 | I199: 37226 | J199: 4
A200: =ROW()-5 -> 754 | B200: F- | C200: 3070 | D200: 1 | E200: 03070-7 | F200: 财务学基础――财务管理逻辑与实务 （第二版）Foundations of Finance The Logic and Practice of Financial Management | G200: Keown Petty Scott Martin | H200: 50 | I200: 36708 | J200: 5
A201: =ROW()-5 -> 755 | B201: F- | C201: 3048 | D201: 1 | E201: 03048-0 | F201: 跨国公司财务管理基础（第三版） (Foundations of Multinational Financial Management) | G201: Alan C.Shapiro | H201: 48 | I201: 1998 | J201: 5
A202: =ROW()-5 -> 756 | B202: F- | C202: 0938 | D202: 1 | E202: 00938-4 | F202: 决策支持系统与智能系统 （第5版） （Decision Support Systems and Intelligent Systems) | G202: Efraim Turban等 | H202: 79 | I202: 36617 | J202: 4
A203: =ROW()-5 -> 757 | B203: F- | C203: 3034 | D203: 2 | E203: 03034-0 | F203: 管理信息系统（第五版） （Management Information Systems) | G203: Kenneth C.Laudon | H203: 62 | I203: 36526 | J203: 4
A204: =ROW()-5 -> 758 | B204: F- | C204: 3161 | D204: 1 | E204: 03161- | F204: 现代管理学（Modern Management) | G204: Samuel C.Certo | H204: 49.8 | I204: 1998 | J204: 5
A205: =ROW()-5 -> 759 | B205: F- | C205: 3162 | D205: 1 | E205: 03162-2 | F205: 财务管理与政策（第十一版） (Financial Management and Policy) | G205: James C.Van Horne | H205: 62 | I205: 1998 | J205: 4
A206: =ROW()-5 -> 760 | B206: F- | C206: 3125 | D206: 1 | E206: 03125-8 | F206: 国际金融 管理-市场-机构 （International Finance Management, Markets and Institutions) | G206: James C.Baker | H206: 43 | I206: 1998 | J206: 5
A207: =ROW()-5 -> 761 | B207: F- | C207: 3263 | D207: 1 | E207: 03263-7 | F207: 整合营销传播（Integrated Marketing Communications A Systems Approach) | G207: M.Joseph Sirgy | H207: 29.5 | I207: 1998 | J207: 9
A208: =ROW()-5 -> 762 | B208: F- | C208: 3206 | D208: 1 | E208: 03206-8 | F208: 国际经济中的经理 (第七版） （The manager in the International Economy) | G208: Raymond Vernon等 | H208: 41 | I208: 1998 | J208: 7
A209: =ROW()-5 -> 763 | B209: F- | C209: 3205 | D209: 1 | E209: 03205-X | F209: 风险管理和保险导论 (Introduction to Risk Management and Insurance) | G209: Mark S.Dorfman | H209: 54 | I209: 1998 | J209: 5
A210: =ROW()-5 -> 764 | B210: F- | C210: 2471 | D210: 4 | E210: 02471-5 | F210: 组织行为学――概念, 争议 ,应用 (第7版) (Organizational Behavior) | G210: Stephen P. Robbins | H210: 59 | I210: 36342 | J210: 4
A211: =ROW()-5 -> 765 | B211: F- | C211: 2470 | D211: 3 | E211: 02470-7 | F211: 消费者行为学(第5版) (Consumer Behavior) | G211: Leon G.Schiffman | H211: 46 | I211: 1998 | J211: 4
A212: =ROW()-5 -> 766 | B212: F- | C212: 2469 | D212: 5 | E212: 02469-3 | F212: 营销管理(第9版) (Marketing Management) | G212: Philip Kotle | H212: 58 | I212: 37012 | J212: 4
A213: =ROW()-5 -> 767 | B213: F- | C213: 2495 | D213: 3 | E213: 02495-2 | F213: 全球营销管理(第5版) (Global Marketing Management) | G213: Warren J. Keegen | H213: 60 | I213: 1998 | J213: 4
A214: =ROW()-5 -> 768 | B214: F- | C214: 2692 | D214: 3 | E214: 02692-0 | F214: 市场营销原理（第7版） (Principles of Marketing) | G214: Philip Kotle等 | H214: 64 | I214: 37073 | J214: 4
A215: =ROW()-5 -> 769 | B215: F- | C215: 2494 | D215: 4 | E215: 02494-4 | F215: 微观经济学(第3版) (Microeconomics) | G215: Robert S.Pindyck | H215: 49 | I215: 36617 | J215: 4
A216: =ROW()-5 -> 770 | B216: F- | C216: 2473 | D216: 4 | E216: 02473-1 | F216: 国际经济学(第5版) (International Economics) | G216: Dominick Salvatore | H216: 56 | I216: 37226 | J216: 4
A217: =ROW()-5 -> 771 | B217: F- | C217: 2493 | D217: 4 | E217: 02493-6 | F217: 宏观经济学 (Macroeconomics) | G217: Olivier Blanchard | H217: 50 | I217: 1999 | J217: 4
A218: =ROW()-5 -> 772 | B218: F- | C218: 2724 | D218: 3 | E218: 02724-2 | F218: 管理学 (Management) | G218: StephenP. Robbins等 | H218: 66 | I218: 1999 | J218: 4
A219: =ROW()-5 -> 773 | B219: F- | C219: 2727 | D219: 1 | E219: 02727-7 | F219: 战略管理(第6版) (Strategic Management) | G219: F.R.David | H219: 79 | I219: 1998 | J219: 3
A220: =ROW()-5 -> 774 | B220: F- | C220: 2720 | D220: 3 | E220: 02720-X | F220: 人力资源管理 (Human Resource Management) | G220: Gary Dessler | H220: 56 | I220: 1998 | J220: 4
A221: =ROW()-5 -> 775 | B221: F- | C221: 4051 | D221: 1 | E221: 04051- | F221: 人力资源――获取竞争优势 | H221: 66 | I221: 36800 | J221: 5
A222: =ROW()-5 -> 776 | B222: F- | C222: 4090 | D222: 1 | E222: 04090-7 | F222: 产业组织战略方法 * Industrial Organization A Strategic Approach | G222: Jeffrey Church | H222: 86 | I222: 36831 | J222: 4
A223: 本书是一本产业组织理论的最新教材，被美国和加拿大的很多著名院校广泛采用。本书内容的组织紧紧围绕“策略”这一主线，广泛应用博弈理论的最新研究成果，是真正意义上的新“产业组织理论”。本书的作者曾在政府机构中任职，因而提供了很多有关的实际案例分析，这在其他同类教材中是不多见的。本书已被清华大学、北京大学选为教材。
A224: =ROW()-5 -> 778 | B224: F- | C224: 2699 | D224: 2 | E224: 02699-8 | F224: 投资学（第5版）(Investment) | G224: William F.Sharpe等 | H224: 83 | I224: 1998 | J224: 3
A225: =ROW()-5 -> 779 | B225: F- | C225: 2676 | D225: 2 | E225: 02676-9 | F225: Kleppner 广告教程（第13版）* (Kleppner's Advertising) | G225: J.Thomas | H225: 63 | I225: 1998 | J225: 4
A226: 本书为在美国广告营销界被奉为《圣经》的《KLEPPNER广告管理》的第十三版。 该版本结合了传统的广告管理过程与新材料， 特别是在营销、 广告和媒介方面的变化， 着眼于将学生引导到21世纪的广告业。
A227: =ROW()-5 -> 781 | B227: F- | C227: 2691 | D227: 2 | E227: 02691-2 | F227: 成本会计――管理的着重点 （第9版） （Cost Accounting） | G227: Charles T.Horngren | H227: 78 | I227: 1998 | J227: 3
A228: =ROW()-5 -> 782 | B228: F- | C228: 2723 | D228: 2 | E228: 02723-4 | F228: 会计学（第3版）（Accounting） | G228: Charles T.Horngren | H228: 92 | I228: 37104 | J228: 3
A229: =ROW()-5 -> 783 | B229: F- | C229: 3122 | D229: 1 | E229: 03122-3 | F229: 管理沟通指南――有效商务写作与交谈 （Managerial Communication Effective Business Writing and Speaking） | G229: [美] Mary Munter | H229: 14 | I229: 36739 | J229: 25
A230: =ROW()-5 -> 784 | B230: F- | C230: 4219 | D230: 1 | E230: 04219-5 | F230: 决策支持和数据仓库系统 (Decision Support and Data Warehouse Systems) | G230: Efrem G. Mallach | H230: 59 | I230: 36892 | J230: 4
F231: 清华版创业系列教材
A232: =ROW()-5 -> 786 | B232: F- | C232: 5122 | D232: 1 | E232: 05122-4 | F232: 新企业与创业者(第5版)（New Business Ventures and The Enterpreneur Fifth Edition） | G232: Howard H.Stevenson等 | H232: 58 | I232: 37469 | J232: 6
F233: 工商管理经典译丛.项目管理系列
A234: =ROW()-5 -> 788 | B234: F- | C234: 5675 | D234: 1 | E234: 05675-7 | F234: 项目计划、进度与控制(第3版) | G234: 赤向东译 | H234: 49 | I234: 37530 | J234: 6
F235: 4.考试辅导教材
F236: 2003MBA全国联考应试 清华辅导教材
A237: 这套教材充分体现了“MBA考试大纲”的要求，注意侧重提高应试人员的逻辑思维能力，汉语和英语的阅读、表达及运用能力，抽象概括能力，空间想象能力，基本运算能力，以及运用基本知识分析和解决实际管理问题的能力。本丛书包含了大量的 例题和习题，训练应试人员在理解理论要点的基础上，提高分析和解题能力；包含了 以往联考的试题分析；并附有模拟试题和题解，帮助应试人员进行自我训练和自我检验。
A238: =ROW()-5 -> 792 | B238: F- | C238: 5677 | D238: 1 | E238: 05677-3 | F238: 语文（2003） | G238: 谷衍奎 | H238: 34 | I238: 37469 | J238: 12
A239: =ROW()-5 -> 793 | B239: F- | C239: 5600 | D239: 1 | E239: 05600-5 | F239: 数学（2003） | G239: 程佳惠等 | H239: 47 | I239: 37500 | J239: 8
A240: =ROW()-5 -> 794 | B240: F- | C240: 5622 | D240: 1 | E240: 05622-6 | F240: 管理（2003） | G240: 张 德等 | H240: 38 | I240: 37438 | J240: 11
A241: =ROW()-5 -> 795 | B241: F- | C241: 5862 | D241: 1 | E241: 05862-8 | F241: 英语（2003）(含2音带) | G241: 王敬慧等 | H241: 53 | I241: 37500 | J241: 4
A242: =ROW()-5 -> 796 | B242: F- | C242: 5721 | D242: 1 | E242: 05721-4 | F242: 逻辑（2003） | G242: 朱 岩 | H242: 46 | I242: 37500 | J242: 8
F243: 全国经济学硕士研究生入学统一考试
A244: =ROW()-5 -> 798 | B244: F- | C244: 5238 | D244: 1 | E244: 05238-7 | F244: 数学考试辅导（2003） | G244: 傅维潼 | H244: 36 | I244: 37500 | J244: 9
F245: 2003年考研辅导系列丛书
F246: 名校 名师 名作
A247: =ROW()-5 -> 801 | B247: D- | C247: 5786 | D247: 1 | E247: 05786-9 | F247: 政治理论精解考点与精编试题 | G247: 杨树先等 | H247: 38.00 | I247: 37530 | J247: 5
A248: =ROW()-5 -> 802 | B248: D- | C248: 5766 | D248: 1 | E248: 05766-4 | F248: 全国法律硕士研究生联考应试练习（综合试卷） | G248: 赵秉志 | H248: 29.00 | I248: 37530 | J248: 8
A249: =ROW()-5 -> 803 | B249: D- | C249: 5767 | D249: 1 | E249: 05767-2 | F249: 全国法律硕士研究生联考应试练习（民法・刑法卷） | G249: 赵秉志 | H249: 35.00 | I249: 37530 | J249: 7
A250: =ROW()-5 -> 804 | B250: D- | C250: 5838 | D250: 1 | E250: 05838-5 | F250: 新编考研政治理论冲刺模拟题集 | G250: 杨树先等 | H250: 18.00 | I250: 37500 | J250: 5
F251: 清华科技与社会丛书
A252: =ROW()-5 -> 806 | B252: B- | C252: 5764 | D252: 1 | E252: 05764-8 | F252: 赛博空间的哲学探索 | G252: 曾国屏 | H252: 20.00 | I252: 37530 | J252: 16
F253: （二）经济管理一般图书
F254: 1.系列丛书
F255: 对公司账底了如指掌
A256: 这是一套颇具特色的商务类畅销书。它站在“大众理解”的全新角度，以通俗的语言、浅显的运算，从最基本处入手，步步深入地探讨了有关损益表、现金流以及财务报告的方方面面。书中引用大量案例，既有名不见经传的小企业，也包括富甲天下的大跨国公司。
A257: =ROW()-5 -> 811 | B257: F- | C257: 3571 | D257: 2 | E257: 03571-7 | F257: 全面理解损益表 | G257: 刘东明译 | H257: 19.8 | I257: 36739 | J257: 19
A258: =ROW()-5 -> 812 | B258: F- | C258: 3633 | D258: 2 | E258: 03633-0 | F258: 全面理解现金流 | G258: 李桂荣译 | H258: 18 | I258: 36739 | J258: 22
A259: =ROW()-5 -> 813 | B259: F- | C259: 1304 | D259: 1 | E259: 01304-7 | F259: 全面理解财务报告（第5版） | G259: 刘东明译 | H259: 16 | I259: 36586 | J259: 25
F260: 企业物流管理培训教材系列
F261: 中国物资流通协会推荐用书
A262: 该套丛书主编、顾问及作者大部分是国内知名物流学界及业界名家，如吴清一教授是我国著名的留日物流专家，也是我国第一位物流专业博士生导师，全套丛书由中国物资流通协会会长及副会长担当顾问，从而使之更加适合业界培训和学习。
A263: =ROW()-5 -> 817 | B263: F- | C263: 0883 | D263: 1 | E263: 00883-3 | F263: 物流基础 | G263: 丁立言等 | H263: 16 | I263: 37375 | J263: 15
A264: =ROW()-5 -> 818 | B264: F- | C264: 4366 | D264: 1 | E264: 04366-3 | F264: 英汉物流管理辞典 | G264: 苏士哲 | H264: 30 | I264: 36982 | J264: 13
A265: =ROW()-5 -> 819 | B265: F- | C265: 4366 | D265: 2 | E265: 04366-3 | F265: 英汉物流管理辞典（精） | G265: 苏士哲 | H265: 46 | I265: 37012 | J265: 13
A266: =ROW()-5 -> 820 | B266: F- | C266: 3743 | D266: 1 | E266: 03743-1 | F266: 物流管理 | G266: 丁立言译 | H266: 16 | I266: 37335 | J266: 18
A267: =ROW()-5 -> 821 | B267: F- | C267: 1095 | D267: 1 | E267: 01095-1 | F267: 物流系统工程 | G267: 丁立言等 | H267: 22 | I267: 37135 | J267: 12
A268: =ROW()-5 -> 822 | B268: F- | C268: 0870 | D268: 1 | E268: 00870-1 | F268: 物流企业管理 | G268: 丁立言等 | H268: 19 | I268: 37288 | J268: 14
A269: =ROW()-5 -> 823 | B269: F- | C269: 0940 | D269: 1 | E269: 00940-6 | F269: 国际物流学 | G269: 丁立言等 | H269: 23 | I269: 37316 | J269: 12
F270: 企业物流技术培训教材系列
F271: 中国物流与采购联合会指定教材
A272: =ROW()-5 -> 826 | B272: F- | C272: 5638 | D272: 1 | E272: 05638-2 | F272: 仓储自动化 | G272: 鲁晓春 | H272: 17.00 | I272: 37500 | J272: 12
A273: =ROW()-5 -> 827 | B273: F- | C273: 5624 | D273: 1 | E273: 05624-2 | F273: 供应链管理技术与方法 | G273: 张成海 | H273: 20.00 | I273: 37500 | J273: 13
A274: =ROW()-5 -> 828 | B274: F- | C274: 4953 | D274: 1 | E274: 04953-X | F274: 物流配送 | G274: 丁立言等 | H274: 22.00 | I274: 37469 | J274: 10
A275: =ROW()-5 -> 829 | B275: F- | C275: 5352 | D275: 1 | E275: 05352-1 | F275: 仓储规划与技术 | G275: 丁立言等 | H275: 28 | I275: 37408 | J275: 10
A276: =ROW()-5 -> 830 | B276: F- | C276: 4526 | D276: 1 | E276: 04526-7 | F276: 供应链管理实用建模方法及数据挖掘 | G276: 丁立言等 | H276: 18 | I276: 37135 | J276: 15
F277: 课里播企业培训课程 （企业文化学习方案）
A278: 课里播企业培训课程由美国专业培训顾问师结合企业辅导工作开发，将当今全球验证成功的企业管理方法整理成简便易行、文字浅显，以能力基因为本的互动课程。该课程在全球20个国家的企业中使用，其中包括75%以上的美国500强企业以及美国总统的办公室。
A279: =ROW()-5 -> 833 | B279: F- | C279: 4102 | D279: 1 | E279: 04102-4 | F279: 质量在工作中运行{职业标准的个人指南} | G279: 方书美译 | H279: 20 | I279: 36861 | J279: 17
A280: =ROW()-5 -> 834 | B280: F- | C280: 4102 | D280: 2 | E280: 04102-4 | F280: 态度（第3版）{你最宝贵的财产} | G280: 美 琳译 | H280: 20 | I280: 36861 | J280: 17
A281: =ROW()-5 -> 835 | B281: F- | C281: 4102 | D281: 3 | E281: 04102-4 | F281: 做个好队员{团队队员手册} | G281: 邹新明译 | H281: 20 | I281: 36861 | J281: 15
A282: =ROW()-5 -> 836 | B282: F- | C282: 4102 | D282: 4 | E282: 04102-4 | F282: 创造一个学习型组织{通过教育促进卓越} | G282: 夏银平译 | H282: 20 | I282: 37438 | J282: 17
A283: =ROW()-5 -> 837 | B283: F- | C283: 4102 | D283: 5 | E283: 04102-4 | F283: 令客户满意{工作中的另一方面} | G283: 石冰译 | H283: 20 | I283: 37438 | J283: 17
A284: =ROW()-5 -> 838 | B284: F- | C284: 4102 | D284: 6 | E284: 04102-4 | F284: 50 个全面优质管理的妙方 | G284: 王虹译 | H284: 20 | I284: 36861 | J284: 17
F285: 项目管理教材系列
A286: 这套系列教材系世界银行针对中国大陆的项目培训课程教材，教材的编写从项目业主对项目全过程进行管理的角度编写，不同于针对建设项目承包商的项目经理和监理工程师的培训教材。编写时力求联系我国现实，符合国际惯例，反应项目管理领域最新发展，使之有较广的应用范围。
A287: =ROW()-5 -> 841 | B287: F- | C287: 3042 | D287: 2 | E287: 03042-1 | F287: 项目后评价 | G287: 张三力 | H287: 10 | I287: 37135 | J287: 25
A288: =ROW()-5 -> 842 | B288: F- | C288: 1258 | D288: 1 | E288: 01258-X | F288: 项目管理引论 | G288: 吴之明等 | H288: 14 | I288: 37226 | J288: 25
A289: =ROW()-5 -> 843 | B289: F- | C289: 4165 | D289: 1 | E289: 04165-2 | F289: 项目采购管理 | G289: 冯之楹等 | H289: 15 | I289: 37104 | J289: 22
A290: =ROW()-5 -> 844 | B290: F- | C290: 4120 | D290: 1 | E290: 04120-2 | F290: 项目组织 | G290: 余志峰 | H290: 12 | I290: 37500 | J290: 30
A291: =ROW()-5 -> 845 | B291: F- | C291: 4284 | D291: 1 | E291: 04284-5 | F291: 英汉-汉英对照项目管理词语精选 | G291: 卢有杰等 | H291: 25 | I291: 37377 | J291: 15
A292: =ROW()-5 -> 846 | B292: F- | C292: 3024 | D292: 2 | E292: 03024-3 | F292: 项目风险管理 | G292: 卢有杰等 | H292: 7.5 | I292: 37104 | J292: 33
A293: =ROW()-5 -> 847 | B293: F- | C293: 3037 | D293: 2 | E293: 03037-5 | F293: 项目融资 | G293: 卢家仪等 | H293: 10 | I293: 37438 | J293: 30
A294: =ROW()-5 -> 848 | B294: F- | C294: 3584 | D294: 1 | E294: 03584-9 | F294: 项目人力资源与沟通管理 | G294: 刘新梅等 | H294: 8.8 | I294: 37257 | J294: 32
A295: =ROW()-5 -> 849 | B295: F- | C295: 4894 | D295: 1 | E295: 04894-0 | F295: 项目进度管理 | G295: 朱宏亮 | H295: 13 | I295: 37316 | J295: 26
F296: 傲姿时代项目管理系列教材
A297: =ROW()-5 -> 851 | B297: P- | C297: 3703 | D297: 1 | E297: 7900637036 | F297: 项目管理基础（配光盘） | G297: 傲姿时代 | H297: 38 | I297: 37530 | J297: 12
A298: =ROW()-5 -> 852 | B298: F- | C298: 5498 | D298: 1 | E298: 05498-3 | F298: 实用项目管理与图解 | G298: 傲姿时代 | H298: 28 | I298: 37377 | J298: 8
F299: 电子商务热点丛书
A300: 本套丛书由国内相关行业的最优秀的专家学者编著，丛书结合中国国情对电子商务的机理、运营模式、网络营销模式等问题进行深入的研究，寻找物流配送、金融与安全、网站建设的解决方案，营造适宜发展电子商务的环境和相应的法律规范，以促进中国电子商务健康有序的发展。
A301: =ROW()-5 -> 855 | B301: F- | C301: 4056 | D301: 1 | E301: 04056-7 | F301: 电子商务基础 | G301: 梅绍祖等 | H301: 26 | I301: 37469 | J301: 14
A302: =ROW()-5 -> 856 | B302: F- | C302: 3908 | D302: 1 | E302: 03908-9 | F302: 电子商务与物流 | G302: 张 铎 | H302: 25 | I302: 37438 | J302: 15
A303: =ROW()-5 -> 857 | B303: F- | C303: 4046 | D303: 1 | E303: 04046-X | F303: 电子商务法律规范 | G303: 梅绍祖等 | H303: 32 | I303: 37135 | J303: 11
A304: =ROW()-5 -> 858 | B304: F- | C304: 3983 | D304: 1 | E304: 03983-6 | F304: 电子商务网站建设 | G304: 陈信祥等 | H304: 22 | I304: 37012 | J304: 15
A305: =ROW()-5 -> 859 | B305: F- | C305: 1256 | D305: 1 | E305: 01256-3 | F305: 电子商务实现技术 | G305: 陈晓红 | H305: 35 | I305: 36923 | J305: 10
A306: =ROW()-5 -> 860 | B306: F- | C306: 3972 | D306: 1 | E306: 03972-0 | F306: 电子商务金融与安全 | G306: 梅绍祖 | H306: 19.5 | I306: 36739 | J306: 15
F307: 网络先锋 ―― 电子商务经典系列
A308: 丛书所选图书均是在国外深受欢迎、并被名牌高校广泛采用的优秀教材，绝大部分堪称电子商务图书领域中的经典之作；各本图书相互贯穿，既有内在的联系，又相对独立，自成体系，整体反映了电子商务运作的全貌；丛书作者对电子商务的管理及技术有深刻的体会和丰富的实践经验，他们能准确地理解和阐述电子商务运作的理念、管理与技术。
A309: =ROW()-5 -> 863 | B309: F- | C309: 0762 | D309: 1 | E309: 00762-4 | F309: 电子商务 ―― 管理指南* | G309: 陈雪美译 | H309: 43 | I309: 36800 | J309: 8
B310: * | C310: 该书被选为清华大学经济管理学院电子商务课程教学辅导教材。
A311: =ROW()-5 -> 865 | B311: F- | C311: 4599 | D311: 1 | E311: 04599-2 | F311: 互联网商务模式与战略――理论和案例* | G311: 李明志等译 | H311: 46 | I311: 37196 | J311: 7
B312: * 本书作为哈佛―清华高级经理培训课程使用，为本科生及商学院学生提供了有关战略、电子商务、管理信息系统、创业、市场营销等方面的知识。
A313: =ROW()-5 -> 867 | B313: F- | C313: 4816 | D313: 1 | E313: 04816-9 | F313: 电子商务管理者指南――从战术到战略* | G313: 黄京华等译 | H313: 23 | I313: 37226 | J313: 9
B314: * 本书是著名的普华永道管理咨询公司的咨询顾问们指导企业e化的经验汇总，本书详细提供了企业在特定时期所处的电子商务各阶段所需要的信息。
A315: =ROW()-5 -> 869 | B315: F- | C315: 1263 | D315: 1 | E315: 01263-6 | F315: 电子商务 ―― 管理・技术・应用 | G315: 查修杰等译 | H315: 69 | I315: 36708 | J315: 5
A316: =ROW()-5 -> 870 | B316: F- | C316: 3864 | D316: 1 | E316: 03864-3 | F316: 知识管理 ―― 网络应用实作指南 | G316: 冯国扶译 | H316: 16 | I316: 36708 | J316: 25
A317: =ROW()-5 -> 871 | B317: F- | C317: 4025 | D317: 1 | E317: 04025-7 | F317: 电子商务 ―― 策略、技术与应用 （英文影印版） | G317: David whiteley | H317: 32 | I317: 36800 | J317: 12
F318: 清华经管案例库
A319: =ROW()-5 -> 873 | B319: F- | C319: 3742 | D319: 1 | E319: 03742-6 | F319: 市场营销案例（中国卷 第一辑） | G319: 赵 平等 | H319: 16.5 | I319: 36526 | J319: 15
A320: =ROW()-5 -> 874 | B320: F- | C320: 1283 | D320: 1 | E320: 01283-4 | F320: 中国著名企业战略管理案例 | G320: 金占明等 | H320: 21 | I320: 37104 | J320: 12
A321: =ROW()-5 -> 875 | B321: F- | C321: 0724 | D321: 2 | E321: 00724-1 | F321: 中国建设项目审计案例 | G321: 贾 震 | H321: 33 | I321: 36800 | J321: 8
A322: =ROW()-5 -> 876 | B322: F- | C322: 1243 | D322: 1 | E322: 01243--1 | F322: 风险投资实务与案例 | G322: 王俊峰等 | H322: 22 | I322: 36678 | J322: 12
F323: 清华经管译林
A324: =ROW()-5 -> 878 | B324: F- | C324: 3629 | D324: 1 | E324: 03629-2 | F324: 领导引擎 ――公司常胜宝典 | G324: 林宙辰等译 | H324: 24 | I324: 36434 | J324: 15
A325: =ROW()-5 -> 879 | B325: F- | C325: 3393 | D325: 1 | E325: 03393-5 | F325: 水牛的腾飞 ―― 走向经济成功之路 | G325: 陈 晓译 | H325: 22 | I325: 36404 | J325: 16
A326: =ROW()-5 -> 880 | B326: F- | C326: 5043 | D326: 1 | E326: 05043-0 | F326: 高技术企业产品战略――推动企业商务向网络速度迈进（第二版） | G326: 刘求生译 | H326: 27 | I326: 37257 | J326: 8
A327: =ROW()-5 -> 881 | B327: F- | C327: 4571 | D327: 1 | E327: 04571-2 | F327: 新技术的商业化――从创意到市场 | G327: 张作义等译 | H327: 29 | I327: 37135 | J327: 8
A328: =ROW()-5 -> 882 | B328: F- | C328: 4111 | D328: 1 | E328: 04111-3 | F328: 实时的魅力――成功企业对实现实时信息技术的反应和应用* | G328: 史晓旬 等译 | H328: 15 | I328: 36923 | J328: 23
A329: 作者阐述了信息如何影响竞争优势的取得，指出开发传递综合、实时、活跃的信息传递系统能够使企业做出迅速、有创造性的反应。本书对于那些努力在全球化、技术泛滥、竞争激烈的时代具有更强竞争力的人会大有帮助。
A330: =ROW()-5 -> 884 | B330: F- | C330: 3758 | D330: 1 | E330: 03758-2 | F330: 一课之师 ―― 经济学反省 | G330: 吴栋等译 | H330: 12 | I330: 36495 | J330: 25
A331: =ROW()-5 -> 885 | B331: F- | C331: 3718 | D331: 1 | E331: 03718-3 | F331: 百年锋芒 ―― 吉列领先之路 | G331: 朱升华等译 | H331: 25 | I331: 36678 | J331: 12
A332: =ROW()-5 -> 886 | B332: F- | C332: 1351 | D332: 1 | E332: 01351-9 | F332: 中小企业的经营秘诀* | G332: 田子琪译 | H332: 15 | I332: 37104 | J332: 30
A333: 本书的作者是日本企业家、学者，他成功地在日本国内外创立并经营着十几家企业。作者结合自己的切身经验，用浅显的语言讲述了经营中小型企业应注重的技巧和方法，蕴涵的哲理十分深刻。
A334: =ROW()-5 -> 888 | B334: F- | C334: 2526 | D334: 1 | E334: 02526-6 | F334: 默顿・米勒论金融衍生工具 | G334: 刘勇等译 | H334: 19 | I334: 36495 | J334: 19
A335: 本书汇集了1990年诺贝尔经济学奖得主默顿 米勒教授1990―1997在不同场合的22篇发言和演讲。作者除了论述金融衍生工具外，对世界上两种主要的公司管理模式进行了对比和探讨，并对中国经济发展前景等一系列广泛问题发表了见解。
A336: =ROW()-5 -> 890 | B336: F- | C336: 2330 | D336: 1 | E336: 02330-1 | F336: 期货交易技术分析 | G336: 马龙龙等译 | H336: 75 | I336: 36526 | J336: 5
A337: 本书作者Jack D.Schwager是美国期货界技术分析派重要的代表人物之一，他提出的理论与方法受到越来越多的业内人士推崇。本书全面阐述了期货交易中的图表分析方法与策略，语言通俗易懂，是一本优秀的金融类畅销书。
A338: =ROW()-5 -> 892 | B338: F- | C338: 2189 | D338: 1 | E338: 02189-9 | F338: 股市无敌 | G338: 傅保华等译 | H338: 16.8 | I338: 37012 | J338: 26
A339: 本书作者在美国股民中家喻户晓――小理查德阿姆斯。以其名字命名的阿姆斯指数已成为华尔街最重要的技术分析指标之一。本书中阿姆斯阐述了其独特的股票交易技术分析方法，解释了阿姆斯指数的计算方法及其具体应用。
F340: 营销之旅 (翻译版)
A341: 本丛书均是国外相关领域最好的图书之一。书中有大量的案例分析，有助于企业解决经营中的若干棘手问题。
A342: =ROW()-5 -> 896 | B342: F- | C342: 3247 | D342: 2 | E342: 03247-5 | F342: 营销之旅 ―― 定价策略与技巧(第2版) (The Strategy and Tactics of Pricing) | G342: 赵平等译 | H342: 26.8 | I342: 37257 | J342: 13
A343: =ROW()-5 -> 897 | B343: F- | C343: 3717 | D343: 1 | E343: 03717-5 | F343: 营销之旅―― 塑造品牌特征市场竞争中通向成功的策略（Building Brand Identity) | G343: 戴贤远译 | H343: 24.5 | I343: 37196 | J343: 12
A344: =ROW()-5 -> 898 | B344: F- | C344: 3974 | D344: 1 | E344: 03974-7 | F344: 市场营销渠道（第五版） （Marketing Channels） | G344: 赵 平等译 | H344: 39 | I344: 37012 | J344: 8
A345: =ROW()-5 -> 899 | B345: F- | C345: 3354 | D345: 1 | E345: 03354-4 | F345: 营销之旅 ――广告管理 * （Advertising Management) | G345: Rajeev Batra 等 | H345: 49 | I345: 37469 | J345: 6
A346: 本书是国际上最优秀的广告管理教材之一，哈佛商学院、沃顿商学院等著名商学院都将本书作为MBA课程的首选教材。
F347: 国家自然科学基金重大项目金融工程丛书
A348: 本丛书反映了“九五”自然科学基金重大项目“金融数学、金融工程及金融管理”的部分研究成果。
A349: =ROW()-5 -> 903 | B349: F- | C349: 3003 | D349: 2 | E349: 03003-0 | F349: 金融工程 | G349: 宋逢明等 | H349: 49 | I349: 37226 | J349: 5
A350: =ROW()-5 -> 904 | B350: F- | C350: 3714 | D350: 1 | E350: 03714-0 | F350: 金融工程原理 无套利均衡分析 | G350: 宋逢明 | H350: 20 | I350: 37438 | J350: 11
A351: =ROW()-5 -> 905 | B351: F- | C351: 3383 | D351: 1 | E351: 03383-8 | F351: 金融工程原理 无套利均衡分析 | G351: 朱武祥等译 | H351: 48 | I351: 37288 | J351: 6
A352: =ROW()-5 -> 906 | B352: F- | C352: 3488 | D352: 1 | E352: 03488-5 | F352: 与天为敌―― 风险探索传奇* | G352: 毛二万等译 | H352: 19.8 | I352: 37012 | J352: 15
A353: =ROW()-5 -> 907 | B353: F- | C353: 4980 | D353: 1 | E353: 04980-7 | F353: 新金融学――有效市场的反例 | G353: 赵冬青译 | H353: 15 | I353: 37384 | J353: 15
A354: 本书是一部轰动世界金融界的畅销书。作者用一个个精心整理的真实故事，讲述了古希腊哲学家、阿拉伯数学家、历史上的赌徒、商人、科学家以及著名的思想家和虽名不见经传但颇有灵感的业余者在人类探索风险历程中的奇闻轶事。
F355: 清华质量科学丛书
A356: =ROW()-5 -> 910 | B356: F- | C356: 4291 | D356: 1 | E356: 04291-8 | F356: 接近零不合格过程的质量控制 | G356: 孙 静 | H356: 25 | I356: 36982 | J356: 14
A357: 在电子、汽车等产业其产品控制都需要利用“接近零不合格过程的质量控制”这一新学科。本书作者为中国质量控制与质量保证标准化技术委员会委员，其对接近零不合格过程的研究，已取得多项国际水准的研究成果。
A358: =ROW()-5 -> 912 | B358: F- | C358: 3725 | D358: 1 | E358: 03725-6 | F358: 朱兰论质量策划（产品与服务质量策划的新步骤） | G358: 杨文士等译 | H358: 35 | I358: 36526 | J358: 10
A359: =ROW()-5 -> 913 | B359: F- | C359: 0781 | D359: 1 | E359: 00781-0 | F359: 质量管理小组活动 ―― 管理・工具・技巧 | G359: 徐明达 | H359: 12 | I359: 36739 | J359: 20
F360: 美国资本市场运作译丛
A361: =ROW()-5 -> 915 | B361: F- | C361: 2745 | D361: 1 | E361: 02745-5 | F361: 期货市场运作 | G361: 马龙龙译 | H361: 14 | I361: 1997 | J361: 22
A362: =ROW()-5 -> 916 | B362: F- | C362: 2806 | D362: 1 | E362: 02806-0 | F362: 期权市场运作 | G362: （美）沃克 | H362: 12.8 | I362: 1998 | J362: 25
A363: =ROW()-5 -> 917 | B363: F- | C363: 2795 | D363: 1 | E363: 02795-1 | F363: 股票市场运作 (第2版) | G363: John M.Dalton | H363: 17.8 | I363: 1998 | J363: 16
A364: =ROW()-5 -> 918 | B364: F- | C364: 2765 | D364: 1 | E364: 02765-X | F364: 债券市场运作 | G364: 褚福灵等译 | H364: 17.8 | I364: 1998 | J364: 17
A365: =ROW()-5 -> 919 | B365: F- | C365: 2811 | D365: 1 | E365: 02811-7 | F365: 共同基金运作 | G365: 刘勇等译 | H365: 18.8 | I365: 1998 | J365: 14
F366: 技术创新丛书
A367: 本丛书反映了国家自然科学基金重大项目――中国技术创新研究的最新研究成果，丛书汇集了多个中国大中型企业的案例，是关于企业创新与发展的第一手实证资料。
A368: =ROW()-5 -> 922 | B368: F- | C368: 2530 | D368: 3 | E368: 02530-4 | F368: 中国企业技术创新分析 | G368: 高 建 | H368: 15 | I368: 36526 | J368: 23
A369: =ROW()-5 -> 923 | B369: F- | C369: 2988 | D369: 2 | E369: 02988-1 | F369: 市场创新 | G369: 黄恒学 | H369: 15 | I369: 36434 | J369: 22
A370: =ROW()-5 -> 924 | B370: F- | C370: 3123 | D370: 2 | E370: 03123-1 | F370: 技术创新学 | G370: 傅家骥 | H370: 25 | I370: 37104 | J370: 14
A371: =ROW()-5 -> 925 | B371: F- | C371: 2528 | D371: 1 | E371: 02528-2 | F371: 技术创新产权 | G371: 扬 武 | H371: 16 | I371: 36708 | J371: 20
A372: =ROW()-5 -> 926 | B372: F- | C372: 3346 | D372: 1 | E372: 03346-3 | F372: 后发优势 | G372: 施培公 | H372: 15 | I372: 1999 | J372: 21
F373: 创新译丛
A374: =ROW()-5 -> 928 | B374: F- | C374: 3262 | D374: 1 | E374: 03262-9 | F374: 创新制胜 | G374: 孙连勇等译 | H374: 16 | I374: 1999 | J374: 20
A375: =ROW()-5 -> 929 | B375: F- | C375: 3487 | D375: 2 | E375: 03487-7 | F375: 把握创新 | G375: 高建等译 | H375: 20 | I375: 36586 | J375: 20
A376: =ROW()-5 -> 930 | B376: F- | C376: 3959 | D376: 1 | E376: 03959-3 | F376: 创新聚集 ―― 产业创新手册 | G376: 陈劲等译 | H376: 29.8 | I376: 36708 | J376: 11
A377: =ROW()-5 -> 931 | B377: F- | C377: 4932 | D377: 1 | E377: 04932-7 | F377: 创新管理――技术、市场与组织变革的集成 | G377: 陈劲 等译 | H377: 28 | I377: 37408 | J377: 10
F378: 世界流通产业透视丛书
A379: =ROW()-5 -> 933 | B379: F- | C379: 4282 | D379: 1 | E379: 04282-9 | F379: 美国现代商品零售业历史、现状与未来 | G379: 吕一林 | H379: 15 | I379: 37012 | J379: 25
A380: =ROW()-5 -> 934 | B380: F- | C380: 4305 | D380: 1 | E380: 04305-1 | F380: 日本现代流通产业 | G380: 李东贤 | H380: 17 | I380: 37013 | J380: 22
F381: 审计署中级培训教材
A382: =ROW()-5 -> 936 | B382: F- | C382: 5525 | D382: 1 | E382: 05525-1 | F382: 会计信息系统 | G382: 乔鹏等 | H382: 26 | I382: 37438 | J382: 10
F383: 2.经济管理分类图书
F384: 管理类
A385: =ROW()-5 -> 939 | B385: F- | C385: 5253 | D385: 1 | E385: 5253-0 | F385: 企业能源审计方法（第二版） | G385: 孟昭利 | H385: 29.00 | I385: 37347 | J385: 12
A386: =ROW()-5 -> 940 | B386: F- | C386: 5302 | D386: 1 | E386: 05302-1 | F386: 企业资源规划――管理、技术、应用 | G386: 朱岩译 | H386: 33.00 | I386: 37438 | J386: 9
A387: =ROW()-5 -> 941 | B387: F- | C387: 5300 | D387: 1 | E387: 05300-6 | F387: 消费者心理学（第二版） | G387: 罗子明 | H387: 30.00 | I387: 37469 | J387: 9
A388: =ROW()-5 -> 942 | B388: F- | C388: 5790 | D388: 1 | E388: 05790-7 | F388: 创业营销：沃顿MBA创业课程 | G388: 艾郁等译 | H388: 21 | I388: 37530 | J388: 12
A389: =ROW()-5 -> 943 | B389: F- | C389: 4413 | D389: 1 | E389: 04413-9 | F389: 欧洲 MBA 浓缩读本――我的 MBA 学习笔记 | G389: 王革非 | H389: 29 | I389: 37500 | J389: 9
A390: =ROW()-5 -> 944 | B390: F- | C390: 4542 | D390: 1 | E390: 04542-9 | F390: 公司规范化管理实务 | G390: 许 强 | H390: 95 | I390: 37438 | J390: 4
A391: =ROW()-5 -> 945 | B391: F- | C391: 4758 | D391: 1 | E391: 04758-8 | F391: 面向 21 世纪中国可持续发展战略研究 | G391: 编委会 | H391: 29 | I391: 37196 | J391: 12
A392: =ROW()-5 -> 946 | B392: F- | C392: 4966 | D392: 1 | E392: 04966-1 | F392: 国际财务报表分析 | G392: 王中华等译 | H392: 30 | I392: 37196 | J392: 8
A393: =ROW()-5 -> 947 | B393: F- | C393: 2361 | D393: 1 | E393: 02361-1 | F393: 一个外企经理的管理札记 | G393: 刘 博 | H393: 18 | I393: 37226 | J393: 17
A394: =ROW()-5 -> 948 | B394: F- | C394: 2775 | D394: 2 | E394: 02775-7 | F394: 沃伦・巴菲特之路 | G394: 朱武祥译 | H394: 21 | I394: 1998 | J394: 15
A395: =ROW()-5 -> 949 | B395: F- | C395: 1085 | D395: 1 | E395: 01085-4 | F395: 企业文化与 CI 策划 | G395: 张 德等 | H395: 18 | I395: 37500 | J395: 15
A396: =ROW()-5 -> 950 | B396: F- | C396: 0733 | D396: 1 | E396: 00733-0 | F396: 现代人力资源管理手册* | G396: 涂台良 | H396: 20 | I396: 37316 | J396: 20
A397: 作者集其多年的人力资源管理实务经验，全方位介绍了现代人力资源管理的基本理念和操作方法。本书论及招聘、培训、员工辅导、办公室管理、保安管理等40个人力资源管理功能，内容全面、精炼，具有很强的可操作性。
A398: =ROW()-5 -> 952 | B398: F- | C398: 3923 | D398: 1 | E398: 03923-2 | F398: 管理与伦理 | G398: 周祖城 | H398: 17 | I398: 36678 | J398: 24
A399: =ROW()-5 -> 953 | B399: F- | C399: 3984 | D399: 1 | E399: 03984-4 | F399: 中国地带差距与中西部开发 | H399: 18 | I399: 36831 | J399: 22
A400: =ROW()-5 -> 954 | B400: TP | C400: 3327 | D400: 1 | E400: 03327-7 | F400: 硅谷商战 | G400: 李彦宏 | H400: 18.8 | I400: 1999 | J400: 17
A401: =ROW()-5 -> 955 | B401: TP | C401: 5075 | D401: 1 | E401: 05075-9 | F401: 客户关系管理 | G401: 丁秋林等 | H401: 16 | I401: 37348 | J401: 20
A402: =ROW()-5 -> 956 | B402: F- | C402: 3290 | D402: 1 | E402: 03290-4 | F402: 大转变――企业构建工程的七项原则 | G402: 李东贤等译 | H402: 48 | I402: 36281 | J402: 6
A403: =ROW()-5 -> 957 | B403: F- | C403: 2671 | D403: 4 | E403: 02671-8 | F403: 生存之路――计算机技术引发的全新经营 革命 | G403: 李东贤等译 | H403: 24 | I403: 1998 | J403: 10
A404: =ROW()-5 -> 958 | B404: Z- | C404: 2755 | D404: 2 | E404: 02755-2 | F404: 创造性领导的挑战 | G404: 郑泉水等 | H404: 24 | I404: 1998 | J404: 10
A405: =ROW()-5 -> 959 | B405: F- | C405: 3669 | D405: 1 | E405: 03669-1 | F405: 现代企业经营决策―― 博弈论方法应用 | G405: 雷林 等 | H405: 27 | I405: 36373 | J405: 10
A406: =ROW()-5 -> 960 | B406: F- | C406: 3225 | D406: 1 | E406: 03225-4 | F406: 并行工程管理方法与应用 | G406: 陈国权 | H406: 12.8 | I406: 1999 | J406: 25
A407: =ROW()-5 -> 961 | B407: F- | C407: 2757 | D407: 1 | E407: 02757-9 | F407: 正反馈 | G407: 郑维敏 | H407: 18.6 | I407: 1998 | J407: 13
A408: =ROW()-5 -> 962 | B408: F- | C408: 2682 | D408: 1 | E408: 02682-3 | F408: 振兴中国管理科学――中国管理学引论 | G408: 潘承烈等 | H408: 19.5 | I408: 1997 | J408: 13
A409: =ROW()-5 -> 963 | B409: F- | C409: 3364 | D409: 1 | E409: 03364-1 | F409: 面向负荷的生产控制 | G409: 肖田元等译 | H409: 36 | I409: 36342 | J409: 9
F410: 其他类
A411: =ROW()-5 -> 965 | B411: F- | C411: 1184 | D411: 2 | E411: 01184-2 | F411: 中国电子商务与实践 | G411: 关翔 等 | H411: 24 | I411: 36678 | J411: 12
A412: =ROW()-5 -> 966 | B412: F- | C412: 5457 | D412: 1 | E412: 05457-6 | F412: 客户关系管理――企业典范 | G412: ARC远擎管理顾问公司 | H412: 12 | I412: 37438 | J412: 37
A413: =ROW()-5 -> 967 | B413: F- | C413: 5696 | D413: 1 | E413: 05696-X | F413: 诺贝尔经济学奖与数学 | G413: 史树中 | H413: 10 | I413: 37469 | J413: 30
A414: =ROW()-5 -> 968 | B414: G- | C414: 0795 | D414: 1 | E414: 00795-0 | F414: 由香港制造 | G414: 侯世昌等译 | H414: 24 | I414: 36831 | J414: 16
A415: =ROW()-5 -> 969 | B415: F- | C415: 2959 | D415: 1 | E415: 02959-8 | F415: 发达资本主义国家的所有制研究 | G415: 高峰 等 | H415: 16 | I415: 1998 | J415: 15
A416: =ROW()-5 -> 970 | B416: F- | C416: 3018 | D416: 1 | E416: 03018-9 | F416: 中国事业管理体制改革研究 | G416: 黄恒学 | H416: 15 | I416: 1998 | J416: 16
A417: =ROW()-5 -> 971 | B417: F- | C417: 2339 | D417: 1 | E417: 02339-5 | F417: 中外合资企业管理基础 （投资\组建\经营） | G417: 林功实等 | H417: 13.6 | I417: 1997 | J417: 15
A418: =ROW()-5 -> 972 | B418: F- | C418: 2689 | D418: 1 | E418: 02689-X | F418: 非营利组织会计准则理论框架 | G418: 荆 新 | H418: 8.5 | I418: 1997 | J418: 30
A419: =ROW()-5 -> 973 | B419: F- | C419: 3280 | D419: 1 | E419: 03280-7 | F419: 政府及非赢利组织会计理论与务实 | G419: 王建英等译 | H419: 62 | I419: 36281 | J419: 5
A420: =ROW()-5 -> 974 | B420: TS | C420: 5443 | D420: 1 | E420: 05443-6 | F420: 第三届龙玺环球华文广告奖获奖作品集（配光盘） | G420: 创意奖公司 | H420: 120.00 | I420: 37377 | J420: 20
A421: =ROW()-5 -> 975 | B421: F- | C421: 5830 | D421: 1 | E421: 05830-X | F421: 投资学 | G421: 朱宝宪 | H421: 39.00 | I421: 37530 | J421: 6
A422: =ROW()-5 -> 976 | B422: F- | C422: 5601 | D422: 1 | E422: 05601-3 | F422: 以风险为基础的基金临管现代化 | G422: 李仲祥 | H422: 20.00 | I422: 37530 | J422: 18
A423: =ROW()-5 -> 977 | B423: F- | C423: 5656 | D423: 1 | E423: 05656-0 | F423: 当代风险管理与保险教程（第7版）（Introduction to Risk Management and insurance Seventh Edition) | G423: 齐瑞宗等译 | H423: 48.00 | I423: 37530 | J423: 5

A1: 张幕津等