A1: 序号 | C1: 代 号 | E1: ISBN 7-302- | F1: 名 称 | G1: 著译编者 | H1: 定价(元) | I1: 印年 | J1: 册/包 | K1: 订数
F2: 三、工程技术与基础学科
E3: （一）自动化技术 电子技术 电机工程
F4: 1.自动化
A5: =ROW()-4 -> 1 | B5: TP | C5: 4499 | D5: 1 | E5: 04499-6 | F5: 智能优化算法及其应用 | G5: 王 凌 | H5: 22.00 | I5: 37165 | J5: 12
A6: =ROW()-4 -> 2 | B6: TP | C6: 2406 | D6: 1 | E6: 02406-5 | F6: 集成化离散生产控制 ―― 分析与综合 | G6: 熊光楞等 | H6: 19.60 | I6: 1997 | J6: 12
A7: =ROW()-4 -> 3 | B7: TP | C7: 2233 | D7: 1 | E7: 02233-X | F7: 集散型控制系统选型与应用 | G7: 王常力等 | H7: 35.00 | I7: 36923 | J7: 6
A8: =ROW()-4 -> 4 | B8: TP | C8: 3407 | D8: 1 | E8: 03407-9 | F8: 离散事件系统建模与仿真 | G8: 顾启秦 | H8: 13.50 | I8: 36373 | J8: 16
A9: =ROW()-4 -> 5 | B9: TP | C9: 2551 | D9: 2 | E9: 02551-7 | F9: 模糊数学在自动化技术中的应用 | G9: 张曾科 | H9: 21.00 | I9: 36434 | J9: 10
A10: =ROW()-4 -> 6 | B10: TP | C10: 2096 | D10: 1 | E10: 02096-5 | F10: 计算机集成制造(CIM)系统设计和实施方法论 | G10: 陈禹六等 | H10: 8.80 | I10: 35156 | J10: 22
A11: =ROW()-4 -> 7 | B11: TP | C11: 2825 | D11: 1 | E11: 02825-7 | F11: 先进制造业运行模式 | G11: 陈禹六 | H11: 8.5 | I11: 1998 | J11: 20
A12: =ROW()-4 -> 8 | B12: TP | C12: 0956 | D12: 7 | E12: 00956-2 | F12: 控制工程基础 | G12: 董景新等 | H12: 19.00 | I12: 37408 | J12: 10
A13: =ROW()-4 -> 9 | B13: TP | C13: 0456 | D13: 3 | E13: 00456-0 | F13: 计算机控制理论及应用 | G13: 孙增圻 | H13: 19.50 | I13: 1996 | J13: 8
A14: =ROW()-4 -> 10 | B14: TP | C14: 2882 | D14: 3 | E14: 02882-6 | F14: 计算机控制系统 | G14: 何克忠等 | H14: 29.80 | I14: 37316 | J14: 7
A15: =ROW()-4 -> 11 | B15: TP | C15: 3257 | D15: 1 | E15: 03257-2 | F15: 柔性装配系统的设计与实现 | G15: 何健廉等 | H15: 8.00 | I15: 36708 | J15: 40
A16: =ROW()-4 -> 12 | B16: TP | C16: 3950 | D16: 1 | E16: 03950-X | F16: 机器人学* | G16: 蔡自兴 | H16: 38.00 | I16: 36800 | J16: 7
A17: =ROW()-4 -> 13 | B17: TP | C17: 3950 | D17: 2 | E17: 03950-X | F17: 机器人学 (精）* | G17: 蔡自兴 | H17: 49.00 | I17: 36831 | J17: 5
F18: *本书获2002年教育部全国普通高等学校优秀教材一等奖。
A19: =ROW()-4 -> 15 | B19: TP | C19: 3721 | D19: 1 | E19: 03721-3 | F19: 机器人鲁棒控制基础 | G19: 申铁龙 | H19: 16.00 | I19: 36586 | J19: 20
A20: =ROW()-4 -> 16 | B20: TP | C20: 4075 | D20: 1 | E20: 04075-3 | F20: 自动检测和仪表中的共性技术 | G20: 徐科军等 | H20: 20.00 | I20: 36892 | J20: 12
A21: =ROW()-4 -> 17 | B21: TP | C21: 3546 | D21: 1 | E21: 03546-6 | F21: 现代计算机技术在商场管理中的应用 | G21: 鲍居武等 | H21: 26.00 | I21: 36312 | J21: 9
A22: =ROW()-4 -> 18 | B22: TP | C22: 4678 | D22: 1 | E22: 04678-6 | F22: Motorola 微控制器 MC68HC08 原理及其嵌入式应用 | G22: 刘慧银等 | H22: 26.00 | I22: 37104 | J22: 10
A23: =ROW()-4 -> 19 | B23: TP | C23: 0853 | D23: 1 | E23: 00853-1 | F23: 反馈控制系统设计与分析―― MATLAB 语言应用 | G23: 薛定宇 | H23: 36.00 | I23: 36678 | J23: 6
A24: =ROW()-4 -> 20 | B24: TP | C24: 3417 | D24: 2 | E24: 03417-6 | F24: IDEF 建模分析和设计方法 | G24: 陈禹六 | H24: 28.00 | I24: 36586 | J24: 9
A25: =ROW()-4 -> 21 | B25: P- | C25: 3561 | D25: 1 | E25: 7900635610 | F25: 监控组态软件及其应用（配光盘） | G25: 马国华 | H25: 29.80 | I25: 37369 | J25: 9
A26: =ROW()-4 -> 22 | B26: TP | C26: 4583 | D26: 1 | E26: 04583-6 | F26: 控制网络技术 | G26: 郑文波 | H26: 16.00 | I26: 37104 | J26: 18
A27: =ROW()-4 -> 23 | B27: TP | C27: 3384 | D27: 1 | E27: 03384-6 | F27: 现场总线技术及其应用 | G27: 阳宪惠等 | H27: 36.00 | I27: 37469 | J27: 8
A28: =ROW()-4 -> 24 | B28: TP | C28: 3289 | D28: 1 | E28: 03289-0 | F28: MACH 可编程逻辑器件及其开发工具 （第二版） | G28: 薛宏熙等 | H28: 53.00 | I28: 1998 | J28: 5
A29: =ROW()-4 -> 25 | B29: TP | C29: 2840 | D29: 1 | E29: 02840-0 | F29: TH-DAIMS清华图纸自动输入及管理系统使用指南 | G29: 李新友等 | H29: 16 | I29: 1998 | J29: 18
A30: =ROW()-4 -> 26 | B30: TP | C30: 5103 | D30: 1 | E30: 05103-8 | F30: CIMS 环境下――集成化管理系统的分析、设计与实施 | G30: 夸克工作室 | H30: 48 | I30: 37288 | J30: 5
A31: =ROW()-4 -> 27 | B31: TN | C31: 3322 | D31: 1 | E31: 03322-6 | F31: 雷达自动检测与恒虚警处理 | G31: 何友等 | H31: 38.00 | I31: 36312 | J31: 5
A32: =ROW()-4 -> 28 | B32: TN | C32: 3876 | D32: 1 | E32: 03876-7 | F32: 空时自适应信号处理（精） | G32: 王永良等 | H32: 32.00 | I32: 36923 | J32: 8
A33: =ROW()-4 -> 29 | B33: TP | C33: 5171 | D33: 1 | E33: 05171-2 | F33: 非线性控制中的L2增益和无源化方法（第二版） | G33: 孙元章 | H33: 35.00 | I33: 37316 | J33: 6
A34: =ROW()-4 -> 30 | B34: TP | C34: 4997 | D34: 1 | E34: 04997-1 | F34: 产品数据标准与PDM | G34: 李善平等 | H34: 32.00 | I34: 37347 | J34: 8
A35: =ROW()-4 -> 31 | B35: TH | C35: 5048 | D35: 1 | E35: 05048-1 | F35: 机电控制工程 | G35: 高钟毓 | H35: 23.00 | I35: 37347 | J35: 12
A36: =ROW()-4 -> 32 | B36: TH | C36: 5712 | D36: 1 | E36: 05712-5 | F36: 质量工程与计量技术基础 | G36: 方仲彦 | H36: 28.00 | I36: 37500 | J36: 10
A37: =ROW()-4 -> 33 | B37: TH | C37: 5712 | D37: 1 | E37: 05712-5 | F37: 质量工程与计量技术基础 | G37: 方仲彦 | H37: 28.00 | I37: 37500 | J37: 10
F38: 现代集成制造系统（CIMS）系列
A39: =ROW()-4 -> 35 | B39: TP | C39: 3978 | D39: 1 | E39: 03978-X | F39: 复杂系统的面向对象建模、分析与设计 （配光盘） | G39: 范玉顺等 | H39: 38.00 | I39: 36831 | J39: 11
A40: =ROW()-4 -> 36 | B40: TP | C40: 4005 | D40: 1 | E40: 04005-2 | F40: 产品数据管理（PDM）技术 | G40: 童秉枢等 | H40: 25.00 | I40: 36861 | J40: 12
A41: =ROW()-4 -> 37 | B41: TP | C41: 4313 | D41: 1 | E41: 04313-2 | F41: 工作流管理技术基础 （配光盘）（平装） | G41: 范玉顺 | H41: 39.00 | I41: 37135 | J41: 7
A42: =ROW()-4 -> 38 | B42: TP | C42: 4313 | D42: 2 | E42: 04313-2 | F42: 工作流管理技术基础 （配光盘）（精装） | G42: 范玉顺 | H42: 55.00 | I42: 37012 | J42: 7
A43: =ROW()-4 -> 39 | B43: TP | C43: 4767 | D43: 1 | E43: 04767-7 | F43: 企业建模理论与方法学导论 | G43: 范玉顺等 | H43: 33.00 | I43: 37196 | J43: 9
A44: =ROW()-4 -> 40 | B44: TP | C44: 4653 | D44: 1 | E44: 04653-0 | F44: 敏捷供需链管理 | G44: 柴跃进等 | H44: 23.00 | I44: 37135 | J44: 12
A45: =ROW()-4 -> 41 | B45: TP | C45: 4169 | D45: 1 | E45: 04169-5 | F45: 并行工程理论与实践 | G45: 熊光楞等 | H45: 29.50 | I45: 37012 | J45: 9
A46: =ROW()-4 -> 42 | B46: TP | C46: 4356 | D46: 1 | E46: 04356-6 | F46: 经营过程重构（BPR）与系统集成 | G46: 陈禹六等 | H46: 19.00 | I46: 37043 | J46: 16
F47: 现代制造技术系列教材
A48: =ROW()-4 -> 44 | B48: TH | C48: 4612 | D48: 1 | E48: 04612-3 | F48: 制造系统 | G48: 郑力 等 | H48: 23.00 | I48: 37104 | J48: 12
A49: =ROW()-4 -> 45 | B49: TH | C49: 3113 | D49: 1 | E49: 03113-4 | F49: 机械制造工程原理 | G49: 冯之敬 | H49: 25.00 | I49: 37500 | J49: 8
A50: =ROW()-4 -> 46 | B50: TH | C50: 5740 | D50: 1 | E50: 05740-0 | F50: 数字控制技术 | G50: 叶蓓华 | H50: 22.00 | I50: 37500 | J50: 13
F51: 国际知名大学原版教材――信息技术学科
F52: 与电气工程学科系列
A53: =ROW()-4 -> 49 | B53: P- | C53: 3098 | D53: 1 | E53: 7900630988 | F53: 电路基础 (配光盘） | H53: 88.00 | I53: 37408 | J53: 3
A54: =ROW()-4 -> 50 | B54: TP | C54: 4141 | D54: 1 | E54: 04141-5 | F54: 线性控制系统工程 | G54: Morris Driels | H54: 54.00 | I54: 37408 | J54: 5
A55: =ROW()-4 -> 51 | B55: TP | C55: 4136 | D55: 1 | E55: 04136-9 | F55: 线性控制系统分析与设计（第4版） | H55: 65.00 | I55: 36892 | J55: 4
A56: =ROW()-4 -> 52 | B56: TP | C56: 4132 | D56: 1 | E56: 04132-6 | F56: 仿真建模与分析（第3版） | G56: Averill M.Law | H56: 65.00 | I56: 36892 | J56: 4
A57: =ROW()-4 -> 53 | B57: TP | C57: 4747 | D57: 1 | E57: 04747-2 | F57: 动态系统的数字控制（第3版）（配光盘） | G57: Gene F.Franklin 等 | H57: 59.00 | I57: 37135 | J57: 4
A58: =ROW()-4 -> 54 | B58: TP | C58: 4748 | D58: 1 | E58: 04748-0 | F58: 实时系统 | G58: C.M.Krishna 等 | H58: 39.00 | I58: 37165 | J58: 7
A59: =ROW()-4 -> 55 | B59: TP | C59: 4766 | D59: 1 | E59: 04766-9 | F59: 计算机组成与结构（第3版） | H59: 49.00 | I59: 37165 | J59: 5
A60: =ROW()-4 -> 56 | B60: TP | C60: 4936 | D60: 1 | E60: 04936-X | F60: 神经网络的综合基础（第2版） | G60: Simon Haykin | H60: 78.00 | I60: 37469 | J60: 3
A61: =ROW()-4 -> 57 | B61: TP | C61: 4937 | D61: 1 | E61: 04937-8 | F61: 模糊控制 | G61: Kevin M.Passino 等 | H61: 47.50 | I61: 37469 | J61: 6
A62: =ROW()-4 -> 58 | B62: TP | C62: 5008 | D62: 1 | E62: 05008-2 | F62: 计算机控制系统――理论与设计（第3版） | G62: Karl J.Astrom 等 | H62: 49.00 | I62: 37438 | J62: 5
A63: =ROW()-4 -> 59 | B63: P- | C63: 3589 | D63: 1 | E63: 7900635890 | F63: 控制系统设计 | G63: Graham C.Goodwin 等 | H63: 68.00 | I63: 2001.12 | J63: 3
A64: =ROW()-4 -> 60 | B64: P- | C64: 3099 | D64: 1 | E64: 7900630996 | F64: 电子电路分析与设计（配光盘）第2版 | H64: 99.80 | I64: 37469 | J64: 2
A65: =ROW()-4 -> 61 | B65: TN | C65: 4547 | D65: 1 | E65: 04547-X | F65: 电力电子系统――理论与设计 | G65: Jai P.Agrawal | H65: 55.00 | I65: 37135 | J65: 5
A66: =ROW()-4 -> 62 | B66: TN | C66: 4546 | D66: 1 | E66: 04546-1 | F66: 数字信号处理――基于计算机的方法（第2版） | G66: Sanjit K.Mitra | H66: 59.80 | I66: 37408 | J66: 4
A67: =ROW()-4 -> 63 | B67: TN | C67: 4545 | D67: 1 | E67: 04545-3 | F67: 电磁学及其应用（第5版） | G67: Kraus Fleisch | H67: 58.00 | I67: 37104 | J67: 5
A68: =ROW()-4 -> 64 | B68: TP | C68: 5143 | D68: 1 | E68: 05143-7 | F68: 系统辨识－－使用者的理论 | G68: Lennart Ljung | H68: 50.00 | I68: 37288 | J68: 5
A69: =ROW()-4 -> 65 | B69: P- | C69: 4119 | D69: 1 | E69: 790064119X | F69: 计算机网络与因特网（第3版）(配光盘) | G69: comer | H69: 62.00 | I69: 37316 | J69: 4
A70: =ROW()-4 -> 66 | B70: TP | C70: 5827 | D70: 1 | E70: 05827-X | F70: 分布式系统――原理与范例 | G70: S.Tanenbaum | H70: 59.00 | I70: 37500 | J70: 4
F71: 电子工程系列教材（英文影印版）
A72: =ROW()-4 -> 68 | B72: TN | C72: 3058 | D72: 2 | E72: 03058-8 | F72: 信号与系统 (Signals & Systems) | G72: Oppenheim A.V. | H72: 44.00 | I72: 37257 | J72: 6
A73: =ROW()-4 -> 69 | B73: TN | C73: 3059 | D73: 2 | E73: 03059-6 | F73: 信号处理导论 (Introuction to Signal Processing) | G73: Orfanidis S.J. | H73: 39.00 | I73: 37377 | J73: 7
A74: =ROW()-4 -> 70 | B74: TN | C74: 3060 | D74: 1 | E74: 03060-X | F74: 数字集成电路设计透视 (Digital Integrated Circuits) | G74: Jan M.Rabaey | H74: 36.00 | I74: 37500 | J74: 8
F75: 《信息技术丛书》与《信息、控制与系统》系列教材
A76: =ROW()-4 -> 72 | B76: TP | C76: 1059 | D76: 1 | E76: 01059-5 | F76: 模式识别（第2版） | G76: 边肇祺等 | H76: 25.00 | I76: 37337 | J76: 9
A77: =ROW()-4 -> 73 | B77: TP | C77: 3907 | D77: 2 | E77: 03907-0 | F77: 现代故障诊断与容错控制 | G77: 周东华等 | H77: 26.00 | I77: 36678 | J77: 8
A78: =ROW()-4 -> 74 | B78: TP | C78: 0581 | D78: C | E78: 00581-8 | F78: 自动控制原理（上） | G78: 吴 麒 | H78: 20.00 | I78: 37438 | J78: 8
A79: =ROW()-4 -> 75 | B79: TP | C79: 0957 | D79: 9 | E79: 00957-0 | F79: 自动控制原理（下） | G79: 吴 麒 | H79: 26.00 | I79: 37469 | J79: 7
A80: =ROW()-4 -> 76 | B80: TP | C80: 3555 | D80: 2 | E80: 03555-5 | F80: 随机控制 | G80: 郭尚来 | H80: 18.00 | I80: 36586 | J80: 12
A81: =ROW()-4 -> 77 | B81: TP | C81: 1115 | D81: 6 | E81: 01115-X | F81: 过程控制 | G81: 金以慧 | H81: 25.00 | I81: 37340 | J81: 8
A82: =ROW()-4 -> 78 | B82: TP | C82: 0925 | D82: 6 | E82: 00925-2 | F82: 过程计算机控制 | G82: 王锦标等 | H82: 21.00 | I82: 37196 | J82: 10
A83: =ROW()-4 -> 79 | B83: TP | C83: 0738 | D83: 4 | E83: 00738-1 | F83: 连续系统仿真及离散事件系统仿真 | G83: 熊光楞等 | H83: 25.00 | I83: 36739 | J83: 8
A84: =ROW()-4 -> 80 | B84: TP | C84: 0569 | D84: 5 | E84: 00569-9 | F84: 线性系统理论 | G84: 郑大钟 | H84: 27.00 | I84: 37347 | J84: 7
A85: =ROW()-4 -> 81 | B85: TP | C85: 1618 | D85: 2 | E85: 01618-6 | F85: 系统工程概论 | G85: 夏绍纬等 | H85: 12.60 | I85: 1995 | J85: 11
A86: =ROW()-4 -> 82 | B86: TP | C86: 0707 | D86: 4 | E86: 00707-1 | F86: 自动控制理论基础 | G86: 戴忠达 | H86: 29.00 | I86: 37073 | J86: 5
A87: =ROW()-4 -> 83 | B87: TP | C87: 2871 | D87: 1 | E87: 02871-0 | F87: 多变量频率域控制理论 | G87: 高黛陵等 | H87: 18.00 | I87: 1998 | J87: 11
A88: =ROW()-4 -> 84 | B88: TP | C88: 1103 | D88: 2 | E88: 01103-6 | F88: 信息理论基础 | G88: 常 迥 | H88: 20.00 | I88: 36951 | J88: 10
A89: =ROW()-4 -> 85 | B89: TP | C89: 1818 | D89: 3 | E89: 01818-9 | F89: 自适应控制 | G89: 韩曾晋 | H89: 15.00 | I89: 37257 | J89: 11
A90: =ROW()-4 -> 86 | B90: TP | C90: 0229 | D90: 4 | E90: 00229-0 | F90: 过程辨识 | G90: 方崇智等 | H90: 29.00 | I90: 37438 | J90: 5
A91: =ROW()-4 -> 87 | B91: TP | C91: 3977 | D91: 2 | E91: 03977-1 | F91: 人工神经网络与模拟进化计算* | G91: 阎平凡等 | H91: 36.00 | I91: 37327 | J91: 7
F92: *本书获2002年教育部全国普通高等学校优秀教材一等奖。
A93: =ROW()-4 -> 89 | B93: TN | C93: 1335 | D93: 1 | E93: 01335-7 | F93: 模拟系统的故障诊断与可靠性设计 | G93: 杨士元编著 | H93: 10.60 | I93: 37196 | J93: 10
A94: =ROW()-4 -> 90 | B94: TP | C94: 1136 | D94: 1 | E94: 01136-2 | F94: 数字系统的故障诊断与可靠性设计(第2版) | G94: 杨士元 | H94: 25.00 | I94: 36892 | J94: 9
A95: =ROW()-4 -> 91 | B95: TP | C95: 3965 | D95: 1 | E95: 03965-8 | F95: 离散事件动态系统 | G95: 郑大钟 | H95: 39.00 | I95: 37316 | J95: 6
A96: =ROW()-4 -> 92 | B96: TP | C96: 4962 | D96: 1 | E96: 04962-9 | F96: 高等过程控制 | G96: 王桂增等 | H96: 21.00 | I96: 37316 | J96: 11
A97: =ROW()-4 -> 93 | B97: TP | C97: 5275 | D97: 1 | E97: 05275-1 | F97: 自动控制理论例题习题集 | G97: 王诗宓等 | H97: 45.00 | I97: 37469 | J97: 5
A98: =ROW()-4 -> 94 | B98: TP | C98: 5305 | D98: 1 | E98: 05305-7 | F98: 宽带信息网络 | G98: 戴 琼海 | H98: 35.00 | I98: 37500 | J98: 7
F99: 自动化技术丛书
A100: =ROW()-4 -> 96 | B100: TP | C100: 2962 | D100: 2 | E100: 02962-8 | F100: 神经网络与模糊控制 | G100: 张乃尧 | H100: 19.50 | I100: 1999 | J100: 10
A101: =ROW()-4 -> 97 | B101: TP | C101: 2141 | D101: 3 | E101: 02141-4 | F101: CIMS 环境下――集成化管理系统的分析、设计与实施 | G101: 李芳芸等 | H101: 19.50 | I101: 37073 | J101: 10
A102: =ROW()-4 -> 98 | B102: TP | C102: 2317 | D102: 2 | E102: 02317-4 | F102: 计算机集成制造系统的组成与实施 | G102: 熊光楞等 | H102: 11.50 | I102: 1997 | J102: 20
A103: =ROW()-4 -> 99 | B103: TP | C103: 4113 | D103: 1 | E103: 04113-X | F103: 调节器与执行器 | G103: 王家桢 | H103: 17.00 | I103: 36951 | J103: 15
A104: =ROW()-4 -> 100 | B104: TP | C104: 2108 | D104: 4 | E104: 02108-2 | F104: 传感器与变送器 | G104: 王家桢等 | H104: 20.00 | I104: 37135 | J104: 10
F105: 现代工业企业自动化丛书
A106: =ROW()-4 -> 102 | B106: TP | C106: 2217 | D106: 1 | E106: 02217-8 | F106: 电子技术改造传统产业概论 | G106: 冯辛安 | H106: 20.00 | I106: 1996 | J106: 10
A107: =ROW()-4 -> 103 | B107: TP | C107: 4160 | D107: 1 | E107: 04160-1 | F107: 智能制造概论 | G107: 曾芬芳等 | H107: 23.00 | I107: 36982 | J107: 11
A108: =ROW()-4 -> 104 | B108: TP | C108: 4190 | D108: 1 | E108: 04190-3 | F108: 工业控制计算机组成原理 | G108: 孙廷才等 | H108: 15.00 | I108: 37012 | J108: 15
A109: =ROW()-4 -> 105 | B109: TP | C109: 3680 | D109: 1 | E109: 03680-2 | F109: 工业控制计算机实时操作系统 | G109: 蔡德聪等 | H109: 20.00 | I109: 36495 | J109: 11
A110: =ROW()-4 -> 106 | B110: TP | C110: 2899 | D110: 2 | E110: 02899-0 | F110: PC总线工业控制系统精粹 | G110: 凌 澄 | H110: 27.00 | I110: 1999 | J110: 8
A111: =ROW()-4 -> 107 | B111: TP | C111: 2719 | D111: 1 | E111: 02719-6 | F111: 信息系统工程原理、方法及应用 | G111: 周广声等 | H111: 19.50 | I111: 1998 | J111: 11
A112: =ROW()-4 -> 108 | B112: TP | C112: 2560 | D112: 3 | E112: 02560-6 | F112: 制造资源计划MRP-II 及其应用 | G112: 张 毅 | H112: 20.00 | I112: 37043 | J112: 10
A113: =ROW()-4 -> 109 | B113: TP | C113: 2409 | D113: 1 | E113: 02409- | F113: 企业数据通信 | G113: 吕建平 | H113: 15.00 | I113: 1997 | J113: 14
A114: =ROW()-4 -> 110 | B114: F- | C114: 3245 | D114: 1 | E114: 03245-9 | F114: 企业管理信息系统开发的理论和方法 | G114: 葛世伦等 | H114: 16 | I114: 37226 | J114: 14
A115: =ROW()-4 -> 111 | B115: TP | C115: 2657 | D115: 1 | E115: 02657-2 | F115: 柔性制造自动化的原理与实践 | G115: 吴启迪等 | H115: 18.00 | I115: 1997 | J115: 12
A116: =ROW()-4 -> 112 | B116: TP | C116: 4276 | D116: 1 | E116: 04276-4 | F116: 计算机智能监测控制系统的设计及应用 | G116: 周德泽等 | H116: 23.90 | I116: 37226 | J116: 10
A117: =ROW()-4 -> 113 | B117: TP | C117: 2688 | D117: 1 | E117: 02688-2 | F117: 计算机集成制造系统――CIMS概论 | G117: 白英彩等 | H117: 21.60 | I117: 36739 | J117: 10
A118: =ROW()-4 -> 114 | B118: TP | C118: 1460 | D118: 1 | E118: 01460-4 | F118: 可编程控制器网络通信及应用 | G118: 邱公伟 | H118: 32.00 | I118: 36951 | J118: 8
A119: =ROW()-4 -> 115 | B119: TP | C119: 2725 | D119: 1 | E119: 02725-0 | F119: 现代生产物流及仿真 | G119: 张晓萍等 | H119: 24.00 | I119: 36678 | J119: 10
A120: =ROW()-4 -> 116 | B120: TP | C120: 2921 | D120: 1 | E120: 02921-0 | F120: 计算机新型控制策略及其应用 | G120: 袁南儿等 | H120: 14.50 | I120: 1998 | J120: 16
A121: =ROW()-4 -> 117 | B121: TP | C121: 4426 | D121: 1 | E121: 04426-0 | F121: 工业常用传感器选型指南 | G121: 曲波 等 | H121: 20.00 | I121: 37257 | J121: 15
A122: =ROW()-4 -> 118 | B122: TP | C122: 5375 | D122: 1 | E122: 05375-8 | F122: 模糊控制理论与应用技术 | G122: 汤兵勇等 | H122: 16.80 | I122: 37500 | J122: 15
A123: =ROW()-4 -> 119 | B123: TP | C123: 5603 | D123: 1 | E123: 05603-X | F123: 可编程控制器原理及应用 | G123: 路林吉 | H123: 19.00 | I123: 37500 | J123: 13
F124: 工控与电子精品图书
A125: =ROW()-4 -> 121 | B125: P- | C125: 3726 | D125: 2 | E125: 7900637265 | F125: CPLD 数字电路设计――使用MAX + plus II 入门篇（配光盘） | G125: 廖裕评等 | H125: 49.00 | I125: 37408 | J125: 5
A126: =ROW()-4 -> 122 | B126: P- | C126: 3727 | D126: 1 | E126: 7900637273 | F126: PIC16F87X 快速上手（配光盘） | G126: 何信龙等 | H126: 29.00 | I126: 37226 | J126: 10
A127: =ROW()-4 -> 123 | B127: TP | C127: 4965 | D127: 1 | E127: 04965-3 | F127: PLD 逻辑设计实务 | G127: 邱耀煌 | H127: 24.00 | I127: 37196 | J127: 10
A128: =ROW()-4 -> 124 | B128: TP | C128: 4479 | D128: 1 | E128: 04479-1 | F128: 非线性系统的自适应控制导论 | G128: 周东华 | H128: 18.00 | I128: 37257 | J128: 16
A129: =ROW()-4 -> 125 | B129: TP | C129: 4841 | D129: 1 | E129: 04841-X | F129: 声控计算机制作与应用入门（配光盘） | G129: 陈龙三 | H129: 22.00 | I129: 37197 | J129: 12
A130: =ROW()-4 -> 126 | B130: TP | C130: 4120 | D130: 1 | E130: 04120-1 | F130: TMS320 C5XDSP原理设计与应用（配光盘） | G130: 孙宗瀛 | H130: 49.00 | I130: 37347 | J130: 6
A131: =ROW()-4 -> 127 | B131: P- | C131: 4144 | D131: 1 | E131: 7900641440 | F131: MATLAB程序设计与应用（配光盘） | G131: 张智星 | H131: 41.00 | I131: 37347 | J131: 7
A132: =ROW()-4 -> 128 | B132: TN | C132: 5511 | D132: 1 | E132: 05511-4 | F132: TMS320C54xx DSP实用技术 | G132: 汪安民 | H132: 29.00 | I132: 37469 | J132: 10
A133: =ROW()-4 -> 129 | B133: TP | C133: 5342 | D133: 1 | E133: 05342-1 | F133: VLSI概论 | G133: 谢永瑞 | H133: 35.00 | I133: 37500 | J133: 9
A134: =ROW()-4 -> 130 | B134: P- | C134: 4139 | D134: 1 | E134: 7900641394 | F134: PIC 16C 7X入门与应用范例（配光盘） | G134: 何信龙等 | H134: 39.00 | I134: 37500 | J134: 8
F135: 国外大学优秀教材――工业工程系列（影印版）
A136: =ROW()-4 -> 132 | B136: TB | C136: 5483 | D136: 1 | E136: 05483-1 | F136: 工程和设计中的人因学（第7版） | G136: Mark S.Sanders and Ernest | H136: 76 | I136: 37438 | J136: 3
A137: =ROW()-4 -> 133 | B137: TB | C137: 5604 | D137: 1 | E137: 05604-8 | F137: 21世纪制造 | G137: Paul Kenneth Wrigh | H137: 49 | I137: 37438 | J137: 6
A138: =ROW()-4 -> 134 | B138: P- | C138: 4197 | D138: 1 | E138: 7900641971 | F138: 工程师和科学家实用统计分析（用户手册） | G138: J.Wesley Barnes | H138: 65 | I138: 37469 | J138: 4
A139: =ROW()-4 -> 135 | B139: TB | C139: 5666 | D139: 1 | E139: 05666-8 | F139: 制造设施设计和物料搬运（第２版） | G139: Fred E.Meyers | H139: 53 | I139: 37469 | J139: 6
A140: =ROW()-4 -> 136 | B140: TB | C140: 5602 | D140: 1 | E140: 05602-1 | F140: Introduction To Industrial And System Engineer (工业与系统工程概论 第3版） | G140: Wayne C. Turner | H140: 49 | I140: 37469 | J140: 5
A141: =ROW()-4 -> 137 | B141: TB | C141: 5484 | D141: 1 | E141: 05484-3 | F141: Automation, Production Systems,and Computer-Integrated Manufacturing Second Edition 自动化、生产系统与计算机集成制造(第2版) | G141: Mikell P.Groover | H141: 72 | I141: 37469 | J141: 3
A142: =ROW()-4 -> 138 | B142: P- | C142: 4198 | D142: 1 | E142: 790064198X | F142: Statistical Quality Control 统计质量控制(含盘） | G142: EUGENE L.GRANT RICHARDS. LEAVENWORT | H142: 74 | I142: 37469 | J142: 4
A143: =ROW()-4 -> 139 | B143: TB | C143: 5657 | D143: 1 | E143: 05657-9 | F143: Systems Engineering and Analysis 3rd Edition (系统工程与分析 第3版） | G143: Benjamin S.Blanchard等 | H143: 71 | I143: 37469 | J143: 3
F144: 2、电子技术 电机工程
A145: =ROW()-4 -> 141 | B145: TN | C145: 2498 | D145: 4 | E145: 02498-7 | F145: 数字信号处理――理论、算法与实现 | G145: 胡广书 | H145: 29.00 | I145: 37525 | J145: 6
A146: =ROW()-4 -> 142 | B146: P- | C146: 3167 | D146: 1 | E146: 7900631674 | F146: 数字信号处理教程（第二版）（配光盘） | G146: 程佩青 | H146: 39.80 | I146: 37341 | J146: 6
A147: =ROW()-4 -> 143 | B147: TB | C147: 4918 | D147: 1 | E147: 04918-1 | F147: 可靠性工程原理 | G147: 郭永基 | H147: 24.00 | I147: 37257 | J147: 11
A148: =ROW()-4 -> 144 | B148: TP | C148: 0140 | D148: 5 | E148: 00140-5 | F148: 随机过程及其应用 | H148: 20.00 | I148: 37342 | J148: 8
A149: =ROW()-4 -> 145 | B149: P- | C149: 2548 | D149: 1 | E149: 7900625488 | F149: EWB 电路设计入门与应用（配光盘） | G149: 钟文耀等 | H149: 24.00 | I149: 37135 | J149: 25
A150: =ROW()-4 -> 146 | B150: TN | C150: 1707 | D150: 4 | E150: 01707-7 | F150: 现代信号处理 | G150: 张贤达 | H150: 34.00 | I150: 37333 | J150: 5
A151: =ROW()-4 -> 147 | B151: TN | C151: 1415 | D151: 6 | E151: 01415-9 | F151: 信号与系统分析基础 | G151: 姜建国等 | H151: 20.80 | I151: 37344 | J151: 10
A152: =ROW()-4 -> 148 | B152: O- | C152: 1315 | D152: 1 | E152: 01315-2 | F152: 光波导理论 | G152: 吴重庆 | H152: 16.00 | I152: 36617 | J152: 14
A153: =ROW()-4 -> 149 | B153: TN | C153: 1189 | D153: 3 | E153: 01189-3 | F153: 数字电路与系统 | G153: 刘宝琴 | H153: 23.00 | I153: 37257 | J153: 7
A154: =ROW()-4 -> 150 | B154: TN | C154: 1164 | D154: 6 | E154: 01164-8 | F154: 数字电子技术基础解题指南 | G154: 唐竞新 | H154: 22.00 | I154: 37500 | J154: 9
A155: =ROW()-4 -> 151 | B155: TN | C155: 2776 | D155: 4 | E155: 02776-5 | F155: 模拟电子技术基础解题指南 | G155: 唐竞新 | H155: 22.50 | I155: 37530 | J155: 9
A156: =ROW()-4 -> 152 | B156: TN | C156: 3158 | D156: 2 | E156: 03158-4 | F156: 模拟电路的计算机分析与设计――Pspice程序 | G156: 高文焕等 | H156: 25.00 | I156: 37408 | J156: 8
A157: =ROW()-4 -> 153 | B157: TN | C157: 2924 | D157: 1 | E157: 02924-5 | F157: 数字大哥大用户手册 | G157: 陈 滇 | H157: 16.00 | I157: 1998 | J157: 15
A158: =ROW()-4 -> 154 | B158: TN | C158: 3671 | D158: 1 | E158: 03671-3 | F158: 数字数据网 | G158: 陈炽文等 | H158: 25.50 | I158: 36861 | J158: 12
A159: =ROW()-4 -> 155 | B159: TN | C159: 1002 | D159: A | E159: 01002-1 | F159: 现代通信原理 | G159: 曹志刚等 | H159: 27.00 | I159: 37530 | J159: 7
A160: =ROW()-4 -> 156 | B160: TN | C160: 3726 | D160: 1 | E160: 03726-4 | F160: 通信原理简明教程 | G160: 南利平 | H160: 21.00 | I160: 37288 | J160: 10
A161: =ROW()-4 -> 157 | B161: TN | C161: 0770 | D161: 1 | E161: 00770-5 | F161: 现代网络频谱测量技术 | G161: 吕洪国 | H161: 17.00 | I161: 36708 | J161: 15
A162: =ROW()-4 -> 158 | B162: TN | C162: 3991 | D162: 1 | E162: 03991-7 | F162: 通信流理论基础与多媒体通信网 | G162: 岳五一等译 | H162: 20.00 | I162: 36831 | J162: 16
A163: =ROW()-4 -> 159 | B163: TN | C163: 1248 | D163: 1 | E163: 01248-2 | F163: 天线原理 | G163: 王朴中等 | H163: 7.20 | I163: 1993 | J163: 12
A164: =ROW()-4 -> 160 | B164: TN | C164: 1335 | D164: 1 | E164: 01335-7 | F164: 模拟系统的故障诊断与可靠性设计 | G164: 杨士元 | H164: 10.60 | I164: 1994 | J164: 10
A165: =ROW()-4 -> 161 | B165: TN | C165: 0882 | D165: 3 | E165: 00882-5 | F165: 程控数字交换机硬件软件及应用 | G165: 乐正友等 | H165: 13.50 | I165: 1995 | J165: 10
A166: =ROW()-4 -> 162 | B166: O- | C166: 2017 | D166: 2 | E166: 02017-5 | F166: 时间序列分析――高阶统计量方法 | G166: 张贤达 | H166: 29.80 | I166: 36526 | J166: 7
A167: =ROW()-4 -> 163 | B167: TM | C167: 1968 | D167: 5 | E167: 01968-1 | F167: 电路原理(上) | G167: 江缉光 | H167: 17.50 | I167: 37438 | J167: 11
A168: =ROW()-4 -> 164 | B168: TM | C168: 2297 | D168: 4 | E168: 02297-6 | F168: 电路原理(下) | G168: 江缉光 | H168: 12.80 | I168: 37257 | J168: 17
A169: =ROW()-4 -> 165 | B169: TM | C169: 3420 | D169: 2 | E169: 03420-6 | F169: 电工技术与电子技术（上）(第二版) | G169: 王鸿明 | H169: 20.00 | I169: 37073 | J169: 12
A170: =ROW()-4 -> 166 | B170: TM | C170: 3996 | D170: 1 | E170: 03996-8 | F170: 电工技术与电子技术（下）(第二版) | G170: 王鸿明 | H170: 20.00 | I170: 36770 | J170: 11
A171: =ROW()-4 -> 167 | B171: TM | C171: 1787 | D171: 4 | E171: 01787-5 | F171: 现代电力电子技术基础 | G171: 赵良炳 | H171: 13.00 | I171: 37104 | J171: 15
A172: =ROW()-4 -> 168 | B172: TM | C172: 1591 | D172: 2 | E172: 01591-0 | F172: 电磁场基础 | G172: 马信山等 | H172: 22.00 | I172: 36647 | J172: 9
A173: =ROW()-4 -> 169 | B173: TM | C173: 2476 | D173: 1 | E173: 02476-6 | F173: 电磁测量 | G173: 唐统一等 | H173: 13.50 | I173: 36982 | J173: 13
A174: =ROW()-4 -> 170 | B174: TM | C174: 1439 | D174: 9 | E174: 01439-6 | F174: 电机与拖动基础（第2版） | G174: 李发海等 | H174: 26.00 | I174: 37500 | J174: 8
A175: =ROW()-4 -> 171 | B175: TM | C175: 4096 | D175: 1 | E175: 04096-6 | F175: 高电压试验工程 | G175: 肖如泉等 | H175: 18.00 | I175: 37104 | J175: 18
A176: =ROW()-4 -> 172 | B176: TN | C176: 0913 | D176: 3 | E176: 00913-9 | F176: 高电压绝缘 | G176: 朱德恒等 | H176: 16.80 | I176: 1996 | J176: 11
A177: =ROW()-4 -> 173 | B177: TM | C177: 4077 | D177: 1 | E177: 04077-X | F177: 高压断路器原理和应用 | G177: 徐国政等 | H177: 34.00 | I177: 36831 | J177: 7
A178: =ROW()-4 -> 174 | B178: TM | C178: 3039 | D178: 1 | E178: 03039-1 | F178: 金属氧化物非线性电阻特性和应用(精) | G178: 吴维韩等 | H178: 15.00 | I178: 1999 | J178: 14
A179: =ROW()-4 -> 175 | B179: TN | C179: 5031 | D179: 1 | E179: 05031-7 | F179: 电路原理试题选编 | G179: 王树民等 | H179: 15.00 | I179: 37469 | J179: 20
A180: =ROW()-4 -> 176 | B180: TM | C180: 1972 | D180: 4 | E180: 01972-X | F180: 电路典型题解（第2版）――硕士研究生入学考试 | G180: 向国菊等 | H180: 25.00 | I180: 37469 | J180: 7
A181: =ROW()-4 -> 177 | B181: O- | C181: 3186 | D181: 1 | E181: 03186-X | F181: 应变电测与传感器 | G181: 张如一等 | H181: 14.60 | I181: 1999 | J181: 14
A182: =ROW()-4 -> 178 | B182: TN | C182: 2531 | D182: 1 | E182: 02531-2 | F182: 电路与设备测试检修技术及仪器 | G182: 朱锡仁等 | H182: 36.00 | I182: 1997 | J182: 4
A183: =ROW()-4 -> 179 | B183: TM | C183: 1251 | D183: 1 | E183: 01251-2 | F183: 交流电机及其系统的分析（精） | G183: 高景德等 | H183: 22.00 | I183: 1992 | J183: 6
A184: =ROW()-4 -> 180 | B184: TM | C184: 2774 | D184: 2 | E184: 02774-9 | F184: 电工技术与电子技术基础 | G184: 符磊 等 | H184: 28.00 | I184: 37165 | J184: 7
A185: =ROW()-4 -> 181 | B185: TP | C185: 1082 | D185: 6 | E185: 781082032X | F185: 现代电力电子器件及其应用 | G185: 华伟等 | H185: 19.00 | I185: 37316 | J185: 10
F186: 高等职业教育机电类系列教材
A187: =ROW()-4 -> 183 | B187: TH | C187: 4494 | D187: 1 | E187: 04494-5 | F187: 机械设计基础 | G187: 郭仁生 | H187: 27.00 | I187: 37341 | J187: 9
A188: =ROW()-4 -> 184 | B188: TH | C188: 5492 | D188: 1 | E188: 05492-4 | F188: 机械设计基础 学习与训练指导 | G188: 吕慧英 | H188: 20.00 | I188: 37500 | J188: 14
A189: =ROW()-4 -> 185 | B189: TH | C189: 4539 | D189: 1 | E189: 04539-9 | F189: 数控机床及应用 | G189: 李 佳 | H189: 24.00 | I189: 37073 | J189: 10
A190: =ROW()-4 -> 186 | B190: TM | C190: 4927 | D190: 1 | E190: 04927-0 | F190: 电工技术 | G190: 付植桐 | H190: 24.00 | I190: 37165 | J190: 11
A191: =ROW()-4 -> 187 | B191: TB | C191: 4602 | D191: 1 | E191: 04602-6 | F191: 中央空调系统运行管理 | G191: 付小平等 | H191: 18.00 | I191: 37104 | J191: 15
A192: =ROW()-4 -> 188 | B192: TK | C192: 5608 | D192: 1 | E192: 05608-0 | F192: 流体力学与热工基础 | G192: 陈礼 | H192: 19.80 | I192: 37469 | J192: 14
A193: =ROW()-4 -> 189 | B193: TG | C193: 5060 | D193: 1 | E193: 05060-0 | F193: 冷冲模具设计 | G193: 李双义 | H193: 21.00 | I193: 37288 | J193: 12
F194: 清华大学电子与信息技术系列教材
A195: =ROW()-4 -> 191 | B195: TN | C195: 3343 | D195: 2 | E195: 03343-9 | F195: 图象工程(上) 图象处理和分析* | G195: 章毓晋 | H195: 20.00 | I195: 37408 | J195: 10
A196: =ROW()-4 -> 192 | B196: TN | C196: 3980 | D196: 1 | E196: 03980-1 | F196: 图象工程(下) 图象理解与计算机视觉* | G196: 章毓晋 | H196: 20.00 | I196: 36800 | J196: 11
F197: *本书获2002年教育部全国普通高等学校优秀教材一等奖。
A198: =ROW()-4 -> 194 | B198: TN | C198: 4935 | D198: 1 | E198: 04935-1 | F198: 图象工程（附册）教学参考及习题解答 | G198: 章毓晋 | H198: 19.00 | I198: 37196 | J198: 14
A199: =ROW()-4 -> 195 | B199: TN | C199: 3963 | D199: 1 | E199: 03963-1 | F199: 微机图象处理系统 | G199: 苏光大 | H199: 19.50 | I199: 36708 | J199: 11
A200: =ROW()-4 -> 196 | B200: TN | C200: 4251 | D200: 1 | E200: 04251-9 | F200: 电磁场理论基础 | G200: 王 蔷等 | H200: 24.00 | I200: 37135 | J200: 10
A201: =ROW()-4 -> 197 | B201: TN | C201: 4154 | D201: 1 | E201: 04154-7 | F201: 应用信息论基础 | G201: 朱雪龙 | H201: 26.00 | I201: 37377 | J201: 8
A202: =ROW()-4 -> 198 | B202: TN | C202: 3837 | D202: 1 | E202: 03837-6 | F202: 数字集成系统的结构化设计与高层次综合 | G202: 王志华等 | H202: 29.50 | I202: 36982 | J202: 7
A203: =ROW()-4 -> 199 | B203: TN | C203: 4679 | D203: 1 | E203: 04679-4 | F203: 离散时间信号分析和处理 | G203: 应启珩等 | H203: 34.00 | I203: 37135 | J203: 8
A204: =ROW()-4 -> 200 | B204: TN | C204: 3275 | D204: 1 | E204: 03275-0 | F204: 超大规模集成电路设计方法学导论(第2版)* | G204: 杨之廉等 | H204: 25.00 | I204: 37469 | J204: 8
F205: *本书获2002年教育部全国普通高等学校优秀教材二等奖。
A206: =ROW()-4 -> 202 | B206: TN | C206: 2086 | D206: 3 | E206: 02086-8 | F206: 电子电路的计算机辅助分析与设计方法 | G206: 汪蕙 等 | H206: 18.00 | I206: 37104 | J206: 10
A207: =ROW()-4 -> 203 | B207: TN | C207: 4085 | D207: 1 | E207: 04085-0 | F207: 半导体集成电路 | G207: 朱正涌 | H207: 29.80 | I207: 37196 | J207: 7
A208: =ROW()-4 -> 204 | B208: O- | C208: 1003 | D208: 1 | E208: 1003-X | F208: 光纤光学 | G208: 廖延彪 | H208: 20.00 | I208: 37226 | J208: 11
A209: =ROW()-4 -> 205 | B209: TN | C209: 3355 | D209: 1 | E209: 03355-2 | F209: 程控交换与综合业务通信网 | G209: 乐正友等 | H209: 29.50 | I209: 37104 | J209: 7
A210: =ROW()-4 -> 206 | B210: TN | C210: 5282 | D210: 1 | E210: 05282-4 | F210: 图像并行处理技术 | G210: 苏光大 | H210: 18.00 | I210: 37438 | J210: 14
F211: 现代电力系统丛书
A212: =ROW()-4 -> 208 | B212: TM | C212: 2522 | D212: 2 | E212: 02522-3 | F212: 电力系统最优分散协调控制 (平) | G212: 韩英铎等 | H212: 28.00 | I212: 1997 | J212: 8
A213: =ROW()-4 -> 209 | B213: TM | C213: 2139 | D213: 2 | E213: 02139-2 | F213: 高等电力网络分析 | G213: 张伯明等 | H213: 26.50 | I213: 36465 | J213: 10
A214: =ROW()-4 -> 210 | B214: TK | C214: 0206 | D214: 3 | E214: 00206-1 | F214: 电力系统故障分析 | G214: 周荣光 | H214: 9.60 | I214: 1998 | J214: 20
A215: =ROW()-4 -> 211 | B215: TM | C215: 5142 | D215: 1 | E215: 05142-9 | F215: 动态电力系统的理论和分析 | G215: 陈寿孙 | H215: 38.00 | I215: 37377 | J215: 7
F216: 国家电工电子教学基地系列教材
A217: =ROW()-4 -> 213 | B217: TN | C217: 1082 | D217: 1 | E217: 7810820311 | F217: 现代电路分析 | G217: 周荣光 | H217: 25.00 | I217: 37347 | J217: 9
A218: =ROW()-4 -> 214 | B218: TN | C218: 1082 | D218: 2 | E218: 781082080X | F218: 基础电路分析 | G218: 闻跃等 | H218: 29.00 | I218: 37500 | J218: 8
F219: 半导体器件手册
A220: =ROW()-4 -> 216 | B220: TN | C220: 2539 | D220: 1 | E220: 02539-8 | F220: 电力与工业用半导体器件手册 | G220: 庞振泰等译 | H220: 48.00 | I220: 1997 | J220: 5
A221: =ROW()-4 -> 217 | B221: TN | C221: 2306 | D221: 1 | E221: 02306-9 | F221: 视频信号处理IC手册 | G221: 庞振泰等译 | H221: 49.00 | I221: 1997 | J221: 3
A222: =ROW()-4 -> 218 | B222: TN | C222: 2423 | D222: 1 | E222: 02423-5 | F222: 微机外设LSI手册 | G222: 庞振泰等译 | H222: 42.00 | I222: 1997 | J222: .6
A223: =ROW()-4 -> 219 | B223: TP | C223: 2451 | D223: 1 | E223: 02451-0 | F223: CMOS器件手册 | G223: 庞振泰等译 | H223: 45.00 | I223: 1997 | J223: 5
A224: =ROW()-4 -> 220 | B224: TN | C224: 2538 | D224: 1 | E224: 02538-X | F224: A-D/D-A转换器手册 | G224: 庞振泰等译 | H224: 29.80 | I224: 1997 | J224: 8
A225: =ROW()-4 -> 221 | B225: TN | C225: 2663 | D225: 1 | E225: 02663-7 | F225: 光电显示器件手册 | G225: 庞振泰等译 | H225: 25.00 | I225: 1997 | J225: 10
A226: =ROW()-4 -> 222 | B226: TN | C226: 2664 | D226: 1 | E226: 02664-5 | F226: 光电接口器件手册 | G226: 庞振泰等译 | H226: 32.00 | I226: 1997 | J226: 8
A227: =ROW()-4 -> 223 | B227: TN | C227: 2707 | D227: 1 | E227: 02707-2 | F227: 线性IC手册(放大用IC） | G227: 庞振泰等译 | H227: 29.00 | I227: 1997 | J227: 10
A228: =ROW()-4 -> 224 | B228: TN | C228: 2705 | D228: 1 | E228: 02705-6 | F228: 线性IC手册(模拟IC部分） | G228: 庞振泰等译 | H228: 35.00 | I228: 1997 | J228: 8
E229: （二）机械 精密仪器 汽车 热能
F230: 1、机械 精密仪器 汽车
A231: =ROW()-4 -> 227 | B231: TH | C231: 3592 | D231: 1 | E231: 03592-X | F231: 机械原理教程 | G231: 申永胜 | H231: 29.00 | I231: 37438 | J231: 7
A232: =ROW()-4 -> 228 | B232: TH | C232: 3716 | D232: 1 | E232: 03716-7 | F232: 机械原理辅导与习题* | G232: 申永胜 | H232: 16.00 | I232: 37408 | J232: 12
F233: *本书获2002年教育部全国普通高等学校优秀教材一等奖。
A234: =ROW()-4 -> 230 | B234: TH | C234: 4492 | D234: 1 | E234: 04492-9 | F234: 机械制图（非机械类）第四版 | G234: 邹宜侯等 | H234: 27.00 | I234: 37438 | J234: 8
A235: =ROW()-4 -> 231 | B235: TH | C235: 4491 | D235: 1 | E235: 04491-0 | F235: 机械制图（非机械类）第四版习题集 | G235: 邹宜侯等 | H235: 15.00 | I235: 37469 | J235: 25
A236: =ROW()-4 -> 232 | B236: TH | C236: 1221 | D236: C | E236: 01221-0 | F236: 机械制图（非机械制造类）增补版 | G236: 邹宜侯等 | H236: 23.50 | I236: 36708 | J236: 8
A237: =ROW()-4 -> 233 | B237: TH | C237: 1220 | D237: C | E237: 01220-2 | F237: 机械制图习题集（非机械制造类)增补版 | G237: 邹宜侯等 | H237: 11.50 | I237: 36739 | J237: 30
A238: =ROW()-4 -> 234 | B238: GP | C238: 4313 | D238: 1 | E238: 7900643133 | F238: 机械制图习题集（非机械制造类)电子教案 第二版 CD-ROM | G238: 杨惠英等 | H238: 1500.00 | I238: 37500 | J238: 5
A239: =ROW()-4 -> 235 | B239: TH | C239: 3458 | D239: 1 | E239: 03458-3 | F239: 机械制造工艺基础习题集（金属工艺学冷加工部分） | G239: 张学政 | H239: 8.00 | I239: 37196 | J239: 24
A240: =ROW()-4 -> 236 | B240: TH | C240: 0313 | D240: 7 | E240: 00313-0 | F240: 机械制造工艺学（上） | G240: 王先逵 | H240: 28.00 | I240: 36861 | J240: 7
A241: =ROW()-4 -> 237 | B241: TH | C241: 0314 | D241: 7 | E241: 00314-9 | F241: 机械制造工艺学（下） | G241: 王先逵 | H241: 15.00 | I241: 36373 | J241: 10
A242: =ROW()-4 -> 238 | B242: TH | C242: 3348 | D242: 1 | E242: 03348-X | F242: MDT 三维参数化特征造型机械CAD | G242: 樊炳辉等 | H242: 18 | I242: 1999 | J242: 14
A243: =ROW()-4 -> 239 | B243: TH | C243: 2903 | D243: 1 | E243: 02903-2 | F243: 机械CAD 原理与实践 | G243: 肖 刚等 | H243: 20 | I243: 37408 | J243: 10
A244: =ROW()-4 -> 240 | B244: TH | C244: 2101 | D244: 6 | E244: 02101-5 | F244: 机械CAD技术基础 | G244: 童秉枢等 | H244: 17.00 | I244: 37469 | J244: 11
A245: =ROW()-4 -> 241 | B245: TH | C245: 2834 | D245: 2 | E245: 02834-6 | F245: 机械系统的微机控制 | G245: 陈 强等 | H245: 16 | I245: 36373 | J245: 12
A246: =ROW()-4 -> 242 | B246: TH | C246: 4224 | D246: 1 | E246: 04224-1 | F246: 机械系统计算机控制（配光盘） | G246: 钟约先等 | H246: 39.8 | I246: 37104 | J246: 6
A247: =ROW()-4 -> 243 | B247: TP | C247: 1762 | D247: 2 | E247: 01762-X | F247: 系统设计与仿真 | G247: 顾启泰 | H247: 17.50 | I247: 1998 | J247: 9
A248: =ROW()-4 -> 244 | B248: TM | C248: 4940 | D248: 1 | E248: 04940-1 | F248: 过电压防护及绝缘配合 | G248: 何金良等 | H248: 30.00 | I248: 37408 | J248: 9
A249: =ROW()-4 -> 245 | B249: TH | C249: 2142 | D249: 2 | E249: 02142-2 | F249: 机械可靠性设计 | G249: 刘惟信 | H249: 27.80 | I249: 37257 | J249: 6
A250: =ROW()-4 -> 246 | B250: TP | C250: 3902 | D250: 2 | E250: 03902-X | F250: 现代CAD技术 | G250: 童秉枢等 | H250: 19.00 | I250: 36861 | J250: 12
A251: =ROW()-4 -> 247 | B251: TH | C251: 1471 | D251: 3 | E251: 01471-X | F251: 机械最优化设计（第2版）―― 计算机辅助设计丛书 | G251: 刘惟信 | H251: 23.60 | I251: 37438 | J251: 7
A252: =ROW()-4 -> 248 | B252: TH | C252: 2788 | D252: 1 | E252: 02788-9 | F252: 纳米摩擦学(精) | G252: 温诗铸 | H252: 26.00 | I252: 37043 | J252: 12
A253: =ROW()-4 -> 249 | B253: TB | C253: 1660 | D253: 3 | E253: 01660-7 | F253: 工业产品艺术造型设计 | G253: 王介民等 | H253: 12.60 | I253: 37469 | J253: 15
A254: =ROW()-4 -> 250 | B254: TH | C254: 0792 | D254: 7 | E254: 00792-6 | F254: 测试技术与测试信号处理 | G254: 吴正毅 | H254: 14.00 | I254: 36586 | J254: 12
A255: =ROW()-4 -> 251 | B255: TH | C255: 0564 | D255: 1 | E255: 00564-8 | F255: Dubbel机械工程手册 第1卷 基础卷 | G255: 张维等译 | H255: 67.00 | I255: 1991 | J255: 2
A256: =ROW()-4 -> 252 | B256: TH | C256: 1946 | D256: 1 | E256: 01946-0 | F256: Dubbel机械工程手册（第2,3合卷） | G256: 张维等译 | H256: 160.00 | I256: 1996 | J256: 2
A257: =ROW()-4 -> 253 | B257: TH | C257: 4529 | D257: 1 | E257: 04529-1 | F257: 汽车设计 | G257: 刘惟信 | H257: 58.00 | I257: 37073 | J257: 4
A258: =ROW()-4 -> 254 | B258: TH | C258: 4677 | D258: 1 | E258: 04677-8 | F258: 汽车发动机原理教程 | G258: 刘峥 等 | H258: 23.00 | I258: 37135 | J258: 10
A259: =ROW()-4 -> 255 | B259: TH | C259: 1921 | D259: 1 | E259: 01921-5 | F259: 现代汽车维修 第1册 发动机 | G259: 孟嗣宗等 | H259: 10.80 | I259: 1996 | J259: 22
A260: =ROW()-4 -> 256 | B260: TH | C260: 2055 | D260: 1 | E260: 02055-8 | F260: 现代汽车维修 第2册 底盘 | G260: 孟嗣宗等 | H260: 10.50 | I260: 1996 | J260: 22
A261: =ROW()-4 -> 257 | B261: TH | C261: 2449 | D261: 1 | E261: 02449-9 | F261: 现代汽车维修 第3册 电气与电控 | G261: 孟嗣宗等 | H261: 8.50 | I261: 1997 | J261: 25
A262: =ROW()-4 -> 258 | B262: TH | C262: 2491 | D262: 1 | E262: 02491-X | F262: 现代汽车维修 第4册 故障诊断与保养维修规范 | G262: 孟嗣宗等 | H262: 15.00 | I262: 1997 | J262: 14
A263: =ROW()-4 -> 259 | B263: TH | C263: 4507 | D263: 1 | E263: 04507-0 | F263: 声强技术及其在汽车工程中的应用（精） | G263: 蒋孝煜等 | H263: 26.00 | I263: 37073 | J263: 12
A264: =ROW()-4 -> 260 | B264: TH | C264: 4187 | D264: 1 | E264: 04187-3 | F264: 汽车碰撞与安全 | G264: 黄世霖等 | H264: 15.00 | I264: 36861 | J264: 30
A265: =ROW()-4 -> 261 | B265: TH | C265: 1007 | D265: 1 | E265: 01007-2 | F265: 弹性流体动力润滑 | G265: 温诗铸等 | H265: 13.90 | I265: 1992 | J265: 8
A266: =ROW()-4 -> 262 | B266: TH | C266: 2401 | D266: 1 | E266: 02401-4 | F266: 光学显微分析 | G266: 孙业英 | H266: 15.00 | I266: 1997 | J266: 10
A267: =ROW()-4 -> 263 | B267: TB | C267: 3589 | D267: 1 | E267: 03589-X | F267: 透射电子显微学新进展 (1)理论和方法 (英文版) | G267: 章效锋等 | H267: 58.00 | I267: 37104 | J267: 5
A268: =ROW()-4 -> 264 | B268: TB | C268: 3589 | D268: 2 | E268: 03589-X | F268: 透射电子显微学新进展 (2)在材料科学中的应用 (英文版) | G268: 章效锋等 | H268: 58.00 | I268: 37104 | J268: 6
A269: =ROW()-4 -> 265 | B269: TB | C269: 1966 | D269: 1 | E269: 01966-5 | F269: 振动病及其防治 | G269: 郦 明 | H269: 11.00 | I269: 1996 | J269: 30
A270: =ROW()-4 -> 266 | B270: TB | C270: 1993 | D270: 1 | E270: 01993-2 | F270: 现代防雷技术基础 | G270: 虞 昊等 | H270: 16.50 | I270: 1995 | J270: 12
A271: =ROW()-4 -> 267 | B271: V- | C271: 4021 | D271: 1 | E271: 04021-4 | F271: 中国航空史（精） | G271: 姜长英 | H271: 90.00 | I271: 36831 | J271: 5
A272: =ROW()-4 -> 268 | B272: P- | C272: 4312 | D272: 1 | E272: 7900643125 | F272: 机械制图（非机类）（配光盘） | G272: 杨惠英等 | H272: 36.00 | I272: 37469 | J272: 10
A273: =ROW()-4 -> 269 | B273: TH | C273: 5736 | D273: 1 | E273: 05736-2 | F273: 机械制图习题集（非机类） | G273: 杨惠英等 | H273: 15.00 | I273: 37469 | J273: 16
A274: =ROW()-4 -> 270 | B274: TB | C274: 5356 | D274: 1 | E274: 05356-1 | F274: 测量不确定度――实验数据的处理与表示 | G274: 钱绍圣 | H274: 9.50 | I274: 37500 | J274: 33
A275: =ROW()-4 -> 271 | B275: TK | C275: 5706 | D275: 1 | E275: 05706-0 | F275: 汽车发动机燃料供给与调节 | G275: 陆际清等 | H275: 17.00 | I275: 37530 | J275: 13
A276: =ROW()-4 -> 272 | B276: TK | C276: 5385 | D276: 1 | E276: 05385-5 | F276: 清华学术专著：大型火电机组系统仿真与建模(精) | G276: 吕崇德 | H276: 63.00 | I276: 37530 | J276: 5
F277: 零件设计系列丛书
A278: =ROW()-4 -> 274 | B278: P- | C278: 3549 | D278: 1 | E278: 7900635491 | F278: Pro/ENGINEER 2000i 零件设计基础篇（上）（配光盘） | G278: 林清安 | H278: 50.00 | I278: 37377 | J278: 7
A279: =ROW()-4 -> 275 | B279: P- | C279: 3550 | D279: 1 | E279: 7900635505 | F279: Pro/ENGINEER 2001i 零件设计基础篇（下）（配光盘） | G279: 林清安 | H279: 57.00 | I279: 37257 | J279: 6
A280: =ROW()-4 -> 276 | B280: P- | C280: 3783 | D280: 1 | E280: 7900637834 | F280: Pro/ENGINEER 2001i 零件装配与产品设计（配光盘） | G280: 林清安 | H280: 59.00 | I280: 37500 | J280: 6
F281: 北京市精品教材
A282: =ROW()-4 -> 278 | B282: O- | C282: 5421 | D282: 1 | E282: 05421-5 | F282: 仪器分析（第2版） | G282: 刘密新等 | H282: 30 | I282: 37500 | J282: 9
F283: 2、热能
A284: =ROW()-4 -> 280 | B284: TK | C284: 1721 | D284: 4 | E284: 01721-2 | F284: 工程热力学 | G284: 朱明善等 | H284: 17.60 | I284: 37327 | J284: 12
A285: =ROW()-4 -> 281 | B285: O- | C285: 1137 | D285: 1 | E285: 01137-0 | F285: 工程热力学题型分析（第2版） | G285: 朱明善等 | H285: 17.50 | I285: 37530 | J285: 14
A286: =ROW()-4 -> 282 | B286: TB | C286: 4074 | D286: 1 | E286: 04074-5 | F286: 热工过程自动控制 | G286: 杨献勇 | H286: 24.00 | I286: 37500 | J286: 10
A287: =ROW()-4 -> 283 | B287: TK | C287: 3654 | D287: 1 | E287: 03654-3 | F287: 热质交换过程与设备 | G287: 许为全 | H287: 6.60 | I287: 36404 | J287: 34
A288: =ROW()-4 -> 284 | B288: TK | C288: 2906 | D288: 1 | E288: 02906-7 | F288: 流体激振(精) | G288: 陈佐一 | H288: 29.00 | I288: 1998 | J288: 9
A289: =ROW()-4 -> 285 | B289: TU | C289: 0805 | D289: B | E289: 00805-1 | F289: 空气调节 | G289: 薛殿华等 | H289: 21.50 | I289: 36617 | J289: 8
A290: =ROW()-4 -> 286 | B290: TK | C290: 1799 | D290: 1 | E290: 01799-9 | F290: 燃料与燃烧概论 | G290: 胡震岗等 | H290: 8.60 | I290: 1995 | J290: 18
A291: =ROW()-4 -> 287 | B291: TK | C291: 1466 | D291: 0 | E291: 01466-3 | F291: 烧煤的燃气―蒸汽联合循环装置 | G291: 焦树建 | H291: 18.00 | I291: 1995 | J291: 11
A292: =ROW()-4 -> 288 | B292: TU | C292: 2136 | D292: 1 | E292: 02136-8 | F292: 民用供暖散热器 | G292: 萧日嵘等 | H292: 18.00 | I292: 1996 | J292: 10
A293: =ROW()-4 -> 289 | B293: TB | C293: 4718 | D293: 1 | E293: 04718-9 | F293: 热工参数测量与处理（第二版） | G293: 吕崇德 | H293: 24.00 | I293: 37135 | J293: 10
E294: （三）土木 建筑 水利 环境
F295: 1. 土木
A296: =ROW()-4 -> 292 | B296: TU | C296: 1296 | D296: 3 | E296: 01296- | F296: 建筑工程专业概论 | G296: 罗福午 | H296: 9.50 | I296: 36647 | J296: 23
A297: =ROW()-4 -> 293 | B297: P- | C297: 3771 | D297: 1 | E297: 7900637710 | F297: 混凝土结构（上册）（配光盘/按新规范编写） | G297: 叶列平 | H297: 33.00 | I297: 37316 | J297: 9
A298: =ROW()-4 -> 294 | B298: TU | C298: 3254 | D298: 1 | E298: 03254-8 | F298: 钢筋混凝土原理 | G298: 过镇海 | H298: 25.00 | I298: 37196 | J298: 7
A299: =ROW()-4 -> 295 | B299: TU | C299: 0160 | D299: 6 | E299: 00160-X | F299: 钢筋混凝土基本构件（第2版） | G299: 藤智明等 | H299: 25.00 | I299: 37226 | J299: 7
A300: =ROW()-4 -> 296 | B300: TU | C300: 1467 | D300: 4 | E300: 01467-1 | F300: 混凝土结构及砌体结构学习指导 | G300: 藤智明 | H300: 18.00 | I300: 36708 | J300: 10
A301: =ROW()-4 -> 297 | B301: TU | C301: 2609 | D301: 1 | E301: 02609-2 | F301: 混凝土的强度和变形――试验基础和本构关系 | G301: 过镇海 | H301: 24.00 | I301: 1997 | J301: 7
A302: =ROW()-4 -> 298 | B302: TU | C302: 1250 | D302: 5 | E302: 01250-4 | F302: 钢结构――原理与设计 | G302: 王国周等 | H302: 28.00 | I302: 36586 | J302: 6
A303: =ROW()-4 -> 299 | B303: TU | C303: 4275 | D303: 1 | E303: 04275-6 | F303: 金属建筑系统设计与规范（手册 精） | G303: 余州亮译 | H303: 98.00 | I303: 37104 | J303: 6
A304: =ROW()-4 -> 300 | B304: TU | C304: 1380 | D304: 3 | E304: 01380-2 | F304: 土力学 | G304: 陈仲颐等 | H304: 20.00 | I304: 37165 | J304: 8
A305: =ROW()-4 -> 301 | B305: TU | C305: 2279 | D305: 1 | E305: 02279-8 | F305: 基础工程 | G305: 周景星等 | H305: 22.00 | I305: 37469 | J305: 9
A306: =ROW()-4 -> 302 | B306: TU | C306: 2674 | D306: 4 | E306: 02674-2 | F306: 土力学地基基础（第3版） | G306: 陈希哲 | H306: 32.00 | I306: 37377 | J306: 6
A307: =ROW()-4 -> 303 | B307: TU | C307: 1366 | D307: 2 | E307: 01366-7 | F307: 地基事故与预防 | G307: 陈希哲 | H307: 14.00 | I307: 1996 | J307: 14
A308: =ROW()-4 -> 304 | B308: TU | C308: 1639 | D308: 3 | E308: 01639-9 | F308: 建筑施工―― 建筑施工技术 | G308: 朱燕等 | H308: 15.00 | I308: 1998 | J308: 11
A309: =ROW()-4 -> 305 | B309: TU | C309: 0635 | D309: 5 | E309: 00635-0 | F309: 单层工业厂房结构设计（第2版） | G309: 罗福午 | H309: 22.00 | I309: 37012 | J309: 3978
A310: =ROW()-4 -> 306 | B310: TU | C310: 0666 | D310: D | E310: 00666-0 | F310: 高层建筑结构设计（第2版） | G310: 包世华等 | H310: 26.00 | I310: 37226 | J310: 7
A311: =ROW()-4 -> 307 | B311: TU | C311: 0891 | D311: 6 | E311: 00891-4 | F311: 建筑结构概念体系与估算 | G311: 罗福午 | H311: 20.00 | I311: 37226 | J311: 11
A312: =ROW()-4 -> 308 | B312: TU | C312: 4231 | D312: 1 | E312: 04231-4 | F312: 城市交通与道路系统规划设计 | G312: 文国玮 | H312: 29.00 | I312: 37438 | J312: 10
A313: =ROW()-4 -> 309 | B313: TU | C313: 0210 | D313: 7 | E313: 00210-X | F313: 建筑结构实验 | G313: 王娴明 | H313: 12.00 | I313: 37073 | J313: 16
A314: =ROW()-4 -> 310 | B314: TU | C314: 4717 | D314: 1 | E314: 04717-0 | F314: 现代普通测量学 | G314: 王侬 等 | H314: 24.50 | I314: 37165 | J314: 9
A315: =ROW()-4 -> 311 | B315: TM | C315: 4532 | D315: 1 | E315: 04532-1 | F315: 民用建筑电气技术与设计（第二版） | G315: 胡乃定等 | H315: 38.00 | I315: 37073 | J315: 6
A316: =ROW()-4 -> 312 | B316: TU | C316: 2800 | D316: 1 | E316: 02800-1 | F316: 大比例尺数字测图的原理方法与应用 | G316: 杨德麟等 | H316: 15 | I316: 37104 | J316: 12
A317: =ROW()-4 -> 313 | B317: TU | C317: 2837 | D317: 1 | E317: 02837-0 | F317: 交通规划理论与方法 | G317: 陆化普 | H317: 16.50 | I317: 1998 | J317: 14
A318: =ROW()-4 -> 314 | B318: TU | C318: 2021 | D318: 2 | E318: 02021-3 | F318: 结构力学解疑 | G318: 雷钟和等 | H318: 16.50 | I318: 37226 | J318: 11
A319: =ROW()-4 -> 315 | B319: TU | C319: 5642 | D319: 1 | E319: 05642-0 | F319: 第二届全国土木工程用纤维增强复合材料（FRP）应用技术学术交流会论文集 | G319: 岳清瑞等 | H319: 180.00 | I319: 37438 | J319: 6
F320: 2.建筑
A321: =ROW()-4 -> 317 | B321: TU | C321: 5981 | D321: 1 | E321: 05981-0 | F321: 中国建筑设计研究院室内设计作品选2002 | G321: 孟建国 | H321: 120.00 | I321: 2002.10 | J321: 24
A322: =ROW()-4 -> 318 | B322: TU | C322: 5653 | D322: 1 | E322: 05653-6 | F322: 中国建筑设计研究院作品选2002 | G322: 崔 恺 | H322: 120.00 | I322: 37438 | J322: 38
A323: =ROW()-4 -> 319 | B323: TU | C323: 5605 | D323: 1 | E323: 05605-6 | F323: 中国民用机场集锦 | G323: 蒋作舟 | H323: 300.00 | I323: 37439 | J323: 4
A324: =ROW()-4 -> 320 | B324: TU | F324: 京津冀地区城乡空间发展规划研究 | G324: 吴良镛 等 | H324: 260.00 | I324: 37561
A325: =ROW()-4 -> 321 | B325: TU | C325: 5629 | D325: 1 | E325: 05629-3 | F325: 国际建协《北京宪章》――建筑学的未来 | G325: 吴良镛 | H325: 48.00 | I325: 37500 | J325: 25
A326: =ROW()-4 -> 322 | B326: TU | C326: 5377 | D326: 1 | E326: 05377-4 | F326: 关肇邺选集 | G326: 关肇邺 | H326: 198.00 | I326: 37347 | J326: 10
A327: =ROW()-4 -> 323 | B327: TU | C327: 4873 | D327: 1 | E327: 04873-8 | F327: 德国当代博物馆建筑（精） | G327: 王 路 | H327: 228.00 | I327: 37196 | J327: 10
A328: =ROW()-4 -> 324 | B328: TU | C328: 1980 | D328: 2 | E328: 01980-0 | F328: 建筑热环境 | G328: 叶 歆 | H328: 10.00 | I328: 1998 | J328: 17
A329: =ROW()-4 -> 325 | B329: TU | C329: 3520 | D329: 1 | E329: 03520-2 | F329: 建筑声环境 (第2 版) | G329: 秦佑国等 | H329: 13.00 | I329: 36373 | J329: 16
A330: =ROW()-4 -> 326 | B330: TU | C330: 3391 | D330: 2 | E330: 03391-9 | F330: 环境行为学概论 | G330: 李道增 | H330: 16.00 | I330: 36586 | J330: 15
A331: =ROW()-4 -> 327 | B331: TU | C331: 3919 | D331: 1 | E331: 03919-4 | F331: 智能建筑的系统集成及其工程实施（上） | G331: 张瑞武 | H331: 39.00 | I331: 36739 | J331: 7
A332: =ROW()-4 -> 328 | B332: TU | C332: 0002 | D332: 2 | E332: 00002- | F332: 中国古代建筑（英文)(精） | G332: 清华建筑系 | H332: 30.00 | I332: 1990 | J332: 5
A333: =ROW()-4 -> 329 | B333: TU | C333: 3385 | D333: 1 | E333: 03385-4 | F333: 中国古典园林史 (第2版) | G333: 周维权 | H333: 54.00 | I333: 37500 | J333: 4
A334: =ROW()-4 -> 330 | B334: TU | C334: 3691 | D334: 1 | E334: 03691-8 | F334: 中国园林建筑（第2版）（精） | G334: 冯钟平 | H334: 86.00 | I334: 36617 | J334: 5
A335: =ROW()-4 -> 331 | B335: TU | C335: 2264 | D335: 1 | E335: 02264-X | F335: 中国名山风景区 | G335: 周维权 | H335: 35.00 | I335: 1997 | J335: 7
A336: =ROW()-4 -> 332 | B336: TU | C336: 2868 | D336: 1 | E336: 02868-0 | F336: 中国传统民居图说――桂北篇 | G336: 单德启 | H336: 99.00 | I336: 1998 | J336: 10
A337: =ROW()-4 -> 333 | B337: TU | C337: 2867 | D337: 1 | E337: 02867-2 | F337: 中国传统民居图说――徽州篇 | G337: 单德启 | H337: 99.00 | I337: 1998 | J337: 10
A338: =ROW()-4 -> 334 | B338: TU | C338: 3627 | D338: 1 | E338: 03627-6 | F338: 中国传统民居图说――越都篇 | G338: 单德启 | H338: 99.00 | I338: 36586 | J338: 10
A339: =ROW()-4 -> 335 | B339: TU | C339: 3966 | D339: 1 | E339: 03966-6 | F339: 中国传统民居图说――五邑篇 | G339: 单德启 | H339: 85.00 | I339: 36951 | J339: 10
A340: =ROW()-4 -> 336 | B340: TU | C340: 3512 | D340: 1 | E340: 03512-1 | F340: 建筑与树木铅笔写生教程 | G340: 周宏智 | H340: 17.00 | I340: 36342 | J340: 11
A341: =ROW()-4 -> 337 | B341: TU | C341: 3652 | D341: 1 | E341: 03652-7 | F341: 中国近代建筑研究与保护（一） | G341: 张复合等 | H341: 46.00 | I341: 36526 | J341: 6
A342: =ROW()-4 -> 338 | B342: TU | C342: 4541 | D342: 1 | E342: 04541-0 | F342: 中国近代建筑研究与保护（二） | G342: 张复合 | H342: 58.00 | I342: 37073 | J342: 6
A343: =ROW()-4 -> 339 | B343: TU | C343: 5365 | D343: 1 | E343: 05365-0 | F343: 建筑史论文集 第16辑 | G343: 张复合主编 | H343: 28.00 | I343: 37377 | J343: 8
A344: =ROW()-4 -> 340 | B344: TU | C344: 2996 | D344: 1 | E344: 02996-2 | F344: 中国城市住宅小区建设试点丛书(第2辑) 建筑实录篇 | G344: 丛书编委会 | H344: 160.00 | I344: 1998 | J344: 5
A345: =ROW()-4 -> 341 | B345: TU | C345: 2918 | D345: 1 | E345: 02918-0 | F345: 中国城市住宅小区建设试点丛书(第2辑) 建筑经验篇 | G345: 丛书编委会 | H345: 36.00 | I345: 1998 | J345: 10
A346: =ROW()-4 -> 342 | B346: TU | C346: 3203 | D346: 1 | E346: 03203-3 | F346: 中国城市住宅小区建设试点丛书(第2辑) 规划设计篇 | G346: 丛书编委会 | H346: 28.00 | I346: 1999 | J346: 12
A347: =ROW()-4 -> 343 | B347: TU | C347: 3204 | D347: 1 | E347: 03204-1 | F347: 中国城市住宅小区建设试点丛书(第2辑) 建筑设计篇 | G347: 丛书编委会 | H347: 39.80 | I347: 1999 | J347: 9
F348: 土建工长（技术员）培训教材
F349: （全国“星火计划”丛书通用教材）
A350: =ROW()-4 -> 346 | B350: TU | C350: 4478 | D350: 1 | E350: 04478-3 | F350: 建筑材料 (第三版) | G350: 纪士斌 | H350: 16.00 | I350: 37469 | J350: 20
A351: =ROW()-4 -> 347 | B351: TU | C351: 4615 | D351: 1 | E351: 04615-8 | F351: 建筑力学（第三版） | G351: 张兆棣等 | H351: 16.00 | I351: 37357 | J351: 20
A352: =ROW()-4 -> 348 | B352: TU | C352: 4826 | D352: 1 | E352: 04826-6 | F352: 房屋构造（第三版） | G352: 杨金铎等 | H352: 19.00 | I352: 37165 | J352: 12
A353: =ROW()-4 -> 349 | B353: TU | C353: 4853 | D353: 1 | E353: 04853-3 | F353: 建筑装饰工程施工（第二版） | G353: 纪士斌 | H353: 18.00 | I353: 37226 | J353: 17
A354: =ROW()-4 -> 350 | B354: TU | C354: 4772 | D354: 1 | E354: 04772-3 | F354: 建筑机械基础（第三版） | G354: 纪士斌 | H354: 18.00 | I354: 37226 | J354: 16
A355: =ROW()-4 -> 351 | B355: TU | C355: 5094 | D355: 1 | E355: 05094-1 | F355: 建筑水电知识（第三版） | G355: 田会杰等 | H355: 12.00 | I355: 37377 | J355: 19
A356: =ROW()-4 -> 352 | B356: TU | C356: 5482 | D356: 1 | E356: 05482-7 | F356: 建筑工程定额与预算（第三版） | G356: 赵玉槐等 | H356: 10.80 | I356: 37469 | J356: 23
A357: =ROW()-4 -> 353 | B357: TU | C357: 5570 | D357: 1 | E357: 05570-X | F357: 建筑施工技术（第三版） | G357: 任继良等 | H357: 18.00 | I357: 37500 | J357: 19
A358: =ROW()-4 -> 354 | B358: TU | F358: 建筑施工测量（第三版） | H358: 12.00 | I358: 37591
A359: =ROW()-4 -> 355 | B359: TU | C359: 1643 | D359: D | E359: 01643-7 | F359: 建筑制图与识图（第2版） | G359: 宋莲琴等 | H359: 11.00 | I359: 37327 | J359: 18
A360: =ROW()-4 -> 356 | B360: TU | C360: 1740 | D360: 6 | E360: 01740-9 | F360: 建筑施工组织与管理（第2版） | G360: 李建华等 | H360: 8.80 | I360: 37349 | J360: 24
A361: =ROW()-4 -> 357 | B361: TU | C361: 1642 | D361: 6 | E361: 01642-9 | F361: 建筑结构（第2版） | G361: 郭继武等 | H361: 19.50 | I361: 37322 | J361: 10
A362: =ROW()-4 -> 358 | B362: TU | C362: 2477 | D362: 2 | E362: 02477-4 | F362: 结构抗震基本知识 (第2版) | G362: 张述勇 | H362: 8.00 | I362: 1998 | J362: 22
A363: =ROW()-4 -> 359 | B363: TU | C363: 1742 | D363: 5 | E363: 01742-5 | F363: 地基与基础（第2版） | G363: 郭继武等 | H363: 7.20 | I363: 37347 | J363: 25
A364: =ROW()-4 -> 360 | B364: TU | C364: 2712 | D364: 2 | E364: 02712-9 | F364: 土建工长（技术员）应试指南(第2版） | G364: 冯小川等 | H364: 12.00 | I364: 1999 | J364: 15
A365: =ROW()-4 -> 361 | B365: TU | C365: 1739 | D365: 7 | E365: 01739-4 | F365: 建筑工程定额与预算（第2版） | G365: 赵玉槐等 | H365: 9.50 | I365: 37328 | J365: 22
A366: =ROW()-4 -> 362 | B366: TU | C366: 1640 | D366: 5 | E366: 01640-2 | F366: 建筑机械基础（第2版） | G366: 纪士斌等 | H366: 9.20 | I366: 34870 | J366: 18
A367: =ROW()-4 -> 363 | B367: TU | C367: 1751 | D367: 9 | E367: 01751-4 | F367: 建筑施工技术（第2版） | G367: 任继良等 | H367: 12.80 | I367: 37377 | J367: 18
F368: 3.水利 环境
A369: =ROW()-4 -> 365 | B369: TV | C369: 0943 | D369: 2 | E369: 00943-0 | F369: 水电站建筑物（第2版） | G369: 王树人等 | H369: 14.00 | I369: 1996 | J369: 10
A370: =ROW()-4 -> 366 | B370: TV | C370: 3005 | D370: 1 | E370: 03005-7 | F370: 水资源利用工程与管理 | G370: 李广贺等 | H370: 25.00 | I370: 37500 | J370: 7
A371: =ROW()-4 -> 367 | B371: TV | C371: 3570 | D371: 1 | E371: 03570-9 | F371: 明槽及变流――理论和在水工中的应用 | G371: 余长昭 | H371: 28.00 | I371: 36495 | J371: 13
A372: =ROW()-4 -> 368 | B372: TV | C372: 4278 | D372: 1 | E372: 04278-0 | F372: 混凝土坝-地基-库水系统的数值模拟 （精） | G372: 张楚汉等 | H372: 82.00 | I372: 36982 | J372: 4
A373: =ROW()-4 -> 369 | B373: TV | C373: 3056 | D373: 1 | E373: 03056-1 | F373: 计算浅水动力学――有限体积法的应用 | G373: 谭维炎 | H373: 15.00 | I373: 1998 | J373: 14
A374: =ROW()-4 -> 370 | B374: O- | C374: 3168 | D374: 1 | E374: 03168-1 | F374: 流体力学 | G374: 张兆顺 | H374: 25.50 | I374: 37073 | J374: 8
A375: =ROW()-4 -> 371 | B375: X- | C375: 1024 | D375: 2 | E375: 01024-2 | F375: 环境流体力学导论 | G375: 余常昭 | H375: 12.00 | I375: 1998 | J375: 14
A376: =ROW()-4 -> 372 | B376: X- | C376: 4159 | D376: 1 | E376: 04159-8 | F376: 现代环境生物技术 | G376: 王建龙等 | H376: 35.00 | I376: 37135 | J376: 6
A377: =ROW()-4 -> 373 | B377: X- | C377: 4452 | D377: 1 | E377: 04452-X | F377: 酸沉降临界负荷及其应用 | G377: 郝吉明等 | H377: 58.00 | I377: 37043 | J377: 5
A378: =ROW()-4 -> 374 | B378: X- | C378: 1234 | D378: 1 | E378: 01234-2 | F378: 环境政策学 | G378: 李 康 | H378: 15.00 | I378: 36647 | J378: 22
A379: =ROW()-4 -> 375 | B379: X- | C379: 1432 | D379: 5 | E379: 01432-9 | F379: 环境学导论（第2版） | G379: 何 强等 | H379: 25.00 | I379: 37226 | J379: 8
A380: =ROW()-4 -> 376 | B380: X- | C380: 2814 | D380: 1 | E380: 02814-1 | F380: 环境与贸易―― 生态、经济、体制和政策 | G380: 黄 晶等 | H380: 11 | I380: 1998 | J380: 27
A381: =ROW()-4 -> 377 | B381: X- | C381: 0782 | D381: 1 | E381: 00782-9 | F381: 环境资本运营 ―― 生态效益与经济效益的统一 | G381: 翁 端等译 | H381: 15 | I381: 36770 | J381: 25
A382: =ROW()-4 -> 378 | B382: X- | C382: 5508 | D382: 1 | E382: 05508-4 | F382: 中国生物圈保护区可持续管理案例研究丛书―锡林郭勒生物圈保护区退化生态系统管理 | G382: 韩念勇等 | H382: 38.00 | I382: 37377 | J382: 10
A383: =ROW()-4 -> 379 | B383: X- | C383: 4298 | D383: 1 | E383: 04298-5 | F383: 以煤为主多元化的清洁能源战略 | G383: 吴宗鑫等 | H383: 25.00 | I383: 37012 | J383: 12
A384: =ROW()-4 -> 380 | B384: X- | C384: 5837 | D384: 1 | E384: 05837-7 | F384: 环境保护基础 | G384: 程发良等 | H384: 26.00 | I384: 37500 | J384: 10
A385: =ROW()-4 -> 381 | B385: TV | C385: 5357 | D385: 1 | E385: 05357-X | F385: 水利水电工程科学前沿 | G385: 张楚汉 | H385: 58.00 | I385: 37347 | J385: 6
F386: 大学环境教育丛书
A387: =ROW()-4 -> 383 | B387: X- | C387: 1013 | D387: 1 | E387: 01013-7 | F387: 环境工程化学（第4版）（英文影印版） Chemistry for Environmental Engineering | G387: Clair N.Sawyer等 | H387: 49.50 | I387: 36617 | J387: 5
A388: =ROW()-4 -> 384 | B388: X- | C388: 4130 | D388: 1 | E388: 04130-X | F388: 环境工程导论（第3版）（翻译版） | G388: 王泽龙译 | H388: 54.00 | I388: 37226 | J388: 4
A389: =ROW()-4 -> 385 | B389: X- | C389: 1014 | D389: 1 | E389: 01014-5 | F389: 环境科学 ―― 交叉关系科学（第7版）（英文影印版） Environmental Science | G389: Eldon D.Enger | H389: 48.00 | I389: 36708 | J389: 7
A390: =ROW()-4 -> 386 | B390: X- | C390: 1012 | D390: 1 | E390: 01012-9 | F390: 固体废物的全过程管理――工程原理及管理问题 （英文影印版） Intergrated Solid Waste Mangerment | G390: George T.等 | H390: 69.50 | I390: 36647 | J390: 3
A391: =ROW()-4 -> 387 | B391: X- | C391: 0814 | D391: 1 | E391: 00814-0 | F391: 大气污染控制工程（第2版）(英文影印版) Air Pollution Control Engineering | G391: Noel de Nevers | H391: 49.00 | I391: 36647 | J391: 5
A392: =ROW()-4 -> 388 | B392: X- | C392: 5135 | D392: 1 | E392: 05135-6 | F392: 污染预防理论与实践（英文影印版） （Pollution Prevention） | G392: Paul Lbishop | H392: 56.00 | I392: 37347 | J392: 6
A393: =ROW()-4 -> 389 | B393: X- | C393: 5136 | D393: 1 | E393: 05136-4 | F393: 工程与环境引论（英文影印版） （Introduction to Engineering&the Environment） | G393: Edward S.Rubin | H393: 52.00 | I393: 37316 | J393: 4
A394: =ROW()-4 -> 390 | B394: X- | C394: 5386 | D394: 1 | E394: 05386-1 | F394: 环境生物技术：原理与应用（ Environmental Biotechnology: Principles and Applications） | G394: Bruce E. Rittmann | H394: 60.00 | I394: 37389 | J394: 3
A395: =ROW()-4 -> 391 | B395: X- | C395: 5134 | D395: 1 | E395: 05134-8 | F395: 工业水污染控制（第3版） （Industrial Water Pollution Control Third Edition） | G395: W.Wesley Eckenfelder, Jr. | H395: 48.00 | I395: 37288 | J395: 5
F396: （四）生物 医学
A397: =ROW()-4 -> 393 | B397: Q- | C397: 3756 | D397: 1 | E397: 03756-6 | F397: 现代生物学导论实验指导 | G397: 吴庆余等 | H397: 5.50 | I397: 36434 | J397: 45
A398: =ROW()-4 -> 394 | B398: Q- | C398: 5378 | D398: 1 | E398: 05378-2 | F398: 计算分子生物学前沿课题 | H398: 100.00 | I398: 37363 | J398: 4
A399: =ROW()-4 -> 395 | B399: Q- | C399: 3887 | D399: 1 | E399: 03887-2 | F399: 英日汉生物工程学辞典（精） | G399: 刘进元 | H399: 32.00 | I399: 37043 | J399: 13
A400: =ROW()-4 -> 396 | B400: Q- | C400: 4530 | D400: 1 | E400: 04530-5 | F400: 生物化学 | G400: 王希成 | H400: 36.00 | I400: 37104 | J400: 7
A401: =ROW()-4 -> 397 | B401: Q- | C401: 5073 | D401: 1 | E401: 05073-2 | F401: 真核生物转录调控概念、策略和方法（影印版） | G401: Michael Carey等 | H401: 68.00 | I401: 37257 | J401: 5
A402: =ROW()-4 -> 398 | B402: Q- | C402: 4531 | D402: 1 | E402: 04531-3 | F402: 生物化学学习指导 | G402: 王希成 | H402: 12.00 | I402: 37257 | J402: 20
A403: =ROW()-4 -> 399 | B403: Q- | C403: 3997 | D403: 1 | E403: 03997-6 | F403: 生物信息学 ―― 基因和蛋白质分析的实用指南 | G403: 李衍达等 | H403: 39.00 | I403: 37226 | J403: 9
A404: =ROW()-4 -> 400 | B404: Q- | C404: 5350 | D404: 1 | E404: 05350-2 | F404: 生物信息学 ―― 后基因组信息学 | G404: 孙之荣译 | H404: 19.80 | I404: 37384 | J404: 14
A405: =ROW()-4 -> 401 | B405: Q- | C405: 3329 | D405: 1 | E405: 03329-3 | F405: 蛋白质分子结构（精） | G405: 严隆飞等 | H405: 42.00 | I405: 36923 | J405: 6
A406: =ROW()-4 -> 402 | B406: Q- | C406: 4941 | D406: 1 | E406: 04941-6 | F406: 现代免疫学――免疫的细胞和分子基础 | G406: 郑昌学 | H406: 40.00 | I406: 37316 | J406: 5
A407: =ROW()-4 -> 403 | B407: Z- | C407: 5074 | D407: 1 | E407: 05074-0 | F407: 工程前沿――美国国家工程院“工程前沿学术研讨会”1997年及1998年会议文集 | G407: 中国工程院国家自然科学基金委员会 | H407: 27.00 | I407: 37347 | J407: 10
A408: =ROW()-4 -> 404 | B408: Q- | C408: 5260 | D408: 1 | E408: 05260-3 | F408: Translational Control of Gene Expression（基因表达的翻译调控） | G408: Nahum Sonenberg | H408: 69.00 | I408: 37348 | J408: 2
A409: =ROW()-4 -> 405 | B409: R- | C409: 5273 | D409: 1 | E409: 05273-1 | F409: 骨与关节损伤和疾病的诊断分类及功能 评定标准 | G409: 刘云鹏 刘沂等 | H409: 35.00 | I409: 37349 | J409: 7
A410: =ROW()-4 -> 406 | B410: Q- | C410: 5427 | D410: 1 | E410: 05427-4 | F410: Bioseparation process Science（生物分离过程科学） | G410: Antonio A.Garcia等 | H410: 38.00 | I410: 37408 | J410: 7
A411: =ROW()-4 -> 407 | B411: Q- | C411: 4938 | D411: 1 | E411: 04938-6 | F411: 食用蕈菌生物技术及应用(精) | G411: 刘祖同等 | H411: 38.00 | I411: 37500 | J411: 7
F412: 国外大学生物学优秀教材（影印版）
A413: =ROW()-4 -> 409 | B413: Q- | C413: 4818 | D413: 1 | E413: 04818-5 | F413: 生态学：原理与应用（第二版） | G413: J.L.Chapman等 | H413: 35.00 | I413: 37165 | J413: 9
A414: =ROW()-4 -> 410 | B414: Q- | C414: 4820 | D414: 1 | E414: 04820-7 | F414: 营养学：概念与争论（第八版） | G414: Frances Sizer Eleanor Whitney | H414: 68.00 | I414: 37196 | J414: 4
A415: =ROW()-4 -> 411 | B415: Q- | C415: 5096 | D415: 1 | E415: 05096-1 | F415: 酵母遗传实验方法――冷泉港实验课手册 | G415: D.Burke 等 | H415: 26.00 | I415: 37257 | J415: 13
A416: =ROW()-4 -> 412 | B416: Q- | C416: 4819 | D416: 1 | E416: 04819-3 | F416: 生物统计学导论 | G416: Glover & MITCHELL | H416: 38.00 | I416: 37165 | J416: 6
A417: =ROW()-4 -> 413 | B417: Q- | C417: 5095 | D417: 1 | E417: 05095-3 | F417: Introduction to Molecular Biology(分子生物学导论) | G417: Peter Paolella | H417: 38.00 | I417: 37288 | J417: 9
A418: =ROW()-4 -> 414 | B418: Q- | C418: 5428 | D418: 1 | E418: 05428-8 | F418: Biology (生物学 第6版) | G418: Peter H Raver等 | H418: 98.00 | I418: 37469 | J418: 2
A419: =ROW()-4 -> 415 | B419: Q- | C419: 5487 | D419: 1 | E419: 05487-8 | F419: Essentials of Glycobiology (糖生物学) | G419: Ajit Varki等 | H419: 49.00 | I419: 37469 | J419: 5
F420: 生物信息学引进版丛书
A421: =ROW()-4 -> 417 | B421: Q- | C421: 5097 | D421: 1 | E421: 05097-X | F421: 生物序列分析：蛋白质和核酸的概率论模型 | G421: R.Durbin 等 | H421: 38.00 | I421: 37257 | J421: 8
F422: 生物医学工程与仪器丛书
A423: =ROW()-4 -> 419 | B423: TQ | C423: 2884 | D423: 1 | E423: 02884-2 | F423: 医学超声成像机理 | G423: 白 净 | H423: 20.00 | I423: 1998 | J423: 17
A424: =ROW()-4 -> 420 | B424: R- | C424: 4049 | D424: 1 | E424: 04049-4 | F424: 远程医疗概论 | G424: 白净等 | H424: 20.00 | I424: 36831 | J424: 13
A425: =ROW()-4 -> 421 | B425: TN | C425: 1206 | D425: 1 | E425: 01206-7 | F425: 医学成像系统 | G425: 高上凯 | H425: 13.80 | I425: 36586 | J425: 17
F426: （五）农业 林业
A427: =ROW()-4 -> 423 | B427: S- | C427: 5098 | D427: 1 | E427: 05098-8 | F427: 烟台农业结构战略性调整研究 | G427: 张幸福等 | H427: 26.00 | I427: 37257 | J427: 15
F428: （六）基础学科
F429: 1.数学
A430: =ROW()-4 -> 426 | B430: O- | C430: 2760 | D430: 2 | E430: 02760-9 | F430: 现代应用数学手册――运筹学与最优化理论卷 | G430: 马振华等 | H430: 28.00 | I430: 37226 | J430: 11
A431: =ROW()-4 -> 427 | B431: O- | C431: 4565 | D431: 1 | E431: 04565-8 | F431: 现代应用数学手册――离散数学卷 | G431: 马振华等 | H431: 33.00 | I431: 37358 | J431: 9
A432: =ROW()-4 -> 428 | B432: O- | C432: 3054 | D432: 1 | E432: 03054-5 | F432: 现代应用数学手册――现代应用分析卷 | G432: 马振华等 | H432: 36.00 | I432: 1998 | J432: 8
A433: =ROW()-4 -> 429 | B433: O- | C433: 4613 | D433: 1 | E433: 04613-1 | F433: 大学数学――概念、方法与技巧（线性代数与概率统计部分） | G433: 俞正光等 | H433: 24.00 | I433: 37288 | J433: 11
A434: =ROW()-4 -> 430 | B434: O- | C434: 4647 | D434: 1 | E434: 04647-6 | F434: 大学数学――概念、方法与技巧（微积分部分） | G434: 刘坤林等 | H434: 29.00 | I434: 37321 | J434: 8
A435: =ROW()-4 -> 431 | B435: O- | C435: 4533 | D435: 1 | E435: 04533-X | F435: 高等代数解题方法 | G435: 许甫华等 | H435: 29.80 | I435: 37257 | J435: 7
A436: =ROW()-4 -> 432 | B436: O- | C436: 3553 | D436: 1 | E436: 03553-9 | F436: 现代应用数学手册――概率统计与随机过程卷 | H436: 48.00 | I436: 36739 | J436: 7
A437: =ROW()-4 -> 433 | B437: O- | C437: 2515 | D437: 3 | E437: 02515-0 | F437: 工学硕士研究生入学考试数学复习指导 (第2版) | G437: 胡金德等 | H437: 29.00 | I437: 1999 | J437: 7
A438: =ROW()-4 -> 434 | B438: O- | C438: 1803 | D438: 4 | E438: 01803-0 | F438: 高等数学（第1卷）基础与代数 | G438: 萧树铁等 | H438: 14.00 | I438: 36892 | J438: 12
A439: =ROW()-4 -> 435 | B439: O- | C439: 2135 | D439: 3 | E439: 02135-X | F439: 高等数学（第2卷)一元微积分与微分方程 | G439: 居余马等 | H439: 15.50 | I439: 36892 | J439: 11
A440: =ROW()-4 -> 436 | B440: O- | C440: 2433 | D440: 3 | E440: 02433-2 | F440: 高等数学（第3卷) 多元微积分与微分几何 初步 | G440: 萧树铁等 | H440: 13.00 | I440: 36893 | J440: 15
A441: =ROW()-4 -> 437 | B441: O- | C441: 5064 | D441: 1 | E441: 05064-3 | F441: 高等数学例题与习题集（一）一元微积分 | G441: 利亚什科等 | H441: 36.00 | I441: 37469 | J441: 7
A442: =ROW()-4 -> 438 | B442: O- | C442: 3957 | D442: 1 | E442: 03957-7 | F442: 文科高等数学学习指导 | G442: 徐庆和等 | H442: 27.00 | I442: 37226 | J442: 9
A443: =ROW()-4 -> 439 | B443: O- | C443: 3583 | D443: 2 | E443: 03583-0 | F443: 微积分教程 (上) | G443: 韩云瑞等 | H443: 15.80 | I443: 37104 | J443: 15
A444: =ROW()-4 -> 440 | B444: O- | C444: 1201 | D444: 1 | E444: 01201-6 | F444: 微积分教程 (下) | G444: 扈志明等 | H444: 15.00 | I444: 37135 | J444: 15
A445: =ROW()-4 -> 441 | B445: O- | C445: 4129 | D445: 1 | E445: 04129-6 | F445: 特殊矩阵 | G445: 陈景良等 | H445: 45.00 | I445: 36923 | J445: 8
A446: =ROW()-4 -> 442 | B446: O- | C446: 4045 | D446: 1 | E446: 04045-1 | F446: 微积分学习指导 | G446: 韩云瑞等 | H446: 18.00 | I446: 37500 | J446: 14
A447: =ROW()-4 -> 443 | B447: O- | C447: 1277 | D447: H | E447: 01277-6 | F447: 高等数学辅导（第2版）上册 | G447: 盛祥耀等 | H447: 14.00 | I447: 37334 | J447: 12
A448: =ROW()-4 -> 444 | B448: O- | C448: 1278 | D448: F | E448: 01278-4 | F448: 高等数学辅导（第2版）下册 | G448: 盛祥耀等 | H448: 17.50 | I448: 37530 | J448: 10
A449: =ROW()-4 -> 445 | B449: O- | C449: 4297 | D449: 1 | E449: 04297-7 | F449: 高等数学（一）考试辅导 | G449: 居余马等 | H449: 17.00 | I449: 36982 | J449: 18
A450: =ROW()-4 -> 446 | B450: O- | C450: 4112 | D450: 1 | E450: 04112-1 | F450: 高等数学（二）考试辅导 | G450: 居余马等 | H450: 12.00 | I450: 37196 | J450: 25
A451: =ROW()-4 -> 447 | B451: O- | C451: 2452 | D451: 4 | E451: 02452-9 | F451: 高等代数教程(上) | G451: 王萼芳 | H451: 14.50 | I451: 37328 | J451: 15
A452: =ROW()-4 -> 448 | B452: O- | C452: 2478 | D452: 3 | E452: 02478-2 | F452: 高等代数教程(下) | G452: 王萼芳 | H452: 14.00 | I452: 37135 | J452: 16
A453: =ROW()-4 -> 449 | B453: O- | C453: 2483 | D453: 3 | E453: 02483-9 | F453: 高等代数教程习题集 | G453: 王萼芳 | H453: 20.00 | I453: 36892 | J453: 10
A454: =ROW()-4 -> 450 | B454: O- | C454: 1425 | D454: 1 | E454: 01425-6 | F454: 线性代数 | G454: 王萼芳 | H454: 18.00 | I454: 37288 | J454: 16
A455: =ROW()-4 -> 451 | B455: O- | C455: 1142 | D455: 1 | E455: 01142-7 | F455: 线性代数习题集 | G455: 王萼芳 | H455: 13.50 | I455: 37500 | J455: 20
A456: =ROW()-4 -> 452 | B456: O- | C456: 2740 | D456: 2 | E456: 02740-4 | F456: 高等代数学 | G456: 张贤科等 | H456: 21.00 | I456: 37257 | J456: 8
A457: =ROW()-4 -> 453 | B457: O- | C457: 2977 | D457: 3 | E457: 02977-6 | F457: 理工科代数基础 | G457: 俞正光等 | H457: 13.50 | I457: 37226 | J457: 16
A458: =ROW()-4 -> 454 | B458: O- | C458: 1698 | D458: D | E458: 01698-4 | F458: 线性代数 | G458: 居余马等 | H458: 15.00 | I458: 37438 | J458: 15
A459: =ROW()-4 -> 455 | B459: O- | C459: 1760 | D459: 9 | E459: 01760-3 | F459: 线性代数辅导（第2版） | G459: 胡金德等 | H459: 15.00 | I459: 37500 | J459: 12
A460: =ROW()-4 -> 456 | B460: O- | C460: 2854 | D460: 3 | E460: 02854-0 | F460: 线性代数与解析几何 | G460: 俞正光等 | H460: 13.50 | I460: 37511 | J460: 13
A461: =ROW()-4 -> 457 | B461: O- | C461: 2990 | D461: 2 | E461: 02990-3 | F461: 数理统计基础 | G461: 陆 璇 | H461: 11.00 | I461: 37104 | J461: 18
A462: =ROW()-4 -> 458 | B462: O- | C462: 3676 | D462: 1 | E462: 03676-4 | F462: 应用统计 | G462: 陆 璇 | H462: 14.50 | I462: 36982 | J462: 17
A463: =ROW()-4 -> 459 | B463: O- | C463: 0802 | D463: 1 | E463: 00802-7 | F463: 概率论自然公理系统 | G463: 雄大国 | H463: 14.00 | I463: 36861 | J463: 30
A464: =ROW()-4 -> 460 | B464: O- | C464: 4387 | D464: 1 | E464: 04387-6 | F464: 概率论与数理统计辅导 | G464: 傅维潼 | H464: 20.00 | I464: 37226 | J464: 14
A465: =ROW()-4 -> 461 | B465: O- | C465: 2385 | D465: 2 | E465: 02385-9 | F465: 线性代数――成人高教试用教材 | G465: 李永乐 | H465: 8.90 | I465: 1998 | J465: 20
A466: =ROW()-4 -> 462 | B466: O- | C466: 3264 | D466: 1 | E466: 03264-5 | F466: 应用近世代数 (第二版) | G466: 胡冠章 | H466: 10.00 | I466: 37408 | J466: 22
A467: =ROW()-4 -> 463 | B467: O- | C467: 3964 | D467: 1 | E467: 03964-X | F467: 统计学习理论的本质 | G467: 张学工译 | H467: 27.00 | I467: 36770 | J467: 12
A468: =ROW()-4 -> 464 | B468: O- | C468: 1453 | D468: 1 | E468: 01453-1 | F468: 复分析 | G468: 郑建华 | H468: 11.00 | I468: 36586 | J468: 22
A469: =ROW()-4 -> 465 | B469: O- | C469: 4561 | D469: 1 | E469: 04561-5 | F469: 数值分析（第4版） | G469: 李庆扬等 | H469: 16.00 | I469: 37500 | J469: 14
A470: =ROW()-4 -> 466 | B470: O- | C470: 4749 | D470: 1 | E470: 04749-9 | F470: 数值分析与实验学习指导 | G470: 蔡大用 | H470: 10.00 | I470: 37500 | J470: 35
A471: =ROW()-4 -> 467 | B471: O- | C471: 0626 | D471: 4 | E471: 0626-1 | F471: 数值计算方法 | G471: 关治 等 | H471: 16.50 | I471: 37226 | J471: 10
A472: =ROW()-4 -> 468 | B472: O- | C472: 2395 | D472: 3 | E472: 02395-6 | F472: 高等数值分析 | G472: 蔡大用等 | H472: 12.00 | I472: 36739 | J472: 21
A473: =ROW()-4 -> 469 | B473: O- | C473: 0873 | D473: 3 | E473: 00873-6 | F473: 离散数学导引 | G473: 马振华等 | H473: 17.00 | I473: 37165 | J473: 16
A474: =ROW()-4 -> 470 | B474: O- | C474: 3942 | D474: 1 | E474: 03942-9 | F474: 数值计算原理 | G474: 李庆扬等 | H474: 20.00 | I474: 37500 | J474: 13
A475: =ROW()-4 -> 471 | B475: O- | C475: 4900 | D475: 1 | E475: 04900-9 | F475: Scientific Computing: An Introductory Survey 科学计算导论（第二版）（影印版） | G475: M.T.HEATH | H475: 55.00 | I475: 37500 | J475: 5
A476: =ROW()-4 -> 472 | B476: O- | C476: 0424 | D476: 7 | E476: 00424-2 | F476: 最优化理论与算法 | G476: 陈宝林 | H476: 19.50 | I476: 37530 | J476: 10
A477: =ROW()-4 -> 473 | B477: O- | C477: 5534 | D477: 1 | E477: 05534-3 | F477: 线性代数（第2版） | G477: 居余马等 | H477: 16.00 | I477: 37500 | J477: 13
A478: =ROW()-4 -> 474 | B478: F- | C478: 5434 | D478: 1 | E478: 05434-7 | F478: 运筹学习题集（第三版） | G478: 胡运权 | H478: 25.00 | I478: 37500 | J478: 11
A479: =ROW()-5 -> 474 | B479: O- | C479: 5535 | D479: 1 | E479: 05535-1 | F479: 有限群论基础 | G479: 王萼芳 | H479: 12.00 | I479: 37500 | J479: 25
F480: 工程硕士应用数学系列教材
A481: =ROW()-4 -> 477 | B481: O- | C481: 5448 | D481: 1 | E481: 54487 | F481: 全国工程硕士研究生入学考试数学解题指导 | G481: 俞正光等 | H481: 18.00 | I481: 37438 | J481: 14
A482: =ROW()-4 -> 478 | B482: O- | C482: 3484 | D482: 2 | E482: 03484-2 | F482: 科学和工程计算基础 | G482: 施妙根等 | H482: 29.50 | I482: 37341 | J482: 6
A483: =ROW()-4 -> 479 | B483: F- | C483: 3922 | D483: 1 | E483: 03922-4 | F483: 运筹学基础 | G483: 何坚勇 | H483: 31.00 | I483: 36982 | J483: 6
A484: =ROW()-4 -> 480 | B484: O- | C484: 1018 | D484: 2 | E484: 01018-8 | F484: 应用概率统计 | G484: 陈 魁 | H484: 25.00 | I484: 37408 | J484: 9
A485: =ROW()-4 -> 481 | B485: O- | C485: 5422 | D485: 1 | E485: 05422-3 | F485: 全国工程硕士研究生入学考试数学考试大纲及考前辅导教材（修订版） | G485: 指导委员会 | H485: 29.00 | I485: 37408 | J485: 12
F486: 《最优化基础――模型与方法》系列教材
A487: =ROW()-4 -> 483 | B487: O- | C487: 3610 | D487: 2 | E487: 03610-1 | F487: 现代优化计算方法 | G487: 邢文训等 | H487: 13.50 | I487: 37012 | J487: 20
A488: =ROW()-4 -> 484 | B488: O- | C488: 3998 | D488: 1 | E488: 03998-4 | F488: 网络优化 | G488: 谢金星等 | H488: 13.50 | I488: 36739 | J488: 18
A489: =ROW()-4 -> 485 | B489: O- | C489: 3007 | D489: 1 | E489: 03007-3 | F489: 随机规划与模糊规划 | G489: 刘宝碇等 | H489: 12.00 | I489: 37226 | J489: 20
F490: 2.物理
A491: =ROW()-4 -> 487 | B491: O- | C491: 3371 | D491: 4 | E491: 03371-4 | F491: 大学物理学（一）力学 (第2版) | G491: 张三慧等 | H491: 16.00 | I491: 37226 | J491: 14
A492: =ROW()-4 -> 488 | B492: O- | C492: 3485 | D492: 4 | E492: 03485-0 | F492: 大学物理学（二）热学 (第2版) | G492: 张三慧等 | H492: 9.50 | I492: 37257 | J492: 22
A493: =ROW()-4 -> 489 | B493: O- | C493: 3819 | D493: 3 | E493: 03819-8 | F493: 大学物理学（三）电磁学 (第2版) | G493: 张三慧等 | H493: 16.00 | I493: 37408 | J493: 14
A494: =ROW()-4 -> 490 | B494: O- | C494: 3783 | D494: 1 | E494: 03783-3 | F494: 大学物理学（四）波动与光学(第2版) | G494: 张三慧等 | H494: 10.00 | I494: 37257 | J494: 22
A495: =ROW()-4 -> 491 | B495: O- | C495: 4010 | D495: 1 | E495: 04010-9 | F495: 大学物理学（五）量子物理(第2版) | G495: 张三慧等 | H495: 11.00 | I495: 37257 | J495: 23
A496: =ROW()-4 -> 492 | B496: O- | C496: 3810 | D496: 2 | E496: 03810-4 | F496: 大学物理学习题解答（第2版） | G496: 张三慧 | H496: 30.00 | I496: 37226 | J496: 12
F497: *《大学物理学》（第二版）获2002年教育部全国普通高等学校优秀教材二等奖。
A498: =ROW()-4 -> 494 | B498: O- | C498: 3224 | D498: 1 | E498: 03224-6 | F498: 大学物理导论（上）物理学的理论与方法、历史与前沿 | G498: 向义和 | H498: 19.80 | I498: 37226 | J498: 11
A499: =ROW()-4 -> 495 | B499: O- | C499: 3486 | D499: 1 | E499: 03486-9 | F499: 大学物理导论（下）物理学的理论与方法、历史与前沿 | G499: 向义和 | H499: 18.00 | I499: 37226 | J499: 11
A500: =ROW()-4 -> 496 | B500: O- | C500: 3979 | D500: 1 | E500: 03979-8 | F500: 大学物理导论学习辅导 | G500: 向义和 | H500: 13.50 | I500: 37398 | J500: 20
A501: =ROW()-4 -> 497 | B501: O- | C501: 0849 | D501: B | E501: 00849-3 | F501: 大学物理学习题讨论课指导（上） | G501: 沈慧君等 | H501: 9.50 | I501: 37438 | J501: 17
A502: =ROW()-4 -> 498 | B502: O- | C502: 0850 | D502: A | E502: 00850-7 | F502: 大学物理学习题讨论课指导（下） | G502: 沈慧君等 | H502: 9.50 | I502: 37530 | J502: 18
A503: =ROW()-4 -> 499 | B503: O- | C503: 4423 | D503: 1 | E503: 04423-6 | F503: 近代物理与高新技术物理基础――大学物理续篇 | G503: 陈泽民 | H503: 38.00 | I503: 37357 | J503: 6
A504: =ROW()-4 -> 500 | B504: O- | C504: 0978 | D504: 6 | E504: 00978-3 | F504: 物理实验教程（普通物理实验部分） | G504: 丁慎训等 | H504: 16.50 | I504: 37135 | J504: 10
A505: =ROW()-4 -> 501 | B505: O- | C505: 0826 | D505: 2 | E505: 00826-4 | F505: 物理实验教程（近代物理实验部分） | G505: 张孔时等 | H505: 22.00 | I505: 37043 | J505: 10
A506: =ROW()-4 -> 502 | B506: O- | C506: 3511 | D506: 1 | E506: 03511-3 | F506: 膜技术基本原理 （第2版） | G506: 李 琳译 | H506: 35.00 | I506: 36342 | J506: 7
A507: =ROW()-4 -> 503 | B507: TN | C507: 3916 | D507: 1 | E507: 03916-X | F507: 电子动量谱学的原理和应用 | G507: 陈学俊等 | H507: 38.00 | I507: 36678 | J507: 7
A508: =ROW()-4 -> 504 | B508: TL | C508: 1064 | D508: 1 | E508: 01064-1 | F508: 神通广大的射线装置――带电粒子加速器 | G508: 方守贤等 | H508: 16.00 | I508: 36923 | J508: 20
A509: =ROW()-4 -> 505 | B509: O- | C509: 2521 | D509: 3 | E509: 02521-5 | F509: 近代物理学进展――“九五”教委重点教材 | G509: 张 礼 | H509: 22.50 | I509: 36586 | J509: 8
A510: =ROW()-4 -> 506 | B510: O- | C510: 1472 | D510: 5 | E510: 01472-8 | F510: 硕士研究生入学考试普通物理精选试题解 | G510: 卢先河等 | H510: 20.00 | I510: 1999 | J510: 10
A511: =ROW()-4 -> 507 | B511: O- | C511: 1187 | D511: 6 | E511: 01187-7 | F511: 物理学史 | G511: 郭奕玲等 | H511: 17.00 | I511: 37469 | J511: 11
A512: =ROW()-4 -> 508 | B512: O- | C512: 4995 | D512: 1 | E512: 04995-5 | F512: 分子振动光谱学：原理与研究 | G512: 吴国祯 | H512: 23.00 | I512: 37226 | J512: 22
A513: =ROW()-4 -> 509 | B513: TL | C513: 4289 | D513: 1 | E513: 04289-6 | F513: 聚变能及其未来 | G513: 王乃彦 | H513: 18.00 | I513: 36982 | J513: 24
A514: =ROW()-4 -> 510 | B514: O- | C514: 3249 | D514: 1 | E514: 03249-1 | F514: 保尔-厄任费斯脱――20世纪著名的理论物理学 | G514: 高达声等译 | H514: 18.00 | I514: 1999 | J514: 15
A515: =ROW()-4 -> 511 | B515: TK | C515: 4757 | D515: 1 | E515: 04757-X | F515: 两相流与沸腾传热 | G515: 鲁钟琪 | H515: 17.00 | I515: 37257 | J515: 18
A516: =ROW()-4 -> 512 | B516: O- | C516: 4773 | D516: 1 | E516: 04773-1 | F516: 流态化工程原理（精） | G516: 金涌 等 | H516: 68.00 | I516: 37104 | J516: 4
A517: =ROW()-4 -> 513 | B517: O- | C517: 5745 | D517: 1 | E517: 05745-1 | F517: Boundary Element Techniques(边界元技术) | G517: 姚振汉 | H517: 89.00 | I517: 37500 | J517: 5
A518: =ROW()-4 -> 514 | B518: O- | C518: 5798 | D518: 1 | E518: 05798-2 | F518: 物理实验教程（第二版） | G518: 丁慎训等 | H518: 28.00 | I518: 37500 | J518: 8
A519: =ROW()-4 -> 515 | B519: O- | C519: 5763 | D519: 2 | E519: 05763-X | F519: 相对论导引 | G519: 赵展岳 | H519: 19.00 | I519: 37500 | J519: 16
A520: =ROW()-4 -> 516 | B520: O- | C520: 5763 | D520: 1 | E520: 05763-X | F520: 相对论导引(精) | G520: 赵展岳 | H520: 28.00 | I520: 37500 | J520: 12
F521: 3.力学
A522: =ROW()-4 -> 518 | B522: O- | C522: 1611 | D522: 3 | E522: 01611-9 | F522: 材料力学实验 | G522: 张小凡等 | H522: 9.00 | I522: 36951 | J522: 30
A523: =ROW()-4 -> 519 | B523: O- | C523: 2852 | D523: 3 | E523: 02852-4 | F523: 粘性流体力学 | G523: 章梓雄等 | H523: 20.00 | I523: 36404 | J523: 9
A524: =ROW()-4 -> 520 | B524: O- | C524: 2852 | D524: 2 | E524: 02852-4 | F524: 粘性流体力学（精） | G524: 章梓雄等 | H524: 38.00 | I524: 1998 | J524: 7
A525: =ROW()-4 -> 521 | B525: O- | C525: 1800 | D525: 2 | E525: 01800-6 | F525: 应用弹塑性力学 | G525: 徐秉业等 | H525: 20.00 | I525: 37500 | J525: 10
A526: =ROW()-4 -> 522 | B526: O- | C526: 3663 | D526: 2 | E526: 03663-2 | F526: 固体本构关系 | G526: 黄克智等 | H526: 34.00 | I526: 36495 | J526: 6
A527: =ROW()-4 -> 523 | B527: O- | C527: 3710 | D527: 1 | E527: 03710-8 | F527: 量子力学的前沿问题 | G527: 张 礼等 | H527: 42.00 | I527: 36617 | J527: 5
A528: =ROW()-4 -> 524 | B528: O- | C528: 2421 | D528: 4 | E528: 02421-9 | F528: 有限单元法基本原理和数值方法(第2版) | G528: 王勖成等 | H528: 29.8 | I528: 37530 | J528: 5
A529: =ROW()-4 -> 525 | B529: P- | C529: 3594 | D529: 1 | E529: 7900635947 | F529: 数字化经典力学（配光盘） | G529: 纪哲瑞 | H529: 38 | I529: 37196 | J529: 9
A530: =ROW()-4 -> 526 | B530: O- | C530: 2300 | D530: 2 | E530: 02300-X | F530: 理论力学辅导 | G530: 贾书惠等 | H530: 18.00 | I530: 37226 | J530: 10
A531: =ROW()-4 -> 527 | B531: O- | C531: 2718 | D531: 1 | E531: 02718-8 | F531: 损伤力学 | G531: 余寿文等 | H531: 14.00 | I531: 1997 | J531: 15
A532: =ROW()-4 -> 528 | B532: TB | C532: 4851 | D532: 1 | E532: 04851-7 | F532: 陶瓷材料断裂力学（精） | G532: 龚江宏 | H532: 60.00 | I532: 37165 | J532: 6
A533: =ROW()-4 -> 529 | B533: O- | C533: 3713 | D533: 1 | E533: 03713-2 | F533: 材料的损伤断裂机理和宏微观力学理论 | G533: 黄克智等 | H533: 38.00 | I533: 36739 | J533: 8
A534: =ROW()-4 -> 530 | B534: TB | C534: 4106 | D534: 1 | E534: 04106-7 | F534: 力电失效学 （精） | G534: 杨 卫 | H534: 35.00 | I534: 36951 | J534: 7
A535: =ROW()-4 -> 531 | B535: O- | C535: 5488 | D535: 1 | E535: 05488-6 | F535: 力学及其在土木工程中的应用 | G535: 郑泉水等 | H535: 89.00 | I535: 37500 | J535: 6
A536: =ROW()-4 -> 532 | B536: O- | C536: 5168 | D536: 1 | E536: 51682 | F536: 工程力学公式与习题 第1册 静力学 | G536: 任文敏 | H536: 17.00 | I536: 37469 | J536: 20
A537: =ROW()-4 -> 533 | B537: O- | C537: 4768 | D537: 1 | E537: 04768-5 | F537: Mechatronic Reliability （力电失效学） | G537: 杨卫 | H537: 180.00 | I537: 37530 | J537: 5
F538: 高等院校力学类系列教材
A539: =ROW()-4 -> 535 | B539: O- | C539: 4700 | D539: 1 | E539: 04700-6 | F539: 高等院校力学类系列教材――理论力学 | G539: 李俊峰 | H539: 24 | I539: 37135 | J539: 9
A540: =ROW()-4 -> 536 | B540: O- | C540: 4555 | D540: 1 | E540: 04555-0 | F540: 高等院校力学类系列教材――弹性理论基础（第2 版）（上） | G540: 陆明万等 | H540: 19 | I540: 37135 | J540: 11
A541: =ROW()-4 -> 537 | B541: O- | C541: 4555 | D541: 2 | E541: 04555-0 | F541: 高等院校力学类系列教材――弹性理论基础（第2 版）（下） | G541: 陆明万等 | H541: 19 | I541: 37135 | J541: 11
F542: 国际著名力学图书――影印版教材
A543: =ROW()-4 -> 539 | B543: O- | C543: 4595 | D543: 1 | E543: 04595-X | F543: 工程力学――静力学（第2版） | G543: Andrew Pytel、 Jaan Kiusalaas | H543: 46.00 | I543: 37104 | J543: 6
A544: =ROW()-4 -> 540 | B544: O- | C544: 4594 | D544: 1 | E544: 04594-1 | F544: 工程力学――动力学（第2版） | G544: Andrew Pytel、 Jaan Kiusalaas | H544: 49.00 | I544: 37135 | J544: 5
A545: =ROW()-4 -> 541 | B545: O- | C545: 4593 | D545: 1 | E545: 04593-3 | F545: 高等材料力学和实用应力分析 （第2版） | G545: Richard G. Budynas | H545: 73.00 | I545: 37135 | J545: 3
A546: =ROW()-4 -> 542 | B546: O- | C546: 5190 | D546: 1 | E546: 05190-9 | F546: Theory of Structure Second Edition (结构理论 第2版） | G546: S.P.Timoshenko D.H.Young | H546: 34.00 | I546: 37371 | J546: 9
A547: =ROW()-4 -> 543 | B547: O- | C547: 5189 | D547: 1 | E547: 05189-5 | F547: Computational Fluid Dymanics :The Basic with Applications (计算流体力学入门) | G547: John D.Anderson,JR. | H547: 34.00 | I547: 37354 | J547: 10
A548: =ROW()-4 -> 544 | B548: P- | C548: 4137 | D548: 1 | E548: 7900641378 | F548: Thermodynamics: An Engineering Approach Fourth Edition (热力学---原理及工程技术应用第4版 配光盘） | G548: Yunus A. Cengel Michael A. Boles | H548: 79.00 | I548: 37397 | J548: 3
F549: 4. 化学 化工 材料
A550: =ROW()-4 -> 546 | B550: O- | C550: 3641 | D550: 1 | E550: 03641-1 | F550: 现代化学基础 | G550: 沈光球等 | H550: 21.50 | I550: 37073 | J550: 9
A551: =ROW()-4 -> 547 | B551: O- | C551: 3268 | D551: 1 | E551: 03268-8 | F551: 化学工程基础 | G551: 林爱光 | H551: 24.00 | I551: 37257 | J551: 8
A552: =ROW()-4 -> 548 | B552: O- | C552: 3154 | D552: 1 | E552: 03154-1 | F552: 元素有机化学 | G552: 赵玉芬等 | H552: 25.00 | I552: 1999 | J552: 9
A553: =ROW()-4 -> 549 | B553: O- | C553: 2386 | D553: 1 | E553: 02386-7 | F553: 大学化学实验(第2版) | G553: 徐功骅等 | H553: 9.80 | I553: 36678 | J553: 17
A554: =ROW()-4 -> 550 | B554: O- | C554: 2302 | D554: 2 | E554: 02302- | F554: 有机化学 | G554: 王芹珠等 | H554: 28.00 | I554: 37226 | J554: 7
A555: =ROW()-4 -> 551 | B555: O- | C555: 4156 | D555: 1 | E555: 04156-3 | F555: 有机化学实验 | G555: 李兆陇等 | H555: 16.00 | I555: 37226 | J555: 13
A556: =ROW()-4 -> 552 | B556: O- | C556: 2084 | D556: 2 | E556: 02084-1 | F556: 无机化学实验 | G556: 袁书玉 | H556: 12.00 | I556: 37288 | J556: 17
A557: =ROW()-4 -> 553 | B557: O- | C557: 4116 | D557: 1 | E557: 04116-4 | F557: 离子色谱原理与应用（精） | G557: 丁明玉等 | H557: 38.00 | I557: 36982 | J557: 5
A558: =ROW()-4 -> 554 | B558: O- | C558: 1388 | D558: 2 | E558: 01388- | F558: 分析化学(第2版) | G558: 薛华等 | H558: 19.50 | I558: 37104 | J558: 8
A559: =ROW()-4 -> 555 | B559: O- | C559: 1764 | D559: 3 | E559: 01764-6 | F559: 物理化学（上册） | G559: 朱文涛 | H559: 20.00 | I559: 36495 | J559: 9
A560: =ROW()-4 -> 556 | B560: O- | C560: 1778 | D560: 3 | E560: 01778-6 | F560: 物理化学（下册） | G560: 朱文涛 | H560: 18.50 | I560: 36526 | J560: 10
A561: =ROW()-4 -> 557 | B561: O- | C561: 3038 | D561: 2 | E561: 03038-3 | F561: 物理化学中的公式与概念 | G561: 朱文涛 | H561: 11.50 | I561: 37196 | J561: 30
A562: =ROW()-4 -> 558 | B562: O- | C562: 0955 | D562: 3 | E562: 00955-4 | F562: 无机材料物理性能 | G562: 关振铎等 | H562: 12.60 | I562: 37500 | J562: 14
A563: =ROW()-4 -> 559 | B563: O- | C563: 0797 | D563: 2 | E563: 00797-7 | F563: 仪器分析 | G563: 邓勃等 | H563: 12.80 | I563: 1996 | J563: 10
A564: =ROW()-4 -> 560 | B564: O- | C564: 3912 | D564: 1 | E564: 03912-7 | F564: 聚合物近代仪器分析（第2版） | G564: 汪昆华等 | H564: 24.00 | I564: 36678 | J564: 10
A565: =ROW()-4 -> 561 | B565: O- | C565: 2188 | D565: 1 | E565: 02188-0 | F565: 现代仪器分析实验与技术 | G565: 陈培榕等 | H565: 26.80 | I565: 37165 | J565: 8
A566: =ROW()-4 -> 562 | B566: O- | C566: 1048 | D566: 4 | E566: 01048-X | F566: 化工原理（上） | G566: 蒋维钧等 | H566: 19.80 | I566: 1998 | J566: 9
A567: =ROW()-4 -> 563 | B567: O- | C567: 1252 | D567: 4 | E567: 01252-0 | F567: 化工原理（下） | G567: 蒋维钧等 | H567: 17.50 | I567: 37257 | J567: 10
A568: =ROW()-4 -> 564 | B568: O- | C568: 1408 | D568: 5 | E568: 01408-6 | F568: 化工原理实验 | G568: 雷良恒等 | H568: 7.40 | I568: 1998 | J568: 22
A569: =ROW()-4 -> 565 | B569: O- | C569: 2299 | D569: 1 | E569: 02299- | F569: 化工设备设计 | G569: 潘国昌等 | H569: 16.80 | I569: 1997 | J569: 10
A570: =ROW()-4 -> 566 | B570: O- | C570: 1273 | D570: 1 | E570: 01273-3 | F570: 分离过程化学 | G570: 陆九芳等 | H570: 9.80 | I570: 1993 | J570: 9
A571: =ROW()-4 -> 567 | B571: O- | C571: 1736 | D571: 2 | E571: 01736-0 | F571: 化工热力学 | G571: 童景山等 | H571: 24.00 | I571: 36982 | J571: 7
A572: =ROW()-4 -> 568 | B572: TP | C572: 5170 | D572: 1 | E572: 05170-4 | F572: 化工网上营销资源查询实用手册 | G572: 刘燕秋 | H572: 28.00 | I572: 37377 | J572: 9
A573: =ROW()-4 -> 569 | B573: O- | C573: 0765 | D573: 1 | E573: 00765-9 | F573: 化工热力学 ―― 基本内容、习题详解和计算程序 | G573: 高光华等 | H573: 18.50 | I573: 36678 | J573: 12
A574: =ROW()-4 -> 570 | B574: TL | C574: 1097 | D574: 1 | E574: 01097-8 | F574: 先进沸水反应堆技术研究 | G574: 张作义 | H574: 28.00 | I574: 36557 | J574: 18
A575: =ROW()-4 -> 571 | B575: Z- | C575: 1868 | D575: 3 | E575: 01868-5 | F575: 分形 | G575: 张济忠 | H575: 16 | I575: 37135 | J575: 15
A576: =ROW()-4 -> 572 | B576: TB | C576: 4461 | D576: 1 | E576: 04461-9 | F576: 材料物理学概论 | G576: 李言荣等 | H576: 32.00 | I576: 37012 | J576: 9
A577: =ROW()-4 -> 573 | B577: TB | C577: 4852 | D577: 1 | E577: 04852-5 | F577: 环境材料学 | G577: 翁 端 | H577: 19.00 | I577: 37196 | J577: 13
A578: =ROW()-4 -> 574 | B578: TB | C578: 2762 | D578: 2 | E578: 02762-5 | F578: 材料科学基础 | G578: 潘金生等 | H578: 39.00 | I578: 37257 | J578: 5
A579: =ROW()-4 -> 575 | B579: TH | C579: 2453 | D579: 1 | E579: 02453-7 | F579: 近代材料加工原理 | G579: 吴德海 | H579: 21.00 | I579: 1997 | J579: 7
A580: =ROW()-4 -> 576 | B580: TH | C580: 0847 | D580: C | E580: 00847-7 | F580: 工程材料（第2版） | G580: 郑明新 | H580: 19.00 | I580: 36892 | J580: 10
A581: =ROW()-4 -> 577 | B581: TH | C581: 4115 | D581: 1 | E581: 04115-6 | F581: 工程材料（第3版） | G581: 朱张校 | H581: 29.00 | I581: 37257 | J581: 7
A582: =ROW()-4 -> 578 | B582: TH | C582: 1238 | D582: 8 | E582: 01238-5 | F582: 工程材料习题与辅导 | G582: 郑明新等 | H582: 7.80 | I582: 37469 | J582: 25
A583: =ROW()-4 -> 579 | B583: O- | C583: 5801 | D583: 1 | E583: 05801-6 | F583: 工程材料习题与辅导(第三版） | G583: 郑明新等 | H583: 8.60 | I583: 37500 | J583: 25
A584: =ROW()-4 -> 580 | B584: O- | C584: 5072 | D584: 1 | E584: 05072-4 | F584: 传递过程原理 | G584: 王运东 | H584: 30.00 | I584: 37316 | J584: 11
F585: 基础工业训练系列教材
A586: =ROW()-4 -> 582 | B586: TH | C586: 3196 | D586: 2 | E586: 03196-7 | F586: 机械制造工艺基础（金属工艺学冷加工部分） | G586: 傅水根等 | H586: 16.00 | I586: 37196 | J586: 11
A587: =ROW()-4 -> 583 | B587: TH | C587: 4570 | D587: 1 | E587: 04570-4 | F587: 材料成形工艺基础（金属工艺学热加工部分） | G587: 严绍华 | H587: 20.00 | I587: 37104 | J587: 13
A588: =ROW()-4 -> 584 | B588: TH | C588: 0944 | D588: 9 | E588: 00944-9 | F588: 金属工艺学实习（非机类） | G588: 严绍华等 | H588: 12.00 | I588: 37469 | J588: 15
A589: =ROW()-4 -> 585 | B589: TN | C589: 3947 | D589: 1 | E589: 03947-X | F589: 电工技术工艺基础 | G589: 王天曦等编 | H589: 21.50 | I589: 37257 | J589: 11
F590: 剑桥非线性科学系列（英文影印版）
A591: =ROW()-4 -> 587 | B591: O- | C591: 3905 | D591: 1 | E591: 03905-4 | F591: 湍流研究的动力系统方法 (Dynamical Systems Approach to Turbulence) | G591: Tomas Bohr 等 | H591: 45.00 | I591: 36892 | J591: 8
A592: =ROW()-4 -> 588 | B592: O- | C592: 3903 | D592: 1 | E592: 03903-8 | F592: 复杂性 ―― 物理学中的递阶结构和标度 Hierarchical structures and scaling in physics | G592: Remo Badii | H592: 39.00 | I592: 36678 | J592: 10
A593: =ROW()-4 -> 589 | B593: O- | C593: 3904 | D593: 1 | E593: 03904-9 | F593: 分形、标度及远离平衡态的增长 （Fractal,scaling and growth far from equilibrium) | G593: Paul Meakin | H593: 78.00 | I593: 36923 | J593: 5
A594: =ROW()-4 -> 590 | B594: O- | C594: 3906 | D594: 1 | E594: 03906-2 | F594: 非线性时间序列分析 (Nonlinear Time Series Analysis) | G594: Holger Kantz 等 | H594: 39.00 | I594: 36982 | J594: 10
F595: 清华大学建筑材料系列教材
A596: =ROW()-4 -> 592 | B596: TU | C596: 4503 | D596: 1 | E596: 04503-8 | F596: 建筑材料与人居环境 | G596: 杨 静 | H596: 23.00 | I596: 37135 | J596: 12
A597: =ROW()-4 -> 593 | B597: TB | C597: 4035 | D597: 1 | E597: 04035-4 | F597: 结构工程材料 | G597: 覃维祖 | H597: 19.00 | I597: 36770 | J597: 14
F598: 新材料在高技术中的应用丛书
A599: =ROW()-4 -> 595 | B599: TB | C599: 4084 | D599: 1 | E599: 04084-2 | F599: 磁性材料 | G599: 田民波 | H599: 34.00 | I599: 36982 | J599: 8
A600: =ROW()-4 -> 596 | B600: TB | C600: 4309 | D600: 1 | E600: 43094 | F600: 电子显示 | G600: 田民波 | H600: 39.00 | I600: 36983 | J600: 7
A601: =ROW()-4 -> 597 | B601: G- | C601: 5588 | D601: 1 | E601: 05588-2 | F601: 纳米科技探索 | G601: 薛增泉 | H601: 12.00 | I601: 37500 | J601: 29
A602: =ROW()-4 -> 598 | B602: TB | C602: 5442 | D602: 1 | E602: 05442-8 | F602: Handbook of Nanophase andNanostructured Materials-Characterization 纳米相和纳米结构材料―结构和性能表征手册（精） | G602: Zhonglin Wang 王中林主编 | H602: 120.00 | I602: 37377 | J602: 5
A603: =ROW()-4 -> 599 | B603: TB | C603: 5251 | D603: 1 | E603: 05251-4 | F603: Handbook of Nanophase andNanostructured Materials-Synthesis 纳米相和纳米结构材料――合成手册 | G603: Zhonglin Wang 王中林主编 | H603: 120.00 | I603: 37500 | J603: 5
F604: 21世纪科技前沿
A605: =ROW()-4 -> 601 | B605: TB | C605: 5304 | D605: 1 | E605: 05304-1 | F605: 纳米科学和纳米技术前瞻 | G605: 刘国奎、王中林 | H605: 80 | I605: 37438 | J605: 6
A606: =ROW()-4 -> 602 | B606: TB | C606: 5734 | D606: 1 | E606: 05734-6 | F606: Handbook of Nanophase and Nanostructured Materials―Materials Systems and Applications(1) 纳米相和纳米结构材料――应用（1）手册 | G606: Zhonglin Wang 王中林主编 | H606: 120.00 | I606: 37500 | J606: 5
A607: =ROW()-4 -> 603 | B607: TB | C607: 5735 | D607: 1 | E607: 05735-4 | F607: Handbook of Nanophase and Nanostructured Materials―Materials Systems and Applications(2) 纳米相和纳米结构材料――应用（2）手册 | G607: Zhonglin Wang 王中林主编 | H607: 120.00 | I607: 37500 | J607: 5
F608: （七）科学普及读物
F609: 院士科普书系（第一辑）
A610: =ROW()-4 -> 606 | B610: G- | C610: 3866 | D610: 1 | E610: 03866-X | F610: 对称与不对称 | G610: 李政道等 | H610: 12 | I610: 37500 | J610: 40
A611: =ROW()-4 -> 607 | B611: GG | C611: 0930 | D611: 1 | E611: 7810299301 | F611: 计算机怎样解几何题 ―― 谈谈自动推理 | G611: 张景中 | H611: 15 | I611: 36800 | J611: 22
A612: =ROW()-4 -> 608 | B612: GG | C612: 0932 | D612: 1 | E612: 7810299328 | F612: 梳理人、事、物的纠纷―― 问题分析方法 | G612: 肖纪美 | H612: 15 | I612: 37500 | J612: 22
A613: =ROW()-4 -> 609 | B613: GG | C613: 0934 | D613: 1 | E613: 7810299344 | F613: 菌物世界漫游 | G613: 裘维蕃 | H613: 15 | I613: 36800 | J613: 25
A614: =ROW()-4 -> 610 | B614: GG | C614: 0789 | D614: 1 | E614: 7810297899 | F614: 节水农业 | G614: 山 仑等 | H614: 15 | I614: 36801 | J614: 23
A615: =ROW()-4 -> 611 | B615: G- | C615: 3869 | D615: 1 | E615: 03869-4 | F615: 动物的运动 | G615: 钦俊德 | H615: 12 | I615: 36802 | J615: 35
A616: =ROW()-4 -> 612 | B616: G- | C616: 3662 | D616: 2 | E616: 03662-4 | F616: 机会的数学 | G616: 陈希孺 | H616: 15 | I616: 37500 | J616: 25
A617: =ROW()-4 -> 613 | B617: GG | C617: 0940 | D617: 1 | E617: 7810299409 | F617: 第三种科学方法――计算机时代的科学计算 | G617: 石钟慈 | H617: 12 | I617: 37500 | J617: 38
A618: =ROW()-4 -> 614 | B618: GG | C618: 0926 | D618: 1 | E618: 7810299263 | F618: 信息世界漫谈 | G618: 李衍达 | H618: 12 | I618: 36800 | J618: 30
A619: =ROW()-4 -> 615 | B619: GG | C619: 0782 | D619: 1 | E619: 7810297821 | F619: 今日水世界 | G619: 刘昌明等 | H619: 15 | I619: 36800 | J619: 20
A620: =ROW()-4 -> 616 | B620: GG | C620: 0931 | D620: 1 | E620: 781029931X | F620: 征战癌王 | G620: 汤钊猷 | H620: 15 | I620: 36800 | J620: 25
A621: =ROW()-4 -> 617 | B621: GG | C621: 0938 | D621: 1 | E621: 7810299387 | F621: 21世纪的绿色交通工具―― 电动车 | G621: 陈清泉等 | H621: 15 | I621: 36800 | J621: 22
A622: =ROW()-4 -> 618 | B622: GG | C622: 0783 | D622: 1 | E622: 781029783X | F622: 消除血肉之灾 ―― 创伤防治 | G622: 王正国 | H622: 15 | I622: 36800 | J622: 20
A623: =ROW()-4 -> 619 | B623: GG | C623: 0935 | D623: 1 | E623: 7810299352 | F623: 产业大观 | G623: 朱高峰 | H623: 12 | I623: 36800 | J623: 25
A624: =ROW()-4 -> 620 | B624: GG | C624: 0785 | D624: 1 | E624: 7810297856 | F624: 九曲黄河万里沙 ―― 黄河与黄土高原 | G624: 张宗祜 | H624: 12 | I624: 36800 | J624: 25
A625: =ROW()-4 -> 621 | B625: GG | C625: 0929 | D625: 1 | E625: 7810299298 | F625: 悄悄进行的破坏 ―― 金属腐蚀 | G625: 曹楚南 | H625: 12 | I625: 36801 | J625: 25
A626: =ROW()-4 -> 622 | B626: GG | C626: 0774 | D626: 1 | E626: 7810297740 | F626: 沉默的宝藏 ―― 盐湖资源 | G626: 张彭熹 | H626: 15 | I626: 36802 | J626: 26
A627: =ROW()-4 -> 623 | B627: GG | C627: 0928 | D627: 1 | E627: 781029928X | F627: 海陆空天显神威 ―― 惯性技术纵横谈 | G627: 丁衡高 | H627: 12 | I627: 36803 | J627: 30
A628: =ROW()-4 -> 624 | B628: G- | C628: 3868 | D628: 1 | E628: 03868-6 | F628: 从绿叶到激光光盘 ―― 颜色与化学 | G628: 袁渭康等 | H628: 12 | I628: 36804 | J628: 31
A629: =ROW()-4 -> 625 | B629: GG | C629: 0933 | D629: 1 | E629: 7810299336 | F629: 地球上最重要的化学反应 ―― 光合作用 | G629: 沈允钢 | H629: 12 | I629: 36805 | J629: 33
A630: =ROW()-4 -> 626 | B630: GG | C630: 0939 | D630: 1 | E630: 7810299395 | F630: 千秋功罪话水坝 | G630: 潘家铮 | H630: 15 | I630: 36806 | J630: 25
A631: =ROW()-4 -> 627 | B631: GG | C631: 0936 | D631: 1 | E631: 7810299360 | F631: 人类认识世界的帮手 ―― 虚拟现实 | G631: 汪成为 | H631: 15 | I631: 36807 | J631: 25
A632: =ROW()-4 -> 628 | B632: GG | C632: 0927 | D632: 1 | E632: 7810299271 | F632: 运筹帷幄，决胜千里 ―― 从生态控制系统工程谈起 | G632: 关君蔚 | H632: 15 | I632: 37500 | J632: 25
A633: =ROW()-4 -> 629 | B633: G- | C633: 3867 | D633: 1 | E633: 7302038678 | F633: 来自微观世界的新概念 ―― 单分子科学与技术 | G633: 白春礼 | H633: 15 | I633: 36809 | J633: 25
A634: =ROW()-4 -> 630 | B634: GG | C634: 0937 | D634: 1 | E634: 7810299379 | F634: 坐飞机去―― 现代民用运输航空 | G634: 管 德 | H634: 12 | I634: 36810 | J634: 28
F635: 院士科普书系（第二辑）
A636: =ROW()-4 -> 632 | B636: G- | C636: 4199 | D636: 1 | E636: 04199-7 | F636: 中子―打开原子能时代的金钥匙 | G636: 丁大钊 | H636: 12 | I636: 37438 | J636: 25
A637: =ROW()-4 -> 633 | B637: G- | C637: 4201 | D637: 1 | E637: 04201-2 | F637: 我们生活在磁的世界里――物质的磁性和应用 | G637: 章 综等 | H637: 15 | I637: 37104 | J637: 20
A638: =ROW()-4 -> 634 | B638: G- | C638: 4214 | D638: 1 | E638: 04214-4 | F638: 数字地球与测绘 | G638: 宁津生等 | H638: 15 | I638: 37104 | J638: 23
A639: =ROW()-4 -> 635 | B639: G- | C639: 4200 | D639: 1 | E639: 04200-4 | F639: 加速器与科技创新 | G639: 谢家麟 | H639: 12 | I639: 37438 | J639: 24
A640: =ROW()-4 -> 636 | B640: G- | C640: 4202 | D640: 1 | E640: 04202-0 | F640: 稀土元素――您身边的大家族 | G640: 苏 锵 | H640: 12 | I640: 37135 | J640: 36
A641: =ROW()-4 -> 637 | B641: G- | C641: 2980 | D641: 1 | E641: 7810298054 | F641: 岩溶――奇峰异洞的世界 | G641: 卢耀如 | H641: 15 | I641: 37500 | J641: 22
A642: =ROW()-4 -> 638 | B642: G- | C642: 4210 | D642: 1 | E642: 04210-1 | F642: 能源世界之窗 | G642: 朱亚杰等 | H642: 12.00 | I642: 37329 | J642: 30
A643: =ROW()-4 -> 639 | B643: G- | C643: 4197 | D643: 1 | E643: 04197-0 | F643: 人类认识世界的五个里程碑 | G643: 席泽宗 | H643: 15.00 | I643: 37288 | J643: 25
A644: =ROW()-4 -> 640 | B644: G- | C644: 4204 | D644: 1 | E644: 04204-7 | F644: 人类的灾难――核武器与核爆炸 | G644: 乔登江等 | H644: 12 | I644: 37438 | J644: 30
A645: =ROW()-4 -> 641 | B645: G- | C645: 4205 | D645: 1 | E645: 04205-5 | F645: 变幻流动的科学――多相流体力学 | G645: 林宗虎 | H645: 12 | I645: 37500 | J645: 28
A646: =ROW()-4 -> 642 | B646: G- | C646: 4198 | D646: 1 | E646: 04198-9 | F646: 人造小太阳――受控惯性约束聚变 | G646: 王淦昌 | H646: 15 | I646: 37438 | J646: 18
A647: =ROW()-4 -> 643 | B647: G- | C647: 4207 | D647: 1 | E647: 04207-1 | F647: 神奇的表面工程 | G647: 徐滨士 | H647: 15 | I647: 37438 | J647: 25
A648: =ROW()-4 -> 644 | B648: G- | C648: 4208 | D648: 1 | E648: 04208-X | F648: 空天技术与材料科学 | G648: 傅恒志等 | H648: 15 | I648: 37438 | J648: 22
A649: =ROW()-4 -> 645 | B649: G- | C649: 4211 | D649: 1 | E649: 04211-X | F649: 石油树结奇异果 | G649: 汪燮卿等 | H649: 15 | I649: 37530 | J649: 20
A650: =ROW()-4 -> 646 | B650: G- | C650: 4213 | D650: 1 | E650: 04213-6 | F650: 21世纪的铁路 | G650: 王梦恕等 | H650: 15 | I650: 37165 | J650: 25
A651: =ROW()-4 -> 647 | B651: G- | C651: 4216 | D651: 1 | E651: 04216-0 | F651: 教电脑识字――浅谈汉字识别 | G651: 吴佑寿 | H651: 12 | I651: 37469 | J651: 35
A652: =ROW()-4 -> 648 | B652: GG | C652: 0784 | D652: 1 | E652: 7810297848 | F652: 面对大自然的报复――防灾与减灾 | G652: 马宗晋等 | H652: 15 | I652: 37500 | J652: 22
A653: =ROW()-4 -> 649 | B653: GG | C653: 0781 | D653: 1 | E653: 7810297813 | F653: 天堂的种子――热带作物 | G653: 黄宗道 | H653: 15 | I653: 37530 | J653: 25
A654: =ROW()-4 -> 650 | B654: G- | C654: 4209 | D654: 1 | E654: 04209-8 | F654: 泥土中的铝――科技腾飞的使者 | G654: 邱竹贤 | H654: 12 | I654: 37469 | J654: 35
A655: =ROW()-4 -> 651 | B655: G- | C655: 4215 | D655: 1 | E655: 04215-2 | F655: 信息化社会的基石――计算机 | G655: 周兴铭等 | H655: 15 | I655: 37469 | J655: 18
A656: =ROW()-4 -> 652 | B656: G- | C656: 4217 | D656: 1 | E656: 04217-9 | F656: 妇女保健 | G656: 宋鸿钊等 | H656: 15 | I656: 37438 | J656: 18
A657: =ROW()-4 -> 653 | B657: GG | C657: 0803 | D657: 1 | E657: 7810298038 | F657: 神奇的地热 | G657: 汪集D等 | H657: 12 | I657: 37165 | J657: 25
A658: =ROW()-4 -> 654 | B658: G- | C658: 4206 | D658: 1 | E658: 04206-3 | F658: 模糊性――精确的另一半 | G658: 刘应明等 | H658: 12 | I658: 37196 | J658: 30
A659: =ROW()-4 -> 655 | B659: G- | C659: 4212 | D659: 1 | E659: 04212-8 | F659: 海底矿产 | G659: 金庆焕 | H659: 12 | I659: 37591 | J659: 27
A660: =ROW()-4 -> 656 | B660: G- | C660: 4203 | D660: 1 | E660: 04203-9 | H660: 15 | I660: 37438 | J660: 21
F661: 院士科普书系（第三辑）
A662: =ROW()-4 -> 658 | B662: G- | C662: 4882 | D662: 1 | E662: 04882-7 | F662: 返回式卫星 | G662: 林华宝 | H662: 12.00 | I662: 2002.1 | J662: 32
A663: =ROW()-4 -> 659 | B663: G- | C663: 4643 | D663: 1 | E663: 04643-3 | F663: 化学污染――破坏环境的元凶 | G663: 陈荣悌等 | H663: 12.00 | I663: 2002.1 | J663: 26
A664: =ROW()-4 -> 660 | B664: G- | C664: 4337 | D664: 1 | E664: 04337-X | F664: 还我大自然――地球敲响了警钟 | G664: 李星学等 | H664: 12.00 | I664: 37257 | J664: 21
A665: =ROW()-4 -> 661 | B665: G- | C665: 4856 | D665: 1 | E665: 04856-8 | F665: 石油――人类文明社会的血液 | G665: 李德生 | H665: 12.00 | I665: 37316 | J665: 30
A666: =ROW()-4 -> 662 | B666: G- | C666: 5092 | D666: 1 | E666: 05092-9 | F666: 坚韧的盾牌――中国筑城史话 | G666: 杨秀敏等 | H666: 15.00 | I666: 37316 | J666: 25
A667: =ROW()-4 -> 663 | B667: G- | C667: 4960 | D667: 1 | E667: 04960-2 | F667: 核能――无穷的能源 | G667: 欧阳予主编 | H667: 12.00 | I667: 37316 | J667: 27
A668: =ROW()-4 -> 664 | B668: G- | C668: 4917 | D668: 1 | E668: 04917-3 | F668: 21世纪的阳光产业――生态农业 | G668: 金鉴明等 | H668: 15.00 | I668: 2002.9 | J668: 20
A669: =ROW()-4 -> 665 | B669: G- | C669: 4881 | D669: 1 | E669: 04881-9 | F669: 工业发展的面包――芯片 | G669: 沈绪榜 | H669: 15.00 | I669: 2002.8 | J669: 20
A670: =ROW()-4 -> 666 | B670: G- | C670: 4905 | D670: 1 | E670: 04905-X | F670: 我们身边的超声世界 | G670: 应崇福 | H670: 15.00 | I670: 2002.8 | J670: 25
A671: =ROW()-4 -> 667 | B671: G- | C671: 5560 | D671: 1 | E671: 05560-2 | F671: 地下城市 | G671: 钱七虎等 | H671: 15.00 | I671: 2002.9 | J671: 24
A672: =ROW()-4 -> 668 | B672: G- | C672: 5062 | D672: 1 | E672: 05062-7 | F672: 生态系统浅说 | G672: 阳含熙等 | H672: 15.00 | I672: 2002.8 | J672: 23
A673: =ROW()-4 -> 669 | B673: G- | C673: 5063 | D673: 1 | E673: 05063-5 | F673: 胆石病――一个外科学家的实录 | G673: 黄志强 | H673: 15.00 | I673: 2002.8 | J673: 25
A674: =ROW()-4 -> 670 | B674: G- | C674: 5321 | E674: 05321-9 | F674: 飞行的金属 | G674: 刘业翔等 | H674: 12.00 | I674: 2002.9 | J674: 25
A675: =ROW()-4 -> 671 | B675: G- | C675: 5263 | D675: 1 | E675: 05263-8 | F675: 玻璃丝的神通――浅谈光纤通信 | G675: 赵梓森 | H675: 15.00 | I675: 2002.8 | J675: 27
A676: =ROW()-4 -> 672 | B676: G- | C676: 4939 | D676: 1 | E676: 04939-4 | F676: 黄道婆走进现代纺织大观园――纺织新技术、新工艺和新设备 | G676: 季国标等 | H676: 15.00 | I676: 2002.8 | J676: 17
A677: =ROW()-4 -> 673 | B677: G- | C677: 5264 | D677: 1 | E677: 05264-6 | F677: 射线束和材料改性 | G677: 黄祖洽 | H677: 12.00 | I677: 2002.8 | J677: 37
A678: =ROW()-4 -> 674 | B678: G- | C678: 5486 | D678: 1 | E678: 05486-X | F678: 癌症有那么可怕吗――认识癌症，为了防治 | G678: 吴 昊 | H678: 12.00 | I678: 2002.8 | J678: 37
A679: =ROW()-4 -> 675 | B679: G- | C679: 5449 | D679: 1 | E679: 05449-5 | F679: 揭开核武器的神秘面纱 | G679: 经福谦等 | H679: 15.00 | I679: 2002.8 | J679: 20
A680: =ROW()-4 -> 676 | B680: G- | C680: 5326 | D680: 1 | E680: 53262 | F680: 氮循环――维系地球生命生生不息的一个自然过程 | G680: 朱兆良等 | H680: 12.00 | I680: 2002.8 | J680: 34
A681: =ROW()-4 -> 677 | B681: G- | C681: 5322 | D681: 1 | E681: 05322-7 | F681: 探索地球内部的奥秘 | G681: 曾融生等 | H681: 12.00 | I681: 2002.9 | J681: 33
A682: =ROW()-4 -> 678 | B682: G- | C682: 5346 | D682: 1 | E682: 05346-4 | F682: 黄河――我们的母亲河 | G682: 任美锷 | H682: 12.00 | I682: 37377 | J682: 32
A683: =ROW()-4 -> 679 | B683: G- | C683: 5587 | D683: 1 | E683: 05587-4 | F683: 金矿――人类最早认识和利用的矿产 | G683: 涂光炽等 | H683: 12.00 | I683: 2002.9 | J683: 25
A684: =ROW()-4 -> 680 | B684: G- | C684: 5221 | D684: 1 | E684: 05221-2 | F684: 营造绚丽多彩的光世界――发光学趣谈 | G684: 徐叙 | H684: 15.00 | I684: 2002.9 | J684: 23
A685: =ROW()-4 -> 681 | B685: G- | C685: 5324 | D685: 1 | E685: 05324-3 | F685: 先进制造技术 | G685: 姚福生等 | H685: 15.00 | I685: 2002.8 | J685: 25
A686: =ROW()-4 -> 682 | B686: G- | C686: 5593 | D686: 1 | E686: 05593-9 | F686: 脑的奥秘 | G686: 陈宜张等 | H686: 15 | I686: 37500 | J686: 19
A687: =ROW()-4 -> 683 | B687: G- | C687: 5485 | D687: 1 | E687: 05485-1 | F687: 贵金属――周期表中一族璀璨的元素 | G687: 陈景 等 | H687: 12.00 | I687: 2002.9 | J687: 20
A688: =ROW()-4 -> 684 | B688: G- | C688: 4338 | D688: 1 | E688: 04338-8 | F688: 纺织新境界――纺织新原料与纺织品应用领域新发展 | G688: 郁铭芳等 | H688: 15.00 | I688: 2002-9 | J688: 18
A689: =ROW()-4 -> 685 | B689: G- | C689: 5319 | D689: 1 | E689: 05319-7 | F689: 农药化学 | G689: 陈茹玉等 | H689: 12.00 | I689: 2002.9 | J689: 25
A690: =ROW()-4 -> 686 | B690: G- | C690: 5592 | D690: 1 | E690: 05592-0 | F690: 工程抗震的新发展 | G690: 周锡元等 | H690: 12.00 | I690: 2002-9 | J690: 22
A691: =ROW()-4 -> 687 | B691: G- | C691: 5323 | D691: 1 | E691: 05323-5 | F691: 材料世界的天之骄子――航空材料 | G691: 曹春晓等 | H691: 12.00 | I691: 2002-9 | J691: 22
A692: =ROW()-4 -> 688 | B692: G- | C692: 4961 | D692: 1 | E692: 04961-0 | F692: 离子的喷泉――电子回旋共振离子源 | G692: 魏宝文等 | H692: 12.00 | I692: 37377 | J692: 35
A693: =ROW()-4 -> 689 | B693: G- | C693: 4959 | D693: 1 | E693: 04959-9 | F693: 大地中的宝藏――实说中国的矿产资源 | G693: 程裕淇等 | H693: 15.00 | I693: 2002.8 | J693: 25
A694: =ROW()-4 -> 690 | B694: G- | C694: 5320 | D694: 1 | E694: 05320-0 | F694: 溶剂萃取 | G694: 汪家鼎等 | H694: 12.00 | I694: 2002.8 | J694: 32
A695: =ROW()-4 -> 691 | B695: G- | C695: 5325 | D695: 1 | E695: 05325-1 | F695: 光子学技术――信息化时代的支撑技术 | G695: 王启明等 | H695: 15.00 | I695: 2002.8 | J695: 20
A696: =ROW()-4 -> 692 | B696: G- | C696: 4857 | D696: 1 | E696: 04857-6 | F696: 月球――人类走向深空的前哨站 | G696: 欧阳自远等 | H696: 15.00 | I696: 2002.5 | J696: 27
A697: =ROW()-4 -> 693 | B697: G- | C697: 5265 | D697: 1 | E697: 05265-4 | F697: 人类的诞生与进化 | G697: 吴汝康著 | H697: 15.00 | I697: 2002.5 | J697: 25
F698: 科普读物
A699: =ROW()-4 -> 695 | B699: Q- | C699: 4324 | D699: 1 | E699: 04324-8 | F699: 外星生命探索 20世纪对地球以外生命的争论 | G699: 李 经等译 | H699: 18 | I699: 37073 | J699: 16
A700: =ROW()-4 -> 696 | B700: TU | C700: 5605 | D700: 1 | E700: 05605-6 | F700: 中国民用机场集锦 | G700: 蒋作舟 | H700: 300 | I700: 37500 | J700: 4
A701: =ROW()-4 -> 697 | B701: G- | C701: 4493 | D701: 1 | E701: 04493-7 | F701: 动物世界彩绘百科全书（一、二、三、四卷） | G701: 苏 真 | H701: 168 | I701: 37165 | J701: 6
A702: =ROW()-4 -> 698 | B702: Q- | C702: 1320 | D702: 1 | E702: 01320-9 | F702: 丹顶鹤的自然保护 | G702: 马志军等 | H702: 19 | I702: 36617 | J702: 17
A703: =ROW()-4 -> 699 | B703: Z- | C703: 1352 | D703: 1 | E703: 01352-7 | F703: 中国气候变化国别研究 | G703: 研究组 | H703: 59 | I703: 36647 | J703: 7
A704: =ROW()-4 -> 700 | B704: Z- | C704: 3265 | D704: 1 | E704: 03265-3 | F704: 中国自然科学基金制度常识讲座 | G704: 刘才栓 | H704: 18 | I704: 1999 | J704: 16
A705: =ROW()-4 -> 701 | B705: G- | C705: 1509 | D705: 1 | E705: 01509-0 | F705: 中国插花（精） | G705: 北京插花艺术研究会 | H705: 48 | I705: 1994 | J705: 8
A706: =ROW()-4 -> 702 | B706: S- | C706: 2846 | D706: 1 | E706: 02846-X | F706: 切花生产技术丛书 ―― 玫瑰 | G706: 郭志刚等 | H706: 14 | I706: 1998 | J706: 20
A707: =ROW()-4 -> 703 | B707: TP | C707: 4327 | D707: 1 | E707: 04327-2 | F707: 电脑启示录（上篇）电脑的故事 | G707: 徐志伟 | H707: 15.00 | I707: 37043 | J707: 17

A1: 陆大 金

A1: 奇异的光――激光

A1: 姚建铨