F1: 六、人文社科类
F2: 1.学术专著
F3: 清华文丛
A4: =ROW()-5 -> 981 | B4: I- | C4: 0974 | D4: 5 | E4: 00974-0 | F4: 吴宓与陈寅恪―― 清华文丛之一 | G4: 吴学昭 | H4: 8 | I4: 1997 | J4: 20
A5: =ROW()-5 -> 982 | B5: I- | C5: 1191 | D5: 4 | E5: 01191-5 | F5: 陈寅恪诗集 ―― 清华文丛之二 | G5: 陈美延 | H5: 16 | I5: 1998 | J5: 17
A6: =ROW()-5 -> 983 | B6: I- | C6: 1245 | D6: 5 | E6: 01245-8 | F6: 文学与人生―― 清华文丛之三 | G6: 吴 宓 | H6: 15 | I6: 36617 | J6: 17
A7: =ROW()-5 -> 984 | B7: K- | C7: 1709 | D7: 4 | E7: 01709-3 | F7: 古史新证――王国维最后的讲义 ―清华文丛之五 | G7: 王国维 | H7: 20 | I7: 36617 | J7: 12
A8: =ROW()-5 -> 985 | B8: I- | C8: 1198 | D8: 3 | E8: 01198-2 | F8: 浦江清文史杂文集―― 清华文丛之六 | G8: 浦汉明 | H8: 16.8 | I8: 1997 | J8: 16
A9: =ROW()-5 -> 986 | B9: K- | C9: 1594 | D9: 4 | E9: 01594-5 | F9: 李济与清华 ―― 清华文丛之七 | G9: 李光谟 | H9: 18 | I9: 1997 | J9: 16
A10: =ROW()-5 -> 987 | B10: K- | C10: 3073 | D10: 1 | E10: 03073-1 | F10: 清华人文学科年谱 ―― 清华文丛之八 | G10: 齐家莹 | H10: 25 | I10: 1999 | J10: 11
F11: 新清华文丛
A12: =ROW()-5 -> 989 | B12: I- | C12: 2546 | D12: 1 | E12: 02546-0 | F12: 新清华文丛之一 ―― 释古与清华学派 | G12: 徐葆耕 | H12: 12 | I12: 1997 | J12: 20
A13: =ROW()-5 -> 990 | B13: I- | C13: 2902 | D13: 1 | E13: 02902-4 | F13: 新清华文丛之二――中国宗教与文学论集 | G13: 葛兆光 | H13: 13.5 | I13: 1998 | J13: 20
A14: =ROW()-5 -> 991 | B14: I- | C14: 2975 | D14: 1 | E14: 02975-X | F14: 新清华文丛之三――现代文学经典 ：症候式分析 | G14: 蓝棣之 | H14: 13.5 | I14: 1998 | J14: 20
A15: =ROW()-5 -> 992 | B15: K- | C15: 2963 | D15: 1 | E15: 02963-6 | F15: 新清华文丛之四―― 四海寻珍 | G15: 李学勤 | H15: 18.5 | I15: 1998 | J15: 17
A16: =ROW()-5 -> 993 | B16: I- | C16: 3101 | D16: 1 | E16: 03101-0 | F16: 新清华文丛之五――结构-解构视角 | G16: 郑 敏 | H16: 18 | I16: 1998 | J16: 20
A17: =ROW()-5 -> 994 | B17: I- | C17: 5650 | D17: 1 | E17: 05650-1 | F17: 和而不同――中国现代文学片论 | G17: 解志熙 | H17: 22 | I17: 37500 | J17: 20
A18: =ROW()-5 -> 995 | B18: I- | C18: 5673 | D18: 1 | E18: 05673-0 | F18: 小说叙事研究 | G18: 格 非 | H18: 17 | I18: 37530 | J18: 18
A19: =ROW()-5 -> 996 | B19: I- | C19: 5672 | D19: 1 | E19: 05672-1 | F19: 现代诗歌理论：渊源与走势 | G19: 蓝棣之 | H19: 17 | I19: 37530
F20: 20世纪人文学术史研究丛书
A21: =ROW()-5 -> 998 | B21: I- | C21: 5296 | D21: 1 | E21: 05296-4 | F21: 综合创新－－张岱年先生学记 | G21: 刘鄂培主编 | H21: 30 | I21: 37530
A22: =ROW()-5 -> 999 | B22: I- | C22: 5503 | D22: 1 | E22: 05503-3 | F22: 知识、逻辑与价值－－中国新实在论思潮的兴起 | G22: 胡伟希 | H22: 21 | I22: 37530
A23: =ROW()-5 -> 1000 | B23: I- | C23: 5186 | D23: 1 | E23: 05186-0 | F23: 20世纪中国历史文献研究 | G23: 王子今 | H23: 33 | I23: 37530
F24: 北京市社科理论著作出版基金资助项目
A25: =ROW()-5 -> 1002 | B25: F- | C25: 4333 | D25: 1 | E25: 04333-7 | F25: 轿车交通批判 | G25: 王蒲生 | H25: 15 | I25: 37073 | J25: 25
A26: =ROW()-5 -> 1003 | B26: F- | C26: 4422 | D26: 1 | E26: 04422-8 | F26: 自组织方法论研究 | G26: 吴 彤 | H26: 16 | I26: 37073 | J26: 20
A27: =ROW()-5 -> 1004 | B27: B- | C27: 4420 | D27: 1 | E27: 04420-1 | F27: 深层生态学思想研究 | G27: 雷 毅 | H27: 15 | I27: 37073 | J27: 25
A28: =ROW()-5 -> 1005 | B28: C- | C28: 4807 | D28: 1 | E28: 04807-X | F28: 失业下岗问题对比研究 | G28: 李强 等 | H28: 20 | I28: 37165 | J28: 14
A29: =ROW()-5 -> 1006 | B29: F- | C29: 2180 | D29: 1 | E29: 02180-5 | F29: 行政组织管理 | G29: 吴 刚 | H29: 17 | I29: 36495 | J29: 18
A30: =ROW()-5 -> 1007 | B30: I- | C30: 3572 | D30: 1 | E30: 03572-5 | F30: 三曹与中国诗史 | G30: 孙明君 | H30: 19.5 | I30: 36465 | J30: 18
A31: =ROW()-5 -> 1008 | B31: G- | C31: 3437 | D31: 1 | E31: 03437-0 | F31: 高等教育与人材市场 | G31: 蓝劲松 | H31: 12.8 | I31: 36373 | J31: 25
A32: =ROW()-5 -> 1009 | B32: B- | C32: 3569 | D32: 1 | E32: 03569-5 | F32: 精神、自由与历史――克罗齐历史哲学研究 | G32: 彭 刚 | H32: 8.8 | I32: 36342 | J32: 35
A33: =ROW()-5 -> 1010 | B33: G- | C33: 2227 | D33: 1 | E33: 02227-5 | F33: 通识教育―― 一种大学教育观 | G33: 李曼丽 | H33: 18 | I33: 36557 | J33: 20
F34: 社会科学类专著
A35: =ROW()-5 -> 1012 | B35: I- | C35: 5257 | D35: 1 | E35: 05257-3 | F35: 清华校园文学论稿（1911-1949） | G35: 张玲霞 | H35: 28 | I35: 37377 | J35: 12
A36: =ROW()-5 -> 1013 | B36: G- | C36: 1272 | D36: 1 | E36: 01272-5 | F36: 全球化与大众传媒：冲突・融合・互动 | G36: 尹鸿等 | H36: 28 | I36: 37347 | J36: 15
A37: =ROW()-5 -> 1014 | B37: K- | C37: 5239 | D37: 1 | E37: 05239-5 | F37: 清华大学思想文化研究所集刊（第2辑） | G37: 廖名春 | H37: 29 | I37: 37316 | J37: 17
A38: =ROW()-5 -> 1015 | B38: D- | C38: 4455 | D38: 1 | E38: 04455-4 | F38: 当代中国改革与发展――跨世纪回顾与前瞻 | G38: 胡天赐等 | H38: 56 | I38: 37104 | J38: 7
A39: =ROW()-5 -> 1016 | B39: K- | C39: 4710 | D39: 1 | E39: 04710-3 | F39: 历史理性批判论集（精） | G39: 何兆武 | H39: 45 | I39: 37165 | J39: 5
A40: =ROW()-5 -> 1017 | B40: K- | C40: 3865 | D40: 1 | E40: 03865-1 | F40: 二战中苏（中俄）关系的演变与发展 | G40: 王 奇 | H40: 16 | I40: 36678 | J40: 22
A41: =ROW()-5 -> 1018 | B41: K- | C41: 4315 | D41: 1 | E41: 04315-9 | F41: 戊戌变法史述论稿（精） | G41: 王宪明等 | H41: 59 | I41: 37043 | J41: 6
A42: =ROW()-5 -> 1019 | B42: I- | C42: 4508 | D42: 1 | E42: 04508-6 | F42: 新文学史 I | G42: 王 宁 | H42: 29 | I42: 37043 | J42: 8
A43: =ROW()-5 -> 1020 | B43: K- | C43: 4990 | D43: 1 | E43: 04990-4 | F43: 科学与爱国――严复思想新探 | G43: 习近平 | H43: 38 | I43: 37196 | J43: 6
A44: =ROW()-5 -> 1021 | B44: Z- | C44: 3668 | D44: 1 | E44: 03668-3 | F44: 严复思想新论 | G44: 刘桂生等 | H44: 26 | I44: 36526 | J44: 13
A45: =ROW()-5 -> 1022 | B45: I- | C45: 1185 | D45: 1 | E45: 01185-0 | F45: 清华汉学研究（第3辑） | G45: 葛兆光 | H45: 16 | I45: 36586 | J45: 20
A46: =ROW()-5 -> 1023 | B46: I- | C46: 2624 | D46: 1 | E46: 02624-6 | F46: 清华汉学研究（第2辑） | G46: 葛兆光 | H46: 16 | I46: 1997 | J46: 16
A47: =ROW()-5 -> 1024 | B47: Z- | C47: 3210 | D47: 1 | E47: 03210-6 | F47: 法国汉学（第3辑） | G47: 丛书编委会 | H47: 28 | I47: 1999 | J47: 16
A48: =ROW()-5 -> 1025 | B48: Z- | C48: 2672 | D48: 1 | E48: 02672-6 | F48: 法国汉学（第2辑） | G48: [法]龙巴尔[中]李学勤 | H48: 28 | I48: 1997 | J48: 13
A49: =ROW()-5 -> 1026 | B49: Z- | C49: 2179 | D49: 1 | E49: 02179-1 | F49: 法国汉学（第1辑） | G49: [法]龙巴尔[中]李学勤 | H49: 26 | I49: 1997 | J49: 12
A50: =ROW()-5 -> 1027 | B50: TU | C50: 3401 | D50: 1 | E50: 03401-X | F50: 西方戏剧-剧场史 (上、下) | G50: 李道增 | H50: 180 | I50: 1999 | J50: 2
A51: =ROW()-5 -> 1028 | B51: D- | C51: 3409 | D51: 1 | E51: 03409-5 | F51: 美国公务员制和道德规范 | G51: 马国泉 | H51: 12 | I51: 36281 | J51: 27
A52: =ROW()-5 -> 1029 | B52: B- | C52: 1970 | D52: 3 | E52: 01970-3 | F52: 系统论 ―― 系统科学哲学 | G52: 魏宏森等 | H52: 20 | I52: 1999 | J52: 11
A53: =ROW()-5 -> 1030 | B53: Z- | C53: 1971 | D53: 1 | E53: 01971-1 | F53: 戴震全集(五) | G53: 戴震研究会 | H53: 29 | I53: 1997 | J53: 9
A54: =ROW()-5 -> 1031 | B54: Z- | C54: 2877 | D54: 1 | E54: 02877-X | F54: 戴震全集(六) | G54: 戴震研究会 | H54: 38 | I54: 36281 | J54: 6
A55: =ROW()-5 -> 1032 | B55: C- | C55: 5520 | D55: 1 | E55: 05520-3 | F55: 感性与智慧 | G55: [日]秋野浩基 | H55: 22 | I55: 37408 | J55: 8
A56: =ROW()-5 -> 1033 | B56: K- | C56: 5680 | D56: 1 | E56: 05680-3 | F56: 航天情―― 永远的眷恋 | G56: 彭洁青 | H56: 16 | I56: 37500 | J56: 20
A57: =ROW()-5 -> 1034 | B57: I- | C57: 5456 | D57: 1 | E57: 05456-8 | F57: 我的人生之路 | G57: 张光斗 | H57: 90 | I57: 37347 | J57: 10
A58: =ROW()-5 -> 1035 | B58: G- | C58: 1446 | D58: 1 | E58: 01446- | F58: 认知科学与广义进化论 | G58: 赵南元 | H58: 16.8 | I58: 1996 | J58: 11
A59: =ROW()-5 -> 1036 | B59: N- | C59: 5187 | D59: 1 | E59: 05187-9 | F59: 认知科学揭秘（第二版） | G59: 赵南元 | H59: 23 | I59: 37377 | J59: 13
A60: =ROW()-5 -> 1037 | B60: H- | C60: 5788 | D60: 1 | E60: 05788-5 | F60: 计算语言学 | G60: 刘颖 | H60: 22 | I60: 37530 | J60: 13
A61: =ROW()-5 -> 1038 | B61: F- | C61: 5720 | D61: 1 | E61: 05720-6 | F61: 金融发展与经济增长――理论、实证与政策 | G61: 韩廷春 | H61: 16 | I61: 37500 | J61: 26
F62: *本书第一版获第九届中国图书奖
F63: 清华科技与社会丛书
A64: =ROW()-5 -> 1041 | B64: B- | C64: 5764 | D64: 1 | E64: 05764-8 | F64: 赛博空间的哲学探索 | G64: 曾国屏 | H64: 20.00 | I64: 37530 | J64: 16
F65: 2.法律图书
F66: 清华法律图书
A67: =ROW()-5 -> 1044 | B67: D- | C67: 3989 | D67: 1 | E67: 03989-5 | F67: 法律基础教程* | G67: 王振民等 | H67: 16 | I67: 37469 | J67: 18
A68: =ROW()-5 -> 1045 | B68: D- | C68: 4803 | D68: 1 | E68: 04803-7 | F68: 瑞典的议会监察专员 | G68: 程洁 译 | H68: 15 | I68: 37226 | J68: 26
A69: =ROW()-5 -> 1046 | B69: D- | C69: 5364 | D69: 1 | E69: 05364-2 | F69: 清华法学文库：对抗与判定――日本民事诉讼的基本结构 | G69: 王亚新 | H69: 38 | I69: 37347 | J69: 11
A70: =ROW()-5 -> 1047 | B70: D- | C70: 5634 | D70: 1 | E70: 05634-X | F70: 清华法学文库：中央与特别行政区关系――一种法治结构的解析 | G70: 王振民 | H70: 26 | I70: 37500 | J70: 12
A71: =ROW()-5 -> 1048 | B71: D- | C71: 3377 | D71: 1 | E71: 03377-3 | F71: 外国刑法纲要* | G71: 张明楷 | H71: 32 | I71: 36281 | J71: 7
A72: =ROW()-5 -> 1049 | B72: D- | C72: 3692 | D72: 1 | E72: 03692-6 | F72: 德国行政法* | G72: 于 安 | H72: 16 | I72: 36434 | J72: 20
A73: =ROW()-5 -> 1050 | B73: D- | C73: 0902 | D73: 1 | E73: 00902-3 | F73: 诉讼构架与程式――民事诉讼的法理分析* | G73: 张卫平 | H73: 32 | I73: 37337 | J73: 11
A74: =ROW()-5 -> 1051 | B74: D- | C74: 4404 | D74: 1 | E74: 04404-X | F74: 单位刑事责任论* | G74: 黎 宏 | H74: 22 | I74: 37012 | J74: 15
A75: =ROW()-5 -> 1052 | B75: D- | C75: 0962 | D75: 1 | E75: 00962-7 | F75: 金文简帛中的刑法思想* | G75: 崔永东 | H75: 12.8 | I75: 36617 | J75: 25
A76: =ROW()-5 -> 1053 | B76: D- | C76: 4348 | D76: 1 | E76: 04348-5 | F76: 司法公证与司法改革研究综述* | G76: 胡夏冰等 | H76: 36 | I76: 37043 | J76: 10
B77: * | C77: 上述六本法律图书为清华大学法学院教材。
A78: =ROW()-5 -> 1055 | B78: D- | C78: 0694 | D78: 1 | E78: 00694-6 | F78: 清华法治论衡 （1） | G78: 高鸿钧等 | H78: 38 | I78: 36861 | J78: 10
A79: =ROW()-5 -> 1056 | B79: D- | C79: 4991 | D79: 1 | E79: 04991-2 | F79: 清华法治论衡（第二辑） | G79: 高鸿钧主编 | H79: 39.00 | I79: 2001.12 | J79: 9
A80: =ROW()-5 -> 1057 | B80: D- | C80: 3121 | D80: 2 | E80: 03121-5 | F80: 清华法律评论 (第1辑) | G80: 马俊驹主编 | H80: 29.5 | I80: 1999 | J80: 9
A81: =ROW()-5 -> 1058 | B81: D- | C81: 3419 | D81: 1 | E81: 03419-2 | F81: 清华法律评论 (第2辑) | G81: 马俊驹主编 | H81: 43.6 | I81: 36739 | J81: 7
A82: =ROW()-5 -> 1059 | B82: D- | C82: 1117 | D82: 1 | E82: 01117-6 | F82: 清华法律评论 (第3辑) | G82: 马俊驹主编 | H82: 36 | I82: 36647 | J82: 8
A83: =ROW()-5 -> 1060 | B83: D- | C83: 5071 | D83: 1 | E83: 05071-6 | F83: 清华法律评论 (第4辑) | G83: 马俊驹主编 | H83: 31 | I83: 37316 | J83: 9
F84: 法律硕士入学联考辅导丛书
A85: =ROW()-5 -> 1062 | B85: D- | C85: 0741 | D85: 1 | E85: 00741-1 | F85: 刑法学模拟试题 | G85: 王世洲 | H85: 17 | I85: 36800 | J85: 22
A86: =ROW()-5 -> 1063 | B86: D- | C86: 0725 | D86: 1 | E86: 00725-X | F86: 综合模拟试题 | G86: 梁海静 | H86: 12 | I86: 36800 | J86: 35
A87: =ROW()-5 -> 1064 | B87: D- | C87: 0726 | D87: 1 | E87: 00726-8 | F87: 民法学模拟试题 | G87: 苏号朋 | H87: 16 | I87: 36800 | J87: 25
F88: 清华法学文库法治研究系列
A89: =ROW()-5 -> 1066 | B89: D- | C89: 5070 | D89: 1 | E89: 05070-8 | F89: 法治视野中的刑法客观主义 | G89: 周光权 | H89: 22 | I89: 37316 | J89: 16
A90: =ROW()-5 -> 1067 | B90: D- | C90: 4543 | D90: 2 | E90: 04543-7 | F90: 法治与政治权威 | G90: 程燎原等 | H90: 23 | I90: 37104 | J90: 15
F91: 3.大学教材
F92: 社会科学类教材
A93: =ROW()-5 -> 1070 | B93: K- | C93: 3809 | D93: 2 | E93: 03809-0 | F93: 毛泽东与20世纪中国* | G93: 朱育和等 | H93: 19.5 | I93: 37408 | J93: 12
B94: *本书系清华大学“毛泽东思想概论”课主干教材
A95: =ROW()-5 -> 1072 | B95: K- | C95: 2006 | D95: 5 | E95: 02006-X | F95: 中国革命史通论（第2版） | G95: 朱育和等 | H95: 18.8 | I95: 36557 | J95: 10
A96: =ROW()-5 -> 1073 | B96: K- | C96: 2032 | D96: 3 | E96: 02032-9 | F96: 中国革命史通论逻辑图集成 | G96: 朱育和 | H96: 4 | I96: 1997 | J96: 100
A97: =ROW()-5 -> 1074 | B97: G- | C97: 3459 | D97: 1 | E97: 03459-1 | F97: 应用图书馆学教程 | G97: 郭依群 | H97: 8.8 | I97: 36312 | J97: 30
A98: =ROW()-5 -> 1075 | B98: G- | C98: 4453 | D98: 1 | E98: 04453-8 | F98: 舆论传播 | G98: 刘建明 | H98: 36 | I98: 37043 | J98: 7
A99: =ROW()-5 -> 1076 | B99: G- | C99: 4257 | D99: 1 | E99: 04257-8 | F99: 网络媒体概论 | G99: 匡文波 | H99: 17 | I99: 36951 | J99: 16
A100: =ROW()-5 -> 1077 | B100: G- | C100: 4629 | D100: 1 | E100: 04629-8 | F100: 思想道德修养（学生用书） | G100: 刘书林 | H100: 12 | I100: 37408 | J100: 22
A101: =ROW()-5 -> 1078 | B101: D- | C101: 5674 | D101: 1 | E101: 05674-9 | F101: 思想道德修养（教师用书） | G101: 刘书林 | H101: 23 | I101: 37469 | J101: 11
A102: =ROW()-5 -> 1079 | B102: Z- | C102: 2461 | D102: 1 | E102: 02461-8 | F102: 科技传播导论 | G102: 孙宝寅 | H102: 9.6 | I102: 1997 | J102: 20
A103: =ROW()-5 -> 1080 | B103: G- | C103: 2372 | D103: 2 | E103: 02372-7 | F103: 科学信息检索 | G103: 孙平等 | H103: 9.5 | I103: 36739 | J103: 22
A104: =ROW()-5 -> 1081 | B104: H- | C104: 1443 | D104: 3 | E104: 01443-4 | F104: 大学生音乐知识与赏析 | G104: 清华音乐 | H104: 11 | I104: 36739 | J104: 15
A105: =ROW()-5 -> 1082 | B105: G- | C105: 5330 | D105: 1 | E105: 05330-8 | F105: 军事理论教程 | G105: 王和中等 | H105: 16 | I105: 37347 | J105: 14
A106: =ROW()-5 -> 1083 | B106: G- | C106: 5788 | D106: 1 | E106: 05788-5 | F106: 计算语言学 | G106: 刘颖 | H106: 22 | I106: 37530 | J106: 13
A107: =ROW()-5 -> 1084 | B107: G- | C107: 5949 | D107: 1 | E107: 05949-3 | F107: 初为记者 | G107: 孙静惟 | H107: 17 | I107: 37561
F108: 清华传播译丛
A109: =ROW()-5 -> 1086 | B109: G- | C109: 4813 | D109: 1 | E109: 04813-4 | F109: 清华传播译丛――新媒介与创新思维 | G109: 熊澄宇等译 | H109: 29.8 | I109: 37196 | J109: 6
A110: =ROW()-5 -> 1087 | B110: P- | C110: 4158 | D110: 1 | E110: 7900641580 | F110: 清华传播译丛――数字媒体技术与应用(配光盘） | G110: 熊澄宇等译 | H110: 23.5 | I110: 37316 | J110: 10
A111: =ROW()-5 -> 1088 | B111: G- | C111: 5191 | D111: 1 | E111: 05191-7 | F111: 清华传播译丛――软边缘：信息革命的历史与未来 | G111: 熊澄宇等译 | H111: 25 | I111: 37350 | J111: 10
A112: =ROW()-5 -> 1089 | B112: G- | C112: 5338 | D112: 1 | E112: 05338-3 | F112: 清华传播译丛――今日媒介：信息时代的传播媒介 | G112: 熊澄宇等译 | H112: 42 | I112: 37350 | J112: 5
A113: =ROW()-5 -> 1090 | B113: D- | C113: 5633 | D113: 1 | E113: 05633-1 | F113: 清华传播译丛――美国大众传播法：判例评析（上、下）（第六版） | G113: 梁宁等译 | H113: 89 | I113: 37530 | J113: 6
F114: 新闻与传播系列教材・英文原版系列
A115: =ROW()-5 -> 1092 | B115: G- | C115: 5416 | D115: 1 | E115: 05416-9 | F115: 娱乐产业经济学――财务分析指南（第五版） | G115: Harold L.Vogel | H115: 68 | I115: 37377 | J115: 5
F116: 清华大学专门史系列教材
A117: =ROW()-5 -> 1094 | B117: K- | C117: 5030 | D117: 1 | E117: 05030-9 | F117: 古代中国社会与文化十讲 | G117: 葛兆光 | H117: 25 | I117: 37257 | J117: 10
F118: 清华大学中国经济史学丛书
A119: =ROW()-5 -> 1096 | B119: K- | C119: 5299 | D119: 1 | E119: 05299-9 | F119: 理论、方法、发展趋势――中国经济史研究新探 | G119: 李伯重 | H119: 20 | I119: 37469 | J119: 15
A120: =ROW()-5 -> 1097 | B120: F- | C120: 5842 | D120: 1 | E120: 05842-3 | F120: 中国近代经济史教程 | G120: 陈争平等 | H120: 17 | I120: 37500 | J120: 15
F121: 清华公共管理译丛
A122: =ROW()-5 -> 1099 | B122: C- | C122: 5505 | D122: 1 | E122: 05505-X | F122: 理解和管理公共组织(第2版) (Understanding and Managing Public Organization) | G122: [美]海尔.G.瑞尼 | H122: 32.6 | I122: 37500 | J122: 9
A123: =ROW()-5 -> 1100 | B123: F- | C123: 5506 | D123: 1 | E123: 05506-8 | F123: 研究与开发政策的经济学(Economics of R&D Policy) | G123: [美]乔治 | H123: 18 | I123: 37500 | J123: 19
A124: =ROW()-5 -> 1101 | B124: F- | C124: 5504 | D124: 1 | E124: 05504-1 | F124: 公共和非营利性组织的人力资源管理(Human Resources Management for Public and NonProfit Organizations) | G124: Joan E.Pynes | H124: 22 | I124: 37530 | J124: 14
A125: =ROW()-5 -> 1102 | B125: F- | C125: 5723 | D125: 1 | E125: 05723－0 | F125: 公共预算系统（第6版） | G125: 美〕罗伯特.李 罗纳德.约翰逊 | H125: 36 | I125: 37500
F126: 教育部大学生文化素质教育书系
A127: 本书系是教育部高等教育司组织编写的“大学生文化素质教育书系”的一部分。
A128: =ROW()-5 -> 1105 | B128: B- | C128: 3236 | D128: 1 | E128: 03236-X | F128: 中国古代人生哲学 | G128: 钱 逊 | H128: 13.6 | I128: 1998 | J128: 18
A129: =ROW()-5 -> 1106 | B129: F- | C129: 4414 | D129: 1 | E129: 04414-7 | F129: 知识经济学导论 | G129: 雷家马肃等 | H129: 20 | I129: 37135 | J129: 17
A130: =ROW()-5 -> 1107 | B130: P- | C130: 2583 | D130: 1 | E130: 7900625836 | F130: 经济管理基础（配软盘） | G130: 韩伯棠主编 | H130: 35 | I130: 37469 | J130: 10
A131: =ROW()-5 -> 1108 | B131: K- | C131: 5164 | D131: 1 | E131: 05164-X | F131: 近代中国的民族觉醒 | G131: 行龙さ | H131: 16 | I131: 37316 | J131: 20
F132: 清华大学文化素质教育丛书
A133: =ROW()-5 -> 1110 | B133: B- | C133: 5436 | D133: 1 | E133: 05436-3 | F133: 西方哲学精神 | G133: 何兆武 | H133: 12 | I133: 37408 | J133: 28
A134: =ROW()-5 -> 1111 | B134: I- | C134: 5497 | D134: 1 | E134: 05497-5 | F134: 永远的乌托邦――西方文学名著导读 | G134: 曹莉 | H134: 13 | I134: 37408 | J134: 23
A135: =ROW()-5 -> 1112 | B135: I- | C135: 5480 | D135: 1 | E135: 05480-0 | F135: 西方文学――心灵的历史 | G135: 徐葆耕 | H135: 16 | I135: 37408 | J135: 19
A136: =ROW()-5 -> 1113 | B136: I- | C136: 5450 | D136: 1 | E136: 05450-9 | F136: 咫尺千里――明清小说研究 | G136: 丁夏 | H136: 13 | I136: 37409 | J136: 22
A137: =ROW()-5 -> 1114 | B137: I- | C137: 5481 | D137: 1 | E137: 05481-9 | F137: 万川一月――中国古代散文史 | G137: 杨民 | H137: 13 | I137: 37410 | J137: 23
A138: =ROW()-5 -> 1115 | B138: I- | C138: 0780 | D138: 2 | E138: 00780-2 | F138: 昨夜星辰――中国古典诗歌品鉴 | G138: 孙明君 | H138: 13 | I138: 37408 | J138: 24
A139: =ROW()-5 -> 1116 | B139: I- | C139: 5451 | D139: 1 | E139: 05451-7 | F139: 探骊寻珠――二十世纪外国文学名著导读 | G139: 张玲霞 | H139: 13 | I139: 37408 | J139: 24
A140: =ROW()-5 -> 1117 | B140: K- | C140: 5502 | D140: 1 | E140: 05502-5 | F140: 文物精品与文化中国 | G140: 彭林 | H140: 13 | I140: 37408 | J140: 22
A141: =ROW()-5 -> 1118 | B141: G- | C141: 3628 | D141: 2 | E141: 03628-4 | F141: 众妙之门 ―― 中国文化名著导读 | G141: 张岂之等 | H141: 13 | I141: 37404 | J141: 27
F142: 4.文化教育读物
F143: 了解中国丛书
A144: =ROW()-5 -> 1121 | B144: K- | C144: 2571 | D144: 1 | E144: 02571-1 | F144: 封闭与开放 | G144: 朱育和 | H144: 6.8 | I144: 1997 | J144: 30
A145: =ROW()-5 -> 1122 | B145: D- | C145: 4628 | D145: 1 | E145: 04628-X | F145: 中国政府架构 | G145: 夏 海 | H145: 12 | I145: 37135 | J145: 30
A146: =ROW()-5 -> 1123 | B146: D- | C146: 4651 | D146: 1 | E146: 04651-4 | F146: 中国社会保障制度改革 | G146: 宋晓梧 | H146: 12 | I146: 37165 | J146: 25
A147: =ROW()-5 -> 1124 | B147: D- | C147: 4872 | D147: 1 | E147: 04872-X | F147: 中国公务员制度 | G147: 溪 流 | H147: 13 | I147: 37408 | J147: 30
A148: =ROW()-5 -> 1125 | B148: F- | C148: 4630 | D148: 1 | E148: 04630-1 | F148: 紧缩与扩张――中国经济宏观调控模式选择 | G148: 吴 军 | H148: 15 | I148: 37165 | J148: 23
A149: =ROW()-5 -> 1126 | B149: C- | C149: 2703 | D149: 1 | E149: 02703-X | F149: 中国人口的现状和对策 | G149: 邬沧萍等 | H149: 6 | I149: 1998 | J149: 30
A150: =ROW()-5 -> 1127 | B150: F- | C150: 2742 | D150: 1 | E150: 02742-0 | F150: 改革与开放中的中国金融业 | G150: 狄卫平等 | H150: 9 | I150: 1998 | J150: 20
A151: =ROW()-5 -> 1128 | B151: TV | C151: 2969 | D151: 1 | E151: 02969-5 | F151: 长江与三峡工程 | G151: 张仁 | H151: 5 | I151: 1998 | J151: 40
A152: =ROW()-5 -> 1129 | B152: F- | C152: 2584 | D152: 1 | E152: 02584-4 | F152: 中国区域经济差异及其对策 | G152: 胡兆量等 | H152: 6.5 | I152: 1997 | J152: 30
A153: =ROW()-5 -> 1130 | B153: H- | C153: 2597 | D153: 1 | E153: 02597-5 | F153: 中国语文的时代演进 | G153: 周有光 | H153: 7 | I153: 1997 | J153: 25
F154: 社会科学类读物
A155: =ROW()-5 -> 1132 | B155: G- | C155: 1350 | D155: 1 | E155: 01350-0 | F155: 心理咨询导论 | G155: 于鲁文 | H155: 19.5 | I155: 36708 | J155: 16
A156: =ROW()-5 -> 1133 | B156: G- | C156: 4554 | D156: 1 | E156: 04554-2 | F156: 香港高校学生辅导 | G156: 樊富珉等 | H156: 24 | I156: 37104 | J156: 14
A157: =ROW()-5 -> 1134 | B157: G- | C157: 4614 | D157: 1 | E157: 04614-X | F157: 21世纪教育督导人员与中小学校长培训教材――中小学校督导评估方案选编 | G157: 国家教育督导团办公室 | H157: 38 | I157: 37404 | J157: 6
A158: =ROW()-5 -> 1135 | B158: G- | C158: 5303 | D158: 1 | E158: 05303-0 | F158: 中小学校课程改革参考书―中小学校课程开发与示例 | G158: 周韫玉等 | H158: 52 | I158: 37404 | J158: 6
A159: =ROW()-5 -> 1136 | B159: G- | C159: 2394 | D159: 1 | E159: 02394-8 | F159: 团体咨询的理论与实践――大学心理咨询与教育指导丛书 | G159: 樊富珉 | H159: 15 | I159: 37469 | J159: 20
A160: =ROW()-5 -> 1137 | B160: G- | C160: 2583 | D160: 2 | E160: 02583-5 | F160: 大学生心理健康与发展 | G160: 樊富珉 | H160: 12.5 | I160: 37333 | J160: 15
A161: =ROW()-5 -> 1138 | B161: G- | C161: 2648 | D161: 1 | E161: 02648-3 | F161: 大学德育新探 | G161: 林 泰 | H161: 16 | I161: 1997 | J161: 16
A162: =ROW()-5 -> 1139 | B162: G- | C162: 1065 | D162: 1 | E162: 01065-X | F162: 校园文化与人才培养 | G162: 张德 等 | H162: 18 | I162: 37135 | J162: 22
A163: =ROW()-5 -> 1140 | B163: G- | C163: 1060 | D163: 1 | E163: 01060-9 | F163: 青年质量学 | G163: 高 成 | H163: 20 | I163: 36678 | J163: 15
A164: =ROW()-5 -> 1141 | B164: Z- | C164: 2045 | D164: 2 | E164: 02045-0 | F164: 冯友兰先生百年诞辰纪念文集 | G164: 冯钟璞等 | H164: 29.5 | I164: 1997 | J164: 10
A165: =ROW()-5 -> 1142 | B165: G- | C165: 3157 | D165: 1 | E165: 03157-6 | F165: 蒋南翔教育思想研究 | G165: 本书编委会 | H165: 20 | I165: 36373 | J165: 15
A166: =ROW()-5 -> 1143 | B166: G- | C166: 3402 | D166: 1 | E166: 03402-8 | F166: 高景德纪念文集 | G166: 本书编委会 | H166: 32 | I166: 1999 | J166: 13
A167: =ROW()-5 -> 1144 | B167: G- | C167: 0843 | D167: 1 | E167: 00834-5 | F167: 中国高等教育的改革与发展 | G167: 方惠坚等 | H167: 15 | I167: 36923 | J167: 20
A168: =ROW()-5 -> 1145 | B168: G- | C168: 4981 | D168: 1 | E168: 04981-5 | F168: 中国科技运行论 | G168: 丁厚德 | H168: 16 | I168: 37226 | J168: 21
A169: =ROW()-5 -> 1146 | B169: I- | C169: 2510 | D169: 1 | E169: 02510-X | F169: 归国谣―― 无弦曲合集(精) | G169: 黄 绮 | H169: 28 | I169: 1997 | J169: 7
A170: =ROW()-5 -> 1147 | B170: H- | C170: 2689 | D170: 1 | E170: 02689-0 | H170: 15 | I170: 1998 | J170: 20
A171: =ROW()-5 -> 1148 | B171: X- | C171: 3012 | D171: 1 | E171: 03012-X | F171: 行云流水 | G171: 顾毓 | H171: 25 | I171: 1998 | J171: 14
A172: =ROW()-5 -> 1149 | B172: B- | C172: 2697 | D172: 1 | E172: 02697-1 | F172: 孟子选讲 | G172: 刘鄂培 | H172: 16.8 | I172: 1998 | J172: 13
A173: =ROW()-5 -> 1150 | B173: B- | C173: 2598 | D173: 1 | E173: 02598-3 | F173: 孟子大传(精) | G173: 刘鄂培 | H173: 29.8 | I173: 1998 | J173: 9
A174: =ROW()-5 -> 1151 | B174: Z- | C174: 4335 | D174: 1 | E174: 04335-3 | F174: 中国高校科技进展年度报告（2000） | G174: 教育部科学技术司 | H174: 138 | I174: 37043 | J174: 10
F175: 中 学 辅 导
A176: =ROW()-5 -> 1153 | B176: G- | C176: 2102 | D176: 1 | E176: 02102-3 | F176: “3+X” 高考指南 | G176: 吕静锋等 | H176: 18 | I176: 36434 | J176: 18
A177: =ROW()-5 -> 1154 | B177: G- | C177: 1986 | D177: 2 | E177: 01986-X | F177: 决胜高考（语文） ―― 清华大学附属中学考前指导 | G177: 本教研室 | H177: 12 | I177: 36466 | J177: 17
A178: =ROW()-5 -> 1155 | B178: G- | C178: 2020 | D178: 2 | E178: 02020-5 | F178: 决胜高考（数学） ―― 清华大学附属中学考前指导 | G178: 本教研室 | H178: 15 | I178: 36467 | J178: 12
A179: =ROW()-5 -> 1156 | B179: G- | C179: 2069 | D179: 2 | E179: 02069-8 | F179: 决胜高考（英语） ―― 清华大学附属中学考前指导 | G179: 本教研室 | H179: 13 | I179: 36468 | J179: 14
A180: =ROW()-5 -> 1157 | B180: G- | C180: 1956 | D180: 2 | E180: 01956-8 | F180: 决胜高考（物理） ―― 清华大学附属中学考前指导 | G180: 本教研室 | H180: 12 | I180: 36469 | J180: 15
A181: =ROW()-5 -> 1158 | B181: G- | C181: 2077 | D181: 1 | E181: 02077-9 | F181: 决胜高考（化学） ―― 清华大学附属中学考前指导 | G181: 本教研室 | H181: 13 | I181: 36470 | J181: 13
A182: =ROW()-5 -> 1159 | B182: G- | C182: 2126 | D182: 2 | E182: 02126-0 | F182: 决胜高考（政治） ―― 清华大学附属中学考前指导 | G182: 本教研室 | H182: 10 | I182: 36471 | J182: 20
A183: =ROW()-5 -> 1160 | B183: G- | C183: 2103 | D183: 2 | E183: 02103-1 | F183: 决胜高考（历史） ―― 清华大学附属中学考前指导 | G183: 本教研室 | H183: 13 | I183: 36465 | J183: 13
A184: =ROW()-5 -> 1161 | B184: G- | C184: 2384 | D184: 1 | E184: 02384-0 | F184: 清华附中同步辅导与测试丛书 高二英语 | G184: 李 黎等 | H184: 12 | I184: 1997 | J184: 15
A185: =ROW()-5 -> 1162 | B185: G- | C185: 2369 | D185: 1 | E185: 02369-7 | F185: 清华附中同步辅导与测试丛书 高二数学 | G185: 邵光砚等 | H185: 15.8 | I185: 1997 | J185: 12
A186: =ROW()-5 -> 1163 | B186: G- | C186: 2354 | D186: 1 | E186: 02354-9 | F186: 清华附中同步辅导与测试丛书 高二语文 | G186: 杨建宇等 | H186: 10 | I186: 1997 | J186: 18
F187: 乐理考级教程
A188: =ROW()-5 -> 1165 | B188: G- | C188: 1009 | D188: 1 | E188: 01009-9 | F188: 乐理考级教程（第1级）（配光盘） | G188: 巩小强 | H188: 20 | I188: 36739 | J188: 30
A189: =ROW()-5 -> 1166 | B189: G- | C189: 1009 | D189: 2 | E189: 01009-9 | F189: 乐理考级教程（第2级）（配光盘） | G189: 巩小强 | H189: 20 | I189: 36739 | J189: 30
F190: 5.清华90周年校庆图书
A191: =ROW()-5 -> 1168 | B191: G- | C191: 4319 | D191: 1 | E191: 04319-1 | F191: 清华大学志（上、下）（精装） | G191: 方惠坚等 | H191: 298 | I191: 36982 | J191: 1
A192: =ROW()-5 -> 1169 | B192: K- | C192: 4316 | D192: 1 | E192: 04316-7 | F192: 清华大学 90 年大事记 | G192: 校室史 | H192: 55 | I192: 36983 | J192: 5
A193: =ROW()-5 -> 1170 | B193: G- | C193: 4388 | D193: 1 | E193: 04388-4 | F193: 水木清华 群星璀璨 | G193: 校室史 | H193: 38 | I193: 36984 | J193: 8
A194: =ROW()-5 -> 1171 | B194: G- | C194: 4421 | D194: 1 | E194: 04421-X | F194: 世纪清华（三） | G194: 庄丽君等 | H194: 24 | I194: 36985 | J194: 12
A195: =ROW()-5 -> 1172 | B195: Z- | C195: 4323 | D195: 1 | E195: 04323-X | F195: 攀登与奉献――清华大学科技50年（上、下） | G195: 宣传部 | H195: 50 | I195: 36986 | J195: 6
A196: =ROW()-5 -> 1173 | B196: G- | C196: 4281 | D196: 1 | E196: 04281-0 | F196: 两弹一星功勋传（上、下）（精装） | G196: 宋 健主编 | H196: 128 | I196: 36987 | J196: 2
A197: =ROW()-5 -> 1174 | B197: G- | C197: 4400 | D197: 1 | E197: 04400-7 | F197: 清华园风物志（增补版） | G197: 黄延复等 | H197: 20 | I197: 36988 | J197: 15
A198: =ROW()-5 -> 1175 | B198: I- | C198: 4321 | D198: 1 | E198: 04321-3 | F198: 不尽书缘――忆清华大学图书馆 | G198: 侯竹筠等 | H198: 17 | I198: 36989 | J198: 18
A199: =ROW()-5 -> 1176 | B199: G- | C199: 4375 | D199: 1 | E199: 04375-2 | F199: 求索――新形势下清华大学德育工作若干新课题的实践与思考 | G199: 团委 学生部 | H199: 21 | I199: 36990 | J199: 15
A200: =ROW()-5 -> 1177 | B200: G- | C200: 4332 | D200: 1 | E200: 04332-9 | F200: 我心中的清华园 | G200: 束 为主编 | H200: 19 | I200: 37257 | J200: 18
A201: =ROW()-5 -> 1178 | B201: G- | C201: 4326 | D201: 1 | E201: 04326-4 | F201: 水木清华世纪风――报刊上的清华大学 | G201: 类正旭编 | H201: 22 | I201: 36992 | J201: 14
A202: =ROW()-5 -> 1179 | B202: J- | C202: 4285 | D202: 1 | E202: 04285-3 | F202: 水木湛清华（画册）（精装） | G202: 校办 | H202: 280 | I202: 36993 | J202: 10
A203: =ROW()-5 -> 1180 | B203: G- | C203: 4325 | D203: 1 | E203: 04325-6 | F203: 藤影荷声――清华校刊文选（1911-1949） | G203: 张玲霞 | H203: 19 | I203: 36994 | J203: 17
A204: =ROW()-5 -> 1181 | B204: K- | C204: 5047 | D204: 1 | E204: 05047-3 | F204: 北京高等教育丛书：清华园学研究院史话 | G204: 孙敦恒 | H204: 20 | I204: 37257 | J204: 22
A205: =ROW()-5 -> 1182 | B205: K- | C205: 4304 | D205: 1 | E205: 04304-3 | F205: 梅贻琦日记（1941-1946） | G205: 黄延复等 | H205: 18 | I205: 36995 | J205: 18
A206: =ROW()-5 -> 1183 | B206: I- | C206: 4299 | D206: 1 | E206: 04299-3 | F206: 期颐集（精装） | H206: 29 | I206: 36996 | J206: 15
A207: =ROW()-5 -> 1184 | B207: Z- | C207: 4374 | D207: 1 | E207: 04374-4 | F207: 清华学者论文学――《新生报》副刊《语言与文 学》选粹 | G207: 张国风编 | H207: 20 | I207: 36997 | J207: 15
A208: =ROW()-5 -> 1185 | B208: I- | C208: 4373 | D208: 1 | E208: 04373-6 | F208: 清华 九十 年美文选 | G208: 丹 妤 | H208: 20 | I208: 36998 | J208: 16
A209: =ROW()-5 -> 1186 | B209: I- | C209: 4367 | D209: 1 | E209: 04367-1 | F209: 清华文学寻踪（1911-1949） | G209: 张玲霞 | H209: 23 | I209: 36999 | J209: 13
A210: =ROW()-5 -> 1187 | B210: G- | C210: 0871 | D210: 1 | E210: 00871-X | F210: 假如又回到高中――清华学子全面点评高中生活 | G210: 钟 松等 | H210: 15 | I210: 37165 | J210: 15
F211: 6.美术与艺术类
F212: 报考清华大学美术学院考前指导系列丛书
A213: =ROW()-5 -> 1190 | B213: J- | C213: 4895 | D213: 1 | E213: 04895-9 | F213: 考前素描指导 | G213: 王国伦等 | H213: 39 | I213: 37196 | J213: 70
A214: =ROW()-5 -> 1191 | B214: J- | C214: 4899 | D214: 1 | E214: 04899-1 | F214: 考前速写指导 | G214: 王国伦等 | H214: 39 | I214: 37196 | J214: 70
A215: =ROW()-5 -> 1192 | B215: J- | C215: 4896 | D215: 1 | E215: 04896-7 | F215: 考前设计基础指导 | G215: 王国伦等 | H215: 39.8 | I215: 37196 | J215: 100
A216: =ROW()-5 -> 1193 | B216: J- | C216: 4898 | D216: 1 | E216: 04898-3 | F216: 考前色彩指导 | G216: 王国伦等 | H216: 49 | I216: 37196 | J216: 70
A217: =ROW()-5 -> 1194 | B217: J- | C217: 5038 | D217: 1 | E217: 05038-4 | F217: 考前绘画创作指导 | G217: 刘巨德等 | H217: 39.8 | I217: 37226 | J217: 2
A218: =ROW()-5 -> 1195 | B218: J- | C218: 4842 | D218: 1 | E218: 04842-8 | F218: 丹・雷辛格 | G218: 余秉楠 | H218: 188 | I218: 37288 | J218: 20
A219: =ROW()-5 -> 1196 | B219: J- | C219: 5577 | D219: 1 | E219: 05577-1 | F219: 艺术院校动画基础系列教材：动画速写基础 | G219: 刘临 | H219: 29.8 | I219: 37438 | J219: 8
A220: =ROW()-5 -> 1197 | B220: J- | C220: 5287 | D220: 1 | E220: 05287-5 | F220: 动漫艺术教程 | G220: 张弓等 | H220: 39.8 | I220: 37347 | J220: 10
A221: =ROW()-5 -> 1198 | B221: G- | C221: 5414 | D221: 1 | E221: 05414-2 | F221: 清华大学九十周年校庆集锦 | G221: 清华大学新闻中心 | H221: 48 | I221: 37347 | J221: 40
A222: =ROW()-5 -> 1199 | B222: J- | C222: 5409 | D222: 1 | E222: 05409-6 | F222: 工业设计・陶瓷艺术设计 | G222: 清华大学美术学院 | H222: 38.8 | I222: 37347 | J222: 15
A223: =ROW()-5 -> 1200 | B223: J- | C223: 5409 | D223: 1 | E223: 05409-6 | F223: 染织设计・服装设计 | G223: 清华大学美术学院 | H223: 38.8 | I223: 37347 | J223: 15
A224: =ROW()-5 -> 1201 | B224: J- | C224: 5409 | D224: 1 | E224: 05409-6 | F224: 装潢艺术设计 | G224: 清华大学美术学院 | H224: 38.8 | I224: 37347 | J224: 15
A225: =ROW()-5 -> 1202 | B225: J- | C225: 5409 | D225: 1 | E225: 05409-6 | F225: 环境艺术设计 | G225: 清华大学美术学院 | H225: 38.8 | I225: 37347 | J225: 15
A226: =ROW()-5 -> 1203 | B226: J- | C226: 5409 | D226: 1 | E226: 05409-6 | F226: 绘画・雕塑・工艺美术 | G226: 清华大学美术学院 | H226: 38.8 | I226: 37347 | J226: 15

A1: 日本文化的皇冠宝珠――短歌

A1: 王瑞林

A1: 顾毓