A1: 序号 | B1: 代 号 | E1: ISBN 7-302- | F1: 名 称 | G1: 著译编者 | H1: 定价(元) | I1: 印年 | J1: 册/包 | K1: 订数
F2: 外 语 类
C3: 国际权威ELT教材――《博采英语》系列教材（2001年影印版）
F4: 该系列教材2002年5月被列入国家教育部优秀外语教材推荐书目
B5: 世界著名英语教学专家联合编写，美国汤姆森学习出版集团最新推出，众多国家与地区广泛使用，以培养高素质国际外语通用人才为目的，强调语言的实际应用能力和学习能力的培养。
A6: =ROW()-5 -> 1 | B6: H- | C6: 4344 | D6: 1 | E6: 04344-2 | F6: 博采英语――阅读 （1） | G6: Virginia L. Guleff | H6: 23 | I6: 37530 | J6: 13
A7: =ROW()-5 -> 2 | B7: H- | C7: 4344 | D7: 2 | E7: 04344-2 | F7: 博采英语――阅读 （2） | G7: Michael Ryall | H7: 23 | I7: 37358 | J7: 12
A8: =ROW()-5 -> 3 | B8: H- | C8: 4344 | D8: 3 | E8: 04344-2 | F8: 博采英语――阅读 （3） | G8: Linda Robinson Fellag | H8: 23 | I8: 37530 | J8: 11
A9: =ROW()-5 -> 4 | B9: H- | C9: 4344 | D9: 4 | E9: 04344-2 | F9: 博采英语――阅读 （4） | G9: M.E.Sokolik | H9: 23 | I9: 37530 | J9: 11
A10: =ROW()-5 -> 5 | B10: H- | C10: 4346 | D10: 1 | E10: 04346-9 | F10: 博采英语――写作（1） | G10: Meredith Pike-Baky | H10: 24 | I10: 37316 | J10: 12
A11: =ROW()-5 -> 6 | B11: H- | C11: 4346 | D11: 2 | E11: 04346-9 | F11: 博采英语――写作（2） | G11: Meredith Pike-Baky Laurie Blass | H11: 24 | I11: 37073 | J11: 10
A12: =ROW()-5 -> 7 | B12: H- | C12: 4346 | D12: 9 | E12: 04346-9 | F12: 博采英语――写作（3） | G12: Marie Hutchison Weidauer | H12: 24 | I12: 37073 | J12: 11
A13: =ROW()-5 -> 8 | B13: H- | C13: 4346 | D13: 4 | E13: 04346-9 | F13: 博采英语――写作（4） | G13: M.E.Sokolik | H13: 24 | I13: 37073 | J13: 11
A14: =ROW()-5 -> 9 | B14: H- | C14: 4345 | D14: 1 | E14: 04345-0 | F14: 博采英语――听说 （1） | G14: Cheryl Benz，Kara Dworak | H14: 26.5 | I14: 37469 | J14: 9
A15: =ROW()-5 -> 10 | B15: H- | C15: 4345 | D15: 2 | E15: 04345-0 | F15: 博采英语――听说 （2） | G15: Mary McVey Gill Pamela Hartmann | H15: 26.5 | I15: 37073 | J15: 10
A16: =ROW()-5 -> 11 | B16: H- | C16: 4345 | D16: 3 | E16: 04345-0 | F16: 博采英语――听说 （3） | G16: Karen Carlisi Susana Christie | H16: 26.5 | I16: 37500 | J16: 9
A17: =ROW()-5 -> 12 | B17: H- | C17: 4345 | D17: 4 | E17: 04543-0 | F17: 博采英语――听说 （4） | G17: Helen Kalksten Fragiadkis 等 | H17: 26.5 | I17: 37500 | J17: 9
A18: =ROW()-5 -> 13 | B18: CD | C18: 4345 | D18: 1 | F18: 博采英语――听说（1）音带 2盘 | H18: 14 | I18: 37105 | J18: 10
A19: =ROW()-5 -> 14 | B19: CD | C19: 4345 | D19: 2 | F19: 博采英语――听说（2）音带 3盘 | H19: 21 | I19: 37106 | J19: 8
A20: =ROW()-5 -> 15 | B20: CD | C20: 4345 | D20: 3 | F20: 博采英语――听说（3）音带 2盘 | H20: 14 | I20: 37073 | J20: 12
A21: =ROW()-5 -> 16 | B21: CD | C21: 4345 | D21: 4 | F21: 博采英语――听说（4）音带 2盘 | H21: 14 | I21: 37104 | J21: 12
A22: =ROW()-5 -> 17 | B22: H- | C22: 4689 | D22: 1 | E22: 04689-1 | F22: 博采英语――阅读 教学参考书（全一册） | H22: 24 | I22: 37105 | J22: 15
A23: =ROW()-5 -> 18 | B23: H- | C23: 4648 | D23: 1 | E23: 04648-4 | F23: 博采英语――写作 教学参考书（全一册） | H23: 24 | I23: 37106 | J23: 16
A24: =ROW()-5 -> 19 | B24: H- | C24: 4674 | D24: 1 | E24: 04674-3 | F24: 博采英语――听说 教学参考书（全一册） | H24: 24 | I24: 37107 | J24: 15
A25: =ROW()-5 -> 20 | B25: H- | C25: 0832 | D25: 1 | E25: 00832-9 | F25: 博采英语――样课汇编 （ 听说 写作 阅读） | G25: 编辑组 | H25: 48.00 | I25: 37377 | J25: 8
A26: =ROW()-5 -> 21 | B26: CD | C26: 0832 | D26: 1 | F26: 博采英语――听说样课汇编（样带） | H26: 7 | I26: 37104 | J26: 25
A27: =ROW()-5 -> 22 | B27: H- | C27: 4880 | D27: 1 | E27: 04880-0 | F27: 博采英语――教师必读 | H27: 24 | I27: 37135 | J27: 10
B28: 注：其中《听说》《阅读》《写作》各配有2盘CNN节目VCD，为集体用户免费赠送。
F29: 清华语言论丛
A30: =ROW()-5 -> 25 | B30: H- | C30: 5589 | D30: 1 | E30: 05589-0 | F30: 中国学生英语色彩语码认知模式研究 | G30: 杨永林 | H30: 25 | I30: 37469 | J30: 15
A31: =ROW()-5 -> 26 | B31: H- | C31: 5133 | D31: 1 | E31: 05133-X | F31: 汉语文化语用学（第二版）* | G31: 钱冠连 | H31: 33.5 | I31: 37288 | J31: 13
A32: =ROW()-5 -> 27 | B32: H- | C32: 5185 | D32: 2 | E32: 05185-2 | F32: 英汉缩略语的比较与应用 | G32: 余富林 | H32: 14 | I32: 37288 | J32: 18
A33: =ROW()-5 -> 28 | B33: H- | C33: 4596 | D33: 8 | E33: 04596-8 | F33: 多角度研究语言 | G33: 王德春 | H33: 33 | I33: 37257 | J33: 9
A34: *为教育部研究生工作办公室推荐的“研究生教学用书”
F35: 英语学术类图书
A36: =ROW()-5 -> 31 | B36: H- | C36: 2586 | D36: 2 | E36: 02586-X | F36: 功能语言学在中国的进展 | G36: 胡壮麟等 | H36: 18 | I36: 1998 | J36: 14
A37: =ROW()-5 -> 32 | B37: H- | C37: 5137 | D37: 1 | E37: 05137-2 | F37: 大学外语教学研究 | G37: 许建平 | H37: 19 | I37: 37377 | J37: 18
F38: 小型英语实用辞书
A39: =ROW()-5 -> 34 | B39: H- | C39: 3014 | D39: 1 | E39: 03014-6 | F39: 国际商务英语用法词典 | G39: 徐 健 | H39: 32.80 | I39: 36739 | J39: 6
A40: =ROW()-5 -> 35 | B40: H- | C40: 3105 | D40: 1 | E40: 03105-3 | F40: 英汉双解美国20世纪流行文化词典 | H40: 24.00 | I40: 1998 | J40: 12
A41: =ROW()-5 -> 36 | B41: H- | C41: 2376 | D41: 3 | E41: 02376-X | F41: 美国习语、俚语插图词典 | G41: 吕志士等译 | H41: 12.5 | I41: 36982 | J41: 21
A42: =ROW()-5 -> 37 | B42: H- | C42: 2514 | D42: 4 | E42: 02514-2 | F42: 美国口语惯用法例句集粹 | G42: Shawn Holley | H42: 18.5 | I42: 36892 | J42: 12
A43: =ROW()-5 -> 38 | B43: H- | C43: 3630 | D43: 1 | E43: 03630-6 | F43: 英语新词新义 （收录了当今一般词典中还未包括的英语新词新义） | G43: Shawn Holley | H43: 12.5 | I43: 36678 | J43: 25
A44: =ROW()-5 -> 39 | B44: H- | C44: 2876 | D44: 1 | E44: 02876-1 | F44: 中学生实用英语动词搭配词典（精） | G44: 席玉虎 | H44: 50 | I44: 37530 | J44: 7
F45: 捷进英语
F46: 国际著名英语教育家亚历山大倾力之作 ―― 享誉世界的新一代交际英语
A47: =ROW()-5 -> 42 | B47: H- | C47: 3172 | D47: 2 | E47: 03172-X | F47: 捷进英语（1）（包括主课本和学习用书） | G47: 亚历山大 | H47: 28 | I47: 1999 | J47: 7
A48: =ROW()-5 -> 43 | B48: H- | C48: 3180 | D48: 2 | E48: 03180-0 | F48: 捷进英语（2）（包括主课本和学习用书） | G48: 亚历山大 | H48: 28 | I48: 1999 | J48: 7
A49: =ROW()-5 -> 44 | B49: H- | C49: 3171 | D49: 2 | E49: 03171-1 | F49: 捷进英语（3）（包括主课本和学习用书） | G49: 亚历山大 | H49: 28 | I49: 1999 | J49: 7
A50: =ROW()-5 -> 45 | B50: H- | C50: 3179 | D50: 2 | E50: 03179-7 | F50: 捷进英语（4）（包括主课本和学习用书） | G50: 亚历山大 | H50: 28 | I50: 1998 | J50: 7
A51: =ROW()-5 -> 46 | B51: H- | C51: 3182 | D51: 2 | E51: 03182-7 | F51: 捷进英语（5）（包括主课本和学习用书） | G51: 亚历山大 | H51: 28 | I51: 1998 | J51: 7
A52: =ROW()-5 -> 47 | B52: H- | C52: 3181 | D52: 2 | E52: 03181-9 | F52: 捷进英语（6）（包括主课本和学习用书） | G52: 亚历山大 | H52: 28 | I52: 1998 | J52: 7
A53: =ROW()-5 -> 48 | B53: CD | C53: 3172 | D53: 1 | F53: 《捷进英语》（1） (自学带) | G53: 亚历山大 | H53: 30 | I53: 1998 | J53: 6
A54: =ROW()-5 -> 49 | B54: CD | C54: 3180 | D54: 1 | F54: 《捷进英语》（2） (自学带) | G54: 亚历山大 | H54: 30 | I54: 1998 | J54: 6
A55: =ROW()-5 -> 50 | B55: CD | C55: 3171 | D55: 1 | F55: 《捷进英语》（3） (自学带) | G55: 亚历山大 | H55: 30 | I55: 1998 | J55: 6
A56: =ROW()-5 -> 51 | B56: CD | C56: 3179 | D56: 1 | F56: 《捷进英语》（4） (自学带) | G56: 亚历山大 | H56: 30 | I56: 1998 | J56: 6
A57: =ROW()-5 -> 52 | B57: CD | C57: 3182 | D57: 1 | F57: 《捷进英语》（5） (自学带) | G57: 亚历山大 | H57: 30 | I57: 1998 | J57: 6
A58: =ROW()-5 -> 53 | B58: CD | C58: 3181 | D58: 1 | F58: 《捷进英语》（6） (自学带) | G58: 亚历山大 | H58: 30 | I58: 1998 | J58: 6
A59: =ROW()-5 -> 54 | B59: CD | C59: 3172 | D59: 3 | F59: 《捷进英语》（1） (教学音带 总1-9) | G59: 亚历山大 | H59: 63 | I59: 36526 | J59: 3
A60: =ROW()-5 -> 55 | B60: CD | C60: 3180 | D60: 3 | F60: 《捷进英语》（2） (教学音带 总10-18) | G60: 亚历山大 | H60: 63 | I60: 36526 | J60: 3
A61: =ROW()-5 -> 56 | B61: CD | C61: 3171 | D61: 3 | F61: 《捷进英语》（3） (教学音带 总19-27) | G61: 亚历山大 | H61: 63 | I61: 36526 | J61: 3
A62: =ROW()-5 -> 57 | B62: CD | C62: 3179 | D62: 3 | F62: 《捷进英语》（4） (教学音带 总28-36) | G62: 亚历山大 | H62: 63 | I62: 36526 | J62: 3
A63: =ROW()-5 -> 58 | B63: CD | C63: 3182 | D63: 3 | F63: 《捷进英语》（5） (教学音带 总37-45) | G63: 亚历山大 | H63: 63 | I63: 36526 | J63: 3
A64: =ROW()-5 -> 59 | B64: CD | C64: 3181 | D64: 3 | F64: 《捷进英语》（6） (教学音带 总46-54) | G64: 亚历山大 | H64: 63 | I64: 36526 | J64: 3
A65: =ROW()-5 -> 60 | B65: CD | C65: 3172 | D65: 2 | F65: 《捷进英语》（1） (原声带) | G65: 亚历山大 | H65: 7 | I65: 36647 | J65: 25
A66: =ROW()-5 -> 61 | B66: CD | C66: 3180 | D66: 2 | F66: 《捷进英语》（2） (原声带) | G66: 亚历山大 | H66: 7 | I66: 36648 | J66: 25
A67: =ROW()-5 -> 62 | B67: CD | C67: 3171 | D67: 2 | F67: 《捷进英语》（3） (原声带) | G67: 亚历山大 | H67: 7 | I67: 36649 | J67: 25
A68: =ROW()-5 -> 63 | B68: CD | C68: 3179 | D68: 2 | F68: 《捷进英语》（4） (原声带) | G68: 亚历山大 | H68: 7 | I68: 36650 | J68: 25
A69: =ROW()-5 -> 64 | B69: CD | C69: 3182 | D69: 2 | F69: 《捷进英语》（5） (原声带) | G69: 亚历山大 | H69: 7 | I69: 36651 | J69: 25
A70: =ROW()-5 -> 65 | B70: CD | C70: 3181 | D70: 2 | F70: 《捷进英语》（6） (原声带) | G70: 亚历山大 | H70: 7 | I70: 36652 | J70: 25
A71: =ROW()-5 -> 66 | B71: XD | C71: 0039 | D71: 0 | F71: 《捷进英语》（1） （像带） | G71: 亚历山大 | H71: 80 | I71: 1999 | J71: 8
A72: =ROW()-5 -> 67 | B72: XD | C72: 0039 | D72: 2 | F72: 《捷进英语》（2） （像带） | G72: 亚历山大 | H72: 80 | I72: 1999 | J72: 8
A73: =ROW()-5 -> 68 | B73: XD | C73: 0039 | D73: 3 | F73: 《捷进英语》（3） （像带） | G73: 亚历山大 | H73: 80 | I73: 1999 | J73: 8
A74: =ROW()-5 -> 69 | B74: XD | C74: 0039 | D74: 4 | F74: 《捷进英语》（4） （像带） | G74: 亚历山大 | H74: 80 | I74: 1999 | J74: 8
A75: =ROW()-5 -> 70 | B75: XD | C75: 0039 | D75: 5 | F75: 《捷进英语》（5） （像带） | G75: 亚历山大 | H75: 80 | I75: 1999 | J75: 8
A76: =ROW()-5 -> 71 | B76: XD | C76: 0039 | D76: 6 | F76: 《捷进英语》（6） （像带） | G76: 亚历山大 | H76: 80 | I76: 1999 | J76: 8
A77: =ROW()-5 -> 72 | B77: VD | C77: 0317 | D77: 1 | F77: 《捷进英语》（1） （VCD） | G77: 亚历山大 | H77: 25 | I77: 36708 | J77: 25
A78: =ROW()-5 -> 73 | B78: VD | C78: 0317 | D78: 2 | F78: 《捷进英语》（2） （VCD） | G78: 亚历山大 | H78: 25 | I78: 36587 | J78: 50
A79: =ROW()-5 -> 74 | B79: VD | C79: 0317 | D79: 3 | F79: 《捷进英语》（3） （VCD） | G79: 亚历山大 | H79: 25 | I79: 36588 | J79: 30
A80: =ROW()-5 -> 75 | B80: VD | C80: 0317 | D80: 4 | F80: 《捷进英语》（4） （VCD） | G80: 亚历山大 | H80: 25 | I80: 36589 | J80: 50
A81: =ROW()-5 -> 76 | B81: VD | C81: 0317 | D81: 5 | F81: 《捷进英语》（5） （VCD） | G81: 亚历山大 | H81: 25 | I81: 36590 | J81: 50
A82: =ROW()-5 -> 77 | B82: VD | C82: 0317 | D82: 6 | F82: 《捷进英语》（6） （VCD） | G82: 亚历山大 | H82: 25 | I82: 36591 | J82: 50
F83: 新英语教程（第3版）
F84: 该系列教材被列入国家教育部优秀外语教材推荐书目
C85: 文、理、工科院校兼用，大学公共英语系列教材，根据最新教学大纲编写
C86: 荣获北京市2001年教育教学成果（高等教育）二等奖，2002年教育部优秀教材二等奖。
A87: =ROW()-5 -> 82 | B87: H- | C87: 4711 | D87: 1 | E87: 04711-1 | F87: 预备级 | G87: 孙建民等 | H87: 16 | I87: 37226 | J87: 12
A88: =ROW()-5 -> 83 | B88: H- | C88: 4712 | D88: 1 | E88: 04712-X | F88: 预备级教学参考书 | G88: 王新奇等 | H88: 10 | I88: 37165 | J88: 26
A89: =ROW()-5 -> 84 | B89: H- | C89: 3468 | D89: 3 | E89: 03468-0 | F89: 阅读 (1) | G89: 刘平梅等 | H89: 18.00 | I89: 37500 | J89: 12
A90: =ROW()-5 -> 85 | B90: H- | C90: 3543 | D90: 3 | E90: 03543-1 | F90: 阅读 (2) | G90: 刘平梅等 | H90: 20 | I90: 37500 | J90: 10
A91: =ROW()-5 -> 86 | B91: H- | C91: 3666 | D91: 2 | E91: 03666-7 | F91: 阅读 (3) | G91: 刘平梅等 | H91: 25 | I91: 37500 | J91: 8
A92: =ROW()-5 -> 87 | B92: H- | C92: 3046 | D92: 3 | E92: 03046-4 | F92: 阅读 (4) | G92: 刘平梅等 | H92: 21 | I92: 37438 | J92: 10
A93: =ROW()-5 -> 88 | B93: H- | C93: 3467 | D93: 2 | E93: 03467-2 | F93: 阅读 (1) 教参 | G93: 刘平梅等 | H93: 14 | I93: 37344 | J93: 15
A94: =ROW()-5 -> 89 | B94: H- | C94: 3544 | D94: 2 | E94: 03544-X | F94: 阅读 (2) 教参 | G94: 刘平梅等 | H94: 13.5 | I94: 37257 | J94: 18
A95: =ROW()-5 -> 90 | B95: H- | C95: 2904 | D95: 2 | E95: 02904-9 | F95: 阅读 (3) 教参 | G95: 刘平梅等 | H95: 18 | I95: 37135 | J95: 13
A96: =ROW()-5 -> 91 | B96: H- | C96: 3021 | D96: 2 | E96: 03021-9 | F96: 阅读 (4) 教参 | G96: 刘平梅等 | H96: 15.6 | I96: 36982 | J96: 16
A97: =ROW()-5 -> 92 | B97: H- | C97: 4808 | D97: 1 | E97: 04808-8 | F97: 阅读（1）学生必备 | G97: 刘平梅等 | H97: 18 | I97: 37438 | J97: 12
A98: =ROW()-5 -> 93 | B98: H- | C98: 4892 | D98: 1 | E98: 04892-4 | F98: 阅读（2）学生必备 | G98: 刘平梅等 | H98: 16 | I98: 37438 | J98: 14
A99: =ROW()-5 -> 94 | B99: H- | C99: 4916 | D99: 1 | E99: 04916-5 | F99: 阅读（3）学生必备 | G99: 刘平梅等 | H99: 23 | I99: 37438 | J99: 8
A100: =ROW()-5 -> 95 | B100: H- | C100: 4958 | D100: 1 | E100: 04958-0 | F100: 阅读（4）学生必备 | G100: 刘平梅等 | H100: 18 | I100: 37438 | J100: 11
A101: =ROW()-5 -> 96 | B101: CD | C101: 3468 | D101: 1 | F101: 阅读 (1) 音带2盘 | G101: 刘平梅等 | H101: 14 | I101: 36314 | J101: 15
A102: =ROW()-5 -> 97 | B102: CD | C102: 3543 | D102: 1 | F102: 阅读 (2) 音带1盘 | G102: 刘平梅等 | H102: 7 | I102: 36404 | J102: 30
A103: =ROW()-5 -> 98 | B103: CD | C103: 3666 | D103: 1 | F103: 阅读 (3) 音带1盘 | G103: 刘平梅等 | H103: 7 | I103: 36465 | J103: 30
A104: =ROW()-5 -> 99 | B104: CD | C104: 3046 | D104: 1 | E104: 3046100 | F104: 阅读 (4) 音带1盘 | G104: 刘平梅等 | H104: 7 | I104: 36495 | J104: 25
A105: =ROW()-5 -> 100 | B105: H- | C105: 3750 | D105: 1 | E105: 03750-7 | F105: 阅读 (1) (2) 补充练习 | G105: 刘平梅等 | H105: 16 | I105: 37438 | J105: 13
A106: =ROW()-5 -> 101 | B106: H- | C106: 3967 | D106: 1 | E106: 03967-4 | F106: 阅读 (3) (4) 补充练习 | G106: 刘平梅等 | H106: 15.5 | I106: 37438 | J106: 15
A107: =ROW()-5 -> 102 | B107: H- | C107: 0987 | D107: 1 | E107: 00987-2 | F107: 样课汇编 | G107: 本书编辑组 | H107: 29 | I107: 37073 | J107: 9
A108: =ROW()-5 -> 103 | B108: CD | C108: 0987 | D108: 1 | F108: 样课汇编（音带） | G108: 本书编辑组 | H108: 7 | J108: 25
A109: =ROW()-5 -> 104 | B109: H- | C109: 3363 | D109: 3 | E109: 03363-3 | F109: 听说 (1) | G109: 刘平梅等 | H109: 12.5 | I109: 37438 | J109: 14
A110: =ROW()-5 -> 105 | B110: H- | C110: 3469 | D110: 2 | E110: 03469-9 | F110: 听说 (2) | G110: 刘平梅等 | H110: 13.5 | I110: 37438 | J110: 17
A111: =ROW()-5 -> 106 | B111: HH | C111: 3104 | D111: 2 | E111: 03104-5 | F111: 听说 (3) | G111: 刘平梅等 | H111: 14.8 | I111: 37438 | J111: 15
A112: =ROW()-5 -> 107 | B112: H- | C112: 3696 | D112: 2 | E112: 03696-9 | F112: 听说 (4) | G112: 刘平梅等 | H112: 17 | I112: 37073 | J112: 13
A113: =ROW()-5 -> 108 | B113: H- | C113: 3362 | D113: 1 | E113: 03362-5 | F113: 听说 (1) 教参 | G113: 刘平梅等 | H113: 7 | I113: 36647 | J113: 35
A114: =ROW()-5 -> 109 | B114: H- | C114: 3470 | D114: 2 | E114: 03470-2 | F114: 听说 (2) 教参 | G114: 刘平梅等 | H114: 6.8 | I114: 36678 | J114: 38
A115: =ROW()-5 -> 110 | B115: H- | C115: 1927 | D115: 1 | E115: 01927-4 | F115: 听说 (3) 教参 | G115: 刘平梅等 | H115: 7 | I115: 36678 | J115: 36
A116: =ROW()-5 -> 111 | B116: H- | C116: 3697 | D116: 1 | E116: 03697-7 | F116: 听说 (4) 教参 | G116: 刘平梅等 | H116: 9.5 | I116: 36800 | J116: 25
A117: =ROW()-5 -> 112 | B117: CD | C117: 3363 | D117: 1 | F117: 听说 (1) 音带5盘 | G117: 何福胜等 | H117: 35 | I117: 36586 | J117: 6
A118: =ROW()-5 -> 113 | B118: CD | C118: 3469 | D118: 1 | F118: 听说 (2) 音带5盘 | G118: 何福胜等 | H118: 35 | I118: 36404 | J118: 5
A119: =ROW()-5 -> 114 | B119: CD | C119: 3104 | D119: 1 | F119: 听说 (3) 音带4盘 | G119: 何福胜等 | H119: 28 | I119: 36404 | J119: 6
A120: =ROW()-5 -> 115 | B120: CD | C120: 3696 | D120: 1 | F120: 听说 (4) 音带5盘 | G120: 何福胜等 | H120: 35 | I120: 36495 | J120: 6
A121: =ROW()-5 -> 116 | B121: H- | C121: 4107 | D121: 1 | E121: 04107-5 | F121: 写作实践 | G121: 张文霞等 | H121: 12.8 | I121: 37469 | J121: 18
A122: =ROW()-5 -> 117 | B122: GP | C122: 2214 | D122: 1 | E122: 7900622144 | F122: 新英语教程（第3版）阅读1（CD-ROM） | G122: 覃学岚等 | H122: 29 | I122: 37377
A123: =ROW()-5 -> 118 | B123: GP | C123: 2266 | D123: 1 | E123: 7900622667 | F123: 新英语教程（第3版）听说1（CD-ROM） | G123: 何福胜等 | H123: 29 | I123: 37377
F124: 新英语教程（第2版）
A125: =ROW()-5 -> 120 | B125: H- | C125: 2011 | D125: 5 | E125: 02011-6 | F125: 词汇练习（第1册） | G125: 熊敦礼等 | H125: 7.3 | I125: 37408 | J125: 20
A126: =ROW()-5 -> 121 | B126: H- | C126: 2010 | D126: 5 | E126: 02010-8 | F126: 词汇练习（第2册） | G126: 熊敦礼等 | H126: 8.5 | I126: 37408 | J126: 22
A127: =ROW()-5 -> 122 | B127: H- | C127: 2067 | D127: 6 | E127: 02067-1 | F127: 词汇练习（第3册） | G127: 熊敦礼等 | H127: 8.50 | I127: 37408 | J127: 20
A128: =ROW()-5 -> 123 | B128: H- | C128: 2068 | D128: 4 | E128: 02068-X | F128: 词汇练习（第4册） | G128: 熊敦礼等 | H128: 6.6 | I128: 37408 | J128: 25
A129: =ROW()-5 -> 124 | B129: H- | C129: 1919 | D129: 7 | E129: 01919-3 | F129: 快读（第1册） | G129: 程建华等 | H129: 4 | I129: 36434 | J129: 30
A130: =ROW()-5 -> 125 | B130: H- | C130: 1920 | D130: 7 | E130: 01920-7 | F130: 快读（第2册） | G130: 饶健华等 | H130: 4 | I130: 36526 | J130: 30
A131: =ROW()-5 -> 126 | B131: H- | C131: 1750 | D131: 1 | E131: 01750-7 | F131: 补充读物（2） | G131: 刘平梅等编 | H131: 7.6 | I131: 34700 | J131: 20
A132: =ROW()-5 -> 127 | B132: H- | C132: 1584 | D132: 8 | E132: 01584-8 | F132: 听力练习册（第1册） | G132: 黄淑琳等 | H132: 4.6 | I132: 37135 | J132: 33
A133: =ROW()-5 -> 128 | B133: H- | C133: 1695 | D133: 8 | E133: 01695-X | F133: 听力练习册（第2册） | G133: 李瑞芳等 | H133: 5 | I133: 37135 | J133: 27
A134: =ROW()-5 -> 129 | B134: CD | C134: 1584 | D134: 4 | F134: 听力练习册（第1册）音带 | G134: 黄淑琳等 | H134: 28 | I134: 1996 | J134: 12
A135: =ROW()-5 -> 130 | B135: CD | C135: 1695 | D135: 1 | F135: 听力练习册（第2册）音带 | G135: 李瑞芳等 | H135: 28 | I135: 1996 | J135: 12
A136: =ROW()-5 -> 131 | B136: H- | C136: 2315 | D136: 9 | E136: 02315-8 | F136: 语法（全1册） | G136: 孙志成等 | H136: 28 | I136: 37135 | J136: 7
F137: 全国工程硕士研究生英语系列图书
F138: （荣获清华大学2001年优秀教材一等奖）
A139: =ROW()-5 -> 134 | B139: H- | C139: 4114 | D139: 1 | E139: 04114-8 | F139: 工程硕士研究生英语听力教程 | G139: 伊秀波 | H139: 17 | I139: 37408 | J139: 15
A140: =ROW()-5 -> 135 | B140: CD | C140: 4114 | D140: 1 | F140: 工程硕士研究生英语听力教程 音带 5 盘 | G140: 伊秀波 | H140: 35 | I140: 37104 | J140: 5
A141: =ROW()-5 -> 136 | B141: H- | C141: 4454 | D141: 1 | E141: 04454-6 | F141: 工程硕士研究生英语泛读教程 | G141: 徐方赋等 | H141: 15 | I141: 37335 | J141: 15
A142: =ROW()-5 -> 137 | B142: H- | C142: 4176 | D142: 1 | E142: 04176-8 | F142: 工程硕士研究生英语教程（第二版、教师用书） | G142: 何福胜等 | H142: 15 | I142: 37354 | J142: 20
A143: =ROW()-5 -> 138 | B143: H- | C143: 4157 | D143: 1 | E143: 04157-1 | F143: 工程硕士研究生英语教程（第二版、学生用书） | G143: 罗立胜等 | H143: 26 | I143: 37438 | J143: 10
A144: =ROW()-5 -> 139 | B144: CD | C144: 3439 | D144: 1 | F144: 工程硕士研究生英语教程（第二版、学生用书） 音带4盘 | H144: 28 | I144: 37104 | J144: 10
A145: =ROW()-5 -> 140 | B145: H- | C145: 4331 | D145: 1 | E145: 04331-0 | F145: 工程硕士研究生英语教程 （ 第二版、测试习题集) | G145: 罗承丽 | H145: 20 | I145: 37408 | J145: 13
A146: =ROW()-5 -> 141 | B146: CD | C146: 3498 | D146: 1 | F146: 工程硕士研究生英语教程 （第二版、测试习题集) 音带2盘 | H146: 14 | I146: 37104 | J146: 14
A147: =ROW()-5 -> 142 | B147: H- | C147: 3883 | D147: 1 | E147: 03883-X | F147: 全国工程硕士专业学位研究生英语教学大纲 | G147: 指导委员会 | H147: 20 | I147: 37397 | J147: 14
A148: =ROW()-5 -> 143 | B148: CD | C148: 3883 | D148: 1 | F148: 全国工程硕士专业学位研究生英语教学大纲 音带2盘 | H148: 14 | J148: 20
A149: =ROW()-5 -> 144 | B149: H- | C149: 0919 | D149: 1 | E149: 001919-8 | F149: 全国工程硕士研究生入学考试英语考试大纲 | G149: 指导委员会 | H149: 11 | I149: 37362 | J149: 30
A150: =ROW()-5 -> 145 | B150: H- | C150: 4080 | D150: 1 | E150: 04080-X | F150: 全国工程硕士研究生入学考试英语考试指南 | G150: 陈大明等 | H150: 29 | I150: 37358 | J150: 8
F151: 清华大学远程教育专升本英语系列教材
A152: =ROW()-5 -> 147 | B152: H- | C152: 4044 | D152: 1 | E152: 04044-3 | F152: 英语听力（1）（供专升本英语专业使用） | G152: 孙 霞等 | H152: 20 | I152: 36831 | J152: 13
A153: =ROW()-5 -> 148 | B153: H- | C153: 4247 | D153: 1 | E153: 04247-0 | F153: 英语听力 （2） （供专升本英语专业使用） | G153: 孙 霞等 | H153: 22 | I153: 36923 | J153: 12
A154: =ROW()-5 -> 149 | B154: H- | C154: 4597 | D154: 1 | E154: 04597-6 | F154: 英语听力 （3） （供专升本英语专业使用） | G154: 孙 霞等 | H154: 26 | I154: 37104 | J154: 10
A155: =ROW()-5 -> 150 | B155: H- | C155: 5123 | D155: 1 | E155: 05123-2 | F155: 英语听力 （4） （供专升本英语专业使用） | G155: 孙 霞等 | H155: 28 | I155: 37288 | J155: 10
A156: =ROW()-5 -> 151 | B156: CD | C156: 4041 | D156: 1 | F156: 英语听力（1）音带4盘 | H156: 28 | I156: 36861 | J156: 6
A157: =ROW()-5 -> 152 | B157: CD | C157: 4247 | D157: 1 | F157: 英语听力（2）音带4盘 | H157: 28 | I157: 37073 | J157: 6
A158: =ROW()-5 -> 153 | B158: CD | C158: 4597 | D158: 1 | E158: 7880140190 | F158: 英语听力（3）音带5盘 | H158: 35 | I158: 37135 | J158: 8
A159: =ROW()-5 -> 154 | B159: CD | C159: 5123 | D159: 1 | E159: 7880141502 | F159: 英语听力（4）音带6盘 | H159: 42 | I159: 37257 | J159: 20
A160: =ROW()-5 -> 155 | B160: H- | C160: 4093 | D160: 1 | E160: 04093-1 | F160: 英语写作（上册）（供专升本英语专业使用） | G160: 蔡 蔚等 | H160: 21 | I160: 36861 | J160: 12
A161: =ROW()-5 -> 156 | B161: H- | C161: 4270 | D161: 1 | E161: 04270-5 | F161: 英语写作（下册） （供专升本英语专业使用） | G161: 蔡 蔚等 | H161: 20 | I161: 36951 | J161: 12
A162: =ROW()-5 -> 157 | B162: H- | C162: 5123 | D162: 1 | E162: 05123-2 | F162: 英语听力（第四册）（供专升本英语专业使用） | G162: 孙霞等 | H162: 28.00 | I162: 37257 | J162: 10
A163: =ROW()-5 -> 158 | B163: H- | C163: 4072 | D163: 1 | E163: 04072-9 | F163: 英语读写译（第一册）(供专升本非英语专业使用） | G163: 罗立胜等 | H163: 14 | I163: 37469 | J163: 18
A164: =ROW()-5 -> 159 | B164: CD | C164: 4072 | D164: 1 | F164: 英语读写译（第一册）（供专升本非英语专业使用）音带2盘 | G164: 罗立胜 | H164: 14 | I164: 37165 | J164: 12
A165: =ROW()-5 -> 160 | B165: H- | C165: 4252 | D165: 1 | E165: 04252-7 | F165: 英语读写译（第二册）（供专升本非英语专业使用） | G165: 罗立胜等 | H165: 16 | I165: 37104 | J165: 18
A166: =ROW()-5 -> 161 | B166: CD | C166: 4252 | D166: 1 | F166: 英语读写译（第二册）（供专升本非英语专业使用）音带2盘 | G166: 罗立胜 | H166: 14 | I166: 37288 | J166: 18
A167: =ROW()-5 -> 162 | B167: H- | C167: 5255 | D167: 1 | E167: 05255-7 | F167: 英语读写译 学习辅导（全一册） | G167: 崔荣佳 | H167: 21.00 | I167: 37500 | J167: 12
A168: =ROW()-5 -> 163 | B168: H- | C168: 4092 | D168: 1 | E168: 04092-3 | F168: 综合英语（第一册）（供专升本英语专业 使用） | G168: 崔刚等 | H168: 20 | I168: 36861 | J168: 14
A169: =ROW()-5 -> 164 | B169: H- | C169: 4265 | D169: 1 | E169: 04265-9 | F169: 综合英语（第二册）（供专升本英语专业 使用） | G169: 崔刚等 | H169: 19.5 | I169: 36982 | J169: 13
A170: =ROW()-5 -> 165 | B170: H- | C170: 4662 | D170: 1 | E170: 04662-X | F170: 高级英语（第一册）（供专升本英语专业 使用） | G170: 崔刚等 | H170: 15.5 | I170: 37104 | J170: 15
F171: 高校英语选修课系列教材
F172: 适合于公共外语二年级以上、英语专业低年级学生或中高级水平的一般英语爱好者
A173: =ROW()-5 -> 168 | B173: H- | C173: 3088 | D173: 2 | E173: 03088-X | F173: 英汉语篇翻译 | G173: 李运兴 | H173: 12 | I173: 36831 | J173: 18
A174: =ROW()-5 -> 169 | B174: H- | C174: 2791 | D174: 2 | E174: 02791-9 | F174: 汉英语篇翻译 | G174: 居祖纯 | H174: 7 | I174: 37469 | J174: 40
A175: =ROW()-5 -> 170 | B175: H- | C175: 0729 | D175: 1 | E175: 00729-2 | F175: 高级汉英语篇翻译（切实提高汉英翻译水平的教材） | G175: 居祖纯 | H175: 9.8 | I175: 36770 | J175: 30
A176: =ROW()-5 -> 171 | B176: H- | C176: 4369 | D176: 1 | E176: 04369-8 | F176: 汉英时文翻译实践 | G176: 张 蓓 | H176: 14 | I176: 37043 | J176: 30
A177: =ROW()-5 -> 172 | B177: H- | C177: 4806 | D177: 1 | E177: 04806-1 | F177: 高级英汉翻译理论与实践 | G177: 叶子南 | H177: 21 | I177: 37196 | J177: 14
A178: =ROW()-5 -> 173 | B178: H- | C178: 2041 | D178: 1 | E178: 02041-8 | F178: 书面英语基本功训练（影印版） | G178: Robin Macpherson | H178: 14 | I178: 36831 | J178: 21
A179: =ROW()-5 -> 174 | B179: H- | C179: 3804 | D179: 1 | E179: 03804-X | F179: 商务管理听力教程 | G179: 陈亚平 | H179: 17 | I179: 36678 | J179: 20
A180: =ROW()-5 -> 175 | B180: CD | C180: 3804 | D180: 1 | F180: 商务管理听力教程 （音带3盘） | G180: 陈亚平 | H180: 21 | I180: 36831 | J180: 8
A181: =ROW()-5 -> 176 | B181: H- | C181: 4043 | D181: 1 | E181: 04043-5 | F181: 英文商务写作教程 | G181: 范 红 | H181: 22 | I181: 37500 | J181: 14
A182: =ROW()-5 -> 177 | B182: H- | C182: 1016 | D182: 2 | E182: 01016-1 | F182: 英汉互译实践与技巧 | G182: 许建平 | H182: 20 | I182: 37362 | J182: 13
A183: =ROW()-5 -> 178 | B183: H- | C183: 5404 | D183: 1 | E183: 05404-5 | F183: 英美文学赏析教程（散文与诗歌） | G183: 罗选民 | H183: 20 | I183: 37469 | J183: 15
A184: =ROW()-5 -> 179 | B184: H- | C184: 5851 | D184: 1 | E184: 05851-2 | F184: 如何写好英语作文――大学生写作弱点分析 | G184: 纪康丽 | H184: 13 | I184: 37530 | J184: 18
F185: 实用英语听说教材系列
F186: 美国著名教科书出版商组织语言专家编写的英语听说教材系列 （白领阶层的必修课）
A187: =ROW()-5 -> 182 | B187: H- | C187: 3248 | D187: 1 | E187: 03248-3 | F187: 商务英语 | G187: Nick Brieger | H187: 19.8 | I187: 37377 | J187: 15
A188: =ROW()-5 -> 183 | B188: H- | C188: 3261 | D188: 2 | E188: 03261-0 | F188: 办公室英语 | G188: Nick Brieger | H188: 25 | I188: 37406 | J188: 12
A189: =ROW()-5 -> 184 | B189: H- | C189: 3298 | D189: 1 | E189: 03298-X | F189: 技术英语 | G189: Nick Brieger | H189: 20 | I189: 36617 | J189: 15
A190: =ROW()-5 -> 185 | B190: H- | C190: 3299 | D190: 2 | E190: 03299-8 | F190: 社交英语 | G190: Nick Brieger | H190: 21.5 | I190: 36617 | J190: 13
A191: =ROW()-5 -> 186 | B191: CD | C191: 3248 | D191: 1 | F191: 商务英语 音带1盘 | G191: Nick Brieger | H191: 7 | I191: 36586 | J191: 25
A192: =ROW()-5 -> 187 | B192: CD | C192: 3261 | D192: 1 | F192: 办公室英语 音带2盘 | G192: Nick Brieger | H192: 14 | I192: 36586 | J192: 25
A193: =ROW()-5 -> 188 | B193: CD | C193: 3298 | D193: 1 | F193: 技术英语 音带2盘 | G193: Nick Brieger | H193: 14 | I193: 1999 | J193: 25
A194: =ROW()-5 -> 189 | B194: CD | C194: 3299 | D194: 1 | F194: 社交英语 音带1盘 | G194: Nick Brieger | H194: 7 | I194: 1999 | J194: 25
F195: 专业英语阅读系列教材
A196: =ROW()-5 -> 191 | B196: H- | C196: 3191 | D196: 1 | E196: 03191-6 | F196: 市场营销英语（Marketing) | G196: Maggie-Jo等 | H196: 13.6 | I196: 37500 | J196: 20
A197: =ROW()-5 -> 192 | B197: H- | C197: 3192 | D197: 1 | E197: 03192-4 | F197: 保险英语（Insurance) | G197: Michael R. Sneyd | H197: 14.5 | I197: 1998 | J197: 17
A198: =ROW()-5 -> 193 | B198: H- | C198: 3190 | D198: 1 | E198: 03190-8 | F198: 西方会计英语（Accounting) | G198: Michael R. Sneyd | H198: 14.5 | I198: 1998 | J198: 15
A199: =ROW()-5 -> 194 | B199: H- | C199: 3267 | D199: 1 | E199: 03267-X | F199: 国际财政金融英语 （International Banking and Finance) | G199: Michael R. Sneyd | H199: 14.5 | I199: 1998 | J199: 20
A200: =ROW()-5 -> 195 | B200: H- | C200: 3189 | D200: 1 | E200: 03189-4 | F200: 广告宣传英语 （Advertising and the Promotion Industry) | G200: Maggie-Jo等 | H200: 14.5 | I200: 1998 | J200: 18
A201: =ROW()-5 -> 196 | B201: CD | C201: 3191 | D201: 1 | F201: 市场营销英语 音带2盘 | G201: Maggie- JoSt John | H201: 14 | I201: 1999 | J201: 25
A202: =ROW()-5 -> 197 | B202: CD | C202: 3192 | D202: 1 | F202: 保险英语 音带2盘 | G202: Michael R.Sneyd | H202: 14 | I202: 1999 | J202: 25
A203: =ROW()-5 -> 198 | B203: CD | C203: 3190 | D203: 1 | F203: 西方会计英语 音带2盘 | G203: Michael R.Sneyd | H203: 14 | I203: 1999 | J203: 25
A204: =ROW()-5 -> 199 | B204: CD | C204: 3267 | D204: 1 | F204: 国际财政金融英语 音带2盘 | G204: Micheal R.Sneyd | H204: 14 | I204: 1999 | J204: 25
A205: =ROW()-5 -> 200 | B205: CD | C205: 3189 | D205: 1 | F205: 广告宣传英语 音带2盘 | G205: Maggie- JoSt John | H205: 14 | I205: 1999 | J205: 25
F206: 其他英语教材
A207: =ROW()-5 -> 202 | B207: H- | C207: 2892 | D207: 2 | E207: 02892-3 | F207: 听说进阶――中高级英语听说教程 (第2版） | G207: 何福胜 | H207: 19 | I207: 1999 | J207: 11
A208: =ROW()-5 -> 203 | B208: CD | C208: 2892 | D208: 1 | F208: 《听说进阶》（音带） | G208: 何福胜 | H208: 35 | I208: 1998 | J208: 5
A209: =ROW()-5 -> 204 | B209: H- | C209: 3064 | D209: 1 | E209: 03064-2 | F209: 高级英语视听说教程(学生用书) (上) | G209: 戴劲等 | H209: 8 | I209: 37438 | J209: 30
A210: =ROW()-5 -> 205 | B210: H- | C210: 3065 | D210: 1 | E210: 03065-0 | F210: 高级英语视听说教程(教师用书) (上) | G210: 刘晶等 | H210: 11 | I210: 1998 | J210: 23
A211: =ROW()-5 -> 206 | B211: H- | C211: 2251 | D211: 1 | E211: 02251-8 | F211: 高级英语视听说教程(学生用书) (下) | G211: 刘晶等 | H211: 9.5 | I211: 36526 | J211: 20
A212: =ROW()-5 -> 207 | B212: H- | C212: 2228 | D212: 1 | E212: 02228-3 | F212: 高级英语视听说教程(教师用书) (下) | G212: 刘晶等 | H212: 15 | I212: 36527 | J212: 10
A213: =ROW()-5 -> 208 | B213: CD | C213: 3065 | D213: 1 | F213: 高级英语视听说教程（上）音带3盘 | G213: 刘晶等 | H213: 21 | I213: 1998 | J213: 3
A214: =ROW()-5 -> 209 | B214: CD | C214: 2228 | D214: 1 | F214: 高级英语视听说教程 (下) 音带4盘 | G214: 刘晶等 | H214: 30 | I214: 36586 | J214: 12
A215: =ROW()-5 -> 210 | B215: H- | C215: 3522 | D215: 1 | E215: 03522-9 | F215: 例解涉外经贸英语――复合型人材速成实用教材 | G215: 虞瑞钧等 | H215: 17 | I215: 36434 | J215: 12
F216: 同等学力申请硕士学位外语水平全国统考应试指导丛书
A217: =ROW()-5 -> 212 | B217: H- | C217: 4235 | D217: 1 | E217: 04235-7 | F217: 俄语试卷评析与应试指导 | G217: 发展中心 | H217: 25 | I217: 37347 | J217: 11
A218: =ROW()-5 -> 213 | B218: CD | C218: 4235 | D218: 1 | F218: 俄语试卷评析与应试指导 （音带上、下） | G218: 发展中心 | H218: 12 | I218: 36923 | J218: 12
A219: =ROW()-5 -> 214 | B219: H- | C219: 4225 | D219: 1 | E219: 4225 | F219: 德语试卷评析与应试指导 | G219: 发展中心 | H219: 21 | I219: 37257 | J219: 18
A220: =ROW()-5 -> 215 | B220: CD | C220: 4225 | D220: 1 | F220: 德语试卷评析与应试指导 （音带上、下） | G220: 发展中心 | H220: 12 | I220: 36923 | J220: 12
A221: =ROW()-5 -> 216 | B221: H- | C221: 4221 | D221: 1 | E221: 04221-7 | F221: 法语试卷评析与应试指导 | G221: 发展中心 | H221: 18 | I221: 37530 | J221: 15
A222: =ROW()-5 -> 217 | B222: CD | C222: 4221 | D222: 1 | F222: 法语试卷评析与应试指导 （音带上、下） | G222: 发展中心 | H222: 12 | I222: 36923 | J222: 12
A223: =ROW()-5 -> 218 | B223: H- | C223: 5254 | D223: 1 | E223: 04235-7 | F223: 英语试卷评析与应试指导（2002版） | G223: 发展中心 | H223: 28.00 | I223: 37336 | J223: 8
A224: =ROW()-5 -> 219 | B224: H- | C224: 5193 | D224: 1 | E224: 05193-3 | F224: 日语试卷评析与应试指导（含配套音带） | G224: 发展中心 | H224: 22.00 | I224: 37316 | J224: 10
F225: 新世纪英语考试大纲词汇手册丛书
A226: =ROW()-5 -> 221 | B226: H- | C226: 4146 | D226: 1 | E226: 04146-6 | F226: 同等学历申请硕士学位英语考试大纲词汇 手册 | G226: 安 枚 | H226: 12 | I226: 37377 | J226: 20
A227: =ROW()-5 -> 222 | B227: H- | C227: 4145 | D227: 1 | E227: 04145-8 | F227: 硕士研究生入学考试英语大纲词汇手册 | G227: 安 枚 | H227: 13.5 | I227: 37012 | J227: 18
A228: =ROW()-5 -> 223 | B228: H- | C228: 4192 | D228: 1 | E228: 04192-X | F228: 高等教育自学考试公共英语考试（专科和本科）大纲词汇手册 | G228: 刘建评 | H228: 12 | I228: 36982 | J228: 22
A229: =ROW()-5 -> 224 | B229: H- | C229: 4147 | D229: 1 | E229: 04147-4 | F229: MBA 入学考试英语大纲词汇手册 | G229: 刘 清 | H229: 12 | I229: 37073 | J229: 19
A230: =ROW()-5 -> 225 | B230: H- | C230: 4244 | D230: 1 | E230: 04244-6 | F230: 全国公共英语等级考试大纲词汇手册 （1-3级） | G230: 周雄方 | H230: 12 | I230: 36982 | J230: 18
A231: =ROW()-5 -> 226 | B231: H- | C231: 4196 | D231: 1 | E231: 04196-2 | F231: 全国公共英语等级考试大纲词汇手册 （4-5级） | G231: 周雄方 | H231: 18 | I231: 37408 | J231: 14
A232: =ROW()-5 -> 227 | B232: H- | C232: 4175 | D232: 1 | E232: 04175-X | F232: 全国高考英语大纲词汇手册 | G232: 李汤灵 | H232: 9 | I232: 37012 | J232: 27
A233: =ROW()-5 -> 228 | B233: H- | C233: 4243 | D233: 1 | E233: 04243-8 | F233: 专升本英语考试大纲词汇手册 | G233: 成 枫 | H233: 12 | I233: 37337 | J233: 20
A234: =ROW()-5 -> 229 | B234: H | C234: 4191 | D234: 1 | E234: 04191-1 | F234: 高等专科英语考试大纲词汇手册 | G234: 汤 华 | H234: 12 | I234: 36951 | J234: 20
A235: =ROW()-5 -> 230 | B235: H- | C235: 1063 | D235: 1 | E235: 01063-3 | F235: 学历文凭考试基础英语大纲词汇手册 | G235: 张 千力 | H235: 10 | I235: 37226 | J235: 23
A236: =ROW()-5 -> 231 | B236: H- | C236: 5083 | D236: 1 | E236: 05083-X | F236: 成人高考英语大纲词汇手册 | G236: 李汤灵 | H236: 8.00 | I236: 2002.1 | J236: 25
A237: =ROW()-5 -> 232 | B237: H- | C237: 4921 | D237: 1 | E237: 04921-1 | F237: 大学英语学习手册（第1册） | G237: 佟学伶主编 | H237: 12.00 | I237: 2001.12 | J237: 20
A238: =ROW()-5 -> 233 | B238: H- | C238: 4922 | D238: 1 | E238: 04922-X | F238: 大学英语学习手册（第2册） | G238: 佟学伶主编 | H238: 12 | I238: 37226 | J238: 20
A239: =ROW()-5 -> 234 | B239: H- | C239: 4923 | D239: 1 | E239: 04923-8 | F239: 大学英语学习手册（第3册） | G239: 佟学伶主编 | H239: 13.50 | I239: 2002.1 | J239: 18
F240: 职称英语考试迎考必读
A241: =ROW()-5 -> 236 | B241: H- | C241: 4368 | D241: 1 | E241: 04368-X | F241: 全国专业技术人员职称英语等级考试指导 综合与人文类 | G241: 赵恒元 | H241: 32 | I241: 37104 | J241: 7
A242: =ROW()-5 -> 237 | B242: H- | C242: 4582 | D242: 1 | E242: 04582-8 | F242: 全国专业技术人员职称英语等级考试指导 财经类 | G242: 赵恒元 | H242: 34 | I242: 37104 | J242: 7
A243: =ROW()-5 -> 238 | B243: H- | C243: 4805 | D243: 1 | E243: 04805-3 | F243: 全国专业技术人员职称英语等级考试指导 卫生类 | G243: 赵恒元 | H243: 32 | I243: 37165 | J243: 8
A244: =ROW()-5 -> 239 | B244: H- | C244: 4173 | D244: 1 | E244: 04173-3 | F244: 全国专业技术人员职称英语等级考试指导 理工科类 | G244: 赵恒元 | H244: 29.8 | I244: 36861 | J244: 9
A245: =ROW()-5 -> 240 | B245: H- | C245: 4814 | D245: 1 | E245: 04814-2 | F245: 职称英语考试大纲词汇背诵手册 | G245: 黄淑琳 | H245: 17 | I245: 37226 | J245: 14
A246: =ROW()-5 -> 241 | B246: H- | C246: 1073 | D246: 1 | E246: 01073-0 | F246: 全国职称英语等级考试大纲词汇详解 | G246: 黄淑琳等 | H246: 28 | I246: 36617 | J246: 9
A247: =ROW()-5 -> 242 | B247: H- | C247: 4059 | D247: 1 | E247: 04059-1 | F247: 全国职称英语等级考试模拟试题 | G247: 黄淑琳等 | H247: 24.5 | I247: 36861 | J247: 10
F248: 钟道隆学习法系列
F249: 钟道隆教授
F250: 45岁自学英语口语,一年后成为口语翻译.
F251: 52岁自学电脑,十几年写作与翻译二十余本书.
F252: 57岁学习和研究记忆方法,极大提高了记忆力.
A253: =ROW()-5 -> 248 | B253: G- | C253: 4849 | D253: 1 | E253: 04849-5 | F253: 逆向法丛书――学习贵在开窍 | G253: 钟道隆 | H253: 15.00 | I253: 2002.4 | J253: 17
A254: =ROW()-5 -> 249 | B254: H- | C254: 5698 | D254: 1 | E254: 05698-6 | F254: 逆向法丛书――踏踏实实学英语――英语学习逆向法 | G254: 钟道隆 | H254: 15.00 | I254: 37530 | J254: 16
A255: =ROW()-5 -> 250 | B255: G- | C255: 0761 | D255: 2 | E255: 00761-6 | F255: 记忆的窍门（第二版） | G255: 钟道隆 | H255: 10 | I255: 37329 | J255: 30
A256: =ROW()-5 -> 251 | B256: H- | C256: 4232 | D256: 1 | E256: 04232-2 | F256: 逆向法巧学英语 (第3.1版) | G256: 钟道隆 | H256: 18 | I256: 37257 | J256: 17
A257: =ROW()-5 -> 252 | B257: CD | C257: 3719 | D257: 1 | F257: 逆向法巧学英语 (第3版)（光盘） | G257: 钟道隆 | H257: 28 | I257: 37135 | J257: 25
A258: =ROW()-5 -> 253 | B258: CD | C258: 4002 | D258: 1 | F258: 趣味慢速英语 （第一辑 书+音带） | G258: 钟道隆 | H258: 18 | I258: 37226 | J258: 8
A259: =ROW()-5 -> 254 | B259: CD | C259: 4031 | D259: 1 | F259: 趣味慢速英语 （第二辑 书+音带） | G259: 钟道隆 | H259: 18 | I259: 37226 | J259: 8
A260: =ROW()-5 -> 255 | B260: CD | C260: 4039 | D260: 1 | F260: 趣味慢速英语 （第三辑 书+音带） | G260: 钟道隆 | H260: 18 | I260: 37135 | J260: 8
A261: =ROW()-5 -> 256 | B261: CD | C261: 4010 | D261: 1 | F261: 趣味慢速英语 （第四辑 书+音带） | G261: 钟道隆 | H261: 18 | I261: 37226 | J261: 8
A262: =ROW()-5 -> 257 | B262: CD | C262: 88014 | D262: 3 | F262: 趣味慢速英语 （第五辑 书+音带） | G262: 钟道隆 | H262: 18.00 | I262: 37316 | J262: 10
A263: =ROW()-5 -> 258 | B263: CD | C263: 88014 | D263: 4 | F263: 趣味慢速英语 （第六辑 书+音带） | G263: 钟道隆 | H263: 18.00 | I263: 37316 | J263: 10
A264: =ROW()-5 -> 259 | B264: CD | C264: 0156 | D264: 1 | F264: 趣味慢速英语 （第七辑 1书+2音带） | G264: 钟道隆 | H264: 18.00 | I264: 37400 | J264: 10
A265: =ROW()-5 -> 260 | B265: CD | C265: 0168 | D265: 1 | E265: 7880141685 | F265: 趣味慢速英语 (第八辑 1本书+2音带） | G265: 钟道隆 | H265: 18.00 | I265: 37469 | J265: 5
A266: =ROW()-5 -> 261 | B266: CD | C266: 4232 | D266: 1 | F266: 慢速英语听力练习 （第3版）（音带3盘） | G266: 钟道隆 | H266: 21 | I266: 36892 | J266: 8
A267: =ROW()-5 -> 262 | B267: CD | C267: 9957 | D267: 1 | F267: 踏踏实实学英语 (音带2盘) | G267: 钟道隆 | H267: 14 | I267: 36434 | J267: 12
A268: =ROW()-5 -> 263 | B268: VD | C268: 9996 | D268: 1 | E268: 9996100 | F268: 踏踏实实学英语 (VCD2盘) | G268: 钟道隆 | H268: 25 | I268: 36617 | J268: 25
A269: =ROW()-5 -> 264 | B269: H- | C269: 3119 | D269: 5 | E269: 03119-3 | F269: 听遍全世界 | G269: 钟道隆 | H269: 14.5 | I269: 37288 | J269: 20
A270: =ROW()-5 -> 265 | B270: H- | C270: 5196 | D270: 1 | E270: 05196-8 | F270: 听遍全世界（第二版） | G270: 钟道隆 | H270: 14 | I270: 37368 | J270: 20
A271: =ROW()-5 -> 266 | B271: CD | C271: 3119 | D271: 1 | F271: 听遍全世界 音带3盘 | G271: 钟道隆 | H271: 21 | I271: 1998 | J271: 3
A272: =ROW()-5 -> 267 | B272: GP | C272: 2265 | D272: 1 | E272: 7900622659 | F272: 听遍全世界 CD-ROM 1盘 | G272: 钟道隆 | H272: 29 | I272: 36647 | J272: 25
A273: =ROW()-5 -> 268 | B273: G- | C273: 2804 | D273: 3 | E273: 02804-4 | F273: 学习成功的乐趣――从学会英语与电脑说起 | G273: 钟道隆 | H273: 10 | I273: 36982 | J273: 30
A274: =ROW()-5 -> 269 | B274: TP | C274: 4557 | D274: 1 | E274: 04557-7 | F274: 巧学巧用系列丛书――巧学巧用五笔字型 (第3版）（计算机书目已列） | G274: 钟道隆 | H274: 23.00 | I274: 37073 | J274: 11
A275: =ROW()-5 -> 270 | B275: TP | C275: 2190 | D275: 8 | E275: 02190-2 | F275: 巧学巧用系列丛书――巧学巧用五笔字型 （第2版） (计算机书目已列） | G275: 钟道隆 | H275: 18.8 | I275: 36465 | J275: 12
A276: =ROW()-5 -> 271 | B276: GP | C276: 1744 | D276: 1 | E276: 7900617442 | F276: 逆向法巧学英语（配书） | G276: 本 社 | H276: 38 | I276: 1998.9 | J276: 10
A277: =ROW()-5 -> 272 | B277: H- | C277: 4000 | D277: 2 | E277: 788014000 | F277: 钟道隆逆向法文库 | G277: 本 社 | H277: 140 | I277: 37347 | J277: 2
F278: 国外考试用书（TOEFL、GRE、IELTS等）
A279: =ROW()-5 -> 274 | B279: H- | C279: 3839 | D279: 1 | E279: 03839-20 | F279: 10000词语――TOEFL\EPT\ GMAT 考试必备 （第二版） | G279: 汪礼瑞 | H279: 24 | I279: 37336 | J279: 9
A280: =ROW()-5 -> 275 | B280: H- | C280: 4370 | D280: 1 | E280: 04370-1 | F280: 易混淆的 GRE 单词手册 | G280: 邵 华 | H280: 14 | I280: 37073 | J280: 15
A281: =ROW()-5 -> 276 | B281: H- | C281: 4760 | D281: 1 | E281: 04760-X | F281: 攻克 GRE 类比/反义词 | G281: 云 帆 | H281: 36 | I281: 37196 | J281: 7
A282: =ROW()-5 -> 277 | B282: H- | C282: 5108 | D282: 1 | E282: 05108-9 | F282: 最新雅思考试指南・学术类（原版影印）(含2盒磁带） | G282: Penny Cameron等 | H282: 42 | I282: 37257 | J282: 4
A283: =ROW()-5 -> 278 | B283: H- | C283: 5109 | D283: 1 | E283: 05109-7 | F283: 最新雅思考试指南・普通类（原版影印）(含2盒磁带） | G283: Penny Cameron等 | H283: 42 | I283: 37258 | J283: 3
A284: =ROW()-5 -> 279 | B284: H- | C284: 1508 | D284: 8 | E284: 01508-2 | F284: TOEFL词汇精选（含美国国内试题词汇） | G284: 吴永麟 | H284: 7.5 | I284: 37226 | J284: 20
A285: =ROW()-5 -> 280 | B285: H- | C285: 1246 | D285: 7 | E285: 01246-6 | F285: 英语阅读理解指南――TOEFL\EPT\GMAT 必备 | G285: 汪礼瑞 | H285: 10 | I285: 37104 | J285: 20
F286: 大学英语四、六级考试用书
F287: 有声记忆――国内首创、听说领先、正确发音、全面立体、高效永久的记忆
A288: =ROW()-5 -> 283 | B288: H- | C288: 3968 | D288: 2 | E288: 03968-2 | F288: 有声记忆 ―― 最新大学英语四级词汇活用 词典（配音带4盘） | G288: 胡宛如 | H288: 45 | I288: 37165 | J288: 3
A289: =ROW()-5 -> 284 | B289: P- | C289: 3100 | D289: 1 | E289: 7900631003 | F289: 有声记忆 ―― 最新大学英语四级词汇活用 词典（配CD-ROM光盘1张） | G289: 胡宛如 | H289: 32 | I289: 37104 | J289: 9
A290: =ROW()-5 -> 285 | B290: H- | C290: 5131 | D290: 1 | F290: 有声记忆 ―― 最新大学英语四级词汇活用 词典（配音带4盘 配CD-ROM光盘1张） | G290: 胡宛如 | H290: 56 | I290: 37257 | J290: 3
A291: =ROW()-5 -> 286 | B291: H- | C291: 4236 | D291: 2 | E291: 04236-5 | F291: 有声记忆 ―― 最新大学英语六级词汇活用 词典（配音带3盘） | G291: 胡宛如 | H291: 30 | I291: 37341 | J291: 5
A292: =ROW()-5 -> 287 | B292: P- | C292: 3101 | D292: 1 | E292: 7900631011 | F292: 有声记忆 ―― 最新大学英语六级词汇活用 词典（配CD-ROM光盘1张） | G292: 胡宛如 | H292: 20 | I292: 37408 | J292: 25
A293: =ROW()-5 -> 288 | B293: H- | C293: 5132 | D293: 1 | E293: 05132-1 | F293: 有声记忆 ―― 最新大学英语六级词汇活用 词典（配音带3盘 配CD-ROM光盘1张） | G293: 胡宛如 | H293: 38 | I293: 37408 | J293: 4
A294: =ROW()-5 -> 289 | B294: H- | C294: 2623 | D294: 4 | E294: 02623-8 | F294: 大学英语四级通用词汇活用词典 | G294: 张守樟等 | H294: 20 | I294: 36586 | J294: 9
A295: =ROW()-5 -> 290 | B295: H- | C295: 3389 | D295: 2 | E295: 03389-7 | F295: 新编大学英语四级统考模试题及精解 | G295: 李俊峰等 | H295: 15.5 | I295: 37196 | J295: 14
A296: =ROW()-5 -> 291 | B296: CD | C296: 3389 | D296: 1 | F296: 新编大学英语四级统考模试题及精解 音带 | G296: 李俊峰等 | H296: 21 | I296: 36312 | J296: 10
A297: =ROW()-5 -> 292 | B297: H- | C297: 4568 | D297: 1 | E297: 04568-2 | F297: 高级英语应试阅读系列――Reading For CET-4 四级阅读 | G297: 朱 篱 | H297: 20 | I297: 37469 | J297: 15
A298: =ROW()-5 -> 293 | B298: CD | C298: 4568 | D298: 1 | F298: 高级英语应试阅读系列――Reading For CET-4 四级阅读（4音带） | G298: 朱 篱 | H298: 28 | I298: 37226 | J298: 7
A299: =ROW()-5 -> 294 | B299: H- | C299: 4569 | D299: 1 | E299: 04569-1 | F299: 高级英语应试阅读系列――Reading For CET-6 六级阅读 | G299: 朱 篱 | H299: 20.00 | I299: 37469 | J299: 14
A300: =ROW()-5 -> 295 | B300: CD | C300: 4569 | D300: 1 | E300: 04569-1 | F300: 高级英语应试阅读系列――Reading For CET-6 六级阅读（4音带） | G300: 朱 篱 | H300: 28.00 | I300: 37389 | J300: 10
A301: =ROW()-5 -> 296 | B301: H- | C301: 3063 | D301: 2 | E301: 03063-4 | F301: 大学英语三级考试指导与练习 | G301: 刘玉萍 | H301: 16 | I301: 37469 | J301: 12
F302: 考研用书（硕士生、博士生入学考试、申请学位考试）
A303: =ROW()-5 -> 298 | B303: H- | C303: 5862 | D303: 1 | E303: 04467-8 | F303: MBA全国联考清华辅导教材：英语（2003）(含音带2盘) | G303: 王敬慧等 | H303: 53 | I303: 37500 | J303: 11
A304: =ROW()-5 -> 299 | B304: H- | C304: 2191 | D304: 1 | E304: 02191-0 | F304: 清华大学博士生入学考试英语试题选编 （修订版） | G304: 罗立胜等 | H304: 22 | I304: 37500 | J304: 12
A305: =ROW()-5 -> 300 | B305: CD | C305: 2191 | D305: 1 | F305: 清华大学博士生入学考试英语试题选编 （修订版）音带2盘 | H305: 14 | I305: 36586 | J305: 12
A306: =ROW()-5 -> 301 | B306: H- | C306: 5044 | D306: 1 | E306: 05044-9 | F306: 清华大学博士生入学考试词汇训练 | G306: 刘 延等 | H306: 19 | I306: 37520 | J306: 14
A307: =ROW()-5 -> 302 | B307: H- | C307: 4915 | D307: 1 | E307: 04915-7 | F307: 高级英语应试阅读系列――Reading For NETEM 考研阅读 | G307: 朱 篱 | H307: 15 | I307: 37196 | J307: 18
A308: =ROW()-5 -> 303 | B308: H- | C308: 4627 | D308: 1 | E308: 04627-1 | F308: 全国硕士研究生入学考试――英语听力突破 | G308: 何赋声 | H308: 24 | I308: 37104 | J308: 14
A309: =ROW()-5 -> 304 | B309: CD | C309: 4627 | D309: 1 | F309: 全国硕士研究生入学考试――英语听力突破 音带 4 盘 | H309: 28
A310: =ROW()-5 -> 305 | B310: H- | C310: 4649 | D310: 1 | E310: 04649-2 | F310: 全国硕士研究生入学考试――英语考点透视 | G310: 赵恒元 | H310: 36.00 | I310: 37105 | J310: 8
F311: 2002年在职攻读硕士学位入学考试全国联考英语应试教程
A312: =ROW()-5 -> 307 | B312: H- | C312: 5490 | D312: 1 | E312: 05490-8 | F312: 2002年在职攻读硕士学位入学考试全国联考英语应试教程――词汇分册 | G312: 杨芳 | H312: 20.00 | I312: 37408 | J312: 16
A313: =ROW()-5 -> 308 | B313: H- | C313: 5431 | D313: 1 | E313: 05431-2 | F313: 2002年在职攻读硕士学位入学考试全国联考英语应试教程――语法分册 | G313: 何福胜等 | H313: 20.00 | I313: 37408 | J313: 15
A314: =ROW()-5 -> 309 | B314: H- | C314: 5468 | D314: 1 | E314: 05468-1 | F314: 2002年在职攻读硕士学位入学考试全国联考英语应试教程――阅读分册 | G314: 王敬慧 | H314: 12.00 | I314: 37408 | J314: 23
A315: =ROW()-5 -> 310 | B315: H- | C315: 5469 | D315: 1 | E315: 05469-X | F315: 2002年在职攻读硕士学位入学考试全国联考英语应试教程――完形填空 | G315: 罗承丽 | H315: 13.00 | I315: 37408 | J315: 20
A316: =ROW()-5 -> 311 | B316: H- | C316: 5470 | D316: 1 | E316: 05470-3 | F316: 2002年在职攻读硕士学位入学考试全国联考英语应试教程――翻译分册 | G316: 许建平 | H316: 15.00 | I316: 37408 | J316: 20
A317: =ROW()-5 -> 312 | B317: H- | C317: 5471 | D317: 1 | E317: 05471-1 | F317: 2002年在职攻读硕士学位入学考试全国联考英语应试教程――写作分册 | G317: 封宗信 | H317: 15.00 | I317: 37408 | J317: 18
A318: =ROW()-5 -> 313 | B318: H- | C318: 5467 | D318: 1 | E318: 05467-3 | F318: 2002年在职攻读硕士学位入学考试全国联考英语应试教程――模拟试题 | G318: 穆凤良 | H318: 19.00 | I318: 37408 | J318: 15
F319: 其他考试类用书
A320: =ROW()-5 -> 315 | B320: H- | C320: 3661 | D320: 1 | E320: 03661-6 | F320: 英语阅读理解百篇应试训练 四六级、EPT、GRE、TOEFL、考研必备 | G320: 曾传生等 | H320: 22 | I320: 36465 | J320: 12
A321: =ROW()-5 -> 316 | B321: H- | C321: 2956 | D321: 3 | E321: 02956-3 | F321: 美国文学学习指南――美国文学及选读综合练习 | G321: 李翠亭等 | H321: 10 | I321: 37469 | J321: 22
A322: =ROW()-5 -> 317 | B322: H- | C322: 4983 | D322: 1 | E322: 04983-1 | F322: HSK汉语水平考试听力题型分析与训练（初、高中） | G322: 王小宁等 | H322: 34 | I322: 2002.2 | J322: 12
A323: =ROW()-5 -> 318 | B323: CD | C323: 4983 | D323: 1 | E323: 7880141510 | F323: HSK汉语水平考试听力题型分析与训练（初、中等）（4盘音带） | H323: 28 | I323: 2002.3 | J323: 10
A324: =ROW()-5 -> 319 | B324: H- | C324: 3149 | D324: 3 | E324: 03149-5 | F324: 英国文学学习指南 | G324: 李正栓等 | H324: 15 | I324: 37500 | J324: 14
A325: =ROW()-5 -> 320 | B325: CD | C325: 4011 | D325: 1 | F325: 高考英语听力备战（3CD+书） | G325: 段汝佳等 | H325: 28 | I325: 37226 | J325: 8
F326: 优秀电影文学欣赏系列
G327: ―― 老剧本、新品味
F328: 英汉对照电影剧本，原版电影录音
A329: =ROW()-5 -> 324 | B329: H- | C329: 4188 | D329: 1 | E329: 04188-1 | F329: 克莱默夫妇 | G329: 杨慎生等 | H329: 9.50 | I329: 37043 | J329: 30
A330: =ROW()-5 -> 325 | B330: H- | C330: 4457 | D330: 1 | E330: 04457-0 | F330: 欲望号街车 | G330: 杨慎生等 | H330: 12.00 | I330: 37043 | J330: 25
A331: =ROW()-5 -> 326 | B331: H- | C331: 4320 | D331: 1 | E331: 04320-5 | F331: 鸳梦重温 | G331: 杨慎生等 | H331: 12.00 | I331: 37073 | J331: 24
A332: =ROW()-5 -> 327 | B332: H- | C332: 1702 | D332: 7 | E332: 01702-6 | F332: 魂断蓝桥 | G332: 杨慎生等 | H332: 6.2 | I332: 1999 | J332: 32
A333: =ROW()-5 -> 328 | B333: CD | C333: 1702 | D333: 2 | F333: 魂断蓝桥 音带2盘 | G333: 杨慎生等 | H333: 20 | I333: 1996 | J333: 12
A334: =ROW()-5 -> 329 | B334: H- | C334: 1701 | D334: 6 | E334: 01701-8 | F334: 卡萨布兰卡 | G334: 杨慎生等 | H334: 7.9 | I334: 1999 | J334: 30
A335: =ROW()-5 -> 330 | B335: CD | C335: 1701 | D335: 1 | F335: 卡萨布兰卡 音带2盘 | G335: 杨慎生等 | H335: 20 | I335: 1996 | J335: 12
A336: =ROW()-5 -> 331 | B336: H- | C336: 1720 | D336: 6 | E336: 01720-4 | F336: 飘 | G336: 杨慎生等 | H336: 13 | I336: 36647 | J336: 16
A337: =ROW()-5 -> 332 | B337: CD | C337: 1720 | D337: 0 | F337: 飘 音带4盘 | G337: 杨慎生等 | H337: 40 | I337: 1996 | J337: 6
A338: =ROW()-5 -> 333 | B338: H- | C338: 2169 | D338: 6 | E338: 02169-4 | F338: 简・爱 | G338: 杨慎生等 | H338: 5.5 | I338: 1999 | J338: 40
A339: =ROW()-5 -> 334 | B339: CD | C339: 2169 | D339: 9 | F339: 简・爱 音带2盘 | G339: 杨慎生等 | H339: 20 | I339: 1996 | J339: 12
A340: =ROW()-5 -> 335 | B340: H- | C340: 2313 | D340: 3 | E340: 02313-1 | F340: 一夜风流 | G340: 杨慎生等 | H340: 9.8 | I340: 1998 | J340: 22
A341: =ROW()-5 -> 336 | B341: CD | C341: 2313 | D341: 1 | F341: 一夜风流 音带2盘 | G341: 杨慎生等 | H341: 20 | I341: 1996 | J341: 12
A342: =ROW()-5 -> 337 | B342: H- | C342: 2460 | D342: 3 | E342: 02460-X | F342: 远大前程 | G342: 杨慎生等 | H342: 4.8 | I342: 36647 | J342: 45
A343: =ROW()-5 -> 338 | B343: CD | C343: 0003 | D343: 1 | F343: 远大前程 音带2盘 | G343: 杨慎生等 | H343: 20 | I343: 1996 | J343: 12
A344: =ROW()-5 -> 339 | B344: H- | C344: 3532 | D344: 1 | E344: 03532-6 | F344: 公民凯恩 | G344: 杨慎生等 | H344: 10 | I344: 36312 | J344: 23
A345: =ROW()-5 -> 340 | B345: CD | C345: 0004 | D345: 1 | F345: 公民凯恩 音带2盘 | G345: 杨慎生等 | H345: 20 | I345: 1996 | J345: 12
A346: =ROW()-5 -> 341 | B346: H- | C346: 2441 | D346: 3 | E346: 02441-3 | F346: 相见恨晚 | G346: 杨慎生等 | H346: 7 | I346: 1999 | J346: 40
A347: =ROW()-5 -> 342 | B347: CD | C347: 0002 | D347: 2 | F347: 相见恨晚 音带2盘 | G347: 杨慎生等 | H347: 20 | I347: 1996 | J347: 12
A348: =ROW()-5 -> 343 | B348: H- | C348: 2351 | D348: 2 | E348: 02351-4 | F348: 呼啸山庄 | G348: 杨慎生等 | H348: 6.5 | I348: 36647 | J348: 30
A349: =ROW()-5 -> 344 | B349: CD | C349: 2351 | D349: 1 | F349: 呼啸山庄 音带2盘 | G349: 杨慎生等 | H349: 20 | I349: 1996 | J349: 12
A350: =ROW()-5 -> 345 | B350: H- | C350: 3131 | D350: 1 | E350: 03131-2 | F350: 音乐之声 | G350: 杨慎生等 | H350: 6.5 | I350: 1998 | J350: 30
A351: =ROW()-5 -> 346 | B351: CD | C351: 3131 | D351: 1 | F351: 音乐之声 音带3盘 | G351: 杨慎生等 | H351: 24 | I351: 1998 | J351: 8
A352: =ROW()-5 -> 347 | B352: H- | C352: 2185 | D352: 1 | E352: 02185-6 | F352: 爱情故事 | G352: 杨慎生等 | H352: 6 | I352: 36495 | J352: 40
A353: =ROW()-5 -> 348 | B353: CD | C353: 2185 | D353: 1 | F353: 爱情故事 音带2盘 | G353: 杨慎生等 | H353: 16 | I353: 36586 | J353: 12
A354: =ROW()-5 -> 349 | B354: H- | C354: 3167 | D354: 1 | E354: 03167-3 | F354: 双重赔款 | G354: 杨慎生等 | H354: 9 | I354: 1998 | J354: 20
A355: =ROW()-5 -> 350 | B355: CD | C355: 3167 | D355: 1 | F355: 双重赔款 音带2盘 | G355: 杨慎生等 | H355: 16 | I355: 1998 | J355: 12
F356: 世界名著精选
F357: 初级阶段的良好读本―― 充实常用单词实力，奠定坚实语法基础。
F358: 孩子成长的良好伴侣，经典童话的收藏。
A359: =ROW()-5 -> 354 | B359: H- | C359: 3142 | D359: 2 | E359: 03142- | F359: 常春藤初级英文读本――顽童流浪记 | G359: 赖世雄 | H359: 13.8 | I359: 36586 | J359: 25
A360: =ROW()-5 -> 355 | B360: H- | C360: 3145 | D360: 2 | E360: 03145-2 | F360: 常春藤初级英文读本――王子复仇记 | G360: 赖世雄 | H360: 13.8 | I360: 36586 | J360: 25
A361: =ROW()-5 -> 356 | B361: H- | C361: 3144 | D361: 1 | E361: 03144-4 | F361: 常春藤初级英文读本――尼洛与忠狗 | G361: 赖世雄 | H361: 13.8 | I361: 36617 | J361: 23
A362: =ROW()-5 -> 357 | B362: H- | C362: 3143 | D362: 2 | E362: 03143-6 | F362: 常春藤初级英文读本――格列佛游记 | G362: 赖世雄 | H362: 13.8 | I362: 36586 | J362: 27
A363: =ROW()-5 -> 358 | B363: H- | C363: 3244 | D363: 1 | E363: 03244-0 | F363: 常春藤初级英文读本――威尼斯商人 | G363: 赖世雄 | H363: 13.8 | I363: 37104 | J363: 25
A364: =ROW()-5 -> 359 | B364: H- | C364: 3297 | D364: 1 | E364: 03297-1 | F364: 常春藤初级英文读本――圣诞颂 | G364: 赖世雄 | H364: 13.8 | I364: 37257 | J364: 25
A365: =ROW()-5 -> 360 | B365: H- | C365: 3353 | D365: 1 | E365: 03353-6 | F365: 常春藤初级英文读本――最后一课 | G365: 赖世雄 | H365: 13.8 | I365: 37104 | J365: 23
F366: 常春藤英语书架
F367: 高品质的图书、良好的教学方式
G368: ―― 引导读者迈向最佳英语学习环境
A369: =ROW()-5 -> 364 | B369: H- | C369: 1054 | D369: 1 | E369: 01054-4 | F369: 常春藤名家散文背诵选 | G369: 赖世雄 | H369: 16 | I369: 37104 | J369: 20
A370: =ROW()-5 -> 365 | B370: CD | C370: 1054 | D370: 1 | F370: 常春藤名家散文背诵选 音带2盘 | G370: 赖世雄 | H370: 14 | I370: 36708 | J370: 13
A371: =ROW()-5 -> 366 | B371: H- | C371: 2639 | D371: 2 | E371: 02639-4 | F371: 英文实用解析词汇（上） | G371: 赖世雄 | H371: 29.8 | I371: 1997 | J371: 9
A372: =ROW()-5 -> 367 | B372: H- | C372: 2640 | D372: 2 | E372: 02640-8 | F372: 英文实用解析词汇（下） | G372: 赖世雄 | H372: 29.8 | I372: 1997 | J372: 9
A373: =ROW()-5 -> 368 | B373: CD | C373: 2639 | D373: 1 | F373: 英文实用解析词汇（音带） | G373: 赖世雄 | H373: 28 | I373: 1998 | J373: 4
A374: =ROW()-5 -> 369 | B374: H- | C374: 1368 | D374: 1 | E374: 01368-3 | F374: 英语开口说 | G374: 蒋中容等 | H374: 12 | I374: 36586 | J374: 28
A375: =ROW()-5 -> 370 | B375: H- | C375: 1379 | D375: 1 | E375: 01379-9 | F375: 常用英文短语 | G375: 黄文玲 | H375: 9 | I375: 36617 | J375: 36
A376: =ROW()-5 -> 371 | B376: H- | C376: 0771 | D376: 1 | E376: 00771-3 | F376: 英文实用解析短语 | G376: 赖世雄等 | H376: 15 | I376: 36739 | J376: 23
A377: =ROW()-5 -> 372 | B377: H- | C377: 0798 | D377: 1 | E377: 00798-5 | F377: 实况旅游英语 | G377: 黄于文 | H377: 19.8 | I377: 36647 | J377: 17
A378: =ROW()-5 -> 373 | B378: CD | C378: 0798 | D378: 1 | F378: 实况旅游英语 音带2盘 | G378: 黄于文 | H378: 14 | I378: 36708 | J378: 13
A379: =ROW()-5 -> 374 | B379: P- | C379: 3027 | D379: 1 | E379: 7900630279 | F379: 普及美语（1）（配光盘）（ 最酷的美式口语自学用书） | G379: 赖世雄 | H379: 18 | I379: 36892 | J379: 24
A380: =ROW()-5 -> 375 | B380: P- | C380: 3709 | D380: 1 | E380: 7900637095 | F380: 普及美语（2）（配光盘） | G380: 赖世雄 | H380: 18 | I380: 37196 | J380: 25
A381: =ROW()-5 -> 376 | B381: P- | C381: 3704 | D381: 4 | E381: 7900637044 | F381: 普及美语（3）（配光盘） | G381: 赖世雄 | H381: 18.00 | I381: 37377 | J381: 25
A382: =ROW()-5 -> 377 | B382: P- | C382: 4128 | D382: 9 | E382: 7900641289 | F382: 普及美语（4）（配光盘） | G382: 赖世雄 | H382: 18.00 | I382: 37438 | J382: 25
A383: =ROW()-5 -> 378 | B383: P- | F383: 普及美语（5）（配光盘） | G383: 赖世雄 | H383: 18
F384: 独角兽英语阅读文库（中高级水平）
F385: Unicorn English Reading Library
F386: 独角兽是西方的一种象征物。“独角”寓意“专”，“兽”取其“猛”，
F387: 希望读者在英语阅读上用力既专且猛，让独角兽能把我们阅读道路上的拦路虎赶走。
F388: 专题兴趣阅读，具有馈赠好友与较高的欣赏及收藏价值。
A389: =ROW()-5 -> 384 | B389: H- | C389: 0755 | D389: 1 | E389: 00755-1 | F389: 爱情 ―― 丘比特之箭 | G389: 赵白生 | H389: 21 | I389: 37196 | J389: 15
A390: =ROW()-5 -> 385 | B390: H- | C390: 0638 | D390: 1 | E390: 00638-5 | F390: 金钱 ―― 一切谜语的谜底 | G390: 赵白生 | H390: 17 | I390: 37500 | J390: 18
A391: =ROW()-5 -> 386 | B391: H- | C391: 3886 | D391: 1 | E391: 03886-4 | F391: 心理 ―― 冰山的底层 | G391: 赵白生 | H391: 17.5 | I391: 37196 | J391: 18
A392: =ROW()-5 -> 387 | B392: H- | C392: 3973 | D392: 1 | E392: 03973-9 | F392: 两性 ―― 玫瑰与战争 | G392: 赵白生 | H392: 17.00 | I392: 37377 | J392: 18
A393: =ROW()-5 -> 388 | B393: H- | C393: 0730 | D393: 1 | E393: 00730-6 | F393: 法律 ―― 人类行为的规则 | G393: 赵白生 | H393: 18 | I393: 37500 | J393: 16
A394: =ROW()-5 -> 389 | B394: H- | C394: 1151 | D394: 1 | E394: 01151-6 | F394: 电影 ―― 黑暗中的凝视 | G394: 赵白生 | H394: 19.5 | I394: 36892 | J394: 17
A395: =ROW()-5 -> 390 | B395: H- | C395: 1052 | D395: 1 | E395: 01052-8 | F395: 体育 ―― 生命的旋律 | G395: 赵白生 | H395: 18 | I395: 36679 | J395: 16
F396: 世纪风铃阅读文库（英汉对照）
B397: 中等英语水平，世界热点话题，了解最新知识，检测阅读速度及理解能力，英汉对照，为您扫除一切阅读中的迷雾。
A398: =ROW()-5 -> 393 | B398: H- | C398: 1162 | D398: 1 | E398: 01162-1 | F398: 科学的奥秘 | G398: 范 红主编 | H398: 11.8 | I398: 36770 | J398: 25
A399: =ROW()-5 -> 394 | B399: H- | C399: 0731 | D399: 1 | E399: 00731-4 | F399: 当代名人趣闻 | G399: 范 红主编 | H399: 12.5 | I399: 37500 | J399: 25
A400: =ROW()-5 -> 395 | B400: H- | C400: 1327 | D400: 1 | E400: 01327-6 | F400: 新闻聚焦 | G400: 范 红主编 | H400: 10.5 | I400: 36951 | J400: 30
A401: =ROW()-5 -> 396 | B401: H- | C401: 4661 | D401: 1 | E401: 04461-1 | F401: 电脑大观园 | G401: 范 红主编 | H401: 12.8 | I401: 37104 | J401: 25
A402: =ROW()-5 -> 397 | B402: H- | C402: 4502 | D402: 1 | E402: 04502-X | F402: 美好生活启示 | G402: 范 红主编 | H402: 13 | I402: 37104 | J402: 25
A403: 美国中学生优秀作文选（英汉对照、配有音带）
F404: 领会丰富的文化意蕴，学习地道的美国英语
A405: =ROW()-5 -> 400 | B405: H- | C405: 3335 | D405: 1 | E405: 03335-8 | F405: 美国中学生优秀作文选――起飞 | G405: 吴薇等译 | H405: 12.8 | I405: 1999 | J405: 27
A406: =ROW()-5 -> 401 | B406: H- | C406: 3308 | D406: 1 | E406: 03308- | F406: 美国中学生优秀作文选――花季的梦 | G406: 赵恒元等译 | H406: 17.5 | I406: 36281 | J406: 18
A407: =ROW()-5 -> 402 | B407: H- | C407: 3309 | D407: 1 | E407: 03309-9 | F407: 美国中学生优秀作文选――出发 | G407: 吴践等译 | H407: 12.8 | I407: 1999 | J407: 26
A408: =ROW()-5 -> 403 | B408: H- | C408: 3310 | D408: 1 | E408: 03310-2 | F408: 美国中学生优秀作文选――笔下生奇 | G408: 张欣等译 | H408: 16 | I408: 36281 | J408: 21
A409: =ROW()-5 -> 404 | B409: H- | C409: 3706 | D409: 1 | E409: 03706-X | F409: 美国中学生优秀作文选――缤纷生活 | G409: 刘荣跃译 | H409: 14.5 | I409: 36495 | J409: 22
A410: =ROW()-5 -> 405 | B410: H- | C410: 3707 | D410: 1 | E410: 03707-8 | F410: 美国中学生优秀作文选――成长的故事 | G410: 林 锋译 | H410: 16 | I410: 36495 | J410: 20
A411: =ROW()-5 -> 406 | B411: CD | C411: 3335 | D411: 1 | F411: 美国中学生优秀作文选――起飞 （音带） | H411: 7 | I411: 36281 | J411: 30
A412: =ROW()-5 -> 407 | B412: CD | C412: 3308 | D412: 1 | F412: 美国中学生优秀作文选――花季的梦 （音带） | H412: 7 | I412: 36281 | J412: 30
A413: =ROW()-5 -> 408 | B413: CD | C413: 3309 | D413: 1 | F413: 美国中学生优秀作文选――出发（音带） | H413: 7 | I413: 36281 | J413: 30
A414: =ROW()-5 -> 409 | B414: CD | C414: 3310 | D414: 1 | F414: 美国中学生优秀作文选――笔下生奇(音带) | H414: 7 | I414: 36281 | J414: 30
A415: =ROW()-5 -> 410 | B415: CD | C415: 3706 | D415: 1 | F415: 美国中学生优秀作文选――缤纷生活(音带) | H415: 7 | I415: 36586 | J415: 25
A416: =ROW()-5 -> 411 | B416: CD | C416: 3707 | D416: 1 | F416: 美国中学生优秀作文选――成长的故事 （音带） | H416: 7 | I416: 36587 | J416: 25
F417: 新目标小学英语
A418: =ROW()-5 -> 413 | B418: G- | C418: 5719 | D418: D | E418: 05719-2 | F418: 《新目标小学英语》预备级A学生用书 | G418: Ann Word | H418: 8.6 | I418: 37530 | J418: 40
A419: =ROW()-5 -> 414 | B419: G- | C419: 5719 | D419: C | E419: 05719-2 | F419: 《新目标小学英语》预备级B学生用书 | G419: Ann Word | H419: 8.6 | I419: 37530 | J419: 40
A420: =ROW()-5 -> 415 | B420: G- | C420: 5945 | D420: 1 | E420: 05945-4 | F420: 《新目标小学英语》预备级A、B教师用书 | G420: Ann Ward | H420: 8.8 | I420: 37530 | J420: 30
A421: =ROW()-5 -> 416 | B421: G- | C421: 5719 | D421: 1 | E421: 05719-2 | F421: 《新目标小学英语》1A学生用书 | G421: Ron Holt | H421: 8.6 | I421: 37469 | J421: 40
A422: =ROW()-5 -> 417 | B422: G- | C422: 5719 | D422: 2 | E422: 05719-2 | F422: 《新目标小学英语》1B学生用书 | G422: Ron Holt | H422: 8.6 | I422: 37469 | J422: 40
A423: =ROW()-5 -> 418 | B423: G- | C423: 5719 | D423: 8 | E423: 05719-2 | F423: 《新目标小学英语》2A学生用书 | G423: Ron Holt | H423: 8.6 | I423: 37500 | J423: 35
A424: =ROW()-5 -> 419 | B424: G- | C424: 5719 | D424: 7 | E424: 05719-2 | F424: 《新目标小学英语》2B学生用书 | G424: Ron Holt | H424: 8.6 | I424: 37500 | J424: 35
A425: =ROW()-5 -> 420 | B425: G- | C425: 5719 | D425: 4 | E425: 05719-2 | F425: 《新目标小学英语》3A学生用书 | G425: Ron Holt | H425: 8.6 | I425: 37500 | J425: 35
A426: =ROW()-5 -> 421 | B426: G- | C426: 5719 | D426: 3 | E426: 05719-2 | F426: 《新目标小学英语》3B学生用书 | G426: Ron Holt | H426: 8.6 | I426: 37500 | J426: 60
A427: =ROW()-5 -> 422 | B427: G- | C427: 5719 | D427: B | E427: 05719-2 | F427: 《新目标小学英语》4A学生用书 | G427: Ron Holt | H427: 8.6 | I427: 37500 | J427: 35
A428: =ROW()-5 -> 423 | B428: G- | C428: 5719 | D428: A | E428: 05719-2 | F428: 《新目标小学英语》4B学生用书 | G428: Ron Holt | H428: 8.6 | I428: 37500 | J428: 35
A429: =ROW()-5 -> 424 | B429: G- | C429: 5719 | D429: 9 | E429: 05719-2 | F429: 《新目标小学英语》5A学生用书 | G429: Ron Holt | H429: 8.6 | I429: 37500 | J429: 38
A430: =ROW()-5 -> 425 | B430: G- | C430: 5719 | D430: 0 | E430: 05719-2 | F430: 《新目标小学英语》5B学生用书 | G430: Ron Holt | H430: 8.6 | I430: 37500 | J430: 40
A431: =ROW()-5 -> 426 | B431: G- | C431: 5719 | D431: 5 | E431: 05719-2 | F431: 《新目标小学英语》6A学生用书 | G431: Ron Holt | H431: 8.6 | I431: 37500 | J431: 35
A432: =ROW()-5 -> 427 | B432: G- | C432: 5719 | D432: 6 | E432: 05719-2 | F432: 《新目标小学英语》6B学生用书 | G432: Ron Holt | H432: 8.6 | I432: 37500 | J432: 40
A433: =ROW()-5 -> 428 | B433: G- | C433: 5803 | D433: 2 | E433: 05803-2 | F433: 《新目标小学英语》1A教师用书 | G433: Ron Holt | H433: 6.8 | I433: 37500 | J433: 50
A434: =ROW()-5 -> 429 | B434: G- | C434: 5803 | D434: 6 | E434: 05803-2 | F434: 《新目标小学英语》1B教师用书 | G434: Ron Holt | H434: 6.8 | I434: 37500 | J434: 50
A435: =ROW()-5 -> 430 | B435: G- | C435: 5803 | D435: 1 | E435: 05803-2 | F435: 《新目标小学英语》2A教师用书 | G435: Ron Holt | H435: 6.8 | I435: 37500 | J435: 50
A436: =ROW()-5 -> 431 | B436: G- | C436: 5803 | D436: 5 | E436: 05803-2 | F436: 《新目标小学英语》2B教师用书 | G436: Ron Holt | H436: 6.8 | I436: 37500 | J436: 50
A437: =ROW()-5 -> 432 | B437: G- | C437: 5803 | D437: A | E437: 05803-2 | F437: 《新目标小学英语》3A教师用书 | G437: Ron Holt | H437: 6.8 | I437: 37530 | J437: 50
A438: =ROW()-5 -> 433 | B438: G- | C438: 5803 | D438: B | E438: 05803-2 | F438: 《新目标小学英语》3B教师用书 | G438: Ron Holt | H438: 6.8 | I438: 37530 | J438: 50
A439: =ROW()-5 -> 434 | B439: G- | C439: 5803 | D439: 0 | E439: 05803-2 | F439: 《新目标小学英语》4A教师用书 | G439: Ron Holt | H439: 6.8 | I439: 37530 | J439: 50
A440: =ROW()-5 -> 435 | B440: G- | C440: 5803 | D440: 9 | E440: 05803-2 | F440: 《新目标小学英语》4B教师用书 | G440: Ron Holt | H440: 6.8 | I440: 37530 | J440: 50
A441: =ROW()-5 -> 436 | B441: G- | C441: 5803 | D441: 8 | E441: 05803-2 | F441: 《新目标小学英语》5A教师用书 | G441: Ron Holt | H441: 6.8 | I441: 37530 | J441: 50
A442: =ROW()-5 -> 437 | B442: G- | C442: 5803 | D442: 7 | E442: 05803-2 | F442: 《新目标小学英语》5B教师用书 | G442: Ron Holt | H442: 6.8 | I442: 37530 | J442: 50
A443: =ROW()-5 -> 438 | B443: G- | C443: 5803 | D443: 4 | E443: 05803-2 | F443: 《新目标小学英语》6A教师用书 | G443: Ron Holt | H443: 6.8 | I443: 37500 | J443: 55
A444: =ROW()-5 -> 439 | B444: G- | C444: 5803 | D444: 3 | E444: 05803-2 | F444: 《新目标小学英语》6B教师用书 | G444: Ron Holt | H444: 6.8 | I444: 37500 | J444: 55
A445: =ROW()-5 -> 440 | B445: G- | C445: 5802 | D445: 1 | E445: 05802-4 | F445: 《新目标小学英语》1A活动手册 | G445: Ron Holt | H445: 4.2 | I445: 37500 | J445: 60
A446: =ROW()-5 -> 441 | B446: G- | C446: 5802 | D446: 2 | E446: 05802-4 | F446: 《新目标小学英语》1B活动手册 | G446: Ron Holt | H446: 4.2 | I446: 37500 | J446: 60
A447: =ROW()-5 -> 442 | B447: G- | C447: 5802 | D447: 5 | E447: 05802-4 | F447: 《新目标小学英语》2A活动手册 | G447: Ron Holt | H447: 4.2 | I447: 37500 | J447: 60
A448: =ROW()-5 -> 443 | B448: G- | C448: 5802 | D448: 4 | E448: 05802-4 | F448: 《新目标小学英语》2B活动手册 | G448: Ron Holt | H448: 4.2 | I448: 37500 | J448: 60
A449: =ROW()-5 -> 444 | B449: G- | C449: 5802 | D449: 9 | E449: 05802-4 | F449: 《新目标小学英语》3A活动手册 | G449: Ron Holt | H449: 4.2 | I449: 37500 | J449: 60
A450: =ROW()-5 -> 445 | B450: G- | C450: 5802 | D450: 8 | E450: 05802-4 | F450: 《新目标小学英语》3B活动手册 | G450: Ron Holt | H450: 4.2 | I450: 37500 | J450: 70
A451: =ROW()-5 -> 446 | B451: G- | C451: 5802 | D451: 7 | E451: 05802-4 | F451: 《新目标小学英语》4A活动手册 | G451: Ron Holt | H451: 4.2 | I451: 37500 | J451: 60
A452: =ROW()-5 -> 447 | B452: G- | C452: 5802 | D452: 6 | E452: 05802-4 | F452: 《新目标小学英语》4B活动手册 | G452: Ron Holt | H452: 4.2 | I452: 37500 | J452: 70
A453: =ROW()-5 -> 448 | B453: G- | C453: 5802 | D453: 3 | E453: 05802-4 | F453: 《新目标小学英语》5A活动手册 | G453: Ron Holt | H453: 4.2 | I453: 37500 | J453: 60
A454: =ROW()-5 -> 449 | B454: G- | C454: 5802 | D454: B | E454: 05802-4 | F454: 《新目标小学英语》5B活动手册 | G454: Ron Holt | H454: 4.2 | I454: 37500 | J454: 60
A455: =ROW()-5 -> 450 | B455: G- | C455: 5802 | D455: A | E455: 05802-4 | F455: 《新目标小学英语》6A活动手册 | G455: Ron Holt | H455: 4.2 | I455: 37500 | J455: 60
A456: =ROW()-5 -> 451 | B456: G- | C456: 5802 | D456: 1 | E456: 05802-4 | F456: 《新目标小学英语》6B活动手册 | G456: Ron Holt | H456: 4.2 | I456: 37500 | J456: 70
A457: =ROW()-5 -> 452 | B457: CD | C457: 0176 | D457: 7 | E457: 7880141766 | F457: 《新目标小学英语》预备级A/B音带 | H457: 7 | I457: 37500 | J457: 50
A458: =ROW()-5 -> 453 | B458: CD | C458: 0176 | D458: 1 | E458: 7880141766 | F458: 《新目标小学英语》1A/1B音带 | H458: 7 | I458: 37500 | J458: 50
A459: =ROW()-5 -> 454 | B459: CD | C459: 0176 | D459: 2 | E459: 7880141766 | F459: 《新目标小学英语》2A/2B音带 | H459: 7 | I459: 37500 | J459: 50
A460: =ROW()-5 -> 455 | B460: CD | C460: 0176 | D460: 3 | E460: 7880141766 | F460: 《新目标小学英语》3A/3B音带 | H460: 7 | I460: 37500 | J460: 50
A461: =ROW()-5 -> 456 | B461: CD | C461: 0176 | D461: 4 | E461: 7880141766 | F461: 《新目标小学英语》4A/4B音带 | H461: 7 | I461: 37500 | J461: 50
A462: =ROW()-5 -> 457 | B462: CD | C462: 0176 | D462: 5 | E462: 7880141766 | F462: 《新目标小学英语》5A/5B音带 | H462: 7 | I462: 37500 | J462: 50
A463: =ROW()-5 -> 458 | B463: CD | C463: 0176 | D463: 6 | E463: 7880141766 | F463: 《新目标小学英语》6A/6B音带 | H463: 7 | I463: 37500 | J463: 50
A464: =ROW()-5 -> 459 | B464: G- | C464: 5804 | D464: 1 | E464: 05804-0 | F464: 《新目标小学英语》字母手册 | G464: Ron Holt | H464: 4.8 | I464: 37500 | J464: 55
A465: =ROW()-5 -> 460 | B465: G- | C465: 5639 | D465: 1 | E465: 05639-0 | F465: 《新目标小学英语》挂图 | G465: Ron Holt | H465: 138 | I465: 37500 | J465: 13
F466: 清 华 英 语
E467: ――一套适合我国大、中、小学学生的系列英语教材，其中基础教育版根据最新颁布的《国家基础教育英语课程标准》编写
A468: =ROW()-5 -> 463 | B468: G- | C468: 4705 | D468: 2 | E468: 04705-7 | F468: 清华英语基础教育版 第1级第1册（功课手册）（供小学三年级起点选用） | H468: 5.8 | I468: 37364 | J468: 40
A469: =ROW()-5 -> 464 | B469: G- | C469: 4706 | D469: 2 | E469: 04706-5 | F469: 清华英语基础教育版 1A第1级第1册（学生用书） | H469: 8.80 | I469: 37316 | J469: 30
A470: =ROW()-5 -> 465 | B470: G- | C470: 5575 | D470: 1 | E470: 05575-0 | F470: 清华英语基础教育版第1级第2册（学生用书） | H470: 8.80 | I470: 37500 | J470: 30
F471: 小学英语实验教材
F472: 教育部基础教育教材审定办公室批准编写和试用。
F473: 小学三年级起始，一年级可以选用。
A474: =ROW()-5 -> 469 | B474: G- | C474: 3953 | D474: 2 | E474: 03953-4 | F474: 小学英语实验教材（1A） | G474: 清华大学 | H474: 15 | I474: 37500 | J474: 22
A475: =ROW()-5 -> 470 | B475: G- | C475: 3954 | D475: 1 | E475: 03954-2 | F475: 小学英语实验教材（1B） | G475: 清华大学 | H475: 15 | I475: 37316 | J475: 22
A476: =ROW()-5 -> 471 | B476: G- | C476: 4246 | D476: 2 | E476: 04246-2 | F476: 小学英语实验教材（2A） | G476: 清华大学 | H476: 15.00 | I476: 37469 | J476: 22
A477: =ROW()-5 -> 472 | B477: G- | C477: 4598 | D477: 2 | E477: 04598-4 | F477: 小学英语实验教材（2B) | G477: 清华大学 | H477: 15 | I477: 37288 | J477: 22
A478: =ROW()-5 -> 473 | B478: G- | C478: 4598 | D478: 1 | E478: 04598-4 | F478: 小学英语实验教材（3A） | G478: 清华大学 | H478: 15 | I478: 37469 | J478: 22
A479: =ROW()-5 -> 474 | B479: G- | C479: 4598 | D479: 3 | E479: 04598-4 | F479: 小学英语实验教材（3B） | G479: 清华大学 | H479: 15.00 | I479: 37257 | J479: 22
A480: =ROW()-5 -> 475 | B480: G- | C480: 4607 | D480: 8 | E480: 04607-7 | F480: 小学英语实验教材（4B）（普及版） | G480: 清华大学 | H480: 9.80 | I480: 37469 | J480: 25
A481: =ROW()-5 -> 476 | B481: G- | C481: 4607 | D481: 1 | E481: 04607-7 | F481: 小学英语实验教材（1A)（普及版） | G481: 清华大学 | H481: 9.8 | I481: 37500 | J481: 25
A482: =ROW()-5 -> 477 | B482: G- | C482: 4607 | D482: 2 | E482: 04607-7 | F482: 小学英语实验教材（1B)（普及版） | G482: 清华大学 | H482: 9.8 | I482: 37327 | J482: 25
A483: =ROW()-5 -> 478 | B483: G- | C483: 4607 | D483: 4 | E483: 04607-7 | F483: 小学英语实验教材（2A)（普及版） | G483: 清华大学 | H483: 9.8 | I483: 37469 | J483: 25
A484: =ROW()-5 -> 479 | B484: G- | C484: 4607 | D484: 5 | E484: 04607-7 | F484: 小学英语实验教材（2B)（普及版） | G484: 清华大学 | H484: 9.8 | I484: 37135 | J484: 25
A485: =ROW()-5 -> 480 | B485: G- | C485: 4607 | D485: 3 | E485: 04607-7 | F485: 小学英语实验教材（3A)（普及版） | G485: 清华大学 | H485: 9.8 | I485: 37226 | J485: 25
A486: =ROW()-5 -> 481 | B486: G- | C486: 4607 | D486: 7 | E486: 04607-7 | F486: 小学英语实验教材（3B)（普及版） | G486: 清华大学 | H486: 9.8 | I486: 37469 | J486: 25
A487: =ROW()-5 -> 482 | B487: G- | C487: 4607 | D487: 6 | E487: 04607-7 | F487: 小学英语实验教材（4A)（普及版） | G487: 清华大学 | H487: 9.8 | I487: 37438 | J487: 25
A488: =ROW()-5 -> 483 | B488: CD | C488: 3953 | D488: 1 | E488: 03953-4 | F488: 小学英语实验教材（1A）音带1盘 | G488: 清华大学 | H488: 7 | I488: 36739 | J488: 25
A489: =ROW()-5 -> 484 | B489: CD | C489: 3954 | D489: 1 | E489: 03954-2 | F489: 小学英语实验教材（1B）音带1盘 | G489: 清华大学 | H489: 7 | I489: 36739 | J489: 25
A490: =ROW()-5 -> 485 | B490: CD | C490: 4246 | D490: 2 | E490: 04246-2 | F490: 小学英语实验教材（2A）音带1盘 | G490: 清华大学 | H490: 7 | I490: 37074 | J490: 25
A491: =ROW()-5 -> 486 | B491: CD | C491: 4246 | D491: 1 | E491: 7880140050 | F491: 小学英语实验教材（2B）音带1盘 | G491: 清华大学 | H491: 7 | I491: 37073 | J491: 25
A492: =ROW()-5 -> 487 | B492: CD | C492: 4598 | D492: 1 | E492: 788014028X | F492: 小学英语实验教材（3A）音带1盘 | G492: 清华大学 | H492: 7 | I492: 37105 | J492: 25
A493: =ROW()-5 -> 488 | B493: CD | C493: 4598 | D493: 3 | E493: 7880141170 | F493: 小学英语实验教材（3B）音带1盘 | G493: 清华大学 | H493: 7 | I493: 37288 | J493: 25
A494: =ROW()-5 -> 489 | B494: CD | C494: 4607 | D494: 1 | E494: 7880141758 | F494: 小学英语实验教材（4A）音带1盘 | G494: 清华大学 | H494: 7 | I494: 37500 | J494: 40
A495: =ROW()-5 -> 490 | B495: CD | C495: 5491 | D495: 1 | E495: 7880141693 | F495: 小学英语实验教材1A活动手册 音带2盘 | G495: 清华大学 | H495: 13.00 | I495: 37469 | J495: 25
A496: =ROW()-5 -> 491 | B496: CD | C496: 5369 | D496: 1 | E496: 7880141731 | F496: 小学英语实验教材1B活动手册 音带2盘 | G496: 清华大学 | H496: 14.00 | I496: 37500 | J496: 25
A497: =ROW()-5 -> 492 | B497: G- | C497: 4667 | D497: 1 | E497: 04667-0 | F497: 小学英语实验教材1A 挂图 | G497: 清华大学 | H497: 380 | I497: 37135 | J497: 5
A498: =ROW()-5 -> 493 | B498: G- | C498: 4667 | D498: 2 | E498: 0466-7 | F498: 小学英语实验教材1B 挂图 | G498: 清华大学 | H498: 360 | I498: 37135 | J498: 5
A499: =ROW()-5 -> 494 | B499: G- | C499: 5368 | D499: 1 | E499: 05368-5 | F499: 小学英语试验教材2A 挂图 | G499: 清华大学 | H499: 420.00 | I499: 37347 | J499: 5
A500: =ROW()-5 -> 495 | B500: G- | C500: 5423 | D500: 1 | E500: 05423-1 | F500: 小学英语实验教材2B 挂图 | G500: 清华大学 | H500: 450.00 | I500: 37377 | J500: 5
A501: =ROW()-5 -> 496 | B501: G- | C501: 5858 | D501: 1 | E501: 05858-X | F501: 小学英语实验教材3A 挂图 | G501: 清华大学 | H501: 360.00 | I501: 37530 | J501: 5
A502: =ROW()-5 -> 497 | B502: G- | C502: 5491 | D502: 1 | E502: 05491-6 | F502: 小学英语实验教材1A活动手册 | G502: 清华大学 | H502: 5.50 | I502: 37530 | J502: 30
A503: =ROW()-5 -> 498 | B503: G- | C503: 5369 | D503: 1 | E503: 05369-1 | F503: 小学英语实验教材 1B活动手册 | G503: 清华大学 | H503: 5.50 | I503: 37377 | J503: 30
F504: 中学生英语学习天地
A505: =ROW()-5 -> 500 | B505: H- | C505: 5381 | D505: 1 | E505: 05381-2 | F505: 中学生百科英语（第1册） | G505: Patricia Ackert | H505: 25 | I505: 37469 | J505: 9
A506: =ROW()-5 -> 501 | B506: H- | C506: 5382 | D506: 1 | E506: 05382-0 | F506: 中学生百科英语（第2册） | G506: Linda Lee, Barbara Bushby | H506: 22 | I506: 37469 | J506: 10
A507: =ROW()-5 -> 502 | B507: H- | C507: 5383 | D507: 1 | E507: 05383-9 | F507: 中学生百科英语（第3册） | G507: Patricia Ackert | H507: 30 | I507: 37469 | J507: 8
A508: =ROW()-5 -> 503 | B508: G- | C508: 5811 | D508: 1 | E508: 05811-3 | F508: 中学生百科英语――教学参考及试题(全一册) | G508: Patricia Ackert | H508: 12 | I508: 37500 | J508: 27
F509: 英语自学与阅读用书
A510: =ROW()-5 -> 505 | B510: TP | C510: 2480 | D510: B | E510: 02480-4 | F510: 计算机英语（第2版） | G510: 刘兆毓 | H510: 26 | I510: 36708 | J510: 8
A511: =ROW()-5 -> 506 | B511: H- | C511: 2802 | D511: 4 | E511: 02802-8 | F511: 日常英语微型短句1660例 | G511: 陈朝晖等 | H511: 11 | I511: 37135 | J511: 20
A512: =ROW()-5 -> 507 | B512: H- | C512: 4137 | D512: 1 | E512: 04137-7 | F512: 美国英文日常短语 | G512: 侯成源等 | H512: 14 | I512: 36951 | J512: 20
A513: =ROW()-5 -> 508 | B513: CD | C513: 4137 | D513: 1 | F513: 美国英文日常短语（音带1盘） | G513: 侯成源等 | H513: 7 | I513: 37165 | J513: 25
A514: =ROW()-5 -> 509 | B514: H- | C514: 3504 | D514: 1 | E514: 03504-0 | F514: 英汉对照安徒生童话全集（上、中、下） | G514: 叶君健译 | H514: 98 | I514: 37135 | J514: 2
A515: =ROW()-5 -> 510 | B515: H- | C515: 3504 | D515: 2 | E515: 03504-1 | F515: 英汉对照安徒生童话全集（精） | G515: 叶君健译 | H515: 128 | I515: 36495 | J515: 2
A516: =ROW()-5 -> 511 | B516: H- | C516: 5479 | D516: 1 | E516: 05479-7 | F516: 学英语从ABC开始――女将军赵织雯教授教你学英语 | G516: 赵织雯 | H516: 12 | I516: 37469 | J516: 22
A517: =ROW()-5 -> 512 | B517: GP | C517: 5479 | D517: 1 | E517: 7880141669 | F517: 学英语从ABC开始――女将军赵织雯教授教你学英语（8张VCD光盘和1本手册） | G517: 金鉴明 | H517: 96 | I517: 37530 | J517: 20
F518: 休 闲 时 尚 类
F519: 像一个依然鲜明的梦，似一首永不褪色的诗；旅途的风尘，爱恋的悲喜，
F520: 人生的哲理，成长的风雨，在始终清晰的记忆里，都融于这隽永的词曲 ……
A521: =ROW()-5 -> 516 | B521: H- | C521: 4174 | D521: 1 | E521: 04174-1 | F521: 经典影片精彩片段语言评析 | G521: 方 琰等 | H521: 19.8 | I521: 36923 | J521: 14
A522: =ROW()-5 -> 517 | B522: H- | C522: 1040 | D522: C | E522: 01040-4 | F522: 英文抒情歌曲精选解析 (一） | G522: 常春藤 | H522: 17 | I522: 37135 | J522: 15
A523: =ROW()-5 -> 518 | B523: H- | C523: 1080 | D523: C | E523: 01080-3 | F523: 英文抒情歌曲精选解析（二） | G523: 常春藤 | H523: 17 | I523: 36617 | J523: 15
A524: =ROW()-5 -> 519 | B524: H- | C524: 3266 | D524: 2 | E524: 03266-1 | F524: 英文抒情歌曲精选解析（三） | G524: 常春藤 | H524: 18 | I524: 36982 | J524: 15
A525: =ROW()-5 -> 520 | B525: CD | C525: 1040 | D525: 1 | F525: 英文抒情歌曲精选解析 (一) 音带4盘 | G525: 常春藤 | H525: 40 | I525: 1997 | J525: 6
A526: =ROW()-5 -> 521 | B526: CD | C526: 1080 | D526: 1 | F526: 英文抒情歌曲精选解析 (二) 音带4盘 | G526: 常春藤 | H526: 40 | I526: 1997 | J526: 12
A527: =ROW()-5 -> 522 | B527: CD | C527: 3266 | D527: 1 | F527: 英文抒情歌曲精选解析 (三) 音带4盘 | G527: 常春藤 | H527: 40 | I527: 1999 | J527: 13
A528: =ROW()-5 -> 523 | B528: CD | C528: 3031 | D528: 1 | F528: 英文抒情歌曲(一)VCD | H528: 28 | I528: 1998.7 | J528: 50
A529: =ROW()-5 -> 524 | B529: CD | C529: 3032 | D529: 1 | F529: 英文抒情歌曲(二)VCD | H529: 28 | I529: 1998.7 | J529: 50
A530: =ROW()-5 -> 525 | B530: CD | C530: 3033 | D530: 1 | F530: 英文抒情歌曲(三)VCD | H530: 28 | I530: 1998.7 | J530: 50
A531: =ROW()-5 -> 526 | B531: CD | C531: 3034 | D531: 1 | F531: 英文抒情歌曲(四)VCD | H531: 28 | I531: 1998.7 | J531: 50
A532: =ROW()-5 -> 527 | B532: CD | C532: 3035 | D532: 1 | F532: 英文抒情歌曲(五)VCD | H532: 28 | I532: 1998.7 | J532: 50
A533: =ROW()-5 -> 528 | B533: CD | C533: 3036 | D533: 1 | F533: 英文抒情歌曲(六)VCD | H533: 28 | I533: 1998.7 | J533: 50
F534: 听说明星――清华电影文库
E535: 当代美国电影集锦，含文字脚本、注释、书面练习、精彩对白等， 可自学欣赏，也可作视听说教材。
A536: =ROW()-5 -> 531 | B536: H- | C536: 4486 | E536: 04486-4 | F536: 插翅难逃（配双VCD） | G536: 王东风 | H536: 23 | I536: 37257 | J536: 5
A537: =ROW()-5 -> 532 | B537: H- | C537: 4411 | D537: 1 | E537: 04411-2 | F537: 旷世怨偶（配双VCD） | G537: 魏淑花 | H537: 25 | I537: 37530 | J537: 5
A538: =ROW()-5 -> 533 | B538: H- | C538: 4978 | D538: 5 | E538: 04978-5 | F538: 爱的牺牲品（配双VCD） | G538: 孙 霞 | H538: 24 | I538: 37259 | J538: 5
A539: =ROW()-5 -> 534 | B539: H- | C539: 5045 | D539: 1 | E539: 05045-7 | F539: 警匪一家（配双VCD） | G539: 王东风 | H539: 26 | I539: 37530 | J539: 5
A540: =ROW()-5 -> 535 | B540: H- | C540: 4971 | D540: 1 | E540: 04971-8 | F540: 难以释怀（配双VCD） | G540: 金福芬 | H540: 21 | I540: 37530 | J540: 5
F541: 非英语语种图书
B542: 其中《有声记忆――日语资格考试备考词汇10000条》适合于日本日语能力考试1-4级、我国日语四、六级考试、同等学力考试 、考研等各类考生。
A543: =ROW()-5 -> 538 | B543: H- | C543: 4696 | D543: 4 | E543: 04696-4 | F543: 有声记忆―日语资格考试必备词汇10000条 （初级部分）（第二版） | G543: 宫 力 | H543: 14.5 | I543: 37469 | J543: 24
A544: =ROW()-5 -> 539 | B544: CD | C544: 1747 | D544: 1 | F544: 有声记忆―日语资格考试备考词汇10000条 （初级部分）5音带 （第二版） | G544: 岩泽、大泽 | H544: 35 | I544: 36861 | J544: 5
A545: =ROW()-5 -> 540 | B545: H- | C545: 4697 | D545: 1 | E545: 04697-2 | F545: 有声记忆―日语资格考试备考词汇10000条 （中级部分）（第二版） | G545: 宫 力 | H545: 21.5 | I545: 37196 | J545: 14
A546: =ROW()-5 -> 541 | B546: CD | C546: 3147 | D546: 1 | F546: 有声记忆―日语资格考试备考词汇10000条 （中级部分）8音带（第二版） | H546: 56 | I546: 36861
A547: =ROW()-5 -> 542 | B547: H- | C547: 4698 | D547: 7 | E547: 04698-0 | F547: 有声记忆―日语资格考试必备词汇10000条 （高级部分）（第二版） | G547: 宫 力 | H547: 16.5 | I547: 37469 | J547: 20
A548: =ROW()-5 -> 543 | B548: CD | C548: 3533 | D548: 1 | F548: 有声记忆―日语资格考试备考词汇10000条 （高级）音带7盘（第二版） | G548: 松下孝子等 | H548: 49 | I548: 36465 | J548: 4
A549: =ROW()-5 -> 544 | B549: H- | C549: 2758 | D549: 2 | E549: 02758-7 | F549: 新编高级日本语会话 | G549: 松下孝子等 | H549: 10 | I549: 1999 | J549: 27
A550: =ROW()-5 -> 545 | B550: CD | C550: 2758 | D550: 1 | F550: 新编高级日本语会话（音带） | G550: 松下孝子 | H550: 14 | I550: 1998 | J550: 2
A551: =ROW()-5 -> 546 | B551: H- | C551: 1989 | D551: 1 | E551: 01989-4 | F551: 电视商务日语 | G551: 李宗惠等 | H551: 18 | I551: 1996 | J551: 11
A552: =ROW()-5 -> 547 | B552: CD | C552: 1989 | D552: 1 | F552: 电视商务日语（音带） | G552: 李宗惠等 | H552: 98 | I552: 1996 | J552: 14
A553: =ROW()-5 -> 548 | B553: H- | C553: 1949 | D553: 2 | E553: 01949-5 | F553: 现代日语助词与助动词 | G553: 王彦花 | H553: 8 | I553: 1998 | J553: 26
A554: =ROW()-5 -> 549 | B554: H- | C554: 3449 | D554: 1 | E554: 03449-4 | F554: 德语试题 900 | G554: 刘芝琳等 | H554: 19.5 | I554: 37316 | J554: 15
A555: =ROW()-5 -> 550 | B555: H- | C555: 2567 | D555: 1 | E555: 02567-3 | F555: 德语语法问答 | G555: 刘芝琳等 | H555: 16 | I555: 37104 | J555: 20
A556: =ROW()-5 -> 551 | B556: H- | C556: 2689 | D556: 1 | E556: 02689-0 | F556: 日本文化的皇冠宝珠─短歌 | G556: 王瑞林 | H556: 15 | I556: 36100 | J556: 20
A557: =ROW()-5 -> 552 | B557: H- | C557: 2267 | D557: 1 | E557: 0226-7 | F557: 日文书写的要求与格式 | G557: 王瑞林 | H557: 12.5 | I557: 35674 | J557: 14

A1: 李著

A1: 岩泽、 崎