A1: 序号 | B1: 代 号 | E1: ISBN 7-302- | F1: 名 称 | G1: 著译编者 | H1: 定价(元) | I1: 印年 | J1: 册/包 | K1: 订数
F2: 八、音 像 制 品
F3: 1.V C D 光 盘
A4: =ROW()-3 -> 1 | B4: VD | C4: 0021 | D4: 1 | F4: 趣味速学五笔字型 | G4: 本 社 | H4: 15 | I4: 1998.3 | J4: 30
A5: =ROW()-3 -> 2 | B5: VD | C5: 0020 | D5: 1 | F5: 计算机基础入门 | G5: 本 社 | H5: 20 | I5: 1998.3 | J5: 50
A6: =ROW()-3 -> 3 | B6: VD | C6: 0035 | D6: 1 | F6: Internet 入门与提高（VCD2盘） | G6: 汪 晶 | H6: 28 | I6: 36739 | J6: 25
A7: =ROW()-3 -> 4 | B7: VD | C7: 4004 | D7: 1 | F7: 电脑炒股（VCD） | G7: 本 社 | H7: 18 | I7: 37073 | J7: 25
A8: =ROW()-3 -> 5 | B8: VD | C8: 0055 | D8: 1 | F8: 电脑配件的选购和组装（硬件版） （3VCD+书） | G8: 侯昭湘 | H8: 38 | I8: 36923 | J8: 8
A9: =ROW()-3 -> 6 | B9: VD | C9: 1405 | D9: 1 | F9: 电脑维护与使用（书+2VCD） | G9: 侯昭湘 | H9: 35 | I9: 37364 | J9: 10
A10: =ROW()-3 -> 7 | B10: VD | C10: 0154 | D10: 1 | F10: 老年人学电脑用电脑 | G10: 谭浩强 | H10: 10 | I10: 37377 | J10: 10
A11: =ROW()-3 -> 8 | B11: VD | C11: 9869 | D11: 1 | F11: 跟我一起组装电脑 (3VCD) | G11: 本 社 | H11: 39 | I11: 36342 | J11: 12
A12: =ROW()-3 -> 9 | B12: VD | C12: 9833 | D12: 1 | F12: 文字录入员职业技能鉴定指南(4VCD) | G12: 刘 英等 | H12: 60 | I12: 1999 | J12: 20
A13: =ROW()-3 -> 10 | F13: 清华故事 （3VCD）（精装） | G13: 同 方 | H13: 90.00 | I13: 36982
A14: =ROW()-3 -> 11 | F14: 清华故事 （3VCD）（简装） | G14: 同 方 | H14: 60.00 | I14: 36982
F15: 2.配书音像制品
F16: （书目中已列出）
F17: 文化素质教育系列VCD
A18: =ROW()-3 -> 15 | B18: VD | C18: 4001 | D18: 1 | F18: 中国古典诗歌赏析 （32VCD+书） | G18: 刘跃进 | H18: 598 | I18: 37012 | J18: 3
A19: =ROW()-3 -> 16 | B19: VD | C19: 4063 | D19: 1 | F19: 中国文化名著名家演讲 孟子 | G19: 张启之 | H19: 28 | I19: 37226 | J19: 25
A20: =ROW()-3 -> 17 | B20: VD | C20: 4061 | D20: 1 | F20: 中国文化名著名家演讲 周易 | G20: 李学勤 | H20: 28 | I20: 37226 | J20: 25
A21: =ROW()-3 -> 18 | B21: VD | C21: 4064 | D21: 1 | F21: 中国文化名著名家演讲 论语 | G21: 钱逊 | H21: 28 | I21: 37227 | J21: 25
A22: =ROW()-3 -> 19 | B22: VD | C22: 4062 | D22: 1 | F22: 中国文化名著名家演讲 庄子 | G22: 庞朴 | H22: 28 | I22: 37228 | J22: 25
A23: =ROW()-3 -> 20 | B23: VD | C23: 0065 | D23: 1 | F23: 中国文化名著名家演讲 荀子 | G23: 张岂之 | H23: 28 | I23: 37377 | J23: 10
A24: =ROW()-3 -> 21 | B24: VD | C24: 4066 | D24: 1 | F24: 中国文化名著名家演讲 墨子 | G24: 牟仲鉴 | H24: 28 | I24: 37377 | J24: 10
A25: =ROW()-3 -> 22 | B25: VD | F25: 中国文化名著名家演讲 老子 | H25: 28 | I25: 37561
F26: 汉语拼音系列
A27: =ROW()-3 -> 24 | B27: CD | C27: 0170 | D27: 1 | F27: 汉语拼音识字阅读速成(1本书+1拼读盘+3张光盘+1音带+1本课外读物） | G27: 杨正国 | H27: 168 | I27: 37530 | J27: 3
A28: =ROW()-3 -> 25 | B28: CD | C28: 0058 | D28: 1 | F28: 汉语拼音学习速成法（音带配书） | G28: 杨正国 | H28: 20 | I28: 37469 | J28: 10
F29: CCTV 电视讲座教材（图书+VCD）
F30: 迎接新世纪――技能培训系列
A31: =ROW()-3 -> 28 | B31: TP | C31: 3214 | D31: 6 | E31: 03214-9 | F31: Windows 98 中文版操作系统 | G31: 王世忠 | H31: 19.00 | I31: 36586 | J31: 15
A32: =ROW()-3 -> 29 | B32: VD | C32: 9831 | D32: 1 | F32: Windows 98 中文版操作系统（VCD2盘） | G32: 王世忠 | H32: 50 | I32: 1999 | J32: 50
A33: =ROW()-3 -> 30 | B33: TP | C33: 3116 | D33: 6 | E33: 03116-9 | F33: Internet 上网与使用 | G33: 陶文星等 | H33: 16.00 | I33: 36617 | J33: 16
A34: =ROW()-3 -> 31 | B34: VD | F34: Internet 上网与使用（VCD2盘） | G34: 陶文星等 | H34: 50 | I34: 1999 | J34: 50
A35: =ROW()-3 -> 32 | B35: TP | C35: 3146 | D35: 4 | E35: 03146-0 | F35: HTML网页制作 | G35: 王映雪等 | H35: 10.00 | I35: 36495 | J35: 25
A36: =ROW()-3 -> 33 | B36: VD | C36: 9863 | D36: 1 | F36: HTML网页制作 （VCD3盘） | G36: 肖 平 | H36: 75 | I36: 1999 | J36: 25
A37: =ROW()-3 -> 34 | B37: TP | C37: 3176 | D37: 4 | E37: 03176-2 | F37: Internet Explorer 浏览器 | G37: 鲍泓等 | H37: 17.50 | I37: 36495 | J37: 14
A38: =ROW()-3 -> 35 | B38: VD | C38: 9865 | D38: 1 | F38: Internet Explorer 浏览器（VCD2盘） | G38: 鲍泓等 | H38: 50.00 | I38: 1999 | J38: 50
A39: =ROW()-3 -> 36 | B39: TP | C39: 3169 | D39: 4 | E39: 03169-X | F39: Photoshop图象处理 | G39: 沈 洪 | H39: 17.00 | I39: 36586 | J39: 16
A40: =ROW()-3 -> 37 | B40: VD | C40: 9917 | D40: 1 | F40: Photoshop图象处理 (VCD5盘) | G40: 沈洪等 | H40: 125.00 | I40: 1999 | J40: 10
A41: =ROW()-3 -> 38 | B41: TP | C41: 3115 | D41: 5 | E41: 03115-0 | F41: PowerPoint演示文稿制作 | G41: 庄洪林 | H41: 14.00 | I41: 36586 | J41: 18
A42: =ROW()-3 -> 39 | B42: VD | C42: 9918 | D42: 1 | F42: PowerPoint演示文稿制作 (VCD2盘) | G42: 庄洪林 | H42: 50.00 | I42: 1999 | J42: 25
A43: =ROW()-3 -> 40 | B43: TP | C43: 3229 | D43: 3 | E43: 03229-7 | F43: 3D Studio MAX 动画制作 | G43: 李利平 | H43: 12.00 | I43: 36434 | J43: 23
A44: =ROW()-3 -> 41 | B44: VD | C44: 9916 | D44: 1 | F44: 3D Studio MAX 动画制作 (VCD7盘) | G44: 李利平等 | H44: 175.00 | I44: 36281 | J44: 6
A45: =ROW()-3 -> 42 | B45: TP | C45: 3230 | D45: 4 | E45: 03230-0 | F45: Authorware 多媒体制作 | G45: 李秀等 | H45: 16.00 | I45: 36586 | J45: 18
A46: =ROW()-3 -> 43 | B46: VD | C46: 9919 | D46: 1 | F46: Authorware 多媒体制作 (VCD6盘) | G46: 李秀等 | H46: 150.00 | I46: 36281 | J46: 9
A47: =ROW()-3 -> 44 | B47: TP | C47: 3241 | D47: 2 | E47: 03241-6 | F47: 多媒体应用基础 | G47: 王辉等 | H47: 14.00 | I47: 36434 | J47: 18
A48: =ROW()-3 -> 45 | B48: VD | C48: 9915 | D48: 1 | F48: 多媒体应用基础 (VCD2盘) | G48: 王辉等 | H48: 50.00 | I48: 1999 | J48: 40
F49: 迎接新世纪――最新常用软件技能培训丛书
F50: （图书+VCD）
A51: =ROW()-3 -> 48 | B51: TP | C51: 3597 | D51: 2 | E51: 03597-0 | F51: WPS 2000 实用技能 | G51: 求伯君等 | H51: 24.50 | I51: 36342 | J51: 9
A52: =ROW()-3 -> 49 | B52: VD | C52: 9952 | D52: 1 | F52: WPS 2000 实用技能 （5VCD） | G52: 赵新国等 | H52: 125.00 | I52: 36404 | J52: 12
A53: =ROW()-3 -> 50 | B53: TP | C53: 3800 | D53: 2 | E53: 03800-7 | F53: Word 2000 实用技能 | G53: 沈 洪 | H53: 19.00 | I53: 36434 | J53: 12
A54: =ROW()-3 -> 51 | B54: VD | C54: 9980 | D54: 1 | F54: Word 2000 实用技能（2VCD） | G54: 沈 洪等 | H54: 45.00 | I54: 36465 | J54: 25
A55: =ROW()-3 -> 52 | B55: TP | C55: 3800 | D55: 3 | E55: 03800-7 | F55: Word 2000 实用技能（配光盘） | G55: 沈 洪 | H55: 45.00 | I55: 36434 | J55: 12
A56: =ROW()-3 -> 53 | B56: TP | C56: 3824 | D56: 2 | F56: Excel 2000 实用技能 | G56: 李 秀 | H56: 30.00 | I56: 36526 | J56: 12
A57: =ROW()-3 -> 54 | B57: VD | C57: 9985 | D57: 1 | F57: Excel 2000 电子表格 (3VCD） | G57: 李 秀 | H57: 75.00 | I57: 36647 | J57: 12
A58: =ROW()-3 -> 55 | B58: TP | C58: 3799 | D58: 1 | E58: 03799-X | F58: PowerPoint 2000 实用技能 | G58: 庄洪林 | H58: 18.00 | I58: 36434 | J58: 13
A59: =ROW()-3 -> 56 | B59: VD | C59: 9978 | D59: 1 | F59: PowerPoint 2000 实用技能 (5VCD) | G59: 庄洪林等 | H59: 25.00 | I59: 36465 | J59: 25
A60: =ROW()-3 -> 57 | B60: TP | C60: 2492 | D60: 2 | F60: Outlook 2000 实用技能（配光盘） | G60: 郑 坚 | H60: 32.80 | I60: 36526 | J60: 15
A61: =ROW()-3 -> 58 | B61: TP | C61: 2492 | D61: 3 | F61: Outlook 2000 实用技能 | G61: 郑 坚 | H61: 12.80 | I61: 36526 | J61: 18
A62: =ROW()-3 -> 59 | B62: VD | C62: 9988 | D62: 1 | F62: Outlook 2000 个人信息管理（2VCD） | G62: 郑 坚 | H62: 50.00 | I62: 36647 | J62: 25
A63: =ROW()-3 -> 60 | B63: TP | C63: 2380 | D63: 2 | F63: FrontPage 2000 实用技能 | G63: 杜 煜等 | H63: 19.00 | I63: 36527 | J63: 13
A64: =ROW()-3 -> 61 | B64: VD | C64: 9982 | D64: 1 | F64: FrontPage 2000 网页制作（3VCD） | G64: 杜 煜等 | H64: 75.00 | I64: 36647 | J64: 12
A65: =ROW()-3 -> 62 | B65: TP | C65: 3823 | D65: 1 | F65: Office 2000 基础操作与综合应用 | G65: 王 电 | I65: 36529
A66: =ROW()-3 -> 63 | B66: VD | C66: 9989 | D66: 1 | F66: Office 2000 基础操作与综合应用（2VCD） | G66: 王 电 | H66: 50.00 | I66: 36647 | J66: 25
C67: 国际权威ELT教材――《博采英语》系列教材（2001年影印版）
F68: 该系列教材2002年5月被列入国家教育部优秀外语教材推荐书目
B69: 世界著名英语教学专家联合编写，美国汤姆森学习出版集团最新推出，众多国家与地区广泛使用，以培养高素质国际外语通用人才为目的，强调语言的实际应用能力和学习能力的培养。
A70: =ROW()-5 -> 65 | B70: H- | C70: 4344 | D70: 1 | E70: 04344-2 | F70: 博采英语――阅读 （1） | G70: Virginia L. Guleff | H70: 23 | I70: 37333 | J70: 13
A71: =ROW()-5 -> 66 | B71: H- | C71: 4344 | D71: 2 | E71: 04344-2 | F71: 博采英语――阅读 （2） | G71: Michael Ryall | H71: 23 | I71: 37358 | J71: 12
A72: =ROW()-5 -> 67 | B72: H- | C72: 4344 | D72: 3 | E72: 04344-2 | F72: 博采英语――阅读 （3） | G72: Linda Robinson Fellag | H72: 23 | I72: 37073 | J72: 11
A73: =ROW()-5 -> 68 | B73: H- | C73: 4344 | D73: 4 | E73: 04344-2 | F73: 博采英语――阅读 （4） | G73: M.E.Sokolik | H73: 23 | I73: 37073 | J73: 11
A74: =ROW()-5 -> 69 | B74: H- | C74: 4346 | D74: 1 | E74: 04346-9 | F74: 博采英语――写作（1） | G74: Meredith Pike-Baky | H74: 24 | I74: 37316 | J74: 12
A75: =ROW()-5 -> 70 | B75: H- | C75: 4346 | D75: 2 | E75: 04346-9 | F75: 博采英语――写作（2） | G75: Meredith Pike-Baky Laurie Blass | H75: 24 | I75: 37073 | J75: 10
A76: =ROW()-5 -> 71 | B76: H- | C76: 4346 | D76: 9 | E76: 04346-9 | F76: 博采英语――写作（3） | G76: Marie Hutchison Weidauer | H76: 24 | I76: 37073 | J76: 11
A77: =ROW()-5 -> 72 | B77: H- | C77: 4346 | D77: 4 | E77: 04346-9 | F77: 博采英语――写作（4） | G77: M.E.Sokolik | H77: 24 | I77: 37073 | J77: 11
A78: =ROW()-5 -> 73 | B78: H- | C78: 4345 | D78: 1 | E78: 04345-0 | F78: 博采英语――听说 （1） | G78: Cheryl Benz，Kara Dworak | H78: 26.5 | I78: 37469 | J78: 9
A79: =ROW()-5 -> 74 | B79: H- | C79: 4345 | D79: 2 | E79: 04345-0 | F79: 博采英语――听说 （2） | G79: Mary McVey Gill Pamela Hartmann | H79: 26.5 | I79: 37073 | J79: 10
A80: =ROW()-5 -> 75 | B80: H- | C80: 4345 | D80: 3 | E80: 04543-0 | F80: 博采英语――听说 （3） | G80: Karen Carlisi Susana Christie | H80: 26.5 | I80: 37342 | J80: 10
A81: =ROW()-5 -> 76 | B81: H- | C81: 4345 | D81: 4 | E81: 04543-0 | F81: 博采英语――听说 （4） | G81: Helen Kalksten Fragiadkis 等 | H81: 26.5 | I81: 37104 | J81: 9
A82: =ROW()-5 -> 77 | B82: CD | C82: 4345 | D82: 1 | F82: 博采英语――听说（1）音带 2盘 | H82: 14 | I82: 37105 | J82: 10
A83: =ROW()-5 -> 78 | B83: CD | C83: 4345 | D83: 2 | F83: 博采英语――听说（2）音带 3盘 | H83: 21 | I83: 37106 | J83: 8
A84: =ROW()-5 -> 79 | B84: CD | C84: 4345 | D84: 3 | F84: 博采英语――听说（3）音带 2盘 | H84: 14 | I84: 37073 | J84: 12
A85: =ROW()-5 -> 80 | B85: CD | C85: 4345 | D85: 4 | F85: 博采英语――听说（4）音带 2盘 | H85: 14 | I85: 37104 | J85: 12
A86: =ROW()-5 -> 81 | B86: H- | C86: 4689 | D86: 1 | E86: 04689-1 | F86: 博采英语――阅读 教学参考书（全一册） | H86: 24 | I86: 37105 | J86: 15
A87: =ROW()-5 -> 82 | B87: H- | C87: 4648 | D87: 1 | E87: 04648-4 | F87: 博采英语――写作 教学参考书（全一册） | H87: 24 | I87: 37106 | J87: 16
A88: =ROW()-5 -> 83 | B88: H- | C88: 4674 | D88: 1 | E88: 04674-3 | F88: 博采英语――听说 教学参考书（全一册） | H88: 24 | I88: 37107 | J88: 15
A89: =ROW()-5 -> 84 | B89: H- | C89: 0832 | D89: 1 | E89: 00832-9 | F89: 博采英语――样课汇编 （ 听说 写作 阅读） | G89: 编辑组 | H89: 48.00 | I89: 37377 | J89: 8
A90: =ROW()-5 -> 85 | B90: CD | C90: 0832 | D90: 1 | F90: 博采英语――听说样课汇编（样带） | H90: 7 | I90: 37104 | J90: 25
A91: =ROW()-5 -> 86 | B91: H- | C91: 4880 | D91: 1 | E91: 04880-0 | F91: 博采英语――教师必读 | H91: 24 | I91: 37135 | J91: 10
F93: 捷进英语
F94: 国际著名英语教育家亚历山大倾力之作 ―― 享誉世界的新一代交际英语
A95: =ROW()-5 -> 90 | B95: H- | C95: 3172 | D95: 2 | E95: 03172-X | F95: 捷进英语（1）（包括主课本和学习用书） | G95: 亚历山大 | H95: 28 | I95: 1999 | J95: 7
A96: =ROW()-5 -> 91 | B96: H- | C96: 3180 | D96: 2 | E96: 03180-0 | F96: 捷进英语（2）（包括主课本和学习用书） | G96: 亚历山大 | H96: 28 | I96: 1999 | J96: 7
A97: =ROW()-5 -> 92 | B97: H- | C97: 3171 | D97: 2 | E97: 03171-1 | F97: 捷进英语（3）（包括主课本和学习用书） | G97: 亚历山大 | H97: 28 | I97: 1999 | J97: 7
A98: =ROW()-5 -> 93 | B98: H- | C98: 3179 | D98: 2 | E98: 03179-7 | F98: 捷进英语（4）（包括主课本和学习用书） | G98: 亚历山大 | H98: 28 | I98: 1998 | J98: 7
A99: =ROW()-5 -> 94 | B99: H- | C99: 3182 | D99: 2 | E99: 03182-7 | F99: 捷进英语（5）（包括主课本和学习用书） | G99: 亚历山大 | H99: 28 | I99: 1998 | J99: 7
A100: =ROW()-5 -> 95 | B100: H- | C100: 3181 | D100: 2 | E100: 03181-9 | F100: 捷进英语（6）（包括主课本和学习用书） | G100: 亚历山大 | H100: 28 | I100: 1998 | J100: 7
A101: =ROW()-5 -> 96 | B101: CD | C101: 3172 | D101: 1 | F101: 《捷进英语》（1） (自学带) | G101: 亚历山大 | H101: 30 | I101: 1998 | J101: 6
A102: =ROW()-5 -> 97 | B102: CD | C102: 3180 | D102: 1 | F102: 《捷进英语》（2） (自学带) | G102: 亚历山大 | H102: 30 | I102: 1998 | J102: 6
A103: =ROW()-5 -> 98 | B103: CD | C103: 3171 | D103: 1 | F103: 《捷进英语》（3） (自学带) | G103: 亚历山大 | H103: 30 | I103: 1998 | J103: 6
A104: =ROW()-5 -> 99 | B104: CD | C104: 3179 | D104: 1 | F104: 《捷进英语》（4） (自学带) | G104: 亚历山大 | H104: 30 | I104: 1998 | J104: 6
A105: =ROW()-5 -> 100 | B105: CD | C105: 3182 | D105: 1 | F105: 《捷进英语》（5） (自学带) | G105: 亚历山大 | H105: 30 | I105: 1998 | J105: 6
A106: =ROW()-5 -> 101 | B106: CD | C106: 3181 | D106: 1 | F106: 《捷进英语》（6） (自学带) | G106: 亚历山大 | H106: 30 | I106: 1998 | J106: 6
A107: =ROW()-5 -> 102 | B107: CD | C107: 3172 | D107: 3 | F107: 《捷进英语》（1） (教学音带 总1-9) | G107: 亚历山大 | H107: 63 | I107: 36526 | J107: 3
A108: =ROW()-5 -> 103 | B108: CD | C108: 3180 | D108: 3 | F108: 《捷进英语》（2） (教学音带 总10-18) | G108: 亚历山大 | H108: 63 | I108: 36526 | J108: 3
A109: =ROW()-5 -> 104 | B109: CD | C109: 3171 | D109: 3 | F109: 《捷进英语》（3） (教学音带 总19-27) | G109: 亚历山大 | H109: 63 | I109: 36526 | J109: 3
A110: =ROW()-5 -> 105 | B110: CD | C110: 3179 | D110: 3 | F110: 《捷进英语》（4） (教学音带 总28-36) | G110: 亚历山大 | H110: 63 | I110: 36526 | J110: 3
A111: =ROW()-5 -> 106 | B111: CD | C111: 3182 | D111: 3 | F111: 《捷进英语》（5） (教学音带 总37-45) | G111: 亚历山大 | H111: 63 | I111: 36526 | J111: 3
A112: =ROW()-5 -> 107 | B112: CD | C112: 3181 | D112: 3 | F112: 《捷进英语》（6） (教学音带 总46-54) | G112: 亚历山大 | H112: 63 | I112: 36526 | J112: 3
A113: =ROW()-5 -> 108 | B113: CD | C113: 3172 | D113: 2 | F113: 《捷进英语》（1） (原声带) | G113: 亚历山大 | H113: 7 | I113: 36647 | J113: 25
A114: =ROW()-5 -> 109 | B114: CD | C114: 3180 | D114: 2 | F114: 《捷进英语》（2） (原声带) | G114: 亚历山大 | H114: 7 | I114: 36648 | J114: 25
A115: =ROW()-5 -> 110 | B115: CD | C115: 3171 | D115: 2 | F115: 《捷进英语》（3） (原声带) | G115: 亚历山大 | H115: 7 | I115: 36649 | J115: 25
A116: =ROW()-5 -> 111 | B116: CD | C116: 3179 | D116: 2 | F116: 《捷进英语》（4） (原声带) | G116: 亚历山大 | H116: 7 | I116: 36650 | J116: 25
A117: =ROW()-5 -> 112 | B117: CD | C117: 3182 | D117: 2 | F117: 《捷进英语》（5） (原声带) | G117: 亚历山大 | H117: 7 | I117: 36651 | J117: 25
A118: =ROW()-5 -> 113 | B118: CD | C118: 3181 | D118: 2 | F118: 《捷进英语》（6） (原声带) | G118: 亚历山大 | H118: 7 | I118: 36652 | J118: 25
A119: =ROW()-5 -> 114 | B119: XD | C119: 0039 | D119: 0 | F119: 《捷进英语》（1） （像带） | G119: 亚历山大 | H119: 80 | I119: 1999 | J119: 8
A120: =ROW()-5 -> 115 | B120: XD | C120: 0039 | D120: 2 | F120: 《捷进英语》（2） （像带） | G120: 亚历山大 | H120: 80 | I120: 1999 | J120: 8
A121: =ROW()-5 -> 116 | B121: XD | C121: 0039 | D121: 3 | F121: 《捷进英语》（3） （像带） | G121: 亚历山大 | H121: 80 | I121: 1999 | J121: 8
A122: =ROW()-5 -> 117 | B122: XD | C122: 0039 | D122: 4 | F122: 《捷进英语》（4） （像带） | G122: 亚历山大 | H122: 80 | I122: 1999 | J122: 8
A123: =ROW()-5 -> 118 | B123: XD | C123: 0039 | D123: 5 | F123: 《捷进英语》（5） （像带） | G123: 亚历山大 | H123: 80 | I123: 1999 | J123: 8
A124: =ROW()-5 -> 119 | B124: XD | C124: 0039 | D124: 6 | F124: 《捷进英语》（6） （像带） | G124: 亚历山大 | H124: 80 | I124: 1999 | J124: 8
A125: =ROW()-5 -> 120 | B125: VD | C125: 0317 | D125: 2 | F125: 《捷进英语》（1） （VCD） | G125: 亚历山大 | H125: 25 | I125: 36708 | J125: 25
A126: =ROW()-5 -> 121 | B126: VD | C126: 0317 | D126: 2 | F126: 《捷进英语》（2） （VCD） | G126: 亚历山大 | H126: 25 | I126: 36587 | J126: 50
A127: =ROW()-5 -> 122 | B127: VD | C127: 0317 | D127: 3 | F127: 《捷进英语》（3） （VCD） | G127: 亚历山大 | H127: 25 | I127: 36588 | J127: 30
A128: =ROW()-5 -> 123 | B128: VD | C128: 0317 | D128: 4 | F128: 《捷进英语》（4） （VCD） | G128: 亚历山大 | H128: 25 | I128: 36589 | J128: 50
A129: =ROW()-5 -> 124 | B129: VD | C129: 0317 | D129: 5 | F129: 《捷进英语》（5） （VCD） | G129: 亚历山大 | H129: 25 | I129: 36590 | J129: 50
A130: =ROW()-5 -> 125 | B130: VD | C130: 0317 | D130: 6 | F130: 《捷进英语》（6） （VCD） | G130: 亚历山大 | H130: 25 | I130: 36591 | J130: 50
F131: 新英语教程（第3版）
F132: 该系列教材被列入国家教育部优秀外语教材推荐书目
C133: 文、理、工科院校兼用，大学公共英语系列教材，根据最新教学大纲编写
C134: 荣获北京市2001年教育教学成果（高等教育）二等奖，2002年教育部优秀教材二等奖。
A135: =ROW()-5 -> 130 | B135: H- | C135: 4711 | D135: 1 | E135: 04711-1 | F135: 预备级 | G135: 孙建民等 | H135: 16 | I135: 37226 | J135: 12
A136: =ROW()-5 -> 131 | B136: H- | C136: 4712 | D136: 1 | E136: 04712-X | F136: 预备级教学参考书 | G136: 王新奇等 | H136: 10 | I136: 37165 | J136: 26
A137: =ROW()-5 -> 132 | B137: H- | C137: 3468 | D137: 3 | E137: 03468-0 | F137: 阅读 (1) | G137: 刘平梅等 | H137: 18.00 | I137: 37500 | J137: 12
A138: =ROW()-5 -> 133 | B138: H- | C138: 3543 | D138: 3 | E138: 03543-1 | F138: 阅读 (2) | G138: 刘平梅等 | H138: 20 | I138: 37500 | J138: 10
A139: =ROW()-5 -> 134 | B139: H- | C139: 3666 | D139: 2 | E139: 03666-7 | F139: 阅读 (3) | G139: 刘平梅等 | H139: 25 | I139: 37438 | J139: 8
A140: =ROW()-5 -> 135 | B140: H- | C140: 3046 | D140: 3 | E140: 03046-4 | F140: 阅读 (4) | G140: 刘平梅等 | H140: 21 | I140: 37438 | J140: 10
A141: =ROW()-5 -> 136 | B141: H- | C141: 3467 | D141: 2 | E141: 03467-2 | F141: 阅读 (1) 教参 | G141: 刘平梅等 | H141: 14 | I141: 37344 | J141: 15
A142: =ROW()-5 -> 137 | B142: H- | C142: 3544 | D142: 2 | E142: 03544-X | F142: 阅读 (2) 教参 | G142: 刘平梅等 | H142: 13.5 | I142: 37257 | J142: 18
A143: =ROW()-5 -> 138 | B143: H- | C143: 2904 | D143: 2 | E143: 02904-9 | F143: 阅读 (3) 教参 | G143: 刘平梅等 | H143: 18 | I143: 37135 | J143: 13
A144: =ROW()-5 -> 139 | B144: H- | C144: 3021 | D144: 2 | E144: 03021-9 | F144: 阅读 (4) 教参 | G144: 刘平梅等 | H144: 15.6 | I144: 36982 | J144: 16
A145: =ROW()-5 -> 140 | B145: H- | C145: 4808 | D145: 1 | E145: 04808-8 | F145: 阅读（1）学生必备 | G145: 刘平梅等 | H145: 18 | I145: 37438 | J145: 12
A146: =ROW()-5 -> 141 | B146: H- | C146: 4892 | D146: 1 | E146: 04892-4 | F146: 阅读（2）学生必备 | G146: 刘平梅等 | H146: 16 | I146: 37438 | J146: 14
A147: =ROW()-5 -> 142 | B147: H- | C147: 4916 | D147: 1 | E147: 04916-5 | F147: 阅读（3）学生必备 | G147: 刘平梅等 | H147: 23 | I147: 37438 | J147: 8
A148: =ROW()-5 -> 143 | B148: H- | C148: 4958 | D148: 1 | E148: 04958-0 | F148: 阅读（4）学生必备 | G148: 刘平梅等 | H148: 18 | I148: 37438 | J148: 11
A149: =ROW()-5 -> 144 | B149: CD | C149: 3468 | D149: 1 | F149: 阅读 (1) 音带2盘 | G149: 刘平梅等 | H149: 14 | I149: 36314 | J149: 15
A150: =ROW()-5 -> 145 | B150: CD | C150: 3543 | D150: 1 | F150: 阅读 (2) 音带1盘 | G150: 刘平梅等 | H150: 7 | I150: 36404 | J150: 30
A151: =ROW()-5 -> 146 | B151: CD | C151: 3666 | D151: 1 | F151: 阅读 (3) 音带1盘 | G151: 刘平梅等 | H151: 7 | I151: 36465 | J151: 30
A152: =ROW()-5 -> 147 | B152: CD | C152: 3046 | D152: 1 | F152: 阅读 (4) 音带1盘 | G152: 刘平梅等 | H152: 7 | I152: 36495 | J152: 25
A153: =ROW()-5 -> 148 | B153: H- | C153: 3750 | D153: 1 | E153: 03750-7 | F153: 阅读 (1) (2) 补充练习 | G153: 刘平梅等 | H153: 16 | I153: 37438 | J153: 13
A154: =ROW()-5 -> 149 | B154: H- | C154: 3967 | D154: 1 | E154: 03967-4 | F154: 阅读 (3) (4) 补充练习 | G154: 刘平梅等 | H154: 15.5 | I154: 37438 | J154: 15
A155: =ROW()-5 -> 150 | B155: H- | C155: 0987 | D155: 1 | E155: 00987-2 | F155: 样课汇编 | G155: 本书编辑组 | H155: 29 | I155: 37073 | J155: 9
A156: =ROW()-5 -> 151 | B156: CD | C156: 0987 | D156: 1 | F156: 样课汇编（音带） | G156: 本书编辑组 | H156: 7 | J156: 25
A157: =ROW()-5 -> 152 | B157: H- | C157: 3363 | D157: 3 | E157: 03363-3 | F157: 听说 (1) | G157: 刘平梅等 | H157: 12.5 | I157: 37438 | J157: 14
A158: =ROW()-5 -> 153 | B158: H- | C158: 3469 | D158: 2 | E158: 03469-9 | F158: 听说 (2) | G158: 刘平梅等 | H158: 13.5 | I158: 37438 | J158: 17
A159: =ROW()-5 -> 154 | B159: HH | C159: 3104 | D159: 2 | E159: 03104-5 | F159: 听说 (3) | G159: 刘平梅等 | H159: 14.8 | I159: 37438 | J159: 15
A160: =ROW()-5 -> 155 | B160: H- | C160: 3696 | D160: 2 | E160: 03696-9 | F160: 听说 (4) | G160: 刘平梅等 | H160: 17 | I160: 37073 | J160: 13
A161: =ROW()-5 -> 156 | B161: H- | C161: 3362 | D161: 1 | E161: 03362-5 | F161: 听说 (1) 教参 | G161: 刘平梅等 | H161: 7 | I161: 36647 | J161: 35
A162: =ROW()-5 -> 157 | B162: H- | C162: 3470 | D162: 2 | E162: 03470-2 | F162: 听说 (2) 教参 | G162: 刘平梅等 | H162: 6.8 | I162: 36678 | J162: 38
A163: =ROW()-5 -> 158 | B163: H- | C163: 1927 | D163: 1 | E163: 01927-4 | F163: 听说 (3) 教参 | G163: 刘平梅等 | H163: 7 | I163: 36678 | J163: 36
A164: =ROW()-5 -> 159 | B164: H- | C164: 3697 | D164: 1 | E164: 03697-7 | F164: 听说 (4) 教参 | G164: 刘平梅等 | H164: 9.5 | I164: 36800 | J164: 25
A165: =ROW()-5 -> 160 | B165: CD | C165: 3363 | D165: 1 | F165: 听说 (1) 音带5盘 | G165: 何福胜等 | H165: 35 | I165: 36586 | J165: 6
A166: =ROW()-5 -> 161 | B166: CD | C166: 3469 | D166: 1 | F166: 听说 (2) 音带5盘 | G166: 何福胜等 | H166: 35 | I166: 36404 | J166: 5
A167: =ROW()-5 -> 162 | B167: CD | C167: 3104 | D167: 1 | F167: 听说 (3) 音带4盘 | G167: 何福胜等 | H167: 28 | I167: 36404 | J167: 6
A168: =ROW()-5 -> 163 | B168: CD | C168: 3696 | D168: 1 | F168: 听说 (4) 音带5盘 | G168: 何福胜等 | H168: 35 | I168: 36495 | J168: 6
A169: =ROW()-5 -> 164 | B169: H- | C169: 4107 | D169: 1 | E169: 04107-5 | F169: 写作实践 | G169: 张文霞等 | H169: 12.8 | I169: 37469 | J169: 18
A170: =ROW()-5 -> 165 | B170: GP | C170: 2214 | D170: 1 | F170: 新英语教程（第3版）阅读19(CD-ROM) | G170: 覃学岚等 | H170: 29 | I170: 37377
A171: =ROW()-5 -> 166 | B171: GP | C171: 2266 | D171: 1 | F171: 新英语教程（第3版）听说1(CD-ROM) | G171: 何福胜等 | H171: 29 | I171: 37378
F172: 新英语教程（第2版）
A173: =ROW()-5 -> 168 | B173: H- | C173: 1584 | D173: 8 | E173: 01584-8 | F173: 听力练习册（第1册） | G173: 黄淑琳等 | H173: 4.6 | I173: 37135 | J173: 33
A174: =ROW()-5 -> 169 | B174: H- | C174: 1695 | D174: 8 | E174: 01695-X | F174: 听力练习册（第2册） | G174: 李瑞芳等 | H174: 5 | I174: 37135 | J174: 27
A175: =ROW()-5 -> 170 | B175: CD | C175: 1584 | D175: 4 | F175: 听力练习册（第1册）音带 | G175: 黄淑琳等 | H175: 28 | I175: 1996 | J175: 12
A176: =ROW()-5 -> 171 | B176: CD | C176: 1695 | D176: 1 | F176: 听力练习册（第2册）音带 | G176: 李瑞芳等 | H176: 28 | I176: 1996 | J176: 12
F177: 全国工程硕士研究生英语系列图书
F178: （荣获清华大学2001年优秀教材一等奖）
A179: =ROW()-5 -> 174 | B179: H- | C179: 4114 | D179: 1 | E179: 04114-8 | F179: 工程硕士研究生英语听力教程 | G179: 伊秀波 | H179: 17 | I179: 37408 | J179: 15
A180: =ROW()-5 -> 175 | B180: CD | C180: 4114 | D180: 1 | F180: 工程硕士研究生英语听力教程 音带 5 盘 | G180: 伊秀波 | H180: 35 | I180: 37104 | J180: 5
A181: =ROW()-5 -> 176 | B181: H- | C181: 4454 | D181: 1 | E181: 04454-6 | F181: 工程硕士研究生英语泛读教程 | G181: 徐方赋等 | H181: 15 | I181: 37335 | J181: 15
A182: =ROW()-5 -> 177 | B182: H- | C182: 4176 | D182: 1 | E182: 04176-8 | F182: 工程硕士研究生英语教程（第二版、教师用书） | G182: 何福胜等 | H182: 15 | I182: 37354 | J182: 20
A183: =ROW()-5 -> 178 | B183: H- | C183: 4157 | D183: 1 | E183: 04157-1 | F183: 工程硕士研究生英语教程（第二版、学生用书） | G183: 罗立胜等 | H183: 26 | I183: 37438 | J183: 10
A184: =ROW()-5 -> 179 | B184: CD | C184: 3439 | D184: 1 | F184: 工程硕士研究生英语教程（第二版、学生用书） 音带4盘 | H184: 28 | I184: 37104 | J184: 10
A185: =ROW()-5 -> 180 | B185: H- | C185: 4331 | D185: 1 | E185: 04331-0 | F185: 工程硕士研究生英语教程 （ 第二版、测试习题集) | G185: 罗承丽 | H185: 20 | I185: 37408 | J185: 13
A186: =ROW()-5 -> 181 | B186: CD | C186: 3498 | D186: 1 | F186: 工程硕士研究生英语教程 （第二版、测试习题集) 音带2盘 | H186: 14 | I186: 37104 | J186: 14
A187: =ROW()-5 -> 182 | B187: H- | C187: 3883 | D187: 1 | E187: 03883-X | F187: 全国工程硕士专业学位研究生英语教学大纲 | G187: 指导委员会 | H187: 20 | I187: 37397 | J187: 14
A188: =ROW()-5 -> 183 | B188: CD | C188: 3883 | D188: 1 | F188: 全国工程硕士专业学位研究生英语教学大纲 音带2盘 | H188: 14 | J188: 20
F189: 清华大学远程教育专升本英语系列教材
A190: =ROW()-5 -> 185 | B190: H- | C190: 4044 | D190: 1 | E190: 04044-3 | F190: 英语听力（1）（供专升本英语专业使用） | G190: 孙 霞等 | H190: 20 | I190: 36831 | J190: 13
A191: =ROW()-5 -> 186 | B191: H- | C191: 4247 | D191: 1 | E191: 04247-0 | F191: 英语听力 （2） （供专升本英语专业使用） | G191: 孙 霞等 | H191: 22 | I191: 36923 | J191: 12
A192: =ROW()-5 -> 187 | B192: H- | C192: 4597 | D192: 1 | E192: 04597-6 | F192: 英语听力 （3） （供专升本英语专业使用） | G192: 孙 霞等 | H192: 26 | I192: 37104 | J192: 10
A193: =ROW()-5 -> 188 | B193: H- | C193: 5123 | D193: 1 | E193: 05123-2 | F193: 英语听力 （4） （供专升本英语专业使用） | G193: 孙 霞等 | H193: 28 | I193: 37288 | J193: 10
A194: =ROW()-5 -> 189 | B194: CD | C194: 4041 | D194: 1 | F194: 英语听力（1）音带4盘 | H194: 28 | I194: 36861 | J194: 6
A195: =ROW()-5 -> 190 | B195: CD | C195: 4247 | D195: 1 | F195: 英语听力（2）音带4盘 | H195: 28 | I195: 37073 | J195: 6
A196: =ROW()-5 -> 191 | B196: CD | C196: 4597 | D196: 1 | E196: 7880140190 | F196: 英语听力（3）音带5盘 | H196: 35 | I196: 37135 | J196: 8
A197: =ROW()-5 -> 192 | B197: CD | C197: 5123 | D197: 1 | E197: 7880141502 | F197: 英语听力（4）音带6盘 | H197: 42 | I197: 37257 | J197: 20
A198: =ROW()-5 -> 193 | B198: H- | C198: 4072 | D198: 1 | E198: 04072-9 | F198: 英语读写译（第一册）(供专升本非英语专业使用） | G198: 罗立胜等 | H198: 14 | I198: 37469 | J198: 18
A199: =ROW()-5 -> 194 | B199: CD | C199: 4072 | D199: 1 | F199: 英语读写译（第一册）（供专升本非英语专业使用）音带2盘 | G199: 罗立胜 | H199: 14 | I199: 37165 | J199: 12
A200: =ROW()-5 -> 195 | B200: H- | C200: 4252 | D200: 1 | E200: 04252-7 | F200: 英语读写译（第二册）（供专升本非英语专业使用） | G200: 罗立胜等 | H200: 16 | I200: 37104 | J200: 18
A201: =ROW()-5 -> 196 | B201: CD | C201: 4252 | D201: 1 | F201: 英语读写译（第二册）（供专升本非英语专业使用）音带2盘 | G201: 罗立胜 | H201: 14 | I201: 37288
F202: 高校英语选修课系列教材
F203: 适合于公共外语二年级以上、英语专业低年级学生或中高级水平的一般英语爱好者
A204: =ROW()-5 -> 199 | B204: H- | C204: 3804 | D204: 1 | E204: 03804-X | F204: 商务管理听力教程 | G204: 陈亚平 | H204: 17 | I204: 36678 | J204: 20
A205: =ROW()-5 -> 200 | B205: CD | C205: 3804 | D205: 1 | F205: 商务管理听力教程 （音带3盘） | G205: 陈亚平 | H205: 21 | I205: 36831 | J205: 8
F206: 实用英语听说教材系列
E207: 美国著名教科书出版商组织语言专家编写的英语听说教材系列 （白领阶层的必修课）
A208: =ROW()-5 -> 203 | B208: H- | C208: 3248 | D208: 1 | E208: 03248-3 | F208: 商务英语 | G208: Nick Brieger | H208: 19.8 | I208: 37377 | J208: 15
A209: =ROW()-5 -> 204 | B209: H- | C209: 3261 | D209: 2 | E209: 03261-0 | F209: 办公室英语 | G209: Nick Brieger | H209: 25 | I209: 37406 | J209: 12
A210: =ROW()-5 -> 205 | B210: H- | C210: 3298 | D210: 1 | E210: 03298-X | F210: 技术英语 | G210: Nick Brieger | H210: 20 | I210: 36617 | J210: 15
A211: =ROW()-5 -> 206 | B211: H- | C211: 3299 | D211: 2 | E211: 03299-8 | F211: 社交英语 | G211: Nick Brieger | H211: 21.5 | I211: 36617 | J211: 13
A212: =ROW()-5 -> 207 | B212: CD | C212: 3248 | D212: 1 | F212: 商务英语 音带1盘 | G212: Nick Brieger | H212: 7 | I212: 36586 | J212: 25
A213: =ROW()-5 -> 208 | B213: CD | C213: 3261 | D213: 1 | F213: 办公室英语 音带2盘 | G213: Nick Brieger | H213: 14 | I213: 36586 | J213: 25
A214: =ROW()-5 -> 209 | B214: CD | C214: 3298 | D214: 1 | F214: 技术英语 音带2盘 | G214: Nick Brieger | H214: 14 | I214: 1999 | J214: 25
A215: =ROW()-5 -> 210 | B215: CD | C215: 3299 | D215: 1 | F215: 社交英语 音带1盘 | G215: Nick Brieger | H215: 7 | I215: 1999 | J215: 25
F216: 专业英语阅读系列教材
A217: =ROW()-5 -> 212 | B217: H- | C217: 3191 | D217: 1 | E217: 03191-6 | F217: 市场营销英语（Marketing) | G217: Maggie-Jo等 | H217: 13.6 | I217: 37135 | J217: 20
A218: =ROW()-5 -> 213 | B218: H- | C218: 3192 | D218: 1 | E218: 03192-4 | F218: 保险英语（Insurance) | G218: Michael R. Sneyd | H218: 14.5 | I218: 1998 | J218: 17
A219: =ROW()-5 -> 214 | B219: H- | C219: 3190 | D219: 1 | E219: 03190-8 | F219: 西方会计英语（Accounting) | G219: Michael R. Sneyd | H219: 14.5 | I219: 1998 | J219: 15
A220: =ROW()-5 -> 215 | B220: H- | C220: 3267 | D220: 1 | E220: 03267-X | F220: 国际财政金融英语 （International Banking and Finance) | G220: Michael R. Sneyd | H220: 14.5 | I220: 1998 | J220: 20
A221: =ROW()-5 -> 216 | B221: H- | C221: 3189 | D221: 1 | E221: 03189-4 | F221: 广告宣传英语 （Advertising and the Promotion Industry) | G221: Maggie-Jo等 | H221: 14.5 | I221: 1998 | J221: 18
A222: =ROW()-5 -> 217 | B222: CD | C222: 3191 | D222: 1 | F222: 市场营销英语 音带2盘 | G222: Maggie- JoSt John | H222: 14 | I222: 1999 | J222: 25
A223: =ROW()-5 -> 218 | B223: CD | C223: 3192 | D223: 1 | F223: 保险英语 音带2盘 | G223: Michael R.Sneyd | H223: 14 | I223: 1999 | J223: 25
A224: =ROW()-5 -> 219 | B224: CD | C224: 3190 | D224: 1 | F224: 西方会计英语 音带2盘 | G224: Michael R.Sneyd | H224: 14 | I224: 1999 | J224: 25
A225: =ROW()-5 -> 220 | B225: CD | C225: 3267 | D225: 1 | F225: 国际财政金融英语 音带2盘 | G225: Micheal R.Sneyd | H225: 14 | I225: 1999 | J225: 25
A226: =ROW()-5 -> 221 | B226: CD | C226: 3189 | D226: 1 | F226: 广告宣传英语 音带2盘 | G226: Maggie- JoSt John | H226: 14 | I226: 1999 | J226: 25
F227: 其他英语教材
A228: =ROW()-5 -> 223 | B228: H- | C228: 2892 | D228: 2 | E228: 02892-3 | F228: 听说进阶――中高级英语听说教程 (第2版） | G228: 何福胜 | H228: 19 | I228: 1999 | J228: 11
A229: =ROW()-5 -> 224 | B229: CD | C229: 2892 | D229: 1 | F229: 《听说进阶》（音带） | G229: 何福胜 | H229: 35 | I229: 1998 | J229: 5
A230: =ROW()-5 -> 225 | B230: H- | C230: 3064 | D230: 1 | E230: 03064-2 | F230: 高级英语视听说教程(学生用书) (上) | G230: 戴劲等 | H230: 8 | I230: 37438 | J230: 30
A231: =ROW()-5 -> 226 | B231: H- | C231: 3065 | D231: 1 | E231: 03065-0 | F231: 高级英语视听说教程(教师用书) (上) | G231: 刘晶等 | H231: 11 | I231: 1998 | J231: 23
A232: =ROW()-5 -> 227 | B232: H- | C232: 2251 | D232: 1 | E232: 02251-8 | F232: 高级英语视听说教程(学生用书) (下) | G232: 刘晶等 | H232: 9.5 | I232: 36526 | J232: 20
A233: =ROW()-5 -> 228 | B233: H- | C233: 2228 | D233: 1 | E233: 02228-3 | F233: 高级英语视听说教程(教师用书) (下) | G233: 刘晶等 | H233: 15 | I233: 36527 | J233: 10
A234: =ROW()-5 -> 229 | B234: CD | C234: 3065 | D234: 1 | F234: 高级英语视听说教程（上）音带3盘 | G234: 刘晶等 | H234: 21 | I234: 1998 | J234: 3
A235: =ROW()-5 -> 230 | B235: CD | C235: 2228 | D235: 1 | F235: 高级英语视听说教程 (下) 音带4盘 | G235: 刘晶等 | H235: 30 | I235: 36586 | J235: 12
F236: 同等学力申请硕士学位外语水平全国统考应试指导丛书
A237: =ROW()-5 -> 232 | B237: H- | C237: 4235 | D237: 1 | E237: 04235-7 | F237: 俄语试卷评析与应试指导 | G237: 发展中心 | H237: 25 | I237: 37347 | J237: 11
A238: =ROW()-5 -> 233 | B238: CD | C238: 4235 | D238: 1 | F238: 俄语试卷评析与应试指导 （音带上、下） | G238: 发展中心 | H238: 12 | I238: 36923 | J238: 12
A239: =ROW()-5 -> 234 | B239: H- | C239: 4225 | D239: 1 | E239: 4225 | F239: 德语试卷评析与应试指导 | G239: 发展中心 | H239: 21 | I239: 37257 | J239: 18
A240: =ROW()-5 -> 235 | B240: CD | C240: 4225 | D240: 1 | F240: 德语试卷评析与应试指导 （音带上、下） | G240: 发展中心 | H240: 12 | I240: 36923 | J240: 12
A241: =ROW()-5 -> 236 | B241: H- | C241: 4221 | D241: 1 | E241: 04221-7 | F241: 法语试卷评析与应试指导 | G241: 发展中心 | H241: 18 | I241: 37135 | J241: 15
A242: =ROW()-5 -> 237 | B242: CD | C242: 4221 | D242: 1 | F242: 法语试卷评析与应试指导 （音带上、下） | G242: 发展中心 | H242: 12 | I242: 36923 | J242: 12
A243: =ROW()-5 -> 238 | B243: H- | C243: 5254 | D243: 1 | E243: 04235-7 | F243: 英语试卷评析与应试指导（2002版） | G243: 发展中心 | H243: 28.00 | I243: 37336 | J243: 8
A244: =ROW()-5 -> 239 | B244: CD | C244: 4230 | D244: 1 | E244: 04235-7 | F244: 英语试卷评析与应试指导（2002版音带上下） | G244: 发展中心 | H244: 12.00 | I244: 36923 | J244: 12
A245: =ROW()-5 -> 240 | B245: H- | C245: 5193 | D245: 1 | E245: 05193-3 | F245: 日语试卷评析与应试指导（含配套音带） | G245: 发展中心 | H245: 22.00 | I245: 37316 | J245: 10
F246: 钟道隆学习法系列
F247: 钟道隆教授
F248: 45岁自学英语口语,一年后成为口语翻译.
F249: 52岁自学电脑,十几年写作与翻译二十余本书.
F250: 57岁学习和研究记忆方法,极大提高了记忆力.
A251: =ROW()-5 -> 246 | B251: H- | C251: 4232 | D251: 1 | E251: 04232-2 | F251: 逆向法巧学英语 (第3.1版) | G251: 钟道隆 | H251: 18 | I251: 37257 | J251: 17
A252: =ROW()-5 -> 247 | B252: CD | C252: 3719 | D252: 1 | F252: 逆向法巧学英语 (第3版)（光盘） | G252: 钟道隆 | H252: 28 | I252: 37135 | J252: 25
A253: =ROW()-5 -> 248 | B253: CD | C253: 4002 | D253: 1 | F253: 趣味慢速英语 （第一辑 书+音带） | G253: 钟道隆 | H253: 18 | I253: 37226 | J253: 8
A254: =ROW()-5 -> 249 | B254: CD | C254: 4031 | D254: 1 | F254: 趣味慢速英语 （第二辑 书+音带） | G254: 钟道隆 | H254: 18 | I254: 37226 | J254: 8
A255: =ROW()-5 -> 250 | B255: CD | C255: 4039 | D255: 1 | F255: 趣味慢速英语 （第三辑 书+音带） | G255: 钟道隆 | H255: 18 | I255: 37135 | J255: 8
A256: =ROW()-5 -> 251 | B256: CD | C256: 4010 | D256: 1 | F256: 趣味慢速英语 （第四辑 书+音带） | G256: 钟道隆 | H256: 18 | I256: 37226 | J256: 8
A257: =ROW()-5 -> 252 | B257: CD | C257: 88014 | D257: 3 | F257: 趣味慢速英语 （第五辑 书+音带） | G257: 钟道隆 | H257: 18.00 | I257: 37316 | J257: 10
A258: =ROW()-5 -> 253 | B258: CD | C258: 88014 | D258: 4 | F258: 趣味慢速英语 （第六辑 书+音带） | G258: 钟道隆 | H258: 18.00 | I258: 37316 | J258: 10
A259: =ROW()-5 -> 254 | B259: CD | C259: 0156 | D259: 1 | F259: 趣味慢速英语 （第七辑 1书+2音带） | G259: 钟道隆 | H259: 18.00 | I259: 37400 | J259: 10
A260: =ROW()-5 -> 255 | B260: CD | C260: 0168 | D260: 1 | E260: 7880141685 | F260: 趣味慢速英语 (第八辑 1本书+2音带） | G260: 钟道隆 | H260: 18.00 | I260: 37469
A261: =ROW()-5 -> 256 | B261: CD | C261: 4232 | D261: 1 | F261: 慢速英语听力练习 （第3版）（音带3盘） | G261: 钟道隆 | H261: 21 | I261: 36892 | J261: 8
A262: =ROW()-5 -> 257 | B262: CD | C262: 9957 | D262: 1 | F262: 踏踏实实学英语 (音带2盘) | G262: 钟道隆 | H262: 14 | I262: 36434 | J262: 12
A263: =ROW()-5 -> 258 | B263: VD | C263: 9996 | D263: 1 | E263: 9996100 | F263: 踏踏实实学英语 (VCD2盘) | G263: 钟道隆 | H263: 25 | I263: 36617 | J263: 25
A264: =ROW()-5 -> 259 | B264: H- | C264: 3119 | D264: 5 | E264: 03119-3 | F264: 听遍全世界 | G264: 钟道隆 | H264: 14.5 | I264: 37288 | J264: 20
A265: =ROW()-5 -> 260 | B265: H- | C265: 5196 | D265: 1 | E265: 05196-8 | F265: 听遍全世界（第二版） | G265: 钟道隆 | H265: 14 | I265: 37368 | J265: 20
A266: =ROW()-5 -> 261 | B266: CD | C266: 1415 | D266: 3 | E266: 7880141537 | F266: 逆向法丛书：听遍全世界 听力练习带（第1辑）（1本书+2音带） | G266: 钟道隆 | H266: 18 | I266: 37369 | J266: 10
A267: =ROW()-5 -> 262 | B267: GP | C267: 2265 | D267: 1 | E267: 7900622659 | F267: 听遍全世界 CD-ROM 1盘 | G267: 钟道隆 | H267: 29 | I267: 36647 | J267: 25
F268: 国外考试用书（TOEFL、GRE、IELTS等）
A269: =ROW()-5 -> 264 | B269: H- | C269: 5108 | D269: 1 | E269: 05108-9 | F269: 最新雅思考试指南・学术类（原版影印）(含2盒磁带） | G269: Penny Cameron等 | H269: 42 | I269: 37257 | J269: 4
A270: =ROW()-5 -> 265 | B270: H- | C270: 5109 | D270: 1 | E270: 05109-7 | F270: 最新雅思考试指南・普通类（原版影印）(含2盒磁带） | G270: Penny Cameron等 | H270: 42 | I270: 37258 | J270: 3
F271: 大学英语四、六级考试用书
F272: 有声记忆――国内首创、听说领先、正确发音、全面立体、高效永久的记忆
A273: =ROW()-5 -> 268 | B273: H- | C273: 3968 | D273: 2 | F273: 有声记忆 ――最新大学英语四级词汇活用词典（配音带4盘） | G273: 胡宛如 | H273: 45 | I273: 37165 | J273: 3
A274: =ROW()-5 -> 269 | B274: P- | C274: 3100 | D274: 1 | E274: 7900631003 | F274: 有声记忆 ―― 最新大学英语四级词汇活用词典（配CD-ROM光盘1张） | G274: 胡宛如 | H274: 32 | I274: 37104 | J274: 9
A275: =ROW()-5 -> 270 | B275: H- | C275: 5131 | D275: 1 | F275: 有声记忆 ―― 最新大学英语四级词汇活用词典（配音带4盘 配CD-ROM光盘1张） | G275: 胡宛如 | H275: 56 | I275: 37257 | J275: 3
A276: =ROW()-5 -> 271 | B276: H- | C276: 4236 | D276: 2 | E276: 04236-5 | F276: 有声记忆 ―― 最新大学英语六级词汇活用词典（配音带3盘） | G276: 胡宛如 | H276: 30 | I276: 37341 | J276: 5
A277: =ROW()-5 -> 272 | B277: P- | C277: 3101 | D277: 1 | E277: 7900631011 | F277: 有声记忆 ―― 最新大学英语六级词汇活用词典（配CD-ROM光盘1张） | G277: 胡宛如 | H277: 20 | I277: 37408 | J277: 25
A278: =ROW()-5 -> 273 | B278: H- | C278: 5132 | D278: 1 | E278: 05132-1 | F278: 有声记忆 ―― 最新大学英语六级词汇活用词典（配音带3盘 配CD-ROM光盘1张） | G278: 胡宛如 | H278: 38 | I278: 37408 | J278: 4
A279: =ROW()-5 -> 274 | B279: CD | C279: 4049 | D279: 1 | F279: 有声记忆 ―― 最新大学英语四级词汇活用词典（配音带4盘 ） | G279: 胡宛如 | H279: 45 | I279: 37165 | J279: 3
A280: =ROW()-5 -> 275 | B280: H- | C280: 3389 | D280: 2 | E280: 03389-7 | F280: 新编大学英语四级统考模试题及精解 | G280: 李俊峰等 | H280: 15.5 | I280: 37196 | J280: 14
A281: =ROW()-5 -> 276 | B281: CD | C281: 3389 | D281: 1 | F281: 新编大学英语四级统考模试题及精解 音带 | G281: 李俊峰等 | H281: 21 | I281: 36312 | J281: 10
A282: =ROW()-5 -> 277 | B282: H- | C282: 4568 | D282: 1 | E282: 04568-2 | F282: 高级英语应试阅读系列――Reading For CET-4 四级阅读 | G282: 朱 篱 | H282: 20 | I282: 37469 | J282: 15
A283: =ROW()-5 -> 278 | B283: CD | C283: 4568 | D283: 1 | F283: 高级英语应试阅读系列――Reading For CET-4 四级阅读（4音带） | G283: 朱 篱 | H283: 28 | I283: 37226 | J283: 7
A284: =ROW()-5 -> 279 | B284: H- | C284: 4569 | D284: 1 | E284: 04569-1 | F284: 高级英语应试阅读系列――Reading For CET-6 六级阅读 | G284: 朱 篱 | H284: 20.00 | I284: 37469 | J284: 14
A285: =ROW()-5 -> 280 | B285: CD | C285: 4569 | D285: 1 | E285: 04569-1 | F285: 高级英语应试阅读系列――Reading For CET-6 六级阅读（4音带） | G285: 朱 篱 | H285: 28.00 | I285: 37389 | J285: 10
F286: 有声记忆――外语单词记忆方法新突破系列丛书
A287: =ROW()-5 -> 282 | B287: CD | C287: 165 | D287: 1 | E287: 7880141650 | F287: 有声记忆 全国公共英语等级考试大纲有声词汇手册（1-3级）（4音带+1本词汇口袋书） | G287: 美籍专家录音 | H287: 28.00 | I287: 37500 | J287: 10
A288: =ROW()-5 -> 283 | B288: CD | C288: 164 | D288: 1 | E288: 7880141642 | F288: 有声记忆 全国高考英语大纲有声词汇手册（2音带+1本词汇口袋书） | G288: 美籍专家录音 | H288: 14.00 | I288: 37500 | J288: 5
A289: =ROW()-5 -> 284 | B289: CD | C289: 163 | D289: 1 | E289: 7880141634 | F289: 有声记忆 学历文凭考试基础英语大纲有声词汇手册 （3音带+1本词汇口袋书） | G289: 美籍专家录音 | H289: 21.00 | I289: 37500 | J289: 5
A290: =ROW()-5 -> 285 | B290: CD | C290: 162 | D290: 1 | E290: 7880141626 | F290: 有声记忆 专升本英语考试大纲有声词汇手册（3音带+1本词汇口袋书） | G290: 美籍专家录音 | H290: 21.00 | I290: 37500 | J290: 5
A291: =ROW()-5 -> 286 | B291: CD | C291: 161 | D291: 1 | E291: 7880141618 | F291: 有声记忆－硕士研究生入学考试英语大纲有声词汇手册（4音带+1本词汇口袋书） | G291: 美籍专家录音 | H291: 28.00 | I291: 37500 | J291: 10
A292: =ROW()-5 -> 287 | B292: CD | C292: 160 | D292: 1 | E292: 788014160X | F292: 有声记忆－同等学力申请硕士学位英语考试大纲有声词汇手册（4音带+1本词汇口袋书） | G292: 美籍专家录音 | H292: 28.00 | I292: 37500 | J292: 10
A293: =ROW()-5 -> 288 | B293: CD | C293: 4011 | D293: 1 | E293: 7880140115 | F293: 高考英语听力备战(3CD+书) | H293: 28.00 | I293: 37226 | J293: 8
F294: 考研用书（硕士生、博士生入学考试、申请学位考试）
A295: =ROW()-5 -> 290 | B295: H- | C295: 5862 | D295: 1 | E295: 05862-8 | F295: MBA全国联考清华辅导教材：英语（2003）(含音带2盘) | G295: 王敬慧等 | H295: 53 | I295: 37500 | J295: 4
A296: =ROW()-5 -> 291 | B296: H- | C296: 2191 | D296: 1 | E296: 02191-0 | F296: 清华大学博士生入学考试英语试题选编 （修订版） | G296: 罗立胜等 | H296: 22 | I296: 37500 | J296: 12
A297: =ROW()-5 -> 292 | B297: CD | C297: 2191 | D297: 1 | F297: 清华大学博士生入学考试英语试题选编 （修订版）音带2盘 | H297: 14 | I297: 36586 | J297: 12
F298: 其他考试类用书
A299: =ROW()-5 -> 294 | B299: H- | C299: 4983 | D299: 1 | E299: 04983-1 | F299: HSK汉语水平考试听力题型分析与训练（初、高中） | G299: 王小宁等 | H299: 34 | I299: 2002.2 | J299: 12
A300: =ROW()-5 -> 295 | B300: CD | C300: 4983 | D300: 1 | E300: 7880141510 | F300: HSK汉语水平考试听力题型分析与训练（初、中等）（4盘音带） | H300: 28 | I300: 2002.3 | J300: 10
F301: 优秀电影文学欣赏系列
G302: ―― 老剧本、新品味
F303: 英汉对照电影剧本，原版电影录音
A304: =ROW()-5 -> 299 | B304: H- | C304: 4188 | D304: 1 | E304: 04188-1 | F304: 克莱默夫妇 | G304: 杨慎生等 | H304: 9.50 | I304: 37043 | J304: 30
A305: =ROW()-5 -> 300 | B305: H- | C305: 4457 | D305: 1 | E305: 04457-0 | F305: 欲望号街车 | G305: 杨慎生等 | H305: 12.00 | I305: 37043 | J305: 25
A306: =ROW()-5 -> 301 | B306: H- | C306: 4320 | D306: 1 | E306: 04320-5 | F306: 鸳梦重温 | G306: 杨慎生等 | H306: 12.00 | I306: 37073 | J306: 24
A307: =ROW()-5 -> 302 | B307: H- | C307: 1702 | D307: 7 | E307: 01702-6 | F307: 魂断蓝桥 | G307: 杨慎生等 | H307: 6.2 | I307: 1999 | J307: 32
A308: =ROW()-5 -> 303 | B308: CD | C308: 1702 | D308: 2 | F308: 魂断蓝桥 音带2盘 | G308: 杨慎生等 | H308: 20 | I308: 1996 | J308: 12
A309: =ROW()-5 -> 304 | B309: H- | C309: 1701 | D309: 6 | E309: 01701-8 | F309: 卡萨布兰卡 | G309: 杨慎生等 | H309: 7.9 | I309: 1999 | J309: 30
A310: =ROW()-5 -> 305 | B310: CD | C310: 1701 | D310: 1 | F310: 卡萨布兰卡 音带2盘 | G310: 杨慎生等 | H310: 20 | I310: 1996 | J310: 12
A311: =ROW()-5 -> 306 | B311: H- | C311: 1720 | D311: 6 | E311: 01720-4 | F311: 飘 | G311: 杨慎生等 | H311: 13 | I311: 36647 | J311: 16
A312: =ROW()-5 -> 307 | B312: CD | C312: 1720 | D312: 0 | F312: 飘 音带4盘 | G312: 杨慎生等 | H312: 40 | I312: 1996 | J312: 6
A313: =ROW()-5 -> 308 | B313: H- | C313: 2169 | D313: 6 | E313: 02169-4 | F313: 简・爱 | G313: 杨慎生等 | H313: 5.5 | I313: 1999 | J313: 40
A314: =ROW()-5 -> 309 | B314: CD | C314: 2169 | D314: 9 | F314: 简・爱 音带2盘 | G314: 杨慎生等 | H314: 20 | I314: 1996 | J314: 12
A315: =ROW()-5 -> 310 | B315: H- | C315: 2313 | D315: 3 | E315: 02313-1 | F315: 一夜风流 | G315: 杨慎生等 | H315: 9.8 | I315: 1998 | J315: 22
A316: =ROW()-5 -> 311 | B316: CD | C316: 2313 | D316: 1 | F316: 一夜风流 音带2盘 | G316: 杨慎生等 | H316: 20 | I316: 1996 | J316: 12
A317: =ROW()-5 -> 312 | B317: H- | C317: 2460 | D317: 3 | E317: 02460-X | F317: 远大前程 | G317: 杨慎生等 | H317: 4.8 | I317: 36647 | J317: 45
A318: =ROW()-5 -> 313 | B318: CD | C318: 0003 | D318: 1 | F318: 远大前程 音带2盘 | G318: 杨慎生等 | H318: 20 | I318: 1996 | J318: 12
A319: =ROW()-5 -> 314 | B319: H- | C319: 3532 | D319: 1 | E319: 03532-6 | F319: 公民凯恩 | G319: 杨慎生等 | H319: 10 | I319: 36312 | J319: 23
A320: =ROW()-5 -> 315 | B320: CD | C320: 0004 | D320: 1 | F320: 公民凯恩 音带2盘 | G320: 杨慎生等 | H320: 20 | I320: 1996 | J320: 12
A321: =ROW()-5 -> 316 | B321: H- | C321: 2441 | D321: 3 | E321: 02441-3 | F321: 相见恨晚 | G321: 杨慎生等 | H321: 7 | I321: 1999 | J321: 40
A322: =ROW()-5 -> 317 | B322: CD | C322: 0002 | D322: 2 | F322: 相见恨晚 音带2盘 | G322: 杨慎生等 | H322: 20 | I322: 1996 | J322: 12
A323: =ROW()-5 -> 318 | B323: H- | C323: 2351 | D323: 2 | E323: 02351-4 | F323: 呼啸山庄 | G323: 杨慎生等 | H323: 6.5 | I323: 36647 | J323: 30
A324: =ROW()-5 -> 319 | B324: CD | C324: 2351 | D324: 1 | F324: 呼啸山庄 音带2盘 | G324: 杨慎生等 | H324: 20 | I324: 1996 | J324: 12
A325: =ROW()-5 -> 320 | B325: H- | C325: 3131 | D325: 1 | E325: 03131-2 | F325: 音乐之声 | G325: 杨慎生等 | H325: 6.5 | I325: 1998 | J325: 30
A326: =ROW()-5 -> 321 | B326: CD | C326: 3131 | D326: 1 | F326: 音乐之声 音带3盘 | G326: 杨慎生等 | H326: 24 | I326: 1998 | J326: 8
A327: =ROW()-5 -> 322 | B327: H- | C327: 2185 | D327: 1 | E327: 02185-6 | F327: 爱情故事 | G327: 杨慎生等 | H327: 6 | I327: 36495 | J327: 40
A328: =ROW()-5 -> 323 | B328: CD | C328: 2185 | D328: 1 | F328: 爱情故事 音带2盘 | G328: 杨慎生等 | H328: 16 | I328: 36586 | J328: 12
A329: =ROW()-5 -> 324 | B329: H- | C329: 3167 | D329: 1 | E329: 03167-3 | F329: 双重赔款 | G329: 杨慎生等 | H329: 9 | I329: 1998 | J329: 20
A330: =ROW()-5 -> 325 | B330: CD | C330: 3167 | D330: 1 | F330: 双重赔款 音带2盘 | G330: 杨慎生等 | H330: 16 | I330: 1998 | J330: 12
F331: 听说明星――清华电影文库
E332: 当代美国电影集锦，含文字脚本、注释、书面练习、精彩对白等，可自学欣赏，也可作视听说教材。
A333: =ROW()-5 -> 328 | B333: H- | C333: 4486 | D333: 1 | E333: 04486-4 | F333: 插翅难逃（配双VCD） | G333: 王东风 | H333: 23 | I333: 37257 | J333: 5
A334: =ROW()-5 -> 329 | B334: H- | C334: 4411 | D334: 1 | E334: 04411-2 | F334: 旷世怨偶（配双VCD） | G334: 魏淑花 | H334: 25 | I334: 37258 | J334: 5
A335: =ROW()-5 -> 330 | B335: H- | C335: 4978 | D335: 1 | E335: 04978-5 | F335: 爱的牺牲品（配双VCD） | G335: 孙 霞 | H335: 24 | I335: 37259 | J335: 5
A336: =ROW()-5 -> 331 | B336: H- | C336: 5045 | D336: 1 | E336: 05045-7 | F336: 警匪一家（配双VCD） | G336: 王东风 | H336: 26 | I336: 37260 | J336: 5
A337: =ROW()-5 -> 332 | B337: H- | C337: 4971 | D337: 1 | E337: 04971-8 | F337: 难以释怀（配双VCD） | G337: 金福芬 | H337: 21 | I337: 37261 | J337: 5
F338: 常春藤英语书架
F339: 高品质的图书、良好的教学方式
G340: ―― 引导读者迈向最佳英语学习环境
A341: =ROW()-5 -> 336 | B341: H- | C341: 1054 | D341: 1 | E341: 01054-4 | F341: 常春藤名家散文背诵选 | G341: 赖世雄 | H341: 16 | I341: 37104 | J341: 20
A342: =ROW()-5 -> 337 | B342: CD | C342: 1054 | D342: 1 | F342: 常春藤名家散文背诵选 音带2盘 | G342: 赖世雄 | H342: 14 | I342: 36708 | J342: 13
A343: =ROW()-5 -> 338 | B343: H- | C343: 2639 | D343: 2 | E343: 02639-4 | F343: 英文实用解析词汇（上） | G343: 赖世雄 | H343: 29.8 | I343: 1997 | J343: 9
A344: =ROW()-5 -> 339 | B344: H- | C344: 2640 | D344: 2 | E344: 02640-8 | F344: 英文实用解析词汇（下） | G344: 赖世雄 | H344: 29.8 | I344: 1997 | J344: 9
A345: =ROW()-5 -> 340 | B345: CD | C345: 2639 | D345: 1 | F345: 英文实用解析词汇（音带） | G345: 赖世雄 | H345: 28 | I345: 1998 | J345: 4
A346: =ROW()-5 -> 341 | B346: H- | C346: 0798 | D346: 1 | E346: 00798-5 | F346: 实况旅游英语 | G346: 黄于文 | H346: 19.8 | I346: 36647 | J346: 17
A347: =ROW()-5 -> 342 | B347: CD | C347: 0798 | D347: 1 | F347: 实况旅游英语 音带2盘 | G347: 黄于文 | H347: 14 | I347: 36708 | J347: 13
A348: =ROW()-5 -> 343 | B348: P- | C348: 3027 | D348: 1 | E348: 7900630279 | F348: 普及美语（1）（配光盘）（ 最酷的美式口语自学用书） | G348: 赖世雄 | H348: 18 | I348: 36892 | J348: 24
A349: =ROW()-5 -> 344 | B349: P- | C349: 3709 | D349: 1 | E349: 7900637095 | F349: 普及美语（2）（配光盘） | G349: 赖世雄 | H349: 18 | I349: 37196 | J349: 25
A350: =ROW()-5 -> 345 | B350: P- | C350: 3704 | D350: 4 | E350: 7900637044 | F350: 普及美语（3）（配光盘） | G350: 赖世雄 | H350: 18.00 | I350: 37377 | J350: 25
A351: =ROW()-5 -> 346 | B351: P- | C351: 4128 | D351: 9 | E351: 7900641289 | F351: 普及美语（4）（配光盘） | G351: 赖世雄 | H351: 18.00 | I351: 37438 | J351: 25
A352: =ROW()-5 -> 347 | B352: P- | F352: 普及美语（5）（配光盘） | G352: 赖世雄 | H352: 18
A353: 美国中学生优秀作文选（英汉对照、配有音带）
F354: 领会丰富的文化意蕴，学习地道的美国英语
A355: =ROW()-5 -> 350 | B355: H- | C355: 3335 | D355: 1 | E355: 03335-8 | F355: 美国中学生优秀作文选――起飞 | G355: 吴薇等译 | H355: 12.8 | I355: 1999 | J355: 27
A356: =ROW()-5 -> 351 | B356: H- | C356: 3308 | D356: 1 | E356: 03308- | F356: 美国中学生优秀作文选――花季的梦 | G356: 赵恒元等译 | H356: 17.5 | I356: 36281 | J356: 18
A357: =ROW()-5 -> 352 | B357: H- | C357: 3309 | D357: 1 | E357: 03309-9 | F357: 美国中学生优秀作文选――出发 | G357: 吴践等译 | H357: 12.8 | I357: 1999 | J357: 26
A358: =ROW()-5 -> 353 | B358: H- | C358: 3310 | D358: 1 | E358: 03310-2 | F358: 美国中学生优秀作文选――笔下生奇 | G358: 张欣等译 | H358: 16 | I358: 36281 | J358: 21
A359: =ROW()-5 -> 354 | B359: H- | C359: 3706 | D359: 1 | E359: 03706-X | F359: 美国中学生优秀作文选――缤纷生活 | G359: 刘荣跃译 | H359: 14.5 | I359: 36495 | J359: 22
A360: =ROW()-5 -> 355 | B360: H- | C360: 3707 | D360: 1 | E360: 03707-8 | F360: 美国中学生优秀作文选――成长的故事 | G360: 林 锋译 | H360: 16 | I360: 36495 | J360: 20
A361: =ROW()-5 -> 356 | B361: CD | C361: 3335 | D361: 1 | F361: 美国中学生优秀作文选――起飞（音带） | H361: 7 | I361: 36281 | J361: 30
A362: =ROW()-5 -> 357 | B362: CD | C362: 3308 | D362: 1 | F362: 美国中学生优秀作文选――花季的梦 （音带） | H362: 7 | I362: 36281 | J362: 30
A363: =ROW()-5 -> 358 | B363: CD | C363: 3309 | D363: 1 | F363: 美国中学生优秀作文选――出发（音带） | H363: 7 | I363: 36281 | J363: 30
A364: =ROW()-5 -> 359 | B364: CD | C364: 3310 | D364: 1 | F364: 美国中学生优秀作文选――笔下生奇(音带) | H364: 7 | I364: 36281 | J364: 30
A365: =ROW()-5 -> 360 | B365: CD | C365: 3706 | D365: 1 | F365: 美国中学生优秀作文选――缤纷生活(音带) | H365: 7 | I365: 36586 | J365: 25
A366: =ROW()-5 -> 361 | B366: CD | C366: 3707 | D366: 1 | F366: 美国中学生优秀作文选――成长的故事 （音带） | H366: 7 | I366: 36587 | J366: 25
F367: 新目标小学英语
A368: =ROW()-5 -> 363 | B368: G- | C368: 5719 | D368: D | E368: 05719-2 | F368: 《新目标小学英语》预备级A学生用书 | G368: Ann Word | H368: 8.6 | I368: 37530 | J368: 40
A369: =ROW()-5 -> 364 | B369: G- | C369: 5719 | D369: C | E369: 05719-2 | F369: 《新目标小学英语》预备级B学生用书 | G369: Ann Word | H369: 8.6 | I369: 37530 | J369: 40
A370: =ROW()-5 -> 365 | B370: G- | C370: 5945 | D370: 1 | E370: 05945-4 | F370: 《新目标小学英语》预备级A、B教师用书 | G370: Ann Ward | H370: 8.8 | I370: 37530 | J370: 30
A371: =ROW()-5 -> 366 | B371: G- | C371: 5719 | D371: 1 | E371: 05719-2 | F371: 《新目标小学英语》1A学生用书 | G371: Ron Holt | H371: 8.6 | I371: 37469 | J371: 40
A372: =ROW()-5 -> 367 | B372: G- | C372: 5719 | D372: 2 | E372: 05719-2 | F372: 《新目标小学英语》1B学生用书 | G372: Ron Holt | H372: 8.6 | I372: 37469 | J372: 40
A373: =ROW()-5 -> 368 | B373: G- | C373: 5719 | D373: 8 | E373: 05719-2 | F373: 《新目标小学英语》2A学生用书 | G373: Ron Holt | H373: 8.6 | I373: 37500 | J373: 35
A374: =ROW()-5 -> 369 | B374: G- | C374: 5719 | D374: 7 | E374: 05719-2 | F374: 《新目标小学英语》2B学生用书 | G374: Ron Holt | H374: 8.6 | I374: 37500 | J374: 35
A375: =ROW()-5 -> 370 | B375: G- | C375: 5719 | D375: 4 | E375: 05719-2 | F375: 《新目标小学英语》3A学生用书 | G375: Ron Holt | H375: 8.6 | I375: 37500 | J375: 35
A376: =ROW()-5 -> 371 | B376: G- | C376: 5719 | D376: 3 | E376: 05719-2 | F376: 《新目标小学英语》3B学生用书 | G376: Ron Holt | H376: 8.6 | I376: 37500 | J376: 60
A377: =ROW()-5 -> 372 | B377: G- | C377: 5719 | D377: B | E377: 05719-2 | F377: 《新目标小学英语》4A学生用书 | G377: Ron Holt | H377: 8.6 | I377: 37500 | J377: 35
A378: =ROW()-5 -> 373 | B378: G- | C378: 5719 | D378: A | E378: 05719-2 | F378: 《新目标小学英语》4B学生用书 | G378: Ron Holt | H378: 8.6 | I378: 37500 | J378: 35
A379: =ROW()-5 -> 374 | B379: G- | C379: 5719 | D379: 9 | E379: 05719-2 | F379: 《新目标小学英语》5A学生用书 | G379: Ron Holt | H379: 8.6 | I379: 37500 | J379: 38
A380: =ROW()-5 -> 375 | B380: G- | C380: 5719 | D380: 0 | E380: 05719-2 | F380: 《新目标小学英语》5B学生用书 | G380: Ron Holt | H380: 8.6 | I380: 37500 | J380: 40
A381: =ROW()-5 -> 376 | B381: G- | C381: 5719 | D381: 5 | E381: 05719-2 | F381: 《新目标小学英语》6A学生用书 | G381: Ron Holt | H381: 8.6 | I381: 37500 | J381: 35
A382: =ROW()-5 -> 377 | B382: G- | C382: 5719 | D382: 6 | E382: 05719-2 | F382: 《新目标小学英语》6B学生用书 | G382: Ron Holt | H382: 8.6 | I382: 37500 | J382: 40
A383: =ROW()-5 -> 378 | B383: G- | C383: 5803 | D383: 2 | E383: 05803-2 | F383: 《新目标小学英语》1A教师用书 | G383: Ron Holt | H383: 6.8 | I383: 37500 | J383: 50
A384: =ROW()-5 -> 379 | B384: G- | C384: 5803 | D384: 6 | E384: 05803-2 | F384: 《新目标小学英语》1B教师用书 | G384: Ron Holt | H384: 6.8 | I384: 37500 | J384: 50
A385: =ROW()-5 -> 380 | B385: G- | C385: 5803 | D385: 1 | E385: 05803-2 | F385: 《新目标小学英语》2A教师用书 | G385: Ron Holt | H385: 6.8 | I385: 37500 | J385: 50
A386: =ROW()-5 -> 381 | B386: G- | C386: 5803 | D386: 5 | E386: 05803-2 | F386: 《新目标小学英语》2B教师用书 | G386: Ron Holt | H386: 6.8 | I386: 37500 | J386: 50
A387: =ROW()-5 -> 382 | B387: G- | C387: 5803 | D387: A | E387: 05803-2 | F387: 《新目标小学英语》3A教师用书 | G387: Ron Holt | H387: 6.8 | I387: 37530 | J387: 50
A388: =ROW()-5 -> 383 | B388: G- | C388: 5803 | D388: B | E388: 05803-2 | F388: 《新目标小学英语》3B教师用书 | G388: Ron Holt | H388: 6.8 | I388: 37530 | J388: 50
A389: =ROW()-5 -> 384 | B389: G- | C389: 5803 | D389: 0 | E389: 05803-2 | F389: 《新目标小学英语》4A教师用书 | G389: Ron Holt | H389: 6.8 | I389: 37530 | J389: 50
A390: =ROW()-5 -> 385 | B390: G- | C390: 5803 | D390: 9 | E390: 05803-2 | F390: 《新目标小学英语》4B教师用书 | G390: Ron Holt | H390: 6.8 | I390: 37530 | J390: 50
A391: =ROW()-5 -> 386 | B391: G- | C391: 5803 | D391: 8 | E391: 05803-2 | F391: 《新目标小学英语》5A教师用书 | G391: Ron Holt | H391: 6.8 | I391: 37530 | J391: 50
A392: =ROW()-5 -> 387 | B392: G- | C392: 5803 | D392: 7 | E392: 05803-2 | F392: 《新目标小学英语》5B教师用书 | G392: Ron Holt | H392: 6.8 | I392: 37530 | J392: 50
A393: =ROW()-5 -> 388 | B393: G- | C393: 5803 | D393: 4 | E393: 05803-2 | F393: 《新目标小学英语》6A教师用书 | G393: Ron Holt | H393: 6.8 | I393: 37500 | J393: 55
A394: =ROW()-5 -> 389 | B394: G- | C394: 5803 | D394: 3 | E394: 05803-2 | F394: 《新目标小学英语》6B教师用书 | G394: Ron Holt | H394: 6.8 | I394: 37500 | J394: 55
A395: =ROW()-5 -> 390 | B395: G- | C395: 5802 | D395: 1 | E395: 05802-4 | F395: 《新目标小学英语》1A活动手册 | G395: Ron Holt | H395: 4.2 | I395: 37500 | J395: 60
A396: =ROW()-5 -> 391 | B396: G- | C396: 5802 | D396: 2 | E396: 05802-4 | F396: 《新目标小学英语》1B活动手册 | G396: Ron Holt | H396: 4.2 | I396: 37500 | J396: 60
A397: =ROW()-5 -> 392 | B397: G- | C397: 5802 | D397: 5 | E397: 05802-4 | F397: 《新目标小学英语》2A活动手册 | G397: Ron Holt | H397: 4.2 | I397: 37500 | J397: 60
A398: =ROW()-5 -> 393 | B398: G- | C398: 5802 | D398: 4 | E398: 05802-4 | F398: 《新目标小学英语》2B活动手册 | G398: Ron Holt | H398: 4.2 | I398: 37500 | J398: 60
A399: =ROW()-5 -> 394 | B399: G- | C399: 5802 | D399: 9 | E399: 05802-4 | F399: 《新目标小学英语》3A活动手册 | G399: Ron Holt | H399: 4.2 | I399: 37500 | J399: 60
A400: =ROW()-5 -> 395 | B400: G- | C400: 5802 | D400: 8 | E400: 05802-4 | F400: 《新目标小学英语》3B活动手册 | G400: Ron Holt | H400: 4.2 | I400: 37500 | J400: 70
A401: =ROW()-5 -> 396 | B401: G- | C401: 5802 | D401: 7 | E401: 05802-4 | F401: 《新目标小学英语》4A活动手册 | G401: Ron Holt | H401: 4.2 | I401: 37500 | J401: 60
A402: =ROW()-5 -> 397 | B402: G- | C402: 5802 | D402: 6 | E402: 05802-4 | F402: 《新目标小学英语》4B活动手册 | G402: Ron Holt | H402: 4.2 | I402: 37500 | J402: 70
A403: =ROW()-5 -> 398 | B403: G- | C403: 5802 | D403: 3 | E403: 05802-4 | F403: 《新目标小学英语》5A活动手册 | G403: Ron Holt | H403: 4.2 | I403: 37500 | J403: 60
A404: =ROW()-5 -> 399 | B404: G- | C404: 5802 | D404: B | E404: 05802-4 | F404: 《新目标小学英语》5B活动手册 | G404: Ron Holt | H404: 4.2 | I404: 37500 | J404: 60
A405: =ROW()-5 -> 400 | B405: G- | C405: 5802 | D405: A | E405: 05802-4 | F405: 《新目标小学英语》6A活动手册 | G405: Ron Holt | H405: 4.2 | I405: 37500 | J405: 60
A406: =ROW()-5 -> 401 | B406: G- | C406: 5802 | D406: 1 | E406: 05802-4 | F406: 《新目标小学英语》6B活动手册 | G406: Ron Holt | H406: 4.2 | I406: 37500 | J406: 70
A407: =ROW()-5 -> 402 | B407: CD | C407: 0176 | D407: 7 | E407: 7880141766 | F407: 《新目标小学英语》预备级A/B音带 | H407: 7 | I407: 37500 | J407: 50
A408: =ROW()-5 -> 403 | B408: CD | C408: 0176 | D408: 1 | E408: 7880141766 | F408: 《新目标小学英语》1A/1B音带 | H408: 7 | I408: 37500 | J408: 50
A409: =ROW()-5 -> 404 | B409: CD | C409: 0176 | D409: 2 | E409: 7880141766 | F409: 《新目标小学英语》2A/2B音带 | H409: 7 | I409: 37500 | J409: 50
A410: =ROW()-5 -> 405 | B410: CD | C410: 0176 | D410: 3 | E410: 7880141766 | F410: 《新目标小学英语》3A/3B音带 | H410: 7 | I410: 37500 | J410: 50
A411: =ROW()-5 -> 406 | B411: CD | C411: 0176 | D411: 4 | E411: 7880141766 | F411: 《新目标小学英语》4A/4B音带 | H411: 7 | I411: 37500 | J411: 50
A412: =ROW()-5 -> 407 | B412: CD | C412: 0176 | D412: 5 | E412: 7880141766 | F412: 《新目标小学英语》5A/5B音带 | H412: 7 | I412: 37500 | J412: 50
A413: =ROW()-5 -> 408 | B413: CD | C413: 0176 | D413: 6 | E413: 7880141766 | F413: 《新目标小学英语》6A/6B音带 | H413: 7 | I413: 37500 | J413: 50
A414: =ROW()-5 -> 409 | B414: G- | C414: 5804 | D414: 1 | E414: 05804-0 | F414: 《新目标小学英语》字母手册 | G414: Ron Holt | H414: 4.8 | I414: 37500 | J414: 55
A415: =ROW()-5 -> 410 | B415: G- | C415: 5639 | D415: 1 | E415: 05639-0 | F415: 《新目标小学英语》挂图 | G415: Ron Holt | H415: 138 | I415: 37500 | J415: 13
F416: 小学英语实验教材
F417: 教育部基础教育教材审定办公室批准编写和试用。
F418: 小学三年级起始，一年级可以选用。
A419: =ROW()-5 -> 414 | B419: G- | C419: 3953 | D419: 2 | E419: 03953-4 | F419: 小学英语实验教材（1A） | G419: 清华大学 | H419: 15 | I419: 37500 | J419: 22
A420: =ROW()-5 -> 415 | B420: G- | C420: 3954 | D420: 1 | E420: 03954-2 | F420: 小学英语实验教材（1B） | G420: 清华大学 | H420: 15 | I420: 37316 | J420: 22
A421: =ROW()-5 -> 416 | B421: G- | C421: 4246 | D421: 2 | E421: 04262-2 | F421: 小学英语实验教材（2A） | G421: 清华大学 | H421: 15.00 | I421: 37469 | J421: 22
A422: =ROW()-5 -> 417 | B422: G- | C422: 4598 | D422: 2 | E422: 04598-4 | F422: 小学英语实验教材（2B) | G422: 清华大学 | H422: 15 | I422: 37288 | J422: 22
A423: =ROW()-5 -> 418 | B423: G- | C423: 4598 | D423: 1 | E423: 04598-4 | F423: 小学英语实验教材（3A） | G423: 清华大学 | H423: 15 | I423: 37469 | J423: 22
A424: =ROW()-5 -> 419 | B424: G- | C424: 4598 | D424: 3 | E424: 04598-4 | F424: 小学英语实验教材（3B） | G424: 清华大学 | H424: 15.00 | I424: 37257 | J424: 22
A425: =ROW()-5 -> 420 | B425: G- | C425: 4607 | D425: 8 | E425: 04607-7 | F425: 小学英语实验教材（4B）（普及版） | G425: 清华大学 | H425: 9.80 | I425: 37469 | J425: 25
A426: =ROW()-5 -> 421 | B426: G- | C426: 4607 | D426: 1 | E426: 04607-7 | F426: 小学英语实验教材（1A)（普及版） | G426: 清华大学 | H426: 9.8 | I426: 37500 | J426: 25
A427: =ROW()-5 -> 422 | B427: G- | C427: 4607 | D427: 2 | E427: 04607-7 | F427: 小学英语实验教材（1B)（普及版） | G427: 清华大学 | H427: 9.8 | I427: 37327 | J427: 25
A428: =ROW()-5 -> 423 | B428: G- | C428: 4607 | D428: 4 | E428: 04607-7 | F428: 小学英语实验教材（2A)（普及版） | G428: 清华大学 | H428: 9.8 | I428: 37469 | J428: 25
A429: =ROW()-5 -> 424 | B429: G- | C429: 4607 | D429: 5 | E429: 04607-7 | F429: 小学英语实验教材（2B)（普及版） | G429: 清华大学 | H429: 9.8 | I429: 37135 | J429: 25
A430: =ROW()-5 -> 425 | B430: G- | C430: 4607 | D430: 3 | E430: 04607-7 | F430: 小学英语实验教材（3A)（普及版） | G430: 清华大学 | H430: 9.8 | I430: 37226 | J430: 25
A431: =ROW()-5 -> 426 | B431: G- | C431: 4607 | D431: 7 | E431: 04607-7 | F431: 小学英语实验教材（3B)（普及版） | G431: 清华大学 | H431: 9.8 | I431: 37469 | J431: 25
A432: =ROW()-5 -> 427 | B432: G- | C432: 4607 | D432: 6 | E432: 04607-7 | F432: 小学英语实验教材（4A)（普及版） | G432: 清华大学 | H432: 9.8 | I432: 37438 | J432: 25
A433: =ROW()-5 -> 428 | B433: CD | C433: 3953 | D433: 1 | F433: 小学英语实验教材（1A）音带1盘 | G433: 清华大学 | H433: 7 | I433: 36739 | J433: 25
A434: =ROW()-5 -> 429 | B434: CD | C434: 3954 | D434: 1 | F434: 小学英语实验教材（1B）音带1盘 | G434: 清华大学 | H434: 7 | I434: 36739 | J434: 25
A435: =ROW()-5 -> 430 | B435: CD | C435: 4246 | D435: 2 | F435: 小学英语实验教材（2A）音带1盘 | G435: 清华大学 | H435: 7 | I435: 37074 | J435: 25
A436: =ROW()-5 -> 431 | B436: CD | C436: 4246 | D436: 1 | F436: 小学英语实验教材（2B）音带1盘 | G436: 清华大学 | H436: 7 | I436: 37073 | J436: 25
A437: =ROW()-5 -> 432 | B437: CD | C437: 4598 | D437: 1 | E437: 788014028X | F437: 小学英语实验教材（3A）音带1盘 | G437: 清华大学 | H437: 7 | I437: 37105 | J437: 25
A438: =ROW()-5 -> 433 | B438: CD | C438: 4598 | D438: 3 | E438: 7880141170 | F438: 小学英语实验教材（3B）音带1盘 | G438: 清华大学 | H438: 7 | I438: 37288 | J438: 25
A439: =ROW()-5 -> 434 | B439: CD | C439: 4607 | D439: 1 | E439: 7880141758 | F439: 小学英语实验教材（4A）音带1盘 | G439: 清华大学 | H439: 7 | I439: 37500 | J439: 40
A440: =ROW()-5 -> 435 | B440: CD | C440: 5491 | D440: 1 | E440: 7880141693 | F440: 小学英语实验教材1A活动手册 音带2盘 | G440: 清华大学 | H440: 13.00 | I440: 37469 | J440: 25
A441: =ROW()-5 -> 436 | B441: CD | C441: 5369 | D441: 1 | E441: 7880141731 | F441: 小学英语实验教材1B活动手册 音带2盘 | G441: 清华大学 | H441: 14.00 | I441: 37500 | J441: 25
A442: =ROW()-5 -> 437 | B442: G- | C442: 4667 | D442: 1 | E442: 04667-0 | F442: 小学英语实验教材1A 挂图 | G442: 清华大学 | H442: 380 | I442: 37135 | J442: 5
A443: =ROW()-5 -> 438 | B443: G- | C443: 4667 | D443: 2 | E443: 0466-7 | F443: 小学英语实验教材1B 挂图 | G443: 清华大学 | H443: 360 | I443: 37135 | J443: 5
A444: =ROW()-5 -> 439 | B444: G- | C444: 5368 | D444: 1 | E444: 05368-5 | F444: 小学英语试验教材2A 挂图 | G444: 清华大学 | H444: 420.00 | I444: 37347 | J444: 5
A445: =ROW()-5 -> 440 | B445: G- | C445: 5423 | D445: 1 | E445: 05423-1 | F445: 小学英语实验教材2B 挂图 | G445: 清华大学 | H445: 450.00 | I445: 37377 | J445: 5
A446: =ROW()-5 -> 441 | B446: G- | C446: 5858 | D446: 1 | E446: 05858-X | F446: 小学英语实验教材3A 挂图 | G446: 清华大学 | H446: 360.00 | I446: 37530 | J446: 5
A447: =ROW()-5 -> 442 | B447: G- | C447: 5491 | D447: 1 | E447: 05491-6 | F447: 小学英语实验教材1A活动手册 | G447: 清华大学 | H447: 5.50 | I447: 37530 | J447: 30
A448: =ROW()-5 -> 443 | B448: G- | C448: 5369 | D448: 1 | E448: 05369-1 | F448: 小学英语实验教材 1B活动手册 | G448: 清华大学 | H448: 5.50 | I448: 37377 | J448: 30
F449: 英语自学与阅读用书
A450: =ROW()-5 -> 445 | B450: H- | C450: 4137 | D450: 1 | E450: 04137-7 | F450: 美国英文日常短语 | G450: 侯成源等 | H450: 14 | I450: 36951 | J450: 20
A451: =ROW()-5 -> 446 | B451: CD | C451: 4137 | D451: 1 | F451: 美国英文日常短语（音带1盘） | G451: 侯成源等 | H451: 7 | I451: 37165 | J451: 25
A452: =ROW()-5 -> 447 | B452: GP | C452: 5479 | D452: 1 | E452: 7880141669 | F452: 学英语从ABC开始――女将军赵织雯教授教你学英语（8张VCD光盘和1本手册） | G452: 赵织雯 | H452: 96 | I452: 37530 | J452: 20
A453: =ROW()-5 -> 448 | B453: H- | C453: 5479 | D453: 1 | E453: 05479-7 | F453: 学英语从ABC开始――女将军赵织雯教授教你学英语 | G453: 赵织雯 | H453: 12 | I453: 37469 | J453: 22
A454: =ROW()-5 -> 449 | B454: H- | F454: 学英语从ABC开始――女将军赵织雯教授教你学英语（10音带） | G454: 赵织雯 | H454: 70
F455: 休 闲 时 尚 类
F456: 像一个依然鲜明的梦，似一首永不褪色的诗；旅途的风尘，爱恋的悲喜，
F457: 人生的哲理，成长的风雨，在始终清晰的记忆里，都融于这隽永的词曲 ……
A458: =ROW()-5 -> 453 | B458: H- | C458: 4174 | D458: 1 | E458: 04174-1 | F458: 经典影片精彩片段语言评析 | G458: 方 琰等 | H458: 19.8 | I458: 36923 | J458: 14
A459: =ROW()-5 -> 454 | B459: H- | C459: 1040 | D459: C | E459: 01040-4 | F459: 英文抒情歌曲精选解析 (一） | G459: 常春藤 | H459: 17 | I459: 37135 | J459: 15
A460: =ROW()-5 -> 455 | B460: H- | C460: 1080 | D460: C | E460: 01080-3 | F460: 英文抒情歌曲精选解析（二） | G460: 常春藤 | H460: 17 | I460: 36617 | J460: 15
A461: =ROW()-5 -> 456 | B461: H- | C461: 3266 | D461: 2 | E461: 03266-1 | F461: 英文抒情歌曲精选解析（三） | G461: 常春藤 | H461: 18 | I461: 36982 | J461: 15
A462: =ROW()-5 -> 457 | B462: CD | C462: 1040 | D462: 1 | F462: 英文抒情歌曲精选解析 (一) 音带4盘 | G462: 常春藤 | H462: 40 | I462: 1997 | J462: 6
A463: =ROW()-5 -> 458 | B463: CD | C463: 1080 | D463: 1 | F463: 英文抒情歌曲精选解析 (二) 音带4盘 | G463: 常春藤 | H463: 40 | I463: 1997 | J463: 12
A464: =ROW()-5 -> 459 | B464: CD | C464: 3266 | D464: 1 | F464: 英文抒情歌曲精选解析 (三) 音带4盘 | G464: 常春藤 | H464: 40 | I464: 1999 | J464: 13
A465: =ROW()-5 -> 460 | B465: CD | C465: 3031 | D465: 1 | F465: 英文抒情歌曲(一)VCD | H465: 28 | I465: 1998.7 | J465: 50
A466: =ROW()-5 -> 461 | B466: CD | C466: 3032 | D466: 1 | F466: 英文抒情歌曲(二)VCD | H466: 28 | I466: 1998.7 | J466: 50
A467: =ROW()-5 -> 462 | B467: CD | C467: 3033 | D467: 1 | F467: 英文抒情歌曲(三)VCD | H467: 28 | I467: 1998.7 | J467: 50
A468: =ROW()-5 -> 463 | B468: CD | C468: 3034 | D468: 1 | F468: 英文抒情歌曲(四)VCD | H468: 28 | I468: 1998.7 | J468: 50
A469: =ROW()-5 -> 464 | B469: CD | C469: 3035 | D469: 1 | F469: 英文抒情歌曲(五)VCD | H469: 28 | I469: 1998.7 | J469: 50
A470: =ROW()-5 -> 465 | B470: CD | C470: 3036 | D470: 1 | F470: 英文抒情歌曲(六)VCD | H470: 28 | I470: 1998.7 | J470: 50
F471: 非英语语种图书
B472: 其中《有声记忆――日语资格考试备考词汇10000条》适合于日本日语能力考试1-4级、我国日语四、六级考试、同等学力考试 、考研等各类考生。
A473: =ROW()-5 -> 468 | B473: H- | C473: 4696 | D473: 4 | E473: 04696-4 | F473: 有声记忆―日语资格考试必备词汇10000条 （初级部分）（第二版） | G473: 宫 力 | H473: 14.5 | I473: 37469 | J473: 24
A474: =ROW()-5 -> 469 | B474: CD | C474: 1747 | D474: 1 | F474: 有声记忆―日语资格考试备考词汇10000条 （初级部分）5音带 （第二版） | G474: 岩泽、大泽 | H474: 35 | I474: 36861 | J474: 5
A475: =ROW()-5 -> 470 | B475: H- | C475: 4697 | D475: 1 | E475: 04697-2 | F475: 有声记忆―日语资格考试备考词汇10000条 （中级部分）（第二版） | G475: 宫 力 | H475: 21.5 | I475: 37196 | J475: 14
A476: =ROW()-5 -> 471 | B476: CD | C476: 3147 | D476: 1 | F476: 有声记忆―日语资格考试备考词汇10000条 （中级部分）8音带（第二版） | H476: 56 | I476: 36861
A477: =ROW()-5 -> 472 | B477: H- | C477: 4698 | D477: 7 | E477: 04698-0 | F477: 有声记忆―日语资格考试必备词汇10000条 （高级部分）（第二版） | G477: 宫 力 | H477: 16.5 | I477: 37469 | J477: 20
A478: =ROW()-5 -> 473 | B478: CD | C478: 3533 | D478: 1 | F478: 有声记忆―日语资格考试备考词汇10000条 （高级）音带7盘（第二版） | G478: 松下孝子等 | H478: 49 | I478: 36465 | J478: 4
A479: =ROW()-5 -> 474 | B479: H- | C479: 2758 | D479: 2 | E479: 02758-7 | F479: 新编高级日本语会话 | G479: 松下孝子等 | H479: 10 | I479: 1999 | J479: 27
A480: =ROW()-5 -> 475 | B480: CD | C480: 2758 | D480: 1 | F480: 新编高级日本语会话（音带） | G480: 松下孝子 | H480: 14 | I480: 1998 | J480: 2
A481: =ROW()-5 -> 476 | B481: H- | C481: 1989 | D481: 1 | E481: 01989-4 | F481: 电视商务日语 | G481: 李宗惠等 | H481: 18 | I481: 1996 | J481: 11
A482: =ROW()-5 -> 477 | B482: CD | C482: 1989 | D482: 1 | F482: 电视商务日语（音带） | G482: 李宗惠等 | H482: 98 | I482: 1996 | J482: 14

A1: 注：其中《听说》《阅读》《写作》各配有2盘CNN节目VCD，为集体用户免费赠送。

A1: 岩泽、 崎