A1: 序号 | C1: 代 号 | E1: ISBN 7-302- | F1: 书 名 | G1: 著译编者 | H1: 定价(元) | I1: 印年 | J1: 册/包 | K1: 订数
F2: 2002年7月新书订单
F3: 计算机类
A4: 1 | B4: P- | C4: 4195 | D4: 1 | E4: 04195-1 | F4: SolidWorks 精彩实例 | G4: 李维等著 | H4: 20.00 | I4: 37438 | J4: 16
A5: 2 | B5: P- | C5: 4193 | D5: 1 | E5: 04193-0 | F5: MCSE 制胜宝典 ―― MS BizTalk Server 2000 (配光盘）微软公司著 | G5: 萧湘工作室 | H5: 63.00 | I5: 37438 | J5: 7
A6: 3 | B6: TP | C6: 5556 | D6: 1 | E6: 05556-1 | F6: Visual FoxPro 7.0函数和系统变量手册 | G6: 王冬等 | H6: 36.00 | I6: 37438 | J6: 7
A7: 4 | B7: TP | C7: 5545 | D7: 1 | E7: 55451 | F7: 精通 MATLAB 6 | G7: 张航等译 | H7: 69.00 | I7: 37438 | J7: 5
A8: 5 | B8: P- | C8: 4180 | D8: 1 | E8: 04180-1 | F8: MATLAB 扩展编程（配光盘） | G8: 何强等 | H8: 42.00 | I8: 37438 | J8: 7
A9: 6 | B9: TP | C9: 5512 | D9: 1 | E9: 05512-1 | F9: FoxBASE 程序设计(二级)辅导 | G9: 徐士良等 | H9: 25.00 | I9: 37438 | J9: 10
A10: 7 | B10: P- | C10: 4319 | D10: 1 | E10: 04319-1 | F10: 财务软件应用技术（配光盘） | G10: 孙万军等 | H10: 28.60 | I10: 37438 | J10: 11
A11: 8 | B11: TP | C11: 5054 | D11: 1 | E11: 05054-1 | F11: 全C编程（配软盘） | G11: 高永强等 | H11: 59.00 | I11: 37438 | J11: 4
A12: 9 | B12: P- | C12: 4311 | D12: 1 | E12: 04311-1 | F12: 电脑绘画――边学边做（配光盘） | G12: 方其桂等 | H12: 19.00 | I12: 37438 | J12: 12
A13: 10 | B13: TP | C13: 5228 | D13: 1 | E13: 05228-1 | F13: 基于ACIS的几何造型技术与系统开发 | G13: 詹海生等 | H13: 42.00 | I13: 37438 | J13: 8
A14: 11 | B14: TP | C14: 5551 | D14: 1 | E14: 05551-1 | F14: DB2技术参考大全 | G14: 袁勤勇等译 | H14: 85.00 | I14: 37438 | J14: 4
A15: 12 | B15: TP | C15: 5597 | D15: 1 | E15: 05597-1 | F15: Photoshop 7.0 入门与提高 | G15: 应勤 | H15: 34.00 | I15: 37438 | J15: 6
A16: 13 | B16: TP | C16: 5517 | D16: 1 | E16: 05517-1 | F16: 掌上型电脑大盘点――全面解读PDA | G16: 时间创作室 | H16: 19.00 | I16: 37438 | J16: 13
A17: 14 | B17: TP | C17: 5023 | D17: 1 | E17: 05023-1 | F17: 微机接口技术实用教程 | G17: 艾德才等 | H17: 34.00 | I17: 37438 | J17: 7
A18: 15 | B18: P- | C18: 4191 | D18: 1 | E18: 04191-1 | F18: UG高级铣加工应用培训教程（配光盘） | G18: 苗春杰编译 | H18: 30.00 | I18: 37438 | J18: 12
A19: 16 | B19: TP | C19: 5569 | D19: 1 | E19: 05569-1 | F19: ASP.NET 1.0 高级编程 | G19: 王毅等译 | H19: 128.00 | I19: 37438 | J19: 3
A20: 17 | B20: P- | C20: 4127 | D20: 1 | E20: 04127-1 | F20: Windows 2000 程序设计（配光盘） | G20: 天宏工作室译 | H20: 108.00 | I20: 37438 | J20: 3
A21: 18 | B21: TP | C21: 1082 | D21: C | F21: 从HTML 到 XML（含盘） | G21: 蔡翠平主编 | H21: 26.00 | I21: 37438 | J21: 11
A22: 19 | B22: TP | C22: 5522 | D22: 1 | E22: 05522-1 | F22: .NET XML 高级编程 | G22: Dinar Dalvi Joe Gray等著 | H22: 75.00 | I22: 37438 | J22: 4
A23: 20 | B23: TP | C23: 5566 | D23: 1 | E23: 05566-1 | F23: Java程序设计培训教程 | G23: 孙燕等 | H23: 24.00 | I23: 37438 | J23: 10
A24: 21 | B24: TP | C24: 5518 | D24: 1 | E24: 05518-1 | F24: AutoCAD 2002 定制与开发 | G24: 郭朝勇等 | H24: 42.00 | I24: 37438 | J24: 6
A25: 22 | B25: TP | C25: 5446 | D25: 1 | E25: 05446-1 | F25: 微型机应用基础教程――从windows98到 windows 2000 | G25: 戴梅萼 | H25: 28.00 | I25: 37438 | J25: 9
A26: 23 | B26: TP | C26: 5552 | D26: 1 | E26: 05552-1 | F26: Linux 管理与应用基础（配光盘) | G26: 位元文化 | H26: 38.00 | I26: 37438 | J26: 7
A27: 24 | B27: TP | C27: 5494 | D27: 1 | E27: 05494-1 | F27: 程序员教程同步辅导 | G27: 谢树煜主编 | H27: 39.00 | I27: 37438 | J27: 7
A28: 25 | B28: P- | C28: 4316 | D28: 1 | E28: 04316-1 | F28: 会计住处系统实验教程（配光盘） | G28: 王新玲汪刚主编 | H28: 28.80 | I28: 37438 | J28: 10
A29: 26 | B29: P- | C29: 4310 | D29: 1 | E29: 04310-1 | F29: JAVA事件处理指南（配光盘） | G29: 沈莹谢乐健等译 | H29: 58.00 | I29: 37438 | J29: 6
A30: 27 | B30: TP | C30: 5571 | D30: 1 | E30: 05571-1 | F30: QBASIC程序设计(二级)样题汇编 | G30: 徐士良等 | H30: 16.00 | I30: 37438 | J30: 14
A31: 28 | B31: P- | C31: 4309 | D31: 1 | E31: 04309-1 | F31: UG知识熔接技术培训教程（配光盘） | G31: 王刚等译 | H31: 22.00 | I31: 37438 | J31: 20
A32: 29 | B32: TP | C32: 5572 | D32: 1 | E32: 5572 | F32: C 程序设计(二级)样题汇编 | G32: 鲍有文等 | H32: 15.00 | I32: 37438 | J32: 14
A33: 30 | B33: TP | C33: 5447 | D33: 1 | E33: 05447-1 | F33: 多代理系统理论、方法与应用 | G33: 范玉顺、曹军威 | H33: 25.00 | I33: 37438 | J33: 13
A34: 31 | B34: TP | C34: 5513 | D34: 1 | E34: 05513-1 | F34: Web 服务架构与开放互操作技术 | G34: 柴晓路 | H34: 42.00 | I34: 37438 | J34: 7
A35: 32 | B35: TP | C35: 5565 | D35: 1 | E35: 05565-1 | F35: ASP.NET移动控件编程 | G35: Matt Butler等 | H35: 38.00 | I35: 37438 | J35: 9
A36: 33 | B36: TP | C36: 5394 | D36: 1 | E36: 05394-1 | F36: Exchange 2000 sever应用程序开发指南 | G36: 唐明湘等 | H36: 26 | I36: 37438 | J36: 9
A37: 34 | B37: TP | C37: 5393 | D37: 1 | E37: 05393-1 | F37: Ｗindows 环境下的多线程编程原理与应用 | G37: 王险峰等 | H37: 35.00 | I37: 37438 | J37: 8
A38: 35 | B38: P- | C38: 4189 | D38: 1 | E38: 04189-1 | F38: 3DS MAX 4.2 效果图制作与实用线架大全（配光盘） | G38: 朱仁成等 | H38: 49.00 | I38: 37438 | J38: 7
A39: 36 | B39: TP | C39: 5576 | D39: 1 | E39: 05576-1 | F39: I-DEAS 入门与提高 | G39: 杨建新等 | H39: 23.00 | I39: 37438 | J39: 10
A40: 37 | B40: TP | C40: 5554 | D40: 1 | E40: 05554-1 | F40: Visual FoxPro 7.0类和对象手册 | G40: 王冬等 | H40: 30.00 | I40: 37438 | J40: 8
A41: 38 | B41: TP | C41: 5460 | D41: 1 | E41: 05460-1 | F41: SQL Server 2000 培训教程 | G41: 陈小兵等 | H41: 29.00 | I41: 37438 | J41: 9
A42: 39 | B42: P- | C42: 4305 | D42: 1 | E42: 04305-1 | F42: C++ Builder与RS-232串行通信控制（配光盘） | G42: 范逸之 | H42: 49.00 | I42: 37438 | J42: 6
A43: 40 | B43: TP | C43: 5540 | D43: 1 | E43: 05540-1 | F43: Visual FoxPro 7.0 高级编程 | G43: 孙立明刘琳等 | H43: 35.00 | I43: 37438 | J43: 7
A44: 41 | B44: P- | C44: 4315 | D44: 1 | E44: 04315-1 | F44: 财务软件实用教程（配光盘） | G44: 孙莲香 | H44: 26.80 | I44: 37438 | J44: 12
A45: 42 | B45: TP | C45: 5021 | D45: 1 | E45: 05021-1 | F45: 自动机理论、语言和计算机导论（第2版）(Introduction to Automata Theory,Languages,and Computation) | G45: John E.Hopcroft等 | H45: 47 | I45: 37438 | J45: 5
A46: 43 | B46: TP | C46: 5539 | D46: 1 | E46: 05539-1 | F46: Windows XP 注册表应用实践与精通 | G46: 林山主编 | H46: 35.00 | I46: 37438 | J46: 6
A47: 44 | B47: TP | C47: 1082 | D47: D | E47: 01082-1 | F47: 蓝牙技术原理与技术 | G47: 朱刚等 | H47: 26.00 | I47: 37438 | J47: 12
A48: 45 | B48: P- | C48: 4314 | D48: 1 | E48: 04314-1 | F48: AutoCAD 权威技术支持（配光盘） | G48: 马力著 | H48: 45.00 | I48: 37438 | J48: 7
A49: =ROW()-2 -> 47 | B49: TP | C49: 5610 | D49: 1 | E49: 05610-1 | F49: Delphi 6 程序设计培训教程（清华电脑学堂） | G49: 王渝等 | H49: 29.00 | I49: 37438 | J49: 9
A50: =ROW()-2 -> 48 | B50: TP | C50: 5660 | D50: 1 | E50: 05660-1 | F50: Windows XP 中文版快捷教程 | G50: 东方人华 | H50: 28.00 | I50: 37438 | J50: 8
A51: =ROW()-2 -> 49 | B51: TP | C51: 5532 | D51: 1 | E51: 05532-1 | F51: Internet 实用综合培训教程 | G51: 苏武荣主编 | H51: 29.00 | I51: 37438 | J51: 10
A52: =ROW()-2 -> 50 | B52: TP | C52: 5659 | D52: 1 | E52: 05659-1 | F52: Internet 网络冲浪百事通 | G52: 张洪彬 | H52: 26.00 | I52: 37438 | J52: 10
A53: =ROW()-2 -> 51 | B53: G- | C53: 5599 | D53: 1 | E53: 05599-1 | F53: 电脑启示录（中篇）硅谷的秘密 | G53: 徐志伟 | H53: 18.00 | I53: 37438 | J53: 13
A54: 46 | B54: TP | C54: 5618 | D54: 1 | E54: 05618-1 | F54: 手把手教你学用Flish MX | G54: 韩伟峰等 | H54: 28.00 | I54: 37438 | J54: 9
A55: 47 | B55: TP | C55: 3509 | D55: 1 | E55: 03509-1 | F55: Windows C程序设计入门与提高 | G55: 柳永新等 | H55: 32.50 | I55: 37438 | J55: 6
A56: 48 | B56: TP | C56: 5649 | D56: 1 | E56: 5649 | F56: 基于 XML的ASP.NET开发 | G56: 王宝良译 | H56: 42.00 | I56: 37438 | J56: 7
A57: 49 | B57: TP | C57: 5609 | D57: 1 | E57: 05609-1 | F57: ASP.NET 程序设计 | G57: [美]G.Andrew Duthie | H57: 48.00 | I57: 37438 | J57: 6
A58: 50 | B58: TP | C58: 5611 | D58: 1 | E58: 05611-1 | F58: C/C++程序设计培训教程（清华电脑学堂） | G58: 王雷编著 | H58: 38.00 | I58: 37438 | J58: 7
A59: 51 | B59: TP | C59: 5689 | D59: 1 | E59: 05689-1 | F59: 奔腾系列微型计算机原理及接口技术 | G59: 谢瑞和等 | H59: 24.00 | I59: 37438 | J59: 12
A60: 52 | B60: TP | C60: 4999 | D60: 1 | E60: 04999-1 | F60: The 80x86 IBM PC and Compatible Computers(Volumes I &II)(80x86 IBM PC 及兼容计算机（卷I和卷II）（配软盘） | G60: Muhammad Ali Mazidi等 | H60: 85.00 | I60: 37438 | J60: 3
A61: 53 | B61: P- | C61: 4196 | D61: 1 | E61: 41961 | F61: SolidWorks 装配和二维工程图（配光盘） | G61: 夏燕等 | H61: 24.00 | I61: 37438 | J61: 12
A62: 54 | B62: TP | C62: 1082 | D62: E | E62: 01082-E | F62: 新编Internet基础及应用教程 | G62: 李军义等 | H62: 19.00 | I62: 37438 | J62: 12
A63: =ROW()-2 -> 61 | B63: TP | C63: 5523 | D63: 1 | E63: 05523-8 | F63: Java 2简明教程 | G63: 李诚等 | H63: 37.00 | I63: 37438 | J63: 8
A64: =ROW()-2 -> 62 | B64: TP | C64: 5507 | D64: 1 | E64: 05507-6 | F64: CASL程序设计教程 | G64: 刘克武等 | H64: 23 | I64: 37439 | J64: 14
A65: =ROW()-2 -> 63 | B65: TP | C65: 5046 | D65: 1 | E65: 05046-5 | F65: 8×C196KX单片机及其应用系统设计 | G65: 刘复华 | H65: 29.60 | I65: 37440 | J65: 8
A66: =ROW()-2 -> 64 | B66: TP | C66: 5581 | D66: 1 | E66: 05581-5 | F66: .NET数据服务 C#高级编程 | G66: Fabio Clandio Ferracchiati等 | H66: 78.00 | I66: 37438 | J66: 4
A67: =ROW()-2 -> 65 | B67: TP | C67: 5279 | D67: 1 | E67: 05279-4 | F67: 数据库驱动的Web站点 | G67: [美]Mike Morrison等 | H67: 18.00 | I67: 37438 | J67: 9
A68: =ROW()-2 -> 66 | B68: TP | C68: 5687 | D68: 1 | E68: 05687-0 | F68: C语言程序设计题典 | G68: 李春葆等 | H68: 29.00 | I68: 37438 | J68: 9
A69: =ROW()-2 -> 67 | B69: TP | C69: 5686 | D69: 1 | E69: 05686-2 | F69: C++语言程序设计题典 | G69: 李春葆等 | H69: 25.00 | I69: 37438 | J69: 10
A70: 709 | B70: TP | C70: 5663 | D70: 1 | E70: 05663-3 | F70: 微软ADO.NET 程序设计 | G70: [美]Rebecca M.Riordan | H70: 48.00 | I70: 37438 | J70: 6
A71: =ROW()-2 -> 69 | B71: TP | C71: 5596 | D71: 1 | E71: 05596-3 | F71: 电子商务新视野 | G71: 陈锡筠等译 | H71: 29.00 | I71: 37438 | J71: 10
A72: 709 | B72: TP | C72: 5640 | D72: 1 | E72: 05640-4 | F72: Visual Basic.Net 和Visual C#.NET面向对象程序设计 | G72: [美]Robin A.Reynolds-Haertle | H72: 36.00 | I72: 37439 | J72: 6
A73: =ROW()-2 -> 71 | B73: TP 5389 1 | C73: 5553 | E73: 05553-X | F73: 软件配置管理 | G73: 徐晓春等 | H73: 30.00 | I73: 37438 | J73: 9
A74: =ROW()-2 -> 72 | B74: TP | C74: 5617 | D74: 1 | E74: 05617-1 | F74: Unix/solaris 系统管理与网络管理 | G74: 饶云华等 | H74: 45.00 | I74: 37438 | J74: 7
A75: =ROW()-2 -> 73 | B75: P- | C75: 4318 | D75: 1 | E75: 643-18-4 | F75: UG高级装配培训教程（配光盘） | G75: Unigraphics Solutions Inc | H75: 24.00 | I75: 37438 | J75: 17
F76: 理工与基础学科类
A77: 56 | B77: TB | C77: 5304 | D77: 1 | E77: 05304-1 | F77: 纳米科学和纳米技术前瞻 | G77: 刘国奎、王中林 | H77: 80 | I77: 37438 | J77: 6
A78: 57 | B78: TB | C78: 5483 | D78: 1 | E78: 05483-1 | F78: 工程和设计中的人因学（第7版） | G78: 麦格劳-希尔教育出版集团 | H78: 76 | I78: 37438 | J78: 3
A79: 655 | B79: TB | C79: 5604 | D79: 1 | E79: 560401 | F79: 21世纪制造 | G79: Paul Kenneth Wrigh | H79: 49 | I79: 37438 | J79: 6
F80: 外语类
A81: 200 | B81: H- | C81: 5453 | D81: 1 | E81: 05453-1 | F81: 新编汉英语篇翻译强化训练 | G81: 居祖纯 | H81: 14 | I81: 37438 | J81: 20
A82: =ROW()-2 -> 80 | B82: H | C82: 5698 | D82: 1 | E82: 5698 | F82: 逆向法丛书――踏踏实实学英语――英语学习逆向法 | G82: 钟道隆 | H82: 15.00 | I82: 37438 | J82: 16
F83: 经管及人文社科类
A84: 914 | B84: F- | C84: 5457 | D84: 1 | E84: 05457-1 | F84: 客户关系管理――企业典范 | G84: ARC远擎管理顾问公司 | H84: 12 | I84: 37438 | J84: 37
A85: 598 | B85: F- | C85: 5533 | D85: 1 | E85: 05533-1 | F85: 会计信息系统 | G85: 付得一 | H85: 22 | I85: 37438 | J85: 12
A86: 887 | B86: F- | C86: 5302 | D86: 1 | E86: 05302-1 | F86: 企业资源规划――管理、技术、应用 | G86: 朱岩译 | H86: 33 | I86: 37438 | J86: 9
A87: 1123 | B87: F- | C87: 5525 | D87: 1 | E87: 05525-1 | F87: 会计信息系统 | G87: 乔鹏等 | H87: 26 | I87: 37438 | J87: 10
A88: =ROW()-2 -> 86 | B88: F- | C88: 5622 | D88: 1 | E88: 05622-6 | F88: 管理（清华MBA联考2003） | G88: 张 德等 | H88: 38 | I88: 37438 | J88: 11
A89: 1124 | B89: J- | C89: 5577 | D89: 1 | E89: 05577-1 | F89: 艺术院校动画基础系列教材：动画速写基础 | G89: 刘临 | H89: 29.8 | I89: 37438 | J89: 8
A90: =ROW()-2 -> 88 | B90: F- | C90: 5069 | D90: 1 | E90: 05069-4 | F90: 企业竞争力提升战略 | G90: 吴维库 | H90: 28 | I90: 37438 | J90: 10
F91: 电子、音像
A92: =ROW()-2 -> 90 | B92: CD | C92: 4915 | D92: 1 | E92: 04915-7 | F92: 高级英语应试阅读系列――Reading For NETEM 考研阅读（5音带） | G92: 朱 篱 | H92: 35 | I92: 37196 | J92: 5