A1: 序号 | C1: 代 号 | E1: ISBN 7-302- | F1: 书 名 | G1: 著译编者 | H1: 定价(元) | I1: 印年 | J1: 册/包 | K1: 订数
F2: 2002年10月新书订单
F3: 计算机类
A4: =ROW()-2 -> 3 | B4: TP | C4: 5870 | D4: 1 | E4: 05870-9 | F4: Java 网络程序设计 | G4: 黄嘉辉 | H4: 58.00 | I4: 37530 | J4: 6
A5: =ROW()-2 -> 4 | B5: TP | C5: 5821 | D5: 1 | E5: 05821-0 | F5: Photoshop 7.0 电视讲座教程 | G5: 雷波 | H5: 45.00 | I5: 37530 | J5: 6
A6: =ROW()-2 -> 5 | B6: TP | C6: 5813 | D6: 1 | E6: 05813-X | F6: 计算机基础知识与基本操作（第二版） | G6: 张玲 | H6: 24.00 | I6: 37530 | J6: 11
A7: =ROW()-2 -> 6 | B7: TP | C7: 5879 | D7: 1 | E7: 05879-2 | F7: 系统实时仿真开发环境与应用 | G7: 杨涤 | H7: 46.00 | I7: 37530 | J7: 7
A8: =ROW()-2 -> 7 | B8: TP | C8: 5886 | D8: 1 | E8: 05886-5 | F8: .NET Freamework 编程思想 | G8: Kent Tegets tony Baer | H8: 35.00 | I8: 37530 | J8: 12
A9: =ROW()-2 -> 8 | B9: TP | C9: 5902 | D9: 1 | E9: 05902-0 | F9: 软件工程师丛 Visual Basic 程序设计题典 | G9: 李春葆等 | H9: 25.00 | I9: 37530 | J9: 10
A10: =ROW()-2 -> 9 | B10: P- | C10: 4325 | D10: 1 | E10: 7900643257 | F10: 深入浅出Delphi 6 （配光盘） | G10: 董良 | H10: 72.00 | I10: 37530 | J10: 4
A11: =ROW()-2 -> 10 | B11: TP | C11: 5327 | D11: 1 | E11: 05327-8 | F11: 管理动态IP网络 | G11: 徐六通等 | H11: 28.00 | I11: 37530 | J11: 8
A12: =ROW()-2 -> 11 | B12: TP | C12: 5918 | D12: 1 | E12: 05918-7 | F12: 构建Web解决方案――应用ASP.NET和ADO.NET | G12: Dino Esposito | H12: 45.00 | I12: 37530 | J12: 9
A13: =ROW()-2 -> 12 | B13: TP | C13: 5848 | D13: 1 | E13: 05848-2 | F13: Windows 2000 黑客大曝光：网络安全机密与解决方案 | G13: Joel Scambray, Stuart McClure 著 | H13: 53.00 | I13: 37530 | J13: 6
A14: =ROW()-2 -> 13 | B14: TP | C14: 5876 | D14: 1 | E14: 05876-8 | F14: Linux 黑客大曝光：Linux 安全机密与解决方案 | G14: Brian Hatch, James Lee,George Kurtz 著 | H14: 59.00 | I14: 37530 | J14: 5
A15: =ROW()-2 -> 14 | B15: TP | C15: 5785 | D15: 1 | E15: 7900643222 | F15: 数据结构（C 语言版）（配光盘） | G15: 黄国瑜 | H15: 30.00 | I15: 37530 | J15: 8
A16: =ROW()-2 -> 15 | B16: TP | C16: 5795 | D16: 1 | E16: 05795-8 | F16: 超越零点学网页制作 | G16: 顾义华 | H16: 24 | I16: 37530 | J16: 12
A17: =ROW()-2 -> 16 | B17: TP | C17: 5863 | D17: 1 | E17: 05836-6 | F17: 网页设计师实用培训教程 | G17: 李伟学 | H17: 30.00 | I17: 37530 | J17: 8
A18: =ROW()-2 -> 17 | B18: TP | C18: 5796 | D18: 1 | E18: 05796-6 | F18: 电脑DIY入门与提高 | G18: 宋宏伟 | H18: 29.00 | I18: 37530 | J18: 7
A19: =ROW()-2 -> 18 | B19: TP | C19: 5637 | D19: 1 | E19: 05637-4 | F19: 定性推理方法 | G19: 石纯一 | H19: 20.00 | I19: 37530 | J19: 15
A20: =ROW()-2 -> 19 | B20: TP | C20: 5705 | D20: 1 | E20: 05705-2 | F20: 多媒体技术基础（第2版） | G20: 林福宗 | H20: 37.00 | I20: 37530 | J20: 6
A21: =ROW()-2 -> 20 | B21: P- | C21: 4366 | D21: 1 | E21: 7900643664 | F21: 战胜特效字制作快易60讲（配光盘） | G21: 王永辉 | H21: 36.00 | I21: 37530 | J21: 7
A22: =ROW()-2 -> 21 | B22: TP | C22: 5738 | D22: 1 | E22: 05738-9 | F22: Windows 2000管理指南 | G22: George Spalding | H22: 72.00 | I22: 37530 | J22: 4
A23: =ROW()-2 -> 22 | B23: TP- | C23: 5936 | D23: 1 | E23: 05936-5 | F23: C语言程序设计 | G23: 彭四伟 | H23: 18.00 | I23: 37530 | J23: 13
A24: =ROW()-2 -> 23 | B24: TP | C24: 5002 | D24: 1 | E24: 05002-3 | F24: Photoshop 7.0 | G24: 于鹏 | H24: 35.00 | I24: 37530 | J24: 7
A25: =ROW()-2 -> 24 | B25: TP- | C25: 5742 | D25: 1 | E25: 05742-7 | F25: Pro/ENGINEER 2001 中文版自由曲面与行为建模 | G25: 柳迎春 | H25: 23.00 | I25: 37530 | J25: 14
A26: =ROW()-2 -> 25 | B26: TP | C26: 5897 | D26: 1 | E26: 05897-0 | F26: Mastercam 9实用培训教程 | G26: 张小宁 | H26: 35.00 | I26: 37530 | J26: 9
A27: =ROW()-2 -> 26 | B27: P- | C27: 4363 | D27: 1 | E27: 790064363X | F27: 从Matlab/Simulink 模型到代码实现（配光盘） | G27: 陈永春 | H27: 34.00 | I27: 37530 | J27: 8
A28: =ROW()-2 -> 27 | B28: TP | C28: 5889 | D28: 1 | E28: 05889-X | F28: ASP.NET1.0入门经典――VB.NET编程篇 | G28: Chris Goode,John Kauffman | H28: 78.00 | I28: 37530 | J28: 5
A29: =ROW()-2 -> 28 | B29: P- | C29: 4353 | D29: 1 | E29: 7900643532 | F29: Photoshop 7.0 经典实例详解（配光盘） | G29: 朱仁成等 | H29: 36.00 | I29: 37530 | J29: 7
A30: =ROW()-2 -> 29 | B30: P- | C30: 4355 | D30: 1 | E30: 7900643559 | F30: 网站美工高级培训教程（配光盘） | G30: 张帆 | H30: 39.50 | I30: 37530 | J30: 8
A31: =ROW()-2 -> 30 | B31: TP | C31: 5607 | D31: 1 | E31: 7302056072 | F31: 信息系统分析与设计（第2版） | G31: 邝孔武 | H31: 22.00 | I31: 37530 | J31: 12
A32: =ROW()-2 -> 31 | B32: TP | C32: 5867 | D32: 1 | E32: 05867-9 | F32: 风险管理――软件系统开发方法 | G32: Elasne M.Hall | H32: 49.00 | I32: 37530 | J32: 7
A33: =ROW()-2 -> 32 | B33: TP | C33: 5733 | D33: 1 | E33: 05733-8 | F33: 黑客大挑战――用20个案例测试你的事件响应能力 | G33: Mike Schiffman | H33: 38.00 | I33: 37530 | J33: 8
A34: =ROW()-2 -> 33 | B34: TP | C34: 5277 | D34: 1 | E34: 05739-7 | F34: CMM：软件过程的管理与改进 | G34: 雷剑文 | H34: 15.00 | I34: 37530 | J34: 20
A35: =ROW()-2 -> 34 | B35: P- | C35: 4356 | D35: 1 | E35: 7900643567 | F35: US工业设计培训教程（配光盘） | G35: Unigraphics Solutions Inc | H35: 35.00 | I35: 37530 | J35: 10
A36: =ROW()-2 -> 35 | B36: TP | C36: 5894 | D36: 1 | E36: 05894-6 | F36: Visual Basic.NET 入门与进阶 | G36: 博文 | H36: 36.00 | I36: 37530 | J36: 7
A37: =ROW()-2 -> 36 | B37: TP | C37: 5693 | D37: 1 | E37: 05693-5 | F37: 多媒体教学系统组建与管理 | G37: 李香敏 | H37: 28.00 | I37: 37530 | J37: 10
A38: =ROW()-2 -> 37 | B38: P- | C38: 4338 | D38: 1 | E38: 7900643389 | F38: 闪客必备――Flash MX精彩实例详解（配光盘） | G38: 王太吉 | H38: 39.00 | I38: 37530 | J38: 7
A39: =ROW()-2 -> 38 | B39: TP | C39: 5928 | D39: 1 | E39: 05928-4 | F39: 网络工程概论 | G39: 蔡建新 | H39: 33.00 | I39: 37530 | J39: 7
A40: =ROW()-2 -> 39 | B40: TP | C40: 5865 | D40: 1 | E40: 05865-2 | F40: 技术人员管理――创新、协作和软件过程 | G40: 瓦茨 | H40: 49.00 | I40: 37530 | J40: 8
A41: =ROW()-2 -> 40 | B41: TP | C41: 5947 | D41: 1 | E41: 05947-0 | F41: Windows网络编程（第2版） | G41: Anthory Jones, Jim Ohlund | H41: 78.00 | I41: 37530 | J41: 6
A42: =ROW()-2 -> 41 | B42: TP | C42: 5872 | D42: 1 | E42: 05872-5 | F42: Dreamweaver MX看图速成 | G42: 魏洪斌等 | H42: 28.00 | I42: 37530 | J42: 10
A43: =ROW()-2 -> 42 | B43: P- | C43: 4370 | D43: 1 | E43: 7900643702 | F43: SolidWorks 2001 Plus原厂教育训练手册（上）（配光盘） | G43: 实威科技 | H43: 49.00 | I43: 37530 | J43: 7
A44: =ROW()-2 -> 43 | B44: P- | C44: 4371 | D44: 1 | E44: 7900643710 | F44: 网页制作教程（配光盘） | G44: 赵祖荫 | H44: 23 | I44: 37530 | J44: 9
A45: =ROW()-2 -> 44 | B45: TP | C45: 5866 | D45: 1 | E45: 05866-0 | F45: 软件制胜之道 | G45: Watts S. Humphrey | H45: 29.00 | I45: 37530 | J45: 12
A46: =ROW()-2 -> 45 | B46: TP | C46: 5435 | D46: 1 | E46: 05435-5 | F46: 自然语言理解――一种让机器懂得人类语言的研究第２版 | G46: 李春葆 | H46: 39.80 | I46: 37530 | J46: 6
A47: =ROW()-2 -> 46 | B47: TP | C47: 5946 | D47: 1 | E47: 05946-2 | F47: Visual C++.NET语言参考手册 | G47: 微软公司 | H47: 108.00 | I47: 37530 | J47: 4
A48: =ROW()-2 -> 47 | B48: TP | C48: 5871 | D48: 1 | E48: 05871-7 | F48: 计算机网络与通信自学辅导 | G48: 程向前等 | H48: 21.00 | I48: 37530 | J48: 13
A49: =ROW()-2 -> 48 | B49: Ｐ- | C49: 4352 | D49: 1 | E49: 7900643524 | F49: 趣味程序导学Visual Basic （含光盘） | G49: 彭永清 | H49: 32.00 | I49: 37530 | J49: 8
A50: =ROW()-2 -> 49 | B50: TP | C50: 5938 | D50: 1 | E50: 05938-1 | F50: 面向对象的软件工程――构建复杂且多变的系统 | G50: 布鲁志 | H50: 45.00 | I50: 37530 | J50: 3
A51: =ROW()-2 -> 50 | B51: TP | C51: 5727 | D51: 1 | E51: 05727-3 | F51: Java程序设计教程 | G51: John Smiley | H51: 56.00 | I51: 37530 | J51: 6
A52: =ROW()-2 -> 51 | B52: TP | C52: 5793 | D52: 1 | E52: 05793-1 | F52: 网络安全实用技术 | G52: 叶丹 | H52: 33.00 | I52: 37530 | J52: 8
A53: =ROW()-2 -> 52 | B53: TP | C53: 5937 | D53: 1 | E53: 05937-3 | F53: USB ２.0硬件设计 | G53: 萧世文 | H53: 35.00 | I53: 37530 | J53: 9
A54: =ROW()-2 -> 53 | B54: TP | C54: 5791 | D54: 1 | E54: 05791-5 | F54: ＩＰ认证园地系列：Illustrator & Photoshop 平面设计电视讲座教程 | G54: 马鑫 | H54: 36.00 | I54: 37530 | J54: 8
A55: =ROW()-2 -> 54 | B55: TP | C55: 5646 | D55: 1 | E55: 05646-3 | F55: Visual FoxPro 6.0程序设计基础 | G55: 李吉梅等 | H55: 30 | I55: 37530 | J55: 18
A56: =ROW()-2 -> 55 | B56: F- | C56: 5829 | D56: 1 | E56: 05829-6 | F56: 管理控制 | G56: 杜栋 | H56: 15.00 | I56: 37530 | J56: 18
A57: =ROW()-2 -> 56 | B57: TP | C57: 5770 | D57: 1 | E57: 05770-2 | F57: Windows XP+Office XP办公应用培训教程 | G57: 王文娟 | H57: 40.00 | I57: 37530 | J57: 7
A58: =ROW()-2 -> 57 | B58: TP | C58: 5935 | D58: 1 | E58: 05935-7 | F58: 电脑DIY选购、组装与维护教程 | G58: 王卫国 | H58: 33.00 | I58: 37530 | J58: 7
A59: =ROW()-2 -> 58 | B59: TP | C59: 5927 | D59: 1 | E59: 05927-6 | F59: .NET移动通信程序设计 | G59: 刘志安 | H59: 20.00 | I59: 37530 | J59: 15
A60: =ROW()-2 -> 59 | B60: TP | C60: 5930 | D60: 1 | E60: 05930-6 | F60: 战胜Poser Pro快易60讲 | G60: 王岩 | H60: 28.00 | I60: 37530 | J60: 8
A61: =ROW()-2 -> 60 | B61: TP | C61: 4586 | D61: 1 | E61: 04586-0 | F61: 信息王国中的代码 | G61: 董百年 | H61: 19.90 | I61: 37530 | J61: 12
A62: =ROW()-2 -> 61 | B62: TP | C62: 5869 | D62: 1 | E62: 05869-5 | F62: Windows.NET Server安全指南 | G62: Seth Fogie 等 | H62: 39.00 | I62: 37530 | J62: 9
A63: =ROW()-2 -> 62 | B63: TP | C63: 5860 | D63: 1 | E63: 05860-1 | F63: Windows XP 网络信息服务应用实践与精通 | G63: 林山 | H63: 45.00 | I63: 37530 | J63: 6
A64: =ROW()-2 -> 63 | B64: P- | C64: 4360 | D64: 1 | E64: 7900643605 | F64: Flash MX培训教程（配光盘） | G64: 赵东升等 | H64: 35.00 | I64: 37530 | J64: 9
A65: =ROW()-2 -> 64 | B65: TP | C65: 5664 | D65: 1 | E65: 05664-1 | F65: 数据库原理自学辅导 | G65: 王卫平 | H65: 13.00 | I65: 37530 | J65: 20
A66: =ROW()-2 -> 65 | B66: TP | C66: 5654 | D66: 1 | E66: 05654-4 | F66: Visual Basic.NET开发快速入门 | G66: 天宏工作室译 | H66: 22.00 | I66: 37530 | J66: 12
A67: =ROW()-2 -> 66 | B67: TP 5389 1 | C67: 5873 | D67: 1 | E67: 05873-3 | F67: CVS和Nightly Build技术 | G67: 杨锦方 | H67: 25.00 | I67: 37530 | J67: 12
A68: =ROW()-2 -> 67 | B68: TP | C68: 5820 | D68: 1 | E68: 05820-2 | F68: IP认证园地系列：PageMaker & Acrobat Adobe出版工具电视讲座教程 | G68: 马鑫等 | H68: 39.00 | I68: 37530 | J68: 7
A69: =ROW()-2 -> 68 | B69: TP- | C69: 5878 | D69: 1 | E69: 05878-4 | F69: 闪客必备――Flash MX动画制作基础教程 | G69: 甘登岱等 | H69: 26.00 | I69: 37530 | J69: 11
A70: =ROW()-2 -> 69 | B70: TP | C70: 5925 | D70: 1 | E70: 05925-X | F70: Visual Basic.NET线程参考手册 | G70: Kourosh Ardestani | H70: 32.00 | I70: 37530 | J70: 12
A71: =ROW()-2 -> 70 | B71: TP | C71: 5890 | D71: 1 | E71: 05890-3 | F71: 构建Web服务和.NET应用程序 | G71: Lonnie Wal 等 | H71: 54.00 | I71: 37530 | J71: 7
A72: =ROW()-2 -> 71 | B72: TP | C72: 5948 | D72: 1 | E72: 05948-9 | F72: 微软.NET程序设计系列：WEB数据库程序设计（.NET版） | G72: Jim Buyens | H72: 68.00 | I72: 37530 | J72: 6
F76: 工程与基础学科类
A77: =ROW()-5 -> 73 | B77: F- | C77: 5601 | D77: 1 | E77: 05601-3 | F77: 以风险为基础的基金临管现代化 | G77: 李仲祥 | H77: 20.00 | I77: 37530 | J77: 18
A78: =ROW()-4 -> 75 | B78: F- | C78: 5172 | D78: 1 | E78: 05172-0 | F78: Bio――股市信息学 | G78: 张冬生 | H78: 45.00 | I78: 37530 | J78: 6
A79: =ROW()-4 -> 76 | B79: TK | C79: 5706 | D79: 1 | E79: 05706-0 | F79: 汽车发动机燃料供给与调节 | G79: 刘峥 | H79: 17.00 | I79: 37530 | J79: 13
A80: =ROW()-4 -> 77 | B80: O- | C80: 4768 | D80: 1 | E80: 04768-5 | F80: Mechatronic Reliability （力电失效学） | G80: 杨卫 | H80: 180.00 | I80: 37530 | J80: 5
A81: =ROW()-4 -> 78 | B81: TK | C81: 5385 | D81: 1 | E81: 05385-5 | F81: 清华学术专著：大型火电机组系统仿真与建模(精) | G81: 吕崇德 | H81: 63.00 | I81: 37530 | J81: 5
F90: 大文科
A91: =ROW()-5 -> 87 | B91: G- | C91: 5803 | D91: 0 | E91: 05803-2 | F91: 《新目标小学英语》4A教师用书 | G91: Ron Holt | H91: 6.8 | I91: 37530 | J91: 50
A92: =ROW()-5 -> 88 | B92: G- | C92: 5803 | D92: 9 | E92: 05803-2 | F92: 《新目标小学英语》4B教师用书 | G92: Ron Holt | H92: 6.8 | I92: 37530 | J92: 50
A93: =ROW()-5 -> 89 | B93: G- | C93: 5803 | D93: B | E93: 05803-2 | F93: 《新目标小学英语》3B教师用书 | G93: Ron Holt | H93: 6.8 | I93: 37530 | J93: 50
A94: =ROW()-5 -> 90 | B94: G- | C94: 5945 | D94: 1 | E94: 05945-4 | F94: 《新目标小学英语》预备级A、B教师用书 | G94: Ann Ward | H94: 8.8 | I94: 37530 | J94: 30
A95: =ROW()-5 -> 91 | B95: H- | C95: 4411 | D95: 1 | E95: 04411-2 | F95: 旷世怨偶（配光盘） | G95: 魏淑花 | H95: 25 | I95: 37530
A96: =ROW()-5 -> 92 | B96: F- | C96: 5830 | D96: 1 | E96: 05830-X | F96: 投资学 | G96: 朱宝宪 | H96: 39.00 | I96: 37530 | J96: 6
A97: =ROW()-5 -> 93 | B97: F- | C97: 5790 | D97: 1 | E97: 05790-7 | F97: 企业营销：沃顿MBA创业课程 | G97: 艾郁 | H97: 21 | I97: 37530 | J97: 12
A98: =ROW()-5 -> 94 | B98: G- | C98: 5802 | D98: 3 | E98: 05802-4 | F98: 《新目标小学英语》5A活动手册 | G98: Ron Holt | H98: 4.2 | I98: 37500 | J98: 60
A99: =ROW()-5 -> 95 | B99: G- | C99: 5803 | D99: 7 | E99: 05803-2 | F99: 《新目标小学英语》5B教师手书 | G99: Ron Holt | H99: 6.8 | I99: 37530 | J99: 50
A100: =ROW()-5 -> 96 | B100: F- | C100: 5504 | D100: 1 | E100: 05504-1 | F100: 公共和非营利性组织的人力资源管理 | G100: Joan E.Pynes | H100: 22 | I100: 37530 | J100: 14
A101: =ROW()-5 -> 97 | B101: H- | C101: 5851 | D101: 1 | E101: 05851-2 | F101: 如何写好英语作文――大学生写作弱点分析 | G101: 纪康丽 | H101: 13 | I101: 37530 | J101: 18
A102: =ROW()-5 -> 98 | B102: Z- | C102: 30621 | D102: 4 | E102: 30621-4 | F102: 经管引进版新书预告 | I102: 37530 | J102: 100
A103: =ROW()-5 -> 99 | B103: G- | C103: 5719 | D103: D | E103: 05719-2 | F103: 《新目标小学英语》预备级A学生用书 | G103: Ann Word | H103: 8.6 | I103: 37530 | J103: 40
A104: =ROW()-5 -> 100 | B104: G- | C104: 5719 | D104: C | E104: 05719-2 | F104: 《新目标小学英语》预备级B学生用书 | G104: Ann Word | H104: 8.6 | I104: 37530 | J104: 40
A105: =ROW()-5 -> 101 | B105: H- | C105: 2876 | D105: 1 | E105: 02876-1 | F105: 中学生实用英语动词搭配词典（精） | G105: 席玉虎 | H105: 50 | I105: 37530 | J105: 7
A106: =ROW()-5 -> 102 | B106: G- | C106: 5803 | D106: A | E106: 05803-2 | F106: 《新目标小学英语》3A教师用书 | G106: Ron Holt | H106: 6.8 | I106: 37530 | J106: 50
A107: =ROW()-5 -> 103 | B107: I- | C107: 5650 | D107: 1 | E107: 05650-1 | F107: 和而不同――中国现代文学片论 | G107: 解志熙 | H107: 22 | I107: 37530 | J107: 20
A108: =ROW()-5 -> 104 | B108: F- | C108: 5656 | D108: 1 | E108: 05656-0 | F108: 当代风险管理与保险教程（第7版） | G108: 齐瑞宗 | H108: 48.00 | I108: 37530 | J108: 5
A109: =ROW()-5 -> 105 | B109: I- | C109: 5673 | D109: 1 | E109: 05673-0 | F109: 小说叙事研究 | G109: 格 非 | H109: 17 | I109: 37530 | J109: 18
A110: =ROW()-3 -> 108 | B110: CD | C110: 0058 | D110: 1 | E110: 7880141707 | F110: 汉语拼音识字阅读速成(1本书+1拼读盘+3张光盘+1音带+1本课外读物） | G110: 杨正国 | H110: 168 | I110: 37530 | J110: 3
A111: =ROW()-5 -> 107 | B111: G- | C111: 5858 | D111: 1 | E111: 05858-X | F111: 小学英语实验教材3A 挂图 | G111: 清华大学 | H111: 360.00 | I111: 37530 | J111: 5
A112: =ROW()-5 -> 108 | B112: G- | C112: 5719 | D112: 2 | E112: 05719-2 | F112: 《新目标小学英语》1B学生用书 | G112: Ron Holt | H112: 8.6 | I112: 37469 | J112: 40
A113: =ROW()-5 -> 109 | B113: GP | C113: 5479 | D113: 1 | E113: 7880141669 | F113: 学英语从ABC开始――女将军赵织雯教授教你学英语（8张VCD光盘和1本手册） | G113: 金鉴明 | H113: 96 | I113: 37530 | J113: 20
A114: =ROW()-5 -> 110 | B114: H- | C114: 5045 | D114: 1 | E114: 788014157X | F114: 警匪一家（配双VCD） | G114: 王东风 | H114: 26 | I114: 37530
A115: =ROW()-5 -> 111 | B115: H- | C115: 4971 | D115: 1 | E115: 7880141588 | F115: 难以释怀（配双VCD） | G115: 金福芬 | H115: 21 | I115: 37530
A116: =ROW()-5 -> 112 | B116: F- | C116: 5829 | D116: 1 | E116: 05829-6 | F116: 管理控制 | G116: 杜栋 | H116: 15 | I116: 37530 | J116: 18
A117: =ROW()-5 -> 113 | B117: F- | C117: 5274 | D117: 1 | E117: 05274-3 | F117: 信息管理学教程 | G117: 杜栋 | H117: 15 | I117: 37530 | J117: 20
A118: =ROW()-5 -> 114 | B118: H- | C118: 5788 | D118: 1 | E118: 05788-5 | F118: 计算语言学 | G118: 刘颖 | H118: 22 | I118: 37530 | J118: 13
A119: =ROW()-5 -> 115 | B119: D- | C119: 5633 | D119: 1 | E119: 05633-1 | F119: 清华传播译丛――美国大从传播法：判例评析（第六版）上、下 | G119: 梁宁等译 | H119: 89 | I119: 37530 | J119: 6
A120: =ROW()-5 -> 116 | B120: F- | C120: 5675 | D120: 1 | E120: 05675-7 | F120: 项目计划、进度与控制(第3版) | G120: 赤向东译 | H120: 49 | I120: 37530 | J120: 6