A1: 序号 | C1: 代 号 | E1: ISBN 7-302- | F1: 书 名 | G1: 著译编者 | H1: 定价(元) | I1: 印年 | J1: 册/包 | K1: 订数
F2: 2002年11月新书订单
F3: 计算机类
A4: =ROW()-4 -> 1 | B4: P- | C4: 4379 | D4: 1 | E4: 7900643796 | F4: Flash MX 精彩设计实例与进阶应用（配光盘） | G4: 李雪琴 | H4: 30.00 | I4: 37561 | J4: 10
A5: =ROW()-4 -> 2 | B5: TP | C5: 5986 | D5: 1 | E5: 05986-1 | F5: 构建XML Web 服务――基于MICROSOFT.NET平台 | G5: 斯考特 | H5: 49.00 | I5: 37561 | J5: 8
A6: =ROW()-4 -> 3 | B6: TP | C6: 5961 | D6: 1 | E6: 05961-6 | F6: 高效掌握 Visual Basic.NET | G6: Billy S.Hollis Rockford Lhotka | H6: 45.00 | I6: 37561 | J6: 8
A7: =ROW()-4 -> 4 | B7: TP | C7: 5900 | D7: 1 | E7: 05900-4 | F7: Windows XP 规划管理 | G7: 林山 | H7: 45.00 | I7: 37561 | J7: 6
A8: =ROW()-4 -> 5 | B8: TP | C8: 5327 | D8: 1 | E8: 06011-8 | F8: GTK+2.0 编程范例 | G8: 宋国伟 | H8: 33.00 | I8: 37561 | J8: 9
A9: =ROW()-4 -> 6 | B9: TP | C9: 5955 | D9: 1 | E9: 05955-1 | F9: 网页制作入门与提高：MX版 | G9: 北京东方人华科技有限公司 | H9: 31.00 | I9: 37561 | J9: 7
A10: =ROW()-4 -> 7 | B10: TP | C10: 5990 | D10: 1 | E10: 05990-X | F10: SolidWorks 原厂教育训练手册（下）（配光盘） | G10: 实威科技 | H10: 49.00 | I10: 37561 | J10: 7
A11: =ROW()-4 -> 8 | B11: TP | C11: 5950 | D11: 1 | E11: 05950-0 | F11: 战胜Photoshop 7.0 快易70讲 | G11: 汪端 | H11: 35.00 | I11: 37561 | J11: 6
A12: =ROW()-4 -> 9 | B12: TP | C12: 5996 | D12: 1 | E12: 05996-9 | F12: UG 18 基础教程 | G12: 张广礼 等 | H12: 59.00 | I12: 37561 | J12: 5
A13: =ROW()-4 -> 10 | B13: TP | C13: 5888 | D13: 1 | E13: 058885 | F13: MRPⅡ/ERP 原理与应用 | G13: 程控等 | H13: 38.00 | I13: 37561 | J13: 8
A14: =ROW()-4 -> 11 | B14: TP | C14: 5977 | D14: 1 | E14: 05977-2 | F14: 计算机工程绘图教程 | G14: 黎立新 等 | H14: 28.00 | I14: 37561 | J14: 9
A15: =ROW()-4 -> 12 | B15: TP | C15: 5824 | D15: 1 | E15: 05824-5 | F15: SQL Server 存储过程、XML和HTML 高级指南 | G15: 康博 译 | H15: 73.00 | I15: 37561 | J15: 9
A16: =ROW()-4 -> 13 | B16: TP | C16: 5975 | D16: 1 | E16: 05975-6 | F16: CATIA V5曲面造型 | G16: 尤春风 | H16: 36.00 | I16: 37561 | J16: 9
A17: =ROW()-4 -> 14 | B17: TP | C17: 5822 | D17: 1 | E17: 05822-9 | F17: XSLT 精要：从XML到HTML | G17: 汉扬天地 | H17: 38.00 | I17: 37561 | J17: 7
A18: =ROW()-4 -> 15 | B18: TP | C18: 5885 | D18: 1 | E18: 05885-7 | F18: 高效掌握C# | G18: Alex Homer Dave Sussman | H18: 45.00 | I18: 37561 | J18: 7
A19: =ROW()-4 -> 16 | B19: TP | C19: 5914 | D19: 1 | E19: 05914-4 | F19: Java消息服务API参考指南――J2EE平台的消息传递 | G19: 康博 译 | H19: 46.00 | I19: 37561 | J19: 8
A20: =ROW()-4 -> 17 | B20: TP | C20: 5836 | D20: 1 | E20: 05836-9 | F20: SQL与PL/SQL程序设计基础 | G20: 冯凤娟 | H20: 26.00 | I20: 37561 | J20: 9
A21: =ROW()-4 -> 18 | B21: TP | C21: 5887 | D21: 1 | E21: 05887-3 | F21: J2EE Web应用高级编程 | G21: 林 琪等译 | H21: 38.00 | I21: 37561 | J21: 10
A22: =ROW()-4 -> 19 | B22: TP | C22: 5978 | D22: 1 | E22: 05978-0 | F22: 计算机组成原理与系统结构解题辅导 | G22: 胡越明 | H22: 26.00 | I22: 37561 | J22: 10
A23: =ROW()-4 -> 20 | B23: TP | C23: 5966 | D23: 1 | E23: 05966-7 | F23: 网络常用工具软件看图速成 | G23: 王苏颖 等编著 | H23: 27.00 | I23: 37561 | J23: 10
A24: =ROW()-4 -> 21 | B24: P- | C24: 4368 | D24: 1 | E24: 7900643680 | F24: 凌波微步 软件开发警戒案例集（配光盘） | G24: 王咏刚 等 | H24: 42.00 | I24: 37561 | J24: 7
A25: =ROW()-4 -> 22 | B25: TP | C25: 5942 | D25: 1 | E25: 05942-X | F25: C#程序设计基础 | G25: 鼎 新等 | H25: 26.00 | I25: 37561 | J25: 7
A26: =ROW()-4 -> 23 | B26: TP | C26: 5730 | D26: 1 | E26: 05730-3 | F26: 应急响应：计算机犯罪调查 | G26: 常晓波译 | H26: 63.00 | I26: 37561 | J26: 5
A27: =ROW()-4 -> 24 | B27: TP | C27: 5899 | D27: 1 | E27: 05899-7 | F27: Flash MX+Dreamweaver MX+Fireworks MX 三合一实例教程 | G27: 吴 光等 | H27: 30.00 | I27: 37561 | J27: 10
A28: =ROW()-4 -> 25 | B28: TP | C28: 5814 | D28: 1 | E28: 05814-8 | F28: 影印 计算机程序设计艺术(1、2、3卷)（精） | G28: DONALD E.KNUTH | H28: 248.00 | I28: 37561 | J28: 1
A29: =ROW()-4 -> 26 | B29: P- | C29: 4335 | D29: 1 | E29: 7900643354 | F29: FrontPage 2002 开发指南(含光盘) | G29: Mike Jennett | H29: 69.00 | I29: 37561 | J29: 5
A30: =ROW()-4 -> 27 | B30: P- | C30: 4375 | D30: 1 | E30: 7900643-75-3 | F30: C++Builder 实用技术与典型案例（配光盘） | G30: 徐科 等 | H30: 35.00 | I30: 37561 | J30: 8
A31: =ROW()-4 -> 28 | B31: TP | C31: 5967 | D31: 1 | E31: 05967-5 | F31: 电脑日常维护看图速成（第2版） | G31: 肖军 杨钢 等 | H31: 29.00 | I31: 2002.11 | J31: 9
A32: =ROW()-4 -> 29 | B32: TP | C32: 5985 | D32: 1 | E32: 05985-3 | F32: 无线通信网络概论 | G32: 禹帆 | H32: 22.00 | I32: 37561 | J32: 11
A33: =ROW()-4 -> 30 | B33: TP | C33: 5916 | D33: 1 | E33: 05916-0 | F33: C++Builder 6 编程基础 | G33: 肖建 等 | H33: 28.00 | I33: 37561 | J33: 10
A34: =ROW()-4 -> 31 | B34: TP | C34: 5916 | D34: 1 | E34: 05965-9 | F34: 电脑常见故障排除看图速成 | G34: 朱竞飞 宁松 等 | H34: 28.00 | I34: 37561 | J34: 10
A35: =ROW()-4 -> 32 | B35: TP | C35: 5939 | D35: 1 | E35: 05939-X | F35: 网格计算 | G35: 都志辉 等 | H35: 19.00 | I35: 37561 | J35: 15
A36: =ROW()-4 -> 33 | B36: F | C36: 5969 | D36: 1 | E36: 05969-1 | F36: 操作系统概论自学考试指导 | G36: 袁薇 | H36: 20.00 | I36: 37561 | J36: 15
A37: =ROW()-4 -> 34 | B37: TP | C37: 5984 | D37: 1 | E37: 05984-5 | F37: 超越零点学电脑 | G37: 王健 丛刚 | H37: 27 | I37: 37561 | J37: 10
A38: =ROW()-4 -> 35 | B38: TB | C38: 5973 | D38: 1 | E38: 05973-X | F38: Factory Physics:Foundations of Manufacturing Management, second edition. 工厂物理学――制造企业管理基础（第2版） | G38: Wallace J.Hopp 等 | H38: 66 | I38: 37561 | J38: 42
A39: =ROW()-4 -> 36 | B39: TP | C39: 5901 | D39: 1 | E39: 05901-2 | F39: 多媒体制作急救手册 | G39: 郭飞宇 刘柳 等 | H39: 50.00 | I39: 37561 | J39: 6
A40: =ROW()-4 -> 37 | B40: TP | C40: 5989 | D40: 1 | E40: 05989-6 | F40: Visual Basic. NET XML Web 服务开发人员指南 | G40: Roger Jennings | H40: 53.00 | I40: 37561 | J40: 8
A41: =ROW()-4 -> 38 | B41: TP | C41: 5059 | D41: 1 | E41: 06059-2 | F41: 局域网组建实用培训教程 | G41: 韩伟峰 王祥仲 | H41: 28.00 | I41: 37561 | J41: 9
A42: =ROW()-4 -> 39 | B42: TP | C42: 5932 | D42: 1 | E42: 05932-2 | F42: 人月神话 | G42: 布鲁克斯 | H42: 29.80 | I42: 37561 | J42: 9
A43: =ROW()-4 -> 40 | B43: P- | C43: 4339 | D43: 1 | E43: 790043397 | F43: C++ Builder 高级应用开发指南（配光盘） | G43: 李幼仪 | H43: 56.00 | I43: 37561 | J43: 5
A44: =ROW()-4 -> 41 | B44: TP | C44: 5913 | D44: 1 | E44: 05913-6 | F44: WPS Offfice 2002 实用培训教程 | G44: 何立军 等 | H44: 33.00 | I44: 37561 | J44: 8
A45: =ROW()-4 -> 42 | B45: P- | C45: 4374 | D45: 1 | E45: 7900643745 | F45: Photoshop 平面广告创意与设计（附光盘） | G45: 刘小伟 | H45: 29.00 | I45: 37561 | J45: 8
A46: =ROW()-4 -> 43 | B46: TP | C46: 6028 | D46: 1 | E46: 06028-2 | F46: 超越零点学五笔字型及输入法 | G46: 单永杰 | H46: 26 | I46: 37561 | J46: 11
A47: =ROW()-4 -> 44 | B47: TP | C47: 5968 | D47: 1 | E47: 05968-3 | F47: Visual C++ 课程设计与系统开发案例 | G47: 伍俊良 | H47: 25.00 | I47: 37561 | J47: 11
A48: =ROW()-4 -> 45 | B48: TP | C48: 6026 | D48: 1 | E48: 06026-6 | F48: 高效掌握ASP.NET――C#编程篇 | G48: Marco Bellinaso 等 | H48: 43.00 | I48: 37561 | J48: 9
A49: =ROW()-4 -> 46 | B49: TP | C49: 5896 | D49: 1 | E49: 05896-2 | F49: 用商业组件构建系统 | G49: 瓦尔诺 等 | H49: 59.00 | I49: 37561 | J49: 6
A50: =ROW()-4 -> 47 | B50: TP | C50: 5861 | D50: 1 | E50: 05861-X | F50: Windows.NET Server 中文版实用组网技术 | G50: 李岩 等 | H50: 34.00 | I50: 37561 | J50: 8
A51: =ROW()-4 -> 48 | B51: P- | C51: 4365 | D51: 1 | E51: 7900643656 | F51: Java 3D 编程实践――网络上的三维动画（配光盘） | G51: 顾雷 等 | H51: 48.00 | I51: 37561 | J51: 9
A52: =ROW()-4 -> 49 | B52: TP | C52: 5999 | D52: 1 | E52: 05999-3 | F52: VB.NET和SQL Server 2000 高级编程――创建高效数据层 | G52: Tony Bain Denise Gosnell 等著 | H52: 59.00 | I52: 37561 | J52: 6
A53: =ROW()-4 -> 50 | B53: TP | C53: 6009 | D53: 1 | E53: 06009-6 | F53: ColdFusion 5 开发指南 | G53: 常晓波等译 | H53: 58.00 | I53: 37561 | J53: 5
A54: =ROW()-4 -> 51 | B54: TP | C54: 6038 | D54: 1 | E54: 06038-X | F54: Visual Basic.Net | G54: Andy Olsen 等 | H54: 43.00 | I54: 37561 | J54: 9
A55: =ROW()-4 -> 52 | B55: TP | C55: 5964 | D55: 1 | E55: 05964-0 | F55: Star Suite 6.0 | G55: Sun Microsystems,Inc. | H55: 38.00 | I55: 37561 | J55: 7
A56: =ROW()-4 -> 53 | B56: TP | C56: 6034 | D56: 1 | E56: 06034-7 | F56: 科学与工程数值算法（Visual C++版） | G56: 周长发 | H56: 38.00 | I56: 37561 | J56: 9
A57: =ROW()-4 -> 54 | B57: TP | C57: 5979 | D57: 1 | E57: 05979-9 | F57: UNIX 网络管理实用教程 | G57: 张伟 等 | H57: 28.00 | I57: 37561 | J57: 9
A58: =ROW()-4 -> 55 | B58: P- | C58: 4381 | D58: 1 | E58: 7900643818 | F58: 战胜Maya 4快易60讲（配光盘） | G58: 刘友全 等 | H58: 34.00 | I58: 37561 | J58: 7
A59: =ROW()-4 -> 56 | B59: TP | C59: 5700 | D59: 1 | E59: 057001 | F59: 离散数学自学辅导 | G59: 邓米克 等 | H59: 31.00 | I59: 37561 | J59: 9
A60: =ROW()-4 -> 57 | B60: TP | C60: 6021 | D60: 1 | E60: 06021-5 | F60: CERT 安全指南 | G60: Julia H.Allen | H60: 49.00 | I60: 37561 | J60: 6
A61: =ROW()-4 -> 58 | B61: TP | C61: 6030 | D61: 1 | E61: 06030-4 | F61: Flash MX 编程轻松上手 | G61: 向元杰 | H61: 32.00 | I61: 37561 | J61: 9
A62: =ROW()-4 -> 59 | B62: P- | C62: 4376 | D62: 1 | E62: 7900643761 | F62: Visual Basic.NET 高级编程（配光盘） | G62: 刘安新 等 | H62: 55.00 | I62: 37561 | J62: 6
A63: =ROW()-4 -> 60 | B63: TP | C63: 6020 | D63: 1 | E63: 06020-7 | F63: 软件构架评估 | G63: Paul Clements 等 | H63: 39.00 | I63: 37561 | J63: 8
A64: =ROW()-4 -> 61 | B64: P- | C64: 4377 | D64: 1 | E64: 7900643-77-X | F64: Visual C++.NET 高级编程（配光盘） | G64: 齐舒创作室 | H64: 55.00 | I64: 37561 | J64: 6
A65: =ROW()-4 -> 62 | B65: TP | C65: 6029 | D65: 1 | E65: 06023-0 | F65: 动态电子商务的Web 服务 | G65: 李劲 | H65: 26.00 | I65: 37561 | J65: 12
A66: =ROW()-4 -> 63 | B66: TP | C66: 5898 | D66: 1 | E66: 05898-9 | F66: 中学信息技术教学论 | G66: 薛维明 | H66: 22.00 | I66: 37561 | J66: 12
A67: =ROW()-4 -> 64 | B67: TP | C67: 5957 | D67: 1 | E67: 05957-8 | F67: 信息网络安全 | G67: 张红旗 | H67: 24.00 | I67: 37561 | J67: 12
A68: =ROW()-4 -> 65 | B68: TP | C68: 5943 | D68: 1 | E68: 05943-8 | F68: VB.NET 字符串和正则表达式参考手册 | G68: Francois Liger 等 | H68: 30.00 | I68: 37561 | J68: 12
A69: =ROW()-4 -> 66 | B69: TP | C69: 5807 | D69: 1 | E69: 05807-5 | F69: 无线网络通信原理与应用 | G69: 刘 剑等译 | H69: 56.00 | I69: 37561 | J69: 7
A70: =ROW()-4 -> 67 | B70: P- | C70: 4386 | D70: 1 | E70: 7900643869 | F70: AutoCAD Mechanical 6 培训教程（配光盘） | G70: 卢章平等译 | H70: 58.00 | I70: 37561 | J70: 5
A71: =ROW()-4 -> 68 | B71: TP | C71: 5988 | D71: 1 | E71: 05988-8 | F71: Oracle编程入门经典--覆盖至Oracle 9i版本 | G71: 袁勤勇等译 | H71: 128.00 | I71: 37561 | J71: 3
A72: =ROW()-4 -> 69 | B72: TP | C72: 6070 | D72: 1 | E72: 06070-3 | F72: 超越零点学平面设计 | G72: 幸莉仙 | H72: 25 | I72: 37561 | J72: 11
A73: =ROW()-4 -> 70 | B73: TP | C73: 5994 | D73: 1 | E73: 05994-2 | F73: 模式识别――原理、方法及应用 | G73: 吴逸飞译 | H73: 45.00 | I73: 37561 | J73: 8
F75: 工程与基础学科类
A76: =ROW()-4 -> 73 | B76: TN | C76: 5840 | D76: 1 | E76: 05840-7 | F76: 定点DSP的原理、开发与应用 | G76: 徐科军等 | H76: 10.00 | I76: 37561 | J76: 10
A77: =ROW()-4 -> 74 | B77: TP | C77: 5501 | D77: 1 | E77: 05501-7 | F77: 线性系统理论 （第2版） | G77: 郑大钟 | H77: 46.00 | I77: 37561 | J77: 4
A78: =ROW()-4 -> 75 | B78: X- | C78: 5857 | D78: 1 | E78: 05857-1 | F78: Wastewater Engineering: Treatment and Reuse, 4th Ed. (废水工程：处理与回用 第4版 I-II-III) | G78: Metcalf & Eddy, Inc | H78: 169.00 全三册 | I78: 37530 | J78: 1
A79: =ROW()-4 -> 76 | B79: TN | C79: 6003 | D79: 1 | E79: 06003-7 | F79: 现代信号处理 （第二版） | G79: 张贤达 | H79: 38.00 | I79: 37561 | J79: 6
A80: =ROW()-5 -> 76 | B80: TP | C80: 6010 | D80: 1 | E80: 06010-X | F80: 科学与工程数值算法（Visual Basic 版） | G80: 周长发 | H80: 32.00 | I80: 37561 | J80: 9
A81: =ROW()-4 -> 78 | B81: TU | C81: 5993 | D81: 1 | E81: 05993-4 | F81: 京津冀地区城乡空间发展规划研究 | G81: 吴良镛 等 | H81: 260.00 | I81: 37561
A82: =ROW()-4 -> 79 | B82: TU | C82: 6090 | D82: 1 | E82: 06090-8 | F82: 2002 WA 中国建筑奖 | G82: 世界建筑杂志社 | H82: 68.00 | I82: 37561 | J82: 10
A83: =ROW()-4 -> 80 | B83: TU | C83: 5773 | D83: 1 | E83: 05773-7 | F83: 建筑工程施工测量（第2版） | G83: 唐 敏等 | H83: 10.00 | I83: 37561 | J83: 30
A84: =ROW()-4 -> 81 | B84: Q- | C84: 5711 | D84: 1 | E84: 05711-7 | F84: 糖生物学与糖生物工程 | G84: 张树政 | H84: 15.60 | I84: 37561 | J84: 27
A85: =ROW()-4 -> 82 | B85: O- | C85: 5852 | D85: 1 | E85: 05852-0 | F85: 工程力学公式与习题（第2册）弹性静力学和流体静力学 | G85: 姚振汉等 | H85: 15.00 | I85: 37561 | J85: 25
F87: 大文科
A88: =ROW()-5 -> 84 | B88: D- | C88: 5909 | D88: 1 | E88: 05909-8 | F88: 法典编篡论――一个比较法的视角 | G88: 封丽霞 | H88: 35 | I88: 37561 | J88: 11
A89: =ROW()-5 -> 85 | B89: D- | C89: 5907 | D89: 1 | E89: 05907-1 | F89: 比较法律文化 | G89: H.W.埃尔曼 | H89: 28 | I89: 37561 | J89: 15
A90: =ROW()-5 -> 86 | B90: D- | C90: 5908 | D90: 1 | E90: 05908-X | F90: 英国法与法国法：一种实质性比较 | G90: 勒内・达维 | H90: 22 | I90: 37561 | J90: 17
A91: =ROW()-5 -> 87 | B91: D- | C91: 5906 | D91: 1 | E91: 05906-3 | F91: 比较法的力量与弱点 | G91: 伯恩哈德・格罗斯菲尔德 | H91: 26 | I91: 37561 | J91: 20
A92: =ROW()-5 -> 88 | B92: H- | C92: 5131 | D92: 1 | E92: 05131-3 | F92: 有声记忆 ―― 最新大学英语四级词汇活用 词典（配音带4盘 配CD-ROM光盘1张） | G92: 胡宛如 | H92: 56 | I92: 37561 | J92: 15
A93: =ROW()-5 -> 89 | B93: F- | C93: 5765 | D93: 1 | E93: 05765-6 | F93: 21世纪的决策支持系统 | G93: 朱岩 | H93: 43 | I93: 37561 | J93: 7
A94: =ROW()-5 -> 90 | B94: H- | C94: 1082 | D94: 1 | E94: 7810820818 | F94: 商务英语综合教程（第1册） | G94: 杨翠萍 | H94: 38.5 | I94: 37561 | J94: 6
A95: =ROW()-5 -> 91 | B95: G- | C95: 6031 | D95: 1 | E95: 06031-2 | F95: 大学心理咨询与教育指导丛书：大学生心理健康教育研究 | G95: 攀富珉 | H95: 22 | I95: 37561 | J95: 12
A96: =ROW()-5 -> 92 | B96: G- | C96: 5295 | D96: 1 | E96: 05295-6 | F96: 消失的地域：电子媒介对社会行为的影响 | G96: 约书亚・梅罗维茨 | H96: 35 | I96: 37561 | J96: 7
A97: =ROW()-5 -> 93 | B97: D- | C97: 6065 | D97: 1 | E97: 06065-7 | F97: 法治的层次 | G97: 吴玉章 | H97: 26 | I97: 37561 | J97: 12
A98: =ROW()-5 -> 94 | B98: F- | C98: 5787 | D98: 1 | E98: 05787-7 | F98: 精神价值与中国经济转型 | G98: 董书通 | H98: 23 | I98: 37561 | J98: 13
A99: =ROW()-5 -> 95 | B99: H- | C99: 5655 | D99: 1 | E99: 05655-2 | F99: 中华翻译文摘 | G99: 罗选民 | H99: 16 | I99: 37561 | J99: 20
A100: =ROW()-5 -> 96 | B100: H- | C100: 4600 | D100: 1 | E100: 04600-X | F100: 英语常见问题解答大词典（普及本）(精) | G100: 赵振才 | H100: 58 | I100: 37561 | J100: 5
A101: =ROW()-5 -> 97 | B101: H- | C101: 5905 | D101: 1 | E101: 05905-5 | F101: 中国学生汉语色彩语码认知模式研究 | G101: 杨永林 | H101: 23 | I101: 37257 | J101: 14
A102: =ROW()-5 -> 98 | B102: G- | C102: 5668 | D102: 1 | E102: 05668-4 | F102: 新编初中英语语法学与用 | G102: 袁谷英 等 | H102: 16 | I102: 37561 | J102: 15
A103: =ROW()-5 -> 99 | B103: G- | C103: 5949 | D103: 1 | E103: 05949-7 | F103: 初为记者 | G103: 孙静惟 | H103: 17.00 | I103: 37561 | J103: 16