F1: 2002年12月新书订单
A2: =ROW()-2 -> 0 | B2: TP | C2: 5941 | D2: 1 | E2: 05941-1 | F2: 计算机支持的协同工作导论 | G2: 顾君忠 | H2: 25 | I2: 37591 | J2: 12
A3: =ROW()-2 -> 1 | B3: TP | C3: 5877 | D3: 1 | E3: 05877-6 | F3: 信息战：如何战胜计算机攻击 | G3: 常晓波等译 | H3: 29.00 | I3: 37591 | J3: 10
A4: =ROW()-2 -> 2 | B4: TP | C4: 6062 | D4: 1 | E4: 06062-2 | F4: 超越零点学上网 | G4: 杨光伟等 | H4: 24 | I4: 37591 | J4: 12
A5: =ROW()-5 -> 0 | B5: H- | C5: 5980 | D5: 1 | E5: 05980-2 | F5: 文学语篇的语用文体学研究 | G5: 封宗信 | H5: 33 | I5: 37591 | J5: 10
A6: =ROW()-2 -> 4 | B6: P- | C6: 4380 | D6: 1 | E6: 790064380X | F6: 等级考试（二级） Visual FoxPro 教程----分析、辅导与详解（配光盘） | G6: 郝 方 | H6: 36.00 | I6: 37591 | J6: 9
A7: =ROW()-2 -> 5 | B7: TP | C7: 5992 | D7: 1 | E7: 05992-6 | F7: Windows 注册表修改急救手册 | G7: 王 龙 | H7: 27.00 | I7: 37561 | J7: 10
A8: =ROW()-5 -> 3 | B8: G- | C8: 5921 | D8: 1 | E8: 05921-7 | F8: 研究生英语实用写作教程 | G8: 杨 芳 | H8: 16 | I8: 37561 | J8: 20
A9: =ROW()-2 -> 7 | B9: P- | C9: 4372 | D9: 1 | E9: 7900643729 | F9: PIC单片机宏汇编与集成开发环境（配光盘） | G9: 微芯科技股份有限公司 | H9: 38.00 | I9: 37561 | J9: 7
A10: =ROW()-4 -> 6 | B10: O- | C10: 5632 | D10: 1 | E10: 05632-3 | F10: 有机合成化学与路线设计 | G10: 赵国辉 | H10: 24.00 | I10: 37591 | J10: 12
A11: =ROW()-2 -> 9 | B11: TP | C11: 6007 | D11: 1 | E11: 06007-X | F11: C++面向对象程序设计――使用STL编程 | G11: 袁勤勇等译 | H11: 46.00 | I11: 37591 | J11: 8
A12: =ROW()-2 -> 10 | B12: TP | C12: 1082 | D12: J | E12: 7810820923 | F12: 计算机局域网实用技术 | G12: 蔡翠平主编 | H12: 20.00 | I12: 37591 | J12: 12
A13: =ROW()-2 -> 11 | B13: TP | C13: 1082 | D13: K | E13: 781082094X | F13: 单片机原理及接口技术实验 | G13: 朱定华 | H13: 18.00 | I13: 37591 | J13: 14
A14: =ROW()-2 -> 12 | B14: TP | C14: 6036 | D14: 1 | E14: 06036-3 | F14: Visual Studio.NET高效编程 | G14: 陈安全等译 | H14: 58.00 | I14: 37591 | J14: 6
A15: =ROW()-2 -> 13 | B15: TP | C15: 5923 | D15: 1 | E15: 05923-3 | F15: XML 网页制作实作教程 | G15: 夏帮贵等 | H15: 33.00 | I15: 37561 | J15: 8
A16: =ROW()-5 -> 11 | B16: H- | C16: 1082 | D16: 2 | E16: 7810820826 | F16: 商务英语听说教程（第1册） | G16: 杨翠萍 | H16: 16 | I16: 37591 | J16: 15
A17: =ROW()-2 -> 15 | B17: TP | C17: 6080 | D17: 1 | E17: 06080-0 | F17: 计算机基础五笔字型与专业排版实用培训教程 | G17: 袁建华等 | H17: 25.00 | I17: 37591 | J17: 11
A18: =ROW()-2 -> 16 | B18: TP | C18: 5962 | D18: 1 | E18: 05962-4 | F18: ASP动态网页设计与上机指导 | G18: 冯 昊 | H18: 23.00 | I18: 37591 | J18: 10
A19: =ROW()-2 -> 17 | B19: TP | C19: 6061 | D19: 1 | E19: 06061-4 | F19: Web服务深入编程 | G19: 孙永强 | H19: 38.00 | I19: 37591 | J19: 8
A20: =ROW()-2 -> 18 | B20: TP | C20: 5783 | D20: 1 | E20: 05783-4 | F20: C#开发快速入门 | G20: 天宏工作室 | H20: 23.00 | I20: 37591 | J20: 12
A21: =ROW()-5 -> 16 | B21: B- | C21: 5676 | D21: 1 | E21: 05676-5 | F21: 20世纪墨学研究史 | G21: 郑杰文等 | H21: 29 | I21: 37591 | J21: 9
A22: =ROW()-2 -> 20 | B22: TP | C22: 6045 | D22: 1 | E22: 06045-2 | F22: Visual C++.NET 数据库开发指南 | G22: 吕丹阳 | H22: 42.00 | I22: 37591 | J22: 7
A23: =ROW()-2 -> 21 | B23: P- | C23: 4384 | D23: 1 | E23: 7900643842 | F23: 精通Microsoft Access 2002中文版（配光盘） | G23: 张 波等译 | H23: 98.00 | I23: 37591 | J23: 4
A24: =ROW()-4 -> 20 | B24: X- | C24: 5799 | D24: 1 | E24: 05799-0 | F24: 可持续能源的前景 | G24: 段 雷等译 | H24: 20.00 | I24: 37591 | J24: 15
A25: =ROW()-2 -> 23 | B25: TP | C25: 5895 | D25: 1 | E25: 05895-4 | F25: 数据库系统原理――Internet和Java应用指南 | G25: 管永川等译 | H25: 55.00 | I25: 37591 | J25: 7
A26: =ROW()-2 -> 24 | B26: TP | C26: 6027 | D26: 1 | E26: 06027-4 | F26: PHP 4 开发指南 | G26: 天宏工作室译 | H26: 58.00 | I26: 37591 | J26: 6
A27: =ROW()-2 -> 25 | B27: TP | C27: 5991 | D27: 1 | E27: 05991-8 | F27: Active Directory 服务实用教程 | G27: 天宏工作室译 | H27: 29.00 | I27: 37591 | J27: 11
A28: =ROW()-4 -> 24 | B28: O- | C28: 5958 | D28: 1 | E28: 05958-6 | F28: 应用随机过程 | G28: 林元烈 | H28: 28.00 | I28: 37591 | J28: 8
A29: =ROW()-2 -> 27 | B29: TP | C29: 6060 | D29: 1 | E29: 06060-6 | F29: ASP.NET 1.0入门经典――C#编程篇 | G29: 杨 浩译 | H29: 85.00 | I29: 37591 | J29: 5
A30: =ROW()-2 -> 28 | B30: TP | C30: 5963 | D30: 1 | E30: 05963-2 | F30: 网页设计制作与上机指导 | G30: 韩瑞雨 | H30: 36.00 | I30: 37591 | J30: 6
A31: =ROW()-2 -> 29 | B31: TP | C31: 6129 | D31: 1 | E31: 06129-7 | F31: 网络布线实用大全 | G31: 姚德启等译 | H31: 59.00 | I31: 37591 | J31: 6
A32: =ROW()-2 -> 30 | B32: TP | C32: 6025 | D32: 1 | E32: 06025-8 | F32: C程序设计考研指导 | G32: 李春葆 | H32: 59.00 | I32: 37591 | J32: 6
A33: =ROW()-2 -> 31 | B33: TP | C33: 6081 | D33: 1 | E33: 06081-9 | F33: JSP程序设计指南 | G33: 天宏工作室译 | H33: 24.00 | I33: 37591 | J33: 12
A34: =ROW()-2 -> 32 | B34: TP | C34: 5995 | D34: 1 | E34: 05995-0 | F34: 新编UNIX系统管理实用教程 | G34: 孟庆昌等 | H34: 34.00 | I34: 37591 | J34: 7
A35: =ROW()-2 -> 33 | B35: TP | C35: 5954 | D35: 1 | E35: 05954-3 | F35: 网络管理实用技术 | G35: 张国鸣等 | H35: 29 | I35: 37591 | J35: 10
A36: =ROW()-3 -> 33 | B36: CD | C36: 0200 | D36: 1 | E36: 7880142002 | F36: 语文（北京卷）（2音带+手册） | G36: 张 莉 | H36: 15 | I36: 37591 | J36: 10
A37: =ROW()-3 -> 34 | B37: CD | C37: 0199 | D37: 1 | E37: 7880141995 | F37: 语文（全国卷）（2音带+手册） | G37: 张 莉 | H37: 15 | I37: 37592 | J37: 10
A38: =ROW()-3 -> 35 | B38: CD | C38: 0195 | D38: 1 | E38: 7880141952 | F38: 数学（北京卷 理工类）（2音带+手册） | G38: 赵治中 | H38: 15 | I38: 37597 | J38: 10
A39: =ROW()-3 -> 36 | B39: CD | C39: 0196 | D39: 1 | E39: 7880141960 | F39: 数学（全国卷 理工类）（2音带+手册） | G39: 赵治中 | H39: 15 | I39: 37598 | J39: 10
A40: =ROW()-3 -> 37 | B40: CD | C40: 0198 | D40: 1 | E40: 7880141987 | F40: 文科综合能力测试（2音带+手册） | G40: 葛本红等 | H40: 15 | I40: 37600 | J40: 10
A41: =ROW()-5 -> 36 | B41: F- | C41: 6130 | D41: 1 | E41: 06130-0 | F41: 影响决策的国情报告 | G41: 胡鞍钢 | H41: 36 | I41: 37591 | J41: 6
A42: =ROW()-5 -> 37 | B42: D- | C42: 1061 | D42: 1 | E42: 01061-7 | F42: 马克思主义法理学 | G42: 张光博 | H42: 20 | I42: 37591 | J42: 13
A43: =ROW()-2 -> 41 | B43: TP | C43: 5856 | D43: 1 | E43: 05856-3 | F43: 神经网络理论 | G43: 阎平凡译 | H43: 28.00 | I43: 37591 | J43: 9
A44: =ROW()-2 -> 42 | B44: TP | C44: 5855 | D44: 1 | E44: 05855-5 | F44: 电子商务案例 | G44: 杨坚争等 | H44: 25.00 | I44: 37591 | J44: 10
A45: =ROW()-2 -> 43 | B45: TP | C45: 5329 | D45: 1 | E45: 05329-4 | F45: Visual C++.NET网络编程与互联网应用开发 | G45: 文娟等 | H45: 36.00 | I45: 37591 | J45: 7
A46: =ROW()-2 -> 44 | B46: TP | C46: 6000 | D46: 1 | E46: 06000-2 | F46: C语言程序设计 | G46: 刘振安 | H46: 24.00 | I46: 37591 | J46: 10
A47: =ROW()-2 -> 45 | B47: TP | C47: 6057 | D47: 1 | E47: 06057-6 | F47: The ASIC Handbook（ASIC完备指南） | G47: Horspool, Gorman | H47: 32.00 | I47: 37591 | J47: 8
A48: =ROW()-2 -> 46 | B48: TP | C48: 5929 | D48: 1 | E48: 05929-2 | F48: 英汉对照计算机技术教程 | G48: 易 水 | H48: 33.00 | I48: 37591 | J48: 8
A49: =ROW()-5 -> 44 | B49: F- | C49: 5832 | D49: 1 | E49: 05832-6 | F49: 项目管理手册――改进过程、实现战略目标(第2版) | G49: 任伟等译 | H49: 49.8 | I49: 37591 | J49: 5