A1: 序号 | C1: 代 号 | E1: ISBN 7-302- | F1: 名 称 | G1: 著译编者 | H1: 定价(元) | I1: 印年 | J1: 册/包 | K1: 订数
F2: 一、工 具 书
A3: =ROW()-2 -> 1 | B3: TP | C3: 2970 | D3: 2 | E3: 02970-9 | F3: 计算机科学技术百科全书 | G3: 张效祥等 | H3: 180.00 | I3: 36069 | J3: 2
A4: =ROW()-2 -> 2 | B4: TP | C4: 4789 | D4: 1 | E4: 04789-8 | F4: 计算机科学技术百科全书（选编本） | G4: 张效祥等 | H4: 30.00 | I4: 37257 | J4: 7
A5: =ROW()-2 -> 3 | B5: Z- | C5: 2382 | D5: 2 | E5: 02382-4 | F5: 朗文―清华英汉双解科技大辞典 | G5: 编委会 | H5: 148.00 | I5: 36069 | J5: 1
A6: =ROW()-2 -> 4 | B6: TP | C6: 1465 | D6: 7 | E6: 01465-5 | F6: 英汉双解计算机辞典 (精) | G6: 编委会 | H6: 49.00 | I6: 37257 | J6: 5
A7: =ROW()-2 -> 5 | B7: TP | C7: 2399 | D7: 6 | E7: 02399-9 | F7: 英汉计算机词汇(精) (第2版) | G7: 中国计算机学会编 | H7: 48.00 | I7: 36465 | J7: 5
A8: =ROW()-2 -> 6 | B8: TP | C8: 3516 | D8: 2 | E8: 03516-4 | F8: 最新英汉计算机词汇 (第2版) | G8: 章鸿猷 | H8: 28.00 | I8: 37316 | J8: 8
A9: =ROW()-2 -> 7 | B9: TP | C9: 3347 | D9: 2 | E9: 03347-1 | F9: 新英汉计算机词典 (第2版) | G9: 编委会 | H9: 39.00 | I9: 36495 | J9: 6
A10: =ROW()-2 -> 8 | B10: TP | C10: 4560 | D10: 1 | E10: 04560-7 | F10: 简明英汉信息技术词汇 | G10: 章鸿猷 | H10: 19.00 | I10: 37257 | J10: 16
A11: =ROW()-2 -> 9 | B11: TP | C11: 1939 | D11: 3 | E11: 01939-8 | F11: 微机操作与应用常见英文信息解释 | G11: 王路敬 | H11: 21.00 | I11: 1998 | J11: 12
A12: =ROW()-2 -> 10 | B12: TP | C12: 2929 | D12: 1 | E12: 02929-6 | F12: 英文计算机术语译名研究 | G12: 章鸿猷 | H12: 9.80 | I12: 1998 | J12: 20
A13: =ROW()-2 -> 11 | B13: F- | C13: 0704 | D13: 3 | E13: 00704-7 | F13: 英汉汉英双解会计辞典 | G13: 韩 颖 | H13: 29.80 | I13: 36069 | J13: 6
A14: =ROW()-2 -> 12 | B14: H- | C14: 3014 | D14: 1 | E14: 03014-6 | F14: 国际商务英语用法词典 | G14: 徐 健 | H14: 32.80 | I14: 36739 | J14: 6
A15: =ROW()-2 -> 13 | B15: TP | C15: 3226 | D15: 1 | E15: 03226-2 | F15: 英汉双解微软计算机辞典 （第3版） | G15: 章鸿猷等译 | H15: 100.00 | I15: 36708 | J15: 3
A16: =ROW()-2 -> 14 | B16: TP | C16: 3047 | D16: 1 | E16: 03047-2 | F16: 英汉双解信息技术辞典（1）基本术语 | G16: 章鸿猷 | H16: 4.80 | I16: 1998 | J16: 50
A17: =ROW()-2 -> 15 | B17: H- | C17: 3105 | D17: 1 | E17: 03105-3 | F17: 英汉双解美国20世纪流行文化词典 | H17: 24.00 | I17: 1998 | J17: 12
A18: =ROW()-2 -> 16 | B18: TP | C18: 3199 | D18: 1 | E18: 03199-1 | F18: 英汉信息技术标准词汇 | G18: 章天懿 | H18: 15.00 | I18: 1999 | J18: 15
A19: =ROW()-2 -> 17 | B19: TP | C19: 3159 | D19: 2 | E19: 03159-2 | F19: 英汉多媒体技术词典(精） | G19: 林福宗 | H19: 30.00 | I19: 36495 | J19: 8
A20: =ROW()-2 -> 18 | B20: N- | C20: 4048 | D20: 1 | E20: 04048-6 | F20: 高技术辞典（精） | G20: 王大珩等 | H20: 120.00 | I20: 36831 | J20: 3
A21: =ROW()-2 -> 19 | B21: TP | C21: 4110 | D21: 1 | E21: 04110-5 | F21: 英汉网络技术词汇 | G21: 章鸿猷 | H21: 56.00 | I21: 37469 | J21: 6
A22: =ROW()-2 -> 20 | B22: TP | C22: 2545 | D22: 1 | E22: 02545-2 | F22: 计算机机房工作实用大全（精） | G22: 上海教委会 | H22: 128 | I22: 1998 | J22: 2
F23: 二、计算机类图书
F24: 1.大中专教材
F25: 计算机基础教育丛书
A26: =ROW()-2 -> 24 | B26: TP | C26: 0860 | D26: 3 | E26: 00860-4 | F26: C程序设计(第1版） | G26: 谭浩强 | H26: 22.00 | I26: 37321 | J26: 9
A27: =ROW()-2 -> 25 | B27: TP | C27: 1034 | D27: S | E27: 01034-X | F27: C程序设计题解与上机指导 | G27: 谭浩强 | H27: 14.80 | I27: 37330 | J27: 13
A28: =ROW()-2 -> 26 | B28: TP | C28: 2621 | D28: 6 | E28: 02621-1 | F28: C程序设计实验指导 | G28: 徐士良 | H28: 9.00 | I28: 36951 | J28: 20
A29: =ROW()-2 -> 27 | B29: TP | C29: 2890 | D29: 8 | E29: 02890-7 | F29: C程序设计试题汇编 | G29: 谭浩强等 | H29: 26.00 | I29: 37406 | J29: 8
A30: =ROW()-2 -> 28 | B30: TP | C30: 2466 | D30: 7 | E30: 02466-9 | F30: True Basic程序设计（第3版） | G30: 谭浩强等 | H30: 21.00 | I30: 36861 | J30: 10
A31: =ROW()-2 -> 29 | B31: TP | C31: 0623 | D31: K | E31: 00623-7 | F31: FORTRAN 语言――FORTRAN77结构化程序设计 | G31: 谭浩强 | H31: 22.00 | I31: 37257 | J31: 9
A32: =ROW()-2 -> 30 | B32: TP | C32: 3080 | D32: 2 | E32: 03080-4 | F32: FORTRAN77程序设计试题汇编 | G32: 鲍有文等 | H32: 12.80 | I32: 36586 | J32: 15
A33: =ROW()-2 -> 31 | B33: TP | C33: 0996 | D33: E | E33: 00996-1 | F33: FORTRAN77结构化程序设计题解 | G33: 谭浩强 | H33: 11.00 | I33: 37257 | J33: 20
A34: =ROW()-2 -> 32 | B34: TP | C34: 1422 | D34: N | E34: 01422-1 | F34: FoxBASE+及其应用系统开发 | G34: 史济民等 | H34: 21.00 | I34: 37356 | J34: 9
A35: =ROW()-2 -> 33 | B35: TP | C35: 2842 | D35: 5 | E35: 02842-7 | F35: FoxBASE+及其应用系统开发题解 | G35: 史济民 | H35: 10.00 | I35: 36951 | J35: 20
A36: =ROW()-2 -> 34 | B36: TP | C36: 1958 | D36: 5 | E36: 01958-4 | F36: 计算机常用算法(第2版) | G36: 徐士良 | H36: 25.00 | I36: 35004 | J36: 8
A37: =ROW()-2 -> 35 | B37: TP | C37: 1802 | D37: A | E37: 01802-2 | F37: 微型计算机原理及应用(第2版) | G37: 郑学坚等 | H37: 32.00 | I37: 36892 | J37: 6
A38: =ROW()-2 -> 36 | B38: TP | C38: 1967 | D38: 7 | E38: 01967-3 | F38: 微型计算机原理及应用实验指导（第1版） | G38: 郑学坚等 | H38: 18.00 | I38: 36800 | J38: 11
A39: =ROW()-2 -> 37 | B39: TP | C39: 1961 | D39: 9 | E39: 01961-4 | F39: 清华大学非计算机专业微机原理教材 ――微型计算机系统原理与应用 | G39: 杨素行等 | H39: 27.00 | I39: 37469 | J39: 8
A40: =ROW()-2 -> 38 | B40: TP | C40: 3917 | D40: 1 | E40: 03917-8 | F40: 计算机辅助设计技术基础（第2版） | G40: 孙家广 | H40: 29.50 | I40: 37377 | J40: 7
A41: =ROW()-2 -> 39 | B41: TP | C41: 1866 | D41: 8 | E41: 01866-9 | F41: 微机系统应用基础 | G41: 李大友 | H41: 18.00 | I41: 36526 | J41: 11
A42: =ROW()-2 -> 40 | B42: TP | C42: 1200 | D42: G | E42: 01200-8 | F42: 计算机软件技术基础(第2版) | G42: 李芳芸等 | H42: 16.00 | I42: 36739 | J42: 12
A43: =ROW()-2 -> 41 | B43: TP | C43: 3941 | D43: 1 | E43: 03941-0 | F43: 计算机软件技术基础(第3版) | G43: 沈被娜等 | H43: 21.00 | I43: 37316 | J43: 10
A44: =ROW()-2 -> 42 | B44: TP | C44: 3140 | D44: 2 | E44: 03140-1 | F44: 计算机公共基础（第1版） | G44: 徐士良 | H44: 26.00 | I44: 36708 | J44: 8
A45: =ROW()-2 -> 43 | B45: TP | C45: 3603 | D45: 2 | E45: 03603-9 | F45: 计算机辅助绘图基础 | G45: 陆润民 | H45: 11.00 | I45: 36708 | J45: 18
A46: =ROW()-2 -> 44 | B46: TP | C46: 4032 | D46: 1 | E46: 04032-X | F46: 计算机辅助绘图基础 (2000版） | G46: 陆润民 | H46: 15.00 | I46: 37257 | J46: 16
F47: 新世纪计算机基础教育丛书（谭浩强主编）
A48: =ROW()-2 -> 46 | B48: TP | C48: 3806 | D48: 3 | E48: 03806-6 | F48: C程序设计 （第2版） | G48: 谭浩强 | H48: 26.00 | I48: 37438 | J48: 8
A49: =ROW()-2 -> 47 | B49: TP | C49: 3911 | D49: 2 | E49: 03911-9 | F49: C程序设计题解与上机指导（第2版） | G49: 谭浩强 | H49: 19.50 | I49: 37438 | J49: 11
A50: =ROW()-2 -> 48 | B50: TP | C50: 2883 | D50: 9 | E50: 02883-4 | F50: FoxPro 及其应用系统开发 | G50: 史济民 | H50: 23.00 | I50: 37469 | J50: 9
A51: =ROW()-2 -> 49 | B51: TP | C51: 4053 | D51: 1 | E51: 04053-2 | F51: FoxPro 及其应用系统开发题解 | G51: 史济民等 | H51: 12.00 | I51: 37316 | J51: 20
A52: =ROW()-2 -> 50 | B52: TP | C52: 3778 | D52: 2 | E52: 03778-7 | F52: Visual FoxPro 及其应用系统开发 | G52: 史济民等 | H52: 25.00 | I52: 37469 | J52: 8
A53: =ROW()-2 -> 51 | B53: TP | C53: 4311 | D53: 1 | E53: 04311-6 | F53: Visual FoxPro 及其应用系统开发题解 | G53: 史济民等 | H53: 12.00 | I53: 37340 | J53: 20
A54: =ROW()-2 -> 52 | B54: TP | C54: 3674 | D54: 2 | E54: 03674-8 | F54: FORTRAN77程序设计上机指导（第2版） | G54: 朱明方等 | H54: 12.00 | I54: 37333 | J54: 15
A55: =ROW()-2 -> 53 | B55: TP | C55: 3784 | D55: 1 | E55: 03784-1 | F55: 计算机公共基础（第2版） | G55: 徐士良 | H55: 21.50 | I55: 37135 | J55: 11
A56: =ROW()-2 -> 54 | B56: TP | C56: 4259 | D56: 1 | E56: 04259-4 | F56: 计算机公共基础 （Windows 98 环境 ） | G56: 徐士良 | H56: 22.00 | I56: 37469 | J56: 11
A57: =ROW()-2 -> 55 | B57: TP | C57: 4755 | D57: 1 | E57: 04755-3 | F57: 计算机公共基础 习题与实验指导（Windows 98 环境 ） | G57: 高成强 | H57: 9.00 | I57: 37469 | J57: 28
A58: =ROW()-2 -> 56 | B58: TP | C58: 4644 | D58: 1 | E58: 04644-1 | F58: 计算机图形技术与 CAD | G58: 何 薇 | H58: 21.00 | I58: 37322 | J58: 10
A59: =ROW()-2 -> 57 | B59: TP | C59: 2152 | D59: 2 | E59: 02152-X | F59: 实用数据结构 | G59: 徐士良 | H59: 16.00 | I59: 37469 | J59: 15
A60: =ROW()-2 -> 58 | B60: TP | C60: 4064 | D60: 1 | E60: 04064-8 | F60: 实用数据结构题解 | G60: 徐士良 | H60: 11.00 | I60: 37043 | J60: 22
A61: =ROW()-2 -> 59 | B61: TP | C61: 2206 | D61: 3 | E61: 02206-2 | F61: Internet 基础 | G61: 吴功宜等 | H61: 18.00 | I61: 37327 | J61: 14
A62: =ROW()-2 -> 60 | B62: TP | C62: 4020 | D62: 1 | E62: 04020-6 | F62: 计算机网络与多媒体应用基础 | G62: 黄云森 | H62: 19.00 | I62: 37135 | J62: 12
A63: =ROW()-2 -> 61 | B63: TP | C63: 3695 | D63: 2 | E63: 03695-0 | F63: QBASIC程序设计 | G63: 谭浩强等 | H63: 23.50 | I63: 37469 | J63: 10
A64: =ROW()-2 -> 62 | B64: TP | C64: 3910 | D64: 1 | E64: 03910-0 | F64: QBASIC程序设计题解与上机指导 | G64: 谭浩强等 | H64: 14.00 | I64: 37469 | J64: 15
A65: =ROW()-2 -> 63 | B65: TP | C65: 4177 | D65: 1 | E65: 04177-6 | F65: Delphi 程序设计 | G65: 周果宏等 | H65: 29.00 | I65: 37347 | J65: 8
A66: =ROW()-2 -> 64 | B66: TP | C66: 1121 | D66: 1 | E66: 01121-4 | F66: Visual Basic 程序设计教程 | G66: 刘炳文 | H66: 33.60 | I66: 37469 | J66: 7
A67: =ROW()-2 -> 65 | B67: TP | C67: 4097 | D67: 1 | E67: 04097-4 | F67: Visual Basic 程序设计教程题解与上机指导 | G67: 刘炳文 | H67: 23.00 | I67: 37438 | J67: 10
A68: =ROW()-2 -> 66 | B68: TP | C68: 4549 | D68: 1 | E68: 04549-6 | F68: Java 程序设计 | G68: 辛运帏等 | H68: 21.00 | I68: 37257 | J68: 10
A69: =ROW()-2 -> 67 | B69: TP | C69: 4037 | D69: 1 | E69: 04037-0 | F69: 大学文科计算机教程（第1分册）计算机基础知识与操作平台 | G69: 黄都培 | H69: 15.00 | I69: 37104 | J69: 15
A70: =ROW()-2 -> 68 | B70: TP | C70: 4038 | D70: 1 | E70: 04038-9 | F70: 大学文科计算机教程（第2分册）计算机办公软件 | G70: 周山芙等 | H70: 21.00 | I70: 37135 | J70: 12
A71: =ROW()-2 -> 69 | B71: TP | C71: 4014 | D71: 1 | E71: 04014-1 | F71: 大学文科计算机教程（第3分册）计算机网络应用基础 | G71: 蔡翠平 | H71: 11.00 | I71: 37469 | J71: 20
A72: =ROW()-2 -> 70 | B72: TP | C72: 4023 | D72: 1 | E72: 04023-0 | F72: 电子商务基础教程 | G72: 黄云森等 | H72: 14.00 | I72: 37344 | J72: 16
A73: =ROW()-2 -> 71 | B73: TP | C73: 2213 | D73: 2 | E73: 02213-5 | F73: 网页制作实用技术 ―― FrontPage 2000 | G73: 陈强 等 | H73: 19.50 | I73: 37469 | J73: 12
A74: =ROW()-2 -> 72 | B74: TP | C74: 4052 | D74: 1 | E74: 04052-4 | F74: 微型计算机原理及应用(第3版) | G74: 郑学坚等 | H74: 36.00 | I74: 37469 | J74: 6
A75: =ROW()-2 -> 73 | B75: P- | C75: 1783 | D75: 2 | E75: 7900617833 | F75: 微型计算机原理及应用实验指导（第2版） | G75: 郑学坚等 | H75: 25.00 | I75: 37408 | J75: 8
A76: =ROW()-2 -> 74 | B76: P- | C76: 1783 | D76: 1 | E76: 7900617833 | F76: 微型计算机原理及应用实验指导（第2版） （配光盘） | G76: 郑学坚等 | H76: 35.00 | I76: 36982 | J76: 8
A77: =ROW()-2 -> 75 | B77: TP | C77: 5165 | D77: 1 | E77: 05165-8 | F77: 计算机公共基础（第四版）(Windows98,Office2000) | G77: 徐士良 | H77: 27.00 | I77: 37438 | J77: 8
A78: =ROW()-2 -> 76 | B78: TP | C78: 5005 | D78: 1 | E78: 05005-8 | F78: 计算机网络应用技术教程 | G78: 吴功宜等 | H78: 21.00 | I78: 37438 | J78: 9
A79: =ROW()-2 -> 77 | B79: TP | C79: 5065 | D79: 1 | E79: 05065-1 | F79: 计算机软件技术基础 | G79: 徐士良 | H79: 21.00 | I79: 37408 | J79: 10
A80: =ROW()-2 -> 78 | B80: TP | C80: 5737 | D80: 1 | E80: 05737-0 | F80: 计算机网络公共基础实验指导（Windows 98 Office2000） | G80: 徐士良 | H80: 10.00 | I80: 37469 | J80: 24
A81: =ROW()-2 -> 79 | B81: TP | C81: 5781 | D81: 1 | E81: 05781-8 | F81: Access 2000基础与应用 | G81: 李雁翎 | H81: 26.00 | I81: 37469 | J81: 10
F82: 清华大学计算机基础教育课程系列教材
A83: =ROW()-2 -> 81 | B83: TP | C83: 2966 | D83: 8 | E83: 02966-0 | F83: 计算机文化基础(第2版) | G83: 王行言等 | H83: 16.00 | I83: 36586 | J83: 12
A84: =ROW()-2 -> 82 | B84: TP | C84: 3987 | D84: 1 | E84: 03987-9 | F84: 计算机文化基础(第3版) | G84: 李秀 等 | H84: 29.00 | I84: 37438 | J84: 8
A85: =ROW()-2 -> 83 | B85: TP | C85: 3970 | D85: 1 | E85: 03970-4 | F85: 计算机硬件技术基础（第2版） | G85: 张菊鹏等 | H85: 32.00 | I85: 37438 | J85: 7
A86: 85 | B86: TP | C86: 4019 | D86: 1 | E86: 04019-2 | F86: 计算机硬件技术基础实验指导 | G86: 李芙英等 | H86: 13.00 | I86: 37438 | J86: 17
A87: =ROW()-2 -> 85 | B87: TP | C87: 1261 | D87: 1 | E87: 01261-X | F87: 计算机硬件技术基础习题集 | G87: 沈永林 | H87: 9.00 | I87: 37012 | J87: 22
A88: =ROW()-2 -> 86 | B88: TP | C88: 3836 | D88: 1 | E88: 03836-8 | F88: Visual C++ 面向对象与可视化程序设计 | G88: 黄维通 | H88: 26.00 | I88: 37438 | J88: 8
A89: =ROW()-2 -> 87 | B89: P- | C89: 3058 | D89: 1 | E89: 7900630589 | F89: Visual C++ 面向对象与可视化程序设计习题解析与编程实例（配光盘） | G89: 黄维通 | H89: 38.00 | I89: 37469 | J89: 8
A90: =ROW()-2 -> 88 | B90: TP | C90: 4504 | D90: 1 | E90: 04504-6 | F90: C++语言程序设计(第2版）* | G90: 郑莉 等 | H90: 26.00 | I90: 37438 | J90: 8
E91: *本书第1版荣获2000年度中国高校科学技术奖自然科学二等奖、2000年度全国优秀畅销书奖
A92: =ROW()-2 -> 90 | B92: TP | C92: 3926 | D92: 1 | E92: 03926-7 | F92: C++语言程序设计习题与实验指导（配软盘） | G92: 郑莉 等 | H92: 25.00 | I92: 37500 | J92: 11
A93: =ROW()-2 -> 91 | B93: TP | C93: 3927 | D93: 1 | E93: 03927-5 | F93: Java 语言与面向对象程序设计 | H93: 23.50 | I93: 37326 | J93: 9
A94: =ROW()-2 -> 92 | B94: TP | C94: 4407 | D94: 1 | E94: 04407-4 | F94: Linux 基础教程（1） 操作系统基础 | G94: 汤荷美等 | H94: 19.80 | I94: 37073 | J94: 12
A95: =ROW()-2 -> 93 | B95: TP | C95: 4105 | D95: 1 | E95: 04105-9 | F95: Internet 原理与技术 | G95: 赵锦蓉 | H95: 22.00 | I95: 37438 | J95: 10
A96: =ROW()-2 -> 94 | B96: P- | C96: 3721 | D96: 1 | E96: 7900637214 | F96: 计算机辅助设计技术基础教程（配光盘） | G96: 唐龙等 | H96: 21.00 | I96: 37469 | J96: 11
A97: =ROW()-2 -> 95 | B97: TP | C97: 5606 | D97: 1 | E97: 05606-4 | F97: 计算机辅助绘图基础（第3版）（AutoCAD2002） | G97: 陆润民 | H97: 17.00 | I97: 37469 | J97: 12
F98: 高等学校计算机基础教育教材精选
A99: =ROW()-2 -> 97 | B99: TP | C99: 4685 | D99: 1 | E99: 04685-9 | F99: 计算机文化基础教程 | G99: 冯博琴等 | H99: 25.00 | I99: 37469 | J99: 9
A100: =ROW()-2 -> 98 | B100: TP | C100: 5272 | D100: 1 | E100: 05272-7 | F100: 微型计算机原理与接口技术 | G100: 吴宁等 | H100: 29.00 | I100: 37288 | J100: 7
A101: =ROW()-2 -> 99 | B101: TP | C101: 2042 | D101: B | E101: 02042-7 | F101: 微机原理与接口技术 | G101: 朱定华编 | H101: 28.00 | I101: 37414 | J101: 10
A102: =ROW()-2 -> 100 | B102: TP | C102: 5284 | D102: 1 | E102: 05284-0 | F102: 数据库原理及应用（Access 2000) | G102: 姚普选 | H102: 20.00 | I102: 37347 | J102: 10
A103: =ROW()-2 -> 101 | B103: TP | C103: 5358 | D103: 1 | E103: 05358-8 | F103: 计算机网络公共基础 | G103: 史济民 | H103: 23.00 | I103: 37438 | J103: 9
A104: =ROW()-2 -> 102 | B104: TP | C104: 5360 | D104: 1 | E104: 05360-X | F104: 计算机辅助设计与绘图 | G104: 李学志 | H104: 30.00 | I104: 37469 | J104: 8
A105: =ROW()-2 -> 103 | B105: TP | C105: 5280 | D105: 1 | E105: 05280-8 | F105: C++语言基础教程题解与上机指导 | G105: 吕凤翥 | H105: 18.00 | I105: 37469 | J105: 15
A106: =ROW()-2 -> 104 | B106: TP | C106: 5562 | D106: 1 | E106: 05562-9 | F106: AutoCAD2002实用教程 | G106: 唐嘉平 | H106: 37.00 | I106: 37469 | J106: 7
A107: =ROW()-2 -> 105 | B107: TP | C107: 5760 | D107: 1 | E107: 05760-5 | F107: 基于开放平台的网页设计与编程 | G107: 程向前 | H107: 30.00 | I107: 37469 | J107: 8
F108: 高等学校计算机科学与技术教材
A109: =ROW()-2 -> 107 | B109: TP | C109: 1082 | D109: E | E109: 01082-E | F109: 新编Internet基础及应用教程 | G109: 李军义等 | H109: 19.00 | I109: 37438 | J109: 12
A110: =ROW()-2 -> 108 | B110: TP | C110: 1082 | D110: G | E110: 01082-G | F110: 多媒体计算机外部设备 | G110: 周怡陪等 | H110: 38.00 | I110: 37469 | J110: 6
A111: =ROW()-2 -> 109 | B111: TP | C111: 1082 | D111: H | E111: 7810820737 | F111: 算法与数据结构(C与++描述) | G111: 陈松乔等 | H111: 23.00 | I111: 37500 | J111: 11
F112: 普通高校文科专业计算机系列教材
A113: =ROW()-2 -> 111 | B113: TP | C113: 3183 | D113: 1 | E113: 03183-5 | F113: 计算机应用教程(A类 第二版 DOS环境） | G113: 卢湘鸿 | H113: 29.00 | I113: 1999 | J113: 7
A114: =ROW()-2 -> 112 | B114: TP | C114: 1186 | D114: 1 | E114: 01186-9 | F114: 计算机应用教程(Windows 95环境 第2版） | G114: 卢湘鸿 | H114: 34.00 | I114: 2000.4 | J114: 5
A115: =ROW()-2 -> 113 | B115: TP | C115: 3650 | D115: 3 | E115: 03650-0 | F115: 计算机应用教程(Windows 98环境) | G115: 卢湘鸿 | H115: 35.00 | I115: 37469 | J115: 6
A116: =ROW()-2 -> 114 | B116: TP | C116: 4178 | D116: 1 | E116: 04178-4 | F116: 计算机应用教程（Windows 2000 环境） | G116: 卢湘鸿 | H116: 36.00 | I116: 37135 | J116: 6
A117: =ROW()-2 -> 115 | B117: TP | C117: 5115 | D117: 1 | E117: 05115-1 | F117: 计算机应用教程（Windows 2000 环境）习题解答与实验指导 | G117: 卢湘鸿 | H117: 17 | I117: 37347 | J117: 12
A118: =ROW()-2 -> 116 | B118: TP | C118: 5645 | D118: 1 | E118: 05645-5 | F118: 计算机应用教程(第3版）（Windows XP环境） | G118: 卢湘鸿 | H118: 36 | I118: 37469 | J118: 6
F119: 清华大学计算机系列教材
F120: （普通高等教育“九五”国家教委重点教材）
A121: =ROW()-2 -> 119 | B121: TP | C121: 0984 | D121: L | E121: 00984-8 | F121: 数据结构(第2版) | G121: 严蔚敏等 | H121: 21.00 | I121: 37469 | J121: 9
A122: =ROW()-2 -> 120 | B122: TP | C122: 4540 | D122: 1 | E122: 04540-2 | F122: 80x86汇编语言程序设计 | G122: 沈美明等 | H122: 46.00 | I122: 37408 | J122: 5
A123: =ROW()-2 -> 121 | B123: TP | C123: 2520 | D123: 6 | E123: 02520-7 | F123: 实用软件工程(第2版) | G123: 郑人杰等 | H123: 32.00 | I123: 37469 | J123: 6
A124: =ROW()-2 -> 122 | B124: TP | C124: 3238 | D124: 5 | E124: 03238-6 | F124: 数据结构题集(第2版) | G124: 严蔚敏等 | H124: 15.80 | I124: 37410 | J124: 11
A125: =ROW()-2 -> 123 | B125: TP | C125: 2368 | D125: A | E125: 02368-9 | F125: 数据结构(C语言版) | G125: 严蔚敏 | H125: 22.00 | I125: 37412 | J125: 9
A126: =ROW()-2 -> 124 | B126: TP | C126: 3314 | D126: 4 | E126: 03314-5 | F126: 数据结构题集(C语言版) | G126: 严蔚敏 | H126: 16.00 | I126: 37413 | J126: 13
A127: =ROW()-2 -> 125 | B127: TP | C127: 3405 | D127: 4 | E127: 03405-2 | F127: 数据结构 （用面向对象方法与C++描述） | G127: 殷人昆等 | H127: 26.00 | I127: 37415 | J127: 6
A128: =ROW()-2 -> 126 | B128: TP | C128: 5288 | D128: 1 | E128: 05288-3 | F128: 数据结构习题解析（用面向对象方法与C++语言描述） | G128: 殷人昆等 | H128: 26 | I128: 37438 | J128: 12
A129: =ROW()-2 -> 127 | B129: TP | C129: 5036 | D129: 1 | E129: 05036-8 | F129: 数字逻辑与数字集成电路（第2版） | G129: 王尔乾等 | H129: 29.00 | I129: 37469 | J129: 10
A130: =ROW()-2 -> 128 | B130: TP | C130: 2004 | D130: D | E130: 02004-3 | F130: PASCAL程序设计(第2版) | G130: 郑启华 | H130: 17.60 | I130: 37469 | J130: 10
A131: =ROW()-2 -> 129 | B131: TP | C131: 1992 | D131: C | E131: 01992-4 | F131: PASCAL程序设计习题与选解 (新编 ) | G131: 郑启华 | H131: 11.50 | I131: 37419 | J131: 15
A132: =ROW()-2 -> 130 | B132: TP | C132: 4664 | D132: 1 | E132: 04664-6 | F132: IBM-PC 汇编语言程序设计（第2版） | G132: 沈美明等 | H132: 34.80 | I132: 37420 | J132: 6
A133: =ROW()-2 -> 131 | B133: TP | C133: 0829 | D133: N | E133: 00829-9 | F133: IBM-PC汇编语言程序设计 | G133: 沈美明等 | H133: 26.00 | I133: 37421 | J133: 7
A134: =ROW()-2 -> 132 | B134: TP | C134: 0756 | D134: L | E134: 00756-X | F134: IBM-PC汇编语言程序设计例题习题集 | G134: 温冬婵等 | H134: 7.50 | I134: 37422 | J134: 22
A135: =ROW()-2 -> 133 | B135: TP | C135: 1033 | D135: G | E135: 01033-1 | F135: IBM-PC汇编语言程序设计实验教程 | G135: 沈美明等 | H135: 13.00 | I135: 37423 | J135: 16
A136: =ROW()-2 -> 134 | B136: TP | C136: 3990 | D136: 2 | E136: 03990-9 | F136: 计算机操作系统教程（第2版） | G136: 张尧学等 | H136: 19.60 | I136: 37469 | J136: 10
A137: =ROW()-2 -> 135 | B137: TP | C137: 4004 | D137: 1 | E137: 04004-4 | F137: 计算机操作系统教程（第2版）习题解答与实验指导 | G137: 张尧学 | H137: 11 | I137: 37425 | J137: 20
A138: =ROW()-2 -> 136 | B138: TP | C138: 3082 | D138: 3 | E138: 03082-0 | F138: 计算机图形学（第3版） | G138: 孙家广等 | H138: 39.00 | I138: 37469 | J138: 5
A139: =ROW()-2 -> 137 | B139: TP | C139: 2053 | D139: 5 | E139: 02053-1 | F139: 计算机组成原理实验指导书与习题集 | G139: 王诚 等 | H139: 15.80 | I139: 37427 | J139: 12
A140: =ROW()-2 -> 138 | B140: TP | C140: 2732 | D140: 8 | E140: 02732-3 | F140: 编译原理 | G140: 吕映芝等 | H140: 23.00 | I140: 37469 | J140: 9
A141: =ROW()-2 -> 139 | B141: TP | C141: 0408 | D141: B | E141: 00408-0 | F141: 人工智能导论 | G141: 林尧瑞等 | H141: 16.00 | I141: 37429 | J141: 16
A142: =ROW()-2 -> 140 | B142: TP | C142: 2089 | D142: A | E142: 02089-2 | F142: 微型计算机技术及应用 ――从16位到32位 (第2版) | G142: 戴梅萼等 | H142: 38 | I142: 37430 | J142: 5
A143: =ROW()-2 -> 141 | B143: TP | C143: 2646 | D143: 8 | E143: 02646-7 | F143: 微型计算机技术及应用――从16位到32位习题与实验题集(第2版)（配光盘） | G143: 戴梅萼 | H143: 19.5 | I143: 37431 | J143: 20
A144: =ROW()-2 -> 142 | B144: TP | C144: 2646 | D144: 7 | E144: 02646-7 | F144: 微型计算机技术及应用――从16位到32位习题与实验题集(第2版) | G144: 戴梅萼 | H144: 9.5 | I144: 37432 | J144: 20
A145: =ROW()-2 -> 143 | B145: TP | C145: 2087 | D145: 2 | E145: 02087-6 | F145: 微型计算机技术及应用――微型机软件硬件开发指南 | G145: 戴梅萼 | H145: 8 | I145: 37433 | J145: 20
A146: =ROW()-2 -> 144 | B146: TP | C146: 4095 | D146: 1 | E146: 04095-8 | F146: 计算机组成与结构(第3版) | G146: 王爱英 | H146: 32.50 | I146: 37434 | J146: 7
A147: =ROW()-2 -> 145 | B147: TP | C147: 2900 | D147: 5 | E147: 02900-8 | F147: 计算机系统结构(第2版） | G147: 郑纬民等 | H147: 42.00 | I147: 37435 | J147: 4
A148: =ROW()-2 -> 146 | B148: TP | C148: 3573 | D148: 3 | E148: 03573-3 | F148: 计算机网络与 Internet 教程 | G148: 张尧学等 | H148: 24.50 | I148: 37469 | J148: 8
A149: =ROW()-2 -> 147 | B149: TP | C149: 3933 | D149: 1 | E149: 03933-X | F149: 多媒体技术基础 | G149: 林福宗 | H149: 28.00 | I149: 37438 | J149: 7
A150: =ROW()-2 -> 148 | B150: TP | C150: 4006 | D150: 1 | E150: 04006-0 | F150: 多媒体技术基础实验指南 | G150: 谢霄艳等 | H150: 18.00 | I150: 37438 | J150: 12
A151: =ROW()-2 -> 149 | B151: TP | C151: 2016 | D151: 8 | E151: 02016-7 | F151: 计算机图形学基础 | G151: 唐泽圣等 | H151: 20.00 | I151: 37439 | J151: 10
A152: =ROW()-2 -> 150 | B152: TP | C152: 4042 | D152: 1 | E152: 04042-7 | F152: 数理逻辑与集合论（第2版） | G152: 石纯一等 | H152: 18.00 | I152: 37440 | J152: 12
A153: =ROW()-2 -> 151 | B153: TP | C153: 4528 | D153: 1 | E153: 04528-3 | F153: 数理逻辑与集合论（第2版）精要与题解 | G153: 王宏 等 | H153: 16.00 | I153: 37441 | J153: 20
A154: =ROW()-2 -> 152 | B154: TP | C154: 1814 | D154: 3 | E154: 01814-6 | F154: 图论与代数结构 | G154: 戴一奇等 | H154: 12.90 | I154: 37442 | J154: 12
A155: =ROW()-2 -> 153 | B155: TP | C155: 1615 | D155: 3 | E155: 01615-1 | F155: 系统分析与控制 | G155: 孙增圻 | H155: 17.50 | I155: 37443 | J155: 10
A156: =ROW()-2 -> 154 | B156: TP | C156: 5160 | D156: 1 | E156: 05160-7 | F156: 计算机局域网 （第三版） | G156: 胡道元 | H156: 39.00 | I156: 37444 | J156: 6
A157: =ROW()-2 -> 155 | B157: TP | C157: 5288 | D157: 1 | E157: 05288-3 | F157: 数据结构习题解析（用面向对象方法与C++描述） | G157: 徐孝凯 | H157: 26 | I157: 37445 | J157: 12
A158: =ROW()-2 -> 156 | B158: TP | C158: 5549 | D158: 1 | E158: 05549-1 | F158: 计算机组成与设计实验指导 | G158: 王诚 等 | H158: 21 | I158: 37469 | J158: 15
A159: =ROW()-2 -> 157 | B159: P- | C159: 4358 | D159: 1 | E159: 7900643583 | F159: 计算机组成与设计（配光盘） | G159: 王诚 | H159: 39 | I159: 37500 | J159: 8
F160: 21世纪大学本科计算机专业系列教材
A161: =ROW()-2 -> 159 | B161: TP | C161: 5695 | D161: 1 | E161: 05695-1 | F161: 多媒体技术原理及应用 | G161: 马华东 | H161: 24.8 | I161: 37469 | J161: 10
F162: 普通高校计算机专业(本科）实用教程系列
A163: =ROW()-2 -> 161 | B163: TP | C163: 4730 | D163: 1 | E163: 04730-8 | F163: 计算机组成原理实用教程 | G163: 幸云辉等 | H163: 30.00 | I163: 37257 | J163: 9
A164: =ROW()-2 -> 162 | B164: TP | C164: 4655 | D164: 1 | E164: 04655-7 | F164: 操作系统实用教程 | G164: 任爱华等 | H164: 28.00 | I164: 37377 | J164: 10
A165: =ROW()-2 -> 163 | B165: TP | C165: 5023 | D165: 1 | E165: 05023-1 | F165: 微机接口技术实用教程 | G165: 艾德才等 | H165: 34.00 | I165: 37438 | J165: 7
A166: =ROW()-2 -> 164 | B166: TP | C166: 1950 | D166: 2 | E166: 01950-9 | F166: 数据结构实用教程（C/C++描述） | G166: 徐孝凯 | H166: 29.00 | I166: 37328 | J166: 9
A167: =ROW()-2 -> 165 | B167: TP | C167: 5007 | D167: 1 | E167: 05007-4 | F167: 数据结构课程实验 | G167: 徐孝凯 | H167: 16.00 | I167: 37257 | J167: 16
A168: =ROW()-2 -> 166 | B168: TP | C168: 2072 | D168: 4 | E168: 02072-8 | F168: 数据结构实用教程习题参考解答 | G168: 徐孝凯等 | H168: 12.00 | I168: 37377 | J168: 20
A169: =ROW()-2 -> 167 | B169: TP | C169: 4723 | D169: 1 | E169: 04723-5 | F169: JAVA 2 实用教程(修订版） | G169: 耿祥义等 | H169: 39.00 | I169: 37469 | J169: 7
A170: =ROW()-2 -> 168 | B170: TP | C170: 4797 | D170: 1 | E170: 04797-9 | F170: 数据库实用教程 | G170: 丁宝康等 | H170: 35.00 | I170: 37196 | J170: 8
A171: =ROW()-2 -> 169 | B171: TP | C171: 4296 | D171: 1 | E171: 04296-9 | F171: 面向对象程序设计实用教程 | G171: 张海藩等 | H171: 22.00 | I171: 37408 | J171: 11
A172: =ROW()-2 -> 170 | B172: TP | C172: 4750 | D172: 1 | E172: 04750-2 | F172: 计算机网络实用教程 | G172: 刘云 等 | H172: 32.00 | I172: 37257 | J172: 8
A173: =ROW()-2 -> 171 | B173: TP | C173: 5127 | D173: 1 | E173: 05127-5 | F173: 数字逻辑实用教程 | G173: 王玉龙 | H173: 28.00 | I173: 37408 | J173: 9
A174: =ROW()-2 -> 172 | B174: TP | C174: 5211 | D174: 1 | E174: 05211-5 | F174: 信息技术基础实用教程 | G174: 樊孝忠等 | H174: 26.00 | I174: 37408 | J174: 10
F175: 世界著名计算机教材精选
A176: =ROW()-2 -> 174 | B176: TP | C176: 3463 | D176: 1 | E176: 03463-X | F176: 计算机组织与结构：性能设计 （第4版） | G176: 张昆藏等译 | H176: 56.00 | I176: 36831 | J176: 6
A177: =ROW()-2 -> 175 | B177: TP | C177: 4239 | D177: 1 | E177: 04239-X | F177: 因特网和万维网的基本原理与技术 | G177: 郭振波译 | H177: 42.00 | I177: 36951 | J177: 7
A178: =ROW()-2 -> 176 | B178: TP | C178: 4463 | D178: 1 | E178: 04463-5 | F178: TCP/IP 协议族 | G178: 谢希仁译 | H178: 69.00 | I178: 37135 | J178: 4
A179: =ROW()-2 -> 177 | B179: TP | C179: 3646 | D179: 2 | E179: 03646-2 | F179: 数据库系统基础教程 | G179: 史嘉权等译 | H179: 36.00 | I179: 37469 | J179: 8
A180: =ROW()-2 -> 178 | B180: TP | C180: 2342 | D180: 4 | E180: 02342-5 | F180: 面向对象系统分析与设计 | G180: 周之英等译 | H180: 35.00 | I180: 37469 | J180: 10
A181: =ROW()-2 -> 179 | B181: TP | C181: 3948 | D181: 1 | E181: 03948-8 | F181: 计算理论基础（第2版） | G181: 张立昂等译 | H181: 29.00 | I181: 36708 | J181: 10
A182: =ROW()-2 -> 180 | B182: TP | C182: 3035 | D182: 8 | E182: 03035-9 | F182: 计算机网络(第3版) | G182: 熊桂喜等译 | H182: 48.00 | I182: 37469 | J182: 5
A183: =ROW()-2 -> 181 | B183: TP | C183: 3160 | D183: 4 | E183: 03160-6 | F183: 数据结构 C++语言描述 | G183: 刘卫东等译 | H183: 58.00 | I183: 37135 | J183: 4
A184: =ROW()-2 -> 182 | B184: TP | C184: 4164 | D184: 1 | E184: 04164-4 | F184: 多媒体技术：计算、通信和应用 | G184: 潘志庚等译 | H184: 52.00 | I184: 36861 | J184: 6
A185: =ROW()-2 -> 183 | B185: P- | C185: 4330 | D185: 1 | E185: 7900643303 | F185: 计算机网络与Internet――网络应用(第三版)配光盘 | G185: Douglas E.Comer | H185: 58.00 | I185: 37469 | J185: 6
A186: =ROW()-2 -> 184 | B186: TP | C186: 4871 | D186: 1 | E186: 04871-1 | F186: 计算机系统结构――一种定量的方法（第2版）Computer Architecture: A Quantitative Approach | G186: 郑纬民等译 | H186: 72.00 | I186: 37469 | J186: 4
A187: =ROW()-2 -> 185 | B187: P- | C187: 4342 | D187: 1 | E187: 7900643427 | F187: C/C++/Java程序设计经典教程 第三版（含光盘） | G187: Harvey M. Deitel & Deitel & Paul J. Deitel | H187: 99.00 | I187: 37500 | J187: 3
A188: 大学计算机教育丛书（英文影印版）
A189: =ROW()-2 -> 187 | B189: TP | C189: 3623 | D189: 1 | E189: 03623-3 | F189: Elements of the theory of computation 2nd Edition（ 计算理论基础 第2版) | G189: Harry R.Lewis 等 | H189: 19.00 | I189: 37135 | J189: 16
A190: =ROW()-2 -> 188 | B190: TP | C190: 4480 | D190: 1 | E190: 04480-5 | F190: Applied C ：An Introduction and More （C 的应用：入门和提高） | G190: Alice E.Fischer等 | H190: 79.80 | I190: 37043 | J190: 3
A191: =ROW()-2 -> 189 | B191: P- | C191: 3750 | D191: 1 | E191: 7900637508 | F191: C++ Program Design: An Introduction to Programming and Object-Orient Design 3rd Edition (C++ 程序设计 :程序设计和面向对象设计入门 第3版） | G191: James P.Cohoon 等 | H191: 76.00 | I191: 37364 | J191: 3
A192: =ROW()-2 -> 190 | B192: TP | C192: 2976 | D192: 4 | E192: 02976-8 | F192: Operating Systems Internals and Design Principles 3rd Edition（ 操作系统精髓与设计原理 第3版） | G192: William Stallings | H192: 35.00 | I192: 37257 | J192: 7
A193: =ROW()-2 -> 191 | B193: TP | C193: 4314 | D193: 1 | E193: 04314-0 | F193: Systems Programming and Operating Systems 2nd Edition （系统程序设计和操作系统 第2版修订版） | G193: D.M. Dhamdhere | H193: 56.00 | I193: 37012 | J193: 5
A194: =ROW()-2 -> 192 | B194: TP | C194: 2714 | D194: 4 | E194: 02714-5 | F194: Operating Systems Design and Implementation 2nd Edition（操作系统:设计及实现 第2版 配光盘) | G194: Andrew S. Tanenbaum | H194: 69.00 | I194: 37165 | J194: 6
A195: =ROW()-2 -> 193 | B195: TP | C195: 2411 | D195: 6 | E195: 02411-1 | F195: Distributed Operating Systems （分布式操作系统） | G195: Andrew S. Tanenbaum | H195: 30.00 | I195: 37135 | J195: 9
A196: =ROW()-2 -> 194 | B196: TP | C196: 4378 | D196: 1 | E196: 04378-7 | F196: Data Communications and Networking 2nd Edition（数据通信与网络技术 第2版） | G196: Behrouz A.Forouzan | H196: 78.00 | I196: 37196 | J196: 3
A197: =ROW()-2 -> 195 | B197: TP | C197: 3891 | D197: 1 | E197: 03891-0 | F197: In-line/On-line: Fundamentals of the Internet and the the World Wide Web（因特网与万维网基本原理与技术） | G197: Raymond Greenlaw | H197: 49.00 | I197: 36831 | J197: 5
A198: =ROW()-2 -> 196 | B198: TP | C198: 3890 | D198: 1 | E198: 03890-2 | F198: Student Solution Mannal to Accompany In-line/On-line:Fundamentals of the Internet and the World Web（因特网与万维网基本原理与技术学生解题手册） | H198: 15.00 | I198: 36739 | J198: 17
A199: =ROW()-2 -> 197 | B199: TP | C199: 2410 | D199: 9 | E199: 02410-3 | F199: Computer Networks 3rd Edition （计算机网络 第3版) | G199: Andrew S. Tanenbaum | H199: 45.00 | I199: 37073 | J199: 7
A200: =ROW()-2 -> 198 | B200: P- | C200: 4119 | D200: 1 | E200: 04119-1 | F200: Computer Networks and Internets (计算机网络与因特网 配光盘第3版） | G200: Douglas E.Comer | H200: 62.00 | I200: 37389 | J200: 4
A201: =ROW()-2 -> 199 | B201: TP | C201: 1037 | D201: 1 | E201: 01037-4 | F201: Database Management Systems 2nd Edition (数据库管理系统 第2版） | G201: Raghu Ramakrishnan | H201: 76.00 | I201: 37333 | J201: 3
A202: =ROW()-2 -> 200 | B202: TP | C202: 2829 | D202: 4 | E202: 02829-X | F202: A First Course in Database Systems （数据库系统基础教程） | G202: Jeffrey D.Ullman | H202: 23.00 | I202: 37408 | J202: 12
A203: =ROW()-2 -> 201 | B203: TP | C203: 2414 | D203: 5 | E203: 02414-6 | F203: Multimedia:Computing,Communications & Applications(多媒体技术:计算,通信及应用) | G203: Steinmetz R. | H203: 50.001997000000003 | I203: 37257 | J203: 7
A204: =ROW()-2 -> 202 | B204: TP | C204: 2830 | D204: 3 | E204: 02830-3 | F204: IBM PC Assembly Language and Programming 4nd Edition (IBM PC汇编语言与程序设计 第4版) | G204: Peter Abel | H204: 30.00 | I204: 37406 | J204: 9
A205: =ROW()-2 -> 203 | B205: TP | C205: 2412 | D205: 7 | E205: 02412-X | F205: The C Programming Language (C程序设计语言 第2版 ) | G205: Brian W. Kernighan | H205: 23.00 | I205: 37288 | J205: 21
A206: =ROW()-2 -> 204 | B206: TP | C206: 2728 | D206: 3 | E206: 02728-5 | F206: The C Answer Book Solutions to the Exercises in The C Programming Language （C程序设计语言习题解答 第2版) | G206: Clovis L.Tondo | H206: 12.00 | I206: 37377 | J206: 22
A207: =ROW()-2 -> 205 | B207: TP | C207: 2413 | D207: 6 | E207: 02413-8 | F207: Data Structure with C++ (数据结构 C++语言描述 ) | G207: William Ford | H207: 54.00 | I207: 37043 | J207: 7
A208: =ROW()-2 -> 206 | B208: TP | C208: 2943 | D208: 2 | E208: 02943-1 | G208: Robert L.Kruse | H208: 32.00 | I208: 37414 | J208: 8
A209: =ROW()-2 -> 207 | B209: TP | C209: 2192 | D209: 3 | E209: 02192-9 | F209: Java Structures (数据结构 Java 描述） | G209: Duane A.Bailey | H209: 32.00 | I209: 36861 | J209: 8
A210: =ROW()-2 -> 208 | B210: TP | C210: 2415 | D210: 5 | E210: 02415-4 | F210: Computer Organization and Architecture (计算机组织与结构:性能设计 第4版) | G210: William Stallings | H210: 43.00 | I210: 36982 | J210: 8
A211: =ROW()-2 -> 209 | B211: TP | C211: 2832 | D211: 3 | E211: 02832-X | F211: Software Architecture（软件体系结构) | G211: Mary Shaw | H211: 15.00 | I211: 37469 | J211: 20
A212: =ROW()-2 -> 210 | B212: TP | C212: 4139 | D212: 1 | E212: 04139-3 | F212: Software Engineering a Practitioner's Approach (软件工程实践者之路 第5版） | G212: Roger S.Pressman | H212: 79.00 | I212: 37327 | J212: 3
A213: =ROW()-2 -> 211 | B213: TP | C213: 2766 | D213: 3 | E213: 02766-8 | F213: Discrete Mathematical Structures （离散数学结构 第3版) | G213: Bernard Kolman | H213: 32.00 | I213: 37257 | J213: 10
A214: =ROW()-2 -> 212 | B214: TP | C214: 2744 | D214: 3 | E214: 02744-7 | F214: Digital Logic Circuit Analysis & Design (数字逻辑电路分析与设计 ) | G214: Victor P. Nelsom | H214: 69.00 | I214: 36617 | J214: 3
A215: =ROW()-2 -> 213 | B215: TP | C215: 2944 | D215: 3 | E215: 02944-X | F215: Object-Oriented Systems Analysis and Design（面向对象系统分析与设计) | G215: R.J. Norman | H215: 23.00 | I215: 36982 | J215: 12
A216: =ROW()-2 -> 214 | B216: TP | C216: 3188 | D216: 1 | E216: 03188-6 | F216: Object-Oriented Software Construction (面向对象软件构造 第2版 ) | G216: Bertrand Meyer | H216: 96.00 | I216: 36434 | J216: 2
A217: =ROW()-2 -> 215 | B217: TP | C217: 4098 | D217: 1 | E217: 04098-2 | F217: Practical Object-Ortented Design with UML (面向对象设计的 UML 实践 ) | G217: Mark Priestley | H217: 39.00 | I217: 37323 | J217: 9
A218: =ROW()-2 -> 216 | B218: TP | C218: 4220 | D218: 1 | E218: 04220-9 | F218: An Introduction to Object-Oriented Programming witn Java 2nd Edition (Java 面向对象程序设计 第2版） | G218: C.Thomas Wu | H218: 72.00 | I218: 37165 | J218: 4
A219: =ROW()-2 -> 217 | B219: TP | C219: 2771 | D219: 2 | E219: 02771-4 | F219: Computer Graphics (计算机图形学 C语言版 第2版） | G219: Dorald Hearn | H219: 68 | I219: 1998 | J219: 4
A220: =ROW()-2 -> 218 | B220: TP | C220: 2942 | D220: 3 | E220: 02942-3 | F220: UNIX Network Programming (UNIX网络编程 卷一 第二版) | G220: W.Richard Stevens | H220: 43.00 | I220: 37288 | J220: 6
A221: =ROW()-2 -> 219 | B221: TP | C221: 3547 | D221: 2 | E221: 03547-4 | F221: IPv6 The New Internet Protocol (新因特网协议 IPv6 第2版) | G221: Christian Huitema | H221: 14 | I221: 36861 | J221: 20
A222: =ROW()-2 -> 220 | B222: TN | C222: 2828 | D222: 3 | E222: 02828-1 | F222: Digital Image Processing (数字图象处理） | G222: K.R. Castleman | H222: 32.00 | I222: 37371 | J222: 8
A223: =ROW()-2 -> 221 | B223: TN | C223: 2927 | D223: 2 | E223: 02927-X | F223: Digital Video Processing（数字视频处理） | G223: A.Murat Tekalp | H223: 27.00 | I223: 1998 | J223: 10
A224: =ROW()-2 -> 222 | B224: TP | C224: 3640 | D224: 1 | E224: 03640-3 | F224: Fundamentals of Speech Recognition (语音识别基本原理) | G224: Lawrence Rabiner等 | H224: 41.00 | I224: 36404 | J224: 5
A225: =ROW()-2 -> 223 | B225: TP | C225: 2831 | D225: 2 | E225: 02831-1 | F225: Computer System Architecture（计算机系统体系结构 第3版） | G225: M.Morris Mano | H225: 28.00 | I225: 37469 | J225: 11
A226: =ROW()-2 -> 224 | B226: TP | C226: 4123 | D226: 1 | E226: 04123-7 | F226: Communication Networks Fundamental Concepts and key Architectures (通信网基本概念与主体结构) | G226: Alberto Leon-Garcia | H226: 72.00 | I226: 36892 | J226: 4
A227: =ROW()-2 -> 225 | B227: TP | C227: 4100 | D227: 1 | E227: 04100-8 | F227: TCP/IP Protocol Suite (TCP/IP 协议族 ) | G227: Behrouz A. | H227: 69.00 | I227: 36861 | J227: 4
A228: =ROW()-2 -> 226 | B228: TP | C228: 2946 | D228: 3 | E228: 02946-6 | F228: Principles,Protocols and ArchitectureTCP/IP ( 网络互联技术1 原理，协议和体系结构 第3版） | G228: Douglas E.Comer | H228: 30.00 | I228: 37500 | J228: 10
A229: =ROW()-2 -> 227 | B229: TP | C229: 2947 | D229: 3 | E229: 02947-4 | F229: Design,Implementation and Internals (TCP/IP 网络互联技术2 设计与实现 ) | G229: Douglas E.Comer等 | H229: 30.00 | I229: 37288 | J229: 9
A230: =ROW()-2 -> 228 | B230: TP | C230: 2948 | D230: 2 | E230: 02948-2 | F230: Client-Server Programming and Applications (TCP/IP 网络互联技术3 第2版 客户服务器编程应用BSD套接字版 ) | G230: Douglas E.Comer等 | H230: 32 | I230: 36617 | J230: 10
A231: =ROW()-2 -> 229 | B231: TP | C231: 3094 | D231: 3 | E231: 03094-4 | F231: Client-Server Programming and Applications (TCP/IP 网络互联技术 第3版 客户服务器编程应用Windows套接字版 ) | G231: Douglas E.Comer等 | H231: 30 | I231: 36465 | J231: 10
F232: 大学计算机教育国外著名教材、教参系列（影印版）
A233: =ROW()-2 -> 231 | B233: TP | C233: 5493 | D233: 2 | E233: 05493-2 | F233: Principles of Distributed Database System Second Edition （分布式数据库系统原理 第2版） | G233: Douglas E.Comer等 | H233: 57.00 | I233: 37408 | J233: 4
A234: =ROW()-2 -> 232 | B234: TP | C234: 5021 | D234: 1 | E234: 05021-1 | F234: Introduction to Automata Theory,Languages,and Computation 2ed（自动机理论、语言和计算机导论 第2版） | G234: John E.Hopcroft等 | H234: 47 | I234: 37438 | J234: 5
A235: =ROW()-2 -> 233 | B235: TP | C235: 5355 | D235: 1 | E235: 05355-3 | F235: UNIX Network Progrmming Volume 2:Interprocess Communication 2ed(UNIX网络编程 卷二：过程间通信 第2版) | G235: W.Richard Stevens | H235: 47.00 | I235: 37371 | J235: 5
A236: =ROW()-2 -> 234 | B236: TP | C236: 4999 | D236: 1 | E236: 04999-1 | F236: The 80x86 IBM PC and Compatible Computers(Volumes I &II) Assembly Language, Design and Interfacing 3ed (80x86 IBM PC 及兼容计算机 卷I和卷II）（配光盘） | G236: Muhammad Ali Mazidi等 | H236: 85.00 | I236: 37438 | J236: 3
A237: =ROW()-2 -> 235 | B237: TP | C237: 5536 | D237: 1 | E237: 05536-X | F237: Network Security Essentials:Applications and Stardards（网络安全基础教程:应用与标准） | G237: William Stallings | H237: 35.00 | I237: 37469 | J237: 7
A238: =ROW()-2 -> 236 | B238: TP | C238: 5537 | D238: 1 | E238: 05537-8 | F238: Crytogrphy and Network Security:Principles and Computation 2ed (密码学与网络安全：原理与实践 第2版） | G238: William Stallings | H238: 53.00 | I238: 37469 | J238: 4
A239: =ROW()-2 -> 237 | B239: P- | C239: 4334 | D239: 1 | E239: 7-900643-34-6 | F239: PCI-X System Architecture (PCI-X 系统的体系结构 配光盘） | G239: MindShare,Inc等 | H239: 68.00 | I239: 37469 | J239: 3
A240: =ROW()-2 -> 238 | B240: TP | C240: 5717 | D240: 1 | E240: 05717-6 | F240: Introduction to Logic Design(逻辑设计基础） | G240: Alan B.Marcovitz | H240: 50.00 | I240: 37469 | J240: 4
A241: =ROW()-2 -> 239 | B241: TP | C241: 5710 | D241: 1 | E241: 05710-9 | F241: Operating Systems: A Systematic View (Fifth Edition) (操作系统；实践与应用）（第5版） | G241: William S. Davis T.M. Rajkumar | H241: 55.00 | I241: 37500 | J241: 4
F242: SEI 软件工程丛书（影印版）
A243: =ROW()-2 -> 241 | B243: TP | C243: 5753 | D243: 1 | E243: 05753-2 | F243: 软件制胜之道 | G243: Watts Si Humphrey | H243: 39.00 | I243: 37500 | J243: 10
A244: =ROW()-2 -> 242 | B244: TP | C244: 5757 | D244: 1 | E244: 057575 | F244: 软件采办管理――开放系统和COTS产品 | G244: B Craig Meyers | H244: 59.00 | I244: 37500 | J244: 6
A245: =ROW()-2 -> 243 | B245: TP | C245: 5752 | D245: 1 | E245: 05752-4 | F245: 风险管理――软件系统开发方法 | G245: Elaine M Hall | H245: 49.00 | I245: 37500 | J245: 7
A246: =ROW()-2 -> 244 | B246: TP | C246: 5756 | D246: 1 | E246: 05756-7 | F246: 技术人员管理 | G246: Watts Si Humphrey | H246: 49.00 | I246: 37500 | J246: 7
A247: =ROW()-2 -> 245 | B247: TP | C247: 5758 | D247: 1 | E247: 05758--3 | F247: 软件过程管理 | G247: Watts Si Humphrey | H247: 59.00 | I247: 37469 | J247: 6
A248: =ROW()-2 -> 246 | B248: TP | C248: 5754 | D248: 1 | E248: 05754-0 | F248: 用商业组件构建系统 | G248: Kurt L wallnau | H248: 49.00 | I248: 37469 | J248: 7
F249: Autodesk 官方培训教程系列（影印版）
A250: =ROW()-2 -> 248 | B250: P- | C250: 4346 | D250: 1 | E250: 7-900643-46-X | F250: AutoCAD 2002 Level 1 & Update Official Training Courseware (AutoCAD 2002 专业一级与新功能培训教程 配光盘） | G250: Autodesk公司 | H250: 60.00 | I250: 37469 | J250: 4
F251: 教育部人才培养试点教材
A252: =ROW()-2 -> 250 | B252: TP | C252: 3567 | D252: 2 | E252: 03567-9 | F252: 多媒体技术基础及应用 | G252: 钟玉琢等 | H252: 28.00 | I252: 37438 | J252: 10
A253: =ROW()-2 -> 251 | B253: TP | C253: 0696 | D253: 1 | E253: 00696-2 | F253: 多媒体技术基础及应用辅导与实验 | G253: 钟玉琢等 | H253: 18.00 | I253: 37469 | J253: 15
A254: =ROW()-2 -> 252 | B254: TP | C254: 1314 | D254: 3 | E254: 01314-4 | F254: 计算机组成原理 | G254: 王 诚 | H254: 27.00 | I254: 37469 | J254: 8
A255: =ROW()-2 -> 253 | B255: TP | C255: 5192 | D255: 1 | E255: 05192-5 | F255: 计算机组成原理实验指导书 | G255: 王诚 等 | H255: 13.00 | I255: 37327 | J255: 16
A256: =ROW()-2 -> 254 | B256: TP | C256: 4237 | D256: 1 | E256: 04237-3 | F256: 计算机系统结构 | G256: 郑纬民等 | H256: 29.80 | I256: 37469 | J256: 8
A257: =ROW()-2 -> 255 | B257: TP | C257: 4262 | D257: 2 | E257: 04262-4 | F257: 计算机网络 | G257: 吴企渊 | H257: 23.00 | I257: 37377 | J257: 10
A258: =ROW()-2 -> 256 | B258: TP | C258: 4271 | D258: 1 | E258: 04271-3 | F258: 数据结构 | G258: 殷人昆 | H258: 27.60 | I258: 37408 | J258: 8
A259: =ROW()-2 -> 257 | B259: TP | C259: 4425 | D259: 1 | E259: 04425-2 | F259: 实用软件工具与环境教程――C++ 高级编程 | G259: 谭德强等 | H259: 28.00 | I259: 37073 | J259: 8
A260: =ROW()-2 -> 258 | B260: TP | C260: 4669 | D260: 1 | E260: 04669-7 | F260: 微计算机技术 | G260: 马群生等 | H260: 29.50 | I260: 37196 | J260: 9
A261: =ROW()-2 -> 259 | B261: TP | C261: 4670 | D261: 1 | E261: 04670-0 | F261: 微计算机技术实验教程 | G261: 潘孝梅等 | H261: 8.50 | I261: 37135 | J261: 30
A262: =ROW()-2 -> 260 | B262: TP | C262: 3928 | D262: 2 | E262: 03928-3 | F262: 计算机操作系统 | G262: 吴企渊等 | H262: 16.00 | I262: 37012 | J262: 16
A263: =ROW()-2 -> 261 | B263: TN | C263: 4039 | D263: 2 | E263: 04039-7 | F263: 信号处理原理 | G263: 郑方 等 | H263: 26.00 | I263: 37469 | J263: 11
A264: =ROW()-2 -> 262 | B264: TP | C264: 4699 | D264: 1 | E264: 04699-9 | F264: 数据库系统教程 | G264: 史嘉权等 | H264: 22.00 | I264: 37438 | J264: 13
A265: =ROW()-2 -> 263 | B265: TP | C265: 5159 | D265: 1 | E265: 05159-3 | F265: C++面向对象程序设计教程 | G265: 王萍等 | H265: 35.00 | I265: 37355 | J265: 7
F266: 高等院校信息管理与信息系统专业系列教材
F267: 教程系列
A268: =ROW()-2 -> 266 | B268: TP | C268: 5049 | D268: 1 | E268: 05049-X | F268: 计算机原理与系统结构（第二版） | G268: 侯炳辉等 | H268: 23.00 | I268: 37469 | J268: 9
A269: =ROW()-2 -> 267 | B269: TP | C269: 2787 | D269: 5 | E269: 02787-0 | F269: 计算机组成原理教程(第2版) | G269: 张基温 | H269: 17.00 | I269: 37438 | J269: 13
A270: =ROW()-2 -> 268 | B270: TP | C270: 4013 | D270: 1 | E270: 04013-3 | F270: 计算机组成原理教程题解与实验指导 | G270: 张基温 | H270: 17.50 | I270: 37073 | J270: 12
A271: =ROW()-2 -> 269 | B271: TP | C271: 1123 | D271: 1 | E271: 01123-0 | F271: 操作系统原理教程 | G271: 孟 静 | H271: 25.00 | I271: 37469 | J271: 8
A272: =ROW()-2 -> 270 | B272: TP | C272: 2801 | D272: 2 | E272: 02801-X | F272: 信息经济学教程 | G272: 陈 禹 | H272: 17.00 | I272: 37135 | J272: 11
A273: =ROW()-2 -> 271 | B273: TP | C273: 4443 | D273: 1 | E273: 04443-0 | F273: 信息系统的开发与管理教程 | G273: 左美云等 | H273: 28.00 | I273: 37469 | J273: 8
A274: =ROW()-2 -> 272 | B274: TP | C274: 2913 | D274: 2 | E274: 02913-X | F274: 信息系统开发方法教程 | G274: 陈 佳 | H274: 18.00 | I274: 37438 | J274: 10
A275: =ROW()-2 -> 273 | B275: TP | C275: 3530 | D275: 3 | E275: 03530-X | F275: 信息系统开发方法教程 | G275: 黄叔武等 | H275: 24.50 | I275: 37326 | J275: 8
A276: =ROW()-2 -> 274 | B276: TP | C276: 3739 | D276: 1 | E276: 03739-6 | F276: 计算机网络工程教程题解与实验指导 | G276: 黄叔武等 | H276: 19.00 | I276: 37257 | J276: 11
A277: =ROW()-2 -> 275 | B277: TP | C277: 4012 | D277: 1 | E277: 04012-5 | F277: 数据结构及应用算法教程（配光盘） | G277: 严蔚敏等 | H277: 29.00 | I277: 37469 | J277: 10
A278: =ROW()-2 -> 276 | B278: TP | C278: 3009 | D278: 6 | E278: 03009-X | F278: 数据库系统原理教程 | G278: 王珊 等 | H278: 18.50 | I278: 37438 | J278: 10
A279: =ROW()-2 -> 277 | B279: TP | C279: 3788 | D279: 1 | E279: 03788-4 | F279: 运筹学模型与方法教程 | G279: 程理民等 | H279: 21.00 | I279: 37357 | J279: 9
A280: =ROW()-2 -> 278 | B280: TP | C280: 4088 | D280: 1 | E280: 04088-5 | F280: 运筹学模型与方法教程例题分析与题解 | G280: 刘满凤等 | H280: 22.00 | I280: 37257 | J280: 10
A281: =ROW()-2 -> 279 | B281: TP | C281: 3722 | D281: 2 | E281: 03722-1 | F281: 离散数学 (第二版) | G281: 耿素云等 | H281: 16.80 | I281: 37408 | J281: 12
A282: =ROW()-2 -> 280 | B282: TP | C282: 5274 | D282: 1 | E282: 05274-3 | F282: 信息管理学教程 | G282: 杜栋 | H282: 15.00 | I282: 37347 | J282: 20
A283: =ROW()-2 -> 281 | B283: TP | C283: 3398 | D283: 2 | E283: 03398-6 | F283: 离散数学题解 | G283: 屈婉玲等 | H283: 13.00 | I283: 37357 | J283: 15
F284: 参考系列
A285: =ROW()-2 -> 283 | B285: TP | C285: 3562 | D285: 3 | E285: 03562-8 | F285: 电子商务概论 | G285: 方美琪 | H285: 27.00 | I285: 36982 | J285: 8
A286: =ROW()-2 -> 284 | B286: TP | C286: 4823 | D286: 1 | E286: 04823-1 | F286: 电子商务概论（第二版） | G286: 方美琪 | H286: 37.00 | I286: 37196 | J286: 5
A287: =ROW()-2 -> 285 | B287: TP | C287: 3418 | D287: 1 | E287: 03418-4 | F287: 信息系统开发案例 (第一辑) | G287: 张基温等 | H287: 11.50 | I287: 37257 | J287: 20
A288: =ROW()-2 -> 286 | B288: TP | C288: 3830 | D288: 1 | E288: 03830-9 | F288: 信息系统开发案例 (第二辑) | G288: 张基温等 | H288: 14.00 | I288: 36526 | J288: 15
A289: =ROW()-2 -> 287 | B289: TP | C289: 4122 | D289: 1 | E289: 04122-9 | F289: 信息系统开发案例（第三辑） | G289: 张基温 | H289: 16.00 | I289: 37257 | J289: 15
A290: =ROW()-2 -> 288 | B290: TP | C290: 3277 | D290: 1 | E290: 03277-7 | F290: 信息系统工程中的面向对象方法 | G290: 陈余年等 | H290: 22.00 | I290: 1999 | J290: 9
A291: =ROW()-2 -> 289 | B291: TP | C291: 3995 | D291: 1 | E291: 03995-X | F291: 信息系统建设的软系统方法 | G291: 邝孔武等 | H291: 12.00 | I291: 36770 | J291: 20
A292: =ROW()-2 -> 290 | B292: TP | C292: 3213 | D292: 1 | E292: 03213-0 | F292: 信息系统的安全与保密 | G292: 贾 晶 | H292: 12.00 | I292: 37358 | J292: 22
A293: =ROW()-2 -> 291 | B293: TP | C293: 1055 | D293: 1 | E293: 01055-2 | F293: 管理系统模拟与GPSS语言 | G293: 姜林奇 | H293: 12.00 | I293: 36708 | J293: 18
A294: =ROW()-2 -> 292 | B294: TP | C294: 5454 | D294: 1 | E294: 05454-1 | F294: 信息系统的组织・管理・建模 | G294: 陈国青等 | H294: 22.00 | I294: 37469 | J294: 11
F295: 北京大学信息技术系列教材
A296: =ROW()-2 -> 294 | B296: TP | C296: 1082 | D296: 1 | E296: 7810820001 | F296: 数据库技术－SQL | G296: 蔡翠平主编 | H296: 21.00 | I296: 37257 | J296: 11
A297: =ROW()-2 -> 295 | B297: TP | C297: 1082 | D297: C | E297: 7810820613 | F297: 从HTML 到 XML（含盘） | G297: 蔡翠平主编 | H297: 26.00 | I297: 37438 | J297: 11
A298: =ROW()-2 -> 296 | B298: TP | C298: 1082 | D298: 2 | E298: 7810820095 | F298: 办公自动化软件 | G298: 蔡翠平主编 | H298: 23.00 | I298: 37469 | J298: 10
A299: =ROW()-2 -> 297 | B299: TP | C299: 1082 | D299: 3 | E299: 7810820184 | F299: 计算机信息技术 基础 | G299: 蔡翠平主编 | H299: 17.00 | I299: 37257 | J299: 13
A300: =ROW()-2 -> 298 | B300: TP | C300: 1082 | D300: 4 | E300: 7810820192 | F300: 计算机网络应用技术 | G300: 蔡翠平主编 | H300: 19.00 | I300: 37258 | J300: 12
A301: =ROW()-2 -> 299 | B301: TP | C301: 1082 | D301: 5 | E301: 7810820176 | F301: Visual Basic 程序设计 | G301: 蔡翠平主编 | H301: 27.00 | I301: 37258 | J301: 8
A302: =ROW()-2 -> 300 | B302: TP | C302: 1082 | D302: 7 | E302: 7810820109 | F302: 多媒体应用技术（含光盘） | G302: 蔡翠平主编 | H302: 29.00 | I302: 37317 | J302: 9
A303: =ROW()-2 -> 301 | B303: TP | C303: 1082 | D303: 8 | E303: 7810820087 | F303: 网络程序设计――ASP（含光盘） | G303: 蔡翠平主编 | H303: 28.00 | I303: 37469 | J303: 10
A304: =ROW()-2 -> 302 | B304: TP | C304: 1082 | D304: 9 | E304: 7810820419 | F304: 网页制作技术 | G304: 蔡翠平主编 | H304: 22.00 | I304: 37389 | J304: 12
A305: =ROW()-2 -> 303 | B305: TP | C305: 1082 | D305: A | E305: 7810820303 | F305: Visual FoxPro程序设计 | G305: 蔡翠平主编 | H305: 29.00 | I305: 37414 | J305: 12
F306: 大学计算机文化基础课教材
A307: =ROW()-2 -> 305 | B307: TP | C307: 5729 | D307: 1 | E307: 05729-X | F307: 计算机信息技术基础 | G307: 东方人华 | H307: 25.00 | I307: 37469 | J307: 9
F308: 高等学校工科电子类规划教材
A309: =ROW()-2 -> 307 | B309: TP | C309: 1470 | D309: 9 | E309: 01470-1 | F309: 软件应用技术基础 | G309: 徐士良等 | H309: 23.00 | I309: 37408 | J309: 9
A310: =ROW()-2 -> 308 | B310: TB | C310: 4396 | D310: 1 | E310: 04396-5 | F310: 电子材料导论 | G310: 李言荣等 | H310: 34.00 | I310: 37104 | J310: 7
A311: =ROW()-2 -> 309 | B311: TP | C311: 3390 | D311: 3 | E311: 03390-0 | F311: 信息系统分析与设计 | G311: 邝孔武等 | H311: 16.00 | I311: 37329 | J311: 12
F312: 高等学校电子信息类规划教材
A313: =ROW()-2 -> 311 | B313: TP | C313: 3749 | D313: 2 | E313: 03749-3 | F313: C++面向对象程序设计教程 | G313: 陈维兴等 | H313: 17.00 | I313: 37469 | J313: 13
A314: =ROW()-2 -> 312 | B314: TP | C314: 1082 | D314: D | E314: 01082-1 | F314: 蓝牙技术原理与协议 | G314: 朱刚等 | H314: 26.00 | I314: 37438 | J314: 12
A315: =ROW()-2 -> 313 | B315: TP | C315: 3821 | D315: 1 | E315: 03821-X | F315: 系统仿真导论 | G315: 肖田元等 | H315: 23.50 | I315: 37104 | J315: 10
A316: =ROW()-2 -> 314 | B316: TH | C316: 1389 | D316: 1 | E316: 01389-6 | F316: 电子机械可靠性与维修性 | G316: 王世萍等 | H316: 19.50 | I316: 36647 | J316: 10
F317: 国外计算机科学经典教材
A318: =ROW()-2 -> 316 | B318: TP | C318: 5594 | D318: 1 | E318: 05594-7 | F318: TCP/IP 权威教程（第七版） | G318: Adolfo Rodriguez | H318: 75.00 | I318: 37469 | J318: 5
F319: 现代远程教育计算机信息技术教材
A320: =ROW()-2 -> 318 | B320: TP | C320: 1082 | D320: F | E320: 7-81082-063-X | F320: 微型计算机原理与接口技术 | G320: 毛六平等编 | H320: 26.00 | I320: 37469 | J320: 10
F321: 21 世纪计算机专业大专系列教材（李大友主编）
A322: =ROW()-2 -> 320 | B322: TP | C322: 4292 | D322: 1 | E322: 04292-6 | F322: 离散数学 | G322: 邵学才等 | H322: 17.00 | I322: 37257 | J322: 15
A323: =ROW()-2 -> 321 | B323: TP | C323: 4996 | D323: 1 | E323: 04996-3 | F323: 离散数学习题与解答 | G323: 邵学才等 | H323: 15.00 | I323: 37408 | J323: 14
A324: =ROW()-2 -> 322 | B324: TP | C324: 4505 | D324: 1 | E324: 04505-4 | F324: 多媒体技术及其应用 | G324: 李大友 | H324: 21.00 | I324: 37404 | J324: 11
A325: =ROW()-2 -> 323 | B325: TP 4943 1 | D325: 1 | E325: 04943-1 | F325: 计算机组成原理（第二版） | G325: 李文兵 | H325: 26.00 | I325: 37408 | J325: 8
A326: =ROW()-2 -> 324 | B326: P- | C326: 3711 | D326: 1 | E326: 7900637117 | F326: Java 语言程序设计（配光盘） | G326: 孙一林 | H326: 29.00 | I326: 37327 | J326: 10
A327: =ROW()-2 -> 325 | B327: TP | C327: 5080 | D327: 1 | E327: 05080-5 | F327: 计算机组织与结构 | G327: 蒋本珊 | H327: 28.00 | I327: 37438 | J327: 8
A328: =ROW()-2 -> 326 | B328: TP | C328: 5262 | D328: 1 | E328: 05262-X | F328: Visual FoxPro程序设计 | G328: 陈 明 | H328: 25.00 | I328: 37469 | J328: 9
A329: =ROW()-2 -> 327 | B329: P- | C329: 4167 | D329: 1 | E329: 04167-X | F329: 数据结构(配光盘) | G329: 李大友 | H329: 25.00 | I329: 37469 | J329: 10
A330: =ROW()-2 -> 328 | B330: TP | C330: 5546 | D330: 1 | E330: 05546-7 | F330: 实用软件工程基础 | G330: 陈 明 | H330: 25.00 | I330: 37469 | J330: 10
A331: =ROW()-2 -> 329 | B331: P- | C331: 4199 | D331: 1 | E331: 7900614998 | F331: Visual Basic 程序设计(配光盘） | G331: 彭波 | H331: 27.00 | I331: 37469 | J331: 7
A332: =ROW()-2 -> 330 | B332: TP | C332: 5328 | D332: 1 | E332: 05328-6 | F332: Internet 技术及其应用 | G332: 刘建 | H332: 35.00 | I332: 37469 | J332: 6
E333: 教育部高职高专规划教材
A334: =ROW()-2 -> 332 | B334: TP | C334: 4027 | D334: 1 | E334: 04027-3 | F334: 微机接口技术 | G334: 邵时 等 | H334: 19.00 | I334: 37438 | J334: 13
A335: =ROW()-2 -> 333 | B335: TP | C335: 5041 | D335: 1 | E335: 05041-4 | F335: Pentium 微机原理与接口技术 | G335: 姚放吾主编 | H335: 25.00 | I335: 2002.1 | J335: 9
A336: =ROW()-2 -> 334 | B336: TP | C336: 4827 | D336: 1 | E336: 04827-4 | F336: 微机组装与维修 | G336: 梁和 等 | H336: 29.00 | I336: 37257 | J336: 7
A337: =ROW()-2 -> 335 | B337: TP | C337: 4376 | D337: 1 | E337: 04376-0 | F337: 计算机网络工程与实训 | G337: 沈辉 等 | H337: 21.00 | I337: 37469 | J337: 12
A338: =ROW()-2 -> 336 | B338: TP | C338: 4636 | D338: 1 | E338: 04636-0 | F338: 多媒体技术与应用基础 | G338: 周 琛 | H338: 18.00 | I338: 37469 | J338: 14
A339: =ROW()-2 -> 337 | B339: TP | C339: 4562 | D339: 1 | E339: 04562-3 | F339: 数据库应用系统开发――PowerBuilder 实用编程技术 | G339: 齐治文等 | H339: 28.00 | I339: 37469 | J339: 9
A340: =ROW()-2 -> 338 | B340: TP | C340: 4065 | D340: 1 | E340: 04065-6 | F340: 数据结构 | G340: 张世和 | H340: 16.00 | I340: 37135 | J340: 15
F341: 高职高专计算机系列教材（谭浩强主编）
A342: =ROW()-2 -> 340 | B342: TP | C342: 3802 | D342: 2 | E342: 03802-3 | F342: 计算机基础知识与基本操作 | G342: 张 玲 | H342: 19.50 | I342: 37165 | J342: 13
A343: =ROW()-2 -> 341 | B343: TP | C343: 4603 | D343: 1 | E343: 04603-4 | F343: 微机原理与接口技术 | G343: 李文英等 | H343: 26.00 | I343: 37257 | J343: 8
A344: =ROW()-2 -> 342 | B344: TP | C344: 3952 | D344: 1 | E344: 03952-6 | F344: 最新常用软件的使用 Office 2000 中文版 | G344: 孙慧 等 | H344: 27.00 | I344: 37469 | J344: 9
A345: =ROW()-2 -> 343 | B345: TP | C345: 3791 | D345: 2 | E345: 03791-4 | F345: C 语言程序设计 | G345: 谭浩强 | H345: 24.00 | I345: 37469 | J345: 9
A346: =ROW()-2 -> 344 | B346: TP | C346: 4008 | D346: 1 | E346: 04008-7 | F346: C 语言程序设计题解与上机指导 | G346: 谭浩强等 | H346: 20.00 | I346: 37469 | J346: 12
A347: =ROW()-2 -> 345 | B347: TP | C347: 4771 | D347: 1 | E347: 04771-5 | F347: Visual FoxPro 6.0 使用与开发技术 | G347: 李雁翎 | H347: 25.00 | I347: 37288 | J347: 10
A348: =ROW()-2 -> 346 | B348: TP | C348: 3798 | D348: 1 | E348: 03798-1 | F348: Visual BASIC 程序设计 | G348: 谭浩强等 | H348: 23.00 | I348: 37469 | J348: 10
A349: =ROW()-2 -> 347 | B349: TP | C349: 4086 | D349: 1 | E349: 04086-9 | F349: 多媒体技术及应用 | G349: 陈 明 | H349: 18.00 | I349: 37257 | J349: 14
A350: =ROW()-2 -> 348 | B350: TP | C350: 4018 | D350: 1 | E350: 04018-4 | F350: QBASIC 语言程序设计 | G350: 谭浩强等 | H350: 25.50 | I350: 37469 | J350: 10
A351: =ROW()-2 -> 349 | B351: TP | C351: 4874 | D351: 1 | E351: 04874-6 | F351: QBASIC 语言程序设计题解与上机指导 | G351: 谭浩强 | H351: 13.50 | I351: 37257 | J351: 16
A352: =ROW()-2 -> 350 | B352: TP | C352: 4609 | D352: 1 | E352: 04609-3 | F352: Java 语言程序设计 | G352: 邵光亚等 | H352: 22.00 | I352: 37408 | J352: 10
A353: =ROW()-2 -> 351 | B353: TP | C353: 3805 | D353: 1 | E353: 03805-8 | F353: 数据库应用技术（FoxPro) | G353: 訾秀玲 | H353: 15.00 | I353: 37377 | J353: 15
A354: =ROW()-2 -> 352 | B354: TP | C354: 4638 | D354: 1 | E354: 04638-7 | F354: Internet 应用教程 | G354: 陈强 等 | H354: 20.00 | I354: 37469 | J354: 14
A355: =ROW()-2 -> 353 | B355: TP | C355: 3789 | D355: 2 | E355: 03789-2 | F355: Internet 技术与应用 | G355: 李琳 等 | H355: 13.60 | I355: 37408 | J355: 18
A356: =ROW()-2 -> 354 | B356: TP | C356: 3921 | D356: 1 | E356: 03921-6 | F356: 计算机辅助制图与设计 | G356: 郝玲 等 | H356: 22.00 | I356: 36739 | J356: 12
A357: =ROW()-2 -> 355 | B357: TP | C357: 3807 | D357: 1 | E357: 03807-4 | F357: 计算机安全技术 | G357: 刘荫铭等 | H357: 24.00 | I357: 37412 | J357: 10
A358: =ROW()-2 -> 356 | B358: TP | C358: 5636 | D358: 1 | E358: 05636-6 | F358: 计算机网络安全与应用技术 | G358: 袁家政 | H358: 30.00 | I358: 37500 | J358: 8
A359: =ROW()-2 -> 357 | B359: TP | C359: 5635 | D359: 1 | E359: 05635-8 | F359: 计算机网络 | G359: 徐敬东等 | H359: 26.00 | I359: 37469 | J359: 9
A360: =ROW()-2 -> 358 | B360: TP | C360: 5591 | D360: 1 | E360: 05591-2 | F360: Access 及其应用系统开发 | G360: 薛静锋 | H360: 18.50 | I360: 37469 | J360: 13
A361: =ROW()-2 -> 359 | B361: TP | C361: 5647 | D361: 1 | E361: 05647-1 | F361: 实用数据结构基础 | G361: 陈明 | H361: 25.00 | I361: 37500 | J361: 10
A362: =ROW()-2 -> 360 | B362: TP | C362: 5701 | D362: 1 | E362: 05701-X | F362: 网页编程技术 | G362: 邵丽萍 | H362: 25.00 | I362: 37500 | J362: 10
A363: =ROW()-2 -> 361 | B363: TP | C363: 5731 | D363: 1 | E363: 05731-1 | F363: 网页制作技术 | G363: 赵丰年 | H363: 19.00 | I363: 37500 | J363: 10
F364: 高职高专电子商务专业系列教材
F365: 商业信息化系列培训教材
A366: =ROW()-2 -> 364 | B366: TP | C366: 5213 | D366: 1 | E366: 05213-1 | F366: 商务管理信息系统 | G366: 李大军 | H366: 30.00 | I366: 37288 | J366: 9
A367: =ROW()-2 -> 365 | B367: TP | C367: 5146 | D367: 1 | E367: 05146-1 | F367: 计算机会计与电子商务 | G367: 黄 群 | H367: 15.00 | I367: 37469 | J367: 18
A368: =ROW()-2 -> 366 | B368: TP | C368: 5147 | D368: 1 | E368: 05147-X | F368: 连锁经营与计算机管理 | G368: 李大军 | H368: 23.00 | I368: 37316 | J368: 12
A369: =ROW()-2 -> 367 | B369: TP | C369: 5174 | D369: 1 | E369: 05174-7 | F369: 商业会计实务与财务管理 | G369: 吴江江 | H369: 30.00 | I369: 37316 | J369: 9
A370: =ROW()-2 -> 368 | B370: TP | C370: 5850 | D370: 1 | E370: 05850-4 | F370: 电子商务法律法规 | G370: 王纪平 | H370: 29.50 | I370: 37500 | J370: 9
A371: =ROW()-2 -> 369 | B371: TP | C371: 5817 | D371: 1 | E371: 05817-2 | F371: 电子商务 | G371: 李大军 | H371: 37.00 | I371: 37500 | J371: 7
F372: 计算机专业大专系列教材（李大友主编）
A373: =ROW()-2 -> 371 | B373: TP | C373: 3563 | D373: 2 | E373: 03563-6 | F373: 离散数学 | G373: 耿素云等 | H373: 17.00 | I373: 37226 | J373: 13
A374: =ROW()-2 -> 372 | B374: TP | C374: 2548 | D374: 7 | E374: 02548-7 | F374: 计算机组成原理 | G374: 李文兵 | H374: 18.00 | I374: 37408 | J374: 12
A375: =ROW()-2 -> 373 | B375: TP | C375: 2100 | D375: 3 | E375: 02100-7 | F375: 计算机组成原理题解与实验指导 | G375: 李文兵 | H375: 9.00 | I375: 36678 | J375: 25
A376: =ROW()-2 -> 374 | B376: TP | C376: 2341 | D376: 7 | E376: 02341-7 | F376: 数据库原理及应用(FoxBASE) | G376: 王 利等 | H376: 15.00 | I376: 36526 | J376: 12
A377: =ROW()-2 -> 375 | B377: TP | C377: 1139 | D377: 1 | E377: 01139-7 | F377: 数据库原理及应用（第2版）(FoxPro) | G377: 李大友等 | H377: 14.50 | I377: 37469 | J377: 15
A378: =ROW()-2 -> 376 | B378: TP | C378: 2909 | D378: 3 | E378: 02909-1 | F378: 软件工程概论 | G378: 郑人杰等 | H378: 19.80 | I378: 37321 | J378: 10
A379: =ROW()-2 -> 377 | B379: TP | C379: 3103 | D379: 3 | E379: 03103-7 | F379: C 语言程序设计 | G379: 李大友等 | H379: 15.50 | I379: 36951 | J379: 12
A380: =ROW()-2 -> 378 | B380: TP | C380: 2965 | D380: 5 | E380: 02965-2 | F380: 微型计算机接口技术 | G380: 李大友等 | H380: 22.00 | I380: 37329 | J380: 8
A381: =ROW()-2 -> 379 | B381: TP | C381: 2923 | D381: 4 | E381: 02923-7 | F381: 大专教材 微型计算机原理 | G381: 李大友等 | H381: 21.00 | I381: 37500 | J381: 10
A382: =ROW()-2 -> 380 | B382: TP | C382: 2587 | D382: 4 | E382: 02587-8 | F382: 数字电路逻辑设计 | G382: 严化南等 | H382: 20.00 | I382: 37196 | J382: 10
A383: =ROW()-2 -> 381 | B383: TP | C383: 3084 | D383: 5 | E383: 03084-7 | F383: 计算机网络 | G383: 李大友主编 | H383: 12.00 | I383: 37377 | J383: 18
F384: 21世纪中等职业技术教育计算机系列教材
A385: =ROW()-2 -> 383 | B385: TP | C385: 5226 | D385: 1 | E385: 05226-3 | F385: Word 2000、Excel 2000与上机指导 | G385: 韩祖德等 | H385: 24.00 | I385: 37370 | J385: 9
A386: =ROW()-2 -> 384 | B386: TP | C386: 5294 | D386: 1 | E386: 05294-8 | F386: 多媒体应用软件的设计与制作 | G386: 谢宝荣 | H386: 23.00 | I386: 37408 | J386: 9
A387: =ROW()-2 -> 385 | B387: TP | C387: 5586 | D387: 1 | E387: 05586-6 | F387: Visual Basic 6.0程序设计与上机指导 | G387: 冯 昊 | H387: 26.00 | I387: 37500 | J387: 10
F388: 中等职业技术教育计算机教材
A389: =ROW()-2 -> 387 | B389: TP | C389: 3885 | D389: 1 | E389: 03885-6 | F389: 微型计算机的结构、维护与实习指导 | G389: 戚文正 | H389: 24.00 | I389: 37104 | J389: 10
A390: =ROW()-2 -> 388 | B390: TP | C390: 4172 | D390: 1 | E390: 04172-5 | F390: 微型计算机原理及应用 | G390: 史建华等 | H390: 28.00 | I390: 37012 | J390: 9
A391: =ROW()-2 -> 389 | B391: TP | C391: 2980 | D391: 6 | E391: 02980-6 | F391: FoxBASE+与上机指导 | G391: 吴清萍等 | H391: 20.00 | I391: 37165 | J391: 11
A392: =ROW()-2 -> 390 | B392: TP | C392: 3600 | D392: 2 | E392: 03600-4 | F392: VB5.0/6.0 中文版程序设计与上机指导 | G392: 冯 昊 | H392: 24.00 | I392: 37408 | J392: 10
A393: =ROW()-2 -> 391 | B393: TP | C393: 3651 | D393: 2 | E393: 03651-9 | F393: Visual FoxPro 5.0 中文版与上机指导 | G393: 韩立凡等 | H393: 26.00 | I393: 36892 | J393: 9
A394: =ROW()-2 -> 392 | B394: TP | C394: 3590 | D394: 2 | E394: 03590-3 | F394: C 语言程序设计与上机指导 | G394: 吕凤翥 | H394: 21.00 | I394: 36708 | J394: 11
A395: =ROW()-2 -> 393 | B395: TP | C395: 2403 | D395: 6 | E395: 02403-0 | F395: 计算机基础知识与上机指导 | G395: 吴清萍等 | H395: 14.00 | I395: 36739 | J395: 14
A396: =ROW()-2 -> 394 | B396: TP | C396: 2417 | D396: 8 | E396: 02417-0 | F396: 计算机字表处理与上机指导 | G396: 韩祖德等 | H396: 15.00 | I396: 37043 | J396: 12
A397: =ROW()-2 -> 395 | B397: TP | C397: 3632 | D397: 2 | E397: 03632-2 | F397: 计算机网络应用基础 (NetWare 与 Windows NT) | G397: 吴清萍等 | H397: 14.00 | I397: 36708 | J397: 15
A398: =ROW()-2 -> 396 | B398: TP | C398: 3609 | D398: 2 | E398: 03609-8 | F398: Internet 与上网操作 | G398: 毛汉书 | H398: 11.50 | I398: 37104 | J398: 18
A399: =ROW()-2 -> 397 | B399: TP | C399: 5055 | D399: 1 | E399: 05055-4 | F399: 计算机图像处理与应用――Photoshop 6.0 | G399: 董鲁平 | H399: 16.00 | I399: 37469 | J399: 12
A400: =ROW()-2 -> 398 | B400: TP | C400: 3888 | D400: 1 | E400: 03888-0 | F400: 网页设计与制作 | G400: 宋 琳 等 | H400: 16.00 | I400: 37469 | J400: 15
A401: =ROW()-2 -> 399 | B401: TP | C401: 3481 | D401: 1 | E401: 03481-8 | F401: 计算机字表图处理与上机指导 (Windows 9X环境) | G401: 韩祖德等 | H401: 23.00 | I401: 37104 | J401: 10
A402: =ROW()-2 -> 400 | B402: TP | C402: 4083 | D402: 1 | E402: 04083-4 | F402: 计算机英语 | G402: 曾 江 等 | H402: 21.00 | I402: 37257 | J402: 12
A403: =ROW()-2 -> 401 | B403: TP | C403: 4063 | D403: 1 | E403: 04063-X | F403: 计算机辅助制图与上机指导 | G403: 童 迪 | H403: 22.00 | I403: 36892 | J403: 12
E404: 2.中小学教材（教辅、教参、教师培训）与科普
F405: 信息技术教材
F406: （北京市计算机教育研究会组编）
A407: =ROW()-2 -> 405 | B407: TT | C407: 5134 | D407: 4 | E407: 05134-6 | F407: 信息技术（小学版 第1册）（彩色版） | G407: 教育研究会 | H407: 11.8 | I407: 37438 | J407: 30
A408: =ROW()-2 -> 406 | B408: TT | C408: 5134 | D408: 3 | E408: 7801551346 | F408: 信息技术（小学版 第1册）（黑白版） | G408: 教育研究会 | H408: 6.8 | I408: 37500 | J408: 30
A409: =ROW()-2 -> 407 | B409: TT | C409: 5134 | D409: 4 | E409: 05134-6 | F409: 信息技术（小学版 第2册）（彩色版） | G409: 教育研究会 | H409: 11.8 | I409: 37408 | J409: 30
A410: =ROW()-2 -> 408 | B410: TT | C410: 5134 | D410: 2 | E410: 7801551354 | F410: 信息技术（小学版 第2册）（黑白版） | G410: 教育研究会 | H410: 6.8 | I410: 37500 | J410: 30
A411: =ROW()-2 -> 409 | B411: TP | C411: 4606 | D411: 1 | E411: 04606-9 | F411: 信息技术（小学版 第1册、第2册）教学参考书 | G411: 教育研究会 | H411: 12 | I411: 37408 | J411: 25
A412: =ROW()-2 -> 410 | B412: TP | C412: 5197 | D412: 2 | E412: 05197-6 | F412: 信息技术（小学版 第3册）――综合实践（黑白版） | G412: 教育研究会 | H412: 9.80 | I412: 37500 | J412: 25
A413: =ROW()-2 -> 411 | B413: TP | C413: 5198 | D413: 1 | E413: 05198-4 | F413: 信息技术（小学版 第3册）――综合实践（彩色版） | G413: 教育研究会 | H413: 12.80 | I413: 37342 | J413: 20
A414: =ROW()-2 -> 412 | B414: TP | C414: 5199 | D414: 1 | E414: 05199-2 | F414: 信息技术（小学版 第4册）――LOGO（黑白版） | G414: 教育研究会 | H414: 9.80 | I414: 37500 | J414: 25
A415: =ROW()-2 -> 413 | B415: TP | C415: 5200 | D415: 1 | E415: 05200-X | F415: 信息技术（小学版 第4册）――LOGO（彩色版） | G415: 教育研究会 | H415: 9.80 | I415: 37408 | J415: 20
A416: =ROW()-2 -> 414 | B416: TP | C416: 5311 | D416: 3 | E416: 05311-1 | F416: 信息技术（中学版 第1册）（黑白版） | G416: 教育研究会 | H416: 9.8 | I416: 37408 | J416: 22
A417: =ROW()-2 -> 415 | B417: TP | C417: 3975 | D417: 1 | E417: 03975-5 | F417: 信息技术（中学版 第1册）（彩色版） | G417: 教育研究会 | H417: 14.8 | I417: 37408 | J417: 20
A418: =ROW()-2 -> 416 | B418: TP | C418: 5312 | D418: 3 | E418: 05312-X | F418: 信息技术（中学版 第2册）（黑白版） | G418: 教育研究会 | H418: 9.8 | I418: 37408 | J418: 22
A419: =ROW()-2 -> 417 | B419: TP | C419: 4024 | D419: 2 | E419: 04024-9 | F419: 信息技术（中学版 第2册）（彩色版） | G419: 教育研究会 | H419: 14.8 | I419: 37408 | J419: 20
A420: =ROW()-2 -> 418 | B420: TP | C420: 4633 | D420: 1 | E420: 04633-6 | F420: 信息技术（中学版第1册、第2册）教学参考书 | G420: 教育研究会 | H420: 12 | I420: 37408 | J420: 23
A421: =ROW()-2 -> 419 | B421: TP | C421: 5201 | D421: 1 | E421: 05201-8 | F421: 信息技术（中学版 第3册）――综合实践（黑白版） | G421: 教育研究会 | H421: 9.80 | I421: 37408 | J421: 25
A422: =ROW()-2 -> 420 | B422: TP | C422: 5202 | D422: 1 | E422: 05202-6 | F422: 信息技术（中学版 第3册）――综合实践（彩色版） | G422: 教育研究会 | H422: 12.80 | I422: 37469 | J422: 20
A423: =ROW()-2 -> 421 | B423: TP | C423: 5203 | D423: 1 | E423: 05203-4 | F423: 信息技术（中学版 第4册）――QBASIC（黑白版） | G423: 教育研究会 | H423: 9.80 | I423: 37288 | J423: 25
A424: =ROW()-2 -> 422 | B424: TP | C424: 5204 | D424: 1 | E424: 05204-2 | F424: 信息技术（中学版 第4册）――QBASIC（彩色版） | G424: 教育研究会 | H424: 12.80 | I424: 37337 | J424: 20
F425: （注：清华大学出版社网站免费提供教学资源，浏览方法见教材前言）
F426: 中小学信息技术教材
A427: （谭浩强教授 主编，全日制普通高级中学教科书，经全国中小学教材审定委员会2002年审查通过）
A428: =ROW()-2 -> 426 | B428: TP | C428: 3993 | D428: 1 | E428: 03993-3 | F428: 高中信息技术（第一册） 第2版 | G428: 谭浩强 | H428: 17.9 | I428: 37469 | J428: 11
A429: =ROW()-2 -> 427 | B429: TP | C429: 4279 | D429: 1 | E429: 04279-9 | F429: 高中信息技术（第二册） 第2版 | G429: 谭浩强 | H429: 18.9 | I429: 37469 | J429: 10
A430: =ROW()-2 -> 428 | B430: TP | C430: 4441 | D430: 1 | E430: 04441-4 | F430: 初中信息技术（第一册） 第2版 | G430: 谭浩强 | H430: 12.9 | I430: 37469 | J430: 17
A431: =ROW()-2 -> 429 | B431: TP | C431: 4442 | D431: 2 | E431: 04442-2 | F431: 初中信息技术（第二册） 第2版 | G431: 谭浩强 | H431: 11.9 | I431: 37500 | J431: 17
A432: =ROW()-2 -> 430 | B432: TP | C432: 4753 | D432: 1 | E432: 04753-7 | F432: 小学信息技术（第一册）（黑白版）含光盘 | G432: 谭浩强 | H432: 10.5 | I432: 37377 | J432: 25
A433: =ROW()-2 -> 431 | B433: TP | C433: 4754 | D433: 1 | E433: 04754-5 | F433: 小学信息技术（第二册）（黑白版） | G433: 谭浩强 | H433: 5.5 | I433: 37377 | J433: 35
A434: =ROW()-2 -> 432 | B434: TP | C434: 4751 | D434: 1 | E434: 04751-0 | F434: 小学信息技术（第一册）（彩色版）含光盘 | G434: 谭浩强 | H434: 14 | I434: 37377 | J434: 24
A435: =ROW()-2 -> 433 | B435: TP | C435: 4752 | D435: 1 | E435: 04752-9 | F435: 小学信息技术（第二册）（彩色版） | G435: 谭浩强 | H435: 8.5 | I435: 37377 | J435: 30
F436: 中小学主题信息技术课实验教材
F437: （经吉林省中小学教材审定委员会审定）
A438: =ROW()-2 -> 436 | B438: G- | C438: 4250 | D438: 1 | E438: 04250-0 | F438: 高中主题信息技术课本 | G438: 教材编写组 | H438: 10 | I438: 37408 | J438: 16
A439: =ROW()-2 -> 437 | B439: G- | C439: 4248 | D439: 1 | E439: 04248-9 | F439: 小学主题信息技术课本 | G439: 教材编写组 | H439: 10 | I439: 37469 | J439: 15
A440: =ROW()-2 -> 438 | B440: G- | C440: 4249 | D440: 1 | E440: 04249-7 | F440: 初中主题信息技术课本 | G440: 教材编写组 | H440: 10 | I440: 37469 | J440: 14
F441: 中小学信息技术课实验教材
F442: （杨芙清院士主编）
A443: =ROW()-2 -> 441 | B443: G- | C443: 4047 | D443: 3 | E443: 04047-8 | F443: 小学信息技术课实验教材 入门篇 | G443: 杨芙清 | H443: 12 | I443: 37500 | J443: 18
A444: =ROW()-2 -> 442 | B444: G- | C444: 4047 | D444: 1 | E444: 04047-8 | F444: 小学信息技术课实验教材 基础篇 | G444: 杨芙清 | H444: 12.00 | I444: 37469 | J444: 20
A445: =ROW()-2 -> 443 | B445: G- | C445: 4047 | D445: 2 | E445: 04047-8 | F445: 小学信息技术课实验教材 提高篇 | G445: 杨芙清 | H445: 12.00 | I445: 37469 | J445: 17
A446: =ROW()-2 -> 444 | B446: G- | C446: 4103 | D446: 2 | E446: 04103-2 | F446: 初中信息技术课实验教材 初一分册 | G446: 杨芙清 | H446: 12 | I446: 37469 | J446: 20
A447: =ROW()-2 -> 445 | B447: G- | C447: 4103 | D447: 1 | E447: 04103-2 | F447: 初中信息技术课实验教材 初二分册 | G447: 杨芙清 | H447: 12 | I447: 37469 | J447: 20
A448: =ROW()-2 -> 446 | B448: G- | C448: 4104 | D448: 1 | E448: 04103-0 | F448: 高中信息技术课实验教材 高一分册 | G448: 杨芙清 | H448: 16 | I448: 37469 | J448: 12
A449: =ROW()-2 -> 447 | B449: G- | C449: 4104 | D449: 2 | E449: 04104-0 | F449: 高中信息技术 课实验教材高二分册 | G449: 杨芙清 | H449: 16 | I449: 37135 | J449: 14
F450: 中学信息学教材
A451: =ROW()-2 -> 449 | B451: TP | C451: 3604 | D451: 1 | E451: 03604-7 | F451: 中学信息技术(计算机)教程（高中 上） | G451: 吴文虎等 | H451: 16 | I451: 37469 | J451: 12
A452: =ROW()-2 -> 450 | B452: TP | C452: 3607 | D452: 1 | E452: 03607-1 | F452: 中学信息技术(计算机)教程（高中 下） | G452: 吴文虎等 | H452: 16.5 | I452: 37469 | J452: 13
A453: =ROW()-2 -> 451 | B453: TP | C453: 3302 | D453: 2 | E453: 03302-1 | F453: 中学计算机教学法 | G453: 薛维明 | H453: 13.50 | I453: 37012 | J453: 22
F454: 中学信息技术创新丛书
A455: =ROW()-2 -> 453 | B455: TP | C455: 5387 | D455: 1 | E455: 05387-1 | F455: 从数学题解到程序设计 | G455: 薛维明 | H455: 18.00 | I455: 37377 | J455: 12
A456: =ROW()-2 -> 454 | B456: TP | C456: 5138 | D456: 1 | E456: 05138-0 | F456: Powerpoint 演示文稿设计能手 | G456: 薛维明 | H456: 12.00 | I456: 37377 | J456: 18
A457: =ROW()-2 -> 455 | B457: TP | C457: 5315 | D457: 1 | E457: 05315-4 | F457: Word & Excel 文字表格处理小能手 | G457: 薛维明 | H457: 15.00 | I457: 37377 | J457: 12
F458: 中小学信息技术课程范例教与学系列
F459: (全国中小学计算机教育研究中心组编 吴文虎主审)
F460: 小学信息技术课程范例教与学 76元/套
A461: =ROW()-2 -> 459 | B461: TP | C461: 4050 | D461: 1 | E461: 04050-8 | F461: 文字处理小博士（上） | G461: 教研中心 | H461: 10.00 | I461: 36951 | J461: 25
A462: =ROW()-2 -> 460 | B462: TP | C462: 4050 | D462: 3 | E462: 04050-8 | F462: 文字处理小博士（下） | G462: 教研中心 | H462: 12.00 | I462: 36800 | J462: 25
A463: =ROW()-2 -> 461 | B463: TP | C463: 4050 | D463: 2 | E463: 04050-8 | F463: 电脑美术小博士（上）（四色彩印） | G463: 教研中心 | H463: 14.00 | I463: 36982 | J463: 25
A464: =ROW()-2 -> 462 | B464: TP | C464: 4050 | D464: 5 | E464: 04050-8 | F464: 电脑美术小博士（下）（四色彩印） | G464: 教研中心 | H464: 16.00 | I464: 36831 | J464: 20
A465: =ROW()-2 -> 463 | B465: TP | C465: 4050 | D465: 4 | E465: 04050-8 | F465: 网上冲浪小博士 | G465: 教研中心 | H465: 12.00 | I465: 36831 | J465: 20
A466: =ROW()-2 -> 464 | B466: TP | C466: 4050 | D466: 6 | E466: 04050-8 | F466: 多媒体制作小博士 | G466: 教研中心 | H466: 12.00 | I466: 37469 | J466: 20
F467: 初中信息技术课程范例教与学 76元/套
A468: =ROW()-2 -> 466 | B468: TP | C468: 4138 | D468: 5 | E468: 04138-5 | F468: 多媒体制作小 博士 | G468: 教研中心 | H468: 12.00 | I468: 37073 | J468: 20
A469: =ROW()-2 -> 467 | B469: TP | C469: 4138 | D469: 3 | E469: 04138-5 | F469: 电脑美术小博士（四色彩印） | G469: 教研中心 | H469: 16.00 | I469: 37043 | J469: 20
A470: =ROW()-2 -> 468 | B470: TP | C470: 4138 | D470: 4 | E470: 04138-5 | F470: 数据处理小博士 | G470: 教研中心 | H470: 12.00 | I470: 37044 | J470: 20
A471: =ROW()-2 -> 469 | B471: TP | C471: 4138 | D471: 1 | E471: 04138-5 | F471: 文字处理小博士 | G471: 教研 中心 | H471: 12.00 | I471: 36923 | J471: 20
A472: =ROW()-2 -> 470 | B472: TP | C472: 4138 | D472: 2 | E472: 04138-5 | F472: 网上冲浪小博士 | G472: 教研 中心 | H472: 12.00 | I472: 36951 | J472: 20
A473: =ROW()-2 -> 471 | B473: TP | C473: 4138 | D473: 6 | E473: 04138-5 | F473: 视窗操作小博士 | G473: 教研 中心 | H473: 12.00 | I473: 37104 | J473: 21
F474: 高中信息技术课程范例教与学 72元/套
A475: =ROW()-2 -> 473 | B475: TP | C475: 4155 | D475: 1 | E475: 04155-5 | F475: 数据处理小博士 | H475: 12.00 | I475: 36923 | J475: 20
A476: =ROW()-2 -> 474 | B476: TP | C476: 4155 | D476: 2 | E476: 04155-5 | F476: 网上冲浪小博士 | G476: 教研 中心 | H476: 12.00 | I476: 37073 | J476: 20
A477: =ROW()-2 -> 475 | B477: TP | C477: 4155 | D477: 3 | E477: 04155-5 | F477: 多媒体制作小博士 | G477: 教研中心 | H477: 12.00 | I477: 37135 | J477: 20
A478: =ROW()-2 -> 476 | B478: TP | C478: 4155 | D478: 4 | E478: 04155-5 | F478: 程序设计小博士（Visual Basic） | G478: 教研中心 | H478: 12.00 | I478: 37135 | J478: 20
A479: =ROW()-2 -> 477 | B479: TP | C479: 4155 | D479: 5 | E479: 04155-5 | F479: 文字处理小博士 | G479: 教研 中心 | H479: 12.00 | I479: 37165 | J479: 20
A480: =ROW()-2 -> 478 | B480: TP | C480: 4155 | D480: 6 | E480: 04155-5 | F480: 视窗操作小博士 | G480: 教研 中心 | H480: 12.00 | I480: 37196 | J480: 20
F481: 中小学生电脑制作辅导丛书
A482: =ROW()-2 -> 480 | B482: P- | C482: 4311 | D482: 1 | E482: 7900643117 | F482: 电脑绘画－－边学边做 （配光盘） | G482: 方其桂等 | H482: 19 | I482: 37438 | J482: 12
A483: =ROW()-2 -> 481 | B483: P- | C483: 4304 | D483: 1 | E483: 7900643044 | F483: 网页制作－－边学边做 （配光盘） | G483: 方其桂等 | H483: 21 | I483: 37469 | J483: 10
A484: =ROW()-2 -> 482 | B484: P- | C484: 4302 | D484: 1 | E484: 7900643028 | F484: 电子报刊－－边学边做 （配光盘） | G484: 方其桂等 | H484: 20 | I484: 37469 | J484: 10
A485: =ROW()-2 -> 483 | B485: P- | C485: 4303 | D485: 1 | E485: 7900643036 | F485: 程序设计－－边学边做 （配光盘） | G485: 方其桂等 | H485: 24 | I485: 37469 | J485: 10
A486: =ROW()-2 -> 484 | B486: P- | C486: 4301 | D486: 1 | E486: 790064301X | F486: 电脑动画－－边学边做 （配光盘） | G486: 方其桂等 | H486: 27 | I486: 37500 | J486: 8
F487: 信息学奥林匹克竞赛指导丛书
A488: =ROW()-2 -> 486 | B488: TP | C488: 4055 | D488: 1 | E488: 04055-9 | F488: 信息学奥林匹克竞赛指导 ――1997－1998竞赛试题解析 | G488: 吴文虎等 | H488: 26 | I488: 36923 | J488: 8
F489: 北京景山学校信息技术系列教材
A490: =ROW()-2 -> 488 | B490: TP | C490: 3944 | D490: 1 | E490: 03944-5 | F490: 计算机图文处理与上机指导 | G490: 翟冬敏 | H490: 19.50 | I490: 36831 | J490: 15
F491: 全国中小学教师继续教育教材
A492: =ROW()-2 -> 490 | B492: TP | C492: 4563 | D492: 1 | E492: 04563-1 | F492: 中小学教师继续教育信息技术培训实用教材 | G492: 吴文虎 | H492: 14.50 | I492: 37226 | J492: 17
A493: =ROW()-2 -> 491 | B493: P- | C493: 3592 | D493: 1 | E493: 7900635920 | F493: 用几何画板教平面解析几何（配光盘） | G493: 陶维林 | H493: 29.00 | I493: 37500 | J493: 12
A494: =ROW()-2 -> 492 | B494: P- | C494: 3757 | D494: 1 | E494: 7900637575 | F494: 用几何画板教物理（配光盘） | G494: 杨树崤主编 | H494: 32.00 | I494: 37377 | J494: 10
A495: =ROW()-2 -> 493 | B495: P- | C495: 3162 | D495: 1 | E495: 7900631623 | F495: 几何画板实用范例教程 （配光盘） | G495: 陶维林 | H495: 32.50 | I495: 37350 | J495: 11
A496: =ROW()-2 -> 494 | B496: TP | C496: 5310 | D496: 1 | E496: 05310-3 | F496: 几何画板简明教程 | G496: 陶维林 | H496: 10.00 | I496: 37438 | J496: 25
F497: 信息技术培训教材
A498: =ROW()-2 -> 496 | B498: TP | C498: 1387 | D498: 1 | E498: 01387-2 | F498: 基础知识与应用 | G498: 周美瑞等 | H498: 29.00 | I498: 37500 | J498: 11
F499: 多媒体 CAI 课件制作实例教程丛书
A500: =ROW()-2 -> 498 | B500: P- | C500: 3582 | D500: 1 | E500: 7900635823 | F500: Authorware 多媒体 CAI 课件制作实例教程（配光盘） | G500: 方其桂等 | H500: 38.00 | I500: 37377 | J500: 8
A501: =ROW()-2 -> 499 | B501: P- | C501: 3775 | D501: 1 | E501: 7900637753 | F501: Flash多媒体CAI课件制作实例教程（配光盘） | G501: 王玉华等 | H501: 28 | I501: 37469 | J501: 10
A502: =ROW()-2 -> 500 | B502: P- | C502: 3714 | D502: 1 | E502: 7900637141 | F502: 几何画板多媒体CAI课件制作实例教程（配光盘） | G502: 张杏林等 | H502: 19.00 | I502: 37377 | J502: 16
A503: =ROW()-2 -> 501 | B503: P- | C503: 3766 | D503: 1 | E503: 7900637664 | F503: FrontPage 多媒体CAI课件制作实例教程（配光盘） | G503: 方其桂等 | H503: 28.00 | I503: 37288 | J503: 12
A504: =ROW()-2 -> 502 | B504: P- | C504: 3773 | D504: 1 | E504: 7900637737 | F504: PowerPoint 多媒体CAI课件制作实例教程（配光盘） | G504: 于继成等 | H504: 29.00 | I504: 37469 | J504: 10
A505: 中小学课程网络资源索引
A506: =ROW()-2 -> 504 | B506: TP | C506: 1171 | D506: 1 | E506: 01171-0 | F506: 语文英语分册 | G506: 乌美娜 | H506: 9.00 | I506: 37356 | J506: 30
A507: =ROW()-2 -> 505 | B507: TP | C507: 1269 | D507: 1 | E507: 012691-5 | F507: 信息技术分册 | G507: 乌美娜 | H507: 7.00 | I507: 37356 | J507: 45
A508: =ROW()-2 -> 506 | B508: TP | C508: 1148 | D508: 1 | E508: 01148-6 | F508: 历史地理分册 | G508: 乌美娜 | H508: 13.00 | I508: 37356 | J508: 22
A509: =ROW()-2 -> 507 | B509: TP | C509: 1214 | D509: 1 | E509: 01214-8 | F509: 物理化学分册 | G509: 乌美娜 | H509: 13.00 | I509: 37356 | J509: 22
A510: =ROW()-2 -> 508 | B510: TP | C510: 1156 | D510: 1 | E510: 01156-7 | F510: 数学分册 | G510: 乌美娜 | H510: 8.00 | I510: 37356 | J510: 40
F511: “计算机科学技术创新”科普教育丛书
A512: =ROW()-2 -> 510 | B512: TP | C512: 4410 | D512: 1 | E512: 04410-4 | F512: 网络啊，网络！ | G512: 俞嘉惠 | H512: 18.00 | I512: 37104 | J512: 12
A513: =ROW()-2 -> 511 | B513: TP | C513: 4386 | D513: 1 | E513: 04386-8 | F513: 谁使唤谁――漫谈人机界面 | G513: 刘晋 等 | H513: 14.80 | I513: 37135 | J513: 15
A514: =ROW()-2 -> 512 | B514: TP | C514: 4817 | D514: 1 | E514: 04817-7 | F514: 漫谈电脑“管家”――操作系统的发展与创新 | G514: 袁 捷 | H514: 19.00 | I514: 37196 | J514: 13
A515: =ROW()-2 -> 513 | B515: TP | C515: 4538 | D515: 1 | E515: 04538-0 | F515: 计算机的灵魂程序 | G515: 缪淮扣 | H515: 15.00 | I515: 37196 | J515: 14
A516: =ROW()-2 -> 514 | B516: TP | C516: 4683 | D516: 1 | E516: 04683-2 | F516: 撩开计算机的面纱 | G516: 张世正等 | H516: 9.80 | I516: 37165 | J516: 20
A517: =ROW()-2 -> 515 | B517: TP | C517: 4684 | D517: 1 | E517: 04684-0 | F517: 生活于数字化之中 | G517: 周卓伦 | H517: 11.00 | I517: 37165 | J517: 21
A518: =ROW()-2 -> 516 | B518: TP | C518: 4525 | D518: 1 | E518: 04525-9 | F518: 计算机科学技术创新传奇 | G518: 陈海洋等 | H518: 14.00 | I518: 37135 | J518: 18
F519: 计算机与信息科学十万个为什么（普及版）
A520: =ROW()-2 -> 518 | B520: TP | C520: 4646 | D520: 1 | E520: 04646-8 | F520: 从烽火台到因特网 | G520: 俞嘉惠 | H520: 21.00 | I520: 37196 | J520: 10
A521: =ROW()-2 -> 519 | B521: TP | C521: 4822 | D521: 1 | E521: 04822-3 | F521: 神奇的计算机 | G521: 郁宝忠等 | H521: 18.00 | I521: 37196 | J521: 12
A522: =ROW()-2 -> 520 | B522: TP | C522: 4821 | D522: 1 | E522: 04821-5 | F522: 奥妙的多媒体世界 | G522: 朱亦梅 | H522: 23.00 | I522: 37257 | J522: 10
A523: =ROW()-2 -> 521 | B523: TP | C523: 5286 | D523: 1 | E523: 05286-7 | F523: 高超的计算机辅助技术 | G523: 李启炎等 | H523: 16.00 | I523: 37347 | J523: 12
F524: 新编计算机与信息科学十万个为什么
A525: =ROW()-2 -> 523 | B525: TP | C525: 3931 | D525: 1 | E525: 03931-3 | F525: 新编计算机与信息科学十万个为什么（套） | G525: 丛书编委会 | H525: 200.00 | I525: 36831 | J525: 1
A526: 青少年科学教育丛书――信息科学与技术系列（李衍达主编）
A527: =ROW()-2 -> 525 | B527: TP | C527: 4354 | D527: 1 | E527: 04354-X | F527: 信息时代我们将怎样生活 | G527: 阎平凡 | H527: 10.00 | I527: 37073 | J527: 27
A528: =ROW()-2 -> 526 | B528: TP | C528: 4082 | D528: 1 | E528: 04082-6 | F528: 人类智慧与人工智能 | G528: 林尧瑞等 | H528: 10.00 | I528: 36951 | J528: 25
A529: =ROW()-2 -> 527 | B529: TP | C529: 3855 | D529: 1 | E529: 03855-4 | F529: 电话百年变奏曲 | G529: 乐正友 | H529: 10.00 | I529: 36647 | J529: 30
A530: =ROW()-2 -> 528 | B530: TP | C530: 3782 | D530: 2 | E530: 03782-5 | F530: 漫谈我们身边的自动化 | G530: 王家桢 | H530: 10.00 | I530: 36739 | J530: 25
A531: =ROW()-2 -> 529 | B531: TP | C531: 3994 | D531: 1 | E531: 03994-1 | F531: 走进网络世界 | G531: 张尧学等 | H531: 10.00 | I531: 36739 | J531: 25
A532: =ROW()-2 -> 530 | B532: TP | C532: 5210 | D532: 1 | E532: 05210-7 | F532: 精彩的多媒体世界 | G532: 钟玉琢等 | H532: 10.00 | I532: 37404 | J532: 25
F533: 3.考试与认证
F534: 全国计算机应用技术证书考试 (NIT)用书
A535: =ROW()-2 -> 533 | B535: TP | C535: 3413 | D535: 2 | E535: 03413-3 | F535: 文字处理(WPS 97) 教程 | G535: 教育部 考试中心 | H535: 19.00 | I535: 36739 | J535: 14
A536: =ROW()-2 -> 534 | B536: TP | C536: 3411 | D536: 4 | E536: 03411-7 | F536: 文字处理(Word 97)教程 | G536: 教育部考试中心 | H536: 20.00 | I536: 37469 | J536: 12
A537: =ROW()-2 -> 535 | B537: TP | C537: 2181 | D537: 1 | E537: 02181-3 | F537: 电子表格（Excel 97）教程 | G537: 教育部考试中心 | H537: 22.50 | I537: 37438 | J537: 12
A538: =ROW()-2 -> 536 | B538: TP | C538: 2146 | D538: 1 | E538: 02146-5 | F538: 程序设计（C 语言）教程 | G538: 教育部考试中心 | H538: 19.00 | I538: 37396 | J538: 15
A539: =ROW()-2 -> 537 | B539: TP | C539: 3853 | D539: 1 | E539: 03853-8 | F539: 程序设计（QBASIC语言）教程 | G539: 教育部 考试中心 | H539: 21.50 | I539: 37135 | J539: 12
A540: =ROW()-2 -> 538 | B540: TP | C540: 3412 | D540: 4 | E540: 03412-5 | F540: 因特网 (Internet) 教程 | G540: 教育部考试中心 | H540: 17.00 | I540: 37377 | J540: 15
A541: =ROW()-2 -> 539 | B541: TP | C541: 3412 | D541: 3 | E541: 03412-5 | F541: 因特网 (Internet) 教程（配光盘） | G541: 教育部 考试中心 | H541: 32.00 | I541: 37257 | J541: 15
A542: =ROW()-2 -> 540 | B542: TP | C542: 4054 | D542: 1 | E542: 04054-0 | F542: 局域网（Windows 2000 Server) 教程 | G542: 教育部 考试中心 | H542: 19.50 | I542: 37288 | J542: 14
A543: =ROW()-2 -> 541 | B543: TP | C543: 3466 | D543: 4 | E543: 03466-4 | F543: 计算机操作基础 (Windows 95环境)教程 | G543: 教育部 考试中心 | H543: 14.50 | I543: 37438 | J543: 16
A544: =ROW()-2 -> 542 | B544: TP | C544: 3466 | D544: 3 | E544: 03466-4 | F544: 计算机操作基础 (Windows 95环境)教程（配光盘） | G544: 教育部 考试中心 | H544: 29.50 | I544: 37500 | J544: 16
A545: =ROW()-2 -> 543 | B545: TP | C545: 3414 | D545: 2 | E545: 03414-1 | F545: 会计电算化教程 | G545: 教育部 考试中心 | H545: 15.00 | I545: 37104 | J545: 20
A546: =ROW()-2 -> 544 | B546: TP | C546: 5247 | D546: 1 | E546: 05247-6 | F546: 会计电算化教程（第二版） | G546: 教育部 考试中心 | H546: 21.00 | I546: 37469 | J546: 13
A547: =ROW()-2 -> 545 | B547: TP | C547: 3831 | D547: 1 | E547: 03831-7 | F547: 计算机绘图（AutoCAD R14中文版）教程 | G547: 教育部 考试中心 | H547: 19.80 | I547: 37408 | J547: 12
A548: =ROW()-2 -> 546 | B548: TP | C548: 4269 | D548: 1 | E548: 04269-1 | F548: 计算机绘图（CAXA 电子图板2000）教程 | G548: 教育部 考试中心 | H548: 19.00 | I548: 37321 | J548: 12
A549: =ROW()-2 -> 547 | B549: TP | C549: 4824 | D549: 1 | E549: 04824-X | F549: 图象处理（Photoshop 5.0 中文版）教程 | G549: 教育部 考试中心 | H549: 33.00 | I549: 37226 | J549: 7
A550: =ROW()-2 -> 548 | B550: TP | C550: 3870 | D550: 1 | E550: 03870-8 | F550: 多媒体演示文稿（PowerPoint 97) 教程 | G550: 教育部 考试中心 | H550: 15.00 | I550: 37469 | J550: 16
A551: =ROW()-2 -> 549 | B551: TP | C551: 4109 | D551: 1 | E551: 04109-1 | F551: 数据库（Access 2000 )教程（配软盘） | G551: 教育部 考试中心 | H551: 36.00 | I551: 37469 | J551: 8
A552: =ROW()-2 -> 550 | B552: TP | C552: 3475 | D552: 3 | E552: 03475-3 | F552: 数据库（FoxPro for Windows)教程 | G552: 教育部 考试中心 | H552: 19.00 | I552: 37469 | J552: 14
A553: =ROW()-2 -> 551 | B553: TP | C553: 4099 | D553: 1 | E553: 04099-0 | F553: 局域网（NetWare 5) 教程 | G553: 教育部 考试中心 | H553: 17.50 | I553: 36892 | J553: 15
A554: =ROW()-2 -> 552 | B554: P- | C554: 4160 | D554: 1 | E554: 04160-1 | F554: Linux操作基础及桌面应用（红旗Linux桌面环境）教程（配光盘） | G554: 教育部 考试中心 | H554: 20.00 | I554: 37354 | J554: 15
F555: 全国高等教育自学考试
F556: 自学指导丛书
F557: 计算机信息管理专业专科
A558: =ROW()-2 -> 556 | B558: TP | C558: 0660 | D558: 1 | E558: 00660-1 | F558: 计算机原理自学考试指导 | G558: 教育中心 | H558: 16.00 | I558: 37196 | J558: 15
A559: =ROW()-2 -> 557 | B559: TP | C559: 5568 | D559: 1 | E559: 05568-1 | F559: 数据库原理自学考试指导 | G559: 教育中心 | H559: 18.50 | I559: 37408 | J559: 15
A560: =ROW()-2 -> 558 | B560: TP 5567 1 | E560: 05567-1 | F560: 高级语言程序设计自学考试指导 | G560: 教育中心 | H560: 26.00 | I560: 37408 | J560: 10
A561: =ROW()-2 -> 559 | B561: TP | C561: 1668 | D561: 2 | E561: 01668-2 | F561: 计算机应用技术自学考试指导 | G561: 教育中心 | H561: 15.00 | I561: 37327 | J561: 18
A562: =ROW()-2 -> 560 | B562: TP | C562: 0737 | D562: 1 | E562: 00737-3 | F562: 办公自动化原理及应用自学考试指导 | G562: 教育中心 | H562: 17.00 | I562: 37335 | J562: 18
A563: =ROW()-2 -> 561 | B563: TP | C563: 4258 | D563: 2 | E563: 04258-6 | F563: 数据库及其应用自学考试指导 | G563: 张国鸣等 | H563: 16.00 | I563: 37408 | J563: 16
A564: =ROW()-2 -> 562 | B564: TP | C564: 1393 | D564: 2 | E564: 01393-4 | F564: 管理信息系统自学考试指导 | G564: 盛定宇等 | H564: 15.00 | I564: 37257 | J564: 18
A565: =ROW()-2 -> 563 | B565: TP | C565: 4863 | D565: 1 | E565: 04863-0 | F565: 计算机信息管理专业（专科）实践环节指导 | G565: 教育中心 | H565: 20.00 | I565: 37377 | J565: 14
F566: 计算机信息管理专业本科
A567: =ROW()-2 -> 565 | B567: TP | C567: 3568 | D567: 1 | E567: 03568-7 | F567: 运筹学基础自学考试指导 | G567: 教育中心 | H567: 15.00 | I567: 37012 | J567: 17
A568: =ROW()-2 -> 566 | B568: TP | C568: 4094 | D568: 1 | E568: 04094-X | F568: 操作系统自学考试指导 | G568: 教育中心 | H568: 16 | I568: 36982 | J568: 18
A569: =ROW()-2 -> 567 | B569: TP | C569: 4260 | D569: 1 | E569: 04260-8 | F569: 数据结构自学考试指导 | G569: 丁宝康 | H569: 23 | I569: 37012 | J569: 12
A570: =ROW()-2 -> 568 | B570: TP | C570: 1382 | D570: 2 | E570: 01382-9 | F570: 软件开发工具自学考试指导 | G570: 方美琪等 | H570: 15.00 | I570: 37012 | J570: 18
A571: =ROW()-2 -> 569 | B571: TP | C571: 4418 | D571: 1 | E571: 04418-X | F571: 信息系统开发自学考试指导 | G571: 王守茂 | H571: 25 | I571: 37012 | J571: 12
A572: =ROW()-2 -> 570 | B572: TP | C572: 4704 | D572: 1 | E572: 04704-9 | F572: 计算机网络技术自学考试指导 | G572: 王兵 等 | H572: 21.00 | I572: 37226 | J572: 13
A573: =ROW()-2 -> 571 | B573: TP | C573: 5194 | D573: 1 | E573: 05194-1 | F573: 信息资源管理自学考试指导 | G573: 方锦城 | H573: 10.00 | I573: 37327 | J573: 25
A574: =ROW()-2 -> 572 | B574: TP | C574: 5240 | D574: 1 | E574: 05240-9 | F574: 组织与管理概论自学考试指导 | G574: 陈坚 等 | H574: 15.00 | I574: 37288 | J574: 20
A575: =ROW()-2 -> 573 | B575: TP | C575: 5252 | D575: 1 | E575: 05252-2 | F575: 数据通信原理自学考试指导 | G575: 倪维贞等 | H575: 21.00 | I575: 37327 | J575: 12
A576: =ROW()-2 -> 574 | B576: TP | C576: 4272 | D576: 1 | E576: 04272-1 | F576: 计算机信息管理专业（本科）实践环节指导 | G576: 教育中心 | H576: 26.00 | I576: 37165 | J576: 12
A577: =ROW()-2 -> 575 | B577: TP | C577: 4859 | D577: 1 | E577: 04859-2 | F577: 计算机信息管理专业（本科）毕业设计案例 摘选 | G577: 侯炳辉等 | H577: 23.00 | I577: 37196 | J577: 12
F578: 计算机网络专业本科
A579: =ROW()-2 -> 577 | B579: TP | C579: 1477 | D579: 2 | E579: 01477-9 | F579: 数据库技术自学考试指导 | G579: 丁宝康等 | H579: 19.00 | I579: 37328 | J579: 14
A580: =ROW()-2 -> 578 | B580: TP | C580: 3925 | D580: 1 | E580: 03925-9 | F580: 计算机网络基本原理自学考试指导 | G580: 教育中心 | H580: 22.00 | I580: 37043 | J580: 12
A581: =ROW()-2 -> 579 | B581: TP | C581: 0688 | D581: 1 | E581: 00688-1 | F581: 网络操作系统自学考试指导 | G581: 教育中心 | H581: 20.00 | I581: 37104 | J581: 13
A582: =ROW()-2 -> 580 | B582: TP | C582: 4134 | D582: 1 | E582: 04134-2 | F582: 互联网及其应用自学考试指导 | G582: 教育中心 | H582: 25.00 | I582: 36982 | J582: 12
A583: =ROW()-2 -> 581 | B583: TP | C583: 4181 | D583: 1 | E583: 04181-4 | F583: 局域网技术与组网工程自学考试指导 | G583: 张公忠 | H583: 22.00 | I583: 36982 | J583: 12
A584: =ROW()-2 -> 582 | B584: TP | C584: 4181 | D584: 2 | E584: 04181-4 | F584: 局域网技术与组网工程自学考试指导（修订） | G584: 张公忠 | H584: 27.00 | I584: 37469 | J584: 10
F585: 模拟试题
A586: =ROW()-2 -> 584 | B586: G- | C586: 3937 | D586: 1 | E586: 03937-2 | F586: 法律基础与思想道德修养模拟试题 | G586: 李卫红等 | H586: 12.8 | I586: 36708 | J586: 28
A587: =ROW()-2 -> 585 | B587: G- | C587: 3939 | D587: 1 | E587: 03939-9 | F587: 毛泽东思想概论模拟试题 | G587: 陈道华等 | H587: 16.00 | I587: 36739 | J587: 25
A588: =ROW()-2 -> 586 | B588: G- | C588: 3938 | D588: 1 | E588: 03938-0 | F588: 邓小平理论概论模拟试题 | G588: 闫志民等 | H588: 16 | I588: 36739 | J588: 15
A589: =ROW()-2 -> 587 | B589: G- | C589: 3935 | D589: 1 | E589: 03935-6 | F589: 马克思主义哲学原理模拟试题 | G589: 李卫红 | H589: 16.00 | I589: 36708 | J589: 22
A590: =ROW()-2 -> 588 | B590: G- | C590: 3936 | D590: 1 | E590: 03936-4 | F590: 马克思主义政治经济学原理模拟试题 | G590: 李红薇 | H590: 18 | I590: 36739 | J590: 15
F591: 高等教育自学考试计算机及应用专业（专科）自学辅导丛书
A592: =ROW()-2 -> 590 | B592: TP | C592: 5598 | D592: 1 | E592: 05598-X | F592: 数据结构导论自学考试指导 | G592: 徐孝凯 | H592: 22.00 | I592: 37408 | J592: 13
A593: =ROW()-2 -> 591 | B593: TP | C593: 5771 | D593: 1 | E593: 05771-0 | F593: 微型计算机及其接口技术自学考试指导 | G593: 王亚明 | H593: 30.00 | I593: 37469 | J593: 10
A594: =ROW()-2 -> 592 | B594: TP | C594: 5662 | D594: 1 | E594: 05662-5 | F594: 汇编语言程序设计自学考试指导 | G594: 丁凤刚 | H594: 18.00 | I594: 37469 | J594: 15
F595: 计算机及应用专业（独立本科段）自学辅导丛书
A596: =ROW()-2 -> 594 | B596: TP | C596: 4668 | D596: 1 | E596: 04668-9 | F596: 面向对象程序设计自学辅导（配软盘） | G596: 刘振安 | H596: 25.00 | I596: 37104 | J596: 12
F597: 计算机软件专业技术资格和水平考试指定用书
A598: =ROW()-2 -> 596 | B598: TP | C598: 5380 | D598: 1 | E598: 05380-4 | F598: 2002 年度中国计算机软件专业技术资格和水平考试大纲 | G598: 信息产业部软考办 | H598: 5 | I598: 37408 | J598: 55
A599: =ROW()-2 -> 597 | B599: TP | C599: 4395 | D599: 1 | E599: 04395-7 | F599: 初级程序员教程 | G599: 刘英 等 | H599: 29.8 | I599: 37469 | J599: 9
A600: =ROW()-2 -> 598 | B600: TP | C600: 4371 | D600: 1 | E600: 04371-X | F600: 程序员教程 | G600: 王春森 | H600: 38 | I600: 37377 | J600: 7
A601: =ROW()-2 -> 599 | B601: TP | C601: 4409 | D601: 1 | E601: 04409-0 | F601: 系统设计师（高级程序员）教程 | G601: 王春森 | H601: 49 | I601: 37104 | J601: 6
A602: =ROW()-2 -> 600 | B602: TP | C602: 4310 | D602: 1 | E602: 04310-8 | F602: 网络程序员教程 | G602: 胡道元 | H602: 29.8 | I602: 37104 | J602: 10
A603: =ROW()-2 -> 601 | B603: TP | C603: 4306 | D603: 1 | E603: 04306-X | F603: 网络设计师教程 | G603: 胡道元 | H603: 48 | I603: 37043 | J603: 7
A604: =ROW()-2 -> 602 | B604: TP | C604: 5379 | D604: 1 | E604: 05379-1 | F604: 1999-2001年度初级程序员级试题分析与解答 | G604: 信息产业部软考办 | H604: 11 | I604: 37377 | J604: 25
A605: =ROW()-2 -> 603 | B605: TP | C605: 5401 | D605: 1 | E605: 05401-1 | F605: 1999～2001程序员级试题分析与解答 | G605: 信息产业部软考办 | H605: 11.5 | I605: 37377 | J605: 25
A606: =ROW()-2 -> 604 | B606: TP 5509 1 | D606: 1 | E606: 05509-2 | F606: 1999-2001年度系统分析员级试题分析与解答 | G606: 信息产业部软考办 | H606: 20 | I606: 37469 | J606: 15
A607: =ROW()-2 -> 605 | B607: TP | C607: 5432 | D607: 1 | E607: 05432-1 | F607: 2001年度网络程序员级和网络设计师级试题分析与解答 | G607: 信息产业部软考办 | H607: 13 | I607: 37377 | J607: 20
A608: =ROW()-2 -> 606 | B608: TP | C608: 4322 | D608: 1 | E608: 04322-1 | F608: 1999～2000 年度中国计算机软件专业技术资格和水平考试题集 | G608: 胡道元 | H608: 18 | I608: 37104 | J608: 16
A609: =ROW()-2 -> 607 | B609: TP | C609: 5400 | D609: 1 | E609: 05400-2 | F609: 1999-2001年度系统设计师（高级程序员）级试题分析与解答 | G609: 信息产业部软考办 | H609: 13 | I609: 37377 | J609: 20
E610: 计算机软件专业技术资格和水平考试辅导用书
A611: =ROW()-2 -> 609 | B611: TP | C611: 4652 | D611: 1 | E611: 04652-2 | F611: 网络程序员教程同步辅导 | G611: 郭学理 | H611: 26.00 | I611: 37438 | J611: 10
A612: =ROW()-2 -> 610 | B612: TP | C612: 5494 | D612: 1 | E612: 05494-1 | F612: 程序员教程同步辅导 | G612: 谢树煜主编 | H612: 39.00 | I612: 37438 | J612: 7
A613: =ROW()-2 -> 611 | B613: TP 5500 1 | E613: 05500-6 | F613: 系统设计师（高级程序员）教程 | G613: 谢树煜主编 | H613: 46.00 | I613: 37408 | J613: 6
A614: =ROW()-2 -> 612 | B614: TP 5351 1 | E614: 05351-1 | F614: 初级程序员教程同步辅导 | G614: 沈林兴主编 | H614: 23.00 | I614: 37408 | J614: 12
A615: =ROW()-2 -> 613 | B615: TP | C615: 4713 | D615: 1 | E615: 04713-8 | F615: 网络设计师 教程同步辅导 | G615: 郭学理 | H615: 29.00 | I615: 37104 | J615: 10
E616: 计算机软件专业技术资格和水平考试参考用书
A617: =ROW()-2 -> 615 | B617: TP | C617: 3153 | D617: 1 | E617: 03153-3 | F617: 计算机综合应用知识 (第2版) | G617: 罗晓沛等 | H617: 36.00 | I617: 37135 | J617: 6
A618: =ROW()-2 -> 616 | B618: TP | C618: 2480 | D618: 9 | E618: 02480-4 | F618: 计算机英语(第2版) (配光盘) | G618: 刘兆毓等 | H618: 39.50 | I618: 37337 | J618: 8
A619: =ROW()-2 -> 617 | B619: TP | C619: 2480 | D619: 5 | E619: 02480-4 | F619: 计算机英语(第2版) | G619: 刘兆毓等 | H619: 26.00 | I619: 37438 | J619: 8
E620: 计算机等级考试丛书(2002大纲)
F621: (谭浩强主编)
F622: 教程系列
A623: =ROW()-2 -> 621 | B623: TP | C623: 5040 | D623: 1 | E623: 05040-6 | F623: 计算机基础知识（一级）教程（Windows环境） | G623: 徐士良 | H623: 21.00 | I623: 37469 | J623: 12
A624: =ROW()-2 -> 622 | B624: TP | C624: 5269 | D624: 1 | E624: 05269-7 | F624: 计算机基础知识(二级)教程 | G624: 徐士良 | H624: 12.00 | I624: 37469 | J624: 18
A625: =ROW()-2 -> 623 | B625: TP | C625: 5526 | D625: 1 | E625: 05526-1 | F625: C 程序设计(二级)教程 | G625: 谭浩强等 | H625: 22.00 | I625: 37438 | J625: 10
A626: =ROW()-2 -> 624 | B626: TP | C626: 5529 | D626: 1 | E626: 05529-1 | F626: QBASIC程序设计（二级）教程 | G626: 谭浩强等 | H626: 26.00 | I626: 37469 | J626: 9
A627: =ROW()-2 -> 625 | B627: TP | C627: 5528 | D627: 1 | E627: 05528-1 | F627: FORTRAN 程序设计(二级)教程 | G627: 谭浩强等 | H627: 21.00 | I627: 37469 | J627: 10
A628: =ROW()-2 -> 626 | B628: TP | C628: 5527 | D628: 1 | E628: 05527-0 | F628: FoxBASE 程序设计(二级)教程 | G628: 史济民等 | H628: 14.00 | I628: 37469 | J628: 14
A629: =ROW()-2 -> 627 | B629: TP | C629: 5006 | D629: 1 | E629: 05006-1 | F629: Visual Basic程序设计（二级）教程 | G629: 陈志泊 | H629: 25.00 | I629: 37469 | J629: 8
A630: =ROW()-2 -> 628 | B630: TP | C630: 5177 | D630: 1 | E630: 05177-1 | F630: Visual FoxPro程序设计（二级）教程 | G630: 周山芙 | H630: 28.00 | I630: 37438 | J630: 9
F631: 辅导系列
A632: =ROW()-2 -> 630 | B632: TP | C632: 5475 | D632: 1 | E632: 05475-4 | F632: QBASIC程序设计(二级)辅导 | G632: 殷光复等 | H632: 30.00 | I632: 37408 | J632: 8
A633: =ROW()-2 -> 631 | B633: TP | C633: 5476 | D633: 1 | E633: 05476-2 | F633: C 程序设计(二级)辅导 | G633: 周海燕等 | H633: 29.00 | I633: 37438 | J633: 7
A634: =ROW()-2 -> 632 | B634: TP | C634: 5424 | D634: 1 | E634: 05424-X | F634: FORTRAN 程序设计(二级)辅导 | G634: 徐士良等 | H634: 29.00 | I634: 37408 | J634: 8
A635: =ROW()-2 -> 633 | B635: TP | C635: 5512 | D635: 1 | E635: 05512-2 | F635: FoxBASE程序设计(二级)辅导 | G635: 齐英杰等 | H635: 25.00 | I635: 37469 | J635: 10
F636: 样题汇编系列
A637: =ROW()-2 -> 635 | B637: TP | C637: 5572 | D637: 1 | E637: 05572-6 | F637: C 程序设计(二级)样题汇编 | G637: 鲍有文等 | H637: 15.00 | I637: 37500 | J637: 16
A638: =ROW()-2 -> 636 | B638: TP | C638: 5571 | D638: 1 | E638: 05571-8 | F638: QBASIC程序设计(二级)样题汇编 | G638: 周海燕等 | H638: 16.00 | I638: 37438 | J638: 14
A639: =ROW()-2 -> 637 | B639: TP | C639: 5530 | D639: 1 | E639: 05530-0 | F639: FoxBASE 程序设计(二级)样题汇编 | G639: 李广第等 | H639: 18.00 | I639: 37469 | J639: 12
F640: 全国计算机等级考试全真训练丛书
A641: =ROW()-2 -> 639 | B641: P- | C641: 3042 | D641: 1 | E641: 7900630422 | F641: 全国计算机等级考试（一级DOS）全真训练 （配光盘） | G641: 黄 蓉 | H641: 28.00 | I641: 37073 | J641: 10
A642: =ROW()-2 -> 640 | B642: P- | C642: 3040 | D642: 1 | E642: 7900630406 | F642: 全国计算机等级考试（一级B类）全真训练 （配光盘） | G642: 李 智 | H642: 25.00 | I642: 37073 | J642: 15
A643: =ROW()-2 -> 641 | B643: P- | C643: 3041 | D643: 1 | E643: 7900630414 | F643: 全国计算机等级考试（一级Win）全真训练 （配光盘） | G643: 王俊萍 | H643: 25.00 | I643: 37329 | J643: 16
A644: =ROW()-2 -> 642 | B644: P- | C644: 3062 | D644: 1 | E644: 7900630627 | F644: 全国计算机等级考试(二级QBASIC)全真训练 (配光盘) | G644: 成正祥等 | H644: 29.00 | I644: 37326 | J644: 10
A645: =ROW()-2 -> 643 | B645: P- | C645: 3060 | D645: 1 | E645: 7900630600 | F645: 全国计算机等级考试(二级Pascal )全真训练 (配软盘) | G645: 成正祥等 | H645: 32.00 | I645: 37196 | J645: 9
A646: =ROW()-2 -> 644 | B646: P- | C646: 3063 | D646: 1 | E646: 7900630635 | F646: 全国计算机等级考试（二级C语言）全真训练 （配光盘） | G646: 成正祥等 | H646: 37.00 | I646: 37349 | J646: 8
A647: =ROW()-2 -> 645 | B647: TP | C647: 5208 | D647: 1 | E647: 05208-5 | F647: 全国计算机等级考试（四级）全真训练 ――（软件工程） | G647: 刘生平等 | H647: 28.00 | I647: 37349 | J647: 9
F648: MCP 微软专家认证考试培训教程
A649: =ROW()-2 -> 647 | B649: TP | C649: 3435 | D649: 1 | E649: 03435-4 | F649: 网络基础教程（配光盘）（第2版） | G649: 沈新国译 | H649: 78.00 | I649: 36526 | J649: 5
A650: =ROW()-2 -> 648 | B650: P- | C650: 3071 | D650: 1 | E650: 7900630716 | F650: 网络基础教程（配光盘）（第3版） | G650: 李晔等译 | H650: 79.00 | I650: 36831 | J650: 6
F651: 微软指定 MCSE 教材
A652: =ROW()-2 -> 650 | B652: P- | C652: 2575 | D652: 1 | E652: 7900625755 | F652: MCSE 制胜宝典 ―― MS Windows 2000 Server (配光盘） | G652: 萧湘工作室 | H652: 98.00 | I652: 37344 | J652: 4
A653: =ROW()-2 -> 651 | B653: TP | C653: 4040 | D653: 1 | E653: 04040-0 | F653: MCSE 制胜宝典 ―― MS Windows 2000 Active Directory 服务 | G653: 陈文杰等译 | H653: 79.00 | I653: 36831 | J653: 5
A654: =ROW()-2 -> 652 | B654: P- | C654: 3088 | D654: 1 | E654: 7900630880 | F654: MCSE 制胜宝典――网络基础 （配光盘） | G654: 萧湘工作室 | H654: 78.00 | I654: 36951 | J654: 5
A655: =ROW()-2 -> 653 | B655: P- | C655: 3525 | D655: 1 | E655: 7900635254 | F655: MCSE 制胜宝典――直通 Microsoft Windows 2000（配光盘） | G655: 东方人华 译 | H655: 132.00 | I655: 37104 | J655: 3
A656: =ROW()-2 -> 654 | B656: P- | C656: 3753 | D656: 1 | E656: 7900637532 | F656: MCSE 制胜宝典―― Microsoft Windows 2000目录服务基础结构设计（配光盘） | G656: 曹小刚等译 | H656: 40.00 | I656: 37226 | J656: 9
A657: =ROW()-2 -> 655 | B657: P- | C657: 3593 | D657: 1 | E657: 7900635939 | F657: MCSE 制胜宝典――从Windows NT 4.0 迁移到 Windows 2000（配光盘） | G657: 商丽媛等 | H657: 54.00 | I657: 37135 | J657: 7
A658: =ROW()-2 -> 656 | B658: P- | C658: 3037 | D658: 1 | E658: 7900630376 | F658: MCSE 制胜宝典――IIS 4.0 （配光盘） | G658: 石勇 等译 | H658: 58.00 | I658: 36982 | J658: 10
A659: =ROW()-2 -> 657 | B659: P- | C659: 3038 | D659: 1 | E659: 7900630384 | F659: MCSE 制胜宝典――Windows 2000 网络基础结构管理（配光盘） | G659: 陈萍 等译 | H659: 59.00 | I659: 36923 | J659: 7
A660: =ROW()-2 -> 658 | B660: P- | C660: 3798 | D660: 1 | E660: 7900637982 | F660: MCSE 制胜宝典――Microsoft Windows 2000 Advanced Server 群集服务（配光盘） | G660: 杨丹 等译 | H660: 49.00 | I660: 37257 | J660: 9
A661: =ROW()-2 -> 659 | B661: P- | C661: 3767 | D661: 1 | E661: 7900637672 | F661: MCSE 制胜宝典――Microsoft Windows 2000 网络基础结构设计（配光盘） | G661: 东方人华 译 | H661: 98.00 | I661: 37226 | J661: 4
A662: =ROW()-2 -> 660 | B662: P- | C662: 3716 | D662: 1 | E662: 7900637168 | F662: MCSE 制胜宝典――Microsoft Windows 2000 网络安全设计（配光盘） | G662: 黄波 等译 | H662: 78.00 | I662: 37389 | J662: 5
A663: =ROW()-2 -> 661 | B663: P- | C663: 3715 | D663: 1 | E663: 790063715X | F663: MCSE 制胜宝典――Microsoft Exchange 2000 Server 实现与管理（配光盘） | G663: 树军 等译 | H663: 98.00 | I663: 37135 | J663: 3
A664: =ROW()-2 -> 662 | B664: P- | C664: 3746 | D664: 1 | E664: 790063746X | F664: MCSE 制胜宝典――Microsoft SQL Server 2000 数据库设计与实现（配光盘） | G664: 孙巍 等译 | H664: 69.00 | I664: 37165 | J664: 5
A665: =ROW()-2 -> 663 | B665: P- | C665: 3754 | D665: 1 | E665: 7900637540 | F665: MCSE 制胜宝典――Microsoft SQL Server 2000 系统管理（配光盘） | G665: 高丽媛等译 | H665: 78.00 | I665: 37196 | J665: 5
A666: =ROW()-2 -> 664 | B666: P- | C666: 3082 | D666: 1 | E666: 7900630821 | F666: MCSE制胜宝典――Windows 2000 Professional (配光盘） | G666: 李娇娇等译 | H666: 88.00 | I666: 37412 | J666: 4
A667: =ROW()-2 -> 665 | B667: P- | C667: 4149 | D667: 1 | E667: 7900641491 | F667: MCSE 制胜宝典――Microsoft Windows 2000 Server 技术设计高效的Web解决方案（配光盘） | G667: 韩宏志 等译 | H667: 59.00 | I667: 37316 | J667: 10
A668: =ROW()-2 -> 666 | B668: P- | C668: 4116 | D668: 1 | E668: 7900641165 | F668: MCSE 制胜宝典――Microsoft ISA Server 2000 | G668: 李良波等译 | H668: 58.00 | I668: 37316 | J668: 7
A669: =ROW()-2 -> 667 | B669: P- | C669: 4148 | D669: 1 | E669: 7900641483 | F669: MCSE 制胜宝典――Microsoft Exchange 2000 Server设计与部署 | G669: 黄开枝等译 | H669: 69.00 | I669: 37362 | J669: 6
A670: =ROW()-2 -> 668 | B670: P- | C670: 4193 | D670: 1 | E670: 7900641939 | F670: MCSE 制胜宝典 ―― MS BizTalk Server 2000 (配光盘）微软公司著 | G670: 萧湘工作室 | H670: 63.00 | I670: 37438 | J670: 7
F671: MCSE 官方模拟试题丛书
A672: =ROW()-2 -> 670 | B672: P- | C672: 3175 | D672: 1 | E672: 7900631755 | F672: MCSE 官方模拟试题――实现和管理 Microsoft Windows 2000目录服务基础结构(配光盘) | G672: 胡祺昊等译 | H672: 35.00 | I672: 37073 | J672: 11
A673: =ROW()-2 -> 671 | B673: P- | C673: 4182 | D673: 1 | E673: 7900641823 | F673: MCSE 官方模拟试题――Microsoft Windows XP Professional（配光盘） | G673: 李祥凯等译 | H673: 59.00 | I673: 37408 | J673: 6
A674: =ROW()-2 -> 672 | B674: P- | C674: 3194 | D674: 1 | E674: 7900631941 | F674: MCSE 官方模拟试题――实现和管理 Microsoft Windows 2000 网络基础结构（配光盘） | G674: 东方人华译 | H674: 35.00 | I674: 37104 | J674: 11
A675: =ROW()-2 -> 673 | B675: P- | C675: 3518 | D675: 1 | E675: 7900635181 | F675: MCSE 官方模拟试题――安装、配置和管理Microsoft Windows 2000 Professional （配光盘） | G675: 侯晓霞译 | H675: 39.00 | I675: 37104 | J675: 9
A676: =ROW()-2 -> 674 | B676: P- | C676: 3188 | D676: 1 | E676: 7900631887 | F676: MCSE 官方模拟试题――安装、配置和管理Microsoft Windows 2000 Server（配光盘） | G676: 张为普译 | H676: 42.00 | I676: 37104 | J676: 9
A677: =ROW()-2 -> 675 | B677: P- | C677: 3742 | D677: 1 | E677: 7900637427 | F677: MCSE 官方模拟试题――Microsoft SQL Server 2000 系统管理（配光盘） | G677: 东方人华译 | H677: 39.00 | I677: 37165 | J677: 10
A678: =ROW()-2 -> 676 | B678: P- | C678: 3755 | D678: 1 | E678: 7900637559 | F678: MCSE 官方模拟试题――Microsoft Exchange 2000 Server 系统管理（配光盘） | G678: 东方人华译 | H678: 42.00 | I678: 37196 | J678: 10
A679: =ROW()-2 -> 677 | B679: P- | C679: 3789 | D679: 1 | E679: 7900637893 | F679: MCSE 官方模拟试题――Microsoft Windows 2000 目录服务基础结构设计（配光盘） | G679: 常晓波译 | H679: 59.00 | I679: 37257 | J679: 6
A680: =ROW()-2 -> 678 | B680: P- | C680: 4115 | D680: 1 | E680: 7900641157 | F680: MCSE 官方模拟试题――Microsoft Windows 2000 网络基础结构设计（配光盘） | G680: 微软公司 | H680: 58.00 | I680: 37288 | J680: 7
A681: =ROW()-2 -> 679 | B681: P- | C681: 4161 | D681: 1 | E681: 7900641610 | F681: MCSE 官方模拟试题――Microsoft Windows 2000网 络安全设计 | G681: 微软公司 | H681: 59.00 | I681: 37347 | J681: 6
A682: =ROW()-2 -> 680 | B682: P- | C682: 3081 | D682: 1 | E682: 7900630813 | F682: SQL Server 7.0 数据库设计与实现（配光盘） | G682: 汉扬天地 | H682: 60.00 | I682: 37012 | J682: 6
A683: =ROW()-2 -> 681 | B683: P- | C683: 3069 | D683: 1 | E683: 7900630694 | F683: 管理 SQL Server 7.0 （配光盘） | G683: 健莲工作室 | H683: 52.00 | I683: 36861 | J683: 8
F684: MCSE 学习指南系列
A685: =ROW()-2 -> 683 | B685: TP | C685: 3442 | D685: 2 | E685: 03442-7 | F685: Windows 98 MCSE 学习指南 | G685: 陈武 译 | H685: 51.00 | I685: 36617 | J685: 6
A686: =ROW()-2 -> 684 | B686: TP | C686: 3771 | D686: 1 | E686: 03771-X | F686: Windows NT Workstation 4.0 MCSE 学习指南 | G686: 刘春等译 | H686: 58.00 | I686: 36526 | J686: 6
A687: =ROW()-2 -> 685 | B687: TP | C687: 3577 | D687: 2 | E687: 03577-6 | F687: IIS 4.0 MCSE 学习指南 | G687: 司罗 译 | H687: 34.80 | I687: 36770 | J687: 8
A688: =ROW()-2 -> 686 | B688: GP | C688: 3596 | D688: 1 | E688: 03596-2 | F688: Windows NT Server 4.0 (企业版）MCSE 学习指南(CD-ROM) | H688: 60.00 | I688: 36586 | J688: 25
A689: =ROW()-2 -> 687 | B689: GP | C689: 3616 | D689: 1 | E689: 03616-0 | F689: Windows NT Server 4.0 MCSE 学习指南(CD-ROM) | H689: 60.00 | I689: 36586 | J689: 25
A690: =ROW()-2 -> 688 | B690: GP | C690: 3771 | D690: 1 | E690: 03771-X | F690: Windows NT Workstation 4.0 MCSE 学习指南 (CD-ROM) | H690: 60.00 | I690: 36586 | J690: 25
A691: =ROW()-2 -> 689 | B691: GP | C691: 3442 | D691: 1 | E691: 03442-7 | F691: Windows 98 MCSE 学习指南(CD-ROM) | H691: 60.00 | I691: 36465 | J691: 25
A692: =ROW()-2 -> 690 | B692: GP | C692: 3497 | D692: 1 | E692: 03497-4 | F692: 网络基础 MCSE 学习指南(CD-ROM) | H692: 60.00 | I692: 36465 | J692: 25
A693: =ROW()-2 -> 691 | B693: GP | C693: 3577 | D693: 1 | E693: 03577-6 | F693: IIS 4.0 MCSE 学习指南(CD-ROM) | H693: 60.00 | I693: 36465 | J693: 25
F694: CISCO 丛书 (英文影印版 )
A695: =ROW()-2 -> 693 | B695: TP | C695: 3462 | D695: 2 | E695: 03462-1 | F695: CISCO 路由器配置导论 (Introduction to Cisco Router Configuration) | G695: Laura Chappell | H695: 53.00 | I695: 37257 | J695: 5
A696: =ROW()-2 -> 694 | B696: TP | C696: 3456 | D696: 3 | E696: 03456-7 | F696: IP 路由技术基础 (IP Routing Primer) | G696: Robert Wright | H696: 30.00 | I696: 36617 | J696: 9
A697: =ROW()-2 -> 695 | B697: TP | C697: 2949 | D697: 2 | E697: 02949-0 | F697: TCP/IP 路由技术 卷1 (Routing TCP/IP) | G697: Jeff Doyle | H697: 89.00 | I697: 36831 | J697: 3
A698: =ROW()-2 -> 696 | B698: TP | C698: 3493 | D698: 1 | E698: 03493-1 | F698: 网络互联排错手册 (Internetworking Troubleshooting Handbook) | G698: H.Kim Lew | H698: 69.00 | I698: 36982 | J698: 4
A699: =ROW()-2 -> 697 | B699: TP | C699: 1036 | D699: 1 | E699: 01036-6 | F699: 网络设计与个案分析 （Network Design and Case Studies) | G699: Cisco Systems | H699: 75.00 | I699: 36557 | J699: 3
A700: =ROW()-2 -> 698 | B700: TP | C700: 1094 | D700: 1 | E700: 01094-3 | F700: Cisco 高级路由器配置技术 （Adveanced Cisco Router Configuration) | G700: Laura Chappell | H700: 58.00 | I700: 36526 | J700: 4
A701: =ROW()-2 -> 699 | B701: TP | C701: 3660 | D701: 2 | E701: 03660-8 | F701: IP 路由技术原理 (IP Routing Fundamentals) | G701: Mark A.Sportack | H701: 47.00 | I701: 36617 | J701: 5
A702: =ROW()-2 -> 700 | B702: TP | C702: 1093 | D702: 1 | E702: 01093-5 | F702: Internet 路由技术 （Internet Routing Architectures) | G702: Bassam Halabi | H702: 44.00 | I702: 36831 | J702: 6
A703: =ROW()-2 -> 701 | B703: P- | C703: 2218 | D703: 2 | E703: 7900622181 | F703: CCNA 资格认证考试及培训必读 (配光盘） （CCNA Exam Certification Guide) | G703: Wendell Odom | H703: 65.00 | I703: 36739 | J703: 5
F704: 4.培训
F705: 计算机技术系列培训教材
A706: =ROW()-2 -> 704 | B706: TP | C706: 3453 | D706: 2 | E706: 03453-9 | F706: 软件工程初级培训教程 | G706: 郑人杰 | H706: 29.5 | I706: 36373 | J706: 10
A707: =ROW()-2 -> 705 | B707: TP | C707: 3231 | D707: 1 | E707: 03231-9 | F707: 软件工程 中级培训教程 | G707: 郑人杰 | H707: 49 | I707: 36404 | J707: 6
A708: =ROW()-2 -> 706 | B708: TP | C708: 3534 | D708: 1 | E708: 03534-2 | F708: 软件工程高级培训教程 | G708: 郑人杰 | H708: 37 | I708: 36373 | J708: 8
A709: =ROW()-2 -> 707 | B709: TP | C709: 3550 | D709: 2 | E709: 03550-4 | F709: 数据库技术初级培训教程 | G709: 罗晓沛等 | H709: 26 | I709: 36892 | J709: 10
A710: =ROW()-2 -> 708 | B710: TP | C710: 3528 | D710: 2 | E710: 03528-1 | F710: 数据库技术中级培训教程 | G710: 罗晓沛等 | H710: 38 | I710: 36465 | J710: 8
A711: =ROW()-2 -> 709 | B711: TP | C711: 3634 | D711: 2 | E711: 03634-9 | F711: 数据库技术高级培训教程 | G711: 罗晓沛等 | H711: 46 | I711: 36465 | J711: 7
A712: =ROW()-2 -> 710 | B712: TP | C712: 3415 | D712: 2 | E712: 03415-X | F712: 计算机网络初级培训教程 | G712: 胡道元 | H712: 19.00 | I712: 37288 | J712: 13
A713: =ROW()-2 -> 711 | B713: TP | C713: 3446 | D713: 3 | E713: 03446-X | F713: 计算机网络中级培训教程 | G713: 胡道元 | H713: 20.00 | I713: 36951 | J713: 12
A714: =ROW()-2 -> 712 | B714: TP | C714: 3574 | D714: 1 | E714: 03574-1 | F714: 计算机网络高级培训教程 | G714: 胡道元 | H714: 34.00 | I714: 36951 | J714: 9
A715: =ROW()-2 -> 713 | B715: TP | C715: 3457 | D715: 3 | E715: 03457-5 | F715: 多媒体技术初级培训教程 | G715: 钟玉琢 | H715: 29.00 | I715: 37288 | J715: 10
A716: =ROW()-2 -> 714 | B716: TP | C716: 3480 | D716: 2 | E716: 03480-X | F716: 多媒体技术中级培训教程 | G716: 钟玉琢 | H716: 22.00 | I716: 37288 | J716: 12
A717: =ROW()-2 -> 715 | B717: TP | C717: 3416 | D717: 2 | E717: 03416-8 | F717: 多媒体技术高级培训教程 | G717: 钟玉琢 | H717: 55 | I717: 36373 | J717: 5
F718: 公务员电脑培训教程系列
A719: =ROW()-2 -> 717 | B719: TP | C719: 1134 | D719: 1 | E719: 01134-6 | F719: 公务员电脑文字处理培训教程 | G719: 庄盛珠 | H719: 29.00 | I719: 36800 | J719: 9
A720: =ROW()-2 -> 718 | B720: TP | C720: 1134 | D720: 2 | E720: 01134-6 | F720: 公务员电脑表格处理培训教程 | G720: 王旭升 | H720: 29.00 | I720: 36708 | J720: 9
A721: =ROW()-2 -> 719 | B721: TP | C721: 1134 | D721: 3 | E721: 01134-6 | F721: 公务员上网培训教程 | G721: 林章波等 | H721: 23.00 | I721: 36861 | J721: 12
A722: =ROW()-2 -> 720 | B722: TP | C722: 3685 | D722: 4 | E722: 03685-3 | F722: 公务员电脑培训教程 （Windows98 Office 97 Internet) | G722: 文信达 | H722: 30.00 | I722: 37257 | J722: 9
A723: =ROW()-2 -> 721 | B723: TP | C723: 1348 | D723: 1 | E723: 01348-9 | F723: 公务人员电脑培训教程 Win Me | G723: 东方人华 | H723: 30.00 | I723: 36951 | J723: 10
F724: 国家公务员培训教材
A725: =ROW()-2 -> 723 | B725: TP | C725: 4929 | D725: 1 | E725: 04929-7 | F725: 信息技术与电子政务 | H725: 30.00 | I725: 37397 | J725: 9
F726: 新东方电脑标准培训教材
A727: =ROW()-2 -> 725 | B727: TP | C727: 4518 | D727: 1 | E727: 04518-6 | F727: 办公软件专家系列丛书――Internet Explorer 5.5 & FrontPage 实用教程 | G727: 张剑悦 | H727: 29.00 | I727: 37257 | J727: 11
A728: =ROW()-2 -> 726 | B728: TP | C728: 4520 | D728: 1 | E728: 04520-8 | F728: 办公软件专家系列丛书――Word 实用教程 | G728: 贾燕枫等 | H728: 38.00 | I728: 37073 | J728: 9
A729: =ROW()-2 -> 727 | B729: TP | C729: 4521 | D729: 1 | E729: 04521-6 | F729: 办公软件专家系列丛书――Excel 实用教程 | G729: 何 丰 | H729: 33.00 | I729: 37073 | J729: 10
A730: =ROW()-2 -> 728 | B730: TP | C730: 4522 | D730: 1 | E730: 04522-4 | F730: 办公软件专家系列丛书――PowerPoint 实用教程 | G730: 贾燕枫 | H730: 19.00 | I730: 37073 | J730: 15
A731: =ROW()-2 -> 729 | B731: TP | C731: 4519 | D731: 1 | E731: 04519-4 | F731: 办公软件专家系列丛书――Windows 2000 Professional 实用教程 | G731: 王 宁 | H731: 34.00 | I731: 37500 | J731: 9
A732: =ROW()-2 -> 730 | B732: TP | C732: 4572 | D732: 1 | E732: 04572-0 | F732: 网络工程师系列丛书――Windows 2000 活动目录 | G732: 殷 强 | H732: 26.00 | I732: 37073 | J732: 10
A733: =ROW()-2 -> 731 | B733: TP | C733: 4585 | D733: 1 | E733: 04585-2 | F733: 网络工程师系列丛书――Windows 2000 网络基础 | G733: 钱 强 | H733: 28.00 | I733: 37104 | J733: 11
A734: =ROW()-2 -> 732 | B734: TP | C734: 4725 | D734: 1 | E734: 04725-1 | F734: 网络工程师系列丛书――Windows 2000 网络服务 | G734: 李伟东 | H734: 42.00 | I734: 37337 | J734: 8
A735: =ROW()-2 -> 733 | B735: TP | C735: 4830 | D735: 1 | E735: 04830-4 | F735: 网络工程师系列丛书――Windows 2000 Server 配置与管理 | G735: 施伟光等 | H735: 31.00 | I735: 37288 | J735: 10
A736: =ROW()-2 -> 734 | B736: TP | C736: 4672 | D736: 1 | E736: 04672-7 | F736: 网络工程师系列丛书――RedHat 7.0 安装配置与管理 | G736: 梁如军 | H736: 67.00 | I736: 37408 | J736: 5
A737: =ROW()-2 -> 735 | B737: TP | C737: 4671 | D737: 1 | E737: 04671-9 | F737: 网络工程师系列丛书――Exchange 2000 Server 配置与管理 | G737: 金 悦 | H737: 34.00 | I737: 37135 | J737: 9
A738: =ROW()-2 -> 736 | B738: TP | C738: 5347 | D738: 1 | E738: 05347-1 | F738: 网络工程师系列丛书――ISA配置与管理 | G738: 邱亮 等 | H738: 25.00 | I738: 37364 | J738: 13
A739: =ROW()-2 -> 737 | B739: TP | C739: 4725 | D739: 1 | E739: 047251 | F739: 网络工程师系列丛书――Windows 2000网络服务 | G739: 李伟东 | H739: 42.00 | I739: 37469 | J739: 8
A740: =ROW()-2 -> 738 | B740: P- | C740: 3588 | D740: 1 | E740: 7900635882 | F740: 软件程序员系列丛书――网页编程基础 （配光盘） | G740: 石志国 | H740: 32.00 | I740: 37316 | J740: 12
A741: =ROW()-2 -> 739 | B741: TP | C741: 4783 | D741: 1 | E741: 04783-9 | F741: 软件程序员系列丛书――ASP 动态网站编程 | G741: 石志国 | H741: 35.00 | I741: 37469 | J741: 9
A742: =ROW()-2 -> 740 | B742: TP | C742: 4911 | D742: 1 | E742: 049111-4 | F742: 软件程序员系列丛书――XML 程序设计 | G742: 栗松涛 | H742: 40.00 | I742: 37196 | J742: 8
A743: =ROW()-2 -> 741 | B743: TP | C743: 5014 | D743: 1 | E743: 05014-7 | F743: 软件程序员系列丛书――PHP 4.0 与 MySQL 动态网站编程 | G743: 冯燕奎 | H743: 35.00 | I743: 37226 | J743: 9
A744: =ROW()-2 -> 742 | B744: P- | C744: 3587 | D744: 1 | E744: 7900635874 | F744: 电脑美术系列丛书――Fireworks 4.0 网页图象设计（配光盘） | G744: 沈晓春 | H744: 46.00 | I744: 37105 | J744: 8
A745: =ROW()-2 -> 743 | B745: TP | C745: 4656 | D745: 1 | E745: 04656-5 | F745: 电脑美术系列丛书――Photoshop 6.0 网页图象 设计 | G745: 刘鸿 等 | H745: 25.00 | I745: 37165 | J745: 12
A746: =ROW()-2 -> 744 | B746: TP | C746: 5059 | D746: 1 | E746: 05059-7 | F746: 电脑美术系列丛书――Flash5.0网页动画设计 | G746: 沈晓春 | H746: 28.00 | I746: 37362 | J746: 11
A747: =ROW()-2 -> 745 | B747: P- | C747: 3572 | D747: 1 | E747: 7900635726 | F747: 电脑美术系列丛书――Dreamweaver 4.0 网页设计 （配光盘） | G747: 白 煜 | H747: 36.00 | I747: 37257 | J747: 10
F748: 网络工程师系列丛书
A749: =ROW()-2 -> 747 | B749: TP | C749: 5084 | D749: 1 | E749: 05084-8 | F749: 网络工程师系列丛书――校园网组建与管理 | G749: 王竹林等 | H749: 26.00 | I749: 37288 | J749: 9
A750: =ROW()-2 -> 748 | B750: TP | C750: 5077 | D750: 1 | E750: 05077-5 | F750: 网络工程师系列丛书――局域网组建与管理 | G750: 吴迪 等 | H750: 25.00 | I750: 37341 | J750: 12
A751: =ROW()-2 -> 749 | B751: TP | C751: 5225 | D751: 1 | E751: 05225-1 | F751: 网络工程师系列丛书――局域网经典案例教程 | G751: 龙岗 等 | H751: 35.00 | I751: 37347 | J751: 7
A752: =ROW()-2 -> 750 | B752: TP | C752: 5374 | D752: 1 | E752: 05374-1 | F752: 网络工程师系列丛书――Cisco Catalyst系列交换机的使用与组网技术 | G752: 刘鲁川 等 | H752: 28.00 | I752: 37377 | J752: 9
F753: 微软.NET程序员系列
A754: =ROW()-2 -> 752 | B754: TP | C754: 5609 | D754: 1 | E754: 05609-1 | F754: ASP.NET 程序设计 | G754: [美]G.Andrew Duthie | H754: 48.00 | I754: 37438 | J754: 6
A755: =ROW()-2 -> 753 | B755: P- 4168 1 | E755: 04168-1 | F755: ASP.NET Web应用程序开发新思维(配光盘) | G755: [美]Douglas J. Reilly | H755: 38.00 | I755: 37408 | J755: 7
A756: =ROW()-2 -> 754 | B756: TP | C756: 5412 | D756: 1 | E756: 05412-6 | F756: MICROSOFT.NET MY SERVICES 精解 | G756: [美]微软公司 | H756: 69.00 | I756: 37500 | J756: 5
A757: =ROW()-2 -> 755 | B757: TP | C757: 5809 | D757: 1 | E757: 05809-1 | F757: Visual Basic. NET语言参考手册 | G757: [美]微软公司 | H757: 68.00 | I757: 37500 | J757: 5
A758: =ROW()-2 -> 756 | B758: TP | C758: 5775 | D758: 1 | E758: 05775-3 | F758: 应用程序升级――Visual Basic 6.0到Visual Basic .NET | G758: [美]Ed Robinson | H758: 49.00 | I758: 37500 | J758: 6
F759: 微软.NET程序设计系列
A760: =ROW()-2 -> 758 | B760: TP | C760: 5663 | D760: 1 | E760: 05663-3 | F760: 微软ADO.NET 程序设计 | G760: [美]Rebecca M.Riordan | H760: 48.00 | I760: 37438 | J760: 7
A761: =ROW()-2 -> 759 | B761: TP | C761: 5640 | D761: 1 | E761: 05640-4 | F761: Visual Basic.Net 和Visual C#.NET面向对象程序设计 | G761: [美]Robin A.Reynolds-Haertle | H761: 36.00 | I761: 37439 | J761: 6
A762: =ROW()-2 -> 760 | B762: TP | C762: 5644 | D762: 1 | E762: 05644-7 | F762: Visual Basic.Net 程序设计 | G762: [美]Michael Halvorson | H762: 48.00 | I762: 37439 | J762: 5
A763: =ROW()-2 -> 761 | B763: TP | C763: 5643 | D763: 1 | E763: 05643-9 | F763: Visual C++.NET 程序设计 | G763: [美]Julian Templeman,Andy Olsen | H763: 58.00 | I763: 37469 | J763: 5
F764: 计算机综合培训教程系列丛书
A765: =ROW()-2 -> 763 | B765: TP | C765: 4516 | D765: 1 | E765: 04516-X | F765: 网页制作综合培训教程――Flash 5.0 Dreamweaver 4.0 Fireworks 4.0 | G765: 高清风 | H765: 27.00 | I765: 37288 | J765: 8
A766: =ROW()-2 -> 764 | B766: TP | C766: 5532 | D766: 1 | E766: 05532-1 | F766: Internet 实用综合培训教程 | G766: 苏武荣主编 | H766: 29.00 | I766: 37438 | J766: 10
A767: =ROW()-2 -> 765 | B767: TP | C767: 4552 | D767: 1 | E767: 04552-6 | F767: 平面设计综合培训教程 | G767: 江燕飞 | H767: 34.00 | I767: 37104 | J767: 7
A768: =ROW()-2 -> 766 | B768: TP | C768: 5558 | D768: 1 | E768: 05558-0 | F768: 排版软件四合一短期速成培训教程 | G768: 马晓敏等 | H768: 32.00 | I768: 37469 | J768: 9
F769: 微软培训教材系列
A770: =ROW()-2 -> 768 | B770: P- | C770: 3011 | D770: 1 | E770: 7900630112 | F770: MS VC++ 开发教程（配光盘） | G770: 博彦公司 | H770: 42.00 | I770: 36982 | J770: 8
A771: =ROW()-2 -> 769 | B771: P- | C771: 3106 | D771: 1 | E771: 7900631062 | F771: Access 开发教程 （配光盘） | G771: 博彦公司 | H771: 42.00 | I771: 37104 | J771: 8
A772: =ROW()-2 -> 770 | B772: P- | C772: 3010 | D772: 1 | E772: 7900630104 | F772: MS VB++ 开发教程（配光盘） | G772: 博彦公司 | H772: 40.00 | I772: 36800 | J772: 8
A773: =ROW()-2 -> 771 | B773: P- | C773: 3014 | D773: 1 | E773: 7900630147 | F773: MS Visual J++ 开发教程（配光盘） | G773: 博彦公司 | H773: 39.00 | I773: 36800 | J773: 10
A774: =ROW()-2 -> 772 | B774: P- | C774: 3016 | D774: 1 | E774: 7900630163 | F774: MS Visual InterDev 开发教程（配光盘） | G774: 博彦公司 | H774: 39.00 | I774: 36800 | J774: 8
A775: =ROW()-2 -> 773 | B775: P- | C775: 3049 | D775: 1 | E775: 790063049X | F775: MS Windows NT 网络管理教程（配光盘） | G775: 博彦公司 | H775: 39.00 | I775: 37316 | J775: 8
A776: =ROW()-2 -> 774 | B776: P- | C776: 3048 | D776: 1 | E776: 7900630481 | F776: MS Windows NT 核心技术教程（配光盘） | G776: 博彦公司 | H776: 42.00 | I776: 36861 | J776: 9
A777: =ROW()-2 -> 775 | B777: P- | C777: 3012 | D777: 1 | E777: 7900630120 | F777: MS Office 2000 中文版培训教程（配光盘） | G777: 博彦公司 | H777: 40.00 | I777: 37104 | J777: 8
A778: =ROW()-2 -> 776 | B778: P- | C778: 3050 | D778: 1 | E778: 7900630503 | F778: 网络基础培训教程（配光盘） | G778: 博彦公司 | H778: 38.00 | I778: 36831 | J778: 10
A779: =ROW()-2 -> 777 | B779: P- | C779: 1518 | D779: X | E779: 01518-X | F779: 微软培训与认证系列教材 Implementing and Administering Microsoft Windows 2000 Directory Services | G779: 微软公司 | H779: 180.00 | I779: 37257
F780: 微软 Office 产品组推荐短训教材
A781: =ROW()-2 -> 779 | B781: TP | C781: 4536 | D781: 1 | E781: 04536-4 | F781: Office XP 中文版快捷教程 | G781: 东方人华 | H781: 20.00 | I781: 37135 | J781: 10
A782: =ROW()-2 -> 780 | B782: TP | C782: 4536 | D782: 2 | E782: 04536-4 | F782: PowerPoint 20002中文版快捷教程 | G782: 东方人华 | H782: 20.00 | I782: 37135 | J782: 12
A783: =ROW()-2 -> 781 | B783: TP | C783: 4536 | D783: 5 | E783: 04536-4 | F783: FrontPage 2002 中文版快捷教程 | G783: 东方人华 | H783: 20.00 | I783: 37073 | J783: 12
A784: =ROW()-2 -> 782 | B784: TP | C784: 4536 | D784: 3 | E784: 04536-4 | F784: Word 2002 中文版快捷教程 | G784: 东方人华 | H784: 20.00 | I784: 37135 | J784: 10
A785: =ROW()-2 -> 783 | B785: TP | C785: 4536 | D785: 4 | E785: 04536-5 | F785: Excel 2002 中文版快捷教程 | G785: 东方人华 | H785: 20.00 | I785: 37135 | J785: 15
F786: MCSD 培训教程
A787: =ROW()-2 -> 785 | B787: P- | C787: 3108 | D787: 1 | E787: 7900631089 | F787: Visual C++6.0 桌面应用程序开发 | G787: 魏星 等译 | H787: 75.00 | I787: 36923 | J787: 5
A788: =ROW()-2 -> 786 | B788: P- | C788: 3507 | D788: 1 | E788: 7900635076 | F788: Visual Basic 6.0 分布式应用程序开发 | G788: 李晔 等译 | H788: 58.00 | I788: 37196 | J788: 6
A789: =ROW()-2 -> 787 | B789: P- | C789: 3120 | D789: 1 | E789: 7900631208 | F789: Visual InterDev 6.0 Web 应用程序开发 （配光盘） | G789: 李晔 译 | H789: 58.00 | I789: 37165 | J789: 6
F790: 微软培训教程
A791: =ROW()-2 -> 789 | B791: P- | C791: 3002 | D791: 1 | E791: 7900630023 | F791: MS Windows 2000 Professional 中文版进阶教程 （配光盘） | G791: 东庭 等译 | H791: 30.00 | I791: 36800 | J791: 17
A792: =ROW()-2 -> 790 | B792: P- | C792: 2582 | D792: 1 | E792: 7900625828 | F792: MS Windows 2000 Professional 中文版基础教程 （配光盘） | G792: 东 庭等译 | H792: 28.00 | I792: 36831 | J792: 20
A793: =ROW()-2 -> 791 | B793: P- | C793: 3019 | D793: 1 | E793: 7900630198 | F793: MS Access 2000 中文版基础教程（配光盘） | G793: 东方人华 | H793: 30.00 | I793: 36800 | J793: 17
A794: =ROW()-2 -> 792 | B794: P- | C794: 2581 | D794: 1 | E794: 790062581X | F794: MS Access 2000 中文版进阶教程（配光盘） | G794: 林洁等译 | H794: 38.00 | I794: 36800 | J794: 12
A795: =ROW()-2 -> 793 | B795: P- | C795: 3009 | D795: 1 | E795: 7900630090 | F795: MS FrontPage 2000 中文版基础教程（配光盘） | G795: 崔伟等译 | H795: 30.00 | I795: 36800 | J795: 16
A796: =ROW()-2 -> 794 | B796: P- | C796: 3003 | D796: 1 | E796: 7900630031 | F796: MS FrontPage 2000 中文版进阶教程（配光盘） | G796: 孙晓东译 | H796: 30.00 | I796: 36831 | J796: 16
A797: =ROW()-2 -> 795 | B797: P- | C797: 3092 | D797: 1 | E797: 7900630929 | F797: MS Word 2000中文版进阶教程(配光盘) | G797: 东庭 译 | H797: 35.00 | I797: 36892 | J797: 13
A798: =ROW()-2 -> 796 | B798: P- | C798: 3086 | D798: 1 | E798: 7900630864 | F798: MS Excel 2000 中文版进阶教程（配光盘） | G798: 杜朝 译 | H798: 29.00 | I798: 36892 | J798: 15
A799: =ROW()-2 -> 797 | B799: P- | C799: 3078 | D799: 1 | E799: 7900630872 | F799: MS Outlook 2000 中文版基础教程（配光盘） | G799: 东方人华 | H799: 32.00 | I799: 36892 | J799: 14
A800: =ROW()-2 -> 798 | B800: P- | C800: 3084 | D800: 1 | E800: 7900630848 | F800: MS Outlook 2000 中文版进阶教程（配光盘） | G800: 东方人华 | H800: 28.00 | I800: 36892 | J800: 15
A801: =ROW()-2 -> 799 | B801: P- | C801: 3036 | D801: 1 | E801: 7900630368 | F801: MS Excel 2000 中文版基础教程（配光盘） | G801: 付东云译 | H801: 25.00 | I801: 36861 | J801: 16
F802: CCTV 电视讲座教材
A803: 迎接新世纪――计算机技能培训丛书（谭浩强主编）
A804: =ROW()-2 -> 802 | B804: TP | C804: 3214 | D804: 6 | E804: 03214-9 | F804: Windows 98 中文版操作系统 | G804: 王世忠 | H804: 19.00 | I804: 37135 | J804: 15
A805: =ROW()-2 -> 803 | B805: TP | C805: 3116 | D805: 6 | E805: 03116-9 | F805: Internet 上网与使用 | G805: 陶文星等 | H805: 16.00 | I805: 36739 | J805: 16
A806: =ROW()-2 -> 804 | B806: TP | C806: 3146 | D806: 4 | E806: 03146-0 | F806: HTML网页制作 | G806: 王映雪等 | H806: 10.00 | I806: 36770 | J806: 25
A807: =ROW()-2 -> 805 | B807: TP | C807: 3176 | D807: 4 | E807: 03176-2 | F807: Internet Explorer 浏览器 | G807: 鲍泓 等 | H807: 17.50 | I807: 36495 | J807: 14
A808: =ROW()-2 -> 806 | B808: TP | C808: 3155 | D808: 4 | E808: 03155-X | F808: Lotus Notes 网络办公平台 | G808: 赵丽萍 | H808: 16.00 | I808: 36495 | J808: 15
A809: =ROW()-2 -> 807 | B809: TP | C809: 3169 | D809: 4 | E809: 03169-X | F809: Photoshop图象处理 | G809: 沈 洪 | H809: 17.00 | I809: 36770 | J809: 16
A810: =ROW()-2 -> 808 | B810: TP | C810: 3115 | D810: 5 | E810: 03115-0 | F810: PowerPoint演示文稿制作 | G810: 庄洪林 | H810: 14.00 | I810: 37135 | J810: 18
A811: =ROW()-2 -> 809 | B811: TP | C811: 3229 | D811: 4 | E811: 03229-7 | F811: 3D Studio MAX 动画制作 | G811: 李利平 | H811: 12.00 | I811: 36647 | J811: 22
A812: =ROW()-2 -> 810 | B812: TP | C812: 3230 | D812: 4 | E812: 03230-0 | F812: Authorware 多媒体制作 | G812: 李秀等 | H812: 16.00 | I812: 37226 | J812: 18
A813: =ROW()-2 -> 811 | B813: P- | C813: 4310 | D813: 1 | E813: 04310-1 | F813: JAVA事件处理指南（配光盘） | G813: 沈莹谢乐健等译 | H813: 58.00 | I813: 37438 | J813: 6
A814: =ROW()-2 -> 812 | B814: TP | C814: 3170 | D814: 2 | E814: 03170-3 | F814: Java 程序设计 | G814: 刘 波 | H814: 14.80 | I814: 36982 | J814: 15
A815: =ROW()-2 -> 813 | B815: TP | C815: 3241 | D815: 2 | E815: 03241-6 | F815: 多媒体应用基础 | G815: 王辉 等 | H815: 14.00 | I815: 36923 | J815: 18
A816: =ROW()-2 -> 814 | B816: VD | C816: 9831 | D816: 1 | F816: Windows 98 中文版操作系统（VCD2盘） | G816: 王世忠 | H816: 50 | I816: 1999 | J816: 50
A817: =ROW()-2 -> 815 | B817: VD | F817: Internet 上网与使用（VCD2盘） | G817: 陶文星等 | H817: 50 | I817: 1999 | J817: 50
A818: =ROW()-2 -> 816 | B818: VD | C818: 9863 | D818: 1 | F818: HTML网页制作 （VCD3盘） | G818: 肖 平 | H818: 75 | I818: 1999 | J818: 25
A819: =ROW()-2 -> 817 | B819: VD | C819: 9865 | D819: 1 | F819: Internet Explorer 浏览器（VCD2盘） | G819: 鲍泓等 | H819: 50.00 | I819: 1999 | J819: 50
A820: =ROW()-2 -> 818 | B820: VD | C820: 9917 | D820: 1 | F820: Photoshop图象处理 (VCD5盘) | G820: 沈洪 等 | H820: 125.00 | I820: 1999 | J820: 10
A821: =ROW()-2 -> 819 | B821: VD | C821: 9918 | D821: 1 | F821: PowerPoint演示文稿制作 (VCD2盘) | G821: 庄洪林 | H821: 50.00 | I821: 1999 | J821: 25
A822: =ROW()-2 -> 820 | B822: VD | C822: 9916 | D822: 1 | F822: 3D Studio MAX 动画制作 (VCD7盘) | G822: 李利平等 | H822: 175.00 | I822: 36281 | J822: 6
A823: =ROW()-2 -> 821 | B823: VD | C823: 9919 | D823: 1 | F823: Authorware 多媒体制作 (VCD6盘) | G823: 李秀 等 | H823: 150.00 | I823: 36281 | J823: 9
A824: =ROW()-2 -> 822 | B824: VD | C824: 9915 | D824: 1 | F824: 多媒体应用基础 (VCD2盘) | G824: 王辉 等 | H824: 50.00 | I824: 1999 | J824: 40
A825: =ROW()-2 -> 823 | B825: GP | C825: 1759 | D825: 1 | E825: 7900617590 | F825: 多媒体技术应用部分 (CD-ROM) | G825: 刘 波 | H825: 35.00 | I825: 36281 | J825: 30
A826: 迎接新世纪――最新常用软件技能培训丛书（谭浩强主编）
A827: =ROW()-2 -> 825 | B827: TP | C827: 3597 | D827: 3 | E827: 03597-0 | F827: WPS 2000 实用技能 | G827: 求伯君等 | H827: 24.50 | I827: 37327 | J827: 9
A828: =ROW()-2 -> 826 | B828: TP | C828: 3800 | D828: 3 | E828: 03800-7 | F828: Word 2000 实用技能 | G828: 沈 洪 | H828: 19.00 | I828: 36982 | J828: 13
A829: =ROW()-2 -> 827 | B829: TP | C829: 3824 | D829: 2 | E829: 03824-4 | F829: Excel 2000 实用技能 (配光盘） | G829: 李 秀 | H829: 30.00 | I829: 36495 | J829: 12
A830: =ROW()-2 -> 828 | B830: TP | C830: 3799 | D830: 1 | E830: 03799-X | F830: PowerPoint 2000 实用技能 | G830: 庄洪林 | H830: 18.00 | I830: 36982 | J830: 13
A831: =ROW()-2 -> 829 | B831: TP | C831: 2492 | D831: 3 | E831: 02492-8 | F831: Outlook 2000 实用技能 | G831: 郑 坚 | H831: 12.80 | I831: 36586 | J831: 18
A832: =ROW()-2 -> 830 | B832: TP | C832: 2380 | D832: 3 | E832: 02380-8 | F832: FrontPage 2000 实用技能 | G832: 杜煜 等 | H832: 19.00 | I832: 37334 | J832: 13
A833: =ROW()-2 -> 831 | B833: TP | C833: 1207 | D833: 1 | E833: 01207-5 | F833: Access 2000 实用技能 | G833: 杨一平等 | H833: 23.00 | I833: 37408 | J833: 12
A834: =ROW()-2 -> 832 | B834: TP | C834: 1207 | D834: 2 | E834: 01207-5 | F834: Access 2000 实用技能（配光盘） | G834: 杨一平等 | H834: 43.00 | I834: 36770 | J834: 10
A835: =ROW()-2 -> 833 | B835: TP | C835: 3823 | D835: 1 | E835: 03823-6 | F835: Office 2000 基础操作与综合应用 | G835: 王 电 | H835: 22.00 | I835: 36982 | J835: 12
A836: =ROW()-2 -> 834 | B836: TP | C836: 3823 | D836: 2 | E836: 03823-6 | F836: Office 2000 基础操作与综合应用（配光盘） | G836: 王 电 | H836: 42.00 | I836: 36739 | J836: 10
A837: =ROW()-2 -> 835 | B837: TP | C837: 3945 | D837: 1 | E837: 03945-3 | F837: Auto CAD 2000 实用教程 | G837: 谭浩强主编 | H837: 35.00 | I837: 36923 | J837: 7
A838: =ROW()-2 -> 836 | B838: P- | C838: 2563 | D838: 1 | E838: 7900625631 | F838: 多媒体制作实例与技巧（配光盘） | G838: 黄心渊等 | H838: 26.00 | I838: 36739 | J838: 16
A839: =ROW()-2 -> 837 | B839: VD | C839: 9952 | D839: 1 | F839: WPS 2000 实用技能 （5VCD） | G839: 赵新国等 | H839: 125.00 | I839: 36404 | J839: 12
A840: =ROW()-2 -> 838 | B840: VD | C840: 9980 | D840: 1 | F840: Word 2000 实用技能（2VCD） | G840: 沈 洪等 | H840: 45.00 | I840: 36465 | J840: 25
A841: =ROW()-2 -> 839 | B841: VD | C841: 9978 | D841: 1 | F841: PowerPoint 2000 实用技能 (5VCD) | G841: 庄洪林等 | H841: 25.00 | I841: 36465 | J841: 25
A842: =ROW()-2 -> 840 | B842: VD | C842: 9985 | D842: 1 | F842: Excel 2000 电子表格 (3VCD） | G842: 李 秀 | H842: 75.00 | I842: 36647 | J842: 12
A843: =ROW()-2 -> 841 | B843: VD | C843: 9988 | D843: 1 | F843: Outlook 2000 个人信息管理（2VCD） | G843: 郑 坚 | H843: 50.00 | I843: 36647 | J843: 25
A844: =ROW()-2 -> 842 | B844: VD | C844: 9989 | D844: 1 | F844: Office 2000 基础操作与综合应用（2VCD） | G844: 王 电 | H844: 50.00 | I844: 36647 | J844: 25
A845: =ROW()-2 -> 843 | B845: VD | C845: 9982 | D845: 1 | F845: FrontPage 2000 网页制作（3VCD） | G845: 杜煜 等 | H845: 75.00 | I845: 36647 | J845: 12
F846: 5.其他系列丛书
F847: 信息技术丛书
A848: =ROW()-2 -> 846 | B848: TP | C848: 3965 | D848: 1 | E848: 03965-8 | F848: 离散事件动态系统 | G848: 郑大钟等 | H848: 39 | I848: 36892 | J848: 6
A849: =ROW()-2 -> 847 | B849: TP | C849: 5227 | D849: 1 | E849: 05227-1 | F849: 自适应控制系统 | G849: 谢树民 | H849: 21 | I849: 37469 | J849: 13
F850: 微软版权图书
A851: =ROW()-2 -> 849 | B851: TP | C851: 4433 | D851: 1 | E851: 04433-3 | F851: 微软电子商务制胜策略 | G851: 侯 或等译 | H851: 28.00 | I851: 37073 | J851: 10
A852: =ROW()-2 -> 850 | B852: P- | C852: 3761 | D852: 1 | E852: 7900637613 | F852: 微软电子商务解决方案――Microsoft Commerce Server 2000（配光盘） | G852: 张涛 等译 | H852: 54.00 | I852: 37226 | J852: 6
A853: =ROW()-2 -> 851 | B853: TP | C853: 4982 | D853: 1 | E853: 04982-3 | F853: 电子商务管理实务 | G853: 健莲科技译 | H853: 38.00 | I853: 37226 | J853: 9
A854: =ROW()-2 -> 852 | B854: P- | C854: 3531 | D854: 1 | E854: 7900635319 | F854: Microsoft Exchange 2000 Server 资源大全 | G854: 东方人华译 | H854: 125.00 | I854: 37104 | J854: 3
A855: =ROW()-2 -> 853 | B855: P- | C855: 3584 | D855: 1 | E855: 790063584X | F855: Microsoft SQL Server 2000 系统管理员宝典 (配光盘） | G855: 孙岩 等译 | H855: 115.00 | I855: 37104 | J855: 3
A856: =ROW()-2 -> 854 | B856: TP | C856: 3087 | D856: 4 | E856: 03087-1 | F856: Microsoft Windows 98 中文版使用大全 | G856: 博彦公司 | H856: 79.00 | I856: 36951 | J856: 5
A857: =ROW()-2 -> 855 | B857: TP | C857: 4294 | D857: 1 | E857: 04294-2 | F857: 微软知识管理策略 | G857: 夏兆彦等译 | H857: 20.00 | I857: 36982 | J857: 17
A858: =ROW()-2 -> 856 | B858: TP | C858: 1402 | D858: A | E858: 01402-7 | F858: Microsoft Windows 2000 系统管理员手册 | G858: 王悦亲等译 | H858: 43.00 | I858: 36951 | J858: 8
A859: =ROW()-2 -> 857 | B859: TP | C859: 3698 | D859: 2 | E859: 03698-5 | F859: Microsoft Office 2000 中文中小企业版使用大全 | G859: 博彦公司 | H859: 100.00 | I859: 36557 | J859: 4
A860: =ROW()-2 -> 858 | B860: TP | C860: 3747 | D860: 1 | E860: 03747-7 | F860: Microsoft Office 2000 中文专业版使用大全 | G860: 汉扬天地 | H860: 115.00 | I860: 36465 | J860: 3
A861: =ROW()-2 -> 859 | B861: TP | C861: 3768 | D861: 1 | E861: 03768-X | F861: Microsoft Office 2000 中文企业版使用大全 | G861: 汉扬天地 | H861: 140.00 | I861: 36465 | J861: 2
A862: =ROW()-2 -> 860 | B862: TP | C862: 3759 | D862: 1 | E862: 03759-0 | F862: Microsoft Word 2000 中文版使用大全 | G862: 汉扬天地 | H862: 90.00 | I862: 36465 | J862: 3
A863: =ROW()-2 -> 861 | B863: TP | C863: 4011 | D863: 1 | E863: 04011-7 | F863: Microsoft Excel 2000 中文版使用大全 | G863: 汉扬天地 | H863: 95.00 | I863: 37073 | J863: 4
A864: =ROW()-2 -> 862 | B864: P- | C864: 2259 | D864: 1 | E864: 02259-4 | F864: Microsoft Access 2000 中文版使用大全 | G864: 汉扬天地 | H864: 98.00 | I864: 37104 | J864: 3
A865: =ROW()-2 -> 863 | B865: TP | C865: 3761 | D865: 2 | E865: 03761-2 | F865: Microsoft PowerPoint 2000 中文版使用大全 | G865: 汉扬天地 | H865: 55.00 | I865: 36586 | J865: 6
A866: =ROW()-2 -> 864 | B866: TP | C866: 3769 | D866: 1 | E866: 03769-8 | F866: Microsoft Outlook 2000中文版使用大全 | G866: 汉扬天地 | H866: 65.00 | I866: 36434 | J866: 5
A867: =ROW()-2 -> 865 | B867: TP | C867: 3767 | D867: 2 | E867: 03767-1 | F867: Microsoft FrontPage 2000中文版使用大全 | G867: 汉扬天地 | H867: 99.00 | I867: 36647 | J867: 4
A868: =ROW()-2 -> 866 | B868: TP | C868: 2750 | D868: 4 | E868: 02750-1 | F868: Microsoft Office 97 中文版使用大全 | G868: 黄林红等译 | H868: 98.00 | I868: 1999 | J868: 3
A869: =ROW()-2 -> 867 | B869: TP | C869: 3083 | D869: 2 | E869: 03083-9 | F869: Microsoft Excel 97中文版使用大全 | G869: 詹津明等译 | H869: 88.00 | I869: 1999 | J869: 3
A870: =ROW()-2 -> 868 | B870: TP | C870: 3240 | D870: 3 | E870: 03240-8 | F870: Microsoft Access 97 中文版使用大全(配光盘) | G870: 贺军等译 | H870: 95.00 | I870: 36465 | J870: 4
A871: =ROW()-2 -> 869 | B871: TP | C871: 3328 | D871: 2 | E871: 03328-5 | F871: Windows 高级编程指南 (配光盘) | G871: 王书洪等译 | H871: 99.00 | I871: 36495 | J871: 3
A872: =ROW()-2 -> 870 | B872: TP 5550 12 | D872: 1 | E872: 05550-1 | F872: GNU/Linux 编程指南(第二版）入门应用精通 | G872: Kurt Wall 等著 | H872: 68.00 | I872: 37408 | J872: 4
A873: =ROW()-2 -> 871 | B873: TP | C873: 3316 | D873: 1 | E873: 03316-1 | F873: Visual C++ 使用指南 | G873: 詹津明等译 | H873: 65.00 | I873: 36281 | J873: 6
A874: =ROW()-2 -> 872 | B874: TP | C874: 3253 | D874: 1 | E874: 03253-X | F874: Microsoft Visual C++ 语言参考手册 | G874: 前导工作室译 | H874: 69.00 | I874: 1999 | J874: 5
A875: =ROW()-2 -> 873 | B875: TP | C875: 2866 | D875: 3 | E875: 02866-4 | F875: Windows NT Server 4.0 中文版使用大全 | G875: 白卫等译 | H875: 49.00 | I875: 36708 | J875: 7
A876: =ROW()-2 -> 874 | B876: TP | C876: 3243 | D876: 2 | E876: 03243-2 | F876: Visual C++ 技术内幕（第4版）(配光盘) | G876: 潘爱民等译 | H876: 96.00 | I876: 37356 | J876: 3
A877: =ROW()-2 -> 875 | B877: TP | C877: 3118 | D877: 2 | E877: 03118-5 | F877: Microsoft SQL Server 6.5 技术内幕 | G877: Ron Soukup | H877: 79.00 | I877: 1999 | J877: 5
A878: =ROW()-2 -> 876 | B878: TP | C878: 0836 | D878: 1 | E878: 00836-1 | F878: 深入理解 COM+ | G878: 潘爱民译 | H878: 25.00 | I878: 36678 | J878: 14
A879: =ROW()-2 -> 877 | B879: TP | C879: 3320 | D879: 1 | E879: 03320-X | F879: COM 技术内幕――微软组件对象模型 （配光盘） | G879: 杨秀章译 | H879: 50.00 | I879: 36678 | J879: 9
A880: =ROW()-2 -> 878 | B880: P- | C880: 3140 | D880: 1 | E880: 7900631401 | F880: 构建Active Directory 服务――业内专家经验笔录 （配光盘） | G880: 东方人华译 | H880: 59.00 | I880: 37073 | J880: 7
A881: =ROW()-2 -> 879 | B881: TP | C881: 3301 | D881: 1 | E881: 03301-3 | F881: Internet 标准与协议 | G881: 博彦公司 | H881: 32.00 | I881: 1999 | J881: 10
F882: 微软战略性技术丛书
A883: =ROW()-2 -> 881 | B883: TP | C883: 2955 | D883: 2 | E883: 02955-5 | F883: 电子贸易 | G883: David Kosiur | H883: 24.80 | I883: 1999 | J883: 15
A884: =ROW()-2 -> 882 | B884: TP | C884: 3311 | D884: 1 | E884: 03311-0 | F884: 带宽的竞争：全面理解数据传输 | G884: Cary Lu | H884: 20.00 | I884: 1999 | J884: 20
F885: 微软全面掌握系列
A886: =ROW()-2 -> 884 | B886: P- | C886: 3542 | D886: 1 | E886: 7900635424 | F886: 全面掌握 Microsoft Visual C++ 6.0 MFC 应用程序开发（配光盘） | G886: 博彦公司译 | H886: 65.00 | I886: 2001.12 | J886: 6
A887: =ROW()-2 -> 885 | B887: P- | C887: 3052 | D887: 1 | E887: 790063052X | F887: 全面掌握 MS Office 2000 应用程序开发 （配光盘） | G887: 博彦公司译 | H887: 56.00 | I887: 36831 | J887: 6
A888: =ROW()-2 -> 886 | B888: P- | C888: 3046 | D888: 1 | E888: 7900630465 | F888: 全面掌握 MS VB 6.0 基础（配光盘） | G888: 博彦公司译 | H888: 49.00 | I888: 36800 | J888: 11
A889: =ROW()-2 -> 887 | B889: P- | C889: 3015 | D889: 1 | E889: 7900630155 | F889: 全面掌握 MS VB 6.0 企业应用程序开发 （配光盘） | G889: 博彦公司译 | H889: 56.00 | I889: 36770 | J889: 8
A890: =ROW()-2 -> 888 | B890: P- | C890: 3021 | D890: 1 | E890: 790063021X | F890: 全面掌握 MS VB 6.0 应用程序开发（配光盘） | G890: 博彦公司译 | H890: 58.80 | I890: 36770 | J890: 7
A891: =ROW()-2 -> 889 | B891: P- | C891: 3008 | D891: 1 | E891: 7900630082 | F891: 全面掌握电子商务开发技术：Business to Consumer （配光盘） | G891: 博彦公司译 | H891: 46.00 | I891: 36831 | J891: 9
A892: =ROW()-2 -> 890 | B892: P- | C892: 3055 | D892: 1 | E892: 7900630554 | F892: 全面掌握电子商务开发技术：Business to Business （配光盘） | G892: 博彦公司译 | H892: 45.00 | I892: 36892 | J892: 8
A893: =ROW()-2 -> 891 | B893: P- | C893: 3018 | D893: 1 | E893: 790063018X | F893: 全面掌握 MS Visual InterDev 6.0 Web 应用程序开发 （配光盘） | G893: 博彦公司译 | H893: 63.00 | I893: 36800 | J893: 7
F894: Microsoft 程序设计系列
A895: =ROW()-2 -> 893 | B895: P- | C895: 3080 | D895: 1 | E895: 7900630805 | F895: Microsoft Internet Explorer 5 程序设计 （配光盘） | G895: 博彦公司译 | H895: 59.00 | I895: 36951 | J895: 6
A896: =ROW()-2 -> 894 | B896: P- | C896: 3192 | D896: 1 | E896: 7900631925 | F896: MFC Windows 程序设计（第2版）（配光盘） | G896: 博彦公司译 | H896: 128.00 | I896: 37319 | J896: 2
F897: 微软 Visual Studio.NET程序开发系列丛书
A898: =ROW()-2 -> 896 | B898: TP | C898: 4389 | D898: 1 | E898: 04389-2 | F898: C# 编程技术 | G898: 微软公司 东方人华 | H898: 42.00 | I898: 37135 | J898: 8
A899: =ROW()-2 -> 897 | B899: P- | C899: 3759 | D899: 1 | E899: 7900637591 | F899: C# 技术内幕 | G899: 微软公司 东方人华 | H899: 49.00 | I899: 37408 | J899: 7
A900: =ROW()-2 -> 898 | B900: TP | C900: 4434 | D900: 1 | E900: 04434-1 | F900: C# 语言参考手册 | G900: 微软公司 东方人华 | H900: 49.50 | I900: 37073 | J900: 7
A901: =ROW()-2 -> 899 | B901: TP | C901: 4462 | D901: 1 | E901: 04462-7 | F901: Visual Studio.NET开发环境使用指南 | G901: 微软公司 东方人华 | H901: 49.00 | I901: 37104 | J901: 6
A902: =ROW()-2 -> 900 | B902: TP | C902: 4620 | D902: 1 | E902: 04620-4 | F902: XML 3.0 技术内幕 | G902: 微软公司 东方人华 | H902: 72.00 | I902: 37104 | J902: 4
F903: 乐思.NET和Oracle编程经典系列
A904: =ROW()-2 -> 902 | B904: TP | C904: 5725 | D904: 1 | E904: 05725-7 | F904: J#程序设计教程――从Java到.NET的桥梁 | G904: Dr.P.G.Sarang Rahim Adatia | H904: 32.00 | I904: 37500 | J904: 11
A905: =ROW()-2 -> 903 | B905: TP | C905: 5684 | D905: 1 | E905: 05684-6 | F905: C#高级编程 | G905: Simon Robinson K.Scott Allen | H905: 128.00 | I905: 37500 | J905: 3
A906: =ROW()-2 -> 904 | B906: TP | C906: 5683 | D906: 1 | E906: 05683-8 | F906: Oracle 9i Java程序设计――使用 PLISQL和Java的解决方案 | G906: Bjarki H`olm John Carnell | H906: 88.00 | I906: 37500 | J906: 4
A907: =ROW()-2 -> 905 | B907: TP | C907: 5205 | D907: 1 | E907: 05205-0 | F907: ASP.NET入门经典――VB.NET编程篇 | G907: 崔洪斌等译 | H907: 75.00 | I907: 37347 | J907: 4
A908: =ROW()-2 -> 906 | B908: TP | C908: 5569 | D908: 1 | E908: 05569-1 | F908: ASP.NET 1.0 高级编程 | G908: 王毅等译 | H908: 128.00 | I908: 37438 | J908: 3
A909: =ROW()-2 -> 907 | B909: TP | C909: 5407 | D909: 1 | E909: 05407-X | F909: ASP.NET入门经典――C#编程篇 | G909: Chris Ullman等 | H909: 75.00 | I909: 37377 | J909: 4
A910: =ROW()-2 -> 908 | B910: TP | C910: 5334 | D910: 1 | E910: 05334-0 | F910: Oracle专家高级编程 | G910: 袁勤勇等译 | H910: 138.00 | I910: 37347 | J910: 2
A911: =ROW()-2 -> 909 | B911: TP | C911: 5236 | D911: 1 | E911: 05236-0 | F911: VB.NET高级编程 | G911: 康博译 | H911: 88.00 | I911: 37347 | J911: 2
A912: =ROW()-2 -> 910 | B912: TP | C912: 5359 | D912: 1 | E912: 05359-6 | F912: VB.NET入门经典 | G912: 康博译 | H912: 75.00 | I912: 37384 | J912: 4
A913: =ROW()-2 -> 911 | B913: TP | C913: 5333 | D913: 1 | E913: 05333-1 | F913: C#入门经典 | G913: 康博译 | H913: 96.00 | I913: 37384 | J913: 3
A914: =ROW()-2 -> 912 | B914: TP | C914: 5522 | D914: 1 | E914: 05522-1 | F914: .NET XML 高级编程 | G914: Dinar Dalvi Joe Gray等著 | H914: 75.00 | I914: 37438 | J914: 4
A915: =ROW()-2 -> 913 | B915: TP | C915: 5406 | D915: 1 | E915: 05406-1 | F915: .NET Framework高级编程 | G915: 汪钟鸣等译 | H915: 68.00 | I915: 37384 | J915: 5
A916: =ROW()-2 -> 914 | B916: TP | C916: 5366 | D916: 1 | E916: 05366-1 | F916: ASP.NET程序员参考手册 | G916: 赵彦敏译 | H916: 98.00 | I916: 37384 | J916: 3
A917: =ROW()-2 -> 915 | B917: TP | C917: 5283 | D917: 1 | E917: 05283-1 | F917: Cold Fusion 5.0高级编程 | G917: 杜炜等译 | H917: 115.00 | I917: 37384 | J917: 3
A918: =ROW()-2 -> 916 | B918: TP 5439 1 | E918: 05439-9 | F918: BizTalk 高级编程 | G918: 康博译 | H918: 68.00 | I918: 37408 | J918: 5
A919: =ROW()-2 -> 917 | B919: TP | C919: 5464 | D919: 1 | E919: 05464-9 | F919: ASP.NET Web服务高级编程 | G919: Russ Basiura等 | H919: 69.00 | I919: 37413 | J919: 4
A920: =ROW()-2 -> 918 | B920: TP | C920: 5521 | D920: 1 | E920: 05521-1 | F920: Windows Forms 高级编程 | G920: Jason Bell等 | H920: 65.00 | I920: 37413 | J920: 5
A921: =ROW()-2 -> 919 | B921: TP | C921: 5581 | D921: 1 | E921: 05581-5 | F921: .NET数据服务 C#高级编程 | G921: Fabio Clandio Ferracchiati等 | H921: 78.00 | I921: 37438 | J921: 4
A922: =ROW()-2 -> 920 | B922: TP | C922: 5564 | D922: 1 | E922: 05564-5 | F922: Visual Basic.NET数据库开发入门经典 | G922: Bill Forgey等 | H922: 65.00 | I922: 37438 | J922: 5
A923: =ROW()-2 -> 921 | B923: TP | C923: 5746 | D923: 1 | E923: 05746-X | F923: Visual Basic.NET互操作高级编程――从com和VB 6升级到.NET | G923: Billy Hollis等 | H923: 42.00 | I923: 37469 | J923: 8
A924: =ROW()-2 -> 922 | B924: TP | C924: 5619 | D924: 1 | E924: 05619-6 | F924: VB.NET事务处理高级编程 | G924: Matthew Bortniker等 | H924: 52.00 | I924: 37469 | J924: 6
A925: =ROW()-2 -> 923 | B925: TP | C925: 5728 | D925: 1 | E925: 057281 | F925: .NET 企业应用高级编程――C#编程篇 | G925: Matthew Reynolds Karli Watson等 | H925: 48.00 | I925: 37469 | J925: 8
A926: =ROW()-2 -> 924 | B926: TP | C926: 5685 | D926: 1 | E926: 05685-4 | F926: C#Web 服务高级编程――使用.NET Remoting 和ASP.NET 创建WEB服务 | G926: Ashish Banerjee | H926: 68.00 | I926: 37469 | J926: 6
A927: =ROW()-2 -> 925 | B927: TP | C927: 5749 | D927: 1 | E927: 05749-4 | F927: ASP. NET Web 站点高级编程 | G927: Marco Bellinaso Kevin Hotlman | H927: 55.00 | I927: 37500 | J927: 6
A928: =ROW()-2 -> 926 | B928: TP | C928: 5412 | D928: 1 | E928: 05412-0 | F928: 微软NET编程系列 Microsoft. NET My Services 精解 | G928: 微软公司 | H928: 69.00 | I928: 37500 | J928: 5
A929: =ROW()-2 -> 927 | B929: TP | C929: 5715 | D929: 1 | E929: 05715-X | F929: Visual C++.NET编程经典----从C++到Visual C++.NET快速进阶 | G929: Aravind Corera Stephen Fraser | H929: 46.00 | I929: 37500 | J929: 7
F930: Deitel 编程金典
A931: =ROW()-2 -> 929 | B931: TP | C931: 5751 | D931: 1 | E931: 05751-6 | F931: Deitel 编程金典; Perl How to program、Perl 编程金典 | G931: H.M.Deitel etal | H931: 128.00 | I931: 37500 | J931: 3
F932: ACCD 设计师系列丛书
A933: =ROW()-2 -> 931 | B933: TP | C933: 1329 | D933: 1 | E933: 01329-2 | F933: Illustrator 9.0 培训教程 | G933: 王晓亮 | H933: 30.00 | I933: 37257 | J933: 8
A934: =ROW()-2 -> 932 | B934: P- | C934: 3583 | D934: 1 | E934: 7900635831 | F934: Photoshop 6.0 培训教程 （配光盘） | G934: 李 涛 | H934: 43.00 | I934: 37196 | J934: 6
A935: =ROW()-2 -> 933 | B935: P- | C935: 3179 | D935: 1 | E935: 7900631798 | F935: Photoshop 6.0 中文版 培训教程 （配光盘） | G935: 李 涛 | H935: 44.00 | I935: 37358 | J935: 6
A936: =ROW()-2 -> 934 | B936: P- | C936: 3532 | D936: 1 | E936: 7900635327 | F936: After Effects 4.1 培训教程（配光盘） | G936: 秦化雨等 | H936: 31.00 | I936: 37073 | J936: 10
A937: =ROW()-2 -> 935 | B937: TP | C937: 4474 | D937: 1 | E937: 04474-0 | F937: Acrobat 4.0 中文版培训手册 | G937: 邵 喃 | H937: 23.00 | I937: 37043 | J937: 10
A938: =ROW()-2 -> 936 | B938: TP | C938: 4392 | D938: 1 | E938: 04392-2 | F938: PageMaker 6.5C 培训手册 | G938: 邵 喃 | H938: 38.00 | I938: 37333 | J938: 6
F939: EDA工程系列丛书
A940: =ROW()-2 -> 938 | B940: TP | C940: 3896 | D940: 2 | E940: 03896-1 | F940: VHDL程序设计(第二版) | G940: 曾繁泰等 | H940: 37.00 | I940: 36951 | J940: 8
A941: =ROW()-2 -> 939 | B941: TP | C941: 4312 | D941: 1 | E941: 04312-4 | F941: 可编程器件应用导论 | G941: 曾繁泰等 | H941: 30.00 | I941: 36982 | J941: 9
A942: =ROW()-2 -> 940 | B942: TP | C942: 5057 | D942: 1 | E942: 05057-0 | F942: EDA工程概论 | G942: 曾繁泰等 | H942: 41.00 | I942: 37288 | J942: 6
F943: 计算机实用技术与案例丛书
A944: =ROW()-2 -> 942 | B944: TP | C944: 1096 | D944: 1 | E944: 01096-X | F944: Java 编程实用技术与案例 | G944: 杨绍方 | H944: 34.00 | I944: 36951 | J944: 8
A945: =ROW()-2 -> 943 | B945: TP | C945: 4445 | D945: 1 | E945: 04445-7 | F945: Photoshop 6.0 实用技术与案例 | G945: 周天明等 | H945: 29.00 | I945: 37337 | J945: 7
A946: =ROW()-2 -> 944 | B946: TP | C946: 4349 | D946: 1 | E946: 04349-3 | F946: 计算机工程绘图及动画设计技巧与实例 | G946: 郭克希等 | H946: 32.00 | I946: 36982 | J946: 8
A947: =ROW()-2 -> 945 | B947: TP | C947: 4398 | D947: 1 | E947: 04398-1 | F947: Visual C++ 6.0 编程实用技术与案例 | G947: 陈元琰等 | H947: 51.00 | I947: 37196 | J947: 5
F948: 百 问 丛 书
A949: =ROW()-2 -> 947 | B949: TP | C949: 3045 | D949: 1 | E949: 03045-6 | F949: WPS 97 实用100问 | G949: 史惠康等 | H949: 8.50 | I949: 1998 | J949: 35
A950: =ROW()-2 -> 948 | B950: TP | C950: 3097 | D950: 1 | E950: 03097-9 | F950: Word 97 中文版实用100问 | G950: 史惠康等 | H950: 8.50 | I950: 1998 | J950: 35
A951: =ROW()-2 -> 949 | B951: TP | C951: 3086 | D951: 1 | E951: 03086-3 | F951: Access 97 中文版实用100问 | G951: 史惠康等 | H951: 8.50 | I951: 1998 | J951: 30
A952: =ROW()-2 -> 950 | B952: TP | C952: 3151 | D952: 1 | E952: 03151-7 | F952: PowerPoint 97中文版实用100问 | G952: 史惠康等 | H952: 8.50 | I952: 1998 | J952: 30
A953: =ROW()-2 -> 951 | B953: TP | C953: 3178 | D953: 1 | E953: 03178-9 | F953: 常用小工具软件100问 | G953: 史惠康等 | H953: 8.50 | I953: 1998 | J953: 22
F954: 电脑应用百科系列读物
A955: =ROW()-2 -> 953 | B955: TP | C955: 3929 | D955: 1 | E955: 03929-1 | F955: 电脑入门和基本操作（配光盘） | G955: 史斌星等 | H955: 25.00 | I955: 37104 | J955: 15
A956: =ROW()-2 -> 954 | B956: TP | C956: 3929 | D956: 2 | E956: 03929-1 | F956: 怎样上网和制作网页（配光盘） | G956: 高婉英等 | H956: 25.00 | I956: 37408 | J956: 14
A957: =ROW()-2 -> 955 | B957: TP | C957: 3929 | D957: 3 | E957: 03929-1 | F957: 怎样用电脑管理日常事物（配光盘） | G957: 刘朝芬等 | H957: 25.00 | I957: 36739 | J957: 15
A958: =ROW()-2 -> 956 | B958: TP | C958: 1499 | D958: 2 | E958: 01499-X | F958: 怎样玩电脑游戏 | G958: 刘朝芬 | H958: 12.00 | I958: 36861 | J958: 20
A959: =ROW()-2 -> 957 | B959: TP | C959: 3929 | D959: 4 | E959: 03929-1 | F959: 汉字输入和文稿编辑（配光盘） | G959: 史斌星等 | H959: 25.00 | I959: 36861 | J959: 15
A960: =ROW()-2 -> 958 | B960: TP | C960: 3929 | D960: 5 | E960: 03929-2 | F960: 图片的制作和欣赏（配光盘） | G960: 史斌星等 | H960: 25.00 | I960: 36861 | J960: 15
E961: IT&AT 教育部实用型信息技术人才培养系列教材
A962: =ROW()-2 -> 960 | B962: TP | C962: 2168 | D962: 1 | E962: 02168-6 | F962: Access2000中文版入门与提高 | G962: 张堪 等 | H962: 22.00 | I962: 37347
A963: =ROW()-2 -> 961 | B963: TP | C963: 4973 | D963: 2 | E963: 04973-4 | F963: Delphi6编程基础 | G963: 肖建 等 | H963: 36.00 | I963: 37347
A964: =ROW()-2 -> 962 | B964: TP | C964: 5398 | D964: 1 | E964: 05398-7 | F964: 自己动手建商务网站 | G964: 张义忠 | H964: 32.00 | I964: 37347
A965: =ROW()-2 -> 963 | B965: TP | C965: 4632 | D965: 2 | E965: 04632-8 | F965: C++语言基础教程 | G965: 徐孝凯 | H965: 28.00 | I965: 37349 | J965: 10
A966: =ROW()-2 -> 964 | B966: TP | C966: 4632 | D966: 2 | E966: 04632-8 | F966: C++语言基础教程（配光盘） | G966: 徐孝凯 | H966: 36.00 | I966: 37469 | J966: 10
A967: =ROW()-2 -> 965 | B967: TP | C967: 4579 | D967: 1 | E967: 04579-8 | F967: 自己动手组装和维护多媒体电脑 | G967: 何卫雄等 | H967: 26.00 | I967: 37257 | J967: 10
A968: =ROW()-2 -> 966 | B968: TP | C968: 4687 | D968: 1 | E968: 04687-5 | F968: 计算机机房管理 | G968: 方刚 等 | H968: 30.00 | I968: 37438 | J968: 9
A969: =ROW()-2 -> 967 | B969: TP | C969: 4703 | D969: 1 | E969: 04703-0 | F969: 常用工具软件 | G969: 孙雷 等 | H969: 18.00 | I969: 37408 | J969: 14
A970: =ROW()-2 -> 968 | B970: TP | C970: 4658 | D970: 1 | E970: 04658-1 | F970: Perl 5 程序设计 | G970: 戴高乐等 | H970: 28.00 | I970: 37135 | J970: 10
A971: =ROW()-2 -> 969 | B971: TP | C971: 4638 | D971: 4 | E971: 04638-7 | F971: Internet 应用教程 | G971: 谭浩强 | H971: 20.00 | I971: 37165 | J971: 14
A972: =ROW()-2 -> 970 | B972: TP | C972: 5011 | D972: 2 | E972: 05011-2 | F972: 边用边学 C 语言（含光盘） | G972: 郎建昭 | H972: 33.00 | I972: 37347 | J972: 11
A973: =ROW()-2 -> 971 | B973: TP | C973: 4009 | D973: 1 | E973: 04009-5 | F973: 自己动手建立个人网站 | G973: 张 秦 | H973: 20.00 | I973: 37500 | J973: 18
A974: =ROW()-2 -> 972 | B974: TP | C974: 4031 | D974: 1 | E974: 04031-1 | F974: 自己动手建立企业局域网 | G974: 吴怀宇 | H974: 33.00 | I974: 37438 | J974: 9
A975: =ROW()-2 -> 973 | B975: TP | C975: 4030 | D975: 1 | E975: 04030-3 | F975: 自己动手建立企业网站 | G975: 李颂华 | H975: 32.00 | I975: 37165 | J975: 9
A976: =ROW()-2 -> 974 | B976: TP | C976: 1378 | D976: 1 | E976: 01378-0 | F976: 自己动手制作动态网页 | G976: 邱亚希 | H976: 32.00 | I976: 36982 | J976: 9
A977: =ROW()-2 -> 975 | B977: TP | C977: 4381 | D977: 1 | E977: 04381-7 | F977: 边用边学 Delphi 编程 | G977: 刘彦利等 | H977: 19.80 | I977: 37012 | J977: 13
A978: =ROW()-2 -> 976 | B978: TP | C978: 4362 | D978: 1 | E978: 04362-9 | F978: 边用边学 Visual FoxPro 编程 | G978: 张治文 | H978: 28.00 | I978: 37347 | J978: 9
A979: =ROW()-2 -> 977 | B979: TP | C979: 1070 | D979: 1 | E979: 01070-6 | F979: 边用边学 Visual Basic 编程 | G979: 魏江江 | H979: 29.00 | I979: 37362 | J979: 8
A980: =ROW()-2 -> 978 | B980: TP | C980: 4166 | D980: 1 | E980: 04166-0 | F980: 边用边学Power Builder编程 | G980: 李礼 等 | H980: 21.00 | I980: 37319 | J980: 14
A981: =ROW()-2 -> 979 | B981: TP | C981: 4124 | D981: 1 | E981: 04124-5 | F981: 边用边学 Visual C++ 编程 | G981: 黄维通等 | H981: 34.00 | I981: 36923 | J981: 8
A982: =ROW()-2 -> 980 | B982: TP | C982: 5134 | D982: 1 | E982: 05134-8 | F982: 边用边学 Linux | G982: Xteam | H982: 24.00 | I982: 37358 | J982: 10
A983: =ROW()-2 -> 981 | B983: TP | C983: 5078 | D983: 1 | E983: 05078-3 | F983: 边用边学 计算机英语 | G983: 刘兆毓等 | H983: 18.00 | I983: 37316 | J983: 15
A984: =ROW()-2 -> 982 | B984: P- | C984: 4179 | D984: 1 | E984: 04179-1 | F984: 边用边学Fireworks设计互动网页(配光盘) | G984: 王彦峰等 | H984: 27.00 | I984: 37377 | J984: 12
A985: =ROW()-2 -> 983 | B985: TP | C985: 5212 | D985: 1 | E985: 05212-1 | F985: 多媒体基础 | G985: 陈明 | H985: 24.00 | I985: 37377 | J985: 11
F986: 信息技术 (CIT)系 列
A987: =ROW()-2 -> 985 | B987: TP | C987: 2042 | D987: 9 | E987: 02042-6 | F987: 计算机初阶 | G987: 苏运霖 | H987: 18.50 | I987: 36892 | J987: 15
E988: 看图速成系列 | F988: 看图速成系列
A989: =ROW()-2 -> 987 | B989: TP | C989: 0837 | D989: 1 | E989: 00837-X | F989: Windows 2000 中文版看图速成 | G989: 王彦峰等 | H989: 30.00 | I989: 36923 | J989: 9
A990: =ROW()-2 -> 988 | B990: TP | C990: 5515 | D990: 1 | E990: 05515-1 | F990: 常用工具软件看图速成 | G990: 程旭 等 | H990: 27.00 | I990: 37408 | J990: 9
A991: =ROW()-2 -> 989 | B991: TP | C991: 4017 | D991: 1 | E991: 04017-6 | F991: Windows ME 中文版看图速成 | G991: 王剑 等 | H991: 24.00 | I991: 36923 | J991: 10
A992: =ROW()-2 -> 990 | B992: TP | C992: 4635 | D992: 1 | E992: 04635-2 | F992: Windows XP 中文版看图速成 | G992: 黄劲杉等 | H992: 26.00 | I992: 37349 | J992: 10
A993: =ROW()-2 -> 991 | B993: TP | C993: 4625 | D993: 1 | E993: 04625-5 | F993: WPS Office 看图速成 | G993: 仇轶 等 | H993: 27.00 | I993: 37328 | J993: 9
A994: =ROW()-2 -> 992 | B994: TP | C994: 4618 | D994: 1 | E994: 04618-2 | F994: Office XP 中文版看图速成 | G994: 王冬 等 | H994: 33.00 | I994: 37135 | J994: 7
A995: =ROW()-2 -> 993 | B995: TP | C995: 4675 | D995: 1 | E995: 04675-1 | F995: Word 2002 中文版看图速成 | G995: 张少宇等 | H995: 28.00 | I995: 37226 | J995: 10
A996: =ROW()-2 -> 994 | B996: TP | C996: 4576 | D996: 1 | E996: 04576-3 | F996: Excel 2002 中文版看图速成 | G996: 潘宁 等 | H996: 27.00 | I996: 37104 | J996: 9
A997: =ROW()-2 -> 995 | B997: TP | C997: 4619 | D997: 1 | E997: 04619-0 | F997: FrontPage 2002 中文版看图速成 | G997: 李海峰等 | H997: 28.00 | I997: 37257 | J997: 9
A998: =ROW()-2 -> 996 | B998: TP | C998: 3704 | D998: 3 | E998: 03704-3 | F998: WPS 2000 中文版看图速成 | G998: 张凤龙等 | H998: 20.00 | I998: 36861 | J998: 12
A999: =ROW()-2 -> 997 | B999: TP | C999: 3477 | D999: 3 | E999: 03477-X | F999: Office 2000 中文版看图速成 | G999: 鑫万博 | H999: 25.00 | I999: 37257 | J999: 10
A1000: =ROW()-2 -> 998 | B1000: TP | C1000: 1280 | D1000: 1 | E1000: 01280-6 | F1000: Premiere 5.5 看图速成 | G1000: 郭亮 等 | H1000: 28.00 | I1000: 36951 | J1000: 10
A1001: =ROW()-2 -> 999 | B1001: TP | C1001: 4416 | D1001: 1 | E1001: 04416-3 | F1001: IE 5.5 上网起步看图速成 | G1001: 农孙雄等 | H1001: 24.00 | I1001: 37012 | J1001: 11
A1002: =ROW()-2 -> 1000 | B1002: TP | C1002: 1377 | D1002: 1 | E1002: 01377-2 | F1002: 网上冲浪看图速成 | G1002: 雨波 等 | H1002: 23.80 | I1002: 36951 | J1002: 12
A1003: =ROW()-2 -> 1001 | B1003: P- | C1003: 4006 | D1003: 1 | E1003: 7880140069 | F1003: Internet 看图速成――实用技巧篇（配光盘） | G1003: 汪 晶 | H1003: 28.00 | I1003: 37012 | J1003: 10
A1004: =ROW()-2 -> 1002 | B1004: TP | C1004: 4438 | D1004: 1 | E1004: 04438-4 | F1004: Fireworks 4 看图速成 | G1004: 夏辉 等 | H1004: 22.00 | I1004: 37012 | J1004: 11
A1005: =ROW()-2 -> 1003 | B1005: TP | C1005: 4617 | D1005: 1 | E1005: 04617-4 | F1005: AutoCAD 2002 看图速成 | G1005: 肖军 等 | H1005: 28.00 | I1005: 37104 | J1005: 10
A1006: =ROW()-2 -> 1004 | B1006: TP | C1006: 3476 | D1006: 3 | E1006: 03476-1 | F1006: Word 2000 中文版看图速成 | G1006: 应 勤 | H1006: 19.80 | I1006: 37104 | J1006: 12
A1007: =ROW()-2 -> 1005 | B1007: TP | C1007: 3454 | D1007: 2 | E1007: 03454-0 | F1007: Excel 2000 中文版看图速成 | G1007: 张凤龙 | H1007: 22.80 | I1007: 37469 | J1007: 10
A1008: =ROW()-2 -> 1006 | B1008: TP | C1008: 3579 | D1008: 2 | E1008: 03579-2 | F1008: Access 2000 中文版看图速成 | G1008: 白致铭 | H1008: 19.50 | I1008: 36465 | J1008: 10
A1009: =ROW()-2 -> 1007 | B1009: TP | C1009: 3614 | D1009: 1 | E1009: 03614-4 | F1009: Outlook 2000 中文版看图速成 | G1009: 朱宏伟 | H1009: 19.00 | I1009: 36404 | J1009: 12
A1010: =ROW()-2 -> 1008 | B1010: TP | C1010: 3455 | D1010: 2 | E1010: 03455-9 | F1010: PowerPoint 2000中文版看图速成 | G1010: 李晓红 | H1010: 19.80 | I1010: 37012 | J1010: 12
A1011: =ROW()-2 -> 1009 | B1011: TP | C1011: 3478 | D1011: 2 | E1011: 03478-8 | F1011: FrontPage 2000 中文版看图速成 | G1011: 杨学斌 | H1011: 18.00 | I1011: 37165 | J1011: 14
A1012: =ROW()-2 -> 1010 | B1012: TP | C1012: 3095 | D1012: 6 | E1012: 03095-2 | F1012: Windows 98 中文版看图速成 | G1012: 鑫万博 | H1012: 24.50 | I1012: 37362 | J1012: 10
A1013: =ROW()-2 -> 1011 | B1013: TP | C1013: 2654 | D1013: 9 | E1013: 02654-8 | F1013: Word 97中文版看图速成 | G1013: 应 勤 | H1013: 19.80 | I1013: 36647 | J1013: 11
A1014: =ROW()-2 -> 1012 | B1014: TP | C1014: 2656 | D1014: 5 | E1014: 02656-4 | F1014: Excel 97中文版看图速成 | G1014: 樊 荣 | H1014: 19.50 | I1014: 36373 | J1014: 12
A1015: =ROW()-2 -> 1013 | B1015: TP | C1015: 2653 | D1015: 9 | E1015: 02653-X | F1015: Office 97中文版看图速成 | G1015: 黄中兴 | H1015: 21.80 | I1015: 36617 | J1015: 9
A1016: =ROW()-2 -> 1014 | B1016: TP | C1016: 3165 | D1016: 1 | E1016: 03165-7 | F1016: Outlook 97 中文版看图速成 | G1016: 黎建辉 | H1016: 19.80 | I1016: 1998 | J1016: 10
A1017: =ROW()-2 -> 1015 | B1017: TP | C1017: 3338 | D1017: 3 | E1017: 03338-2 | F1017: Photoshop 5.0 看图速成 | G1017: 东方人华 | H1017: 21.00 | I1017: 36739 | J1017: 11
A1018: =ROW()-2 -> 1016 | B1018: TP | C1018: 0697 | D1018: 1 | E1018: 00697-0 | F1018: Photoshop 6.0 看图速成 | G1018: 王谦 等 | H1018: 30.00 | I1018: 37135 | J1018: 8
A1019: =ROW()-2 -> 1017 | B1019: TP | C1019: 4471 | D1019: 1 | E1019: 04471-6 | F1019: CorelDRAW 10 看图速成 | G1019: 吴光 等 | H1019: 30.80 | I1019: 37104 | J1019: 9
A1020: =ROW()-2 -> 1018 | B1020: TP | C1020: 4417 | D1020: 1 | E1020: 04417-1 | F1020: 3DS MAX 看图速成 | G1020: 马赢 等 | H1020: 32.00 | I1020: 37104 | J1020: 8
A1021: =ROW()-2 -> 1019 | B1021: TP | C1021: 1339 | D1021: 1 | E1021: 01339-X | F1021: COOL 3D 3.0 看图速成 | G1021: 王谦 等 | H1021: 28.80 | I1021: 36951 | J1021: 9
A1022: =ROW()-2 -> 1020 | B1022: TP | C1022: 3539 | D1022: 3 | E1022: 03539-3 | F1022: Authorware 5.0 看图速成 | G1022: 所玉君 | H1022: 24.50 | I1022: 37104 | J1022: 10
A1023: =ROW()-2 -> 1021 | B1023: TP | C1023: 4180 | D1023: 1 | E1023: 04180-6 | F1023: Authorware 5.x看图速成 | G1023: 魏洪斌等 | H1023: 25.00 | I1023: 36982 | J1023: 11
A1024: =ROW()-2 -> 1022 | B1024: TP | C1024: 3601 | D1024: 2 | E1024: 03601-2 | F1024: PageMaker 6.5 看图速成 | G1024: 淦 伟 | H1024: 22.50 | I1024: 36557 | J1024: 10
A1025: =ROW()-2 -> 1023 | B1025: TP | C1025: 4073 | D1025: 1 | E1025: 04073-7 | F1025: Dreamweaver 3.0 看图速成 | G1025: 王 谦 | H1025: 28.80 | I1025: 36831 | J1025: 8
A1026: =ROW()-2 -> 1024 | B1026: TP | C1026: 4472 | D1026: 1 | E1026: 04472-4 | F1026: Dreamweaver 4 看图速成 | G1026: 王冬 等 | H1026: 29.80 | I1026: 37104 | J1026: 9
A1027: =ROW()-2 -> 1025 | B1027: TP | C1027: 1200 | D1027: I | E1027: 01200-8 | F1027: Flash 5 看图速成 | G1027: 吴光 等 | H1027: 29.80 | I1027: 36982 | J1027: 8
A1028: =ROW()-2 -> 1026 | B1028: TP | C1028: 4142 | D1028: 1 | E1028: 04142-3 | F1028: FreeHand 9 看图速成 | G1028: 雷福林等 | H1028: 23.80 | I1028: 36861 | J1028: 12
A1029: =ROW()-2 -> 1027 | B1029: TP | C1029: 1132 | D1029: 1 | E1029: 01132-X | F1029: Internet 看图速成 ―― 入门篇 | G1029: 汪 晶 | H1029: 14.00 | I1029: 36861 | J1029: 15
A1030: =ROW()-2 -> 1028 | B1030: TP | C1030: 1132 | D1030: 2 | E1030: 01132-X | F1030: Internet 看图速成 ―― 入门篇（配光盘） | G1030: 汪 晶 | H1030: 24.00 | I1030: 36800 | J1030: 15
A1031: =ROW()-2 -> 1029 | B1031: TP | C1031: 1133 | D1031: 1 | E1031: 01133-8 | F1031: Internet 看图速成 ―― 提高篇 | G1031: 汪 晶 | H1031: 19.00 | I1031: 36800 | J1031: 14
A1032: =ROW()-2 -> 1030 | B1032: TP | C1032: 1133 | D1032: 2 | E1032: 01133-8 | F1032: Internet 看图速成 ―― 提高篇（配光盘） | G1032: 汪 晶 | H1032: 28.00 | I1032: 36739 | J1032: 12
A1033: =ROW()-2 -> 1031 | B1033: TP | C1033: 4087 | D1033: 1 | E1033: 04087-7 | F1033: Maya 3.0 看图速成 | G1033: 仲喃喃等 | H1033: 29.80 | I1033: 36982 | J1033: 9
A1034: =ROW()-2 -> 1032 | B1034: TP | C1034: 4227 | D1034: 1 | E1034: 04227-6 | F1034: 电脑日常维护看图速成 | G1034: 宁松 等 | H1034: 27.00 | I1034: 37438 | J1034: 9
A1035: =ROW()-2 -> 1033 | B1035: TP | C1035: 3479 | D1035: 1 | E1035: 03479-6 | F1035: Director 6.X 看图速成 | G1035: 孙久文 | H1035: 22.00 | I1035: 36281 | J1035: 10
A1036: =ROW()-2 -> 1034 | B1036: TP | C1036: 0698 | D1036: 1 | E1036: 00698-9 | F1036: Director 8.0 看图速成 | G1036: 刘刀桂等 | H1036: 21.00 | I1036: 36831 | J1036: 13
A1037: =ROW()-2 -> 1035 | B1037: TP | C1037: 5180 | D1037: 1 | E1037: 05180-1 | F1037: PageMaker7.0看图速成 | G1037: 余磊等 | H1037: 27.00 | I1037: 37316 | J1037: 10
A1038: =ROW()-2 -> 1036 | B1038: TP | C1038: 5396 | D1038: 1 | E1038: 05396-0 | F1038: Flash MX看图速成 | G1038: 巨泽建等 | H1038: 25.50 | I1038: 37377 | J1038: 10
A1039: =ROW()-2 -> 1037 | B1039: TP | C1039: 5348 | D1039: 1 | E1039: 05348-0 | F1039: Authorware 6.0看图速成 | G1039: 黄劲杉等 | H1039: 27.00 | I1039: 37347 | J1039: 9
A1040: =ROW()-2 -> 1038 | B1040: TP | C1040: 5627 | D1040: 1 | E1040: 05627-7 | F1040: Photoshop 7.0看图速成 | G1040: 凌晓聪等 | H1040: 28.00 | I1040: 37469 | J1040: 9
A1041: =ROW()-2 -> 1039 | B1041: TP | C1041: 5614 | D1041: 1 | E1041: 05614-5 | F1041: 我的第一个主页 | G1041: 王苏颖等 | H1041: 27.00 | I1041: 37469 | J1041: 10
E1042: 流 行 软 件 速 成 丛 书
A1043: =ROW()-2 -> 1041 | B1043: TP | C1043: 1313 | D1043: 2 | E1043: 01313-6 | F1043: Windows 2000 中文版使用速成 | G1043: 梁书斌等 | H1043: 32.00 | I1043: 36831 | J1043: 7
A1044: =ROW()-2 -> 1042 | B1044: TP | C1044: 4057 | D1044: 1 | E1044: 04057-5 | F1044: Windows ME 中文版使用速成 | G1044: 康博创作室 | H1044: 32.00 | I1044: 36982 | J1044: 9
A1045: =ROW()-2 -> 1043 | B1045: TP | C1045: 4727 | D1045: 1 | E1045: 04727-8 | F1045: Office XP 中文版使用速成 | G1045: 刘钦彦等 | H1045: 42.80 | I1045: 37377 | J1045: 6
A1046: =ROW()-2 -> 1044 | B1046: TP | C1046: 4692 | D1046: 1 | E1046: 04692-1 | F1046: Word 2002 中文版使用速成 | G1046: 左禹 等 | H1046: 28.00 | I1046: 37257 | J1046: 9
A1047: =ROW()-2 -> 1045 | B1047: TP | C1047: 4728 | D1047: 1 | E1047: 04728-6 | F1047: Excel 2002 中文版使用速成 | G1047: 牟洪雨等 | H1047: 29.00 | I1047: 37226 | J1047: 9
A1048: =ROW()-2 -> 1046 | B1048: TP | C1048: 4786 | D1048: 1 | E1048: 04786-3 | F1048: Access 2002 中文版使用速成 | G1048: 武陵 等 | H1048: 34.80 | I1048: 37288 | J1048: 8
A1049: =ROW()-2 -> 1047 | B1049: TP | C1049: 4693 | D1049: 1 | E1049: 04693-X | F1049: FrontPage 2002 中文版使用速成 | G1049: 任广杰等 | H1049: 24.00 | I1049: 37257 | J1049: 11
A1050: =ROW()-2 -> 1048 | B1050: TP | C1050: 4709 | D1050: 1 | E1050: 04709-X | F1050: PowerPoint 2002 中文版使用速成 | G1050: 何百磊等 | H1050: 26.00 | I1050: 37165 | J1050: 10
A1051: =ROW()-2 -> 1049 | B1051: TP | C1051: 5179 | D1051: 1 | E1051: 05179-8 | F1051: Windows XP 中文版使用速成 | G1051: 程旭等 | H1051: 30.00 | I1051: 37316 | J1051: 9
A1052: =ROW()-2 -> 1050 | B1052: TP | C1052: 2813 | D1052: 9 | E1052: 02813-3 | F1052: Office 97中文版使用速成 | G1052: 黄林红等 | H1052: 20.00 | I1052: 36892 | J1052: 10
A1053: =ROW()-2 -> 1051 | B1053: TP | C1053: 3081 | D1053: 2 | E1053: 03181-2 | F1053: Access 97中文版使用速成 | G1053: 贺民 等 | H1053: 16.00 | I1053: 1999 | J1053: 13
A1054: =ROW()-2 -> 1052 | B1054: TP | C1054: 2885 | D1054: 4 | E1054: 02885-0 | F1054: Excel 97 中文版使用速成 | G1054: 张文 等 | H1054: 15.00 | I1054: 36404 | J1054: 13
A1055: =ROW()-2 -> 1053 | B1055: TP | C1055: 4907 | D1055: 1 | E1055: 04907-6 | F1055: Visio 2002 使用速成 | G1055: 黄劲杉等 | H1055: 26.50 | I1055: 37196 | J1055: 10
A1056: =ROW()-2 -> 1054 | B1056: TP | C1056: 5010 | D1056: 1 | E1056: 05010-4 | F1056: Mastercam 8.X 使用速成 | G1056: 巨泽建等 | H1056: 36.00 | I1056: 37226 | J1056: 8
A1057: =ROW()-2 -> 1055 | B1057: TP | C1057: 3352 | D1057: 5 | E1057: 03352-8 | F1057: AutoCAD R14 中文版使用速成 | G1057: 崔洪斌等 | H1057: 19.50 | I1057: 36923 | J1057: 12
A1058: =ROW()-2 -> 1056 | B1058: TP | C1058: 3689 | D1058: 2 | E1058: 03689-6 | F1058: AutoCAD 2000 中文版使用速成 | G1058: 康博创作室 | H1058: 19.50 | I1058: 37469 | J1058: 11
A1059: =ROW()-2 -> 1057 | B1059: TP | C1059: 1068 | D1059: 1 | E1059: 01068-4 | F1059: AutoCAD 2000 I 使用速成 | G1059: 康博创作室 | H1059: 32.00 | I1059: 36982 | J1059: 9
A1060: =ROW()-2 -> 1058 | B1060: TP | C1060: 3491 | D1060: 3 | E1060: 03491-5 | F1060: Photoshop 5.0 中文版使用速成 | G1060: 康博创作室 | H1060: 27.00 | I1060: 36831 | J1060: 8
A1061: =ROW()-2 -> 1059 | B1061: TP | C1061: 1019 | D1061: 1 | E1061: 01019-6 | F1061: Photoshop 5.5 使用速成 | G1061: 康博创作室 | H1061: 30.00 | I1061: 36739 | J1061: 8
A1062: =ROW()-2 -> 1060 | B1062: TP | C1062: 4135 | D1062: 1 | E1062: 04135-0 | F1062: Photoshop 6.0 使用速成 | G1062: 王军 等 | H1062: 35.00 | I1062: 36923 | J1062: 9
A1063: =ROW()-2 -> 1061 | B1063: TP | C1063: 4402 | D1063: 1 | E1063: 04402-3 | F1063: PhotoImpact 6.0 使用速成 | G1063: 康博创作室 | H1063: 29.80 | I1063: 37012 | J1063: 9
A1064: =ROW()-2 -> 1062 | B1064: TP | C1064: 1373 | D1064: 2 | E1064: 01373-X | F1064: Maya 3.0 使用速成 | G1064: 郭骁 等 | H1064: 38.00 | I1064: 36951 | J1064: 7
A1065: =ROW()-2 -> 1063 | B1065: TP | C1065: 1458 | D1065: 2 | E1065: 01458-2 | F1065: Illustrator 9.0 使用速成 | G1065: 康博创作室 | H1065: 22.80 | I1065: 36982 | J1065: 11
A1066: =ROW()-2 -> 1064 | B1066: TP | C1066: 4384 | D1066: 1 | E1066: 04384-1 | F1066: 3DS MAX 4 使用速成 | G1066: 孙海峰等 | H1066: 25.00 | I1066: 37135 | J1066: 10
A1067: =ROW()-2 -> 1065 | B1067: TP | C1067: 0749 | D1067: 1 | E1067: 00749-7 | F1067: 3D Studio MAX R3 使用速成 | G1067: 康博创作室 | H1067: 29.00 | I1067: 36617 | J1067: 10
A1068: =ROW()-2 -> 1066 | B1068: TP | C1068: 3862 | D1068: 1 | E1068: 03862-7 | F1068: 3D Studio Viz R3 使用速成 | G1068: 王 军 | H1068: 34.80 | I1068: 36708 | J1068: 8
A1069: =ROW()-2 -> 1067 | B1069: TP | C1069: 1222 | D1069: 1 | E1069: 01222-9 | F1069: Poser 4 使用速成 | G1069: 康博创作室 | H1069: 20.00 | I1069: 36831 | J1069: 15
A1070: =ROW()-2 -> 1068 | B1070: TP | C1070: 0981 | D1070: 1 | E1070: 00981-3 | F1070: Director 8 使用速成 | G1070: 康博创作室 | H1070: 21.00 | I1070: 36800 | J1070: 12
A1071: =ROW()-2 -> 1069 | B1071: TP | C1071: 4302 | D1071: 1 | E1071: 04302-7 | F1071: 中文版 Linux 使用速成 | G1071: 张红军等 | H1071: 35.00 | I1071: 36982 | J1071: 8
A1072: =ROW()-2 -> 1070 | B1072: TP | C1072: 0886 | D1072: 1 | E1072: 00886-8 | F1072: Freehand 9 使用速成 | G1072: 康博创作室 | H1072: 28.00 | I1072: 36770 | J1072: 11
A1073: =ROW()-2 -> 1071 | B1073: TP | C1073: 4657 | D1073: 1 | E1073: 04657-3 | F1073: Corel DRAW 10 使用速成 | G1073: 吴光 等 | H1073: 37.50 | I1073: 37398 | J1073: 7
A1074: =ROW()-2 -> 1072 | B1074: TP | C1074: 2298 | D1074: 1 | E1074: 02298-4 | F1074: Corel DRAW 9 使用速成 | G1074: 康博创作室 | H1074: 18.00 | I1074: 36923 | J1074: 13
A1075: =ROW()-2 -> 1073 | B1075: TP | C1075: 3719 | D1075: 1 | E1075: 03719-1 | F1075: Authorware 5 使用速成 | G1075: 康博创作室 | H1075: 22.50 | I1075: 36951 | J1075: 10
A1076: =ROW()-2 -> 1074 | B1076: TP | C1076: 3023 | D1076: 1 | E1076: 03023-5 | F1076: VRML2.0使用速成 | G1076: 施寅 等 | H1076: 16.50 | I1076: 1998 | J1076: 13
A1077: =ROW()-2 -> 1075 | B1077: TP | C1077: 4186 | D1077: 1 | E1077: 04186-5 | F1077: Flash 5 使用速成 | G1077: 康博创作室 | H1077: 19.00 | I1077: 36892 | J1077: 13
A1078: =ROW()-2 -> 1076 | B1078: TP | C1078: 1390 | D1078: 2 | E1078: 01390-X | F1078: Norton SystemWorks 2000 使用速成 | G1078: 康博创作室 | H1078: 19.00 | I1078: 36951 | J1078: 15
A1079: =ROW()-2 -> 1077 | B1079: TP | C1079: 3962 | D1079: 1 | E1079: 03962-3 | F1079: Firework 3.0 使用速成 | G1079: 鞠盈禧等 | H1079: 20.00 | I1079: 36739 | J1079: 14
A1080: =ROW()-2 -> 1078 | B1080: TP | C1080: 3856 | D1080: 1 | E1080: 03856-2 | F1080: Dreamweaver 3.0 使用速成 | G1080: 周苏明等 | H1080: 21.00 | I1080: 36831 | J1080: 12
A1081: =ROW()-2 -> 1079 | B1081: TP | C1081: 1032 | D1081: 1 | E1081: 01032-3 | F1081: Office 2000 中文版使用速成 | G1081: 黄林红等 | H1081: 29.80 | I1081: 37438 | J1081: 7
A1082: =ROW()-2 -> 1080 | B1082: TP | C1082: 1177 | D1082: 1 | E1082: 01177-X | F1082: Word 2000 中文版使用速成 | G1082: 杨秀章等 | H1082: 26.00 | I1082: 36982 | J1082: 8
A1083: =ROW()-2 -> 1081 | B1083: TP | C1083: 1203 | D1083: 1 | E1083: 01203-2 | F1083: Excel 2000 中文版使用速成 | G1083: 潇湘工作室 | H1083: 20.00 | I1083: 36831 | J1083: 12
A1084: =ROW()-2 -> 1082 | B1084: TP | C1084: 2175 | D1084: 9 | E1084: 02175-9 | F1084: Power Point 2000 中文版使用速成 | G1084: 黄建江等 | H1084: 20.00 | I1084: 36495 | J1084: 10
A1085: =ROW()-2 -> 1083 | B1085: TP | C1085: 1305 | D1085: 1 | E1085: 01305-5 | F1085: PhotoDraw 2000 和 Publisher 2000 中文版使用速成 | G1085: 康博创作室 | H1085: 30.00 | I1085: 36617 | J1085: 8
A1086: =ROW()-2 -> 1084 | B1086: TP | C1086: 0773 | D1086: 1 | E1086: 00773-X | F1086: 我行我速 3.0 使用速成 | G1086: 康博创作室 | H1086: 23.80 | I1086: 36831 | J1086: 10
A1087: =ROW()-2 -> 1085 | B1087: TP | C1087: 3490 | D1087: 3 | E1087: 03490-9 | F1087: Front Page 2000 中文版使用速成 | G1087: 康博创作室 | H1087: 17.80 | I1087: 37438 | J1087: 14
F1088: 入门与提高丛书
A1089: =ROW()-2 -> 1087 | B1089: TP | C1089: 3075 | D1089: B | E1089: 03075-8 | F1089: Windows 98 中文版 | G1089: 鑫万博创作室 | H1089: 37.50 | I1089: 37469 | J1089: 6
A1090: =ROW()-2 -> 1088 | B1090: TP | C1090: 1149 | D1090: 1 | E1090: 01149-4 | F1090: Windows 2000 中文版入门与提高 | G1090: 东方华人 | H1090: 39.80 | I1090: 37500 | J1090: 7
A1091: =ROW()-2 -> 1089 | B1091: TP | C1091: 4089 | D1091: 1 | E1091: 04089-3 | F1091: Windows Me 中文版入门与提高 | G1091: 赵永捷等 | H1091: 34.00 | I1091: 37135 | J1091: 8
A1092: =ROW()-2 -> 1090 | B1092: TP | C1092: 3509 | D1092: 1 | E1092: 03509-1 | F1092: Windows C程序设计入门与提高 | G1092: 柳永新等 | H1092: 32.50 | I1092: 37438 | J1092: 6
A1093: =ROW()-2 -> 1091 | B1093: TP | C1093: 5576 | D1093: 1 | E1093: 05576-1 | F1093: I-DEAS 入门与提高 | G1093: 杨建新等 | H1093: 23.00 | I1093: 37438 | J1093: 10
A1094: =ROW()-2 -> 1092 | B1094: TP | C1094: 4488 | D1094: 1 | E1094: 04488-0 | F1094: Office XP 中文版入门与提高 | G1094: 东方华人 | H1094: 29.80 | I1094: 37469 | J1094: 7
A1095: =ROW()-2 -> 1093 | B1095: TP | C1095: 4567 | D1095: 1 | E1095: 04567-4 | F1095: Excel 2002 中文版入门与提高 | G1095: 东方华人 | H1095: 29.80 | I1095: 37500 | J1095: 8
A1096: =ROW()-2 -> 1094 | B1096: TP | C1096: 4663 | D1096: 1 | E1096: 04663-8 | F1096: PowerPoint 2002 中文版入门与提高 | G1096: 东方华人 | H1096: 26.00 | I1096: 37408 | J1096: 10
A1097: =ROW()-2 -> 1095 | B1097: TP | C1097: 4906 | D1097: 1 | E1097: 04906-8 | F1097: FrontPage 2002 中文版入门与提高 | G1097: 杨 聪 | H1097: 29.50 | I1097: 37408 | J1097: 8
A1098: =ROW()-2 -> 1096 | B1098: TP | C1098: 4804 | D1098: 1 | E1098: 04804-5 | F1098: Word 2002 中文版入门与提高 | G1098: 蒋川 等 | H1098: 28.00 | I1098: 37469 | J1098: 9
A1099: =ROW()-2 -> 1097 | B1099: TP | C1099: 4883 | D1099: 1 | E1099: 04883-5 | F1099: Access 2002 中文版入门与提高 | G1099: 王成辉 | H1099: 26.00 | I1099: 37368 | J1099: 9
A1100: =ROW()-2 -> 1098 | B1100: TP | C1100: 5033 | D1100: 1 | E1100: 05033-3 | F1100: AutoCAD 2002 入门与提高 | G1100: 张跃峰等 | H1100: 38.00 | I1100: 37328 | J1100: 6
A1101: =ROW()-2 -> 1099 | B1101: TP | C1101: 4238 | D1101: 1 | E1101: 04238-1 | F1101: 电脑上网入门与提高 | G1101: 东方人华 | H1101: 34.00 | I1101: 37329 | J1101: 8
A1102: =ROW()-2 -> 1100 | B1102: TP | C1102: 4062 | D1102: 1 | E1102: 04062-1 | F1102: 网页制作入门与提高 | G1102: 东方人华 | H1102: 32.00 | I1102: 37469 | J1102: 8
A1103: =ROW()-2 -> 1101 | B1103: TP | C1103: 4274 | D1103: 1 | E1103: 04274-8 | F1103: Firework 4 入门与提高 | G1103: 李鹰 等 | H1103: 28.00 | I1103: 37012 | J1103: 9
A1104: =ROW()-2 -> 1102 | B1104: TP | C1104: 2588 | D1104: 2 | E1104: 02588-6 | F1104: Windows NT 3.51中文版入门与提高 | G1104: 王国栋 | H1104: 35.00 | I1104: 1998 | J1104: 6
A1105: =ROW()-2 -> 1103 | B1105: TP | C1105: 2835 | D1105: 5 | E1105: 02835-4 | F1105: Windows NT Server 4.0中文版入门与提高 | G1105: 王国栋等 | H1105: 32.00 | I1105: 37372 | J1105: 7
A1106: =ROW()-2 -> 1104 | B1106: TP | C1106: 3602 | D1106: 2 | E1106: 03602-0 | F1106: UNIX 入门与提高 | G1106: 许锦波等 | H1106: 26.00 | I1106: 37336 | J1106: 8
A1107: =ROW()-2 -> 1105 | B1107: TP | C1107: 0967 | D1107: 1 | E1107: 0967-8 | F1107: Red Hat Linux 6.x 入门与提高 | G1107: 陆涛涛等 | H1107: 35.00 | I1107: 37104 | J1107: 8
A1108: =ROW()-2 -> 1106 | B1108: TP | C1108: 4268 | D1108: 1 | E1108: 04268-3 | F1108: 现代办公入门与提高 | G1108: 东方人华 | H1108: 38.00 | I1108: 37469 | J1108: 6
A1109: =ROW()-2 -> 1107 | B1109: TP | C1109: 5144 | D1109: 1 | E1109: 05144-5 | F1109: 现代办公（XP）入门与提高 | G1109: 东方人华 | H1109: 33.00 | I1109: 37500 | J1109: 7
A1110: =ROW()-2 -> 1108 | B1110: TP | C1110: 2972 | D1110: F | E1110: 02972-5 | F1110: Office 97 中文版入门与提高 | G1110: 吕建忠等 | H1110: 28.00 | I1110: 36892 | J1110: 8
A1111: =ROW()-2 -> 1109 | B1111: TP | C1111: 3141 | D1111: 2 | E1111: 03141-X | F1111: WPS97入门与提高 | G1111: 丁胜昔等 | H1111: 18.00 | I1111: 1998 | J1111: 12
A1112: =ROW()-2 -> 1110 | B1112: TP | C1112: 3703 | D1112: 2 | E1112: 03703-5 | F1112: WPS 2000 入门与提高 | G1112: 周 斌 等 | H1112: 28.00 | I1112: 37043 | J1112: 8
A1113: =ROW()-2 -> 1111 | B1113: TP | C1113: 3538 | D1113: 5 | E1113: 03538-5 | F1113: Office 2000 中文版入门与提高 | G1113: 东方人华 | H1113: 29.80 | I1113: 37469 | J1113: 8
A1114: =ROW()-2 -> 1112 | B1114: TP | C1114: 3611 | D1114: 3 | E1114: 03611-X | F1114: Word 2000 中文版入门与提高 | G1114: 张本龙 | H1114: 29.80 | I1114: 37377 | J1114: 8
A1115: =ROW()-2 -> 1113 | B1115: TP | C1115: 3527 | D1115: 4 | E1115: 03527-X | F1115: Excel 2000 中文版入门与提高 | G1115: 谢国锋 | H1115: 29.80 | I1115: 37347 | J1115: 8
A1116: =ROW()-2 -> 1114 | B1116: TP | C1116: 3638 | D1116: 2 | E1116: 03638-1 | F1116: PowerPoint 2000 中文版入门与提高 | G1116: 谢之明 | H1116: 27.50 | I1116: 37469 | J1116: 10
A1117: =ROW()-2 -> 1115 | B1117: TP | C1117: 2168 | D1117: 9 | E1117: 02168-6 | F1117: Access 2000 中文版入门与提高 | G1117: 张堪 等 | H1117: 22.00 | I1117: 37370 | J1117: 10
A1118: =ROW()-2 -> 1116 | B1118: TP | C1118: 3593 | D1118: 4 | E1118: 03593-8 | F1118: FrontPage 2000 中文版入门与提高 | G1118: 黄敏如 | H1118: 32.00 | I1118: 37408 | J1118: 7
A1119: =ROW()-2 -> 1117 | B1119: TP | C1119: 3737 | D1119: 1 | E1119: 03737-X | F1119: Outlook 2000 中文版入门与提高 | G1119: 郑海利 | H1119: 20.00 | I1119: 36465 | J1119: 12
A1120: =ROW()-2 -> 1118 | B1120: TP | C1120: 3840 | D1120: 1 | E1120: 03840-6 | F1120: SQL Server 7.0 入门与提高 | G1120: 周绪 等 | H1120: 35.00 | I1120: 37365 | J1120: 7
A1121: =ROW()-2 -> 1119 | B1121: TP | C1121: 4468 | D1121: 1 | E1121: 04468-6 | F1121: SQL Server 2000中文版 入门与提高 | G1121: 周绪 等 | H1121: 39.50 | I1121: 37438 | J1121: 7
A1122: =ROW()-2 -> 1120 | B1122: TP | C1122: 4448 | D1122: 1 | E1122: 04448-1 | F1122: Macromedia 网页制作软件入门与提高 | G1122: 东方人华 | H1122: 34.80 | I1122: 37371 | J1122: 6
A1123: =ROW()-2 -> 1121 | B1123: TP | C1123: 3951 | D1123: 1 | E1123: 03951-8 | F1123: Dreamweaver 3.0 入门与提高 | G1123: 杨守申等 | H1123: 29.80 | I1123: 36892 | J1123: 8
A1124: =ROW()-2 -> 1122 | B1124: TP | C1124: 4355 | D1124: 1 | E1124: 04355-8 | F1124: Dreamweaver 4 入门与提高 | G1124: 东方人华 | H1124: 29.80 | I1124: 37408 | J1124: 8
A1125: =ROW()-2 -> 1123 | B1125: TP | C1125: 4756 | D1125: 1 | E1125: 04756-1 | F1125: Dreamweaver UltraDev 4 入门与提高 | G1125: 蔡长明等 | H1125: 26.00 | I1125: 37370 | J1125: 9
A1126: =ROW()-2 -> 1124 | B1126: TP | C1126: 3762 | D1126: 2 | E1126: 03762-0 | F1126: Authorware 5.0 入门与提高 | G1126: 曲 昊 | H1126: 33.00 | I1126: 37328 | J1126: 7
A1127: =ROW()-2 -> 1125 | B1127: TP | C1127: 1208 | D1127: 1 | E1127: 01208-3 | F1127: MATLAB 5.x 入门与提高 | G1127: 龚剑 等 | H1127: 33.00 | I1127: 36982 | J1127: 7
A1128: =ROW()-2 -> 1126 | B1128: TP | C1128: 3841 | D1128: 1 | E1128: 03841-4 | F1128: 3D Studio MAX 3.0 入门与提高 | G1128: 熊歆斌 | H1128: 34.80 | I1128: 37288 | J1128: 8
A1129: =ROW()-2 -> 1127 | B1129: TP | C1129: 4328 | D1129: 1 | E1129: 04328-0 | F1129: Photoshop 6.0 入门与提高 | G1129: 应 勤 | H1129: 42.00 | I1129: 37469 | J1129: 6
A1130: =ROW()-2 -> 1128 | B1130: TP | C1130: 3250 | D1130: 7 | E1130: 03250-5 | F1130: Photoshop 5.0 入门与提高 | G1130: 应 勤 | H1130: 34.00 | I1130: 36951 | J1130: 8
A1131: =ROW()-2 -> 1129 | B1131: TP | C1131: 4041 | D1131: 1 | E1131: 04041-9 | F1131: Photoshop 5.x 入门与提高 | G1131: 应勤 等 | H1131: 39.00 | I1131: 37043 | J1131: 7
A1132: =ROW()-2 -> 1130 | B1132: TP | C1132: 4026 | D1132: 1 | E1132: 04026-5 | F1132: PhotoImpact 5.0 入门与提高 | G1132: 杨 璞 | H1132: 32.00 | I1132: 36800 | J1132: 8
A1133: =ROW()-2 -> 1131 | B1133: TP | C1133: 3873 | D1133: 1 | E1133: 03873-2 | F1133: Illustrator 8.0 中文版入门与提高 | G1133: 苏 瑞 | H1133: 29.00 | I1133: 36739 | J1133: 8
A1134: =ROW()-2 -> 1132 | B1134: TP | C1134: 3860 | D1134: 1 | E1134: 03860-0 | F1134: PageMaker 6.5C 入门与提高 | G1134: 孙全党等 | H1134: 24.80 | I1134: 37369 | J1134: 11
A1135: =ROW()-2 -> 1133 | B1135: TP | C1135: 3851 | D1135: 1 | E1135: 03851-1 | F1135: Premiere 5.X 入门与提高 | G1135: 吴英华 | H1135: 24.00 | I1135: 37104 | J1135: 10
A1136: =ROW()-2 -> 1134 | B1136: TP | C1136: 3078 | D1136: 9 | E1136: 03078-2 | F1136: AutoCAD R14 入门与提高 | G1136: 张跃峰等 | H1136: 35.00 | I1136: 37392 | J1136: 6
A1137: =ROW()-2 -> 1135 | B1137: TP | C1137: 2171 | D1137: 5 | E1137: 02171-6 | F1137: AutoCAD 2000 入门与提高 | G1137: 张跃峰等 | H1137: 42.00 | I1137: 37469 | J1137: 6
A1138: =ROW()-2 -> 1136 | B1138: TP | C1138: 3899 | D1138: 1 | E1138: 03899-6 | F1138: AutoCAD 2000 中文版入门与提高 | G1138: 陈通 等 | H1138: 42.80 | I1138: 37469 | J1138: 6
A1139: =ROW()-2 -> 1137 | B1139: TP | C1139: 3854 | D1139: 1 | E1139: 03854-6 | F1139: FreeHand 8.0 中文版入门与提高 | G1139: 张 冲 | H1139: 32.80 | I1139: 36647 | J1139: 8
A1140: =ROW()-2 -> 1138 | B1140: TP | C1140: 1008 | D1140: 1 | E1140: 01008-0 | F1140: Flash 4.0 入门与提高 | G1140: 李 鹰 | H1140: 25.00 | I1140: 36892 | J1140: 10
A1141: =ROW()-2 -> 1139 | B1141: TP | C1141: 4469 | D1141: 1 | E1141: 04469-4 | F1141: Flash 5 入门与提高 | G1141: 赵 明 | H1141: 29.50 | I1141: 37469 | J1141: 8
A1142: =ROW()-2 -> 1140 | B1142: TP | C1142: 3744 | D1142: 2 | E1142: 03744-2 | F1142: Java Script 入门与提高 | G1142: 杨 浩 | H1142: 26.80 | I1142: 36923 | J1142: 9
A1143: =ROW()-2 -> 1141 | B1143: TP | C1143: 3832 | D1143: 1 | E1143: 03832-5 | F1143: Visual J++ 6.0 入门与提高 | G1143: 赖宇阳等 | H1143: 35.00 | I1143: 36831 | J1143: 8
A1144: =ROW()-2 -> 1142 | B1144: TP | C1144: 3509 | D1144: 2 | E1144: 03509-1 | F1144: Windows C 程序设计入门与提高 | G1144: 柳永新等 | H1144: 32.50 | I1144: 36831 | J1144: 6
A1145: =ROW()-2 -> 1143 | B1145: TP | C1145: 2622 | D1145: 4 | E1145: 02622-X | F1145: Visual C++ 4.X入门与提高 | G1145: 柳永新等 | H1145: 32.00 | I1145: 1998 | J1145: 8
A1146: =ROW()-2 -> 1144 | B1146: TP | C1146: 3508 | D1146: 2 | E1146: 03508-3 | F1146: Visual C++ 6.0 入门与提高 | G1146: 徐晓刚等 | H1146: 29.80 | I1146: 37469 | J1146: 8
A1147: =ROW()-2 -> 1145 | B1147: TP | C1147: 2589 | D1147: 4 | E1147: 02589-4 | F1147: Borland C++5.0入门与提高 | G1147: 陈志全 | H1147: 35.00 | I1147: 1998 | J1147: 6
A1148: =ROW()-2 -> 1146 | B1148: TP | C1148: 3901 | D1148: 1 | E1148: 03901-1 | F1148: Delphi 5.0入门与提高 | G1148: 鲁宗相 | H1148: 36.00 | I1148: 37257 | J1148: 7
A1149: =ROW()-2 -> 1147 | B1149: TP | C1149: 1127 | D1149: 1 | E1149: 01127-3 | F1149: Director 7.0/8.0 入门与提高 | G1149: 蔡长明等 | H1149: 27.00 | I1149: 36861 | J1149: 9
A1150: =ROW()-2 -> 1148 | B1150: TP | C1150: 0767 | D1150: 1 | E1150: 00767-5 | F1150: Oracle 8 入门与提高 | G1150: 付继彬等 | H1150: 29.80 | I1150: 37369 | J1150: 9
A1151: =ROW()-2 -> 1149 | B1151: TP | C1151: 3558 | D1151: 4 | E1151: 03558-X | F1151: Visual FoxPro 6.0 中文版入门与提高 | G1151: 李加福等 | H1151: 38.00 | I1151: 37469 | J1151: 7
A1152: =ROW()-2 -> 1150 | B1152: TP | C1152: 3489 | D1152: 3 | E1152: 03489-3 | F1152: Visual Basic 6.0中文版入门与提高 | G1152: 张树兵等 | H1152: 33.00 | I1152: 37469 | J1152: 7
A1153: =ROW()-2 -> 1151 | B1153: TP | C1153: 5113 | D1153: 1 | E1153: 05113-5 | F1153: 3ds max 4入门与提高 | G1153: 金涛 等 | H1153: 31.00 | I1153: 37368 | J1153: 8
A1154: =ROW()-2 -> 1152 | B1154: TP | C1154: 5112 | D1154: 1 | E1154: 05112-7 | F1154: JSP入门与提高 | G1154: 杨学瑜 等 | H1154: 24.00 | I1154: 37469 | J1154: 9
A1155: =ROW()-2 -> 1153 | B1155: TP | C1155: 5141 | D1155: 1 | E1155: 05141-0 | F1155: Photoshop 6.x 中文版入门与提高 | G1155: 应勤 | H1155: 37.00 | I1155: 37469 | J1155: 6
A1156: =ROW()-2 -> 1154 | B1156: TP | C1156: 5372 | D1156: 1 | E1156: 05372-3 | F1156: BIOS和注册表入门与提高 | G1156: 王炯 | H1156: 29.00 | I1156: 37469 | J1156: 8
A1157: =ROW()-2 -> 1155 | B1157: TP | C1157: 5371 | D1157: 1 | E1157: 05371-1 | F1157: DB2 入门与提高 | G1157: 刘耸柏著 | H1157: 39.00 | I1157: 37377 | J1157: 7
A1158: =ROW()-2 -> 1156 | B1158: TP | C1158: 5403 | D1158: 1 | E1158: 05403-1 | F1158: WPS office 入门与提高 | G1158: 东方人华 | H1158: 27.00 | I1158: 37469 | J1158: 9
A1159: =ROW()-2 -> 1157 | B1159: TP | C1159: 5417 | D1159: 1 | E1159: 05417-7 | F1159: Windows XP中文版入门与提高 | G1159: 鑫万博创作室 | H1159: 36.00 | I1159: 37500 | J1159: 6
A1160: =ROW()-2 -> 1158 | B1160: TP | C1160: 5495 | D1160: 1 | E1160: 05495-9 | F1160: SQL Server 2000 与Visual Basic.NET数据库.NET入门与提高 | G1160: 东方人华 | H1160: 38.00 | I1160: 37500 | J1160: 6
A1161: =ROW()-2 -> 1159 | B1161: TP | C1161: 5597 | D1161: 1 | E1161: 05597-1 | F1161: Photoshop 7.0 入门与提高 | G1161: 应勤 | H1161: 34.00 | I1161: 37500 | J1161: 6
A1162: =ROW()-2 -> 1160 | B1162: TP | C1162: 5612 | D1162: 1 | E1162: 05612-9 | F1162: Delphi 6 入门与提高 | G1162: 吕伟臣 | H1162: 37.00 | I1162: 37500 | J1162: 7
A1163: =ROW()-2 -> 1161 | B1163: TP | C1163: 5651 | D1163: 1 | E1163: 05651-X | F1163: Visual C++.NET入门与提高 | G1163: 孙飞等 | H1163: 34.00 | I1163: 37469 | J1163: 8
A1164: =ROW()-2 -> 1162 | B1164: TP | C1164: 5692 | D1164: 1 | E1164: 056927 | F1164: Visual C#.NET入门与提高 | G1164: 孙永强 | H1164: 41.00 | I1164: 37469 | J1164: 6
F1165: 红旗 Linux
A1166: =ROW()-2 -> 1164 | B1166: P- | C1166: 3123 | D1166: 1 | E1166: 7900631232 | F1166: 红旗 Linux 应用软件（配光盘） | G1166: 中科红旗 | H1166: 42.00 | I1166: 37012 | J1166: 7
A1167: =ROW()-2 -> 1165 | B1167: P- | C1167: 3116 | D1167: 1 | E1167: 790063116X | F1167: 红旗 Linux 技能荟萃（配光盘） | G1167: 中科红旗 | H1167: 49.80 | I1167: 37043 | J1167: 6
A1168: =ROW()-2 -> 1166 | B1168: P- | C1168: 3125 | D1168: 1 | E1168: 7900631259 | F1168: 红旗 Linux 桌面版入门（配光盘） | G1168: 中科红旗 | H1168: 32.00 | I1168: 37043 | J1168: 11
A1169: =ROW()-2 -> 1167 | B1169: TP | C1169: 4605 | D1169: 1 | E1169: 04605-0 | F1169: Linux/UNIX 高级编程 | G1169: 中科红旗 | H1169: 60.00 | I1169: 37073 | J1169: 5
A1170: =ROW()-2 -> 1168 | B1170: P | C1170: 3124 | D1170: 1 | E1170: 7900631240 | F1170: 红旗Linux软件开发技术（配光盘） | G1170: 中科红旗 | H1170: 42.00 | I1170: 36982 | J1170: 9
F1171: 战胜系列丛书
A1172: =ROW()-2 -> 1170 | B1172: TP | C1172: 5797 | D1172: 1 | E1172: 05797-4 | F1172: 战胜Flash MX快易60讲 | G1172: 汪端 | H1172: 32.00 | I1172: 37500 | J1172: 8
F1173: 软件开发指南丛书
A1174: =ROW()-2 -> 1172 | B1174: TP | C1174: 1346 | D1174: 2 | E1174: 01346-2 | F1174: Delphi 5 开发指南 | G1174: 谢玉凤等 | H1174: 40.00 | I1174: 36951 | J1174: 7
F1175: 流行软件指南丛书
A1176: =ROW()-2 -> 1174 | B1176: TP | C1176: 0699 | D1176: 1 | E1176: 00699-7 | F1176: 红旗 Linux 使用指南 | G1176: 孔长征 | H1176: 26.00 | I1176: 36770 | J1176: 10
A1177: =ROW()-2 -> 1175 | B1177: TP | C1177: 2554 | D1177: 5 | E1177: 02554-1 | F1177: UNIX使用指南 | G1177: 杜维文 | H1177: 35.00 | I1177: 36404 | J1177: 7
A1178: =ROW()-2 -> 1176 | B1178: TP | C1178: 3366 | D1178: 1 | E1178: 03366-8 | F1178: Lotus 1-2-3 Office Pro 97 中文版使用指南 | G1178: 谢何 等 | H1178: 36.00 | I1178: 1999 | J1178: 6
A1179: =ROW()-2 -> 1177 | B1179: TP | C1179: 0765 | D1179: 1 | E1179: 00765-9 | F1179: Lotus Notes 5.0 使用指南 | G1179: 桂隽超 | H1179: 29.00 | I1179: 36831 | J1179: 9
A1180: =ROW()-2 -> 1178 | B1180: P- | C1180: 0756 | D1180: 1 | E1180: 00756-X | F1180: Windows 2000 中文版使用指南 | G1180: 李博轩等 | H1180: 32.00 | I1180: 36617 | J1180: 7
A1181: =ROW()-2 -> 1179 | B1181: TP | C1181: 4028 | D1181: 1 | E1181: 04028-1 | F1181: Windows ME 中文版使用指南 | G1181: 孟晓东等 | H1181: 32.00 | I1181: 37104 | J1181: 8
A1182: =ROW()-2 -> 1180 | B1182: TP | C1182: 2961 | D1182: 2 | E1182: 02961-X | F1182: WPS 97 使用指南 | G1182: 金帆工作室 | H1182: 15.00 | I1182: 1998 | J1182: 14
A1183: =ROW()-2 -> 1181 | B1183: TP | C1183: 3474 | D1183: 2 | E1183: 03474-5 | F1183: WPS 2000 使用指南 | G1183: 罗运模等 | H1183: 21.00 | I1183: 36434 | J1183: 12
A1184: =ROW()-2 -> 1182 | B1184: TP | C1184: 4163 | D1184: 1 | E1184: 04163-6 | F1184: 方正书版 9.0 使用速成 | G1184: 许书明 | H1184: 29.00 | I1184: 36861 | J1184: 10
A1185: =ROW()-2 -> 1183 | B1185: TP | C1185: 2920 | D1185: 2 | E1185: 02920-2 | F1185: Excel 97 中文版使用指南 | G1185: 张群英等 | H1185: 21.00 | I1185: 1998 | J1185: 10
A1186: =ROW()-2 -> 1184 | B1186: TP | C1186: 3139 | D1186: 1 | E1186: 03139-8 | F1186: PowerPoint 97中文版使用指南 | G1186: 张 羿 | H1186: 16.80 | I1186: 1998 | J1186: 15
A1187: =ROW()-2 -> 1185 | B1187: TP | C1187: 3388 | D1187: 4 | E1187: 03388-9 | F1187: AutoCAD R14 中文版使用指南 | G1187: 康博创作室 | H1187: 34.00 | I1187: 36831 | J1187: 7
A1188: =ROW()-2 -> 1186 | B1188: TP | C1188: 3107 | D1188: 3 | E1188: 3107-X | F1188: 3D Studio MAX 使用指南 | G1188: 王朝阳等 | H1188: 23.5 | I1188: 36434 | J1188: 10
A1189: =ROW()-2 -> 1187 | B1189: TP | C1189: 3251 | D1189: 4 | E1189: 03251-3 | F1189: Photoshop 5.0 使用指南 | G1189: 黄雄 等 | H1189: 28.00 | I1189: 36586 | J1189: 8
F1190: 老年人学电脑用电脑丛书（谭浩强主编）
A1191: =ROW()-2 -> 1189 | B1191: TP | C1191: 1100 | D1191: 1 | E1191: 01100-1 | F1191: 老年人学电脑用电脑丛书（套） | H1191: 90.00 | I1191: 37135 | J1191: 3
A1192: =ROW()-2 -> 1190 | B1192: TP | C1192: 4686 | D1192: 1 | E1192: 04686-7 | F1192: 怎样使用电脑 | G1192: 赵野军等 | H1192: 20.00 | I1192: 37377 | J1192: 15
A1193: =ROW()-2 -> 1191 | B1193: TP | C1193: 4726 | D1193: 1 | E1193: 04726-X | F1193: 怎样用电脑写信和理财 | G1193: 宋金珂 | H1193: 20.00 | I1193: 37135 | J1193: 13
A1194: =ROW()-2 -> 1192 | B1194: TP | C1194: 4796 | D1194: 1 | E1194: 04796-0 | F1194: 怎样上网 | G1194: 尚晓航等 | H1194: 20.00 | I1194: 37135 | J1194: 12
A1195: =ROW()-2 -> 1193 | B1195: P- | C1195: 3701 | D1195: 1 | E1195: 790063701x | F1195: 怎样制作电子相册（配光盘） | G1195: 沈洪 等 | H1195: 30.00 | I1195: 37135 | J1195: 10
A1196: =ROW()-2 -> 1194 | B1196: GP | C1196: 154 | D1196: 1 | E1196: 0154-1 | F1196: 老年人学电脑用电脑 | G1196: 谭浩强 | H1196: 10.00 | I1196: 37393 | J1196: 10
F1197: 电 脑 神 通 傻 瓜 丛 书
A1198: =ROW()-2 -> 1196 | B1198: TP | C1198: 3096 | D1198: 4 | E1198: 03096-0 | F1198: Windows 98 中文版傻瓜书 | G1198: 汉扬天地译 | H1198: 32.00 | I1198: 36617 | J1198: 9
A1199: =ROW()-2 -> 1197 | B1199: TP | C1199: 3871 | D1199: 1 | E1199: 7302038716 | F1199: Windows CE 傻瓜书 | H1199: 36.00 | I1199: 36708 | J1199: 8
A1200: =ROW()-2 -> 1198 | B1200: P- | C1200: 2260 | D1200: 1 | E1200: 7900622608 | F1200: Linux 傻瓜书（配光盘） | G1200: 王义豹译 | H1200: 39.00 | I1200: 36647 | J1200: 8
A1201: =ROW()-2 -> 1199 | B1201: TP | C1201: 2915 | D1201: 1 | E1201: 02915-6 | F1201: Mircosoft Visual InterDEV――因特网开发工具傻瓜书（配光盘） | G1201: 林福宗等译 | H1201: 46.00 | I1201: 1998 | J1201: 8
A1202: =ROW()-2 -> 1200 | B1202: TP | C1202: 3797 | D1202: 1 | E1202: 03797-3 | F1202: Office 2000 中文版傻瓜书 | G1202: 汉扬天地译 | H1202: 28.00 | I1202: 36617 | J1202: 10
A1203: =ROW()-2 -> 1201 | B1203: TP | C1203: 2360 | D1203: 6 | E1203: 02360-3 | F1203: FrontPage 2000 中文版傻瓜书 | G1203: 汉扬天地译 | H1203: 33.00 | I1203: 36678 | J1203: 8
A1204: =ROW()-2 -> 1202 | B1204: TP | C1204: 2628 | D1204: 3 | E1204: 02628-9 | F1204: PowerPoint 97中文版傻瓜书 | G1204: 赵 + 洋译 | H1204: 25.00 | I1204: 1998 | J1204: 11
A1205: =ROW()-2 -> 1203 | B1205: TP | C1205: 2950 | D1205: 1 | E1205: 02950-4 | F1205: Netscape Communicator 4 傻瓜书 | G1205: 曹 卫 译 | H1205: 28.00 | I1205: 1998 | J1205: 12
A1206: =ROW()-2 -> 1204 | B1206: TP | C1206: 2733 | D1206: 1 | E1206: 02733-1 | F1206: Windows NT Workstation 4.0中文版傻 瓜书 | G1206: 贺军等译 | H1206: 34 | I1206: 1997 | J1206: 10
A1207: =ROW()-2 -> 1205 | B1207: TP | C1207: 3133 | D1207: 1 | E1207: 03133-9 | F1207: 创建HTML4 Web页面傻瓜书(配盘) | G1207: 李建民 | H1207: 45 | I1207: 1998 | J1207: 8
F1208: 《电脑神通傻瓜丛书》新编系列
A1209: =ROW()-2 -> 1207 | B1209: TP | C1209: 3100 | D1209: 4 | E1209: 03100-2 | F1209: 中文 Windows 98 实用傻瓜书 | G1209: 钱培德等 | H1209: 19.00 | I1209: 36465 | J1209: 13
A1210: =ROW()-2 -> 1208 | B1210: TP | C1210: 3410 | D1210: 4 | E1210: 03410-9 | F1210: 中文Visual Basic 6.0 傻瓜书 | G1210: 钱培德等 | H1210: 35.00 | I1210: 36586 | J1210: 7
A1211: =ROW()-2 -> 1209 | B1211: TP | C1211: 2887 | D1211: 6 | E1211: 02887-7 | F1211: 电脑选购与配置傻瓜书 | G1211: 张夷人等 | H1211: 19.80 | I1211: 36678 | J1211: 12
A1212: =ROW()-2 -> 1210 | B1212: TP | C1212: 3020 | D1212: 8 | E1212: 03020-0 | F1212: 电脑组装与维护傻瓜书 | G1212: 张夷人等 | H1212: 21.00 | I1212: 36586 | J1212: 12
F1213: 电 脑 神 通 百 事 通 系 列
A1214: =ROW()-2 -> 1212 | B1214: P- | C1214: 2286 | D1214: 2 | E1214: 7900622861 | F1214: 计算机病毒防治百事通（配光盘） | G1214: 陈立新 | H1214: 36.00 | I1214: 36708 | J1214: 8
A1215: =ROW()-2 -> 1213 | B1215: TP | C1215: 1145 | D1215: 1 | E1215: 01145-1 | F1215: 共享软件百事通 | G1215: 张洪彬 | H1215: 35.00 | I1215: 36647 | J1215: 7
A1216: =ROW()-2 -> 1214 | B1216: TP | C1216: 1179 | D1216: 2 | E1216: 01179-6 | F1216: 电脑组装与维护百事通（配光盘） | G1216: 张夷人等 | H1216: 32.00 | I1216: 37135 | J1216: 10
F1217: 电脑使用急救手册系列
A1218: =ROW()-2 -> 1216 | B1218: TP | C1218: 4487 | D1218: 1 | E1218: 04487-2 | F1218: Word 排版急救手册 | G1218: 徐进明 | H1218: 17.00 | I1218: 37043 | J1218: 16
A1219: =ROW()-2 -> 1217 | B1219: TP | C1219: 4860 | D1219: 1 | E1219: 04860-6 | F1219: Windows 急救手册 | G1219: 郭闰丙 | H1219: 35.00 | I1219: 37344 | J1219: 8
A1220: =ROW()-2 -> 1218 | B1220: TP | C1220: 4858 | D1220: 1 | E1220: 04858-4 | F1220: 电脑常见故障急救手册 | G1220: 苏瑞 等 | H1220: 28.00 | I1220: 37377 | J1220: 9
F1221: 轻 松 学 习 系 列
A1222: =ROW()-2 -> 1220 | B1222: TP | C1222: 2240 | D1222: I | E1222: 02240-2 | F1222: 轻松学习 Windows 95 中文版 | G1222: 章 辉 | H1222: 28.00 | I1222: 36586 | J1222: 8
F1223: 轻 松 掌 握 系 列
A1224: =ROW()-2 -> 1222 | B1224: P- | C1224: 3065 | D1224: 1 | E1224: 7900630651 | F1224: 轻松掌握 Adobe Photoshop 6 (配光盘) | G1224: 张昀 等 | H1224: 42.00 | I1224: 36892 | J1224: 8
A1225: =ROW()-2 -> 1223 | B1225: P- | C1225: 2283 | D1225: 1 | E1225: 7900622837 | F1225: 轻松掌握 3D Studio MAX R3 (下)(配光盘) | G1225: 张昀 等 | H1225: 39.50 | I1225: 36647 | J1225: 9
A1226: =ROW()-2 -> 1224 | B1226: P- | C1226: 1780 | D1226: 2 | E1226: 7900617809 | F1226: 轻松掌握 Office 2000 中文标准版 (配光盘) | G1226: 张 昀 | H1226: 48.00 | I1226: 36586 | J1226: 8
A1227: =ROW()-2 -> 1225 | B1227: P- | C1227: 1777 | D1227: 1 | E1227: 7900617779 | F1227: 轻松掌握 WPS 2000（配光盘） | G1227: 初英 等 | H1227: 43.00 | I1227: 36373 | J1227: 9
A1228: =ROW()-2 -> 1226 | B1228: P- | C1228: 1796 | D1228: 2 | E1228: 7900617965 | F1228: 轻松掌握 Word 2000（配光盘） | G1228: 徐自亮等 | H1228: 48.00 | I1228: 36617 | J1228: 8
A1229: =ROW()-2 -> 1227 | B1229: P- | C1229: 2242 | D1229: 1 | E1229: 790062242X | F1229: 轻松掌握 PowerPoint 2000（配光盘） | G1229: 徐自亮等 | H1229: 39.00 | I1229: 36526 | J1229: 11
A1230: =ROW()-2 -> 1228 | B1230: P- | C1230: 2547 | D1230: 1 | E1230: 790062547X | F1230: 轻松掌握网上冲浪新技能（配光盘） | G1230: 张昀 等 | H1230: 33.00 | I1230: 37012 | J1230: 10
A1231: =ROW()-2 -> 1229 | B1231: P- | C1231: 3516 | D1231: 1 | E1231: 7900635165 | F1231: 轻松掌握个人主页制作（配光盘） | G1231: 张昀 等 | H1231: 38.00 | I1231: 37135 | J1231: 8
A1232: =ROW()-2 -> 1230 | B1232: P- | C1232: 3017 | D1232: 1 | E1232: 7900630171 | F1232: 轻松掌握电脑炒股（配光盘） | G1232: 张昀 等 | H1232: 34.00 | I1232: 37226 | J1232: 10
A1233: =ROW()-2 -> 1231 | B1233: P- | C1233: 2213 | D1233: 2 | E1233: 7900622136 | F1233: 轻松掌握 方正飞腾（配光盘） | G1233: 张昀 等 | H1233: 39.00 | I1233: 36557 | J1233: 10
A1234: =ROW()-2 -> 1232 | B1234: P- | C1234: 1734 | D1234: 1 | E1234: 7900617345 | F1234: 轻松掌握电脑使用 （配光盘） | G1234: 徐自亮等 | H1234: 58.00 | I1234: 36739 | J1234: 7
F1235: 循序渐进学用系列
A1236: =ROW()-2 -> 1234 | B1236: TP | C1236: 0969 | D1236: 1 | E1236: 00969-4 | F1236: 学用 Windows 2000 Professional 中文版 | G1236: 超峰创作室 | H1236: 29.80 | I1236: 36617 | J1236: 8
A1237: =ROW()-2 -> 1235 | B1237: TP | C1237: 3431 | D1237: 4 | E1237: 03431-1 | F1237: 学用 Office 2000 中文版 | G1237: 丁力波等 | H1237: 28.00 | I1237: 37438 | J1237: 9
A1238: =ROW()-2 -> 1236 | B1238: TP | C1238: 3620 | D1238: 2 | E1238: 03620-9 | F1238: 学用 Excel 2000 中文版 | G1238: 李铁军 | H1238: 30.00 | I1238: 36557 | J1238: 9
A1239: =ROW()-2 -> 1237 | B1239: TP | C1239: 3664 | D1239: 2 | E1239: 03664-0 | F1239: 学用 FrontPage 2000 中文版 | G1239: 李 滨 | H1239: 24.00 | I1239: 36831 | J1239: 12
A1240: =ROW()-2 -> 1238 | B1240: TP | C1240: 3795 | D1240: 1 | E1240: 03795-7 | F1240: 学用PageMaker 6.X | G1240: 强翔等译 | H1240: 48.00 | I1240: 36526 | J1240: 10
A1241: =ROW()-2 -> 1239 | B1241: TP | C1241: 3619 | D1241: 2 | E1241: 03619-5 | F1241: 学用 WPS 2000 | G1241: 宋征 等 | H1241: 25.00 | I1241: 36831 | J1241: 12
A1242: =ROW()-2 -> 1240 | B1242: TP | C1242: 0997 | D1242: 1 | E1242: 00997-X | F1242: 学用 AutoCAD 2000 | G1242: 李涛 等 | H1242: 38.00 | I1242: 37469 | J1242: 6
A1243: =ROW()-2 -> 1241 | B1243: TP | C1243: 3524 | D1243: 3 | E1243: 03524-5 | F1243: 学用 Visual FoxPro 6.0 中文版 | G1243: 冯晓利等 | H1243: 43.00 | I1243: 36982 | J1243: 6
A1244: =ROW()-2 -> 1242 | B1244: TP | C1244: 3728 | D1244: 2 | E1244: 03728-0 | F1244: 学用 Visual Basic 6.0 | G1244: 戴红等译 | H1244: 59.80 | I1244: 36982 | J1244: 6
A1245: =ROW()-2 -> 1243 | B1245: TP | C1245: 3564 | D1245: 2 | E1245: 03564-4 | F1245: 学用 Visual C++ 6.0 | G1245: 张长乐译 | H1245: 59.80 | I1245: 37408 | J1245: 5
A1246: =ROW()-2 -> 1244 | B1246: TP | C1246: 3379 | D1246: 1 | E1246: 03379-X | F1246: 学用Authorware 4 (配光盘) | G1246: 常促宇等译 | H1246: 48.00 | I1246: 36312 | J1246: 9
F1247: 实例精通系列
A1248: =ROW()-2 -> 1246 | B1248: P- | C1248: 2505 | D1248: 2 | E1248: 7900625054 | F1248: Authorware 5 实例精通（配光盘） | G1248: 叶 彬 | H1248: 30.00 | I1248: 37012 | J1248: 10
A1249: =ROW()-2 -> 1247 | B1249: P- | C1249: 2503 | D1249: 2 | E1249: 7900625038 | F1249: Photoshop 5.0-5.5 实例精通（配光盘） | G1249: 陈培军 | H1249: 36.00 | I1249: 36861 | J1249: 8
A1250: =ROW()-2 -> 1248 | B1250: P- | C1250: 2543 | D1250: 1 | E1250: 7900625437 | F1250: CorelDRAW 9 实例精通（配光盘） | G1250: 李新媛 | H1250: 42.00 | I1250: 36892 | J1250: 7
A1251: =ROW()-2 -> 1249 | B1251: TP | C1251: 4460 | D1251: 1 | E1251: 04460-0 | F1251: Dreamweaver UltraDev 4 精彩网页制作与动态网站开发 | G1251: 刘 烊 | H1251: 32.00 | I1251: 37043 | J1251: 8
A1252: =ROW()-2 -> 1250 | B1252: P- | C1252: 2506 | D1252: 2 | E1252: 7900625062 | F1252: Delphi 5 实例精通（配光盘） | G1252: 徐万力 | H1252: 30.00 | I1252: 36708 | J1252: 10
A1253: =ROW()-2 -> 1251 | B1253: P- | C1253: 2504 | D1253: 2 | E1253: 7900625046 | F1253: Visual Basic 6.0 实例精通 (配光盘) | G1253: 周 颖 | H1253: 38.00 | I1253: 37469 | J1253: 8
F1254: 实例通系列丛书
A1255: =ROW()-2 -> 1253 | B1255: P- | C1255: 3573 | D1255: 1 | E1255: 7900635734 | F1255: 实例通系列丛书――Visual Basic 基础编程百例（配光盘） | G1255: 魏江江等 | H1255: 40.00 | I1255: 37362 | J1255: 8
A1256: =ROW()-2 -> 1254 | B1256: P- | C1256: 3756 | D1256: 1 | E1256: 7900637567 | F1256: 实例通系列丛书――网页特效编程百例 （配光盘） | G1256: 林少景 | H1256: 38.00 | I1256: 37226 | J1256: 8
A1257: =ROW()-2 -> 1255 | B1257: TP | C1257: 4984 | D1257: 1 | E1257: 04984-X | F1257: 实例通系列丛书――ASP.NET 网站设计实例通 | G1257: 王 易 | H1257: 32.00 | I1257: 37226 | J1257: 8
A1258: =ROW()-2 -> 1256 | B1258: TP | C1258: 4162 | D1258: 1 | E1258: 04162-1 | F1258: 实例通系列丛书――ASP.NET 编程百例通 | G1258: 林少景 | H1258: 34.00 | I1258: 37377 | J1258: 7
A1259: =ROW()-2 -> 1257 | B1259: P- | C1259: 4328 | D1259: 1 | E1259: 7-900643-28-1 | F1259: 实例通系列丛书――Flash MX实用编程百例（配光盘） | G1259: 林少景 | H1259: 36.00 | I1259: 37469 | J1259: 9
F1260: 自学教程系列
A1261: =ROW()-2 -> 1259 | B1261: TP | C1261: 2995 | D1261: 7 | E1261: 02995-4 | F1261: Windows 98 中文版自学教程 | G1261: 康博创作室 | H1261: 37.00 | I1261: 37288 | J1261: 6
A1262: =ROW()-2 -> 1260 | B1262: TP | C1262: 4060 | D1262: 1 | E1262: 04060-5 | F1262: Windows 2000 Professional 中文版自学教程 | G1262: 益嘉创作室 | H1262: 33.00 | I1262: 36861 | J1262: 8
A1263: =ROW()-2 -> 1261 | B1263: TP | C1263: 1394 | D1263: 3 | E1263: 01394-2 | F1263: Windows 2000 Server 中文版自学教程 | G1263: 益嘉创作室 | H1263: 35.00 | I1263: 36982 | J1263: 8
A1264: =ROW()-2 -> 1262 | B1264: TP | C1264: 4153 | D1264: 1 | E1264: 04153-9 | F1264: Windows ME 中文版自学教程 | G1264: 益嘉创作室 | H1264: 31.00 | I1264: 37043 | J1264: 8
A1265: =ROW()-2 -> 1263 | B1265: TP | C1265: 3924 | D1265: 1 | E1265: 03924-0 | F1265: Linux 中文版自学教程 | G1265: 康博创作室 | H1265: 21.00 | I1265: 36800 | J1265: 12
A1266: =ROW()-2 -> 1264 | B1266: TP | C1266: 2162 | D1266: 2 | E1266: 02162-7 | F1266: Office 2000 中文版自学教程 | G1266: 益嘉创作室 | H1266: 39.80 | I1266: 37288 | J1266: 6
A1267: =ROW()-2 -> 1265 | B1267: TP | C1267: 3684 | D1267: 2 | E1267: 03684-5 | F1267: Word 2000 中文版自学教程 | G1267: 康博创作室 | H1267: 29.80 | I1267: 37104 | J1267: 8
A1268: =ROW()-2 -> 1266 | B1268: TP | C1268: 3894 | D1268: 1 | E1268: 03894-5 | F1268: Excel 2000 中文版自学教程 | G1268: 益嘉创作室 | H1268: 26.00 | I1268: 36708 | J1268: 9
A1269: =ROW()-2 -> 1267 | B1269: TP | C1269: 4033 | D1269: 1 | E1269: 04033-8 | F1269: FrontPage 2000 中文版自学教程 | G1269: 康博创作室 | H1269: 28.00 | I1269: 36982 | J1269: 10
A1270: =ROW()-2 -> 1268 | B1270: TP | C1270: 4125 | D1270: 1 | E1270: 04125-3 | F1270: Internet Explorer 5.5 中文版自学教程 | G1270: 康博创作室 | H1270: 27.00 | I1270: 36861 | J1270: 10
A1271: =ROW()-2 -> 1269 | B1271: TP | C1271: 3644 | D1271: 2 | E1271: 03644-6 | F1271: WPS 2000 自学教程 | G1271: 康博创作室 | H1271: 20.00 | I1271: 36586 | J1271: 10
A1272: =ROW()-2 -> 1270 | B1272: TP | C1272: 2220 | D1272: 2 | E1272: 02220-8 | F1272: AutoCAD 2000 （中文版）自学教程 | G1272: 段红梅等 | H1272: 47.00 | I1272: 37438 | J1272: 6
A1273: =ROW()-2 -> 1271 | B1273: TP | C1273: 1124 | D1273: 1 | E1273: 01124-9 | F1273: AutoCAD 2000 自学教程 | G1273: 益嘉创作室 | H1273: 48.00 | I1273: 36982 | J1273: 6
A1274: =ROW()-2 -> 1272 | B1274: TP | C1274: 3052 | D1274: 3 | E1274: 03052-9 | F1274: Word 97 中文版自学教程 | G1274: 益嘉创作室 | H1274: 29.80 | I1274: 1999 | J1274: 7
A1275: =ROW()-2 -> 1273 | B1275: TP | C1275: 3296 | D1275: 3 | E1275: 03296-3 | F1275: Office 97 中文版自学教程 | G1275: 益嘉创作室 | H1275: 42.00 | I1275: 1999 | J1275: 5
A1276: =ROW()-2 -> 1274 | B1276: TP | C1276: 4126 | D1276: 1 | E1276: 04126-1 | F1276: SQL Server 2000 自学教程 | G1276: 杨继平等 | H1276: 32.00 | I1276: 36982 | J1276: 9
A1277: =ROW()-2 -> 1275 | B1277: TP | C1277: 3740 | D1277: 1 | E1277: 03740-X | F1277: Microsoft Visual C++ 6.0 程序设计自学教程 | G1277: 康博创作室 | H1277: 34.80 | I1277: 37257 | J1277: 7
A1278: =ROW()-2 -> 1276 | B1278: TP | C1278: 3670 | D1278: 2 | E1278: 03670-5 | F1278: Visual FoxPro 6.0 中文版自学教程 | G1278: 益嘉创作室 | H1278: 39.80 | I1278: 36951 | J1278: 8
A1279: =ROW()-2 -> 1277 | B1279: TP | C1279: 3588 | D1279: 2 | E1279: 03588-1 | F1279: Photoshop 5.0 自学教程 | G1279: 益嘉创作室 | H1279: 29.50 | I1279: 36526 | J1279: 9
A1280: =ROW()-2 -> 1278 | B1280: TP | C1280: 1275 | D1280: 2 | E1280: 01275-X | F1280: Illustrator 9.0 实用宝典 | G1280: 张喜平等 | H1280: 24.00 | I1280: 36892 | J1280: 11
A1281: =ROW()-2 -> 1279 | B1281: TP | C1281: 4061 | D1281: 1 | E1281: 04061-3 | F1281: Illustrator 9.0 自学教程 | G1281: 益嘉创作室 | H1281: 32.00 | I1281: 36861 | J1281: 8
A1282: =ROW()-2 -> 1280 | B1282: TP | C1282: 3900 | D1282: 1 | E1282: 03900-3 | F1282: CorelDRAW 9 自学教程 | G1282: 张喜平等 | H1282: 39.80 | I1282: 37104 | J1282: 6
A1283: =ROW()-2 -> 1281 | B1283: TP | C1283: 3637 | D1283: 3 | E1283: 03637-3 | F1283: Authorware 5 自学教程 | G1283: 康博创作室 | H1283: 33.00 | I1283: 36923 | J1283: 6
A1284: =ROW()-2 -> 1282 | B1284: TP | C1284: 3946 | D1284: 1 | E1284: 03946-1 | F1284: 3D Studio MAX 3.0 自学教程 | G1284: 康博创作室 | H1284: 22.00 | I1284: 36951 | J1284: 12
A1285: =ROW()-2 -> 1283 | B1285: TP | C1285: 2978 | D1285: 1 | E1285: 02978-4 | F1285: 中文AutoCAD R14自学教程 | G1285: 林立域 | H1285: 45.00 | I1285: 1998 | J1285: 7
F1286: 实用教程系列
A1287: =ROW()-2 -> 1285 | B1287: TP | C1287: 1262 | D1287: 1 | E1287: 01262-8 | F1287: 中文 Windows 2000 实用教程 | G1287: 孟晓东等 | H1287: 18.00 | I1287: 36586 | J1287: 12
A1288: =ROW()-2 -> 1286 | B1288: TP | C1288: 3109 | D1288: 7 | E1288: 03109-6 | F1288: 中文 Windows 98实用教程 | G1288: 谢术清等 | H1288: 15.00 | I1288: 37438 | J1288: 13
A1289: =ROW()-2 -> 1287 | B1289: TP | C1289: 3643 | D1289: 2 | E1289: 03643-8 | F1289: WPS 2000 实用教程 | G1289: 合力工作室 | H1289: 16.80 | I1289: 36739 | J1289: 14
A1290: =ROW()-2 -> 1288 | B1290: TP | C1290: 3688 | D1290: 1 | E1290: 03688-8 | F1290: 中文 Outlook 2000 实用教程 | G1290: 合力工作室 | H1290: 13.50 | I1290: 36465 | J1290: 15
A1291: =ROW()-2 -> 1289 | B1291: TP | C1291: 3678 | D1291: 2 | E1291: 03678-0 | F1291: 中文 FrontPage 2000 实用教程 | G1291: 合力工作室 | H1291: 15.00 | I1291: 37469 | J1291: 15
A1292: =ROW()-2 -> 1290 | B1292: TP | C1292: 3679 | D1292: 2 | E1292: 03679-9 | F1292: 中文 Excel 2000 实用教程 | G1292: 合力工作室 | H1292: 15.00 | I1292: 37469 | J1292: 15
A1293: =ROW()-2 -> 1291 | B1293: TP | C1293: 3702 | D1293: 1 | E1293: 03702-7 | F1293: 中文 PowerPoint 2000 实用教程 | G1293: 合力工作室 | H1293: 11.50 | I1293: 37469 | J1293: 20
A1294: =ROW()-2 -> 1292 | B1294: TP | C1294: 3639 | D1294: 1 | E1294: 03639-X | F1294: 中文 Word 2000 中文版实用教程 | G1294: 合力工作室 | H1294: 17.00 | I1294: 37319 | J1294: 14
A1295: =ROW()-2 -> 1293 | B1295: TP | C1295: 3764 | D1295: 1 | E1295: 03764-7 | F1295: 中文 Access 2000 中文版实用教程 | G1295: 合力工作室 | H1295: 17.00 | I1295: 37328 | J1295: 13
A1296: =ROW()-2 -> 1294 | B1296: TP | C1296: 3776 | D1296: 1 | E1296: 03776-0 | F1296: 3D Studio MAX 3.0 实用教程 | G1296: 陆水 等 | H1296: 16.00 | I1296: 36526 | J1296: 16
A1297: =ROW()-2 -> 1295 | B1297: TP | C1297: 4861 | D1297: 1 | E1297: 04861-4 | F1297: 中文Office 实用教程 | G1297: 王冬 等 | H1297: 29.80 | I1297: 37165
F1298: 实用培训教程系列
A1299: =ROW()-2 -> 1297 | B1299: P- | C1299: 2521 | D1299: 1 | E1299: 7900625216 | F1299: CorelDRAW 9 实用培训教程 | G1299: 李新媛 | H1299: 35.00 | I1299: 36982 | J1299: 9
A1300: =ROW()-2 -> 1298 | B1300: TP 5474 1 | D1300: 1 | E1300: 05474-6 | F1300: Director 8.5 实用培训教程 | G1300: 龚正伟张璇 | H1300: 30.00 | I1300: 37408 | J1300: 9
A1301: =ROW()-2 -> 1299 | B1301: P- | C1301: 3028 | D1301: 1 | E1301: 7900630287 | F1301: Access 2000 实用培训教程 （配光盘） | G1301: 白松涛 | H1301: 35.00 | I1301: 37104 | J1301: 10
A1302: =ROW()-2 -> 1300 | B1302: TP | C1302: 5053 | D1302: 1 | E1302: 05053-8 | F1302: Oracle 9i 中文版实用培训教程 | G1302: 赵伯山 | H1302: 33.00 | I1302: 37371 | J1302: 8
A1303: =ROW()-2 -> 1301 | B1303: TP | C1303: 5408 | D1303: 1 | E1303: 05408-8 | F1303: Oracle 9i中文版基础教程 | G1303: 张曜等 | H1303: 35.00 | I1303: 37469 | J1303: 7
A1304: =ROW()-2 -> 1302 | B1304: P- | C1304: 2520 | D1304: 1 | F1304: Oracle 9i 中文版实用培训教程 | G1304: 邹 冰 | H1304: 35.00 | I1304: 37329 | J1304: 7
A1305: =ROW()-2 -> 1303 | B1305: P- | C1305: 4135 | D1305: 1 | E1305: 00641-35 | F1305: Visual C++.NET中文版实用培训教程 | G1305: 晓东等 | H1305: 23.00 | I1305: 37316 | J1305: 8
A1306: =ROW()-2 -> 1304 | B1306: TP | C1306: 5209 | D1306: 1 | E1306: 05209-3 | F1306: Maya4.0实用培训教程 | G1306: 薛树旗等 | H1306: 26.00 | I1306: 37316 | J1306: 10
A1307: =ROW()-2 -> 1305 | B1307: TP | C1307: 5224 | D1307: 1 | E1307: 05224-7 | F1307: Authorware 6.0实用培训教程 | G1307: 焦智芳 | H1307: 34.00 | I1307: 37469 | J1307: 7
A1308: =ROW()-2 -> 1306 | B1308: TP | C1308: 5235 | D1308: 1 | E1308: 05235-2 | F1308: Visual Basic.Net中文 版实用培训教程 | G1308: 李万红等 | H1308: 28.00 | I1308: 37316 | J1308: 9
A1309: =ROW()-2 -> 1307 | B1309: TP | C1309: 5306 | D1309: 1 | E1309: 05306-5 | F1309: Flash MX实用培训教程 | G1309: 李伟等 | H1309: 26.00 | I1309: 37362 | J1309: 10
A1310: =ROW()-2 -> 1308 | B1310: TP | C1310: 5466 | D1310: 1 | E1310: 05466-1 | F1310: Photoshop 7.0实用培训教程 | G1310: 许书明 | H1310: 32.00 | I1310: 37469 | J1310: 8
A1311: =ROW()-2 -> 1309 | B1311: TP | C1311: 5440 | D1311: 1 | E1311: 05440-1 | F1311: Autodesk VIZ4实用培训教程 | G1311: 王军等 | H1311: 36.00 | I1311: 37391 | J1311: 8
A1312: =ROW()-2 -> 1310 | B1312: TP | C1312: 5519 | D1312: 1 | E1312: 05519-X | F1312: 多媒体电脑组装实用培训教程 | G1312: 许书明 | H1312: 25.00 | I1312: 37408 | J1312: 9
F1313: 计算机综合培训教程系列
A1314: =ROW()-2 -> 1312 | B1314: TP | C1314: 4399 | D1314: 1 | E1314: 04399-X | F1314: 电脑办公综合培训教程 | G1314: 李月强 | H1314: 27.00 | I1314: 37335 | J1314: 8
F1315: 计算机实用技术培训系列教材
A1316: =ROW()-2 -> 1314 | B1316: TP | C1316: 4946 | D1316: 1 | E1316: 04946-7 | F1316: 办公系列软件简明教程 | G1316: 杨大勇等 | H1316: 26.00 | I1316: 37370 | J1316: 9
A1317: =ROW()-2 -> 1315 | B1317: TP | C1317: 5460 | D1317: 1 | E1317: 05460-1 | F1317: SQL Server 2000 培训教程 | G1317: 陈小兵等 | H1317: 29.00 | I1317: 37438 | J1317: 9
F1318: 计算机实用技术系列教程
A1319: =ROW()-2 -> 1317 | B1319: TP | C1319: 5391 | D1319: 1 | E1319: 05391-x | F1319: 新编微机基础实用教程 | G1319: 赵世霞 | H1319: 33.00 | I1319: 37469 | J1319: 8
F1320: 简明教程系列
A1321: =ROW()-2 -> 1319 | B1321: TP | C1321: 4022 | D1321: 1 | E1321: 04022-2 | F1321: 中文 Windows 2000 上网简明教程 | G1321: 甘登岱等 | H1321: 22.00 | I1321: 36951 | J1321: 12
A1322: =ROW()-2 -> 1320 | B1322: TP | C1322: 3988 | D1322: 6 | E1322: 03028-6 | F1322: 中文Windows 2000 Server 简明教程 | G1322: 罗运模 | H1322: 28.00 | I1322: 36861 | J1322: 10
A1323: =ROW()-2 -> 1321 | B1323: P- | C1323: 3517 | D1323: 2 | E1323: 03517-2 | F1323: 中文Windows 2000 专业版简明教程 | G1323: 罗运模等 | H1323: 28.00 | I1323: 36647 | J1323: 11
A1324: =ROW()-2 -> 1322 | B1324: TP | C1324: 3202 | D1324: 2 | E1324: 03202-5 | F1324: 中文Windows 98 上网简明教程 | G1324: 罗运模等 | H1324: 28.00 | I1324: 1999 | J1324: 9
A1325: =ROW()-2 -> 1323 | B1325: TP | C1325: 3028 | D1325: 6 | E1325: 03028-6 | F1325: 中文Windows 98 简明教程 | G1325: 罗运模 | H1325: 22.00 | I1325: 36923 | J1325: 12
A1326: =ROW()-2 -> 1324 | B1326: TP | C1326: 3537 | D1326: 2 | E1326: 03537-7 | F1326: Word 2000 简明教程 | G1326: 罗运模等 | H1326: 26.00 | I1326: 36465 | J1326: 10
A1327: =ROW()-2 -> 1325 | B1327: TP | C1327: 3608 | D1327: 2 | E1327: 03608-X | F1327: 中文 Excel 2000 简明教程 | G1327: 罗运模等 | H1327: 25.00 | I1327: 36465 | J1327: 10
A1328: =ROW()-2 -> 1326 | B1328: TP | C1328: 3581 | D1328: 2 | E1328: 03581-4 | F1328: PowerPoint 2000 简明教程 | G1328: 罗运模等 | H1328: 26.00 | I1328: 36434 | J1328: 10
A1329: =ROW()-2 -> 1327 | B1329: TP | C1329: 3026 | D1329: 1 | E1329: 03026-X | F1329: 中文Lotus Freelance Graphics 97简明教程 | G1329: 罗运模等 | H1329: 19.50 | I1329: 1998 | J1329: 15
A1330: =ROW()-2 -> 1328 | B1330: TP | C1330: 3027 | D1330: 1 | E1330: 03027-8 | F1330: 中文Lotus Word Pro 97 简明教程 | G1330: 罗运模等 | H1330: 19.00 | I1330: 1998 | J1330: 15
A1331: =ROW()-2 -> 1329 | B1331: TP | C1331: 3336 | D1331: 1 | E1331: 03336-6 | F1331: 写作之星――WDS 98 简明教程 | G1331: 罗运模等 | H1331: 17.00 | I1331: 36281 | J1331: 15
A1332: =ROW()-2 -> 1330 | B1332: TP | C1332: 3618 | D1332: 3 | E1332: 03618-7 | F1332: SQL Server 实用简明教程 | G1332: 黄维通等 | H1332: 18.00 | I1332: 36923 | J1332: 15
A1333: =ROW()-2 -> 1331 | B1333: TP | C1333: 2647 | D1333: 2 | E1333: 02647-5 | F1333: VHDL简明教程 | G1333: 王小军 | H1333: 19.50 | I1333: 36861 | J1333: 15
F1334: 电 脑 秀 丛 书
A1335: =ROW()-2 -> 1333 | B1335: P- | C1335: 3117 | D1335: 1 | E1335: 7900631178 | F1335: 百年经典――多媒体影视制作实战 （配光盘） | G1335: 吴春旭等 | H1335: 76.00 | I1335: 36982 | J1335: 7
A1336: =ROW()-2 -> 1334 | B1336: P- | C1336: 3143 | D1336: 1 | E1336: 7900631437 | F1336: 网络冠军（配光盘） | G1336: 王 彦 | H1336: 45.00 | I1336: 37073 | J1336: 7
A1337: =ROW()-2 -> 1335 | B1337: P- | C1337: 3529 | D1337: 1 | E1337: 7900635297 | F1337: 世界公园――3DS VIZ R3.0 再现世界建筑奇观（配光盘） | G1337: 数字公社 | H1337: 38.00 | I1337: 37135 | J1337: 10
A1338: =ROW()-2 -> 1336 | B1338: P- | C1338: 3197 | D1338: 1 | E1338: 7900631976 | F1338: 虚拟国的日记――Photoshop 6.0 探索 （配光盘） | G1338: 数字公社 | H1338: 46.00 | I1338: 37135 | J1338: 7
A1339: =ROW()-2 -> 1337 | B1339: P- | C1339: 3149 | D1339: 1 | E1339: 7900631496 | F1339: 戏剧人生――活用 Photoshop 与 Premiere （配光盘） | G1339: 数字公社 | H1339: 39.00 | I1339: 37135 | J1339: 9
A1340: =ROW()-2 -> 1338 | B1340: P- | C1340: 3563 | D1340: 1 | E1340: 7900635637 | F1340: 生物大疯狂――3DS MAX 4.0 与 Maya 4.0 生物制作特效（配光盘） | G1340: 数字公社 | H1340: 48.00 | I1340: 37135 | J1340: 13
A1341: =ROW()-2 -> 1339 | B1341: P- | C1341: 3520 | D1341: 1 | E1341: 7900635203 | F1341: 室内风景――3DS MAX 室内装潢经典实例 （配光盘） | G1341: 数字公社 | H1341: 32.00 | I1341: 37104 | J1341: 11
A1342: =ROW()-2 -> 1340 | B1342: P- | C1342: 3151 | D1342: 1 | E1342: 7900631518 | F1342: 变形金刚――3DS MAX 的诱惑（配光盘） | G1342: 李 等 | H1342: 58.00 | I1342: 37104 | J1342: 10
F1343: 电 脑 DIY 系 列
A1344: =ROW()-2 -> 1342 | B1344: TP | C1344: 3958 | D1344: 1 | E1344: 03958-5 | F1344: 精品网页制作 DIY | G1344: 甘登岱等 | H1344: 39.00 | I1344: 37012 | J1344: 7
A1345: =ROW()-2 -> 1343 | B1345: TP | C1345: 0678 | D1345: 1 | E1345: 00678-4 | F1345: 精品电脑绘图 DIY | G1345: 甘登岱等 | H1345: 36.00 | I1345: 36770 | J1345: 8
A1346: =ROW()-2 -> 1344 | B1346: TP | C1346: 4133 | D1346: 1 | E1346: 04133-4 | F1346: 精品图像处理DIY | G1346: 甘登岱等 | H1346: 32.00 | I1346: 36892 | J1346: 9
A1347: =ROW()-2 -> 1345 | B1347: TP | C1347: 0750 | D1347: 1 | E1347: 00750-0 | F1347: 电脑 DIY 一点通 | G1347: 小熊在线 | H1347: 20.00 | I1347: 36739 | J1347: 12
A1348: =ROW()-2 -> 1346 | B1348: TP | C1348: 4183 | D1348: 1 | E1348: 04183-0 | F1348: 电脑 DIY 一点通 （2001版） | G1348: 张晓 等 | H1348: 25.00 | I1348: 37104 | J1348: 10
A1349: =ROW()-2 -> 1347 | B1349: TP | C1349: 4343 | D1349: 1 | E1349: 04343-4 | F1349: 电脑 DIY2001 局域网资源共享 | G1349: 林建铭 | H1349: 46.00 | I1349: 37165 | J1349: 6
A1350: =ROW()-2 -> 1348 | B1350: TP | C1350: 4483 | D1350: 1 | E1350: 04483-X | F1350: 局域网建设 DIY | G1350: 曲景东等 | H1350: 32.00 | I1350: 37469 | J1350: 8
A1351: =ROW()-2 -> 1349 | B1351: TP | C1351: 4295 | D1351: 1 | E1351: 04295-0 | F1351: DIY 2001 电脑选购/组装/维修 | G1351: 江钧研究室 | H1351: 30.00 | I1351: 37104 | J1351: 8
A1352: =ROW()-2 -> 1350 | B1352: TP | C1352: 1321 | D1352: 1 | E1352: 01321-7 | F1352: 免费网站 DIY | G1352: 陈长念 | H1352: 18.00 | I1352: 36892 | J1352: 17
A1353: =ROW()-2 -> 1351 | B1353: TP | C1353: 4226 | D1353: 1 | E1353: 04226-8 | F1353: 网络生活 DIY | G1353: 刘 霄 | H1353: 26.00 | I1353: 36923 | J1353: 11
A1354: =ROW()-2 -> 1352 | B1354: P- | C1354: 3196 | D1354: 1 | E1354: 7900631968 | F1354: 网上炒股 DIY （配光盘） | G1354: 韦宇 等 | H1354: 32.00 | I1354: 37012 | J1354: 10
A1355: =ROW()-2 -> 1353 | B1355: TP | C1355: 1102 | D1355: 1 | E1355: 01002-8 | F1355: 电脑死机急救 DIY | G1355: 解健彬 | H1355: 18.00 | I1355: 37012 | J1355: 15
A1356: =ROW()-2 -> 1354 | B1356: TP | C1356: 4016 | D1356: 1 | E1356: 04016-8 | F1356: 包罗万象 ―― 电脑硬件DIY应用大全 | G1356: 荣钦科技 | H1356: 24.00 | I1356: 36982 | J1356: 11
A1357: =ROW()-2 -> 1355 | B1357: TP | C1357: 4071 | D1357: 1 | E1357: 04071-0 | F1357: 电脑选购与配置 DIY | G1357: 马汝峰等 | H1357: 35.00 | I1357: 36982 | J1357: 9
F1358: 清华电脑学堂
A1359: =ROW()-2 -> 1357 | B1359: TP | C1359: 5610 | D1359: 1 | E1359: 05610-1 | F1359: Delphi 6 程序设计培训教程 | G1359: 王渝等 | H1359: 29.00 | I1359: 37438 | J1359: 9
A1360: =ROW()-2 -> 1358 | B1360: TP | C1360: 5215 | D1360: 1 | E1360: 05215-8 | F1360: 办公文秘上机培训教程 | G1360: 周予滨 | H1360: 28.00 | I1360: 37438 | J1360: 8
A1361: =ROW()-2 -> 1359 | B1361: TP | C1361: 5611 | D1361: 1 | E1361: 05611-1 | F1361: C/C++程序设计培训教程 | G1361: 王雷编著 | H1361: 38.00 | I1361: 37438 | J1361: 7
A1362: =ROW()-2 -> 1360 | B1362: TP | C1362: 5566 | D1362: 1 | E1362: 05566-1 | F1362: Java程序设计培训教程 | G1362: 孙燕等 | H1362: 24.00 | I1362: 37438 | J1362: 10
A1363: =ROW()-2 -> 1361 | B1363: TP | C1363: 5052 | D1363: 1 | E1363: 05052-x | F1363: 互联网上机培训教程 | G1363: 周予滨 | H1363: 29.00 | I1363: 37347 | J1363: 8
A1364: =ROW()-2 -> 1362 | B1364: TP | C1364: 5217 | D1364: 1 | E1364: 05217-4 | F1364: XML 1.x 编程培训教程 | G1364: 赵克立等 | H1364: 32.00 | I1364: 37347 | J1364: 9
A1365: =ROW()-2 -> 1363 | B1365: TP | C1365: 5176 | D1365: 1 | E1365: 05176-3 | F1365: 零起点学电脑上机培训教程 | G1365: 史斌星等 | H1365: 24.00 | I1365: 37377 | J1365: 10
A1366: =ROW()-2 -> 1364 | B1366: TP | C1366: 5335 | D1366: 1 | E1366: 05335-9 | F1366: 网页制作上机培训教程 | G1366: 周予滨 | H1366: 25.00 | I1366: 37347 | J1366: 9
A1367: =ROW()-2 -> 1365 | B1367: TP | C1367: 5402 | D1367: 1 | E1367: 05402-9 | F1367: 平面设计上机培训教程 | G1367: 周予滨 | H1367: 26.00 | I1367: 37469 | J1367: 9
A1368: =ROW()-2 -> 1366 | B1368: TP | C1368: 5415 | D1368: 1 | E1368: 05415-1 | F1368: 电脑组装与维修上机培训教程 | G1368: 周予滨 | H1368: 28.00 | I1368: 37377 | J1368: 8
A1369: =ROW()-2 -> 1367 | B1369: TP | C1369: 5489 | D1369: 1 | E1369: 05489-4 | F1369: Excel 会计电算化培训教程 | G1369: 俞建海等 | H1369: 19.00 | I1369: 37469 | J1369: 13
A1370: =ROW()-2 -> 1368 | B1370: P | C1370: 4184 | D1370: 1 | E1370: 04184-X | F1370: AutoCAD 2002中文版培训教程 | G1370: 孙立斌等 | H1370: 38.00 | I1370: 37414 | J1370: 8
A1371: =ROW()-2 -> 1369 | B1371: TP | C1371: 5419 | D1371: 1 | F1371: ASP.NET编程培训教程 | G1371: 赵克立 | H1371: 32.00 | I1371: 37414 | J1371: 9
A1372: =ROW()-2 -> 1370 | B1372: TP | C1372: 5628 | D1372: 1 | E1372: 05628-5 | F1372: Visual C++程序设计培训教程 | G1372: 赵克立 | H1372: 48.00 | I1372: 37438 | J1372: 6
F1373: 工具软件实用详解系列
A1374: =ROW()-2 -> 1372 | B1374: TP | C1374: 3738 | D1374: 1 | E1374: 03738-8 | F1374: Internet 工具和翻译软件实用详解 | G1374: 骞文 等 | H1374: 28.00 | I1374: 37408 | J1374: 8
A1375: =ROW()-2 -> 1373 | B1375: TP | C1375: 3727 | D1375: 1 | E1375: 03727-2 | F1375: FreeHand 8.0 实用详解 | G1375: 雷 波 | H1375: 28.00 | I1375: 36465 | J1375: 12
A1376: =ROW()-2 -> 1374 | B1376: TP | C1376: 1181 | D1376: 1 | E1376: 01181-8 | F1376: CorelDRAW 9 实用详解 | G1376: 张 韬 | H1376: 35.00 | I1376: 36708 | J1376: 7
A1377: =ROW()-2 -> 1375 | B1377: TP | C1377: 3829 | D1377: 1 | E1377: 03829-5 | F1377: PageMaker 6.5 C 实用详解 | G1377: 雷 波 | H1377: 28.00 | I1377: 36526 | J1377: 12
A1378: =ROW()-2 -> 1376 | B1378: TP | C1378: 3754 | D1378: 1 | E1378: 03754-X | F1378: Adobe Illustrator 8.0 中文版实用详解 | G1378: 雷 波 | H1378: 30.00 | I1378: 36495 | J1378: 9
A1379: =ROW()-2 -> 1377 | B1379: TP | C1379: 3631 | D1379: 1 | E1379: 03631-4 | F1379: 系统工具、杀毒工具及测试工具实用详解 | G1379: 崔 勃 | H1379: 21.00 | I1379: 36465 | J1379: 12
F1380: 参 考 详 解 系 列
A1381: =ROW()-2 -> 1379 | B1381: TP | C1381: 3816 | D1381: 2 | E1381: 03816-3 | F1381: Visual FoxPro 6.0 参考详解 | G1381: 方建平等 | H1381: 46.00 | I1381: 36617 | J1381: 8
A1382: =ROW()-2 -> 1380 | B1382: TP | C1382: 3796 | D1382: 2 | E1382: 03796-5 | F1382: Visual Basic 6.0 中文版参考详解 | G1382: 李怀明等 | H1382: 62.00 | I1382: 37347 | J1382: 5
A1383: =ROW()-2 -> 1381 | B1383: TP | C1383: 3772 | D1383: 1 | E1383: 03772-8 | F1383: Visual C++ 6.0 参考详解 | G1383: 刘金龙等 | H1383: 62.00 | I1383: 36892 | J1383: 6
A1384: =ROW()-2 -> 1382 | B1384: TP | C1384: 3793 | D1384: 1 | E1384: 03793-0 | F1384: Borland C++ Builder 3.0/4.0 高级类参考详解 | G1384: 王秀娟等 | H1384: 46.00 | I1384: 36617 | J1384: 8
A1385: =ROW()-2 -> 1383 | B1385: TP | C1385: 3773 | D1385: 2 | E1385: 03773-6 | F1385: Delphi 4.0/5.0 类参考详解 | G1385: 秦绪佳等 | H1385: 48.00 | I1385: 36647 | J1385: 7
F1386: 技法教室1+1系列
A1387: =ROW()-2 -> 1385 | B1387: P- | C1387: 3096 | D1387: 1 | E1387: 7900630961 | F1387: Dreamweaver 3.0 技法教室 1+1（配光盘） | G1387: 周予滨 | H1387: 35 | I1387: 36861 | J1387: 11
A1388: =ROW()-2 -> 1386 | B1388: P- | C1388: 3112 | D1388: 1 | E1388: 7900631127 | F1388: Authorware 5.X 技法教室 1+1 （配光盘） | G1388: 周予滨 | H1388: 38.00 | I1388: 36951 | J1388: 9
A1389: =ROW()-2 -> 1387 | B1389: P- | C1389: 3157 | D1389: 1 | E1389: 7900631577 | F1389: Flash 5.0 技法教室 1+1 （配光盘） | G1389: 周予滨 | H1389: 36.00 | I1389: 36982 | J1389: 10
A1390: =ROW()-2 -> 1388 | B1390: P- | C1390: 3193 | D1390: 1 | E1390: 7900631933 | F1390: Fireworks 4.0 技法教室 1+1（配光盘） | G1390: 周予滨 | H1390: 36.00 | I1390: 37012 | J1390: 11
A1391: =ROW()-2 -> 1389 | B1391: P- | C1391: 3097 | D1391: 1 | E1391: 790063097X | F1391: Director 8.0 技法教室 1+1（配光盘） | G1391: 周予滨 | H1391: 32 | I1391: 36861 | J1391: 11
F1392: SCO OpenServer 5 实用大全丛书
A1393: =ROW()-2 -> 1391 | B1393: TP | C1393: 3239 | D1393: 1 | E1393: 03239-4 | F1393: SCO OpenServer用户指南 | G1393: 胡钦谙等译 | H1393: 98.00 | I1393: 1999 | J1393: 7
A1394: =ROW()-2 -> 1392 | B1394: TP | C1394: 3219 | D1394: 1 | E1394: 03219-X | F1394: SCO OpenServer系统管理指南 | G1394: 胡才勇等译 | H1394: 98.00 | I1394: 1999 | J1394: 8
A1395: =ROW()-2 -> 1393 | B1395: TP | C1395: 3218 | D1395: 1 | E1395: 03218-1 | F1395: SCO OpenServer 网络指南 | G1395: 何军等译 | H1395: 126.00 | I1395: 1999 | J1395: 6
A1396: =ROW()-2 -> 1394 | B1396: TP | C1396: 3124 | D1396: 1 | E1396: 03124-X | F1396: SCO OpenServer开发系统编程工具指南 | G1396: 熊胜峰等译 | H1396: 168.00 | I1396: 1999 | J1396: 6
A1397: =ROW()-2 -> 1395 | B1397: TP | C1397: 3220 | D1397: 1 | E1397: 03220-3 | F1397: SCO OpenServer程序员技术精粹 | G1397: 李祥凯等译 | H1397: 88.00 | I1397: 1998 | J1397: 13
F1398: Osborne 计算机专业技术丛书
A1399: =ROW()-2 -> 1397 | B1399: P- | C1399: 3177 | D1399: 1 | E1399: 7900631771 | F1399: Windows 系统策略（配光盘） | G1399: 天宏工作室译 | H1399: 63.00 | I1399: 37196 | J1399: 7
A1400: =ROW()-2 -> 1398 | B1400: TP | C1400: 4029 | D1400: 1 | E1400: 04029-X | F1400: 实用联网指南 | G1400: 天宏工作室译 | H1400: 38.00 | I1400: 36800 | J1400: 9
A1401: =ROW()-2 -> 1399 | B1401: TP | C1401: 4427 | D1401: 1 | E1401: 04427-9 | F1401: Windows 2000 实用指南 | G1401: 天宏工作室译 | H1401: 65.00 | I1401: 37012 | J1401: 5
A1402: =ROW()-2 -> 1400 | B1402: TP | C1402: 4601 | D1402: 1 | E1402: 04601-8 | F1402: Windows 2000 Active Directory | G1402: 天宏工作室译 | H1402: 50.00 | I1402: 37165 | J1402: 6
A1403: =ROW()-2 -> 1401 | B1403: TP | C1403: 4970 | D1403: 1 | E1403: 04970-X | F1403: Windows 2000 DNS 服务器 | G1403: 天宏工作室译 | H1403: 58.80 | I1403: 37226 | J1403: 5
A1404: =ROW()-2 -> 1402 | B1404: P- | C1404: 4127 | D1404: 1 | E1404: 04127-1 | F1404: Windows 2000 程序设计（配光盘） | G1404: 天宏工作室译 | H1404: 108.00 | I1404: 37438 | J1404: 3
A1405: =ROW()-2 -> 1403 | B1405: P- | C1405: 3178 | D1405: 1 | E1405: 790063178X | F1405: Windows 2000 与 UNIX 集成指南（配光盘） | G1405: 天宏工作室译 | H1405: 65.00 | I1405: 37196 | J1405: 1
A1406: =ROW()-2 -> 1404 | B1406: TP | C1406: 4076 | D1406: 1 | E1406: 04076-1 | F1406: Windows 2000 设计与移植 | G1406: 天宏 工作室译 | H1406: 58.00 | I1406: 36831 | J1406: 6
A1407: =ROW()-2 -> 1405 | B1407: TP | C1407: 4182 | D1407: 1 | E1407: 04182-2 | F1407: SQL Server 7 备份与还原 | G1407: 天宏工作室译 | H1407: 50.00 | I1407: 36951 | J1407: 7
A1408: =ROW()-2 -> 1406 | B1408: TP | C1408: 4277 | D1408: 1 | E1408: 04277-2 | F1408: Windows Web 脚本开发指南 （配软盘） | G1408: 天宏工 作室译 | H1408: 68.00 | I1408: 36982 | J1408: 6
A1409: =ROW()-2 -> 1407 | B1409: TP | C1409: 4770 | D1409: 1 | E1409: 04770-7 | F1409: Solaris 管理实用指南 | G1409: 天宏工 作室译 | H1409: 48.00 | I1409: 37165 | J1409: 7
A1410: =ROW()-2 -> 1408 | B1410: P- | C1410: 3075 | D1410: 1 | E1410: 7900630759 | F1410: COM+ 开发指南 （配光盘） | G1410: 天宏工 作室译 | H1410: 56.00 | I1410: 36892 | J1410: 7
A1411: =ROW()-2 -> 1409 | B1411: TP | C1411: 5050 | D1411: 1 | E1411: 05050-3 | F1411: 使用Visual Studio 6开发Web数据库应用程序 | G1411: 天宏工 作室译 | H1411: 74.00 | I1411: 37316 | J1411: 4
A1412: =ROW()-2 -> 1410 | B1412: TP | C1412: 5066 | D1412: 1 | E1412: 05066-1 | F1412: 北电网络故障排除与优化 | G1412: 天宏工 作室译 | H1412: 63.00 | I1412: 37347 | J1412: 5
A1413: =ROW()-2 -> 1411 | B1413: TP | C1413: 5703 | D1413: 1 | E1413: 0573-6 | F1413: 北电网络实用指南 | G1413: 天宏工 作室译 | H1413: 48.00 | I1413: 37500 | J1413: 7
F1414: ATM 与 B-ISDN 技术丛书 （影印版）
A1415: =ROW()-2 -> 1413 | B1415: TN | C1415: 2816 | D1415: 3 | E1415: 02816-8 | F1415: 宽带网络技术基础（ATM：Foundation for Broadband Networks） | G1415: Uyless Black | H1415: 22.00 | I1415: 1998 | J1415: 11
A1416: =ROW()-2 -> 1414 | B1416: TN | C1416: 2817 | D1416: 2 | E1416: 02817-6 | F1416: 宽带网络信令（ATM：Signaling in Broadband Networks） | G1416: Uyless Black | H1416: 12.00 | I1416: 1998 | J1416: 25
A1417: =ROW()-2 -> 1415 | B1417: TN | C1417: 2815 | D1417: 4 | E1417: 02815-X | F1417: 现代通信最新技术（第2版） (Emerging Communications Technologies 2nd Edition) | G1417: Uyless Black | H1417: 26.00 | I1417: 37469 | J1417: 12
A1418: =ROW()-2 -> 1416 | B1418: TN | C1418: 2818 | D1418: 2 | E1418: 02818-4 | F1418: 宽带网络性能分析 （Broadband Integrated Networks） | G1418: Mischa Schwartz | H1418: 19.80 | I1418: 1998 | J1418: 13
A1419: =ROW()-2 -> 1417 | B1419: TN | C1419: 2819 | D1419: 2 | E1419: 02819-2 | F1419: ATM网络规划与管理（Planning and Managing ATM Networks） | G1419: Dan Minoli | H1419: 17.00 | I1419: 1998 | J1419: 15
A1420: =ROW()-2 -> 1418 | B1420: TN | C1420: 2821 | D1420: 3 | E1420: 02821-4 | F1420: ATM网互通技术 （Internet Working with ATM） | G1420: Uyless Black | H1420: 13.80 | I1420: 1999 | J1420: 20
A1421: =ROW()-2 -> 1419 | B1421: TN | C1421: 2820 | D1421: 1 | E1421: 02820-6 | F1421: 解决因特网、企业网和居民宽带的新途径(ATM：The New Paradigm for Internet，Intranet and Residential Broadband Services and Applications ) | G1421: Timothy Kwok | H1421: 21.00 | I1421: 1998 | J1421: 14
F1422: ATM 与 B-ISDN 技术丛书(翻译版）
A1423: =ROW()-2 -> 1421 | B1423: TP | C1423: 1182 | D1423: 1 | E1423: 01182-6 | F1423: 现代通信最新技术（第2版） | G1423: 贺苏宁译 | H1423: 36.00 | I1423: 37257 | J1423: 9
A1424: =ROW()-2 -> 1422 | B1424: TP | C1424: 0840 | D1424: 1 | E1424: 00840-X | F1424: ATM 宽带网络 | G1424: 吕良双等译 | H1424: 64.00 | I1424: 36892 | J1424: 5
F1425: VHDL 与集成电路设计丛书
A1426: =ROW()-2 -> 1424 | B1426: TP | C1426: 3932 | D1426: 1 | E1426: 03932-1 | F1426: 用 VHDL 设计电子线路 | G1426: 边计年等译 | H1426: 42.00 | I1426: 36982 | J1426: 7
A1427: =ROW()-2 -> 1425 | B1427: P- | C1427: 2502 | D1427: 1 | E1427: 790062502X | F1427: VHDL 语言100例详解（配光盘） | G1427: 北京理工大学 | H1427: 52.00 | I1427: 36982 | J1427: 5
A1428: =ROW()-2 -> 1426 | B1428: P- | C1428: 3536 | D1428: 1 | E1428: 790063536X | F1428: 硬件描述语言 Verilog（第四版 配光盘） | G1428: 刘明业等译 | H1428: 36.00 | I1428: 37104 | J1428: 8
F1429: Microsoft 编程系列
A1430: =ROW()-2 -> 1428 | B1430: P- | C1430: 2569 | D1430: 1 | E1430: 7900625690 | F1430: 基于服务器的应用程序技术内幕（配光盘） （Inside Server-Based Applications) | G1430: 潇湘工作室译 | H1430: 89.00 | I1430: 36861 | J1430: 5
A1431: =ROW()-2 -> 1429 | B1431: P- | C1431: 3527 | D1431: 1 | E1431: 7900635270 | F1431: Direct 3D 技术内幕（配光盘） | G1431: 李晔 等译 | H1431: 58.00 | I1431: 37104 | J1431: 7
A1432: =ROW()-2 -> 1430 | B1432: P- | C1432: 3089 | D1432: 1 | E1432: 7900630899 | F1432: ADO 编程技术 （配光盘） | H1432: 48.00 | I1432: 36951 | J1432: 10
A1433: =ROW()-2 -> 1431 | B1433: P- | C1433: 3159 | D1433: 1 | E1433: 7900631593 | F1433: 应用程序调试技术（配光盘） | G1433: 潘文林等译 | H1433: 65.00 | I1433: 37104 | J1433: 7
A1434: =ROW()-2 -> 1432 | B1434: P- | C1434: 3158 | D1434: 1 | E1434: 7900631585 | F1434: Exchange 2000 Server 协作式网络编程 （配光盘） | H1434: 80.00 | I1434: 37012 | J1434: 5
F1435: Windows 2000 系列图书
A1436: =ROW()-2 -> 1434 | B1436: TP | C1436: 0904 | D1436: 1 | E1436: 00904-X | F1436: 中文Windows 2000 办公自动化培训教程 | G1436: 张涛 等 | H1436: 24.00 | I1436: 36770 | J1436: 11
A1437: =ROW()-2 -> 1435 | B1437: TP | C1437: 3859 | D1437: 1 | E1437: 03859-7 | F1437: Windows 2000 中文版初中级教程（基础篇） | G1437: 东箭工作室 | H1437: 20.00 | I1437: 36739 | J1437: 12
A1438: =ROW()-2 -> 1436 | B1438: TP | C1438: 3857 | D1438: 1 | E1438: 03857-0 | F1438: Windows 2000 中文版初中级教程（网络篇） | G1438: 东箭工作室 | H1438: 18.00 | I1438: 36770 | J1438: 15
A1439: =ROW()-2 -> 1437 | B1439: TP | C1439: 3909 | D1439: 1 | E1439: 03909-7 | F1439: Windows 2000 中文版初中级教程（系统篇） | G1439: 东箭工作室 | H1439: 16.00 | I1439: 36739 | J1439: 15
A1440: =ROW()-2 -> 1438 | B1440: TP | C1440: 3960 | D1440: 1 | E1440: 03960-7 | F1440: Windows ME 中文版初中级教程 | G1440: 东箭工作室 | H1440: 39.50 | I1440: 36739 | J1440: 6
A1441: =ROW()-2 -> 1439 | B1441: TP | C1441: 1072 | D1441: 1 | E1441: 01072-2 | F1441: Windows 2000 中文版快速入门 | G1441: 高越明等 | H1441: 32.00 | I1441: 36617 | J1441: 9
A1442: =ROW()-2 -> 1440 | B1442: TP | C1442: 1128 | D1442: 2 | E1442: 01128-1 | F1442: Windows 2000 中文版实用组网技术 | G1442: 刘芝泉等 | H1442: 28.00 | I1442: 36678 | J1442: 10
A1443: =ROW()-2 -> 1441 | B1443: TP | C1443: 1113 | D1443: 1 | E1443: 01113-3 | F1443: Windows2000中文版注册表使用开发与实例 | G1443: 曹国钧等 | H1443: 58.00 | I1443: 36831 | J1443: 4
A1444: =ROW()-2 -> 1442 | B1444: TP | C1444: 2280 | D1444: 3 | E1444: 02280-1 | F1444: Windows 2000 中文版新功能 | G1444: 康博创作室 | H1444: 18.00 | I1444: 36586 | J1444: 13
A1445: =ROW()-2 -> 1443 | B1445: TP | C1445: 0742 | D1445: 1 | E1445: 00742-X | F1445: Windows 2000 中文版系统管理员指南 | G1445: 孙全党等 | H1445: 36.00 | I1445: 36770 | J1445: 7
A1446: =ROW()-2 -> 1444 | B1446: TP | C1446: 3787 | D1446: 1 | E1446: 03787-6 | F1446: 中文版 Windows 2000 网络实用指南 | G1446: 戴有炜 | H1446: 32.00 | I1446: 36831 | J1446: 9
A1447: =ROW()-2 -> 1445 | B1447: TP | C1447: 4078 | D1447: 1 | E1447: 04078-8 | F1447: 中文版 Windows 2000 网络专业指南 | G1447: 戴有炜 | H1447: 35.00 | I1447: 36831 | J1447: 8
A1448: =ROW()-2 -> 1446 | B1448: TP | C1448: 3874 | D1448: 1 | E1448: 03874-0 | F1448: 图解 Windows 2000 配置手册 | G1448: 郝岩冰 | H1448: 29.00 | I1448: 36770 | J1448: 10
F1449: Microsoft SQL Server 2000 开发指南系列丛书
A1450: =ROW()-2 -> 1448 | B1450: TP | C1450: 4666 | D1450: 1 | E1450: 04666-2 | F1450: 数据库创建、数据仓库与优化 | G1450: 郭东清等译 | H1450: 41.00 | I1450: 37104 | J1450: 8
A1451: =ROW()-2 -> 1449 | B1451: TP | C1451: 4673 | D1451: 1 | E1451: 04673-5 | F1451: 分析服务 | G1451: 东方人华译 | H1451: 62.00 | I1451: 37135 | J1451: 6
A1452: =ROW()-2 -> 1450 | B1452: TP | C1452: 4622 | D1452: 1 | E1452: 04622-0 | F1452: 复制与自然语言查询 | G1452: 李宏益等 | H1452: 56.00 | I1452: 37135 | J1452: 6
A1453: =ROW()-2 -> 1451 | B1453: TP | C1453: 4954 | D1453: 1 | E1453: 04954-8 | F1453: Microsoft T-SQL 语言参考 | G1453: 潇湘工作室译 | H1453: 69.00 | I1453: 37196 | J1453: 4
A1454: =ROW()-2 -> 1452 | B1454: TP | C1454: 4623 | D1454: 1 | E1454: 04623-9 | F1454: SQL Server 2000 体系结构与 XML/Internet 支持 | G1454: 孙岩 等译 | H1454: 67.00 | I1454: 37135 | J1454: 5
A1455: =ROW()-2 -> 1453 | B1455: TP | C1455: 4624 | D1455: 1 | E1455: 04624-7 | F1455: T-SQL 存储过程和表引用 | G1455: 潇湘工作室 | H1455: 104.00 | I1455: 37135 | J1455: 3
F1456: JAVA 技 术 丛 书
A1457: =ROW()-2 -> 1455 | B1457: TP | C1457: 0719 | D1457: 1 | E1457: 00719-5 | F1457: Java 2 程序设计 | G1457: 王克宏等 | H1457: 32.00 | I1457: 36982 | J1457: 9
A1458: =ROW()-2 -> 1456 | B1458: TP | C1458: 3306 | D1458: 1 | E1458: 03306-4 | F1458: Java 编程技术教程 | G1458: 姚晓春等 | H1458: 42.00 | I1458: 37012 | J1458: 6
A1459: =ROW()-2 -> 1457 | B1459: TP | C1459: 3269 | D1459: 1 | E1459: 03269-6 | F1459: JavaBean 组件程序设计 | G1459: 王 炜 | H1459: 32.00 | I1459: 1999 | J1459: 7
A1460: =ROW()-2 -> 1458 | B1460: TP | C1460: 3518 | D1460: 1 | E1460: 03518-0 | F1460: Java 多媒体程序设计 | G1460: 王峰 等 | H1460: 17.50 | I1460: 36312 | J1460: 14
A1461: =ROW()-2 -> 1459 | B1461: TP | C1461: 3350 | D1461: 1 | E1461: 03350-1 | F1461: Java 服务器程序设计 | G1461: 宋辉 等 | H1461: 27.00 | I1461: 36739 | J1461: 10
A1462: =ROW()-2 -> 1460 | B1462: TP | C1462: 2537 | D1462: 1 | E1462: 02537-1 | F1462: Java 程序设计语言 | G1462: 吴建平等 | H1462: 28.00 | I1462: 36739 | J1462: 9
A1463: =ROW()-2 -> 1461 | B1463: TP | C1463: 3380 | D1463: 1 | E1463: 03380-3 | F1463: Java 问答式教程 | G1463: 戴梅萼 | H1463: 26.50 | I1463: 36739 | J1463: 11
F1464: JAVA 技术教程系列丛书
A1465: =ROW()-2 -> 1463 | B1465: TP | C1465: 5234 | D1465: 1 | E1465: 05234-4 | F1465: Java 技术教程（基础篇） | G1465: 王克宏等 | H1465: 48.00 | I1465: 37347 | J1465: 6
F1466: Visual Foxpro 6.0中文版技术丛书
A1467: =ROW()-2 -> 1465 | B1467: TP | C1467: 3284 | D1467: 2 | E1467: 03284-X | F1467: Visual Foxpro 6.0 中文版函数手册 | G1467: 吴迪 等 | H1467: 35.00 | I1467: 37196 | J1467: 9
A1468: =ROW()-2 -> 1466 | B1468: TP | C1468: 3326 | D1468: 3 | E1468: 03326-9 | F1468: Visual FoxPro 6.0 中文版命令手册 | G1468: 吴迪 等 | H1468: 39.50 | I1468: 36951 | J1468: 8
A1469: =ROW()-2 -> 1467 | B1469: TP | C1469: 3337 | D1469: 3 | E1469: 03337-4 | F1469: Visual FoxPro 6.0 中文版类和对象手册 | G1469: 吴迪 等 | H1469: 35.50 | I1469: 36617 | J1469: 10
A1470: =ROW()-2 -> 1468 | B1470: TP | C1470: 3233 | D1470: 3 | E1470: 03233-5 | F1470: Visual FoxPro 6.0 中文版程序设计指南 | G1470: 吴迪 等 | H1470: 58.00 | I1470: 36923 | J1470: 6
A1471: =ROW()-2 -> 1469 | B1471: TP | C1471: 3400 | D1471: 3 | E1471: 03400-1 | F1471: Visual FoxPro 6.0 中文版入门与技巧 | G1471: 木林森 | H1471: 25.00 | I1471: 37257 | J1471: 12
A1472: =ROW()-2 -> 1470 | B1472: TP | C1472: 3373 | D1472: 4 | E1472: 03373-0 | F1472: 中文Visual FoxPro 6.0 编程基础 | G1472: 合力工作室 | H1472: 32.00 | I1472: 36982 | J1472: 8
A1473: =ROW()-2 -> 1471 | B1473: TP | C1473: 3423 | D1473: 4 | E1473: 03423-0 | F1473: 中文Visual FoxPro 6.0 高级编程 | G1473: 合力工作室 | H1473: 39.80 | I1473: 36617 | J1473: 6
A1474: =ROW()-2 -> 1472 | B1474: TP | C1474: 3494 | D1474: 2 | E1474: 03494-X | F1474: Visual FoxPro 6.0开发实例 | G1474: 张治文等 | H1474: 29.00 | I1474: 36281 | J1474: 11
A1475: =ROW()-2 -> 1473 | B1475: TP | C1475: 3746 | D1475: 2 | E1475: 03746-9 | F1475: 深入Visual FoxPro 6.0面向对象程序设计 | G1475: 冯惠璋等 | H1475: 29.00 | I1475: 36526 | J1475: 10
F1476: Visual Foxpro 7.0参考手册
A1477: =ROW()-2 -> 1475 | B1477: TP | C1477: 5555 | D1477: 1 | E1477: 05555-6 | F1477: Visual FoxPro 7.0命令手册 | G1477: 夏辉等 | H1477: 40.00 | I1477: 37469 | J1477: 7
F1478: PowerBuilder 7 .0 技术丛书
A1479: =ROW()-2 -> 1477 | B1479: TP | C1479: 3961 | D1479: 1 | E1479: 03961-5 | F1479: PowerBuilder 7.0 入门 | G1479: 崔巍 等 | H1479: 18.00 | I1479: 36831 | J1479: 17
A1480: =ROW()-2 -> 1478 | B1480: TP | C1480: 1228 | D1480: 1 | E1480: 01228-3 | F1480: PowerBuilder 7.0 使用指南 | G1480: 崔巍 等 | H1480: 33.00 | I1480: 37012 | J1480: 9
A1481: =ROW()-2 -> 1479 | B1481: TP | C1481: 0816 | D1481: 1 | E1481: 00816-7 | F1481: PowerBuilder 7.0 应用技术 | G1481: 崔巍 等 | H1481: 29.00 | I1481: 36982 | J1481: 9
A1482: =ROW()-2 -> 1480 | B1482: TP | C1482: 0701 | D1482: 1 | E1482: 00701-2 | F1482: PowerBuilder 7.0 参考手册 | G1482: 崔巍 等 | H1482: 70.00 | I1482: 37257 | J1482: 4
A1483: =ROW()-2 -> 1481 | B1483: TP | C1483: 1229 | D1483: 1 | E1483: 01229-6 | F1483: PowerBuilder 7.0 数据库窗口程序设计 | G1483: 崔巍 等 | H1483: 68.00 | I1483: 36982 | J1483: 4
F1484: PowerBuilder 8.0 系列图书
A1485: =ROW()-2 -> 1483 | B1485: TP | C1485: 5089 | D1485: 1 | E1485: 05089-9 | F1485: PowerBuilder 8.0 数据库开发入门 | G1485: 崔巍编著 | H1485: 20.00 | I1485: 37408 | J1485: 13
A1486: =ROW()-2 -> 1484 | B1486: TP | C1486: 5195 | D1486: 1 | E1486: 05195-X | F1486: PowerBuilder 8.0 数据库应用系统开发教程 | G1486: 崔巍编著 | H1486: 29.00 | I1486: 37408 | J1486: 9
A1487: =ROW()-2 -> 1485 | B1487: TP | C1487: 5397 | D1487: 1 | E1487: 05397-9 | F1487: PowerBuilder 8.0 高级应用技术 | G1487: 崔巍编著 | H1487: 30.00 | I1487: 37384 | J1487: 9
A1488: =ROW()-2 -> 1486 | B1488: P- | C1488: 4181 | D1488: 1 | E1488: 641-81-5 | F1488: PowerBuilder 8.0 进阶篇（实例与技巧篇 附光盘） | G1488: 柯建勋等 | H1488: 56.00 | I1488: 37408 | J1488: 5
A1489: =ROW()-2 -> 1487 | B1489: P- | C1489: 4187 | D1489: 1 | E1489: 04187-8 | F1489: PowerBuilder 8.0 编程实用技术与案例（配光盘） | G1489: 朱爱民 | H1489: 48.00 | I1489: 37408 | J1489: 7
A1490: =ROW()-2 -> 1488 | B1490: TP | C1490: 5343 | D1490: 1 | E1490: 05343-1 | F1490: PowerBuilder 8.0 基础篇 | G1490: 柯建勋等 | H1490: 65.00 | I1490: 37384 | J1490: 4
F1491: Linux/UNIX 开发与应用系列
A1492: =ROW()-2 -> 1490 | B1492: TP | C1492: 1423 | D1492: 2 | E1492: 01423-X | F1492: 用 Linux 构建 Intranet | G1492: 王少华等 | H1492: 28.00 | I1492: 36982 | J1492: 10
A1493: =ROW()-2 -> 1491 | B1493: TP | C1493: 4341 | D1493: 1 | E1493: 04341-8 | F1493: UNIX 程序设计教程 | G1493: 赵克佳等 | H1493: 50.00 | I1493: 37257 | J1493: 5
A1494: =ROW()-2 -> 1492 | B1494: TP | C1494: 1219 | D1494: 1 | E1494: 01219-9 | F1494: Linux 平台下的 Web 编程 | G1494: 张斌 等 | H1494: 35.00 | I1494: 36831 | J1494: 7
A1495: =ROW()-2 -> 1493 | B1495: TP | C1495: 1098 | D1495: 1 | E1495: 01098-6 | F1495: Linux 网络编程 | G1495: 张斌 等 | H1495: 27.00 | I1495: 36678 | J1495: 8
A1496: =ROW()-2 -> 1494 | B1496: TP | C1496: 0772 | D1496: 1 | E1496: 00772-1 | F1496: UNIX 网络管理（SCO,Solaris,Linux) | G1496: 窦剑 等 | H1496: 33.00 | I1496: 36861 | J1496: 9
A1497: =ROW()-2 -> 1495 | B1497: TP | C1497: 0975 | D1497: 1 | E1497: 00975-9 | F1497: UNIX 使用与系统管理（SCO,Solaris） | G1497: 孟庆昌等 | H1497: 45.00 | I1497: 36831 | J1497: 6
A1498: =ROW()-2 -> 1496 | B1498: TP | C1498: 5580 | D1498: 1 | E1498: 05580-7 | F1498: Sun Solaris 8 系统管理员指南 | G1498: 徐国平 | H1498: 45.00 | I1498: 37469 | J1498: 6
F1499: C++Builder 4 高级编程丛书
A1500: =ROW()-2 -> 1498 | B1500: TP | C1500: 3848 | D1500: 1 | E1500: 03848-1 | F1500: 集成开发环境与面向对象编程技术 | G1500: 徐新华 | H1500: 18.00 | I1500: 36647 | J1500: 15
A1501: =ROW()-2 -> 1499 | B1501: TP | C1501: 3835 | D1501: 1 | E1501: 03835-X | F1501: 数据库与 MIDAS 编程技术 | G1501: 徐新华 | H1501: 22.00 | I1501: 36647 | J1501: 12
A1502: =ROW()-2 -> 1500 | B1502: TP | C1502: 3897 | D1502: 1 | E1502: 03897-X | F1502: 图形用户界面编程技术 | G1502: 徐新华 | H1502: 35.00 | I1502: 36678 | J1502: 8
A1503: =ROW()-2 -> 1501 | B1503: TP | C1503: 3898 | D1503: 1 | E1503: 03898-8 | F1503: COM、CORBA 与 Internet 编程技术 | G1503: 徐新华 | H1503: 22.00 | I1503: 36678 | J1503: 12
F1504: 计算机编程技术丛书
A1505: =ROW()-2 -> 1503 | B1505: P- | C1505: 3047 | D1505: 1 | E1505: 7900630473 | F1505: Windows 2000 高级编程技巧与剖析（配光盘） | G1505: 齐舒创作室 | H1505: 49.00 | I1505: 36861 | J1505: 7
A1506: =ROW()-2 -> 1504 | B1506: P- | C1506: 2525 | D1506: 1 | E1506: 7900625259 | F1506: Windows API 常用技巧汇编（配光盘） | G1506: 王宏 等 | H1506: 29.00 | I1506: 36892 | J1506: 12
A1507: =ROW()-2 -> 1505 | B1507: TP | C1507: 3672 | D1507: 2 | E1507: 03672-1 | F1507: Authorware 5.0 实战与精通 | G1507: 刘 春 | H1507: 29.00 | I1507: 36861 | J1507: 10
A1508: =ROW()-2 -> 1506 | B1508: TP | C1508: 3709 | D1508: 2 | E1508: 03709-4 | F1508: Visual FoxPro 6.0 实战与精通 | G1508: 方可燕等 | H1508: 39.50 | I1508: 36647 | J1508: 8
A1509: =ROW()-2 -> 1507 | B1509: TP | C1509: 2356 | D1509: 4 | E1509: 02356-5 | F1509: AutoCAD 2000 (机械版）实战与精通 | G1509: 徐进明等 | H1509: 35.00 | I1509: 37165 | J1509: 8
A1510: =ROW()-2 -> 1508 | B1510: TP | C1510: 5613 | D1510: 1 | E1510: 05613-7 | F1510: AutoCAD 2002实战与精通 | G1510: 邢增平 | H1510: 35.00 | I1510: 37469 | J1510: 8
A1511: =ROW()-2 -> 1509 | B1511: TP | C1511: 1130 | D1511: 1 | E1511: 01130-3 | F1511: Delphi 5 实战与精通（实战篇） | G1511: 唐健 等 | H1511: 28.00 | I1511: 36678 | J1511: 9
A1512: =ROW()-2 -> 1510 | B1512: TP | C1512: 3872 | D1512: 1 | E1512: 03872-4 | F1512: Delphi 5 实战与精通（精通篇） | G1512: 方可燕等 | H1512: 34.00 | I1512: 36831 | J1512: 9
A1513: =ROW()-2 -> 1511 | B1513: TP | C1513: 3930 | D1513: 1 | E1513: 03930-5 | F1513: Delphi 5 数据库编程实战与精通 | G1513: 房增华等 | H1513: 30.00 | I1513: 37012 | J1513: 9
A1514: =ROW()-2 -> 1512 | B1514: TP | C1514: 0964 | D1514: 1 | E1514: 00964-3 | F1514: Delphi 5.0 专题开发指南 | G1514: 刘华 等 | H1514: 39.80 | I1514: 36770 | J1514: 6
A1515: =ROW()-2 -> 1513 | B1515: TP | C1515: 1183 | D1515: 1 | E1515: 01183-4 | F1515: 精通 Visual C++ 6.0 | G1515: 刘小石等 | H1515: 46.00 | I1515: 37438 | J1515: 6
A1516: =ROW()-2 -> 1514 | B1516: TP | C1516: 0906 | D1516: 1 | E1516: 00906-6 | F1516: Visual C++ 6.0 实战与精通 | G1516: 方可燕等 | H1516: 42.00 | I1516: 37012 | J1516: 6
F1517: 计算机编程系列
A1518: =ROW()-2 -> 1516 | B1518: TP | C1518: 2268 | D1518: 3 | E1518: 02268-2 | F1518: COM 原理与应用 | G1518: 潘爱民 | H1518: 39.00 | I1518: 37326 | J1518: 7
A1519: =ROW()-2 -> 1517 | B1519: P- | C1519: 2262 | D1519: 1 | E1519: 7900622624 | F1519: COM/DCOM 编程指南（配光盘） | G1519: 刘云等译 | H1519: 52.00 | I1519: 36495 | J1519: 7
A1520: =ROW()-2 -> 1518 | B1520: TP | C1520: 5543 | D1520: 1 | E1520: 05543-2 | F1520: COM与CORBA本质与互用：体系结构 策略实现 | G1520: Jason Pritchard | H1520: 39.00 | I1520: 37408 | J1520: 8
A1521: =ROW()-2 -> 1519 | B1521: TP | C1521: 0758 | D1521: 1 | E1521: 00758-6 | F1521: Delphi 5 编程基础 | G1521: 吴小前等 | H1521: 27.00 | I1521: 36923 | J1521: 9
A1522: =ROW()-2 -> 1520 | B1522: TP | C1522: 3955 | D1522: 1 | E1522: 03955-0 | F1522: Delphi 5 高级编程 | G1522: 熊傲 等 | H1522: 33.00 | I1522: 36739 | J1522: 8
A1523: =ROW()-2 -> 1521 | B1523: TP | C1523: 3578 | D1523: 2 | E1523: 03578-4 | F1523: Visual C++6.0编程基础 | G1523: 王世同等 | H1523: 19.80 | I1523: 37469 | J1523: 12
A1524: =ROW()-2 -> 1522 | B1524: TP | C1524: 3507 | D1524: 3 | E1524: 03507-5 | F1524: Visual C++6.0高级编程 | G1524: 康博创作室 | H1524: 29.80 | I1524: 36586 | J1524: 7
A1525: =ROW()-2 -> 1523 | B1525: TP | C1525: 3681 | D1525: 1 | E1525: 03681-0 | F1525: Visual C++6.0开发技巧及实例剖析(配光盘) | G1525: 齐舒创作室 | H1525: 59.00 | I1525: 36708 | J1525: 5
A1526: =ROW()-2 -> 1524 | B1526: P- | C1526: 3068 | D1526: 1 | E1526: 7900630686 | F1526: Visual C++ 图形用户界面开发指南(配光盘) | G1526: 李博轩 | H1526: 46.80 | I1526: 36861 | J1526: 7
A1527: =ROW()-2 -> 1525 | B1527: P- | C1527: 2282 | D1527: 1 | E1527: 7900622829 | F1527: Visual C++6.0多媒体开发指南（配光盘） | G1527: 李博轩 | H1527: 35.00 | I1527: 36678 | J1527: 9
A1528: =ROW()-2 -> 1526 | B1528: P- | C1528: 2568 | D1528: 1 | E1528: 7900625682 | F1528: Visual C++6.0 网络及 Internet 开发指南(配光盘) | G1528: 李博轩 | H1528: 42.00 | I1528: 36739 | J1528: 7
A1529: =ROW()-2 -> 1527 | B1529: P- | C1529: 3044 | D1529: 1 | E1529: 7900630449 | F1529: Visual C++6.0 项目开发指南 （配光盘） | G1529: 张志学等 | H1529: 48.00 | I1529: 36831 | J1529: 7
A1530: =ROW()-2 -> 1528 | B1530: P- | C1530: 2536 | D1530: 1 | E1530: 7900625364 | F1530: Visual C++6.0 计算方法开发指南（配光盘） | G1530: 黄淼云等 | H1530: 32.00 | I1530: 36739 | J1530: 12
A1531: =ROW()-2 -> 1529 | B1531: TP | C1531: 3365 | D1531: 4 | E1531: 03365-X | F1531: 中文Visual Basic 6.0 编程基础 | G1531: 宋伟 等 | H1531: 32.00 | I1531: 36586 | J1531: 7
A1532: =ROW()-2 -> 1530 | B1532: TP | C1532: 3422 | D1532: 3 | E1532: 03422-2 | F1532: 中文Visual Basic 6.0 高级编程 | G1532: 宋伟 等 | H1532: 29.80 | I1532: 36739 | J1532: 8
A1533: =ROW()-2 -> 1531 | B1533: TP | C1533: 1125 | D1533: 1 | E1533: 01125-7 | F1533: Visual Basic 6.0 数据库开发指南 | G1533: 王福成等 | H1533: 25.80 | I1533: 37500 | J1533: 10
A1534: =ROW()-2 -> 1532 | B1534: P- | C1534: 2507 | D1534: 1 | E1534: 7900625070 | F1534: Visual Basic 实用编程百例 | G1534: 吴师通 | H1534: 39.00 | I1534: 37320 | J1534: 8
A1535: =ROW()-2 -> 1533 | B1535: TP | C1535: 3657 | D1535: 2 | E1535: 03657-8 | F1535: 编程丛书 Visual Basic 6.0 常用编程技巧 | G1535: 抖斗书屋 | H1535: 31.00 | I1535: 36526 | J1535: 9
A1536: =ROW()-2 -> 1534 | B1536: P- | C1536: 2212 | D1536: 1 | E1536: 7900622128 | F1536: Visual Basic 6.0 数据库开发(配光盘) | G1536: 顾 斌等译 | H1536: 85 | I1536: 36404 | J1536: 4
A1537: =ROW()-2 -> 1535 | B1537: P- | C1537: 2246 | D1537: 1 | E1537: 7900622462 | F1537: Visual Basic 6.0 多媒体与因特网应用(配光盘) | G1537: 朱锦坤 | H1537: 39 | I1537: 36495 | J1537: 9
A1538: =ROW()-2 -> 1536 | B1538: TP | C1538: 0966 | D1538: 1 | E1538: 00966-X | F1538: PowerBuilder 7 编程基础 | G1538: 李国民等 | H1538: 29 | I1538: 37165 | J1538: 8
A1539: =ROW()-2 -> 1537 | B1539: P- | C1539: 2570 | D1539: 1 | E1539: 7900625704 | F1539: Visual J++ 图形设计与图象处理（配光盘） | G1539: 向世明等 | H1539: 66 | I1539: 36739 | J1539: 5
A1540: =ROW()-2 -> 1538 | B1540: TP | C1540: 3913 | D1540: 1 | E1540: 03913-5 | F1540: GNU/Linux 编程指南 | H1540: 62.00 | I1540: 36678 | J1540: 5
A1541: =ROW()-2 -> 1539 | B1541: P- | C1541: 2510 | D1541: 1 | E1541: 7900625100 | F1541: 因特网应用编程（配光盘） | G1541: 汪蒲阳 | H1541: 48.00 | I1541: 36617 | J1541: 6
A1542: =ROW()-2 -> 1540 | B1542: TP | C1542: 3893 | D1542: 1 | E1542: 03893-7 | F1542: Authorware 数据库编程 | G1542: 朱诗兵等 | H1542: 30.00 | I1542: 36739 | J1542: 9
A1543: =ROW()-2 -> 1541 | B1543: TP | C1543: 5175 | D1543: 1 | E1543: 05175-5 | F1543: 基于Windows的TCP/IP编程 | G1543: 王罡 | H1543: 35.00 | I1543: 37438 | J1543: 8
A1544: =ROW()-2 -> 1542 | B1544: TP | C1544: 3775 | D1544: 2 | E1544: 03775-2 | F1544: Delphi 5 标准教程 | G1544: Inprise 公司 | H1544: 49.00 | I1544: 36617 | J1544: 7
A1545: =ROW()-2 -> 1543 | B1545: TP | C1545: 1174 | D1545: 1 | E1545: 01174-5 | F1545: Borland C++ Builder 4 标准教程 | G1545: Inprise 公司 | H1545: 60.00 | I1545: 36678 | J1545: 7
A1546: =ROW()-2 -> 1544 | B1546: TP | C1546: 5101 | D1546: 1 | E1546: 05101-1 | F1546: 全面理解JavaScript | G1546: 马雷等译 | H1546: 74.00 | I1546: 37347 | J1546: 5
A1547: =ROW()-2 -> 1545 | B1547: P- | C1547: 4140 | D1547: 1 | E1547: 7900641408 | F1547: 精通Servlets――Java平台的服务器端编程（配光盘） | G1547: 战小苏译 | H1547: 85.00 | I1547: 37347 | J1547: 4
A1548: =ROW()-2 -> 1546 | B1548: TP | C1548: 5261 | D1548: 1 | E1548: 05261-1 | F1548: 破译思科之CCNA2.0卷 | G1548: 李宇峰等 | H1548: 26.00 | I1548: 37347 | J1548: 10
A1549: =ROW()-2 -> 1547 | B1549: P- | C1549: 4171 | D1549: 1 | E1549: 7900641718 | F1549: Java2编程21天自学通（配光盘） | G1549: 束闻等译 | H1549: 65.00 | I1549: 37347 | J1549: 5
F1550: Macromedia 系列技术软件丛书
A1551: =ROW()-2 -> 1549 | B1551: P- | C1551: 2584 | D1551: 1 | E1551: 7900625844 | F1551: Flash 标准教程（配光盘） | G1551: 刘 超 等 | H1551: 42.00 | I1551: 36892 | J1551: 8
A1552: =ROW()-2 -> 1550 | B1552: TP | C1552: 4194 | D1552: 1 | E1552: 04194-6 | F1552: CourseBuilder 标准教程 | G1552: 石明贵等 | H1552: 27.00 | I1552: 36982 | J1552: 11
A1553: =ROW()-2 -> 1551 | B1553: P- | C1553: 2539 | D1553: 1 | E1553: 7900625399 | F1553: Authorware 程序经典 -Show Me 程序50例 | G1553: 石明贵等 | H1553: 49.00 | I1553: 36800 | J1553: 7
A1554: =ROW()-2 -> 1552 | B1554: P- | C1554: 3056 | D1554: 1 | E1554: 7900630562 | F1554: Authorware 5.1 标准教程（配光盘） | G1554: 石明贵等 | H1554: 49.00 | I1554: 36831 | J1554: 8
F1555: 计算机网络教育丛书(谭浩强主编）
A1556: =ROW()-2 -> 1554 | B1556: TP | C1556: 4848 | D1556: 1 | E1556: 04848-7 | F1556: 主页制作与站点建设 | G1556: 刘 涛 | H1556: 19.80 | I1556: 37165 | J1556: 15
A1557: =ROW()-2 -> 1555 | B1557: TP | C1557: 2038 | D1557: 5 | E1557: 02038-8 | F1557: 怎样使用 Internet Explorer 5 浏览器 | G1557: 邵丽萍等 | H1557: 12.00 | I1557: 36617 | J1557: 8
A1558: =ROW()-2 -> 1556 | B1558: TP | C1558: 3763 | D1558: 2 | E1558: 03763-9 | F1558: 怎样制作 Web 页面 | G1558: 邵丽萍等 | H1558: 14.00 | I1558: 36586 | J1558: 18
A1559: =ROW()-2 -> 1557 | B1559: TP | C1559: 2178 | D1559: 5 | E1559: 02178-3 | F1559: 怎样使用 Internet | G1559: 浩强创作室 | H1559: 14.00 | I1559: 36923 | J1559: 16
A1560: =ROW()-2 -> 1558 | B1560: TP | C1560: 2176 | D1560: 1 | E1560: 02176-7 | F1560: 怎样使用 Netscape 浏览器 | G1560: 浩强创作室 | H1560: 14.00 | I1560: 36557 | J1560: 18
A1561: =ROW()-2 -> 1559 | B1561: TP | C1561: 3690 | D1561: 3 | E1561: 03690-X | F1561: 计算机局域网与 Windows NT 实用教程 | G1561: 尚晓航等 | H1561: 27.50 | I1561: 2002、8 | J1561: 9
A1562: =ROW()-2 -> 1560 | B1562: TP | C1562: 3705 | D1562: 2 | E1562: 03705-1 | F1562: 计算机网络实用教程 | G1562: 浩强创作室 | H1562: 32.00 | I1562: 37469 | J1562: 8
A1563: =ROW()-2 -> 1561 | B1563: TP | C1563: 5452 | D1563: 1 | E1563: 7302054525 | F1563: Web数据库技术实用教程 | G1563: 魏善师 | H1563: 30.00 | I1563: 37408 | J1563: 8
F1564: 新手上网实用系列
A1565: =ROW()-2 -> 1563 | B1565: TP | C1565: 1213 | D1565: 1 | E1565: 01213-X | F1565: 网上冲浪完全手册 | G1565: 东箭工作室 | H1565: 18.00 | I1565: 37165 | J1565: 13
A1566: =ROW()-2 -> 1564 | B1566: TP | C1566: 4465 | D1566: 1 | E1566: 04465-1 | F1566: 网上下载完全手册 | G1566: 东箭工作室 | H1566: 20.00 | I1566: 37377 | J1566: 12
A1567: =ROW()-2 -> 1565 | B1567: TP | C1567: 4575 | D1567: 1 | E1567: 04575-5 | F1567: QQ/ICQ 完全手册 | G1567: 东箭工作室 | H1567: 13.80 | I1567: 37257 | J1567: 18
A1568: =ROW()-2 -> 1566 | B1568: TP | C1568: 4449 | D1568: 1 | E1568: 04449-X | F1568: 电子邮件完全手册 | G1568: 东箭工作室 | H1568: 19.00 | I1568: 37328 | J1568: 13
F1569: 计算机网络安全丛书
A1570: =ROW()-2 -> 1568 | B1570: TP | C1570: 3293 | D1570: 2 | E1570: 03293-9 | F1570: Internet/Intranet 网络安全结构设计 | G1570: 徐锦波等 | H1570: 53.00 | I1570: 36434 | J1570: 6
A1571: =ROW()-2 -> 1569 | B1571: TP | C1571: 2683 | D1571: 2 | E1571: 02683-1 | F1571: 网络安全基础 | G1571: 黄允聪等 | H1571: 25.00 | I1571: 37469 | J1571: 15
A1572: =ROW()-2 -> 1570 | B1572: TP | C1572: 3576 | D1572: 2 | E1572: 03576-8 | F1572: Windows NT 系统安全实用技术 | G1572: 高鹏 等 | H1572: 27.00 | I1572: 36434 | J1572: 14
A1573: =ROW()-2 -> 1571 | B1573: TP | C1573: 3341 | D1573: 2 | E1573: 03341-2 | F1573: 计算机网络安全工具 | G1573: 张小斌等 | H1573: 29.00 | I1573: 36342 | J1573: 12
A1574: =ROW()-2 -> 1572 | B1574: TP | C1574: 3305 | D1574: 2 | E1574: 03305-6 | F1574: 防火墙的选型、配置、安装和维护 | G1574: 黄允聪等 | H1574: 23.00 | I1574: 1999 | J1574: 14
A1575: =ROW()-2 -> 1573 | B1575: TP | C1575: 3460 | D1575: 4 | E1575: 03460-5 | F1575: 黑客分析与防范技术 | G1575: 张小斌等 | H1575: 25.00 | I1575: 37012 | J1575: 11
F1576: 网络新技术丛书（翻译版）
A1577: =ROW()-2 -> 1575 | B1577: TP | C1577: 2344 | D1577: 2 | E1577: 02344-1 | F1577: 新因特网协议 IPv6 (第2版) | G1577: 陶文星等译 | H1577: 20.00 | I1577: 36678 | J1577: 15
F1578: 网络新技术丛书（影印版）
A1579: =ROW()-2 -> 1577 | B1579: TP | C1579: 1083 | D1579: 1 | E1579: 01083-8 | F1579: 移动 IP （MOBILE IP） | G1579: James D.Solomon | H1579: 36.00 | I1579: 37012 | J1579: 8
A1580: =ROW()-2 -> 1578 | B1580: TP | C1580: 4119 | D1580: 1 | E1580: 04119-9 | F1580: 管理动态 IP 网络 (Managing Dynamic IP Networks) | G1580: Paul T.Ammann | H1580: 46.00 | I1580: 36861 | J1580: 7
A1581: =ROW()-2 -> 1579 | B1581: TP | C1581: 4118 | D1581: 1 | E1581: 04118-0 | F1581: IP 与 ATM 网络中的 QoS 和业务量管理 （QoS &Traffic Management in IP & ATM Networks) | G1581: David McDysan | H1581: 46.00 | I1581: 36861 | J1581: 7
A1582: =ROW()-2 -> 1580 | B1582: TP | C1582: 4117 | D1582: 1 | E1582: 04117-2 | F1582: XDSL 体系结构 （XDSL Architecture) | G1582: Padmanand Warrier | H1582: 48.00 | I1582: 36861 | J1582: 6
A1583: =ROW()-2 -> 1581 | B1583: TP | C1583: 1081 | D1583: 1 | E1583: 01081-1 | F1583: 虚拟局域网（Virtual LANs) | G1583: Marina Smith | H1583: 40.00 | I1583: 36557 | J1583: 7
A1584: =ROW()-2 -> 1582 | B1584: TP | C1584: 4121 | D1584: 1 | E1584: 04121-0 | F1584: 电信协议（第2版） (Telecommunications Protocols) | G1584: Travis Russell | H1584: 45.00 | I1584: 36861 | J1584: 7
A1585: =ROW()-2 -> 1583 | B1585: TP | C1585: 1091 | D1585: 1 | E1585: 01091-9 | F1585: 交换式局域网（Switched LANs) | G1585: John J.Roese | H1585: 40.00 | I1585: 36557 | J1585: 7
A1586: =ROW()-2 -> 1584 | B1586: TP | C1586: 1092 | D1586: 1 | E1586: 01092-7 | F1586: 千兆以太网（Gigabit Ethernet Networking) | G1586: David G. William G. | H1586: 49.00 | I1586: 36526 | J1586: 5
F1587: 网页设计・网站建设培训教材
A1588: =ROW()-2 -> 1586 | B1588: TP | C1588: 4068 | D1588: 1 | E1588: 04068-0 | F1588: 网页核心 XML 应用技巧与实例 | G1588: 刘 光 | H1588: 28.00 | I1588: 36800 | J1588: 9
A1589: =ROW()-2 -> 1587 | B1589: TP | C1589: 4168 | D1589: 1 | E1589: 04168-7 | F1589: JSP编程入门与应用实例 | G1589: 李巍 | H1589: 24.00 | I1589: 36892
F1590: 网络编程实例导学系列
A1591: =ROW()-2 -> 1589 | B1591: P- | C1591: 3094 | D1591: 1 | E1591: 7900630945 | F1591: Windows 网络编程之Delphi篇（配光盘） | G1591: 萧秋水等 | H1591: 35.00 | I1591: 36923 | J1591: 10
A1592: =ROW()-2 -> 1590 | B1592: P- | C1592: 3114 | D1592: 1 | E1592: 7900631143 | F1592: Windows 网络编程之VB 篇 （配光盘） | G1592: 萧秋水等 | H1592: 32.00 | I1592: 36951 | J1592: 12
A1593: =ROW()-2 -> 1591 | B1593: P- | C1593: 3109 | D1593: 1 | E1593: 7900631097 | F1593: Windows 网络编程之VC篇（配光盘） | G1593: 萧秋水等 | H1593: 35.00 | I1593: 37196 | J1593: 10
F1594: 全面突破网络编程技术丛书
A1595: =ROW()-2 -> 1593 | B1595: TP | C1595: 1397 | D1595: 1 | E1595: 01397-7 | F1595: JSP 程序设计与实例分析教程 | G1595: 姜晓铭等 | H1595: 38.00 | I1595: 36982 | J1595: 7
A1596: =ROW()-2 -> 1594 | B1596: TP | C1596: 4382 | D1596: 1 | E1596: 04382-5 | F1596: JSP 网站开发技术 | G1596: 徐进明 | H1596: 28.00 | I1596: 37012 | J1596: 10
A1597: =ROW()-2 -> 1595 | B1597: TP | C1597: 4470 | D1597: 1 | E1597: 04470-8 | F1597: PHP程序设计与实例分析教程 | G1597: 姜晓铭等 | H1597: 29.00 | I1597: 37043 | J1597: 9
F1598: 程序员指南丛书
A1599: =ROW()-2 -> 1597 | B1599: TP | C1599: 4956 | D1599: 1 | E1599: 04956-4 | F1599: Visual C++.NET 编程基础 | G1599: 冯敏 等 | H1599: 29.80 | I1599: 37226 | J1599: 9
A1600: =ROW()-2 -> 1598 | B1600: TP | C1600: 5540 | D1600: 1 | E1600: 05540-1 | F1600: Visual FoxPro 7.0 高级编程 | G1600: 孙立明刘琳等 | H1600: 35.00 | I1600: 37438 | J1600: 7
A1601: =ROW()-2 -> 1599 | B1601: TP | C1601: 4974 | D1601: 1 | E1601: 04974-2 | F1601: Visual C#.NET 编程基础 | G1601: 李满潮等 | H1601: 25.00 | I1601: 37227 | J1601: 10
A1602: =ROW()-2 -> 1600 | B1602: TP | C1602: 4963 | D1602: 1 | E1602: 04963-7 | F1602: Visual Basic.NET 编程基础 | G1602: 张文 等 | H1602: 26.80 | I1602: 37408 | J1602: 10
A1603: =ROW()-2 -> 1601 | B1603: TP | C1603: 5056 | D1603: 1 | E1603: 05056-2 | F1603: Visual FoxPro 7.0 编程基础 | G1603: 赵静 等 | H1603: 25.00 | I1603: 37377 | J1603: 10
A1604: =ROW()-2 -> 1602 | B1604: TP | C1604: 4973 | D1604: 1 | E1604: 04973-4 | F1604: Delphi 6 编程基础 | G1604: 肖建 等 | H1604: 36.00 | I1604: 37226 | J1604: 7
A1605: =ROW()-2 -> 1603 | B1605: TP | C1605: 4964 | D1605: 1 | E1605: 04964-5 | F1605: PowerBuilder 8.0 编程基础 | G1605: 李超 等 | H1605: 22.80 | I1605: 37389 | J1605: 11
A1606: =ROW()-2 -> 1604 | B1606: TP | C1606: 5373 | D1606: 1 | E1606: 05373-1 | F1606: VisualC#.NET高级 编程 | G1606: 李满潮 等 | H1606: 42.80 | I1606: 37349 | J1606: 6
A1607: =ROW()-2 -> 1605 | B1607: TP 5510 1 | E1607: 05510-1 | F1607: Visual Basic.NET程序设计入门 | G1607: 李万红等 | H1607: 28.00 | I1607: 37408 | J1607: 9
A1608: =ROW()-2 -> 1606 | B1608: TP | C1608: 5395 | D1608: 1 | E1608: 05395-1 | F1608: ASP.NET 编程基础 | G1608: 肖建 等 | H1608: 27.00 | I1608: 37385 | J1608: 9
F1609: Unigraphics 应用指导系列丛书
A1610: =ROW()-2 -> 1608 | B1610: TP | C1610: 5004 | D1610: 1 | E1610: 05004-X | F1610: UG 渲染与实例 | G1610: 李开林 | H1610: 20.00 | I1610: 37226 | J1610: 13
A1611: =ROW()-2 -> 1609 | B1611: P- | C1611: 4191 | D1611: 1 | E1611: 04191-1 | F1611: UG高级铣加工应用培训教程（配光盘） | G1611: 苗春杰编译 | H1611: 30.00 | I1611: 37438 | J1611: 12
A1612: =ROW()-2 -> 1610 | B1612: P- | C1612: 3790 | D1612: 1 | E1612: 7900637907 | F1612: UG 设计应用培训教程（配光盘） | G1612: 丁炜 等译 | H1612: 39.00 | I1612: 37333 | J1612: 9
A1613: =ROW()-2 -> 1611 | B1613: P- | C1613: 4309 | D1613: 1 | E1613: 04309-1 | F1613: UG知识熔接技术培训教程（配光盘） | G1613: 王刚等译 | H1613: 22.00 | I1613: 37438 | J1613: 20
A1614: =ROW()-2 -> 1612 | B1614: P- | C1614: 3796 | D1614: 1 | E1614: 637-96-6 | F1614: UG 自由形状特征建模培训教程（配光盘） | G1614: 龚勉 译 | H1614: 27.00 | I1614: 37408 | J1614: 15
A1615: =ROW()-2 -> 1613 | B1615: P- | C1615: 3795 | D1615: 1 | E1615: 7900637958 | F1615: UG 制图基础培训教程（配光盘） | G1615: 赵翠莲等译 | H1615: 42.00 | I1615: 37226 | J1615: 8
A1616: =ROW()-2 -> 1614 | B1616: P- | C1616: 3793 | D1616: 1 | E1616: 7900637931 | F1616: UG CAD 快速入门指导（配光盘） | G1616: 洪如瑾 | H1616: 47.00 | I1616: 37408 | J1616: 7
A1617: =ROW()-2 -> 1615 | B1617: P- | C1617: 3792 | D1617: 1 | E1617: 7900637923 | F1617: UG 相关参数化设计培训教程（配光盘） | G1617: 张琴 译 | H1617: 30.00 | I1617: 37226 | J1617: 12
A1618: =ROW()-2 -> 1616 | B1618: P- | C1618: 3791 | D1618: 1 | E1618: 7900637915 | F1618: UG/Open GRIP 实用编程基础（配光盘） | G1618: 王庆林 | H1618: 46.00 | I1618: 37288 | J1618: 7
A1619: =ROW()-2 -> 1617 | B1619: P- | C1619: 4183 | D1619: 1 | E1619: 7900641831 | F1619: UG WAVE 产品设计技术培训教程(配光盘) | G1619: Unigraphics Solutions Inc | H1619: 30.00 | I1619: 37408 | J1619: 13
A1620: =ROW()-2 -> 1618 | B1620: P- | C1620: 4318 | D1620: 1 | E1620: 643-18-4 | F1620: UG高级装配培训教程（配光盘） | G1620: Unigraphics Solutions Inc | H1620: 24.00 | I1620: 37438 | J1620: 17
A1621: =ROW()-2 -> 1619 | B1621: P- | C1621: 5658 | D1621: 1 | E1621: 05658-7 | F1621: UG CAD 实用教程 | G1621: 赵波等 | H1621: 49.00 | I1621: 37438 | J1621: 6
A1622: =ROW()-2 -> 1620 | B1622: P- | C1622: 3794 | D1622: 1 | F1622: UG 铣制造过程培训教程（配光盘） | G1622: 苏红卫译 | H1622: 30.00 | I1622: 37333 | J1622: 11
A1623: =ROW()-2 -> 1621 | B1623: P- | C1623: 4317 | D1623: 1 | E1623: 7900643176 | F1623: UG多轴铣制造过程培训教程 | G1623: Unigraphics Solutions Inc | H1623: 26.00 | I1623: 37469 | J1623: 15
A1624: =ROW()-2 -> 1622 | B1624: P- | C1624: 4321 | D1624: 1 | E1624: 7900643214 | F1624: UG铣制造过程实用指导(配光盘) | G1624: 王庆林等 | H1624: 46.00 | I1624: 37469 | J1624: 8
A1625: =ROW()-2 -> 1623 | B1625: P- | C1625: 5708 | D1625: 1 | E1625: 05708-7 | F1625: UG/Open API编程基础 | G1625: 董正卫等 | H1625: 28.00 | I1625: 37469 | J1625: 11
A1626: =ROW()-2 -> 1624 | B1626: P- | C1626: 4324 | D1626: 1 | E1626: 7-900643-24-9 | F1626: UG实践应用初步培训教程（配光盘） | G1626: 李维等著 | H1626: 36.00 | I1626: 37469 | J1626: 10
F1627: Delphi 网络和通信编程的深入教程
A1628: =ROW()-2 -> 1626 | B1628: P- | C1628: 3580 | D1628: 1 | E1628: 7900635807 | F1628: Internet 与 TCP/IP程序设计之 Delphi 高手 （配光盘） | G1628: 黄志鸿等 | H1628: 56.00 | I1628: 37135 | J1628: 6
A1629: =ROW()-2 -> 1627 | B1629: TP 5308 1 | D1629: 1 | E1629: 05308-1 | F1629: 局域网生手组网宝典 | G1629: 郭 玲文 | H1629: 35.00 | I1629: 37469 | J1629: 8
F1630: 程序开发人员进阶与提高黑皮书
A1631: =ROW()-2 -> 1629 | B1631: P- | C1631: 3510 | D1631: 1 | E1631: 7900635106 | F1631: Borland C++ Builder 程序设计（配光盘） | G1631: 刘华 等 | H1631: 55.00 | I1631: 37073 | J1631: 6
A1632: =ROW()-2 -> 1630 | B1632: P- | C1632: 3778 | D1632: 1 | E1632: 7900637788 | F1632: Borland Delphi 数据库应用开发技术与实例（配光盘） | G1632: 张大年等 | H1632: 55.00 | I1632: 37438 | J1632: 5
A1633: =ROW()-2 -> 1631 | B1633: TP | C1633: 5298 | D1633: 1 | E1633: 05298-0 | F1633: Borland Delphi程序设计 | G1633: 蒋方帅 | H1633: 43.00 | I1633: 37347 | J1633: 5
A1634: =ROW()-2 -> 1632 | B1634: P- | C1634: 3776 | D1634: 1 | E1634: 03776-1 | F1634: Borland Delphi多媒体应用开发技术与实例（配光盘） | G1634: 韩冰 等 | H1634: 55.00 | I1634: 37257 | J1634: 5
A1635: =ROW()-2 -> 1633 | B1635: P- | C1635: 4138 | D1635: 1 | E1635: 04138-6 | F1635: Borland Delphi网络应用开发技术与实例（配光盘） | G1635: 黄超 等 | H1635: 59.00 | I1635: 37316 | J1635: 5
F1636: 平面设计人员进阶与提高黑皮书
A1637: =ROW()-2 -> 1635 | B1637: P- | C1637: 4331 | D1637: 2 | E1637: 7900643311 | F1637: Photoshop 7.0 平面设计绘创作技法 | G1637: 李达 | H1637: 49.00 | I1637: 37500 | J1637: 6
F1638: 网页设计 e 典系列
A1639: =ROW()-2 -> 1637 | B1639: TP | C1639: 4300 | D1639: 1 | E1639: 04300-0 | F1639: Macromedia 网页设计梦之队 | G1639: 东方人华 | H1639: 46.90 | I1639: 37012 | J1639: 6
A1640: =ROW()-2 -> 1638 | B1640: TP | C1640: 1336 | D1640: 2 | E1640: 01336-5 | F1640: Dreamweaver 4 网页制作 | G1640: 东方人华 | H1640: 30 | I1640: 37043 | J1640: 8
A1641: =ROW()-2 -> 1639 | B1641: TP | C1641: 4450 | D1641: 1 | E1641: 04450-3 | F1641: Dreamweaver UltraDev 4 互动式网页数据库 | G1641: 东方人华 | H1641: 36.50 | I1641: 37073 | J1641: 7
A1642: =ROW()-2 -> 1640 | B1642: P- | C1642: 3555 | D1642: 1 | E1642: 7900635556 | F1642: FLASH 5 Action 程序设计（配光盘） | G1642: 王 刚 | H1642: 28.00 | I1642: 37104 | J1642: 10
A1643: =ROW()-2 -> 1641 | B1643: TP | C1643: 1345 | D1643: 2 | E1643: 01345-4 | F1643: Fireworks 4 网页图形制作 | G1643: 东方人华 | H1643: 33 | I1643: 36982 | J1643: 7
F1644: .NET 框架开发人员参考手册
A1645: =ROW()-2 -> 1643 | B1645: TP | C1645: 4286 | D1645: 1 | E1645: 04286-1 | F1645: .NET 框架开发人员参考手册 系统构架分册 | G1645: 张志学等 | H1645: 64.00 | I1645: 36982 | J1645: 5
A1646: =ROW()-2 -> 1644 | B1646: TP | C1646: 4286 | D1646: 2 | E1646: 04286-1 | F1646: .NET 框架开发人员参考手册 数据库分册 | G1646: 张志学 | H1646: 64.00 | I1646: 37043 | J1646: 5
A1647: =ROW()-2 -> 1645 | B1647: TP | C1647: 4286 | D1647: 3 | E1647: 04286-1 | F1647: .NET 框架开发人员参考手册 网络和Internet分册 | G1647: 张志学 | H1647: 64.00 | I1647: 37073 | J1647: 4
A1648: =ROW()-2 -> 1646 | B1648: TP | C1648: 4286 | D1648: 4 | E1648: 04286-1 | F1648: .NET 框架开发人员参考手册 编程要素分册 | G1648: 张志学 | H1648: 64.00 | I1648: 37135 | J1648: 4
F1649: 电脑平面设计丛书
A1650: =ROW()-2 -> 1648 | B1650: TP | C1650: 3711 | D1650: 1 | E1650: 03711-6 | F1650: CorelDRAW 平面设计 | G1650: 马特 等 | H1650: 28.00 | I1650: 36647 | J1650: 12
F1651: 图象处理与多媒体制作范例集丛书
A1652: =ROW()-2 -> 1650 | B1652: TP | C1652: 0872 | D1652: 1 | E1652: 00827-8 | F1652: CorelDRAW 9 范例集 | G1652: 张 雨 | H1652: 29.00 | I1652: 36770 | J1652: 10
A1653: =ROW()-2 -> 1651 | B1653: TP | C1653: 1230 | D1653: 1 | E1653: 01230-X | F1653: FreeHand 范例集 | G1653: 朱竟非等 | H1653: 39.00 | I1653: 36831 | J1653: 9
A1654: =ROW()-2 -> 1652 | B1654: TP | C1654: 1109 | D1654: 1 | E1654: 01109-5 | F1654: Dreamweaver 网页制作范例集 | G1654: 王 峰 等 | H1654: 26.00 | I1654: 36647 | J1654: 10
A1655: =ROW()-2 -> 1653 | B1655: P- | C1655: 2540 | D1655: 1 | E1655: 7900625402 | F1655: Flash 4.0 范例集（配光盘） | G1655: 刘继恩等 | H1655: 34.00 | I1655: 36739 | J1655: 11
A1656: =ROW()-2 -> 1654 | B1656: P- | C1656: 2538 | D1656: 1 | E1656: 7900625380 | F1656: Authorware 5.0 范例集（配光盘） | G1656: 马首敖等 | H1656: 35.00 | I1656: 36923 | J1656: 10
A1657: =ROW()-2 -> 1655 | B1657: TP | C1657: 1131 | D1657: 1 | E1657: 01131-1 | F1657: Illustrator 范例集（配光盘） | G1657: 苏忠 等 | H1657: 20.00 | I1657: 36708 | J1657: 12
A1658: =ROW()-2 -> 1656 | B1658: TP | C1658: 3195 | D1658: 4 | E1658: 03195-9 | F1658: Photoshop 5 范例集 (配光盘） | G1658: 张 雨 | H1658: 39.00 | I1658: 36617 | J1658: 8
A1659: =ROW()-2 -> 1657 | B1659: P- | C1659: 2541 | D1659: 1 | E1659: 7900625410 | F1659: Photoshop 5.5 范例集 (配光盘） | G1659: 前途工作室 | H1659: 36.80 | I1659: 36770 | J1659: 9
A1660: =ROW()-2 -> 1658 | B1660: P- | C1660: 3095 | D1660: 1 | E1660: 7900630953 | F1660: Maya 3.0 范例集（配光盘） | G1660: 杨蔚 等 | H1660: 52.80 | I1660: 36923 | J1660: 7
A1661: =ROW()-2 -> 1659 | B1661: TP | C1661: 1105 | D1661: 1 | E1661: 01105-2 | F1661: PageMaker 6.5c 范例集 | G1661: 顾铁成等 | H1661: 29.00 | I1661: 36800 | J1661: 9
A1662: =ROW()-2 -> 1660 | B1662: P- | C1662: 2281 | D1662: 1 | E1662: 7900622810 | F1662: 3D Studio MAX 范例集（配光盘） | G1662: 陆 水 | H1662: 38 | I1662: 36678 | J1662: 9
F1663: AutoCAD 开发技术丛书
A1664: =ROW()-2 -> 1662 | B1664: TP | C1664: 0960 | D1664: 1 | E1664: 00960-0 | F1664: AutoCAD 2000 VBA 开发技术 | G1664: 张国宝 | H1664: 30.00 | I1664: 36800 | J1664: 9
A1665: =ROW()-2 -> 1663 | B1665: TP | C1665: 0702 | D1665: 1 | E1665: 00702-0 | F1665: AutoCAD 2000 ARX 开发技术 | G1665: 刘良华等 | H1665: 42.00 | I1665: 36800 | J1665: 6
A1666: =ROW()-2 -> 1664 | B1666: TP | C1666: 4447 | D1666: 1 | E1666: 04447-3 | F1666: AutoCAD 2000 定制与 Visual LISP 开发技术 | G1666: 李学志 | H1666: 39.00 | I1666: 37043 | J1666: 7
F1667: AutoCAD 2002 应用与开发系列
A1668: =ROW()-2 -> 1666 | B1668: TP | C1668: 4353 | D1668: 1 | E1668: 04353-1 | F1668: AutoCAD 2002/2000 VBA 开发指南 | G1668: 李凤华 | H1668: 42.00 | I1668: 37012 | J1668: 7
A1669: =ROW()-2 -> 1667 | B1669: TP | C1669: 4654 | D1669: 1 | E1669: 04654-9 | F1669: AutoCAD 2002/2000 Visual LISP 开发指南 | G1669: 康 博 | H1669: 62.00 | I1669: 37135 | J1669: 5
A1670: =ROW()-2 -> 1668 | B1670: P- | C1670: 4314 | D1670: 1 | E1670: 04314-1 | F1670: AutoCAD 权威技术支持（配光盘） | G1670: 马力著 | H1670: 45.00 | I1670: 37438 | J1670: 7
A1671: =ROW()-2 -> 1669 | B1671: TP | C1671: 4926 | D1671: 1 | E1671: 04926-2 | F1671: AutoCAD 2002 二次开发技术指南 | G1671: 梁雪春等 | H1671: 45.00 | I1671: 37196 | J1671: 6
A1672: =ROW()-2 -> 1670 | B1672: TP | C1672: 4377 | D1672: 1 | E1672: 04377-9 | F1672: AutoCAD 2002实用培训教程 | G1672: 崔洪斌等 | H1672: 46.00 | I1672: 37469 | J1672: 6
A1673: =ROW()-2 -> 1671 | B1673: TP | C1673: 4782 | D1673: 1 | E1673: 04782-0 | F1673: 中文版 AutoCAD 2002 高级应用技巧 | G1673: 王爱民等 | H1673: 45.00 | I1673: 37135 | J1673: 6
A1674: =ROW()-2 -> 1672 | B1674: TP | C1674: 4879 | D1674: 1 | E1674: 04879-7 | F1674: 中文版 AutoCAD 2002 机械图形设计 | G1674: 黎广生 | H1674: 36.00 | I1674: 37334 | J1674: 7
A1675: =ROW()-2 -> 1673 | B1675: TP | C1675: 4578 | D1675: 1 | E1675: 04578-X | F1675: AutoCAD 2002 中文版建筑图形设计 | G1675: 白振刚等 | H1675: 30.00 | I1675: 37469 | J1675: 10
A1676: =ROW()-2 -> 1674 | B1676: TP | C1676: 4626 | D1676: 1 | E1676: 04626-3 | F1676: AutoCAD 2002 中文版实用指南 | G1676: 黎广生等 | H1676: 56.00 | I1676: 37073 | J1676: 5
A1677: =ROW()-2 -> 1675 | B1677: TP | C1677: 4466 | D1677: 1 | E1677: 04466-X | F1677: AutoCAD 2002 三维图形设计 | G1677: 崔洪斌等 | H1677: 35.00 | I1677: 37257 | J1677: 8
A1678: =ROW()-2 -> 1676 | B1678: P- | C1678: 4143 | D1678: 1 | E1678: 04143-2 | F1678: AutoCAD 2002 建筑应用实例导学 | G1678: 陈克等 | H1678: 44.00 | I1678: 37347 | J1678: 7
F1679: AutoCAD 高级应用与开发丛书
A1680: =ROW()-2 -> 1678 | B1680: TP | C1680: 5145 | D1680: 1 | E1680: 05145-3 | F1680: AutoCAD 与3DS MAX精彩效果图设计 | G1680: 陈健 | H1680: 26.00 | I1680: 37374 | J1680: 10
A1681: =ROW()-2 -> 1679 | B1681: TP | C1681: 5518 | D1681: 1 | E1681: 05518-1 | F1681: AutoCAD 2002 定制与开发 | G1681: 郭朝勇等 | H1681: 42.00 | I1681: 37438 | J1681: 6
A1682: =ROW()-2 -> 1680 | B1682: TP | C1682: 5128 | D1682: 1 | E1682: 05128-3 | F1682: Visual Basic与AutoCAD 二次开发 | G1682: 张晋西 | H1682: 29.00 | I1682: 37315 | J1682: 10
F1683: Mastercam 应用指导丛书
A1684: =ROW()-2 -> 1682 | B1684: TP | C1684: 5035 | D1684: 1 | E1684: 05035-X | F1684: Mastercam 8 实体设计应用指南 | G1684: 周永俊 | H1684: 12.00 | I1684: 37469 | J1684: 18
A1685: =ROW()-2 -> 1683 | B1685: TP | C1685: 5149 | D1685: 1 | E1685: 05149-6 | F1685: Mastercam V8 .1高手指路 | G1685: 简琦昭 | H1685: 39.00 | I1685: 37469 | J1685: 6
A1686: =ROW()-2 -> 1684 | B1686: TP | C1686: 5034 | D1686: 1 | E1686: 05034-1 | F1686: Mastercam应用指南：Mastercam 8铣削/车削应用指南 | G1686: 周永俊 | H1686: 24.00 | I1686: 37347 | J1686: 11
F1687: 电脑美术设计师全面培训教程
A1688: =ROW()-2 -> 1686 | B1688: TP | C1688: 4992 | D1688: 1 | E1688: 04992-0 | F1688: 绘图经典――CorelDRAW+FreeHand | G1688: 龚正伟等 | H1688: 32.00 | I1688: 37226 | J1688: 8
A1689: =ROW()-2 -> 1687 | B1689: P- | C1689: 4177 | D1689: 1 | E1689: 04177-1 | F1689: 影像经典――3D Studio MAX | G1689: 龚正伟等 | H1689: 38.00 | I1689: 37408 | J1689: 8
A1690: =ROW()-2 -> 1688 | B1690: P | C1690: 4136 | D1690: 1 | E1690: 04992-0 | F1690: 建筑效果――3D Studio MAX+Photoshop | G1690: 龚正伟等 | H1690: 38.00 | I1690: 37438 | J1690: 8
A1691: =ROW()-2 -> 1689 | B1691: TP | C1691: 4885 | D1691: 1 | E1691: 04885-1 | F1691: 图像处理大师――Photoshop | G1691: 张璇等 | H1691: 29.00 | I1691: 37408 | J1691: 9
A1692: =ROW()-2 -> 1690 | B1692: TP | C1692: 4885 | D1692: 1 | E1692: 641-94-7 | F1692: 动感十足――flash | G1692: 张璇等 | H1692: 35.00 | I1692: 37438
F1693: 3ds max 4.2 专家之路系列丛书
A1694: =ROW()-2 -> 1692 | B1694: P- | C1694: 3758 | D1694: 1 | E1694: 637-58-3 | F1694: 3ds max 4.2 实体造型专家之路（配光盘） | G1694: 吉海滨 | H1694: 35.00 | I1694: 37406 | J1694: 8
A1695: =ROW()-2 -> 1693 | B1695: P- | C1695: 3762 | D1695: 1 | E1695: 7900637621 | F1695: 3ds max 4.2 动画制作专家之路（配光盘） | G1695: 杨 军 | H1695: 35.00 | I1695: 37196 | J1695: 6
A1696: =ROW()-2 -> 1694 | B1696: P- | C1696: 3763 | D1696: 1 | E1696: 790063763X | F1696: 3ds max 4.2 建筑建模专家之路（配光盘） | G1696: 刘晓东 | H1696: 35.00 | I1696: 37363 | J1696: 7
A1697: =ROW()-2 -> 1695 | B1697: P- | C1697: 3581 | D1697: 1 | E1697: 7900635815 | F1697: 3ds max 4.2专家之路（配光盘） | G1697: 么 远 | H1697: 35.00 | I1697: 37226 | J1697: 8
F1698: 笑傲3D Studio MAX R4.0系列丛书
A1699: =ROW()-2 -> 1697 | B1699: P- | C1699: 3797 | D1699: 4 | E1699: 7900637974 | F1699: 笑傲3D Studio MAX R4.0之造型篇 | G1699: 张铭歧 | H1699: 28.00 | I1699: 37316 | J1699: 9
F1700: Office XP 专家之路系列丛书
A1701: =ROW()-2 -> 1699 | B1701: P- | C1701: 3784 | D1701: 1 | E1701: 7900637842 | F1701: 精通 Microsoft Excel 2002 中文版（配光盘） | G1701: 曹晓刚等译 | H1701: 98.00 | I1701: 37257 | J1701: 4
A1702: =ROW()-2 -> 1700 | B1702: P- | C1702: 4103 | D1702: 1 | E1702: 7900641033 | F1702: 精通 Microsoft Word 2002 中文版（配光盘） | G1702: Mary Milluon | H1702: 98.00 | I1702: 37258 | J1702: 4
A1703: =ROW()-2 -> 1701 | B1703: P- | C1703: 4102 | D1703: 1 | E1703: 7900641025 | F1703: 精通 Microsoft Office XP 中文版（配光盘） | G1703: 智慧东方工作室译 | H1703: 128.00 | I1703: 37257 | J1703: 3
A1704: =ROW()-2 -> 1702 | B1704: TP | C1704: 5120 | D1704: 1 | E1704: 05120-8 | F1704: 精通 Outlook 2002 中文版 | G1704: 智慧东方工作室译 | H1704: 98.00 | I1704: 37257 | J1704: 4
A1705: =ROW()-2 -> 1703 | B1705: P- | C1705: 3785 | D1705: 1 | E1705: 7900637850 | F1705: 精通 Microsoft FrontPage 2002 中文版（配光盘） | G1705: 艾希亚公司译 | H1705: 98.00 | I1705: 2001.12 | J1705: 4
F1706: 计算机信息基础教育丛书
A1707: =ROW()-2 -> 1705 | B1707: TP | C1707: 4989 | D1707: 1 | E1707: 04989-0 | F1707: 五笔及汉字输入培训教程 | G1707: 东方人华 | H1707: 23.00 | I1707: 37500 | J1707: 9
A1708: =ROW()-2 -> 1706 | B1708: TP | C1708: 4994 | D1708: 1 | E1708: 04994-7 | F1708: 计算机办公应用培训教程 | G1708: 东方人华 | H1708: 22.00 | I1708: 37408 | J1708: 9
A1709: =ROW()-2 -> 1707 | B1709: TP | C1709: 5024 | D1709: 1 | E1709: 05024-4 | F1709: 计算机基础培训教程 | G1709: 东方人华 | H1709: 21.00 | I1709: 37413 | J1709: 9
A1710: =ROW()-2 -> 1708 | B1710: TP | C1710: 4890 | D1710: 1 | E1710: 04890-8 | F1710: Internet 培训教程 | G1710: 东方人华 | H1710: 23.00 | I1710: 37469 | J1710: 8
F1711: 事半功倍系列丛书
A1712: =ROW()-2 -> 1710 | B1712: TP | C1712: 4357 | D1712: 1 | E1712: 04357-4 | F1712: Unix | G1712: 叶丽彬译 | H1712: 31.50 | I1712: 37104 | J1712: 9
A1713: =ROW()-2 -> 1711 | B1713: TP | C1713: 4357 | D1713: 2 | E1713: 04357-4 | F1713: XML | G1713: 白俊涛译 | H1713: 28.00 | I1713: 37104 | J1713: 10
A1714: =ROW()-2 -> 1712 | B1714: TP | C1714: 4357 | D1714: 3 | E1714: 04357-4 | F1714: HTML | G1714: 孙巍 等译 | H1714: 29.00 | I1714: 37104 | J1714: 9
A1715: =ROW()-2 -> 1713 | B1715: TP | C1715: 4357 | D1715: 4 | E1715: 04357-4 | F1715: Perl | G1715: 刘昕 等译 | H1715: 27.00 | I1715: 37104 | J1715: 11
A1716: =ROW()-2 -> 1714 | B1716: TP | C1716: 4357 | D1716: 5 | E1716: 04357-4 | F1716: Active Server Pages 3.0 | G1716: 曹晓刚译 | H1716: 28.00 | I1716: 37104 | J1716: 10
A1717: =ROW()-2 -> 1715 | B1717: TP | C1717: 4357 | D1717: 6 | E1717: 04357-4 | F1717: Linux | G1717: 孙巍 译 | H1717: 31.00 | I1717: 37104 | J1717: 9
A1718: =ROW()-2 -> 1716 | B1718: TP | C1718: 4357 | D1718: 7 | E1718: 04357-4 | F1718: JavaScript | G1718: 侯 等译 | H1718: 27.00 | I1718: 37104 | J1718: 10
F1719: 专家指导丛书
A1720: =ROW()-2 -> 1718 | B1720: TP | C1720: 4828 | D1720: 1 | E1720: 04828-2 | F1720: Dreamweaver 4 网页设计专家指导 | G1720: 王颖倩等 | H1720: 35.00 | I1720: 37408 | J1720: 8
A1721: =ROW()-2 -> 1719 | B1721: TP | C1721: 4785 | D1721: 1 | E1721: 04785-5 | F1721: Fireworks 4 网页图象设计专家指导 | G1721: 林渊博等 | H1721: 35.00 | I1721: 37196 | J1721: 7
A1722: =ROW()-2 -> 1720 | B1722: P- | C1722: 3713 | D1722: 1 | E1722: 7900637133 | F1722: 电脑室内装修设计专家指导（配光盘） | G1722: 李绍勇等 | H1722: 60.00 | I1722: 37344 | J1722: 5
F1723: 直通车系列丛书
A1724: =ROW()-2 -> 1722 | B1724: TP | C1724: 4588 | D1724: 1 | E1724: 04588-7 | F1724: Windows XP 直通车 | G1724: 刘涛 等 | H1724: 34.00 | I1724: 37327 | J1724: 9
A1725: =ROW()-2 -> 1723 | B1725: TP | C1725: 4590 | D1725: 1 | E1725: 04590-9 | F1725: Execl 2002 XP 中文版直通车 | G1725: 刘胜雷等 | H1725: 39.00 | I1725: 37104 | J1725: 7
A1726: =ROW()-2 -> 1724 | B1726: TP | C1726: 4591 | D1726: 1 | E1726: 04591-7 | F1726: Word 2002 中文版直通车 | G1726: 徐冉 等 | H1726: 35.00 | I1726: 37257 | J1726: 8
A1727: =ROW()-2 -> 1725 | B1727: TP | C1727: 4592 | D1727: 1 | E1727: 04592-5 | F1727: PowerPoint 2002 中文版直通车 | G1727: 徐冉 等 | H1727: 30.00 | I1727: 37257 | J1727: 8
A1728: =ROW()-2 -> 1726 | B1728: TP | C1728: 5648 | D1728: 1 | E1728: 05648-x | F1728: Photoshop 7.0 直通车 | G1728: 贺军 | H1728: 34.00 | I1728: 37469 | J1728: 8
A1729: =ROW()-2 -> 1727 | B1729: TP | C1729: 4556 | D1729: 1 | E1729: 04556-9 | F1729: FrontPage 2002 中文版直通车 | G1729: 刘胜雷等 | H1729: 29.00 | I1729: 37336 | J1729: 9
F1730: 全面掌握中文版系列丛书
A1731: =ROW()-2 -> 1729 | B1731: TP | C1731: 4831 | D1731: 1 | E1731: 04831-2 | F1731: 全面掌握中文版 Excel 2002 | G1731: 康博创作室 | H1731: 41.00 | I1731: 37469 | J1731: 6
A1732: =ROW()-2 -> 1730 | B1732: TP | C1732: 4631 | D1732: 1 | E1732: 04631-X | F1732: 全面掌握中文版 FrontPage 2002 | G1732: 康博创作室 | H1732: 37.00 | I1732: 37329 | J1732: 7
A1733: =ROW()-2 -> 1731 | B1733: TP | C1733: 4955 | D1733: 1 | E1733: 04955-6 | F1733: 全面掌握中文版 Access 2002 | G1733: 钟鸣 等 | H1733: 46.00 | I1733: 37408 | J1733: 6
A1734: =ROW()-2 -> 1732 | B1734: TP | C1734: 4986 | D1734: 1 | E1734: 04986-6 | F1734: 全面掌握中文版 Word 2002 | G1734: 康博创作室 | H1734: 45.00 | I1734: 37226 | J1734: 6
A1735: =ROW()-2 -> 1733 | B1735: TP | C1735: 5081 | D1735: 1 | E1735: 05081-3 | F1735: 全面掌握中文版Windows XP | G1735: 袁建华等 | H1735: 36.00 | I1735: 37469 | J1735: 7
A1736: =ROW()-2 -> 1734 | B1736: TP | C1736: 5082 | D1736: 1 | E1736: 05082-1 | F1736: 全面掌握中文版 Office XP | G1736: 仵春光 | H1736: 59.00 | I1736: 37438 | J1736: 4
F1737: 趣味程序导学
A1738: =ROW()-2 -> 1736 | B1738: P | C1738: 4123 | D1738: 1 | E1738: 7900641238 | F1738: 趣味程序导学 C++Builder（配光盘） | G1738: 刘光编著 | H1738: 35.00 | I1738: 37257 | J1738: 8
A1739: =ROW()-2 -> 1737 | B1739: P- | C1739: 4125 | D1739: 1 | E1739: 7900641254 | F1739: 趣味程序导学 Java 2（配光盘） | G1739: 宋现锋 | H1739: 32.00 | I1739: 37257 | J1739: 8
A1740: =ROW()-2 -> 1738 | B1740: P- | C1740: 4124 | D1740: 1 | E1740: 7900641246 | F1740: 趣味程序导学 Java Script（配光盘） | G1740: 杨正华等 | H1740: 32.00 | I1740: 37288 | J1740: 8
A1741: =ROW()-2 -> 1739 | B1741: P- | C1741: 4307 | D1741: 1 | E1741: 7900643079 | F1741: 趣味程序导学 Visual C++（配光盘） | G1741: 董末名等 | H1741: 29.50 | I1741: 37408 | J1741: 10
A1742: =ROW()-2 -> 1740 | B1742: P- | C1742: 4331 | D1742: 1 | E1742: 7900643311 | F1742: 趣味程序导学 Delphi（配光盘） | G1742: 杨正华等 | H1742: 32.00 | I1742: 37469 | J1742: 9
F1743: 编程之路系列教材
A1744: =ROW()-2 -> 1742 | B1744: TP | C1744: 5015 | D1744: 1 | E1744: 05015-5 | F1744: 编程之路系列教材――Visual Basic 6 程序设计导学 | G1744: 刘圣才等 | H1744: 32.00 | I1744: 37316 | J1744: 8
A1745: =ROW()-2 -> 1743 | B1745: TP | C1745: 5246 | D1745: 1 | E1745: 05246-8 | F1745: 编程之路系列教材――数据结构导学 | G1745: 苏光奎等 | H1745: 22.00 | I1745: 37288 | J1745: 12
A1746: =ROW()-2 -> 1744 | B1746: TP | C1746: 5271 | D1746: 1 | E1746: 05271-9 | F1746: 编程之路系列教材――Visual C++ 6程序设计导学 | G1746: 马安鹏 | H1746: 38.00 | I1746: 37316 | J1746: 7
A1747: =ROW()-2 -> 1745 | B1747: TP | C1747: 5388 | D1747: 1 | E1747: 05388-X | F1747: 编程之路系列教材――Delphi 6程序设计导学 | G1747: 张春林 | H1747: 29.00 | I1747: 37363 | J1747: 8
A1748: =ROW()-2 -> 1746 | B1748: TP | C1748: 5472 | D1748: 1 | E1748: 05472-1 | F1748: 编程之路系列教材――C++Builder程序设计导学 | G1748: 刘光 | H1748: 32.00 | I1748: 37398 | J1748: 8
A1749: =ROW()-2 -> 1747 | B1749: TP | C1749: 5544 | D1749: 1 | E1749: 05544-0 | F1749: 编程之路系列教材――Power Builder 7 程序设计导学 | G1749: 徐武平 | H1749: 38.00 | I1749: 37408 | J1749: 6
F1750: 计算机专业教学辅导丛书
A1751: =ROW()-2 -> 1749 | B1751: TP | C1751: 5316 | D1751: 1 | E1751: 05316-2 | F1751: 计算机组成原理――习题与解析 | G1751: 徐爱萍 | H1751: 30.00 | I1751: 37316 | J1751: 8
A1752: =ROW()-2 -> 1750 | B1752: TP | C1752: 5411 | D1752: 1 | E1752: 05411-8 | F1752: 数据结构（C语言篇）――习题与解析（修订版） | G1752: 李春葆 | H1752: 29.00 | I1752: 37363 | J1752: 8
A1753: =ROW()-2 -> 1751 | B1753: TP | C1753: 4512 | D1753: 1 | E1753: 04512-7 | F1753: 编译原理――习题与解析 | G1753: 伍春香 | H1753: 25.00 | I1753: 37043 | J1753: 9
A1754: =ROW()-2 -> 1752 | B1754: TP | C1754: 5163 | D1754: 1 | E1754: 05163-1 | F1754: 离散数学――习题与解析 | G1754: 胡新启等 | H1754: 28.00 | I1754: 37257 | J1754: 9
A1755: =ROW()-2 -> 1753 | B1755: TP | C1755: 4948 | D1755: 1 | E1755: 04948-3 | F1755: C++ 语言――习题与解析 | G1755: 李春葆 | H1755: 26.00 | I1755: 37165 | J1755: 9
A1756: =ROW()-2 -> 1754 | B1756: TP | C1756: 3513 | D1756: 1 | E1756: 03513-X | F1756: 数据结构――习题与解析 | G1756: 李春葆 | H1756: 26.00 | I1756: 36281 | J1756: 10
A1757: =ROW()-2 -> 1755 | B1757: TP | C1757: 3786 | D1757: 1 | E1757: 03786-8 | F1757: 数据结构(C语言篇)习题与解析 | G1757: 李春葆 | H1757: 28.00 | I1757: 36526 | J1757: 8
A1758: =ROW()-2 -> 1756 | B1758: TP | C1758: 4659 | D1758: 1 | E1758: 04659-X | F1758: 操作系统――习题与解析 | G1758: 曾平 等 | H1758: 24.00 | I1758: 37073 | J1758: 10
A1759: =ROW()-2 -> 1757 | B1759: TP | C1759: 4534 | D1759: 1 | E1759: 04534-8 | F1759: 计算机网络――习题与解析 | G1759: 鲁士文 | H1759: 28.00 | I1759: 37043 | J1759: 8
F1760: 信息安全技术系列丛书
A1761: =ROW()-2 -> 1759 | B1761: TP | C1761: 4245 | D1761: 1 | E1761: 04245-4 | F1761: 计算机通信网络安全 | G1761: 冯登国 | H1761: 22.00 | I1761: 36951 | J1761: 12
A1762: =ROW()-2 -> 1760 | B1762: TP | C1762: 5099 | D1762: 1 | E1762: 05099-6 | F1762: 系统安全与入侵检测 | G1762: 戴英侠等 | H1762: 26.00 | I1762: 37316 | J1762: 9
F1763: 科海电脑技术丛书
A1764: =ROW()-2 -> 1762 | B1764: TP | C1764: 5289 | D1764: 1 | E1764: 05289-1 | F1764: Perl网络编程 | G1764: 王超等译 | H1764: 62.00 | I1764: 37316 | J1764: 5
A1765: =ROW()-2 -> 1763 | B1765: TP | C1765: 5241 | D1765: 1 | E1765: 05241-7 | F1765: SOLARIS系统管理员指南 | G1765: 束文译 | H1765: 39.00 | I1765: 37316 | J1765: 8
A1766: =ROW()-2 -> 1764 | B1766: TP | C1766: 4172 | D1766: 1 | E1766: 04172-6 | F1766: JavaScript示例导学 | G1766: 聊宏斌等译 | H1766: 54.00 | I1766: 37347 | J1766: 5
F1767: 网络程序设计系列丛书
A1768: =ROW()-2 -> 1766 | B1768: TP | C1768: 5309 | D1768: 1 | E1768: 05309-X | F1768: Borland C++ Builder网络 编程 | G1768: 贺涛 | H1768: 36.00 | I1768: 37408 | J1768: 7
F1769: 北京计算机教育培训中心培训系列教材
A1770: =ROW()-2 -> 1768 | B1770: P- | C1770: 4142 | D1770: 1 | E1770: 7900641424 | F1770: 3ds max电视讲座教程――3ds max认证考试题解 | G1770: 黄心渊 | H1770: 28.00 | I1770: 37347 | J1770: 12
F1771: 审计署计算机审计中级培训系列教材
A1772: =ROW()-2 -> 1770 | B1772: P- | C1772: 5559 | D1772: 1 | E1772: 05559-9 | F1772: 数据库基础及应用技术 | G1772: 何玉洁 | H1772: 39.00 | I1772: 37408 | J1772: 8
A1773: =ROW()-2 -> 1771 | B1773: P- | C1773: 4190 | D1773: 1 | E1773: 641-90-4 | F1773: 计算机审计――数据采集与分析技术（配光盘） | G1773: 董化礼等 | H1773: 36.00 | I1773: 37408 | J1773: 10
A1774: =ROW()-2 -> 1772 | B1774: P- | C1774: 5430 | D1774: 1 | E1774: 05430-4 | F1774: Visual Basic 编程基础与应用 | G1774: 董宛 | H1774: 29.00 | I1774: 37408 | J1774: 10
F1775: CAXA实用范例教程系列
A1776: =ROW()-2 -> 1774 | B1776: P- | C1776: 4101 | D1776: 1 | E1776: 7900641009 | F1776: CAXA二维电子图板V2范例教程 | G1776: 高梦月等 | H1776: 35.00 | I1776: 37347 | J1776: 9
F1777: 尚顾问企业信息化丛书
A1778: =ROW()-2 -> 1776 | B1778: P- | C1778: 2559 | D1778: 1 | E1778: 7900625593 | F1778: 企业信息化经典――企业信息化指南(配光盘) | H1778: 98.00 | I1778: 36951 | J1778: 3
F1779: 推荐教材与自学用书
A1780: =ROW()-2 -> 1778 | B1780: TP | C1780: 5437 | D1780: 1 | E1780: 05437-1 | F1780: Java程序设计基础 | G1780: 吴晓东 | H1780: 25.00 | I1780: 37438 | J1780: 9
F1781: 数据库技术专业丛书
A1782: =ROW()-2 -> 1780 | B1782: TP | C1782: 5107 | D1782: 1 | E1782: 05107-0 | F1782: 数据库技术专业丛书――SQL Server 2000 管理指南 | G1782: 吕静桦等译 | H1782: 37.00 | I1782: 2001.12 | J1782: 9
A1783: =ROW()-2 -> 1781 | B1783: TP | C1783: 4949 | D1783: 1 | E1783: 04949-1 | F1783: 数据库技术专业丛书――SQL Server 2000 Web 应用开发指南 | G1783: 宫丽杰译 | H1783: 39.00 | I1783: 37165 | J1783: 8
A1784: =ROW()-2 -> 1782 | B1784: TP | C1784: 5009 | D1784: 1 | E1784: 05009-0 | F1784: 数据库技术专业丛书――SQL Server 2000 设计与 T-SQL 编程 | G1784: 卢庆龄等译 | H1784: 40.00 | I1784: 37196 | J1784: 7
A1785: =ROW()-2 -> 1783 | B1785: P- | C1785: 3712 | D1785: 1 | E1785: 7900637125 | F1785: 数据库技术专业丛书――SQL Server 2000 基础教程（配光盘） | G1785: 吕静桦等译 | H1785: 52.00 | I1785: 37135 | J1785: 6
A1786: =ROW()-2 -> 1784 | B1786: TP | C1786: 5106 | D1786: 1 | E1786: 05106-2 | F1786: 数据库技术专业丛书――SQL Server 2000 开发指南（配光盘） | G1786: 陈恩义等译 | H1786: 95.00 | I1786: 37257 | J1786: 3
A1787: =ROW()-2 -> 1785 | B1787: TP | C1787: 5270 | D1787: 1 | E1787: 05270-0 | F1787: 数据库技术专业丛书――SQL Server 2000 高级编程技术 | G1787: 熊桂喜等译 | H1787: 52.00 | I1787: 37316 | J1787: 6
A1788: =ROW()-2 -> 1786 | B1788: TP | C1788: 5542 | D1788: 1 | E1788: 05542-4 | F1788: 数据库技术专业丛书――SQL Server 2000 参考大全 | G1788: Jeffrey R.Shapiro | H1788: 69.00 | I1788: 37408 | J1788: 4
F1789: 计算机科学组合学丛书
A1790: =ROW()-2 -> 1788 | B1790: TP | C1790: 4581 | D1790: 6 | E1790: 04581-X | F1790: 组合数学（第3版） | G1790: 卢开澄等 | H1790: 19.80 | I1790: 37438 | J1790: 11
A1791: =ROW()-2 -> 1789 | B1791: TP | C1791: 3330 | D1791: 1 | E1791: 03330-7 | F1791: 单目标、多目标与整数规划 | G1791: 卢开澄 | H1791: 29.80 | I1791: 36373 | J1791: 8
A1792: =ROW()-2 -> 1790 | B1792: TP | C1792: 1817 | D1792: 3 | E1792: 01817-0 | F1792: 图论及其应用 (第2版) | G1792: 卢开澄等 | H1792: 12.80 | I1792: 37226 | J1792: 15
A1793: =ROW()-2 -> 1791 | B1793: TP | C1793: 2277 | D1793: 4 | E1793: 02277-1 | F1793: 计算机算法导引――设计与分析 | G1793: 卢开澄 | H1793: 21.00 | I1793: 37469 | J1793: 10
A1794: =ROW()-2 -> 1792 | B1794: TP | C1794: 2783 | D1794: 3 | E1794: 02783-8 | F1794: 计算机密码学 (第2版) | G1794: 卢开澄 | H1794: 19.80 | I1794: 37196 | J1794: 9
F1795: 软件工程师编程基础丛书
A1796: =ROW()-2 -> 1794 | B1796: TP | C1796: 5687 | D1796: 1 | E1796: 05687-0 | F1796: C语言程序设计题典 | G1796: 李春葆等 | H1796: 29.00 | I1796: 37438 | J1796: 9
A1797: =ROW()-2 -> 1795 | B1797: TP | C1797: 5686 | D1797: 1 | E1797: 05686-2 | F1797: C++语言程序设计题典 | G1797: 李春葆等 | H1797: 25.00 | I1797: 37438 | J1797: 10
A1798: =ROW()-2 -> 1796 | B1798: TP | C1798: 5688 | D1798: 1 | E1798: 05688-9 | F1798: 数据结构程序设计题典 | G1798: 李春葆等 | H1798: 34.00 | I1798: 37469 | J1798: 7
F1799: 计算机在农业工程中的应用丛书
A1800: =ROW()-2 -> 1798 | B1800: S- | C1800: 2925 | D1800: 1 | E1800: 02925-3 | F1800: 农业机械计算机辅助分析和设计 | G1800: 赵匀 | H1800: 15.00 | I1800: 1998 | J1800: 15
A1801: =ROW()-2 -> 1799 | B1801: S- | C1801: 3120 | D1801: 1 | E1801: 03120-7 | F1801: 计算机在农机化管理中的应用 | G1801: 晏国生 | H1801: 15.00 | I1801: 1998 | J1801: 15
A1802: =ROW()-2 -> 1800 | B1802: S- | C1802: 2779 | D1802: 1 | E1802: 02779-X | F1802: 计算机在农业生物环境测控与管理中的应用 | G1802: 白广存等 | H1802: 22.8 | I1802: 1998 | J1802: 10
A1803: =ROW()-2 -> 1801 | B1803: TP | C1803: 3849 | D1803: 1 | E1803: 03849-X1 | F1803: 农业专家系统入门 | G1803: 石纯一等 | H1803: 16 | I1803: 36647 | J1803: 30
F1804: 精通SolidWorks 丛书
A1805: =ROW()-2 -> 1803 | B1805: TP 5389 1 | E1805: 05389-7 | F1805: SolidWorks 零件设计 | G1805: 杨勇生等 | H1805: 18.00 | I1805: 37408 | J1805: 13
A1806: =ROW()-2 -> 1804 | B1806: P- | C1806: 4196 | D1806: 1 | E1806: 04196-1 | F1806: SolidWorks 装配和二维工程图（配光盘） | G1806: 夏燕等 | H1806: 24.00 | I1806: 37438 | J1806: 12
A1807: =ROW()-2 -> 1805 | B1807: P- | C1807: 4195 | D1807: 1 | E1807: 04195-1 | F1807: SolidWorks 精彩实例 | G1807: 李维等著 | H1807: 20.00 | I1807: 37438 | J1807: 16
F1808: 建筑智能化系统设计丛书
A1809: =ROW()-2 -> 1807 | B1809: TP | C1809: 5429 | D1809: 1 | E1809: 05429-0 | F1809: 智能建筑计算机网络工程 | G1809: 胡道元 | H1809: 27.00 | I1809: 37500 | J1809: 11
F1810: 软件研发管理技术丛书
A1811: =ROW()-2 -> 1809 | B1811: TP 5389 1 | C1811: 5553 | E1811: 05553-X | F1811: 软件配置管理 | G1811: 徐晓春等 | H1811: 30.00 | I1811: 37438 | J1811: 9
F1812: Visual Basic 高级程序设计
A1813: =ROW()-2 -> 1811 | B1813: TP | C1813: 5426 | D1813: 1 | E1813: 05426-6 | F1813: Visual Basic Internet 程序设计 | G1813: 刘炳文 | H1813: 25 | I1813: 37469 | J1813: 13
A1814: =ROW()-2 -> 1812 | B1814: TP | C1814: 5420 | D1814: 1 | E1814: 054207 | F1814: Visual Basic ActiveX 程序设计 | G1814: 刘炳文 | H1814: 17 | I1814: 37469 | J1814: 12
A1815: =ROW()-2 -> 1813 | B1815: TP | C1815: 5425 | D1815: 1 | E1815: 05425-8 | F1815: Visual Basic 图形与多媒体程序设计 | G1815: 刘炳文 | H1815: 23 | I1815: 37469 | J1815: 10
F1816: 6.分类图书
F1817: 计算机原理及基础知识
A1818: =ROW()-2 -> 1816 | B1818: TP | C1818: 3812 | D1818: 1 | E1818: 03812-0 | F1818: 计算机组成与系统结构 | G1818: 李亚民 | H1818: 32.00 | I1818: 36678 | J1818: 7
A1819: =ROW()-2 -> 1817 | B1819: TP | C1819: 5363 | D1819: 1 | E1819: 05363-4 | F1819: 电脑选购、组装、维护一路通 | G1819: 导向科技 | H1819: 25.00 | I1819: 37500 | J1819: 10
A1820: =ROW()-2 -> 1818 | B1820: TP | C1820: 3114 | D1820: 4 | E1820: 03114-2 | F1820: 微型计算机系统原理及应用(第三版 下） | G1820: 宋瀚涛 | H1820: 13.50 | I1820: 37438 | J1820: 14
A1821: =ROW()-2 -> 1819 | B1821: TP | C1821: 5548 | D1821: 1 | E1821: 05548-3 | F1821: 微型计算机系统原理及应用(第4版） | G1821: 周明德 | H1821: 33.00 | I1821: 37408 | J1821: 7
A1822: =ROW()-2 -> 1820 | B1822: TP | C1822: 5561 | D1822: 1 | E1822: 05561-0 | F1822: 微型计算机系统原理及应用(第4版）――习题集与实验指导书 | G1822: 周明德 | H1822: 8.50 | I1822: 37408 | J1822: 25
A1823: =ROW()-2 -> 1821 | B1823: TP | C1823: 5689 | D1823: 1 | E1823: 05689-1 | F1823: 奔腾系列微型计算机原理及接口技术 | G1823: 谢瑞和等 | H1823: 24.00 | I1823: 37438 | J1823: 12
A1824: =ROW()-2 -> 1822 | B1824: TP | C1824: 5446 | D1824: 1 | E1824: 05446-1 | F1824: 微型机应用基础教程――从windows98到 windows 2000 | G1824: 戴梅萼 | H1824: 28.00 | I1824: 37438 | J1824: 9
A1825: =ROW()-2 -> 1823 | B1825: TP | C1825: 4977 | D1825: 1 | E1825: 04977-7 | F1825: 新编计算机应用基础教程 | G1825: 王军 等 | H1825: 39.00 | I1825: 37469 | J1825: 7
A1826: =ROW()-2 -> 1824 | B1826: P- | C1826: 3799 | D1826: 1 | E1826: 7-900637-99-0 | F1826: 硬盘修复、备份、分区一次搞定（附光盘） | G1826: 王丽琴 | H1826: 42.00 | I1826: 37469 | J1826: 8
A1827: =ROW()-2 -> 1825 | B1827: TP | C1827: 2290 | D1827: 4 | E1827: 02290-1 | F1827: C 常用算法程序集 | G1827: 徐士良 | H1827: 48.00 | I1827: 37408 | J1827: 7
A1828: =ROW()-2 -> 1826 | B1828: P- | C1828: 3198 | D1828: 1 | F1828: 新编16-32位微型计算机原理及应用（第2 版） | G1828: 李继灿等 | H1828: 36.00 | I1828: 37347 | J1828: 7
A1829: =ROW()-2 -> 1827 | B1829: TP | C1829: 0237 | D1829: I | E1829: 00237-1 | F1829: 微型计算机硬件软件及其应用(修订版) | G1829: 周明德 | H1829: 36.00 | I1829: 36739 | J1829: 5
A1830: =ROW()-2 -> 1828 | B1830: TP | C1830: 3992 | D1830: 2 | E1830: 03992-5 | F1830: 微型计算机应用技术（上）―― 数据采集与控制技术 | G1830: 唐光荣等 | H1830: 18.00 | I1830: 36739 | J1830: 12
A1831: =ROW()-2 -> 1829 | B1831: TP | C1831: 3992 | D1831: 1 | E1831: 03992-5 | F1831: 微型计算机应用技术（下）―― 计算机网络与多媒体应用技术 | G1831: 张曾科等 | H1831: 18.00 | I1831: 36739 | J1831: 13
A1832: =ROW()-2 -> 1830 | B1832: TP | C1832: 3359 | D1832: 3 | E1832: 03359-5 | F1832: 微型计算机控制技术 | G1832: 于海生等 | H1832: 24.00 | I1832: 37373 | J1832: 10
A1833: =ROW()-2 -> 1831 | B1833: TP | C1833: 3880 | D1833: 1 | E1833: 03880-5 | F1833: 32位微型计算机原理与接口技术 | G1833: 仇玉章等 | H1833: 28.50 | I1833: 37288 | J1833: 7
A1834: =ROW()-2 -> 1832 | B1834: TP | C1834: 3881 | D1834: 1 | E1834: 03881-3 | F1834: 32位微型计算机原理与接口技术实验指导 | G1834: 仇玉章等 | H1834: 6.00 | I1834: 37469 | J1834: 35
A1835: =ROW()-2 -> 1833 | B1835: TP | C1835: 3370 | D1835: 1 | E1835: 03370-6 | F1835: 计算机应用能力考试培训教程 (中级) | G1835: 陈国荣等 | H1835: 39.00 | I1835: 1999 | J1835: 6
A1836: =ROW()-2 -> 1834 | B1836: TP | C1836: 2658 | D1836: 7 | E1836: 02658-0 | F1836: 计算机基础教程（WINDOWS版） | G1836: 黄云森 | H1836: 25.00 | I1836: 1999 | J1836: 10
A1837: =ROW()-2 -> 1835 | B1837: TP | C1837: 1152 | D1837: 1 | E1837: 01152-4 | F1837: 微机使用综合教程 | G1837: 成正祥等 | H1837: 24.00 | I1837: 37500 | J1837: 12
A1838: =ROW()-2 -> 1836 | B1838: TP | C1838: 3875 | D1838: 1 | E1838: 03875-9 | F1838: 新编微机培训教程（2000版） | G1838: 王诚君 | H1838: 24.00 | I1838: 36923 | J1838: 8
A1839: =ROW()-2 -> 1837 | B1839: TP | C1839: 3843 | D1839: 2 | E1839: 03843-0 | F1839: 初学计算机实用教程 | G1839: 钟建华等 | H1839: 22.00 | I1839: 36982 | J1839: 12
A1840: =ROW()-2 -> 1838 | B1840: TP | C1840: 1372 | D1840: 2 | E1840: 01372-1 | F1840: 你也能用电脑计算∏=3.14159…到千万位 | G1840: 杨自强等 | H1840: 10.00 | I1840: 36982 | J1840: 25
A1841: =ROW()-2 -> 1839 | B1841: TP | C1841: 3635 | D1841: 1 | E1841: 03635-7 | F1841: 用于最优化的计算智能 | G1841: 李军等译 | H1841: 18.00 | I1841: 36495 | J1841: 20
A1842: =ROW()-2 -> 1840 | B1842: TP | C1842: 1762 | D1842: 2 | E1842: 01762-X | F1842: 系统设计与仿真 | G1842: 顾启泰 | H1842: 17.50 | I1842: 1998 | J1842: 9
A1843: =ROW()-2 -> 1841 | B1843: TP | C1843: 4577 | D1843: 1 | E1843: 04577-1 | F1843: PIC 单片机轻松入门 | G1843: 施威铭 研究室 | H1843: 27.00 | I1843: 37377 | J1843: 8
A1844: =ROW()-2 -> 1842 | B1844: TP | C1844: 5046 | D1844: 1 | E1844: 05046-5 | F1844: 8×C196KX单片机及其应用系统设计 | G1844: 刘复华 | H1844: 29.60 | I1844: 37438 | J1844: 8
A1845: =ROW()-2 -> 1843 | B1845: TP | C1845: 4714 | D1845: 1 | E1845: 04714-6 | F1845: 单片机原理及系统设计 | G1845: 胡汉才 | H1845: 39.00 | I1845: 37377 | J1845: 6
A1846: =ROW()-2 -> 1844 | B1846: TP | C1846: 5531 | D1846: 1 | E1846: 05531-9 | F1846: 8051单片机实践与应用 | G1846: 吴金戌等 | H1846: 39.00 | I1846: 37500 | J1846: 7
A1847: =ROW()-2 -> 1845 | B1847: TP | C1847: 3686 | D1847: 1 | E1847: 03686-1 | F1847: 8051 单片机 C 语言控制与应用 | G1847: 陈龙三 | H1847: 35.00 | I1847: 36404 | J1847: 9
A1848: =ROW()-2 -> 1846 | B1848: TP | C1848: 2914 | D1848: 1 | E1848: 02914-8 | F1848: 8098单片机及扩展接口实验指导 | G1848: 唐庆红 | H1848: 15.00 | I1848: 1998 | J1848: 15
A1849: =ROW()-2 -> 1847 | B1849: TP | C1849: 0948 | D1849: E | E1849: 00948-1 | F1849: 计算机原理与系统结构 | G1849: 侯炳辉 | H1849: 18.00 | I1849: 37288 | J1849: 9
A1850: =ROW()-2 -> 1848 | B1850: TP | C1850: 3599 | D1850: 1 | E1850: 03599-7 | F1850: 微机控制应用实验与实例 | G1850: 黄胜军 | H1850: 20.00 | I1850: 36495 | J1850: 12
A1851: =ROW()-2 -> 1849 | B1851: TP | C1851: 4580 | D1851: 1 | E1851: 04580-1 | F1851: Fuzzy Control of Queueing Networks | G1851: 张润彤 | H1851: 49.00 | I1851: 37288 | J1851: 7
A1852: =ROW()-2 -> 1850 | B1852: TP | C1852: 1101 | D1852: 4 | E1852: 01101-X | F1852: 8098 单片机及其应用系统设计 | G1852: 刘复华 | H1852: 20.00 | I1852: 37196 | J1852: 9
A1853: =ROW()-2 -> 1851 | B1853: TP | C1853: 2343 | D1853: 1 | E1853: 02343- | F1853: 8098单片机及其应用系统设计例题习题教程 | G1853: 刘复华 | H1853: 16.80 | I1853: 1997 | J1853: 10
A1854: =ROW()-2 -> 1852 | B1854: TP | C1854: 1086 | D1854: 1 | E1854: 01086-2 | F1854: H8S/2655 系列 16 位 单片机 | G1854: 李芙英等 | H1854: 26.00 | I1854: 36770 | J1854: 9
A1855: =ROW()-2 -> 1853 | B1855: TP | C1855: 2107 | D1855: 7 | E1855: 02107-4 | F1855: 单片机原理及其接口技术 | G1855: 胡汉才 | H1855: 32.00 | I1855: 37438 | J1855: 6
A1856: =ROW()-2 -> 1854 | B1856: TP | C1856: 2737 | D1856: 1 | E1856: 02737-4 | F1856: 单片机应用技术教程 | G1856: 张洪润等 | H1856: 29.00 | I1856: 1997 | J1856: 10
A1857: =ROW()-2 -> 1855 | B1857: TP | C1857: 3252 | D1857: 1 | E1857: 03252-2 | F1857: SH3高级单片机原理及应用 | G1857: 沈永林 | H1857: 22.00 | I1857: 1999 | J1857: 12
A1858: =ROW()-2 -> 1856 | B1858: TP | C1858: 2675 | D1858: 2 | E1858: 02675-0 | F1858: IBM AS/400计算机概论 | G1858: 濮群 等 | H1858: 40.00 | I1858: 1998 | J1858: 8
A1859: =ROW()-2 -> 1857 | B1859: TP | C1859: 2540 | D1859: 6 | E1859: 02540-1 | F1859: 计算机基础知识与操作(第2版) | G1859: 徐士良等 | H1859: 17.00 | I1859: 36526 | J1859: 12
A1860: =ROW()-2 -> 1858 | B1860: TP | C1860: 1447 | D1860: I | E1860: 01447-7 | F1860: 计算机基础知识教程 | G1860: 姜爱群等 | H1860: 13.50 | I1860: 36404 | J1860: 13
A1861: =ROW()-2 -> 1859 | B1861: TP | C1861: 0768 | D1861: 1 | E1861: 00768-3 | F1861: 计算机导论 | G1861: Roberta Baber | H1861: 48.00 | I1861: 37438 | J1861: 6
A1862: =ROW()-2 -> 1860 | B1862: P- | C1862: 1748 | D1862: 1 | E1862: 7900617485 | F1862: 家庭电脑十用 (配光盘) | G1862: 史斌星等 | H1862: 46.00 | I1862: 36647 | J1862: 8
A1863: =ROW()-2 -> 1861 | B1863: GP | C1863: 1748 | D1863: 1 | E1863: 7900617485 | F1863: 家庭电脑十用 (光盘) | H1863: 31.00 | I1863: 36434 | J1863: 25
A1864: =ROW()-2 -> 1862 | B1864: TP | C1864: 2928 | D1864: 3 | E1864: 02928-8 | F1864: 计算机病毒防治实用技术 | G1864: 袁忠良 | H1864: 28.00 | I1864: 36526 | J1864: 8
A1865: =ROW()-2 -> 1863 | B1865: TP | C1865: 3425 | D1865: 2 | E1865: 03425-7 | F1865: 安全防范系统工程 | G1865: 陈 龙 | H1865: 21.50 | I1865: 36465 | J1865: 12
A1866: =ROW()-2 -> 1864 | B1866: TP | C1866: 2789 | D1866: 1 | E1866: 02789-7 | F1866: 计算机应用系统安全要则 | G1866: 叶 红 | H1866: 7.8 | I1866: 1998 | J1866: 25
A1867: =ROW()-2 -> 1865 | B1867: TP | C1867: 5392 | D1867: 1 | E1867: 05392-8 | F1867: 入侵检测系统实例剖析 | G1867: 韩东海等 | H1867: 28.00 | I1867: 37377 | J1867: 9
A1868: =ROW()-2 -> 1866 | B1868: TP | C1868: 4001 | D1868: 1 | E1868: 04001-X | F1868: PC 技术内幕（第8版） | G1868: 张琦等译 | H1868: 56.00 | I1868: 36739 | J1868: 5
A1869: =ROW()-2 -> 1867 | B1869: TP | C1869: 3288 | D1869: 1 | E1869: 03288-2 | F1869: 多媒体电脑日常维护与故障排除 | G1869: 范文历等 | H1869: 29.80 | I1869: 37073 | J1869: 9
A1870: =ROW()-2 -> 1868 | B1870: TP | C1870: 4608 | D1870: 1 | E1870: 04608-5 | F1870: 电脑应用入门教程 | G1870: 王诚君 | H1870: 19.80 | I1870: 37073 | J1870: 8
A1871: =ROW()-2 -> 1869 | B1871: TP | C1871: 4640 | D1871: 1 | E1871: 04640-9 | F1871: 电脑生手入门宝典 | G1871: 高越明等 | H1871: 36.00 | I1871: 37469 | J1871: 7
A1872: =ROW()-2 -> 1870 | B1872: TP | C1872: 1076 | D1872: 1 | E1872: 01076-5 | F1872: 电脑应用入门宝典 | G1872: 高越明等 | H1872: 42.00 | I1872: 37408 | J1872: 6
A1873: =ROW()-2 -> 1871 | B1873: TP | C1873: 5249 | D1873: 1 | E1873: 05249-2 | F1873: 计算机短期培训教程 | G1873: 胡辰浩 | H1873: 26.00 | I1873: 37316 | J1873: 10
A1874: =ROW()-2 -> 1872 | B1874: TP | C1874: 4253 | D1874: 1 | E1874: 04253-5 | F1874: 计算机维护技术 （第二版） | G1874: 瓮正科 | H1874: 29.00 | I1874: 36951 | J1874: 8
A1875: =ROW()-2 -> 1873 | B1875: TP | C1875: 3061 | D1875: 1 | E1875: 03061-8 | F1875: 最新电脑配置与故障检修 | H1875: 26.00 | I1875: 1998 | J1875: 10
A1876: =ROW()-2 -> 1874 | B1876: TP | C1876: 5317 | D1876: 1 | E1876: 05317-0 | F1876: 中文Windows培训教程 | G1876: 牛田 | H1876: 29.00 | I1876: 37316 | J1876: 7
A1877: =ROW()-2 -> 1875 | B1877: TP | C1877: 5292 | D1877: 1 | E1877: 05292-1 | F1877: 新编微机培训教程（2002版） | G1877: 王诚君 | H1877: 28.00 | I1877: 37316 | J1877: 8
A1878: =ROW()-2 -> 1876 | B1878: TP | C1878: 5100 | D1878: 1 | E1878: 05100-3 | F1878: 微机原理、外设、接口 | G1878: 陈启美 | H1878: 42.00 | I1878: 37316 | J1878: 6
A1879: =ROW()-2 -> 1877 | B1879: TP | C1879: 5722 | D1879: 1 | E1879: 05722-2 | F1879: 最新微机操作培训教程（第三版） | G1879: 王诚君 | H1879: 29.00 | I1879: 37469 | J1879: 7
A1880: =ROW()-2 -> 1878 | B1880: TP | C1880: 5726 | D1880: 1 | E1880: 05726-5 | F1880: 软件企业IS9001认证教程 | G1880: 田代军 | H1880: 28.00 | I1880: 37469 | J1880: 11
A1881: =ROW()-2 -> 1879 | B1881: TP | C1881: 5354 | D1881: 1 | E1881: 05354-5 | F1881: 微机硬盘管理实用详解 | G1881: 王恒青等 | H1881: 24.00 | I1881: 37469 | J1881: 11
F1882: 计算机语言及程序设计
A1883: =ROW()-2 -> 1881 | B1883: TP | C1883: 4566 | D1883: 1 | E1883: 04566-6 | F1883: 高性能计算并行编程技术――MPI 并行程序设计 | G1883: 都志辉 | H1883: 36.00 | I1883: 37104 | J1883: 9
A1884: =ROW()-2 -> 1882 | B1884: TP | C1884: 4847 | D1884: 1 | E1884: 04847-9 | F1884: Kylix 程序设计 | G1884: 杨宗志 | H1884: 33.00 | I1884: 37165 | J1884: 7
A1885: =ROW()-2 -> 1883 | B1885: P- | C1885: 3522 | D1885: 1 | E1885: 790063522X | F1885: 活动目录编程指南（配光盘） | G1885: 谭郁松等译 | H1885: 66.00 | I1885: 37012 | J1885: 5
A1886: =ROW()-2 -> 1884 | B1886: TP | C1886: 5000 | D1886: 1 | E1886: 05000-7 | F1886: Application Center 2000 专家指南 | G1886: 袁勤勇等译 | H1886: 39.00 | I1886: 37196 | J1886: 8
A1887: =ROW()-2 -> 1885 | B1887: TP | C1887: 3374 | D1887: 2 | E1887: 03374-9 | F1887: Windows Sockets 网络程序设计大全 | G1887: 蒋东兴等 | H1887: 29.50 | I1887: 36831 | J1887: 8
A1888: =ROW()-2 -> 1886 | B1888: P- | C1888: 2544 | D1888: 1 | E1888: 7900625445 | F1888: Windows 图形编程（配光盘） | G1888: 罗骏等译 | H1888: 75.00 | I1888: 36708 | J1888: 5
A1889: =ROW()-2 -> 1887 | B1889: TP | C1889: 4564 | D1889: 1 | E1889: 04564-X | F1889: 精通 InstallShield 6 | G1889: 张铭 等 | H1889: 29.00 | I1889: 37073 | J1889: 9
A1890: =ROW()-2 -> 1888 | B1890: TP | C1890: 4334 | D1890: 1 | E1890: 04334-5 | F1890: API for Windows 98/2000 详解 | G1890: 张昆深等 | H1890: 48.00 | I1890: 37349 | J1890: 7
A1891: =ROW()-2 -> 1889 | B1891: TP | C1891: 4875 | D1891: 1 | E1891: 04875-4 | F1891: Perl 调试技术 | G1891: 曾奇 译 | H1891: 16.00 | I1891: 37165 | J1891: 18
A1892: =ROW()-2 -> 1890 | B1892: P- | C1892: 2515 | D1892: 1 | E1892: 7900625151 | F1892: OpenGL 程序设计 | G1892: 乔林 等 | H1892: 54.00 | I1892: 36647 | J1892: 6
A1893: =ROW()-2 -> 1891 | B1893: P- | C1893: 3113 | D1893: 1 | E1893: 7900631135 | F1893: 可视化OpenGL程序设计 （配光盘） | G1893: 费广正等 | H1893: 42.00 | I1893: 36982 | J1893: 8
A1894: =ROW()-2 -> 1892 | B1894: TP | C1894: 3825 | D1894: 1 | E1894: 03825-2 | F1894: 漫游 Logo 世界 | G1894: 薛维明 | H1894: 10.00 | I1894: 36617 | J1894: 18
A1895: =ROW()-2 -> 1893 | B1895: TP | C1895: 3472 | D1895: 2 | E1895: 03472-9 | F1895: 应用软件系统开发 | G1895: 柴跃廷等 | H1895: 24.00 | I1895: 36526 | J1895: 8
A1896: =ROW()-2 -> 1894 | B1896: TP | C1896: 4002 | D1896: 1 | E1896: 04002-8 | F1896: 游戏软件设计与开发大揭秘 | G1896: 何健辉等译 | H1896: 42.00 | I1896: 36770 | J1896: 8
A1897: =ROW()-2 -> 1895 | B1897: TP | C1897: 1223 | D1897: 1 | E1897: 01223-7 | F1897: DirectDraw 原理与 API 参考 | G1897: 武永康 | H1897: 39.00 | I1897: 36831 | J1897: 8
A1898: =ROW()-2 -> 1896 | B1898: TP | C1898: 4484 | D1898: 1 | E1898: 04484-8 | F1898: DirectInput 原理与 API 参考 | G1898: 武永康 | H1898: 32.00 | I1898: 37073 | J1898: 9
A1899: =ROW()-2 -> 1897 | B1899: TP | C1899: 4774 | D1899: 1 | E1899: 04774-X | F1899: Direct3D 与 API 参考（上） | G1899: 武永康 | H1899: 32.00 | I1899: 37196 | J1899: 8
A1900: =ROW()-2 -> 1898 | B1900: TP | C1900: 4774 | D1900: 2 | E1900: 4774-X | F1900: Direct3D 与 API 参考（下） | G1900: 武永康 | H1900: 38.00 | I1900: 37196 | J1900: 7
A1901: =ROW()-2 -> 1899 | B1901: TP | C1901: 5118 | D1901: 1 | E1901: 05118-6 | F1901: ASP.NET 高级编程 | H1901: 128.00 | I1901: 37257 | J1901: 3
A1902: =ROW()-2 -> 1900 | B1902: P | C1902: 3730 | D1902: 1 | E1902: 7900637303 | F1902: C#和ASP.NET程序设计教程（含盘） | G1902: 木林森 | H1902: 38.00 | I1902: 37288 | J1902: 8
A1903: =ROW()-2 -> 1901 | B1903: TP | C1903: 4876 | D1903: 1 | E1903: 04876-2 | F1903: C# 程序设计教程 | G1903: 康博 译 | H1903: 38.00 | I1903: 37341 | J1903: 7
A1904: =ROW()-2 -> 1902 | B1904: TP | C1904: 4787 | D1904: 1 | E1904: 04787-1 | F1904: C# 程序设计 | G1904: 郭大权等 | H1904: 28.00 | I1904: 37165 | J1904: 10
A1905: =ROW()-2 -> 1903 | B1905: TP | C1905: 5091 | D1905: 1 | E1905: 05091-0 | F1905: C#高级编程 | G1905: Simon Robinson | H1905: 128.00 | I1905: 37257 | J1905: 3
A1906: =ROW()-2 -> 1904 | B1906: TP | C1906: 5155 | D1906: 1 | E1906: 05155-0 | F1906: Oracle 8i应用高级编程――Java, PL/SQL 和XML深入开发 | G1906: John Carnell | H1906: 128.00 | I1906: 37257 | J1906: 2
A1907: =ROW()-2 -> 1905 | B1907: TP | C1907: 4976 | D1907: 1 | E1907: 04976-9 | F1907: C# 程序设计案例教程 | G1907: 王 宏 | H1907: 28.00 | I1907: 37226 | J1907: 10
A1908: =ROW()-2 -> 1906 | B1908: TP | C1908: 5111 | D1908: 1 | E1908: 05111-9 | F1908: C++ 程序设计导学 | G1908: 李春葆 | H1908: 30.00 | I1908: 2001.12 | J1908: 8
A1909: =ROW()-2 -> 1907 | B1909: TP | C1909: 5173 | D1909: 1 | E1909: 05173-9 | F1909: C#编程实例与技巧 | G1909: 刘浩 等 | H1909: 30.00 | I1909: 2002.2 | J1909: 10
A1910: =ROW()-2 -> 1908 | B1910: P- | C1910: 3585 | D1910: 1 | E1910: 7900635858 | F1910: C 语言贯通教程――C、C++、Visual C++ 及Windows 应用程序 | G1910: 史斌星等 | H1910: 46.00 | I1910: 37438 | J1910: 6
A1911: =ROW()-2 -> 1909 | B1911: P- | C1911: 3565 | D1911: 1 | E1911: 7900635653 | F1911: Internet TCP/IP 程序设计之 C ++ Builder 高手 （配光盘） | G1911: 黄嘉辉 | H1911: 54.00 | I1911: 37165 | J1911: 6
A1912: =ROW()-2 -> 1910 | B1912: TP | C1912: 3253 | D1912: 1 | E1912: 03253-X | F1912: Microsoft Visual C++ 语言参考手册 | H1912: 69.00 | I1912: 1999 | J1912: 5
A1913: =ROW()-2 -> 1911 | B1913: TP | C1913: 3321 | D1913: 5 | E1913: 03321-8 | F1913: C++ 语言基础教程 | G1913: 吕凤翥 | H1913: 26.00 | I1913: 37329 | J1913: 9
A1914: =ROW()-2 -> 1912 | B1914: TP | C1914: 3421 | D1914: 6 | E1914: 03421-4 | F1914: C++ 程序设计教程 | G1914: 钱 能 | H1914: 39.50 | I1914: 37288 | J1914: 7
A1915: =ROW()-2 -> 1913 | B1915: TP | C1915: 2140 | D1915: 3 | E1915: 02140-6 | F1915: C++ 程序设计习题与解答 | G1915: 钱 能 | H1915: 14.00 | I1915: 37375 | J1915: 18
A1916: =ROW()-2 -> 1914 | B1916: TP | C1916: 3496 | D1916: 4 | E1916: 03496-6 | F1916: C++ 程序设计实验指导 | G1916: 钱 能 | H1916: 9.50 | I1916: 37337 | J1916: 20
A1917: =ROW()-2 -> 1915 | B1917: TP | C1917: 2063 | D1917: B | E1917: 02063-9 | F1917: C高级实用程序设计 | G1917: 王士元等 | H1917: 32.00 | I1917: 37398 | J1917: 6
A1918: =ROW()-2 -> 1916 | B1918: TP | C1918: 2393 | D1918: 4 | E1918: 02393-X | F1918: C语言编程常见问题解答 | G1918: 张芳妮等 | H1918: 34.00 | I1918: 37104 | J1918: 7
A1919: =ROW()-2 -> 1917 | B1919: TP | C1919: 2290 | D1919: 4 | E1919: 02290-9 | F1919: C常用算法程序集(第2版) (含盘) | G1919: 徐士良 | H1919: 48.00 | I1919: 37135 | J1919: 7
A1920: =ROW()-2 -> 1918 | B1920: TP | C1920: 2269 | D1920: 4 | E1920: 02269-0 | F1920: 面向对象的理论与C++实践 | G1920: 王 燕 | H1920: 26.00 | I1920: 37288 | J1920: 7
A1921: =ROW()-2 -> 1919 | B1921: TP | C1921: 1011 | D1921: 1 | E1921: 01011-0 | F1921: 面向对象分析设计与编程OOA/OOD/OOP | G1921: 吴炜煜 | H1921: 19.50 | I1921: 37104 | J1921: 11
A1922: =ROW()-2 -> 1920 | B1922: TP | C1922: 1271 | D1922: 1 | E1922: 01271-7 | F1922: 面向对象分析和设计 | H1922: 39.00 | I1922: 36923 | J1922: 6
A1923: =ROW()-2 -> 1921 | B1923: TP | C1923: 2794 | D1923: 7 | E1923: 02794-3 | F1923: C++语言和面向对象程序设计(第2版) | G1923: 宛延 | H1923: 24.00 | I1923: 36708 | J1923: 9
A1924: =ROW()-2 -> 1922 | B1924: TP | C1924: 4509 | D1924: 1 | E1924: 04509-7 | F1924: 数据结构（C语言版） | G1924: 黄国瑜等 | H1924: 32.00 | I1924: 37438 | J1924: 7
A1925: =ROW()-2 -> 1923 | B1925: TP | C1925: 5119 | D1925: 1 | E1925: 05119-4 | F1925: 数据结构（Java语言版） | G1925: 黄国瑜等 | H1925: 32.00 | I1925: 37469 | J1925: 7
A1926: =ROW()-2 -> 1924 | B1926: TP | C1926: 1663 | D1926: 8 | E1926: 01663-1 | F1926: 数据结构简明教程 | G1926: 徐孝凯 | H1926: 17.00 | I1926: 37288 | J1926: 11
A1927: =ROW()-2 -> 1925 | B1927: TP | C1927: 4505 | D1927: 1 | E1927: 04505-4 | F1927: 多媒体技术及其应用 | G1927: 李大友 | H1927: 21.00 | I1927: 37469 | J1927: 11
A1928: =ROW()-2 -> 1926 | B1928: P- | C1928: 3523 | D1928: 1 | F1928: Framework 程序设计 | G1928: 胡哲源 | H1928: 54.00 | I1928: 37104 | J1928: 6
A1929: =ROW()-2 -> 1927 | B1929: TP | C1929: 3227 | D1929: 2 | E1929: 03227-0 | F1929: Visual C++6.0使用与开发 | G1929: 木林森等 | H1929: 40.00 | I1929: 1998 | J1929: 8
A1930: =ROW()-2 -> 1928 | B1930: P- | C1930: 3020 | D1930: 1 | F1930: Visual C++6.0 DCOM 开发指南（配光盘） | G1930: 田雨 等译 | H1930: 42.00 | I1930: 36770 | J1930: 10
A1931: =ROW()-2 -> 1929 | B1931: P- | C1931: 2527 | D1931: 1 | F1931: 实用 Visual C++6.0 教程（配光盘） | G1931: 何健辉等译 | H1931: 69.00 | I1931: 36739 | J1931: 5
A1932: =ROW()-2 -> 1930 | B1932: P- | C1932: 4165 | D1932: 1 | E1932: 7900641653 | F1932: VC++编程技术与难点剖析（配光盘） | G1932: 梅林 | H1932: 46.00 | I1932: 37500 | J1932: 2
A1933: =ROW()-2 -> 1931 | B1933: P- | C1933: 4323 | D1933: 1 | E1933: 7-900643-23-0 | F1933: Visual C++ .Net 开发南（配光盘） | G1933: John Paul Maller | H1933: 68.00 | I1933: 37469 | J1933: 5
A1934: =ROW()-2 -> 1932 | B1934: P- | C1934: 4333 | D1934: 1 | E1934: 7-900643-33-8 | F1934: 即学即用ASP.NET应用开发（含光盘） | G1934: [美]Greg Buczek | H1934: 69.00 | I1934: 37500 | J1934: 5
A1935: =ROW()-2 -> 1933 | B1935: TP | C1935: 4308 | D1935: 1 | E1935: 04308-6 | F1935: Java 程序设计百事通 | G1935: 张洪斌 | H1935: 39.00 | I1935: 37104 | J1935: 8
A1936: =ROW()-2 -> 1934 | B1936: TP | C1936: 5016 | D1936: 1 | E1936: 05016-3 | F1936: Java 2 参考大全（第四版） | G1936: 张玉清等译 | H1936: 79.00 | I1936: 37196 | J1936: 4
A1937: =ROW()-2 -> 1935 | B1937: P- | C1937: 3728 | D1937: 1 | F1937: 反编译 Java 程序（配光盘） | G1937: Decoder | H1937: 47.00 | I1937: 37196 | J1937: 6
A1938: =ROW()-2 -> 1936 | B1938: P- | C1938: 3586 | D1938: 1 | F1938: JAVA 范例实战（配光盘） | G1938: 数位文化 | H1938: 39.00 | I1938: 37135 | J1938: 6
A1939: =ROW()-2 -> 1937 | B1939: P- | C1939: 3751 | D1939: 1 | F1939: Java 与 XML 数据库整合应用（配光盘） | G1939: 沈兆阳 | H1939: 49.00 | I1939: 37226 | J1939: 6
A1940: =ROW()-2 -> 1938 | B1940: TP | C1940: 5067 | D1940: 1 | E1940: 05067-1 | F1940: Java 2 程序设计 | G1940: 普悠玛数位科技 | H1940: 35.00 | I1940: 37438 | J1940: 7
A1941: =ROW()-2 -> 1939 | B1941: TP | C1941: 5523 | D1941: 1 | E1941: 05523-8 | F1941: Java 2简明教程 | G1941: 李诚等 | H1941: 37.00 | I1941: 37438 | J1941: 8
A1942: =ROW()-2 -> 1940 | B1942: TP | C1942: 5223 | D1942: 1 | E1942: 05223-9 | F1942: Java Servlet 网络编程 | G1942: 陈海山 | H1942: 30.00 | I1942: 37316 | J1942: 8
A1943: =ROW()-2 -> 1941 | B1943: TP | C1943: 5207 | D1943: 1 | E1943: 05207-7 | F1943: JBuilder 5 实例教程 | G1943: 张 焱 | H1943: 26.00 | I1943: 37363 | J1943: 10
A1944: =ROW()-2 -> 1942 | B1944: P- | C1944: 3571 | D1944: 1 | F1944: J2EE 构建企业系统――专家级解决方案 | G1944: 谭郁松等译 | H1944: 105.00 | I1944: 37043 | J1944: 3
A1945: =ROW()-2 -> 1943 | B1945: P- | C1945: 3576 | D1945: 1 | F1945: C++ Builder 程序设计轻松上手（配光盘） | G1945: 洪国胜等 | H1945: 49.00 | I1945: 37165 | J1945: 4
A1946: =ROW()-2 -> 1944 | B1946: P- | C1946: 3745 | D1946: 1 | F1946: C++ Builder 数据库程序设计（配光盘） | G1946: 杨宗志 | H1946: 35.00 | I1946: 37165 | J1946: 8
A1947: =ROW()-2 -> 1945 | B1947: TP | C1947: 1322 | D1947: 1 | E1947: 01322-5 | F1947: C++ Builder 程序设计教程 | G1947: 王宏 等 | H1947: 48.00 | I1947: 36586 | J1947: 6
A1948: =ROW()-2 -> 1946 | B1948: P- | C1948: 4329 | D1948: 1 | E1948: 790064329X | F1948: C++ Builder 与Windows API经典范例（配光盘) | G1948: 郑明等 | H1948: 49.00 | I1948: 37469 | J1948: 6
A1949: =ROW()-2 -> 1947 | B1949: TP | C1949: 3659 | D1949: 1 | E1949: 03659-4 | F1949: C 语言与习题解答 | G1949: 李春葆 | H1949: 26.00 | I1949: 36373 | J1949: 9
A1950: =ROW()-2 -> 1948 | B1950: TP | C1950: 3613 | D1950: 2 | E1950: 03613-6 | F1950: C++ Builder 4.0 从入门到精通 | G1950: 李智慧等 | H1950: 37.00 | I1950: 36465 | J1950: 8
A1951: =ROW()-2 -> 1949 | B1951: P- | C1951: 3526 | D1951: 1 | F1951: Borland C++ Builder 5 实例精解 （配光盘） | G1951: 余明兴等 | H1951: 60.00 | I1951: 37073 | J1951: 5
A1952: =ROW()-2 -> 1950 | B1952: P- | C1952: 3510 | D1952: 1 | E1952: 7900635106 | F1952: Borland C++ Builder 程序设计（配光盘） | G1952: 刘华 等 | H1952: 55.00 | I1952: 37469 | J1952: 5
A1953: =ROW()-2 -> 1951 | B1953: TP | C1953: 2199 | D1953: 1 | E1953: 02199-6 | F1953: Delphi――从入门到精通 | G1953: 张育荣等 | H1953: 26.00 | I1953: 1996 | J1953: 12
A1954: =ROW()-2 -> 1952 | B1954: TP | C1954: 2559 | D1954: 6 | E1954: 02559-2 | F1954: Qbasic程序设计教程 | G1954: 邓德祥等 | H1954: 23.00 | I1954: 36617 | J1954: 9
A1955: =ROW()-2 -> 1953 | B1955: TP | C1955: 2662 | D1955: 3 | E1955: 02662-9 | F1955: Qbasic常用算法程序集(配盘） | G1955: 徐士良 | H1955: 50.00 | I1955: 1998 | J1955: 5
A1956: =ROW()-2 -> 1954 | B1956: TP | C1956: 4837 | D1956: 1 | E1956: 04837-1 | F1956: 从 Qbasic 到 Visual Basic 实用教程 | G1956: 刘士杰 | H1956: 29.00 | I1956: 37196 | J1956: 8
A1957: =ROW()-2 -> 1955 | B1957: TP | C1957: 5042 | D1957: 1 | E1957: 05042-2 | F1957: Visual Basic 程序设计实用教程（第二版） | G1957: 王 栋 | H1957: 36.00 | I1957: 37408 | J1957: 6
A1958: =ROW()-2 -> 1956 | B1958: P- | C1958: 3145 | D1958: 1 | F1958: Visual Basic & Access 数据库管理系统构建实例 （配光盘） | G1958: 谢炎桦 | H1958: 32.00 | I1958: 37073 | J1958: 11
A1959: =ROW()-2 -> 1957 | B1959: TP | C1959: 4665 | D1959: 1 | E1959: 04665-4 | F1959: Visual Basic Win32 API 程序设计 | G1959: 刘炳文等 | H1959: 58.00 | I1959: 37288 | J1959: 5
A1960: =ROW()-2 -> 1958 | B1960: P- | C1960: 3768 | D1960: 1 | F1960: Visual Basic 与分布式监控系统――RS-232/485串行 通信（配光盘） | G1960: 范逸之 | H1960: 59.00 | I1960: 37408 | J1960: 4
A1961: =ROW()-2 -> 1959 | B1961: P- | C1961: 4188 | D1961: 1 | E1961: 04188-1 | F1961: Delphi 与RS-232串行通信控制（配光盘） | G1961: 范逸之 | H1961: 49.00 | I1961: 37408 | J1961: 7
A1962: =ROW()-2 -> 1960 | B1962: P- | C1962: 4305 | D1962: 1 | E1962: 04305-1 | F1962: C++ Builder与RS-232串行通信控制（配光盘） | G1962: 范逸之 | H1962: 49.00 | I1962: 37438 | J1962: 6
A1963: =ROW()-2 -> 1961 | B1963: P- | C1963: 3732 | D1963: 1 | F1963: Visual Basic 游戏编程21天自学通 | G1963: 王国春等译 | H1963: 58.00 | I1963: 37135 | J1963: 5
A1964: =ROW()-2 -> 1962 | B1964: TP | C1964: 1180 | D1964: 1 | E1964: 01180-X | F1964: Visual Basic 程序设计教程 | G1964: 周霭如等 | H1964: 30.00 | I1964: 37333 | J1964: 8
A1965: =ROW()-2 -> 1963 | B1965: TP | C1965: 3985 | D1965: 1 | E1965: 03985-2 | F1965: Visual Basic 程序设计 | G1965: 谭浩强等 | H1965: 23.00 | I1965: 37469 | J1965: 10
A1966: =ROW()-2 -> 1964 | B1966: TP | C1966: 4359 | D1966: 1 | E1966: 04359-0 | F1966: Visual C++ 程序设计基础 | G1966: 戴 锋 | H1966: 29.00 | I1966: 37330 | J1966: 8
A1967: =ROW()-2 -> 1965 | B1967: TP | C1967: 5384 | D1967: 1 | E1967: 05384-1 | F1967: Visual C#.NET程序设计基础 | G1967: 孙永强等 | H1967: 30.00 | I1967: 37386 | J1967: 7
A1968: =ROW()-2 -> 1966 | B1968: TP | C1968: 4393 | D1968: 1 | E1968: 04393-0 | F1968: Visual Basic 程序设计基础 | G1968: 韦源 等 | H1968: 29.90 | I1968: 37377 | J1968: 8
A1969: =ROW()-2 -> 1967 | B1969: P- | C1969: 3743 | D1969: 1 | F1969: Visual Basic 经典范例（配光盘） | G1969: 杨仓杰 | H1969: 35.00 | I1969: 37165 | J1969: 8
A1970: =ROW()-2 -> 1968 | B1970: P- | C1970: 3717 | D1970: 1 | F1970: Visual Basic 与 Windows API 程序设计高手（配光盘） | G1970: 黄嘉辉等 | H1970: 48.00 | I1970: 37165 | J1970: 7
A1971: =ROW()-2 -> 1969 | B1971: TP | C1971: 4793 | D1971: 1 | E1971: 04793-6 | F1971: Visual InterDev 6.0 程序设计 | G1971: 白飞明等 | H1971: 37.00 | I1971: 37165 | J1971: 7
A1972: =ROW()-2 -> 1970 | B1972: P | C1972: 4138 | D1972: 1 | F1972: Borland Delphi 网络应用开发技术与实例 | G1972: 黄超等 | H1972: 59.00 | I1972: 37316 | J1972: 5
A1973: =ROW()-2 -> 1971 | B1973: P- | C1973: 3764 | D1973: 1 | F1973: Delphi 6 应用开发指南（配光盘） | G1973: 郭旭 等译 | H1973: 62.00 | I1973: 37196 | J1973: 5
A1974: =ROW()-2 -> 1972 | B1974: TP | C1974: 4363 | D1974: 1 | E1974: 04363-9 | F1974: Delphi 程序设计基础 | G1974: 刘海涛 | H1974: 32.50 | I1974: 37349 | J1974: 7
A1975: =ROW()-2 -> 1973 | B1975: TP | C1975: 4573 | D1975: 1 | E1975: 04573-9 | F1975: Delphi 5.0 因特网与数据库程序设计 | G1975: 刘海涛 | H1975: 36.00 | I1975: 37104 | J1975: 8
A1976: =ROW()-2 -> 1974 | B1976: P- | C1976: 3744 | D1976: 1 | F1976: Delphi 数据库程序设计（配光盘） | G1976: 杨宗志 | H1976: 35.00 | I1976: 37344 | J1976: 9
A1977: =ROW()-2 -> 1975 | B1977: TP | C1977: 5117 | D1977: 1 | E1977: 05117-8 | F1977: Delphi 6 程序设计教程 | G1977: 韩伟峰 | H1977: 32.00 | I1977: 37374 | J1977: 8
A1978: =ROW()-2 -> 1976 | B1978: TP | C1978: 4845 | D1978: 1 | E1978: 04845-2 | F1978: Framework 程序设计 | G1978: 孙永强 | H1978: 39.00 | I1978: 37165 | J1978: 6
A1979: =ROW()-2 -> 1977 | B1979: TP | C1979: 4036 | D1979: 1 | E1979: 04036-2 | F1979: Visual Basic 程序设计实用教程（含实验指导与习题解答） | G1979: 王 栋 | H1979: 32.00 | I1979: 36800 | J1979: 8
A1980: =ROW()-2 -> 1978 | B1980: TP | C1980: 0820 | D1980: 1 | E1980: 00820-5 | F1980: Visual Basic 中文版面向对象与可视化程序设计 | G1980: 廖彬山 | H1980: 38.00 | I1980: 37408 | J1980: 7
A1981: =ROW()-2 -> 1979 | B1981: P- | C1981: 2220 | D1981: 2 | F1981: Visual Basic 6.0 数据库编程(配光盘) | G1981: 陈海标译 | H1981: 85.00 | I1981: 37343 | J1981: 4
A1982: =ROW()-2 -> 1980 | B1982: TP | C1982: 3369 | D1982: 3 | E1982: 03369-2 | F1982: Visual Basic 6.0中文版入门与技巧 | G1982: 木林森 工作室 | H1982: 25.00 | I1982: 36557 | J1982: 12
A1983: =ROW()-2 -> 1981 | B1983: TP | C1983: 2166 | D1983: 2 | E1983: 02166-X | F1983: VBScript 可视化程序设计 | G1983: 刘炳文 | H1983: 42.00 | I1983: 36739 | J1983: 7
A1984: =ROW()-2 -> 1982 | B1984: P- | C1984: 3554 | D1984: 1 | F1984: JScript 应用系统开发宝典（配光盘） | G1984: 帝 龙 | H1984: 45.00 | I1984: 37104 | J1984: 7
A1985: =ROW()-2 -> 1983 | B1985: TP | C1985: 4878 | D1985: 1 | E1985: 04878-9 | F1985: VB.NET 程序设计教程 | G1985: 康博 译 | H1985: 40.00 | I1985: 37373 | J1985: 7
A1986: =ROW()-2 -> 1984 | B1986: TP | C1986: 3999 | D1986: 1 | E1986: 03999-2 | F1986: 实用 Visual InterDev 6 教程 | G1986: 冯毅等译 | H1986: 62.00 | I1986: 36739 | J1986: 5
A1987: =ROW()-2 -> 1985 | B1987: TP | C1987: 1947 | D1987: 2 | E1987: 01947-9 | F1987: FORTRAN 常用算法程序集( 第2版 )(含盘) | G1987: 徐士良 | H1987: 52.00 | I1987: 1999 | J1987: 5
A1988: =ROW()-2 -> 1986 | B1988: TP | C1988: 1135 | D1988: 1 | E1988: 01135-4 | F1988: Fortran PowerStation 4.0 基础教程 | G1988: 徐 明 | H1988: 30.00 | I1988: 36678 | J1988: 8
A1989: =ROW()-2 -> 1987 | B1989: TP | C1989: 0992 | D1989: 1 | E1989: 09921-9 | F1989: Turbo Pascal 程序设计基础 | G1989: 刘海涛 | H1989: 26.00 | I1989: 36647 | J1989: 10
A1990: =ROW()-2 -> 1988 | B1990: TP | C1990: 3510 | D1990: 1 | E1990: 03510-5 | F1990: HP VEE 可视化编程 (第3版) | G1990: 惠普中心 | H1990: 34.00 | I1990: 36312 | J1990: 9
A1991: =ROW()-2 -> 1989 | B1991: TP | C1991: 2632 | D1991: 3 | E1991: 02632-7 | F1991: 编译程序原理与技术 | G1991: 李赣生等 | H1991: 28.00 | I1991: 1998 | J1991: 8
A1992: =ROW()-2 -> 1990 | B1992: TP | C1992: 0737 | D1992: 5 | E1992: 00737-3 | F1992: PL/M 96 程序设计语言及其应用 | G1992: 袁 涛 | H1992: 11.00 | I1992: 1997 | J1992: 15
A1993: =ROW()-2 -> 1991 | B1993: TP | C1993: 2901 | D1993: 3 | E1993: 02901-6 | F1993: 80X86汇编语言程序设计教程 | G1993: 杨季文等 | H1993: 39.00 | I1993: 37408 | J1993: 5
A1994: =ROW()-2 -> 1992 | B1994: TP | C1994: 3150 | D1994: 2 | E1994: 03150-9 | F1994: 程序设计方法与PASCAL语言(修订) | G1994: 彭 澎 | H1994: 24.00 | I1994: 1999 | J1994: 11
A1995: =ROW()-2 -> 1993 | B1995: P- | C1995: 2502 | D1995: 1 | F1995: VHDL 语言 100 例详解（配光盘） | G1995: 理工大学 | H1995: 52.00 | I1995: 36982 | J1995: 5
A1996: =ROW()-2 -> 1994 | B1996: TP | C1996: 3440 | D1996: 1 | E1996: 03440-0 | F1996: Visual Basic 6.0中文版学习捷径(配光盘) | G1996: 李天启等 | H1996: 43 | I1996: 36892 | J1996: 8
A1997: =ROW()-2 -> 1995 | B1997: TP | C1997: 4266 | D1997: 1 | F1997: 实用Visual Basic 6 教程 | H1997: 59 | I1997: 36951 | J1997: 5
A1998: =ROW()-2 -> 1996 | B1998: TP | C1998: 2932 | D1998: 1 | E1998: 02932-6 | F1998: Windows 95 Visual Basic编程指导 (第4版) | G1998: (美)Peter Norton | H1998: 69 | I1998: 1998 | J1998: 4
A1999: =ROW()-2 -> 1997 | B1999: TP | C1999: 3324 | D1999: 3 | E1999: 03324-2 | F1999: Win 9X 虚拟设备驱动程序编程指南 | G1999: 杨强 等 | H1999: 15 | I1999: 36586 | J1999: 17
A2000: =ROW()-2 -> 1998 | B2000: TP | C2000: 0900 | D2000: 1 | E2000: 00900-7 | F2000: Windows 设备驱动程序技术内幕 | G2000: 孙守阁等 | H2000: 22 | I2000: 36678 | J2000: 12
A2001: =ROW()-2 -> 1999 | B2001: TP | C2001: 0857 | D2001: 1 | E2001: 00857-4 | F2001: Pro/ENGINEER 2000i 轻松学习与实例精解 | G2001: 戴向国 | H2001: 36 | I2001: 37012 | J2001: 8
A2002: =ROW()-2 -> 2000 | B2002: P- | C2002: 3702 | D2002: 1 | F2002: Pro/ENGINEER 2000Ａ慵设计高级篇（上）（配光盘） | G2002: 林清安 | H2002: 58 | I2002: 37329 | J2002: 6
A2003: =ROW()-2 -> 2001 | B2003: P- | C2003: 3747 | D2003: 1 | F2003: Pro/ENGINEER 2000Ａ慵设计高级篇（下）（配光盘） | G2003: 林清安 | H2003: 65 | I2003: 37329 | J2003: 5
A2004: =ROW()-2 -> 2002 | B2004: P- | C2004: 3550 | D2004: 1 | E2004: 7-900635-50-5 | F2004: Pro/ENGINEER 2000Ａ慵设计基础篇（上）（配光盘） | G2004: 林清安 | H2004: 57 | I2004: 37469 | J2004: 6
A2005: =ROW()-2 -> 2003 | B2005: TP | C2005: 0899 | D2005: 1 | E2005: 00899-X | F2005: 版主答疑―― Delphi 高级编程技巧 | G2005: 岳庆生 | H2005: 49.00 | I2005: 37012 | J2005: 6
A2006: =ROW()-2 -> 2004 | B2006: TP | C2006: 4510 | D2006: 1 | E2006: 04510-0 | F2006: 精通Palm OS 程序设计――Code Warrior入门 教程 | G2006: 位元文化 | H2006: 32.00 | I2006: 37073 | J2006: 8
A2007: =ROW()-2 -> 2005 | B2007: P- | C2007: 3558 | D2007: 1 | F2007: Plalm OS 程序设计入门（配光盘） | G2007: 宝库网络 | H2007: 26.00 | I2007: 37073 | J2007: 12
A2008: =ROW()-2 -> 2006 | B2008: TP | C2008: 0939 | D2008: 1 | E2008: 00939-2 | F2008: Director 8 和 Lingo 程序设计 | G2008: 刘小峰 | H2008: 29.00 | I2008: 36708 | J2008: 8
A2009: =ROW()-2 -> 2007 | B2009: TP | C2009: 3545 | D2009: 3 | E2009: 03545-8 | F2009: 精通 MATLAB 5 | G2009: 张宜华 | H2009: 34.50 | I2009: 36831 | J2009: 8
A2010: =ROW()-2 -> 2008 | B2010: TP | C2010: 1138 | D2010: 1 | E2010: 01138-9 | F2010: MATLAB 5.X 与科学计算 | G2010: 王沫然 | H2010: 26.50 | I2010: 37012 | J2010: 10
A2011: =ROW()-2 -> 2009 | B2011: TP | C2011: 5413 | D2011: 1 | E2011: 05413-4 | F2011: MATLAB6.x信号处理 | G2011: 邹鲲等 | H2011: 29.00 | I2011: 37377 | J2011: 10
A2012: =ROW()-2 -> 2010 | B2012: TP | C2012: 1226 | D2012: 1 | E2012: 01126-1 | F2012: 科学运算语言 MATLAB 5.3 程序设计与应用 | G2012: 薛定宇 | H2012: 32.00 | I2012: 36831 | J2012: 9
A2013: =ROW()-2 -> 2011 | B2013: TP | C2013: 5461 | D2013: 1 | E2013: 05461-4 | F2013: 精通MATLAB 6 | G2013: 尹泽明等 | H2013: 38.00 | I2013: 37408 | J2013: 7
A2014: =ROW()-2 -> 2012 | B2014: TP | C2014: 4101 | D2014: 1 | E2014: 04101-6 | F2014: 实用 KDE 教程 | G2014: 张辉 译 | H2014: 49.00 | I2014: 36831 | J2014: 7
A2015: =ROW()-2 -> 2013 | B2015: TP | C2015: 3445 | D2015: 2 | E2015: 03445-1 | F2015: PowerBuilder 6.5 参考手册 | G2015: 合力工作室 | H2015: 52 | I2015: 36465 | J2015: 4
A2016: =ROW()-2 -> 2014 | B2016: TP | C2016: 3443 | D2016: 2 | E2016: 03443-5 | F2016: Power Builder 6.0 入门 | G2016: 刘兴出等 | H2016: 27.5 | I2016: 36281 | J2016: 8
A2017: =ROW()-2 -> 2015 | B2017: TP | C2017: 0901 | D2017: 1 | E2017: 00901-5 | F2017: Power Builder 7.0 初学者指南 | G2017: 抖斗书屋 | H2017: 28.5 | I2017: 36739 | J2017: 9
A2018: =ROW()-2 -> 2016 | B2018: TP | C2018: 0769 | D2018: 1 | E2018: 00769-1 | F2018: Power Builder 7.0 数据库应用系统开发教程 | G2018: 崔 巍 | H2018: 30 | I2018: 37320 | J2018: 9
A2019: =ROW()-2 -> 2017 | B2019: TP | C2019: 0783 | D2019: 1 | E2019: 00783-7 | F2019: Power Builder 7.0 开发者指南 | G2019: 抖斗书屋 | H2019: 36 | I2019: 36770 | J2019: 7
A2020: =ROW()-2 -> 2018 | B2020: TP | C2020: 4544 | D2020: 1 | E2020: 04544-5 | F2020: Power Builder 8 Web 数据库开发指南 | G2020: 徐松林等 | H2020: 34.00 | I2020: 37073 | J2020: 8
A2021: =ROW()-2 -> 2019 | B2021: TP | C2021: 3212 | D2021: 1 | E2021: 03212-2 | F2021: ACM 国际大学生程序设计竞赛试题与分析(1) | G2021: 吴文虎 | H2021: 12 | I2021: 1999 | J2021: 18
A2022: =ROW()-2 -> 2020 | B2022: P | C2022: 4141 | D2022: 1 | F2022: C/C++与数据结构 | G2022: 王立柱 | H2022: 35 | I2022: 37362 | J2022: 9
A2023: =ROW()-2 -> 2021 | B2023: TP | C2023: 5206 | D2023: 1 | E2023: 05206-9 | F2023: XHTML实例精解 | G2023: 袁勤勇等译 | H2023: 59 | I2023: 37347 | J2023: 5
A2024: =ROW()-2 -> 2022 | B2024: TP | C2024: 5267 | D2024: 1 | E2024: 05267-0 | F2024: Flash PHP实用开发技术 | G2024: 王黎译 | H2024: 39 | I2024: 37347 | J2024: 9
A2025: =ROW()-2 -> 2023 | B2025: TP | C2025: 5110 | D2025: 1 | E2025: 05110-0 | F2025: C++高级程序设计 | G2025: 宛延] | H2025: 32 | I2025: 37347 | J2025: 8
A2026: =ROW()-2 -> 2024 | B2026: TP | C2026: 5341 | D2026: 1 | E2026: 05341-3 | F2026: 基于MATLAB/Simulink的系统防真技术与应用 | G2026: 薛定宇等 | H2026: 38 | I2026: 37347 | J2026: 7
A2027: =ROW()-2 -> 2025 | B2027: TP | C2027: 5231 | D2027: 1 | E2027: 05231-X | F2027: Qt程序设计 | G2027: Xteam | H2027: 30 | I2027: 37347 | J2027: 9
A2028: =ROW()-2 -> 2026 | B2028: TP | C2028: 5362 | D2028: 1 | E2028: 05362-6 | F2028: UML精粹（第2版）标准对象建模语言简明指南 | G2028: 徐家福译 | H2028: 24 | I2028: 37408 | J2028: 10
A2029: =ROW()-2 -> 2027 | B2029: TP | C2029: 5465 | D2029: 1 | E2029: 05465-7 | F2029: 使用Visual Basic和UML开发应用程序 | G2029: 李博等译 | H2029: 39 | I2029: 37408 | J2029: 8
A2030: =ROW()-2 -> 2028 | B2030: TP | C2030: 5545 | D2030: 1 | E2030: 55451 | F2030: 精通 MATLAB 6 | G2030: 张航等译 | H2030: 69.00 | I2030: 37438 | J2030: 5
A2031: =ROW()-2 -> 2029 | B2031: P- | C2031: 4180 | D2031: 1 | E2031: 04180-1 | F2031: MATLAB 扩展编程（配光盘） | G2031: 何强等 | H2031: 42 | I2031: 37438 | J2031: 7
A2032: =ROW()-2 -> 2030 | B2032: TP | C2032: 5054 | D2032: 1 | E2032: 05054-1 | F2032: 全C编程（配软盘） | G2032: 高永强等 | H2032: 59 | I2032: 37438 | J2032: 4
A2033: =ROW()-2 -> 2031 | B2033: TP | C2033: 5551 | D2033: 1 | E2033: 05551-1 | F2033: DB2技术参考大全 | G2033: 袁勤勇等译 | H2033: 85 | I2033: 37438 | J2033: 4
A2034: =ROW()-2 -> 2032 | B2034: TP | C2034: 5507 | D2034: 1 | E2034: 05507-6 | F2034: CASL程序设计教程 | G2034: 刘克武等 | H2034: 23 | I2034: 37469 | J2034: 14
A2035: =ROW()-2 -> 2033 | B2035: TP | C2035: 5579 | D2035: 1 | E2035: 05579-3 | F2035: .NET框架程序开发指南（上册） | G2035: 张志学 | H2035: 35 | I2035: 37469 | J2035: 7
A2036: =ROW()-2 -> 2034 | B2036: TP | C2036: 5652 | D2036: 1 | E2036: 05652-8 | F2036: .NET框架程序开发指南（下册） | G2036: 张志学 | H2036: 38 | I2036: 37469 | J2036: 8
A2037: =ROW()-2 -> 2035 | B2037: TP | C2037: 5681 | D2037: 1 | E2037: 05681-1 | F2037: Jbuilder程序设计实例 | G2037: 杨宗志 | H2037: 29 | I2037: 37469 | J2037: 9
A2038: =ROW()-2 -> 2036 | B2038: TP | C2038: 5420 | D2038: 1 | E2038: 05420-7 | F2038: Visual Basic Active X程序设计 | G2038: 刘炳文 | H2038: 17 | I2038: 37469 | J2038: ?
A2039: =ROW()-2 -> 2037 | B2039: TP | C2039: 5759 | D2039: 1 | E2039: 05759-1 | F2039: 面向对象Java编程思想(修订版) | G2039: Timothy Budd | H2039: 45 | I2039: 37469 | J2039: 8
A2040: =ROW()-2 -> 2038 | B2040: TP | C2040: 5713 | D2040: 1 | E2040: 05713-3 | F2040: UNIX C 程序设计入门与应用 | G2040: 洪锦魁 | H2040: 28 | I2040: 37469 | J2040: 10
A2041: =ROW()-2 -> 2039 | B2041: TP | C2041: 5724 | D2041: 1 | E2041: 05724-9 | F2041: Visual C#.Net 应用精彩50例 | G2041: 张龙卿等 | H2041: 26 | I2041: 37469 | J2041: 10
A2042: =ROW()-2 -> 2040 | B2042: TP | C2042: 5595 | D2042: 1 | E2042: 05595-5 | F2042: 用 J2EE和UML开发Java 企业级应用程序 | G2042: Uhawar Zaman Ahme | H2042: 28 | I2042: 37500 | J2042: 11
A2043: =ROW()-2 -> 2041 | B2043: TP | C2043: 5620 | D2043: 1 | E2043: 05620-X | F2043: Perl 实例精解（第三版） | G2043: Eillie Quigley | H2043: 82.00 | I2043: 37500 | J2043: 4
A2044: =ROW()-2 -> 2042 | B2044: TP | C2044: 5625 | D2044: 1 | E2044: 05625-0 | F2044: Java 2 精要：语言详解与编程指南 | G2044: [美]布雷恩等 | H2044: 60.00 | I2044: 37500 | J2044: 5
A2045: =ROW()-2 -> 2043 | B2045: P- | C2045: 4349 | D2045: 1 | E2045: 7900643494 | F2045: 用Python 学编程(含光盘) | G2045: [美]Alan Gauld | H2045: 32.00 | I2045: 37500 | J2045: 12
F2046: 操 作 系 统
A2047: =ROW()-2 -> 2045 | B2047: TP | C2047: 3943 | D2047: 1 | E2047: 03943-7 | F2047: 操作系统基础(第3版) | G2047: 屠祁 等 | H2047: 25.50 | I2047: 37408 | J2047: 8
A2048: =ROW()-2 -> 2046 | B2048: TP | C2048: 5447 | D2048: 1 | E2048: 05447-1 | F2048: 多代理系统理论、方法与应用 | G2048: 范玉顺、曹军威 | H2048: 25.00 | I2048: 37438 | J2048: 13
A2049: =ROW()-2 -> 2047 | B2049: TP | C2049: 5393 | D2049: 1 | E2049: 05393-1 | F2049: Ｗindows 环境下的多线程编程原理与应用 | G2049: 王险峰等 | H2049: 35.00 | I2049: 37438 | J2049: 8
A2050: =ROW()-2 -> 2048 | B2050: TP | C2050: 5158 | D2050: 1 | E2050: 05158-5 | F2050: Ｗindows XP 中文版学习捷径 | G2050: 陈硕辉等 | H2050: 36.00 | I2050: 37257 | J2050: 7
A2051: =ROW()-2 -> 2049 | B2051: TP | C2051: 4240 | D2051: 1 | E2051: 04240-3 | F2051: Windows NT 系统安全指南 | G2051: 熊桂喜等译 | H2051: 30.00 | I2051: 36892 | J2051: 9
A2052: =ROW()-2 -> 2050 | B2052: P- | C2052: 4913 | D2052: 1 | E2052: 04913-0 | F2052: Windows 2000 Server 技术内幕 | G2052: 杨洪涛等译 | H2052: 98.00 | I2052: 37135 | J2052: 3
A2053: =ROW()-2 -> 2051 | B2053: TP | C2053: 5660 | D2053: 1 | E2053: 05660-1 | F2053: Windows XP 中文版快捷教程 | G2053: 东方人华 | H2053: 28.00 | I2053: 37438 | J2053: 8
A2054: =ROW()-2 -> 2052 | B2054: TP | C2054: 4945 | D2054: 1 | E2054: 04945-9 | F2054: Windows XP 中文版家庭多媒体与网络技术 | G2054: 田海波等 | H2054: 28.00 | I2054: 37196 | J2054: 9
A2055: =ROW()-2 -> 2053 | B2055: TP | C2055: 4769 | D2055: 1 | E2055: 04769-3 | F2055: 深入理解 Microsoft Windows 2000 分布式服务 | G2055: 潘爱民译 | H2055: 31.00 | I2055: 37196 | J2055: 8
A2056: =ROW()-2 -> 2054 | B2056: TP | C2056: 5539 | D2056: 1 | E2056: 05539-1 | F2056: Windows XP 注册表应用实践与精通 | G2056: 林山主编 | H2056: 35.00 | I2056: 37438 | J2056: 6
A2057: =ROW()-2 -> 2055 | B2057: TP | C2057: 4908 | D2057: 1 | E2057: 04908-4 | F2057: 巧学巧用 BIOS 与 Windows 注册表 | G2057: 孙 含 | H2057: 32.00 | I2057: 37375 | J2057: 8
A2058: =ROW()-2 -> 2056 | B2058: TP | C2058: 5496 | D2058: 1 | E2058: 05496-7 | F2058: Windows XP 注册表配置、维护与应用900例 | G2058: 东方硅谷 | H2058: 46.00 | I2058: 37408 | J2058: 5
A2059: =ROW()-2 -> 2057 | B2059: TP | C2059: 4931 | D2059: 1 | E2059: 04931-9 | F2059: WSH 实用技术与应用 | G2059: 马文刚等 | H2059: 19.00 | I2059: 37226 | J2059: 10
A2060: =ROW()-2 -> 2058 | B2060: TP | C2060: 4464 | D2060: 1 | E2060: 04464-3 | F2060: Exchange 2000 Server 系统实务经典 | G2060: 东名 等 | H2060: 43.00 | I2060: 37043 | J2060: 6
A2061: =ROW()-2 -> 2059 | B2061: TP | C2061: 3128 | D2061: 2 | E2061: 03128-2 | F2061: 操作系统原理DOS篇 (第2版) | G2061: 张昆苍等 | H2061: 26.00 | I2061: 36770 | J2061: 7
A2062: =ROW()-2 -> 2060 | B2062: TP | C2062: 3852 | D2062: 1 | E2062: 03852-X | F2062: PC 操作系统及常用软件实用教程 | G2062: 王启丁等 | H2062: 34.00 | I2062: 36526 | J2062: 8
A2063: =ROW()-2 -> 2061 | B2063: P- | C2063: 3700 | D2063: 1 | F2063: PC/Mac 跨平台网络连接实务 | G2063: 杜仕德研究室 | H2063: 32.00 | I2063: 37135 | J2063: 8
A2064: =ROW()-2 -> 2062 | B2064: TP | C2064: 1099 | D2064: 1 | E2064: 01099-4 | F2064: DOS & Windows 95/98 无盘工作站配置、管理与实例 | G2064: 曹国钧等 | H2064: 49.00 | I2064: 36831 | J2064: 5
A2065: =ROW()-2 -> 2063 | B2065: TP | C2065: 4910 | D2065: 1 | E2065: 04910-6 | F2065: 中文版 Windows XP 系统管理指南 | G2065: 李万红等 | H2065: 48.00 | I2065: 37349 | J2065: 5
A2066: =ROW()-2 -> 2064 | B2066: TP | C2066: 5012 | D2066: 1 | E2066: 05012-0 | F2066: 中文版 Windows XP 入门与进阶 | G2066: 王梦兰等 | H2066: 35.00 | I2066: 2002.3 | J2066: 7
A2067: =ROW()-2 -> 2065 | B2067: TP | C2067: 5699 | D2067: 1 | E2067: 056994 | F2067: Visual C++.NET 入门与进阶 | G2067: 冉林仓等 | H2067: 38.00 | I2067: 37469 | J2067: 7
A2068: =ROW()-2 -> 2066 | B2068: TP | C2068: 5104 | D2068: 1 | E2068: 05104-6 | F2068: 中文Windows XP 简明教程 | G2068: 罗运模等 | H2068: 37.00 | I2068: 2002.4 | J2068: 7
A2069: =ROW()-2 -> 2067 | B2069: TP | C2069: 1075 | D2069: 1 | E2069: 01075-7 | F2069: Windows 95/98 中文版实用100问 | G2069: 潇湘工作室 | H2069: 22.00 | I2069: 36951 | J2069: 12
A2070: =ROW()-2 -> 2068 | B2070: TP | C2070: 1758 | D2070: 3 | F2070: Microsoft Windows 98 标准学习(配光盘) | G2070: 博彦公司 | H2070: 42.00 | I2070: 36982 | J2070: 8
A2071: =ROW()-2 -> 2069 | B2071: P- | C2071: 2550 | D2071: 2 | F2071: Windows 2000 Professional 中文版标准学习(配光盘) | G2071: 博彦公司 | H2071: 42.00 | I2071: 36770 | J2071: 9
A2072: =ROW()-2 -> 2070 | B2072: TP | C2072: 4415 | D2072: 1 | E2072: 04415-5 | F2072: Windows 2000 Server 配置、管理与应用 | G2072: 甘登岱等 | H2072: 32.00 | I2072: 37408 | J2072: 8
A2073: =ROW()-2 -> 2071 | B2073: P- | C2073: 3579 | D2073: 1 | F2073: Windows 2000 Professional 安装与配置 （配光盘） | G2073: 李博 译 | H2073: 48.00 | I2073: 37073 | J2073: 6
A2074: =ROW()-2 -> 2072 | B2074: TP | C2074: 4524 | D2074: 1 | E2074: 04524-0 | F2074: 无盘 Win 9x 和 Windows 2000 Server 技术精解及实例分析 | G2074: 闵 军 | H2074: 49.00 | I2074: 37257 | J2074: 6
A2075: =ROW()-2 -> 2073 | B2075: P- | C2075: 2578 | D2075: 1 | F2075: 升级到 Windows 2000 （配光盘） | G2075: 陆争鸣译 | H2075: 56.00 | I2075: 36951 | J2075: 9
A2076: =ROW()-2 -> 2074 | B2076: TP | C2076: 4189 | D2076: 1 | E2076: 04189-X | F2076: 中文 Windows Me 培训教程 | G2076: 欧阳春 | H2076: 28.00 | I2076: 36861 | J2076: 8
A2077: =ROW()-2 -> 2075 | B2077: TP | C2077: 4303 | D2077: 1 | E2077: 04303-5 | F2077: 中文 Windows ME 组网与多媒体技术 | G2077: 康博创作室 | H2077: 25.80 | I2077: 36982 | J2077: 10
A2078: =ROW()-2 -> 2076 | B2078: TP | C2078: 4763 | D2078: 1 | E2078: 04763-4 | F2078: Windows 2000 虚拟专用网络 | G2078: 陆建业译 | H2078: 32.00 | I2078: 37104 | J2078: 10
A2079: =ROW()-2 -> 2077 | B2079: TP | C2079: 3019 | D2079: 4 | E2079: 03019-7 | F2079: 中文Windows 98 使用手册 | G2079: 木林森等 | H2079: 34.00 | I2079: 1998 | J2079: 10
A2080: =ROW()-2 -> 2078 | B2080: TP | C2080: 3286 | D2080: 1 | E2080: 03286-6 | F2080: Windows 98 中文版学习捷径 | G2080: 贺军 等 | H2080: 38.00 | I2080: 36892 | J2080: 7
A2081: =ROW()-2 -> 2079 | B2081: TP | C2081: 3349 | D2081: 1 | E2081: 03349-8 | F2081: 中文Windows 98 培训教程 | G2081: 王诚君 | H2081: 28.00 | I2081: 1999 | J2081: 8
A2082: =ROW()-2 -> 2080 | B2082: TP | C2082: 3201 | D2082: 2 | E2082: 03201-7 | F2082: 中文Windows 98 使用技巧与实例 | G2082: 罗运模等 | H2082: 28.00 | I2082: 1999 | J2082: 9
A2083: =ROW()-2 -> 2081 | B2083: TP | C2083: 3126 | D2083: 2 | E2083: 03126-6 | F2083: Windows 98 新功能 | G2083: 陈强等 | H2083: 22.50 | I2083: 1998 | J2083: 9
A2084: =ROW()-2 -> 2082 | B2084: TP | C2084: 3282 | D2084: 1 | E2084: 03282-3 | F2084: Windows 98 高级实用指南 | G2084: 段爱民 等译 | H2084: 59.00 | I2084: 1998 | J2084: 5
A2085: =ROW()-2 -> 2083 | B2085: TP | C2085: 3209 | D2085: 2 | E2085: 03209-2 | F2085: Windows 98 中文版使用、技巧与编程 | G2085: 曹国钧等 | H2085: 48.00 | I2085: 1999 | J2085: 7
A2086: =ROW()-2 -> 2084 | B2086: TP | C2086: 1030 | D2086: 1 | E2086: 01030-7 | F2086: 计算机基础教程 (Windows 98 版) | G2086: 黄云森等 | H2086: 38.00 | I2086: 37469 | J2086: 7
A2087: =ROW()-2 -> 2085 | B2087: TP | C2087: 5085 | D2087: 1 | E2087: 05085-6 | F2087: Windows 2000 安全技术 | G2087: 倪晓强等译 | H2087: 43.00 | I2087: 37226 | J2087: 7
A2088: =ROW()-2 -> 2086 | B2088: TP | C2088: 4476 | D2088: 1 | E2088: 04476-7 | F2088: Windows 2000 注册表技术与应用实例 | G2088: 李进 等 | H2088: 58.00 | I2088: 37257 | J2088: 5
A2089: =ROW()-2 -> 2087 | B2089: TP | C2089: 4844 | D2089: 1 | E2089: 04844-4 | F2089: Windows 2000 注册表彻底剖析 | G2089: 章轩工作室 | H2089: 32.00 | I2089: 37323 | J2089: 8
A2090: =ROW()-2 -> 2088 | B2090: TP | C2090: 5027 | D2090: 1 | E2090: 05027-9 | F2090: 中文版 Windows XP 注册表应用与开发实例 | G2090: 胡辰浩等 | H2090: 32.00 | I2090: 37327 | J2090: 8
A2091: =ROW()-2 -> 2089 | B2091: TP | C2091: 3307 | D2091: 6 | E2091: 03307-2 | F2091: Windows 95/98中文版注册表\配置与应用实例 | G2091: 曹国均等 | H2091: 49.00 | I2091: 36982 | J2091: 5
A2092: =ROW()-2 -> 2090 | B2092: TP | C2092: 1216 | D2092: 2 | E2092: 01216-4 | F2092: Windows 9X/NT 注册表技术内幕 | G2092: 李进 等 | H2092: 32.00 | I2092: 36951 | J2092: 8
A2093: =ROW()-2 -> 2091 | B2093: TP | C2093: 2686 | D2093: 1 | E2093: 02686-6 | F2093: Windows NT Server 4.0中文版专业指南 | G2093: 戴有炜等 | H2093: 35.00 | I2093: 1997 | J2093: 8
A2094: =ROW()-2 -> 2092 | B2094: TP | C2094: 2659 | D2094: 2 | E2094: 02659-9 | F2094: Windows NT Server 4.0中文版实用指南 | G2094: 戴有炜等 | H2094: 32.00 | I2094: 1998 | J2094: 9
A2095: =ROW()-2 -> 2093 | B2095: TP | C2095: 1153 | D2095: 1 | E2095: 01153-2 | F2095: 巧学巧用 Windows me 中文版 | G2095: 刘 彪 等 | H2095: 34.00 | I2095: 36923 | J2095: 7
A2096: =ROW()-2 -> 2094 | B2096: TP | C2096: 4185 | D2096: 1 | E2096: 04185-7 | F2096: 中文 Windows me 实用培训教程 | G2096: 蒋小华等 | H2096: 20.00 | I2096: 37135 | J2096: 13
A2097: =ROW()-2 -> 2095 | B2097: TP | C2097: 4637 | D2097: 1 | F2097: 实用 UNIX 教程 | G2097: 安捷 译 | H2097: 64.00 | I2097: 37073 | J2097: 4
A2098: =ROW()-2 -> 2096 | B2098: TP | C2098: 4500 | D2098: 1 | E2098: 04500-3 | F2098: 最新 UNIX 程序设计与编程技巧 | G2098: 阮戈 等 | H2098: 46.00 | I2098: 37073 | J2098: 6
A2099: =ROW()-2 -> 2097 | B2099: TP | C2099: 4795 | D2099: 1 | E2099: 04795-2 | F2099: UNIX 平台下 C 语言编程 | G2099: 喻志虎 | H2099: 38.00 | I2099: 37337 | J2099: 7
A2100: =ROW()-2 -> 2098 | B2100: TP | C2100: 2767 | D2100: 3 | E2100: 02767-6 | F2100: UNIX系统基础 | G2100: 陈慧蓉 | H2100: 18.50 | I2100: 37226 | J2100: 10
A2101: =ROW()-2 -> 2099 | B2101: P- | C2101: 2532 | D2101: 1 | F2101: UNIX系统管理员大全（配光盘） | G2101: 段剑波译 | H2101: 68.00 | I2101: 36678 | J2101: 6
A2102: =ROW()-2 -> 2100 | B2102: TP | C2102: 3815 | D2102: 1 | E2102: 03815-5 | F2102: UNIX 网络编程 第2卷：进程间通信(第2版) | G2102: 扬继张译 | H2102: 58.00 | I2102: 36586 | J2102: 6
A2103: =ROW()-2 -> 2101 | B2103: TP | C2103: 0427 | D2103: I | E2103: 00427-7 | F2103: 中国计算机培训网统编教材：XENIX系统使用 入门 | G2103: 白晓笛等 | H2103: 25.00 | I2103: 1998 | J2103: 8
A2104: =ROW()-2 -> 2102 | B2104: TP | C2104: 2496 | D2104: 3 | E2104: 02496-0 | F2104: 微机上的UNIX操作系统Linux使用指南 | G2104: 王小鸽等 | H2104: 19.50 | I2104: 1998 | J2104: 11
A2105: =ROW()-2 -> 2103 | B2105: TP | C2105: 5105 | D2105: 1 | E2105: 05105-4 | F2105: Debian GUN/Linux 高级应用大全（配光盘） | G2105: 陈河南等译 | H2105: 95.00 | I2105: 37257 | J2105: 3
A2106: =ROW()-2 -> 2104 | B2106: TP | C2106: 5709 | D2106: 1 | E2106: 05709-5 | F2106: Red Hat Linux 7.2系统管理 | G2106: 李蔚泽 | H2106: 34.00 | I2106: 37500 | J2106: 8
A2107: =ROW()-2 -> 2105 | B2107: TP | C2107: 4263 | D2107: 1 | F2107: 实用 Linux 教程 | H2107: 43.00 | I2107: 36951 | J2107: 7
A2108: =ROW()-2 -> 2106 | B2108: TP | C2108: 4553 | D2108: 1 | E2108: 04553-4 | F2108: Linux 服务器配置与优化 | G2108: 顾云苏 | H2108: 23.00 | I2108: 37135 | J2108: 9
A2109: =ROW()-2 -> 2107 | B2109: TP | C2109: 4688 | D2109: 1 | E2109: 04688-3 | F2109: Linux 实用组网技术 | G2109: 肖薇 等 | H2109: 42.00 | I2109: 37500 | J2109: 7
A2110: =ROW()-2 -> 2108 | B2110: P- | C2110: 3724 | D2110: 1 | F2110: Linux 技术内幕（配光盘） | G2110: 王超 译 | H2110: 39.00 | I2110: 37135 | J2110: 10
A2111: =ROW()-2 -> 2109 | B2111: P- | C2111: 3599 | D2111: 1 | F2111: 嵌入式 Linux 系统设计与应用（配光盘） | G2111: 王学龙 | H2111: 45.00 | I2111: 37104 | J2111: 7
A2112: =ROW()-2 -> 2110 | B2112: TP | C2112: 4979 | D2112: 2 | E2112: 04979-3 | F2112: 嵌入式 Linux 设计与应用（配光盘） | G2112: 邹思轶 | H2112: 38.00 | I2112: 37372 | J2112: 7
A2113: =ROW()-2 -> 2111 | B2113: TP | C2113: 1312 | D2113: 2 | E2113: 01312-8 | F2113: Linux 初学者指南 | G2113: 宋建平等 | H2113: 33.00 | I2113: 36617 | J2113: 8
A2114: =ROW()-2 -> 2112 | B2114: P- | C2114: 1774 | D2114: 2 | F2114: Linux 系统管理指南 （配光盘) | G2114: 晓冬等译 | H2114: 39.00 | I2114: 36312 | J2114: 11
A2115: =ROW()-2 -> 2113 | B2115: TP | C2115: 3720 | D2115: 1 | E2115: 03720-5 | F2115: Linux 管理员指南 （配光盘) | G2115: 何田 等 | H2115: 39.00 | I2115: 36617 | J2115: 8
A2116: =ROW()-2 -> 2114 | B2116: TP | C2116: 1089 | D2116: 1 | E2116: 01089-7 | F2116: Linux 高级网络管理 | G2116: 冯建华等 | H2116: 25.00 | I2116: 36861 | J2116: 10
A2117: 1973 | B2117: TP | C2117: 5552 | D2117: 1 | E2117: 05552-1 | F2117: Linux 管理与应用基础（配光盘) | G2117: 位元文化 | H2117: 38.00 | I2117: 37438 | J2117: 7
A2118: =ROW()-2 -> 2116 | B2118: P- | C2118: 3064 | D2118: 1 | F2118: Linux 实用大全 （配4张光盘） | G2118: 杨文志 | H2118: 95.00 | I2118: 36951 | J2118: 5
A2119: =ROW()-2 -> 2117 | B2119: P- | C2119: 3115 | D2119: 1 | F2119: Linux 快速入门 （配光盘） | G2119: 超星空工作室 | H2119: 33.00 | I2119: 36982 | J2119: 11
A2120: =ROW()-2 -> 2118 | B2120: TP | C2120: 4149 | D2120: 1 | E2120: 04149-0 | F2120: Red Hat Linux 系统管理指南 | G2120: 卢亮等译 | H2120: 30.00 | I2120: 36861 | J2120: 10
A2121: =ROW()-2 -> 2119 | B2121: P- | C2121: 2565 | D2121: 1 | F2121: FreeBSD 3.0 Internet 服务器的架设与管理 （配光盘） | G2121: 王子华 | H2121: 39.00 | I2121: 36800 | J2121: 10
A2122: =ROW()-2 -> 2120 | B2122: P- | C2122: 2566 | D2122: 1 | F2122: FreeBSD 3.x Internet 高级服务器的架设与管理 （配光盘） | G2122: 王子华 | H2122: 39.00 | I2122: 36800 | J2122: 10
F2123: 数 据 库
A2124: =ROW()-2 -> 2122 | B2124: TP | C2124: 0268 | D2124: 5 | E2124: 00268-1 | F2124: 数据库系统原理 | G2124: 俞盘祥等 | H2124: 23.00 | I2124: 36678 | J2124: 8
A2125: =ROW()-2 -> 2123 | B2125: TP | C2125: 4317 | D2125: 1 | F2125: 数据库原理与应用――习题解析 | G2125: 李春葆 | H2125: 24.00 | I2125: 36982 | J2125: 9
A2126: =ROW()-2 -> 2124 | B2126: TP | C2126: 4340 | D2126: 1 | E2126: 04340-X | F2126: 数据库系统原理与应用教程 | G2126: 闪四清 | H2126: 35.00 | I2126: 37438 | J2126: 8
A2127: =ROW()-2 -> 2125 | B2127: TP | C2127: 4574 | D2127: 1 | E2127: 04574-7 | F2127: 精通 SPSS | G2127: 张宜华 | H2127: 30.00 | I2127: 37500 | J2127: 9
A2128: =ROW()-2 -> 2126 | B2128: P- | C2128: 2599 | D2128: 1 | F2128: 多层分布式数据库实战（配光盘） | G2128: 王 涛 | H2128: 33.00 | I2128: 36800 | J2128: 13
A2129: =ROW()-2 -> 2127 | B2129: TP | C2129: 1215 | D2129: 1 | E2129: 01215-6 | F2129: Informix 高级编程指南 | G2129: 赵敬中等 | H2129: 38.00 | I2129: 36831 | J2129: 8
A2130: =ROW()-2 -> 2128 | B2130: TP | C2130: 0759 | D2130: 1 | E2130: 00759-4 | F2130: Visual C++ 6.0 数据库开发指南（配光盘） | G2130: 李博轩 | H2130: 64.00 | I2130: 37226 | J2130: 5
A2131: =ROW()-2 -> 2129 | B2131: TP | C2131: 3029 | D2131: 6 | E2131: 03029-4 | F2131: FoxBASE+关系数据库系统（第二版） | G2131: 郑甫京等 | H2131: 18.80 | I2131: 37104 | J2131: 12
A2132: =ROW()-2 -> 2130 | B2132: TP | C2132: 3645 | D2132: 2 | E2132: 03645-4 | F2132: Visual Basic 6.0 中文版数据库和 Internet 编程 | G2132: 胡荣根 | H2132: 30.00 | I2132: 36678 | J2132: 8
A2133: =ROW()-2 -> 2131 | B2133: TP | C2133: 3617 | D2133: 2 | E2133: 03617-9 | F2133: Visual FoxPro 6.0入门与应用实例(配光盘) | G2133: 李俊德 | H2133: 69.00 | I2133: 37408 | J2133: 5
A2134: =ROW()-2 -> 2132 | B2134: TP | C2134: 4003 | D2134: 1 | F2134: Visual FoxPro 6 数据库开发教程 | H2134: 34.00 | I2134: 36739 | J2134: 6
A2135: =ROW()-2 -> 2133 | B2135: TP | C2135: 3878 | D2135: 1 | E2135: 03878-3 | F2135: Visual FoxPro 6.0 中文版专家指南 | G2135: 夏伟文 | H2135: 16.00 | I2135: 37012 | J2135: 21
A2136: =ROW()-2 -> 2134 | B2136: TP | C2136: 2549 | D2136: 2 | E2136: 02549-5 | F2136: FoxPro 应用系统开发技术 | G2136: 梅绍祖 | H2136: 21.00 | I2136: 1998 | J2136: 10
A2137: =ROW()-2 -> 2135 | B2137: TP | C2137: 2610 | D2137: 1 | E2137: 02610-6 | F2137: FoxPro 2.6数据库应用教程 | G2137: 翁正科 | H2137: 28.00 | I2137: 36892 | J2137: 7
A2138: =ROW()-2 -> 2136 | B2138: P- | C2138: 2254 | D2138: 1 | F2138: SQL Server 7.0 系统管理指南 | G2138: 熊桂喜等译 | H2138: 78.00 | I2138: 36495
A2139: =ROW()-2 -> 2137 | B2139: TP | C2139: 1175 | D2139: 1 | E2139: 01175-3 | F2139: SQL Server 7.0 系统管理和应用开发指南 | G2139: 闪四清 | H2139: 65.00 | I2139: 36770 | J2139: 4
A2140: =ROW()-2 -> 2138 | B2140: TP | C2140: 5455 | D2140: 1 | E2140: 05455-X | F2140: SQL Server 实用简明教程 | G2140: 闪四清 | H2140: 33.00 | I2140: 37347 | J2140: 8
A2141: =ROW()-2 -> 2139 | B2141: P- | C2141: 3045 | D2141: 1 | F2141: Microsoft SQL Server 7.0 开发指南（配光盘） | G2141: 熊桂喜等译 | H2141: 69.00 | I2141: 36770 | J2141: 5
A2142: =ROW()-2 -> 2140 | B2142: TP | C2142: 4161 | D2142: 1 | E2142: 04161-X | F2142: 实用 Microsoft SQL Server 7.0 教程 | G2142: 李昕等译 | H2142: 46.00 | I2142: 36861 | J2142: 6
A2143: =ROW()-2 -> 2141 | B2143: TP | C2143: 4222 | D2143: 1 | E2143: 04222-5 | F2143: SQL Server 2000 系统管理指南 | G2143: 闪四清 | H2143: 42.00 | I2143: 37165 | J2143: 7
A2144: =ROW()-2 -> 2142 | B2144: TP | C2144: 4401 | D2144: 1 | E2144: 04401-5 | F2144: SQL Server 2000 应用开发技术指南 | G2144: 彭 东 | H2144: 58.00 | I2144: 37012 | J2144: 5
A2145: =ROW()-2 -> 2143 | B2145: TP | C2145: 4383 | D2145: 1 | E2145: 04383-3 | F2145: SQL Server 2000 数据仓库设计和使用指南 | G2145: 康博创作室 | H2145: 28.00 | I2145: 37226 | J2145: 10
A2146: =ROW()-2 -> 2144 | B2146: TP | C2146: 4514 | D2146: 1 | E2146: 04514-3 | F2146: SQL Server 2000 数据库设计与系统管理 | G2146: 李劲 等 | H2146: 45.00 | I2146: 37073 | J2146: 6
A2147: =ROW()-2 -> 2145 | B2147: TP | C2147: 4621 | D2147: 1 | E2147: 04621-2 | F2147: SQL Server 2000 与 XML 整合应用 | G2147: 沈兆阳等 | H2147: 33.00 | I2147: 37135 | J2147: 5
A2148: =ROW()-2 -> 2146 | B2148: TP | C2148: 4517 | D2148: 1 | E2148: 04517-8 | F2148: SQL Server 2000 培训教程 | G2148: 余晨 等 | H2148: 36.00 | I2148: 37408 | J2148: 7
A2149: =ROW()-2 -> 2147 | B2149: TP | C2149: 4843 | D2149: 1 | E2149: 04843-6 | F2149: SQL Server 2000 程序设计 | G2149: 隆华软件 | H2149: 33.00 | I2149: 37362 | J2149: 9
A2150: =ROW()-2 -> 2148 | B2150: TP | C2150: 4695 | D2150: 1 | E2150: 04695-6 | F2150: SQL Server 2000 OLAP 解决方案――数据仓库与Analysis Services | G2150: 沈兆阳 | H2150: 31.00 | I2150: 37135 | J2150: 8
A2151: =ROW()-2 -> 2149 | B2151: P- | C2151: 3748 | D2151: 1 | F2151: Microsoft SQL Server 2000 优化指南（配光盘） | G2151: 袁勤勇等译 | H2151: 45.00 | I2151: 37196 | J2151: 7
A2152: =ROW()-2 -> 2150 | B2152: TP | C2152: 4682 | D2152: 1 | E2152: 04682-4 | F2152: 手把手教你开发管理信息系统 | G2152: 罗超理 | H2152: 28.00 | I2152: 37348 | J2152: 10
A2153: =ROW()-2 -> 2151 | B2153: TP | C2153: 5618 | D2153: 1 | E2153: 05618-1 | F2153: 手把手教你学用Flish MX | G2153: 韩伟峰等 | H2153: 28.00 | I2153: 37438 | J2153: 9
A2154: =ROW()-2 -> 2152 | B2154: TP | C2154: 4836 | D2154: 1 | E2154: 04836-3 | F2154: 手把手教你学用 Premiere 6.0 | G2154: 龚正伟 | H2154: 23.00 | I2154: 37165 | J2154: 12
A2155: =ROW()-2 -> 2153 | B2155: TP | C2155: 5554 | D2155: 1 | E2155: 05554-1 | F2155: Visual FoxPro 7.0类和对象手册 | G2155: 王冬等 | H2155: 30.00 | I2155: 37438 | J2155: 8
A2156: =ROW()-2 -> 2154 | B2156: TP | C2156: 4496 | D2156: 1 | E2156: 04496-1 | F2156: 手把手教你学用数据库 | G2156: 赵健明 | H2156: 34.00 | I2156: 37043 | J2156: 8
A2157: =ROW()-2 -> 2155 | B2157: TP | C2157: 5088 | D2157: 1 | E2157: 05088-0 | F2157: Visual FoxPro 7.0实例解析 | G2157: 孙立明等 | H2157: 28.00 | I2157: 37438 | J2157: 10
A2158: =ROW()-2 -> 2156 | B2158: P- | C2158: 4164 | D2158: 1 | F2158: SQL实用参考手册（第四版）（配光盘） | G2158: 康博译 | H2158: 46.00 | I2158: 37348 | J2158: 7
A2159: =ROW()-2 -> 2157 | B2159: TP | C2159: 5293 | D2159: 1 | E2159: 05293-X | F2159: SQL故障诊断与排错技术 | G2159: 康博译 | H2159: 26.00 | I2159: 37348 | J2159: 11
A2160: =ROW()-2 -> 2158 | B2160: TP | C2160: 5129 | D2160: 1 | E2160: 05129-1 | F2160: Delphi分布式多层应用程序开发 | G2160: 陈锐 | H2160: 25.00 | I2160: 37348
A2161: =ROW()-2 -> 2159 | B2161: TP | C2161: 5278 | D2161: 1 | E2161: 05278-6 | F2161: SQL Server 2000简明教程 | G2161: 黄维通等 | H2161: 22.00 | I2161: 37469 | J2161: 11
A2162: =ROW()-2 -> 2160 | B2162: TP | C2162: 5556 | D2162: 1 | E2162: 05556-1 | F2162: Visual FoxPro 7.0函数和系统变量手册 | G2162: 王冬等 | H2162: 36.00 | I2162: 37438 | J2162: 7
A2163: =ROW()-2 -> 2161 | B2163: TP | C2163: 5755 | D2163: 1 | E2163: 057559 | F2163: 分布式Java 2 数据库系统开发指南 | G2163: Stewart birnam | H2163: 36.00 | I2163: 37469 | J2163: 12
F2164: 网 络 与 通 信
A2165: =ROW()-2 -> 2163 | B2165: TP | C2165: 5617 | D2165: 1 | E2165: 05617-1 | F2165: Unix/solaris 系统管理与网络管理 | G2165: 饶云华等 | H2165: 45.00 | I2165: 37438 | J2165: 7
A2166: =ROW()-2 -> 2164 | B2166: TP | C2166: 5153 | D2166: 1 | E2166: 05153-4 | F2166: Windows 2000 Server网络技术与构架管理 | G2166: 蔡一郎 | H2166: 34.00 | I2166: 37469 | J2166: 7
A2167: =ROW()-2 -> 2165 | B2167: TP | C2167: 5178 | D2167: 1 | E2167: 05178-x | F2167: 自己动手装ADSL | G2167: 柯志贤 | H2167: 38.00 | I2167: 37316 | J2167: 7
A2168: =ROW()-2 -> 2166 | B2168: TP | C2168: 4708 | D2168: 1 | E2168: 04708-1 | F2168: 嵌入式 Internet――21世纪的一场信息技术革命 | G2168: 赵 海 | H2168: 29.80 | I2168: 37135 | J2168: 8
A2169: =ROW()-2 -> 2167 | B2169: TP | C2169: 4639 | D2169: 1 | E2169: 04639-5 | F2169: 网络建设与服务技术丛书――MySQL 高级配置和管理 | G2169: 卢湘江等 | H2169: 32.00 | I2169: 37135 | J2169: 8
A2170: =ROW()-2 -> 2168 | B2170: TP | C2170: 4862 | D2170: 1 | E2170: 04862-2 | F2170: 网络建设与服务技术丛书――PHP 语言进阶和高级应用 | G2170: 龙浩 等 | H2170: 45.00 | I2170: 37196 | J2170: 6
A2171: =ROW()-2 -> 2169 | B2171: TP | C2171: 4975 | D2171: 1 | E2171: 04975-0 | F2171: 网络建设与服务技术丛书――Apache 服务器配置和管理 | G2171: 傅宇旭等 | H2171: 32.00 | I2171: 37226 | J2171: 8
A2172: =ROW()-2 -> 2170 | B2172: TP | C2172: 5130 | D2172: 1 | E2172: 05130-5 | F2172: 网络建设与服务技术丛书――Email 服务器配置和管理 | G2172: 傅宇旭等 | H2172: 29.00 | I2172: 37362 | J2172: 9
A2173: =ROW()-2 -> 2171 | B2173: TP | C2173: 4762 | D2173: 1 | E2173: 04762-6 | F2173: 网络系统的集成管理：概念、体系及其应用 | G2173: 曹阳 等译 | H2173: 58.00 | I2173: 37196 | J2173: 8
A2174: =ROW()-2 -> 2172 | B2174: P- | C2174: 3737 | D2174: 1 | F2174: 移动 agent 及其应用 | G2174: 张云勇 | H2174: 34.00 | I2174: 37196 | J2174: 10
A2175: =ROW()-2 -> 2173 | B2175: TP | C2175: 3216 | D2175: 3 | E2175: 03216-5 | F2175: 计算机网络基础 | G2175: 伍小明等 | H2175: 10.00 | I2175: 36586 | J2175: 25
A2176: =ROW()-2 -> 2174 | B2176: P- | C2176: 3122 | D2176: 1 | F2176: 利用 Visual Basic 实现串并行通信技术 （配光盘） | G2176: 范逸之等 | H2176: 57.00 | I2176: 37321 | J2176: 5
A2177: =ROW()-2 -> 2175 | B2177: TP | C2177: 2203 | D2177: 3 | E2177: 02203-8 | F2177: 计算机通信与网络教程 | G2177: 林 生 | H2177: 49.00 | I2177: 36586 | J2177: 5
A2178: =ROW()-2 -> 2176 | B2178: TP | C2178: 5499 | D2178: 1 | E2178: 05499-1 | F2178: Java移动通信程序设计――J2ME MIDP | G2178: 黄聪明 | H2178: 33.00 | I2178: 37408 | J2178: 8
A2179: =ROW()-2 -> 2177 | B2179: TP | C2179: 3920 | D2179: 1 | E2179: 03920-8 | F2179: 计算机网络协议和实现技术 | G2179: 鲁士文 | H2179: 42.00 | I2179: 36739 | J2179: 5
A2180: =ROW()-2 -> 2178 | B2180: TP | C2180: 0775 | D2180: 1 | E2180: 00775-6 | F2180: 网络管理原理与实现技术 | G2180: 杨家海等 | H2180: 38.00 | I2180: 36770 | J2180: 7
A2181: =ROW()-2 -> 2179 | B2181: TP | C2181: 4372 | D2181: 1 | E2181: 04372-8 | F2181: XDSL 技术与体系结构 | G2181: 任天恩译 | H2181: 38.00 | I2181: 36982 | J2181: 9
A2182: =ROW()-2 -> 2180 | B2182: TP | C2182: 3833 | D2182: 1 | E2182: 03833-3 | F2182: 虚拟私用网络技术 | G2182: 孔雷等译 | H2182: 26.00 | I2182: 36617 | J2182: 20
A2183: =ROW()-2 -> 2181 | B2183: TP | C2183: 4267 | D2183: 1 | E2183: 04267-5 | F2183: 计算机网络和计算机系统的性能评价 | G2183: 林 闯 | H2183: 32.00 | I2183: 36982 | J2183: 7
A2184: =ROW()-2 -> 2182 | B2184: TP | C2184: 0989 | D2184: 1 | E2184: 00989-9 | F2184: 电脑・网络基本操作 16讲 | G2184: 陈树楷等 | H2184: 19.00 | I2184: 36617 | J2184: 15
A2185: =ROW()-2 -> 2183 | B2185: TP | C2185: 0989 | D2185: 2 | E2185: 00989-9 | F2185: 电脑・网络基本操作 16讲（配光盘） | G2185: 陈树楷等 | H2185: 29.00 | I2185: 36739 | J2185: 14
A2186: =ROW()-2 -> 2184 | B2186: TP | C2186: 1010 | D2186: 1 | F2186: 计算机常用网络工具集锦 | H2186: 23.00 | I2186: 36647 | J2186: 13
A2187: =ROW()-2 -> 2185 | B2187: TP | C2187: 4140 | D2187: 1 | E2187: 04140-7 | F2187: 当代组网技术 | G2187: 张公忠等 | H2187: 49.80 | I2187: 36861 | J2187: 5
A2188: =ROW()-2 -> 2186 | B2188: TP | C2188: 4256 | D2188: 1 | F2188: ISDN 联网技术与应用指南 | H2188: 29.00 | I2188: 36951 | J2188: 9
A2189: =ROW()-2 -> 2187 | B2189: TP | C2189: 4066 | D2189: 1 | E2189: 04066-4 | F2189: 实用网络布线教程 | G2189: 薛淑良等译 | H2189: 22.00 | I2189: 36800 | J2189: 15
A2190: =ROW()-2 -> 2188 | B2190: P- | C2190: 2508 | D2190: 1 | F2190: 家庭网络实用（配光盘） | G2190: 吴师通 | H2190: 35.00 | I2190: 36739 | J2190: 12
A2191: =ROW()-2 -> 2189 | B2191: TP | C2191: 3969 | D2191: 1 | E2191: 03969-0 | F2191: 微软家庭及中小企业联网指南 | G2191: 陈萍等译 | H2191: 34.00 | I2191: 36739 | J2191: 10
A2192: =ROW()-2 -> 2190 | B2192: TP | C2192: 1319 | D2192: 1 | E2192: 01319-0 | F2192: 政府上网机关工作人员培训教程 | G2192: 李进 等 | H2192: 22.00 | I2192: 36617 | J2192: 12
A2193: =ROW()-2 -> 2191 | B2193: TP | C2193: 2739 | D2193: 3 | E2193: 02739-0 | F2193: 因特网路由技术 | G2193: 陶文星等 | H2193: 27.00 | I2193: 1998 | J2193: 10
A2194: =ROW()-2 -> 2192 | B2194: P- | C2194: 3013 | D2194: 2 | F2194: 因特网应用培训教程（配光盘） | G2194: 北京市委等 | H2194: 25.00 | I2194: 37135 | J2194: 15
A2195: =ROW()-2 -> 2193 | B2195: TP | C2195: 3256 | D2195: 6 | E2195: 03256-4 | F2195: 网上冲浪夺冠 | G2195: 扬 庆 | H2195: 38 | I2195: 36678 | J2195: 8
A2196: =ROW()-2 -> 2194 | B2196: TP | C2196: 4435 | D2196: 1 | E2196: 04435-X | F2196: Microsoft Windows 2000 Server 网络系统与服务 | G2196: 李毅聘 | H2196: 32.00 | I2196: 37104 | J2196: 8
A2197: =ROW()-2 -> 2195 | B2197: TP | C2197: 3724 | D2197: 2 | E2197: 03724-8 | F2197: Windows 98 联网指南 | G2197: 博彦公司 | H2197: 22.80 | I2197: 36708 | J2197: 9
A2198: =ROW()-2 -> 2196 | B2198: TP | C2198: 3755 | D2198: 1 | E2198: 03755-8 | F2198: 国家空间信息基础设施与数字地球 | G2198: 承继成等 | H2198: 21.00 | I2198: 36434 | J2198: 11
A2199: =ROW()-2 -> 2197 | B2199: TP | C2199: 3813 | D2199: 1 | E2199: 03813-9 | F2199: Internet 网络信息检索 ―― 原理 工具 技巧 | G2199: 储荷婷等 | H2199: 26.50 | I2199: 36465 | J2199: 9
A2200: =ROW()-2 -> 2198 | B2200: TP | C2200: 1122 | D2200: 1 | E2200: 01122-2 | F2200: 新一代 Internet 协议 IPv6 | G2200: 卢显良等 | H2200: 16.00 | I2200: 36739 | J2200: 15
A2201: =ROW()-2 -> 2199 | B2201: TP | C2201: 4993 | D2201: 1 | E2201: 04993-9 | F2201: Internet 协议概念与实践 | G2201: 施威铭 研究室 | H2201: 48.00 | I2201: 37165 | J2201: 5
A2202: =ROW()-2 -> 2200 | B2202: TP | C2202: 2782 | D2202: 4 | E2202: 02782-X | F2202: Internet 入网与使用 | G2202: 刘畅 等 | H2202: 24.00 | I2202: 36495 | J2202: 10
A2203: =ROW()-2 -> 2201 | B2203: TP | C2203: 3814 | D2203: 1 | E2203: 03814-7 | F2203: Internet 高级应用与技巧 | G2203: 孙 昕 等 | H2203: 26.00 | I2203: 36617 | J2203: 10
A2204: =ROW()-2 -> 2202 | B2204: TP | C2204: 3803 | D2204: 1 | E2204: 03803-1 | F2204: 上网起步―― 操作与技巧 | G2204: 童纯清等 | H2204: 20.00 | I2204: 36526 | J2204: 12
A2205: =ROW()-2 -> 2203 | B2205: TP | C2205: 4127 | D2205: 1 | E2205: 04127-X | F2205: 上网实用培训教程 | G2205: 王诚君 | H2205: 24.00 | I2205: 36892 | J2205: 9
A2206: =ROW()-2 -> 2204 | B2206: TP | C2206: 4701 | D2206: 1 | E2206: 04701-4 | F2206: 电脑生手轻松上网 | G2206: 高越明等 | H2206: 22.00 | I2206: 37348 | J2206: 13
A2207: =ROW()-2 -> 2205 | B2207: TP | C2207: 4307 | D2207: 1 | E2207: 04307-8 | F2207: 上网实用――技巧与提高 | G2207: 罗晓光 | H2207: 19.00 | I2207: 36982 | J2207: 13
A2208: =ROW()-2 -> 2206 | B2208: TP | C2208: 5659 | D2208: 1 | E2208: 05659-1 | F2208: Internet 网络冲浪百事通 | G2208: 张洪彬 | H2208: 26.00 | I2208: 37438 | J2208: 10
A2209: =ROW()-2 -> 2207 | B2209: TP | C2209: 1074 | D2209: 2 | E2209: 01074-9 | F2209: Internet 网虫百事通 | G2209: 张洪彬 | H2209: 34.00 | I2209: 37073 | J2209: 8
A2210: =ROW()-2 -> 2208 | B2210: TP | C2210: 2260 | D2210: 3 | E2210: 02260-7 | F2210: INTERNET上的各类常用资源 （2000年版） | G2210: 刘波 等 | H2210: 10.00 | I2210: 36739 | J2210: 30
A2211: =ROW()-2 -> 2209 | B2211: TP | C2211: 2889 | D2211: 3 | E2211: 02889-3 | F2211: INTRANET 网络技术及应用 | G2211: 胡道元 | H2211: 29.80 | I2211: 37469 | J2211: 8
A2212: =ROW()-2 -> 2210 | B2212: TP | C2212: 2458 | D2212: 3 | E2212: 02458-8 | F2212: ATM网络互连原理与工程 | G2212: 张宏科等 | H2212: 17.50 | I2212: 36342 | J2212: 13
A2213: =ROW()-2 -> 2211 | B2213: TP | C2213: 4444 | D2213: 1 | E2213: 04444-9 | F2213: ADSL 宽带网技术 | G2213: 郭士秋 | H2213: 32.00 | I2213: 37043 | J2213: 9
A2214: =ROW()-2 -> 2212 | B2214: TN | C2214: 2759 | D2214: 2 | E2214: 02759-5 | F2214: 宽带综合业务数字网与ATM局域网 | G2214: 李津生等 | H2214: 17.50 | I2214: 1998 | J2214: 12
A2215: =ROW()-2 -> 2213 | B2215: TP | C2215: 5157 | D2215: 1 | E2215: 05157-7 | F2215: 宽带网络快易通――网络通信应用指南 | G2215: 王志平 | H2215: 27.00 | I2215: 37257 | J2215: 9
A2216: =ROW()-2 -> 2214 | B2216: TP | C2216: 2951 | D2216: 2 | E2216: 02951-2 | F2216: 网络管理协议及应用开发 | G2216: 岑贤道等 | H2216: 29.00 | I2216: 1999 | J2216: 8
A2217: =ROW()-2 -> 2215 | B2217: TP | C2217: 4865 | D2217: 1 | E2217: 04865-7 | F2217: 局域网应急处理与技巧实例（上册） | G2217: 先 锋 | H2217: 49.00 | I2217: 37196 | J2217: 5
A2218: =ROW()-2 -> 2216 | B2218: TP | C2218: 2336 | D2218: 7 | E2218: 02336-0 | F2218: 计算机局域网(第2版) | G2218: 胡道元 | H2218: 28.00 | I2218: 37257 | J2218: 8
A2219: =ROW()-2 -> 2217 | B2219: TP | C2219: 2336 | D2219: 8 | E2219: 02336-0 | F2219: 计算机局域网(第2版)（配光盘） | G2219: 胡道元 | H2219: 38.00 | I2219: 36982 | J2219: 8
A2220: =ROW()-2 -> 2218 | B2220: TP | C2220: 4397 | D2220: 1 | E2220: 04397-3 | F2220: 以太网组网技术大全 | G2220: 刘晓辉 | H2220: 52.00 | I2220: 37326 | J2220: 5
A2221: =ROW()-2 -> 2219 | B2221: TP | C2221: 4458 | D2221: 1 | E2221: 04458-9 | F2221: 企业网组建指南 | G2221: 郝卫东等 | H2221: 24.00 | I2221: 37012 | J2221: 10
A2222: =ROW()-2 -> 2220 | B2222: TP | C2222: 1945 | D2222: 6 | E2222: 01945-2 | F2222: Novell NetWare 网络速成 | G2222: 夏春和等 | H2222: 11.00 | I2222: 36617 | J2222: 18
A2223: =ROW()-2 -> 2221 | B2223: TP | C2223: 0897 | D2223: 1 | E2223: 00897-3 | F2223: NetWare 5 网络管理及应用 | G2223: 李辉 等 | H2223: 32.00 | I2223: 36923 | J2223: 10
A2224: =ROW()-2 -> 2222 | B2224: TP | C2224: 0898 | D2224: 2 | E2224: 00898-1 | F2224: 网络技术基础 | G2224: 黄丹 等 | H2224: 21.00 | I2224: 36678 | J2224: 16
A2225: =ROW()-2 -> 2223 | B2225: G- | C2225: 4257 | D2225: 1 | E2225: 04257-8 | F2225: 网络媒体概论 | G2225: 匡文波 | H2225: 17.00 | I2225: 36951 | J2225: 16
A2226: =ROW()-2 -> 2224 | B2226: P- | C2226: 2519 | D2226: 1 | F2226: 畅游 Internet 实用培训教程（配光盘） | G2226: 汤 文 | H2226: 35.00 | I2226: 36861 | J2226: 9
A2227: =ROW()-2 -> 2225 | B2227: TP | C2227: 3495 | D2227: 1 | E2227: 03495-8 | F2227: 使用 Internet 问题解答 | G2227: 赵 彬 | H2227: 14.00 | I2227: 36312 | J2227: 20
A2228: =ROW()-2 -> 2226 | B2228: TP | C2228: 3828 | D2228: 1 | E2228: 03828-7 | F2228: WWW 辞典 | G2228: 裴晓明译 | H2228: 12.00 | I2228: 36647 | J2228: 24
A2229: =ROW()-2 -> 2227 | B2229: TP | C2229: 2592 | D2229: 1 | E2229: 02592-4 | F2229: UNIX 网络原理与应用 | G2229: 欧宗生 | H2229: 22.00 | I2229: 1997 | J2229: 15
A2230: =ROW()-2 -> 2228 | B2230: TP | C2230: 3548 | D2230: 1 | E2230: 03548-2 | F2230: UNIX 网络编程 | G2230: 施振川等 | H2230: 94.00 | I2230: 36342 | J2230: 3
A2231: =ROW()-2 -> 2229 | B2231: TP | C2231: 1585 | D2231: 5 | E2231: 01585-6 | F2231: 微机通信原理与实用技术 | G2231: 马宏杰等 | H2231: 19.80 | I2231: 36586 | J2231: 10
A2232: =ROW()-2 -> 2230 | B2232: TP | C2232: 1427 | D2232: C | E2232: 01427-2 | F2232: TCP/IP 网络原理与技术 | G2232: 周明天等 | H2232: 19.00 | I2232: 37358 | J2232: 12
A2233: =ROW()-2 -> 2231 | B2233: TP | C2233: 1077 | D2233: 1 | E2233: 01077-3 | F2233: IP 路由原理与技术 | G2233: 张宏科等 | H2233: 20.00 | I2233: 36831 | J2233: 16
A2234: =ROW()-2 -> 2232 | B2234: TP | C2234: 3847 | D2234: 1 | E2234: 03847-3 | F2234: 实用 Cisco 路由器技术教程 | G2234: 钟向群译 | H2234: 28.00 | I2234: 36647 | J2234: 13
A2235: =ROW()-2 -> 2233 | B2235: TP | C2235: 4150 | D2235: 1 | E2235: 04150-4 | F2235: IIS 5.0 系统管理指南 | G2235: 于骞等译 | H2235: 40.00 | I2235: 36861 | J2235: 8
A2236: =ROW()-2 -> 2234 | B2236: TP | C2236: 2738 | D2236: 1 | E2236: 02738-2 | F2236: 网络工程与综合布线系统 | G2236: 黎连业 | H2236: 34.00 | I2236: 1997 | J2236: 10
A2237: =ROW()-2 -> 2235 | B2237: TP | C2237: 3110 | D2237: 1 | E2237: 03110-X | F2237: 智能大厦网络实施指南 | G2237: 黎连业等 | H2237: 20.00 | I2237: 1998 | J2237: 13
A2238: =ROW()-2 -> 2236 | B2238: TP | C2238: 3031 | D2238: 1 | E2238: 03031-6 | F2238: 网络多媒体技术与应用 | G2238: 张明敏 | H2238: 38.00 | I2238: 1998 | J2238: 7
A2239: =ROW()-2 -> 2237 | B2239: TP | C2239: 4167 | D2239: 1 | F2239: 实用Windows 对等网络连接教程 | H2239: 40.00 | I2239: 36892 | J2239: 7
A2240: =ROW()-2 -> 2238 | B2240: P- | C2240: 4186 | D2240: 1 | E2240: 7-900641-86-6 | F2240: Pro/E 2000 i2 e 点就通（配光盘） | G2240: 杨忠衡等 | H2240: 38.00 | I2240: 37469 | J2240: 8
A2241: =ROW()-2 -> 2239 | B2241: TP | C2241: 5121 | D2241: 1 | E2241: 05121-6 | F2241: 蓝牙技术 | G2241: 禹帆 | H2241: 28.00 | I2241: 37316 | J2241: 10
A2242: =ROW()-2 -> 2240 | B2242: TP | C2242: 5332 | D2242: 1 | E2242: 05332-4 | F2242: 网络银行服务 | G2242: 陈进 | H2242: 14.00 | I2242: 37347 | J2242: 16
A2243: =ROW()-2 -> 2241 | B2243: TP | C2243: 5268 | D2243: 1 | E2243: 05268-9 | F2243: 局域网组建及应用培训教程 | G2243: 孙江宏等 | H2243: 30.00 | I2243: 37469 | J2243: 9
A2244: =ROW()-2 -> 2242 | B2244: TP | C2244: 5266 | D2244: 1 | E2244: 05266-2 | F2244: Windows Internet黑客防范与安全策略 | G2244: 康博译 | H2244: 28.00 | I2244: 37347 | J2244: 12
A2245: =ROW()-2 -> 2243 | B2245: TP | C2245: 5349 | D2245: 1 | E2245: 05349-9 | F2245: Exchange 2000 Server 系统管理指南 | G2245: 吴志华等 | H2245: 30.00 | I2245: 37347 | J2245: 9
A2246: =ROW()-2 -> 2244 | B2246: TP | C2246: 5248 | D2246: 1 | E2246: 05248-4 | F2246: Internet应急处理与技巧实例 | G2246: 先锋 | H2246: 48.00 | I2246: 37347 | J2246: 5
A2247: =ROW()-2 -> 2245 | B2247: TP | C2247: 5184 | D2247: 1 | E2247: 05184-4 | F2247: 下一代的IP网络技术保障――多协议标签交换 | G2247: 吴伟 | H2247: 14.00 | I2247: 37347 | J2247: 18
A2248: =ROW()-2 -> 2246 | B2248: TP | C2248: 5462 | D2248: 1 | E2248: 05462-2 | F2248: Jini实例精解 | G2248: W.Keith Edwards Tom Rodden | H2248: 49.00 | I2248: 37408 | J2248: 7
A2249: =ROW()-2 -> 2247 | B2249: TP | C2249: 5541 | D2249: 1 | E2249: 05541-6 | F2249: 心动数码生活 扫描刻录步步高 | G2249: 鳄鱼宝宝 | H2249: 18.00 | I2249: 37408 | J2249: 23
A2250: =ROW()-2 -> 2248 | B2250: TP | C2250: 5458 | D2250: 1 | E2250: 05458-4 | F2250: 校园网系统集成技术与应用 | G2250: 刘正勇 | H2250: 29.00 | I2250: 37409 | J2250: 9
A2251: =ROW()-2 -> 2249 | B2251: TP | C2251: 5826 | D2251: 1 | E2251: 05826-1 | F2251: 中国计算机科学与技术学科教程2002 | H2251: 32.00 | I2251: 37500 | J2251: 25
A2252: =ROW()-2 -> 2250 | B2252: TP | C2252: 5279 | D2252: 1 | E2252: 05279-4 | F2252: 数据库驱动的Web站点 | G2252: [美]Mike Morrison等 | H2252: 34.00 | I2252: 37438 | J2252: 9
A2253: =ROW()-2 -> 2251 | B2253: TP | C2253: 5835 | D2253: 1 | E2253: 05835-0 | F2253: 中小网络管理维护一点通 | G2253: 东方人华 | H2253: 29.00 | I2253: 37500 | J2253: 10
A2254: =ROW()-2 -> 2252 | B2254: TP | C2254: 5583 | D2254: 1 | E2254: 05583-1 | F2254: XML高级网络应用 | G2254: 但正刚等 | H2254: 36.00 | I2254: 37469 | J2254: 7
F2255: 电 子 商 务
A2256: =ROW()-2 -> 2254 | B2256: TP | C2256: 3636 | D2256: 2 | E2256: 03636-5 | F2256: EDI 与电子商务 | G2256: 信息办公室 | H2256: 38.00 | I2256: 36708 | J2256: 6
A2257: =ROW()-2 -> 2255 | B2257: TP | C2257: 1154 | D2257: 1 | E2257: 01154-0 | F2257: 实战网络营销 ―― 理论与实践 | G2257: 刘光峰等 | H2257: 39.80 | I2257: 36678 | J2257: 6
A2258: =ROW()-2 -> 2256 | B2258: TP | C2258: 5102 | D2258: 1 | E2258: 05102-X | F2258: 网络营销基础与实践 | G2258: 冯英健 | H2258: 27.00 | I2258: 37469 | J2258: 12
A2259: =ROW()-2 -> 2257 | B2259: TP | C2259: 4152 | D2259: 1 | E2259: 04125-0 | F2259: 电子商务与企业通信 | G2259: 沈伦译 | H2259: 24.00 | I2259: 36892 | J2259: 12
A2260: =ROW()-2 -> 2258 | B2260: TP | C2260: 4058 | D2260: 1 | E2260: 04058-3 | F2260: 电子商务网站的构建与维护 | G2260: 王志峰等 | H2260: 25.00 | I2260: 36982 | J2260: 11
A2261: =ROW()-2 -> 2259 | B2261: TP | C2261: 4884 | D2261: 1 | E2261: 04884-3 | F2261: 电子商务――从理念到行动 | G2261: 梁春晓等 | H2261: 27.00 | I2261: 37165 | J2261: 7
A2262: =ROW()-2 -> 2260 | B2262: P- | C2262: 3780 | D2262: 1 | F2262: 电子商务原理与应用开发实务（配光盘） | G2262: 李明刚等 | H2262: 46.00 | I2262: 37226 | J2262: 7
A2263: =ROW()-2 -> 2261 | B2263: P- | C2263: 3739 | D2263: 1 | F2263: Microsoft Commerce Server 建构智能化电子商务平台（配光盘） | G2263: 东 名 | H2263: 33.00 | I2263: 37196 | J2263: 9
A2264: =ROW()-2 -> 2262 | B2264: TP | C2264: 3844 | D2264: 1 | E2264: 03844-9 | F2264: 网上商品行销指南 | G2264: 孙 昕等译 | H2264: 36.00 | I2264: 36647 | J2264: 10
A2265: =ROW()-2 -> 2263 | B2265: TP | C2265: 5596 | D2265: 1 | E2265: 05596-3 | F2265: 电子商务新视野 | G2265: 陈锡筠等译 | H2265: 29.00 | I2265: 37438 | J2265: 10
A2266: =ROW()-2 -> 2264 | B2266: TP | C2266: 5621 | D2266: 1 | E2266: 056218 | F2266: 电子商务实务教程 | G2266: 陈科鹤 | H2266: 30.00 | I2266: 37469 | J2266: 9
F2267: 网 络 安 全
A2268: =ROW()-2 -> 2266 | B2268: TP | C2268: 5026 | D2268: 1 | E2268: 05026-0 | F2268: 黑客大暴光 （第二版）―― 网络安全机密与解决方案 | G2268: 钟向群等译 | H2268: 69.00 | I2268: 37196 | J2268: 3
A2269: =ROW()-2 -> 2267 | B2269: P- | C2269: 3749 | D2269: 1 | F2269: 黑客攻防对策（配光盘） | G2269: 秘密客 | H2269: 34.00 | I2269: 37257 | J2269: 8
A2270: =ROW()-2 -> 2268 | B2270: P- | C2270: 4146 | D2270: 1 | E2270: 04146-7 | F2270: 黑客攻防对策之木马篇 | G2270: 秘密客 | H2270: 29.00 | I2270: 37414 | J2270: 12
A2271: =ROW()-2 -> 2269 | B2271: TP | C2271: 5020 | D2271: 1 | E2271: 05020-1 | F2271: Windows 2000 Server 网络建设及安全维护 | G2271: 庄彦泽 | H2271: 23.00 | I2271: 37226 | J2271: 12
A2272: =ROW()-2 -> 2270 | B2272: TP | C2272: 0819 | D2272: 1 | E2272: 00819-1 | F2272: 网络安全与防火墙技术 | G2272: 王睿 等 | H2272: 25.00 | I2272: 36831 | J2272: 12
A2273: =ROW()-2 -> 2271 | B2273: G- | C2273: 5641 | D2273: 1 | E2273: 05641-2 | F2273: e矛e盾 | G2273: 白 硕 | H2273: 16.00 | I2273: 37469 | J2273: 18
F2274: RAS信息安全系列丛书
A2275: =ROW()-2 -> 2273 | B2275: P- | C2275: 3718 | D2275: 1 | F2275: 密码工程实践指南（配光盘） | G2275: 冯登国等译 | H2275: 53.00 | I2275: 37196 | J2275: 6
A2276: =ROW()-2 -> 2274 | B2276: TP | C2276: 4942 | D2276: 1 | E2276: 04942-4 | F2276: IPSec：VPN的安全实施 | G2276: 周永彬等译 | H2276: 52.00 | I2276: 37226 | J2276: 7
F2277: 网站及网页
A2278: =ROW()-2 -> 2276 | B2278: TP | C2278: 4523 | D2278: 1 | E2278: 04523-2 | F2278: Web 管理员手册 | G2278: 李凤华 | H2278: 32.00 | I2278: 37073 | J2278: 9
A2279: =ROW()-2 -> 2277 | B2279: TP | C2279: 4988 | D2279: 1 | E2279: 04988-2 | F2279: Microsoft .NET 战略 | G2279: 王黎 等译 | H2279: 36.00 | I2279: 37377 | J2279: 8
A2280: =ROW()-2 -> 2278 | B2280: TP | C2280: 4233 | D2280: 1 | E2280: 04233-0 | F2280: 精通 Linux 系统管理与应用开发技术 | G2280: 超星空工作室 | H2280: 49.00 | I2280: 36982 | J2280: 5
A2281: =ROW()-2 -> 2279 | B2281: P- | C2281: 3124 | D2281: 1 | F2281: 红旗 Linux 软件开发技术 （配光盘） | G2281: 中科红旗 | H2281: 42.00 | I2281: 36982 | J2281: 9
A2282: =ROW()-2 -> 2280 | B2282: P- | C2282: 3035 | D2282: 1 | F2282: Linux 架站玩家（配光盘） | G2282: 浮 云 | H2282: 53.00 | I2282: 36800 | J2282: 6
A2283: =ROW()-2 -> 2281 | B2283: P- | C2283: 3557 | D2283: 1 | F2283: 实用 JavaScript 网页特效编程百宝箱 （配光盘） | G2283: 张宝亮 | H2283: 88.00 | I2283: 37073 | J2283: 4
A2284: =ROW()-2 -> 2282 | B2284: TP | C2284: 5514 | D2284: 1 | E2284: 05514-9 | F2284: JavaScript 网页编程案例教程 | G2284: 屈鹏飞 | H2284: 30.00 | I2284: 37408 | J2284: 9
A2285: =ROW()-2 -> 2283 | B2285: TP | C2285: 4329 | D2285: 1 | E2285: 04329-9 | F2285: APACHE 系统管理指南 | G2285: 王一川译 | H2285: 36.00 | I2285: 36982 | J2285: 8
A2286: =ROW()-2 -> 2284 | B2286: TP | C2286: 4352 | D2286: 1 | E2286: 04352-3 | F2286: 网络社区建设――设计策略揭秘 | G2286: 张署 等译 | H2286: 26.00 | I2286: 36982 | J2286: 12
A2287: =ROW()-2 -> 2285 | B2287: P- | C2287: 3578 | D2287: 1 | F2287: qmail 实用技术指南（配光盘） | G2287: 赖斌 等 | H2287: 46.00 | I2287: 37073 | J2287: 7
A2288: =ROW()-2 -> 2286 | B2288: TP | C2288: 4589 | D2288: 1 | E2288: 04589-5 | F2288: WAP 建站技术详解与实例 | G2288: 汪翔 等 | H2288: 31.00 | I2288: 37073 | J2288: 9
A2289: =ROW()-2 -> 2287 | B2289: TP | C2289: 5513 | D2289: 1 | E2289: 05513-1 | F2289: Web 服务架构与开放互操作技术 | G2289: 柴晓路 | H2289: 42.00 | I2289: 37438 | J2289: 7
A2290: =ROW()-2 -> 2288 | B2290: TP | C2290: 4511 | D2290: 1 | E2290: 04511-9 | F2290: CGI 技术全面接触 | G2290: 刘伟 等 | H2290: 39.00 | I2290: 37104 | J2290: 9
A2291: =ROW()-2 -> 2289 | B2291: P- | C2291: 4345 | D2291: 1 | E2291: 7900643451 | F2291: XML网页开发实例教程（配光盘） | G2291: 李永详 | H2291: 30.00 | I2291: 37500 | J2291: 10
A2292: =ROW()-2 -> 2290 | B2292: TP | C2292: 4724 | D2292: 1 | E2292: 04724-3 | F2292: 网页设计九合一培训教程 | G2292: 陈新峰等 | H2292: 35.00 | I2292: 37257 | J2292: 8
A2293: =ROW()-2 -> 2291 | B2293: P- | C2293: 3779 | D2293: 1 | E2293: 7900637796 | F2293: 网页设计与Web数据库发布技术（配光盘） | G2293: 魏应彬 | H2293: 27.00 | I2293: 37469 | J2293: 9
A2294: =ROW()-2 -> 2292 | B2294: P- | C2294: 3564 | D2294: 1 | F2294: 个性主页平面方案 + Photoshop 手记 （配光盘） | G2294: 老 鱼 | H2294: 58 | I2294: 37196 | J2294: 10
A2295: =ROW()-2 -> 2293 | B2295: TP | C2295: 3934 | D2295: 1 | E2295: 03934-8 | F2295: 实用网站建设技术 | G2295: 陈育松 | H2295: 30 | I2295: 36739 | J2295: 9
A2296: =ROW()-2 -> 2294 | B2296: TP | C2296: 3197 | D2296: 1 | E2296: 03197-5 | F2296: HTML 语言与 Web 站点开发技术 | G2296: 马洪兵等 | H2296: 33 | I2296: 1999 | J2296: 6
A2297: =ROW()-2 -> 2295 | B2297: TP | C2297: 4391 | D2297: 1 | E2297: 04391-4 | F2297: 网页数据库实例应用宝典 | G2297: 数位文化 | H2297: 36.00 | I2297: 37043 | J2297: 8
A2298: =ROW()-2 -> 2296 | B2298: TP | C2298: 4385 | D2298: 1 | E2298: 04385-X | F2298: 网页数据库设计圣典 | G2298: 数位文化 | H2298: 32.9 | I2298: 37043 | J2298: 9
A2299: =ROW()-2 -> 2297 | B2299: TP | C2299: 4681 | D2299: 1 | E2299: 04681-6 | F2299: FrontPage 2002 中文版动态网页开发密笈 | G2299: 张振峰等 | H2299: 52 | I2299: 37104 | J2299: 6
A2300: =ROW()-2 -> 2298 | B2300: P- | C2300: 3076 | D2300: 1 | F2300: FrontPage 2000 & ASP 网页设计技巧与网站 维护 | G2300: 蒋方帅 | H2300: 56.00 | I2300: 36831 | J2300: 5
A2301: =ROW()-2 -> 2299 | B2301: TP | C2301: 4228 | D2301: 1 | E2301: 04228-4 | F2301: 网站策划与建设手册――FrontPage 2000网站建 设篇 | G2301: 刘凤英 | H2301: 18.00 | I2301: 36982 | J2301: 13
A2302: =ROW()-2 -> 2300 | B2302: TP | C2302: 4437 | D2302: 1 | E2302: 04437-6 | F2302: 网站策划与建设手册――Fireworks 4.0 图形设 计篇 | G2302: 刘光峰等 | H2302: 37.00 | I2302: 37012 | J2302: 9
A2303: =ROW()-2 -> 2301 | B2303: TP | C2303: 4350 | D2303: 1 | E2303: 04350-7 | F2303: 网站策划与建设手册――Dreamwerver 4.0网站设 计篇 | G2303: 刘光峰等 | H2303: 24.00 | I2303: 37012 | J2303: 9
A2304: =ROW()-2 -> 2302 | B2304: TP | C2304: 2670 | D2304: 2 | E2304: 02670-X | F2304: World Wide Web循序渐进 | G2304: 毛伟 等 | H2304: 19.00 | I2304: 1998 | J2304: 13
A2305: =ROW()-2 -> 2303 | B2305: P- | C2305: 2549 | D2305: 1 | F2305: 网页设计总动员（配光盘） | G2305: 上奇科技 | H2305: 78.00 | I2305: 36739 | J2305: 8
A2306: 2271 | B2306: TP | C2306: 4351 | D2306: 1 | E2306: 04351-5 | F2306: 网页设计三剑客 | G2306: 培训中心 | H2306: 26.00 | I2306: 37469 | J2306: 10
A2307: 2272 | B2307: TP | C2307: 4223 | D2307: 1 | E2307: 04223-3 | F2307: 动态网页设计培训教程 | G2307: 刘育楠等 | H2307: 28.00 | I2307: 36982 | J2307: 10
A2308: =ROW()-2 -> 2306 | B2308: TP | C2308: 0774 | D2308: 1 | E2308: 00774-8 | F2308: 网页设计培训教程 | G2308: 周宇坤 | H2308: 29.80 | I2308: 36739 | J2308: 8
A2309: =ROW()-2 -> 2307 | B2309: TP | C2309: 4067 | D2309: 1 | E2309: 04067-2 | F2309: 网页标题制作技巧与实例 | G2309: 吕少华 | H2309: 22.00 | I2309: 36800 | J2309: 10
A2310: =ROW()-2 -> 2308 | B2310: TP | C2310: 4234 | D2310: 1 | E2310: 04234-9 | F2310: 网页织梦完全手册 | G2310: 东箭工作室 | H2310: 26.00 | I2310: 37196 | J2310: 11
A2311: =ROW()-2 -> 2309 | B2311: TP | C2311: 1268 | D2311: 1 | E2311: 01268-7 | F2311: 网页图像特效完全手册（上）―― 基础篇 | G2311: 东箭工作室 | H2311: 32.00 | I2311: 36982 | J2311: 8
A2312: =ROW()-2 -> 2310 | B2312: P- | C2312: 3091 | D2312: 1 | F2312: 网页图象特效完全手册（下）――实例篇 （配光盘） | G2312: 东箭工作室 | H2312: 54.00 | I2312: 36923 | J2312: 10
A2313: =ROW()-2 -> 2311 | B2313: P- | C2313: 3111 | D2313: 1 | F2313: 网页动画特效完全手册（配光盘） | G2313: 东箭工作室 | H2313: 48.00 | I2313: 36982 | J2313: 6
A2314: =ROW()-2 -> 2312 | B2314: P- | C2314: 3153 | D2314: 1 | F2314: 精品网页创意制作集粹 （配光盘） | G2314: 龚正伟等 | H2314: 38.00 | I2314: 36982 | J2314: 8
A2315: =ROW()-2 -> 2313 | B2315: TP | C2315: 3111 | D2315: 4 | E2315: 03111-8 | F2315: 精品网页制作（配光盘） | G2315: 鲁倩 等 | H2315: 42 | I2315: 36617 | J2315: 10
A2316: =ROW()-2 -> 2314 | B2316: P- | C2316: 2518 | D2316: 1 | F2316: 精品网页制作 ―― Flash 4.0（配光盘） | G2316: 汤 文 | H2316: 35 | I2316: 36831 | J2316: 10
A2317: =ROW()-2 -> 2315 | B2317: P- | C2317: 2232 | D2317: 2 | F2317: 精品动态网页制作（配光盘） | G2317: 杨内 等 | H2317: 39 | I2317: 36739 | J2317: 10
A2318: =ROW()-2 -> 2316 | B2318: TP | C2318: 4193 | D2318: 1 | F2318: 动态网页程序设计 | G2318: 施红芹等 | H2318: 27 | I2318: 37043 | J2318: 11
A2319: =ROW()-2 -> 2317 | B2319: P- | C2319: 3546 | D2319: 1 | F2319: 动态网页设计――Photoshop 与 ImageReady 整合应用（配光盘） | G2319: 慧通资讯 | H2319: 34 | I2319: 37135 | J2319: 8
A2320: =ROW()-2 -> 2318 | B2320: TP | C2320: 4490 | D2320: 1 | E2320: 04490-2 | F2320: 动态网页制作精粹 | G2320: 张红军等 | H2320: 41 | I2320: 37043 | J2320: 7
A2321: =ROW()-2 -> 2319 | B2321: P- | C2321: 2562 | D2321: 1 | F2321: 交互式动画网页与网站设计（配光盘） | G2321: 杨内 等 | H2321: 36 | I2321: 36800 | J2321: 11
A2322: =ROW()-2 -> 2320 | B2322: TP | C2322: 3621 | D2322: 3 | E2322: 03621-7 | F2322: 网页数据库设计与分布 | G2322: 第三波 | H2322: 28 | I2322: 36892 | J2322: 10
A2323: =ROW()-2 -> 2321 | B2323: P- | C2323: 3559 | D2323: 1 | F2323: Java 网页特效180招（配光盘） | G2323: 数位文化 | H2323: 48 | I2323: 37104 | J2323: 5
A2324: =ROW()-2 -> 2322 | B2324: TP | C2324: 3760 | D2324: 1 | E2324: 03760-4 | F2324: 动态 Web 网页技术大全 | G2324: 於志渊 | H2324: 46 | I2324: 36617 | J2324: 6
A2325: =ROW()-2 -> 2323 | B2325: TP | C2325: 4358 | D2325: 1 | E2325: 04358-2 | F2325: CSS 动态网页样式表应用开发手册 | G2325: 王天利 | H2325: 21 | I2325: 36982 | J2325: 15
A2326: =ROW()-2 -> 2324 | B2326: TP | C2326: 3982 | D2326: 1 | E2326: 03982-8 | F2326: 动态网页设计 Flash 4 攻略手册 | H2326: 22 | I2326: 36708 | J2326: 12
A2327: =ROW()-2 -> 2325 | B2327: TP | C2327: 1264 | D2327: 2 | E2327: 01264-4 | F2327: 网页制作常用工具指南 | G2327: 林贻珀 | H2327: 26 | I2327: 36647 | J2327: 10
A2328: =ROW()-2 -> 2326 | B2328: TP | C2328: 4229 | D2328: 1 | E2328: 04229-2 | F2328: 网页制作梦幻组合 | G2328: 田守瑞等 | H2328: 33.00 | I2328: 37257 | J2328: 9
A2329: =ROW()-2 -> 2327 | B2329: TP | C2329: 3845 | D2329: 1 | E2329: 03845-7 | F2329: CSS & DHTML for Web 专业设计 | G2329: 陈 虹 译 | H2329: 20.00 | I2329: 36647 | J2329: 17
A2330: =ROW()-2 -> 2328 | B2330: TP | C2330: 4131 | D2330: 1 | E2330: 04131-8 | F2330: CSS & DHTML 网页制作特效与实例 | G2330: 杨正华等 | H2330: 32.00 | I2330: 36831 | J2330: 7
A2331: =ROW()-2 -> 2329 | B2331: TP | C2331: 4365 | D2331: 1 | E2331: 04365-5 | F2331: DHTML 使用与技巧――用DHTML开发动态网站 | G2331: 蒋骏 等 | H2331: 32.00 | I2331: 36982 | J2331: 8
A2332: =ROW()-2 -> 2330 | B2332: P- | C2332: 3545 | D2332: 1 | F2332: XHTML 高级应用――网页动画与特效 （配光盘） | G2332: 何东隆等 | H2332: 49 | I2332: 37135 | J2332: 5
A2333: =ROW()-2 -> 2331 | B2333: TP | C2333: 3914 | D2333: 1 | E2333: 03914-3 | F2333: 大师指点 Web 动画创意 | G2333: 何健辉等译 | H2333: 38 | I2333: 36678 | J2333: 7
A2334: =ROW()-2 -> 2332 | B2334: TP | C2334: 1005 | D2334: 1 | E2334: 01005-6 | F2334: Web 设计要素与名作欣赏（第2版） | G2334: 陈 武 译 | H2334: 43 | I2334: 36647 | J2334: 7
A2335: =ROW()-2 -> 2333 | B2335: P- | C2335: 2268 | D2335: 1 | F2335: Dreamweaver 2.0 梦幻网页（配光盘） | G2335: 郑志强等 | H2335: 89 | I2335: 36586 | J2335: 9
A2336: =ROW()-2 -> 2334 | B2336: P- | C2336: 2572 | D2336: 1 | F2336: Dreamweaver 3 筑梦王国（配光盘） | G2336: 吕志宏 | H2336: 78 | I2336: 36708 | J2336: 8
A2337: =ROW()-2 -> 2335 | B2337: P- | C2337: 2579 | D2337: 1 | F2337: Dreamweaver 3 网页设计宝典（配光盘） | G2337: 贰工数位设计 | H2337: 39 | I2337: 36800 | J2337: 9
A2338: =ROW()-2 -> 2336 | B2338: P- | C2338: 3552 | D2338: 1 | F2338: Dreamweaver 4 筑梦天堂（配光盘） | G2338: 吕志宏 | H2338: 34 | I2338: 37135 | J2338: 9
A2339: =ROW()-2 -> 2337 | B2339: TP | C2339: 4288 | D2339: 1 | E2339: 04288-8 | F2339: Dreamweaver 4 网页制作教程 | G2339: 白振刚等 | H2339: 32 | I2339: 36982 | J2339: 9
A2340: =ROW()-2 -> 2338 | B2340: TP | C2340: 4408 | D2340: 1 | E2340: 04408-2 | F2340: Dreamweaver 4 网页设计梦幻作坊 | G2340: 苏国彬 | H2340: 29 | I2340: 37073 | J2340: 9
A2341: =ROW()-2 -> 2339 | B2341: TP | C2341: 5025 | D2341: 1 | E2341: 05025-2 | F2341: Dreamweaver 4.0 动态网页制作精粹 | G2341: 高云峰等 | H2341: 39 | I2341: 37226 | J2341: 8
A2342: =ROW()-2 -> 2340 | B2342: TP | C2342: 4604 | D2342: 1 | E2342: 04604-2 | F2342: 全面掌握 Dreamweaver 4.0 可视化网页设计 | G2342: 甘登岱等 | H2342: 36 | I2342: 37469 | J2342: 7
A2343: =ROW()-2 -> 2341 | B2343: TP | C2343: 4513 | D2343: 1 | E2343: 04513-5 | F2343: Dreamweaver 4 Fireworks 4 Flash 5 网页设计梦幻组合 | G2343: 洪锦魁 | H2343: 55.00 | I2343: 37349 | J2343: 5
A2344: =ROW()-2 -> 2342 | B2344: TP | C2344: 4729 | D2344: 1 | E2344: 04729-4 | F2344: Dreamweaver 4 + Flash 5 + Fireworks 4 梦幻网站设计 | G2344: 覃艳馨等 | H2344: 43.8 | I2344: 37165 | J2344: 6
A2345: =ROW()-2 -> 2343 | B2345: TP | C2345: 4446 | D2345: 1 | E2345: 04446-5 | F2345: 实例精通丛书――Dreamweaver 4 精彩网页制作 | G2345: 田守瑞等 | H2345: 27 | I2345: 37073 | J2345: 8
A2346: =ROW()-2 -> 2344 | B2346: TP | C2346: 4584 | D2346: 1 | E2346: 04584-4 | F2346: Dreamweaver UltraDev 4 交互网站轻松做 | G2346: 张长军等 | H2346: 34 | I2346: 37135 | J2346: 7
A2347: =ROW()-2 -> 2345 | B2347: TP | C2347: 4868 | D2347: 1 | E2347: 04868-1 | F2347: Dreamweaver UltraDev 建站手册 | G2347: 战祥森 | H2347: 32 | I2347: 37196 | J2347: 8
A2348: =ROW()-2 -> 2346 | B2348: TP | C2348: 4280 | D2348: 1 | F2348: Dreamweaver UltraDev 4 培训教程 | H2348: 29 | I2348: 36951 | J2348: 8
A2349: =ROW()-2 -> 2347 | B2349: TP | C2349: 4432 | D2349: 1 | E2349: 04432-5 | F2349: Dreamweaver UltraDev 4 动态网页开发指南 | G2349: 李万红等 | H2349: 39 | I2349: 37043 | J2349: 7
A2350: =ROW()-2 -> 2348 | B2350: P- | C2350: 3569 | D2350: 1 | F2350: Dreamweaver UltraDev 4 动态数据库网站快速上手（配光盘） | G2350: 小正正 | H2350: 36 | I2350: 37104 | J2350: 13
A2351: =ROW()-2 -> 2349 | B2351: P- | C2351: 3591 | D2351: 1 | F2351: Dreamweaver UltraDev 4 技术大全（配光盘） | G2351: 郝启堂等译 | H2351: 75 | I2351: 37104 | J2351: 5
A2352: =ROW()-2 -> 2350 | B2352: TP | C2352: 3981 | D2352: 1 | E2352: 03981-X | F2352: 梦幻网页设计Dreamweaver 3.0 培训教程 | G2352: 高志兴 | H2352: 28 | I2352: 36708 | J2352: 8
A2353: =ROW()-2 -> 2351 | B2353: TP | C2353: 1225 | D2353: 1 | E2353: 01225-3 | F2353: 基于 Dreamweaver 3 的网站规划与建设 | G2353: 沈江天等 | H2353: 24 | I2353: 36861 | J2353: 10
A2354: =ROW()-2 -> 2352 | B2354: TP | C2354: 5126 | D2354: 1 | E2354: 05126-7 | F2354: Dreamweaver 4 的Web开发指南 | G2354: 刘小东等 | H2354: 36.00 | I2354: 37316 | J2354: 8
A2355: =ROW()-2 -> 2353 | B2355: TP | C2355: 4342 | D2355: 1 | E2355: 04342-6 | F2355: Photoshop 6.0 Dreamweaver 4.0 网页及动画制作 | G2355: 蒋俊峰等 | H2355: 30 | I2355: 37043 | J2355: 10
A2356: =ROW()-2 -> 2354 | B2356: TP | C2356: 4846 | D2356: 1 | E2356: 04846-0 | F2356: Photoshop 6 网页活点子――Image Ready 3.0 | G2356: 叶翊隆 | H2356: 30 | I2356: 37165 | J2356: 9
A2357: =ROW()-2 -> 2355 | B2357: P- | C2357: 3141 | D2357: 1 | F2357: Fireworks 4.0 完全成长手册 | G2357: 马存伟等 | H2357: 37 | I2357: 37012 | J2357: 9
A2358: =ROW()-2 -> 2356 | B2358: TP | C2358: 4481 | D2358: 1 | E2358: 04481-3 | F2358: Fireworks 4.0 网页制作彻底解析 | G2358: 赵健斌等 | H2358: 22 | I2358: 37012 | J2358: 12
A2359: =ROW()-2 -> 2357 | B2359: TP | C2359: 4485 | D2359: 1 | E2359: 04485-6 | F2359: Fireworks 4 精彩网页图象制作 | G2359: 李永清等 | H2359: 26 | I2359: 37104 | J2359: 8
A2360: =ROW()-2 -> 2358 | B2360: P- | C2360: 2567 | D2360: 1 | F2360: Fireworks 3 网页图形设计宝典（配光盘） | G2360: 上奇科技 | H2360: 39 | I2360: 36708 | J2360: 8
A2361: =ROW()-2 -> 2359 | B2361: TP | C2361: 5473 | D2361: 1 | E2361: 05473-1 | F2361: Flash 4 游戏设计宝典 | G2361: 康博 译 | H2361: 59.00 | I2361: 37408 | J2361: 5
A2362: =ROW()-2 -> 2360 | B2362: P- | C2362: 2500 | D2362: 1 | F2362: Flash 4 网页动画（配光盘） | G2362: 赵英杰 | H2362: 48 | I2362: 36647 | J2362: 8
A2363: =ROW()-2 -> 2361 | B2363: P- | C2363: 2297 | D2363: 1 | F2363: Flash 4 网页动画动画设计宝典（配光盘） | G2363: 廖御琪 | H2363: 98 | I2363: 36739 | J2363: 7
A2364: =ROW()-2 -> 2362 | B2364: P- | C2364: 3119 | D2364: 1 | F2364: Flash 5 动态网页e点通 （配光盘） | G2364: 朱志山 | H2364: 34.00 | I2364: 36951 | J2364: 8
A2365: =ROW()-2 -> 2363 | B2365: P- | C2365: 3139 | D2365: 1 | F2365: Flash 5 动态网页设计精粹（配光盘） | G2365: 陈怡杰 | H2365: 39 | I2365: 36982 | J2365: 9
A2366: =ROW()-2 -> 2364 | B2366: P- | C2366: 3160 | D2366: 1 | F2366: Flash 5.0 综合精彩实例（配光盘） | G2366: 潘正海等 | H2366: 35 | I2366: 37073 | J2366: 9
A2367: =ROW()-2 -> 2365 | B2367: P- | C2367: 3553 | D2367: 1 | F2367: Flash 5 魔幻密笈（配光盘） | G2367: 廖御琪 | H2367: 36 | I2367: 37135 | J2367: 9
A2368: =ROW()-2 -> 2366 | B2368: TP | C2368: 4255 | D2368: 1 | E2368: 04255-1 | F2368: Flash 5 网页设计自学通 | G2368: 杨洪涛 | H2368: 20 | I2368: 36951 | J2368: 11
A2369: =ROW()-2 -> 2367 | B2369: TP | C2369: 4897 | D2369: 1 | E2369: 04897-5 | F2369: Flash 实用编程指南 | G2369: 张璇 等 | H2369: 25 | I2369: 37135 | J2369: 10
A2370: =ROW()-2 -> 2368 | B2370: TP | C2370: 4558 | D2370: 1 | E2370: 04558-5 | F2370: 深入剖析 Flash 5 | G2370: 范承松等 | H2370: 39 | I2370: 37104 | J2370: 7
A2371: =ROW()-2 -> 2369 | B2371: P- | C2371: 3508 | D2371: 1 | F2371: Flash 5 网络游戏大观（配光盘） | G2371: 王大任等 | H2371: 38 | I2371: 37135 | J2371: 7
A2372: =ROW()-2 -> 2370 | B2372: P- | C2372: 3577 | D2372: 1 | F2372: 进阶 Flash 5 网络游戏（配光盘） | G2372: 位元文化 | H2372: 42 | I2372: 37196 | J2372: 6
A2373: =ROW()-2 -> 2371 | B2373: TP | C2373: 5376 | D2373: 1 | E2373: 05376-6 | F2373: 宽带风暴――视频点播与网络游戏 | G2373: 卢军等 | H2373: 30.00 | I2373: 37377 | J2373: 9
A2374: =ROW()-2 -> 2372 | B2374: TP | C2374: 5444 | D2374: 1 | E2374: 05444-4 | F2374: 说不尽的flash――flash动画设计实例 | G2374: 王且力 | H2374: 49.00 | I2374: 37469 | J2374: 11
A2375: =ROW()-2 -> 2373 | B2375: P- | C2375: 3199 | D2375: 1 | F2375: 动画奇兵 Flash 5 ――中高级实例详解 （配光盘） | G2375: 祁新 等 | H2375: 29 | I2375: 37073 | J2375: 9
A2376: =ROW()-2 -> 2374 | B2376: TP | C2376: 4784 | D2376: 1 | E2376: 04784-7 | F2376: Flash 5 外挂程序精粹 | G2376: 数位猫 | H2376: 30 | I2376: 37226 | J2376: 10
A2377: =ROW()-2 -> 2375 | B2377: TP | C2377: 4439 | D2377: 1 | E2377: 04439-2 | F2377: Macromedia 网页风暴培训教程 | G2377: 田守瑞 | H2377: 36 | I2377: 37073 | J2377: 7
A2378: =ROW()-2 -> 2376 | B2378: TP | C2378: 4428 | D2378: 1 | E2378: 04428-7 | F2378: Adobe GoLive 5.0 网页设计入门 | G2378: 杨涛 等 | H2378: 29 | I2378: 37073 | J2378: 9
A2379: =ROW()-2 -> 2377 | B2379: P- | C2379: 3195 | D2379: 1 | F2379: 完全 Adobe GoLive 5（配光盘） | G2379: 郑志强 | H2379: 36 | I2379: 37104 | J2379: 9
A2380: =ROW()-2 -> 2378 | B2380: TP | C2380: 1078 | D2380: 1 | E2380: 01078-1 | F2380: Active Server Pages (ASP) 网页制作指南 | G2380: 周中雨等 | H2380: 24 | I2380: 36739 | J2380: 10
A2381: =ROW()-2 -> 2379 | B2381: P- | C2381: 2237 | D2381: 1 | F2381: Actice Sever Pages 网应用大全（配光盘） | G2381: 廖信彦 | H2381: 65.00 | I2381: 36800 | J2381: 6
A2382: =ROW()-2 -> 2380 | B2382: TP | C2382: 1217 | D2382: 1 | E2382: 01217-2 | F2382: ASP 动态网站开发教程 | G2382: 廖彬山等 | H2382: 29.00 | I2382: 37469 | J2382: 9
A2383: =ROW()-2 -> 2381 | B2383: TP | C2383: 4794 | D2383: 1 | E2383: 04794-4 | F2383: ASP 网络编程技术 | G2383: 肖金秀 | H2383: 44 | I2383: 37196 | J2383: 6
A2384: =ROW()-2 -> 2382 | B2384: TP | C2384: 4889 | D2384: 1 | E2384: 04889-4 | F2384: 轻松学习――ASP 网络实用编程 | G2384: 冯能山等 | H2384: 25.00 | I2384: 37257 | J2384: 10
A2385: =ROW()-2 -> 2383 | B2385: TP | C2385: 4364 | D2385: 1 | E2385: 04364-7 | F2385: ASP编程技术与综合实例演练 | G2385: 蒙 新 | H2385: 26.00 | I2385: 37043 | J2385: 9
A2386: =ROW()-2 -> 2384 | B2386: TP | C2386: 4869 | D2386: 1 | E2386: 04869-X | F2386: ASP.NET 动态网页设计高手 | G2386: 东 名 | H2386: 38 | I2386: 37165 | J2386: 6
A2387: =ROW()-2 -> 2385 | B2387: TP | C2387: 5003 | D2387: 1 | E2387: 05003-1 | F2387: 亲密接触 ASP.Net （配软盘） | G2387: 杜 亮 | H2387: 39 | I2387: 2001.12 | J2387: 7
A2388: =ROW()-2 -> 2386 | B2388: TP | C2388: 5086 | D2388: 1 | E2388: 05086－4 | F2388: JSP快速高效开发利器－Dreamweaver UltraDev | G2388: 许增伟等 | H2388: 42.00 | I2388: 2002-1 | J2388: 6
A2389: =ROW()-2 -> 2387 | B2389: TP | C2389: 4951 | D2389: 1 | E2389: 04951-3 | F2389: JSP 技术揭密 | G2389: Decoder | H2389: 38 | I2389: 37196 | J2389: 8
A2390: =ROW()-2 -> 2388 | B2390: TP | C2390: 4840 | D2390: 1 | E2390: 04840-1 | F2390: JSP 实用编程实例集锦 | G2390: 马文刚等 | H2390: 27 | I2390: 37196 | J2390: 8
A2391: =ROW()-2 -> 2389 | B2391: TP | C2391: 4430 | D2391: 1 | E2391: 04430-9 | F2391: JSP 程序设计精彩实例 | G2391: 姜晓明等 | H2391: 28 | I2391: 37073 | J2391: 9
A2392: =ROW()-2 -> 2390 | B2392: P- | C2392: 3562 | D2392: 1 | F2392: JSP 应用程序开发指南 | G2392: 章明 等译 | H2392: 34 | I2392: 37073 | J2392: 10
A2393: =ROW()-2 -> 2391 | B2393: TP | C2393: 4336 | D2393: 1 | E2393: 04336-1 | F2393: 深入 JSP 网络编程 | G2393: 雨阳隆春等 | H2393: 52 | I2393: 37073 | J2393: 6
A2394: =ROW()-2 -> 2392 | B2394: P- | C2394: 3511 | D2394: 1 | F2394: JSP/Servlet ――基于 Java 的最新网站建设工具 （配光盘） | G2394: 王迪华等 | H2394: 42 | I2394: 37073 | J2394: 8
A2395: =ROW()-2 -> 2393 | B2395: P- | C2395: 3568 | D2395: 1 | F2395: PHP 4 交互式网页数据实战手册 | G2395: 数位文化 | H2395: 85 | I2395: 37165 | J2395: 4
A2396: =ROW()-2 -> 2394 | B2396: TP | C2396: 5001 | D2396: 1 | E2396: 05001-5 | F2396: PHP 4.0 入门与提高 | G2396: 吕京涛等 | H2396: 29 | I2396: 37469 | J2396: 9
A2397: =ROW()-2 -> 2395 | B2397: TP | C2397: 4497 | D2397: 1 | E2397: 04497-X | F2397: PHP & MySQL 网站建设宝典 | G2397: 黄经纬 | H2397: 21 | I2397: 37104 | J2397: 10
A2398: =ROW()-2 -> 2396 | B2398: P- | C2398: 3548 | D2398: 1 | F2398: PHP Web 数据库开发与实例（配光盘） | G2398: 木林森 | H2398: 34 | I2398: 37073 | J2398: 10
A2399: =ROW()-2 -> 2397 | B2399: TP | C2399: 5017 | D2399: 1 | E2399: 05017-1 | F2399: PHP4 应用开发指南 | G2399: 杨洪涛等译 | H2399: 62 | I2399: 37196 | J2399: 4
A2400: =ROW()-2 -> 2398 | B2400: P- | C2400: 3566 | D2400: 1 | F2400: 最新PHP 及 MySQL 进阶教程（配光盘） | G2400: 荣钦科技 | H2400: 38 | I2400: 37073 | J2400: 10
A2401: =ROW()-2 -> 2399 | B2401: TP- | C2401: 5344 | D2401: 1 | E2401: 05344-8 | F2401: PHP高级开发技术与应用 | G2401: 曹轶群等 | H2401: 32.00 | I2401: 37408 | J2401: 7
A2402: =ROW()-2 -> 2400 | B2402: TP | C2402: 4559 | D2402: 1 | E2402: 04559-3 | F2402: 企业网站建设解决方案（上篇）――基于 Windows 的网站建设 | G2402: 董小满等 | H2402: 39 | I2402: 37135 | J2402: 7
A2403: =ROW()-2 -> 2401 | B2403: TP | C2403: 4909 | D2403: 1 | E2403: 04909-2 | F2403: 企业网站建设解决方案（中篇）――跨平台的 PHP+MySQL | G2403: 罗明 等 | H2403: 32 | I2403: 37196 | J2403: 8
A2404: =ROW()-2 -> 2402 | B2404: TP | C2404: 5297 | D2404: 1 | E2404: 05297-1 | F2404: 企业网站建设解决方案（下篇）― 基于Linux的Apache+JSP+Oracle | G2404: 张金涛 | H2404: 29.00 | I2404: 37384 | J2404: 9
A2405: =ROW()-2 -> 2403 | B2405: TP | C2405: 4934 | D2405: 1 | E2405: 04934-3 | F2405: ASP 与 XML 高级编程 | G2405: 康博 译 | H2405: 78.00 | I2405: 36892 | J2405: 4
A2406: =ROW()-2 -> 2404 | B2406: P- | C2406: 3765 | D2406: 1 | F2406: XML 编程技术大全 | G2406: 康博 译 | H2406: 95.00 | I2406: 2002.1 | J2406: 4
A2407: =ROW()-2 -> 2405 | B2407: TP | C2407: 5812 | D2407: 1 | E2407: 05812-1 | F2407: XML 示例程序导学（第二版） | G2407: Benoit Marchal | H2407: 42.00 | I2407: 37469 | J2407: 7
A2408: =ROW()-2 -> 2406 | B2408: TP | C2408: 4158 | D2408: 1 | E2408: 04158-X | F2408: XML 实用进阶教程 | G2408: XML中国论坛 | H2408: 34 | I2408: 36982 | J2408: 8
A2409: =ROW()-2 -> 2407 | B2409: TP | C2409: 5649 | D2409: 1 | E2409: 5649 | F2409: 基于 XML的ASP.NET开发 | G2409: 王宝良译 | H2409: 42.00 | I2409: 37438 | J2409: 7
A2410: =ROW()-2 -> 2408 | B2410: TP | C2410: 4501 | D2410: 1 | E2410: 04501-1 | F2410: XML 新网页语言开发手册 | G2410: 黄中杰等 | H2410: 35 | I2410: 37043 | J2410: 8
A2411: =ROW()-2 -> 2409 | B2411: P- | C2411: 3528 | D2411: 1 | F2411: XML 揭秘――入门・应用・精通（配光盘） | G2411: 陆新年等译 | H2411: 69.5 | I2411: 37043 | J2411: 4
A2412: =ROW()-2 -> 2410 | B2412: P- | C2412: 3533 | D2412: 1 | F2412: XML & ASP 网页程序设计（配光盘） | G2412: 陈勤意等 | H2412: 42 | I2412: 37165 | J2412: 9
A2413: =ROW()-2 -> 2411 | B2413: TP | C2413: 5183 | D2413: 1 | E2413: 05183-6 | F2413: XML精要：语法详解与编辑指南（第二版） | G2413: 赵洪利等译 | H2413: 68.00 | I2413: 37377 | J2413: 4
A2414: =ROW()-2 -> 2412 | B2414: P- | C2414: 3556 | D2414: 1 | F2414: HTML 与 ASP 编程实务（配光盘） | G2414: 林信成等 | H2414: 38 | I2414: 37196 | J2414: 9
A2415: =ROW()-2 -> 2413 | B2415: P- | C2415: 3073 | D2415: 1 | F2415: HTML Web 页面制作教程（配光盘） | G2415: 宛延]等 | H2415: 108.00 | I2415: 36892 | J2415: 3
A2416: =ROW()-2 -> 2414 | B2416: TP- | C2416: 5290 | D2416: 1 | E2416: 05290-5 | F2416: HTML 参考大全（第三版） | G2416: 杨正华等译 | H2416: 92.00 | I2416: 37316 | J2416: 3
A2417: =ROW()-2 -> 2415 | B2417: P- | C2417: 3560 | D2417: 1 | F2417: 精通 XHTML（配光盘） | G2417: 萧世文 | H2417: 53 | I2417: 37104 | J2417: 6
A2418: =ROW()-2 -> 2416 | B2418: TP | C2418: 4406 | D2418: 1 | E2418: 04406-6 | F2418: XML 与 WML 整合应用 | G2418: 隆华软件 | H2418: 19.90 | I2418: 37012 | J2418: 13
A2419: =ROW()-2 -> 2417 | B2419: P- | C2419: 3524 | D2419: 1 | F2419: VRML 虚拟现实网页语言 （配光盘） | G2419: 严子翔 | H2419: 30 | I2419: 37104 | J2419: 10
A2420: =ROW()-2 -> 2418 | B2420: P- | C2420: 3147 | D2420: 1 | F2420: 纯手工打造――黄金网页（配光盘） | G2420: 数位文化 | H2420: 56.00 | I2420: 37012 | J2420: 6
A2421: =ROW()-2 -> 2419 | B2421: P- | C2421: 3148 | D2421: 1 | F2421: 精通 VBScript （配光盘） | G2421: 刘中宏等 | H2421: 58 | I2421: 37104 | J2421: 5
A2422: =ROW()-2 -> 2420 | B2422: P- | C2422: 3152 | D2422: 1 | F2422: JavaScript/VBScript 网页编程实例解析 （配光盘） | G2422: 武晓军等 | H2422: 30.00 | I2422: 36982 | J2422: 11
A2423: =ROW()-2 -> 2421 | B2423: TP | C2423: 4361 | D2423: 1 | E2423: 04361-2 | F2423: HotDog 6.x 网页设计宝典 | G2423: 马占魁等 | H2423: 26.00 | I2423: 36982 | J2423: 9
A2424: =ROW()-2 -> 2422 | B2424: TP | C2424: 4241 | D2424: 1 | E2424: 04241-1 | F2424: 网页编程入门与应用实例 | H2424: 29.00 | I2424: 36923 | J2424: 8
A2425: =ROW()-2 -> 2423 | B2425: P- | C2425: 3072 | D2425: 1 | F2425: 网页设计创意与精品赏析 | H2425: 50.00 | I2425: 36892 | J2425: 7
A2426: =ROW()-2 -> 2424 | B2426: TP | C2426: 4998 | D2426: 1 | E2426: 04998-X | F2426: Internet Information Server5.0/6.0配置与使用详解 | G2426: 刘晓辉 | H2426: 34.00 | I2426: 37316 | J2426: 8
A2427: =ROW()-2 -> 2425 | B2427: TP | C2427: 5232 | D2427: 1 | E2427: 05232-8 | F2427: eWAP无线世界――WML玩家通 | G2427: 千展发展中心 | H2427: 28.00 | I2427: 37347 | J2427: 10
A2428: =ROW()-2 -> 2426 | B2428: TP | C2428: 5181 | D2428: 1 | E2428: 05181-X | F2428: 用ASP.NET开发动态网站 | G2428: 张敏等 | H2428: 22.50 | I2428: 37316 | J2428: 12
A2429: =ROW()-2 -> 2427 | B2429: TP | C2429: 5152 | D2429: 1 | E2429: 05152-6 | F2429: ASP.NET与网站开发编程实战 | G2429: 陈湘 | H2429: 41.00 | I2429: 37288
A2430: =ROW()-2 -> 2428 | B2430: TP | C2430: 5148 | D2430: 1 | E2430: 05148-8 | F2430: PHP4网页编程实例解析 | G2430: 李辛铭 | H2430: 26.00 | I2430: 37316 | J2430: 10
A2431: =ROW()-2 -> 2429 | B2431: TP | C2431: 5463 | D2431: 1 | E2431: 05463-0 | F2431: Flash XML实用开发技术 | G2431: Lan Tindale等 | H2431: 38.00 | I2431: 37412 | J2431: 8
A2432: =ROW()-2 -> 2430 | B2432: TP | C2432: 5459 | D2432: 1 | E2432: 05459-2 | F2432: Windows/UNIX/Linux综合组网技术 | G2432: 黄永峰等 | H2432: 52.00 | I2432: 37438 | J2432: 5
F2433: 多媒体技术及应用
A2434: =ROW()-2 -> 2432 | B2434: TP | C2434: 3319 | D2434: 4 | E2434: 03319-6 | F2434: 多媒体计算机技术原理 | G2434: 马华东 | H2434: 18.00 | I2434: 37469 | J2434: 12
A2435: =ROW()-2 -> 2433 | B2435: P- | C2435: 3567 | D2435: 1 | F2435: 多媒体课件设计与实例剖析 | G2435: 孙江宏等 | H2435: 38.00 | I2435: 37257 | J2435: 9
A2436: =ROW()-2 -> 2434 | B2436: TP | C2436: 1150 | D2436: 1 | E2436: 01150-8 | F2436: 多媒体电脑升级与改装 | G2436: 葛宁轩 | H2436: 28.00 | I2436: 36739 | J2436: 10
A2437: =ROW()-2 -> 2435 | B2437: P- | C2437: 3074 | D2437: 1 | F2437: 多媒体课件制作实用教程（配光盘） | G2437: 刘振华等 | H2437: 37.00 | I2437: 37408 | J2437: 8
A2438: =ROW()-2 -> 2436 | B2438: TP | C2438: 1530 | D2438: 3 | E2438: 01530-9 | F2438: 多媒体电脑选购与组装 | G2438: 葛宁轩 | H2438: 28.00 | I2438: 36800 | J2438: 11
A2439: =ROW()-2 -> 2437 | B2439: P- | C2439: 2269 | D2439: 1 | F2439: 多媒体课件开发与方正奥应用（配光盘） | G2439: 刘剑平等 | H2439: 29.00 | I2439: 36526 | J2439: 14
A2440: =ROW()-2 -> 2438 | B2440: P- | C2440: 3054 | D2440: 1 | F2440: 多媒体演示─方法、技术与实例(配光盘) | G2440: 宋铁英 | H2440: 37.00 | I2440: 36892 | J2440: 9
A2441: =ROW()-2 -> 2439 | B2441: P- | C2441: 3142 | D2441: 1 | F2441: After Effects 4.1 视频大飓风 （配光盘） | G2441: 马存伟 | H2441: 46.00 | I2441: 36982 | J2441: 7
A2442: =ROW()-2 -> 2440 | B2442: P- | C2442: 3118 | D2442: 1 | F2442: After Effects 4.x 使用指南 （配光盘） | G2442: 谢正武等 | H2442: 35.00 | I2442: 36982 | J2442: 10
A2443: =ROW()-2 -> 2441 | B2443: P- | C2443: 2573 | D2443: 1 | F2443: Director 8 多媒体设计宝典（配光盘） | G2443: 曾安德 | H2443: 39.80 | I2443: 36770 | J2443: 10
A2444: =ROW()-2 -> 2442 | B2444: P- | C2444: 3156 | D2444: 1 | F2444: 最新 Director 8 进阶教程 （配光盘） | G2444: 荣钦科技 | H2444: 48.00 | I2444: 36982 | J2444: 7
A2445: =ROW()-2 -> 2443 | B2445: TP | C2445: 2326 | D2445: 1 | E2445: 02326-3 | F2445: Action 3.0 for Window 使用手册 | G2445: 曾安德 | H2445: 23.00 | I2445: 1997 | J2445: 13
A2446: =ROW()-2 -> 2444 | B2446: P- | C2446: 2299 | D2446: 1 | F2446: Authorware Attain 多媒体大师（配光盘） | G2446: 上奇科技 | H2446: 43.00 | I2446: 36678 | J2446: 13
A2447: =ROW()-2 -> 2445 | B2447: TP | C2447: 4702 | D2447: 1 | E2447: 04702-2 | F2447: Authorware 5.2 实例演练 | G2447: 谭干森 | H2447: 26.00 | I2447: 37288 | J2447: 10
A2448: =ROW()-2 -> 2446 | B2448: TP | C2448: 1295 | D2448: 1 | E2448: 01295-4 | F2448: Authorware 与多媒体编程 | G2448: 朱诗兵等 | H2448: 26.00 | I2448: 36951 | J2448: 11
A2449: =ROW()-2 -> 2447 | B2449: TP | C2449: 5250 | D2449: 1 | E2449: 05250-6 | F2449: Authorware 6.0网上多媒体课件制作 | G2449: 周苏明等 | H2449: 25.00 | I2449: 37347 | J2449: 11
A2450: =ROW()-2 -> 2448 | B2450: TP | C2450: 5214 | D2450: 1 | E2450: 05214-X | F2450: Authorware 6培训教程 | G2450: 石明贵 | H2450: 29.00 | I2450: 37438 | J2450: 9
A2451: =ROW()-2 -> 2449 | B2451: TP | C2451: 5337 | D2451: 1 | E2451: 05337-5 | F2451: Python技术参考大全 | G2451: Martin C.Brown | H2451: 54.00 | I2451: 37377 | J2451: 6
A2452: =ROW()-2 -> 2450 | B2452: TP | C2452: 5370 | D2452: 1 | E2452: 05370-7 | F2452: 电脑音乐梦工厂 | G2452: 王锐 | H2452: 40.00 | I2452: 37377 | J2452: 6
A2453: =ROW()-2 -> 2451 | B2453: P- | C2453: 4320 | D2453: 1 | E2453: 7900643206 | F2453: 多媒体CAI课件制作实例教程 | G2453: 方其桂 | H2453: 46.00 | I2453: 37469 | J2453: 7
A2454: =ROW()-2 -> 2452 | B2454: TP | C2454: 5778 | D2454: 1 | E2454: 05778-8 | F2454: Flash MX动画乐园 | G2454: 翟志强 | H2454: 30.00 | I2454: 37500 | J2454: 10
A2455: =ROW()-2 -> 2453 | B2455: TP | C2455: 5718 | D2455: 1 | E2455: 05718-4 | F2455: Flash 动画与卡通制作创意导航 | G2455: [美]Lbis Fernamdez | H2455: 39.00 | I2455: 37500
E2456: 图形、图像处理及计算机辅助设计
A2457: =ROW()-2 -> 2455 | B2457: TP | C2457: 4886 | D2457: 1 | E2457: 04886-X | F2457: Solid Works 2001 中文版实用技术精粹 | G2457: 邢启恩等 | H2457: 32 | I2457: 37226 | J2457: 9
A2458: =ROW()-2 -> 2456 | B2458: TP | C2458: 4967 | D2458: 1 | E2458: 04967-X | F2458: Solid Edge V9 中文版三维设计与工程实践 | G2458: 孟磊 等 | H2458: 29 | I2458: 37226 | J2458: 9
A2459: =ROW()-2 -> 2457 | B2459: TP | C2459: 4551 | D2459: 1 | E2459: 04551-8 | F2459: 数字化平面设计实用教程 | G2459: 吴延雄 | H2459: 48 | I2459: 37104 | J2459: 5
A2460: =ROW()-2 -> 2458 | B2460: TP | C2460: 4318 | D2460: 1 | E2460: 04318-3 | F2460: 人工鱼――计算机动画的人工生命方法 （配光盘） | G2460: 涂晓媛 | H2460: 25.00 | I2460: 36982 | J2460: 15
A2461: =ROW()-2 -> 2459 | B2461: TP | C2461: 4330 | D2461: 1 | E2461: 04330-2 | F2461: 建筑计算机绘图入门与进阶实战教程 | G2461: 陈明 等 | H2461: 32.00 | I2461: 37012 | J2461: 10
A2462: =ROW()-2 -> 2460 | B2462: P- | C2462: 3736 | D2462: 1 | F2462: 电脑美术全接触（配光盘） | G2462: 火神动漫网 | H2462: 30 | I2462: 37226 | J2462: 11
A2463: =ROW()-2 -> 2461 | B2463: TP | C2463: 5410 | D2463: 1 | E2463: 05410-X | F2463: MATLAB6.x图像处理 | G2463: 孙兆林 | H2463: 30.00 | I2463: 37469 | J2463: 9
A2464: =ROW()-2 -> 2462 | B2464: TP | C2464: 1176 | D2464: 2 | E2464: 01176-1 | F2464: 计算机图象处理 | G2464: 容观澳 | H2464: 26.00 | I2464: 36831 | J2464: 9
A2465: =ROW()-2 -> 2463 | B2465: P- | C2465: 2258 | D2465: 1 | F2465: 我行我速 2.0 电脑艺术卡片设计(配光盘) | G2465: 李四达 | H2465: 66.00 | I2465: 36526 | J2465: 10
A2466: =ROW()-2 -> 2464 | B2466: TP | C2466: 4947 | D2466: 1 | E2466: 04947-5 | F2466: 建立个人数码相馆 | G2466: 高林 等 | H2466: 20 | I2466: 37226 | J2466: 11
A2467: =ROW()-2 -> 2465 | B2467: TP | C2467: 5058 | D2467: 1 | E2467: 05058-9 | F2467: 数码相机使用与影像处理快速攻略 | G2467: 许书明等 | H2467: 28.00 | I2467: 37257 | J2467: 13
A2468: =ROW()-2 -> 2466 | B2468: TP | C2468: 3451 | D2468: 1 | E2468: 03451-6 | F2468: 印前图象处理高级指导 扫描.校色.特技 | G2468: 邬国明 | H2468: 98.00 | I2468: 1999 | J2468: 7
A2469: =ROW()-2 -> 2467 | B2469: TP | C2469: 3406 | D2469: 2 | E2469: 03406-0 | F2469: 电脑建筑画创作技术与实例精选 (配光盘) | G2469: 方可 等 | H2469: 48.00 | I2469: 36465 | J2469: 9
A2470: =ROW()-2 -> 2468 | B2470: P- | C2470: 2509 | D2470: 1 | F2470: 室内设计与精品赏析（配光盘） | G2470: 郑 曙 | H2470: 39.00 | I2470: 36708 | J2470: 15
A2471: =ROW()-2 -> 2469 | B2471: P- | C2471: 3161 | D2471: 1 | F2471: 电脑室内外效果图创意制作大全 （配光盘） | G2471: 邓红梅等 | H2471: 65.00 | I2471: 36982 | J2471: 5
A2472: =ROW()-2 -> 2470 | B2472: P- | C2472: 4178 | D2472: 1 | F2472: 电脑室内装修设计教程―双实例十一讲 | G2472: 曾冬梅等 | H2472: 28.00 | I2472: 37377 | J2472: 10
A2473: =ROW()-2 -> 2471 | B2473: TP | C2473: 3842 | D2473: 1 | E2473: 03842-2 | F2473: 急救 ―― 平面设计实用手册 | G2473: 杨宝忠等 | H2473: 98.00 | I2473: 36495 | J2473: 7
A2474: =ROW()-2 -> 2472 | B2474: TP | C2474: 4587 | D2474: 1 | E2474: 04587-9 | F2474: Mastercam 8.X 实用培训教程 | G2474: 王睿 等 | H2474: 36 | I2474: 37469 | J2474: 7
A2475: =ROW()-2 -> 2473 | B2475: P- | C2475: 2226 | D2475: 1 | F2475: 用 3DS MAX 3.0 和 Photoshop 5.0 画建筑表现图（配光盘） | G2475: 吴嘉明等 | H2475: 48.00 | I2475: 36678 | J2475: 8
A2476: =ROW()-2 -> 2474 | B2476: P- | C2476: 4166 | D2476: 1 | F2476: 3D Studio VIZ R3 100问室内设计渲染秘籍大公开100问（配光盘） | G2476: 李展铭等 | H2476: 26.00 | I2476: 37377 | J2476: 11
A2477: =ROW()-2 -> 2475 | B2477: TP | C2477: 3902 | D2477: 1 | E2477: 03902-X | F2477: 现代 CAD 技术 | G2477: 童秉枢 | H2477: 19.00 | I2477: 36708 | J2477: 13
A2478: =ROW()-2 -> 2476 | B2478: P- | C2478: 3752 | D2478: 1 | F2478: AutoCAD 高级教程（配光盘） | G2478: 宋振会 | H2478: 64 | I2478: 37226 | J2478: 5
A2479: =ROW()-2 -> 2477 | B2479: TP | C2479: 5277 | D2479: 1 | E2479: 05277-1 | F2479: AutoCAD 2000/2002 辅助设计培训教程 | G2479: 李香敏主编 | H2479: 29.00 | I2479: 37408 | J2479: 8
A2480: =ROW()-2 -> 2478 | B2480: TP | C2480: 3482 | D2480: 2 | E2480: 03482-6 | F2480: AutoCAD 2000 中文版使用大全 | G2480: 康博创作室 | H2480: 59.80 | I2480: 36892 | J2480: 4
A2481: =ROW()-2 -> 2479 | B2481: TP | C2481: 3723 | D2481: 2 | E2481: 03723-X | F2481: AutoCAD 2000 中文版新功能 | G2481: 康博创作室 | H2481: 19.00 | I2481: 36586 | J2481: 12
A2482: =ROW()-2 -> 2480 | B2482: TP | C2482: 3781 | D2482: 2 | E2482: 03781-7 | F2482: 精通 AutoCAD 2000 中文版 | G2482: 郭玲文等 | H2482: 49.00 | I2482: 37469 | J2482: 6
A2483: =ROW()-2 -> 2481 | B2483: TP | C2483: 1039 | D2483: 2 | E2483: 01039-0 | F2483: AutoCAD 2000 三维建模技巧与范例 | G2483: 谭荣伟 | H2483: 30.00 | I2483: 36647 | J2483: 8
A2484: =ROW()-2 -> 2482 | B2484: TP | C2484: 1401 | D2484: 1 | E2484: 01401-9 | F2484: AutoCAD 2000 三维技术精粹 | G2484: 颜国忠等 | H2484: 39.00 | I2484: 36982 | J2484: 7
A2485: =ROW()-2 -> 2483 | B2485: P- | C2485: 3725 | D2485: 1 | F2485: AutoCAD 2000 中文版实用教程（配光盘） | G2485: 蔡希林 | H2485: 32.00 | I2485: 37362 | J2485: 8
A2486: =ROW()-2 -> 2484 | B2486: TP | C2486: 4790 | D2486: 1 | E2486: 04790-1 | F2486: 实现网络三维互动――Cult3D 应用指南 | G2486: 苏威洲等 | H2486: 30 | I2486: 37165 | J2486: 8
A2487: =ROW()-2 -> 2485 | B2487: P- | C2487: 3121 | D2487: 1 | E2487: 7900631216 | F2487: AutoCAD 2000 实体模拟与三维渲染 （配光盘） | G2487: 何冬隆等 | H2487: 59.00 | I2487: 36982 | J2487: 5
A2488: =ROW()-2 -> 2486 | B2488: TP | C2488: 0784 | D2488: 1 | E2488: 00784-5 | F2488: AutoCAD 2000 机械设计指南 | G2488: 齐舒创作室 | H2488: 42.00 | I2488: 36861 | J2488: 7
A2489: =ROW()-2 -> 2487 | B2489: TP | C2489: 1129 | D2489: 1 | E2489: 01129-X | F2489: 中文 AutoCAD 2000 创意实例（机械篇） | G2489: 黎广生等 | H2489: 34.00 | I2489: 36647 | J2489: 9
A2490: =ROW()-2 -> 2488 | B2490: TP | C2490: 3877 | D2490: 1 | E2490: 03877-5 | F2490: 中文 AutoCAD 2000 创意实例（建筑篇） | G2490: 李增民等 | H2490: 36.00 | I2490: 36982 | J2490: 8
A2491: =ROW()-2 -> 2489 | B2491: TP | C2491: 4162 | D2491: 1 | E2491: 04162-8 | F2491: AutoCAD 2000i 中文版实用教程 | G2491: 杨鹏起等 | H2491: 37.00 | I2491: 36982 | J2491: 7
A2492: =ROW()-2 -> 2490 | B2492: P- | C2492: 3146 | D2492: 1 | F2492: AutoCAD 2000i 中文版建筑实例与技巧 （配光盘） | G2492: 朱涛 等 | H2492: 38.00 | I2492: 37257 | J2492: 8
A2493: =ROW()-2 -> 2491 | B2493: TP | C2493: 4641 | D2493: 1 | E2493: 04641-7 | F2493: AutoCAD 2002 使用与精通 | G2493: 宋勇 等 | H2493: 63.00 | I2493: 37344 | J2493: 4
A2494: =ROW()-2 -> 2492 | B2494: TP | C2494: 4887 | D2494: 1 | E2494: 04887-8 | F2494: 中文版 AutoCAD 2002 实用大全 | G2494: 高强 等 | H2494: 45.00 | I2494: 37369 | J2494: 6
A2495: =ROW()-2 -> 2493 | B2495: TP | C2495: 4128 | D2495: 1 | E2495: 04128-8 | F2495: 中文AutoCAD 2000i 使用大全 | G2495: 黎广生 | H2495: 66.00 | I2495: 36892 | J2495: 4
A2496: =ROW()-2 -> 2494 | B2496: TP | C2496: 4835 | D2496: 1 | E2496: 04835-5 | F2496: 手把手教你学用中文版 AutoCAD 2002 | G2496: 王毅 等 | H2496: 33.00 | I2496: 37288 | J2496: 9
A2497: =ROW()-2 -> 2495 | B2497: TP | C2497: 3010 | D2497: 2 | E2497: 03010-3 | F2497: AutoCAD 建筑工程设计绘图 | G2497: 唐 海 | H2497: 29.60 | I2497: 1998 | J2497: 7
A2498: =ROW()-2 -> 2496 | B2498: TP | C2498: 4390 | D2498: 1 | E2498: 04390-6 | F2498: AutoCAD 2000 建筑与室内设计应用 | G2498: 薛希浩 | H2498: 15.00 | I2498: 37104 | J2498: 17
A2499: =ROW()-2 -> 2497 | B2499: TP | C2499: 4866 | D2499: 1 | E2499: 04866-5 | F2499: UG/CAD 工程设计基础教程（上册） | G2499: 孙江宏等 | H2499: 38.00 | I2499: 37327 | J2499: 7
A2500: =ROW()-2 -> 2498 | B2500: TP | C2500: 4888 | D2500: 1 | E2500: 04888-6 | F2500: UG/CAD 工程设计基础教程（下册） | G2500: 孙江宏等 | H2500: 32.00 | I2500: 37333 | J2500: 8
A2501: =ROW()-2 -> 2499 | B2501: P- | C2501: 4192 | D2501: 1 | E2501: 7900641920 | F2501: UG范例教程（配光盘） | G2501: 黄贵东等 | H2501: 48.00 | I2501: 37469 | J2501: 6
A2502: =ROW()-2 -> 2500 | B2502: TP | C2502: 5124 | D2502: 1 | E2502: 05124-0 | F2502: Unigraphics 18版CAD应用基础 | G2502: 莫蓉 | H2502: 48.00 | I2502: 37377 | J2502: 5
A2503: =ROW()-2 -> 2501 | B2503: P- | C2503: 2516 | D2503: 1 | F2503: After Effects 4.0 影像处理宝典（配光盘） | G2503: 张世昌等 | H2503: 98.00 | I2503: 36647 | J2503: 8
A2504: =ROW()-2 -> 2502 | B2504: P- | C2504: 3043 | D2504: 1 | F2504: MediaStudio Pro 6.0 影音传奇 （配光盘） | G2504: 郑正权 | H2504: 42.00 | I2504: 36982 | J2504: 9
A2505: =ROW()-2 -> 2503 | B2505: P- | C2505: 3735 | D2505: 1 | F2505: Premiere 6.0 高级视频编辑技术与实战指南 （配光盘） | G2505: 王 琦 | H2505: 30.00 | I2505: 37356 | J2505: 10
A2506: =ROW()-2 -> 2504 | B2506: P- | C2506: 3004 | D2506: 1 | F2506: Premiere 5.x 视频处理使用指南（配光盘） | G2506: 李阳 等 | H2506: 39.00 | I2506: 36831 | J2506: 9
A2507: =ROW()-2 -> 2505 | B2507: TP | C2507: 4184 | D2507: 1 | E2507: 04184-9 | F2507: Adobe Premiere 5.x 实例教程 | G2507: 胡晓冰等 | H2507: 40.00 | I2507: 36982 | J2507: 6
A2508: =ROW()-2 -> 2506 | B2508: TP | C2508: 4645 | D2508: 1 | E2508: 04645-X | F2508: Visio 工程图表制作实例导学 | G2508: 甘登岱等 | H2508: 28 | I2508: 37135 | J2508: 10
A2509: =ROW()-2 -> 2507 | B2509: TP | C2509: 5399 | D2509: 1 | E2509: 05399-5 | F2509: FreeHand 10 创意设计精彩实例 | G2509: 李晓鲁 | H2509: 24.00 | I2509: 37408 | J2509: 10
A2510: =ROW()-2 -> 2508 | B2510: P- | C2510: 2530 | D2510: 1 | F2510: FreeHand 中文版绘图宝典（配光盘） | G2510: 叶宝文 | H2510: 58.00 | I2510: 36708 | J2510: 7
A2511: =ROW()-2 -> 2509 | B2511: TP | C2511: 4877 | D2511: 1 | E2511: 04877-0 | F2511: FreeHand 10 实用培训教程 | G2511: 崔洪斌等 | H2511: 32 | I2511: 37469 | J2511: 9
A2512: =ROW()-2 -> 2510 | B2512: TP | C2512: 4944 | D2512: 1 | E2512: 04944-0 | F2512: FreeHand 10 平面设计与网页制作 | G2512: 张璇 等 | H2512: 24 | I2512: 37196 | J2512: 11
A2513: =ROW()-2 -> 2511 | B2513: TP | C2513: 4920 | D2513: 1 | E2513: 04920-3 | F2513: FreeHand 10 发烧友 | G2513: 东海 等 | H2513: 23 | I2513: 37196 | J2513: 11
A2514: =ROW()-2 -> 2512 | B2514: TP | C2514: 4788 | D2514: 1 | E2514: 04788-X | F2514: LiveMotion 速学速用 | G2514: 赵文博等 | H2514: 20 | I2514: 37165 | J2514: 13
A2515: =ROW()-2 -> 2513 | B2515: P- | C2515: 2526 | D2515: 1 | F2515: 工业设计电脑表现技法 | G2515: 牛凯工作室 | H2515: 30.00 | I2515: 36708 | J2515: 12
A2516: =ROW()-2 -> 2514 | B2516: TP | C2516: 2085 | D2516: 4 | E2516: 02085-X | F2516: C语言绘图教程 | G2516: 陆润民 | H2516: 16.00 | I2516: 36708 | J2516: 12
A2517: =ROW()-2 -> 2515 | B2517: TP | C2517: 3523 | D2517: 2 | E2517: 03523-7 | F2517: 数字图象处理编程入门 ―― 做一个自己的 Photoshop | G2517: 吕凤军 | H2517: 24.00 | I2517: 36495 | J2517: 13
A2518: =ROW()-2 -> 2516 | B2518: TP | C2518: 2194 | D2518: 5 | E2518: 02194-5 | F2518: 控制系统计算机辅助设计―― MATLAB 语言及应用 | G2518: 薛定宇 | H2518: 28.00 | I2518: 37316 | J2518: 8
A2519: =ROW()-2 -> 2517 | B2519: P- | C2519: 2288 | D2519: 1 | F2519: Photoshop 文字效果创意与设计(配光盘) | G2519: 方彩欣 | H2519: 108.00 | I2519: 36617 | J2519: 7
A2520: =ROW()-2 -> 2518 | B2520: P- | C2520: 2501 | D2520: 1 | F2520: Photoshop 锦囊妙计（配光盘） | G2520: 谢建勋译 | H2520: 76.00 | I2520: 36708 | J2520: 11
A2521: =ROW()-2 -> 2519 | B2521: TP | C2521: 3790 | D2521: 2 | E2521: 03790-6 | F2521: Photoshop 平面设计 | G2521: 张 舜 | H2521: 30.00 | I2521: 36982 | J2521: 10
A2522: =ROW()-2 -> 2520 | B2522: P- | C2522: 2514 | D2522: 1 | F2522: Photoshop 绝招100（配光盘） | G2522: 李乃雄 | H2522: 98.00 | I2522: 36647 | J2522: 9
A2523: =ROW()-2 -> 2521 | B2523: P- | C2523: 2512 | D2523: 1 | F2523: Photoshop 创意无限（第2版） | G2523: 孙晓东译 | H2523: 116.00 | I2523: 36647 | J2523: 7
A2524: =ROW()-2 -> 2522 | B2524: TP | C2524: 3368 | D2524: 2 | E2524: 03368-4 | F2524: Photoshop 5 完全使用手册 (配软盘） | G2524: 张文 等 | H2524: 45.00 | I2524: 36526 | J2524: 7
A2525: =ROW()-2 -> 2523 | B2525: TP | C2525: 3682 | D2525: 2 | E2525: 03682-9 | F2525: Photoshop 5.0 中文版实务经典 | G2525: 若扬其等 | H2525: 38.00 | I2525: 36434 | J2525: 7
A2526: =ROW()-2 -> 2524 | B2526: TP | C2526: 4829 | D2526: 1 | E2526: 04829-0 | F2526: Photoshop 6.0 中文版电视讲座教程 | G2526: 雷 波 | H2526: 45.00 | I2526: 37333 | J2526: 6
A2527: =ROW()-2 -> 2525 | B2527: TP | C2527: 4610 | D2527: 2 | E2527: 04610-7 | F2527: 中文版 Photoshop 6.X 实用培训教程 | G2527: 张林娣等 | H2527: 30.00 | I2527: 37326 | J2527: 9
A2528: =ROW()-2 -> 2526 | B2528: TP | C2528: 4985 | D2528: 1 | E2528: 04985-8 | F2528: 全面接触 Photoshop 6.0 中文版 | G2528: 王军 等 | H2528: 35.00 | I2528: 37326 | J2528: 8
A2529: =ROW()-2 -> 2527 | B2529: TP | C2529: 4498 | D2529: 1 | E2529: 04498-8 | F2529: 精通 Photoshop 6.0 | G2529: 张雪峰等 | H2529: 36.00 | I2529: 37135 | J2529: 8
A2530: =ROW()-2 -> 2528 | B2530: TP | C2530: 4515 | D2530: 1 | E2530: 04515-1 | F2530: 战胜 Potoshop 6.0 必做练习 60 题 | G2530: 汪 端 | H2530: 33.00 | I2530: 37369 | J2530: 6
A2531: =ROW()-2 -> 2529 | B2531: TP | C2531: 4429 | D2531: 1 | E2531: 04429-5 | F2531: “画”说 Photoshop 6.0 | G2531: 郭 勐 | H2531: 24.00 | I2531: 37257 | J2531: 10
A2532: =ROW()-2 -> 2530 | B2532: TP | C2532: 4885 | D2532: 1 | E2532: 04885-1 | F2532: 图像处理大师――Photoshop | G2532: 张璇 等 | H2532: 29.00 | I2532: 37330 | J2532: 9
A2533: =ROW()-2 -> 2531 | B2533: TP | C2533: 1395 | D2533: 2 | E2533: 01395-0 | F2533: Photoshop 6.0 设计师手册 | G2533: 王 谦 | H2533: 59.80 | I2533: 37073 | J2533: 5
A2534: =ROW()-2 -> 2532 | B2534: P- | C2534: 2533 | D2534: 1 | F2534: Photoshop 6.0 图象设计宝典 | G2534: 陈思聪等 | H2534: 56 | I2534: 37073 | J2534: 6
A2535: =ROW()-2 -> 2533 | B2535: TP | C2535: 1232 | D2535: 1 | E2535: 01232-6 | F2535: Photoshop 6.0 影像设计培训教程 | G2535: 朱旋 等 | H2535: 39.80 | I2535: 37012 | J2535: 7
A2536: =ROW()-2 -> 2534 | B2536: TP | C2536: 3748 | D2536: 1 | E2536: 03748-5 | F2536: Photoshop 6.0影像密码 | G2536: 游闵州 | H2536: 49.00 | I2536: 37316 | J2536: 7
A2537: =ROW()-2 -> 2535 | B2537: P- | C2537: 3107 | D2537: 1 | F2537: Photoshop 6.0 创意实例（配光盘） | G2537: 康博创作室 | H2537: 38.00 | I2537: 36951 | J2537: 8
A2538: =ROW()-2 -> 2536 | B2538: TP | C2538: 4779 | D2538: 1 | E2538: 04779-0 | F2538: 中文版Photoshop 6.0 创意技法实例 | G2538: 翟志强等 | H2538: 32.00 | I2538: 37349 | J2538: 9
A2539: =ROW()-2 -> 2537 | B2539: TP | C2539: 4833 | D2539: 1 | E2539: 04833-9 | F2539: 深入解析 Photoshop 6.X 中文版 | G2539: 龚飞伟 | H2539: 32.00 | I2539: 37364 | J2539: 8
A2540: =ROW()-2 -> 2538 | B2540: TP | C2540: 4195 | D2540: 1 | E2540: 04195-4 | F2540: 动画与图象处理大师――Photoshop 6.0 教程与实例 | G2540: 刘金喜等 | H2540: 39.00 | I2540: 36982 | J2540: 7
A2541: =ROW()-2 -> 2539 | B2541: TP | C2541: 4301 | D2541: 1 | E2541: 04301-9 | F2541: Photoshop 6.0 梦幻王国 | G2541: 陈燕凌等 | H2541: 32.00 | I2541: 37104 | J2541: 8
A2542: =ROW()-2 -> 2540 | B2542: P- | C2542: 3163 | D2542: 1 | F2542: Photoshop 6.0 综合精彩实例（配光盘） | G2542: 杨林 等 | H2542: 38.00 | I2542: 37104 | J2542: 9
A2543: =ROW()-2 -> 2541 | B2543: TP | C2543: 4722 | D2543: 1 | E2543: 04722-7 | F2543: 精通 Photoshop 6 中文版完全手册 | G2543: 何茜 等 | H2543: 37 | I2543: 37104 | J2543: 7
A2544: =ROW()-2 -> 2542 | B2544: TP | C2544: 4691 | D2544: 1 | E2544: 04691-3 | F2544: 图象处理新概念――Photoshop 6.0 CorelDRAW 10 与 PHOTO-PAINT 10 综合实例诠释 | G2544: 张治文等 | H2544: 38 | I2544: 37135 | J2544: 7
A2545: =ROW()-2 -> 2543 | B2545: TP | C2545: 4832 | D2545: 1 | E2545: 04832-0 | F2545: 中文 Photoshop 6.0 与 ImageReady 3.0 经典教程与实例 | G2545: 赵健斌等 | H2545: 42 | I2545: 37165 | J2545: 7
A2546: =ROW()-2 -> 2544 | B2546: P- | C2546: 3781 | D2546: 1 | F2546: Photoshop 外挂滤镜完全攻略（配光盘） | G2546: 孙文姬等 | H2546: 88.00 | I2546: 37257 | J2546: 7
A2547: =ROW()-2 -> 2545 | B2547: P- | C2547: 2513 | D2547: 1 | F2547: Photoshop/Painter 创意与设计梦幻组合 （配光盘） | G2547: 萧淑慧等 | H2547: 108.00 | I2547: 36678 | J2547: 10
A2548: =ROW()-2 -> 2546 | B2548: P- | C2548: 2564 | D2548: 1 | F2548: Painter 6 图象设计宝典（配光盘） | G2548: 陈春辉 | H2548: 76.00 | I2548: 36739 | J2548: 8
A2549: =ROW()-2 -> 2547 | B2549: TP | C2549: 4440 | D2549: 1 | E2549: 04440-6 | F2549: Painter 6.0 实例教程 | G2549: 金晓明等 | H2549: 29 | I2549: 37073 | J2549: 9
A2550: =ROW()-2 -> 2548 | B2550: P- | C2550: 3155 | D2550: 1 | F2550: Painter 6.0 梦幻王国 （配光盘） | G2550: 薛书琴等 | H2550: 35.00 | I2550: 36982 | J2550: 9
A2551: =ROW()-2 -> 2549 | B2551: TP | C2551: 3700 | D2551: 1 | E2551: 03700-0 | F2551: 图像处理大师 Paint Shop Pro 5.0 从入门到精通 | H2551: 29.00 | I2551: 36434 | J2551: 11
A2552: =ROW()-2 -> 2550 | B2552: P- | C2552: 2545 | D2552: 1 | F2552: After Efects 从入门到精通（配光盘） | G2552: 萧湘工作室 | H2552: 49.00 | I2552: 36831 | J2552: 6
A2553: =ROW()-2 -> 2551 | B2553: TP | C2553: 1194 | D2553: 1 | E2553: 01194-X | F2553: Photoshop 5.5 & ImageReady2.0操作与应用 | G2553: 张文 等 | H2553: 39.00 | I2553: 36586 | J2553: 7
A2554: =ROW()-2 -> 2552 | B2554: TP | C2554: 3274 | D2554: 1 | E2554: 03274-2 | F2554: 文字特效设计宝典 | G2554: 柴永茂 | H2554: 36.00 | I2554: 1999 | J2554: 12
A2555: =ROW()-2 -> 2553 | B2555: TP | C2555: 4254 | D2555: 1 | E2555: 04254-3 | F2555: Pro/ENGINEER 2000i 入门 | G2555: 苏厚合等 | H2555: 34.00 | I2555: 36951 | J2555: 8
A2556: =ROW()-2 -> 2554 | B2556: P- | C2556: 3164 | D2556: 1 | F2556: Pro/ENGINEER 2000i 进阶教程 | G2556: 张沛颀等 | H2556: 42.00 | I2556: 36982 | J2556: 8
A2557: =ROW()-2 -> 2555 | B2557: P- | C2557: 3590 | D2557: 1 | F2557: Pro/ENGINEER 2000i 基础设计教程(配光盘) | G2557: 孙江宏等 | H2557: 52.00 | I2557: 37316 | J2557: 5
A2558: =ROW()-2 -> 2556 | B2558: TP | C2558: 4987 | D2558: 1 | E2558: 04987-4 | F2558: Pro/ENGINEER 2000i 高级功能应用及二次开发 | G2558: 孙江宏等 | H2558: 30.00 | I2558: 37404 | J2558: 9
A2559: =ROW()-2 -> 2557 | B2559: P- | C2559: 3760 | D2559: 1 | F2559: Pro/ENGINEER 2001 工业造型设计（配光盘） | G2559: 柳迎春等 | H2559: 39.00 | I2559: 37257 | J2559: 9
A2560: =ROW()-2 -> 2558 | B2560: TP- | C2560: 5216 | D2560: 1 | F2560: Pro/ENGINEER 2000i/i2 与三维模型设计 | G2560: 甘登岱等 | H2560: 34.00 | I2560: 37469 | J2560: 8
A2561: =ROW()-2 -> 2559 | B2561: P- | C2561: 4126 | D2561: 1 | F2561: Pro/ENGINEER 数控加工（基础篇）（配光盘） | G2561: 赵德永等 | H2561: 31.00 | I2561: 37347 | J2561: 12
A2562: =ROW()-2 -> 2560 | B2562: P- | C2562: 3136 | D2562: 1 | E2562: 05336-7 | F2562: Pro/ENGINEER 2000i 数控铣床加工自动编程技术 | G2562: 戴向国等 | H2562: 25.00 | I2562: 37408 | J2562: 12
A2563: =ROW()-2 -> 2561 | B2563: P- | C2563: 3061 | D2563: 1 | F2563: 图像艺术设计与实现（配光盘） | G2563: 陈杰明 | H2563: 37.00 | I2563: 36831 | J2563: 9
A2564: =ROW()-2 -> 2562 | B2564: TP | C2564: 3092 | D2564: 1 | E2564: 03092-8 | F2564: 细说风云――图象扫描与编修 | G2564: 牛 凯 | H2564: 168.00 | I2564: 1998 | J2564: 9
A2565: =ROW()-2 -> 2563 | B2565: TP | C2565: 1547 | D2565: 2 | E2565: 01547-3 | F2565: 扫描与半色调处理（第2版） | G2565: 潘文林等译 | H2565: 39.00 | I2565: 36770 | J2565: 8
A2566: =ROW()-2 -> 2564 | B2566: P- | C2566: 2285 | D2566: 1 | F2566: Adobe Illustrator 8.0 中创意与设计无限 （配光盘） | G2566: 陈杰民 | H2566: 98.00 | I2566: 36586 | J2566: 8
A2567: =ROW()-2 -> 2565 | B2567: TP | C2567: 3594 | D2567: 1 | E2567: 03594-6 | F2567: CorelDRAW 8 中文版完全使用手册 | G2567: 张文 等 | H2567: 45.00 | I2567: 36342 | J2567: 6
A2568: =ROW()-2 -> 2566 | B2568: TP | C2568: 3892 | D2568: 1 | E2568: 03892-9 | F2568: CorelDRAW 9 中文版专家指南 | G2568: 李阳 等 | H2568: 38.80 | I2568: 36739 | J2568: 8
A2569: =ROW()-2 -> 2567 | B2569: P- | C2569: 2546 | D2569: 1 | F2569: CorelDRAW 9 实战创意与分析（配光盘） | G2569: 张璇 等 | H2569: 38.00 | I2569: 36831 | J2569: 8
A2570: =ROW()-2 -> 2568 | B2570: TP | C2570: 4290 | D2570: 1 | E2570: 04290-X | F2570: CorelDRAW 9.0 基础 案例 技巧 创意 | G2570: 田守瑞等 | H2570: 29.00 | I2570: 37288 | J2570: 8
A2571: =ROW()-2 -> 2569 | B2571: P- | C2571: 2511 | D2571: 1 | F2571: CorelDRAW 9 中文版绘图设计宝典（配光盘） | G2571: 陈思聪等 | H2571: 52.00 | I2571: 37043 | J2571: 6
A2572: =ROW()-2 -> 2570 | B2572: P- | C2572: 2291 | D2572: 1 | F2572: CorelDRAW 9 创意实例（配光盘） | G2572: 康博创作室 | H2572: 39.00 | I2572: 36708 | J2572: 9
A2573: =ROW()-2 -> 2571 | B2573: P- | C2573: 2517 | F2573: CorelDRAW 9 中文版绘图手册（配光盘） | G2573: 徐凯玲 | H2573: 58.00 | I2573: 36708 | J2573: 6
A2574: =ROW()-2 -> 2572 | B2574: TP | C2574: 0751 | D2574: 1 | E2574: 00751-9 | F2574: CorelDRAW 9 中文版初中级教程 | G2574: 东箭工作室 | H2574: 37.00 | I2574: 37377 | J2574: 7
A2575: =ROW()-2 -> 2573 | B2575: TP | C2575: 3826 | D2575: 2 | E2575: 03826-0 | F2575: 精通 CorelDRAW 9 | G2575: 张文 等 | H2575: 43.00 | I2575: 36465 | J2575: 6
A2576: =ROW()-2 -> 2574 | B2576: P- | C2576: 3547 | D2576: 1 | F2576: CorelDRAW 10 企业标识、产品包装和广告设计（配光盘） | G2576: 张璇 等 | H2576: 35.00 | I2576: 37073 | J2576: 11
A2577: =ROW()-2 -> 2575 | B2577: TP | C2577: 4489 | D2577: 1 | E2577: 04489-9 | F2577: CorelDRAW 10 绘图实用宝典（上）――基础篇 | G2577: 陈浩 等 | H2577: 26.00 | I2577: 37043 | J2577: 10
A2578: =ROW()-2 -> 2576 | B2578: P- | C2578: 3154 | D2578: 1 | F2578: CorelDRAW 10 绘图实用宝典（下）――创意篇（配光盘） | G2578: 陈浩 等 | H2578: 35 | I2578: 37073 | J2578: 9
A2579: =ROW()-2 -> 2577 | B2579: P- | C2579: 3509 | D2579: 1 | F2579: CorelDRAW 10 平面设计精粹（配光盘） | G2579: 张璇 等 | H2579: 32 | I2579: 37073 | J2579: 10
A2580: =ROW()-2 -> 2578 | B2580: P- | C2580: 3544 | D2580: 1 | F2580: Maya 角色动画技术（配光盘） | G2580: 陈跃琴等译 | H2580: 49.00 | I2580: 37043 | J2580: 7
A2581: =ROW()-2 -> 2579 | B2581: TP | C2581: 4148 | D2581: 1 | E2581: 04148-2 | F2581: Maya 3 实例教程 | G2581: 巨泽建等 | H2581: 32.00 | I2581: 36982 | J2581: 8
A2582: =ROW()-2 -> 2580 | B2582: P- | C2582: 2534 | D2582: 1 | F2582: Maya 3.0动画（配光盘） | G2582: 苑利维等 | H2582: 48.00 | I2582: 36739 | J2582: 6
A2583: =ROW()-2 -> 2581 | B2583: TP | C2583: 1071 | D2583: 1 | E2583: 01071-4 | F2583: Maya 2.5 使用手册 | G2583: 姚文龙等 | H2583: 34.60 | I2583: 36708 | J2583: 8
A2584: =ROW()-2 -> 2582 | B2584: P- | C2584: 3051 | D2584: 1 | F2584: Maya 2.5/3.0 建模技巧与范例（配光盘） | G2584: 姚文龙等 | H2584: 40.00 | I2584: 36831 | J2584: 9
A2585: =ROW()-2 -> 2583 | B2585: P- | C2585: 3543 | D2585: 1 | F2585: Maya 3.0 精品实例创作（上篇）（配光盘） | G2585: 张毅卓等 | H2585: 34 | I2585: 37073 | J2585: 9
A2586: =ROW()-2 -> 2584 | B2586: P- | C2586: 3731 | D2586: 1 | F2586: Maya 3.0 精品实例创作（下篇）（配光盘） | G2586: 岳夏 等 | H2586: 28 | I2586: 37196 | J2586: 11
A2587: =ROW()-2 -> 2585 | B2587: P- | C2587: 2552 | D2587: 1 | F2587: Maya 特效（配光盘） | G2587: 苑利维等 | H2587: 48.00 | I2587: 36739 | J2587: 6
A2588: =ROW()-2 -> 2586 | B2588: P- | C2588: 2535 | D2588: 1 | F2588: Maya 3.0造型（配光盘） | G2588: 苑利维等 | H2588: 48.00 | I2588: 36739 | J2588: 5
A2589: =ROW()-2 -> 2587 | B2589: TP- | C2589: 5156 | D2589: 1 | E2589: 05156-9 | F2589: Maya4 动画特效制作 | G2589: 翟志强 | H2589: 28.00 | I2589: 37288 | J2589: 11
A2590: =ROW()-2 -> 2588 | B2590: TP | C2590: 4380 | D2590: 1 | E2590: 04380-9 | F2590: SoftImage 3D 全攻略 | G2590: 黄云 等 | H2590: 51.00 | I2590: 37012 | J2590: 6
A2591: =ROW()-2 -> 2589 | B2591: P- | C2591: 4189 | D2591: 1 | E2591: 04189-1 | F2591: 3DS MAX 4.2 效果图制作与实用线架大全（配光盘） | G2591: 朱仁成等 | H2591: 49.00 | I2591: 37438 | J2591: 7
A2592: =ROW()-2 -> 2590 | B2592: P- | C2592: 4341 | D2592: 1 | E2592: 7900643419 | F2592: MAYA 4 3D动画总动员（含光盘） | G2592: 微粒工作室 | H2592: 36.00 | I2592: 37500 | J2592: 8
A2593: =ROW()-2 -> 2591 | B2593: P- | C2593: 3530 | D2593: 1 | F2593: 神秘园――3DS MAX 4.0 创意新能量 | G2593: 周 锦 | H2593: 58 | I2593: 37135 | J2593: 10
A2594: =ROW()-2 -> 2592 | B2594: TP | C2594: 4535 | D2594: 1 | E2594: 04535-6 | F2594: 3DS MAX 4.0 例解 | G2594: 吴绍炜等 | H2594: 29.00 | I2594: 37333 | J2594: 8
A2595: =ROW()-2 -> 2593 | B2595: P- | C2595: 3769 | D2595: 1 | F2595: 3ds max 4 横空出世（配2张光盘） | G2595: 陈邦本等 | H2595: 48 | I2595: 37226 | J2595: 7
A2596: =ROW()-2 -> 2594 | B2596: TP | C2596: 5032 | D2596: 1 | E2596: 05032-5 | F2596: 3ds max 4.x 实用速查手册 | G2596: 陈世红等 | H2596: 30.00 | I2596: 37469 | J2596: 10
A2597: =ROW()-2 -> 2595 | B2597: P- | C2597: 3551 | D2597: 1 | F2597: 3DS MAX 4.0 高级造型技巧与实用产品设计（配光盘） | G2597: 宋雪岩 | H2597: 29 | I2597: 37073 | J2597: 12
A2598: =ROW()-2 -> 2596 | B2598: P- | C2598: 3534 | D2598: 1 | F2598: 3D Studio MAX R4 三维建模与动画实战攻略（配光盘） | G2598: 吴海滨等 | H2598: 34 | I2598: 37073 | J2598: 9
A2599: =ROW()-2 -> 2597 | B2599: TP | C2599: 4287 | D2599: 1 | E2599: 04287-X | F2599: 3D Studio MAX R4 实用培训教程 | G2599: 李东升等 | H2599: 35.00 | I2599: 36982 | J2599: 9
A2600: =ROW()-2 -> 2598 | B2600: TP | C2600: 4482 | D2600: 1 | E2600: 04482-1 | F2600: 3D Studio MAX R4 技术精粹 | G2600: 龚正伟 | H2600: 30 | I2600: 37073 | J2600: 10
A2601: =ROW()-2 -> 2599 | B2601: P- | C2601: 3535 | D2601: 1 | F2601: 3D Studio MAX R4 人体与生物建模宝典 （配光盘） | G2601: 赵 建 | H2601: 35 | I2601: 37104 | J2601: 10
A2602: =ROW()-2 -> 2600 | B2602: P- | C2602: 3189 | D2602: 1 | F2602: 3D Studio MAX R4 建筑与环境效果制作宝典（配光盘） | G2602: 翟志强 | H2602: 35.00 | I2602: 37012 | J2602: 10
A2603: =ROW()-2 -> 2601 | B2603: TP | C2603: 4867 | D2603: 1 | E2603: 04867-3 | F2603: 3D Studio MAX 4.0 + Photoshop6.0 建筑装潢 设计 | G2603: 张国权等 | H2603: 36.00 | I2603: 37326 | J2603: 8
A2604: =ROW()-2 -> 2602 | B2604: TP | C2604: 4928 | D2604: 1 | E2604: 04928-9 | F2604: 3D Studio VIZ 3i 建筑效果设计宝典 | G2604: 赵 健 | H2604: 24 | I2604: 37196 | J2604: 11
A2605: =ROW()-2 -> 2603 | B2605: P- | C2605: 3521 | D2605: 1 | F2605: 3DS VIZ R3 超完美空间设计（配光盘） | G2605: 卢师德 | H2605: 49.00 | I2605: 37012 | J2605: 6
A2606: =ROW()-2 -> 2604 | B2606: P- | C2606: 2248 | D2606: 1 | F2606: 3D STUDIO MAX R3 动画设计宝典(配光盘） | G2606: 徐之洋等 | H2606: 116.00 | I2606: 36770 | J2606: 6
A2607: =ROW()-2 -> 2605 | B2607: TP | C2607: 1233 | D2607: 1 | E2607: 01233-4 | F2607: 3D Studio MAX R3 基础教程 ―― 建模篇 | G2607: 马 放 | H2607: 26.00 | I2607: 36708 | J2607: 10
A2608: =ROW()-2 -> 2606 | B2608: P- | C2608: 2576 | D2608: 1 | F2608: 3D Studio MAX R3 创意实例（配光盘） | G2608: 刘继良等 | H2608: 46.80 | I2608: 36739 | J2608: 7
A2609: =ROW()-2 -> 2607 | B2609: P- | C2609: 2531 | D2609: 1 | F2609: 3D Studio MAX R3 三维动画设计实例 （配光盘） | G2609: 孙全党等 | H2609: 36.00 | I2609: 36831 | J2609: 9
A2610: =ROW()-2 -> 2608 | B2610: P- | C2610: 1750 | D2610: 1 | F2610: 3D Studio MAX 实例通（配光盘） | G2610: 游易霖 | H2610: 39.8 | I2610: 36861 | J2610: 8
A2611: =ROW()-2 -> 2609 | B2611: P- | C2611: 2252 | D2611: 1 | F2611: 3D Studio MAX 动画创意与设计无限完全进化论（配光盘） | G2611: V.N.Club | H2611: 126 | I2611: 36617 | J2611: 7
A2612: =ROW()-2 -> 2610 | B2612: P- | C2612: 2247 | D2612: 1 | F2612: 3D Studio MAX 动画创意与设计无限超级进化论（配光盘） | G2612: V.N.Club | H2612: 130 | I2612: 36617 | J2612: 7
A2613: =ROW()-2 -> 2611 | B2613: P- | C2613: 2561 | D2613: 1 | F2613: 3D Studio MAX 3.0 影视广告与片头设计 | G2613: 李阳 等 | H2613: 46 | I2613: 36739 | J2613: 8
A2614: =ROW()-2 -> 2612 | B2614: P- | C2614: 2542 | D2614: 1 | F2614: 3D Studio MAX 3.0 专家指南（配光盘） | G2614: 陆水 等 | H2614: 42 | I2614: 36739 | J2614: 7
A2615: =ROW()-2 -> 2613 | B2615: P- | C2615: 3007 | D2615: 1 | F2615: 3D Studio MAX 3.0 建模技巧与范例 （配光盘） | G2615: 杨蔚 等 | H2615: 45 | I2615: 36800 | J2615: 7
A2616: =ROW()-2 -> 2614 | B2616: TP | C2616: 1461 | D2616: 1 | E2616: 01461-2 | F2616: 3D Studio MAX 动画设计操作与实例 | G2616: 甘登岱等 | H2616: 39 | I2616: 36770 | J2616: 7
A2617: =ROW()-2 -> 2615 | B2617: P- | C2617: 2298 | D2617: 1 | F2617: 3D Studio MAX 建筑与装饰设计(配光盘) | G2617: 张璐 等 | H2617: 39.8 | I2617: 36617 | J2617: 11
A2618: =ROW()-2 -> 2616 | B2618: P- | C2618: 2290 | D2618: 1 | F2618: 3DS MAX 3.0 和 Photoshop 5.0 建筑装潢与室内设计（配光盘） | G2618: 吴嘉明等 | H2618: 42 | I2618: 36647 | J2618: 8
A2619: =ROW()-2 -> 2617 | B2619: P- | C2619: 2249 | D2619: 1 | F2619: 3D Studio MAX R3 动画超能量(配光盘) | G2619: 郑正权 | H2619: 68 | I2619: 36526 | J2619: 6
A2620: =ROW()-2 -> 2618 | B2620: TP | C2620: 4690 | D2620: 1 | E2620: 04690-5 | F2620: 3D Studio Viz R3i 实用培训教程 | G2620: 王庆军等 | H2620: 36 | I2620: 37104 | J2620: 8
A2621: =ROW()-2 -> 2619 | B2621: TP | C2621: 1289 | D2621: 1 | E2621: 01289-X | F2621: Rhino 造型专家 | G2621: 黄云 等 | H2621: 32 | I2621: 36923 | J2621: 6
A2622: =ROW()-2 -> 2620 | B2622: TP | C2622: 604 | D2622: 1 | E2622: 00604-0 | F2622: 电脑服装样板设计 | G2622: 张兆璞 | H2622: 20 | I2622: 36892 | J2622: 16
A2623: =ROW()-2 -> 2621 | B2623: P- | C2623: 3039 | D2623: 1 | F2623: Illustrator 绘图宝典 | G2623: 叶 翊 | H2623: 46.00 | I2623: 36982 | J2623: 7
A2624: =ROW()-2 -> 2622 | B2624: P- | C2624: 2577 | D2624: 1 | F2624: OpenGL 三维动画程序设计（配光盘） | G2624: 杨武功等 | H2624: 29.00 | I2624: 36770 | J2624: 14
A2625: =ROW()-2 -> 2623 | B2625: TP | C2625: 5068 | D2625: 1 | E2625: 05068-6 | F2625: MPEG-2运动图像压缩编码国际标准及MPEG的新进展 | G2625: 钟玉琢等 | H2625: 35 | I2625: 37438 | J2625: 8
A2626: =ROW()-2 -> 2624 | B2626: TP | C2626: 5151 | D2626: 1 | E2626: 05151-8 | F2626: 设计大师AutoCAD2002高级使用篇 | G2626: 孙海林 | H2626: 32 | I2626: 37347 | J2626: 8
A2627: =ROW()-2 -> 2625 | B2627: TP | C2627: 5441 | D2627: 1 | E2627: 05441-X | F2627: Autodesk VIZ 4 经典设计集粹 | G2627: 翟志强 | H2627: 30 | I2627: 37377 | J2627: 10
A2628: =ROW()-2 -> 2626 | B2628: P- | C2628: 4147 | D2628: 1 | F2628: Rhino3D 2.0 实用设计（配光盘） | G2628: 黄少刚等 | H2628: 38 | I2628: 37378 | J2628: 9
A2629: =ROW()-2 -> 2627 | B2629: TP | C2629: 5390 | D2629: 1 | E2629: 05390-1 | F2629: Lightwave 3D角色建模 | G2629: JJ N2M3 | H2629: 24 | I2629: 37378 | J2629: 10
A2630: =ROW()-2 -> 2628 | B2630: P- | C2630: 4327 | D2630: 1 | E2630: 7900643273 | F2630: photoshop 7.0图像艺术设计实例教程(含光盘) | G2630: 郭万军 | H2630: 36 | I2630: 37469 | J2630: 9
A2631: =ROW()-2 -> 2629 | B2631: TP | C2631: 5661 | D2631: 1 | E2631: 05661-7 | F2631: photoshop 7.0全方位突破 | G2631: 龚正伟等 | H2631: 30 | I2631: 37469 | J2631: 10
F2632: 人 工 智 能
A2633: =ROW()-2 -> 2631 | B2633: TP | C2633: 2962 | D2633: 2 | E2633: 02962- | F2633: 神经网络与模糊控制 | G2633: 张乃尧等 | H2633: 19.50 | I2633: 36861 | J2633: 10
A2634: =ROW()-2 -> 2632 | B2634: TP | C2634: 1307 | D2634: 7 | E2634: 01307-1 | F2634: 人工智能原理 | G2634: 石纯一等 | H2634: 15.00 | I2634: 37319 | J2634: 15
A2635: =ROW()-2 -> 2633 | B2635: TP | C2635: 2127 | D2635: 5 | E2635: 02127-9 | F2635: 人工智能及其应用(第2版) | G2635: 蔡自兴等 | H2635: 32.50 | I2635: 37438 | J2635: 6
A2636: =ROW()-2 -> 2634 | B2636: TP | C2636: 3879 | D2636: 1 | E2636: 03879-1 | F2636: 智能卡应用系统 | G2636: 黄淼云等 | H2636: 20.00 | I2636: 36770 | J2636: 13
A2637: =ROW()-2 -> 2635 | B2637: TP | C2637: 3971 | D2637: 1 | E2637: 03971-2 | F2637: 智能卡技术―― IC 卡（第二版） | G2637: 王爱英 | H2637: 29.00 | I2637: 37073 | J2637: 8
A2638: =ROW()-2 -> 2636 | B2638: TP | C2638: 2431 | D2638: 2 | E2638: 02431-6 | F2638: 智能控制理论与技术 | G2638: 孙增圻 | H2638: 32.00 | I2638: 37337 | J2638: 7
F2639: 软件技术与软件工程
A2640: =ROW()-2 -> 2638 | B2640: TP | C2640: 2799 | D2640: 9 | E2640: 02799-4 | F2640: 软件工程导论(第3版) | G2640: 张海藩 | H2640: 24.00 | I2640: 2002.8 | J2640: 8
A2641: =ROW()-2 -> 2639 | B2641: TP | C2641: 2709 | D2641: 1 | E2641: 02709-9 | F2641: 计算机软件著作权保护 | G2641: 寿 步 | H2641: 23.80 | I2641: 1997 | J2641: 8
A2642: =ROW()-2 -> 2640 | B2642: TP | C2642: 2726 | D2642: 1 | E2642: 02726-9 | F2642: Win95 & Internet 文件压缩与防毒 | G2642: 许世英 | H2642: 20.00 | I2642: 1997 | J2642: 15
A2643: =ROW()-2 -> 2641 | B2643: TP | C2643: 3811 | D2643: 1 | E2643: 03811-2 | F2643: 软件能力成熟度模型 | G2643: 何新贵等 | H2643: 28.00 | I2643: 36982 | J2643: 12
A2644: =ROW()-2 -> 2642 | B2644: P- | C2644: 4145 | D2644: 1 | F2644: VB问答式教程（配光盘） | G2644: 庞一鸣 | H2644: 39.00 | I2644: 37347 | J2644: 7
A2645: =ROW()-2 -> 2643 | B2645: P- | C2645: 5707 | D2645: 1 | E2645: 05707-9 | F2645: 集成化系统开发的技术基础 | G2645: 萧蕴诗等 | H2645: 29.00 | I2645: 37500 | J2645: 10
F2646: 办公自动化及字表处理
A2647: =ROW()-2 -> 2645 | B2647: TP | C2647: 4861 | D2647: 1 | E2647: 04861-4 | F2647: 中文 Office XP 实用教程 | G2647: 王冬 等 | H2647: 29.80 | I2647: 37327 | J2647: 8
A2648: =ROW()-2 -> 2646 | B2648: TP | C2648: 5230 | D2648: 1 | E2648: 05230-1 | F2648: Microsoft office XP新体验 | G2648: 王仲麒 | H2648: 17.00 | I2648: 37377 | J2648: 14
A2649: =ROW()-2 -> 2647 | B2649: TP | C2649: 4864 | D2649: 1 | E2649: 04864-9 | F2649: 精通 Office XP 中文版 | G2649: 甘登岱等 | H2649: 36.00 | I2649: 37288 | J2649: 7
A2650: =ROW()-2 -> 2648 | B2650: TP | C2650: 4854 | D2650: 1 | E2650: 04854-1 | F2650: Office XP 中文版入门与进阶 | G2650: 刘兴亮等 | H2650: 31.50 | I2650: 37374 | J2650: 10
A2651: =ROW()-2 -> 2649 | B2651: TP | C2651: 4903 | D2651: 1 | E2651: 04903-3 | F2651: 中文版 Windows XP 实用培训教程 | G2651: 许书明 | H2651: 28.00 | I2651: 37373 | J2651: 9
A2652: =ROW()-2 -> 2650 | B2652: TP | C2652: 5394 | D2652: 1 | E2652: 05394-1 | F2652: Exchange 2000 sever应用程序开发指南 | G2652: 唐明湘等 | H2652: 26 | I2652: 37438 | J2652: 9
A2653: =ROW()-2 -> 2651 | B2653: TP | C2653: 4919 | D2653: 1 | E2653: 04919-X | F2653: Exchange 2000 应用程序开发经典 | G2653: 贾建平译 | H2653: 39.00 | I2653: 37196 | J2653: 7
A2654: =ROW()-2 -> 2652 | B2654: TP | C2654: 4495 | D2654: 1 | E2654: 04495-3 | F2654: Word 2002 中文版实用培训教程 | G2654: 许书明等 | H2654: 28.00 | I2654: 37257 | J2654: 9
A2655: =ROW()-2 -> 2653 | B2655: TP | C2655: 4825 | D2655: 1 | E2655: 04825-8 | F2655: 中文 Word 2002 培训教程 | G2655: 王诚君 | H2655: 25.00 | I2655: 37135 | J2655: 9
A2656: =ROW()-2 -> 2654 | B2656: TP | C2656: 4855 | D2656: 2 | E2656: 04855-X | F2656: 中文 Word 2002 简明教程 | G2656: 罗运模等 | H2656: 32.00 | I2656: 37372 | J2656: 10
A2657: =ROW()-2 -> 2655 | B2657: TP | C2657: 4950 | D2657: 1 | E2657: 04950-5 | F2657: 中文 Excel 2002 及其在财务管理和投资分析中的应用 | G2657: 罗运模等 | H2657: 29.00 | I2657: 37336 | J2657: 10
A2658: =ROW()-2 -> 2656 | B2658: TP | C2658: 3378 | D2658: 2 | E2658: 03378-1 | F2658: Excel 在财务管理中的应用 | G2658: 侯国屏等编 | H2658: 18.00 | I2658: 37257 | J2658: 12
A2659: =ROW()-2 -> 2657 | B2659: TP | C2659: 4781 | D2659: 1 | E2659: 04781-2 | F2659: 网上办公一册通――中文版Word 2002、Excel 2002、FrontPage 2002 | G2659: 袁建华等 | H2659: 45.00 | I2659: 37135 | J2659: 6
A2660: =ROW()-2 -> 2658 | B2660: TP | C2660: 4957 | D2660: 1 | E2660: 04957-2 | F2660: 中文 Office XP 培训教程 | G2660: 王诚君 | H2660: 28 | I2660: 37165 | J2660: 8
A2661: =ROW()-2 -> 2659 | B2661: TP | C2661: 4834 | D2661: 1 | E2661: 04834-7 | F2661: WPS Office 上网办公一册通 | G2661: 王毅 等 | H2661: 28 | I2661: 37165 | J2661: 9
A2662: =ROW()-2 -> 2660 | B2662: TP | C2662: 4968 | D2662: 1 | E2662: 04968-8 | F2662: WPS Office 简明教程 | G2662: 罗运模等 | H2662: 32.5 | I2662: 37196 | J2662: 8
A2663: =ROW()-2 -> 2661 | B2663: TP | C2663: 4419 | D2663: 1 | F2663: 学电脑不求人（Windows98、Word2000、Excel2000 快易通教程） | H2663: 18.00 | I2663: 37012 | J2663: 11
A2664: =ROW()-2 -> 2662 | B2664: TP | C2664: 0823 | D2664: 1 | E2664: 00823-X | F2664: Acrobat 4.0 中文版应用教程 | G2664: 方满洲等 | H2664: 29.00 | I2664: 36770 | J2664: 9
A2665: =ROW()-2 -> 2663 | B2665: TP | C2665: 3785 | D2665: 1 | E2665: 03785-X | F2665: 图文双解 Office 2000 应用大全 | G2665: 尹锵等译 | H2665: 62.00 | I2665: 36526 | J2665: 5
A2666: =ROW()-2 -> 2664 | B2666: TP | C2666: 0778 | D2666: 1 | E2666: 00778-0 | F2666: 中文 Access 问题与技巧精解 | G2666: 叶 彬 | H2666: 28.00 | I2666: 36739 | J2666: 9
A2667: =ROW()-2 -> 2665 | B2667: TP | C2667: 4780 | D2667: 1 | E2667: 04780-4 | F2667: 精通中文版 Access 2002 数据库开发与应用 | G2667: 梁书斌等 | H2667: 49 | I2667: 37135 | J2667: 6
A2668: =ROW()-2 -> 2666 | B2668: TP | C2668: 4264 | D2668: 1 | E2668: 04264-0 | F2668: 中文 Access 2000 培训教程 | G2668: 王诚君 | H2668: 22.00 | I2668: 36951 | J2668: 9
A2669: =ROW()-2 -> 2667 | B2669: TP | C2669: 4431 | D2669: 1 | E2669: 04431-7 | F2669: 用 Access 2000 和 VisualFoxPro 6.0 管理公司和个人数据 | G2669: 肖勇波等 | H2669: 29.00 | I2669: 37043 | J2669: 9
A2670: =ROW()-2 -> 2668 | B2670: TP | C2670: 1001 | D2670: 1 | E2670: 01001-3 | F2670: 精通 Office 2000 | G2670: 甘登岱等 | H2670: 49.00 | I2670: 37330 | J2670: 5
A2671: =ROW()-2 -> 2669 | B2671: TP | C2671: 3766 | D2671: 2 | E2671: 03766-3 | F2671: Office 2000 中文版使用与技巧 | G2671: 高越明等 | H2671: 36.00 | I2671: 36800 | J2671: 8
A2672: =ROW()-2 -> 2670 | B2672: TP | C2672: 3624 | D2672: 1 | E2672: 03624-1 | F2672: Word 2000 中文版使用与技巧 | G2672: 木林森等 | H2672: 22.00 | I2672: 36557 | J2672: 13
A2673: =ROW()-2 -> 2671 | B2673: TP | C2673: 3765 | D2673: 2 | E2673: 03765-5 | F2673: Excel 2000 中文版使用与技巧 | G2673: 木林森等 | H2673: 20.00 | I2673: 36526 | J2673: 13
A2674: =ROW()-2 -> 2672 | B2674: TP | C2674: 2074 | D2674: 2 | E2674: 02074-4 | F2674: PowerPoint 2000 中文版使用与技巧 | G2674: 付新丽等 | H2674: 25.00 | I2674: 36526 | J2674: 11
A2675: =ROW()-2 -> 2673 | B2675: TP | C2675: 3780 | D2675: 1 | E2675: 03780-9 | F2675: PhotoDraw 2000 中文版使用与技巧 | G2675: 黄正力等 | H2675: 29.00 | I2675: 36495 | J2675: 10
A2676: =ROW()-2 -> 2674 | B2676: P- | C2676: 4316 | D2676: 1 | E2676: 04316-1 | F2676: 会计信息系统实验教程（配光盘） | G2676: 王新玲汪刚主编 | H2676: 28.80 | I2676: 37438 | J2676: 10
A2677: =ROW()-2 -> 2675 | B2677: TP | C2677: 1227 | D2677: 3 | E2677: 01227-X | F2677: 电子表格化财务、会计与管理 | G2677: 王啸 等 | H2677: 36.00 | I2677: 37104 | J2677: 8
A2678: =ROW()-2 -> 2676 | B2678: TP | C2678: 4537 | D2678: 1 | E2678: 04537-2 | F2678: Excel 2002 中文版实用培训教程 | G2678: 韩伟峰等 | H2678: 32 | I2678: 37073 | J2678: 9
A2679: =ROW()-2 -> 2677 | B2679: TP | C2679: 3595 | D2679: 2 | E2679: 03595-4 | F2679: Word 2000 命令与实例 | G2679: 赖晓凌 | H2679: 28.50 | I2679: 36404 | J2679: 9
A2680: =ROW()-2 -> 2678 | B2680: TP | C2680: 3541 | D2680: 1 | E2680: 03541-5 | F2680: Excel 2000 命令与实例 | G2680: 曾 毅 | H2680: 28.50 | I2680: 36312 | J2680: 9
A2681: =ROW()-2 -> 2679 | B2681: TP | C2681: 3575 | D2681: 1 | E2681: 03575-X | F2681: Access 2000 命令与实例 | G2681: 陈立航 | H2681: 28.50 | I2681: 36831 | J2681: 9
A2682: =ROW()-2 -> 2680 | B2682: TP | C2682: 3542 | D2682: 2 | E2682: 03542-3 | F2682: Power Point 2000 命令与实例 | G2682: 方延风等 | H2682: 28.50 | I2682: 36404 | J2682: 9
A2683: =ROW()-2 -> 2681 | B2683: TP | C2683: 3687 | D2683: 2 | E2683: 03687-X | F2683: FrontPage 2000 命令与实例 | G2683: 张大为等 | H2683: 28.50 | I2683: 36739 | J2683: 9
A2684: =ROW()-2 -> 2682 | B2684: TP | C2684: 3529 | D2684: 2 | E2684: 03529-6 | F2684: WPS 2000 入门与技巧 | G2684: 曹国均等 | H2684: 38.00 | I2684: 36434 | J2684: 7
A2685: =ROW()-2 -> 2683 | B2685: TP | C2685: 3001 | D2685: 1 | E2685: 03001-4 | F2685: 易学易用UCDOS/WIN 7.0 | G2685: 曹国钧等 | H2685: 36.00 | I2685: 1998 | J2685: 9
A2686: =ROW()-2 -> 2684 | B2686: TP | C2686: 3535 | D2686: 1 | E2686: 03535-0 | F2686: 中文 Word 2000 培训教程 | G2686: 科海中心 | H2686: 28.00 | I2686: 36312 | J2686: 8
A2687: =ROW()-2 -> 2685 | B2687: TP | C2687: 3658 | D2687: 1 | E2687: 03658-6 | F2687: 中文 Excel 2000 培训教程 | G2687: 王诚君 | H2687: 26.00 | I2687: 36373 | J2687: 9
A2688: =ROW()-2 -> 2686 | B2688: TP | C2688: 3655 | D2688: 1 | E2688: 03655-1 | F2688: 郑码输入法操作教程 | G2688: 崔彦文等 | H2688: 16.00 | I2688: 36526 | J2688: 15
A2689: =ROW()-2 -> 2687 | B2689: TP | C2689: 0813 | D2689: 1 | E2689: 00813-2 | F2689: 智能 ABC 教程（配光盘） | G2689: 李政等 | H2689: 25.00 | I2689: 36861 | J2689: 22
A2690: =ROW()-2 -> 2688 | B2690: TP | C2690: 4557 | D2690: 1 | E2690: 04557-7 | F2690: 巧学巧用系列丛书――巧学巧用五笔字型 (第3版） | G2690: 钟道隆 | H2690: 18.00 | I2690: 37377 | J2690: 14
A2691: =ROW()-2 -> 2689 | B2691: TP | C2691: 5538 | D2691: 1 | E2691: 05538-6 | F2691: 巧学巧用系列丛书――巧学巧用Photoshop 7.0 | G2691: 应勤等 | H2691: 29.00 | I2691: 37469 | J2691: 8
A2692: =ROW()-2 -> 2690 | B2692: TP | C2692: 5125 | D2692: 1 | E2692: 05125-9 | F2692: 巧学巧用系列丛书――巧学巧用photoshop 6.x中文版 | G2692: 周韬等 | H2692: 28.00 | I2692: 37355 | J2692: 10
A2693: =ROW()-2 -> 2691 | B2693: TP | C2693: 5125 | D2693: 1 | E2693: 05125-9 | F2693: 巧学巧用系列丛书――巧学巧用photoshop 6.x中文版 | G2693: 周韬等 | H2693: 28.00 | I2693: 37355 | J2693: 10
A2694: =ROW()-2 -> 2692 | B2694: TP | C2694: 4891 | D2694: 1 | E2694: 04891-6 | F2694: 巧学巧用系列丛书――巧学巧用AutoCAD 2002 | G2694: 王旭升 | H2694: 29 | I2694: 37319 | J2694: 8
A2695: =ROW()-2 -> 2693 | B2695: TP | C2695: 4548 | D2695: 1 | E2695: 04548-8 | F2695: 巧学巧用 Office XP 中文版 | G2695: 余琦 等 | H2695: 29 | I2695: 37135 | J2695: 8
A2696: =ROW()-2 -> 2694 | B2696: TP | C2696: 2190 | D2696: 9 | E2696: 02190-2 | F2696: 巧学巧用系列丛书――巧学巧用五笔字型 (第2版） | G2696: 钟道隆 | H2696: 18.80 | I2696: 36892 | J2696: 13
A2697: =ROW()-2 -> 2695 | B2697: TP | C2697: 4870 | D2697: 1 | E2697: 04870-3 | F2697: 最好用的五笔字型――智能五笔（配软盘） | G2697: 陈 虎 | H2697: 23 | I2697: 37500 | J2697: 10
A2698: =ROW()-2 -> 2696 | B2698: TP | C2698: 2668 | D2698: I | E2698: 02668-8 | F2698: 趣味速学五笔字型 | G2698: 杨植莲 | H2698: 15.00 | I2698: 37438 | J2698: 15
A2699: =ROW()-2 -> 2697 | B2699: TP | C2699: 2668 | D2699: E | E2699: 02668-8 | F2699: 趣味速学五笔字型（配光盘） | G2699: 杨植莲 | H2699: 29.00 | I2699: 37438 | J2699: 15
A2700: =ROW()-2 -> 2698 | B2700: TP | C2700: 3615 | D2700: 1 | E2700: 03615-2 | F2700: 趣味速学 98 王码 | G2700: 杨植莲 | H2700: 15.00 | I2700: 36617 | J2700: 20
A2701: =ROW()-2 -> 2699 | B2701: TP | C2701: 1718 | D2701: 1 | E2701: 01718- | F2701: 五笔字型学习捷径 | G2701: 庄跃辉等 | H2701: 15.00 | I2701: 1997 | J2701: 13
A2702: =ROW()-2 -> 2700 | B2702: TP | C2702: 5846 | D2702: 1 | E2702: 05846-6 | F2702: 五笔字型简明教程 | G2702: 东方人华 | H2702: 18.00 | I2702: 37500 | J2702: 15
A2703: =ROW()-2 -> 2701 | B2703: TP | C2703: 1469 | D2703: 6 | E2703: 01469-3 | F2703: 打字指法练习与电脑输入 | G2703: 陈炳旭等 | H2703: 15.80 | I2703: 1998 | J2703: 10
A2704: =ROW()-2 -> 2702 | B2704: P- | C2704: 2263 | D2704: 1 | F2704: 电脑学校 2000 入门篇 (配光盘) | G2704: 博彦公司 | H2704: 26.00 | I2704: 36526 | J2704: 14
A2705: =ROW()-2 -> 2703 | B2705: P- | C2705: 1771 | D2705: 2 | F2705: 电脑学校 2000 基础篇 (配光盘) | G2705: 博彦公司 | H2705: 32.00 | I2705: 36557 | J2705: 15
A2706: =ROW()-2 -> 2704 | B2706: P- | C2706: 1770 | D2706: 1 | F2706: 电脑学校 2000 应用篇 (配光盘) | G2706: 博彦公司 | H2706: 32.00 | I2706: 36343 | J2706: 14
A2707: =ROW()-2 -> 2705 | B2707: P- | C2707: 1772 | D2707: 1 | F2707: 电脑学校 2000 扩展篇 (配光盘) | G2707: 博彦公司 | H2707: 32.00 | I2707: 36342 | J2707: 14
A2708: =ROW()-2 -> 2706 | B2708: P- | C2708: 1773 | D2708: 2 | F2708: 电脑学校 2000 Internet篇 (配光盘) | G2708: 博彦公司 | H2708: 32.00 | I2708: 36526 | J2708: 9
A2709: =ROW()-2 -> 2707 | B2709: TP | C2709: 3820 | D2709: 1 | E2709: 03820-1 | F2709: 电脑打字实用教材（第2版） | G2709: 康东日 | H2709: 18.00 | I2709: 37012 | J2709: 15
A2710: =ROW()-2 -> 2708 | B2710: TP | C2710: 4930 | D2710: 1 | E2710: 04930-0 | F2710: PageMaker 专业排版技术与实例分析 | G2710: 孙江宏等 | H2710: 28 | I2710: 37328 | J2710: 9
A2711: =ROW()-2 -> 2709 | B2711: TP | C2711: 4791 | D2711: 1 | E2711: 04791-X | F2711: 北大方正书版9.01培训教程 | G2711: 楠天健 | H2711: 38 | I2711: 37104 | J2711: 8
A2712: =ROW()-2 -> 2710 | B2712: TP | C2712: 5087 | D2712: 1 | E2712: 05087-2 | F2712: 精通彩色页面排版和 Web 页设计 | G2712: 龚正伟 | H2712: 24.00 | I2712: 37257 | J2712: 13
A2713: =ROW()-2 -> 2711 | B2713: TP | C2713: 1392 | D2713: 8 | E2713: 01392-6 | F2713: 电脑文字编辑与数据处理 | G2713: 康东日 | H2713: 12.50 | I2713: 1997 | J2713: 12
A2714: =ROW()-2 -> 2712 | B2714: TP | C2714: 1879 | D2714: 6 | E2714: 01879-0 | F2714: 微型计算机操作员录入员培训教材 (第3版) | G2714: 刘尊全等 | H2714: 28.00 | I2714: 1998 | J2714: 6
A2715: =ROW()-2 -> 2713 | B2715: TP | C2715: 2600 | D2715: 3 | E2715: 02600-9 | F2715: 计算机文字录入处理员技术等级考试题解 （第2版） | G2715: 吴克忠 | H2715: 17.50 | I2715: 1999 | J2715: 12
A2716: =ROW()-2 -> 2714 | B2716: TP | C2716: 1937 | D2716: 5 | E2716: 01937-1 | F2716: 计算机操作与上机指导培训教程(上) | G2716: 王路敬等 | H2716: 24.00 | I2716: 1998 | J2716: 11
A2717: =ROW()-2 -> 2715 | B2717: TP | C2717: 1938 | D2717: 4 | E2717: 01938-X | F2717: 计算机操作与上机指导培训教程(下) | G2717: 王路敬等 | H2717: 21.00 | I2717: 1998 | J2717: 13
A2718: =ROW()-2 -> 2716 | B2718: TP | C2718: 4007 | D2718: 1 | E2718: 04007-9 | F2718: 新编电脑实用教程 | G2718: 刘小伟 | H2718: 27.00 | I2718: 37043 | J2718: 12
A2719: =ROW()-2 -> 2717 | B2719: TP | C2719: 4360 | D2719: 1 | E2719: 04360-4 | F2719: Adobe InDesign 1.5 实用宝典 | G2719: 孙玉珊等 | H2719: 25.00 | I2719: 36982 | J2719: 10
A2720: =ROW()-2 -> 2718 | B2720: P- | C2720: 4144 | D2720: 1 | E2720: 04144-X | F2720: Excel 2000中文版函数图书馆 | G2720: 程 锦 | H2720: 46.00 | I2720: 36892 | J2720: 6
A2721: =ROW()-2 -> 2719 | B2721: TP | C2721: 5090 | D2721: 1 | E2721: 05090-2 | F2721: WPS Office案例培训教程 | G2721: 华源中科辅龙 | H2721: 20.00 | I2721: 37355 | J2721: 12
F2722: 计算机硬件、外部设备及维修
A2723: =ROW()-2 -> 2721 | B2723: TP | C2723: 3461 | D2723: 5 | E2723: 03461-3 | F2723: 微机 BIOS 与 COMS 实用详解 | G2723: 王恒青等 | H2723: 14.00 | I2723: 37043 | J2723: 18
A2724: =ROW()-2 -> 2722 | B2724: TP | C2724: 4634 | D2724: 1 | E2724: 04634-4 | F2724: 微机 BIOS 和COMS 设置与管理图解教程 | G2724: 王少华等 | H2724: 25.00 | I2724: 37327 | J2724: 11
A2725: =ROW()-2 -> 2723 | B2725: P- | C2725: 3575 | D2725: 1 | F2725: BIOS 研发技术剖析（配光盘） | G2725: 陈文钦 | H2725: 49 | I2725: 37135 | J2725: 5
A2726: =ROW()-2 -> 2724 | B2726: TP | C2726: 5517 | D2726: 1 | E2726: 05517-1 | F2726: 掌上型电脑大盘点――全面解读PDA | G2726: 时间创作室 | H2726: 19.00 | I2726: 37438 | J2726: 13
A2727: =ROW()-2 -> 2725 | B2727: TP | C2727: 4792 | D2727: 1 | E2727: 04792-8 | F2727: iMac 万事无忧 | G2727: 刘建昌等译 | H2727: 49 | I2727: 37196 | J2727: 7
A2728: =ROW()-2 -> 2726 | B2728: TP | C2728: 5051 | D2728: 1 | E2728: 05051-1 | F2728: 电脑使用万事通――软、硬件及外围设备大揭密 | G2728: 郭玲文 | H2728: 30.00 | I2728: 37336 | J2728: 9
A2729: =ROW()-2 -> 2727 | B2729: TP | C2729: 3040 | D2729: 1 | E2729: 03040-5 | F2729: 微型计算机及外部设备常用芯片手册 | G2729: 编辑委员会 | H2729: 78.00 | I2729: 36495 | J2729: 4
A2730: =ROW()-2 -> 2728 | B2730: TP | C2730: 3895 | D2730: 1 | E2730: 03895-3 | F2730: 硬件大师 | G2730: 秋实工作室 | H2730: 32.8 | I2730: 37316 | J2730: 8
A2731: =ROW()-2 -> 2729 | B2731: TP | C2731: 0674 | D2731: 1 | E2731: 00674-1 | F2731: 电脑与网络超频、提速及配置实例 | G2731: 曹国钧等 | H2731: 59.00 | I2731: 36831 | J2731: 4
A2732: =ROW()-2 -> 2730 | B2732: TP | C2732: 1274 | D2732: 1 | E2732: 01274-1 | F2732: 驱动器与内存故障处理手册 | G2732: 李晔 译 | H2732: 28.00 | I2732: 36892 | J2732: 12
A2733: =ROW()-2 -> 2731 | B2733: TP | C2733: 4261 | D2733: 1 | E2733: 04261-6 | F2733: 打印机故障处理手册 | H2733: 24.00 | I2733: 36951 | J2733: 14
A2734: =ROW()-2 -> 2732 | B2734: TP | C2734: 1308 | D2734: 1 | E2734: 01308-X | F2734: 电脑性能测试与超频 | G2734: 易鸿 等 | H2734: 25.00 | I2734: 36951 | J2734: 11
A2735: =ROW()-2 -> 2733 | B2735: TP | C2735: 3318 | D2735: 2 | E2735: 03318-8 | F2735: MPP 嵌入式计算机设计 | G2735: 沈绪榜 | H2735: 40.00 | I2735: 36404 | J2735: 6
A2736: =ROW()-2 -> 2734 | B2736: TP | C2736: 3436 | D2736: 1 | E2736: 03436-2 | F2736: 数字相机入门 | G2736: 水 木 | H2736: 35.00 | I2736: 36342 | J2736: 22
A2737: =ROW()-2 -> 2735 | B2737: TP | C2737: 1491 | D2737: 1 | E2737: 01491-4 | F2737: 激光印字机原理及维修 | G2737: 曲志深 | H2737: 5.00 | I2737: 1994 | J2737: 30
A2738: =ROW()-2 -> 2736 | B2738: TP | C2738: 1733 | D2738: 2 | E2738: 01733-6 | F2738: 喷墨打印机原理与维修 | G2738: 曲志深 | H2738: 8.80 | I2738: 1997 | J2738: 20
A2739: =ROW()-2 -> 2737 | B2739: TP | C2739: 2043 | D2739: 1 | E2739: 02043-4 | F2739: EPSON打印机使用大全 | G2739: 金山编辑室 | H2739: 26.50 | I2739: 1996 | J2739: 8
A2740: =ROW()-2 -> 2738 | B2740: TP | C2740: 2024 | D2740: 2 | E2740: 02024-8 | F2740: 扫描仪的原理与开发应用 | G2740: 郭繁夏 | H2740: 16.80 | I2740: 1997 | J2740: 12
A2741: =ROW()-2 -> 2739 | B2741: TP | C2741: 3753 | D2741: 2 | E2741: 03753-1 | F2741: CD-R/RW光盘刻录 ABC | G2741: 简中山 | H2741: 28.50 | I2741: 36678 | J2741: 9
A2742: =ROW()-2 -> 2740 | B2742: TP | C2742: 2091 | D2742: 2 | E2742: 02091-4 | F2742: PC机外部设备的配置、使用与维护 (第2版) | G2742: 韩乐 等 | H2742: 8.00 | I2742: 1997 | J2742: 22
A2743: =ROW()-2 -> 2741 | B2743: TP | C2743: 3949 | D2743: 1 | E2743: 03949-6 | F2743: 最新电脑装机与调试 | G2743: 袁 辉等 | H2743: 25.00 | I2743: 37104 | J2743: 10
A2744: =ROW()-2 -> 2742 | B2744: TP | C2744: 3949 | D2744: 1 | E2744: 05367-1 | F2744: 最新电脑装机与调试（第二版） | G2744: 刘小伟等 | H2744: 31.00 | I2744: 37377 | J2744: 9
A2745: =ROW()-2 -> 2743 | B2745: TP | C2745: 4838 | D2745: 1 | E2745: 04838-X | F2745: 装机大师 | G2745: 秋实科技 | H2745: 18 | I2745: 37323 | J2745: 13
A2746: =ROW()-2 -> 2744 | B2746: TP | C2746: 4293 | D2746: 1 | E2746: 04293-4 | F2746: 学电脑、装电脑、修电脑不求人 | H2746: 23.00 | I2746: 36982 | J2746: 9
A2747: =ROW()-2 -> 2745 | B2747: P- | C2747: 3085 | D2747: 1 | F2747: 硬盘故障不求人 （配光盘） | G2747: 林东和 | H2747: 27.00 | I2747: 36982 | J2747: 12
A2748: =ROW()-2 -> 2746 | B2748: TP | C2748: 4904 | D2748: 1 | E2748: 04904-1 | F2748: 排除电脑故障实例精选 | G2748: 王寒晖 | H2748: 19.00 | I2748: 37377 | J2748: 12
A2749: =ROW()-2 -> 2747 | B2749: TP | C2749: 3606 | D2749: 1 | E2749: 03606-3 | F2749: 电脑自维修手册 | G2749: 林东和 | H2749: 24.00 | I2749: 36312 | J2749: 12
A2750: =ROW()-2 -> 2748 | B2750: TP | C2750: 3536 | D2750: 1 | E2750: 03536-9 | F2750: 电脑工程师维修教程 | G2750: 吴志滨等译 | H2750: 62.00 | I2750: 36312 | J2750: 6
A2751: =ROW()-2 -> 2749 | B2751: TP | C2751: 1525 | D2751: 4 | E2751: 01525-2 | F2751: 微机故障诊断与维修实用大全 | G2751: 袁忠良等 | H2751: 42.00 | I2751: 1997 | J2751: 4
A2752: =ROW()-2 -> 2750 | B2752: TP | C2752: 1791 | D2752: 3 | E2752: 01791-3 | F2752: 微机常见故障诊断与排除的软件技术 | G2752: 谢深泉 | H2752: 18.00 | I2752: 1999 | J2752: 12
A2753: =ROW()-2 -> 2751 | B2753: TP | C2753: 2679 | D2753: 5 | E2753: 02679-3 | F2753: 微机常见故障会诊 | G2753: 金 帆 | H2753: 21.00 | I2753: 1999 | J2753: 10
A2754: =ROW()-2 -> 2752 | B2754: TP | C2754: 3882 | D2754: 1 | E2754: 03882-1 | F2754: 微机常见故障会诊（修订版） | G2754: 杜昌领 | H2754: 27.00 | I2754: 36982 | J2754: 10
F2755: 管 理 信 息 技 术
A2756: =ROW()-2 -> 2754 | B2756: TP | C2756: 3173 | D2756: 1 | E2756: 03173-8 | F2756: 管理信息系统设计与实现 | G2756: 黎连业 | H2756: 20.00 | I2756: 1998 | J2756: 13
A2757: =ROW()-2 -> 2755 | B2757: TP | C2757: 4473 | D2757: 1 | E2757: 04473-2 | F2757: GLOBAL DIGITAL LIBRARY DEVELOPMENT in the New Millennium ――Fertile Ground for Distributed Cross-Disciplinary Collaboration （新千年全球数字图书馆的发展――众多交叉学科合作的沃土） | G2757: Ching-chih Chen | H2757: 198.00 | I2757: 37043 | J2757: 3
A2758: =ROW()-2 -> 2756 | B2758: TP | C2758: 4218 | D2758: 1 | E2758: 04218-7 | F2758: 信息工程――创建企业计算机信息系统的工程 | G2758: 耿继秀 | H2758: 15.00 | I2758: 37257 | J2758: 16
F2759: 信 息 产 业
A2760: =ROW()-2 -> 2758 | B2760: TP | C2760: 1224 | D2760: 1 | E2760: 01224-5 | F2760: 新世纪初信息产业导向 | G2760: 雷晓明等 | H2760: 56.00 | I2760: 36800 | J2760: 6
A2761: =ROW()-2 -> 2759 | B2761: TP | C2761: 5307 | D2761: 1 | E2761: 05307-3 | F2761: 信息资源规划――信息化建设基础工程 | G2761: 高复先 | H2761: 22.00 | I2761: 37347 | J2761: 11
A2762: =ROW()-2 -> 2760 | B2762: TP | C2762: 1431 | D2762: 1 | E2762: 01431-2 | F2762: 信息化先锋 | G2762: 陈禹等 | H2762: 130.00 | I2762: 37347 | J2762: 10
F2763: 计算机在各个领域中的应用
A2764: =ROW()-2 -> 2762 | B2764: TP | C2764: 2645 | D2764: 1 | E2764: 02645-9 | F2764: 并行工程原理及应用 | G2764: 潘雪增 | H2764: 16.00 | I2764: 1997 | J2764: 14
A2765: =ROW()-2 -> 2763 | B2765: TP | C2765: 1178 | D2765: 1 | E2765: 01178-8 | F2765: MatLab 工程数学应用 | G2765: 许波 等 | H2765: 39.80 | I2765: 36861 | J2765: 7
A2766: =ROW()-2 -> 2764 | B2766: TP | C2766: 1168 | D2766: 1 | E2766: 01168-0 | F2766: Protel 99 电路设计指南 | G2766: 王彦平等 | H2766: 24 | I2766: 37328 | J2766: 11
A2767: =ROW()-2 -> 2765 | B2767: P- | C2767: 3070 | D2767: 1 | F2767: Protel 99 SE 电路设计与仿真应用（配光盘） | G2767: 梁恩主等 | H2767: 49 | I2767: 36831 | J2767: 6
A2768: =ROW()-2 -> 2766 | B2768: TP | C2768: 4451 | D2768: 1 | E2768: 04451-1 | F2768: Protel PCB 99 SE 电路板设计 | G2768: 谢淑如等 | H2768: 48 | I2768: 37257 | J2768: 5
A2769: =ROW()-2 -> 2767 | B2769: TP | C2769: 4079 | D2769: 1 | E2769: 04079-6 | F2769: 数字图书馆 ―― 原理与技术实现 | G2769: 高文 等 | H2769: 39.50 | I2769: 36800 | J2769: 6
A2770: =ROW()-2 -> 2768 | B2770: TU | C2770: 2145 | D2770: 1 | E2770: 02145-7 | F2770: 建筑工程计算机应用系列教材：工程结构计算机仿真分析 | G2770: 江见鲸 | H2770: 17.60 | I2770: 1996 | J2770: 11
A2771: =ROW()-2 -> 2769 | B2771: TU | C2771: 2875 | D2771: 1 | E2771: 02875-3 | F2771: 建筑结构计算机分析及程序 | G2771: 江见鲸等 | H2771: 18.80 | I2771: 1998 | J2771: 10
A2772: =ROW()-2 -> 2770 | B2772: TP | C2772: 2289 | D2772: 2 | E2772: 02289-5 | F2772: 建筑结构计算机分析及程序 | G2772: 张 戈 | H2772: 73.00 | I2772: 1997 | J2772: 6
A2773: =ROW()-2 -> 2771 | B2773: G- | C2773: 5599 | D2773: 1 | E2773: 05599-1 | F2773: 电脑启示录（中篇）硅谷的秘密 | G2773: 徐志伟 | H2773: 18.00 | I2773: 37438 | J2773: 13
A2774: =ROW()-2 -> 2772 | B2774: P | C2774: 4185 | D2774: 1 | F2774: MIDI技巧与数字音频（配光盘） | G2774: 颜东成等 | H2774: 43.00 | I2774: 37404 | J2774: 7
A2775: =ROW()-2 -> 2773 | B2775: TP | C2775: 5743 | D2775: 1 | E2775: 05743-5 | F2775: Protel 电路设计教程 | G2775: 江思敏等 | H2775: 32.00 | I2775: 37500 | J2775: 8
A2776: =ROW()-2 -> 2774 | B2776: TH | C2776: 3198 | D2776: 1 | E2776: 03198-3 | F2776: 计算机辅助制造 | G2776: 王先逵 | H2776: 14.00 | I2776: 36861 | J2776: 15
A2777: =ROW()-2 -> 2775 | B2777: TP | C2777: 4224 | D2777: 1 | E2777: 04224-1 | F2777: 机械系统计算机控制 | G2777: 钟约先等 | H2777: 36.00 | I2777: 36982 | J2777: 6
A2778: =ROW()-2 -> 2776 | B2778: TP | C2778: 2502 | D2778: 1 | E2778: 02502-9 | F2778: 计算机辅助光学测量 | G2778: 金观昌 | H2778: 19.50 | I2778: 1997 | J2778: 12
A2779: =ROW()-2 -> 2777 | B2779: TP | C2779: 4550 | D2779: 1 | E2779: 04550-X | F2779: 智能建筑火灾监控系统设计 | G2779: 陈 南 | H2779: 24 | I2779: 37073 | J2779: 12
A2780: =ROW()-2 -> 2778 | B2780: TU | C2780: 2229 | D2780: 4 | E2780: 02229-1 | F2780: 智能建筑 | G2780: 张瑞武 | H2780: 36 | I2780: 37257 | J2780: 8
A2781: =ROW()-2 -> 2779 | B2781: P | C2781: 3738 | D2781: 1 | F2781: Delphi构建进销存系统――POS系统开发实例 | G2781: 黄文钰 | H2781: 55.00 | I2781: 37408 | J2781: 6
A2782: =ROW()-2 -> 2780 | B2782: TP | C2782: 5150 | D2782: 1 | E2782: 05150-X | F2782: Intranet技术及在住宅智能化中的应用 | G2782: 吴成东 | H2782: 38.00 | I2782: 37347 | J2782: 8
A2783: =ROW()-2 -> 2781 | B2783: TP | C2783: 5281 | D2783: 1 | E2783: 05281-6 | F2783: 精通ChemDraw | G2783: 胡立江 | H2783: 21.00 | I2783: 37347
A2784: =ROW()-2 -> 2782 | B2784: TP | C2784: 5331 | D2784: 1 | E2784: 05331-6 | F2784: 安全电子商务实用技术 | G2784: 张炯明 | H2784: 28.00 | I2784: 37347 | J2784: 10
A2785: =ROW()-2 -> 2783 | B2785: TP | C2785: 5103 | D2785: 1 | E2785: 05103-8 | F2785: 有限元分析基础篇ANSYS与Mathematica | G2785: 夸克工作室 | H2785: 48.00 | I2785: 37469 | J2785: 5
F2786: 7.学术专著
A2787: =ROW()-2 -> 2785 | B2787: TP | C2787: 3200 | D2787: 2 | E2787: 03200-9 | F2787: HNC（概念层次网络）理论――计算机理解语言研究的新思路 | G2787: 黄曾阳 | H2787: 66.00 | I2787: 36586 | J2787: 5
A2788: =ROW()-2 -> 2786 | B2788: TP | C2788: 4477 | D2788: 1 | E2788: 04477-5 | F2788: 认知逻辑导论 | G2788: 周昌乐 | H2788: 25.00 | I2788: 37043 | J2788: 19
A2789: =ROW()-2 -> 2787 | B2789: TP | C2789: 4475 | D2789: 1 | E2789: 04475-9 | F2789: 世纪之交的知识工程与知识科学 | G2789: 陆汝钤 | H2789: 46 | I2789: 37135 | J2789: 6
A2790: =ROW()-2 -> 2788 | B2790: TP | C2790: 2935 | D2790: 1 | E2790: 02935-0 | F2790: 现代汉语语法信息词典详解（精） | G2790: 俞士汶等 | H2790: 86.00 | I2790: 1998 | J2790: 3
A2791: =ROW()-2 -> 2789 | B2791: TP | C2791: 1875 | D2791: 3 | E2791: 01875-8 | F2791: 高等计算机系统结构 | G2791: 王鼎兴等译 | H2791: 36.00 | I2791: 37196 | J2791: 4
A2792: =ROW()-2 -> 2790 | B2792: TP | C2792: 3976 | D2792: 1 | E2792: 03976-3 | F2792: 密码分析学 | G2792: 冯登国 | H2792: 14.00 | I2792: 36861 | J2792: 20
A2793: =ROW()-2 -> 2791 | B2793: P- | C2793: 3782 | D2793: 1 | F2793: Mathcad 2001详解（配盘） | G2793: 纪哲锐 | H2793: 38 | I2793: 37288 | J2793: 9
A2794: =ROW()-2 -> 2792 | B2794: TP | C2794: 4379 | D2794: 1 | E2794: 04379-5 | F2794: 密码学与计算机网络安全 | G2794: 卿斯汉 | H2794: 28 | I2794: 37327 | J2794: 10
A2795: =ROW()-2 -> 2793 | B2795: TP | C2795: 3986 | D2795: 1 | E2795: 03986-0 | F2795: 分组密码的设计与分析 | G2795: 冯登国等 | H2795: 18 | I2795: 36770 | J2795: 18
A2796: =ROW()-2 -> 2794 | B2796: TP | C2796: 3801 | D2796: 1 | E2796: 03801-5 | F2796: 计算几何―― 算法分析与设计 | G2796: 周培德 | H2796: 29 | I2796: 36647 | J2796: 9
A2797: =ROW()-2 -> 2795 | B2797: TP | C2797: 5061 | D2797: 1 | E2797: 05061-9 | F2797: 知识发现 | G2797: 史忠植 | H2797: 38.00 | I2797: 37257 | J2797: 7
A2798: =ROW()-2 -> 2796 | B2798: TP | C2798: 3232 | D2798: 1 | E2798: 03232-7 | F2798: 计算机视觉――算法与系统原理 | G2798: 高文 等 | H2798: 29.00 | I2798: 36617 | J2798: 10
A2799: =ROW()-2 -> 2797 | B2799: TP | C2799: 3752 | D2799: 1 | E2799: 03752-3 | F2799: 三维数据场可视化 | G2799: 唐泽圣等 | H2799: 24.00 | I2799: 36647 | J2799: 9
A2800: =ROW()-2 -> 2798 | B2800: TP | C2800: 3752 | D2800: 2 | E2800: 03752-3 | F2800: 三维数据场可视化（精） | G2800: 唐泽圣等 | H2800: 36.00 | I2800: 36586 | J2800: 7
A2801: =ROW()-2 -> 2799 | B2801: TP | C2801: 1017 | D2801: 1 | E2801: 01017-X | F2801: 随机 Petri 网和系统性能评价 | G2801: 林 闯 | H2801: 28.00 | I2801: 36526 | J2801: 10
A2802: =ROW()-2 -> 2800 | B2802: TP | C2802: 3580 | D2802: 1 | E2802: 03580-6 | F2802: 人工神经元网络及其应用 | G2802: 袁曾任 | H2802: 29.80 | I2802: 36861 | J2802: 8
A2803: =ROW()-2 -> 2801 | B2803: TP | C2803: 3235 | D2803: 2 | E2803: 03235-1 | F2803: 面向对象的系统分析 | G2803: 邵维忠等 | H2803: 20.00 | I2803: 37135 | J2803: 12
A2804: =ROW()-2 -> 2802 | B2804: TP | C2804: 5345 | D2804: 1 | E2804: 05345-6 | F2804: 系统分析 | G2804: 黄敬仁 | H2804: 22.00 | I2804: 37469 | J2804: 11
A2805: =ROW()-2 -> 2803 | B2805: TP | C2805: 3940 | D2805: 1 | E2805: 03940-2 | F2805: 面向中文信息处理的现代汉语短语结构规则 研究 | G2805: 詹卫东 | H2805: 19.00 | I2805: 36739 | J2805: 14
A2806: =ROW()-2 -> 2804 | B2806: TP | C2806: 2218 | D2806: 3 | E2806: 02218-6 | F2806: 决策支持系统(DSS)理论・方法・案例 | G2806: 高洪深 | H2806: 24.00 | I2806: 36557 | J2806: 9
A2807: =ROW()-2 -> 2805 | B2807: TP | C2807: 3915 | D2807: 1 | E2807: 03915-1 | F2807: 决策支持系统(DSS)理论・方法・案例（第2版） | G2807: 高洪深 | H2807: 36.00 | I2807: 37073 | J2807: 7
A2808: =ROW()-2 -> 2806 | B2808: TP | C2808: 0968 | D2808: 1 | E2808: 00968-6 | F2808: 决策支持系统及其开发（第2版） | G2808: 陈文伟 | H2808: 30.00 | I2808: 36678 | J2808: 7
A2809: =ROW()-2 -> 2807 | B2809: TP | C2809: 3587 | D2809: 1 | E2809: 03587-3 | F2809: 工程数据库系统 | H2809: 21.00 | I2809: 36373 | J2809: 12
A2810: =ROW()-2 -> 2808 | B2810: TP | C2810: 3382 | D2810: 2 | E2810: 03382-X | F2810: 关系数据库理论 | G2810: 马 垣 | H2810: 33.00 | I2810: 36434 | J2810: 7
A2811: =ROW()-2 -> 2809 | B2811: TP | C2811: 2897 | D2811: 2 | E2811: 02897-4 | F2811: 演化计算 | G2811: 潘正君等 | H2811: 20.00 | I2811: 36617 | J2811: 12
A2812: =ROW()-2 -> 2810 | B2812: G | C2812: 4850 | D2812: 1 | E2812: 04850-9 | F2812: 高中数学学法指津 | G2812: 叶运佳 | H2812: 16.00 | I2812: 37362 | J2812: 15
A2813: =ROW()-2 -> 2811 | B2813: TP | C2813: 2061 | D2813: 2 | E2813: 02061-2 | F2813: 模糊理论和神经网络的基础与应用 | G2813: 赵振宇等 | H2813: 16.00 | I2813: 1997 | J2813: 11
A2814: =ROW()-2 -> 2812 | B2814: TP | C2814: 3675 | D2814: 1 | E2814: 03675-6 | F2814: 推陈出新―― 传统文化在现代的发展 | G2814: 钱 逊 | H2814: 20.00 | I2814: 36495 | J2814: 17
A2815: =ROW()-2 -> 2813 | B2815: TP | C2815: 5405 | D2815: 1 | E2815: 05405-1 | F2815: 亿恒C164CI 16位单片机 | G2815: 陆延丰等 | H2815: 40.00 | I2815: 37408 | J2815: 7
A2816: =ROW()-2 -> 2814 | B2816: Z | C2816: 5019 | D2816: 1 | E2816: 05019-8 | F2816: 工程前沿――美国国家工程院“工程前沿学术研讨会”1995年及1996年会议文集 | G2816: 国家自然 科学基金会 | H2816: 22 | I2816: 37438 | J2816: 11
A2817: =ROW()-2 -> 2815 | B2817: TP | C2817: 5162 | D2817: 1 | E2817: 05162-3 | F2817: 理论力学计算机模拟（配光盘） | G2817: 彭芳麟等 | H2817: 31.00 | I2817: 37316 | J2817: 10
A2818: =ROW()-2 -> 2816 | B2818: TP | C2818: 5228 | D2818: 1 | E2818: 05228-1 | F2818: 基于ACIS的几何造型技术与系统开发 | G2818: 詹海生等 | H2818: 42.00 | I2818: 37438 | J2818: 8

A1: 李著

A1: 印 等

A1: TM

A1: Data Structure & Program Design in C (数据结构与程序设计C语言描述 第2版)

A1: 教研中心

A1: 肖 火 等译

A1: 彭松虎等译

A1: 宛延

A1: 李晔 译

A1: 田

A1: 宛延